A1: Utah Valley Corporate Games Pistol Shoot - 2003
B2: Results for May 21st, 2003 | E2: Total Points Down
A3: Place | B3: Name | C3: Organization (Note) | D3: Shoot Total | F3: Stage 1 | G3: String 1 | H3: Points Down | I3: Stage 2 | J3: String 1 | K3: Points Down | L3: Stage 3 | M3: String 1 | N3: String 2 | O3: String 3 | P3: Points Down
A4: 1 | B4: Mike Stilwell | C4: Nu Skin | D4: =+F4+I4+L4 -> 42.20 | E4: =+H4+K4+P4 -> 8 | F4: =+G4+(H4*0.5) -> 13.64 | G4: 11.14 | H4: 5.00 | I4: =+J4+(K4*0.5) -> 19.69 | J4: 19.69 | K4: 0 | L4: =+M4+N4+O4+(P4*0.5) -> 8.87 | M4: 2.40 | N4: 2.59 | O4: 2.38 | P4: 3
A5: 2 | B5: Terry Snelson | C5: Provo City | D5: =+F5+I5+L5 -> 45.35 | E5: =+H5+K5+P5 -> 17 | F5: =+G5+(H5*0.5) -> 18.32 | G5: 13.82 | H5: 9.00 | I5: =+J5+(K5*0.5) -> 18.62 | J5: 16.62 | K5: 4 | L5: =+M5+N5+O5+(P5*0.5) -> 8.41 | M5: 2.17 | N5: 2.09 | O5: 2.15 | P5: 4
A6: 3 | B6: Kevin Thomas | C6: IHC | D6: =+F6+I6+L6 -> 53.16 | E6: =+H6+K6+P6 -> 31 | F6: =+G6+(H6*0.5) -> 14.34 | G6: 13.34 | H6: 2.00 | I6: =+J6+(K6*0.5) -> 22.96 | J6: 16.96 | K6: 12 | L6: =+M6+N6+O6+(P6*0.5) -> 15.86 | M6: 2.48 | N6: 2.39 | O6: 2.49 | P6: 17
A7: 4 | B7: Kyle Adams | C7: Provo City (Revolver) | D7: =+F7+I7+L7 -> 58.56 | E7: =+H7+K7+P7 -> 13 | F7: =+G7+(H7*0.5) -> 19.88 | G7: 19.88 | H7: 0.00 | I7: =+J7+(K7*0.5) -> 30.20 | J7: 24.70 | K7: 11 | L7: =+M7+N7+O7+(P7*0.5) -> 8.48 | M7: 2.63 | N7: 2.48 | O7: 2.37 | P7: 2
A8: 5 | B8: Jim Griggs | C8: Flow Serve | D8: =+F8+I8+L8 -> 60.61 | E8: =+H8+K8+P8 -> 21 | F8: =+G8+(H8*0.5) -> 23.30 | G8: 17.30 | H8: 12.00 | I8: =+J8+(K8*0.5) -> 26.10 | J8: 25.60 | K8: 1 | L8: =+M8+N8+O8+(P8*0.5) -> 11.21 | M8: 2.51 | N8: 2.42 | O8: 2.28 | P8: 8
A9: 6 | B9: Jim Bolinder | C9: Nu Skin | D9: =+F9+I9+L9 -> 62.12 | E9: =+H9+K9+P9 -> 18 | F9: =+G9+(H9*0.5) -> 23.34 | G9: 18.84 | H9: 9.00 | I9: =+J9+(K9*0.5) -> 29.82 | J9: 25.82 | K9: 8 | L9: =+M9+N9+O9+(P9*0.5) -> 8.96 | M9: 3.26 | N9: 2.69 | O9: 2.51 | P9: 1
A10: 7 | B10: Mike Wilson | C10: Flow Serve | D10: =+F10+I10+L10 -> 67.96 | E10: =+H10+K10+P10 -> 19 | F10: =+G10+(H10*0.5) -> 23.20 | G10: 21.20 | H10: 4.00 | I10: =+J10+(K10*0.5) -> 32.77 | J10: 27.77 | K10: 10 | L10: =+M10+N10+O10+(P10*0.5) -> 11.99 | M10: 3.37 | N10: 3.20 | O10: 2.92 | P10: 5
A11: 8 | B11: Mike Jones | C11: UVSC | D11: =+F11+I11+L11 -> 70.91 | E11: =+H11+K11+P11 -> 6 | F11: =+G11+(H11*0.5) -> 26.69 | G11: 25.19 | H11: 3.00 | I11: =+J11+(K11*0.5) -> 32.54 | J11: 32.54 | K11: 0 | L11: =+M11+N11+O11+(P11*0.5) -> 11.68 | M11: 3.67 | N11: 3.30 | O11: 3.21 | P11: 3
A12: 9 | B12: Carl Schwitzer | C12: IHC | D12: =+F12+I12+L12 -> 74.10 | E12: =+H12+K12+P12 -> 36 | F12: =+G12+(H12*0.5) -> 25.27 | G12: 20.77 | H12: 9.00 | I12: =+J12+(K12*0.5) -> 35.04 | J12: 27.04 | K12: 16 | L12: =+M12+N12+O12+(P12*0.5) -> 13.79 | M12: 2.82 | N12: 2.87 | O12: 2.60 | P12: 11
A13: 10 | B13: Rhead Richards | C13: Nu Skin | D13: =+F13+I13+L13 -> 77.79 | E13: =+H13+K13+P13 -> 7 | F13: =+G13+(H13*0.5) -> 29.91 | G13: 27.41 | H13: 5.00 | I13: =+J13+(K13*0.5) -> 29.57 | J13: 29.07 | K13: 1 | L13: =+M13+N13+O13+(P13*0.5) -> 18.31 | M13: 5.50 | N13: 6.18 | O13: 6.13 | P13: 1
A14: 11 | B14: Bruce Johnson | C14: IHC | D14: =+F14+I14+L14 -> 84.46 | E14: =+H14+K14+P14 -> 21 | F14: =+G14+(H14*0.5) -> 29.57 | G14: 27.57 | H14: 4.00 | I14: =+J14+(K14*0.5) -> 42.30 | J14: 34.30 | K14: 16 | L14: =+M14+N14+O14+(P14*0.5) -> 12.59 | M14: 4.38 | N14: 3.04 | O14: 4.67 | P14: 1
A15: 12 | B15: Mike Barrett | C15: Flow Serve | D15: =+F15+I15+L15 -> 89.26 | E15: =+H15+K15+P15 -> 14 | F15: =+G15+(H15*0.5) -> 30.08 | G15: 29.08 | H15: 2.00 | I15: =+J15+(K15*0.5) -> 39.75 | J15: 36.75 | K15: 6 | L15: =+M15+N15+O15+(P15*0.5) -> 19.43 | M15: 6.86 | N15: 4.33 | O15: 5.24 | P15: 6
A16: 13 | B16: Cary Rollins | C16: IHC | D16: =+F16+I16+L16 -> 90.07 | E16: =+H16+K16+P16 -> 24 | F16: =+G16+(H16*0.5) -> 33.05 | G16: 30.55 | H16: 5.00 | I16: =+J16+(K16*0.5) -> 40.80 | J16: 32.30 | K16: 17 | L16: =+M16+N16+O16+(P16*0.5) -> 16.22 | M16: 4.82 | N16: 4.52 | O16: 5.88 | P16: 2
A17: 14 | B17: Joe Ford | C17: Nu Skin | D17: =+F17+I17+L17 -> 90.60 | E17: =+H17+K17+P17 -> 31 | F17: =+G17+(H17*0.5) -> 42.48 | G17: 36.48 | H17: 12.00 | I17: =+J17+(K17*0.5) -> 29.62 | J17: 26.12 | K17: 7 | L17: =+M17+N17+O17+(P17*0.5) -> 18.50 | M17: 3.70 | N17: 4.56 | O17: 4.24 | P17: 12
A18: 15 | B18: Gary Johnson | C18: Flow Serve | D18: =+F18+I18+L18 -> 91.14 | E18: =+H18+K18+P18 -> 8 | F18: =+G18+(H18*0.5) -> 43.45 | G18: 41.95 | H18: 3.00 | I18: =+J18+(K18*0.5) -> 32.72 | J18: 32.22 | K18: 1 | L18: =+M18+N18+O18+(P18*0.5) -> 14.97 | M18: 4.32 | N18: 4.47 | O18: 4.18 | P18: 4
A19: 16 | B19: Roy Moore | C19: Flow Serve | D19: =+F19+I19+L19 -> 94.25 | E19: =+H19+K19+P19 -> 26 | F19: =+G19+(H19*0.5) -> 35.74 | G19: 34.24 | H19: 3.00 | I19: =+J19+(K19*0.5) -> 36.92 | J19: 30.92 | K19: 12 | L19: =+M19+N19+O19+(P19*0.5) -> 21.59 | M19: 5.08 | N19: 5.40 | O19: 5.61 | P19: 11
A20: 17 | B20: Chad Larson | C20: Nu Skin | D20: =+F20+I20+L20 -> 94.47 | E20: =+H20+K20+P20 -> 20 | F20: =+G20+(H20*0.5) -> 32.03 | G20: 30.03 | H20: 4.00 | I20: =+J20+(K20*0.5) -> 40.70 | J20: 35.70 | K20: 10 | L20: =+M20+N20+O20+(P20*0.5) -> 21.74 | M20: 6.26 | N20: 4.84 | O20: 7.64 | P20: 6
A21: 18 | B21: Jonathan Harrison | C21: Flow Serve | D21: =+F21+I21+L21 -> 95.27 | E21: =+H21+K21+P21 -> 24 | F21: =+G21+(H21*0.5) -> 33.02 | G21: 27.52 | H21: 11.00 | I21: =+J21+(K21*0.5) -> 49.09 | J21: 43.09 | K21: 12 | L21: =+M21+N21+O21+(P21*0.5) -> 13.16 | M21: 4.01 | N21: 4.85 | O21: 3.80 | P21: 1
A22: 19 | B22: Jason Smith | C22: Provo City | D22: =+F22+I22+L22 -> 99.54 | E22: =+H22+K22+P22 -> 48 | F22: =+G22+(H22*0.5) -> 36.04 | G22: 29.04 | H22: 14.00 | I22: =+J22+(K22*0.5) -> 40.68 | J22: 30.18 | K22: 21 | L22: =+M22+N22+O22+(P22*0.5) -> 22.82 | M22: 7.67 | N22: 4.48 | O22: 4.17 | P22: 13
A23: 20 | B23: Doug Jenkins | C23: Nu Skin | D23: =+F23+I23+L23 -> 102.39 | E23: =+H23+K23+P23 -> 36 | F23: =+G23+(H23*0.5) -> 31.25 | G23: 28.75 | H23: 5.00 | I23: =+J23+(K23*0.5) -> 48.64 | J23: 35.64 | K23: 26 | L23: =+M23+N23+O23+(P23*0.5) -> 22.50 | M23: 6.90 | N23: 6.90 | O23: 6.20 | P23: 5
A24: 21 | B24: Joel Jenkins | C24: Nu Skin | D24: =+F24+I24+L24 -> 102.98 | E24: =+H24+K24+P24 -> 44 | F24: =+G24+(H24*0.5) -> 40.91 | G24: 31.41 | H24: 19.00 | I24: =+J24+(K24*0.5) -> 43.74 | J24: 34.74 | K24: 18 | L24: =+M24+N24+O24+(P24*0.5) -> 18.33 | M24: 5.29 | N24: 5.02 | O24: 4.52 | P24: 7
A25: NC | B25: Preston Koerner | C25: Nu Skin (.22) | D25: =+F25+I25+L25 -> 122.45 | E25: =+H25+K25+P25 -> 7 | F25: =+G25+(H25*0.5) -> 36.76 | G25: 36.76 | H25: 0.00 | I25: =+J25+(K25*0.5) -> 60.48 | J25: 56.98 | K25: 7 | L25: =+M25+N25+O25+(P25*0.5) -> 25.21 | M25: 14.81 | N25: 4.04 | O25: 6.36 | P25: 0
A26: 23 | B26: Ron Clark | C26: Flow Serve | D26: =+F26+I26+L26 -> 125.23 | E26: =+H26+K26+P26 -> 50 | F26: =+G26+(H26*0.5) -> 31.34 | G26: 29.34 | H26: 4.00 | I26: =+J26+(K26*0.5) -> 76.94 | J26: 55.94 | K26: 42 | L26: =+M26+N26+O26+(P26*0.5) -> 16.95 | M26: 5.10 | N26: 5.00 | O26: 4.85 | P26: 4
A27: 24 | B27: Dwayne Austin | C27: Nu Skin | D27: =+F27+I27+L27 -> 135.44 | E27: =+H27+K27+P27 -> 33 | F27: =+G27+(H27*0.5) -> 62.04 | G27: 58.54 | H27: 7.00 | I27: =+J27+(K27*0.5) -> 57.46 | J27: 46.96 | K27: 21 | L27: =+M27+N27+O27+(P27*0.5) -> 15.94 | M27: 3.75 | N27: 5.04 | O27: 4.65 | P27: 5
A28: 25 | B28: Ken McClure | C28: Liberty Safe | D28: =+F28+I28+L28 -> 135.66 | E28: =+H28+K28+P28 -> 1 | F28: =+G28+(H28*0.5) -> 54.00 | G28: 54.00 | H28: 0.00 | I28: =+J28+(K28*0.5) -> 56.37 | J28: 56.37 | K28: 0 | L28: =+M28+N28+O28+(P28*0.5) -> 25.29 | M28: 8.25 | N28: 8.39 | O28: 8.15 | P28: 1
A29: 1 | B29: Ari Theodore | C29: UDPL | D29: =+F29+I29+L29 -> 45.31 | E29: =+H29+K29+P29 -> 18 | F29: =+G29+(H29*0.5) -> 13.31 | G29: 11.81 | H29: 3.00 | I29: =+J29+(K29*0.5) -> 23.25 | J29: 17.75 | K29: 11 | L29: =+M29+N29+O29+(P29*0.5) -> 8.75 | M29: 2.27 | N29: 2.27 | O29: 2.21 | P29: 4
A30: 2 | B30: Kevin Thomas | C30: UDPL | D30: =+F30+I30+L30 -> 46.60 | E30: =+H30+K30+P30 -> 15 | F30: =+G30+(H30*0.5) -> 18.28 | G30: 14.28 | H30: 8.00 | I30: =+J30+(K30*0.5) -> 19.35 | J30: 16.35 | K30: 6 | L30: =+M30+N30+O30+(P30*0.5) -> 8.97 | M30: 2.92 | N30: 2.89 | O30: 2.66 | P30: 1
A31: 3 | B31: Jeff McNail | C31: UDPL | D31: =+F31+I31+L31 -> 50.05 | E31: =+H31+K31+P31 -> 25 | F31: =+G31+(H31*0.5) -> 15.44 | G31: 12.44 | H31: 6.00 | I31: =+J31+(K31*0.5) -> 23.01 | J31: 16.51 | K31: 13 | L31: =+M31+N31+O31+(P31*0.5) -> 11.60 | M31: 2.74 | N31: 2.53 | O31: 3.33 | P31: 6
A32: 4 | B32: Neil Hood | C32: UDPL | D32: =+F32+I32+L32 -> 60.97 | E32: =+H32+K32+P32 -> 17 | F32: =+G32+(H32*0.5) -> 21.94 | G32: 21.44 | H32: 1.00 | I32: =+J32+(K32*0.5) -> 23.77 | J32: 23.27 | K32: 1 | L32: =+M32+N32+O32+(P32*0.5) -> 15.26 | M32: 2.46 | N32: 2.60 | O32: 2.70 | P32: 15
A33: 5 | B33: Dan Garcia | C33: UDPL | D33: =+F33+I33+L33 -> 68.36 | E33: =+H33+K33+P33 -> 5 | F33: =+G33+(H33*0.5) -> 22.67 | G33: 22.17 | H33: 1.00 | I33: =+J33+(K33*0.5) -> 33.29 | J33: 32.29 | K33: 2 | L33: =+M33+N33+O33+(P33*0.5) -> 12.40 | M33: 4.14 | N33: 3.51 | O33: 3.75 | P33: 2
A34: 6 | B34: Carl Burney | C34: UDPL | D34: =+F34+I34+L34 -> 86.79 | E34: =+H34+K34+P34 -> 12 | F34: =+G34+(H34*0.5) -> 33.44 | G34: 32.44 | H34: 2.00 | I34: =+J34+(K34*0.5) -> 36.11 | J34: 31.11 | K34: 10 | L34: =+M34+N34+O34+(P34*0.5) -> 17.24 | M34: 5.95 | N34: 5.62 | O34: 5.67 | P34: 0
A35: 7 | B35: Rhett Runolfson | C35: UDPL | D35: =+F35+I35+L35 -> 87.66 | E35: =+H35+K35+P35 -> 34 | F35: =+G35+(H35*0.5) -> 30.05 | G35: 28.05 | H35: 4.00 | I35: =+J35+(K35*0.5) -> 38.22 | J35: 26.72 | K35: 23 | L35: =+M35+N35+O35+(P35*0.5) -> 19.39 | M35: 6.20 | N35: 6.60 | O35: 3.09 | P35: 7
A37: Notes:
A38: NC | B38: - Not Considered for medal placement because a .22 was used. A 9mm caliber or better is required for a medal.
A39: X | B39: - To make it fair to all corporate competitors, these shooters are ranked in a different class and will be scored and placed only against their fellow UDPL shooters after all three nights of competition. The placing indicated on this list does not necessarily indicate the competitors final overall placing.
A40: X | B40: - Indicates that the Points Down value contains some type of penalty (Procedural = 6 PD, or a "Hit on Non-Threat" = 10 PD).
A41: DNF | B41: - Indicates that the shooter Did Not Finish the match.