B1: Utah Valley Corporate Games Pistol Shoot - 2003
B2: Results for May 13th, 2003 | E2: Total Points Down
A3: Place | B3: Name | C3: Organization (Note) | D3: Shoot Total | F3: Stage 1 | G3: String 1 | H3: Points Down | I3: Stage 2 | J3: String 1 | K3: Points Down | L3: Stage 3 | M3: String 1 | N3: String 2 | O3: String 3 | P3: Points Down
A4: 1 | B4: Jeff Hansen | C4: Mountain View Hospital | D4: =+F4+I4+L4 -> 48.15 | E4: =+H4+K4+P4 -> 23 | F4: =+G4+(H4*0.5) -> 19.85 | G4: 15.35 | H4: 9 | I4: =+J4+(K4*0.5) -> 18.28 | J4: 14.28 | K4: 8 | L4: =+M4+N4+O4+(P4*0.5) -> 10.02 | M4: 2.55 | N4: 2.34 | O4: 2.13 | P4: 6
A5: 2 | B5: Dave Randall | C5: IHC | D5: =+F5+I5+L5 -> 57.34 | E5: =+H5+K5+P5 -> 12 | F5: =+G5+(H5*0.5) -> 23.53 | G5: 21.53 | H5: 4 | I5: =+J5+(K5*0.5) -> 21.90 | J5: 18.90 | K5: 6 | L5: =+M5+N5+O5+(P5*0.5) -> 11.91 | M5: 3.65 | N5: 3.67 | O5: 3.59 | P5: 2
A6: NC | B6: William Hamilton | C6: Nu Skin (.22) | D6: =+F6+I6+L6 -> 59.06 | E6: =+H6+K6+P6 -> 25 | F6: =+G6+(H6*0.5) -> 19.33 | G6: 17.33 | H6: 4 | I6: =+J6+(K6*0.5) -> 30.74 | J6: 21.24 | K6: 19 | L6: =+M6+N6+O6+(P6*0.5) -> 8.99 | M6: 2.94 | N6: 2.26 | O6: 2.79 | P6: 2
A7: NC | B7: David Bailey | C7: Nu Skin (.22) | D7: =+F7+I7+L7 -> 60.77 | E7: =+H7+K7+P7 -> 12 | F7: =+G7+(H7*0.5) -> 20.62 | G7: 20.12 | H7: 1 | I7: =+J7+(K7*0.5) -> 26.69 | J7: 22.69 | K7: 8 | L7: =+M7+N7+O7+(P7*0.5) -> 13.46 | M7: 4.10 | N7: 4.10 | O7: 3.76 | P7: 3
A8: 3 | B8: Dan Thomson | C8: Utah Valley Physical Therapy | D8: =+F8+I8+L8 -> 67.94 | E8: =+H8+K8+P8 -> 44 | F8: =+G8+(H8*0.5) -> 23.52 | G8: 20.02 | H8: 7 | I8: =+J8+(K8*0.5) -> 29.87 | J8: 18.37 | K8: 23 | L8: =+M8+N8+O8+(P8*0.5) -> 14.55 | M8: 2.64 | N8: 2.38 | O8: 2.53 | P8: 14
A9: 4 | B9: Mike Nielson | C9: IHC | D9: =+F9+I9+L9 -> 77.23 | E9: =+H9+K9+P9 -> 19 | F9: =+G9+(H9*0.5) -> 31.69 | G9: 29.19 | H9: 5 | I9: =+J9+(K9*0.5) -> 26.40 | J9: 22.90 | K9: 7 | L9: =+M9+N9+O9+(P9*0.5) -> 19.14 | M9: 4.87 | N9: 5.27 | O9: 5.50 | P9: 7
A10: 5 | B10: Todd Frandsen | C10: Knaack | D10: =+F10+I10+L10 -> 78.16 | E10: =+H10+K10+P10 -> 4 | F10: =+G10+(H10*0.5) -> 33.42 | G10: 32.42 | H10: 2 | I10: =+J10+(K10*0.5) -> 29.02 | J10: 29.02 | K10: 0 | L10: =+M10+N10+O10+(P10*0.5) -> 15.72 | M10: 5.49 | N10: 4.56 | O10: 4.67 | P10: 2
A11: 6 | B11: Tom Larsen | C11: Novell | D11: =+F11+I11+L11 -> 83.52 | E11: =+H11+K11+P11 -> 52 | F11: =+G11+(H11*0.5) -> 34.80 | G11: 31.30 | H11: 7 | I11: =+J11+(K11*0.5) -> 30.33 | J11: 18.83 | K11: 23 | L11: =+M11+N11+O11+(P11*0.5) -> 18.39 | M11: 2.91 | N11: 2.28 | O11: 2.20 | P11: 22
A12: 7 | B12: Tobias Peterson | C12: Mountain View Hospital | D12: =+F12+I12+L12 -> 86.12 | E12: =+H12+K12+P12 -> 40 | F12: =+G12+(H12*0.5) -> 31.10 | G12: 27.60 | H12: 7 | I12: =+J12+(K12*0.5) -> 40.96 | J12: 28.46 | K12: 25 | L12: =+M12+N12+O12+(P12*0.5) -> 14.06 | M12: 3.46 | N12: 3.49 | O12: 3.11 | P12: 8
A13: 8 | B13: Gary Smith | C13: Utah Valley Physical Therapy | D13: =+F13+I13+L13 -> 87.86 | E13: =+H13+K13+P13 -> 51 | F13: =+G13+(H13*0.5) -> 27.33 | G13: 25.33 | H13: 4 | I13: =+J13+(K13*0.5) -> 42.95 | J13: 22.95 | K13: 40 | L13: =+M13+N13+O13+(P13*0.5) -> 17.58 | M13: 5.02 | N13: 4.85 | O13: 4.21 | P13: 7
A14: 9 | B14: Thomas Harris | C14: Del Taco | D14: =+F14+I14+L14 -> 88.82 | E14: =+H14+K14+P14 -> 31 | F14: =+G14+(H14*0.5) -> 44.94 | G14: 34.94 | H14: 20 | I14: =+J14+(K14*0.5) -> 28.62 | J14: 25.62 | K14: 6 | L14: =+M14+N14+O14+(P14*0.5) -> 15.26 | M14: 4.72 | N14: 3.68 | O14: 4.36 | P14: 5
A15: 10 | B15: Brad Jones | C15: Nu Skin | D15: =+F15+I15+L15 -> 90.79 | E15: =+H15+K15+P15 -> 33 | F15: =+G15+(H15*0.5) -> 34.79 | G15: 30.79 | H15: 8 | I15: =+J15+(K15*0.5) -> 33.37 | J15: 24.87 | K15: 17 | L15: =+M15+N15+O15+(P15*0.5) -> 22.63 | M15: 7.99 | N15: 5.87 | O15: 4.77 | P15: 8
A16: 11 | B16: Pat Noonan | C16: IHC | D16: =+F16+I16+L16 -> 92.13 | E16: =+H16+K16+P16 -> 18 | F16: =+G16+(H16*0.5) -> 38.95 | G16: 33.95 | H16: 10 | I16: =+J16+(K16*0.5) -> 37.58 | J16: 33.58 | K16: 8 | L16: =+M16+N16+O16+(P16*0.5) -> 15.60 | M16: 5.30 | N16: 5.07 | O16: 5.23 | P16: 0
A17: 12 | B17: Brandon Peterson | C17: ? | D17: =+F17+I17+L17 -> 93.09 | E17: =+H17+K17+P17 -> 53 | F17: =+G17+(H17*0.5) -> 40.15 | G17: 31.65 | H17: 17 | I17: =+J17+(K17*0.5) -> 34.09 | J17: 25.09 | K17: 18 | L17: =+M17+N17+O17+(P17*0.5) -> 18.85 | M17: 3.90 | N17: 3.16 | O17: 2.79 | P17: 18
A18: 13 | B18: Dan Evans | C18: Mountain View Hospital | D18: =+F18+I18+L18 -> 93.95 | E18: =+H18+K18+P18 -> 35 | F18: =+G18+(H18*0.5) -> 37.99 | G18: 36.49 | H18: 3 | I18: =+J18+(K18*0.5) -> 39.41 | J18: 30.91 | K18: 17 | L18: =+M18+N18+O18+(P18*0.5) -> 16.55 | M18: 3.36 | N18: 3.08 | O18: 2.61 | P18: 15
A19: 14 | B19: Todd Balmforth | C19: Nu Skin | D19: =+F19+I19+L19 -> 95.89 | E19: =+H19+K19+P19 -> 6 | F19: =+G19+(H19*0.5) -> 36.41 | G19: 36.41 | H19: 0 | I19: =+J19+(K19*0.5) -> 32.35 | J19: 32.35 | K19: 0 | L19: =+M19+N19+O19+(P19*0.5) -> 27.13 | M19: 8.43 | N19: 7.49 | O19: 8.21 | P19: 6
A20: 15 | B20: Scott Davidson | C20: Snapp Norris Group | D20: =+F20+I20+L20 -> 96.69 | E20: =+H20+K20+P20 -> 89 | F20: =+G20+(H20*0.5) -> 32.05 | G20: 23.55 | H20: 17 | I20: =+J20+(K20*0.5) -> 52.49 | J20: 19.49 | K20: 66 | L20: =+M20+N20+O20+(P20*0.5) -> 12.15 | M20: 3.39 | N20: 2.82 | O20: 2.94 | P20: 6
A21: 16 | B21: John Pilmer | C21: Snapp Norris Group | D21: =+F21+I21+L21 -> 99.86 | E21: =+H21+K21+P21 -> 31 | F21: =+G21+(H21*0.5) -> 38.41 | G21: 35.91 | H21: 5 | I21: =+J21+(K21*0.5) -> 43.35 | J21: 33.35 | K21: 20 | L21: =+M21+N21+O21+(P21*0.5) -> 18.10 | M21: 5.54 | N21: 5.19 | O21: 4.37 | P21: 6
A22: 17 | B22: Corey Jackson | C22: Nu Skin | D22: =+F22+I22+L22 -> 101.99 | E22: =+H22+K22+P22 -> 39 | F22: =+G22+(H22*0.5) -> 37.82 | G22: 31.32 | H22: 13 | I22: =+J22+(K22*0.5) -> 45.94 | J22: 35.94 | K22: 20 | L22: =+M22+N22+O22+(P22*0.5) -> 18.23 | M22: 5.30 | N22: 4.83 | O22: 5.10 | P22: 6
A23: 18 | B23: Leslie Norris | C23: Snapp Norris Group | D23: =+F23+I23+L23 -> 102.70 | E23: =+H23+K23+P23 -> 42 | F23: =+G23+(H23*0.5) -> 41.43 | G23: 35.93 | H23: 11 | I23: =+J23+(K23*0.5) -> 47.34 | J23: 36.34 | K23: 22 | L23: =+M23+N23+O23+(P23*0.5) -> 13.93 | M23: 3.13 | N23: 3.13 | O23: 3.17 | P23: 9
A24: 19 | B24: Mike Lee | C24: Nu Skin | D24: =+F24+I24+L24 -> 103.12 | E24: =+H24+K24+P24 -> 19 | F24: =+G24+(H24*0.5) -> 44.19 | G24: 41.19 | H24: 6 | I24: =+J24+(K24*0.5) -> 41.55 | J24: 36.05 | K24: 11 | L24: =+M24+N24+O24+(P24*0.5) -> 17.38 | M24: 5.33 | N24: 6.28 | O24: 4.77 | P24: 2
A25: 20 | B25: Steve Poole | C25: Nu Skin | D25: =+F25+I25+L25 -> 111.93 | E25: =+H25+K25+P25 -> 75 | F25: =+G25+(H25*0.5) -> 38.70 | G25: 28.70 | H25: 20 | I25: =+J25+(K25*0.5) -> 54.55 | J25: 33.05 | K25: 43 | L25: =+M25+N25+O25+(P25*0.5) -> 18.68 | M25: 3.91 | N25: 4.80 | O25: 3.97 | P25: 12
A26: 21 | B26: Dallas John | C26: Mountain View Hospital | D26: =+F26+I26+L26 -> 122.41 | E26: =+H26+K26+P26 -> 27 | F26: =+G26+(H26*0.5) -> 48.01 | G26: 47.51 | H26: 1 | I26: =+J26+(K26*0.5) -> 45.83 | J26: 37.83 | K26: 16 | L26: =+M26+N26+O26+(P26*0.5) -> 28.57 | M26: 7.07 | N26: 10.00 | O26: 6.50 | P26: 10
A27: 22 | B27: Julie Anderson | C27: Snapp Norris Group | D27: DNF | E27: DNF | F27: =+G27+(H27*0.5) -> 0.00 | G27: 0.00 | H27: 0 | I27: =+J27+(K27*0.5) -> 87.57 | J27: 71.57 | K27: 32 | L27: =+M27+N27+O27+(P27*0.5) -> 44.67 | M27: 5.41 | N27: 5.04 | O27: 4.72 | P27: 59
A28: 1 | B28: Bob Marshall | C28: UDPL | D28: =+F28+I28+L28 -> 33.83 | E28: =+H28+K28+P28 -> 12 | F28: =+G28+(H28*0.5) -> 10.39 | G28: 9.89 | H28: 1 | I28: =+J28+(K28*0.5) -> 15.01 | J28: 11.51 | K28: 7 | L28: =+M28+N28+O28+(P28*0.5) -> 8.43 | M28: 1.94 | N28: 2.54 | O28: 1.95 | P28: 4
A29: 2 | B29: Pat Zaccardi | C29: UDPL | D29: =+F29+I29+L29 -> 39.52 | E29: =+H29+K29+P29 -> 13 | F29: =+G29+(H29*0.5) -> 15.49 | G29: 11.49 | H29: 8 | I29: =+J29+(K29*0.5) -> 16.13 | J29: 15.13 | K29: 2 | L29: =+M29+N29+O29+(P29*0.5) -> 7.90 | M29: 2.11 | N29: 2.16 | O29: 2.13 | P29: 3
A30: 3 | B30: Kevin Pagano | C30: UDPL | D30: =+F30+I30+L30 -> 42.10 | E30: =+H30+K30+P30 -> 19 | F30: =+G30+(H30*0.5) -> 17.54 | G30: 11.54 | H30: 12 | I30: =+J30+(K30*0.5) -> 16.04 | J30: 14.54 | K30: 3 | L30: =+M30+N30+O30+(P30*0.5) -> 8.52 | M30: 2.01 | N30: 2.30 | O30: 2.21 | P30: 4
A31: 4 | B31: Rylee Snelson | C31: UDPL | D31: =+F31+I31+L31 -> 46.88 | E31: =+H31+K31+P31 -> 21 | F31: =+G31+(H31*0.5) -> 15.54 | G31: 13.54 | H31: 4 | I31: =+J31+(K31*0.5) -> 20.90 | J31: 17.40 | K31: 7 | L31: =+M31+N31+O31+(P31*0.5) -> 10.44 | M31: 1.82 | N31: 1.82 | O31: 1.80 | P31: 10
A32: 5 | B32: John Lowe | C32: UDPL | D32: =+F32+I32+L32 -> 53.44 | E32: =+H32+K32+P32 -> 12 | F32: =+G32+(H32*0.5) -> 16.12 | G32: 15.62 | H32: 1 | I32: =+J32+(K32*0.5) -> 23.67 | J32: 23.67 | K32: 0 | L32: =+M32+N32+O32+(P32*0.5) -> 13.65 | M32: 2.77 | N32: 2.74 | O32: 2.64 | P32: 11
A33: 6 | B33: John Diamond | C33: UDPL | D33: =+F33+I33+L33 -> 82.16 | E33: =+H33+K33+P33 -> 44 | F33: =+G33+(H33*0.5) -> 34.11 | G33: 29.11 | H33: 10 | I33: =+J33+(K33*0.5) -> 34.59 | J33: 21.09 | K33: 27 | L33: =+M33+N33+O33+(P33*0.5) -> 13.46 | M33: 3.00 | N33: 3.15 | O33: 3.81 | P33: 7
A35: Notes:
A36: NC | B36: - Not Considered for medal placement because a .22 was used. A 9mm caliber or better is required for a medal.
A37: X | B37: - To make it fair to all corporate competitors, these shooters are ranked in a different class and will be scored and placed only against their fellow UDPL shooters after all three nights of competition. The placing indicated on this list does not necessarily indicate the competitors final overall placing.
A38: X | B38: - Indicates that the Points Down value contains some type of penalty (Procedural = 6 PD, or a "Hit on Non-Threat" = 10 PD).
A39: DNF | B39: - Indicates that the shooter Did Not Finish the match.