B1: Utah Valley Corporate Games Pistol Shoot - 2003
B2: UDPL Results from May 13th, 16th and 21st, 2003
A3: Place | B3: Name | C3: Organization | D3: Shoot Total | E3: Total Points Down | F3: Stage 1 | G3: String 1 | H3: Points Down | I3: Stage 2 | J3: String 1 | K3: Points Down | L3: Stage 3 | M3: String 1 | N3: String 2 | O3: String 3 | P3: Points Down
A4: 1 | B4: Bob Marshall | C4: UDPL | D4: =+F4+I4+L4 -> 33.83 | E4: =+H4+K4+P4 -> 12 | F4: =+G4+(H4*0.5) -> 10.39 | G4: 9.89 | H4: 1 | I4: =+J4+(K4*0.5) -> 15.01 | J4: 11.51 | K4: 7 | L4: =+M4+N4+O4+(P4*0.5) -> 8.43 | M4: 1.94 | N4: 2.54 | O4: 1.95 | P4: 4
A5: 2 | B5: Pat Zaccardi | C5: UDPL | D5: =+F5+I5+L5 -> 39.52 | E5: =+H5+K5+P5 -> 13 | F5: =+G5+(H5*0.5) -> 15.49 | G5: 11.49 | H5: 8 | I5: =+J5+(K5*0.5) -> 16.13 | J5: 15.13 | K5: 2 | L5: =+M5+N5+O5+(P5*0.5) -> 7.90 | M5: 2.11 | N5: 2.16 | O5: 2.13 | P5: 3
A6: 3 | B6: Ken Collins | C6: UDPL | D6: =+F6+I6+L6 -> 41.14 | E6: =+H6+K6+P6 -> 8 | F6: =+G6+(H6*0.5) -> 15.30 | G6: 14.80 | H6: 1 | I6: =+J6+(K6*0.5) -> 15.94 | J6: 14.94 | K6: 2 | L6: =+M6+N6+O6+(P6*0.5) -> 9.90 | M6: 2.53 | N6: 2.47 | O6: 2.40 | P6: 5
A7: 4 | B7: Kevin Pagano | C7: UDPL | D7: =+F7+I7+L7 -> 42.10 | E7: =+H7+K7+P7 -> 19 | F7: =+G7+(H7*0.5) -> 17.54 | G7: 11.54 | H7: 12 | I7: =+J7+(K7*0.5) -> 16.04 | J7: 14.54 | K7: 3 | L7: =+M7+N7+O7+(P7*0.5) -> 8.52 | M7: 2.01 | N7: 2.30 | O7: 2.21 | P7: 4
A8: 5 | B8: Ari Theodore | C8: UDPL | D8: =+F8+I8+L8 -> 45.31 | E8: =+H8+K8+P8 -> 18 | F8: =+G8+(H8*0.5) -> 13.31 | G8: 11.81 | H8: 3.00 | I8: =+J8+(K8*0.5) -> 23.25 | J8: 17.75 | K8: 11 | L8: =+M8+N8+O8+(P8*0.5) -> 8.75 | M8: 2.27 | N8: 2.27 | O8: 2.21 | P8: 4
A9: 6 | B9: Kevin Thomas | C9: UDPL | D9: =+F9+I9+L9 -> 46.60 | E9: =+H9+K9+P9 -> 15 | F9: =+G9+(H9*0.5) -> 18.28 | G9: 14.28 | H9: 8.00 | I9: =+J9+(K9*0.5) -> 19.35 | J9: 16.35 | K9: 6 | L9: =+M9+N9+O9+(P9*0.5) -> 8.97 | M9: 2.92 | N9: 2.89 | O9: 2.66 | P9: 1
A10: 7 | B10: Rylee Snelson | C10: UDPL | D10: =+F10+I10+L10 -> 46.88 | E10: =+H10+K10+P10 -> 21 | F10: =+G10+(H10*0.5) -> 15.54 | G10: 13.54 | H10: 4 | I10: =+J10+(K10*0.5) -> 20.90 | J10: 17.40 | K10: 7 | L10: =+M10+N10+O10+(P10*0.5) -> 10.44 | M10: 1.82 | N10: 1.82 | O10: 1.80 | P10: 10
A11: 8 | B11: Jeff McNail | C11: UDPL | D11: =+F11+I11+L11 -> 50.05 | E11: =+H11+K11+P11 -> 25 | F11: =+G11+(H11*0.5) -> 15.44 | G11: 12.44 | H11: 6.00 | I11: =+J11+(K11*0.5) -> 23.01 | J11: 16.51 | K11: 13 | L11: =+M11+N11+O11+(P11*0.5) -> 11.60 | M11: 2.74 | N11: 2.53 | O11: 3.33 | P11: 6
A12: 9 | B12: Steve Redford | C12: UDPL | D12: =+F12+I12+L12 -> 50.08 | E12: =+H12+K12+P12 -> 21 | F12: =+G12+(H12*0.5) -> 19.11 | G12: 15.11 | H12: 8 | I12: =+J12+(K12*0.5) -> 21.23 | J12: 17.73 | K12: 7 | L12: =+M12+N12+O12+(P12*0.5) -> 9.74 | M12: 2.34 | N12: 2.22 | O12: 2.18 | P12: 6
A13: 10 | B13: Kent Redford | C13: UDPL | D13: =+F13+I13+L13 -> 51.38 | E13: =+H13+K13+P13 -> 19 | F13: =+G13+(H13*0.5) -> 18.69 | G13: 16.69 | H13: 4 | I13: =+J13+(K13*0.5) -> 20.82 | J13: 17.32 | K13: 7 | L13: =+M13+N13+O13+(P13*0.5) -> 11.87 | M13: 2.82 | N13: 2.80 | O13: 2.25 | P13: 8
A14: 11 | B14: Mark Jensen | C14: UDPL | D14: =+F14+I14+L14 -> 52.34 | E14: =+H14+K14+P14 -> 25 | F14: =+G14+(H14*0.5) -> 16.72 | G14: 15.22 | H14: 3 | I14: =+J14+(K14*0.5) -> 26.21 | J14: 18.21 | K14: 16 | L14: =+M14+N14+O14+(P14*0.5) -> 9.41 | M14: 2.14 | N14: 2.13 | O14: 2.14 | P14: 6
A15: 12 | B15: John Lowe | C15: UDPL | D15: =+F15+I15+L15 -> 53.44 | E15: =+H15+K15+P15 -> 12 | F15: =+G15+(H15*0.5) -> 16.12 | G15: 15.62 | H15: 1 | I15: =+J15+(K15*0.5) -> 23.67 | J15: 23.67 | K15: 0 | L15: =+M15+N15+O15+(P15*0.5) -> 13.65 | M15: 2.77 | N15: 2.74 | O15: 2.64 | P15: 11
A16: 13 | B16: Mike Rodriquez | C16: UDPL | D16: =+F16+I16+L16 -> 55.82 | E16: =+H16+K16+P16 -> 27 | F16: =+G16+(H16*0.5) -> 23.88 | G16: 16.38 | H16: 15 | I16: =+J16+(K16*0.5) -> 20.75 | J16: 17.75 | K16: 6 | L16: =+M16+N16+O16+(P16*0.5) -> 11.19 | M16: 2.45 | N16: 3.02 | O16: 2.72 | P16: 6
A17: 14 | B17: Kyle Adams | C17: UDPL | D17: =+F17+I17+L17 -> 60.03 | E17: =+H17+K17+P17 -> 20 | F17: =+G17+(H17*0.5) -> 24.16 | G17: 17.66 | H17: 13 | I17: =+J17+(K17*0.5) -> 27.10 | J17: 24.60 | K17: 5 | L17: =+M17+N17+O17+(P17*0.5) -> 8.77 | M17: 2.68 | N17: 2.62 | O17: 2.47 | P17: 2
A18: 15 | B18: Neil Hood | C18: UDPL | D18: =+F18+I18+L18 -> 60.97 | E18: =+H18+K18+P18 -> 17 | F18: =+G18+(H18*0.5) -> 21.94 | G18: 21.44 | H18: 1.00 | I18: =+J18+(K18*0.5) -> 23.77 | J18: 23.27 | K18: 1 | L18: =+M18+N18+O18+(P18*0.5) -> 15.26 | M18: 2.46 | N18: 2.60 | O18: 2.70 | P18: 15
A19: 16 | B19: Dan Garcia | C19: UDPL | D19: =+F19+I19+L19 -> 68.36 | E19: =+H19+K19+P19 -> 5 | F19: =+G19+(H19*0.5) -> 22.67 | G19: 22.17 | H19: 1.00 | I19: =+J19+(K19*0.5) -> 33.29 | J19: 32.29 | K19: 2 | L19: =+M19+N19+O19+(P19*0.5) -> 12.40 | M19: 4.14 | N19: 3.51 | O19: 3.75 | P19: 2
A20: 17 | B20: Noel Redford | C20: UDPL | D20: =+F20+I20+L20 -> 71.06 | E20: =+H20+K20+P20 -> 34 | F20: =+G20+(H20*0.5) -> 21.80 | G20: 20.30 | H20: 3 | I20: =+J20+(K20*0.5) -> 33.41 | J20: 22.91 | K20: 21 | L20: =+M20+N20+O20+(P20*0.5) -> 15.85 | M20: 3.88 | N20: 3.39 | O20: 3.58 | P20: 10
A21: 18 | B21: John Diamond | C21: UDPL | D21: =+F21+I21+L21 -> 82.16 | E21: =+H21+K21+P21 -> 44 | F21: =+G21+(H21*0.5) -> 34.11 | G21: 29.11 | H21: 10 | I21: =+J21+(K21*0.5) -> 34.59 | J21: 21.09 | K21: 27 | L21: =+M21+N21+O21+(P21*0.5) -> 13.46 | M21: 3.00 | N21: 3.15 | O21: 3.81 | P21: 7
A22: 19 | B22: Carl Burney | C22: UDPL | D22: =+F22+I22+L22 -> 86.79 | E22: =+H22+K22+P22 -> 12 | F22: =+G22+(H22*0.5) -> 33.44 | G22: 32.44 | H22: 2.00 | I22: =+J22+(K22*0.5) -> 36.11 | J22: 31.11 | K22: 10 | L22: =+M22+N22+O22+(P22*0.5) -> 17.24 | M22: 5.95 | N22: 5.62 | O22: 5.67 | P22: 0
A23: 20 | B23: Rhett Runolfson | C23: UDPL | D23: =+F23+I23+L23 -> 87.66 | E23: =+H23+K23+P23 -> 34 | F23: =+G23+(H23*0.5) -> 30.05 | G23: 28.05 | H23: 4.00 | I23: =+J23+(K23*0.5) -> 38.22 | J23: 26.72 | K23: 23 | L23: =+M23+N23+O23+(P23*0.5) -> 19.39 | M23: 6.20 | N23: 6.60 | O23: 3.09 | P23: 7
A25: Notes:
A26: X | B26: - Indicates that the Points Down value contains some type of penalty (Procedural = 6 PD, or a "Hit on Non-Threat" = 10 PD).