B1: Utah Valley Corporate Games Pistol Shoot - 2003
B2: Results for May 16th, 2003 | E2: Total Points Down
A3: Place | B3: Name | C3: Organization (Note) | D3: Shoot Total | F3: Stage 1 | G3: String 1 | H3: Points Down | I3: Stage 2 | J3: String 1 | K3: Points Down | L3: Stage 3 | M3: String 1 | N3: String 2 | O3: String 3 | P3: Points Down
A4: 1 | B4: Red Redford | C4: Nu Skin | D4: =+F4+I4+L4 -> 46.46 | E4: =+H4+K4+P4 -> 14 | F4: =+G4+(H4*0.5) -> 17.02 | G4: 16.02 | H4: 2 | I4: =+J4+(K4*0.5) -> 18.00 | J4: 15.00 | K4: 6 | L4: =+M4+N4+O4+(P4*0.5) -> 11.44 | M4: 2.91 | N4: 2.83 | O4: 2.70 | P4: 6
A5: 2 | B5: Dave Marlow | C5: Nu Skin | D5: =+F5+I5+L5 -> 62.57 | E5: =+H5+K5+P5 -> 19 | F5: =+G5+(H5*0.5) -> 25.07 | G5: 24.07 | H5: 2 | I5: =+J5+(K5*0.5) -> 25.32 | J5: 21.32 | K5: 8 | L5: =+M5+N5+O5+(P5*0.5) -> 12.18 | M5: 2.58 | N5: 2.61 | O5: 2.49 | P5: 9
A6: 3 | B6: Doug Thompson | C6: NACT | D6: =+F6+I6+L6 -> 77.31 | E6: =+H6+K6+P6 -> 30 | F6: =+G6+(H6*0.5) -> 28.70 | G6: 26.20 | H6: 5 | I6: =+J6+(K6*0.5) -> 32.89 | J6: 24.89 | K6: 16 | L6: =+M6+N6+O6+(P6*0.5) -> 15.72 | M6: 4.66 | N6: 3.48 | O6: 3.08 | P6: 9
A7: NC | B7: Brad Jorgensen | C7: Provo City (.22) | D7: =+F7+I7+L7 -> 84.84 | E7: =+H7+K7+P7 -> 2 | F7: =+G7+(H7*0.5) -> 31.21 | G7: 31.21 | H7: 0 | I7: =+J7+(K7*0.5) -> 33.16 | J7: 33.16 | K7: 0 | L7: =+M7+N7+O7+(P7*0.5) -> 20.47 | M7: 5.97 | N7: 7.67 | O7: 5.83 | P7: 2
A8: 4 | B8: Jeff Lynn | C8: CED | D8: =+F8+I8+L8 -> 85.42 | E8: =+H8+K8+P8 -> 42 | F8: =+G8+(H8*0.5) -> 32.24 | G8: 26.74 | H8: 11 | I8: =+J8+(K8*0.5) -> 38.91 | J8: 25.91 | K8: 26 | L8: =+M8+N8+O8+(P8*0.5) -> 14.27 | M8: 4.63 | N8: 3.51 | O8: 3.63 | P8: 5
A9: 5 | B9: Kulani Fisher | C9: Rader Fishman | D9: =+F9+I9+L9 -> 92.85 | E9: =+H9+K9+P9 -> 41 | F9: =+G9+(H9*0.5) -> 37.44 | G9: 30.94 | H9: 13 | I9: =+J9+(K9*0.5) -> 42.03 | J9: 30.53 | K9: 23 | L9: =+M9+N9+O9+(P9*0.5) -> 13.38 | M9: 3.79 | N9: 3.81 | O9: 3.28 | P9: 5
A10: 6 | B10: Allen Carr | C10: Knaack | D10: =+F10+I10+L10 -> 93.74 | E10: =+H10+K10+P10 -> 45 | F10: =+G10+(H10*0.5) -> 34.39 | G10: 27.39 | H10: 14 | I10: =+J10+(K10*0.5) -> 36.14 | J10: 32.64 | K10: 7 | L10: =+M10+N10+O10+(P10*0.5) -> 23.21 | M10: 4.76 | N10: 3.29 | O10: 3.16 | P10: 24
A11: NC | B11: Dixie Johnson | C11: Nu Skin (.22) | D11: =+F11+I11+L11 -> 96.88 | E11: =+H11+K11+P11 -> 10 | F11: =+G11+(H11*0.5) -> 37.28 | G11: 34.78 | H11: 5 | I11: =+J11+(K11*0.5) -> 38.57 | J11: 38.07 | K11: 1 | L11: =+M11+N11+O11+(P11*0.5) -> 21.03 | M11: 7.78 | N11: 6.30 | O11: 4.95 | P11: 4
A12: 7 | B12: Karl Kennedy | C12: Knaack | D12: =+F12+I12+L12 -> 107.75 | E12: =+H12+K12+P12 -> 60 | F12: =+G12+(H12*0.5) -> 38.59 | G12: 22.59 | H12: 32 | I12: =+J12+(K12*0.5) -> 48.41 | J12: 39.91 | K12: 17 | L12: =+M12+N12+O12+(P12*0.5) -> 20.75 | M12: 4.60 | N12: 4.82 | O12: 5.83 | P12: 11
A13: 8 | B13: Von Bowles | C13: Knaack | D13: =+F13+I13+L13 -> 108.33 | E13: =+H13+K13+P13 -> 19 | F13: =+G13+(H13*0.5) -> 42.39 | G13: 40.39 | H13: 4 | I13: =+J13+(K13*0.5) -> 44.66 | J13: 40.66 | K13: 8 | L13: =+M13+N13+O13+(P13*0.5) -> 21.28 | M13: 3.68 | N13: 9.77 | O13: 4.33 | P13: 7
A14: 9 | B14: Mindyn McCondy | C14: Lone Peak High | D14: =+F14+I14+L14 -> 116.81 | E14: =+H14+K14+P14 -> 63 | F14: =+G14+(H14*0.5) -> 39.20 | G14: 29.70 | H14: 19 | I14: =+J14+(K14*0.5) -> 54.21 | J14: 42.21 | K14: 24 | L14: =+M14+N14+O14+(P14*0.5) -> 23.40 | M14: 4.09 | N14: 4.28 | O14: 5.03 | P14: 20
A15: 10 | B15: Alika Fisher | C15: Holiday Construction | D15: =+F15+I15+L15 -> 116.98 | E15: =+H15+K15+P15 -> 60 | F15: =+G15+(H15*0.5) -> 50.44 | G15: 33.94 | H15: 33 | I15: =+J15+(K15*0.5) -> 43.51 | J15: 35.51 | K15: 16 | L15: =+M15+N15+O15+(P15*0.5) -> 23.03 | M15: 5.43 | N15: 5.92 | O15: 6.18 | P15: 11
A16: NC | B16: Teri Fry | C16: Nu Skin (.22) | D16: =+F16+I16+L16 -> 136.27 | E16: =+H16+K16+P16 -> 26 | F16: =+G16+(H16*0.5) -> 53.47 | G16: 52.47 | H16: 2 | I16: =+J16+(K16*0.5) -> 46.44 | J16: 38.44 | K16: 16 | L16: =+M16+N16+O16+(P16*0.5) -> 36.36 | M16: 20.28 | N16: 5.21 | O16: 6.87 | P16: 8
A17: 11 | B17: John Nebeker | C17: Central Utah Surgical Center | D17: =+F17+I17+L17 -> 144.12 | E17: =+H17+K17+P17 -> 10 | F17: =+G17+(H17*0.5) -> 49.74 | G17: 49.74 | H17: 0 | I17: =+J17+(K17*0.5) -> 60.51 | J17: 55.51 | K17: 10 | L17: =+M17+N17+O17+(P17*0.5) -> 33.87 | M17: 8.98 | N17: 9.32 | O17: 15.57 | P17: 0
A18: NC | B18: Doug Jorgensen | C18: Provo City (.22) | D18: =+F18+I18+L18 -> 162.53 | E18: =+H18+K18+P18 -> 8 | F18: =+G18+(H18*0.5) -> 66.63 | G18: 65.63 | H18: 2 | I18: =+J18+(K18*0.5) -> 65.30 | J18: 65.30 | K18: 0 | L18: =+M18+N18+O18+(P18*0.5) -> 30.60 | M18: 9.36 | N18: 8.62 | O18: 9.62 | P18: 6
A19: 1 | B19: Ken Collins | C19: UDPL | D19: =+F19+I19+L19 -> 41.14 | E19: =+H19+K19+P19 -> 8 | F19: =+G19+(H19*0.5) -> 15.30 | G19: 14.80 | H19: 1 | I19: =+J19+(K19*0.5) -> 15.94 | J19: 14.94 | K19: 2 | L19: =+M19+N19+O19+(P19*0.5) -> 9.90 | M19: 2.53 | N19: 2.47 | O19: 2.40 | P19: 5
A20: 2 | B20: Steve Redford | C20: UDPL | D20: =+F20+I20+L20 -> 50.08 | E20: =+H20+K20+P20 -> 21 | F20: =+G20+(H20*0.5) -> 19.11 | G20: 15.11 | H20: 8 | I20: =+J20+(K20*0.5) -> 21.23 | J20: 17.73 | K20: 7 | L20: =+M20+N20+O20+(P20*0.5) -> 9.74 | M20: 2.34 | N20: 2.22 | O20: 2.18 | P20: 6
A21: 3 | B21: Kent Redford | C21: UDPL | D21: =+F21+I21+L21 -> 51.38 | E21: =+H21+K21+P21 -> 19 | F21: =+G21+(H21*0.5) -> 18.69 | G21: 16.69 | H21: 4 | I21: =+J21+(K21*0.5) -> 20.82 | J21: 17.32 | K21: 7 | L21: =+M21+N21+O21+(P21*0.5) -> 11.87 | M21: 2.82 | N21: 2.80 | O21: 2.25 | P21: 8
A22: 4 | B22: Mark Jensen | C22: UDPL | D22: =+F22+I22+L22 -> 52.34 | E22: =+H22+K22+P22 -> 25 | F22: =+G22+(H22*0.5) -> 16.72 | G22: 15.22 | H22: 3 | I22: =+J22+(K22*0.5) -> 26.21 | J22: 18.21 | K22: 16 | L22: =+M22+N22+O22+(P22*0.5) -> 9.41 | M22: 2.14 | N22: 2.13 | O22: 2.14 | P22: 6
A23: 5 | B23: Mike Rodriquez | C23: UDPL | D23: =+F23+I23+L23 -> 55.82 | E23: =+H23+K23+P23 -> 27 | F23: =+G23+(H23*0.5) -> 23.88 | G23: 16.38 | H23: 15 | I23: =+J23+(K23*0.5) -> 20.75 | J23: 17.75 | K23: 6 | L23: =+M23+N23+O23+(P23*0.5) -> 11.19 | M23: 2.45 | N23: 3.02 | O23: 2.72 | P23: 6
A24: 6 | B24: Kyle Adams | C24: UDPL | D24: =+F24+I24+L24 -> 60.03 | E24: =+H24+K24+P24 -> 20 | F24: =+G24+(H24*0.5) -> 24.16 | G24: 17.66 | H24: 13 | I24: =+J24+(K24*0.5) -> 27.10 | J24: 24.60 | K24: 5 | L24: =+M24+N24+O24+(P24*0.5) -> 8.77 | M24: 2.68 | N24: 2.62 | O24: 2.47 | P24: 2
A25: 7 | B25: Noel Redford | C25: UDPL | D25: =+F25+I25+L25 -> 71.06 | E25: =+H25+K25+P25 -> 34 | F25: =+G25+(H25*0.5) -> 21.80 | G25: 20.30 | H25: 3 | I25: =+J25+(K25*0.5) -> 33.41 | J25: 22.91 | K25: 21 | L25: =+M25+N25+O25+(P25*0.5) -> 15.85 | M25: 3.88 | N25: 3.39 | O25: 3.58 | P25: 10
A27: Notes:
A28: NC | B28: - Not Considered for medal placement because a .22 was used. A 9mm caliber or better is required for a medal.
A29: X | B29: - To make it fair to all corporate competitors, these shooters are ranked in a different class and will be scored and placed only against their fellow UDPL shooters after all three nights of competition. The placing indicated on this list does not necessarily indicate the competitors final overall placing.
A30: X | B30: - Indicates that the Points Down value contains some type of penalty (Procedural = 6 PD, or a "Hit on Non-Threat" = 10 PD).
A31: DNF | B31: - Indicates that the shooter Did Not Finish the match.