B1: UDPL 3-Gun Match - Results for August 21, 2004 held at the F.A.R.M.
B2: (Results listed by Time without regard to Division) | J2: To see a description of each Stage, click on the Stage #.
B3: Click here for results by DIVISION.
A4: Place | B4: Name | C4: Div * | D4: Shoot Total | E4: Total Points Down | F4: Stage 1 | G4: String 1 | H4: String 2 | I4: PD | J4: Stage 2 | K4: String 1 | L4: String 2 | M4: PD | N4: Stage 3 | O4: String 1 | P4: String 2 | Q4: PD | R4: Stage 4 | S4: String 1 | T4: String 2 | U4: String 3 | V4: PD | W4: Stage 5 | X4: String 1 | Y4: String 2 | Z4: PD | AA4: Stage 6 | AB4: String 1 | AC4: String 2 | AD4: String 3 | AE4: PD | AF4: Stage 7 | AG4: String 1 | AH4: PD | AI4: Stage 8 | AJ4: String 1 | AK4: String 2 | AL4: String 3 | AM4: PD | AN4: Stage 9 | AO4: String 1 | AP4: String 2 | AQ4: String 3 | AR4: PD
A5: 1 | B5: Outzen, Craig | C5: TRO | D5: =+F5+J5+N5+R5+W5+AA5+AF5+AI5+AN5 -> 299.13 | E5: =+I5+M5+Q5+V5+Z5+AE5+AH5+AM5+AR5 -> 97 | F5: =+(G5+H5)+(0.5*I5) -> 53.59 | G5: 28.13 | H5: 25.46 | I5: 0 | J5: =+(K5+L5)+0.5*M5 -> 23.53 | K5: 9.99 | L5: 8.04 | M5: =3+2+4+2 -> 11 | N5: =+(O5+P5)+0.5*Q5 -> 47.81 | O5: 16.69 | P5: 17.62 | Q5: =4+8+2+2+3+6+1+1 -> 27 | R5: =+(S5+T5+U5)+0.5*V5 -> 37.47 | S5: 3.93 | T5: 6.93 | U5: 6.61 | V5: =7+12+2+3+6+10 -> 40 | W5: =+(X5+Y5)+0.5*Z5 -> 45.39 | X5: 19.83 | Y5: 25.56 | Z5: 0 | AA5: =+(AB5+AC5+AD5)+0.5*AE5 -> 20.47 | AB5: 3.24 | AC5: 2.70 | AD5: 14.53 | AE5: 0 | AF5: =+(AG5)+0.5*AH5 -> 29.63 | AG5: 21.13 | AH5: =2+3+1+3+1+1+3+1+2 -> 17 | AI5: =+(AJ5+AK5+AL5)+0.5*AM5 -> 6.73 | AJ5: 1.68 | AK5: 3.40 | AL5: 1.65 | AM5: 0 | AN5: =+(AO5+AP5+AQ5)+0.5*AR5 -> 34.51 | AO5: 13.29 | AP5: 13.09 | AQ5: 7.13 | AR5: 2
A6: 2 | B6: Theodore, Ari | C6: T | D6: =+F6+J6+N6+R6+W6+AA6+AF6+AI6+AN6 -> 301.08 | E6: =+I6+M6+Q6+V6+Z6+AE6+AH6+AM6+AR6 -> 100 | F6: =+(G6+H6)+(0.5*I6) -> 46.36 | G6: 23.30 | H6: 23.06 | I6: 0 | J6: =+(K6+L6)+0.5*M6 -> 21.83 | K6: 9.20 | L6: 8.63 | M6: 8 | N6: =+(O6+P6)+0.5*Q6 -> 68.65 | O6: 21.35 | P6: 21.30 | Q6: =12+8+6+6+2+6+3+6+3 -> 52 | R6: =+(S6+T6+U6)+0.5*V6 -> 36.86 | S6: 6.35 | T6: 8.13 | U6: 8.88 | V6: =4+4+1+6+2+10 -> 27 | W6: =+(X6+Y6)+0.5*Z6 -> 34.60 | X6: 18.75 | Y6: 15.85 | Z6: 0 | AA6: =+(AB6+AC6+AD6)+0.5*AE6 -> 20.04 | AB6: 3.19 | AC6: 5.29 | AD6: 11.56 | AE6: 0 | AF6: =+(AG6)+0.5*AH6 -> 28.88 | AG6: 22.88 | AH6: =3+1+2+2+1+2+1 -> 12 | AI6: =+(AJ6+AK6+AL6)+0.5*AM6 -> 5.28 | AJ6: 1.89 | AK6: 1.71 | AL6: 1.68 | AM6: 0 | AN6: =+(AO6+AP6+AQ6)+0.5*AR6 -> 38.58 | AO6: 14.02 | AP6: 19.06 | AQ6: 5.00 | AR6: 1
A7: 3 | B7: Ostler, Jeff | C7: TRO | D7: =+F7+J7+N7+R7+W7+AA7+AF7+AI7+AN7 -> 327.53300000000002 | E7: =+I7+M7+Q7+V7+Z7+AE7+AH7+AM7+AR7 -> 108 | F7: =+(G7+H7)+(0.5*I7) -> 62.832999999999998 | G7: 31.02 | H7: 31.812999999999999 | I7: 0 | J7: =+(K7+L7)+0.5*M7 -> 19.36 | K7: 8.94 | L7: 8.92 | M7: 3 | N7: =+(O7+P7)+0.5*Q7 -> 55.53 | O7: 23.22 | P7: 19.81 | Q7: =5+3+5+3+3+3+3 -> 25 | R7: =+(S7+T7+U7)+0.5*V7 -> 48.98 | S7: 5.18 | T7: 7.15 | U7: 5.65 | V7: =3+11+8+13+7+20 -> 62 | W7: =+(X7+Y7)+0.5*Z7 -> 36.33 | X7: 16.87 | Y7: 19.46 | Z7: 0 | AA7: =+(AB7+AC7+AD7)+0.5*AE7 -> 18.97 | AB7: 2.87 | AC7: 2.28 | AD7: 13.82 | AE7: 0 | AF7: =+(AG7)+0.5*AH7 -> 45.33 | AG7: 37.83 | AH7: 15 | AI7: =+(AJ7+AK7+AL7)+0.5*AM7 -> 5.86 | AJ7: 2.13 | AK7: 1.90 | AL7: 1.83 | AM7: 0 | AN7: =+(AO7+AP7+AQ7)+0.5*AR7 -> 34.34 | AO7: 14.05 | AP7: 13.09 | AQ7: 5.70 | AR7: 3
A8: 4 | B8: Latham, Corey | C8: L | D8: =+F8+J8+N8+R8+W8+AA8+AF8+AI8+AN8 -> 332.48 | E8: =+I8+M8+Q8+V8+Z8+AE8+AH8+AM8+AR8 -> 26 | F8: =+(G8+H8)+(0.5*I8) -> 65.94 | G8: 34.36 | H8: 31.58 | I8: 0 | J8: =+(K8+L8)+0.5*M8 -> 30.27 | K8: 15.62 | L8: 13.65 | M8: 2 | N8: =+(O8+P8)+0.5*Q8 -> 49.17 | O8: 22.09 | P8: 21.08 | Q8: =2+5+2+3 -> 12 | R8: =+(S8+T8+U8)+0.5*V8 -> 28.55 | S8: 4.75 | T8: 8.84 | U8: 11.96 | V8: 6 | W8: =+(X8+Y8)+0.5*Z8 -> 41.55 | X8: 18.49 | Y8: 23.06 | Z8: 0 | AA8: =+(AB8+AC8+AD8)+0.5*AE8 -> 19.33 | AB8: 2.82 | AC8: 2.66 | AD8: 13.85 | AE8: 0 | AF8: =+(AG8)+0.5*AH8 -> 39.63 | AG8: 36.63 | AH8: 6 | AI8: =+(AJ8+AK8+AL8)+0.5*AM8 -> 5.50 | AJ8: 1.84 | AK8: 1.84 | AL8: 1.82 | AM8: 0 | AN8: =+(AO8+AP8+AQ8)+0.5*AR8 -> 52.54 | AO8: 20.67 | AP8: 15.96 | AQ8: 15.91 | AR8: 0
A9: 5 | B9: Richards, Dave | C9: TRO | D9: =+F9+J9+N9+R9+W9+AA9+AF9+AI9+AN9 -> 339.47199999999998 | E9: =+I9+M9+Q9+V9+Z9+AE9+AH9+AM9+AR9 -> 57 | F9: =+(G9+H9)+(0.5*I9) -> 59.71 | G9: 31.30 | H9: 28.41 | I9: 0 | J9: =+(K9+L9)+0.5*M9 -> 22.16 | K9: 7.77 | L9: 8.89 | M9: 11 | N9: =+(O9+P9)+0.5*Q9 -> 69.25 | O9: 28.74 | P9: 32.01 | Q9: =3+4+2+6+1+1 -> 17 | R9: =+(S9+T9+U9)+0.5*V9 -> 32.421999999999997 | S9: 6.2320000000000002 | T9: 9.19 | U9: 8.00 | V9: =2+1+5+9+1 -> 18 | W9: =+(X9+Y9)+0.5*Z9 -> 42.94 | X9: 22.03 | Y9: 20.91 | Z9: 0 | AA9: =+(AB9+AC9+AD9)+0.5*AE9 -> 30.41 | AB9: 9.53 | AC9: 3.53 | AD9: 17.35 | AE9: 0 | AF9: =+(AG9)+0.5*AH9 -> 32.19 | AG9: 28.69 | AH9: 7 | AI9: =+(AJ9+AK9+AL9)+0.5*AM9 -> 8.13 | AJ9: 2.00 | AK9: 3.16 | AL9: 2.97 | AM9: 0 | AN9: =+(AO9+AP9+AQ9)+0.5*AR9 -> 42.26 | AO9: 17.45 | AP9: 17.46 | AQ9: 5.35 | AR9: 4
A10: 6 | B10: Zaccardi, Pat | C10: TRO | D10: =+F10+J10+N10+R10+W10+AA10+AF10+AI10+AN10 -> 341.93 | E10: =+I10+M10+Q10+V10+Z10+AE10+AH10+AM10+AR10 -> 91 | F10: =+(G10+H10)+(0.5*I10) -> 55.31 | G10: 28.12 | H10: 27.19 | I10: 0 | J10: =+(K10+L10)+0.5*M10 -> 19.08 | K10: 8.07 | L10: 7.51 | M10: 7 | N10: =+(O10+P10)+0.5*Q10 -> 59.08 | O10: 22.97 | P10: 21.61 | Q10: =2+7+4+1+4+3+3+5 -> 29 | R10: =+(S10+T10+U10)+0.5*V10 -> 39.96 | S10: 5.90 | T10: 9.00 | U10: 8.06 | V10: =16+9+1+2+6 -> 34 | W10: =+(X10+Y10)+0.5*Z10 -> 51.61 | X10: 25.35 | Y10: 26.26 | Z10: 0 | AA10: =+(AB10+AC10+AD10)+0.5*AE10 -> 30.97 | AB10: 4.03 | AC10: 5.64 | AD10: 21.30 | AE10: 0 | AF10: =+(AG10)+0.5*AH10 -> 37.82 | AG10: 27.32 | AH10: =3+1+1+4+7+1+2+1+1 -> 21 | AI10: =+(AJ10+AK10+AL10)+0.5*AM10 -> 7.52 | AJ10: 2.61 | AK10: 2.69 | AL10: 2.22 | AM10: 0 | AN10: =+(AO10+AP10+AQ10)+0.5*AR10 -> 40.58 | AO10: 19.37 | AP10: 16.94 | AQ10: 4.27 | AR10: 0
A11: 7 | B11: Correia, Larry | C11: O | D11: =+F11+J11+N11+R11+W11+AA11+AF11+AI11+AN11 -> 356.68 | E11: =+I11+M11+Q11+V11+Z11+AE11+AH11+AM11+AR11 -> 64 | F11: =+(G11+H11)+(0.5*I11) -> 57.46 | G11: 29.24 | H11: 28.22 | I11: 0 | J11: =+(K11+L11)+0.5*M11 -> 28.28 | K11: 11.71 | L11: 12.07 | M11: =2+2+1+4 -> 9 | N11: =+(O11+P11)+0.5*Q11 -> 63.87 | O11: 25.32 | P11: 25.55 | Q11: =4+5+8+1+4+1+1+2 -> 26 | R11: =+(S11+T11+U11)+0.5*V11 -> 34.84 | S11: 5.42 | T11: 8.34 | U11: 12.08 | V11: =3+6+2+1+6 -> 18 | W11: =+(X11+Y11)+0.5*Z11 -> 44.51 | X11: 20.81 | Y11: 23.70 | Z11: 0 | AA11: =+(AB11+AC11+AD11)+0.5*AE11 -> 15.43 | AB11: 3.35 | AC11: 2.24 | AD11: 9.84 | AE11: 0 | AF11: =+(AG11)+0.5*AH11 -> 64.24 | AG11: 59.74 | AH11: =1+2+3+2+1 -> 9 | AI11: =+(AJ11+AK11+AL11)+0.5*AM11 -> 9.80 | AJ11: 5.48 | AK11: 2.62 | AL11: 1.70 | AM11: 0 | AN11: =+(AO11+AP11+AQ11)+0.5*AR11 -> 38.25 | AO11: 17.10 | AP11: 14.97 | AQ11: 5.18 | AR11: 2
A12: 8 | B12: Lowe, John | C12: TRO | D12: =+F12+J12+N12+R12+W12+AA12+AF12+AI12+AN12 -> 359.32 | E12: =+I12+M12+Q12+V12+Z12+AE12+AH12+AM12+AR12 -> 81 | F12: =+(G12+H12)+(0.5*I12) -> 50.58 | G12: 26.82 | H12: 23.76 | I12: 0 | J12: =+(K12+L12)+0.5*M12 -> 19.69 | K12: 7.65 | L12: 7.04 | M12: =2+3+3+2 -> 10 | N12: =+(O12+P12)+0.5*Q12 -> 58.49 | O12: 18.37 | P12: 21.62 | Q12: =6+2+2+4+1+1+3+1+11+6 -> 37 | R12: =+(S12+T12+U12)+0.5*V12 -> 31.51 | S12: 5.57 | T12: 7.62 | U12: 8.32 | V12: =4+5+3+3+5 -> 20 | W12: =+(X12+Y12)+0.5*Z12 -> 40.21 | X12: 20.37 | Y12: 19.84 | Z12: 0 | AA12: =+(AB12+AC12+AD12)+0.5*AE12 -> 40.46 | AB12: 5.76 | AC12: 3.95 | AD12: 30.75 | AE12: 0 | AF12: =+(AG12)+0.5*AH12 -> 40.57 | AG12: 36.57 | AH12: 8 | AI12: =+(AJ12+AK12+AL12)+0.5*AM12 -> 9.48 | AJ12: 4.96 | AK12: 2.87 | AL12: 1.65 | AM12: 0 | AN12: =+(AO12+AP12+AQ12)+0.5*AR12 -> 68.33 | AO12: 30.18 | AP12: 26.02 | AQ12: 9.13 | AR12: 6
A13: 9 | B13: Vollmer, Phil | C13: T | D13: =+F13+J13+N13+R13+W13+AA13+AF13+AI13+AN13 -> 374.08 | E13: =+I13+M13+Q13+V13+Z13+AE13+AH13+AM13+AR13 -> 52 | F13: =+(G13+H13)+(0.5*I13) -> 66.20 | G13: 34.17 | H13: 32.03 | I13: 0 | J13: =+(K13+L13)+0.5*M13 -> 19.62 | K13: 8.28 | L13: 9.84 | M13: 3 | N13: =+(O13+P13)+0.5*Q13 -> 64.97 | O13: 28.21 | P13: 30.76 | Q13: 12 | R13: =+(S13+T13+U13)+0.5*V13 -> 37.22 | S13: 6.05 | T13: 8.06 | U13: 8.61 | V13: =9+7+9+1+3 -> 29 | W13: =+(X13+Y13)+0.5*Z13 -> 44.56 | X13: 22.47 | Y13: 22.09 | Z13: 0 | AA13: =+(AB13+AC13+AD13)+0.5*AE13 -> 33.70 | AB13: 4.15 | AC13: 3.90 | AD13: 25.65 | AE13: 0 | AF13: =+(AG13)+0.5*AH13 -> 42.62 | AG13: 40.62 | AH13: 4 | AI13: =+(AJ13+AK13+AL13)+0.5*AM13 -> 13.32 | AJ13: 3.93 | AK13: 4.83 | AL13: 4.56 | AM13: 0 | AN13: =+(AO13+AP13+AQ13)+0.5*AR13 -> 51.87 | AO13: 17.64 | AP13: 24.84 | AQ13: 7.39 | AR13: 4
A14: 10 | B14: Langford, Les | C14: TRO | D14: =+F14+J14+N14+R14+W14+AA14+AF14+AI14+AN14 -> 376.86 | E14: =+I14+M14+Q14+V14+Z14+AE14+AH14+AM14+AR14 -> 69 | F14: =+(G14+H14)+(0.5*I14) -> 76.22 | G14: 37.78 | H14: 38.44 | I14: 0 | J14: =+(K14+L14)+0.5*M14 -> 28.19 | K14: 13.65 | L14: 13.04 | M14: 3 | N14: =+(O14+P14)+0.5*Q14 -> 63.62 | O14: 25.82 | P14: 24.80 | Q14: =1+2+6+4+4+2+2+3+2 -> 26 | R14: =+(S14+T14+U14)+0.5*V14 -> 29.70 | S14: 4.97 | T14: 8.09 | U14: 7.64 | V14: =3+4+6+2+3 -> 18 | W14: =+(X14+Y14)+0.5*Z14 -> 43.66 | X14: 23.00 | Y14: 20.66 | Z14: 0 | AA14: =+(AB14+AC14+AD14)+0.5*AE14 -> 22.15 | AB14: 3.61 | AC14: 2.78 | AD14: 15.76 | AE14: 0 | AF14: =+(AG14)+0.5*AH14 -> 58.84 | AG14: 49.34 | AH14: =2+5+2+3+2+3+1+1 -> 19 | AI14: =+(AJ14+AK14+AL14)+0.5*AM14 -> 11.48 | AJ14: 2.77 | AK14: 2.73 | AL14: 5.98 | AM14: 0 | AN14: =+(AO14+AP14+AQ14)+0.5*AR14 -> 43.00 | AO14: 17.87 | AP14: 17.30 | AQ14: 6.33 | AR14: 3
A15: 11 | B15: Zaccardi, Juke | C15: TRO | D15: =+F15+J15+N15+R15+W15+AA15+AF15+AI15+AN15 -> 377.17 | E15: =+I15+M15+Q15+V15+Z15+AE15+AH15+AM15+AR15 -> 130 | F15: =+(G15+H15)+(0.5*I15) -> 64.10 | G15: 33.12 | H15: 30.98 | I15: 0 | J15: =+(K15+L15)+0.5*M15 -> 26.13 | K15: 6.94 | L15: 7.19 | M15: =1+8+2+3+10 -> 24 | N15: =+(O15+P15)+0.5*Q15 -> 61.73 | O15: 21.33 | P15: 26.40 | Q15: =6+2+7+3+1+3+3+1+2 -> 28 | R15: =+(S15+T15+U15)+0.5*V15 -> 44.37 | S15: 6.54 | T15: 9.37 | U15: 9.46 | V15: =4+10+9+4+1+10 -> 38 | W15: =+(X15+Y15)+0.5*Z15 -> 49.68 | X15: 24.76 | Y15: 24.92 | Z15: 0 | AA15: =+(AB15+AC15+AD15)+0.5*AE15 -> 28.85 | AB15: 3.89 | AC15: 4.47 | AD15: 20.49 | AE15: 0 | AF15: =+(AG15)+0.5*AH15 -> 39.36 | AG15: 27.36 | AH15: =1+3+5+2+1+2+10 -> 24 | AI15: =+(AJ15+AK15+AL15)+0.5*AM15 -> 12.77 | AJ15: 1.90 | AK15: 1.67 | AL15: 4.20 | AM15: 10 | AN15: =+(AO15+AP15+AQ15)+0.5*AR15 -> 50.18 | AO15: 14.74 | AP15: 18.83 | AQ15: 13.61 | AR15: 6
A16: 12 | B16: Knapp, Chris | C16: TRO | D16: =+F16+J16+N16+R16+W16+AA16+AF16+AI16+AN16 -> 389.13 | E16: =+I16+M16+Q16+V16+Z16+AE16+AH16+AM16+AR16 -> 64 | F16: =+(G16+H16)+(0.5*I16) -> 80.71 | G16: 46.41 | H16: 34.30 | I16: 0 | J16: =+(K16+L16)+0.5*M16 -> 24.89 | K16: 12.42 | L16: 11.47 | M16: 2 | N16: =+(O16+P16)+0.5*Q16 -> 73.49 | O16: 33.03 | P16: 27.96 | Q16: =1+3+7+4+3+2+3+2 -> 25 | R16: =+(S16+T16+U16)+0.5*V16 -> 45.05 | S16: 7.87 | T16: 9.90 | U16: 10.28 | V16: =3+5+1+5+20 -> 34 | W16: =+(X16+Y16)+0.5*Z16 -> 48.35 | X16: 28.23 | Y16: 20.12 | Z16: 0 | AA16: =+(AB16+AC16+AD16)+0.5*AE16 -> 31.18 | AB16: 4.83 | AC16: 3.66 | AD16: 22.69 | AE16: 0 | AF16: =+(AG16)+0.5*AH16 -> 37.36 | AG16: 36.86 | AH16: 1 | AI16: =+(AJ16+AK16+AL16)+0.5*AM16 -> 10.70 | AJ16: 4.70 | AK16: 3.50 | AL16: 2.50 | AM16: 0 | AN16: =+(AO16+AP16+AQ16)+0.5*AR16 -> 37.40 | AO16: 14.23 | AP16: 14.28 | AQ16: 7.89 | AR16: 2
A17: 13 | B17: Eddy, Nephi | C17: TRO | D17: =+F17+J17+N17+R17+W17+AA17+AF17+AI17+AN17 -> 412.12 | E17: =+I17+M17+Q17+V17+Z17+AE17+AH17+AM17+AR17 -> 82 | F17: =+(G17+H17)+(0.5*I17) -> 89.01 | G17: 42.49 | H17: 46.52 | I17: 0 | J17: =+(K17+L17)+0.5*M17 -> 28.84 | K17: 11.36 | L17: 10.48 | M17: 14 | N17: =+(O17+P17)+0.5*Q17 -> 65.43 | O17: 25.38 | P17: 29.55 | Q17: =1+4+4+6+1+2+1+2 -> 21 | R17: =+(S17+T17+U17)+0.5*V17 -> 34.67 | S17: 6.18 | T17: 8.82 | U17: 9.17 | V17: =4+9+2+6 -> 21 | W17: =+(X17+Y17)+0.5*Z17 -> 40.09 | X17: 21.05 | Y17: 19.04 | Z17: 0 | AA17: =+(AB17+AC17+AD17)+0.5*AE17 -> 28.79 | AB17: 4.88 | AC17: 3.78 | AD17: 20.13 | AE17: 0 | AF17: =+(AG17)+0.5*AH17 -> 67.77 | AG17: 56.27 | AH17: =5+2+5+1+10 -> 23 | AI17: =+(AJ17+AK17+AL17)+0.5*AM17 -> 12.39 | AJ17: 4.96 | AK17: 3.28 | AL17: 4.15 | AM17: 0 | AN17: =+(AO17+AP17+AQ17)+0.5*AR17 -> 45.13 | AO17: 20.70 | AP17: 16.02 | AQ17: 6.91 | AR17: 3
A18: 14 | B18: Young, Ren | C18: O | D18: =+F18+J18+N18+R18+W18+AA18+AF18+AI18+AN18 -> 427.86 | E18: =+I18+M18+Q18+V18+Z18+AE18+AH18+AM18+AR18 -> 142 | F18: =+(G18+H18)+(0.5*I18) -> 76.77 | G18: 39.41 | H18: 37.36 | I18: 0 | J18: =+(K18+L18)+0.5*M18 -> 24.27 | K18: 10.91 | L18: 11.36 | M18: 4 | N18: =+(O18+P18)+0.5*Q18 -> 85.01 | O18: 34.81 | P18: 24.70 | Q18: =2+2+10+18+2+3+6+5+3 -> 51 | R18: =+(S18+T18+U18)+0.5*V18 -> 50.90 | S18: 6.20 | T18: 9.05 | U18: 7.65 | V18: =14+10+3+5+4+20 -> 56 | W18: =+(X18+Y18)+0.5*Z18 -> 49.82 | X18: 24.86 | Y18: 24.96 | Z18: 0 | AA18: =+(AB18+AC18+AD18)+0.5*AE18 -> 14.65 | AB18: 5.97 | AC18: 4.57 | AD18: 4.11 | AE18: 0 | AF18: =+(AG18)+0.5*AH18 -> 55.53 | AG18: 43.03 | AH18: =6+2+3+2+3+3+2+3+1 -> 25 | AI18: =+(AJ18+AK18+AL18)+0.5*AM18 -> 11.22 | AJ18: 3.41 | AK18: 3.67 | AL18: 4.14 | AM18: 0 | AN18: =+(AO18+AP18+AQ18)+0.5*AR18 -> 59.69 | AO18: 22.40 | AP18: 29.64 | AQ18: 4.65 | AR18: 6
A19: 15 | B19: Simpson, Harold | C19: TRO | D19: =+F19+J19+N19+R19+W19+AA19+AF19+AI19+AN19 -> 459.38 | E19: =+I19+M19+Q19+V19+Z19+AE19+AH19+AM19+AR19 -> 61 | F19: =+(G19+H19)+(0.5*I19) -> 66.78 | G19: 48.06 | H19: 18.72 | I19: 0 | J19: =+(K19+L19)+0.5*M19 -> 34.29 | K19: 17.56 | L19: 16.73 | M19: 0 | N19: =+(O19+P19)+0.5*Q19 -> 82.59 | O19: 36.34 | P19: 35.25 | Q19: =2+6+5+4+1+2+2 -> 22 | R19: =+(S19+T19+U19)+0.5*V19 -> 40.30 | S19: 9.12 | T19: 10.64 | U19: 10.04 | V19: =1+5+3+1+1+10 -> 21 | W19: =+(X19+Y19)+0.5*Z19 -> 60.39 | X19: 31.66 | Y19: 28.73 | Z19: 0 | AA19: =+(AB19+AC19+AD19)+0.5*AE19 -> 41.40 | AB19: 6.34 | AC19: 5.70 | AD19: 29.36 | AE19: 0 | AF19: =+(AG19)+0.5*AH19 -> 58.77 | AG19: 49.77 | AH19: =15+1+1+1 -> 18 | AI19: =+(AJ19+AK19+AL19)+0.5*AM19 -> 14.25 | AJ19: 3.29 | AK19: 4.78 | AL19: 6.18 | AM19: 0 | AN19: =+(AO19+AP19+AQ19)+0.5*AR19 -> 60.61 | AO19: 23.85 | AP19: 26.95 | AQ19: 9.81 | AR19: 0
A20: 16 | B20: Rodriquez, Mike | C20: L | D20: =+F20+J20+N20+R20+W20+AA20+AF20+AI20+AN20 -> 464.27 | E20: =+I20+M20+Q20+V20+Z20+AE20+AH20+AM20+AR20 -> 118 | F20: =+(G20+H20)+(0.5*I20) -> 82.35 | G20: 40.12 | H20: 42.23 | I20: 0 | J20: =+(K20+L20)+0.5*M20 -> 27.87 | K20: 12.39 | L20: 12.98 | M20: 5 | N20: =+(O20+P20)+0.5*Q20 -> 88.58 | O20: 29.71 | P20: 29.37 | Q20: =6+14+10+10+4+4+3+4+4 -> 59 | R20: =+(S20+T20+U20)+0.5*V20 -> 45.90 | S20: 6.56 | T20: 8.21 | U20: 8.63 | V20: =2+10+14+5+4+10 -> 45 | W20: =+(X20+Y20)+0.5*Z20 -> 55.77 | X20: 29.43 | Y20: 26.34 | Z20: 0 | AA20: =+(AB20+AC20+AD20)+0.5*AE20 -> 49.15 | AB20: 5.02 | AC20: 5.38 | AD20: 38.75 | AE20: 0 | AF20: =+(AG20)+0.5*AH20 -> 52.85 | AG20: 49.85 | AH20: 6 | AI20: =+(AJ20+AK20+AL20)+0.5*AM20 -> 13.37 | AJ20: 5.99 | AK20: 3.93 | AL20: 3.45 | AM20: 0 | AN20: =+(AO20+AP20+AQ20)+0.5*AR20 -> 48.43 | AO20: 19.78 | AP20: 19.31 | AQ20: 7.84 | AR20: 3
A21: 17 | B21: Warren, Tad | C21: T | D21: =+F21+J21+N21+R21+W21+AA21+AF21+AI21+AN21 -> 470.58 | E21: =+I21+M21+Q21+V21+Z21+AE21+AH21+AM21+AR21 -> 88 | F21: =+(G21+H21)+(0.5*I21) -> 93.91 | G21: 50.96 | H21: 42.95 | I21: 0 | J21: =+(K21+L21)+0.5*M21 -> 27.17 | K21: 11.24 | L21: 11.93 | M21: 8 | N21: =+(O21+P21)+0.5*Q21 -> 73.01 | O21: 35.14 | P21: 33.37 | Q21: 9 | R21: =+(S21+T21+U21)+0.5*V21 -> 52.97 | S21: 7.40 | T21: 7.99 | U21: 17.58 | V21: =6+10+14+6+4 -> 40 | W21: =+(X21+Y21)+0.5*Z21 -> 62.29 | X21: 33.26 | Y21: 29.03 | Z21: 0 | AA21: =+(AB21+AC21+AD21)+0.5*AE21 -> 17.96 | AB21: 5.12 | AC21: 8.76 | AD21: 4.08 | AE21: 0 | AF21: =+(AG21)+0.5*AH21 -> 70.42 | AG21: 60.92 | AH21: 19 | AI21: =+(AJ21+AK21+AL21)+0.5*AM21 -> 15.87 | AJ21: 3.99 | AK21: 2.94 | AL21: 3.94 | AM21: 10 | AN21: =+(AO21+AP21+AQ21)+0.5*AR21 -> 56.98 | AO21: 24.20 | AP21: 26.04 | AQ21: 5.74 | AR21: 2
A22: 18 | B22: Lauritzen, Scott | C22: L | D22: =+F22+J22+N22+R22+W22+AA22+AF22+AI22+AN22 -> 480.41 | E22: =+I22+M22+Q22+V22+Z22+AE22+AH22+AM22+AR22 -> 113 | F22: =+(G22+H22)+(0.5*I22) -> 77.81 | G22: 43.17 | H22: 34.64 | I22: 0 | J22: =+(K22+L22)+0.5*M22 -> 28.83 | K22: 9.38 | L22: 9.45 | M22: =9+6+4+1 -> 20 | N22: =+(O22+P22)+0.5*Q22 -> 75.45 | O22: 36.00 | P22: 28.45 | Q22: =1+1+1+2+4+5+4+4 -> 22 | R22: =+(S22+T22+U22)+0.5*V22 -> 41.96 | S22: 6.23 | T22: 9.82 | U22: 11.91 | V22: =2+5+6+4+1+10 -> 28 | W22: =+(X22+Y22)+0.5*Z22 -> 57.69 | X22: 31.09 | Y22: 26.60 | Z22: 0 | AA22: =+(AB22+AC22+AD22)+0.5*AE22 -> 34.71 | AB22: 3.80 | AC22: 4.38 | AD22: 26.53 | AE22: 0 | AF22: =+(AG22)+0.5*AH22 -> 53.56 | AG22: 49.06 | AH22: 9 | AI22: =+(AJ22+AK22+AL22)+0.5*AM22 -> 7.78 | AJ22: 2.95 | AK22: 2.76 | AL22: 2.07 | AM22: 0 | AN22: =+(AO22+AP22+AQ22)+0.5*AR22 -> 102.62 | AO22: 30.00 | AP22: 30.00 | AQ22: 25.62 | AR22: 34
A23: 19 | B23: Durant, Steve | C23: T | D23: =+F23+J23+N23+R23+W23+AA23+AF23+AI23+AN23 -> 482.57 | E23: =+I23+M23+Q23+V23+Z23+AE23+AH23+AM23+AR23 -> 95 | F23: =+(G23+H23)+(0.5*I23) -> 105.55 | G23: 55.59 | H23: 49.96 | I23: 0 | J23: =+(K23+L23)+0.5*M23 -> 33.73 | K23: 17.57 | L23: 12.66 | M23: 7 | N23: =+(O23+P23)+0.5*Q23 -> 61.33 | O23: 25.46 | P23: 27.37 | Q23: =1+3+1+6+2+2+2 -> 17 | R23: =+(S23+T23+U23)+0.5*V23 -> 52.46 | S23: 6.80 | T23: 11.87 | U23: 8.29 | V23: =8+8+16+8+1+10 -> 51 | W23: =+(X23+Y23)+0.5*Z23 -> 54.16 | X23: 30.44 | Y23: 23.72 | Z23: 0 | AA23: =+(AB23+AC23+AD23)+0.5*AE23 -> 40.04 | AB23: 8.22 | AC23: 7.02 | AD23: 24.80 | AE23: 0 | AF23: =+(AG23)+0.5*AH23 -> 63.82 | AG23: 55.32 | AH23: 17 | AI23: =+(AJ23+AK23+AL23)+0.5*AM23 -> 10.20 | AJ23: 3.95 | AK23: 3.31 | AL23: 2.94 | AM23: 0 | AN23: =+(AO23+AP23+AQ23)+0.5*AR23 -> 61.28 | AO23: 17.75 | AP23: 28.80 | AQ23: 13.23 | AR23: 3
A24: 20 | B24: Redford, "Red" | C24: T | D24: =+F24+J24+N24+R24+W24+AA24+AF24+AI24+AN24 -> 497.32 | E24: =+I24+M24+Q24+V24+Z24+AE24+AH24+AM24+AR24 -> 63 | F24: =+(G24+H24)+(0.5*I24) -> 90.83 | G24: 45.24 | H24: 45.59 | J24: =+(K24+L24)+0.5*M24 -> 26.61 | K24: 12.01 | L24: 12.60 | M24: 4 | N24: =+(O24+P24)+0.5*Q24 -> 80.45 | O24: 34.42 | P24: 33.53 | Q24: =2+3+3+7+4+1+2+3 -> 25 | R24: =+(S24+T24+U24)+0.5*V24 -> 32.79 | S24: 5.66 | T24: 7.44 | U24: 7.19 | V24: =6+1+5+3+10 -> 25 | W24: =+(X24+Y24)+0.5*Z24 -> 81.05 | X24: 42.05 | Y24: 39.00 | Z24: 0 | AA24: =+(AB24+AC24+AD24)+0.5*AE24 -> 36.55 | AB24: 3.63 | AC24: 4.05 | AD24: 28.87 | AE24: 0 | AF24: =+(AG24)+0.5*AH24 -> 84.61 | AG24: 80.61 | AH24: 8 | AI24: =+(AJ24+AK24+AL24)+0.5*AM24 -> 10.72 | AJ24: 3.04 | AK24: 3.88 | AL24: 3.80 | AM24: 0 | AN24: =+(AO24+AP24+AQ24)+0.5*AR24 -> 53.71 | AO24: 23.31 | AP24: 22.93 | AQ24: 6.97 | AR24: 1
A25: 21 | B25: Stone, Scott | C25: TRO | D25: =+F25+J25+N25+R25+W25+AA25+AF25+AI25+AN25 -> 511.81 | E25: =+I25+M25+Q25+V25+Z25+AE25+AH25+AM25+AR25 -> 160 | F25: =+(G25+H25)+(0.5*I25) -> 87.00 | G25: 38.81 | H25: 48.19 | I25: 0 | J25: =+(K25+L25)+0.5*M25 -> 42.57 | K25: 16.77 | L25: 16.80 | M25: =7+6+5 -> 18 | N25: =+(O25+P25)+0.5*Q25 -> 91.49 | O25: 32.26 | P25: 29.23 | Q25: =2+4+6+6+4+14+8+6+10 -> 60 | R25: =+(S25+T25+U25)+0.5*V25 -> 39.95 | S25: 5.86 | T25: 5.76 | U25: 7.83 | V25: =7+11+7+5+1+10 -> 41 | W25: =+(X25+Y25)+0.5*Z25 -> 66.55 | X25: 31.19 | Y25: 35.36 | Z25: 0 | AA25: =+(AB25+AC25+AD25)+0.5*AE25 -> 38.84 | AB25: 7.41 | AC25: 7.66 | AD25: 23.77 | AE25: 0 | AF25: =+(AG25)+0.5*AH25 -> 67.13 | AG25: 50.13 | AH25: =3+2+4+1+3+1+3+1+3+3+10 -> 34 | AI25: =+(AJ25+AK25+AL25)+0.5*AM25 -> 11.98 | AJ25: 4.48 | AK25: 3.73 | AL25: 3.77 | AM25: 0 | AN25: =+(AO25+AP25+AQ25)+0.5*AR25 -> 66.30 | AO25: 27.46 | AP25: 25.46 | AQ25: 9.88 | AR25: 7
A26: 22 | B26: Greenfield, Don | C26: L | D26: =+F26+J26+N26+R26+W26+AA26+AF26+AI26+AN26 -> 515.78 | E26: =+I26+M26+Q26+V26+Z26+AE26+AH26+AM26+AR26 -> 128 | F26: =+(G26+H26)+(0.5*I26) -> 93.55 | G26: 45.03 | H26: 48.52 | I26: 0 | J26: =+(K26+L26)+0.5*M26 -> 33.52 | K26: 15.28 | L26: 15.24 | M26: 6 | N26: =+(O26+P26)+0.5*Q26 -> 88.17 | O26: 31.74 | P26: 32.93 | Q26: =9+5+7+8+3+4+4+3+4 -> 47 | R26: =+(S26+T26+U26)+0.5*V26 -> 49.74 | S26: 8.47 | T26: 12.01 | U26: 11.26 | V26: =7+17+2+2+8 -> 36 | W26: =+(X26+Y26)+0.5*Z26 -> 56.38 | X26: 28.31 | Y26: 28.07 | Z26: 0 | AA26: =+(AB26+AC26+AD26)+0.5*AE26 -> 32.49 | AB26: 3.86 | AC26: 4.93 | AD26: 23.70 | AE26: 0 | AF26: =+(AG26)+0.5*AH26 -> 67.66 | AG26: 61.66 | AH26: =3+2+1+1+2+2+1 -> 12 | AI26: =+(AJ26+AK26+AL26)+0.5*AM26 -> 16.00 | AJ26: 9.30 | AK26: 3.07 | AL26: 3.63 | AM26: 0 | AN26: =+(AO26+AP26+AQ26)+0.5*AR26 -> 78.27 | AO26: 30.00 | AP26: 30.00 | AQ26: 4.77 | AR26: 27
A27: 23 | B27: Durant, David | C27: T | D27: =+F27+J27+N27+R27+W27+AA27+AF27+AI27+AN27 -> 563.08 | E27: =+I27+M27+Q27+V27+Z27+AE27+AH27+AM27+AR27 -> 162 | F27: =+(G27+H27)+(0.5*I27) -> 106.49 | G27: 47.26 | H27: 59.23 | I27: 0 | J27: =+(K27+L27)+0.5*M27 -> 42.01 | K27: 13.82 | L27: 12.69 | M27: =12+8+7+4 -> 31 | N27: =+(O27+P27)+0.5*Q27 -> 99.24 | O27: 41.49 | P27: 35.75 | Q27: =9+10+12+6+5+1+1 -> 44 | R27: =+(S27+T27+U27)+0.5*V27 -> 52.61 | S27: 6.12 | T27: 8.92 | U27: 8.07 | V27: =13+16+17+7+6 -> 59 | W27: =+(X27+Y27)+0.5*Z27 -> 57.08 | X27: 26.38 | Y27: 30.70 | Z27: 0 | AA27: =+(AB27+AC27+AD27)+0.5*AE27 -> 54.34 | AB27: 12.01 | AC27: 7.75 | AD27: 34.58 | AE27: 0 | AF27: =+(AG27)+0.5*AH27 -> 79.71 | AG27: 70.71 | AH27: =3+4+5+1+1+3+1 -> 18 | AI27: =+(AJ27+AK27+AL27)+0.5*AM27 -> 14.92 | AJ27: 3.99 | AK27: 4.30 | AL27: 6.63 | AM27: 0 | AN27: =+(AO27+AP27+AQ27)+0.5*AR27 -> 56.68 | AO27: 23.41 | AP27: 18.75 | AQ27: 9.52 | AR27: 10
A28: 24 | B28: Diamond, John | C28: L | D28: =+F28+J28+N28+R28+W28+AA28+AF28+AI28+AN28 -> 578.06 | E28: =+I28+M28+Q28+V28+Z28+AE28+AH28+AM28+AR28 -> 172 | F28: =+(G28+H28)+(0.5*I28) -> 120.74 | G28: 65.57 | H28: 55.17 | I28: 0 | J28: =+(K28+L28)+0.5*M28 -> 47.19 | K28: 21.15 | L28: 21.04 | M28: =1+7+1+1 -> 10 | N28: =+(O28+P28)+0.5*Q28 -> 70.67 | O28: 29.57 | P28: 22.10 | Q28: =7+14+5+5+2+2+1+2 -> 38 | R28: =+(S28+T28+U28)+0.5*V28 -> 64.45 | S28: 6.20 | T28: 12.79 | U28: 8.96 | V28: =12+9+15+3+14+20 -> 73 | W28: =+(X28+Y28)+0.5*Z28 -> 57.75 | X28: 28.15 | Y28: 19.60 | Z28: 20 | AA28: =+(AB28+AC28+AD28)+0.5*AE28 -> 38.51 | AB28: 21.78 | AC28: 12.39 | AD28: 4.34 | AE28: 0 | AF28: =+(AG28)+0.5*AH28 -> 81.44 | AG28: 81.44 | AH28: 0 | AI28: =+(AJ28+AK28+AL28)+0.5*AM28 -> 13.76 | AJ28: 2.32 | AK28: 2.87 | AL28: 8.57 | AM28: 0 | AN28: =+(AO28+AP28+AQ28)+0.5*AR28 -> 83.55 | AO28: 30.00 | AP28: 30.00 | AQ28: 8.05 | AR28: 31
A29: 25 | B29: Andrus, Jay | C29: L | D29: =+F29+J29+N29+R29+W29+AA29+AF29+AI29+AN29 -> 590.02 | E29: =+I29+M29+Q29+V29+Z29+AE29+AH29+AM29+AR29 -> 163 | F29: =+(G29+H29)+(0.5*I29) -> 123.95 | G29: 63.05 | H29: 60.90 | I29: 0 | J29: =+(K29+L29)+0.5*M29 -> 47.78 | K29: 13.46 | L29: 23.82 | M29: =9+5+6+1 -> 21 | N29: =+(O29+P29)+0.5*Q29 -> 101.83 | O29: 34.43 | P29: 38.40 | Q29: =18+15+3+5+2+4+3+4+4 -> 58 | R29: =+(S29+T29+U29)+0.5*V29 -> 63.55 | S29: 7.30 | T29: 13.67 | U29: 15.58 | V29: =12+11+4+4+3+20 -> 54 | W29: =+(X29+Y29)+0.5*Z29 -> 57.00 | X29: 31.96 | Y29: 25.04 | Z29: 0 | AA29: =+(AB29+AC29+AD29)+0.5*AE29 -> 39.89 | AB29: 6.74 | AC29: 5.34 | AD29: 27.81 | AE29: 0 | AF29: =+(AG29)+0.5*AH29 -> 73.03 | AG29: 62.53 | AH29: =1+15+2+1+2 -> 21 | AI29: =+(AJ29+AK29+AL29)+0.5*AM29 -> 12.91 | AJ29: 4.24 | AK29: 3.56 | AL29: 5.11 | AM29: 0 | AN29: =+(AO29+AP29+AQ29)+0.5*AR29 -> 70.08 | AO29: 23.93 | AP29: 30.00 | AQ29: 11.65 | AR29: =6+3 -> 9
A30: 26 | B30: Hill, Randy | C30: L | D30: =+F30+J30+N30+R30+W30+AA30+AF30+AI30+AN30 -> 595.59 | E30: =+I30+M30+Q30+V30+Z30+AE30+AH30+AM30+AR30 -> 169 | F30: =+(G30+H30)+(0.5*I30) -> 104.60 | G30: 52.08 | H30: 52.52 | I30: 0 | J30: =+(K30+L30)+0.5*M30 -> 35.84 | K30: 15.62 | L30: 15.72 | M30: =3+3+2+1 -> 9 | N30: =+(O30+P30)+0.5*Q30 -> 92.22 | O30: 33.83 | P30: 31.39 | Q30: =5+7+4+4+3+6+12+6+7 -> 54 | R30: =+(S30+T30+U30)+0.5*V30 -> 47.08 | S30: 5.91 | T30: 6.72 | U30: 9.45 | V30: =3+15+13+1+8+10 -> 50 | W30: =+(X30+Y30)+0.5*Z30 -> 88.01 | X30: 38.03 | Y30: 44.98 | Z30: 10 | AA30: =+(AB30+AC30+AD30)+0.5*AE30 -> 41.96 | AB30: 8.10 | AC30: 4.81 | AD30: 29.05 | AE30: 0 | AF30: =+(AG30)+0.5*AH30 -> 77.29 | AG30: 73.29 | AH30: 8 | AI30: =+(AJ30+AK30+AL30)+0.5*AM30 -> 15.86 | AJ30: 6.14 | AK30: 5.04 | AL30: 4.68 | AM30: 0 | AN30: =+(AO30+AP30+AQ30)+0.5*AR30 -> 92.73 | AO30: 30.00 | AP30: 28.61 | AQ30: 15.12 | AR30: 38
A31: 27 | B31: Wong, Hang | C31: TRO | D31: =+F31+J31+N31+R31+W31+AA31+AF31+AI31+AN31 -> 617.93 | E31: =+I31+M31+Q31+V31+Z31+AE31+AH31+AM31+AR31 -> 283.3 | F31: =+(G31+H31)+(0.5*I31) -> 121.52 | G31: 47.46 | H31: 44.06 | I31: 60 | J31: =+(K31+L31)+0.5*M31 -> 40.53 | K31: 16.70 | L31: 14.83 | M31: =6+6+2+4 -> 18 | N31: =+(O31+P31)+0.5*Q31 -> 98.78 | O31: 38.38 | P31: 27.90 | Q31: =12+10+12+16+2+1+1+11 -> 65 | R31: =+(S31+T31+U31)+0.5*V31 -> 68.31 | S31: 9.96 | T31: 11.12 | U31: 12.23 | V31: =7+19+9+10+15+10 -> 70 | W31: =+(X31+Y31)+0.5*Z31 -> 50.65 | X31: 26.73 | Y31: 23.92 | Z31: 0 | AA31: =+(AB31+AC31+AD31)+0.5*AE31 -> 56.47 | AB31: 8.55 | AC31: 7.40 | AD31: 40.52 | AE31: 0 | AF31: =+(AG31)+0.5*AH31 -> 79.51 | AG31: 67.36 | AH31: =3+2+0.3+3+3+2+2+2+1+6 -> 24.3 | AI31: =+(AJ31+AK31+AL31)+0.5*AM31 -> 13.29 | AJ31: 3.59 | AK31: 4.72 | AL31: 4.98 | AM31: 0 | AN31: =+(AO31+AP31+AQ31)+0.5*AR31 -> 88.87 | AO31: 30.00 | AP31: 30.00 | AQ31: 5.87 | AR31: 46
A32: 28 | B32: Fentenberger, Matt | C32: TRO | D32: =+F32+J32+N32+R32+W32+AA32+AF32+AI32+AN32 -> 625.41 | E32: =+I32+M32+Q32+V32+Z32+AE32+AH32+AM32+AR32 -> 144 | F32: =+(G32+H32)+(0.5*I32) -> 141.75 | G32: 70.92 | H32: 70.83 | I32: 0 | J32: =+(K32+L32)+0.5*M32 -> 44.13 | K32: 20.95 | L32: 19.68 | M32: =2+1+2+2 -> 7 | N32: =+(O32+P32)+0.5*Q32 -> 100.26 | O32: 43.05 | P32: 41.21 | Q32: =2+5+5+10+1+2+4+3 -> 32 | R32: =+(S32+T32+U32)+0.5*V32 -> 82.81 | S32: 8.78 | T32: 16.78 | U32: 18.25 | V32: =12+16+16+14+10+10 -> 78 | W32: =+(X32+Y32)+0.5*Z32 -> 63.58 | X32: 27.38 | Y32: 36.20 | Z32: 0 | AA32: =+(AB32+AC32+AD32)+0.5*AE32 -> 49.52 | AB32: 7.74 | AC32: 5.86 | AD32: 35.92 | AE32: 0 | AF32: =+(AG32)+0.5*AH32 -> 60.56 | AG32: 49.56 | AH32: =3+2+1+3+3+2+3+2+3 -> 22 | AI32: =+(AJ32+AK32+AL32)+0.5*AM32 -> 14.99 | AJ32: 3.63 | AK32: 7.18 | AL32: 4.18 | AM32: 0 | AN32: =+(AO32+AP32+AQ32)+0.5*AR32 -> 67.81 | AO32: 28.48 | AP32: 26.92 | AQ32: 9.91 | AR32: 5
A33: 29 | B33: Phillips, RDan | C33: L | D33: =+F33+J33+N33+R33+W33+AA33+AF33+AI33+AN33 -> 626.26 | E33: =+I33+M33+Q33+V33+Z33+AE33+AH33+AM33+AR33 -> 169 | F33: =+(G33+H33)+(0.5*I33) -> 111.95 | G33: 55.88 | H33: 56.07 | I33: 0 | J33: =+(K33+L33)+0.5*M33 -> 34.34 | K33: 15.38 | L33: 16.46 | M33: 5 | N33: =+(O33+P33)+0.5*Q33 -> 84.29 | O33: 32.85 | P33: 33.44 | Q33: =2+14+5+1+4+3+4+3 -> 36 | R33: =+(S33+T33+U33)+0.5*V33 -> 58.58 | S33: 5.92 | T33: 7.69 | U33: 7.97 | V33: =10+11+17+6+10+20 -> 74 | W33: =+(X33+Y33)+0.5*Z33 -> 66.87 | X33: 34.11 | Y33: 32.76 | Z33: 0 | AA33: =+(AB33+AC33+AD33)+0.5*AE33 -> 74.16 | AB33: 5.65 | AC33: 6.92 | AD33: 61.59 | AE33: 0 | AF33: =+(AG33)+0.5*AH33 -> 81.33 | AG33: 75.83 | AH33: 11 | AI33: =+(AJ33+AK33+AL33)+0.5*AM33 -> 14.09 | AJ33: 5.14 | AK33: 4.65 | AL33: 4.30 | AM33: 0 | AN33: =+(AO33+AP33+AQ33)+0.5*AR33 -> 100.65 | AO33: 30.00 | AP33: 30.00 | AQ33: 19.15 | AR33: 43
A34: 30 | B34: Durant, Stephen | C34: T | D34: =+F34+J34+N34+R34+W34+AA34+AF34+AI34+AN34 -> 650.14 | E34: =+I34+M34+Q34+V34+Z34+AE34+AH34+AM34+AR34 -> 235 | F34: =+(G34+H34)+(0.5*I34) -> 166.51 | G34: 93.58 | H34: 72.93 | I34: 0 | J34: =+(K34+L34)+0.5*M34 -> 29.80 | K34: 11.86 | L34: 12.44 | M34: =6+2+1+2 -> 11 | N34: =+(O34+P34)+0.5*Q34 -> 93.43 | O34: 38.32 | P34: 30.61 | Q34: =12+8+3+4+5+8+3+4+2 -> 49 | R34: =+(S34+T34+U34)+0.5*V34 -> 75.16 | S34: 6.59 | T34: 8.16 | U34: 7.91 | V34: =20+21+16+11+17+20 -> 105 | W34: =+(X34+Y34)+0.5*Z34 -> 72.87 | X34: 24.87 | Y34: 38.00 | Z34: 20 | AA34: =+(AB34+AC34+AD34)+0.5*AE34 -> 59.53 | AB34: 8.95 | AC34: 9.59 | AD34: 40.99 | AE34: 0 | AF34: =+(AG34)+0.5*AH34 -> 69.38 | AG34: 53.38 | AH34: =3+1+1+2+15+3+1+6 -> 32 | AI34: =+(AJ34+AK34+AL34)+0.5*AM34 -> 17.95 | AJ34: 5.54 | AK34: 4.24 | AL34: 3.17 | AM34: 10 | AN34: =+(AO34+AP34+AQ34)+0.5*AR34 -> 65.51 | AO34: 28.32 | AP34: 24.80 | AQ34: 8.39 | AR34: 8
A35: 31 | B35: Kirkham, Glade | C35: L | D35: =+F35+J35+N35+R35+W35+AA35+AF35+AI35+AN35 -> 661.42 | E35: =+I35+M35+Q35+V35+Z35+AE35+AH35+AM35+AR35 -> 140 | F35: =+(G35+H35)+(0.5*I35) -> 166.41 | G35: 102.71 | H35: 63.70 | I35: 0 | J35: =+(K35+L35)+0.5*M35 -> 40.70 | K35: 17.34 | L35: 16.36 | M35: =3+9+2 -> 14 | N35: =+(O35+P35)+0.5*Q35 -> 125.47 | O35: 56.20 | P35: 41.27 | Q35: =8+12+10+1+8+11+2+3+1 -> 56 | R35: =+(S35+T35+U35)+0.5*V35 -> 51.59 | S35: 9.54 | T35: 13.60 | U35: 9.45 | V35: =9+13+4+2+10 -> 38 | W35: =+(X35+Y35)+0.5*Z35 -> 59.67 | X35: 31.57 | Y35: 28.10 | Z35: 0 | AA35: =+(AB35+AC35+AD35)+0.5*AE35 -> 51.67 | AB35: 6.12 | AC35: 7.68 | AD35: 27.87 | AE35: 20 | AF35: =+(AG35)+0.5*AH35 -> 79.66 | AG35: 77.66 | AH35: 4 | AI35: =+(AJ35+AK35+AL35)+0.5*AM35 -> 19.58 | AJ35: 4.34 | AK35: 7.59 | AL35: 7.65 | AM35: 0 | AN35: =+(AO35+AP35+AQ35)+0.5*AR35 -> 66.67 | AO35: 20.80 | AP35: 19.48 | AQ35: 22.39 | AR35: 8
A36: 32 | B36: Fentenberger, Denver | C36: TRO | D36: =+F36+J36+N36+R36+W36+AA36+AF36+AI36+AN36 -> 661.61 | E36: =+I36+M36+Q36+V36+Z36+AE36+AH36+AM36+AR36 -> 172 | F36: =+(G36+H36)+(0.5*I36) -> 130.15 | G36: 77.56 | H36: 52.59 | I36: 0 | J36: =+(K36+L36)+0.5*M36 -> 44.27 | K36: 18.91 | L36: 21.86 | M36: 7 | N36: =+(O36+P36)+0.5*Q36 -> 96.64 | O36: 48.73 | P36: 40.41 | Q36: =4+1+4+2+1+2+1 -> 15 | R36: =+(S36+T36+U36)+0.5*V36 -> 47.30 | S36: 6.66 | T36: 9.56 | U36: 10.08 | V36: =9+7+13+9+4 -> 42 | W36: =+(X36+Y36)+0.5*Z36 -> 75.71 | X36: 40.98 | Y36: 34.73 | Z36: 0 | AA36: =+(AB36+AC36+AD36)+0.5*AE36 -> 72.07 | AB36: 8.01 | AC36: 7.04 | AD36: 37.02 | AE36: 40 | AF36: =+(AG36)+0.5*AH36 -> 92.87 | AG36: 72.87 | AH36: =5+5+1+7+2+1+3+6+10 -> 40 | AI36: =+(AJ36+AK36+AL36)+0.5*AM36 -> 16.32 | AJ36: 6.38 | AK36: 4.93 | AL36: 5.01 | AM36: 0 | AN36: =+(AO36+AP36+AQ36)+0.5*AR36 -> 86.28 | AO36: 30.00 | AP36: 25.69 | AQ36: 16.59 | AR36: 28
A37: 33 | B37: Crawford, George | C37: L | D37: =+F37+J37+N37+R37+W37+AA37+AF37+AI37+AN37 -> 680.94 | E37: =+I37+M37+Q37+V37+Z37+AE37+AH37+AM37+AR37 -> 173 | F37: =+(G37+H37)+(0.5*I37) -> 106.37 | G37: 56.64 | H37: 49.73 | I37: 0 | J37: =+(K37+L37)+0.5*M37 -> 36.49 | K37: 19.32 | L37: 16.67 | M37: 1 | N37: =+(O37+P37)+0.5*Q37 -> 141.73 | O37: 54.98 | P37: 50.25 | Q37: =6+8+12+16+10+1+6+7+7 -> 73 | R37: =+(S37+T37+U37)+0.5*V37 -> 58.07 | S37: 7.83 | T37: 8.56 | U37: 9.68 | V37: =3+21+21+4+5+10 -> 64 | W37: =+(X37+Y37)+0.5*Z37 -> 76.45 | X37: 37.29 | Y37: 39.16 | Z37: 0 | AA37: =+(AB37+AC37+AD37)+0.5*AE37 -> 21.65 | AB37: 6.37 | AC37: 7.10 | AD37: 8.18 | AE37: 0 | AF37: =+(AG37)+0.5*AH37 -> 147.96 | AG37: 140.46 | AH37: =2+2+1+10 -> 15 | AI37: =+(AJ37+AK37+AL37)+0.5*AM37 -> 15.32 | AJ37: 5.04 | AK37: 5.75 | AL37: 4.53 | AM37: 0 | AN37: =+(AO37+AP37+AQ37)+0.5*AR37 -> 76.90 | AO37: 26.92 | AP37: 30.00 | AQ37: 9.98 | AR37: 20
A38: 34 | B38: Crosby, Mike | C38: L | D38: =+F38+J38+N38+R38+W38+AA38+AF38+AI38+AN38 -> 732.91 | E38: =+I38+M38+Q38+V38+Z38+AE38+AH38+AM38+AR38 -> 147 | F38: =+(G38+H38)+(0.5*I38) -> 165.72 | G38: 76.99 | H38: 88.73 | I38: 0 | J38: =+(K38+L38)+0.5*M38 -> 45.86 | K38: 18.38 | L38: 21.48 | M38: =5+4+3 -> 12 | N38: =+(O38+P38)+0.5*Q38 -> 135.90 | O38: 50.74 | P38: 65.16 | Q38: =1+5+9+5+3+4+4+4+5 -> 40 | R38: =+(S38+T38+U38)+0.5*V38 -> 45.75 | S38: 9.47 | T38: 8.07 | U38: 6.21 | V38: =7+15+11+7+4 -> 44 | W38: =+(X38+Y38)+0.5*Z38 -> 84.12 | X38: 41.68 | Y38: 42.44 | Z38: 0 | AA38: =+(AB38+AC38+AD38)+0.5*AE38 -> 26.79 | AB38: 7.45 | AC38: 12.00 | AD38: 7.34 | AE38: 0 | AF38: =+(AG38)+0.5*AH38 -> 84.43 | AG38: 75.43 | AH38: =1+1+3+1+3+3+3+3 -> 18 | AI38: =+(AJ38+AK38+AL38)+0.5*AM38 -> 52.20 | AJ38: 7.88 | AK38: 40.60 | AL38: 3.72 | AM38: 0 | AN38: =+(AO38+AP38+AQ38)+0.5*AR38 -> 92.14 | AO38: 30.00 | AP38: 30.00 | AQ38: 15.64 | AR38: =1+2+30 -> 33
A39: 35 | B39: Brown, Keith | C39: TRO | D39: DNF | E39: DNF | F39: =+(G39+H39)+(0.5*I39) -> 70.38 | G39: 37.38 | H39: 33.00 | I39: 0 | J39: =+(K39+L39)+0.5*M39 -> 30.67 | K39: 12.94 | L39: 17.23 | M39: 1 | N39: =+(O39+P39)+0.5*Q39 -> 71.73 | O39: 32.02 | P39: 13.21 | Q39: =5+3+3+2+10+10+10+10 -> 53 | R39: =+(S39+T39+U39)+0.5*V39 -> 0.00 | W39: =+(X39+Y39)+0.5*Z39 -> 62.10 | X39: 38.34 | Y39: 23.76 | Z39: 0 | AA39: =+(AB39+AC39+AD39)+0.5*AE39 -> 39.98 | AB39: 5.19 | AC39: 5.66 | AD39: 29.13 | AE39: 0 | AF39: =+(AG39)+0.5*AH39 -> 58.48 | AG39: 41.48 | AH39: =1+15+15+1+1+1 -> 34 | AI39: =+(AJ39+AK39+AL39)+0.5*AM39 -> 12.30 | AJ39: 4.01 | AK39: 4.39 | AL39: 3.90 | AM39: 0 | AN39: =+(AO39+AP39+AQ39)+0.5*AR39 -> 39.01 | AO39: 19.38 | AP39: 15.26 | AQ39: 3.87 | AR39: 1
A40: Notes:
A41: - | B41: Div * - Refer to the UDPL 3-Gun Division Specifications for specifics on each Division.
B42: L = | C42: LIMITED
B43: T = | C43: TACTICAL
B44: TRO = | C44: TACTICAL RIFLE-OPTICAL
B45: O = | C45: OPEN
A46: PD | B46: = Points Down = .5 seconds x Points Down. PD Total is added to the total Stage time.
A47: XX | B47: = Indicates that the Points Down value includes some kind of penalty (Procedural Error, Hits on Non-Threat, Misses on Steel (5 seconds each), etc.).
A48: DNF | B48: = Did Not Finish
A49: NS | B49: = No Score was recorded for this string. Shooter placed lower than indicated.
A50: ? | B50: = Shooter did not indicate which Division he should be scored in.