A1: Utah Shooting Academy June 9th, 2004
A2: OVERALL SCORES (Includes procedurals and penalties)
A3: Number | B3: Name | C3: Match | D3: Stage1 | E3: Stage 2 | F3: Stage 3 | G3: Stage3
A4: S01 | B4: ='[June 2004.xls]S15'!$B$1 -> Ari Theodore | C4: ='[June 2004.xls]S15'!$F$27 -> 37.77 | D4: ='[June 2004.xls]S15'!B$27 -> 15.45 | E4: ='[June 2004.xls]S15'!C$27 -> 15.14 | F4: ='[June 2004.xls]S15'!D$27 -> 0.00 | G4: ='[June 2004.xls]S15'!E$27 -> 7.18
A5: S02 | B5: ='[June 2004.xls]S16'!$B$1 -> Craig Outzen | C5: ='[June 2004.xls]S16'!$F$27 -> 42.04 | D5: ='[June 2004.xls]S16'!B$27 -> 16.99 | E5: ='[June 2004.xls]S16'!C$27 -> 16.45 | F5: ='[June 2004.xls]S16'!D$27 -> 0.00 | G5: ='[June 2004.xls]S16'!E$27 -> 8.60
A6: S03 | B6: ='[June 2004.xls]S14'!$B$1 -> Red (Auto) | C6: ='[June 2004.xls]S14'!$F$27 -> 42.74 | D6: ='[June 2004.xls]S14'!B$27 -> 18.95 | E6: ='[June 2004.xls]S14'!C$27 -> 13.87 | F6: ='[June 2004.xls]S14'!D$27 -> 0.00 | G6: ='[June 2004.xls]S14'!E$27 -> 9.92
A7: S04 | B7: ='[June 2004.xls]S18'!$B$1 -> Pat Ziccardi | C7: ='[June 2004.xls]S18'!$F$27 -> 43.03 | D7: ='[June 2004.xls]S18'!B$27 -> 16.99 | E7: ='[June 2004.xls]S18'!C$27 -> 14.67 | F7: ='[June 2004.xls]S18'!D$27 -> 0.00 | G7: ='[June 2004.xls]S18'!E$27 -> 11.37
A8: S05 | B8: ='[June 2004.xls]S19'!$B$1 -> Bryan Mortensen | C8: ='[June 2004.xls]S19'!$F$27 -> 44.85 | D8: ='[June 2004.xls]S19'!B$27 -> 15.26 | E8: ='[June 2004.xls]S19'!C$27 -> 15.19 | F8: ='[June 2004.xls]S19'!D$27 -> 0.00 | G8: ='[June 2004.xls]S19'!E$27 -> 14.40
A9: S06 | B9: ='[June 2004.xls]S5'!$B$1 -> Blake Huff | C9: ='[June 2004.xls]S5'!$F$27 -> 55.41 | D9: ='[June 2004.xls]S5'!B$27 -> 21.71 | E9: ='[June 2004.xls]S5'!C$27 -> 19.76 | F9: ='[June 2004.xls]S5'!D$27 -> 0.00 | G9: ='[June 2004.xls]S5'!E$27 -> 13.94
A10: S07 | B10: ='[June 2004.xls]S17'!$B$1 -> Chris Roach | C10: ='[June 2004.xls]S17'!$F$27 -> 58.38 | D10: ='[June 2004.xls]S17'!B$27 -> 23.73 | E10: ='[June 2004.xls]S17'!C$27 -> 24.61 | F10: ='[June 2004.xls]S17'!D$27 -> 0.00 | G10: ='[June 2004.xls]S17'!E$27 -> 10.04
A11: S08 | B11: ='[June 2004.xls]S13'!$B$1 -> Red (Rev.) | C11: ='[June 2004.xls]S13'!$F$27 -> 59.48 | D11: ='[June 2004.xls]S13'!B$27 -> 25.66 | E11: ='[June 2004.xls]S13'!C$27 -> 24.40 | F11: ='[June 2004.xls]S13'!D$27 -> 0.00 | G11: ='[June 2004.xls]S13'!E$27 -> 9.42
A12: S09 | B12: ='[June 2004.xls]S9'!$B$1 -> Justin Park | C12: ='[June 2004.xls]S9'!$F$27 -> 63.99 | D12: ='[June 2004.xls]S9'!B$27 -> 20.52 | E12: ='[June 2004.xls]S9'!C$27 -> 28.41 | F12: ='[June 2004.xls]S9'!D$27 -> 0.00 | G12: ='[June 2004.xls]S9'!E$27 -> 15.06
A13: S10 | B13: ='[June 2004.xls]S1'!$B$1 -> Neil Hood | C13: ='[June 2004.xls]S1'!$F$27 -> 64.37 | D13: ='[June 2004.xls]S1'!B$27 -> 27.53 | E13: ='[June 2004.xls]S1'!C$27 -> 26.33 | F13: ='[June 2004.xls]S1'!D$27 -> 0.00 | G13: ='[June 2004.xls]S1'!E$27 -> 10.51
A14: S11 | B14: ='[June 2004.xls]S12'!$B$1 -> William "Nitro" Dezell | C14: ='[June 2004.xls]S12'!$F$27 -> 64.60 | D14: ='[June 2004.xls]S12'!B$27 -> 31.04 | E14: ='[June 2004.xls]S12'!C$27 -> 18.95 | F14: ='[June 2004.xls]S12'!D$27 -> 0.00 | G14: ='[June 2004.xls]S12'!E$27 -> 14.61
A15: S12 | B15: ='[June 2004.xls]S10'!$B$1 -> Creatch | C15: ='[June 2004.xls]S10'!$F$27 -> 69.26 | D15: ='[June 2004.xls]S10'!B$27 -> 26.00 | E15: ='[June 2004.xls]S10'!C$27 -> 29.41 | F15: ='[June 2004.xls]S10'!D$27 -> 0.00 | G15: ='[June 2004.xls]S10'!E$27 -> 13.85
A16: S13 | B16: ='[June 2004.xls]S3'!$B$1 -> Carl Burney | C16: ='[June 2004.xls]S3'!$F$27 -> 70.10 | D16: ='[June 2004.xls]S3'!B$27 -> 34.13 | E16: ='[June 2004.xls]S3'!C$27 -> 21.01 | F16: ='[June 2004.xls]S3'!D$27 -> 0.00 | G16: ='[June 2004.xls]S3'!E$27 -> 14.96
A17: S14 | B17: ='[June 2004.xls]S4'!$B$1 -> John Diamond | C17: ='[June 2004.xls]S4'!$F$27 -> 83.53 | D17: ='[June 2004.xls]S4'!B$27 -> 29.58 | E17: ='[June 2004.xls]S4'!C$27 -> 36.33 | F17: ='[June 2004.xls]S4'!D$27 -> 0.00 | G17: ='[June 2004.xls]S4'!E$27 -> 17.62
A18: S15 | B18: ='[June 2004.xls]S7'!$B$1 -> Ken Thorne | C18: ='[June 2004.xls]S7'!$F$27 -> 84.86 | D18: ='[June 2004.xls]S7'!B$27 -> 38.12 | E18: ='[June 2004.xls]S7'!C$27 -> 27.58 | F18: ='[June 2004.xls]S7'!D$27 -> 0.00 | G18: ='[June 2004.xls]S7'!E$27 -> 19.16
A19: S16 | B19: ='[June 2004.xls]S2'!$B$1 -> Ryan Thorne | C19: ='[June 2004.xls]S2'!$F$27 -> 90.15 | D19: ='[June 2004.xls]S2'!B$27 -> 39.16 | E19: ='[June 2004.xls]S2'!C$27 -> 28.13 | F19: ='[June 2004.xls]S2'!D$27 -> 0.00 | G19: ='[June 2004.xls]S2'!E$27 -> 22.86
A20: S17 | B20: ='[June 2004.xls]S8'!$B$1 -> Randy Hill | C20: ='[June 2004.xls]S8'!$F$27 -> 111.04 | D20: ='[June 2004.xls]S8'!B$27 -> 54.42 | E20: ='[June 2004.xls]S8'!C$27 -> 35.35 | F20: ='[June 2004.xls]S8'!D$27 -> 0.00 | G20: ='[June 2004.xls]S8'!E$27 -> 21.27
A21: S18 | B21: ='[June 2004.xls]S6'!$B$1 -> Jerry Wilkenson | C21: ='[June 2004.xls]S6'!$F$27 -> 121.55 | D21: ='[June 2004.xls]S6'!B$27 -> 48.11 | E21: ='[June 2004.xls]S6'!C$27 -> 48.61 | F21: ='[June 2004.xls]S6'!D$27 -> 0.00 | G21: ='[June 2004.xls]S6'!E$27 -> 24.83
A22: S19 | B22: ='[June 2004.xls]S11'!$B$1 -> R Dan Phillips | C22: ='[June 2004.xls]S11'!$F$27 -> 164.64 | D22: ='[June 2004.xls]S11'!B$27 -> 85.45 | E22: ='[June 2004.xls]S11'!C$27 -> 51.93 | F22: ='[June 2004.xls]S11'!D$27 -> 0.00 | G22: ='[June 2004.xls]S11'!E$27 -> 27.26
A23: S20 | B23: Scott Stone (Did Not Finish) | C23: ='[June 2004.xls]S20'!$F$27 -> 11.74 | D23: ='[June 2004.xls]S20'!B$27 -> 0.00 | E23: ='[June 2004.xls]S20'!C$27 -> 0.00 | F23: ='[June 2004.xls]S20'!D$27 -> 0.00 | G23: ='[June 2004.xls]S20'!E$27 -> 11.74
A24: =COUNTIF($C$4:$C$23,">0") -> 20 | B24: Overall Average: | C24: =SUM(C4:C23)/$A$24 -> 69.176500000000004 | D24: =SUM(D4:D23)/$A$24 -> 29.44 | E24: =SUM(E4:E23)/$A$24 -> 24.8065 | F24: =SUM(F4:F23)/$A$24 -> 0.00 | G24: =SUM(G4:G23)/$A$24 -> 14.93
A25: RAW TIMES
A26: Number | B26: Name | C26: Match | D26: Stage1 | E26: Stage 2 | F26: Stage 3 | G26: Stage3
A27: S01 | B27: ='[June 2004.xls]S15'!$B$1 -> Ari Theodore | C27: ='[June 2004.xls]S15'!$F$23 -> 28.77 | D27: ='[June 2004.xls]S15'!B$23 -> 12.45 | E27: ='[June 2004.xls]S15'!C$23 -> 9.14 | F27: ='[June 2004.xls]S15'!D$23 -> 0.00 | G27: ='[June 2004.xls]S15'!E$23 -> 7.18
A28: S02 | B28: ='[June 2004.xls]S18'!$B$1 -> Pat Ziccardi | C28: ='[June 2004.xls]S18'!$F$23 -> 35.53 | D28: ='[June 2004.xls]S18'!B$23 -> 12.49 | E28: ='[June 2004.xls]S18'!C$23 -> 13.17 | F28: ='[June 2004.xls]S18'!D$23 -> 0.00 | G28: ='[June 2004.xls]S18'!E$23 -> 9.87
A29: S03 | B29: ='[June 2004.xls]S14'!$B$1 -> Red (Auto) | C29: ='[June 2004.xls]S14'!$F$23 -> 36.24 | D29: ='[June 2004.xls]S14'!B$23 -> 15.95 | E29: ='[June 2004.xls]S14'!C$23 -> 11.37 | F29: ='[June 2004.xls]S14'!D$23 -> 0.00 | G29: ='[June 2004.xls]S14'!E$23 -> 8.92
A30: S04 | B30: ='[June 2004.xls]S19'!$B$1 -> Bryan Mortensen | C30: ='[June 2004.xls]S19'!$F$23 -> 36.85 | D30: ='[June 2004.xls]S19'!B$23 -> 14.26 | E30: ='[June 2004.xls]S19'!C$23 -> 13.19 | F30: ='[June 2004.xls]S19'!D$23 -> 0.00 | G30: ='[June 2004.xls]S19'!E$23 -> 9.40
A31: S05 | B31: ='[June 2004.xls]S16'!$B$1 -> Craig Outzen | C31: ='[June 2004.xls]S16'!$F$23 -> 37.04 | D31: ='[June 2004.xls]S16'!B$23 -> 15.49 | E31: ='[June 2004.xls]S16'!C$23 -> 12.95 | F31: ='[June 2004.xls]S16'!D$23 -> 0.00 | G31: ='[June 2004.xls]S16'!E$23 -> 8.60
A32: S06 | B32: ='[June 2004.xls]S5'!$B$1 -> Blake Huff | C32: ='[June 2004.xls]S5'!$F$23 -> 47.41 | D32: ='[June 2004.xls]S5'!B$23 -> 18.21 | E32: ='[June 2004.xls]S5'!C$23 -> 15.26 | F32: ='[June 2004.xls]S5'!D$23 -> 0.00 | G32: ='[June 2004.xls]S5'!E$23 -> 13.94
A33: S07 | B33: ='[June 2004.xls]S13'!$B$1 -> Red (Rev.) | C33: ='[June 2004.xls]S13'!$F$23 -> 49.48 | D33: ='[June 2004.xls]S13'!B$23 -> 23.66 | E33: ='[June 2004.xls]S13'!C$23 -> 16.90 | F33: ='[June 2004.xls]S13'!D$23 -> 0.00 | G33: ='[June 2004.xls]S13'!E$23 -> 8.92
A34: S08 | B34: ='[June 2004.xls]S17'!$B$1 -> Chris Roach | C34: ='[June 2004.xls]S17'!$F$23 -> 50.38 | D34: ='[June 2004.xls]S17'!B$23 -> 19.73 | E34: ='[June 2004.xls]S17'!C$23 -> 22.11 | F34: ='[June 2004.xls]S17'!D$23 -> 0.00 | G34: ='[June 2004.xls]S17'!E$23 -> 8.54
A35: S09 | B35: ='[June 2004.xls]S12'!$B$1 -> William "Nitro" Dezell | C35: ='[June 2004.xls]S12'!$F$23 -> 57.10 | D35: ='[June 2004.xls]S12'!B$23 -> 26.54 | E35: ='[June 2004.xls]S12'!C$23 -> 15.95 | F35: ='[June 2004.xls]S12'!D$23 -> 0.00 | G35: ='[June 2004.xls]S12'!E$23 -> 14.61
A36: S10 | B36: ='[June 2004.xls]S1'!$B$1 -> Neil Hood | C36: ='[June 2004.xls]S1'!$F$23 -> 59.37 | D36: ='[June 2004.xls]S1'!B$23 -> 25.03 | E36: ='[June 2004.xls]S1'!C$23 -> 23.83 | F36: ='[June 2004.xls]S1'!D$23 -> 0.00 | G36: ='[June 2004.xls]S1'!E$23 -> 10.51
A37: S11 | B37: ='[June 2004.xls]S9'!$B$1 -> Justin Park | C37: ='[June 2004.xls]S9'!$F$23 -> 59.99 | D37: ='[June 2004.xls]S9'!B$23 -> 18.02 | E37: ='[June 2004.xls]S9'!C$23 -> 28.41 | F37: ='[June 2004.xls]S9'!D$23 -> 0.00 | G37: ='[June 2004.xls]S9'!E$23 -> 13.56
A38: S12 | B38: ='[June 2004.xls]S10'!$B$1 -> Creatch | C38: ='[June 2004.xls]S10'!$F$23 -> 61.76 | D38: ='[June 2004.xls]S10'!B$23 -> 19.00 | E38: ='[June 2004.xls]S10'!C$23 -> 29.41 | F38: ='[June 2004.xls]S10'!D$23 -> 0.00 | G38: ='[June 2004.xls]S10'!E$23 -> 13.35
A39: S13 | B39: ='[June 2004.xls]S3'!$B$1 -> Carl Burney | C39: ='[June 2004.xls]S3'!$F$23 -> 66.60 | D39: ='[June 2004.xls]S3'!B$23 -> 32.13 | E39: ='[June 2004.xls]S3'!C$23 -> 20.01 | F39: ='[June 2004.xls]S3'!D$23 -> 0.00 | G39: ='[June 2004.xls]S3'!E$23 -> 14.46
A40: S14 | B40: ='[June 2004.xls]S4'!$B$1 -> John Diamond | C40: ='[June 2004.xls]S4'!$F$23 -> 67.53 | D40: ='[June 2004.xls]S4'!B$23 -> 26.58 | E40: ='[June 2004.xls]S4'!C$23 -> 23.33 | F40: ='[June 2004.xls]S4'!D$23 -> 0.00 | G40: ='[June 2004.xls]S4'!E$23 -> 17.62
A41: S15 | B41: ='[June 2004.xls]S7'!$B$1 -> Ken Thorne | C41: ='[June 2004.xls]S7'!$F$23 -> 77.86 | D41: ='[June 2004.xls]S7'!B$23 -> 32.12 | E41: ='[June 2004.xls]S7'!C$23 -> 27.08 | F41: ='[June 2004.xls]S7'!D$23 -> 0.00 | G41: ='[June 2004.xls]S7'!E$23 -> 18.66
A42: S16 | B42: ='[June 2004.xls]S2'!$B$1 -> Ryan Thorne | C42: ='[June 2004.xls]S2'!$F$23 -> 83.15 | D42: ='[June 2004.xls]S2'!B$23 -> 36.66 | E42: ='[June 2004.xls]S2'!C$23 -> 23.63 | F42: ='[June 2004.xls]S2'!D$23 -> 0.00 | G42: ='[June 2004.xls]S2'!E$23 -> 22.86
A43: S17 | B43: ='[June 2004.xls]S8'!$B$1 -> Randy Hill | C43: ='[June 2004.xls]S8'!$F$23 -> 86.04 | D43: ='[June 2004.xls]S8'!B$23 -> 44.92 | E43: ='[June 2004.xls]S8'!C$23 -> 22.85 | F43: ='[June 2004.xls]S8'!D$23 -> 0.00 | G43: ='[June 2004.xls]S8'!E$23 -> 18.27
A44: S18 | B44: ='[June 2004.xls]S6'!$B$1 -> Jerry Wilkenson | C44: ='[June 2004.xls]S6'!$F$23 -> 115.55 | D44: ='[June 2004.xls]S6'!B$23 -> 47.11 | E44: ='[June 2004.xls]S6'!C$23 -> 43.61 | F44: ='[June 2004.xls]S6'!D$23 -> 0.00 | G44: ='[June 2004.xls]S6'!E$23 -> 24.83
A45: S19 | B45: ='[June 2004.xls]S11'!$B$1 -> R Dan Phillips | C45: ='[June 2004.xls]S11'!$F$23 -> 149.14 | D45: ='[June 2004.xls]S11'!B$23 -> 77.45 | E45: ='[June 2004.xls]S11'!C$23 -> 44.93 | F45: ='[June 2004.xls]S11'!D$23 -> 0.00 | G45: ='[June 2004.xls]S11'!E$23 -> 26.76
A46: S20 | B46: Scott Stone (Did Not Finish) | C46: ='[June 2004.xls]S20'!$F$23 -> 11.74 | D46: ='[June 2004.xls]S20'!B$23 -> 0.00 | E46: ='[June 2004.xls]S20'!C$23 -> 0.00 | F46: ='[June 2004.xls]S20'!D$23 -> 0.00 | G46: ='[June 2004.xls]S20'!E$23 -> 11.74
A47: Raw Time Average: | C47: =SUM(C27:C46)/$A$24 -> 60.8765 | D47: =SUM(D27:D46)/$A$24 -> 25.89 | E47: =SUM(E27:E46)/$A$24 -> 20.8565 | F47: =SUM(F27:F46)/$A$24 -> 0.00 | G47: =SUM(G27:G46)/$A$24 -> 14.13
A48: POINTS DOWN
A49: Number | B49: Name | C49: Match | D49: Stage1 | E49: Stage 2 | F49: Stage 3 | G49: Stage3
A50: S01 | B50: ='[June 2004.xls]S3'!$B$1 -> Carl Burney | C50: ='[June 2004.xls]S3'!$F$24 -> 7 | D50: ='[June 2004.xls]S3'!B$24 -> 4 | E50: ='[June 2004.xls]S3'!C$24 -> 2 | F50: ='[June 2004.xls]S3'!D$24 -> 0 | G50: ='[June 2004.xls]S3'!E$24 -> 1
A51: S02 | B51: ='[June 2004.xls]S9'!$B$1 -> Justin Park | C51: ='[June 2004.xls]S9'!$F$24 -> 8 | D51: ='[June 2004.xls]S9'!B$24 -> 5 | E51: ='[June 2004.xls]S9'!C$24 -> 0 | F51: ='[June 2004.xls]S9'!D$24 -> 0 | G51: ='[June 2004.xls]S9'!E$24 -> 3
A52: S03 | B52: ='[June 2004.xls]S1'!$B$1 -> Neil Hood | C52: ='[June 2004.xls]S1'!$F$24 -> 10 | D52: ='[June 2004.xls]S1'!B$24 -> 5 | E52: ='[June 2004.xls]S1'!C$24 -> 5 | F52: ='[June 2004.xls]S1'!D$24 -> 0 | G52: ='[June 2004.xls]S1'!E$24 -> 0
A53: S04 | B53: ='[June 2004.xls]S16'!$B$1 -> Craig Outzen | C53: ='[June 2004.xls]S16'!$F$24 -> 10 | D53: ='[June 2004.xls]S16'!B$24 -> 3 | E53: ='[June 2004.xls]S16'!C$24 -> 7 | F53: ='[June 2004.xls]S16'!D$24 -> 0 | G53: ='[June 2004.xls]S16'!E$24 -> 0
A54: S05 | B54: ='[June 2004.xls]S6'!$B$1 -> Jerry Wilkenson | C54: ='[June 2004.xls]S6'!$F$24 -> 12 | D54: ='[June 2004.xls]S6'!B$24 -> 2 | E54: ='[June 2004.xls]S6'!C$24 -> 10 | F54: ='[June 2004.xls]S6'!D$24 -> 0 | G54: ='[June 2004.xls]S6'!E$24 -> 0
A55: S06 | B55: ='[June 2004.xls]S14'!$B$1 -> Red (Auto) | C55: ='[June 2004.xls]S14'!$F$24 -> 13 | D55: ='[June 2004.xls]S14'!B$24 -> 6 | E55: ='[June 2004.xls]S14'!C$24 -> 5 | F55: ='[June 2004.xls]S14'!D$24 -> 0 | G55: ='[June 2004.xls]S14'!E$24 -> 2
A56: S07 | B56: ='[June 2004.xls]S2'!$B$1 -> Ryan Thorne | C56: ='[June 2004.xls]S2'!$F$24 -> 14 | D56: ='[June 2004.xls]S2'!B$24 -> 5 | E56: ='[June 2004.xls]S2'!C$24 -> 9 | F56: ='[June 2004.xls]S2'!D$24 -> 0 | G56: ='[June 2004.xls]S2'!E$24 -> 0
A57: S08 | B57: ='[June 2004.xls]S7'!$B$1 -> Ken Thorne | C57: ='[June 2004.xls]S7'!$F$24 -> 14 | D57: ='[June 2004.xls]S7'!B$24 -> 12 | E57: ='[June 2004.xls]S7'!C$24 -> 1 | F57: ='[June 2004.xls]S7'!D$24 -> 0 | G57: ='[June 2004.xls]S7'!E$24 -> 1
A58: S09 | B58: ='[June 2004.xls]S10'!$B$1 -> Creatch | C58: ='[June 2004.xls]S10'!$F$24 -> 15 | D58: ='[June 2004.xls]S10'!B$24 -> 14 | E58: ='[June 2004.xls]S10'!C$24 -> 0 | F58: ='[June 2004.xls]S10'!D$24 -> 0 | G58: ='[June 2004.xls]S10'!E$24 -> 1
A59: S10 | B59: ='[June 2004.xls]S12'!$B$1 -> William "Nitro" Dezell | C59: ='[June 2004.xls]S12'!$F$24 -> 15 | D59: ='[June 2004.xls]S12'!B$24 -> 9 | E59: ='[June 2004.xls]S12'!C$24 -> 6 | F59: ='[June 2004.xls]S12'!D$24 -> 0 | G59: ='[June 2004.xls]S12'!E$24 -> 0
A60: S11 | B60: ='[June 2004.xls]S18'!$B$1 -> Pat Ziccardi | C60: ='[June 2004.xls]S18'!$F$24 -> 15 | D60: ='[June 2004.xls]S18'!B$24 -> 9 | E60: ='[June 2004.xls]S18'!C$24 -> 3 | F60: ='[June 2004.xls]S18'!D$24 -> 0 | G60: ='[June 2004.xls]S18'!E$24 -> 3
A61: S12 | B61: ='[June 2004.xls]S5'!$B$1 -> Blake Huff | C61: ='[June 2004.xls]S5'!$F$24 -> 16 | D61: ='[June 2004.xls]S5'!B$24 -> 7 | E61: ='[June 2004.xls]S5'!C$24 -> 9 | F61: ='[June 2004.xls]S5'!D$24 -> 0 | G61: ='[June 2004.xls]S5'!E$24 -> 0
A62: S13 | B62: ='[June 2004.xls]S17'!$B$1 -> Chris Roach | C62: ='[June 2004.xls]S17'!$F$24 -> 16 | D62: ='[June 2004.xls]S17'!B$24 -> 8 | E62: ='[June 2004.xls]S17'!C$24 -> 5 | F62: ='[June 2004.xls]S17'!D$24 -> 0 | G62: ='[June 2004.xls]S17'!E$24 -> 3
A63: S14 | B63: ='[June 2004.xls]S19'!$B$1 -> Bryan Mortensen | C63: ='[June 2004.xls]S19'!$F$24 -> 16 | D63: ='[June 2004.xls]S19'!B$24 -> 2 | E63: ='[June 2004.xls]S19'!C$24 -> 4 | F63: ='[June 2004.xls]S19'!D$24 -> 0 | G63: ='[June 2004.xls]S19'!E$24 -> 10
A64: S15 | B64: ='[June 2004.xls]S15'!$B$1 -> Ari Theodore | C64: ='[June 2004.xls]S15'!$F$24 -> 18 | D64: ='[June 2004.xls]S15'!B$24 -> 6 | E64: ='[June 2004.xls]S15'!C$24 -> 12 | F64: ='[June 2004.xls]S15'!D$24 -> 0 | G64: ='[June 2004.xls]S15'!E$24 -> 0
A65: S16 | B65: ='[June 2004.xls]S13'!$B$1 -> Red (Rev.) | C65: ='[June 2004.xls]S13'!$F$24 -> 20 | D65: ='[June 2004.xls]S13'!B$24 -> 4 | E65: ='[June 2004.xls]S13'!C$24 -> 15 | F65: ='[June 2004.xls]S13'!D$24 -> 0 | G65: ='[June 2004.xls]S13'!E$24 -> 1
A66: S17 | B66: ='[June 2004.xls]S11'!$B$1 -> R Dan Phillips | C66: ='[June 2004.xls]S11'!$F$24 -> 31 | D66: ='[June 2004.xls]S11'!B$24 -> 16 | E66: ='[June 2004.xls]S11'!C$24 -> 14 | F66: ='[June 2004.xls]S11'!D$24 -> 0 | G66: ='[June 2004.xls]S11'!E$24 -> 1
A67: S18 | B67: ='[June 2004.xls]S4'!$B$1 -> John Diamond | C67: ='[June 2004.xls]S4'!$F$24 -> 32 | D67: ='[June 2004.xls]S4'!B$24 -> 6 | E67: ='[June 2004.xls]S4'!C$24 -> 26 | F67: ='[June 2004.xls]S4'!D$24 -> 0 | G67: ='[June 2004.xls]S4'!E$24 -> 0
A68: S19 | B68: ='[June 2004.xls]S8'!$B$1 -> Randy Hill | C68: ='[June 2004.xls]S8'!$F$24 -> 50 | D68: ='[June 2004.xls]S8'!B$24 -> 19 | E68: ='[June 2004.xls]S8'!C$24 -> 25 | F68: ='[June 2004.xls]S8'!D$24 -> 0 | G68: ='[June 2004.xls]S8'!E$24 -> 6
A69: S20 | B69: Scott Stone (Did Not Finish) | C69: ='[June 2004.xls]S20'!$F$24 -> 0 | D69: ='[June 2004.xls]S20'!B$24 -> 0 | E69: ='[June 2004.xls]S20'!C$24 -> 0 | F69: ='[June 2004.xls]S20'!D$24 -> 0 | G69: ='[June 2004.xls]S20'!E$24 -> 0
A70: Points Down Average: | C70: =SUM(C50:C69)/$A$24 -> 16.6 | D70: =SUM(D50:D69)/$A$24 -> 7.1 | E70: =SUM(E50:E69)/$A$24 -> 7.9 | F70: =SUM(F50:F69)/$A$24 -> 0 | G70: =SUM(G50:G69)/$A$24 -> 1.6