A1: Utah Shooting Academy April 2004
A2: TOTAL MATCH SCORES (Includes procedurals and hits on non-threat) Click on Stage # to view COF
A3: Number | B3: Name | C3: Match | D3: Stage1 | E3: Stage 2 | F3: Stage 3 | G3: Stage4
A4: S01 | B4: Bryan Mortenson | C4: 73.96 | D4: 13.35 | E4: 20.25 | F4: 24.93 | G4: 15.16
A5: S02 | B5: Ari T | C5: 78.87 | D5: 14.54 | E5: 18.22 | F5: 32.31 | G5: 13.80
A6: S03 | B6: Red Redford (Auto) | C6: 80.66 | D6: 13.33 | E6: 21.51 | F6: 25.43 | G6: 20.39
A7: S04 | B7: Chris Roach | C7: 87.40 | D7: 16.02 | E7: 17.29 | F7: 37.78 | G7: 16.31
A8: S05 | B8: Juke Zacardi | C8: 87.41 | D8: 14.18 | E8: 27.24 | F8: 28.63 | G8: 17.36
A9: S06 | B9: Neil Hood | C9: 88.24 | D9: 16.87 | E9: 23.85 | F9: 27.53 | G9: 19.99
A10: S07 | B10: Les Langford | C10: 88.45 | D10: 15.99 | E10: 17.37 | F10: 37.77 | G10: 17.32
A11: S08 | B11: Red Redford (Revolver) | C11: 90.55 | D11: 18.94 | E11: 21.16 | F11: 29.68 | G11: 20.77
A12: S09 | B12: Kip Peterson | C12: 93.66 | D12: 32.06 | E12: 17.77 | F12: 23.77 | G12: 20.06
A13: S10 | B13: Mike Rodriquez | C13: 94.12 | D13: 35.53 | E13: 18.25 | F13: 21.56 | G13: 18.78
A14: S11 | B14: Rob Peterson | C14: 94.99 | D14: 35.61 | E14: 14.37 | F14: 21.08 | G14: 23.93
A15: S12 | B15: Chris Cosper | C15: 97.85 | D15: 17.70 | E15: 24.22 | F15: 32.41 | G15: 23.52
A16: S13 | B16: Creatch Dezel | C16: 103.26 | D16: 20.88 | E16: 20.75 | F16: 36.42 | G16: 25.21
A17: S14 | B17: John Diamond | C17: 111.84 | D17: 23.54 | E17: 27.35 | F17: 36.67 | G17: 24.28
A18: S15 | B18: Bill Cummings | C18: 120.21 | D18: 20.63 | E18: 22.97 | F18: 51.90 | G18: 24.71
A19: S16 | B19: Carl Burney | C19: 124.23 | D19: 23.24 | E19: 27.30 | F19: 44.43 | G19: 29.26
A20: S17 | B20: Bill Dezell | C20: 142.04 | D20: 23.74 | E20: 34.53 | F20: 57.63 | G20: 26.14
A21: S18 | B21: Carol Perez | C21: 178.64 | D21: 37.48 | E21: 40.72 | F21: 56.97 | G21: 43.47
A22: =COUNTIF($C$4:$C$21,">0") -> 18 | B22: Overall Averages: | C22: =SUM(C4:C21)/$A$22 -> 102.0211111111111 | D22: =SUM(D4:D21)/$A$22 -> 21.868333333333332 | E22: =SUM(E4:E21)/$A$22 -> 23.062222222222228 | F22: =SUM(F4:F21)/$A$22 -> 34.827777777777776 | G22: =SUM(G4:G21)/$A$22 -> 22.247777777777774
A23: RAW TIMES
A24: Number | B24: Name | C24: Match | D24: Stage1 | E24: Stage 2 | F24: Stage 3 | G24: Stage4
A25: S01 | B25: Ari T | C25: 67.37 | D25: 14.54 | E25: 17.72 | F25: 21.81 | G25: 13.30
A26: S02 | B26: Bryan Mortenson | C26: 69.69 | D26: 12.35 | E26: 20.25 | F26: 23.93 | G26: 13.16
A27: S03 | B27: Red Redford (Auto) | C27: 70.66 | D27: 12.33 | E27: 20.51 | F27: 18.93 | G27: 18.89
A28: S04 | B28: Chris Roach | C28: 72.40 | D28: 13.52 | E28: 16.29 | F28: 27.78 | G28: 14.81
A29: S05 | B29: Les Langford | C29: 72.45 | D29: 15.99 | E29: 17.37 | F29: 25.27 | G29: 13.82
A30: S06 | B30: Juke Zacardi | C30: 75.41 | D30: 14.18 | E30: 23.24 | F30: 23.13 | G30: 14.86
A31: S07 | B31: Mike Rodriquez | C31: 77.42 | D31: 21.36 | E31: 15.75 | F31: 24.53 | G31: 15.78
A32: S08 | B32: Neil Hood | C32: 80.24 | D32: 16.87 | E32: 19.35 | F32: 27.03 | G32: 16.99
A33: S09 | B33: Red Redford (Revolver) | C33: 81.55 | D33: 17.94 | E33: 20.66 | F33: 23.68 | G33: 19.27
A34: S10 | B34: Kip Peterson | C34: 82.66 | D34: 23.27 | E34: 16.27 | F34: 23.06 | G34: 20.06
A35: S11 | B35: Bill Cummings | C35: 83.24 | D35: 19.13 | E35: 17.50 | F35: 28.90 | G35: 17.71
A36: S12 | B36: Rob Peterson | C36: 83.99 | D36: 19.08 | E36: 13.37 | F36: 31.61 | G36: 19.93
A37: S13 | B37: Chris Cosper | C37: 84.85 | D37: 17.20 | E37: 19.22 | F37: 28.41 | G37: 20.02
A38: S14 | B38: Creatch Dezel | C38: 89.26 | D38: 20.38 | E38: 15.75 | F38: 29.92 | G38: 23.21
A39: S15 | B39: John Diamond | C39: 92.84 | D39: 22.54 | E39: 27.35 | F39: 25.17 | G39: 17.78
A40: S16 | B40: Bill Dezell | C40: 118.54 | D40: 22.74 | E40: 24.53 | F40: 47.13 | G40: 24.14
A41: S17 | B41: Carol Perez | C41: 128.64 | D41: 35.48 | E41: 37.22 | F41: 37.47 | G41: 18.47
A42: Overall Averages: | C42: =SUM(C25:C41)/$A$22 -> 79.51166666666667 | D42: =SUM(D25:D41)/$A$22 -> 17.716666666666669 | E42: =SUM(E25:E41)/$A$22 -> 19.019444444444446 | F42: =SUM(F25:F41)/$A$22 -> 25.986666666666672 | G42: =SUM(G25:G41)/$A$22 -> 16.788888888888891
A43: POINTS DOWN
A44: Number | B44: Name | C44: Match | D44: Stage1 | E44: Stage 2 | F44: Stage 3 | G44: Stage4
A45: S01 | B45: Bryan Mortenson | C45: 8 | D45: 2 | E45: 0 | F45: 2 | G45: 4
A46: S02 | B46: Neil Hood | C46: 16 | D46: 0 | E46: 9 | F46: 1 | G46: 6
A47: S03 | B47: Kip Peterson | C47: 16 | D47: 1 | E47: 3 | F47: 10 | G47: 2
A48: S04 | B48: Carl Burney | C48: 16 | D48: 4 | E48: 0 | F48: 4 | G48: 8
A49: S05 | B49: Red Redford (Revolver) | C49: 18 | D49: 2 | E49: 1 | F49: 12 | G49: 3
A50: S06 | B50: Red Redford (Auto) | C50: 20 | D50: 2 | E50: 2 | F50: 13 | G50: 3
A51: S07 | B51: Rob Peterson | C51: 22 | D51: 4 | E51: 2 | F51: 8 | G51: 8
A52: S08 | B52: Ari T | C52: 23 | D52: 0 | E52: 1 | F52: 21 | G52: 1
A53: S09 | B53: Juke Zacardi | C53: 24 | D53: 0 | E53: 8 | F53: 11 | G53: 5
A54: S10 | B54: Mike Rodriquez | C54: 24 | D54: 1 | E54: 5 | F54: 12 | G54: 6
A55: S11 | B55: Chris Cosper | C55: 26 | D55: 1 | E55: 10 | F55: 8 | G55: 7
A56: S12 | B56: Creatch Dezel | C56: 28 | D56: 1 | E56: 10 | F56: 13 | G56: 4
A57: S13 | B57: John Diamond | C57: 28 | D57: 2 | E57: 0 | F57: 13 | G57: 13
A58: S14 | B58: Chris Roach | C58: 30 | D58: 5 | E58: 2 | F58: 20 | G58: 3
A59: S15 | B59: Les Langford | C59: 32 | D59: 0 | E59: 0 | F59: 25 | G59: 7
A60: S16 | B60: Bill Dezell | C60: 37 | D60: 2 | E60: 20 | F60: 11 | G60: 4
A61: S17 | B61: Bill Cummings | C61: 64 | D61: 3 | E61: 11 | F61: 36 | G61: 14
A62: S18 | B62: Carol Perez | C62: 90 | D62: 4 | E62: 7 | F62: 39 | G62: 40
A63: Overall Averages: | C63: =SUM(C45:C62)/$A$22 -> 29.00 | D63: =SUM(D45:D62)/$A$22 -> 1.8888888888888888 | E63: =SUM(E45:E62)/$A$22 -> 5.0555555555555554 | F63: =SUM(F45:F62)/$A$22 -> 14.388888888888889 | G63: =SUM(G45:G62)/$A$22 -> 7.666666666666667