B2: UDPL IDPA Match Results for November 27, 2004
B3: Sorted by Division. | K3: Click here for results by Time.
B4: Click on the Stage # to view the COF.
A5: Place | B5: Name | C5: (Div-Class) | D5: Shoot Total | E5: Total PD | F5: Stage 1 | G5: String 1 | H5: String 2 | I5: String 3 | J5: String 4 | K5: PD | L5: Stage 2 | M5: String 1 | N5: PD | O5: Stage 3 | P5: String 1 | Q5: PD | R5: Stage 4 | S5: String 1 | T5: PD | U5: Stage 5 | V5: String 1 | W5: String 2 | X5: String 3 | Y5: PD | Z5: Stage 6 | AA5: String 1 | AB5: String 2 | AC5: PD
A7: 1 | B7: Theodore, Ari | C7: CDP-EX | D7: =+F7+L7+O7+R7+U7+Z7 -> 152.94 | E7: =+K7+N7+Q7+T7+Y7+AC7 -> 42 | F7: =+(G7+H7+I7+J7)+0.5*K7 -> 21.31 | G7: 3.60 | H7: 2.97 | I7: 6.98 | J7: 4.26 | K7: =3+2+2 -> 7 | L7: =+(M7)+0.5*N7 -> 19.39 | M7: 18.89 | N7: 1 | O7: =+(P7)+0.5*Q7 -> 26.51 | P7: 19.01 | Q7: =1+3+5+3+1+2 -> 15 | R7: =+(S7)+0.5*T7 -> 24.41 | S7: 21.91 | T7: =1+4 -> 5 | U7: =+(V7+W7+X7)+0.5*Y7 -> 32.63 | V7: 7.40 | W7: 10.09 | X7: 11.14 | Y7: =3+3+2 -> 8 | Z7: =+(AA7+AB7)+0.5*AC7 -> 28.69 | AA7: 12.61 | AB7: 13.08 | AC7: =1+2+1+2 -> 6
A9: 1 | B9: Collins, Ken | C9: CDP-SS | D9: =+F9+L9+O9+R9+U9+Z9 -> 196.18 | E9: =+K9+N9+Q9+T9+Y9+AC9 -> 42 | F9: =+(G9+H9+I9+J9)+0.5*K9 -> 27.68 | G9: 3.85 | H9: 4.37 | I9: 10.39 | J9: 5.07 | K9: =4+1+3 -> 8 | L9: =+(M9)+0.5*N9 -> 30.98 | M9: 27.48 | N9: =1+1+1+2+2 -> 7 | O9: =+(P9)+0.5*Q9 -> 26.05 | P9: 23.55 | Q9: =1+1+1+2 -> 5 | R9: =+(S9)+0.5*T9 -> 38.73 | S9: 36.23 | T9: 5 | U9: =+(V9+W9+X9)+0.5*Y9 -> 36.85 | V9: 10.28 | W9: 9.47 | X9: 12.60 | Y9: =4+4+1 -> 9 | Z9: =+(AA9+AB9)+0.5*AC9 -> 35.89 | AA9: 16.78 | AB9: 15.11 | AC9: =6+1+1 -> 8
A10: 2 | B10: Rodriquez, Mike | C10: CDP-SS | D10: =+F10+L10+O10+R10+U10+Z10 -> 205.57 | E10: =+K10+N10+Q10+T10+Y10+AC10 -> 92 | F10: =+(G10+H10+I10+J10)+0.5*K10 -> 32.50 | G10: 3.47 | H10: 4.04 | I10: 10.18 | J10: 5.31 | K10: =10+3+6 -> 19 | L10: =+(M10)+0.5*N10 -> 28.00 | M10: 24.00 | N10: =2+2+1+1+2 -> 8 | O10: =+(P10)+0.5*Q10 -> 26.08 | P10: 19.58 | Q10: =1+3+1+3+3+1+1 -> 13 | R10: =+(S10)+0.5*T10 -> 34.41 | S10: 25.41 | T10: =1+2+5+10 -> 18 | U10: =+(V10+W10+X10)+0.5*Y10 -> 50.88 | V10: 9.56 | W10: 13.47 | X10: 18.35 | Y10: =6+10+3 -> 19 | Z10: =+(AA10+AB10)+0.5*AC10 -> 33.70 | AA10: 13.50 | AB10: 12.70 | AC10: =4+2+2+1+6 -> 15
A11: 3 | B11: Simpson, Harold | C11: CDP-SS | D11: =+F11+L11+O11+R11+U11+Z11 -> 237.00 | E11: =+K11+N11+Q11+T11+Y11+AC11 -> 74 | F11: =+(G11+H11+I11+J11)+0.5*K11 -> 37.99 | G11: 4.57 | H11: 4.45 | I11: 11.48 | J11: 7.49 | K11: =6+10+4 -> 20 | L11: =+(M11)+0.5*N11 -> 36.99 | M11: 31.99 | N11: =1+1+1+1+3+1+2 -> 10 | O11: =+(P11)+0.5*Q11 -> 41.98 | P11: 31.48 | Q11: =6+2+5+3+2+2+1 -> 21 | R11: =+(S11)+0.5*T11 -> 32.77 | S11: 31.27 | T11: 3 | U11: =+(V11+W11+X11)+0.5*Y11 -> 46.08 | V11: 12.48 | W11: 13.45 | X11: 14.65 | Y11: =2+5+4 -> 11 | Z11: =+(AA11+AB11)+0.5*AC11 -> 41.19 | AA11: 17.80 | AB11: 18.89 | AC11: =3+1+2+2+1 -> 9
A13: 1 | B13: Kirkham, Bart | C13: CDP-MM | D13: =+F13+L13+O13+R13+U13+Z13 -> 197.89 | E13: =+K13+N13+Q13+T13+Y13+AC13 -> 67 | F13: =+(G13+H13+I13+J13)+0.5*K13 -> 27.98 | G13: 3.68 | H13: 3.96 | I13: 10.26 | J13: 6.08 | K13: =2+4+2 -> 8 | L13: =+(M13)+0.5*N13 -> 25.23 | M13: 24.23 | N13: =1+1 -> 2 | O13: =+(P13)+0.5*Q13 -> 34.78 | P13: 27.28 | Q13: =1+4+3+6+1 -> 15 | R13: =+(S13)+0.5*T13 -> 32.07 | S13: 24.07 | T13: =1+1+1+7+6 -> 16 | U13: =+(V13+W13+X13)+0.5*Y13 -> 43.41 | V13: 12.45 | W13: 10.51 | X13: 8.95 | Y13: =4+7+12 -> 23 | Z13: =+(AA13+AB13)+0.5*AC13 -> 34.42 | AA13: 17.43 | AB13: 15.49 | AC13: =1+1+1 -> 3
A14: 2 | B14: Scott, Alan | C14: CDP-MM | D14: =+F14+L14+O14+R14+U14+Z14 -> 231.47 | E14: =+K14+N14+Q14+T14+Y14+AC14 -> 76 | F14: =+(G14+H14+I14+J14)+0.5*K14 -> 30.91 | G14: 4.57 | H14: 4.14 | I14: 9.77 | J14: 5.93 | K14: =4+9 -> 13 | L14: =+(M14)+0.5*N14 -> 30.16 | M14: 22.66 | N14: =1+1+1+1+1+10 -> 15 | O14: =+(P14)+0.5*Q14 -> 44.97 | P14: 27.97 | Q14: =4+6+1+1+1+1+20 -> 34 | R14: =+(S14)+0.5*T14 -> 34.73 | S14: 32.23 | T14: =3+1+1 -> 5 | U14: =+(V14+W14+X14)+0.5*Y14 -> 49.06 | V14: 15.01 | W14: 13.30 | X14: 17.75 | Y14: =1+5 -> 6 | Z14: =+(AA14+AB14)+0.5*AC14 -> 41.64 | AA14: 17.54 | AB14: 22.60 | AC14: =1+1+1 -> 3
A15: 3 | B15: Johnson, Michael | C15: CDP-MM | D15: =+F15+L15+O15+R15+U15+Z15 -> 235.97 | E15: =+K15+N15+Q15+T15+Y15+AC15 -> 81 | F15: =+(G15+H15+I15+J15)+0.5*K15 -> 31.03 | G15: 4.85 | H15: 5.01 | I15: 11.91 | J15: 6.26 | K15: =3+2+1 -> 6 | L15: =+(M15)+0.5*N15 -> 30.33 | M15: 28.83 | N15: =1+1+1 -> 3 | O15: =+(P15)+0.5*Q15 -> 36.73 | P15: 20.73 | Q15: =4+4+1+6+1+5+1+10 -> 32 | R15: =+(S15)+0.5*T15 -> 36.94 | S15: 31.44 | T15: =5+6 -> 11 | U15: =+(V15+W15+X15)+0.5*Y15 -> 57.58 | V15: 13.38 | W15: 14.18 | X15: 26.52 | Y15: =3+4 -> 7 | Z15: =+(AA15+AB15)+0.5*AC15 -> 43.36 | AA15: 17.49 | AB15: 14.87 | AC15: =1+6+2+3+10 -> 22
A16: 4 | B16: Scott, Michael | C16: CDP-MM | D16: =+F16+L16+O16+R16+U16+Z16 -> 237.21 | E16: =+K16+N16+Q16+T16+Y16+AC16 -> 72 | F16: =+(G16+H16+I16+J16)+0.5*K16 -> 29.49 | G16: 4.05 | H16: 4.56 | I16: 10.90 | J16: 5.48 | K16: =6+1+2 -> 9 | L16: =+(M16)+0.5*N16 -> 34.41 | M16: 28.41 | N16: =5+3+1+1+1+1 -> 12 | O16: =+(P16)+0.5*Q16 -> 42.08 | P16: 32.58 | Q16: =4+1+4+2+5+3 -> 19 | R16: =+(S16)+0.5*T16 -> 43.02 | S16: 37.02 | T16: =1+1+5+5 -> 12 | U16: =+(V16+W16+X16)+0.5*Y16 -> 45.22 | V16: 10.24 | W16: 12.49 | X16: 16.99 | Y16: =5+3+3 -> 11 | Z16: =+(AA16+AB16)+0.5*AC16 -> 42.99 | AA16: 16.29 | AB16: 22.20 | AC16: =2+4+3 -> 9
A17: 5 | B17: Katz, Rick | C17: CDP-MM | D17: =+F17+L17+O17+R17+U17+Z17 -> 248.50 | E17: =+K17+N17+Q17+T17+Y17+AC17 -> 91 | F17: =+(G17+H17+I17+J17)+0.5*K17 -> 35.77 | G17: 5.47 | H17: 5.31 | I17: 12.14 | J17: 5.85 | K17: =6+6+2 -> 14 | L17: =+(M17)+0.5*N17 -> 32.50 | M17: 17.00 | N17: =1+4+1+5+10+10 -> 31 | O17: =+(P17)+0.5*Q17 -> 41.87 | P17: 35.87 | Q17: =4+2+2+1+3 -> 12 | R17: =+(S17)+0.5*T17 -> 42.39 | S17: 34.39 | T17: =1+1+6+5+2+1 -> 16 | U17: =+(V17+W17+X17)+0.5*Y17 -> 51.61 | V17: 20.49 | W17: 12.91 | X17: 14.71 | Y17: =2+3+2 -> 7 | Z17: =+(AA17+AB17)+0.5*AC17 -> 44.36 | AA17: 20.62 | AB17: 18.24 | AC17: =1+2+2+2+1+3 -> 11
A18: 6 | B18: Halliday, Mark | C18: CDP-MM | D18: =+F18+L18+O18+R18+U18+Z18 -> 299.05 | E18: =+K18+N18+Q18+T18+Y18+AC18 -> 90 | F18: =+(G18+H18+I18+J18)+0.5*K18 -> 62.20 | G18: 4.51 | H18: 5.10 | I18: 21.46 | J18: 20.63 | K18: =5+11+5 -> 21 | L18: =+(M18)+0.5*N18 -> 39.78 | M18: 30.78 | N18: =2+1+2+2+1+10 -> 18 | O18: =+(P18)+0.5*Q18 -> 38.94 | P18: 33.44 | Q18: =4+1+2+1+2+1 -> 11 | R18: =+(S18)+0.5*T18 -> 39.06 | S18: 33.56 | T18: =1+10 -> 11 | U18: =+(V18+W18+X18)+0.5*Y18 -> 61.71 | V18: 24.54 | W18: 17.15 | X18: 15.02 | Y18: =7+2+1 -> 10 | Z18: =+(AA18+AB18)+0.5*AC18 -> 57.36 | AA18: 17.73 | AB18: 30.13 | AC18: =2+5+2+4+6 -> 19
A20: 1 | B20: Russell, Ryan | C20: CDP-NV | D20: =+F20+L20+O20+R20+U20+Z20 -> 255.67 | E20: =+K20+N20+Q20+T20+Y20+AC20 -> 77 | F20: =+(G20+H20+I20+J20)+0.5*K20 -> 38.03 | G20: 4.82 | H20: 4.92 | I20: 13.48 | J20: 6.31 | K20: =10+2+5 -> 17 | L20: =+(M20)+0.5*N20 -> 49.37 | M20: 37.87 | N20: =1+3+2+1+6+10 -> 23 | O20: =+(P20)+0.5*Q20 -> 36.34 | P20: 32.34 | Q20: =4+1+1+1+1 -> 8 | R20: =+(S20)+0.5*T20 -> 41.17 | S20: 40.17 | T20: =1+1 -> 2 | U20: =+(V20+W20+X20)+0.5*Y20 -> 48.07 | V20: 11.19 | W20: 13.18 | X20: 14.20 | Y20: =6+9+4 -> 19 | Z20: =+(AA20+AB20)+0.5*AC20 -> 42.69 | AA20: 20.63 | AB20: 18.06 | AC20: =1+1+3+1+2 -> 8
A21: 2 | B21: Willis, David | C21: CDP-NV | D21: =+F21+L21+O21+R21+U21+Z21 -> 303.53 | E21: =+K21+N21+Q21+T21+Y21+AC21 -> 162 | F21: =+(G21+H21+I21+J21)+0.5*K21 -> 49.22 | G21: 4.34 | H21: 4.86 | I21: 11.63 | J21: 5.89 | K21: =11+19+15 -> 45 | L21: =+(M21)+0.5*N21 -> 41.31 | M21: 30.81 | N21: =1+1+1+8+1+4+4+1 -> 21 | O21: =+(P21)+0.5*Q21 -> 51.15 | P21: 36.65 | Q21: =6+2+1+4+3+3+6+1+3 -> 29 | R21: =+(S21)+0.5*T21 -> 47.70 | S21: 37.20 | T21: =2+1+8+9+1 -> 21 | U21: =+(V21+W21+X21)+0.5*Y21 -> 59.16 | V21: 11.78 | W21: 19.79 | X21: 15.09 | Y21: =14+8+3 -> 25 | Z21: =+(AA21+AB21)+0.5*AC21 -> 54.99 | AA21: 19.96 | AB21: 24.53 | AC21: =1+6+2+4+2+6 -> 21
A23: 1 | B23: Kirkham, Glade | C23: CDP-UC | D23: =+F23+L23+O23+R23+U23+Z23 -> 275.13 | E23: =+K23+N23+Q23+T23+Y23+AC23 -> 53 | F23: =+(G23+H23+I23+J23)+0.5*K23 -> 47.49 | G23: 4.94 | H23: 6.05 | I23: 21.11 | J23: 10.89 | K23: =4+5 -> 9 | L23: =+(M23)+0.5*N23 -> 34.69 | M23: 33.19 | N23: =1+1+1 -> 3 | O23: =+(P23)+0.5*Q23 -> 39.14 | P23: 36.14 | Q23: =2+1+1+1+1 -> 6 | R23: =+(S23)+0.5*T23 -> 48.19 | S23: 39.19 | T23: =3+6+6+1+2 -> 18 | U23: =+(V23+W23+X23)+0.5*Y23 -> 62.24 | V23: 14.63 | W23: 18.88 | X23: 22.23 | Y23: =8+1+4 -> 13 | Z23: =+(AA23+AB23)+0.5*AC23 -> 43.38 | AA23: 18.14 | AB23: 23.24 | AC23: =2+1+1 -> 4
A25: 1 | B25: Zaccardi, Pat | C25: ESP-SS | D25: =+F25+L25+O25+R25+U25+Z25 -> 186.61 | E25: =+K25+N25+Q25+T25+Y25+AC25 -> 59 | F25: =+(G25+H25+I25+J25)+0.5*K25 -> 24.61 | G25: 4.23 | H25: 3.81 | I25: 8.37 | J25: 5.70 | K25: =2+3 -> 5 | L25: =+(M25)+0.5*N25 -> 25.63 | M25: 23.13 | N25: =2+2+1 -> 5 | O25: =+(P25)+0.5*Q25 -> 25.02 | P25: 19.02 | Q25: =1+1+1+1+6+2 -> 12 | R25: =+(S25)+0.5*T25 -> 35.25 | S25: 29.25 | T25: =5+6+1 -> 12 | U25: =+(V25+W25+X25)+0.5*Y25 -> 40.67 | V25: 9.01 | W25: 10.05 | X25: 14.61 | Y25: =8+2+4 -> 14 | Z25: =+(AA25+AB25)+0.5*AC25 -> 35.43 | AA25: 13.86 | AB25: 16.07 | AC25: =2+6+1+2 -> 11
A27: 1 | B27: Zaccardi, Juke | C27: ESP-MM | D27: =+F27+L27+O27+R27+U27+Z27 -> 191.82 | E27: =+K27+N27+Q27+T27+Y27+AC27 -> 88 | F27: =+(G27+H27+I27+J27)+0.5*K27 -> 30.34 | G27: 3.64 | H27: 4.46 | I27: 8.67 | J27: 7.57 | K27: =3+6+3 -> 12 | L27: =+(M27)+0.5*N27 -> 27.56 | M27: 17.56 | N27: =1+1+1+3+1+3+10 -> 20 | O27: =+(P27)+0.5*Q27 -> 21.47 | P27: 18.47 | Q27: =1+1+4 -> 6 | R27: =+(S27)+0.5*T27 -> 37.73 | S27: 24.73 | T27: =1+1+2+1+1+20 -> 26 | U27: =+(V27+W27+X27)+0.5*Y27 -> 40.11 | V27: 7.42 | W27: 10.23 | X27: 14.96 | Y27: =12+1+2 -> 15 | Z27: =+(AA27+AB27)+0.5*AC27 -> 34.61 | AA27: 12.86 | AB27: 17.25 | AC27: =5+1+2+1 -> 9
A29: 1 | B29: DeLeeuw, Dave | C29: ESP-UC | D29: =+F29+L29+O29+R29+U29+Z29 -> 281.51 | E29: =+K29+N29+Q29+T29+Y29+AC29 -> 93 | F29: =+(G29+H29+I29+J29)+0.5*K29 -> 37.12 | G29: 4.65 | H29: 4.51 | I29: 12.61 | J29: 6.35 | K29: =2+11+5 -> 18 | L29: =+(M29)+0.5*N29 -> 56.32 | M29: 45.82 | N29: =1+20 -> 21 | O29: =+(P29)+0.5*Q29 -> 46.54 | P29: 32.04 | Q29: =6+1+6+5+1+10 -> 29 | R29: =+(S29)+0.5*T29 -> 43.25 | S29: 38.25 | T29: =5+5 -> 10 | U29: =+(V29+W29+X29)+0.5*Y29 -> 53.63 | V29: 15.44 | W29: 17.64 | X29: 18.55 | Y29: =2+2 -> 4 | Z29: =+(AA29+AB29)+0.5*AC29 -> 44.65 | AA29: 21.88 | AB29: 17.27 | AC29: =1+1+5+2+2 -> 11
A31: 1 | B31: Lowe, John | C31: SSP-MA | D31: =+F31+L31+O31+R31+U31+Z31 -> 164.23 | E31: =+K31+N31+Q31+T31+Y31+AC31 -> 40 | F31: =+(G31+H31+I31+J31)+0.5*K31 -> 21.91 | G31: 4.03 | H31: 3.84 | I31: 7.45 | J31: 4.09 | K31: =2+1+2 -> 5 | L31: =+(M31)+0.5*N31 -> 27.48 | M31: 23.98 | N31: =3+1+1+1+1 -> 7 | O31: =+(P31)+0.5*Q31 -> 18.79 | P31: 17.79 | Q31: =1+1 -> 2 | R31: =+(S31)+0.5*T31 -> 27.69 | S31: 25.69 | T31: =1+1+2 -> 4 | U31: =+(V31+W31+X31)+0.5*Y31 -> 36.72 | V31: 8.60 | W31: 8.64 | X31: 10.48 | Y31: =3+5+10 -> 18 | Z31: =+(AA31+AB31)+0.5*AC31 -> 31.64 | AA31: 14.17 | AB31: 15.47 | AC31: =3+1 -> 4
A33: 1 | B33: Montgomery, Robert | C33: SSP-EX | D33: =+F33+L33+O33+R33+U33+Z33 -> 181.43 | E33: =+K33+N33+Q33+T33+Y33+AC33 -> 48 | F33: =+(G33+H33+I33+J33)+0.5*K33 -> 22.38 | G33: 3.62 | H33: 3.94 | I33: 8.06 | J33: 5.26 | K33: =1+1+1 -> 3 | L33: =+(M33)+0.5*N33 -> 26.38 | M33: 22.38 | N33: =1+6+1 -> 8 | O33: =+(P33)+0.5*Q33 -> 22.91 | P33: 17.91 | Q33: =1+1+1+1+2+1+3 -> 10 | R33: =+(S33)+0.5*T33 -> 33.01 | S33: 30.01 | T33: =5+1 -> 6 | U33: =+(V33+W33+X33)+0.5*Y33 -> 43.35 | V33: 10.13 | W33: 12.12 | X33: 17.10 | Y33: =2+4+2 -> 8 | Z33: =+(AA33+AB33)+0.5*AC33 -> 33.40 | AA33: 13.15 | AB33: 13.75 | AC33: =3+1+1+2+6 -> 13
A34: 2 | B34: Vollmer, Phillip | C34: SSP-EX | D34: =+F34+L34+O34+R34+U34+Z34 -> 183.61 | E34: =+K34+N34+Q34+T34+Y34+AC34 -> 73 | F34: =+(G34+H34+I34+J34)+0.5*K34 -> 29.27 | G34: 3.77 | H34: 3.71 | I34: 9.68 | J34: 4.61 | K34: =6+5+4 -> 15 | L34: =+(M34)+0.5*N34 -> 27.31 | M34: 23.31 | N34: =4+2+1+1 -> 8 | O34: =+(P34)+0.5*Q34 -> 33.09 | P34: 20.59 | Q34: =1+2+1+3+1+3+1+2+1+10 -> 25 | R34: =+(S34)+0.5*T34 -> 31.95 | S34: 26.45 | T34: =1+8+1+1 -> 11 | U34: =+(V34+W34+X34)+0.5*Y34 -> 34.61 | V34: 9.53 | W34: 9.97 | X34: 13.61 | Y34: =1+1+1 -> 3 | Z34: =+(AA34+AB34)+0.5*AC34 -> 27.38 | AA34: 10.57 | AB34: 11.31 | AC34: =6+1+1+2+1 -> 11
A36: 1 | B36: Boyer, Steve | C36: SSP-SS | D36: =+F36+L36+O36+R36+U36+Z36 -> 236.55 | E36: =+K36+N36+Q36+T36+Y36+AC36 -> 78 | F36: =+(G36+H36+I36+J36)+0.5*K36 -> 37.76 | G36: 5.99 | H36: 5.74 | I36: 12.04 | J36: 6.49 | K36: =1+10+4 -> 15 | L36: =+(M36)+0.5*N36 -> 40.64 | M36: 32.64 | N36: =1+1+1+2+1+10 -> 16 | O36: =+(P36)+0.5*Q36 -> 38.81 | P36: 28.31 | Q36: =2+1+1+5+6+1+5 -> 21 | R36: =+(S36)+0.5*T36 -> 38.38 | S36: 32.38 | T36: =1+10+1 -> 12 | U36: =+(V36+W36+X36)+0.5*Y36 -> 40.90 | V36: 11.44 | W36: 11.09 | X36: 13.37 | Y36: =6+2+2 -> 10 | Z36: =+(AA36+AB36)+0.5*AC36 -> 40.06 | AA36: 19.19 | AB36: 18.87 | AC36: =1+3 -> 4
A37: 2 | B37: Brownlee, Mike | C37: SSP-SS | D37: =+F37+L37+O37+R37+U37+Z37 -> 239.80 | E37: =+K37+N37+Q37+T37+Y37+AC37 -> 63 | F37: =+(G37+H37+I37+J37)+0.5*K37 -> 34.86 | G37: 4.86 | H37: 4.84 | I37: 13.02 | J37: 5.14 | K37: =7+3+4 -> 14 | L37: =+(M37)+0.5*N37 -> 34.30 | M37: 31.80 | N37: =1+2+1+1 -> 5 | O37: =+(P37)+0.5*Q37 -> 34.46 | P37: 26.46 | Q37: =1+1+2+5+2+5 -> 16 | R37: =+(S37)+0.5*T37 -> 42.12 | S37: 37.12 | T37: =5+5 -> 10 | U37: =+(V37+W37+X37)+0.5*Y37 -> 50.75 | V37: 17.18 | W37: 12.54 | X37: 15.53 | Y37: =6+1+4 -> 11 | Z37: =+(AA37+AB37)+0.5*AC37 -> 43.31 | AA37: 19.14 | AB37: 20.67 | AC37: =2+2+2+1 -> 7
A39: 1 | B39: Young, Ren | C39: SSP-MM | D39: =+F39+L39+O39+R39+U39+Z39 -> 216.57 | E39: =+K39+N39+Q39+T39+Y39+AC39 -> 90 | F39: =+(G39+H39+I39+J39)+0.5*K39 -> 32.61 | G39: 3.22 | H39: 3.35 | I39: 9.21 | J39: 4.33 | K39: =8+9+8 -> 25 | L39: =+(M39)+0.5*N39 -> 29.86 | M39: 27.86 | N39: =1+1+1+1 -> 4 | O39: =+(P39)+0.5*Q39 -> 32.24 | P39: 25.24 | Q39: =1+2+1+10 -> 14 | R39: =+(S39)+0.5*T39 -> 45.34 | S39: 30.34 | T39: =8+5+6+1+10 -> 30 | U39: =+(V39+W39+X39)+0.5*Y39 -> 38.42 | V39: 9.71 | W39: 10.96 | X39: 15.25 | Y39: =1+2+2 -> 5 | Z39: =+(AA39+AB39)+0.5*AC39 -> 38.10 | AA39: 16.82 | AB39: 15.28 | AC39: =3+1+5+3 -> 12
A41: 1 | B41: McDermaid, Jen | C41: SSP-NV | D41: =+F41+L41+O41+R41+U41+Z41 -> 356.97 | E41: =+K41+N41+Q41+T41+Y41+AC41 -> 219 | F41: =+(G41+H41+I41+J41)+0.5*K41 -> 50.68 | G41: 4.66 | H41: 5.26 | I41: 14.06 | J41: 7.20 | K41: =13+7+19 -> 39 | L41: =+(M41)+0.5*N41 -> 52.14 | M41: 40.14 | N41: =2+2+5+3+6+1+3+2 -> 24 | O41: =+(P41)+0.5*Q41 -> 54.04 | P41: 35.04 | Q41: =8+1+1+4+10+5+1+5+3 -> 38 | R41: =+(S41)+0.5*T41 -> 70.30 | S41: 44.80 | T41: =1+1+11+4+4+30 -> 51 | U41: =+(V41+W41+X41)+0.5*Y41 -> 64.63 | V41: 13.55 | W41: 17.49 | X41: 16.59 | Y41: =12+11+11 -> 34 | Z41: =+(AA41+AB41)+0.5*AC41 -> 65.18 | AA41: 21.72 | AB41: 26.96 | AC41: =5+2+8+10+8 -> 33
A42: 2 | B42: Boyer, Amie | C42: SSP-NV | D42: =+F42+L42+O42+R42+U42+Z42 -> 383.82 | E42: =+K42+N42+Q42+T42+Y42+AC42 -> 229 | F42: =+(G42+H42+I42+J42)+0.5*K42 -> 62.64 | G42: 8.11 | H42: 8.64 | I42: 23.50 | J42: 7.89 | K42: =5+11+13 -> 29 | L42: =+(M42)+0.5*N42 -> 61.87 | M42: 34.87 | N42: =3+2+4+10+8+2+4+1+20 -> 54 | O42: =+(P42)+0.5*Q42 -> 65.03 | P42: 38.03 | Q42: =2+6+6+6+6+4+1+3+20 -> 54 | R42: =+(S42)+0.5*T42 -> 67.45 | S42: 46.45 | T42: =1+3+9+11+2+6+10 -> 42 | U42: =+(V42+W42+X42)+0.5*Y42 -> 67.56 | V42: 15.81 | W42: 16.93 | X42: 17.32 | Y42: =9+17+9 -> 35 | Z42: =+(AA42+AB42)+0.5*AC42 -> 59.27 | AA42: 26.22 | AB42: 25.55 | AC42: =7+4+1+1+2 -> 15
A44: 1 | B44: Ward, Dan | C44: SSP-UC | D44: =+F44+L44+O44+R44+U44+Z44 -> 167.84 | E44: =+K44+N44+Q44+T44+Y44+AC44 -> 48 | F44: =+(G44+H44+I44+J44)+0.5*K44 -> 28.46 | G44: 3.31 | H44: 3.65 | I44: 6.64 | J44: 4.36 | K44: =4+10+7 -> 21 | L44: =+(M44)+0.5*N44 -> 23.98 | M44: 21.98 | N44: =1+1+1+1 -> 4 | O44: =+(P44)+0.5*Q44 -> 26.78 | P44: 23.78 | Q44: =1+1+1+1+1+1 -> 6 | R44: =+(S44)+0.5*T44 -> 25.68 | S44: 23.18 | T44: 5 | U44: =+(V44+W44+X44)+0.5*Y44 -> 34.76 | V44: 8.31 | W44: 9.10 | X44: 12.85 | Y44: =1+5+3 -> 9 | Z44: =+(AA44+AB44)+0.5*AC44 -> 28.18 | AA44: 13.92 | AB44: 12.76 | AC44: 3
A45: 2 | B45: Scott, Ryan | C45: SSP-UC | D45: =+F45+L45+O45+R45+U45+Z45 -> 237.62 | E45: =+K45+N45+Q45+T45+Y45+AC45 -> 58 | F45: =+(G45+H45+I45+J45)+0.5*K45 -> 45.38 | G45: 4.17 | H45: 5.78 | I45: 19.62 | J45: 7.31 | K45: =4+8+5 -> 17 | L45: =+(M45)+0.5*N45 -> 36.00 | M45: 27.50 | N45: =1+2+8+1+5 -> 17 | O45: =+(P45)+0.5*Q45 -> 31.17 | P45: 28.17 | Q45: =3+1+1+1 -> 6 | R45: =+(S45)+0.5*T45 -> 34.62 | S45: 29.12 | T45: =6+5 -> 11 | U45: =+(V45+W45+X45)+0.5*Y45 -> 58.98 | V45: 18.88 | W45: 17.87 | X45: 19.23 | Y45: =2+2+2 -> 6 | Z45: =+(AA45+AB45)+0.5*AC45 -> 31.47 | AA45: 16.74 | AB45: 14.23 | AC45: 1
A46: 3 | B46: Wilkinson, Justin | C46: SSP-UC | D46: =+F46+L46+O46+R46+U46+Z46 -> 334.66 | E46: =+K46+N46+Q46+T46+Y46+AC46 -> 98 | F46: =+(G46+H46+I46+J46)+0.5*K46 -> 66.32 | G46: 5.19 | H46: 9.23 | I46: 13.51 | J46: 15.89 | K46: =16+17+12 -> 45 | L46: =+(M46)+0.5*N46 -> 37.84 | M46: 35.34 | N46: =1+2+1+1 -> 5 | O46: =+(P46)+0.5*Q46 -> 46.32 | P46: 38.32 | Q46: =2+2+3+2+1+6 -> 16 | R46: =+(S46)+0.5*T46 -> 37.22 | S46: 29.72 | T46: =2+1+5+6+1 -> 15 | U46: =+(V46+W46+X46)+0.5*Y46 -> 74.87 | V46: 19.41 | W46: 21.19 | X46: 30.27 | Y46: =2+3+3 -> 8 | Z46: =+(AA46+AB46)+0.5*AC46 -> 72.09 | AA46: 17.51 | AB46: 50.08 | AC46: =1+2+3+1+2 -> 9
A47: 26 | B47: Rodriquez, Mike | C47: CDP-MM | D47: DNF | E47: =+K47+N47+Q47+T47+Y47+AC47 -> 0 | F47: =+(G47+#REF!)+0.5*K47 -> #REF! | L47: =+(M47)+0.5*N47 -> 0.00 | O47: =+(P47+#REF!)+0.5*Q47 -> #REF! | R47: =+(S47+#REF!+#REF!)+0.5*T47 -> #REF! | U47: =+(V47)+0.5*Y47 -> 0.00 | Z47: =+(AA47+AB47)+0.5*AC47 -> 0.00
A49: 1 | B49: Kirkham, Devon (.22) | C49: .22-N/C | D49: =+F49+L49+O49+R49+U49+Z49 -> 388.22 | E49: =+K49+N49+Q49+T49+Y49+AC49 -> 126 | F49: =+(G49+H49+I49+J49)+0.5*K49 -> 52.35 | G49: 8.15 | H49: 7.40 | I49: 18.20 | J49: 10.60 | K49: =5+4+7 -> 16 | L49: =+(M49)+0.5*N49 -> 67.99 | M49: 53.49 | N49: =3+4+4+3+1+2+1+1+10 -> 29 | O49: =+(P49)+0.5*Q49 -> 55.30 | P49: 35.30 | Q49: =1+1+4+3+1+1+6+1+2+20 -> 40 | R49: =+(S49)+0.5*T49 -> 61.08 | S49: 49.08 | T49: =4+2+7+7+1+1+2 -> 24 | U49: =+(V49+W49+X49)+0.5*Y49 -> 82.29 | V49: 22.12 | W49: 26.21 | X49: 29.46 | Y49: =6+1+2 -> 9 | Z49: =+(AA49+AB49)+0.5*AC49 -> 69.21 | AA49: 24.35 | AB49: 40.86 | AC49: =1+2+2+1+2 -> 8
A50: 2 | B50: Boyer, Sara | C50: .22-N/C | D50: =+F50+L50+O50+R50+U50+Z50 -> 483.11 | E50: =+K50+N50+Q50+T50+Y50+AC50 -> 213 | F50: =+(G50+H50+I50+J50)+0.5*K50 -> 83.92 | G50: 9.00 | H50: 14.90 | I50: 25.95 | J50: 8.57 | K50: =15+15+21 -> 51 | L50: =+(M50)+0.5*N50 -> 71.32 | M50: 44.32 | N50: =6+10+2+10+6+5+5+10 -> 54 | O50: =+(P50)+0.5*Q50 -> 93.93 | P50: 72.43 | Q50: =2+4+10+2+2+4+4+5+10 -> 43 | R50: =+(S50)+0.5*T50 -> 94.81 | S50: 80.31 | T50: =8+4+5+6+4+1+1 -> 29 | U50: =+(V50+W50+X50)+0.5*Y50 -> 66.38 | V50: 23.17 | W50: 17.10 | X50: 18.61 | Y50: =2+7+6 -> 15 | Z50: =+(AA50+AB50)+0.5*AC50 -> 72.75 | AA50: 30.50 | AB50: 31.75 | AC50: =1+5+2+8+5 -> 21
A51: Notes:
A52: xx | B52: Indicates that the Points Down value includes some kind of penalty (Procedural Error, Hits on Non-Threat or Failure to Neutralize).
A53: PD | B53: = Points Down value is PD x .5 seconds added to the total stage time.
A54: xx | B54: Indicates that the Points Down value includes some kind of penalty (Procedural Error, Hits on Non-Threat or Failure to Neutralize).
A55: DNF | B55: = Did Not Finish
A56: NS | B56: = No Score
B57: Div/Class Information:
A58: - | B58: Division: CDP = Custom Defense Pistol; ESP = Enhanced Service Pistol; SSP = Stock Service Pistol; SSR = Stock Service Revolver
A59: - | B59: Classification: MA = Master; EX = Expert; SS = Sharpshooter; MM = Marksman; NV = Novice; UC = Unclassified
B60: .22-N/C = Shooter used a non IDPA firearm and was not placed in an IDPA Div/Class.