B2: UDPL IDPA Match Results for November 27, 2004
B3: Sorted by Time without regard to Div/Class | K3: Click here for results by Division.
B4: Click on the Stage # to view the COF.
A5: Place | B5: Name | C5: (Div-Class) | D5: Shoot Total | E5: Total PD | F5: Stage 1 | G5: String 1 | H5: String 2 | I5: String 3 | J5: String 4 | K5: PD | L5: Stage 2 | M5: String 1 | N5: PD | O5: Stage 3 | P5: String 1 | Q5: PD | R5: Stage 4 | S5: String 1 | T5: PD | U5: Stage 5 | V5: String 1 | W5: String 2 | X5: String 3 | Y5: PD | Z5: Stage 6 | AA5: String 1 | AB5: String 2 | AC5: PD
A6: 1 | B6: Theodore, Ari | C6: CDP-EX | D6: =+F6+L6+O6+R6+U6+Z6 -> 152.94 | E6: =+K6+N6+Q6+T6+Y6+AC6 -> 42 | F6: =+(G6+H6+I6+J6)+0.5*K6 -> 21.31 | G6: 3.60 | H6: 2.97 | I6: 6.98 | J6: 4.26 | K6: =3+2+2 -> 7 | L6: =+(M6)+0.5*N6 -> 19.39 | M6: 18.89 | N6: 1 | O6: =+(P6)+0.5*Q6 -> 26.51 | P6: 19.01 | Q6: =1+3+5+3+1+2 -> 15 | R6: =+(S6)+0.5*T6 -> 24.41 | S6: 21.91 | T6: =1+4 -> 5 | U6: =+(V6+W6+X6)+0.5*Y6 -> 32.63 | V6: 7.40 | W6: 10.09 | X6: 11.14 | Y6: =3+3+2 -> 8 | Z6: =+(AA6+AB6)+0.5*AC6 -> 28.69 | AA6: 12.61 | AB6: 13.08 | AC6: =1+2+1+2 -> 6
A7: 2 | B7: Lowe, John | C7: SSP-MA | D7: =+F7+L7+O7+R7+U7+Z7 -> 164.23 | E7: =+K7+N7+Q7+T7+Y7+AC7 -> 40 | F7: =+(G7+H7+I7+J7)+0.5*K7 -> 21.91 | G7: 4.03 | H7: 3.84 | I7: 7.45 | J7: 4.09 | K7: =2+1+2 -> 5 | L7: =+(M7)+0.5*N7 -> 27.48 | M7: 23.98 | N7: =3+1+1+1+1 -> 7 | O7: =+(P7)+0.5*Q7 -> 18.79 | P7: 17.79 | Q7: =1+1 -> 2 | R7: =+(S7)+0.5*T7 -> 27.69 | S7: 25.69 | T7: =1+1+2 -> 4 | U7: =+(V7+W7+X7)+0.5*Y7 -> 36.72 | V7: 8.60 | W7: 8.64 | X7: 10.48 | Y7: =3+5+10 -> 18 | Z7: =+(AA7+AB7)+0.5*AC7 -> 31.64 | AA7: 14.17 | AB7: 15.47 | AC7: =3+1 -> 4
A8: 3 | B8: Ward, Dan | C8: SSP-UC | D8: =+F8+L8+O8+R8+U8+Z8 -> 167.84 | E8: =+K8+N8+Q8+T8+Y8+AC8 -> 48 | F8: =+(G8+H8+I8+J8)+0.5*K8 -> 28.46 | G8: 3.31 | H8: 3.65 | I8: 6.64 | J8: 4.36 | K8: =4+10+7 -> 21 | L8: =+(M8)+0.5*N8 -> 23.98 | M8: 21.98 | N8: =1+1+1+1 -> 4 | O8: =+(P8)+0.5*Q8 -> 26.78 | P8: 23.78 | Q8: =1+1+1+1+1+1 -> 6 | R8: =+(S8)+0.5*T8 -> 25.68 | S8: 23.18 | T8: 5 | U8: =+(V8+W8+X8)+0.5*Y8 -> 34.76 | V8: 8.31 | W8: 9.10 | X8: 12.85 | Y8: =1+5+3 -> 9 | Z8: =+(AA8+AB8)+0.5*AC8 -> 28.18 | AA8: 13.92 | AB8: 12.76 | AC8: 3
A9: 4 | B9: Montgomery, Robert | C9: SSP-EX | D9: =+F9+L9+O9+R9+U9+Z9 -> 181.43 | E9: =+K9+N9+Q9+T9+Y9+AC9 -> 48 | F9: =+(G9+H9+I9+J9)+0.5*K9 -> 22.38 | G9: 3.62 | H9: 3.94 | I9: 8.06 | J9: 5.26 | K9: =1+1+1 -> 3 | L9: =+(M9)+0.5*N9 -> 26.38 | M9: 22.38 | N9: =1+6+1 -> 8 | O9: =+(P9)+0.5*Q9 -> 22.91 | P9: 17.91 | Q9: =1+1+1+1+2+1+3 -> 10 | R9: =+(S9)+0.5*T9 -> 33.01 | S9: 30.01 | T9: =5+1 -> 6 | U9: =+(V9+W9+X9)+0.5*Y9 -> 43.35 | V9: 10.13 | W9: 12.12 | X9: 17.10 | Y9: =2+4+2 -> 8 | Z9: =+(AA9+AB9)+0.5*AC9 -> 33.40 | AA9: 13.15 | AB9: 13.75 | AC9: =3+1+1+2+6 -> 13
A10: 5 | B10: Vollmer, Phillip | C10: SSP-EX | D10: =+F10+L10+O10+R10+U10+Z10 -> 183.61 | E10: =+K10+N10+Q10+T10+Y10+AC10 -> 73 | F10: =+(G10+H10+I10+J10)+0.5*K10 -> 29.27 | G10: 3.77 | H10: 3.71 | I10: 9.68 | J10: 4.61 | K10: =6+5+4 -> 15 | L10: =+(M10)+0.5*N10 -> 27.31 | M10: 23.31 | N10: =4+2+1+1 -> 8 | O10: =+(P10)+0.5*Q10 -> 33.09 | P10: 20.59 | Q10: =1+2+1+3+1+3+1+2+1+10 -> 25 | R10: =+(S10)+0.5*T10 -> 31.95 | S10: 26.45 | T10: =1+8+1+1 -> 11 | U10: =+(V10+W10+X10)+0.5*Y10 -> 34.61 | V10: 9.53 | W10: 9.97 | X10: 13.61 | Y10: =1+1+1 -> 3 | Z10: =+(AA10+AB10)+0.5*AC10 -> 27.38 | AA10: 10.57 | AB10: 11.31 | AC10: =6+1+1+2+1 -> 11
A11: 6 | B11: Zaccardi, Pat | C11: ESP-SS | D11: =+F11+L11+O11+R11+U11+Z11 -> 186.61 | E11: =+K11+N11+Q11+T11+Y11+AC11 -> 59 | F11: =+(G11+H11+I11+J11)+0.5*K11 -> 24.61 | G11: 4.23 | H11: 3.81 | I11: 8.37 | J11: 5.70 | K11: =2+3 -> 5 | L11: =+(M11)+0.5*N11 -> 25.63 | M11: 23.13 | N11: =2+2+1 -> 5 | O11: =+(P11)+0.5*Q11 -> 25.02 | P11: 19.02 | Q11: =1+1+1+1+6+2 -> 12 | R11: =+(S11)+0.5*T11 -> 35.25 | S11: 29.25 | T11: =5+6+1 -> 12 | U11: =+(V11+W11+X11)+0.5*Y11 -> 40.67 | V11: 9.01 | W11: 10.05 | X11: 14.61 | Y11: =8+2+4 -> 14 | Z11: =+(AA11+AB11)+0.5*AC11 -> 35.43 | AA11: 13.86 | AB11: 16.07 | AC11: =2+6+1+2 -> 11
A12: 7 | B12: Zaccardi, Juke | C12: ESP-MM | D12: =+F12+L12+O12+R12+U12+Z12 -> 191.82 | E12: =+K12+N12+Q12+T12+Y12+AC12 -> 88 | F12: =+(G12+H12+I12+J12)+0.5*K12 -> 30.34 | G12: 3.64 | H12: 4.46 | I12: 8.67 | J12: 7.57 | K12: =3+6+3 -> 12 | L12: =+(M12)+0.5*N12 -> 27.56 | M12: 17.56 | N12: =1+1+1+3+1+3+10 -> 20 | O12: =+(P12)+0.5*Q12 -> 21.47 | P12: 18.47 | Q12: =1+1+4 -> 6 | R12: =+(S12)+0.5*T12 -> 37.73 | S12: 24.73 | T12: =1+1+2+1+1+20 -> 26 | U12: =+(V12+W12+X12)+0.5*Y12 -> 40.11 | V12: 7.42 | W12: 10.23 | X12: 14.96 | Y12: =12+1+2 -> 15 | Z12: =+(AA12+AB12)+0.5*AC12 -> 34.61 | AA12: 12.86 | AB12: 17.25 | AC12: =5+1+2+1 -> 9
A13: 8 | B13: Collins, Ken | C13: CDP-SS | D13: =+F13+L13+O13+R13+U13+Z13 -> 196.18 | E13: =+K13+N13+Q13+T13+Y13+AC13 -> 42 | F13: =+(G13+H13+I13+J13)+0.5*K13 -> 27.68 | G13: 3.85 | H13: 4.37 | I13: 10.39 | J13: 5.07 | K13: =4+1+3 -> 8 | L13: =+(M13)+0.5*N13 -> 30.98 | M13: 27.48 | N13: =1+1+1+2+2 -> 7 | O13: =+(P13)+0.5*Q13 -> 26.05 | P13: 23.55 | Q13: =1+1+1+2 -> 5 | R13: =+(S13)+0.5*T13 -> 38.73 | S13: 36.23 | T13: 5 | U13: =+(V13+W13+X13)+0.5*Y13 -> 36.85 | V13: 10.28 | W13: 9.47 | X13: 12.60 | Y13: =4+4+1 -> 9 | Z13: =+(AA13+AB13)+0.5*AC13 -> 35.89 | AA13: 16.78 | AB13: 15.11 | AC13: =6+1+1 -> 8
A14: 9 | B14: Kirkham, Bart | C14: CDP-MM | D14: =+F14+L14+O14+R14+U14+Z14 -> 197.89 | E14: =+K14+N14+Q14+T14+Y14+AC14 -> 67 | F14: =+(G14+H14+I14+J14)+0.5*K14 -> 27.98 | G14: 3.68 | H14: 3.96 | I14: 10.26 | J14: 6.08 | K14: =2+4+2 -> 8 | L14: =+(M14)+0.5*N14 -> 25.23 | M14: 24.23 | N14: =1+1 -> 2 | O14: =+(P14)+0.5*Q14 -> 34.78 | P14: 27.28 | Q14: =1+4+3+6+1 -> 15 | R14: =+(S14)+0.5*T14 -> 32.07 | S14: 24.07 | T14: =1+1+1+7+6 -> 16 | U14: =+(V14+W14+X14)+0.5*Y14 -> 43.41 | V14: 12.45 | W14: 10.51 | X14: 8.95 | Y14: =4+7+12 -> 23 | Z14: =+(AA14+AB14)+0.5*AC14 -> 34.42 | AA14: 17.43 | AB14: 15.49 | AC14: =1+1+1 -> 3
A15: 10 | B15: Rodriquez, Mike | C15: CDP-SS | D15: =+F15+L15+O15+R15+U15+Z15 -> 205.57 | E15: =+K15+N15+Q15+T15+Y15+AC15 -> 92 | F15: =+(G15+H15+I15+J15)+0.5*K15 -> 32.50 | G15: 3.47 | H15: 4.04 | I15: 10.18 | J15: 5.31 | K15: =10+3+6 -> 19 | L15: =+(M15)+0.5*N15 -> 28.00 | M15: 24.00 | N15: =2+2+1+1+2 -> 8 | O15: =+(P15)+0.5*Q15 -> 26.08 | P15: 19.58 | Q15: =1+3+1+3+3+1+1 -> 13 | R15: =+(S15)+0.5*T15 -> 34.41 | S15: 25.41 | T15: =1+2+5+10 -> 18 | U15: =+(V15+W15+X15)+0.5*Y15 -> 50.88 | V15: 9.56 | W15: 13.47 | X15: 18.35 | Y15: =6+10+3 -> 19 | Z15: =+(AA15+AB15)+0.5*AC15 -> 33.70 | AA15: 13.50 | AB15: 12.70 | AC15: =4+2+2+1+6 -> 15
A16: 11 | B16: Young, Ren | C16: SSP-MM | D16: =+F16+L16+O16+R16+U16+Z16 -> 216.57 | E16: =+K16+N16+Q16+T16+Y16+AC16 -> 90 | F16: =+(G16+H16+I16+J16)+0.5*K16 -> 32.61 | G16: 3.22 | H16: 3.35 | I16: 9.21 | J16: 4.33 | K16: =8+9+8 -> 25 | L16: =+(M16)+0.5*N16 -> 29.86 | M16: 27.86 | N16: =1+1+1+1 -> 4 | O16: =+(P16)+0.5*Q16 -> 32.24 | P16: 25.24 | Q16: =1+2+1+10 -> 14 | R16: =+(S16)+0.5*T16 -> 45.34 | S16: 30.34 | T16: =8+5+6+1+10 -> 30 | U16: =+(V16+W16+X16)+0.5*Y16 -> 38.42 | V16: 9.71 | W16: 10.96 | X16: 15.25 | Y16: =1+2+2 -> 5 | Z16: =+(AA16+AB16)+0.5*AC16 -> 38.10 | AA16: 16.82 | AB16: 15.28 | AC16: =3+1+5+3 -> 12
A17: 12 | B17: Scott, Alan | C17: CDP-MM | D17: =+F17+L17+O17+R17+U17+Z17 -> 231.47 | E17: =+K17+N17+Q17+T17+Y17+AC17 -> 76 | F17: =+(G17+H17+I17+J17)+0.5*K17 -> 30.91 | G17: 4.57 | H17: 4.14 | I17: 9.77 | J17: 5.93 | K17: =4+9 -> 13 | L17: =+(M17)+0.5*N17 -> 30.16 | M17: 22.66 | N17: =1+1+1+1+1+10 -> 15 | O17: =+(P17)+0.5*Q17 -> 44.97 | P17: 27.97 | Q17: =4+6+1+1+1+1+20 -> 34 | R17: =+(S17)+0.5*T17 -> 34.73 | S17: 32.23 | T17: =3+1+1 -> 5 | U17: =+(V17+W17+X17)+0.5*Y17 -> 49.06 | V17: 15.01 | W17: 13.30 | X17: 17.75 | Y17: =1+5 -> 6 | Z17: =+(AA17+AB17)+0.5*AC17 -> 41.64 | AA17: 17.54 | AB17: 22.60 | AC17: =1+1+1 -> 3
A18: 13 | B18: Johnson, Michael | C18: CDP-MM | D18: =+F18+L18+O18+R18+U18+Z18 -> 235.97 | E18: =+K18+N18+Q18+T18+Y18+AC18 -> 81 | F18: =+(G18+H18+I18+J18)+0.5*K18 -> 31.03 | G18: 4.85 | H18: 5.01 | I18: 11.91 | J18: 6.26 | K18: =3+2+1 -> 6 | L18: =+(M18)+0.5*N18 -> 30.33 | M18: 28.83 | N18: =1+1+1 -> 3 | O18: =+(P18)+0.5*Q18 -> 36.73 | P18: 20.73 | Q18: =4+4+1+6+1+5+1+10 -> 32 | R18: =+(S18)+0.5*T18 -> 36.94 | S18: 31.44 | T18: =5+6 -> 11 | U18: =+(V18+W18+X18)+0.5*Y18 -> 57.58 | V18: 13.38 | W18: 14.18 | X18: 26.52 | Y18: =3+4 -> 7 | Z18: =+(AA18+AB18)+0.5*AC18 -> 43.36 | AA18: 17.49 | AB18: 14.87 | AC18: =1+6+2+3+10 -> 22
A19: 14 | B19: Boyer, Steve | C19: SSP-SS | D19: =+F19+L19+O19+R19+U19+Z19 -> 236.55 | E19: =+K19+N19+Q19+T19+Y19+AC19 -> 78 | F19: =+(G19+H19+I19+J19)+0.5*K19 -> 37.76 | G19: 5.99 | H19: 5.74 | I19: 12.04 | J19: 6.49 | K19: =1+10+4 -> 15 | L19: =+(M19)+0.5*N19 -> 40.64 | M19: 32.64 | N19: =1+1+1+2+1+10 -> 16 | O19: =+(P19)+0.5*Q19 -> 38.81 | P19: 28.31 | Q19: =2+1+1+5+6+1+5 -> 21 | R19: =+(S19)+0.5*T19 -> 38.38 | S19: 32.38 | T19: =1+10+1 -> 12 | U19: =+(V19+W19+X19)+0.5*Y19 -> 40.90 | V19: 11.44 | W19: 11.09 | X19: 13.37 | Y19: =6+2+2 -> 10 | Z19: =+(AA19+AB19)+0.5*AC19 -> 40.06 | AA19: 19.19 | AB19: 18.87 | AC19: =1+3 -> 4
A20: 15 | B20: Simpson, Harold | C20: CDP-SS | D20: =+F20+L20+O20+R20+U20+Z20 -> 237.00 | E20: =+K20+N20+Q20+T20+Y20+AC20 -> 74 | F20: =+(G20+H20+I20+J20)+0.5*K20 -> 37.99 | G20: 4.57 | H20: 4.45 | I20: 11.48 | J20: 7.49 | K20: =6+10+4 -> 20 | L20: =+(M20)+0.5*N20 -> 36.99 | M20: 31.99 | N20: =1+1+1+1+3+1+2 -> 10 | O20: =+(P20)+0.5*Q20 -> 41.98 | P20: 31.48 | Q20: =6+2+5+3+2+2+1 -> 21 | R20: =+(S20)+0.5*T20 -> 32.77 | S20: 31.27 | T20: 3 | U20: =+(V20+W20+X20)+0.5*Y20 -> 46.08 | V20: 12.48 | W20: 13.45 | X20: 14.65 | Y20: =2+5+4 -> 11 | Z20: =+(AA20+AB20)+0.5*AC20 -> 41.19 | AA20: 17.80 | AB20: 18.89 | AC20: =3+1+2+2+1 -> 9
A21: 16 | B21: Scott, Michael | C21: CDP-MM | D21: =+F21+L21+O21+R21+U21+Z21 -> 237.21 | E21: =+K21+N21+Q21+T21+Y21+AC21 -> 72 | F21: =+(G21+H21+I21+J21)+0.5*K21 -> 29.49 | G21: 4.05 | H21: 4.56 | I21: 10.90 | J21: 5.48 | K21: =6+1+2 -> 9 | L21: =+(M21)+0.5*N21 -> 34.41 | M21: 28.41 | N21: =5+3+1+1+1+1 -> 12 | O21: =+(P21)+0.5*Q21 -> 42.08 | P21: 32.58 | Q21: =4+1+4+2+5+3 -> 19 | R21: =+(S21)+0.5*T21 -> 43.02 | S21: 37.02 | T21: =1+1+5+5 -> 12 | U21: =+(V21+W21+X21)+0.5*Y21 -> 45.22 | V21: 10.24 | W21: 12.49 | X21: 16.99 | Y21: =5+3+3 -> 11 | Z21: =+(AA21+AB21)+0.5*AC21 -> 42.99 | AA21: 16.29 | AB21: 22.20 | AC21: =2+4+3 -> 9
A22: 17 | B22: Scott, Ryan | C22: SSP-UC | D22: =+F22+L22+O22+R22+U22+Z22 -> 237.62 | E22: =+K22+N22+Q22+T22+Y22+AC22 -> 58 | F22: =+(G22+H22+I22+J22)+0.5*K22 -> 45.38 | G22: 4.17 | H22: 5.78 | I22: 19.62 | J22: 7.31 | K22: =4+8+5 -> 17 | L22: =+(M22)+0.5*N22 -> 36.00 | M22: 27.50 | N22: =1+2+8+1+5 -> 17 | O22: =+(P22)+0.5*Q22 -> 31.17 | P22: 28.17 | Q22: =3+1+1+1 -> 6 | R22: =+(S22)+0.5*T22 -> 34.62 | S22: 29.12 | T22: =6+5 -> 11 | U22: =+(V22+W22+X22)+0.5*Y22 -> 58.98 | V22: 18.88 | W22: 17.87 | X22: 19.23 | Y22: =2+2+2 -> 6 | Z22: =+(AA22+AB22)+0.5*AC22 -> 31.47 | AA22: 16.74 | AB22: 14.23 | AC22: 1
A23: 18 | B23: Brownlee, Mike | C23: SSP-SS | D23: =+F23+L23+O23+R23+U23+Z23 -> 239.80 | E23: =+K23+N23+Q23+T23+Y23+AC23 -> 63 | F23: =+(G23+H23+I23+J23)+0.5*K23 -> 34.86 | G23: 4.86 | H23: 4.84 | I23: 13.02 | J23: 5.14 | K23: =7+3+4 -> 14 | L23: =+(M23)+0.5*N23 -> 34.30 | M23: 31.80 | N23: =1+2+1+1 -> 5 | O23: =+(P23)+0.5*Q23 -> 34.46 | P23: 26.46 | Q23: =1+1+2+5+2+5 -> 16 | R23: =+(S23)+0.5*T23 -> 42.12 | S23: 37.12 | T23: =5+5 -> 10 | U23: =+(V23+W23+X23)+0.5*Y23 -> 50.75 | V23: 17.18 | W23: 12.54 | X23: 15.53 | Y23: =6+1+4 -> 11 | Z23: =+(AA23+AB23)+0.5*AC23 -> 43.31 | AA23: 19.14 | AB23: 20.67 | AC23: =2+2+2+1 -> 7
A24: 19 | B24: Katz, Rick | C24: CDP-MM | D24: =+F24+L24+O24+R24+U24+Z24 -> 248.50 | E24: =+K24+N24+Q24+T24+Y24+AC24 -> 91 | F24: =+(G24+H24+I24+J24)+0.5*K24 -> 35.77 | G24: 5.47 | H24: 5.31 | I24: 12.14 | J24: 5.85 | K24: =6+6+2 -> 14 | L24: =+(M24)+0.5*N24 -> 32.50 | M24: 17.00 | N24: =1+4+1+5+10+10 -> 31 | O24: =+(P24)+0.5*Q24 -> 41.87 | P24: 35.87 | Q24: =4+2+2+1+3 -> 12 | R24: =+(S24)+0.5*T24 -> 42.39 | S24: 34.39 | T24: =1+1+6+5+2+1 -> 16 | U24: =+(V24+W24+X24)+0.5*Y24 -> 51.61 | V24: 20.49 | W24: 12.91 | X24: 14.71 | Y24: =2+3+2 -> 7 | Z24: =+(AA24+AB24)+0.5*AC24 -> 44.36 | AA24: 20.62 | AB24: 18.24 | AC24: =1+2+2+2+1+3 -> 11
A25: 20 | B25: Russell, Ryan | C25: CDP-NV | D25: =+F25+L25+O25+R25+U25+Z25 -> 255.67 | E25: =+K25+N25+Q25+T25+Y25+AC25 -> 77 | F25: =+(G25+H25+I25+J25)+0.5*K25 -> 38.03 | G25: 4.82 | H25: 4.92 | I25: 13.48 | J25: 6.31 | K25: =10+2+5 -> 17 | L25: =+(M25)+0.5*N25 -> 49.37 | M25: 37.87 | N25: =1+3+2+1+6+10 -> 23 | O25: =+(P25)+0.5*Q25 -> 36.34 | P25: 32.34 | Q25: =4+1+1+1+1 -> 8 | R25: =+(S25)+0.5*T25 -> 41.17 | S25: 40.17 | T25: =1+1 -> 2 | U25: =+(V25+W25+X25)+0.5*Y25 -> 48.07 | V25: 11.19 | W25: 13.18 | X25: 14.20 | Y25: =6+9+4 -> 19 | Z25: =+(AA25+AB25)+0.5*AC25 -> 42.69 | AA25: 20.63 | AB25: 18.06 | AC25: =1+1+3+1+2 -> 8
A26: 21 | B26: Kirkham, Glade | C26: CDP-UC | D26: =+F26+L26+O26+R26+U26+Z26 -> 275.13 | E26: =+K26+N26+Q26+T26+Y26+AC26 -> 53 | F26: =+(G26+H26+I26+J26)+0.5*K26 -> 47.49 | G26: 4.94 | H26: 6.05 | I26: 21.11 | J26: 10.89 | K26: =4+5 -> 9 | L26: =+(M26)+0.5*N26 -> 34.69 | M26: 33.19 | N26: =1+1+1 -> 3 | O26: =+(P26)+0.5*Q26 -> 39.14 | P26: 36.14 | Q26: =2+1+1+1+1 -> 6 | R26: =+(S26)+0.5*T26 -> 48.19 | S26: 39.19 | T26: =3+6+6+1+2 -> 18 | U26: =+(V26+W26+X26)+0.5*Y26 -> 62.24 | V26: 14.63 | W26: 18.88 | X26: 22.23 | Y26: =8+1+4 -> 13 | Z26: =+(AA26+AB26)+0.5*AC26 -> 43.38 | AA26: 18.14 | AB26: 23.24 | AC26: =2+1+1 -> 4
A27: 22 | B27: DeLeeuw, Dave | C27: ESP-UC | D27: =+F27+L27+O27+R27+U27+Z27 -> 281.51 | E27: =+K27+N27+Q27+T27+Y27+AC27 -> 93 | F27: =+(G27+H27+I27+J27)+0.5*K27 -> 37.12 | G27: 4.65 | H27: 4.51 | I27: 12.61 | J27: 6.35 | K27: =2+11+5 -> 18 | L27: =+(M27)+0.5*N27 -> 56.32 | M27: 45.82 | N27: =1+20 -> 21 | O27: =+(P27)+0.5*Q27 -> 46.54 | P27: 32.04 | Q27: =6+1+6+5+1+10 -> 29 | R27: =+(S27)+0.5*T27 -> 43.25 | S27: 38.25 | T27: =5+5 -> 10 | U27: =+(V27+W27+X27)+0.5*Y27 -> 53.63 | V27: 15.44 | W27: 17.64 | X27: 18.55 | Y27: =2+2 -> 4 | Z27: =+(AA27+AB27)+0.5*AC27 -> 44.65 | AA27: 21.88 | AB27: 17.27 | AC27: =1+1+5+2+2 -> 11
A28: 23 | B28: Halliday, Mark | C28: CDP-MM | D28: =+F28+L28+O28+R28+U28+Z28 -> 299.05 | E28: =+K28+N28+Q28+T28+Y28+AC28 -> 90 | F28: =+(G28+H28+I28+J28)+0.5*K28 -> 62.20 | G28: 4.51 | H28: 5.10 | I28: 21.46 | J28: 20.63 | K28: =5+11+5 -> 21 | L28: =+(M28)+0.5*N28 -> 39.78 | M28: 30.78 | N28: =2+1+2+2+1+10 -> 18 | O28: =+(P28)+0.5*Q28 -> 38.94 | P28: 33.44 | Q28: =4+1+2+1+2+1 -> 11 | R28: =+(S28)+0.5*T28 -> 39.06 | S28: 33.56 | T28: =1+10 -> 11 | U28: =+(V28+W28+X28)+0.5*Y28 -> 61.71 | V28: 24.54 | W28: 17.15 | X28: 15.02 | Y28: =7+2+1 -> 10 | Z28: =+(AA28+AB28)+0.5*AC28 -> 57.36 | AA28: 17.73 | AB28: 30.13 | AC28: =2+5+2+4+6 -> 19
A29: 24 | B29: Willis, David | C29: CDP-NV | D29: =+F29+L29+O29+R29+U29+Z29 -> 303.53 | E29: =+K29+N29+Q29+T29+Y29+AC29 -> 162 | F29: =+(G29+H29+I29+J29)+0.5*K29 -> 49.22 | G29: 4.34 | H29: 4.86 | I29: 11.63 | J29: 5.89 | K29: =11+19+15 -> 45 | L29: =+(M29)+0.5*N29 -> 41.31 | M29: 30.81 | N29: =1+1+1+8+1+4+4+1 -> 21 | O29: =+(P29)+0.5*Q29 -> 51.15 | P29: 36.65 | Q29: =6+2+1+4+3+3+6+1+3 -> 29 | R29: =+(S29)+0.5*T29 -> 47.70 | S29: 37.20 | T29: =2+1+8+9+1 -> 21 | U29: =+(V29+W29+X29)+0.5*Y29 -> 59.16 | V29: 11.78 | W29: 19.79 | X29: 15.09 | Y29: =14+8+3 -> 25 | Z29: =+(AA29+AB29)+0.5*AC29 -> 54.99 | AA29: 19.96 | AB29: 24.53 | AC29: =1+6+2+4+2+6 -> 21
A30: 25 | B30: Wilkinson, Justin | C30: SSP-UC | D30: =+F30+L30+O30+R30+U30+Z30 -> 334.66 | E30: =+K30+N30+Q30+T30+Y30+AC30 -> 98 | F30: =+(G30+H30+I30+J30)+0.5*K30 -> 66.32 | G30: 5.19 | H30: 9.23 | I30: 13.51 | J30: 15.89 | K30: =16+17+12 -> 45 | L30: =+(M30)+0.5*N30 -> 37.84 | M30: 35.34 | N30: =1+2+1+1 -> 5 | O30: =+(P30)+0.5*Q30 -> 46.32 | P30: 38.32 | Q30: =2+2+3+2+1+6 -> 16 | R30: =+(S30)+0.5*T30 -> 37.22 | S30: 29.72 | T30: =2+1+5+6+1 -> 15 | U30: =+(V30+W30+X30)+0.5*Y30 -> 74.87 | V30: 19.41 | W30: 21.19 | X30: 30.27 | Y30: =2+3+3 -> 8 | Z30: =+(AA30+AB30)+0.5*AC30 -> 72.09 | AA30: 17.51 | AB30: 50.08 | AC30: =1+2+3+1+2 -> 9
A31: 26 | B31: McDermaid, Jen | C31: SSP-NV | D31: =+F31+L31+O31+R31+U31+Z31 -> 356.97 | E31: =+K31+N31+Q31+T31+Y31+AC31 -> 219 | F31: =+(G31+H31+I31+J31)+0.5*K31 -> 50.68 | G31: 4.66 | H31: 5.26 | I31: 14.06 | J31: 7.20 | K31: =13+7+19 -> 39 | L31: =+(M31)+0.5*N31 -> 52.14 | M31: 40.14 | N31: =2+2+5+3+6+1+3+2 -> 24 | O31: =+(P31)+0.5*Q31 -> 54.04 | P31: 35.04 | Q31: =8+1+1+4+10+5+1+5+3 -> 38 | R31: =+(S31)+0.5*T31 -> 70.30 | S31: 44.80 | T31: =1+1+11+4+4+30 -> 51 | U31: =+(V31+W31+X31)+0.5*Y31 -> 64.63 | V31: 13.55 | W31: 17.49 | X31: 16.59 | Y31: =12+11+11 -> 34 | Z31: =+(AA31+AB31)+0.5*AC31 -> 65.18 | AA31: 21.72 | AB31: 26.96 | AC31: =5+2+8+10+8 -> 33
A32: 27 | B32: Boyer, Amie | C32: SSP-NV | D32: =+F32+L32+O32+R32+U32+Z32 -> 383.82 | E32: =+K32+N32+Q32+T32+Y32+AC32 -> 229 | F32: =+(G32+H32+I32+J32)+0.5*K32 -> 62.64 | G32: 8.11 | H32: 8.64 | I32: 23.50 | J32: 7.89 | K32: =5+11+13 -> 29 | L32: =+(M32)+0.5*N32 -> 61.87 | M32: 34.87 | N32: =3+2+4+10+8+2+4+1+20 -> 54 | O32: =+(P32)+0.5*Q32 -> 65.03 | P32: 38.03 | Q32: =2+6+6+6+6+4+1+3+20 -> 54 | R32: =+(S32)+0.5*T32 -> 67.45 | S32: 46.45 | T32: =1+3+9+11+2+6+10 -> 42 | U32: =+(V32+W32+X32)+0.5*Y32 -> 67.56 | V32: 15.81 | W32: 16.93 | X32: 17.32 | Y32: =9+17+9 -> 35 | Z32: =+(AA32+AB32)+0.5*AC32 -> 59.27 | AA32: 26.22 | AB32: 25.55 | AC32: =7+4+1+1+2 -> 15
A33: 28 | B33: Kirkham, Devon (.22) | C33: .22-N/C | D33: =+F33+L33+O33+R33+U33+Z33 -> 388.22 | E33: =+K33+N33+Q33+T33+Y33+AC33 -> 126 | F33: =+(G33+H33+I33+J33)+0.5*K33 -> 52.35 | G33: 8.15 | H33: 7.40 | I33: 18.20 | J33: 10.60 | K33: =5+4+7 -> 16 | L33: =+(M33)+0.5*N33 -> 67.99 | M33: 53.49 | N33: =3+4+4+3+1+2+1+1+10 -> 29 | O33: =+(P33)+0.5*Q33 -> 55.30 | P33: 35.30 | Q33: =1+1+4+3+1+1+6+1+2+20 -> 40 | R33: =+(S33)+0.5*T33 -> 61.08 | S33: 49.08 | T33: =4+2+7+7+1+1+2 -> 24 | U33: =+(V33+W33+X33)+0.5*Y33 -> 82.29 | V33: 22.12 | W33: 26.21 | X33: 29.46 | Y33: =6+1+2 -> 9 | Z33: =+(AA33+AB33)+0.5*AC33 -> 69.21 | AA33: 24.35 | AB33: 40.86 | AC33: =1+2+2+1+2 -> 8
A34: 29 | B34: Boyer, Sara | C34: .22-N/C | D34: =+F34+L34+O34+R34+U34+Z34 -> 483.11 | E34: =+K34+N34+Q34+T34+Y34+AC34 -> 213 | F34: =+(G34+H34+I34+J34)+0.5*K34 -> 83.92 | G34: 9.00 | H34: 14.90 | I34: 25.95 | J34: 8.57 | K34: =15+15+21 -> 51 | L34: =+(M34)+0.5*N34 -> 71.32 | M34: 44.32 | N34: =6+10+2+10+6+5+5+10 -> 54 | O34: =+(P34)+0.5*Q34 -> 93.93 | P34: 72.43 | Q34: =2+4+10+2+2+4+4+5+10 -> 43 | R34: =+(S34)+0.5*T34 -> 94.81 | S34: 80.31 | T34: =8+4+5+6+4+1+1 -> 29 | U34: =+(V34+W34+X34)+0.5*Y34 -> 66.38 | V34: 23.17 | W34: 17.10 | X34: 18.61 | Y34: =2+7+6 -> 15 | Z34: =+(AA34+AB34)+0.5*AC34 -> 72.75 | AA34: 30.50 | AB34: 31.75 | AC34: =1+5+2+8+5 -> 21
A35: 26 | B35: Rodriquez, Mike | C35: CDP-MM | D35: DNF | E35: =+K35+N35+Q35+T35+Y35+AC35 -> 0 | F35: =+(G35+#REF!)+0.5*K35 -> #REF! | L35: =+(M35)+0.5*N35 -> 0.00 | O35: =+(P35+#REF!)+0.5*Q35 -> #REF! | R35: =+(S35+#REF!+#REF!)+0.5*T35 -> #REF! | U35: =+(V35)+0.5*Y35 -> 0.00 | Z35: =+(AA35+AB35)+0.5*AC35 -> 0.00
A36: Notes:
A37: xx | B37: Indicates that the Points Down value includes some kind of penalty (Procedural Error, Hits on Non-Threat or Failure to Neutralize).
A38: PD | B38: = Points Down value is PD x .5 seconds added to the total stage time.
A39: xx | B39: Indicates that the Points Down value includes some kind of penalty (Procedural Error, Hits on Non-Threat or Failure to Neutralize).
A40: DNF | B40: = Did Not Finish
A41: NS | B41: = No Score
B42: Div/Class Information:
A43: - | B43: Division: CDP = Custom Defense Pistol; ESP = Enhanced Service Pistol; SSP = Stock Service Pistol; SSR = Stock Service Revolver
A44: - | B44: Classification: MA = Master; EX = Expert; SS = Sharpshooter; MM = Marksman; NV = Novice; UC = Unclassified
B45: .22-N/C = Shooter used a non IDPA firearm and was not placed in an IDPA Div/Class.