B2: UDPL Night-Shoot Match Results for July 24, 2004
B3: Sorted by Time without regard to Div/Class | H3: Click on the Stage # to view the COF. | AF3: PAR Time
A4: Place | B4: Name | C4: (Div-Class) | D4: Shoot Total | E4: Total PD | F4: Stage 1 | G4: String 1 | H4: String 2 | I4: String 3 | J4: PD | K4: Stage 2 | L4: String 1 | M4: String 2 | N4: String 3 | O4: PD | P4: Stage 3 | Q4: String 1 | R4: String 2 | S4: String 3 | T4: PD | U4: Stage 4 | V4: String 1 | W4: String 2 | X4: String 3 | Y4: PD | Z4: Stage 5 | AA4: String 1 | AB4: String 2 | AC4: String 3 | AD4: PD | AE4: Stage 6 | AF4: String 1 | AG4: PD
A5: 1 | B5: Theodore, Ari | C5: WM | D5: =+F5+K5+P5+U5+Z5+AE5 -> 75.62 | E5: =+J5+O5+T5+Y5+AD5+AG5 -> 5 | F5: =+(G5+H5+I5)+0.5*J5 -> 34.18 | G5: 10.04 | H5: 10.33 | I5: 13.81 | J5: 0 | K5: =+(L5+M5+N5)+0.5*O5 -> 11.10 | L5: 3.79 | M5: 3.49 | N5: 3.82 | O5: 0 | P5: =+(Q5+R5+S5)+0.5*T5 -> 10.90 | Q5: 3.25 | R5: 3.21 | S5: 3.44 | T5: 2 | U5: =+(V5+W5+X5)+0.5*Y5 -> 8.67 | V5: 3.01 | W5: 2.99 | X5: 2.67 | Y5: 0 | Z5: =+(AA5+AB5+AC5)+0.5*AD5 -> 10.77 | AA5: 2.85 | AB5: 3.42 | AC5: 3.00 | AD5: 3 | AE5: =+(AF5)+0.5*AG5 -> 0.00 | AF5: 0.00 | AG5: 0
A6: 2 | B6: Outzen, Craig | C6: WM | D6: =+F6+K6+P6+U6+Z6+AE6 -> 87.79 | E6: =+J6+O6+T6+Y6+AD6+AG6 -> 12 | F6: =+(G6+H6+I6)+0.5*J6 -> 34.31 | G6: 12.31 | H6: 11.38 | I6: 10.62 | J6: 0 | K6: =+(L6+M6+N6)+0.5*O6 -> 13.52 | L6: 3.91 | M6: 3.52 | N6: 4.09 | O6: 4 | P6: =+(Q6+R6+S6)+0.5*T6 -> 14.11 | Q6: 6.43 | R6: 3.91 | S6: 3.77 | T6: 0 | U6: =+(V6+W6+X6)+0.5*Y6 -> 13.06 | V6: 3.94 | W6: 3.52 | X6: 3.60 | Y6: 4 | Z6: =+(AA6+AB6+AC6)+0.5*AD6 -> 12.79 | AA6: 3.35 | AB6: 3.82 | AC6: 3.62 | AD6: 4 | AE6: =+(AF6)+0.5*AG6 -> 0.00 | AF6: 0.00 | AG6: 0
A7: 3 | B7: Lowe, John | C7: WM | D7: =+F7+K7+P7+U7+Z7+AE7 -> 98.26 | E7: =+J7+O7+T7+Y7+AD7+AG7 -> 8 | F7: =+(G7+H7+I7)+0.5*J7 -> 43.46 | G7: 17.27 | H7: 13.21 | I7: 12.98 | J7: 0 | K7: =+(L7+M7+N7)+0.5*O7 -> 14.89 | L7: 4.64 | M7: 4.66 | N7: 4.59 | O7: 2 | P7: =+(Q7+R7+S7)+0.5*T7 -> 16.82 | Q7: 5.54 | R7: 5.48 | S7: 5.30 | T7: 1 | U7: =+(V7+W7+X7)+0.5*Y7 -> 11.01 | V7: 3.53 | W7: 3.14 | X7: 3.34 | Y7: 2 | Z7: =+(AA7+AB7+AC7)+0.5*AD7 -> 12.08 | AA7: 3.74 | AB7: 3.39 | AC7: 3.45 | AD7: 3 | AE7: =+(AF7)+0.5*AG7 -> 0.00 | AF7: 0.00 | AG7: 0
A8: 4 | B8: Zaccardi, Pat | C8: WM | D8: =+F8+K8+P8+U8+Z8+AE8 -> 100.16 | E8: =+J8+O8+T8+Y8+AD8+AG8 -> 24 | F8: =+(G8+H8+I8)+0.5*J8 -> 38.25 | G8: 10.94 | H8: 17.26 | I8: 10.05 | J8: 0 | K8: =+(L8+M8+N8)+0.5*O8 -> 15.62 | L8: 7.40 | M8: 4.04 | N8: 3.68 | O8: 1 | P8: =+(Q8+R8+S8)+0.5*T8 -> 15.83 | Q8: 5.84 | R8: 4.43 | S8: 5.06 | T8: 1 | U8: =+(V8+W8+X8)+0.5*Y8 -> 10.81 | V8: 3.13 | W8: 3.01 | X8: 3.17 | Y8: 3 | Z8: =+(AA8+AB8+AC8)+0.5*AD8 -> 19.65 | AA8: 3.66 | AB8: 3.31 | AC8: 3.18 | AD8: 19 | AE8: =+(AF8)+0.5*AG8 -> 0.00 | AF8: 0.00 | AG8: 0
A9: 5 | B9: Anderson, Welden | C9: WM | D9: =+F9+K9+P9+U9+Z9+AE9 -> 101.15 | E9: =+J9+O9+T9+Y9+AD9+AG9 -> 18 | F9: =+(G9+H9+I9)+0.5*J9 -> 41.12 | G9: 15.14 | H9: 13.73 | I9: 12.25 | J9: 0 | K9: =+(L9+M9+N9)+0.5*O9 -> 14.08 | L9: 4.34 | M9: 3.89 | N9: 3.35 | O9: 5 | P9: =+(Q9+R9+S9)+0.5*T9 -> 14.27 | Q9: 3.78 | R9: 3.67 | S9: 3.82 | T9: 6 | U9: =+(V9+W9+X9)+0.5*Y9 -> 17.85 | V9: 7.59 | W9: 4.34 | X9: 4.42 | Y9: 3 | Z9: =+(AA9+AB9+AC9)+0.5*AD9 -> 13.83 | AA9: 4.15 | AB9: 4.09 | AC9: 3.59 | AD9: 4 | AE9: =+(AF9)+0.5*AG9 -> 0.00 | AF9: 0.00 | AG9: 0
A10: 6 | B10: Correia, Larry | C10: HH | D10: =+F10+K10+P10+U10+Z10+AE10 -> 113.08 | E10: =+J10+O10+T10+Y10+AD10+AG10 -> 26 | F10: =+(G10+H10+I10)+0.5*J10 -> 43.79 | G10: 16.62 | H10: 13.57 | I10: 13.60 | J10: 0 | K10: =+(L10+M10+N10)+0.5*O10 -> 19.99 | L10: 7.42 | M10: 4.41 | N10: 7.66 | O10: 1 | P10: =+(Q10+R10+S10)+0.5*T10 -> 18.93 | Q10: 4.76 | R10: 5.46 | S10: 7.21 | T10: 3 | U10: =+(V10+W10+X10)+0.5*Y10 -> 12.52 | V10: 3.30 | W10: 3.14 | X10: 2.58 | Y10: 7 | Z10: =+(AA10+AB10+AC10)+0.5*AD10 -> 12.85 | AA10: 3.39 | AB10: 3.61 | AC10: 3.35 | AD10: 5 | AE10: =+(AF10)+0.5*AG10 -> 5.00 | AF10: 0.00 | AG10: 10
A11: 7 | B11: Ostler, Jeff | C11: WM | D11: =+F11+K11+P11+U11+Z11+AE11 -> 117.10 | E11: =+J11+O11+T11+Y11+AD11+AG11 -> 35 | F11: =+(G11+H11+I11)+0.5*J11 -> 39.92 | G11: 15.61 | H11: 9.86 | I11: 11.45 | J11: 6 | K11: =+(L11+M11+N11)+0.5*O11 -> 17.38 | L11: 5.61 | M11: 5.81 | N11: 4.96 | O11: 2 | P11: =+(Q11+R11+S11)+0.5*T11 -> 30.11 | Q11: 6.65 | R11: 6.53 | S11: 6.43 | T11: 21 | U11: =+(V11+W11+X11)+0.5*Y11 -> 16.42 | V11: 8.50 | W11: 4.17 | X11: 3.25 | Y11: 1 | Z11: =+(AA11+AB11+AC11)+0.5*AD11 -> 13.27 | AA11: 4.08 | AB11: 3.20 | AC11: 3.49 | AD11: 5 | AE11: =+(AF11)+0.5*AG11 -> 0.00 | AF11: 0.00 | AG11: 0
A12: 8 | B12: Zaccardi, Juke | C12: WM | D12: =+F12+K12+P12+U12+Z12+AE12 -> 130.43 | E12: =+J12+O12+T12+Y12+AD12+AG12 -> 26 | F12: =+(G12+H12+I12)+0.5*J12 -> 56.90 | G12: 18.75 | H12: 19.30 | I12: 18.85 | J12: 0 | K12: =+(L12+M12+N12)+0.5*O12 -> 24.28 | L12: 10.94 | M12: 8.07 | N12: 5.27 | O12: 0 | P12: =+(Q12+R12+S12)+0.5*T12 -> 21.69 | Q12: 3.38 | R12: 4.10 | S12: 3.21 | T12: 22 | U12: =+(V12+W12+X12)+0.5*Y12 -> 15.00 | V12: 4.83 | W12: 4.86 | X12: 4.81 | Y12: 1 | Z12: =+(AA12+AB12+AC12)+0.5*AD12 -> 12.56 | AA12: 3.87 | AB12: 3.75 | AC12: 3.44 | AD12: 3 | AE12: =+(AF12)+0.5*AG12 -> 0.00 | AF12: 0.00 | AG12: 0
A13: 9 | B13: Latham, Corey | C13: HH | D13: =+F13+K13+P13+U13+Z13+AE13 -> 138.31 | E13: =+J13+O13+T13+Y13+AD13+AG13 -> 36 | F13: =+(G13+H13+I13)+0.5*J13 -> 75.97 | G13: 21.60 | H13: 15.41 | I13: 33.96 | J13: 10 | K13: =+(L13+M13+N13)+0.5*O13 -> 23.09 | L13: 4.14 | M13: 3.71 | N13: 4.24 | O13: 22 | P13: =+(Q13+R13+S13)+0.5*T13 -> 16.20 | Q13: 5.57 | R13: 5.27 | S13: 4.86 | T13: 1 | U13: =+(V13+W13+X13)+0.5*Y13 -> 11.39 | V13: 3.57 | W13: 3.69 | X13: 3.63 | Y13: 1 | Z13: =+(AA13+AB13+AC13)+0.5*AD13 -> 11.66 | AA13: 3.57 | AB13: 3.50 | AC13: 3.59 | AD13: 2 | AE13: =+(AF13)+0.5*AG13 -> 0.00 | AF13: 0.00 | AG13: 0
A14: 10 | B14: Wolf, Doug | C14: HH | D14: =+F14+K14+P14+U14+Z14+AE14 -> 140.37 | E14: =+J14+O14+T14+Y14+AD14+AG14 -> 23 | F14: =+(G14+H14+I14)+0.5*J14 -> 64.30 | G14: 19.71 | H14: 18.55 | I14: 21.04 | J14: 10 | K14: =+(L14+M14+N14)+0.5*O14 -> 20.07 | L14: 6.55 | M14: 6.26 | N14: 5.76 | O14: 3 | P14: =+(Q14+R14+S14)+0.5*T14 -> 22.84 | Q14: 6.99 | R14: 6.85 | S14: 7.00 | T14: 4 | U14: =+(V14+W14+X14)+0.5*Y14 -> 17.33 | V14: 5.75 | W14: 5.10 | X14: 4.98 | Y14: 3 | Z14: =+(AA14+AB14+AC14)+0.5*AD14 -> 15.83 | AA14: 5.18 | AB14: 4.55 | AC14: 4.60 | AD14: 3 | AE14: =+(AF14)+0.5*AG14 -> 0.00 | AF14: 0.00 | AG14: 0
A15: 11 | B15: Huff, Blake | C15: HH | D15: =+F15+K15+P15+U15+Z15+AE15 -> 141.08 | E15: =+J15+O15+T15+Y15+AD15+AG15 -> 26 | F15: =+(G15+H15+I15)+0.5*J15 -> 74.74 | G15: 19.72 | H15: 24.96 | I15: 20.06 | J15: 20 | K15: =+(L15+M15+N15)+0.5*O15 -> 17.63 | L15: 5.59 | M15: 6.25 | N15: 4.79 | O15: 2 | P15: =+(Q15+R15+S15)+0.5*T15 -> 19.38 | Q15: 5.06 | R15: 4.66 | S15: 9.66 | T15: 0 | U15: =+(V15+W15+X15)+0.5*Y15 -> 13.17 | V15: 5.56 | W15: 4.09 | X15: 3.52 | Y15: 0 | Z15: =+(AA15+AB15+AC15)+0.5*AD15 -> 15.66 | AA15: 4.52 | AB15: 4.43 | AC15: 5.21 | AD15: 3 | AE15: =+(AF15)+0.5*AG15 -> 0.50 | AF15: 0.00 | AG15: 1
A16: 12 | B16: Spicer, Richard | C16: WM | D16: =+F16+K16+P16+U16+Z16+AE16 -> 145.86 | E16: =+J16+O16+T16+Y16+AD16+AG16 -> 72 | F16: =+(G16+H16+I16)+0.5*J16 -> 67.11 | G16: 18.46 | H16: 17.54 | I16: 16.11 | J16: 30 | K16: =+(L16+M16+N16)+0.5*O16 -> 20.15 | L16: 6.12 | M16: 5.63 | N16: 4.90 | O16: 7 | P16: =+(Q16+R16+S16)+0.5*T16 -> 15.83 | Q16: 5.39 | R16: 4.60 | S16: 4.84 | T16: 2 | U16: =+(V16+W16+X16)+0.5*Y16 -> 21.43 | V16: 3.04 | W16: 2.89 | X16: 3.00 | Y16: 25 | Z16: =+(AA16+AB16+AC16)+0.5*AD16 -> 21.34 | AA16: 3.50 | AB16: 3.71 | AC16: 10.13 | AD16: 8 | AE16: =+(AF16)+0.5*AG16 -> 0.00 | AF16: 0.00 | AG16: 0
A17: 13 | B17: Spicer, Robert | C17: WM | D17: =+F17+K17+P17+U17+Z17+AE17 -> 146.51 | E17: =+J17+O17+T17+Y17+AD17+AG17 -> 88 | F17: =+(G17+H17+I17)+0.5*J17 -> 61.93 | G17: 19.26 | H17: 20.74 | I17: 16.93 | J17: 10 | K17: =+(L17+M17+N17)+0.5*O17 -> 16.78 | L17: 4.91 | M17: 4.10 | N17: 4.27 | O17: 7 | P17: =+(Q17+R17+S17)+0.5*T17 -> 30.14 | Q17: 4.21 | R17: 4.27 | S17: 3.66 | T17: 36 | U17: =+(V17+W17+X17)+0.5*Y17 -> 15.38 | V17: 2.89 | W17: 4.30 | X17: 2.69 | Y17: 11 | Z17: =+(AA17+AB17+AC17)+0.5*AD17 -> 22.28 | AA17: 3.43 | AB17: 2.94 | AC17: 3.91 | AD17: 24 | AE17: =+(AF17)+0.5*AG17 -> 0.00 | AF17: 0.00 | AG17: 0
A18: 14 | B18: Collins, Ken | C18: HH | D18: =+F18+K18+P18+U18+Z18+AE18 -> 147.13 | E18: =+J18+O18+T18+Y18+AD18+AG18 -> 7 | F18: =+(G18+H18+I18)+0.5*J18 -> 61.89 | G18: 24.89 | H18: 17.46 | I18: 19.54 | J18: 0 | K18: =+(L18+M18+N18)+0.5*O18 -> 31.72 | L18: 12.75 | M18: 11.67 | N18: 6.80 | O18: 1 | P18: =+(Q18+R18+S18)+0.5*T18 -> 25.69 | Q18: 7.51 | R18: 9.41 | S18: 8.77 | T18: 0 | U18: =+(V18+W18+X18)+0.5*Y18 -> 14.38 | V18: 4.68 | W18: 4.27 | X18: 3.93 | Y18: 3 | Z18: =+(AA18+AB18+AC18)+0.5*AD18 -> 13.45 | AA18: 4.38 | AB18: 3.54 | AC18: 4.03 | AD18: 3 | AE18: =+(AF18)+0.5*AG18 -> 0.00 | AF18: 0.00 | AG18: 0
A19: 15 | B19: Pagano, Kevin | C19: HH | D19: =+F19+K19+P19+U19+Z19+AE19 -> 154.70 | E19: =+J19+O19+T19+Y19+AD19+AG19 -> 45 | F19: =+(G19+H19+I19)+0.5*J19 -> 57.93 | G19: 19.86 | H19: 16.14 | I19: 21.93 | J19: 0 | K19: =+(L19+M19+N19)+0.5*O19 -> 17.74 | L19: 7.20 | M19: 5.07 | N19: 4.47 | O19: 2 | P19: =+(Q19+R19+S19)+0.5*T19 -> 21.29 | Q19: 6.55 | R19: 6.32 | S19: 6.42 | T19: 4 | U19: =+(V19+W19+X19)+0.5*Y19 -> 24.09 | V19: 7.03 | W19: 9.62 | X19: 4.44 | Y19: 6 | Z19: =+(AA19+AB19+AC19)+0.5*AD19 -> 33.65 | AA19: 3.92 | AB19: 6.23 | AC19: 7.00 | AD19: 33 | AE19: =+(AF19)+0.5*AG19 -> 0.00 | AF19: 0.00 | AG19: 0
A20: 16 | B20: Eddy, Nephi | C20: HH | D20: =+F20+K20+P20+U20+Z20+AE20 -> 154.81 | E20: =+J20+O20+T20+Y20+AD20+AG20 -> 66 | F20: =+(G20+H20+I20)+0.5*J20 -> 67.89 | G20: 16.46 | H20: 20.46 | I20: 20.97 | J20: 20 | K20: =+(L20+M20+N20)+0.5*O20 -> 18.99 | L20: 6.54 | M20: 5.63 | N20: 5.32 | O20: 3 | P20: =+(Q20+R20+S20)+0.5*T20 -> 17.93 | Q20: 6.72 | R20: 5.56 | S20: 5.65 | T20: 0 | U20: =+(V20+W20+X20)+0.5*Y20 -> 18.90 | V20: 4.77 | W20: 4.95 | X20: 4.68 | Y20: 9 | Z20: =+(AA20+AB20+AC20)+0.5*AD20 -> 30.60 | AA20: 5.00 | AB20: 4.22 | AC20: 4.88 | AD20: 33 | AE20: =+(AF20)+0.5*AG20 -> 0.50 | AF20: 0.00 | AG20: 1
A21: 17 | B21: Montgomery, Robert | C21: HH | D21: =+F21+K21+P21+U21+Z21+AE21 -> 163.06 | E21: =+J21+O21+T21+Y21+AD21+AG21 -> 9 | F21: =+(G21+H21+I21)+0.5*J21 -> 80.87 | G21: 33.83 | H21: 23.14 | I21: 23.90 | J21: 0 | K21: =+(L21+M21+N21)+0.5*O21 -> 25.17 | L21: 8.08 | M21: 8.27 | N21: 7.32 | O21: 3 | P21: =+(Q21+R21+S21)+0.5*T21 -> 25.06 | Q21: 7.60 | R21: 7.98 | S21: 7.98 | T21: 3 | U21: =+(V21+W21+X21)+0.5*Y21 -> 13.69 | V21: 4.68 | W21: 4.63 | X21: 4.38 | Y21: 0 | Z21: =+(AA21+AB21+AC21)+0.5*AD21 -> 18.27 | AA21: 5.07 | AB21: 5.75 | AC21: 5.95 | AD21: 3 | AE21: =+(AF21)+0.5*AG21 -> 0.00 | AF21: 0.00 | AG21: 0
A22: 18 | B22: Brown, Keith | C22: HH | D22: =+F22+K22+P22+U22+Z22+AE22 -> 166.59 | E22: =+J22+O22+T22+Y22+AD22+AG22 -> 6 | F22: =+(G22+H22+I22)+0.5*J22 -> 83.64 | G22: 30.19 | H22: 25.62 | I22: 27.83 | J22: 0 | K22: =+(L22+M22+N22)+0.5*O22 -> 19.78 | L22: 6.16 | M22: 8.56 | N22: 5.06 | O22: 0 | P22: =+(Q22+R22+S22)+0.5*T22 -> 22.07 | Q22: 8.31 | R22: 6.42 | S22: 7.34 | T22: 0 | U22: =+(V22+W22+X22)+0.5*Y22 -> 21.20 | V22: 7.37 | W22: 6.65 | X22: 6.68 | Y22: 1 | Z22: =+(AA22+AB22+AC22)+0.5*AD22 -> 19.40 | AA22: 5.30 | AB22: 5.99 | AC22: 6.11 | AD22: 4 | AE22: =+(AF22)+0.5*AG22 -> 0.50 | AF22: 0.00 | AG22: 1
A23: 19 | B23: Kirkham, Glade | C23: HH | D23: =+F23+K23+P23+U23+Z23+AE23 -> 176.22 | E23: =+J23+O23+T23+Y23+AD23+AG23 -> 20 | F23: =+(G23+H23+I23)+0.5*J23 -> 68.85 | G23: 26.05 | H23: 22.95 | I23: 15.35 | J23: 9 | K23: =+(L23+M23+N23)+0.5*O23 -> 27.13 | L23: 7.78 | M23: 8.92 | N23: 7.93 | O23: 5 | P23: =+(Q23+R23+S23)+0.5*T23 -> 29.93 | Q23: 10.29 | R23: 7.72 | S23: 9.92 | T23: 4 | U23: =+(V23+W23+X23)+0.5*Y23 -> 18.91 | V23: 6.66 | W23: 5.30 | X23: 5.95 | Y23: 2 | Z23: =+(AA23+AB23+AC23)+0.5*AD23 -> 31.40 | AA23: 11.85 | AB23: 12.19 | AC23: 7.36 | AD23: 0 | AE23: =+(AF23)+0.5*AG23 -> 0.00 | AF23: 0.00 | AG23: 0
A24: 20 | B24: Wong, Hang | C24: WM | D24: =+F24+K24+P24+U24+Z24+AE24 -> 176.64 | E24: =+J24+O24+T24+Y24+AD24+AG24 -> 39 | F24: =+(G24+H24+I24)+0.5*J24 -> 48.09 | G24: 16.78 | H24: 15.44 | I24: 15.87 | J24: 0 | K24: =+(L24+M24+N24)+0.5*O24 -> 33.61 | L24: 11.22 | M24: 7.98 | N24: 8.91 | O24: 11 | P24: =+(Q24+R24+S24)+0.5*T24 -> 35.58 | Q24: 13.99 | R24: 10.80 | S24: 10.29 | T24: 1 | U24: =+(V24+W24+X24)+0.5*Y24 -> 19.89 | V24: 5.82 | W24: 6.03 | X24: 6.04 | Y24: 4 | Z24: =+(AA24+AB24+AC24)+0.5*AD24 -> 39.47 | AA24: 10.86 | AB24: 8.28 | AC24: 8.83 | AD24: 23 | AE24: =+(AF24)+0.5*AG24 -> 0.00 | AF24: 0.00 | AG24: 0
A25: 21 | B25: Brownlee, Mike | C25: HH | D25: =+F25+K25+P25+U25+Z25+AE25 -> 177.26 | E25: =+J25+O25+T25+Y25+AD25+AG25 -> 87 | F25: =+(G25+H25+I25)+0.5*J25 -> 95.20 | G25: 21.91 | H25: 20.20 | I25: 18.09 | J25: 70 | K25: =+(L25+M25+N25)+0.5*O25 -> 21.34 | L25: 7.41 | M25: 6.81 | N25: 6.62 | O25: 1 | P25: =+(Q25+R25+S25)+0.5*T25 -> 21.40 | Q25: 7.98 | R25: 6.59 | S25: 6.33 | T25: 1 | U25: =+(V25+W25+X25)+0.5*Y25 -> 21.12 | V25: 5.20 | W25: 5.18 | X25: 5.24 | Y25: 11 | Z25: =+(AA25+AB25+AC25)+0.5*AD25 -> 17.70 | AA25: 6.63 | AB25: 4.94 | AC25: 4.63 | AD25: 3 | AE25: =+(AF25)+0.5*AG25 -> 0.50 | AF25: 0.00 | AG25: 1
A26: 22 | B26: Knapp, Chris | C26: HH | D26: =+F26+K26+P26+U26+Z26+AE26 -> 178.57 | E26: =+J26+O26+T26+Y26+AD26+AG26 -> 61 | F26: =+(G26+H26+I26)+0.5*J26 -> 94.46 | G26: 27.68 | H26: 25.66 | I26: 21.12 | J26: 40 | K26: =+(L26+M26+N26)+0.5*O26 -> 26.31 | L26: 6.78 | M26: 6.36 | N26: 7.17 | O26: 12 | P26: =+(Q26+R26+S26)+0.5*T26 -> 24.18 | Q26: 7.87 | R26: 8.00 | S26: 7.31 | T26: 2 | U26: =+(V26+W26+X26)+0.5*Y26 -> 17.22 | V26: 5.23 | W26: 4.84 | X26: 4.65 | Y26: 5 | Z26: =+(AA26+AB26+AC26)+0.5*AD26 -> 16.40 | AA26: 5.35 | AB26: 5.11 | AC26: 4.94 | AD26: 2 | AE26: =+(AF26)+0.5*AG26 -> 0.00 | AF26: 0.00 | AG26: 0
A27: 23 | B27: Young, Ren | C27: HH | D27: =+F27+K27+P27+U27+Z27+AE27 -> 187.98 | E27: =+J27+O27+T27+Y27+AD27+AG27 -> 22 | F27: =+(G27+H27+I27)+0.5*J27 -> 63.70 | G27: 16.10 | H27: 20.71 | I27: 23.89 | J27: 6 | K27: =+(L27+M27+N27)+0.5*O27 -> 29.57 | L27: 6.99 | M27: 14.44 | N27: 7.14 | O27: 2 | P27: =+(Q27+R27+S27)+0.5*T27 -> 30.33 | Q27: 10.79 | R27: 10.06 | S27: 9.48 | T27: 0 | U27: =+(V27+W27+X27)+0.5*Y27 -> 22.93 | V27: 5.74 | W27: 5.08 | X27: 8.11 | Y27: 8 | Z27: =+(AA27+AB27+AC27)+0.5*AD27 -> 41.45 | AA27: 8.91 | AB27: 21.65 | AC27: 7.89 | AD27: 6 | AE27: =+(AF27)+0.5*AG27 -> 0.00 | AF27: 0.00 | AG27: 0
A28: 24 | B28: Phillips RDan | C28: HH | D28: =+F28+K28+P28+U28+Z28+AE28 -> 194.82 | E28: =+J28+O28+T28+Y28+AD28+AG28 -> 3 | F28: =+(G28+H28+I28)+0.5*J28 -> 97.87 | G28: 42.43 | H28: 26.68 | I28: 28.76 | J28: 0 | K28: =+(L28+M28+N28)+0.5*O28 -> 24.37 | L28: 8.81 | M28: 8.22 | N28: 6.84 | O28: 1 | P28: =+(Q28+R28+S28)+0.5*T28 -> 24.54 | Q28: 7.62 | R28: 7.86 | S28: 9.06 | T28: 0 | U28: =+(V28+W28+X28)+0.5*Y28 -> 22.70 | V28: 6.38 | W28: 8.11 | X28: 8.21 | Y28: 0 | Z28: =+(AA28+AB28+AC28)+0.5*AD28 -> 24.84 | AA28: 7.21 | AB28: 8.51 | AC28: 8.62 | AD28: 1 | AE28: =+(AF28)+0.5*AG28 -> 0.50 | AF28: 0.00 | AG28: 1
A29: 25 | B29: Rodriquez, Mike | C29: HH | D29: =+F29+K29+P29+U29+Z29+AE29 -> 211.65 | E29: =+J29+O29+T29+Y29+AD29+AG29 -> 86 | F29: =+(G29+H29+I29)+0.5*J29 -> 97.24 | G29: 30.97 | H29: 32.81 | I29: 33.46 | J29: 0 | K29: =+(L29+M29+N29)+0.5*O29 -> 23.82 | L29: 7.46 | M29: 6.91 | N29: 6.45 | O29: 6 | P29: =+(Q29+R29+S29)+0.5*T29 -> 24.92 | Q29: 7.05 | R29: 7.51 | S29: 6.86 | T29: 7 | U29: =+(V29+W29+X29)+0.5*Y29 -> 29.81 | V29: 4.49 | W29: 4.36 | X29: 4.46 | Y29: 33 | Z29: =+(AA29+AB29+AC29)+0.5*AD29 -> 35.86 | AA29: 4.88 | AB29: 5.69 | AC29: 5.29 | AD29: 40 | AE29: =+(AF29)+0.5*AG29 -> 0.00 | AF29: 0.00 | AG29: 0
A30: 26 | B30: Kirkham, Devon | C30: HH | D30: =+F30+K30+P30+U30+Z30+AE30 -> 211.88 | E30: =+J30+O30+T30+Y30+AD30+AG30 -> 82 | F30: =+(G30+H30+I30)+0.5*J30 -> 60.89 | G30: 22.21 | H30: 20.78 | I30: 17.90 | J30: 0 | K30: =+(L30+M30+N30)+0.5*O30 -> 26.20 | L30: 7.43 | M30: 6.53 | N30: 6.74 | O30: 11 | P30: =+(Q30+R30+S30)+0.5*T30 -> 41.85 | Q30: 15.69 | R30: 11.74 | S30: 12.42 | T30: 4 | U30: =+(V30+W30+X30)+0.5*Y30 -> 24.60 | V30: 6.16 | W30: 6.00 | X30: 6.44 | Y30: 12 | Z30: =+(AA30+AB30+AC30)+0.5*AD30 -> 58.34 | AA30: 18.84 | AB30: 6.84 | AC30: 5.16 | AD30: 55 | AE30: =+(AF30)+0.5*AG30 -> 0.00 | AF30: 0.00 | AG30: 0
A31: 27 | B31: Boyer, Steve | C31: HH | D31: =+F31+K31+P31+U31+Z31+AE31 -> 213.05 | E31: =+J31+O31+T31+Y31+AD31+AG31 -> 87 | F31: =+(G31+H31+I31)+0.5*J31 -> 107.05 | G31: 28.02 | H31: 32.12 | I31: 21.91 | J31: 50 | K31: =+(L31+M31+N31)+0.5*O31 -> 25.28 | L31: 10.17 | M31: 7.63 | N31: 6.98 | O31: 1 | P31: =+(Q31+R31+S31)+0.5*T31 -> 27.19 | Q31: 12.65 | R31: 7.80 | S31: 6.74 | T31: 0 | U31: =+(V31+W31+X31)+0.5*Y31 -> 19.82 | V31: 7.17 | W31: 5.17 | X31: 4.48 | Y31: 6 | Z31: =+(AA31+AB31+AC31)+0.5*AD31 -> 33.71 | AA31: 7.96 | AB31: 5.50 | AC31: 5.25 | AD31: 30 | AE31: =+(AF31)+0.5*AG31 -> 0.00 | AF31: 0.00 | AG31: 0
A32: 28 | B32: Simpson, Harold | C32: HH | D32: =+F32+K32+P32+U32+Z32+AE32 -> 239.83 | E32: =+J32+O32+T32+Y32+AD32+AG32 -> 24 | F32: =+(G32+H32+I32)+0.5*J32 -> 135.56 | G32: 63.69 | H32: 44.09 | I32: 27.78 | J32: 0 | K32: =+(L32+M32+N32)+0.5*O32 -> 27.07 | L32: 8.46 | M32: 8.37 | N32: 9.24 | O32: 2 | P32: =+(Q32+R32+S32)+0.5*T32 -> 25.73 | Q32: 7.02 | R32: 7.57 | S32: 9.14 | T32: 4 | U32: =+(V32+W32+X32)+0.5*Y32 -> 21.62 | V32: 6.00 | W32: 5.27 | X32: 6.85 | Y32: 7 | Z32: =+(AA32+AB32+AC32)+0.5*AD32 -> 29.85 | AA32: 7.13 | AB32: 7.29 | AC32: 9.93 | AD32: 11 | AE32: =+(AF32)+0.5*AG32 -> 0.00 | AF32: 0.00 | AG32: 0
A33: 29 | B33: Kocher, Michael | C33: HH | D33: =+F33+K33+P33+U33+Z33+AE33 -> 243.87 | E33: =+J33+O33+T33+Y33+AD33+AG33 -> 2 | F33: =+(G33+H33+I33)+0.5*J33 -> 110.72 | G33: 57.16 | H33: 26.63 | I33: 26.93 | J33: 0 | K33: =+(L33+M33+N33)+0.5*O33 -> 34.29 | L33: 10.91 | M33: 11.32 | N33: 12.06 | O33: 0 | P33: =+(Q33+R33+S33)+0.5*T33 -> 32.23 | Q33: 11.35 | R33: 11.07 | S33: 9.81 | T33: 0 | U33: =+(V33+W33+X33)+0.5*Y33 -> 40.73 | V33: 11.97 | W33: 13.66 | X33: 14.60 | Y33: 1 | Z33: =+(AA33+AB33+AC33)+0.5*AD33 -> 25.90 | AA33: 7.64 | AB33: 8.97 | AC33: 8.79 | AD33: 1 | AE33: =+(AF33)+0.5*AG33 -> 0.00 | AF33: 0.00 | AG33: 0
A34: 30 | B34: Hill, Randy | C34: HH | D34: =+F34+K34+P34+U34+Z34+AE34 -> 247.86 | E34: =+J34+O34+T34+Y34+AD34+AG34 -> 45 | F34: =+(G34+H34+I34)+0.5*J34 -> 146.75 | G34: 72.80 | H34: 55.94 | I34: 18.01 | J34: 0 | K34: =+(L34+M34+N34)+0.5*O34 -> 20.00 | L34: 5.79 | M34: 7.46 | N34: 6.75 | O34: 0 | P34: =+(Q34+R34+S34)+0.5*T34 -> 16.83 | Q34: 6.06 | R34: 4.41 | S34: 6.36 | T34: 0 | U34: =+(V34+W34+X34)+0.5*Y34 -> 27.88 | V34: 9.02 | W34: 9.46 | X34: 9.40 | Y34: 0 | Z34: =+(AA34+AB34+AC34)+0.5*AD34 -> 35.90 | AA34: 5.53 | AB34: 4.32 | AC34: 4.05 | AD34: 44 | AE34: =+(AF34)+0.5*AG34 -> 0.50 | AF34: 0.00 | AG34: 1
A35: 31 | B35: Scott, Michael | C35: HH | D35: =+F35+K35+P35+U35+Z35+AE35 -> 260.84 | E35: =+J35+O35+T35+Y35+AD35+AG35 -> 11 | F35: =+(G35+H35+I35)+0.5*J35 -> 167.39 | G35: 89.79 | H35: 28.54 | I35: 49.06 | J35: 0 | K35: =+(L35+M35+N35)+0.5*O35 -> 32.61 | L35: 11.81 | M35: 9.07 | N35: 11.73 | O35: 0 | P35: =+(Q35+R35+S35)+0.5*T35 -> 26.79 | Q35: 9.28 | R35: 9.10 | S35: 7.41 | T35: 2 | U35: =+(V35+W35+X35)+0.5*Y35 -> 16.02 | V35: 4.52 | W35: 4.99 | X35: 5.01 | Y35: 3 | Z35: =+(AA35+AB35+AC35)+0.5*AD35 -> 18.03 | AA35: 4.62 | AB35: 4.93 | AC35: 5.48 | AD35: 6 | AE35: =+(AF35)+0.5*AG35 -> 0.00 | AF35: 0.00 | AG35: 0
A36: 32 | B36: Scott, Alan | C36: HH | D36: =+F36+K36+P36+U36+Z36+AE36 -> 263.66 | E36: =+J36+O36+T36+Y36+AD36+AG36 -> 62 | F36: =+(G36+H36+I36)+0.5*J36 -> 156.30 | G36: 35.20 | H36: 81.81 | I36: 39.29 | J36: 0 | K36: =+(L36+M36+N36)+0.5*O36 -> 24.80 | L36: 8.32 | M36: 8.16 | N36: 7.82 | O36: 1 | P36: =+(Q36+R36+S36)+0.5*T36 -> 26.97 | Q36: 10.35 | R36: 7.62 | S36: 8.50 | T36: 1 | U36: =+(V36+W36+X36)+0.5*Y36 -> 13.75 | V36: 4.31 | W36: 4.77 | X36: 4.17 | Y36: 1 | Z36: =+(AA36+AB36+AC36)+0.5*AD36 -> 41.34 | AA36: 4.42 | AB36: 4.00 | AC36: 3.92 | AD36: 58 | AE36: =+(AF36)+0.5*AG36 -> 0.50 | AF36: 0.00 | AG36: 1
A37: 33 | B37: Young, Matt | C37: HH | D37: =+F37+K37+P37+U37+Z37+AE37 -> 271.30 | E37: =+J37+O37+T37+Y37+AD37+AG37 -> 42 | F37: =+(G37+H37+I37)+0.5*J37 -> 100.50 | G37: 36.91 | H37: 31.44 | I37: 32.15 | J37: 0 | K37: =+(L37+M37+N37)+0.5*O37 -> 47.10 | L37: 16.34 | M37: 15.31 | N37: 13.95 | O37: 3 | P37: =+(Q37+R37+S37)+0.5*T37 -> 42.80 | Q37: 12.45 | R37: 13.97 | S37: 14.38 | T37: 4 | U37: =+(V37+W37+X37)+0.5*Y37 -> 32.11 | V37: 9.18 | W37: 7.28 | X37: 9.65 | Y37: 12 | Z37: =+(AA37+AB37+AC37)+0.5*AD37 -> 48.79 | AA37: 11.50 | AB37: 12.72 | AC37: 13.07 | AD37: 23 | AE37: =+(AF37)+0.5*AG37 -> 0.00 | AF37: 0.00 | AG37: 0
A38: 34 | B38: Bunten, James | C38: * | D38: =+F38+K38+P38+U38+Z38+AE38 -> 300.19 | E38: =+J38+O38+T38+Y38+AD38+AG38 -> 123 | F38: =+(G38+H38+I38)+0.5*J38 -> 162.36 | G38: 47.94 | H38: 30.80 | I38: 33.62 | J38: 100 | K38: =+(L38+M38+N38)+0.5*O38 -> 29.44 | L38: 8.71 | M38: 10.21 | N38: 7.52 | O38: 6 | P38: =+(Q38+R38+S38)+0.5*T38 -> 44.50 | Q38: 21.63 | R38: 11.13 | S38: 10.24 | T38: 3 | U38: =+(V38+W38+X38)+0.5*Y38 -> 24.93 | V38: 9.84 | W38: 5.47 | X38: 8.12 | Y38: 3 | Z38: =+(AA38+AB38+AC38)+0.5*AD38 -> 38.96 | AA38: 9.95 | AB38: 11.91 | AC38: 11.60 | AD38: 11 | AE38: =+(AF38)+0.5*AG38 -> 0.00 | AF38: 0.00 | AG38: 0
A39: 26 | B39: Rodriquez, Mike | C39: CDP-MM | D39: DNF | E39: =+J39+O39+T39+Y39+AG39+#REF! -> #REF! | F39: =+(G39+#REF!)+0.5*J39 -> #REF! | K39: =+(L39)+0.5*O39 -> 0.00 | P39: =+(Q39+#REF!)+0.5*T39 -> #REF! | U39: =+(V39+W39+X39)+0.5*Y39 -> 0.00 | Z39: =+(AA39+AB39+AC39)+0.5*AD39 -> 0.00 | AE39: =+(AF39)+0.5*AG39 -> 0.00
A40: Notes:
A41: xx | B41: Indicates that the Points Down value includes some kind of penalty (Procedural Error, Hits on Non-Threat or Failure to Neutralize).
A42: PD | B42: = Points Down value is PD x .5 seconds added to the total stage time.
A43: xx | B43: Indicates that the Points Down value includes some kind of penalty (Procedural Error, Hits on Non-Threat or Failure to Neutralize).
A44: DNF | B44: = Did Not Finish
B45: Div/Class Information:
A46: - | B46: Division: HH = Hand-Held, WM = Weapon-Mounted
A47: * | B47: James used Night Vision Goggles to shoot the match