A1: Utah Shooting Academy Oct. 13, 2004
A2: SCORES (Including points down and penalties)
A3: Place | B3: Name | C3: Match | D3: Stage 1 | E3: Stage 2 | F3: Stage 3 | G3: Stage 4
A4: 1 | B4: ='\IDPA\FORMS\[match_scoresheet.xls]S1'!$B$1 -> Ari T | C4: ='\IDPA\FORMS\[match_scoresheet.xls]S1'!$F$27 -> 51.70 | D4: ='\IDPA\FORMS\[match_scoresheet.xls]S1'!B$27 -> 3.93 | E4: ='\IDPA\FORMS\[match_scoresheet.xls]S1'!C$27 -> 20.35 | F4: ='\IDPA\FORMS\[match_scoresheet.xls]S1'!D$27 -> 21.70 | G4: ='\IDPA\FORMS\[match_scoresheet.xls]S1'!E$27 -> 5.72
A5: 2 | B5: ='\IDPA\FORMS\[match_scoresheet.xls]S2'!$B$1 -> Brian Mortensen | C5: ='\IDPA\FORMS\[match_scoresheet.xls]S2'!$F$27 -> 56.85 | D5: ='\IDPA\FORMS\[match_scoresheet.xls]S2'!B$27 -> 5.02 | E5: ='\IDPA\FORMS\[match_scoresheet.xls]S2'!C$27 -> 19.55 | F5: ='\IDPA\FORMS\[match_scoresheet.xls]S2'!D$27 -> 25.78 | G5: ='\IDPA\FORMS\[match_scoresheet.xls]S2'!E$27 -> 6.50
A6: 3 | B6: ='\IDPA\FORMS\[match_scoresheet.xls]S6'!$B$1 -> Les Langford | C6: ='\IDPA\FORMS\[match_scoresheet.xls]S6'!$F$27 -> 67.19 | D6: ='\IDPA\FORMS\[match_scoresheet.xls]S6'!B$27 -> 6.70 | E6: ='\IDPA\FORMS\[match_scoresheet.xls]S6'!C$27 -> 16.50 | F6: ='\IDPA\FORMS\[match_scoresheet.xls]S6'!D$27 -> 37.33 | G6: ='\IDPA\FORMS\[match_scoresheet.xls]S6'!E$27 -> 6.66
A7: 4 | B7: ='\IDPA\FORMS\[match_scoresheet.xls]S21'!$B$1 -> Red Redford | C7: ='\IDPA\FORMS\[match_scoresheet.xls]S21'!$F$27 -> 72.63 | D7: ='\IDPA\FORMS\[match_scoresheet.xls]S21'!B$27 -> 4.32 | E7: ='\IDPA\FORMS\[match_scoresheet.xls]S21'!C$27 -> 24.11 | F7: ='\IDPA\FORMS\[match_scoresheet.xls]S21'!D$27 -> 35.12 | G7: ='\IDPA\FORMS\[match_scoresheet.xls]S21'!E$27 -> 9.08
A8: 5 | B8: ='\IDPA\FORMS\[match_scoresheet.xls]S16'!$B$1 -> Mike Rodiquez | C8: ='\IDPA\FORMS\[match_scoresheet.xls]S16'!$F$27 -> 72.96 | D8: ='\IDPA\FORMS\[match_scoresheet.xls]S16'!B$27 -> 6.26 | E8: ='\IDPA\FORMS\[match_scoresheet.xls]S16'!C$27 -> 22.00 | F8: ='\IDPA\FORMS\[match_scoresheet.xls]S16'!D$27 -> 36.26 | G8: ='\IDPA\FORMS\[match_scoresheet.xls]S16'!E$27 -> 8.44
A9: 6 | B9: ='\IDPA\FORMS\[match_scoresheet.xls]S12'!$B$1 -> R Dan Phillips | C9: ='\IDPA\FORMS\[match_scoresheet.xls]S12'!$F$27 -> 78.37 | D9: ='\IDPA\FORMS\[match_scoresheet.xls]S12'!B$27 -> 6.81 | E9: ='\IDPA\FORMS\[match_scoresheet.xls]S12'!C$27 -> 23.38 | F9: ='\IDPA\FORMS\[match_scoresheet.xls]S12'!D$27 -> 37.67 | G9: ='\IDPA\FORMS\[match_scoresheet.xls]S12'!E$27 -> 10.51
A10: 7 | B10: ='\IDPA\FORMS\[match_scoresheet.xls]S4'!$B$1 -> Roger Cox | C10: ='\IDPA\FORMS\[match_scoresheet.xls]S4'!$F$27 -> 79.49 | D10: ='\IDPA\FORMS\[match_scoresheet.xls]S4'!B$27 -> 5.07 | E10: ='\IDPA\FORMS\[match_scoresheet.xls]S4'!C$27 -> 35.36 | F10: ='\IDPA\FORMS\[match_scoresheet.xls]S4'!D$27 -> 32.21 | G10: ='\IDPA\FORMS\[match_scoresheet.xls]S4'!E$27 -> 6.85
A11: 8 | B11: ='\IDPA\FORMS\[match_scoresheet.xls]S8'!$B$1 -> Dave Duncan | C11: ='\IDPA\FORMS\[match_scoresheet.xls]S8'!$F$27 -> 79.80 | D11: ='\IDPA\FORMS\[match_scoresheet.xls]S8'!B$27 -> 6.78 | E11: ='\IDPA\FORMS\[match_scoresheet.xls]S8'!C$27 -> 25.97 | F11: ='\IDPA\FORMS\[match_scoresheet.xls]S8'!D$27 -> 39.42 | G11: ='\IDPA\FORMS\[match_scoresheet.xls]S8'!E$27 -> 7.63
A12: 9 | B12: ='\IDPA\FORMS\[match_scoresheet.xls]S3'!$B$1 -> John Diamond | C12: ='\IDPA\FORMS\[match_scoresheet.xls]S3'!$F$27 -> 83.05 | D12: ='\IDPA\FORMS\[match_scoresheet.xls]S3'!B$27 -> 8.01 | E12: ='\IDPA\FORMS\[match_scoresheet.xls]S3'!C$27 -> 28.49 | F12: ='\IDPA\FORMS\[match_scoresheet.xls]S3'!D$27 -> 39.01 | G12: ='\IDPA\FORMS\[match_scoresheet.xls]S3'!E$27 -> 7.54
A13: 10 | B13: ='\IDPA\FORMS\[match_scoresheet.xls]S5'!$B$1 -> Dave Duncan | C13: ='\IDPA\FORMS\[match_scoresheet.xls]S5'!$F$27 -> 89.43 | D13: ='\IDPA\FORMS\[match_scoresheet.xls]S5'!B$27 -> 7.60 | E13: ='\IDPA\FORMS\[match_scoresheet.xls]S5'!C$27 -> 28.24 | F13: ='\IDPA\FORMS\[match_scoresheet.xls]S5'!D$27 -> 46.96 | G13: ='\IDPA\FORMS\[match_scoresheet.xls]S5'!E$27 -> 6.63
A14: 11 | B14: ='\IDPA\FORMS\[match_scoresheet.xls]S15'!$B$1 -> Harold Simpson | C14: ='\IDPA\FORMS\[match_scoresheet.xls]S15'!$F$27 -> 93.14 | D14: ='\IDPA\FORMS\[match_scoresheet.xls]S15'!B$27 -> 7.01 | E14: ='\IDPA\FORMS\[match_scoresheet.xls]S15'!C$27 -> 28.96 | F14: ='\IDPA\FORMS\[match_scoresheet.xls]S15'!D$27 -> 47.66 | G14: ='\IDPA\FORMS\[match_scoresheet.xls]S15'!E$27 -> 9.51
A15: 12 | B15: ='\IDPA\FORMS\[match_scoresheet.xls]S18'!$B$1 -> Mike Brownlee | C15: ='\IDPA\FORMS\[match_scoresheet.xls]S18'!$F$27 -> 95.85 | D15: ='\IDPA\FORMS\[match_scoresheet.xls]S18'!B$27 -> 7.14 | E15: ='\IDPA\FORMS\[match_scoresheet.xls]S18'!C$27 -> 26.83 | F15: ='\IDPA\FORMS\[match_scoresheet.xls]S18'!D$27 -> 52.18 | G15: ='\IDPA\FORMS\[match_scoresheet.xls]S18'!E$27 -> 9.70
A16: 13 | B16: ='\IDPA\FORMS\[match_scoresheet.xls]S9'!$B$1 -> Justin Park | C16: ='\IDPA\FORMS\[match_scoresheet.xls]S9'!$F$27 -> 103.42 | D16: ='\IDPA\FORMS\[match_scoresheet.xls]S9'!B$27 -> 5.02 | E16: ='\IDPA\FORMS\[match_scoresheet.xls]S9'!C$27 -> 36.23 | F16: ='\IDPA\FORMS\[match_scoresheet.xls]S9'!D$27 -> 56.62 | G16: ='\IDPA\FORMS\[match_scoresheet.xls]S9'!E$27 -> 5.55
A17: 14 | B17: ='\IDPA\FORMS\[match_scoresheet.xls]S7'!$B$1 -> Bill Dezell | C17: ='\IDPA\FORMS\[match_scoresheet.xls]S7'!$F$27 -> 113.15 | D17: ='\IDPA\FORMS\[match_scoresheet.xls]S7'!B$27 -> 9.24 | E17: ='\IDPA\FORMS\[match_scoresheet.xls]S7'!C$27 -> 23.17 | F17: ='\IDPA\FORMS\[match_scoresheet.xls]S7'!D$27 -> 67.79 | G17: ='\IDPA\FORMS\[match_scoresheet.xls]S7'!E$27 -> 12.95
A18: 15 | B18: ='\IDPA\FORMS\[match_scoresheet.xls]S11'!$B$1 -> Dane Burden | C18: ='\IDPA\FORMS\[match_scoresheet.xls]S11'!$F$27 -> 113.50 | D18: ='\IDPA\FORMS\[match_scoresheet.xls]S11'!B$27 -> 5.97 | E18: ='\IDPA\FORMS\[match_scoresheet.xls]S11'!C$27 -> 25.12 | F18: ='\IDPA\FORMS\[match_scoresheet.xls]S11'!D$27 -> 71.44 | G18: ='\IDPA\FORMS\[match_scoresheet.xls]S11'!E$27 -> 10.97
A19: 16 | B19: ='\IDPA\FORMS\[match_scoresheet.xls]S17'!$B$1 -> George Crawford | C19: ='\IDPA\FORMS\[match_scoresheet.xls]S17'!$F$27 -> 132.19 | D19: ='\IDPA\FORMS\[match_scoresheet.xls]S17'!B$27 -> 5.86 | E19: ='\IDPA\FORMS\[match_scoresheet.xls]S17'!C$27 -> 42.29 | F19: ='\IDPA\FORMS\[match_scoresheet.xls]S17'!D$27 -> 75.59 | G19: ='\IDPA\FORMS\[match_scoresheet.xls]S17'!E$27 -> 8.45
A20: 17 | B20: ='\IDPA\FORMS\[match_scoresheet.xls]S20'!$B$1 -> Carl Burney | C20: ='\IDPA\FORMS\[match_scoresheet.xls]S20'!$F$27 -> 132.26 | D20: ='\IDPA\FORMS\[match_scoresheet.xls]S20'!B$27 -> 7.94 | E20: ='\IDPA\FORMS\[match_scoresheet.xls]S20'!C$27 -> 47.34 | F20: ='\IDPA\FORMS\[match_scoresheet.xls]S20'!D$27 -> 69.61 | G20: ='\IDPA\FORMS\[match_scoresheet.xls]S20'!E$27 -> 7.37
A21: 18 | B21: ='\IDPA\FORMS\[match_scoresheet.xls]S13'!$B$1 -> Andrew Johnson | C21: ='\IDPA\FORMS\[match_scoresheet.xls]S13'!$F$27 -> 135.48 | D21: ='\IDPA\FORMS\[match_scoresheet.xls]S13'!B$27 -> 6.69 | E21: ='\IDPA\FORMS\[match_scoresheet.xls]S13'!C$27 -> 41.47 | F21: ='\IDPA\FORMS\[match_scoresheet.xls]S13'!D$27 -> 72.74 | G21: ='\IDPA\FORMS\[match_scoresheet.xls]S13'!E$27 -> 14.58
A22: 19 | B22: ='\IDPA\FORMS\[match_scoresheet.xls]S19'!$B$1 -> Erin Herring | C22: ='\IDPA\FORMS\[match_scoresheet.xls]S19'!$F$27 -> 155.92 | D22: ='\IDPA\FORMS\[match_scoresheet.xls]S19'!B$27 -> 14.34 | E22: ='\IDPA\FORMS\[match_scoresheet.xls]S19'!C$27 -> 35.39 | F22: ='\IDPA\FORMS\[match_scoresheet.xls]S19'!D$27 -> 91.70 | G22: ='\IDPA\FORMS\[match_scoresheet.xls]S19'!E$27 -> 14.49
A23: 20 | B23: ='\IDPA\FORMS\[match_scoresheet.xls]S10'!$B$1 -> Jennifer McDermid | C23: ='\IDPA\FORMS\[match_scoresheet.xls]S10'!$F$27 -> 160.45 | D23: ='\IDPA\FORMS\[match_scoresheet.xls]S10'!B$27 -> 10.77 | E23: ='\IDPA\FORMS\[match_scoresheet.xls]S10'!C$27 -> 48.70 | F23: ='\IDPA\FORMS\[match_scoresheet.xls]S10'!D$27 -> 89.86 | G23: ='\IDPA\FORMS\[match_scoresheet.xls]S10'!E$27 -> 11.12
A24: 21 | B24: ='\IDPA\FORMS\[match_scoresheet.xls]S14'!$B$1 -> Carol Perez | C24: ='\IDPA\FORMS\[match_scoresheet.xls]S14'!$F$27 -> 177.73 | D24: ='\IDPA\FORMS\[match_scoresheet.xls]S14'!B$27 -> 7.71 | E24: ='\IDPA\FORMS\[match_scoresheet.xls]S14'!C$27 -> 44.91 | F24: ='\IDPA\FORMS\[match_scoresheet.xls]S14'!D$27 -> 113.70 | G24: ='\IDPA\FORMS\[match_scoresheet.xls]S14'!E$27 -> 11.41
A25: 22 | B25: ='\IDPA\FORMS\[match_scoresheet.xls]S22'!$B$1 -> Chris Roach | C25: ='\IDPA\FORMS\[match_scoresheet.xls]S22'!$F$27 -> 47.38 | D25: ='\IDPA\FORMS\[match_scoresheet.xls]S22'!B$27 -> 7.10 | E25: DNF | F25: ='\IDPA\FORMS\[match_scoresheet.xls]S22'!D$27 -> 33.25 | G25: ='\IDPA\FORMS\[match_scoresheet.xls]S22'!E$27 -> 7.03
A26: S23 | B26: ='\IDPA\FORMS\[match_scoresheet.xls]S23'!$B$1 -> 0 | C26: ='\IDPA\FORMS\[match_scoresheet.xls]S23'!$F$27 -> 0.00 | D26: ='\IDPA\FORMS\[match_scoresheet.xls]S23'!B$27 -> 0.00 | E26: ='\IDPA\FORMS\[match_scoresheet.xls]S23'!C$27 -> 0.00 | F26: ='\IDPA\FORMS\[match_scoresheet.xls]S23'!D$27 -> 0.00 | G26: ='\IDPA\FORMS\[match_scoresheet.xls]S23'!E$27 -> 0.00
A27: S24 | B27: ='\IDPA\FORMS\[match_scoresheet.xls]S24'!$B$1 -> 0 | C27: ='\IDPA\FORMS\[match_scoresheet.xls]S24'!$F$27 -> 0.00 | D27: ='\IDPA\FORMS\[match_scoresheet.xls]S24'!B$27 -> 0.00 | E27: ='\IDPA\FORMS\[match_scoresheet.xls]S24'!C$27 -> 0.00 | F27: ='\IDPA\FORMS\[match_scoresheet.xls]S24'!D$27 -> 0.00 | G27: ='\IDPA\FORMS\[match_scoresheet.xls]S24'!E$27 -> 0.00
A28: S25 | B28: ='\IDPA\FORMS\[match_scoresheet.xls]S25'!$B$1 -> 0 | C28: ='\IDPA\FORMS\[match_scoresheet.xls]S25'!$F$27 -> 0.00 | D28: ='\IDPA\FORMS\[match_scoresheet.xls]S25'!B$27 -> 0.00 | E28: ='\IDPA\FORMS\[match_scoresheet.xls]S25'!C$27 -> 0.00 | F28: ='\IDPA\FORMS\[match_scoresheet.xls]S25'!D$27 -> 0.00 | G28: ='\IDPA\FORMS\[match_scoresheet.xls]S25'!E$27 -> 0.00
A29: =COUNTIF($C$4:$C$28,">0") -> 22 | B29: Overall Average: | C29: =SUM(C4:C28)/$A$29 -> 99.63363636363637 | D29: =SUM(D4:D28)/$A$29 -> 7.0586363636363636 | E29: =SUM(E4:E28)/$A$29 -> 29.289090909090916 | F29: =SUM(F4:F28)/$A$29 -> 54.254545454545458 | G29: =SUM(G4:G28)/$A$29 -> 9.031363636363638
A30: RAW TIMES
A31: Place | B31: Name | C31: Match | D31: Stage 1 | E31: Stage 2 | F31: Stage 3 | G31: Stage 4
A32: 1 | B32: ='\IDPA\FORMS\[match_scoresheet.xls]S1'!$B$1 -> Ari T | C32: ='\IDPA\FORMS\[match_scoresheet.xls]S1'!$F$23 -> 46.70 | D32: ='\IDPA\FORMS\[match_scoresheet.xls]S1'!B$23 -> 3.93 | E32: ='\IDPA\FORMS\[match_scoresheet.xls]S1'!C$23 -> 16.85 | F32: ='\IDPA\FORMS\[match_scoresheet.xls]S1'!D$23 -> 21.20 | G32: ='\IDPA\FORMS\[match_scoresheet.xls]S1'!E$23 -> 4.72
A33: 2 | B33: ='\IDPA\FORMS\[match_scoresheet.xls]S2'!$B$1 -> Brian Mortensen | C33: ='\IDPA\FORMS\[match_scoresheet.xls]S2'!$F$23 -> 56.35 | D33: ='\IDPA\FORMS\[match_scoresheet.xls]S2'!B$23 -> 4.52 | E33: ='\IDPA\FORMS\[match_scoresheet.xls]S2'!C$23 -> 19.55 | F33: ='\IDPA\FORMS\[match_scoresheet.xls]S2'!D$23 -> 25.78 | G33: ='\IDPA\FORMS\[match_scoresheet.xls]S2'!E$23 -> 6.50
A34: 3 | B34: ='\IDPA\FORMS\[match_scoresheet.xls]S6'!$B$1 -> Les Langford | C34: ='\IDPA\FORMS\[match_scoresheet.xls]S6'!$F$23 -> 57.19 | D34: ='\IDPA\FORMS\[match_scoresheet.xls]S6'!B$23 -> 6.70 | E34: ='\IDPA\FORMS\[match_scoresheet.xls]S6'!C$23 -> 16.00 | F34: ='\IDPA\FORMS\[match_scoresheet.xls]S6'!D$23 -> 28.33 | G34: ='\IDPA\FORMS\[match_scoresheet.xls]S6'!E$23 -> 6.16
A35: 4 | B35: ='\IDPA\FORMS\[match_scoresheet.xls]S4'!$B$1 -> Roger Cox | C35: ='\IDPA\FORMS\[match_scoresheet.xls]S4'!$F$23 -> 60.49 | D35: ='\IDPA\FORMS\[match_scoresheet.xls]S4'!B$23 -> 5.07 | E35: ='\IDPA\FORMS\[match_scoresheet.xls]S4'!C$23 -> 24.36 | F35: ='\IDPA\FORMS\[match_scoresheet.xls]S4'!D$23 -> 24.71 | G35: ='\IDPA\FORMS\[match_scoresheet.xls]S4'!E$23 -> 6.35
A36: 5 | B36: ='\IDPA\FORMS\[match_scoresheet.xls]S16'!$B$1 -> Mike Rodiquez | C36: ='\IDPA\FORMS\[match_scoresheet.xls]S16'!$F$23 -> 63.46 | D36: ='\IDPA\FORMS\[match_scoresheet.xls]S16'!B$23 -> 4.76 | E36: ='\IDPA\FORMS\[match_scoresheet.xls]S16'!C$23 -> 19.50 | F36: ='\IDPA\FORMS\[match_scoresheet.xls]S16'!D$23 -> 33.76 | G36: ='\IDPA\FORMS\[match_scoresheet.xls]S16'!E$23 -> 5.44
A37: 6 | B37: ='\IDPA\FORMS\[match_scoresheet.xls]S12'!$B$1 -> R Dan Phillips | C37: ='\IDPA\FORMS\[match_scoresheet.xls]S12'!$F$23 -> 64.37 | D37: ='\IDPA\FORMS\[match_scoresheet.xls]S12'!B$23 -> 6.31 | E37: ='\IDPA\FORMS\[match_scoresheet.xls]S12'!C$23 -> 20.38 | F37: ='\IDPA\FORMS\[match_scoresheet.xls]S12'!D$23 -> 31.17 | G37: ='\IDPA\FORMS\[match_scoresheet.xls]S12'!E$23 -> 6.51
A38: 7 | B38: ='\IDPA\FORMS\[match_scoresheet.xls]S3'!$B$1 -> John Diamond | C38: ='\IDPA\FORMS\[match_scoresheet.xls]S3'!$F$23 -> 65.05 | D38: ='\IDPA\FORMS\[match_scoresheet.xls]S3'!B$23 -> 8.01 | E38: ='\IDPA\FORMS\[match_scoresheet.xls]S3'!C$23 -> 20.99 | F38: ='\IDPA\FORMS\[match_scoresheet.xls]S3'!D$23 -> 29.01 | G38: ='\IDPA\FORMS\[match_scoresheet.xls]S3'!E$23 -> 7.04
A39: 8 | B39: ='\IDPA\FORMS\[match_scoresheet.xls]S21'!$B$1 -> Red Redford | C39: ='\IDPA\FORMS\[match_scoresheet.xls]S21'!$F$23 -> 66.13 | D39: ='\IDPA\FORMS\[match_scoresheet.xls]S21'!B$23 -> 4.32 | E39: ='\IDPA\FORMS\[match_scoresheet.xls]S21'!C$23 -> 21.61 | F39: ='\IDPA\FORMS\[match_scoresheet.xls]S21'!D$23 -> 33.62 | G39: ='\IDPA\FORMS\[match_scoresheet.xls]S21'!E$23 -> 6.58
A40: 9 | B40: ='\IDPA\FORMS\[match_scoresheet.xls]S8'!$B$1 -> Dave Duncan | C40: ='\IDPA\FORMS\[match_scoresheet.xls]S8'!$F$23 -> 73.30 | D40: ='\IDPA\FORMS\[match_scoresheet.xls]S8'!B$23 -> 6.78 | E40: ='\IDPA\FORMS\[match_scoresheet.xls]S8'!C$23 -> 23.47 | F40: ='\IDPA\FORMS\[match_scoresheet.xls]S8'!D$23 -> 35.92 | G40: ='\IDPA\FORMS\[match_scoresheet.xls]S8'!E$23 -> 7.13
A41: 10 | B41: ='\IDPA\FORMS\[match_scoresheet.xls]S18'!$B$1 -> Mike Brownlee | C41: ='\IDPA\FORMS\[match_scoresheet.xls]S18'!$F$23 -> 73.35 | D41: ='\IDPA\FORMS\[match_scoresheet.xls]S18'!B$23 -> 5.64 | E41: ='\IDPA\FORMS\[match_scoresheet.xls]S18'!C$23 -> 21.33 | F41: ='\IDPA\FORMS\[match_scoresheet.xls]S18'!D$23 -> 40.68 | G41: ='\IDPA\FORMS\[match_scoresheet.xls]S18'!E$23 -> 5.70
A42: 11 | B42: ='\IDPA\FORMS\[match_scoresheet.xls]S5'!$B$1 -> Dave Duncan | C42: ='\IDPA\FORMS\[match_scoresheet.xls]S5'!$F$23 -> 81.43 | D42: ='\IDPA\FORMS\[match_scoresheet.xls]S5'!B$23 -> 6.60 | E42: ='\IDPA\FORMS\[match_scoresheet.xls]S5'!C$23 -> 28.24 | F42: ='\IDPA\FORMS\[match_scoresheet.xls]S5'!D$23 -> 39.96 | G42: ='\IDPA\FORMS\[match_scoresheet.xls]S5'!E$23 -> 6.63
A43: 12 | B43: ='\IDPA\FORMS\[match_scoresheet.xls]S15'!$B$1 -> Harold Simpson | C43: ='\IDPA\FORMS\[match_scoresheet.xls]S15'!$F$23 -> 86.64 | D43: ='\IDPA\FORMS\[match_scoresheet.xls]S15'!B$23 -> 7.01 | E43: ='\IDPA\FORMS\[match_scoresheet.xls]S15'!C$23 -> 28.96 | F43: ='\IDPA\FORMS\[match_scoresheet.xls]S15'!D$23 -> 42.66 | G43: ='\IDPA\FORMS\[match_scoresheet.xls]S15'!E$23 -> 8.01
A44: 13 | B44: ='\IDPA\FORMS\[match_scoresheet.xls]S9'!$B$1 -> Justin Park | C44: ='\IDPA\FORMS\[match_scoresheet.xls]S9'!$F$23 -> 89.92 | D44: ='\IDPA\FORMS\[match_scoresheet.xls]S9'!B$23 -> 2.52 | E44: ='\IDPA\FORMS\[match_scoresheet.xls]S9'!C$23 -> 33.73 | F44: ='\IDPA\FORMS\[match_scoresheet.xls]S9'!D$23 -> 48.62 | G44: ='\IDPA\FORMS\[match_scoresheet.xls]S9'!E$23 -> 5.05
A45: 14 | B45: ='\IDPA\FORMS\[match_scoresheet.xls]S11'!$B$1 -> Dane Burden | C45: ='\IDPA\FORMS\[match_scoresheet.xls]S11'!$F$23 -> 90.00 | D45: ='\IDPA\FORMS\[match_scoresheet.xls]S11'!B$23 -> 4.47 | E45: ='\IDPA\FORMS\[match_scoresheet.xls]S11'!C$23 -> 19.62 | F45: ='\IDPA\FORMS\[match_scoresheet.xls]S11'!D$23 -> 58.44 | G45: ='\IDPA\FORMS\[match_scoresheet.xls]S11'!E$23 -> 7.47
A46: 15 | B46: ='\IDPA\FORMS\[match_scoresheet.xls]S13'!$B$1 -> Andrew Johnson | C46: ='\IDPA\FORMS\[match_scoresheet.xls]S13'!$F$23 -> 98.48 | D46: ='\IDPA\FORMS\[match_scoresheet.xls]S13'!B$23 -> 6.69 | E46: ='\IDPA\FORMS\[match_scoresheet.xls]S13'!C$23 -> 27.47 | F46: ='\IDPA\FORMS\[match_scoresheet.xls]S13'!D$23 -> 54.74 | G46: ='\IDPA\FORMS\[match_scoresheet.xls]S13'!E$23 -> 9.58
A47: 16 | B47: ='\IDPA\FORMS\[match_scoresheet.xls]S7'!$B$1 -> Bill Dezell | C47: ='\IDPA\FORMS\[match_scoresheet.xls]S7'!$F$23 -> 102.65 | D47: ='\IDPA\FORMS\[match_scoresheet.xls]S7'!B$23 -> 7.74 | E47: ='\IDPA\FORMS\[match_scoresheet.xls]S7'!C$23 -> 20.67 | F47: ='\IDPA\FORMS\[match_scoresheet.xls]S7'!D$23 -> 67.29 | G47: ='\IDPA\FORMS\[match_scoresheet.xls]S7'!E$23 -> 6.95
A48: 17 | B48: ='\IDPA\FORMS\[match_scoresheet.xls]S17'!$B$1 -> George Crawford | C48: ='\IDPA\FORMS\[match_scoresheet.xls]S17'!$F$23 -> 102.69 | D48: ='\IDPA\FORMS\[match_scoresheet.xls]S17'!B$23 -> 5.86 | E48: ='\IDPA\FORMS\[match_scoresheet.xls]S17'!C$23 -> 30.29 | F48: ='\IDPA\FORMS\[match_scoresheet.xls]S17'!D$23 -> 59.59 | G48: ='\IDPA\FORMS\[match_scoresheet.xls]S17'!E$23 -> 6.95
A49: 18 | B49: ='\IDPA\FORMS\[match_scoresheet.xls]S20'!$B$1 -> Carl Burney | C49: ='\IDPA\FORMS\[match_scoresheet.xls]S20'!$F$23 -> 115.76 | D49: ='\IDPA\FORMS\[match_scoresheet.xls]S20'!B$23 -> 7.44 | E49: ='\IDPA\FORMS\[match_scoresheet.xls]S20'!C$23 -> 34.84 | F49: ='\IDPA\FORMS\[match_scoresheet.xls]S20'!D$23 -> 66.11 | G49: ='\IDPA\FORMS\[match_scoresheet.xls]S20'!E$23 -> 7.37
A50: 19 | B50: ='\IDPA\FORMS\[match_scoresheet.xls]S10'!$B$1 -> Jennifer McDermid | C50: ='\IDPA\FORMS\[match_scoresheet.xls]S10'!$F$23 -> 121.45 | D50: ='\IDPA\FORMS\[match_scoresheet.xls]S10'!B$23 -> 10.27 | E50: ='\IDPA\FORMS\[match_scoresheet.xls]S10'!C$23 -> 30.70 | F50: ='\IDPA\FORMS\[match_scoresheet.xls]S10'!D$23 -> 72.86 | G50: ='\IDPA\FORMS\[match_scoresheet.xls]S10'!E$23 -> 7.62
A51: 20 | B51: ='\IDPA\FORMS\[match_scoresheet.xls]S19'!$B$1 -> Erin Herring | C51: ='\IDPA\FORMS\[match_scoresheet.xls]S19'!$F$23 -> 129.42 | D51: ='\IDPA\FORMS\[match_scoresheet.xls]S19'!B$23 -> 14.34 | E51: ='\IDPA\FORMS\[match_scoresheet.xls]S19'!C$23 -> 32.89 | F51: ='\IDPA\FORMS\[match_scoresheet.xls]S19'!D$23 -> 74.20 | G51: ='\IDPA\FORMS\[match_scoresheet.xls]S19'!E$23 -> 7.99
A52: 21 | B52: ='\IDPA\FORMS\[match_scoresheet.xls]S14'!$B$1 -> Carol Perez | C52: ='\IDPA\FORMS\[match_scoresheet.xls]S14'!$F$23 -> 167.23 | D52: ='\IDPA\FORMS\[match_scoresheet.xls]S14'!B$23 -> 7.71 | E52: ='\IDPA\FORMS\[match_scoresheet.xls]S14'!C$23 -> 38.91 | F52: ='\IDPA\FORMS\[match_scoresheet.xls]S14'!D$23 -> 113.20 | G52: ='\IDPA\FORMS\[match_scoresheet.xls]S14'!E$23 -> 7.41
A53: 22 | B53: ='\IDPA\FORMS\[match_scoresheet.xls]S22'!$B$1 -> Chris Roach | C53: ='\IDPA\FORMS\[match_scoresheet.xls]S22'!$F$23 -> 40.38 | D53: ='\IDPA\FORMS\[match_scoresheet.xls]S22'!B$23 -> 4.60 | E53: DNF | F53: ='\IDPA\FORMS\[match_scoresheet.xls]S22'!D$23 -> 29.75 | G53: ='\IDPA\FORMS\[match_scoresheet.xls]S22'!E$23 -> 6.03
A54: S23 | B54: ='\IDPA\FORMS\[match_scoresheet.xls]S23'!$B$1 -> 0 | C54: ='\IDPA\FORMS\[match_scoresheet.xls]S23'!$F$23 -> 0.00 | D54: ='\IDPA\FORMS\[match_scoresheet.xls]S23'!B$23 -> 0.00 | E54: ='\IDPA\FORMS\[match_scoresheet.xls]S23'!C$23 -> 0.00 | F54: ='\IDPA\FORMS\[match_scoresheet.xls]S23'!D$23 -> 0.00 | G54: ='\IDPA\FORMS\[match_scoresheet.xls]S23'!E$23 -> 0.00
A55: S24 | B55: ='\IDPA\FORMS\[match_scoresheet.xls]S24'!$B$1 -> 0 | C55: ='\IDPA\FORMS\[match_scoresheet.xls]S24'!$F$23 -> 0.00 | D55: ='\IDPA\FORMS\[match_scoresheet.xls]S24'!B$23 -> 0.00 | E55: ='\IDPA\FORMS\[match_scoresheet.xls]S24'!C$23 -> 0.00 | F55: ='\IDPA\FORMS\[match_scoresheet.xls]S24'!D$23 -> 0.00 | G55: ='\IDPA\FORMS\[match_scoresheet.xls]S24'!E$23 -> 0.00
A56: S25 | B56: ='\IDPA\FORMS\[match_scoresheet.xls]S25'!$B$1 -> 0 | C56: ='\IDPA\FORMS\[match_scoresheet.xls]S25'!$F$23 -> 0.00 | D56: ='\IDPA\FORMS\[match_scoresheet.xls]S25'!B$23 -> 0.00 | E56: ='\IDPA\FORMS\[match_scoresheet.xls]S25'!C$23 -> 0.00 | F56: ='\IDPA\FORMS\[match_scoresheet.xls]S25'!D$23 -> 0.00 | G56: ='\IDPA\FORMS\[match_scoresheet.xls]S25'!E$23 -> 0.00
A57: Overall Average: | C57: =SUM(C32:C56)/$A$29 -> 84.201818181818197 | D57: =SUM(D32:D56)/$A$29 -> 6.4222727272727269 | E57: =SUM(E32:E56)/$A$29 -> 24.107272727272733 | F57: =SUM(F32:F56)/$A$29 -> 46.890909090909084 | G57: =SUM(G32:G56)/$A$29 -> 6.7813636363636371
A58: POINTS DOWN
A59: Place | B59: Name | C59: Match | D59: Stage 1 | E59: Stage 2 | F59: Stage 3 | G59: Stage 4
A60: 1 | B60: ='\IDPA\FORMS\[match_scoresheet.xls]S2'!$B$1 -> Brian Mortensen | C60: ='\IDPA\FORMS\[match_scoresheet.xls]S2'!$F$24 -> 1 | D60: ='\IDPA\FORMS\[match_scoresheet.xls]S2'!B$24 -> 1 | E60: ='\IDPA\FORMS\[match_scoresheet.xls]S2'!C$24 -> 0 | F60: ='\IDPA\FORMS\[match_scoresheet.xls]S2'!D$24 -> 0 | G60: ='\IDPA\FORMS\[match_scoresheet.xls]S2'!E$24 -> 0
A61: 2 | B61: ='\IDPA\FORMS\[match_scoresheet.xls]S1'!$B$1 -> Ari T | C61: ='\IDPA\FORMS\[match_scoresheet.xls]S1'!$F$24 -> 4 | D61: ='\IDPA\FORMS\[match_scoresheet.xls]S1'!B$24 -> 0 | E61: ='\IDPA\FORMS\[match_scoresheet.xls]S1'!C$24 -> 1 | F61: ='\IDPA\FORMS\[match_scoresheet.xls]S1'!D$24 -> 1 | G61: ='\IDPA\FORMS\[match_scoresheet.xls]S1'!E$24 -> 2
A62: 3 | B62: ='\IDPA\FORMS\[match_scoresheet.xls]S8'!$B$1 -> Dave Duncan | C62: ='\IDPA\FORMS\[match_scoresheet.xls]S8'!$F$24 -> 13 | D62: ='\IDPA\FORMS\[match_scoresheet.xls]S8'!B$24 -> 0 | E62: ='\IDPA\FORMS\[match_scoresheet.xls]S8'!C$24 -> 5 | F62: ='\IDPA\FORMS\[match_scoresheet.xls]S8'!D$24 -> 7 | G62: ='\IDPA\FORMS\[match_scoresheet.xls]S8'!E$24 -> 1
A63: 4 | B63: ='\IDPA\FORMS\[match_scoresheet.xls]S15'!$B$1 -> Harold Simpson | C63: ='\IDPA\FORMS\[match_scoresheet.xls]S15'!$F$24 -> 13 | D63: ='\IDPA\FORMS\[match_scoresheet.xls]S15'!B$24 -> 0 | E63: ='\IDPA\FORMS\[match_scoresheet.xls]S15'!C$24 -> 0 | F63: ='\IDPA\FORMS\[match_scoresheet.xls]S15'!D$24 -> 10 | G63: ='\IDPA\FORMS\[match_scoresheet.xls]S15'!E$24 -> 3
A64: 5 | B64: ='\IDPA\FORMS\[match_scoresheet.xls]S21'!$B$1 -> Red Redford | C64: ='\IDPA\FORMS\[match_scoresheet.xls]S21'!$F$24 -> 13 | D64: ='\IDPA\FORMS\[match_scoresheet.xls]S21'!B$24 -> 0 | E64: ='\IDPA\FORMS\[match_scoresheet.xls]S21'!C$24 -> 5 | F64: ='\IDPA\FORMS\[match_scoresheet.xls]S21'!D$24 -> 3 | G64: ='\IDPA\FORMS\[match_scoresheet.xls]S21'!E$24 -> 5
A65: 6 | B65: ='\IDPA\FORMS\[match_scoresheet.xls]S5'!$B$1 -> Dave Duncan | C65: ='\IDPA\FORMS\[match_scoresheet.xls]S5'!$F$24 -> 16 | D65: ='\IDPA\FORMS\[match_scoresheet.xls]S5'!B$24 -> 2 | E65: ='\IDPA\FORMS\[match_scoresheet.xls]S5'!C$24 -> 0 | F65: ='\IDPA\FORMS\[match_scoresheet.xls]S5'!D$24 -> 14 | G65: ='\IDPA\FORMS\[match_scoresheet.xls]S5'!E$24 -> 0
A66: 7 | B66: ='\IDPA\FORMS\[match_scoresheet.xls]S16'!$B$1 -> Mike Rodiquez | C66: ='\IDPA\FORMS\[match_scoresheet.xls]S16'!$F$24 -> 19 | D66: ='\IDPA\FORMS\[match_scoresheet.xls]S16'!B$24 -> 3 | E66: ='\IDPA\FORMS\[match_scoresheet.xls]S16'!C$24 -> 5 | F66: ='\IDPA\FORMS\[match_scoresheet.xls]S16'!D$24 -> 5 | G66: ='\IDPA\FORMS\[match_scoresheet.xls]S16'!E$24 -> 6
A67: 8 | B67: ='\IDPA\FORMS\[match_scoresheet.xls]S6'!$B$1 -> Les Langford | C67: ='\IDPA\FORMS\[match_scoresheet.xls]S6'!$F$24 -> 20 | D67: ='\IDPA\FORMS\[match_scoresheet.xls]S6'!B$24 -> 0 | E67: ='\IDPA\FORMS\[match_scoresheet.xls]S6'!C$24 -> 1 | F67: ='\IDPA\FORMS\[match_scoresheet.xls]S6'!D$24 -> 18 | G67: ='\IDPA\FORMS\[match_scoresheet.xls]S6'!E$24 -> 1
A68: 9 | B68: ='\IDPA\FORMS\[match_scoresheet.xls]S7'!$B$1 -> Bill Dezell | C68: ='\IDPA\FORMS\[match_scoresheet.xls]S7'!$F$24 -> 21 | D68: ='\IDPA\FORMS\[match_scoresheet.xls]S7'!B$24 -> 3 | E68: ='\IDPA\FORMS\[match_scoresheet.xls]S7'!C$24 -> 5 | F68: ='\IDPA\FORMS\[match_scoresheet.xls]S7'!D$24 -> 1 | G68: ='\IDPA\FORMS\[match_scoresheet.xls]S7'!E$24 -> 12
A69: 10 | B69: ='\IDPA\FORMS\[match_scoresheet.xls]S14'!$B$1 -> Carol Perez | C69: ='\IDPA\FORMS\[match_scoresheet.xls]S14'!$F$24 -> 21 | D69: ='\IDPA\FORMS\[match_scoresheet.xls]S14'!B$24 -> 0 | E69: ='\IDPA\FORMS\[match_scoresheet.xls]S14'!C$24 -> 12 | F69: ='\IDPA\FORMS\[match_scoresheet.xls]S14'!D$24 -> 1 | G69: ='\IDPA\FORMS\[match_scoresheet.xls]S14'!E$24 -> 8
A70: 11 | B70: ='\IDPA\FORMS\[match_scoresheet.xls]S9'!$B$1 -> Justin Park | C70: ='\IDPA\FORMS\[match_scoresheet.xls]S9'!$F$24 -> 27 | D70: ='\IDPA\FORMS\[match_scoresheet.xls]S9'!B$24 -> 5 | E70: ='\IDPA\FORMS\[match_scoresheet.xls]S9'!C$24 -> 5 | F70: ='\IDPA\FORMS\[match_scoresheet.xls]S9'!D$24 -> 16 | G70: ='\IDPA\FORMS\[match_scoresheet.xls]S9'!E$24 -> 1
A71: 12 | B71: ='\IDPA\FORMS\[match_scoresheet.xls]S12'!$B$1 -> R Dan Phillips | C71: ='\IDPA\FORMS\[match_scoresheet.xls]S12'!$F$24 -> 28 | D71: ='\IDPA\FORMS\[match_scoresheet.xls]S12'!B$24 -> 1 | E71: ='\IDPA\FORMS\[match_scoresheet.xls]S12'!C$24 -> 6 | F71: ='\IDPA\FORMS\[match_scoresheet.xls]S12'!D$24 -> 13 | G71: ='\IDPA\FORMS\[match_scoresheet.xls]S12'!E$24 -> 8
A72: 13 | B72: ='\IDPA\FORMS\[match_scoresheet.xls]S20'!$B$1 -> Carl Burney | C72: ='\IDPA\FORMS\[match_scoresheet.xls]S20'!$F$24 -> 33 | D72: ='\IDPA\FORMS\[match_scoresheet.xls]S20'!B$24 -> 1 | E72: ='\IDPA\FORMS\[match_scoresheet.xls]S20'!C$24 -> 25 | F72: ='\IDPA\FORMS\[match_scoresheet.xls]S20'!D$24 -> 7 | G72: ='\IDPA\FORMS\[match_scoresheet.xls]S20'!E$24 -> 0
A73: 14 | B73: ='\IDPA\FORMS\[match_scoresheet.xls]S3'!$B$1 -> John Diamond | C73: ='\IDPA\FORMS\[match_scoresheet.xls]S3'!$F$24 -> 36 | D73: ='\IDPA\FORMS\[match_scoresheet.xls]S3'!B$24 -> 0 | E73: ='\IDPA\FORMS\[match_scoresheet.xls]S3'!C$24 -> 15 | F73: ='\IDPA\FORMS\[match_scoresheet.xls]S3'!D$24 -> 20 | G73: ='\IDPA\FORMS\[match_scoresheet.xls]S3'!E$24 -> 1
A74: 15 | B74: ='\IDPA\FORMS\[match_scoresheet.xls]S4'!$B$1 -> Roger Cox | C74: ='\IDPA\FORMS\[match_scoresheet.xls]S4'!$F$24 -> 38 | D74: ='\IDPA\FORMS\[match_scoresheet.xls]S4'!B$24 -> 0 | E74: ='\IDPA\FORMS\[match_scoresheet.xls]S4'!C$24 -> 22 | F74: ='\IDPA\FORMS\[match_scoresheet.xls]S4'!D$24 -> 15 | G74: ='\IDPA\FORMS\[match_scoresheet.xls]S4'!E$24 -> 1
A75: 16 | B75: ='\IDPA\FORMS\[match_scoresheet.xls]S18'!$B$1 -> Mike Brownlee | C75: ='\IDPA\FORMS\[match_scoresheet.xls]S18'!$F$24 -> 45 | D75: ='\IDPA\FORMS\[match_scoresheet.xls]S18'!B$24 -> 3 | E75: ='\IDPA\FORMS\[match_scoresheet.xls]S18'!C$24 -> 11 | F75: ='\IDPA\FORMS\[match_scoresheet.xls]S18'!D$24 -> 23 | G75: ='\IDPA\FORMS\[match_scoresheet.xls]S18'!E$24 -> 8
A76: 17 | B76: ='\IDPA\FORMS\[match_scoresheet.xls]S11'!$B$1 -> Dane Burden | C76: ='\IDPA\FORMS\[match_scoresheet.xls]S11'!$F$24 -> 47 | D76: ='\IDPA\FORMS\[match_scoresheet.xls]S11'!B$24 -> 3 | E76: ='\IDPA\FORMS\[match_scoresheet.xls]S11'!C$24 -> 11 | F76: ='\IDPA\FORMS\[match_scoresheet.xls]S11'!D$24 -> 26 | G76: ='\IDPA\FORMS\[match_scoresheet.xls]S11'!E$24 -> 7
A77: 18 | B77: ='\IDPA\FORMS\[match_scoresheet.xls]S19'!$B$1 -> Erin Herring | C77: ='\IDPA\FORMS\[match_scoresheet.xls]S19'!$F$24 -> 53 | D77: ='\IDPA\FORMS\[match_scoresheet.xls]S19'!B$24 -> 0 | E77: ='\IDPA\FORMS\[match_scoresheet.xls]S19'!C$24 -> 5 | F77: ='\IDPA\FORMS\[match_scoresheet.xls]S19'!D$24 -> 35 | G77: ='\IDPA\FORMS\[match_scoresheet.xls]S19'!E$24 -> 13
A78: 19 | B78: ='\IDPA\FORMS\[match_scoresheet.xls]S17'!$B$1 -> George Crawford | C78: ='\IDPA\FORMS\[match_scoresheet.xls]S17'!$F$24 -> 59 | D78: ='\IDPA\FORMS\[match_scoresheet.xls]S17'!B$24 -> 0 | E78: ='\IDPA\FORMS\[match_scoresheet.xls]S17'!C$24 -> 24 | F78: ='\IDPA\FORMS\[match_scoresheet.xls]S17'!D$24 -> 32 | G78: ='\IDPA\FORMS\[match_scoresheet.xls]S17'!E$24 -> 3
A79: 20 | B79: ='\IDPA\FORMS\[match_scoresheet.xls]S13'!$B$1 -> Andrew Johnson | C79: ='\IDPA\FORMS\[match_scoresheet.xls]S13'!$F$24 -> 74 | D79: ='\IDPA\FORMS\[match_scoresheet.xls]S13'!B$24 -> 0 | E79: ='\IDPA\FORMS\[match_scoresheet.xls]S13'!C$24 -> 28 | F79: ='\IDPA\FORMS\[match_scoresheet.xls]S13'!D$24 -> 36 | G79: ='\IDPA\FORMS\[match_scoresheet.xls]S13'!E$24 -> 10
A80: 21 | B80: ='\IDPA\FORMS\[match_scoresheet.xls]S10'!$B$1 -> Jennifer McDermid | C80: ='\IDPA\FORMS\[match_scoresheet.xls]S10'!$F$24 -> 78 | D80: ='\IDPA\FORMS\[match_scoresheet.xls]S10'!B$24 -> 1 | E80: ='\IDPA\FORMS\[match_scoresheet.xls]S10'!C$24 -> 36 | F80: ='\IDPA\FORMS\[match_scoresheet.xls]S10'!D$24 -> 34 | G80: ='\IDPA\FORMS\[match_scoresheet.xls]S10'!E$24 -> 7
A81: 22 | B81: ='\IDPA\FORMS\[match_scoresheet.xls]S22'!$B$1 -> Chris Roach | C81: ='\IDPA\FORMS\[match_scoresheet.xls]S22'!$F$24 -> 14 | D81: ='\IDPA\FORMS\[match_scoresheet.xls]S22'!B$24 -> 5 | E81: DNF | F81: ='\IDPA\FORMS\[match_scoresheet.xls]S22'!D$24 -> 7 | G81: ='\IDPA\FORMS\[match_scoresheet.xls]S22'!E$24 -> 2
A82: S23 | B82: ='\IDPA\FORMS\[match_scoresheet.xls]S23'!$B$1 -> 0 | C82: ='\IDPA\FORMS\[match_scoresheet.xls]S23'!$F$24 -> 0 | D82: ='\IDPA\FORMS\[match_scoresheet.xls]S23'!B$24 -> 0 | E82: ='\IDPA\FORMS\[match_scoresheet.xls]S23'!C$24 -> 0 | F82: ='\IDPA\FORMS\[match_scoresheet.xls]S23'!D$24 -> 0 | G82: ='\IDPA\FORMS\[match_scoresheet.xls]S23'!E$24 -> 0
A83: S24 | B83: ='\IDPA\FORMS\[match_scoresheet.xls]S24'!$B$1 -> 0 | C83: ='\IDPA\FORMS\[match_scoresheet.xls]S24'!$F$24 -> 0 | D83: ='\IDPA\FORMS\[match_scoresheet.xls]S24'!B$24 -> 0 | E83: ='\IDPA\FORMS\[match_scoresheet.xls]S24'!C$24 -> 0 | F83: ='\IDPA\FORMS\[match_scoresheet.xls]S24'!D$24 -> 0 | G83: ='\IDPA\FORMS\[match_scoresheet.xls]S24'!E$24 -> 0
A84: S25 | B84: ='\IDPA\FORMS\[match_scoresheet.xls]S25'!$B$1 -> 0 | C84: ='\IDPA\FORMS\[match_scoresheet.xls]S25'!$F$24 -> 0 | D84: ='\IDPA\FORMS\[match_scoresheet.xls]S25'!B$24 -> 0 | E84: ='\IDPA\FORMS\[match_scoresheet.xls]S25'!C$24 -> 0 | F84: ='\IDPA\FORMS\[match_scoresheet.xls]S25'!D$24 -> 0 | G84: ='\IDPA\FORMS\[match_scoresheet.xls]S25'!E$24 -> 0
A85: Overall Average: | C85: =SUM(C60:C84)/$A$29 -> 30.59090909090909 | D85: =SUM(D60:D84)/$A$29 -> 1.2727272727272727 | E85: =SUM(E60:E84)/$A$29 -> 10.090909090909092 | F85: =SUM(F60:F84)/$A$29 -> 14.727272727272727 | G85: =SUM(G60:G84)/$A$29 -> 4.5