A1: Utah Shooting Academy Oct. 27, 2004
A2: SCORES (Including points down and penalties)
A3: Placing | B3: Name | C3: Match | D3: Stage1 | E3: Stage 2 | F3: Stage 3 | G3: Stage4
A4: 1 | B4: ='[October 27 2004.xls]S13'!$B$1 -> Bryan Mortenson | C4: ='[October 27 2004.xls]S13'!$F$27 -> 61.63 | D4: ='[October 27 2004.xls]S13'!B$27 -> 7.07 | E4: ='[October 27 2004.xls]S13'!C$27 -> 20.82 | F4: ='[October 27 2004.xls]S13'!D$27 -> 8.52 | G4: ='[October 27 2004.xls]S13'!E$27 -> 25.22
A5: 2 | B5: ='[October 27 2004.xls]S19'!$B$1 -> Dave Duncan | C5: ='[October 27 2004.xls]S19'!$F$27 -> 65.84 | D5: ='[October 27 2004.xls]S19'!B$27 -> 5.75 | E5: ='[October 27 2004.xls]S19'!C$27 -> 20.07 | F5: ='[October 27 2004.xls]S19'!D$27 -> 12.54 | G5: ='[October 27 2004.xls]S19'!E$27 -> 27.48
A6: 3 | B6: ='[October 27 2004.xls]S15'!$B$1 -> Dave Beck | C6: ='[October 27 2004.xls]S15'!$F$27 -> 69.37 | D6: ='[October 27 2004.xls]S15'!B$27 -> 6.92 | E6: ='[October 27 2004.xls]S15'!C$27 -> 20.59 | F6: ='[October 27 2004.xls]S15'!D$27 -> 12.03 | G6: ='[October 27 2004.xls]S15'!E$27 -> 29.83
A7: 4 | B7: ='[October 27 2004.xls]S10'!$B$1 -> Les Langford | C7: ='[October 27 2004.xls]S10'!$F$27 -> 75.66 | D7: ='[October 27 2004.xls]S10'!B$27 -> 6.08 | E7: ='[October 27 2004.xls]S10'!C$27 -> 19.62 | F7: ='[October 27 2004.xls]S10'!D$27 -> 13.84 | G7: ='[October 27 2004.xls]S10'!E$27 -> 36.12
A8: 5 | B8: ='[October 27 2004.xls]S20'!$B$1 -> Ken Oliver | C8: ='[October 27 2004.xls]S20'!$F$27 -> 77.55 | D8: ='[October 27 2004.xls]S20'!B$27 -> 8.45 | E8: ='[October 27 2004.xls]S20'!C$27 -> 31.03 | F8: ='[October 27 2004.xls]S20'!D$27 -> 11.76 | G8: ='[October 27 2004.xls]S20'!E$27 -> 26.31
A9: 6 | B9: ='[October 27 2004.xls]S16'!$B$1 -> Neil Hood | C9: ='[October 27 2004.xls]S16'!$F$27 -> 86.34 | D9: ='[October 27 2004.xls]S16'!B$27 -> 6.95 | E9: ='[October 27 2004.xls]S16'!C$27 -> 35.96 | F9: ='[October 27 2004.xls]S16'!D$27 -> 12.59 | G9: ='[October 27 2004.xls]S16'!E$27 -> 30.84
A10: 7 | B10: ='[October 27 2004.xls]S2'!$B$1 -> Robert Carr | C10: ='[October 27 2004.xls]S2'!$F$27 -> 87.26 | D10: ='[October 27 2004.xls]S2'!B$27 -> 12.48 | E10: ='[October 27 2004.xls]S2'!C$27 -> 31.37 | F10: ='[October 27 2004.xls]S2'!D$27 -> 7.42 | G10: ='[October 27 2004.xls]S2'!E$27 -> 35.99
A11: 8 | B11: ='[October 27 2004.xls]S3'!$B$1 -> Carl Burney | C11: ='[October 27 2004.xls]S3'!$F$27 -> 88.40 | D11: ='[October 27 2004.xls]S3'!B$27 -> 8.94 | E11: ='[October 27 2004.xls]S3'!C$27 -> 33.16 | F11: ='[October 27 2004.xls]S3'!D$27 -> 10.96 | G11: ='[October 27 2004.xls]S3'!E$27 -> 35.34
A12: 9 | B12: ='[October 27 2004.xls]S12'!$B$1 -> Jon Bullough | C12: ='[October 27 2004.xls]S12'!$F$27 -> 92.54 | D12: ='[October 27 2004.xls]S12'!B$27 -> 7.85 | E12: ='[October 27 2004.xls]S12'!C$27 -> 25.77 | F12: ='[October 27 2004.xls]S12'!D$27 -> 14.39 | G12: ='[October 27 2004.xls]S12'!E$27 -> 44.53
A13: 10 | B13: ='[October 27 2004.xls]S4'!$B$1 -> Danimal | C13: ='[October 27 2004.xls]S4'!$F$27 -> 93.12 | D13: ='[October 27 2004.xls]S4'!B$27 -> 9.11 | E13: ='[October 27 2004.xls]S4'!C$27 -> 28.60 | F13: ='[October 27 2004.xls]S4'!D$27 -> 14.97 | G13: ='[October 27 2004.xls]S4'!E$27 -> 40.44
A14: 11 | B14: ='[October 27 2004.xls]S1'!$B$1 -> Milse Barnes | C14: ='[October 27 2004.xls]S1'!$F$27 -> 93.28 | D14: ='[October 27 2004.xls]S1'!B$27 -> 6.94 | E14: ='[October 27 2004.xls]S1'!C$27 -> 31.57 | F14: ='[October 27 2004.xls]S1'!D$27 -> 12.50 | G14: ='[October 27 2004.xls]S1'!E$27 -> 42.27
A15: 12 | B15: ='[October 27 2004.xls]S8'!$B$1 -> Harold Simpson | C15: ='[October 27 2004.xls]S8'!$F$27 -> 97.14 | D15: ='[October 27 2004.xls]S8'!B$27 -> 18.29 | E15: ='[October 27 2004.xls]S8'!C$27 -> 31.12 | F15: ='[October 27 2004.xls]S8'!D$27 -> 9.98 | G15: ='[October 27 2004.xls]S8'!E$27 -> 37.75
A16: 13 | B16: ='[October 27 2004.xls]S18'!$B$1 -> Ken Thorne | C16: ='[October 27 2004.xls]S18'!$F$27 -> 100.91 | D16: ='[October 27 2004.xls]S18'!B$27 -> 10.97 | E16: ='[October 27 2004.xls]S18'!C$27 -> 34.01 | F16: ='[October 27 2004.xls]S18'!D$27 -> 17.99 | G16: ='[October 27 2004.xls]S18'!E$27 -> 37.94
A17: 14 | B17: ='[October 27 2004.xls]S7'!$B$1 -> Bill Dezell | C17: ='[October 27 2004.xls]S7'!$F$27 -> 101.01 | D17: ='[October 27 2004.xls]S7'!B$27 -> 7.28 | E17: ='[October 27 2004.xls]S7'!C$27 -> 33.45 | F17: ='[October 27 2004.xls]S7'!D$27 -> 17.67 | G17: ='[October 27 2004.xls]S7'!E$27 -> 42.61
A18: 15 | B18: ='[October 27 2004.xls]S5'!$B$1 -> Erin Herring | C18: ='[October 27 2004.xls]S5'!$F$27 -> 104.50 | D18: ='[October 27 2004.xls]S5'!B$27 -> 15.90 | E18: ='[October 27 2004.xls]S5'!C$27 -> 32.47 | F18: ='[October 27 2004.xls]S5'!D$27 -> 15.71 | G18: ='[October 27 2004.xls]S5'!E$27 -> 40.42
A19: 16 | B19: ='[October 27 2004.xls]S9'!$B$1 -> Jennifer McDermind | C19: ='[October 27 2004.xls]S9'!$F$27 -> 107.49 | D19: ='[October 27 2004.xls]S9'!B$27 -> 8.60 | E19: ='[October 27 2004.xls]S9'!C$27 -> 26.68 | F19: ='[October 27 2004.xls]S9'!D$27 -> 27.45 | G19: ='[October 27 2004.xls]S9'!E$27 -> 44.76
A20: 17 | B20: ='[October 27 2004.xls]S14'!$B$1 -> Carol Perez | C20: ='[October 27 2004.xls]S14'!$F$27 -> 111.33 | D20: ='[October 27 2004.xls]S14'!B$27 -> 13.36 | E20: ='[October 27 2004.xls]S14'!C$27 -> 29.72 | F20: ='[October 27 2004.xls]S14'!D$27 -> 18.61 | G20: ='[October 27 2004.xls]S14'!E$27 -> 49.64
A21: 18 | B21: ='[October 27 2004.xls]S11'!$B$1 -> Roger Cox | C21: ='[October 27 2004.xls]S11'!$F$27 -> 122.00 | D21: ='[October 27 2004.xls]S11'!B$27 -> 13.83 | E21: ='[October 27 2004.xls]S11'!C$27 -> 28.24 | F21: ='[October 27 2004.xls]S11'!D$27 -> 32.92 | G21: ='[October 27 2004.xls]S11'!E$27 -> 47.01
A22: 19 | B22: ='[October 27 2004.xls]S17'!$B$1 -> Greg Ellingson | C22: ='[October 27 2004.xls]S17'!$F$27 -> 135.49 | D22: ='[October 27 2004.xls]S17'!B$27 -> 8.01 | E22: ='[October 27 2004.xls]S17'!C$27 -> 32.96 | F22: ='[October 27 2004.xls]S17'!D$27 -> 23.83 | G22: ='[October 27 2004.xls]S17'!E$27 -> 70.69
A23: 20 | B23: ='[October 27 2004.xls]S6'!$B$1 -> Chris Roach | C23: ='[October 27 2004.xls]S6'!$F$27 -> 31.86 | D23: ='[October 27 2004.xls]S6'!B$27 -> 5.44 | E23: ='[October 27 2004.xls]S6'!C$27 -> 20.69 | F23: ='[October 27 2004.xls]S6'!D$27 -> 5.73 | G23: ='[October 27 2004.xls]S6'!E$27 -> 0.00
A24: S21
A25: S22 | B25: ='[October 27 2004.xls]S22'!$B$1 -> 0 | C25: ='[October 27 2004.xls]S22'!$F$27 -> 0.00 | D25: ='[October 27 2004.xls]S22'!B$27 -> 0.00 | E25: ='[October 27 2004.xls]S22'!C$27 -> 0.00 | F25: ='[October 27 2004.xls]S22'!D$27 -> 0.00 | G25: ='[October 27 2004.xls]S22'!E$27 -> 0.00
A26: S23 | B26: ='[October 27 2004.xls]S23'!$B$1 -> 0 | C26: ='[October 27 2004.xls]S23'!$F$27 -> 0.00 | D26: ='[October 27 2004.xls]S23'!B$27 -> 0.00 | E26: ='[October 27 2004.xls]S23'!C$27 -> 0.00 | F26: ='[October 27 2004.xls]S23'!D$27 -> 0.00 | G26: ='[October 27 2004.xls]S23'!E$27 -> 0.00
A27: S24 | B27: ='[October 27 2004.xls]S24'!$B$1 -> 0 | C27: ='[October 27 2004.xls]S24'!$F$27 -> 0.00 | D27: ='[October 27 2004.xls]S24'!B$27 -> 0.00 | E27: ='[October 27 2004.xls]S24'!C$27 -> 0.00 | F27: ='[October 27 2004.xls]S24'!D$27 -> 0.00 | G27: ='[October 27 2004.xls]S24'!E$27 -> 0.00
A28: S25 | B28: ='[October 27 2004.xls]S25'!$B$1 -> 0 | C28: ='[October 27 2004.xls]S25'!$F$27 -> 0.00 | D28: ='[October 27 2004.xls]S25'!B$27 -> 0.00 | E28: ='[October 27 2004.xls]S25'!C$27 -> 0.00 | F28: ='[October 27 2004.xls]S25'!D$27 -> 0.00 | G28: ='[October 27 2004.xls]S25'!E$27 -> 0.00
A29: =COUNTIF($C$4:$C$28,">0") -> 20 | B29: Overall Average: | C29: =SUM(C4:C28)/$A$29 -> 90.135999999999996 | D29: =SUM(D4:D28)/$A$29 -> 9.4109999999999996 | E29: =SUM(E4:E28)/$A$29 -> 28.395 | F29: =SUM(F4:F28)/$A$29 -> 15.070499999999999 | G29: =SUM(G4:G28)/$A$29 -> 37.259500000000003
A30: RAW TIMES
A31: Placing | B31: Name | C31: Match | D31: Stage1 | E31: Stage 2 | F31: Stage 3 | G31: Stage4
A32: 1 | B32: ='[October 27 2004.xls]S15'!$B$1 -> Dave Beck | C32: ='[October 27 2004.xls]S15'!$F$23 -> 53.37 | D32: ='[October 27 2004.xls]S15'!B$23 -> 4.92 | E32: ='[October 27 2004.xls]S15'!C$23 -> 15.09 | F32: ='[October 27 2004.xls]S15'!D$23 -> 11.03 | G32: ='[October 27 2004.xls]S15'!E$23 -> 22.33
A33: 2 | B33: ='[October 27 2004.xls]S13'!$B$1 -> Bryan Mortenson | C33: ='[October 27 2004.xls]S13'!$F$23 -> 54.13 | D33: ='[October 27 2004.xls]S13'!B$23 -> 7.07 | E33: ='[October 27 2004.xls]S13'!C$23 -> 16.32 | F33: ='[October 27 2004.xls]S13'!D$23 -> 8.52 | G33: ='[October 27 2004.xls]S13'!E$23 -> 22.22
A34: 3 | B34: ='[October 27 2004.xls]S19'!$B$1 -> Dave Duncan | C34: ='[October 27 2004.xls]S19'!$F$23 -> 55.84 | D34: ='[October 27 2004.xls]S19'!B$23 -> 4.75 | E34: ='[October 27 2004.xls]S19'!C$23 -> 18.07 | F34: ='[October 27 2004.xls]S19'!D$23 -> 7.54 | G34: ='[October 27 2004.xls]S19'!E$23 -> 25.48
A35: 4 | B35: ='[October 27 2004.xls]S10'!$B$1 -> Les Langford | C35: ='[October 27 2004.xls]S10'!$F$23 -> 56.66 | D35: ='[October 27 2004.xls]S10'!B$23 -> 5.08 | E35: ='[October 27 2004.xls]S10'!C$23 -> 17.12 | F35: ='[October 27 2004.xls]S10'!D$23 -> 13.34 | G35: ='[October 27 2004.xls]S10'!E$23 -> 21.12
A36: 5 | B36: ='[October 27 2004.xls]S20'!$B$1 -> Ken Oliver | C36: ='[October 27 2004.xls]S20'!$F$23 -> 67.55 | D36: ='[October 27 2004.xls]S20'!B$23 -> 6.95 | E36: ='[October 27 2004.xls]S20'!C$23 -> 30.53 | F36: ='[October 27 2004.xls]S20'!D$23 -> 8.26 | G36: ='[October 27 2004.xls]S20'!E$23 -> 21.81
A37: 6 | B37: ='[October 27 2004.xls]S3'!$B$1 -> Carl Burney | C37: ='[October 27 2004.xls]S3'!$F$23 -> 69.40 | D37: ='[October 27 2004.xls]S3'!B$23 -> 6.94 | E37: ='[October 27 2004.xls]S3'!C$23 -> 29.16 | F37: ='[October 27 2004.xls]S3'!D$23 -> 10.46 | G37: ='[October 27 2004.xls]S3'!E$23 -> 22.84
A38: 7 | B38: ='[October 27 2004.xls]S1'!$B$1 -> Milse Barnes | C38: ='[October 27 2004.xls]S1'!$F$23 -> 74.28 | D38: ='[October 27 2004.xls]S1'!B$23 -> 6.44 | E38: ='[October 27 2004.xls]S1'!C$23 -> 30.57 | F38: ='[October 27 2004.xls]S1'!D$23 -> 12.50 | G38: ='[October 27 2004.xls]S1'!E$23 -> 24.77
A39: 8 | B39: ='[October 27 2004.xls]S4'!$B$1 -> Danimal | C39: ='[October 27 2004.xls]S4'!$F$23 -> 76.62 | D39: ='[October 27 2004.xls]S4'!B$23 -> 8.61 | E39: ='[October 27 2004.xls]S4'!C$23 -> 28.60 | F39: ='[October 27 2004.xls]S4'!D$23 -> 11.47 | G39: ='[October 27 2004.xls]S4'!E$23 -> 27.94
A40: 9 | B40: ='[October 27 2004.xls]S2'!$B$1 -> Robert Carr | C40: ='[October 27 2004.xls]S2'!$F$23 -> 77.76 | D40: ='[October 27 2004.xls]S2'!B$23 -> 9.98 | E40: ='[October 27 2004.xls]S2'!C$23 -> 27.87 | F40: ='[October 27 2004.xls]S2'!D$23 -> 7.42 | G40: ='[October 27 2004.xls]S2'!E$23 -> 32.49
A41: 10 | B41: ='[October 27 2004.xls]S16'!$B$1 -> Neil Hood | C41: ='[October 27 2004.xls]S16'!$F$23 -> 79.84 | D41: ='[October 27 2004.xls]S16'!B$23 -> 6.95 | E41: ='[October 27 2004.xls]S16'!C$23 -> 35.96 | F41: ='[October 27 2004.xls]S16'!D$23 -> 11.09 | G41: ='[October 27 2004.xls]S16'!E$23 -> 25.84
A42: 11 | B42: ='[October 27 2004.xls]S9'!$B$1 -> Jennifer McDermind | C42: ='[October 27 2004.xls]S9'!$F$23 -> 80.99 | D42: ='[October 27 2004.xls]S9'!B$23 -> 6.60 | E42: ='[October 27 2004.xls]S9'!C$23 -> 22.68 | F42: ='[October 27 2004.xls]S9'!D$23 -> 22.95 | G42: ='[October 27 2004.xls]S9'!E$23 -> 28.76
A43: 12 | B43: ='[October 27 2004.xls]S8'!$B$1 -> Harold Simpson | C43: ='[October 27 2004.xls]S8'!$F$23 -> 83.14 | D43: ='[October 27 2004.xls]S8'!B$23 -> 17.79 | E43: ='[October 27 2004.xls]S8'!C$23 -> 24.12 | F43: ='[October 27 2004.xls]S8'!D$23 -> 9.98 | G43: ='[October 27 2004.xls]S8'!E$23 -> 31.25
A44: 13 | B44: ='[October 27 2004.xls]S12'!$B$1 -> Jon Bullough | C44: ='[October 27 2004.xls]S12'!$F$23 -> 84.04 | D44: ='[October 27 2004.xls]S12'!B$23 -> 7.35 | E44: ='[October 27 2004.xls]S12'!C$23 -> 22.77 | F44: ='[October 27 2004.xls]S12'!D$23 -> 10.89 | G44: ='[October 27 2004.xls]S12'!E$23 -> 43.03
A45: 14 | B45: ='[October 27 2004.xls]S18'!$B$1 -> Ken Thorne | C45: ='[October 27 2004.xls]S18'!$F$23 -> 84.91 | D45: ='[October 27 2004.xls]S18'!B$23 -> 7.97 | E45: ='[October 27 2004.xls]S18'!C$23 -> 32.01 | F45: ='[October 27 2004.xls]S18'!D$23 -> 15.49 | G45: ='[October 27 2004.xls]S18'!E$23 -> 29.44
A46: 15 | B46: ='[October 27 2004.xls]S14'!$B$1 -> Carol Perez | C46: ='[October 27 2004.xls]S14'!$F$23 -> 85.33 | D46: ='[October 27 2004.xls]S14'!B$23 -> 11.36 | E46: ='[October 27 2004.xls]S14'!C$23 -> 23.72 | F46: ='[October 27 2004.xls]S14'!D$23 -> 14.61 | G46: ='[October 27 2004.xls]S14'!E$23 -> 35.64
A47: 16 | B47: ='[October 27 2004.xls]S5'!$B$1 -> Erin Herring | C47: ='[October 27 2004.xls]S5'!$F$23 -> 88.50 | D47: ='[October 27 2004.xls]S5'!B$23 -> 10.90 | E47: ='[October 27 2004.xls]S5'!C$23 -> 28.47 | F47: ='[October 27 2004.xls]S5'!D$23 -> 15.71 | G47: ='[October 27 2004.xls]S5'!E$23 -> 33.42
A48: 17 | B48: ='[October 27 2004.xls]S7'!$B$1 -> Bill Dezell | C48: ='[October 27 2004.xls]S7'!$F$23 -> 88.51 | D48: ='[October 27 2004.xls]S7'!B$23 -> 6.78 | E48: ='[October 27 2004.xls]S7'!C$23 -> 28.45 | F48: ='[October 27 2004.xls]S7'!D$23 -> 14.17 | G48: ='[October 27 2004.xls]S7'!E$23 -> 39.11
A49: 18 | B49: ='[October 27 2004.xls]S11'!$B$1 -> Roger Cox | C49: ='[October 27 2004.xls]S11'!$F$23 -> 103.50 | D49: ='[October 27 2004.xls]S11'!B$23 -> 12.83 | E49: ='[October 27 2004.xls]S11'!C$23 -> 22.74 | F49: ='[October 27 2004.xls]S11'!D$23 -> 32.42 | G49: ='[October 27 2004.xls]S11'!E$23 -> 35.51
A50: 19 | B50: ='[October 27 2004.xls]S17'!$B$1 -> Greg Ellingson | C50: ='[October 27 2004.xls]S17'!$F$23 -> 113.99 | D50: ='[October 27 2004.xls]S17'!B$23 -> 6.51 | E50: ='[October 27 2004.xls]S17'!C$23 -> 30.96 | F50: ='[October 27 2004.xls]S17'!D$23 -> 20.83 | G50: ='[October 27 2004.xls]S17'!E$23 -> 55.69
B51: ='[October 27 2004.xls]S6'!$B$1 -> Chris Roach | C51: ='[October 27 2004.xls]S6'!$F$23 -> 24.36 | D51: ='[October 27 2004.xls]S6'!B$23 -> 4.44 | E51: ='[October 27 2004.xls]S6'!C$23 -> 15.19 | F51: ='[October 27 2004.xls]S6'!D$23 -> 4.73 | G51: ='[October 27 2004.xls]S6'!E$23 -> 0.00
A52: S21
A53: S22 | B53: ='[October 27 2004.xls]S22'!$B$1 -> 0 | C53: ='[October 27 2004.xls]S22'!$F$23 -> 0.00 | D53: ='[October 27 2004.xls]S22'!B$23 -> 0.00 | E53: ='[October 27 2004.xls]S22'!C$23 -> 0.00 | F53: ='[October 27 2004.xls]S22'!D$23 -> 0.00 | G53: ='[October 27 2004.xls]S22'!E$23 -> 0.00
A54: S23 | B54: ='[October 27 2004.xls]S23'!$B$1 -> 0 | C54: ='[October 27 2004.xls]S23'!$F$23 -> 0.00 | D54: ='[October 27 2004.xls]S23'!B$23 -> 0.00 | E54: ='[October 27 2004.xls]S23'!C$23 -> 0.00 | F54: ='[October 27 2004.xls]S23'!D$23 -> 0.00 | G54: ='[October 27 2004.xls]S23'!E$23 -> 0.00
A55: S24 | B55: ='[October 27 2004.xls]S24'!$B$1 -> 0 | C55: ='[October 27 2004.xls]S24'!$F$23 -> 0.00 | D55: ='[October 27 2004.xls]S24'!B$23 -> 0.00 | E55: ='[October 27 2004.xls]S24'!C$23 -> 0.00 | F55: ='[October 27 2004.xls]S24'!D$23 -> 0.00 | G55: ='[October 27 2004.xls]S24'!E$23 -> 0.00
A56: S25 | B56: ='[October 27 2004.xls]S25'!$B$1 -> 0 | C56: ='[October 27 2004.xls]S25'!$F$23 -> 0.00 | D56: ='[October 27 2004.xls]S25'!B$23 -> 0.00 | E56: ='[October 27 2004.xls]S25'!C$23 -> 0.00 | F56: ='[October 27 2004.xls]S25'!D$23 -> 0.00 | G56: ='[October 27 2004.xls]S25'!E$23 -> 0.00
A57: Overall Average: | C57: =SUM(C32:C56)/$A$29 -> 75.135999999999996 | D57: =SUM(D32:D56)/$A$29 -> 8.0109999999999992 | E57: =SUM(E32:E56)/$A$29 -> 25.02 | F57: =SUM(F32:F56)/$A$29 -> 13.170500000000001 | G57: =SUM(G32:G56)/$A$29 -> 28.934500000000003
A58: POINTS DOWN
A59: Placing | B59: Name | C59: Match | D59: Stage1 | E59: Stage 2 | F59: Stage 3 | G59: Stage4
A60: 1 | B60: ='[October 27 2004.xls]S16'!$B$1 -> Neil Hood | C60: ='[October 27 2004.xls]S16'!$F$24 -> 13 | D60: ='[October 27 2004.xls]S16'!B$24 -> 0 | E60: ='[October 27 2004.xls]S16'!C$24 -> 0 | F60: ='[October 27 2004.xls]S16'!D$24 -> 3 | G60: ='[October 27 2004.xls]S16'!E$24 -> 10
A61: 2 | B61: ='[October 27 2004.xls]S13'!$B$1 -> Bryan Mortenson | C61: ='[October 27 2004.xls]S13'!$F$24 -> 15 | D61: ='[October 27 2004.xls]S13'!B$24 -> 0 | E61: ='[October 27 2004.xls]S13'!C$24 -> 9 | F61: ='[October 27 2004.xls]S13'!D$24 -> 0 | G61: ='[October 27 2004.xls]S13'!E$24 -> 6
A62: 3 | B62: ='[October 27 2004.xls]S12'!$B$1 -> Jon Bullough | C62: ='[October 27 2004.xls]S12'!$F$24 -> 17 | D62: ='[October 27 2004.xls]S12'!B$24 -> 1 | E62: ='[October 27 2004.xls]S12'!C$24 -> 6 | F62: ='[October 27 2004.xls]S12'!D$24 -> 7 | G62: ='[October 27 2004.xls]S12'!E$24 -> 3
A63: 4 | B63: ='[October 27 2004.xls]S2'!$B$1 -> Robert Carr | C63: ='[October 27 2004.xls]S2'!$F$24 -> 19 | D63: ='[October 27 2004.xls]S2'!B$24 -> 5 | E63: ='[October 27 2004.xls]S2'!C$24 -> 7 | F63: ='[October 27 2004.xls]S2'!D$24 -> 0 | G63: ='[October 27 2004.xls]S2'!E$24 -> 7
A64: 5 | B64: ='[October 27 2004.xls]S19'!$B$1 -> Dave Duncan | C64: ='[October 27 2004.xls]S19'!$F$24 -> 20 | D64: ='[October 27 2004.xls]S19'!B$24 -> 2 | E64: ='[October 27 2004.xls]S19'!C$24 -> 4 | F64: ='[October 27 2004.xls]S19'!D$24 -> 10 | G64: ='[October 27 2004.xls]S19'!E$24 -> 4
A65: 6 | B65: ='[October 27 2004.xls]S20'!$B$1 -> Ken Oliver | C65: ='[October 27 2004.xls]S20'!$F$24 -> 20 | D65: ='[October 27 2004.xls]S20'!B$24 -> 3 | E65: ='[October 27 2004.xls]S20'!C$24 -> 1 | F65: ='[October 27 2004.xls]S20'!D$24 -> 7 | G65: ='[October 27 2004.xls]S20'!E$24 -> 9
A66: 7 | B66: ='[October 27 2004.xls]S5'!$B$1 -> Erin Herring | C66: ='[October 27 2004.xls]S5'!$F$24 -> 22 | D66: ='[October 27 2004.xls]S5'!B$24 -> 10 | E66: ='[October 27 2004.xls]S5'!C$24 -> 8 | F66: ='[October 27 2004.xls]S5'!D$24 -> 0 | G66: ='[October 27 2004.xls]S5'!E$24 -> 4
A67: 8 | B67: ='[October 27 2004.xls]S18'!$B$1 -> Ken Thorne | C67: ='[October 27 2004.xls]S18'!$F$24 -> 22 | D67: ='[October 27 2004.xls]S18'!B$24 -> 6 | E67: ='[October 27 2004.xls]S18'!C$24 -> 4 | F67: ='[October 27 2004.xls]S18'!D$24 -> 5 | G67: ='[October 27 2004.xls]S18'!E$24 -> 7
A68: 9 | B68: ='[October 27 2004.xls]S7'!$B$1 -> Bill Dezell | C68: ='[October 27 2004.xls]S7'!$F$24 -> 25 | D68: ='[October 27 2004.xls]S7'!B$24 -> 1 | E68: ='[October 27 2004.xls]S7'!C$24 -> 10 | F68: ='[October 27 2004.xls]S7'!D$24 -> 7 | G68: ='[October 27 2004.xls]S7'!E$24 -> 7
A69: 10 | B69: ='[October 27 2004.xls]S1'!$B$1 -> Milse Barnes | C69: ='[October 27 2004.xls]S1'!$F$24 -> 28 | D69: ='[October 27 2004.xls]S1'!B$24 -> 1 | E69: ='[October 27 2004.xls]S1'!C$24 -> 2 | F69: ='[October 27 2004.xls]S1'!D$24 -> 0 | G69: ='[October 27 2004.xls]S1'!E$24 -> 25
A70: 11 | B70: ='[October 27 2004.xls]S3'!$B$1 -> Carl Burney | C70: ='[October 27 2004.xls]S3'!$F$24 -> 28 | D70: ='[October 27 2004.xls]S3'!B$24 -> 4 | E70: ='[October 27 2004.xls]S3'!C$24 -> 8 | F70: ='[October 27 2004.xls]S3'!D$24 -> 1 | G70: ='[October 27 2004.xls]S3'!E$24 -> 15
A71: 12 | B71: ='[October 27 2004.xls]S8'!$B$1 -> Harold Simpson | C71: ='[October 27 2004.xls]S8'!$F$24 -> 28 | D71: ='[October 27 2004.xls]S8'!B$24 -> 1 | E71: ='[October 27 2004.xls]S8'!C$24 -> 14 | F71: ='[October 27 2004.xls]S8'!D$24 -> 0 | G71: ='[October 27 2004.xls]S8'!E$24 -> 13
A72: 13 | B72: ='[October 27 2004.xls]S10'!$B$1 -> Les Langford | C72: ='[October 27 2004.xls]S10'!$F$24 -> 28 | D72: ='[October 27 2004.xls]S10'!B$24 -> 2 | E72: ='[October 27 2004.xls]S10'!C$24 -> 5 | F72: ='[October 27 2004.xls]S10'!D$24 -> 1 | G72: ='[October 27 2004.xls]S10'!E$24 -> 20
A73: 14 | B73: ='[October 27 2004.xls]S15'!$B$1 -> Dave Beck | C73: ='[October 27 2004.xls]S15'!$F$24 -> 32 | D73: ='[October 27 2004.xls]S15'!B$24 -> 4 | E73: ='[October 27 2004.xls]S15'!C$24 -> 11 | F73: ='[October 27 2004.xls]S15'!D$24 -> 2 | G73: ='[October 27 2004.xls]S15'!E$24 -> 15
A74: 15 | B74: ='[October 27 2004.xls]S4'!$B$1 -> Danimal | C74: ='[October 27 2004.xls]S4'!$F$24 -> 33 | D74: ='[October 27 2004.xls]S4'!B$24 -> 1 | E74: ='[October 27 2004.xls]S4'!C$24 -> 0 | F74: ='[October 27 2004.xls]S4'!D$24 -> 7 | G74: ='[October 27 2004.xls]S4'!E$24 -> 25
A75: 16 | B75: ='[October 27 2004.xls]S17'!$B$1 -> Greg Ellingson | C75: ='[October 27 2004.xls]S17'!$F$24 -> 33 | D75: ='[October 27 2004.xls]S17'!B$24 -> 3 | E75: ='[October 27 2004.xls]S17'!C$24 -> 4 | F75: ='[October 27 2004.xls]S17'!D$24 -> 6 | G75: ='[October 27 2004.xls]S17'!E$24 -> 20
A76: 17 | B76: ='[October 27 2004.xls]S11'!$B$1 -> Roger Cox | C76: ='[October 27 2004.xls]S11'!$F$24 -> 37 | D76: ='[October 27 2004.xls]S11'!B$24 -> 2 | E76: ='[October 27 2004.xls]S11'!C$24 -> 11 | F76: ='[October 27 2004.xls]S11'!D$24 -> 1 | G76: ='[October 27 2004.xls]S11'!E$24 -> 23
A77: 18 | B77: ='[October 27 2004.xls]S9'!$B$1 -> Jennifer McDermind | C77: ='[October 27 2004.xls]S9'!$F$24 -> 43 | D77: ='[October 27 2004.xls]S9'!B$24 -> 4 | E77: ='[October 27 2004.xls]S9'!C$24 -> 8 | F77: ='[October 27 2004.xls]S9'!D$24 -> 9 | G77: ='[October 27 2004.xls]S9'!E$24 -> 22
A78: 19 | B78: ='[October 27 2004.xls]S14'!$B$1 -> Carol Perez | C78: ='[October 27 2004.xls]S14'!$F$24 -> 52 | D78: ='[October 27 2004.xls]S14'!B$24 -> 4 | E78: ='[October 27 2004.xls]S14'!C$24 -> 12 | F78: ='[October 27 2004.xls]S14'!D$24 -> 8 | G78: ='[October 27 2004.xls]S14'!E$24 -> 28
A79: 20 | B79: ='[October 27 2004.xls]S6'!$B$1 -> Chris Roach | C79: ='[October 27 2004.xls]S6'!$F$24 -> 15 | D79: ='[October 27 2004.xls]S6'!B$24 -> 2 | E79: ='[October 27 2004.xls]S6'!C$24 -> 11 | F79: ='[October 27 2004.xls]S6'!D$24 -> 2 | G79: ='[October 27 2004.xls]S6'!E$24 -> 0
A80: S21
A81: S22 | B81: ='[October 27 2004.xls]S22'!$B$1 -> 0 | C81: ='[October 27 2004.xls]S22'!$F$24 -> 0 | D81: ='[October 27 2004.xls]S22'!B$24 -> 0 | E81: ='[October 27 2004.xls]S22'!C$24 -> 0 | F81: ='[October 27 2004.xls]S22'!D$24 -> 0 | G81: ='[October 27 2004.xls]S22'!E$24 -> 0
A82: S23 | B82: ='[October 27 2004.xls]S23'!$B$1 -> 0 | C82: ='[October 27 2004.xls]S23'!$F$24 -> 0 | D82: ='[October 27 2004.xls]S23'!B$24 -> 0 | E82: ='[October 27 2004.xls]S23'!C$24 -> 0 | F82: ='[October 27 2004.xls]S23'!D$24 -> 0 | G82: ='[October 27 2004.xls]S23'!E$24 -> 0
A83: S24 | B83: ='[October 27 2004.xls]S24'!$B$1 -> 0 | C83: ='[October 27 2004.xls]S24'!$F$24 -> 0 | D83: ='[October 27 2004.xls]S24'!B$24 -> 0 | E83: ='[October 27 2004.xls]S24'!C$24 -> 0 | F83: ='[October 27 2004.xls]S24'!D$24 -> 0 | G83: ='[October 27 2004.xls]S24'!E$24 -> 0
A84: S25 | B84: ='[October 27 2004.xls]S25'!$B$1 -> 0 | C84: ='[October 27 2004.xls]S25'!$F$24 -> 0 | D84: ='[October 27 2004.xls]S25'!B$24 -> 0 | E84: ='[October 27 2004.xls]S25'!C$24 -> 0 | F84: ='[October 27 2004.xls]S25'!D$24 -> 0 | G84: ='[October 27 2004.xls]S25'!E$24 -> 0
A85: Overall Average: | C85: =SUM(C60:C84)/$A$29 -> 26.5 | D85: =SUM(D60:D84)/$A$29 -> 2.8 | E85: =SUM(E60:E84)/$A$29 -> 6.75 | F85: =SUM(F60:F84)/$A$29 -> 3.8 | G85: =SUM(G60:G84)/$A$29 -> 13.15