A1: Utah Shooting Academy Sept. 15, 2004
A2: SCORES (Including Points Down and Penalties.)
A3: Number | B3: Name | C3: Match | D3: Stage1 | E3: Stage 2 | F3: Stage 3 | G3: Stage4
A4: 1 | B4: ='\Documents and Settings\Chris\My Documents\IDPA\Forms\Match Scores\[September 15 2004.xls]S4'!$B$1 -> Juke Zaccardi | C4: ='\Documents and Settings\Chris\My Documents\IDPA\Forms\Match Scores\[September 15 2004.xls]S4'!$F$27 -> 53.13 | D4: ='\Documents and Settings\Chris\My Documents\IDPA\Forms\Match Scores\[September 15 2004.xls]S4'!B$27 -> 7.40 | E4: ='\Documents and Settings\Chris\My Documents\IDPA\Forms\Match Scores\[September 15 2004.xls]S4'!C$27 -> 16.70 | F4: ='\Documents and Settings\Chris\My Documents\IDPA\Forms\Match Scores\[September 15 2004.xls]S4'!D$27 -> 10.23 | G4: ='\Documents and Settings\Chris\My Documents\IDPA\Forms\Match Scores\[September 15 2004.xls]S4'!E$27 -> 18.80
A5: 2 | B5: ='\Documents and Settings\Chris\My Documents\IDPA\Forms\Match Scores\[September 15 2004.xls]S5'!$B$1 -> Pat Zaccardi | C5: ='\Documents and Settings\Chris\My Documents\IDPA\Forms\Match Scores\[September 15 2004.xls]S5'!$F$27 -> 53.19 | D5: ='\Documents and Settings\Chris\My Documents\IDPA\Forms\Match Scores\[September 15 2004.xls]S5'!B$27 -> 7.46 | E5: ='\Documents and Settings\Chris\My Documents\IDPA\Forms\Match Scores\[September 15 2004.xls]S5'!C$27 -> 11.76 | F5: ='\Documents and Settings\Chris\My Documents\IDPA\Forms\Match Scores\[September 15 2004.xls]S5'!D$27 -> 7.63 | G5: ='\Documents and Settings\Chris\My Documents\IDPA\Forms\Match Scores\[September 15 2004.xls]S5'!E$27 -> 26.34
A6: 3 | B6: ='\Documents and Settings\Chris\My Documents\IDPA\Forms\Match Scores\[September 15 2004.xls]S14'!$B$1 -> Ari Theodore | C6: ='\Documents and Settings\Chris\My Documents\IDPA\Forms\Match Scores\[September 15 2004.xls]S14'!$F$27 -> 54.03 | D6: ='\Documents and Settings\Chris\My Documents\IDPA\Forms\Match Scores\[September 15 2004.xls]S14'!B$27 -> 8.09 | E6: ='\Documents and Settings\Chris\My Documents\IDPA\Forms\Match Scores\[September 15 2004.xls]S14'!C$27 -> 14.38 | F6: ='\Documents and Settings\Chris\My Documents\IDPA\Forms\Match Scores\[September 15 2004.xls]S14'!D$27 -> 8.46 | G6: ='\Documents and Settings\Chris\My Documents\IDPA\Forms\Match Scores\[September 15 2004.xls]S14'!E$27 -> 23.10
A7: 4 | B7: ='\Documents and Settings\Chris\My Documents\IDPA\Forms\Match Scores\[September 15 2004.xls]S21'!$B$1 -> Bryan Mortenson | C7: ='\Documents and Settings\Chris\My Documents\IDPA\Forms\Match Scores\[September 15 2004.xls]S21'!$F$27 -> 57.89 | D7: ='\Documents and Settings\Chris\My Documents\IDPA\Forms\Match Scores\[September 15 2004.xls]S21'!B$27 -> 7.80 | E7: ='\Documents and Settings\Chris\My Documents\IDPA\Forms\Match Scores\[September 15 2004.xls]S21'!C$27 -> 13.27 | F7: ='\Documents and Settings\Chris\My Documents\IDPA\Forms\Match Scores\[September 15 2004.xls]S21'!D$27 -> 9.56 | G7: ='\Documents and Settings\Chris\My Documents\IDPA\Forms\Match Scores\[September 15 2004.xls]S21'!E$27 -> 27.26
A8: 5 | B8: ='\Documents and Settings\Chris\My Documents\IDPA\Forms\Match Scores\[September 15 2004.xls]S3'!$B$1 -> Chris Roach | C8: ='\Documents and Settings\Chris\My Documents\IDPA\Forms\Match Scores\[September 15 2004.xls]S3'!$F$27 -> 63.45 | D8: ='\Documents and Settings\Chris\My Documents\IDPA\Forms\Match Scores\[September 15 2004.xls]S3'!B$27 -> 8.85 | E8: ='\Documents and Settings\Chris\My Documents\IDPA\Forms\Match Scores\[September 15 2004.xls]S3'!C$27 -> 13.10 | F8: ='\Documents and Settings\Chris\My Documents\IDPA\Forms\Match Scores\[September 15 2004.xls]S3'!D$27 -> 17.50 | G8: ='\Documents and Settings\Chris\My Documents\IDPA\Forms\Match Scores\[September 15 2004.xls]S3'!E$27 -> 24.00
A9: 6 | B9: ='\Documents and Settings\Chris\My Documents\IDPA\Forms\Match Scores\[September 15 2004.xls]S16'!$B$1 -> Justin Park | C9: ='\Documents and Settings\Chris\My Documents\IDPA\Forms\Match Scores\[September 15 2004.xls]S16'!$F$27 -> 68.70 | D9: ='\Documents and Settings\Chris\My Documents\IDPA\Forms\Match Scores\[September 15 2004.xls]S16'!B$27 -> 10.35 | E9: ='\Documents and Settings\Chris\My Documents\IDPA\Forms\Match Scores\[September 15 2004.xls]S16'!C$27 -> 19.45 | F9: ='\Documents and Settings\Chris\My Documents\IDPA\Forms\Match Scores\[September 15 2004.xls]S16'!D$27 -> 7.38 | G9: ='\Documents and Settings\Chris\My Documents\IDPA\Forms\Match Scores\[September 15 2004.xls]S16'!E$27 -> 31.52
A10: 7 | B10: ='\Documents and Settings\Chris\My Documents\IDPA\Forms\Match Scores\[September 15 2004.xls]S9'!$B$1 -> Roger "Don't Run" Cox | C10: ='\Documents and Settings\Chris\My Documents\IDPA\Forms\Match Scores\[September 15 2004.xls]S9'!$F$27 -> 69.29 | D10: ='\Documents and Settings\Chris\My Documents\IDPA\Forms\Match Scores\[September 15 2004.xls]S9'!B$27 -> 8.72 | E10: ='\Documents and Settings\Chris\My Documents\IDPA\Forms\Match Scores\[September 15 2004.xls]S9'!C$27 -> 14.27 | F10: ='\Documents and Settings\Chris\My Documents\IDPA\Forms\Match Scores\[September 15 2004.xls]S9'!D$27 -> 12.95 | G10: ='\Documents and Settings\Chris\My Documents\IDPA\Forms\Match Scores\[September 15 2004.xls]S9'!E$27 -> 33.35
A11: 8 | B11: ='\Documents and Settings\Chris\My Documents\IDPA\Forms\Match Scores\[September 15 2004.xls]S10'!$B$1 -> Milos Krivka | C11: ='\Documents and Settings\Chris\My Documents\IDPA\Forms\Match Scores\[September 15 2004.xls]S10'!$F$27 -> 73.33 | D11: ='\Documents and Settings\Chris\My Documents\IDPA\Forms\Match Scores\[September 15 2004.xls]S10'!B$27 -> 9.16 | E11: ='\Documents and Settings\Chris\My Documents\IDPA\Forms\Match Scores\[September 15 2004.xls]S10'!C$27 -> 22.81 | F11: ='\Documents and Settings\Chris\My Documents\IDPA\Forms\Match Scores\[September 15 2004.xls]S10'!D$27 -> 11.41 | G11: ='\Documents and Settings\Chris\My Documents\IDPA\Forms\Match Scores\[September 15 2004.xls]S10'!E$27 -> 29.95
A12: 9 | B12: ='\Documents and Settings\Chris\My Documents\IDPA\Forms\Match Scores\[September 15 2004.xls]S17'!$B$1 -> Ren Young | C12: ='\Documents and Settings\Chris\My Documents\IDPA\Forms\Match Scores\[September 15 2004.xls]S17'!$F$27 -> 74.78 | D12: ='\Documents and Settings\Chris\My Documents\IDPA\Forms\Match Scores\[September 15 2004.xls]S17'!B$27 -> 10.50 | E12: ='\Documents and Settings\Chris\My Documents\IDPA\Forms\Match Scores\[September 15 2004.xls]S17'!C$27 -> 19.72 | F12: ='\Documents and Settings\Chris\My Documents\IDPA\Forms\Match Scores\[September 15 2004.xls]S17'!D$27 -> 17.50 | G12: ='\Documents and Settings\Chris\My Documents\IDPA\Forms\Match Scores\[September 15 2004.xls]S17'!E$27 -> 27.06
A13: 10 | B13: ='\Documents and Settings\Chris\My Documents\IDPA\Forms\Match Scores\[September 15 2004.xls]S18'!$B$1 -> Bill Dezell | C13: ='\Documents and Settings\Chris\My Documents\IDPA\Forms\Match Scores\[September 15 2004.xls]S18'!$F$27 -> 75.78 | D13: ='\Documents and Settings\Chris\My Documents\IDPA\Forms\Match Scores\[September 15 2004.xls]S18'!B$27 -> 14.78 | E13: ='\Documents and Settings\Chris\My Documents\IDPA\Forms\Match Scores\[September 15 2004.xls]S18'!C$27 -> 15.76 | F13: ='\Documents and Settings\Chris\My Documents\IDPA\Forms\Match Scores\[September 15 2004.xls]S18'!D$27 -> 11.86 | G13: ='\Documents and Settings\Chris\My Documents\IDPA\Forms\Match Scores\[September 15 2004.xls]S18'!E$27 -> 33.38
A14: 11 | B14: ='\Documents and Settings\Chris\My Documents\IDPA\Forms\Match Scores\[September 15 2004.xls]S15'!$B$1 -> Mike Brownlee | C14: ='\Documents and Settings\Chris\My Documents\IDPA\Forms\Match Scores\[September 15 2004.xls]S15'!$F$27 -> 78.20 | D14: ='\Documents and Settings\Chris\My Documents\IDPA\Forms\Match Scores\[September 15 2004.xls]S15'!B$27 -> 10.39 | E14: ='\Documents and Settings\Chris\My Documents\IDPA\Forms\Match Scores\[September 15 2004.xls]S15'!C$27 -> 21.83 | F14: ='\Documents and Settings\Chris\My Documents\IDPA\Forms\Match Scores\[September 15 2004.xls]S15'!D$27 -> 15.56 | G14: ='\Documents and Settings\Chris\My Documents\IDPA\Forms\Match Scores\[September 15 2004.xls]S15'!E$27 -> 30.42
A15: 12 | B15: ='\Documents and Settings\Chris\My Documents\IDPA\Forms\Match Scores\[September 15 2004.xls]S2'!$B$1 -> Randy Hill | C15: ='\Documents and Settings\Chris\My Documents\IDPA\Forms\Match Scores\[September 15 2004.xls]S2'!$F$27 -> 81.63 | D15: ='\Documents and Settings\Chris\My Documents\IDPA\Forms\Match Scores\[September 15 2004.xls]S2'!B$27 -> 13.09 | E15: ='\Documents and Settings\Chris\My Documents\IDPA\Forms\Match Scores\[September 15 2004.xls]S2'!C$27 -> 20.57 | F15: ='\Documents and Settings\Chris\My Documents\IDPA\Forms\Match Scores\[September 15 2004.xls]S2'!D$27 -> 15.77 | G15: ='\Documents and Settings\Chris\My Documents\IDPA\Forms\Match Scores\[September 15 2004.xls]S2'!E$27 -> 32.20
A16: 13 | B16: "Red" Redford (Rev) | C16: ='\Documents and Settings\Chris\My Documents\IDPA\Forms\Match Scores\[September 15 2004.xls]S8'!$F$27 -> 84.89 | D16: ='\Documents and Settings\Chris\My Documents\IDPA\Forms\Match Scores\[September 15 2004.xls]S8'!B$27 -> 11.58 | E16: ='\Documents and Settings\Chris\My Documents\IDPA\Forms\Match Scores\[September 15 2004.xls]S8'!C$27 -> 24.75 | F16: ='\Documents and Settings\Chris\My Documents\IDPA\Forms\Match Scores\[September 15 2004.xls]S8'!D$27 -> 17.58 | G16: ='\Documents and Settings\Chris\My Documents\IDPA\Forms\Match Scores\[September 15 2004.xls]S8'!E$27 -> 30.98
A17: 14 | B17: ='\Documents and Settings\Chris\My Documents\IDPA\Forms\Match Scores\[September 15 2004.xls]S6'!$B$1 -> Carl Burney | C17: ='\Documents and Settings\Chris\My Documents\IDPA\Forms\Match Scores\[September 15 2004.xls]S6'!$F$27 -> 86.57 | D17: ='\Documents and Settings\Chris\My Documents\IDPA\Forms\Match Scores\[September 15 2004.xls]S6'!B$27 -> 12.97 | E17: ='\Documents and Settings\Chris\My Documents\IDPA\Forms\Match Scores\[September 15 2004.xls]S6'!C$27 -> 23.07 | F17: ='\Documents and Settings\Chris\My Documents\IDPA\Forms\Match Scores\[September 15 2004.xls]S6'!D$27 -> 13.56 | G17: ='\Documents and Settings\Chris\My Documents\IDPA\Forms\Match Scores\[September 15 2004.xls]S6'!E$27 -> 36.97
A18: 15 | B18: ='\Documents and Settings\Chris\My Documents\IDPA\Forms\Match Scores\[September 15 2004.xls]S1'!$B$1 -> R Dan Phillips | C18: ='\Documents and Settings\Chris\My Documents\IDPA\Forms\Match Scores\[September 15 2004.xls]S1'!$F$27 -> 87.81 | D18: ='\Documents and Settings\Chris\My Documents\IDPA\Forms\Match Scores\[September 15 2004.xls]S1'!B$27 -> 13.95 | E18: ='\Documents and Settings\Chris\My Documents\IDPA\Forms\Match Scores\[September 15 2004.xls]S1'!C$27 -> 22.07 | F18: ='\Documents and Settings\Chris\My Documents\IDPA\Forms\Match Scores\[September 15 2004.xls]S1'!D$27 -> 16.22 | G18: ='\Documents and Settings\Chris\My Documents\IDPA\Forms\Match Scores\[September 15 2004.xls]S1'!E$27 -> 35.57
A19: 16 | B19: ='\Documents and Settings\Chris\My Documents\IDPA\Forms\Match Scores\[September 15 2004.xls]S20'!$B$1 -> John Johnson | C19: ='\Documents and Settings\Chris\My Documents\IDPA\Forms\Match Scores\[September 15 2004.xls]S20'!$F$27 -> 100.95 | D19: ='\Documents and Settings\Chris\My Documents\IDPA\Forms\Match Scores\[September 15 2004.xls]S20'!B$27 -> 17.79 | E19: ='\Documents and Settings\Chris\My Documents\IDPA\Forms\Match Scores\[September 15 2004.xls]S20'!C$27 -> 23.64 | F19: ='\Documents and Settings\Chris\My Documents\IDPA\Forms\Match Scores\[September 15 2004.xls]S20'!D$27 -> 17.38 | G19: ='\Documents and Settings\Chris\My Documents\IDPA\Forms\Match Scores\[September 15 2004.xls]S20'!E$27 -> 42.14
A20: 17 | B20: ='\Documents and Settings\Chris\My Documents\IDPA\Forms\Match Scores\[September 15 2004.xls]S19'!$B$1 -> Paul Green | C20: ='\Documents and Settings\Chris\My Documents\IDPA\Forms\Match Scores\[September 15 2004.xls]S19'!$F$27 -> 102.32 | D20: ='\Documents and Settings\Chris\My Documents\IDPA\Forms\Match Scores\[September 15 2004.xls]S19'!B$27 -> 18.87 | E20: ='\Documents and Settings\Chris\My Documents\IDPA\Forms\Match Scores\[September 15 2004.xls]S19'!C$27 -> 20.31 | F20: ='\Documents and Settings\Chris\My Documents\IDPA\Forms\Match Scores\[September 15 2004.xls]S19'!D$27 -> 18.34 | G20: ='\Documents and Settings\Chris\My Documents\IDPA\Forms\Match Scores\[September 15 2004.xls]S19'!E$27 -> 44.80
A21: 18 | B21: ='\Documents and Settings\Chris\My Documents\IDPA\Forms\Match Scores\[September 15 2004.xls]S13'!$B$1 -> Danimal | C21: ='\Documents and Settings\Chris\My Documents\IDPA\Forms\Match Scores\[September 15 2004.xls]S13'!$F$27 -> 102.97 | D21: ='\Documents and Settings\Chris\My Documents\IDPA\Forms\Match Scores\[September 15 2004.xls]S13'!B$27 -> 18.23 | E21: ='\Documents and Settings\Chris\My Documents\IDPA\Forms\Match Scores\[September 15 2004.xls]S13'!C$27 -> 26.77 | F21: ='\Documents and Settings\Chris\My Documents\IDPA\Forms\Match Scores\[September 15 2004.xls]S13'!D$27 -> 15.35 | G21: ='\Documents and Settings\Chris\My Documents\IDPA\Forms\Match Scores\[September 15 2004.xls]S13'!E$27 -> 42.62
A22: 19 | B22: ='\Documents and Settings\Chris\My Documents\IDPA\Forms\Match Scores\[September 15 2004.xls]S11'!$B$1 -> John Diamond | C22: ='\Documents and Settings\Chris\My Documents\IDPA\Forms\Match Scores\[September 15 2004.xls]S11'!$F$27 -> 109.93 | D22: ='\Documents and Settings\Chris\My Documents\IDPA\Forms\Match Scores\[September 15 2004.xls]S11'!B$27 -> 21.37 | E22: ='\Documents and Settings\Chris\My Documents\IDPA\Forms\Match Scores\[September 15 2004.xls]S11'!C$27 -> 29.74 | F22: ='\Documents and Settings\Chris\My Documents\IDPA\Forms\Match Scores\[September 15 2004.xls]S11'!D$27 -> 23.09 | G22: ='\Documents and Settings\Chris\My Documents\IDPA\Forms\Match Scores\[September 15 2004.xls]S11'!E$27 -> 35.73
A23: 20 | B23: ='\Documents and Settings\Chris\My Documents\IDPA\Forms\Match Scores\[September 15 2004.xls]S7'!$B$1 -> Erin Herring | C23: ='\Documents and Settings\Chris\My Documents\IDPA\Forms\Match Scores\[September 15 2004.xls]S7'!$F$27 -> 125.17 | D23: ='\Documents and Settings\Chris\My Documents\IDPA\Forms\Match Scores\[September 15 2004.xls]S7'!B$27 -> 18.28 | E23: ='\Documents and Settings\Chris\My Documents\IDPA\Forms\Match Scores\[September 15 2004.xls]S7'!C$27 -> 38.64 | F23: ='\Documents and Settings\Chris\My Documents\IDPA\Forms\Match Scores\[September 15 2004.xls]S7'!D$27 -> 24.13 | G23: ='\Documents and Settings\Chris\My Documents\IDPA\Forms\Match Scores\[September 15 2004.xls]S7'!E$27 -> 44.12
A24: 21 | B24: ='\Documents and Settings\Chris\My Documents\IDPA\Forms\Match Scores\[September 15 2004.xls]S12'!$B$1 -> Carol Perez | C24: ='\Documents and Settings\Chris\My Documents\IDPA\Forms\Match Scores\[September 15 2004.xls]S12'!$F$27 -> 131.77 | D24: ='\Documents and Settings\Chris\My Documents\IDPA\Forms\Match Scores\[September 15 2004.xls]S12'!B$27 -> 21.00 | E24: ='\Documents and Settings\Chris\My Documents\IDPA\Forms\Match Scores\[September 15 2004.xls]S12'!C$27 -> 43.46 | F24: ='\Documents and Settings\Chris\My Documents\IDPA\Forms\Match Scores\[September 15 2004.xls]S12'!D$27 -> 25.75 | G24: ='\Documents and Settings\Chris\My Documents\IDPA\Forms\Match Scores\[September 15 2004.xls]S12'!E$27 -> 41.56
A25: S22 | B25: ='\Documents and Settings\Chris\My Documents\IDPA\Forms\Match Scores\[September 15 2004.xls]S22'!$B$1 -> 0 | C25: ='\Documents and Settings\Chris\My Documents\IDPA\Forms\Match Scores\[September 15 2004.xls]S22'!$F$27 -> 0.00 | D25: ='\Documents and Settings\Chris\My Documents\IDPA\Forms\Match Scores\[September 15 2004.xls]S22'!B$27 -> 0.00 | E25: ='\Documents and Settings\Chris\My Documents\IDPA\Forms\Match Scores\[September 15 2004.xls]S22'!C$27 -> 0.00 | F25: ='\Documents and Settings\Chris\My Documents\IDPA\Forms\Match Scores\[September 15 2004.xls]S22'!D$27 -> 0.00 | G25: ='\Documents and Settings\Chris\My Documents\IDPA\Forms\Match Scores\[September 15 2004.xls]S22'!E$27 -> 0.00
A26: S23 | B26: ='\Documents and Settings\Chris\My Documents\IDPA\Forms\Match Scores\[September 15 2004.xls]S23'!$B$1 -> 0 | C26: ='\Documents and Settings\Chris\My Documents\IDPA\Forms\Match Scores\[September 15 2004.xls]S23'!$F$27 -> 0.00 | D26: ='\Documents and Settings\Chris\My Documents\IDPA\Forms\Match Scores\[September 15 2004.xls]S23'!B$27 -> 0.00 | E26: ='\Documents and Settings\Chris\My Documents\IDPA\Forms\Match Scores\[September 15 2004.xls]S23'!C$27 -> 0.00 | F26: ='\Documents and Settings\Chris\My Documents\IDPA\Forms\Match Scores\[September 15 2004.xls]S23'!D$27 -> 0.00 | G26: ='\Documents and Settings\Chris\My Documents\IDPA\Forms\Match Scores\[September 15 2004.xls]S23'!E$27 -> 0.00
A27: S24 | B27: ='\Documents and Settings\Chris\My Documents\IDPA\Forms\Match Scores\[September 15 2004.xls]S24'!$B$1 -> 0 | C27: ='\Documents and Settings\Chris\My Documents\IDPA\Forms\Match Scores\[September 15 2004.xls]S24'!$F$27 -> 0.00 | D27: ='\Documents and Settings\Chris\My Documents\IDPA\Forms\Match Scores\[September 15 2004.xls]S24'!B$27 -> 0.00 | E27: ='\Documents and Settings\Chris\My Documents\IDPA\Forms\Match Scores\[September 15 2004.xls]S24'!C$27 -> 0.00 | F27: ='\Documents and Settings\Chris\My Documents\IDPA\Forms\Match Scores\[September 15 2004.xls]S24'!D$27 -> 0.00 | G27: ='\Documents and Settings\Chris\My Documents\IDPA\Forms\Match Scores\[September 15 2004.xls]S24'!E$27 -> 0.00
A28: S25 | B28: ='\Documents and Settings\Chris\My Documents\IDPA\Forms\Match Scores\[September 15 2004.xls]S25'!$B$1 -> 0 | C28: ='\Documents and Settings\Chris\My Documents\IDPA\Forms\Match Scores\[September 15 2004.xls]S25'!$F$27 -> 0.00 | D28: ='\Documents and Settings\Chris\My Documents\IDPA\Forms\Match Scores\[September 15 2004.xls]S25'!B$27 -> 0.00 | E28: ='\Documents and Settings\Chris\My Documents\IDPA\Forms\Match Scores\[September 15 2004.xls]S25'!C$27 -> 0.00 | F28: ='\Documents and Settings\Chris\My Documents\IDPA\Forms\Match Scores\[September 15 2004.xls]S25'!D$27 -> 0.00 | G28: ='\Documents and Settings\Chris\My Documents\IDPA\Forms\Match Scores\[September 15 2004.xls]S25'!E$27 -> 0.00
A29: =COUNTIF($C$4:$C$28,">0") -> 21 | B29: Overall Average: | C29: =SUM(C4:C28)/$A$29 -> 82.656190476190474 | D29: =SUM(D4:D28)/$A$29 -> 12.887142857142857 | E29: =SUM(E4:E28)/$A$29 -> 21.717619047619042 | F29: =SUM(F4:F28)/$A$29 -> 15.105238095238095 | G29: =SUM(G4:G28)/$A$29 -> 32.94619047619048
A30: RAW TIMES
A31: Number | B31: Name | C31: Match | D31: Stage1 | E31: Stage 2 | F31: Stage 3 | G31: Stage4
A32: S01 | B32: ='\Documents and Settings\Chris\My Documents\IDPA\Forms\Match Scores\[September 15 2004.xls]S4'!$B$1 -> Juke Zaccardi | C32: ='\Documents and Settings\Chris\My Documents\IDPA\Forms\Match Scores\[September 15 2004.xls]S4'!$F$23 -> 42.13 | D32: ='\Documents and Settings\Chris\My Documents\IDPA\Forms\Match Scores\[September 15 2004.xls]S4'!B$23 -> 6.40 | E32: ='\Documents and Settings\Chris\My Documents\IDPA\Forms\Match Scores\[September 15 2004.xls]S4'!C$23 -> 10.20 | F32: ='\Documents and Settings\Chris\My Documents\IDPA\Forms\Match Scores\[September 15 2004.xls]S4'!D$23 -> 7.73 | G32: ='\Documents and Settings\Chris\My Documents\IDPA\Forms\Match Scores\[September 15 2004.xls]S4'!E$23 -> 17.80
A33: S02 | B33: ='\Documents and Settings\Chris\My Documents\IDPA\Forms\Match Scores\[September 15 2004.xls]S5'!$B$1 -> Pat Zaccardi | C33: ='\Documents and Settings\Chris\My Documents\IDPA\Forms\Match Scores\[September 15 2004.xls]S5'!$F$23 -> 43.69 | D33: ='\Documents and Settings\Chris\My Documents\IDPA\Forms\Match Scores\[September 15 2004.xls]S5'!B$23 -> 6.96 | E33: ='\Documents and Settings\Chris\My Documents\IDPA\Forms\Match Scores\[September 15 2004.xls]S5'!C$23 -> 9.26 | F33: ='\Documents and Settings\Chris\My Documents\IDPA\Forms\Match Scores\[September 15 2004.xls]S5'!D$23 -> 7.63 | G33: ='\Documents and Settings\Chris\My Documents\IDPA\Forms\Match Scores\[September 15 2004.xls]S5'!E$23 -> 19.84
A34: S03 | B34: ='\Documents and Settings\Chris\My Documents\IDPA\Forms\Match Scores\[September 15 2004.xls]S9'!$B$1 -> Roger "Don't Run" Cox | C34: ='\Documents and Settings\Chris\My Documents\IDPA\Forms\Match Scores\[September 15 2004.xls]S9'!$F$23 -> 45.29 | D34: ='\Documents and Settings\Chris\My Documents\IDPA\Forms\Match Scores\[September 15 2004.xls]S9'!B$23 -> 6.72 | E34: ='\Documents and Settings\Chris\My Documents\IDPA\Forms\Match Scores\[September 15 2004.xls]S9'!C$23 -> 11.77 | F34: ='\Documents and Settings\Chris\My Documents\IDPA\Forms\Match Scores\[September 15 2004.xls]S9'!D$23 -> 6.95 | G34: ='\Documents and Settings\Chris\My Documents\IDPA\Forms\Match Scores\[September 15 2004.xls]S9'!E$23 -> 19.85
A35: S04 | B35: ='\Documents and Settings\Chris\My Documents\IDPA\Forms\Match Scores\[September 15 2004.xls]S14'!$B$1 -> Ari Theodore | C35: ='\Documents and Settings\Chris\My Documents\IDPA\Forms\Match Scores\[September 15 2004.xls]S14'!$F$23 -> 46.53 | D35: ='\Documents and Settings\Chris\My Documents\IDPA\Forms\Match Scores\[September 15 2004.xls]S14'!B$23 -> 8.09 | E35: ='\Documents and Settings\Chris\My Documents\IDPA\Forms\Match Scores\[September 15 2004.xls]S14'!C$23 -> 12.38 | F35: ='\Documents and Settings\Chris\My Documents\IDPA\Forms\Match Scores\[September 15 2004.xls]S14'!D$23 -> 7.96 | G35: ='\Documents and Settings\Chris\My Documents\IDPA\Forms\Match Scores\[September 15 2004.xls]S14'!E$23 -> 18.10
A36: S05 | B36: ='\Documents and Settings\Chris\My Documents\IDPA\Forms\Match Scores\[September 15 2004.xls]S21'!$B$1 -> Bryan Mortenson | C36: ='\Documents and Settings\Chris\My Documents\IDPA\Forms\Match Scores\[September 15 2004.xls]S21'!$F$23 -> 49.89 | D36: ='\Documents and Settings\Chris\My Documents\IDPA\Forms\Match Scores\[September 15 2004.xls]S21'!B$23 -> 7.80 | E36: ='\Documents and Settings\Chris\My Documents\IDPA\Forms\Match Scores\[September 15 2004.xls]S21'!C$23 -> 11.77 | F36: ='\Documents and Settings\Chris\My Documents\IDPA\Forms\Match Scores\[September 15 2004.xls]S21'!D$23 -> 8.06 | G36: ='\Documents and Settings\Chris\My Documents\IDPA\Forms\Match Scores\[September 15 2004.xls]S21'!E$23 -> 22.26
A37: S06 | B37: ='\Documents and Settings\Chris\My Documents\IDPA\Forms\Match Scores\[September 15 2004.xls]S2'!$B$1 -> Randy Hill | C37: ='\Documents and Settings\Chris\My Documents\IDPA\Forms\Match Scores\[September 15 2004.xls]S2'!$F$23 -> 50.63 | D37: ='\Documents and Settings\Chris\My Documents\IDPA\Forms\Match Scores\[September 15 2004.xls]S2'!B$23 -> 9.59 | E37: ='\Documents and Settings\Chris\My Documents\IDPA\Forms\Match Scores\[September 15 2004.xls]S2'!C$23 -> 15.57 | F37: ='\Documents and Settings\Chris\My Documents\IDPA\Forms\Match Scores\[September 15 2004.xls]S2'!D$23 -> 8.77 | G37: ='\Documents and Settings\Chris\My Documents\IDPA\Forms\Match Scores\[September 15 2004.xls]S2'!E$23 -> 16.70
A38: S07 | B38: ='\Documents and Settings\Chris\My Documents\IDPA\Forms\Match Scores\[September 15 2004.xls]S3'!$B$1 -> Chris Roach | C38: ='\Documents and Settings\Chris\My Documents\IDPA\Forms\Match Scores\[September 15 2004.xls]S3'!$F$23 -> 54.45 | D38: ='\Documents and Settings\Chris\My Documents\IDPA\Forms\Match Scores\[September 15 2004.xls]S3'!B$23 -> 7.35 | E38: ='\Documents and Settings\Chris\My Documents\IDPA\Forms\Match Scores\[September 15 2004.xls]S3'!C$23 -> 12.10 | F38: ='\Documents and Settings\Chris\My Documents\IDPA\Forms\Match Scores\[September 15 2004.xls]S3'!D$23 -> 12.50 | G38: ='\Documents and Settings\Chris\My Documents\IDPA\Forms\Match Scores\[September 15 2004.xls]S3'!E$23 -> 22.50
A39: S08 | B39: ='\Documents and Settings\Chris\My Documents\IDPA\Forms\Match Scores\[September 15 2004.xls]S16'!$B$1 -> Justin Park | C39: ='\Documents and Settings\Chris\My Documents\IDPA\Forms\Match Scores\[September 15 2004.xls]S16'!$F$23 -> 55.70 | D39: ='\Documents and Settings\Chris\My Documents\IDPA\Forms\Match Scores\[September 15 2004.xls]S16'!B$23 -> 10.35 | E39: ='\Documents and Settings\Chris\My Documents\IDPA\Forms\Match Scores\[September 15 2004.xls]S16'!C$23 -> 14.95 | F39: ='\Documents and Settings\Chris\My Documents\IDPA\Forms\Match Scores\[September 15 2004.xls]S16'!D$23 -> 6.88 | G39: ='\Documents and Settings\Chris\My Documents\IDPA\Forms\Match Scores\[September 15 2004.xls]S16'!E$23 -> 23.52
A40: S09 | B40: ='\Documents and Settings\Chris\My Documents\IDPA\Forms\Match Scores\[September 15 2004.xls]S17'!$B$1 -> Ren Young | C40: ='\Documents and Settings\Chris\My Documents\IDPA\Forms\Match Scores\[September 15 2004.xls]S17'!$F$23 -> 58.28 | D40: ='\Documents and Settings\Chris\My Documents\IDPA\Forms\Match Scores\[September 15 2004.xls]S17'!B$23 -> 10.00 | E40: ='\Documents and Settings\Chris\My Documents\IDPA\Forms\Match Scores\[September 15 2004.xls]S17'!C$23 -> 14.72 | F40: ='\Documents and Settings\Chris\My Documents\IDPA\Forms\Match Scores\[September 15 2004.xls]S17'!D$23 -> 10.50 | G40: ='\Documents and Settings\Chris\My Documents\IDPA\Forms\Match Scores\[September 15 2004.xls]S17'!E$23 -> 23.06
A41: S10 | B41: ='\Documents and Settings\Chris\My Documents\IDPA\Forms\Match Scores\[September 15 2004.xls]S10'!$B$1 -> Milos Krivka | C41: ='\Documents and Settings\Chris\My Documents\IDPA\Forms\Match Scores\[September 15 2004.xls]S10'!$F$23 -> 61.33 | D41: ='\Documents and Settings\Chris\My Documents\IDPA\Forms\Match Scores\[September 15 2004.xls]S10'!B$23 -> 8.66 | E41: ='\Documents and Settings\Chris\My Documents\IDPA\Forms\Match Scores\[September 15 2004.xls]S10'!C$23 -> 16.81 | F41: ='\Documents and Settings\Chris\My Documents\IDPA\Forms\Match Scores\[September 15 2004.xls]S10'!D$23 -> 10.41 | G41: ='\Documents and Settings\Chris\My Documents\IDPA\Forms\Match Scores\[September 15 2004.xls]S10'!E$23 -> 25.45
A42: S11 | B42: ='\Documents and Settings\Chris\My Documents\IDPA\Forms\Match Scores\[September 15 2004.xls]S18'!$B$1 -> Bill Dezell | C42: ='\Documents and Settings\Chris\My Documents\IDPA\Forms\Match Scores\[September 15 2004.xls]S18'!$F$23 -> 62.78 | D42: ='\Documents and Settings\Chris\My Documents\IDPA\Forms\Match Scores\[September 15 2004.xls]S18'!B$23 -> 14.78 | E42: ='\Documents and Settings\Chris\My Documents\IDPA\Forms\Match Scores\[September 15 2004.xls]S18'!C$23 -> 13.26 | F42: ='\Documents and Settings\Chris\My Documents\IDPA\Forms\Match Scores\[September 15 2004.xls]S18'!D$23 -> 10.36 | G42: ='\Documents and Settings\Chris\My Documents\IDPA\Forms\Match Scores\[September 15 2004.xls]S18'!E$23 -> 24.38
A43: S12 | B43: ='\Documents and Settings\Chris\My Documents\IDPA\Forms\Match Scores\[September 15 2004.xls]S15'!$B$1 -> Mike Brownlee | C43: ='\Documents and Settings\Chris\My Documents\IDPA\Forms\Match Scores\[September 15 2004.xls]S15'!$F$23 -> 63.20 | D43: ='\Documents and Settings\Chris\My Documents\IDPA\Forms\Match Scores\[September 15 2004.xls]S15'!B$23 -> 9.89 | E43: ='\Documents and Settings\Chris\My Documents\IDPA\Forms\Match Scores\[September 15 2004.xls]S15'!C$23 -> 17.83 | F43: ='\Documents and Settings\Chris\My Documents\IDPA\Forms\Match Scores\[September 15 2004.xls]S15'!D$23 -> 9.06 | G43: ='\Documents and Settings\Chris\My Documents\IDPA\Forms\Match Scores\[September 15 2004.xls]S15'!E$23 -> 26.42
A44: S13 | B44: ='\Documents and Settings\Chris\My Documents\IDPA\Forms\Match Scores\[September 15 2004.xls]S1'!$B$1 -> R Dan Phillips | C44: ='\Documents and Settings\Chris\My Documents\IDPA\Forms\Match Scores\[September 15 2004.xls]S1'!$F$23 -> 67.31 | D44: ='\Documents and Settings\Chris\My Documents\IDPA\Forms\Match Scores\[September 15 2004.xls]S1'!B$23 -> 13.95 | E44: ='\Documents and Settings\Chris\My Documents\IDPA\Forms\Match Scores\[September 15 2004.xls]S1'!C$23 -> 17.57 | F44: ='\Documents and Settings\Chris\My Documents\IDPA\Forms\Match Scores\[September 15 2004.xls]S1'!D$23 -> 9.72 | G44: ='\Documents and Settings\Chris\My Documents\IDPA\Forms\Match Scores\[September 15 2004.xls]S1'!E$23 -> 26.07
A45: S14 | B45: "Red" Redford (Rev) | C45: ='\Documents and Settings\Chris\My Documents\IDPA\Forms\Match Scores\[September 15 2004.xls]S8'!$F$23 -> 67.89 | D45: ='\Documents and Settings\Chris\My Documents\IDPA\Forms\Match Scores\[September 15 2004.xls]S8'!B$23 -> 10.58 | E45: ='\Documents and Settings\Chris\My Documents\IDPA\Forms\Match Scores\[September 15 2004.xls]S8'!C$23 -> 19.75 | F45: ='\Documents and Settings\Chris\My Documents\IDPA\Forms\Match Scores\[September 15 2004.xls]S8'!D$23 -> 13.58 | G45: ='\Documents and Settings\Chris\My Documents\IDPA\Forms\Match Scores\[September 15 2004.xls]S8'!E$23 -> 23.98
A46: S15 | B46: ='\Documents and Settings\Chris\My Documents\IDPA\Forms\Match Scores\[September 15 2004.xls]S20'!$B$1 -> John Johnson | C46: ='\Documents and Settings\Chris\My Documents\IDPA\Forms\Match Scores\[September 15 2004.xls]S20'!$F$23 -> 71.95 | D46: ='\Documents and Settings\Chris\My Documents\IDPA\Forms\Match Scores\[September 15 2004.xls]S20'!B$23 -> 17.79 | E46: ='\Documents and Settings\Chris\My Documents\IDPA\Forms\Match Scores\[September 15 2004.xls]S20'!C$23 -> 17.14 | F46: ='\Documents and Settings\Chris\My Documents\IDPA\Forms\Match Scores\[September 15 2004.xls]S20'!D$23 -> 12.88 | G46: ='\Documents and Settings\Chris\My Documents\IDPA\Forms\Match Scores\[September 15 2004.xls]S20'!E$23 -> 24.14
A47: S16 | B47: ='\Documents and Settings\Chris\My Documents\IDPA\Forms\Match Scores\[September 15 2004.xls]S13'!$B$1 -> Danimal | C47: ='\Documents and Settings\Chris\My Documents\IDPA\Forms\Match Scores\[September 15 2004.xls]S13'!$F$23 -> 77.97 | D47: ='\Documents and Settings\Chris\My Documents\IDPA\Forms\Match Scores\[September 15 2004.xls]S13'!B$23 -> 17.73 | E47: ='\Documents and Settings\Chris\My Documents\IDPA\Forms\Match Scores\[September 15 2004.xls]S13'!C$23 -> 20.77 | F47: ='\Documents and Settings\Chris\My Documents\IDPA\Forms\Match Scores\[September 15 2004.xls]S13'!D$23 -> 11.85 | G47: ='\Documents and Settings\Chris\My Documents\IDPA\Forms\Match Scores\[September 15 2004.xls]S13'!E$23 -> 27.62
A48: S17 | B48: ='\Documents and Settings\Chris\My Documents\IDPA\Forms\Match Scores\[September 15 2004.xls]S6'!$B$1 -> Carl Burney | C48: ='\Documents and Settings\Chris\My Documents\IDPA\Forms\Match Scores\[September 15 2004.xls]S6'!$F$23 -> 80.07 | D48: ='\Documents and Settings\Chris\My Documents\IDPA\Forms\Match Scores\[September 15 2004.xls]S6'!B$23 -> 12.97 | E48: ='\Documents and Settings\Chris\My Documents\IDPA\Forms\Match Scores\[September 15 2004.xls]S6'!C$23 -> 22.57 | F48: ='\Documents and Settings\Chris\My Documents\IDPA\Forms\Match Scores\[September 15 2004.xls]S6'!D$23 -> 10.56 | G48: ='\Documents and Settings\Chris\My Documents\IDPA\Forms\Match Scores\[September 15 2004.xls]S6'!E$23 -> 33.97
A49: S18 | B49: ='\Documents and Settings\Chris\My Documents\IDPA\Forms\Match Scores\[September 15 2004.xls]S11'!$B$1 -> John Diamond | C49: ='\Documents and Settings\Chris\My Documents\IDPA\Forms\Match Scores\[September 15 2004.xls]S11'!$F$23 -> 86.43 | D49: ='\Documents and Settings\Chris\My Documents\IDPA\Forms\Match Scores\[September 15 2004.xls]S11'!B$23 -> 16.37 | E49: ='\Documents and Settings\Chris\My Documents\IDPA\Forms\Match Scores\[September 15 2004.xls]S11'!C$23 -> 26.74 | F49: ='\Documents and Settings\Chris\My Documents\IDPA\Forms\Match Scores\[September 15 2004.xls]S11'!D$23 -> 13.59 | G49: ='\Documents and Settings\Chris\My Documents\IDPA\Forms\Match Scores\[September 15 2004.xls]S11'!E$23 -> 29.73
A50: S19 | B50: ='\Documents and Settings\Chris\My Documents\IDPA\Forms\Match Scores\[September 15 2004.xls]S19'!$B$1 -> Paul Green | C50: ='\Documents and Settings\Chris\My Documents\IDPA\Forms\Match Scores\[September 15 2004.xls]S19'!$F$23 -> 87.82 | D50: ='\Documents and Settings\Chris\My Documents\IDPA\Forms\Match Scores\[September 15 2004.xls]S19'!B$23 -> 18.87 | E50: ='\Documents and Settings\Chris\My Documents\IDPA\Forms\Match Scores\[September 15 2004.xls]S19'!C$23 -> 17.81 | F50: ='\Documents and Settings\Chris\My Documents\IDPA\Forms\Match Scores\[September 15 2004.xls]S19'!D$23 -> 13.34 | G50: ='\Documents and Settings\Chris\My Documents\IDPA\Forms\Match Scores\[September 15 2004.xls]S19'!E$23 -> 37.80
A51: S20 | B51: ='\Documents and Settings\Chris\My Documents\IDPA\Forms\Match Scores\[September 15 2004.xls]S7'!$B$1 -> Erin Herring | C51: ='\Documents and Settings\Chris\My Documents\IDPA\Forms\Match Scores\[September 15 2004.xls]S7'!$F$23 -> 95.67 | D51: ='\Documents and Settings\Chris\My Documents\IDPA\Forms\Match Scores\[September 15 2004.xls]S7'!B$23 -> 17.78 | E51: ='\Documents and Settings\Chris\My Documents\IDPA\Forms\Match Scores\[September 15 2004.xls]S7'!C$23 -> 35.14 | F51: ='\Documents and Settings\Chris\My Documents\IDPA\Forms\Match Scores\[September 15 2004.xls]S7'!D$23 -> 17.13 | G51: ='\Documents and Settings\Chris\My Documents\IDPA\Forms\Match Scores\[September 15 2004.xls]S7'!E$23 -> 25.62
A52: S21 | B52: ='\Documents and Settings\Chris\My Documents\IDPA\Forms\Match Scores\[September 15 2004.xls]S12'!$B$1 -> Carol Perez | C52: ='\Documents and Settings\Chris\My Documents\IDPA\Forms\Match Scores\[September 15 2004.xls]S12'!$F$23 -> 114.77 | D52: ='\Documents and Settings\Chris\My Documents\IDPA\Forms\Match Scores\[September 15 2004.xls]S12'!B$23 -> 20.00 | E52: ='\Documents and Settings\Chris\My Documents\IDPA\Forms\Match Scores\[September 15 2004.xls]S12'!C$23 -> 42.46 | F52: ='\Documents and Settings\Chris\My Documents\IDPA\Forms\Match Scores\[September 15 2004.xls]S12'!D$23 -> 23.75 | G52: ='\Documents and Settings\Chris\My Documents\IDPA\Forms\Match Scores\[September 15 2004.xls]S12'!E$23 -> 28.56
A53: S22 | B53: ='\Documents and Settings\Chris\My Documents\IDPA\Forms\Match Scores\[September 15 2004.xls]S22'!$B$1 -> 0 | C53: ='\Documents and Settings\Chris\My Documents\IDPA\Forms\Match Scores\[September 15 2004.xls]S22'!$F$23 -> 0.00 | D53: ='\Documents and Settings\Chris\My Documents\IDPA\Forms\Match Scores\[September 15 2004.xls]S22'!B$23 -> 0.00 | E53: ='\Documents and Settings\Chris\My Documents\IDPA\Forms\Match Scores\[September 15 2004.xls]S22'!C$23 -> 0.00 | F53: ='\Documents and Settings\Chris\My Documents\IDPA\Forms\Match Scores\[September 15 2004.xls]S22'!D$23 -> 0.00 | G53: ='\Documents and Settings\Chris\My Documents\IDPA\Forms\Match Scores\[September 15 2004.xls]S22'!E$23 -> 0.00
A54: S23 | B54: ='\Documents and Settings\Chris\My Documents\IDPA\Forms\Match Scores\[September 15 2004.xls]S23'!$B$1 -> 0 | C54: ='\Documents and Settings\Chris\My Documents\IDPA\Forms\Match Scores\[September 15 2004.xls]S23'!$F$23 -> 0.00 | D54: ='\Documents and Settings\Chris\My Documents\IDPA\Forms\Match Scores\[September 15 2004.xls]S23'!B$23 -> 0.00 | E54: ='\Documents and Settings\Chris\My Documents\IDPA\Forms\Match Scores\[September 15 2004.xls]S23'!C$23 -> 0.00 | F54: ='\Documents and Settings\Chris\My Documents\IDPA\Forms\Match Scores\[September 15 2004.xls]S23'!D$23 -> 0.00 | G54: ='\Documents and Settings\Chris\My Documents\IDPA\Forms\Match Scores\[September 15 2004.xls]S23'!E$23 -> 0.00
A55: S24 | B55: ='\Documents and Settings\Chris\My Documents\IDPA\Forms\Match Scores\[September 15 2004.xls]S24'!$B$1 -> 0 | C55: ='\Documents and Settings\Chris\My Documents\IDPA\Forms\Match Scores\[September 15 2004.xls]S24'!$F$23 -> 0.00 | D55: ='\Documents and Settings\Chris\My Documents\IDPA\Forms\Match Scores\[September 15 2004.xls]S24'!B$23 -> 0.00 | E55: ='\Documents and Settings\Chris\My Documents\IDPA\Forms\Match Scores\[September 15 2004.xls]S24'!C$23 -> 0.00 | F55: ='\Documents and Settings\Chris\My Documents\IDPA\Forms\Match Scores\[September 15 2004.xls]S24'!D$23 -> 0.00 | G55: ='\Documents and Settings\Chris\My Documents\IDPA\Forms\Match Scores\[September 15 2004.xls]S24'!E$23 -> 0.00
A56: S25 | B56: ='\Documents and Settings\Chris\My Documents\IDPA\Forms\Match Scores\[September 15 2004.xls]S25'!$B$1 -> 0 | C56: ='\Documents and Settings\Chris\My Documents\IDPA\Forms\Match Scores\[September 15 2004.xls]S25'!$F$23 -> 0.00 | D56: ='\Documents and Settings\Chris\My Documents\IDPA\Forms\Match Scores\[September 15 2004.xls]S25'!B$23 -> 0.00 | E56: ='\Documents and Settings\Chris\My Documents\IDPA\Forms\Match Scores\[September 15 2004.xls]S25'!C$23 -> 0.00 | F56: ='\Documents and Settings\Chris\My Documents\IDPA\Forms\Match Scores\[September 15 2004.xls]S25'!D$23 -> 0.00 | G56: ='\Documents and Settings\Chris\My Documents\IDPA\Forms\Match Scores\[September 15 2004.xls]S25'!E$23 -> 0.00
A57: Overall Average: | C57: =SUM(C32:C56)/$A$29 -> 65.894285714285729 | D57: =SUM(D32:D56)/$A$29 -> 12.03 | E57: =SUM(E32:E56)/$A$29 -> 18.122380952380951 | F57: =SUM(F32:F56)/$A$29 -> 11.105238095238095 | G57: =SUM(G32:G56)/$A$29 -> 24.636666666666667
A58: POINTS DOWN
A59: Number | B59: Name | C59: Match | D59: Stage1 | E59: Stage 2 | F59: Stage 3 | G59: Stage4
A60: 1 | B60: ='\Documents and Settings\Chris\My Documents\IDPA\Forms\Match Scores\[September 15 2004.xls]S6'!$B$1 -> Carl Burney | C60: ='\Documents and Settings\Chris\My Documents\IDPA\Forms\Match Scores\[September 15 2004.xls]S6'!$F$24 -> 13 | D60: ='\Documents and Settings\Chris\My Documents\IDPA\Forms\Match Scores\[September 15 2004.xls]S6'!B$24 -> 0 | E60: ='\Documents and Settings\Chris\My Documents\IDPA\Forms\Match Scores\[September 15 2004.xls]S6'!C$24 -> 1 | F60: ='\Documents and Settings\Chris\My Documents\IDPA\Forms\Match Scores\[September 15 2004.xls]S6'!D$24 -> 6 | G60: ='\Documents and Settings\Chris\My Documents\IDPA\Forms\Match Scores\[September 15 2004.xls]S6'!E$24 -> 6
A61: 2 | B61: ='\Documents and Settings\Chris\My Documents\IDPA\Forms\Match Scores\[September 15 2004.xls]S14'!$B$1 -> Ari Theodore | C61: ='\Documents and Settings\Chris\My Documents\IDPA\Forms\Match Scores\[September 15 2004.xls]S14'!$F$24 -> 15 | D61: ='\Documents and Settings\Chris\My Documents\IDPA\Forms\Match Scores\[September 15 2004.xls]S14'!B$24 -> 0 | E61: ='\Documents and Settings\Chris\My Documents\IDPA\Forms\Match Scores\[September 15 2004.xls]S14'!C$24 -> 4 | F61: ='\Documents and Settings\Chris\My Documents\IDPA\Forms\Match Scores\[September 15 2004.xls]S14'!D$24 -> 1 | G61: ='\Documents and Settings\Chris\My Documents\IDPA\Forms\Match Scores\[September 15 2004.xls]S14'!E$24 -> 10
A62: 3 | B62: ='\Documents and Settings\Chris\My Documents\IDPA\Forms\Match Scores\[September 15 2004.xls]S21'!$B$1 -> Bryan Mortenson | C62: ='\Documents and Settings\Chris\My Documents\IDPA\Forms\Match Scores\[September 15 2004.xls]S21'!$F$24 -> 16 | D62: ='\Documents and Settings\Chris\My Documents\IDPA\Forms\Match Scores\[September 15 2004.xls]S21'!B$24 -> 0 | E62: ='\Documents and Settings\Chris\My Documents\IDPA\Forms\Match Scores\[September 15 2004.xls]S21'!C$24 -> 3 | F62: ='\Documents and Settings\Chris\My Documents\IDPA\Forms\Match Scores\[September 15 2004.xls]S21'!D$24 -> 3 | G62: ='\Documents and Settings\Chris\My Documents\IDPA\Forms\Match Scores\[September 15 2004.xls]S21'!E$24 -> 10
A63: 4 | B63: ='\Documents and Settings\Chris\My Documents\IDPA\Forms\Match Scores\[September 15 2004.xls]S3'!$B$1 -> Chris Roach | C63: ='\Documents and Settings\Chris\My Documents\IDPA\Forms\Match Scores\[September 15 2004.xls]S3'!$F$24 -> 18 | D63: ='\Documents and Settings\Chris\My Documents\IDPA\Forms\Match Scores\[September 15 2004.xls]S3'!B$24 -> 3 | E63: ='\Documents and Settings\Chris\My Documents\IDPA\Forms\Match Scores\[September 15 2004.xls]S3'!C$24 -> 2 | F63: ='\Documents and Settings\Chris\My Documents\IDPA\Forms\Match Scores\[September 15 2004.xls]S3'!D$24 -> 10 | G63: ='\Documents and Settings\Chris\My Documents\IDPA\Forms\Match Scores\[September 15 2004.xls]S3'!E$24 -> 3
A64: 5 | B64: ='\Documents and Settings\Chris\My Documents\IDPA\Forms\Match Scores\[September 15 2004.xls]S5'!$B$1 -> Pat Zaccardi | C64: ='\Documents and Settings\Chris\My Documents\IDPA\Forms\Match Scores\[September 15 2004.xls]S5'!$F$24 -> 19 | D64: ='\Documents and Settings\Chris\My Documents\IDPA\Forms\Match Scores\[September 15 2004.xls]S5'!B$24 -> 1 | E64: ='\Documents and Settings\Chris\My Documents\IDPA\Forms\Match Scores\[September 15 2004.xls]S5'!C$24 -> 5 | F64: ='\Documents and Settings\Chris\My Documents\IDPA\Forms\Match Scores\[September 15 2004.xls]S5'!D$24 -> 0 | G64: ='\Documents and Settings\Chris\My Documents\IDPA\Forms\Match Scores\[September 15 2004.xls]S5'!E$24 -> 13
A65: 6 | B65: ='\Documents and Settings\Chris\My Documents\IDPA\Forms\Match Scores\[September 15 2004.xls]S4'!$B$1 -> Juke Zaccardi | C65: ='\Documents and Settings\Chris\My Documents\IDPA\Forms\Match Scores\[September 15 2004.xls]S4'!$F$24 -> 22 | D65: ='\Documents and Settings\Chris\My Documents\IDPA\Forms\Match Scores\[September 15 2004.xls]S4'!B$24 -> 2 | E65: ='\Documents and Settings\Chris\My Documents\IDPA\Forms\Match Scores\[September 15 2004.xls]S4'!C$24 -> 13 | F65: ='\Documents and Settings\Chris\My Documents\IDPA\Forms\Match Scores\[September 15 2004.xls]S4'!D$24 -> 5 | G65: ='\Documents and Settings\Chris\My Documents\IDPA\Forms\Match Scores\[September 15 2004.xls]S4'!E$24 -> 2
A66: 7 | B66: ='\Documents and Settings\Chris\My Documents\IDPA\Forms\Match Scores\[September 15 2004.xls]S10'!$B$1 -> Milos Krivka | C66: ='\Documents and Settings\Chris\My Documents\IDPA\Forms\Match Scores\[September 15 2004.xls]S10'!$F$24 -> 24 | D66: ='\Documents and Settings\Chris\My Documents\IDPA\Forms\Match Scores\[September 15 2004.xls]S10'!B$24 -> 1 | E66: ='\Documents and Settings\Chris\My Documents\IDPA\Forms\Match Scores\[September 15 2004.xls]S10'!C$24 -> 12 | F66: ='\Documents and Settings\Chris\My Documents\IDPA\Forms\Match Scores\[September 15 2004.xls]S10'!D$24 -> 2 | G66: ='\Documents and Settings\Chris\My Documents\IDPA\Forms\Match Scores\[September 15 2004.xls]S10'!E$24 -> 9
A67: 8 | B67: ='\Documents and Settings\Chris\My Documents\IDPA\Forms\Match Scores\[September 15 2004.xls]S16'!$B$1 -> Justin Park | C67: ='\Documents and Settings\Chris\My Documents\IDPA\Forms\Match Scores\[September 15 2004.xls]S16'!$F$24 -> 26 | D67: ='\Documents and Settings\Chris\My Documents\IDPA\Forms\Match Scores\[September 15 2004.xls]S16'!B$24 -> 0 | E67: ='\Documents and Settings\Chris\My Documents\IDPA\Forms\Match Scores\[September 15 2004.xls]S16'!C$24 -> 9 | F67: ='\Documents and Settings\Chris\My Documents\IDPA\Forms\Match Scores\[September 15 2004.xls]S16'!D$24 -> 1 | G67: ='\Documents and Settings\Chris\My Documents\IDPA\Forms\Match Scores\[September 15 2004.xls]S16'!E$24 -> 16
A68: 9 | B68: ='\Documents and Settings\Chris\My Documents\IDPA\Forms\Match Scores\[September 15 2004.xls]S18'!$B$1 -> Bill Dezell | C68: ='\Documents and Settings\Chris\My Documents\IDPA\Forms\Match Scores\[September 15 2004.xls]S18'!$F$24 -> 26 | D68: ='\Documents and Settings\Chris\My Documents\IDPA\Forms\Match Scores\[September 15 2004.xls]S18'!B$24 -> 0 | E68: ='\Documents and Settings\Chris\My Documents\IDPA\Forms\Match Scores\[September 15 2004.xls]S18'!C$24 -> 5 | F68: ='\Documents and Settings\Chris\My Documents\IDPA\Forms\Match Scores\[September 15 2004.xls]S18'!D$24 -> 3 | G68: ='\Documents and Settings\Chris\My Documents\IDPA\Forms\Match Scores\[September 15 2004.xls]S18'!E$24 -> 18
A69: 10 | B69: ='\Documents and Settings\Chris\My Documents\IDPA\Forms\Match Scores\[September 15 2004.xls]S19'!$B$1 -> Paul Green | C69: ='\Documents and Settings\Chris\My Documents\IDPA\Forms\Match Scores\[September 15 2004.xls]S19'!$F$24 -> 29 | D69: ='\Documents and Settings\Chris\My Documents\IDPA\Forms\Match Scores\[September 15 2004.xls]S19'!B$24 -> 0 | E69: ='\Documents and Settings\Chris\My Documents\IDPA\Forms\Match Scores\[September 15 2004.xls]S19'!C$24 -> 5 | F69: ='\Documents and Settings\Chris\My Documents\IDPA\Forms\Match Scores\[September 15 2004.xls]S19'!D$24 -> 10 | G69: ='\Documents and Settings\Chris\My Documents\IDPA\Forms\Match Scores\[September 15 2004.xls]S19'!E$24 -> 14
A70: 11 | B70: ='\Documents and Settings\Chris\My Documents\IDPA\Forms\Match Scores\[September 15 2004.xls]S15'!$B$1 -> Mike Brownlee | C70: ='\Documents and Settings\Chris\My Documents\IDPA\Forms\Match Scores\[September 15 2004.xls]S15'!$F$24 -> 30 | D70: ='\Documents and Settings\Chris\My Documents\IDPA\Forms\Match Scores\[September 15 2004.xls]S15'!B$24 -> 1 | E70: ='\Documents and Settings\Chris\My Documents\IDPA\Forms\Match Scores\[September 15 2004.xls]S15'!C$24 -> 8 | F70: ='\Documents and Settings\Chris\My Documents\IDPA\Forms\Match Scores\[September 15 2004.xls]S15'!D$24 -> 13 | G70: ='\Documents and Settings\Chris\My Documents\IDPA\Forms\Match Scores\[September 15 2004.xls]S15'!E$24 -> 8
A71: 12 | B71: ='\Documents and Settings\Chris\My Documents\IDPA\Forms\Match Scores\[September 15 2004.xls]S17'!$B$1 -> Ren Young | C71: ='\Documents and Settings\Chris\My Documents\IDPA\Forms\Match Scores\[September 15 2004.xls]S17'!$F$24 -> 33 | D71: ='\Documents and Settings\Chris\My Documents\IDPA\Forms\Match Scores\[September 15 2004.xls]S17'!B$24 -> 1 | E71: ='\Documents and Settings\Chris\My Documents\IDPA\Forms\Match Scores\[September 15 2004.xls]S17'!C$24 -> 10 | F71: ='\Documents and Settings\Chris\My Documents\IDPA\Forms\Match Scores\[September 15 2004.xls]S17'!D$24 -> 14 | G71: ='\Documents and Settings\Chris\My Documents\IDPA\Forms\Match Scores\[September 15 2004.xls]S17'!E$24 -> 8
A72: 13 | B72: "Red" Redford (Rev) | C72: ='\Documents and Settings\Chris\My Documents\IDPA\Forms\Match Scores\[September 15 2004.xls]S8'!$F$24 -> 34 | D72: ='\Documents and Settings\Chris\My Documents\IDPA\Forms\Match Scores\[September 15 2004.xls]S8'!B$24 -> 2 | E72: ='\Documents and Settings\Chris\My Documents\IDPA\Forms\Match Scores\[September 15 2004.xls]S8'!C$24 -> 10 | F72: ='\Documents and Settings\Chris\My Documents\IDPA\Forms\Match Scores\[September 15 2004.xls]S8'!D$24 -> 8 | G72: ='\Documents and Settings\Chris\My Documents\IDPA\Forms\Match Scores\[September 15 2004.xls]S8'!E$24 -> 14
A73: 14 | B73: ='\Documents and Settings\Chris\My Documents\IDPA\Forms\Match Scores\[September 15 2004.xls]S12'!$B$1 -> Carol Perez | C73: ='\Documents and Settings\Chris\My Documents\IDPA\Forms\Match Scores\[September 15 2004.xls]S12'!$F$24 -> 34 | D73: ='\Documents and Settings\Chris\My Documents\IDPA\Forms\Match Scores\[September 15 2004.xls]S12'!B$24 -> 2 | E73: ='\Documents and Settings\Chris\My Documents\IDPA\Forms\Match Scores\[September 15 2004.xls]S12'!C$24 -> 2 | F73: ='\Documents and Settings\Chris\My Documents\IDPA\Forms\Match Scores\[September 15 2004.xls]S12'!D$24 -> 4 | G73: ='\Documents and Settings\Chris\My Documents\IDPA\Forms\Match Scores\[September 15 2004.xls]S12'!E$24 -> 26
A74: 15 | B74: ='\Documents and Settings\Chris\My Documents\IDPA\Forms\Match Scores\[September 15 2004.xls]S1'!$B$1 -> R Dan Phillips | C74: ='\Documents and Settings\Chris\My Documents\IDPA\Forms\Match Scores\[September 15 2004.xls]S1'!$F$24 -> 41 | D74: ='\Documents and Settings\Chris\My Documents\IDPA\Forms\Match Scores\[September 15 2004.xls]S1'!B$24 -> 0 | E74: ='\Documents and Settings\Chris\My Documents\IDPA\Forms\Match Scores\[September 15 2004.xls]S1'!C$24 -> 9 | F74: ='\Documents and Settings\Chris\My Documents\IDPA\Forms\Match Scores\[September 15 2004.xls]S1'!D$24 -> 13 | G74: ='\Documents and Settings\Chris\My Documents\IDPA\Forms\Match Scores\[September 15 2004.xls]S1'!E$24 -> 19
A75: 16 | B75: ='\Documents and Settings\Chris\My Documents\IDPA\Forms\Match Scores\[September 15 2004.xls]S11'!$B$1 -> John Diamond | C75: ='\Documents and Settings\Chris\My Documents\IDPA\Forms\Match Scores\[September 15 2004.xls]S11'!$F$24 -> 47 | D75: ='\Documents and Settings\Chris\My Documents\IDPA\Forms\Match Scores\[September 15 2004.xls]S11'!B$24 -> 10 | E75: ='\Documents and Settings\Chris\My Documents\IDPA\Forms\Match Scores\[September 15 2004.xls]S11'!C$24 -> 6 | F75: ='\Documents and Settings\Chris\My Documents\IDPA\Forms\Match Scores\[September 15 2004.xls]S11'!D$24 -> 19 | G75: ='\Documents and Settings\Chris\My Documents\IDPA\Forms\Match Scores\[September 15 2004.xls]S11'!E$24 -> 12
A76: 17 | B76: ='\Documents and Settings\Chris\My Documents\IDPA\Forms\Match Scores\[September 15 2004.xls]S9'!$B$1 -> Roger "Don't Run" Cox | C76: ='\Documents and Settings\Chris\My Documents\IDPA\Forms\Match Scores\[September 15 2004.xls]S9'!$F$24 -> 48 | D76: ='\Documents and Settings\Chris\My Documents\IDPA\Forms\Match Scores\[September 15 2004.xls]S9'!B$24 -> 4 | E76: ='\Documents and Settings\Chris\My Documents\IDPA\Forms\Match Scores\[September 15 2004.xls]S9'!C$24 -> 5 | F76: ='\Documents and Settings\Chris\My Documents\IDPA\Forms\Match Scores\[September 15 2004.xls]S9'!D$24 -> 12 | G76: ='\Documents and Settings\Chris\My Documents\IDPA\Forms\Match Scores\[September 15 2004.xls]S9'!E$24 -> 27
A77: 18 | B77: ='\Documents and Settings\Chris\My Documents\IDPA\Forms\Match Scores\[September 15 2004.xls]S13'!$B$1 -> Danimal | C77: ='\Documents and Settings\Chris\My Documents\IDPA\Forms\Match Scores\[September 15 2004.xls]S13'!$F$24 -> 50 | D77: ='\Documents and Settings\Chris\My Documents\IDPA\Forms\Match Scores\[September 15 2004.xls]S13'!B$24 -> 1 | E77: ='\Documents and Settings\Chris\My Documents\IDPA\Forms\Match Scores\[September 15 2004.xls]S13'!C$24 -> 12 | F77: ='\Documents and Settings\Chris\My Documents\IDPA\Forms\Match Scores\[September 15 2004.xls]S13'!D$24 -> 7 | G77: ='\Documents and Settings\Chris\My Documents\IDPA\Forms\Match Scores\[September 15 2004.xls]S13'!E$24 -> 30
A78: 19 | B78: ='\Documents and Settings\Chris\My Documents\IDPA\Forms\Match Scores\[September 15 2004.xls]S20'!$B$1 -> John Johnson | C78: ='\Documents and Settings\Chris\My Documents\IDPA\Forms\Match Scores\[September 15 2004.xls]S20'!$F$24 -> 58 | D78: ='\Documents and Settings\Chris\My Documents\IDPA\Forms\Match Scores\[September 15 2004.xls]S20'!B$24 -> 0 | E78: ='\Documents and Settings\Chris\My Documents\IDPA\Forms\Match Scores\[September 15 2004.xls]S20'!C$24 -> 13 | F78: ='\Documents and Settings\Chris\My Documents\IDPA\Forms\Match Scores\[September 15 2004.xls]S20'!D$24 -> 9 | G78: ='\Documents and Settings\Chris\My Documents\IDPA\Forms\Match Scores\[September 15 2004.xls]S20'!E$24 -> 36
A79: 20 | B79: ='\Documents and Settings\Chris\My Documents\IDPA\Forms\Match Scores\[September 15 2004.xls]S7'!$B$1 -> Erin Herring | C79: ='\Documents and Settings\Chris\My Documents\IDPA\Forms\Match Scores\[September 15 2004.xls]S7'!$F$24 -> 59 | D79: ='\Documents and Settings\Chris\My Documents\IDPA\Forms\Match Scores\[September 15 2004.xls]S7'!B$24 -> 1 | E79: ='\Documents and Settings\Chris\My Documents\IDPA\Forms\Match Scores\[September 15 2004.xls]S7'!C$24 -> 7 | F79: ='\Documents and Settings\Chris\My Documents\IDPA\Forms\Match Scores\[September 15 2004.xls]S7'!D$24 -> 14 | G79: ='\Documents and Settings\Chris\My Documents\IDPA\Forms\Match Scores\[September 15 2004.xls]S7'!E$24 -> 37
A80: 21 | B80: ='\Documents and Settings\Chris\My Documents\IDPA\Forms\Match Scores\[September 15 2004.xls]S2'!$B$1 -> Randy Hill | C80: ='\Documents and Settings\Chris\My Documents\IDPA\Forms\Match Scores\[September 15 2004.xls]S2'!$F$24 -> 62 | D80: ='\Documents and Settings\Chris\My Documents\IDPA\Forms\Match Scores\[September 15 2004.xls]S2'!B$24 -> 7 | E80: ='\Documents and Settings\Chris\My Documents\IDPA\Forms\Match Scores\[September 15 2004.xls]S2'!C$24 -> 10 | F80: ='\Documents and Settings\Chris\My Documents\IDPA\Forms\Match Scores\[September 15 2004.xls]S2'!D$24 -> 14 | G80: ='\Documents and Settings\Chris\My Documents\IDPA\Forms\Match Scores\[September 15 2004.xls]S2'!E$24 -> 31
A81: S22 | B81: ='\Documents and Settings\Chris\My Documents\IDPA\Forms\Match Scores\[September 15 2004.xls]S22'!$B$1 -> 0 | C81: ='\Documents and Settings\Chris\My Documents\IDPA\Forms\Match Scores\[September 15 2004.xls]S22'!$F$24 -> 0 | D81: ='\Documents and Settings\Chris\My Documents\IDPA\Forms\Match Scores\[September 15 2004.xls]S22'!B$24 -> 0 | E81: ='\Documents and Settings\Chris\My Documents\IDPA\Forms\Match Scores\[September 15 2004.xls]S22'!C$24 -> 0 | F81: ='\Documents and Settings\Chris\My Documents\IDPA\Forms\Match Scores\[September 15 2004.xls]S22'!D$24 -> 0 | G81: ='\Documents and Settings\Chris\My Documents\IDPA\Forms\Match Scores\[September 15 2004.xls]S22'!E$24 -> 0
A82: S23 | B82: ='\Documents and Settings\Chris\My Documents\IDPA\Forms\Match Scores\[September 15 2004.xls]S23'!$B$1 -> 0 | C82: ='\Documents and Settings\Chris\My Documents\IDPA\Forms\Match Scores\[September 15 2004.xls]S23'!$F$24 -> 0 | D82: ='\Documents and Settings\Chris\My Documents\IDPA\Forms\Match Scores\[September 15 2004.xls]S23'!B$24 -> 0 | E82: ='\Documents and Settings\Chris\My Documents\IDPA\Forms\Match Scores\[September 15 2004.xls]S23'!C$24 -> 0 | F82: ='\Documents and Settings\Chris\My Documents\IDPA\Forms\Match Scores\[September 15 2004.xls]S23'!D$24 -> 0 | G82: ='\Documents and Settings\Chris\My Documents\IDPA\Forms\Match Scores\[September 15 2004.xls]S23'!E$24 -> 0
A83: S24 | B83: ='\Documents and Settings\Chris\My Documents\IDPA\Forms\Match Scores\[September 15 2004.xls]S24'!$B$1 -> 0 | C83: ='\Documents and Settings\Chris\My Documents\IDPA\Forms\Match Scores\[September 15 2004.xls]S24'!$F$24 -> 0 | D83: ='\Documents and Settings\Chris\My Documents\IDPA\Forms\Match Scores\[September 15 2004.xls]S24'!B$24 -> 0 | E83: ='\Documents and Settings\Chris\My Documents\IDPA\Forms\Match Scores\[September 15 2004.xls]S24'!C$24 -> 0 | F83: ='\Documents and Settings\Chris\My Documents\IDPA\Forms\Match Scores\[September 15 2004.xls]S24'!D$24 -> 0 | G83: ='\Documents and Settings\Chris\My Documents\IDPA\Forms\Match Scores\[September 15 2004.xls]S24'!E$24 -> 0
A84: S25 | B84: ='\Documents and Settings\Chris\My Documents\IDPA\Forms\Match Scores\[September 15 2004.xls]S25'!$B$1 -> 0 | C84: ='\Documents and Settings\Chris\My Documents\IDPA\Forms\Match Scores\[September 15 2004.xls]S25'!$F$24 -> 0 | D84: ='\Documents and Settings\Chris\My Documents\IDPA\Forms\Match Scores\[September 15 2004.xls]S25'!B$24 -> 0 | E84: ='\Documents and Settings\Chris\My Documents\IDPA\Forms\Match Scores\[September 15 2004.xls]S25'!C$24 -> 0 | F84: ='\Documents and Settings\Chris\My Documents\IDPA\Forms\Match Scores\[September 15 2004.xls]S25'!D$24 -> 0 | G84: ='\Documents and Settings\Chris\My Documents\IDPA\Forms\Match Scores\[September 15 2004.xls]S25'!E$24 -> 0
A85: Overall Average: | C85: =SUM(C60:C84)/$A$29 -> 33.523809523809526 | D85: =SUM(D60:D84)/$A$29 -> 1.7142857142857142 | E85: =SUM(E60:E84)/$A$29 -> 7.1904761904761907 | F85: =SUM(F60:F84)/$A$29 -> 8 | G85: =SUM(G60:G84)/$A$29 -> 16.61904761904762