A1: Utah Shooting Academy Sept. 29, 2004
A2: SCORES (Including points down and penalties)
A3: Place | B3: Name | C3: Match | D3: Stage1 | E3: Stage 2 | F3: Stage 3 | G3: Stage4
A4: 1 | B4: ='[September 29 2004.xls]S8'!$B$1 -> Bryan Mortenson | C4: ='[September 29 2004.xls]S8'!$F$27 -> 47.09 | D4: ='[September 29 2004.xls]S8'!B$27 -> 5.00 | E4: ='[September 29 2004.xls]S8'!C$27 -> 20.55 | F4: ='[September 29 2004.xls]S8'!D$27 -> 21.54 | G4: ='[September 29 2004.xls]S1'!E$27 -> 0.00
A5: 2 | B5: ='[September 29 2004.xls]S10'!$B$1 -> Dave Beck | C5: ='[September 29 2004.xls]S10'!$F$27 -> 50.95 | D5: ='[September 29 2004.xls]S10'!B$27 -> 0.00 | E5: ='[September 29 2004.xls]S10'!C$27 -> 25.12 | F5: ='[September 29 2004.xls]S10'!D$27 -> 25.83 | G5: ='[September 29 2004.xls]S2'!E$27 -> 0.00
A6: 3 | B6: ='[September 29 2004.xls]S2'!$B$1 -> Dave Duncan | C6: ='[September 29 2004.xls]S2'!$F$27 -> 55.74 | D6: ='[September 29 2004.xls]S2'!B$27 -> 2.50 | E6: ='[September 29 2004.xls]S2'!C$27 -> 25.75 | F6: ='[September 29 2004.xls]S2'!D$27 -> 27.49 | G6: ='[September 29 2004.xls]S3'!E$27 -> 0.00
A7: 4 | B7: ='[September 29 2004.xls]S16'!$B$1 -> Justin Park | C7: ='[September 29 2004.xls]S16'!$F$27 -> 56.73 | D7: ='[September 29 2004.xls]S16'!B$27 -> 2.50 | E7: ='[September 29 2004.xls]S16'!C$27 -> 27.88 | F7: ='[September 29 2004.xls]S16'!D$27 -> 26.35 | G7: ='[September 29 2004.xls]S4'!E$27 -> 0.00
A8: 5 | B8: ='[September 29 2004.xls]S1'!$B$1 -> Neil Hood | C8: ='[September 29 2004.xls]S1'!$F$27 -> 57.51 | D8: ='[September 29 2004.xls]S1'!B$27 -> 2.50 | E8: ='[September 29 2004.xls]S1'!C$27 -> 27.15 | F8: ='[September 29 2004.xls]S1'!D$27 -> 27.86 | G8: ='[September 29 2004.xls]S5'!E$27 -> 0.00
A9: 6 | B9: ='[September 29 2004.xls]S12'!$B$1 -> Les Langford | C9: ='[September 29 2004.xls]S12'!$F$27 -> 60.62 | D9: ='[September 29 2004.xls]S12'!B$27 -> 5.00 | E9: ='[September 29 2004.xls]S12'!C$27 -> 25.29 | F9: ='[September 29 2004.xls]S12'!D$27 -> 30.33 | G9: ='[September 29 2004.xls]S6'!E$27 -> 0.00
A10: 7 | B10: ='[September 29 2004.xls]S13'!$B$1 -> Carl Burney | C10: ='[September 29 2004.xls]S13'!$F$27 -> 61.00 | D10: ='[September 29 2004.xls]S13'!B$27 -> 2.50 | E10: ='[September 29 2004.xls]S13'!C$27 -> 26.25 | F10: ='[September 29 2004.xls]S13'!D$27 -> 32.25 | G10: ='[September 29 2004.xls]S7'!E$27 -> 0.00
A11: 8 | B11: ='[September 29 2004.xls]S6'!$B$1 -> Ken Thorne | C11: ='[September 29 2004.xls]S6'!$F$27 -> 67.13 | D11: ='[September 29 2004.xls]S6'!B$27 -> 5.00 | E11: ='[September 29 2004.xls]S6'!C$27 -> 26.75 | F11: ='[September 29 2004.xls]S6'!D$27 -> 35.38 | G11: ='[September 29 2004.xls]S8'!E$27 -> 0.00
A12: 9 | B12: ='[September 29 2004.xls]S15'!$B$1 -> Bill Dezell | C12: ='[September 29 2004.xls]S15'!$F$27 -> 70.17 | D12: ='[September 29 2004.xls]S15'!B$27 -> 10.00 | E12: ='[September 29 2004.xls]S15'!C$27 -> 25.98 | F12: ='[September 29 2004.xls]S15'!D$27 -> 34.19 | G12: ='[September 29 2004.xls]S9'!E$27 -> 0.00
A13: 10 | B13: ='[September 29 2004.xls]S5'!$B$1 -> Dave Deleeuw | C13: ='[September 29 2004.xls]S5'!$F$27 -> 73.00 | D13: ='[September 29 2004.xls]S5'!B$27 -> 15.50 | E13: ='[September 29 2004.xls]S5'!C$27 -> 25.44 | F13: ='[September 29 2004.xls]S5'!D$27 -> 32.06 | G13: ='[September 29 2004.xls]S10'!E$27 -> 0.00
A14: 11 | B14: ='[September 29 2004.xls]S9'!$B$1 -> Danimal | C14: ='[September 29 2004.xls]S9'!$F$27 -> 78.40 | D14: ='[September 29 2004.xls]S9'!B$27 -> 7.50 | E14: ='[September 29 2004.xls]S9'!C$27 -> 30.58 | F14: ='[September 29 2004.xls]S9'!D$27 -> 40.32 | G14: ='[September 29 2004.xls]S11'!E$27 -> 0.00
A15: 12 | B15: ='[September 29 2004.xls]S3'!$B$1 -> Dan Hood | C15: ='[September 29 2004.xls]S3'!$F$27 -> 83.91 | D15: ='[September 29 2004.xls]S3'!B$27 -> 30.00 | E15: ='[September 29 2004.xls]S3'!C$27 -> 27.00 | F15: ='[September 29 2004.xls]S3'!D$27 -> 26.91 | G15: ='[September 29 2004.xls]S12'!E$27 -> 0.00
A16: 13 | B16: ='[September 29 2004.xls]S11'!$B$1 -> R Dan Phillips | C16: ='[September 29 2004.xls]S11'!$F$27 -> 89.13 | D16: ='[September 29 2004.xls]S11'!B$27 -> 27.50 | E16: ='[September 29 2004.xls]S11'!C$27 -> 28.42 | F16: ='[September 29 2004.xls]S11'!D$27 -> 33.21 | G16: ='[September 29 2004.xls]S13'!E$27 -> 0.00
A17: 14 | B17: ='[September 29 2004.xls]S7'!$B$1 -> Ryan Thorne | C17: ='[September 29 2004.xls]S7'!$F$27 -> 98.92 | D17: ='[September 29 2004.xls]S7'!B$27 -> 20.00 | E17: ='[September 29 2004.xls]S7'!C$27 -> 37.01 | F17: ='[September 29 2004.xls]S7'!D$27 -> 41.91 | G17: ='[September 29 2004.xls]S14'!E$27 -> 0.00
A18: 15 | B18: ='[September 29 2004.xls]S14'!$B$1 -> Erin Herring | C18: ='[September 29 2004.xls]S14'!$F$27 -> 101.14 | D18: ='[September 29 2004.xls]S14'!B$27 -> 20.00 | E18: ='[September 29 2004.xls]S14'!C$27 -> 37.13 | F18: ='[September 29 2004.xls]S14'!D$27 -> 44.01 | G18: ='[September 29 2004.xls]S15'!E$27 -> 0.00
A19: 16 | B19: ='[September 29 2004.xls]S4'!$B$1 -> Carol Perez | C19: ='[September 29 2004.xls]S4'!$F$27 -> 138.08 | D19: ='[September 29 2004.xls]S4'!B$27 -> 25.50 | E19: ='[September 29 2004.xls]S4'!C$27 -> 42.33 | F19: ='[September 29 2004.xls]S4'!D$27 -> 70.25 | G19: ='[September 29 2004.xls]S16'!E$27 -> 0.00
A20: S17 | B20: ='[September 29 2004.xls]S17'!$B$1 -> 0 | C20: ='[September 29 2004.xls]S17'!$F$27 -> 0.00 | D20: ='[September 29 2004.xls]S17'!B$27 -> 0.00 | E20: ='[September 29 2004.xls]S17'!C$27 -> 0.00 | F20: ='[September 29 2004.xls]S17'!D$27 -> 0.00 | G20: ='[September 29 2004.xls]S17'!E$27 -> 0.00
A21: S18 | B21: ='[September 29 2004.xls]S18'!$B$1 -> 0 | C21: ='[September 29 2004.xls]S18'!$F$27 -> 0.00 | D21: ='[September 29 2004.xls]S18'!B$27 -> 0.00 | E21: ='[September 29 2004.xls]S18'!C$27 -> 0.00 | F21: ='[September 29 2004.xls]S18'!D$27 -> 0.00 | G21: ='[September 29 2004.xls]S18'!E$27 -> 0.00
A22: S19 | B22: ='[September 29 2004.xls]S19'!$B$1 -> 0 | C22: ='[September 29 2004.xls]S19'!$F$27 -> 0.00 | D22: ='[September 29 2004.xls]S19'!B$27 -> 0.00 | E22: ='[September 29 2004.xls]S19'!C$27 -> 0.00 | F22: ='[September 29 2004.xls]S19'!D$27 -> 0.00 | G22: ='[September 29 2004.xls]S19'!E$27 -> 0.00
A23: S20 | B23: ='[September 29 2004.xls]S20'!$B$1 -> 0 | C23: ='[September 29 2004.xls]S20'!$F$27 -> 0.00 | D23: ='[September 29 2004.xls]S20'!B$27 -> 0.00 | E23: ='[September 29 2004.xls]S20'!C$27 -> 0.00 | F23: ='[September 29 2004.xls]S20'!D$27 -> 0.00 | G23: ='[September 29 2004.xls]S20'!E$27 -> 0.00
A24: S21 | B24: ='[September 29 2004.xls]S21'!$B$1 -> 0 | C24: ='[September 29 2004.xls]S21'!$F$27 -> 0.00 | D24: ='[September 29 2004.xls]S21'!B$27 -> 0.00 | E24: ='[September 29 2004.xls]S21'!C$27 -> 0.00 | F24: ='[September 29 2004.xls]S21'!D$27 -> 0.00 | G24: ='[September 29 2004.xls]S21'!E$27 -> 0.00
A25: S22 | B25: ='[September 29 2004.xls]S22'!$B$1 -> 0 | C25: ='[September 29 2004.xls]S22'!$F$27 -> 0.00 | D25: ='[September 29 2004.xls]S22'!B$27 -> 0.00 | E25: ='[September 29 2004.xls]S22'!C$27 -> 0.00 | F25: ='[September 29 2004.xls]S22'!D$27 -> 0.00 | G25: ='[September 29 2004.xls]S22'!E$27 -> 0.00
A26: S23 | B26: ='[September 29 2004.xls]S23'!$B$1 -> 0 | C26: ='[September 29 2004.xls]S23'!$F$27 -> 0.00 | D26: ='[September 29 2004.xls]S23'!B$27 -> 0.00 | E26: ='[September 29 2004.xls]S23'!C$27 -> 0.00 | F26: ='[September 29 2004.xls]S23'!D$27 -> 0.00 | G26: ='[September 29 2004.xls]S23'!E$27 -> 0.00
A27: S24 | B27: ='[September 29 2004.xls]S24'!$B$1 -> 0 | C27: ='[September 29 2004.xls]S24'!$F$27 -> 0.00 | D27: ='[September 29 2004.xls]S24'!B$27 -> 0.00 | E27: ='[September 29 2004.xls]S24'!C$27 -> 0.00 | F27: ='[September 29 2004.xls]S24'!D$27 -> 0.00 | G27: ='[September 29 2004.xls]S24'!E$27 -> 0.00
A28: S25 | B28: ='[September 29 2004.xls]S25'!$B$1 -> 0 | C28: ='[September 29 2004.xls]S25'!$F$27 -> 0.00 | D28: ='[September 29 2004.xls]S25'!B$27 -> 0.00 | E28: ='[September 29 2004.xls]S25'!C$27 -> 0.00 | F28: ='[September 29 2004.xls]S25'!D$27 -> 0.00 | G28: ='[September 29 2004.xls]S25'!E$27 -> 0.00
A29: =COUNTIF($C$4:$C$28,">0") -> 16 | B29: Overall Average: | C29: =SUM(C4:C28)/$A$29 -> 74.344999999999999 | D29: =SUM(D4:D28)/$A$29 -> 11.3125 | E29: =SUM(E4:E28)/$A$29 -> 28.664375 | F29: =SUM(F4:F28)/$A$29 -> 34.368124999999999 | G29: =SUM(G4:G28)/$A$29 -> 0.00
A30: RAW TIMES
A31: Place | B31: Name | C31: Match | D31: Stage1 | E31: Stage 2 | F31: Stage 3 | G31: Stage4
A32: 1 | B32: ='[September 29 2004.xls]S8'!$B$1 -> Bryan Mortenson | C32: ='[September 29 2004.xls]S8'!$F$23 -> 41.09 | D32: ='[September 29 2004.xls]S8'!B$23 -> 0.00 | E32: ='[September 29 2004.xls]S8'!C$23 -> 20.55 | F32: ='[September 29 2004.xls]S8'!D$23 -> 20.54 | G32: ='[September 29 2004.xls]S1'!E$23 -> 0.00
A33: 2 | B33: ='[September 29 2004.xls]S16'!$B$1 -> Justin Park | C33: ='[September 29 2004.xls]S16'!$F$23 -> 43.73 | D33: ='[September 29 2004.xls]S16'!B$23 -> 0.00 | E33: ='[September 29 2004.xls]S16'!C$23 -> 20.38 | F33: ='[September 29 2004.xls]S16'!D$23 -> 23.35 | G33: ='[September 29 2004.xls]S2'!E$23 -> 0.00
A34: 3 | B34: ='[September 29 2004.xls]S10'!$B$1 -> Dave Beck | C34: ='[September 29 2004.xls]S10'!$F$23 -> 47.95 | D34: ='[September 29 2004.xls]S10'!B$23 -> 0.00 | E34: ='[September 29 2004.xls]S10'!C$23 -> 24.12 | F34: ='[September 29 2004.xls]S10'!D$23 -> 23.83 | G34: ='[September 29 2004.xls]S3'!E$23 -> 0.00
A35: 4 | B35: ='[September 29 2004.xls]S3'!$B$1 -> Dan Hood | C35: ='[September 29 2004.xls]S3'!$F$23 -> 48.41 | D35: ='[September 29 2004.xls]S3'!B$23 -> 0.00 | E35: ='[September 29 2004.xls]S3'!C$23 -> 23.50 | F35: ='[September 29 2004.xls]S3'!D$23 -> 24.91 | G35: ='[September 29 2004.xls]S4'!E$23 -> 0.00
A36: 5 | B36: ='[September 29 2004.xls]S2'!$B$1 -> Dave Duncan | C36: ='[September 29 2004.xls]S2'!$F$23 -> 49.74 | D36: ='[September 29 2004.xls]S2'!B$23 -> 0.00 | E36: ='[September 29 2004.xls]S2'!C$23 -> 24.25 | F36: ='[September 29 2004.xls]S2'!D$23 -> 25.49 | G36: ='[September 29 2004.xls]S5'!E$23 -> 0.00
A37: 6 | B37: ='[September 29 2004.xls]S1'!$B$1 -> Neil Hood | C37: ='[September 29 2004.xls]S1'!$F$23 -> 50.51 | D37: ='[September 29 2004.xls]S1'!B$23 -> 0.00 | E37: ='[September 29 2004.xls]S1'!C$23 -> 25.65 | F37: ='[September 29 2004.xls]S1'!D$23 -> 24.86 | G37: ='[September 29 2004.xls]S6'!E$23 -> 0.00
A38: 7 | B38: ='[September 29 2004.xls]S12'!$B$1 -> Les Langford | C38: ='[September 29 2004.xls]S12'!$F$23 -> 52.62 | D38: ='[September 29 2004.xls]S12'!B$23 -> 0.00 | E38: ='[September 29 2004.xls]S12'!C$23 -> 23.79 | F38: ='[September 29 2004.xls]S12'!D$23 -> 28.83 | G38: ='[September 29 2004.xls]S7'!E$23 -> 0.00
A39: 8 | B39: ='[September 29 2004.xls]S6'!$B$1 -> Ken Thorne | C39: ='[September 29 2004.xls]S6'!$F$23 -> 53.13 | D39: ='[September 29 2004.xls]S6'!B$23 -> 0.00 | E39: ='[September 29 2004.xls]S6'!C$23 -> 21.75 | F39: ='[September 29 2004.xls]S6'!D$23 -> 31.38 | G39: ='[September 29 2004.xls]S8'!E$23 -> 0.00
A40: 9 | B40: ='[September 29 2004.xls]S5'!$B$1 -> Dave Deleeuw | C40: ='[September 29 2004.xls]S5'!$F$23 -> 53.50 | D40: ='[September 29 2004.xls]S5'!B$23 -> 0.00 | E40: ='[September 29 2004.xls]S5'!C$23 -> 23.94 | F40: ='[September 29 2004.xls]S5'!D$23 -> 29.56 | G40: ='[September 29 2004.xls]S9'!E$23 -> 0.00
A41: 10 | B41: ='[September 29 2004.xls]S13'!$B$1 -> Carl Burney | C41: ='[September 29 2004.xls]S13'!$F$23 -> 55.50 | D41: ='[September 29 2004.xls]S13'!B$23 -> 0.00 | E41: ='[September 29 2004.xls]S13'!C$23 -> 25.25 | F41: ='[September 29 2004.xls]S13'!D$23 -> 30.25 | G41: ='[September 29 2004.xls]S10'!E$23 -> 0.00
A42: 11 | B42: ='[September 29 2004.xls]S7'!$B$1 -> Ryan Thorne | C42: ='[September 29 2004.xls]S7'!$F$23 -> 57.92 | D42: ='[September 29 2004.xls]S7'!B$23 -> 0.00 | E42: ='[September 29 2004.xls]S7'!C$23 -> 26.01 | F42: ='[September 29 2004.xls]S7'!D$23 -> 31.91 | G42: ='[September 29 2004.xls]S11'!E$23 -> 0.00
A43: 12 | B43: ='[September 29 2004.xls]S11'!$B$1 -> R Dan Phillips | C43: ='[September 29 2004.xls]S11'!$F$23 -> 58.13 | D43: ='[September 29 2004.xls]S11'!B$23 -> 0.00 | E43: ='[September 29 2004.xls]S11'!C$23 -> 26.42 | F43: ='[September 29 2004.xls]S11'!D$23 -> 31.71 | G43: ='[September 29 2004.xls]S12'!E$23 -> 0.00
A44: 13 | B44: ='[September 29 2004.xls]S15'!$B$1 -> Bill Dezell | C44: ='[September 29 2004.xls]S15'!$F$23 -> 58.17 | D44: ='[September 29 2004.xls]S15'!B$23 -> 0.00 | E44: ='[September 29 2004.xls]S15'!C$23 -> 25.98 | F44: ='[September 29 2004.xls]S15'!D$23 -> 32.19 | G44: ='[September 29 2004.xls]S13'!E$23 -> 0.00
A45: 14 | B45: ='[September 29 2004.xls]S9'!$B$1 -> Danimal | C45: ='[September 29 2004.xls]S9'!$F$23 -> 61.40 | D45: ='[September 29 2004.xls]S9'!B$23 -> 0.00 | E45: ='[September 29 2004.xls]S9'!C$23 -> 26.58 | F45: ='[September 29 2004.xls]S9'!D$23 -> 34.82 | G45: ='[September 29 2004.xls]S14'!E$23 -> 0.00
A46: 15 | B46: ='[September 29 2004.xls]S14'!$B$1 -> Erin Herring | C46: ='[September 29 2004.xls]S14'!$F$23 -> 71.64 | D46: ='[September 29 2004.xls]S14'!B$23 -> 0.00 | E46: ='[September 29 2004.xls]S14'!C$23 -> 31.13 | F46: ='[September 29 2004.xls]S14'!D$23 -> 40.51 | G46: ='[September 29 2004.xls]S15'!E$23 -> 0.00
A47: 16 | B47: ='[September 29 2004.xls]S4'!$B$1 -> Carol Perez | C47: ='[September 29 2004.xls]S4'!$F$23 -> 99.08 | D47: ='[September 29 2004.xls]S4'!B$23 -> 0.00 | E47: ='[September 29 2004.xls]S4'!C$23 -> 37.83 | F47: ='[September 29 2004.xls]S4'!D$23 -> 61.25 | G47: ='[September 29 2004.xls]S16'!E$23 -> 0.00
A48: S17 | B48: ='[September 29 2004.xls]S17'!$B$1 -> 0 | C48: ='[September 29 2004.xls]S17'!$F$23 -> 0.00 | D48: ='[September 29 2004.xls]S17'!B$23 -> 0.00 | E48: ='[September 29 2004.xls]S17'!C$23 -> 0.00 | F48: ='[September 29 2004.xls]S17'!D$23 -> 0.00 | G48: ='[September 29 2004.xls]S17'!E$23 -> 0.00
A49: S18 | B49: ='[September 29 2004.xls]S18'!$B$1 -> 0 | C49: ='[September 29 2004.xls]S18'!$F$23 -> 0.00 | D49: ='[September 29 2004.xls]S18'!B$23 -> 0.00 | E49: ='[September 29 2004.xls]S18'!C$23 -> 0.00 | F49: ='[September 29 2004.xls]S18'!D$23 -> 0.00 | G49: ='[September 29 2004.xls]S18'!E$23 -> 0.00
A50: S19 | B50: ='[September 29 2004.xls]S19'!$B$1 -> 0 | C50: ='[September 29 2004.xls]S19'!$F$23 -> 0.00 | D50: ='[September 29 2004.xls]S19'!B$23 -> 0.00 | E50: ='[September 29 2004.xls]S19'!C$23 -> 0.00 | F50: ='[September 29 2004.xls]S19'!D$23 -> 0.00 | G50: ='[September 29 2004.xls]S19'!E$23 -> 0.00
A51: S20 | B51: ='[September 29 2004.xls]S20'!$B$1 -> 0 | C51: ='[September 29 2004.xls]S20'!$F$23 -> 0.00 | D51: ='[September 29 2004.xls]S20'!B$23 -> 0.00 | E51: ='[September 29 2004.xls]S20'!C$23 -> 0.00 | F51: ='[September 29 2004.xls]S20'!D$23 -> 0.00 | G51: ='[September 29 2004.xls]S20'!E$23 -> 0.00
A52: S21 | B52: ='[September 29 2004.xls]S21'!$B$1 -> 0 | C52: ='[September 29 2004.xls]S21'!$F$23 -> 0.00 | D52: ='[September 29 2004.xls]S21'!B$23 -> 0.00 | E52: ='[September 29 2004.xls]S21'!C$23 -> 0.00 | F52: ='[September 29 2004.xls]S21'!D$23 -> 0.00 | G52: ='[September 29 2004.xls]S21'!E$23 -> 0.00
A53: S22 | B53: ='[September 29 2004.xls]S22'!$B$1 -> 0 | C53: ='[September 29 2004.xls]S22'!$F$23 -> 0.00 | D53: ='[September 29 2004.xls]S22'!B$23 -> 0.00 | E53: ='[September 29 2004.xls]S22'!C$23 -> 0.00 | F53: ='[September 29 2004.xls]S22'!D$23 -> 0.00 | G53: ='[September 29 2004.xls]S22'!E$23 -> 0.00
A54: S23 | B54: ='[September 29 2004.xls]S23'!$B$1 -> 0 | C54: ='[September 29 2004.xls]S23'!$F$23 -> 0.00 | D54: ='[September 29 2004.xls]S23'!B$23 -> 0.00 | E54: ='[September 29 2004.xls]S23'!C$23 -> 0.00 | F54: ='[September 29 2004.xls]S23'!D$23 -> 0.00 | G54: ='[September 29 2004.xls]S23'!E$23 -> 0.00
A55: S24 | B55: ='[September 29 2004.xls]S24'!$B$1 -> 0 | C55: ='[September 29 2004.xls]S24'!$F$23 -> 0.00 | D55: ='[September 29 2004.xls]S24'!B$23 -> 0.00 | E55: ='[September 29 2004.xls]S24'!C$23 -> 0.00 | F55: ='[September 29 2004.xls]S24'!D$23 -> 0.00 | G55: ='[September 29 2004.xls]S24'!E$23 -> 0.00
A56: S25 | B56: ='[September 29 2004.xls]S25'!$B$1 -> 0 | C56: ='[September 29 2004.xls]S25'!$F$23 -> 0.00 | D56: ='[September 29 2004.xls]S25'!B$23 -> 0.00 | E56: ='[September 29 2004.xls]S25'!C$23 -> 0.00 | F56: ='[September 29 2004.xls]S25'!D$23 -> 0.00 | G56: ='[September 29 2004.xls]S25'!E$23 -> 0.00
A57: Overall Average: | C57: =SUM(C32:C56)/$A$29 -> 56.407499999999999 | D57: =SUM(D32:D56)/$A$29 -> 0.00 | E57: =SUM(E32:E56)/$A$29 -> 25.445625 | F57: =SUM(F32:F56)/$A$29 -> 30.961874999999999 | G57: =SUM(G32:G56)/$A$29 -> 0.00
A58: POINTS DOWN
A59: Place | B59: Name | C59: Match | D59: Stage1 | E59: Stage 2 | F59: Stage 3 | G59: Stage4
A60: 1 | B60: ='[September 29 2004.xls]S10'!$B$1 -> Dave Beck | C60: ='[September 29 2004.xls]S10'!$F$24 -> 6 | D60: ='[September 29 2004.xls]S10'!B$24 -> 0 | E60: ='[September 29 2004.xls]S10'!C$24 -> 2 | F60: ='[September 29 2004.xls]S10'!D$24 -> 4 | G60: ='[September 29 2004.xls]S1'!E$24 -> 0
A61: 2 | B61: ='[September 29 2004.xls]S12'!$B$1 -> Les Langford | C61: ='[September 29 2004.xls]S12'!$F$24 -> 6 | D61: ='[September 29 2004.xls]S12'!B$24 -> 0 | E61: ='[September 29 2004.xls]S12'!C$24 -> 3 | F61: ='[September 29 2004.xls]S12'!D$24 -> 3 | G61: ='[September 29 2004.xls]S2'!E$24 -> 0
A62: 3 | B62: ='[September 29 2004.xls]S13'!$B$1 -> Carl Burney | C62: ='[September 29 2004.xls]S13'!$F$24 -> 11 | D62: ='[September 29 2004.xls]S13'!B$24 -> 5 | E62: ='[September 29 2004.xls]S13'!C$24 -> 2 | F62: ='[September 29 2004.xls]S13'!D$24 -> 4 | G62: ='[September 29 2004.xls]S3'!E$24 -> 0
A63: 4 | B63: ='[September 29 2004.xls]S2'!$B$1 -> Dave Duncan | C63: ='[September 29 2004.xls]S2'!$F$24 -> 12 | D63: ='[September 29 2004.xls]S2'!B$24 -> 5 | E63: ='[September 29 2004.xls]S2'!C$24 -> 3 | F63: ='[September 29 2004.xls]S2'!D$24 -> 4 | G63: ='[September 29 2004.xls]S4'!E$24 -> 0
A64: 5 | B64: ='[September 29 2004.xls]S8'!$B$1 -> Bryan Mortenson | C64: ='[September 29 2004.xls]S8'!$F$24 -> 12 | D64: ='[September 29 2004.xls]S8'!B$24 -> 10 | E64: ='[September 29 2004.xls]S8'!C$24 -> 0 | F64: ='[September 29 2004.xls]S8'!D$24 -> 2 | G64: ='[September 29 2004.xls]S5'!E$24 -> 0
A65: 6 | B65: ='[September 29 2004.xls]S1'!$B$1 -> Neil Hood | C65: ='[September 29 2004.xls]S1'!$F$24 -> 14 | D65: ='[September 29 2004.xls]S1'!B$24 -> 5 | E65: ='[September 29 2004.xls]S1'!C$24 -> 3 | F65: ='[September 29 2004.xls]S1'!D$24 -> 6 | G65: ='[September 29 2004.xls]S6'!E$24 -> 0
A66: 7 | B66: ='[September 29 2004.xls]S15'!$B$1 -> Bill Dezell | C66: ='[September 29 2004.xls]S15'!$F$24 -> 24 | D66: ='[September 29 2004.xls]S15'!B$24 -> 20 | E66: ='[September 29 2004.xls]S15'!C$24 -> 0 | F66: ='[September 29 2004.xls]S15'!D$24 -> 4 | G66: ='[September 29 2004.xls]S7'!E$24 -> 0
A67: 8 | B67: ='[September 29 2004.xls]S16'!$B$1 -> Justin Park | C67: ='[September 29 2004.xls]S16'!$F$24 -> 26 | D67: ='[September 29 2004.xls]S16'!B$24 -> 5 | E67: ='[September 29 2004.xls]S16'!C$24 -> 15 | F67: ='[September 29 2004.xls]S16'!D$24 -> 6 | G67: ='[September 29 2004.xls]S8'!E$24 -> 0
A68: 9 | B68: ='[September 29 2004.xls]S6'!$B$1 -> Ken Thorne | C68: ='[September 29 2004.xls]S6'!$F$24 -> 28 | D68: ='[September 29 2004.xls]S6'!B$24 -> 10 | E68: ='[September 29 2004.xls]S6'!C$24 -> 10 | F68: ='[September 29 2004.xls]S6'!D$24 -> 8 | G68: ='[September 29 2004.xls]S9'!E$24 -> 0
A69: 10 | B69: ='[September 29 2004.xls]S9'!$B$1 -> Danimal | C69: ='[September 29 2004.xls]S9'!$F$24 -> 34 | D69: ='[September 29 2004.xls]S9'!B$24 -> 15 | E69: ='[September 29 2004.xls]S9'!C$24 -> 8 | F69: ='[September 29 2004.xls]S9'!D$24 -> 11 | G69: ='[September 29 2004.xls]S10'!E$24 -> 0
A70: 11 | B70: ='[September 29 2004.xls]S5'!$B$1 -> Dave Deleeuw | C70: ='[September 29 2004.xls]S5'!$F$24 -> 39 | D70: ='[September 29 2004.xls]S5'!B$24 -> 31 | E70: ='[September 29 2004.xls]S5'!C$24 -> 3 | F70: ='[September 29 2004.xls]S5'!D$24 -> 5 | G70: ='[September 29 2004.xls]S11'!E$24 -> 0
A71: 12 | B71: ='[September 29 2004.xls]S14'!$B$1 -> Erin Herring | C71: ='[September 29 2004.xls]S14'!$F$24 -> 59 | D71: ='[September 29 2004.xls]S14'!B$24 -> 40 | E71: ='[September 29 2004.xls]S14'!C$24 -> 12 | F71: ='[September 29 2004.xls]S14'!D$24 -> 7 | G71: ='[September 29 2004.xls]S12'!E$24 -> 0
A72: 13 | B72: ='[September 29 2004.xls]S3'!$B$1 -> Dan Hood | C72: ='[September 29 2004.xls]S3'!$F$24 -> 61 | D72: ='[September 29 2004.xls]S3'!B$24 -> 50 | E72: ='[September 29 2004.xls]S3'!C$24 -> 7 | F72: ='[September 29 2004.xls]S3'!D$24 -> 4 | G72: ='[September 29 2004.xls]S13'!E$24 -> 0
A73: 14 | B73: ='[September 29 2004.xls]S11'!$B$1 -> R Dan Phillips | C73: ='[September 29 2004.xls]S11'!$F$24 -> 62 | D73: ='[September 29 2004.xls]S11'!B$24 -> 55 | E73: ='[September 29 2004.xls]S11'!C$24 -> 4 | F73: ='[September 29 2004.xls]S11'!D$24 -> 3 | G73: ='[September 29 2004.xls]S14'!E$24 -> 0
A74: 15 | B74: ='[September 29 2004.xls]S7'!$B$1 -> Ryan Thorne | C74: ='[September 29 2004.xls]S7'!$F$24 -> 72 | D74: ='[September 29 2004.xls]S7'!B$24 -> 30 | E74: ='[September 29 2004.xls]S7'!C$24 -> 22 | F74: ='[September 29 2004.xls]S7'!D$24 -> 20 | G74: ='[September 29 2004.xls]S15'!E$24 -> 0
A75: 16 | B75: ='[September 29 2004.xls]S4'!$B$1 -> Carol Perez | C75: ='[September 29 2004.xls]S4'!$F$24 -> 78 | D75: ='[September 29 2004.xls]S4'!B$24 -> 51 | E75: ='[September 29 2004.xls]S4'!C$24 -> 9 | F75: ='[September 29 2004.xls]S4'!D$24 -> 18 | G75: ='[September 29 2004.xls]S16'!E$24 -> 0
A76: S17 | B76: ='[September 29 2004.xls]S17'!$B$1 -> 0 | C76: ='[September 29 2004.xls]S17'!$F$24 -> 0 | D76: ='[September 29 2004.xls]S17'!B$24 -> 0 | E76: ='[September 29 2004.xls]S17'!C$24 -> 0 | F76: ='[September 29 2004.xls]S17'!D$24 -> 0 | G76: ='[September 29 2004.xls]S17'!E$24 -> 0
A77: S18 | B77: ='[September 29 2004.xls]S18'!$B$1 -> 0 | C77: ='[September 29 2004.xls]S18'!$F$24 -> 0 | D77: ='[September 29 2004.xls]S18'!B$24 -> 0 | E77: ='[September 29 2004.xls]S18'!C$24 -> 0 | F77: ='[September 29 2004.xls]S18'!D$24 -> 0 | G77: ='[September 29 2004.xls]S18'!E$24 -> 0
A78: S19 | B78: ='[September 29 2004.xls]S19'!$B$1 -> 0 | C78: ='[September 29 2004.xls]S19'!$F$24 -> 0 | D78: ='[September 29 2004.xls]S19'!B$24 -> 0 | E78: ='[September 29 2004.xls]S19'!C$24 -> 0 | F78: ='[September 29 2004.xls]S19'!D$24 -> 0 | G78: ='[September 29 2004.xls]S19'!E$24 -> 0
A79: S20 | B79: ='[September 29 2004.xls]S20'!$B$1 -> 0 | C79: ='[September 29 2004.xls]S20'!$F$24 -> 0 | D79: ='[September 29 2004.xls]S20'!B$24 -> 0 | E79: ='[September 29 2004.xls]S20'!C$24 -> 0 | F79: ='[September 29 2004.xls]S20'!D$24 -> 0 | G79: ='[September 29 2004.xls]S20'!E$24 -> 0
A80: S21 | B80: ='[September 29 2004.xls]S21'!$B$1 -> 0 | C80: ='[September 29 2004.xls]S21'!$F$24 -> 0 | D80: ='[September 29 2004.xls]S21'!B$24 -> 0 | E80: ='[September 29 2004.xls]S21'!C$24 -> 0 | F80: ='[September 29 2004.xls]S21'!D$24 -> 0 | G80: ='[September 29 2004.xls]S21'!E$24 -> 0
A81: S22 | B81: ='[September 29 2004.xls]S22'!$B$1 -> 0 | C81: ='[September 29 2004.xls]S22'!$F$24 -> 0 | D81: ='[September 29 2004.xls]S22'!B$24 -> 0 | E81: ='[September 29 2004.xls]S22'!C$24 -> 0 | F81: ='[September 29 2004.xls]S22'!D$24 -> 0 | G81: ='[September 29 2004.xls]S22'!E$24 -> 0
A82: S23 | B82: ='[September 29 2004.xls]S23'!$B$1 -> 0 | C82: ='[September 29 2004.xls]S23'!$F$24 -> 0 | D82: ='[September 29 2004.xls]S23'!B$24 -> 0 | E82: ='[September 29 2004.xls]S23'!C$24 -> 0 | F82: ='[September 29 2004.xls]S23'!D$24 -> 0 | G82: ='[September 29 2004.xls]S23'!E$24 -> 0
A83: S24 | B83: ='[September 29 2004.xls]S24'!$B$1 -> 0 | C83: ='[September 29 2004.xls]S24'!$F$24 -> 0 | D83: ='[September 29 2004.xls]S24'!B$24 -> 0 | E83: ='[September 29 2004.xls]S24'!C$24 -> 0 | F83: ='[September 29 2004.xls]S24'!D$24 -> 0 | G83: ='[September 29 2004.xls]S24'!E$24 -> 0
A84: S25 | B84: ='[September 29 2004.xls]S25'!$B$1 -> 0 | C84: ='[September 29 2004.xls]S25'!$F$24 -> 0 | D84: ='[September 29 2004.xls]S25'!B$24 -> 0 | E84: ='[September 29 2004.xls]S25'!C$24 -> 0 | F84: ='[September 29 2004.xls]S25'!D$24 -> 0 | G84: ='[September 29 2004.xls]S25'!E$24 -> 0
A85: Overall Average: | C85: =SUM(C60:C84)/$A$29 -> 34 | D85: =SUM(D60:D84)/$A$29 -> 20.75 | E85: =SUM(E60:E84)/$A$29 -> 6.4375 | F85: =SUM(F60:F84)/$A$29 -> 6.8125 | G85: =SUM(G60:G84)/$A$29 -> 0.00