A1: UDPL - IDPA Classifier | F1: Results for August 28, 2004 (Listed Alphabetically)
A2: Name | E2: Total Points Down | O2: Points Down | Z2: Points Down | AJ2: Points Down
B3: Div. | C3: Class/ Rank | D3: Match Total | F3: Stage 1 * | G3: Total Stage PD ** | H3: String 1 | I3: String 2 | J3: String 3 | K3: String 4 | L3: String 5 | M3: String 6 | N3: String 7 | O3: T1 | P3: T2 | Q3: T3 | R3: PD Time | S3: Proce durals | T3: Stage 2 | U3: Total Stage PD ** | V3: String 1 | W3: String 2 | X3: String 3 | Y3: String 4 | Z3: T1 | AA3: T2 | AB3: T3 | AC3: PD Time | AD3: Proce durals | AE3: Stage 3 | AF3: Total Stage PD ** | AG3: String 1 | AH3: String 2 | AI3: String 3 | AJ3: T1 | AK3: T2 | AL3: T3 | AM3: PD Time | AN3: Proce durals
A4: Barnes, Michael | B4: CDP | C4: NFC-MM | D4: =+F4+T4+AE4 -> 190.17 | E4: =+G4+U4+AF4 -> 136 | F4: =+H4+I4+J4+K4+L4+M4+N4+(G4*0.5) -> 56.39 | G4: =(O4+P4+Q4)+(S4*6) -> 33 | H4: 3.12 | I4: 3.53 | J4: 3.67 | K4: 7.36 | L4: 5.12 | M4: 9.69 | N4: 7.40 | O4: 19 | P4: 8 | Q4: 6 | R4: =(O4+P4+Q4)*0.5 -> 16.50 | S4: 0 | T4: =+V4+W4+X4+Y4+(U4*0.5) -> 52.82 | U4: =(Z4+AA4+AB4)+(AD4*6) -> 37 | V4: 5.17 | W4: 6.91 | X4: 14.57 | Y4: 7.67 | Z4: 16 | AA4: 11 | AB4: 10 | AC4: =(Z4+AA4+AB4)*0.5 -> 18.50 | AD4: 0 | AE4: =+AG4+AH4+AI4+(AF4*0.5) -> 80.96 | AF4: =(AJ4+AK4+AL4)+(AN4*6) -> 66 | AG4: 20.78 | AH4: 20.49 | AI4: 6.69 | AJ4: 23 | AK4: 18 | AL4: 25 | AM4: =(AJ4+AK4+AL4)*0.5 -> 33.00 | AN4: 0
A5: Bolinder, Jim | B5: ESP | C5: NV(MM) | D5: =+F5+T5+AE5 -> 190.54 | E5: =+G5+U5+AF5 -> 162 | F5: =+H5+I5+J5+K5+L5+M5+N5+(G5*0.5) -> 51.00 | G5: =(O5+P5+Q5)+(S5*6) -> 26 | H5: 3.69 | I5: 3.92 | J5: 4.12 | K5: 7.53 | L5: 3.93 | M5: 9.13 | N5: 5.68 | O5: 12 | P5: 6 | Q5: 8 | R5: =(O5+P5+Q5)*0.5 -> 13.00 | S5: 0 | T5: =+V5+W5+X5+Y5+(U5*0.5) -> 49.08 | U5: =(Z5+AA5+AB5)+(AD5*6) -> 48 | V5: 4.79 | W5: 4.27 | X5: 10.89 | Y5: 5.13 | Z5: 19 | AA5: 19 | AB5: 10 | AC5: =(Z5+AA5+AB5)*0.5 -> 24.00 | AD5: 0 | AE5: =+AG5+AH5+AI5+(AF5*0.5) -> 90.46 | AF5: =(AJ5+AK5+AL5)+(AN5*6) -> 88 | AG5: 18.61 | AH5: 19.86 | AI5: 7.99 | AJ5: 35 | AK5: 27 | AL5: 26 | AM5: =(AJ5+AK5+AL5)*0.5 -> 44.00 | AN5: 0
A6: Boyer, Amie | B6: SSP | C6: NV | D6: =+F6+T6+AE6 -> 248.58 | E6: =+G6+U6+AF6 -> 244 | F6: =+H6+I6+J6+K6+L6+M6+N6+(G6*0.5) -> 75.65 | G6: =(O6+P6+Q6)+(S6*6) -> 65 | H6: 4.39 | I6: 4.28 | J6: 4.32 | K6: 7.82 | L6: 5.04 | M6: 10.56 | N6: 6.74 | O6: 27 | P6: 12 | Q6: 26 | R6: =(O6+P6+Q6)*0.5 -> 32.50 | S6: 0 | T6: =+V6+W6+X6+Y6+(U6*0.5) -> 69.36 | U6: =(Z6+AA6+AB6)+(AD6*6) -> 66 | V6: 6.83 | W6: 6.39 | X6: 15.92 | Y6: 7.22 | Z6: 31 | AA6: 13 | AB6: 22 | AC6: =(Z6+AA6+AB6)*0.5 -> 33.00 | AD6: 0 | AE6: =+AG6+AH6+AI6+(AF6*0.5) -> 103.57 | AF6: =(AJ6+AK6+AL6)+(AN6*6) -> 113 | AG6: 19.97 | AH6: 20.04 | AI6: 7.06 | AJ6: 37 | AK6: 40 | AL6: 36 | AM6: =(AJ6+AK6+AL6)*0.5 -> 56.50 | AN6: 0
A7: Boyer, Steve | B7: SSP | C7: MM | D7: =+F7+T7+AE7 -> 169.38 | E7: =+G7+U7+AF7 -> 94 | F7: =+H7+I7+J7+K7+L7+M7+N7+(G7*0.5) -> 39.54 | G7: =(O7+P7+Q7)+(S7*6) -> 13 | H7: 3.28 | I7: 2.81 | J7: 3.13 | K7: 6.06 | L7: 3.82 | M7: 8.31 | N7: 5.63 | O7: 6 | P7: 0 | Q7: 7 | R7: =(O7+P7+Q7)*0.5 -> 6.50 | S7: 0 | T7: =+V7+W7+X7+Y7+(U7*0.5) -> 44.09 | U7: =(Z7+AA7+AB7)+(AD7*6) -> 26 | V7: 6.14 | W7: 5.98 | X7: 13.03 | Y7: 5.94 | Z7: 14 | AA7: 3 | AB7: 9 | AC7: =(Z7+AA7+AB7)*0.5 -> 13.00 | AD7: 0 | AE7: =+AG7+AH7+AI7+(AF7*0.5) -> 85.75 | AF7: =(AJ7+AK7+AL7)+(AN7*6) -> 55 | AG7: 23.92 | AH7: 24.64 | AI7: 9.69 | AJ7: 17 | AK7: 16 | AL7: 22 | AM7: =(AJ7+AK7+AL7)*0.5 -> 27.50 | AN7: 0
A8: Bridges, David | B8: SSP | C8: MM | D8: =+F8+T8+AE8 -> 188.06 | E8: =+G8+U8+AF8 -> 128 | F8: =+H8+I8+J8+K8+L8+M8+N8+(G8*0.5) -> 54.62 | G8: =(O8+P8+Q8)+(S8*6) -> 21 | H8: 3.80 | I8: 3.52 | J8: 3.66 | K8: 7.66 | L8: 3.80 | M8: 15.11 | N8: 6.57 | O8: 9 | P8: 4 | Q8: 8 | R8: =(O8+P8+Q8)*0.5 -> 10.50 | S8: 0 | T8: =+V8+W8+X8+Y8+(U8*0.5) -> 49.01 | U8: =(Z8+AA8+AB8)+(AD8*6) -> 35 | V8: 5.39 | W8: 5.56 | X8: 13.79 | Y8: 6.77 | Z8: 11 | AA8: 8 | AB8: 16 | AC8: =(Z8+AA8+AB8)*0.5 -> 17.50 | AD8: 0 | AE8: =+AG8+AH8+AI8+(AF8*0.5) -> 84.43 | AF8: =(AJ8+AK8+AL8)+(AN8*6) -> 72 | AG8: 21.85 | AH8: 19.08 | AI8: 7.50 | AJ8: 18 | AK8: 18 | AL8: 36 | AM8: =(AJ8+AK8+AL8)*0.5 -> 36.00 | AN8: 0
A9: Brown, Keith | B9: CDP | C9: SS | D9: =+F9+T9+AE9 -> 132.33 | E9: =+G9+U9+AF9 -> 43 | F9: =+H9+I9+J9+K9+L9+M9+N9+(G9*0.5) -> 33.92 | G9: =(O9+P9+Q9)+(S9*6) -> 6 | H9: 2.98 | I9: 2.45 | J9: 2.51 | K9: 5.70 | L9: 3.49 | M9: 8.39 | N9: 5.40 | O9: 2 | P9: 1 | Q9: 3 | R9: =(O9+P9+Q9)*0.5 -> 3.00 | S9: 0 | T9: =+V9+W9+X9+Y9+(U9*0.5) -> 39.10 | U9: =(Z9+AA9+AB9)+(AD9*6) -> 8 | V9: 5.00 | W9: 4.04 | X9: 17.09 | Y9: 8.97 | Z9: 1 | AA9: 3 | AB9: 4 | AC9: =(Z9+AA9+AB9)*0.5 -> 4.00 | AD9: 0 | AE9: =+AG9+AH9+AI9+(AF9*0.5) -> 59.31 | AF9: =(AJ9+AK9+AL9)+(AN9*6) -> 29 | AG9: 18.54 | AH9: 19.35 | AI9: 6.92 | AJ9: 7 | AK9: 9 | AL9: 13 | AM9: =(AJ9+AK9+AL9)*0.5 -> 14.50 | AN9: 0
A10: Burden, Patrick | B10: SSP | C10: NFC-MM | D10: =+F10+T10+AE10 -> 163.17 | E10: =+G10+U10+AF10 -> 90 | F10: =+H10+I10+J10+K10+L10+M10+N10+(G10*0.5) -> 45.65 | G10: =(O10+P10+Q10)+(S10*6) -> 15 | H10: 3.18 | I10: 3.30 | J10: 3.38 | K10: 6.68 | L10: 4.81 | M10: 10.41 | N10: 6.39 | O10: 7 | P10: 2 | Q10: 6 | R10: =(O10+P10+Q10)*0.5 -> 7.50 | S10: 0 | T10: =+V10+W10+X10+Y10+(U10*0.5) -> 47.15 | U10: =(Z10+AA10+AB10)+(AD10*6) -> 36 | V10: 5.35 | W10: 4.96 | X10: 12.43 | Y10: 6.41 | Z10: 21 | AA10: 5 | AB10: 10 | AC10: =(Z10+AA10+AB10)*0.5 -> 18.00 | AD10: 0 | AE10: =+AG10+AH10+AI10+(AF10*0.5) -> 70.37 | AF10: =(AJ10+AK10+AL10)+(AN10*6) -> 39 | AG10: 20.50 | AH10: 23.30 | AI10: 7.07 | AJ10: 13 | AK10: 15 | AL10: 11 | AM10: =(AJ10+AK10+AL10)*0.5 -> 19.50 | AN10: 0
A11: Burney, Carl | B11: CDP | C11: MM | D11: =+F11+T11+AE11 -> 174.07 | E11: =+G11+U11+AF11 -> 56 | F11: =+H11+I11+J11+K11+L11+M11+N11+(G11*0.5) -> 48.98 | G11: =(O11+P11+Q11)+(S11*6) -> 9 | H11: 3.79 | I11: 4.00 | J11: 4.26 | K11: 7.94 | L11: 6.11 | M11: 11.75 | N11: 6.63 | O11: 2 | P11: 0 | Q11: 1 | R11: =(O11+P11+Q11)*0.5 -> 1.50 | S11: 1 | T11: =+V11+W11+X11+Y11+(U11*0.5) -> 45.53 | U11: =(Z11+AA11+AB11)+(AD11*6) -> 9 | V11: 6.04 | W11: 6.65 | X11: 20.66 | Y11: 7.68 | Z11: 3 | AA11: 3 | AB11: 3 | AC11: =(Z11+AA11+AB11)*0.5 -> 4.50 | AD11: 0 | AE11: =+AG11+AH11+AI11+(AF11*0.5) -> 79.56 | AF11: =(AJ11+AK11+AL11)+(AN11*6) -> 38 | AG11: 27.21 | AH11: 25.03 | AI11: 8.32 | AJ11: 14 | AK11: 12 | AL11: 12 | AM11: =(AJ11+AK11+AL11)*0.5 -> 19.00 | AN11: 0
A12: Correia, Larry | B12: CDP | C12: SS | D12: =+F12+T12+AE12 -> 127.31 | E12: =+G12+U12+AF12 -> 61 | F12: =+H12+I12+J12+K12+L12+M12+N12+(G12*0.5) -> 41.84 | G12: =(O12+P12+Q12)+(S12*6) -> 19 | H12: 3.14 | I12: 3.27 | J12: 2.87 | K12: 6.29 | L12: 3.59 | M12: 7.69 | N12: 5.49 | O12: 9 | P12: 2 | Q12: 8 | R12: =(O12+P12+Q12)*0.5 -> 9.50 | S12: 0 | T12: =+V12+W12+X12+Y12+(U12*0.5) -> 32.25 | U12: =(Z12+AA12+AB12)+(AD12*6) -> 14 | V12: 4.55 | W12: 4.86 | X12: 10.59 | Y12: 5.25 | Z12: 6 | AA12: 6 | AB12: 2 | AC12: =(Z12+AA12+AB12)*0.5 -> 7.00 | AD12: 0 | AE12: =+AG12+AH12+AI12+(AF12*0.5) -> 53.22 | AF12: =(AJ12+AK12+AL12)+(AN12*6) -> 28 | AG12: 14.60 | AH12: 17.55 | AI12: 7.07 | AJ12: 11 | AK12: 8 | AL12: 9 | AM12: =(AJ12+AK12+AL12)*0.5 -> 14.00 | AN12: 0
A13: Edwards, Lance | B13: ESP | C13: EX | D13: =+F13+T13+AE13 -> 92.40 | E13: =+G13+U13+AF13 -> 29 | F13: =+H13+I13+J13+K13+L13+M13+N13+(G13*0.5) -> 28.74 | G13: =(O13+P13+Q13)+(S13*6) -> 7 | H13: 2.38 | I13: 2.26 | J13: 2.51 | K13: 4.18 | L13: 2.83 | M13: 6.64 | N13: 4.44 | O13: 5 | P13: 2 | Q13: 0 | R13: =(O13+P13+Q13)*0.5 -> 3.50 | S13: 0 | T13: =+V13+W13+X13+Y13+(U13*0.5) -> 23.20 | U13: =(Z13+AA13+AB13)+(AD13*6) -> 8 | V13: 3.82 | W13: 3.59 | X13: 7.83 | Y13: 3.96 | Z13: 2 | AA13: 3 | AB13: 3 | AC13: =(Z13+AA13+AB13)*0.5 -> 4.00 | AD13: 0 | AE13: =+AG13+AH13+AI13+(AF13*0.5) -> 40.46 | AF13: =(AJ13+AK13+AL13)+(AN13*6) -> 14 | AG13: 13.51 | AH13: 14.90 | AI13: 5.05 | AJ13: 3 | AK13: 5 | AL13: 6 | AM13: =(AJ13+AK13+AL13)*0.5 -> 7.00 | AN13: 0
A14: Eubanks, Paul | B14: SSP | C14: MM | D14: =+F14+T14+AE14 -> 199.02 | E14: =+G14+U14+AF14 -> 128 | F14: =+H14+I14+J14+K14+L14+M14+N14+(G14*0.5) -> 61.96 | G14: =(O14+P14+Q14)+(S14*6) -> 40 | H14: 3.69 | I14: 3.89 | J14: 3.88 | K14: 7.10 | L14: 4.57 | M14: 12.32 | N14: 6.51 | O14: 12 | P14: 13 | Q14: 15 | R14: =(O14+P14+Q14)*0.5 -> 20.00 | S14: 0 | T14: =+V14+W14+X14+Y14+(U14*0.5) -> 50.97 | U14: =(Z14+AA14+AB14)+(AD14*6) -> 26 | V14: 6.89 | W14: 7.01 | X14: 15.04 | Y14: 9.03 | Z14: 10 | AA14: 9 | AB14: 7 | AC14: =(Z14+AA14+AB14)*0.5 -> 13.00 | AD14: 0 | AE14: =+AG14+AH14+AI14+(AF14*0.5) -> 86.09 | AF14: =(AJ14+AK14+AL14)+(AN14*6) -> 62 | AG14: 22.20 | AH14: 20.77 | AI14: 12.12 | AJ14: 24 | AK14: 20 | AL14: 18 | AM14: =(AJ14+AK14+AL14)*0.5 -> 31.00 | AN14: 0
A15: Greenfield, Don | B15: SSP | C15: NFC-MM | D15: =+F15+T15+AE15 -> 155.00 | E15: =+G15+U15+AF15 -> 88 | F15: =+H15+I15+J15+K15+L15+M15+N15+(G15*0.5) -> 41.96 | G15: =(O15+P15+Q15)+(S15*6) -> 9 | H15: 3.06 | I15: 3.63 | J15: 3.87 | K15: 7.07 | L15: 4.26 | M15: 9.27 | N15: 6.30 | O15: 3 | P15: 3 | Q15: 3 | R15: =(O15+P15+Q15)*0.5 -> 4.50 | S15: 0 | T15: =+V15+W15+X15+Y15+(U15*0.5) -> 36.18 | U15: =(Z15+AA15+AB15)+(AD15*6) -> 17 | V15: 5.13 | W15: 5.53 | X15: 12.09 | Y15: 4.93 | Z15: 4 | AA15: 7 | AB15: 6 | AC15: =(Z15+AA15+AB15)*0.5 -> 8.50 | AD15: 0 | AE15: =+AG15+AH15+AI15+(AF15*0.5) -> 76.86 | AF15: =(AJ15+AK15+AL15)+(AN15*6) -> 62 | AG15: 22.17 | AH15: 16.76 | AI15: 6.93 | AJ15: 21 | AK15: 14 | AL15: 27 | AM15: =(AJ15+AK15+AL15)*0.5 -> 31.00 | AN15: 0
A16: Hill, Randy | B16: CDP | C16: NV | D16: =+F16+T16+AE16 -> 200.35 | E16: =+G16+U16+AF16 -> 162 | F16: =+H16+I16+J16+K16+L16+M16+N16+(G16*0.5) -> 58.82 | G16: =(O16+P16+Q16)+(S16*6) -> 38 | H16: 3.00 | I16: 2.86 | J16: 4.80 | K16: 7.06 | L16: 4.30 | M16: 12.52 | N16: 5.28 | O16: 8 | P16: 11 | Q16: 19 | R16: =(O16+P16+Q16)*0.5 -> 19.00 | S16: 0 | T16: =+V16+W16+X16+Y16+(U16*0.5) -> 44.60 | U16: =(Z16+AA16+AB16)+(AD16*6) -> 35 | V16: 4.45 | W16: 5.07 | X16: 11.42 | Y16: 6.16 | Z16: 11 | AA16: 10 | AB16: 14 | AC16: =(Z16+AA16+AB16)*0.5 -> 17.50 | AD16: 0 | AE16: =+AG16+AH16+AI16+(AF16*0.5) -> 96.93 | AF16: =(AJ16+AK16+AL16)+(AN16*6) -> 89 | AG16: 22.61 | AH16: 22.22 | AI16: 7.60 | AJ16: 35 | AK16: 38 | AL16: 16 | AM16: =(AJ16+AK16+AL16)*0.5 -> 44.50 | AN16: 0
A17: Kirkham, Devon | B17: .22 | C17: NFC | D17: =+F17+T17+AE17 -> 189.08 | E17: =+G17+U17+AF17 -> 107 | F17: =+H17+I17+J17+K17+L17+M17+N17+(G17*0.5) -> 47.08 | G17: =(O17+P17+Q17)+(S17*6) -> 18 | H17: 3.52 | I17: 3.54 | J17: 3.31 | K17: 5.55 | L17: 3.84 | M17: 12.90 | N17: 5.42 | O17: 10 | P17: 4 | Q17: 4 | R17: =(O17+P17+Q17)*0.5 -> 9.00 | S17: 0 | T17: =+V17+W17+X17+Y17+(U17*0.5) -> 53.39 | U17: =(Z17+AA17+AB17)+(AD17*6) -> 39 | V17: 5.26 | W17: 5.06 | X17: 17.30 | Y17: 6.27 | Z17: 10 | AA17: 19 | AB17: 10 | AC17: =(Z17+AA17+AB17)*0.5 -> 19.50 | AD17: 0 | AE17: =+AG17+AH17+AI17+(AF17*0.5) -> 88.61 | AF17: =(AJ17+AK17+AL17)+(AN17*6) -> 50 | AG17: 26.13 | AH17: 28.56 | AI17: 8.92 | AJ17: 10 | AK17: 13 | AL17: 27 | AM17: =(AJ17+AK17+AL17)*0.5 -> 25.00 | AN17: 0
A18: Kirkham, Glade | B18: ESP | C18: MM | D18: =+F18+T18+AE18 -> 171.31 | E18: =+G18+U18+AF18 -> 51 | F18: =+H18+I18+J18+K18+L18+M18+N18+(G18*0.5) -> 54.94 | G18: =(O18+P18+Q18)+(S18*6) -> 11 | H18: 3.71 | I18: 3.37 | J18: 3.71 | K18: 10.98 | L18: 6.41 | M18: 12.54 | N18: 8.72 | O18: 3 | P18: 5 | Q18: 3 | R18: =(O18+P18+Q18)*0.5 -> 5.50 | S18: 0 | T18: =+V18+W18+X18+Y18+(U18*0.5) -> 42.13 | U18: =(Z18+AA18+AB18)+(AD18*6) -> 13 | V18: 5.23 | W18: 5.68 | X18: 17.74 | Y18: 6.98 | Z18: 4 | AA18: 6 | AB18: 3 | AC18: =(Z18+AA18+AB18)*0.5 -> 6.50 | AD18: 0 | AE18: =+AG18+AH18+AI18+(AF18*0.5) -> 74.24 | AF18: =(AJ18+AK18+AL18)+(AN18*6) -> 27 | AG18: 25.66 | AH18: 25.65 | AI18: 9.43 | AJ18: 15 | AK18: 7 | AL18: 5 | AM18: =(AJ18+AK18+AL18)*0.5 -> 13.50 | AN18: 0
A19: Knapp, Chris | B19: ESP | C19: SS | D19: =+F19+T19+AE19 -> 125.48 | E19: =+G19+U19+AF19 -> 45 | F19: =+H19+I19+J19+K19+L19+M19+N19+(G19*0.5) -> 39.65 | G19: =(O19+P19+Q19)+(S19*6) -> 19 | H19: 2.92 | I19: 2.68 | J19: 2.96 | K19: 6.11 | L19: 3.29 | M19: 6.68 | N19: 5.51 | O19: 5 | P19: 12 | Q19: 2 | R19: =(O19+P19+Q19)*0.5 -> 9.50 | S19: 0 | T19: =+V19+W19+X19+Y19+(U19*0.5) -> 31.66 | U19: =(Z19+AA19+AB19)+(AD19*6) -> 12 | V19: 4.45 | W19: 4.32 | X19: 10.17 | Y19: 6.72 | Z19: 5 | AA19: 4 | AB19: 3 | AC19: =(Z19+AA19+AB19)*0.5 -> 6.00 | AD19: 0 | AE19: =+AG19+AH19+AI19+(AF19*0.5) -> 54.17 | AF19: =(AJ19+AK19+AL19)+(AN19*6) -> 14 | AG19: 18.96 | AH19: 19.79 | AI19: 8.42 | AJ19: 3 | AK19: 8 | AL19: 3 | AM19: =(AJ19+AK19+AL19)*0.5 -> 7.00 | AN19: 0
A20: Langford, Les | B20: CDP | C20: SS | D20: =+F20+T20+AE20 -> 119.30 | E20: =+G20+U20+AF20 -> 24 | F20: =+H20+I20+J20+K20+L20+M20+N20+(G20*0.5) -> 37.47 | G20: =(O20+P20+Q20)+(S20*6) -> 8 | H20: 3.21 | I20: 3.02 | J20: 3.12 | K20: 5.72 | L20: 3.64 | M20: 8.50 | N20: 6.26 | O20: 6 | P20: 0 | Q20: 2 | R20: =(O20+P20+Q20)*0.5 -> 4.00 | S20: 0 | T20: =+V20+W20+X20+Y20+(U20*0.5) -> 30.91 | U20: =(Z20+AA20+AB20)+(AD20*6) -> 7 | V20: 4.85 | W20: 5.08 | X20: 11.18 | Y20: 6.30 | Z20: 2 | AA20: 1 | AB20: 4 | AC20: =(Z20+AA20+AB20)*0.5 -> 3.50 | AD20: 0 | AE20: =+AG20+AH20+AI20+(AF20*0.5) -> 50.92 | AF20: =(AJ20+AK20+AL20)+(AN20*6) -> 9 | AG20: 20.49 | AH20: 19.03 | AI20: 6.90 | AJ20: 5 | AK20: 2 | AL20: 2 | AM20: =(AJ20+AK20+AL20)*0.5 -> 4.50 | AN20: 0
A21: Lorenz, David | B21: ESP | C21: NV | D21: =+F21+T21+AE21 -> 197.85 | E21: =+G21+U21+AF21 -> 127 | F21: =+H21+I21+J21+K21+L21+M21+N21+(G21*0.5) -> 69.64 | G21: =(O21+P21+Q21)+(S21*6) -> 40 | H21: 5.13 | I21: 4.31 | J21: 4.19 | K21: 9.03 | L21: 5.70 | M21: 13.47 | N21: 7.81 | O21: 18 | P21: 1 | Q21: 21 | R21: =(O21+P21+Q21)*0.5 -> 20.00 | S21: 0 | T21: =+V21+W21+X21+Y21+(U21*0.5) -> 49.87 | U21: =(Z21+AA21+AB21)+(AD21*6) -> 40 | V21: 5.42 | W21: 5.09 | X21: 12.22 | Y21: 7.14 | Z21: 16 | AA21: 11 | AB21: 13 | AC21: =(Z21+AA21+AB21)*0.5 -> 20.00 | AD21: 0 | AE21: =+AG21+AH21+AI21+(AF21*0.5) -> 78.34 | AF21: =(AJ21+AK21+AL21)+(AN21*6) -> 47 | AG21: 26.41 | AH21: 20.59 | AI21: 7.84 | AJ21: 25 | AK21: 14 | AL21: 8 | AM21: =(AJ21+AK21+AL21)*0.5 -> 23.50 | AN21: 0
A22: Lowe, John | B22: CDP | C22: EX | D22: =+F22+T22+AE22 -> 102.65 | E22: =+G22+U22+AF22 -> 33 | F22: =+H22+I22+J22+K22+L22+M22+N22+(G22*0.5) -> 28.21 | G22: =(O22+P22+Q22)+(S22*6) -> 3 | H22: 2.59 | I22: 2.53 | J22: 2.53 | K22: 5.09 | L22: 3.30 | M22: 6.11 | N22: 4.56 | O22: 1 | P22: 1 | Q22: 1 | R22: =(O22+P22+Q22)*0.5 -> 1.50 | S22: 0 | T22: =+V22+W22+X22+Y22+(U22*0.5) -> 28.25 | U22: =(Z22+AA22+AB22)+(AD22*6) -> 13 | V22: 4.22 | W22: 4.05 | X22: 8.69 | Y22: 4.79 | Z22: 6 | AA22: 1 | AB22: 6 | AC22: =(Z22+AA22+AB22)*0.5 -> 6.50 | AD22: 0 | AE22: =+AG22+AH22+AI22+(AF22*0.5) -> 46.19 | AF22: =(AJ22+AK22+AL22)+(AN22*6) -> 17 | AG22: 14.18 | AH22: 16.91 | AI22: 6.60 | AJ22: 7 | AK22: 3 | AL22: 7 | AM22: =(AJ22+AK22+AL22)*0.5 -> 8.50 | AN22: 0
A23: Maxwell, Allen | B23: SSP | C23: NFC-MM | D23: =+F23+T23+AE23 -> 172.46 | E23: =+G23+U23+AF23 -> 68 | F23: =+H23+I23+J23+K23+L23+M23+N23+(G23*0.5) -> 50.63 | G23: =(O23+P23+Q23)+(S23*6) -> 15 | H23: 3.39 | I23: 3.60 | J23: 3.99 | K23: 7.05 | L23: 4.70 | M23: 14.51 | N23: 5.89 | O23: 1 | P23: 8 | Q23: 6 | R23: =(O23+P23+Q23)*0.5 -> 7.50 | S23: 0 | T23: =+V23+W23+X23+Y23+(U23*0.5) -> 54.24 | U23: =(Z23+AA23+AB23)+(AD23*6) -> 17 | V23: 4.70 | W23: 5.13 | X23: 18.57 | Y23: 17.34 | Z23: 4 | AA23: 10 | AB23: 3 | AC23: =(Z23+AA23+AB23)*0.5 -> 8.50 | AD23: 0 | AE23: =+AG23+AH23+AI23+(AF23*0.5) -> 67.59 | AF23: =(AJ23+AK23+AL23)+(AN23*6) -> 36 | AG23: 22.26 | AH23: 19.91 | AI23: 7.42 | AJ23: 12 | AK23: 19 | AL23: 5 | AM23: =(AJ23+AK23+AL23)*0.5 -> 18.00 | AN23: 0
A24: McDermaid, Jennifer | B24: SSP | C24: NFC-NV | D24: =+F24+T24+AE24 -> 324.04 | E24: =+G24+U24+AF24 -> 360 | F24: =+H24+I24+J24+K24+L24+M24+N24+(G24*0.5) -> 69.93 | G24: =(O24+P24+Q24)+(S24*6) -> 27 | H24: 3.99 | I24: 5.40 | J24: 5.01 | K24: 10.28 | L24: 6.86 | M24: 15.06 | N24: 9.83 | O24: 13 | P24: 8 | Q24: 6 | R24: =(O24+P24+Q24)*0.5 -> 13.50 | S24: 0 | T24: =+V24+W24+X24+Y24+(U24*0.5) -> 78.36 | U24: =(Z24+AA24+AB24)+(AD24*6) -> 83 | V24: 4.95 | W24: 5.19 | X24: 18.14 | Y24: 8.58 | Z24: 20 | AA24: 9 | AB24: 54 | AC24: =(Z24+AA24+AB24)*0.5 -> 41.50 | AD24: 0 | AE24: =+AG24+AH24+AI24+(AF24*0.5) -> 175.75 | AF24: =(AJ24+AK24+AL24)+(AN24*6) -> 250 | AG24: 20.26 | AH24: 23.59 | AI24: 6.90 | AJ24: 75 | AK24: 89 | AL24: 86 | AM24: =(AJ24+AK24+AL24)*0.5 -> 125.00 | AN24: 0
A25: Mousley, Roger | B25: SSR | C25: EX | D25: =+F25+T25+AE25 -> 118.84 | E25: =+G25+U25+AF25 -> 40 | F25: =+H25+I25+J25+K25+L25+M25+N25+(G25*0.5) -> 35.46 | G25: =(O25+P25+Q25)+(S25*6) -> 5 | H25: 2.89 | I25: 2.56 | J25: 2.94 | K25: 6.02 | L25: 4.36 | M25: 8.42 | N25: 5.77 | O25: 2 | P25: 0 | Q25: 3 | R25: =(O25+P25+Q25)*0.5 -> 2.50 | S25: 0 | T25: =+V25+W25+X25+Y25+(U25*0.5) -> 29.36 | U25: =(Z25+AA25+AB25)+(AD25*6) -> 12 | V25: 4.22 | W25: 4.14 | X25: 9.82 | Y25: 5.18 | Z25: 5 | AA25: 3 | AB25: 4 | AC25: =(Z25+AA25+AB25)*0.5 -> 6.00 | AD25: 0 | AE25: =+AG25+AH25+AI25+(AF25*0.5) -> 54.02 | AF25: =(AJ25+AK25+AL25)+(AN25*6) -> 23 | AG25: 19.20 | AH25: 17.02 | AI25: 6.30 | AJ25: 6 | AK25: 8 | AL25: 9 | AM25: =(AJ25+AK25+AL25)*0.5 -> 11.50 | AN25: 0
A26: Mower, Rick | B26: SSP | C26: NFC-NV | D26: =+F26+T26+AE26 -> 252.96 | E26: =+G26+U26+AF26 -> 106 | F26: =+H26+I26+J26+K26+L26+M26+N26+(G26*0.5) -> 81.03 | G26: =(O26+P26+Q26)+(S26*6) -> 22 | H26: 9.26 | I26: 7.07 | J26: 7.01 | K26: 10.56 | L26: 7.20 | M26: 18.73 | N26: 10.20 | O26: 8 | P26: 9 | Q26: 5 | R26: =(O26+P26+Q26)*0.5 -> 11.00 | S26: 0 | T26: =+V26+W26+X26+Y26+(U26*0.5) -> 58.77 | U26: =(Z26+AA26+AB26)+(AD26*6) -> 28 | V26: 6.96 | W26: 8.44 | X26: 18.75 | Y26: 10.62 | Z26: 13 | AA26: 10 | AB26: 5 | AC26: =(Z26+AA26+AB26)*0.5 -> 14.00 | AD26: 0 | AE26: =+AG26+AH26+AI26+(AF26*0.5) -> 113.16 | AF26: =(AJ26+AK26+AL26)+(AN26*6) -> 56 | AG26: 34.87 | AH26: 37.29 | AI26: 13.00 | AJ26: 23 | AK26: 8 | AL26: 25 | AM26: =(AJ26+AK26+AL26)*0.5 -> 28.00 | AN26: 0
A27: Ostler, Jay | B27: CDP | C27: MM | D27: =+F27+T27+AE27 -> 181.30 | E27: =+G27+U27+AF27 -> 78 | F27: =+H27+I27+J27+K27+L27+M27+N27+(G27*0.5) -> 58.91 | G27: =(O27+P27+Q27)+(S27*6) -> 23 | H27: 3.76 | I27: 3.54 | J27: 3.58 | K27: 6.99 | L27: 4.32 | M27: 18.40 | N27: 6.82 | O27: 10 | P27: 11 | Q27: 2 | R27: =(O27+P27+Q27)*0.5 -> 11.50 | S27: 0 | T27: =+V27+W27+X27+Y27+(U27*0.5) -> 49.05 | U27: =(Z27+AA27+AB27)+(AD27*6) -> 26 | V27: 6.70 | W27: 6.22 | X27: 15.73 | Y27: 7.40 | Z27: 6 | AA27: 12 | AB27: 8 | AC27: =(Z27+AA27+AB27)*0.5 -> 13.00 | AD27: 0 | AE27: =+AG27+AH27+AI27+(AF27*0.5) -> 73.34 | AF27: =(AJ27+AK27+AL27)+(AN27*6) -> 29 | AG27: 22.31 | AH27: 27.29 | AI27: 9.24 | AJ27: 13 | AK27: 9 | AL27: 7 | AM27: =(AJ27+AK27+AL27)*0.5 -> 14.50 | AN27: 0
A28: Phillips, Rdan | B28: SSR | C28: NV | D28: =+F28+T28+AE28 -> 243.96 | E28: =+G28+U28+AF28 -> 164 | F28: =+H28+I28+J28+K28+L28+M28+N28+(G28*0.5) -> 68.90 | G28: =(O28+P28+Q28)+(S28*6) -> 42 | H28: 3.60 | I28: 4.05 | J28: 4.06 | K28: 7.28 | L28: 4.79 | M28: 17.10 | N28: 7.02 | O28: 15 | P28: 8 | Q28: 19 | R28: =(O28+P28+Q28)*0.5 -> 21.00 | S28: 0 | T28: =+V28+W28+X28+Y28+(U28*0.5) -> 71.79 | U28: =(Z28+AA28+AB28)+(AD28*6) -> 68 | V28: 5.72 | W28: 5.46 | X28: 19.47 | Y28: 7.14 | Z28: 19 | AA28: 21 | AB28: 28 | AC28: =(Z28+AA28+AB28)*0.5 -> 34.00 | AD28: 0 | AE28: =+AG28+AH28+AI28+(AF28*0.5) -> 103.27 | AF28: =(AJ28+AK28+AL28)+(AN28*6) -> 54 | AG28: 29.40 | AH28: 35.59 | AI28: 11.28 | AJ28: 14 | AK28: 22 | AL28: 18 | AM28: =(AJ28+AK28+AL28)*0.5 -> 27.00 | AN28: 0
A29: Pres, Peter | B29: ESP | C29: MM | D29: =+F29+T29+AE29 -> 189.96 | E29: =+G29+U29+AF29 -> 108 | F29: =+H29+I29+J29+K29+L29+M29+N29+(G29*0.5) -> 60.18 | G29: =(O29+P29+Q29)+(S29*6) -> 46 | H29: 3.16 | I29: 2.83 | J29: 2.27 | K29: 6.42 | L29: 5.51 | M29: 9.97 | N29: 7.02 | O29: 20 | P29: 14 | Q29: 12 | R29: =(O29+P29+Q29)*0.5 -> 23.00 | S29: 0 | T29: =+V29+W29+X29+Y29+(U29*0.5) -> 56.02 | U29: =(Z29+AA29+AB29)+(AD29*6) -> 26 | V29: 5.03 | W29: 5.57 | X29: 23.20 | Y29: 9.22 | Z29: 9 | AA29: 10 | AB29: 7 | AC29: =(Z29+AA29+AB29)*0.5 -> 13.00 | AD29: 0 | AE29: =+AG29+AH29+AI29+(AF29*0.5) -> 73.76 | AF29: =(AJ29+AK29+AL29)+(AN29*6) -> 36 | AG29: 19.77 | AH29: 26.01 | AI29: 9.98 | AJ29: 11 | AK29: 9 | AL29: 16 | AM29: =(AJ29+AK29+AL29)*0.5 -> 18.00 | AN29: 0
A30: Redford, Kent | B30: ESP | C30: MM | D30: =+F30+T30+AE30 -> 148.31 | E30: =+G30+U30+AF30 -> 99 | F30: =+H30+I30+J30+K30+L30+M30+N30+(G30*0.5) -> 47.26 | G30: =(O30+P30+Q30)+(S30*6) -> 35 | H30: 2.89 | I30: 2.37 | J30: 2.80 | K30: 7.09 | L30: 3.61 | M30: 6.19 | N30: 4.81 | O30: 14 | P30: 11 | Q30: 10 | R30: =(O30+P30+Q30)*0.5 -> 17.50 | S30: 0 | T30: =+V30+W30+X30+Y30+(U30*0.5) -> 35.68 | U30: =(Z30+AA30+AB30)+(AD30*6) -> 32 | V30: 3.27 | W30: 3.10 | X30: 8.43 | Y30: 4.88 | Z30: 15 | AA30: 7 | AB30: 10 | AC30: =(Z30+AA30+AB30)*0.5 -> 16.00 | AD30: 0 | AE30: =+AG30+AH30+AI30+(AF30*0.5) -> 65.37 | AF30: =(AJ30+AK30+AL30)+(AN30*6) -> 32 | AG30: 19.30 | AH30: 22.68 | AI30: 7.39 | AJ30: 9 | AK30: 13 | AL30: 10 | AM30: =(AJ30+AK30+AL30)*0.5 -> 16.00 | AN30: 0
A31: Redford, Noel | B31: SSP | C31: MM | D31: =+F31+T31+AE31 -> 167.98 | E31: =+G31+U31+AF31 -> 110 | F31: =+H31+I31+J31+K31+L31+M31+N31+(G31*0.5) -> 46.81 | G31: =(O31+P31+Q31)+(S31*6) -> 28 | H31: 3.08 | I31: 2.67 | J31: 2.54 | K31: 7.05 | L31: 4.62 | M31: 7.23 | N31: 5.62 | O31: 9 | P31: 3 | Q31: 16 | R31: =(O31+P31+Q31)*0.5 -> 14.00 | S31: 0 | T31: =+V31+W31+X31+Y31+(U31*0.5) -> 39.29 | U31: =(Z31+AA31+AB31)+(AD31*6) -> 31 | V31: 4.19 | W31: 4.40 | X31: 9.74 | Y31: 5.46 | Z31: 8 | AA31: 10 | AB31: 13 | AC31: =(Z31+AA31+AB31)*0.5 -> 15.50 | AD31: 0 | AE31: =+AG31+AH31+AI31+(AF31*0.5) -> 81.88 | AF31: =(AJ31+AK31+AL31)+(AN31*6) -> 51 | AG31: 24.04 | AH31: 22.54 | AI31: 9.80 | AJ31: 18 | AK31: 14 | AL31: 19 | AM31: =(AJ31+AK31+AL31)*0.5 -> 25.50 | AN31: 0
A32: Redford, Red | B32: SSP | C32: SS | D32: =+F32+T32+AE32 -> 125.73 | E32: =+G32+U32+AF32 -> 49 | F32: =+H32+I32+J32+K32+L32+M32+N32+(G32*0.5) -> 34.05 | G32: =(O32+P32+Q32)+(S32*6) -> 8 | H32: 3.05 | I32: 2.79 | J32: 2.77 | K32: 6.41 | L32: 3.99 | M32: 6.45 | N32: 4.59 | O32: 3 | P32: 4 | Q32: 1 | R32: =(O32+P32+Q32)*0.5 -> 4.00 | S32: 0 | T32: =+V32+W32+X32+Y32+(U32*0.5) -> 31.71 | U32: =(Z32+AA32+AB32)+(AD32*6) -> 18 | V32: 4.19 | W32: 4.20 | X32: 8.83 | Y32: 5.49 | Z32: 8 | AA32: 3 | AB32: 7 | AC32: =(Z32+AA32+AB32)*0.5 -> 9.00 | AD32: 0 | AE32: =+AG32+AH32+AI32+(AF32*0.5) -> 59.97 | AF32: =(AJ32+AK32+AL32)+(AN32*6) -> 23 | AG32: 18.06 | AH32: 21.67 | AI32: 8.74 | AJ32: 11 | AK32: 5 | AL32: 7 | AM32: =(AJ32+AK32+AL32)*0.5 -> 11.50 | AN32: 0
A33: Redford, Red | B33: SSR | C33: SS | D33: =+F33+T33+AE33 -> 152.89 | E33: =+G33+U33+AF33 -> 66 | F33: =+H33+I33+J33+K33+L33+M33+N33+(G33*0.5) -> 43.35 | G33: =(O33+P33+Q33)+(S33*6) -> 16 | H33: 3.26 | I33: 3.14 | J33: 3.15 | K33: 6.55 | L33: 4.02 | M33: 9.44 | N33: 5.79 | O33: 6 | P33: 1 | Q33: 9 | R33: =(O33+P33+Q33)*0.5 -> 8.00 | S33: 0 | T33: =+V33+W33+X33+Y33+(U33*0.5) -> 37.55 | U33: =(Z33+AA33+AB33)+(AD33*6) -> 20 | V33: 5.05 | W33: 4.94 | X33: 12.21 | Y33: 5.35 | Z33: 7 | AA33: 9 | AB33: 4 | AC33: =(Z33+AA33+AB33)*0.5 -> 10.00 | AD33: 0 | AE33: =+AG33+AH33+AI33+(AF33*0.5) -> 71.99 | AF33: =(AJ33+AK33+AL33)+(AN33*6) -> 30 | AG33: 21.24 | AH33: 26.97 | AI33: 8.78 | AJ33: 10 | AK33: 8 | AL33: 12 | AM33: =(AJ33+AK33+AL33)*0.5 -> 15.00 | AN33: 0
A34: Rodriquez, Mike | B34: CDP | C34: SS | D34: =+F34+T34+AE34 -> 120.70 | E34: =+G34+U34+AF34 -> 45 | F34: =+H34+I34+J34+K34+L34+M34+N34+(G34*0.5) -> 31.43 | G34: =(O34+P34+Q34)+(S34*6) -> 5 | H34: 2.54 | I34: 2.44 | J34: 2.51 | K34: 4.89 | L34: 3.41 | M34: 7.44 | N34: 5.70 | O34: 5 | P34: 0 | Q34: 0 | R34: =(O34+P34+Q34)*0.5 -> 2.50 | S34: 0 | T34: =+V34+W34+X34+Y34+(U34*0.5) -> 31.61 | U34: =(Z34+AA34+AB34)+(AD34*6) -> 16 | V34: 3.98 | W34: 4.10 | X34: 10.19 | Y34: 5.34 | Z34: 8 | AA34: 6 | AB34: 2 | AC34: =(Z34+AA34+AB34)*0.5 -> 8.00 | AD34: 0 | AE34: =+AG34+AH34+AI34+(AF34*0.5) -> 57.66 | AF34: =(AJ34+AK34+AL34)+(AN34*6) -> 24 | AG34: 17.46 | AH34: 20.28 | AI34: 7.92 | AJ34: 8 | AK34: 8 | AL34: 8 | AM34: =(AJ34+AK34+AL34)*0.5 -> 12.00 | AN34: 0
A35: Simpson, Harold | B35: CDP | C35: MM(SS) | D35: =+F35+T35+AE35 -> 160.35 | E35: =+G35+U35+AF35 -> 87 | F35: =+H35+I35+J35+K35+L35+M35+N35+(G35*0.5) -> 40.26 | G35: =(O35+P35+Q35)+(S35*6) -> 9 | H35: 3.41 | I35: 3.55 | J35: 3.63 | K35: 7.00 | L35: 3.44 | M35: 8.35 | N35: 6.38 | O35: 0 | P35: 7 | Q35: 2 | R35: =(O35+P35+Q35)*0.5 -> 4.50 | S35: 0 | T35: =+V35+W35+X35+Y35+(U35*0.5) -> 48.45 | U35: =(Z35+AA35+AB35)+(AD35*6) -> 36 | V35: 6.93 | W35: 5.36 | X35: 10.91 | Y35: 7.25 | Z35: 16 | AA35: 13 | AB35: 7 | AC35: =(Z35+AA35+AB35)*0.5 -> 18.00 | AD35: 0 | AE35: =+AG35+AH35+AI35+(AF35*0.5) -> 71.64 | AF35: =(AJ35+AK35+AL35)+(AN35*6) -> 42 | AG35: 19.06 | AH35: 23.14 | AI35: 8.44 | AJ35: 20 | AK35: 9 | AL35: 13 | AM35: =(AJ35+AK35+AL35)*0.5 -> 21.00 | AN35: 0
A36: Stone, Scott | B36: ESP | C36: MM | D36: =+F36+T36+AE36 -> 155.51 | E36: =+G36+U36+AF36 -> 82 | F36: =+H36+I36+J36+K36+L36+M36+N36+(G36*0.5) -> 36.60 | G36: =(O36+P36+Q36)+(S36*6) -> 9 | H36: 2.99 | I36: 2.70 | J36: 3.07 | K36: 6.09 | L36: 3.87 | M36: 8.03 | N36: 5.35 | O36: 6 | P36: 2 | Q36: 1 | R36: =(O36+P36+Q36)*0.5 -> 4.50 | S36: 0 | T36: =+V36+W36+X36+Y36+(U36*0.5) -> 38.17 | U36: =(Z36+AA36+AB36)+(AD36*6) -> 20 | V36: 4.38 | W36: 4.10 | X36: 12.20 | Y36: 7.49 | Z36: 7 | AA36: 11 | AB36: 2 | AC36: =(Z36+AA36+AB36)*0.5 -> 10.00 | AD36: 0 | AE36: =+AG36+AH36+AI36+(AF36*0.5) -> 80.74 | AF36: =(AJ36+AK36+AL36)+(AN36*6) -> 53 | AG36: 20.77 | AH36: 25.21 | AI36: 8.26 | AJ36: 20 | AK36: 15 | AL36: 18 | AM36: =(AJ36+AK36+AL36)*0.5 -> 26.50 | AN36: 0
A37: Theodore, Ari | B37: SSP | C37: EX | D37: =+F37+T37+AE37 -> 106.95 | E37: =+G37+U37+AF37 -> 41 | F37: =+H37+I37+J37+K37+L37+M37+N37+(G37*0.5) -> 30.85 | G37: =(O37+P37+Q37)+(S37*6) -> 4 | H37: 2.74 | I37: 2.54 | J37: 3.32 | K37: 5.85 | L37: 3.31 | M37: 6.25 | N37: 4.84 | O37: 1 | P37: 1 | Q37: 2 | R37: =(O37+P37+Q37)*0.5 -> 2.00 | S37: 0 | T37: =+V37+W37+X37+Y37+(U37*0.5) -> 25.71 | U37: =(Z37+AA37+AB37)+(AD37*6) -> 9 | V37: 3.83 | W37: 3.73 | X37: 8.11 | Y37: 5.54 | Z37: 3 | AA37: 0 | AB37: 6 | AC37: =(Z37+AA37+AB37)*0.5 -> 4.50 | AD37: 0 | AE37: =+AG37+AH37+AI37+(AF37*0.5) -> 50.39 | AF37: =(AJ37+AK37+AL37)+(AN37*6) -> 28 | AG37: 13.93 | AH37: 15.60 | AI37: 6.86 | AJ37: 8 | AK37: 8 | AL37: 12 | AM37: =(AJ37+AK37+AL37)*0.5 -> 14.00 | AN37: 0
A38: Willis, David | B38: CDP | C38: NV | D38: =+F38+T38+AE38 -> 204.37 | E38: =+G38+U38+AF38 -> 133 | F38: =+H38+I38+J38+K38+L38+M38+N38+(G38*0.5) -> 72.71 | G38: =(O38+P38+Q38)+(S38*6) -> 40 | H38: 4.82 | I38: 4.34 | J38: 4.30 | K38: 8.02 | L38: 8.93 | M38: 12.68 | N38: 9.62 | O38: 12 | P38: 14 | Q38: 14 | R38: =(O38+P38+Q38)*0.5 -> 20.00 | S38: 0 | T38: =+V38+W38+X38+Y38+(U38*0.5) -> 49.40 | U38: =(Z38+AA38+AB38)+(AD38*6) -> 34 | V38: 5.75 | W38: 5.89 | X38: 13.58 | Y38: 7.18 | Z38: 11 | AA38: 8 | AB38: 15 | AC38: =(Z38+AA38+AB38)*0.5 -> 17.00 | AD38: 0 | AE38: =+AG38+AH38+AI38+(AF38*0.5) -> 82.26 | AF38: =(AJ38+AK38+AL38)+(AN38*6) -> 59 | AG38: 25.88 | AH38: 20.50 | AI38: 6.38 | AJ38: 23 | AK38: 15 | AL38: 21 | AM38: =(AJ38+AK38+AL38)*0.5 -> 29.50 | AN38: 0
A39: Wimberley, Jeff | B39: SSP | C39: MM | D39: =+F39+T39+AE39 -> 169.17 | E39: =+G39+U39+AF39 -> 87 | F39: =+H39+I39+J39+K39+L39+M39+N39+(G39*0.5) -> 47.79 | G39: =(O39+P39+Q39)+(S39*6) -> 13 | H39: 3.99 | I39: 4.05 | J39: 3.54 | K39: 8.55 | L39: 3.73 | M39: 10.01 | N39: 7.42 | O39: 7 | P39: 3 | Q39: 3 | R39: =(O39+P39+Q39)*0.5 -> 6.50 | S39: 0 | T39: =+V39+W39+X39+Y39+(U39*0.5) -> 45.94 | U39: =(Z39+AA39+AB39)+(AD39*6) -> 23 | V39: 6.11 | W39: 5.68 | X39: 14.62 | Y39: 8.03 | Z39: 9 | AA39: 5 | AB39: 9 | AC39: =(Z39+AA39+AB39)*0.5 -> 11.50 | AD39: 0 | AE39: =+AG39+AH39+AI39+(AF39*0.5) -> 75.44 | AF39: =(AJ39+AK39+AL39)+(AN39*6) -> 51 | AG39: 22.09 | AH39: 19.06 | AI39: 8.79 | AJ39: 23 | AK39: 10 | AL39: 18 | AM39: =(AJ39+AK39+AL39)*0.5 -> 25.50 | AN39: 0
A40: Wong, Hang | B40: SSP | C40: MM | D40: =+F40+T40+AE40 -> 188.72 | E40: =+G40+U40+AF40 -> 106 | F40: =+H40+I40+J40+K40+L40+M40+N40+(G40*0.5) -> 54.79 | G40: =(O40+P40+Q40)+(S40*6) -> 30 | H40: 4.08 | I40: 3.65 | J40: 3.72 | K40: 7.71 | L40: 4.88 | M40: 9.44 | N40: 6.31 | O40: 7 | P40: 14 | Q40: 9 | R40: =(O40+P40+Q40)*0.5 -> 15.00 | S40: 0 | T40: =+V40+W40+X40+Y40+(U40*0.5) -> 45.26 | U40: =(Z40+AA40+AB40)+(AD40*6) -> 19 | V40: 6.37 | W40: 6.09 | X40: 13.09 | Y40: 10.21 | Z40: 7 | AA40: 7 | AB40: 5 | AC40: =(Z40+AA40+AB40)*0.5 -> 9.50 | AD40: 0 | AE40: =+AG40+AH40+AI40+(AF40*0.5) -> 88.67 | AF40: =(AJ40+AK40+AL40)+(AN40*6) -> 57 | AG40: 21.83 | AH40: 22.04 | AI40: 16.30 | AJ40: 10 | AK40: 25 | AL40: 22 | AM40: =(AJ40+AK40+AL40)*0.5 -> 28.50 | AN40: 0
A41: Young, Ren | B41: SSP | C41: MM | D41: =+F41+T41+AE41 -> 167.23 | E41: =+G41+U41+AF41 -> 84 | F41: =+H41+I41+J41+K41+L41+M41+N41+(G41*0.5) -> 50.17 | G41: =(O41+P41+Q41)+(S41*6) -> 23 | H41: 3.23 | I41: 4.08 | J41: 4.16 | K41: 6.70 | L41: 4.31 | M41: 10.00 | N41: 6.19 | O41: 4 | P41: 12 | Q41: 7 | R41: =(O41+P41+Q41)*0.5 -> 11.50 | S41: 0 | T41: =+V41+W41+X41+Y41+(U41*0.5) -> 44.93 | U41: =(Z41+AA41+AB41)+(AD41*6) -> 33 | V41: 4.83 | W41: 4.70 | X41: 12.73 | Y41: 6.17 | Z41: 6 | AA41: 8 | AB41: 19 | AC41: =(Z41+AA41+AB41)*0.5 -> 16.50 | AD41: 0 | AE41: =+AG41+AH41+AI41+(AF41*0.5) -> 72.13 | AF41: =(AJ41+AK41+AL41)+(AN41*6) -> 28 | AG41: 24.21 | AH41: 24.84 | AI41: 9.08 | AJ41: 10 | AK41: 10 | AL41: 8 | AM41: =(AJ41+AK41+AL41)*0.5 -> 14.00 | AN41: 0
A42: Zaccardi, Juke | B42: ESP | C42: MM | D42: =+F42+T42+AE42 -> 142.54 | E42: =+G42+U42+AF42 -> 79 | F42: =+H42+I42+J42+K42+L42+M42+N42+(G42*0.5) -> 39.14 | G42: =(O42+P42+Q42)+(S42*6) -> 12 | H42: 2.73 | I42: 2.82 | J42: 2.58 | K42: 7.14 | L42: 4.13 | M42: 7.82 | N42: 5.92 | O42: 6 | P42: 4 | Q42: 2 | R42: =(O42+P42+Q42)*0.5 -> 6.00 | S42: 0 | T42: =+V42+W42+X42+Y42+(U42*0.5) -> 34.56 | U42: =(Z42+AA42+AB42)+(AD42*6) -> 11 | V42: 4.68 | W42: 5.52 | X42: 11.25 | Y42: 7.61 | Z42: 2 | AA42: 6 | AB42: 3 | AC42: =(Z42+AA42+AB42)*0.5 -> 5.50 | AD42: 0 | AE42: =+AG42+AH42+AI42+(AF42*0.5) -> 68.84 | AF42: =(AJ42+AK42+AL42)+(AN42*6) -> 56 | AG42: 15.67 | AH42: 18.20 | AI42: 6.97 | AJ42: 16 | AK42: 18 | AL42: 22 | AM42: =(AJ42+AK42+AL42)*0.5 -> 28.00 | AN42: 0
A43: Zaccardi, Pat | B43: ESP | C43: SS | D43: =+F43+T43+AE43 -> 132.42 | E43: =+G43+U43+AF43 -> 64 | F43: =+H43+I43+J43+K43+L43+M43+N43+(G43*0.5) -> 33.97 | G43: =(O43+P43+Q43)+(S43*6) -> 8 | H43: 3.13 | I43: 2.76 | J43: 2.77 | K43: 6.99 | L43: 3.42 | M43: 6.60 | N43: 4.30 | O43: 4 | P43: 3 | Q43: 1 | R43: =(O43+P43+Q43)*0.5 -> 4.00 | S43: 0 | T43: =+V43+W43+X43+Y43+(U43*0.5) -> 30.98 | U43: =(Z43+AA43+AB43)+(AD43*6) -> 11 | V43: 4.24 | W43: 4.10 | X43: 11.68 | Y43: 5.46 | Z43: 3 | AA43: 3 | AB43: 5 | AC43: =(Z43+AA43+AB43)*0.5 -> 5.50 | AD43: 0 | AE43: =+AG43+AH43+AI43+(AF43*0.5) -> 67.47 | AF43: =(AJ43+AK43+AL43)+(AN43*6) -> 45 | AG43: 18.07 | AH43: 19.25 | AI43: 7.65 | AJ43: 12 | AK43: 20 | AL43: 13 | AM43: =(AJ43+AK43+AL43)*0.5 -> 22.50 | AN43: 0
A44: If a shooter has classified with a higher ranking in a previous Classifier Match but ranked lower in this match, they retain the higher ranking. Example: If the notation under Class./Rank indicates something like NV(MM), it means that the shooter qualified in this classifier as a Novice, but retains the higher Marksman ranking previously earned.
A45: NFC-XX = Not For IDPA Classification - Shooter participated in the match, but did not shoot for an IDPA Classification.
A46: Div. = Division; Class/Rank = Classification/Ranking
A47: Divisions: CDP = Custom Defense Pistol; ESP = Enhanced Service Pistol; SSP = Stock Service Pistol; SSR = Stock Service Revolver
A48: Classification Score Breakdown By Division/Ranking:
A49: CDP - Master = 91.76 or less | D49: Expert = 91.77 to 111.43 | G49: Sharpshooter = 111.44 to 141.82 | L49: Marksman = 141.83 to 195.00 | Q49: Novice = 195.01 or more
A50: ESP - Master = 89.41 or less | D50: Expert = 89.42 to 108.57 | G50: Sharpshooter = 108.58 to 138.18 | L50: Marksman = 138.19 to 190.00 | Q50: Novice = 190.01 or more
A51: SSP - Master = 98.82 or less | D51: Expert = 98.83 to 120.00 | G51: Sharpshooter = 120.01 to 152.73 | L51: Marksman = 152.74 to 210.00 | Q51: Novice = 210.01 or more
A52: SSR - Master = 102.35 or less | D52: Expert = 102.36 to 124.29 | G52: Sharpshooter = 124.30 to 158.18 | L52: Marksman = 158.19 to 217.50 | Q52: Novice = 217.51 or more
A53: Points Down = .5 seconds x Points Down
A54: Procedurals = 3 seconds for each procedural penalty
A55: * Stage X Total = Time for all strings + Total Stage PD x .5 seconds
A56: ** Total Stage PD = Total of stage target points down + number of Procedurals x 6 (i.e. total of T1, T2 and T3 = 6; + 1 Prodedural for 6 = 12 Total Stage PD.)