A2: UDPL Match Results for Dec. 18, 2004 | J2: (Sorted by Time without regard to Shotgun Type.)
A3: Handgun/Handgun-Shotgun Match - Shotgun String Only Results
F4: Click here for COF descriptions.
A5: Place | B5: Name | C5: *DIV | D5: Shoot | E5: Total PD | F5: Stage 1 | G5: String | H5: String | I5: PD | J5: Stage 2 | K5: String | L5: String | M5: PD | N5: Stage 3 | O5: String | P5: String | Q5: PD | R5: Stage 4 | S5: String | T5: String | U5: PD | V5: Stage 5 | W5: String | X5: String | Y5: PD | Z5: Stage 6 | AA5: String | AB5: String | AC5: PD
D6: Total | G6: 1 | H6: 2 | K6: 1 | L6: 2 | O6: 1 | P6: 2 | S6: 1 | T6: 2 | W6: 1 | X6: 2 | AA6: 1 | AB6: 2
A7: 1 | B7: Zaccardi, Pat | C7: P+A | D7: =+F7+J7+N7+R7+V7+Z7 -> 37.71 | E7: =+I7+M7+Q7+U7+Y7+AC7 -> 0 | F7: =+(H7)+I7*0.5 -> 4.46 | G7: 11.46 | H7: 4.46 | I7: 0 | J7: =+(L7)+M7*0.5 -> 7.93 | K7: 14.95 | L7: 7.93 | M7: 0 | N7: =+(P7)+Q7*0.5 -> 6.15 | O7: 15.63 | P7: 6.15 | Q7: 0 | R7: =+(T7)+U7*0.5 -> 5.05 | S7: 13.20 | T7: 5.05 | U7: 0 | V7: =+(X7)+Y7*0.5 -> 7.57 | W7: 9.98 | X7: 7.57 | Y7: 0 | Z7: =+(AB7)+AC7*0.5 -> 6.55 | AA7: 10.54 | AB7: 6.55 | AC7: 0
A8: 2 | B8: Theodore, Ari | C8: P+A | D8: =+F8+J8+N8+R8+V8+Z8 -> 47.77 | E8: =+I8+M8+Q8+U8+Y8+AC8 -> 0 | F8: =+(H8)+I8*0.5 -> 6.28 | G8: 11.28 | H8: 6.28 | I8: 0 | J8: =+(L8)+M8*0.5 -> 7.74 | K8: 12.67 | L8: 7.74 | M8: 0 | N8: =+(P8)+Q8*0.5 -> 11.95 | O8: 11.77 | P8: 11.95 | Q8: 0 | R8: =+(T8)+U8*0.5 -> 6.85 | S8: 12.80 | T8: 6.85 | U8: 0 | V8: =+(X8)+Y8*0.5 -> 7.65 | W8: 11.69 | X8: 7.65 | Y8: 0 | Z8: =+(AB8)+AC8*0.5 -> 7.30 | AA8: 7.36 | AB8: 7.30 | AC8: 0
A9: 3 | B9: Latham, Corey | C9: P+A | D9: =+F9+J9+N9+R9+V9+Z9 -> 48.52 | E9: =+I9+M9+Q9+U9+Y9+AC9 -> 0 | F9: =+(H9)+I9*0.5 -> 6.28 | G9: 20.48 | H9: 6.28 | I9: 0 | J9: =+(L9)+M9*0.5 -> 7.05 | K9: 10.36 | L9: 7.05 | M9: 0 | N9: =+(P9)+Q9*0.5 -> 8.38 | O9: 8.37 | P9: 8.38 | Q9: 0 | R9: =+(T9)+U9*0.5 -> 13.35 | S9: 8.84 | T9: 13.35 | U9: 0 | V9: =+(X9)+Y9*0.5 -> 6.58 | W9: 8.35 | X9: 6.58 | Y9: 0 | Z9: =+(AB9)+AC9*0.5 -> 6.88 | AA9: 6.55 | AB9: 6.88 | AC9: 0
A10: 4 | B10: Ostler, Jeff | C10: P+P | D10: =+F10+J10+N10+R10+V10+Z10 -> 51.31 | E10: =+I10+M10+Q10+U10+Y10+AC10 -> 0 | F10: =+(H10)+I10*0.5 -> 7.49 | G10: 10.83 | H10: 7.49 | I10: 0 | J10: =+(L10)+M10*0.5 -> 9.68 | K10: 13.39 | L10: 9.68 | M10: 0 | N10: =+(P10)+Q10*0.5 -> 10.87 | O10: 11.49 | P10: 10.87 | Q10: 0 | R10: =+(T10)+U10*0.5 -> 8.16 | S10: 7.59 | T10: 8.16 | U10: 0 | V10: =+(X10)+Y10*0.5 -> 8.03 | W10: 13.87 | X10: 8.03 | Y10: 0 | Z10: =+(AB10)+AC10*0.5 -> 7.08 | AA10: 11.31 | AB10: 7.08 | AC10: 0
A11: 5 | B11: Spicer, Richard | C11: P+A | D11: =+F11+J11+N11+R11+V11+Z11 -> 52.33 | E11: =+I11+M11+Q11+U11+Y11+AC11 -> 0 | F11: =+(H11)+I11*0.5 -> 7.23 | G11: 24.14 | H11: 7.23 | I11: 0 | J11: =+(L11)+M11*0.5 -> 9.21 | K11: 15.04 | L11: 9.21 | M11: 0 | N11: =+(P11)+Q11*0.5 -> 7.33 | O11: 14.23 | P11: 7.33 | Q11: 0 | R11: =+(T11)+U11*0.5 -> 9.28 | S11: 15.91 | T11: 9.28 | U11: 0 | V11: =+(X11)+Y11*0.5 -> 7.55 | W11: 17.42 | X11: 7.55 | Y11: 0 | Z11: =+(AB11)+AC11*0.5 -> 11.73 | AA11: 17.23 | AB11: 11.73 | AC11: 0
A12: 6 | B12: Knapp, Chris | C12: P+P | D12: =+F12+J12+N12+R12+V12+Z12 -> 56.83 | E12: =+I12+M12+Q12+U12+Y12+AC12 -> 0 | F12: =+(H12)+I12*0.5 -> 9.65 | G12: 16.58 | H12: 9.65 | I12: 0 | J12: =+(L12)+M12*0.5 -> 6.86 | K12: 11.14 | L12: 6.86 | M12: 0 | N12: =+(P12)+Q12*0.5 -> 9.58 | O12: 16.22 | P12: 9.58 | Q12: 0 | R12: =+(T12)+U12*0.5 -> 6.96 | S12: 9.15 | T12: 6.96 | U12: 0 | V12: =+(X12)+Y12*0.5 -> 15.51 | W12: 15.80 | X12: 15.51 | Y12: 0 | Z12: =+(AB12)+AC12*0.5 -> 8.27 | AA12: 9.54 | AB12: 8.27 | AC12: 0
A13: 7 | B13: Zaccardi, Juke | C13: P+A | D13: =+F13+J13+N13+R13+V13+Z13 -> 56.96 | E13: =+I13+M13+Q13+U13+Y13+AC13 -> 0 | F13: =+(H13)+I13*0.5 -> 9.43 | G13: 10.10 | H13: 9.43 | I13: 0 | J13: =+(L13)+M13*0.5 -> 6.67 | K13: 16.66 | L13: 6.67 | M13: 0 | N13: =+(P13)+Q13*0.5 -> 9.41 | O13: 15.88 | P13: 9.41 | Q13: 0 | R13: =+(T13)+U13*0.5 -> 11.66 | S13: 10.79 | T13: 11.66 | U13: 0 | V13: =+(X13)+Y13*0.5 -> 7.53 | W13: 10.33 | X13: 7.53 | Y13: 0 | Z13: =+(AB13)+AC13*0.5 -> 12.26 | AA13: 9.29 | AB13: 12.26 | AC13: 0
A14: 8 | B14: Spicer, Robert | C14: P+A | D14: =+F14+J14+N14+R14+V14+Z14 -> 59.30 | E14: =+I14+M14+Q14+U14+Y14+AC14 -> 0 | F14: =+(H14)+I14*0.5 -> 10.24 | G14: 21.80 | H14: 10.24 | I14: 0 | J14: =+(L14)+M14*0.5 -> 8.48 | K14: 10.50 | L14: 8.48 | M14: 0 | N14: =+(P14)+Q14*0.5 -> 9.71 | O14: 14.85 | P14: 9.71 | Q14: 0 | R14: =+(T14)+U14*0.5 -> 8.00 | S14: 9.20 | T14: 8.00 | U14: 0 | V14: =+(X14)+Y14*0.5 -> 12.22 | W14: 13.68 | X14: 12.22 | Y14: 0 | Z14: =+(AB14)+AC14*0.5 -> 10.65 | AA14: 14.58 | AB14: 10.65 | AC14: 0
A15: 9 | B15: Huff, Blake | C15: P+A | D15: =+F15+J15+N15+R15+V15+Z15 -> 60.94 | E15: =+I15+M15+Q15+U15+Y15+AC15 -> 0 | F15: =+(H15)+I15*0.5 -> 7.20 | G15: 14.84 | H15: 7.20 | I15: 0 | J15: =+(L15)+M15*0.5 -> 14.79 | K15: 9.71 | L15: 14.79 | M15: 0 | N15: =+(P15)+Q15*0.5 -> 7.37 | O15: 18.23 | P15: 7.37 | Q15: 0 | R15: =+(T15)+U15*0.5 -> 7.45 | S15: 11.90 | T15: 7.45 | U15: 0 | V15: =+(X15)+Y15*0.5 -> 14.49 | W15: 12.80 | X15: 14.49 | Y15: 0 | Z15: =+(AB15)+AC15*0.5 -> 9.64 | AA15: 11.20 | AB15: 9.64 | AC15: 0
A16: 10 | B16: Young, Ren | C16: P+P | D16: =+F16+J16+N16+R16+V16+Z16 -> 62.25 | E16: =+I16+M16+Q16+U16+Y16+AC16 -> 0 | F16: =+(H16)+I16*0.5 -> 12.23 | G16: 11.66 | H16: 12.23 | I16: 0 | J16: =+(L16)+M16*0.5 -> 11.03 | K16: 9.47 | L16: 11.03 | M16: 0 | N16: =+(P16)+Q16*0.5 -> 9.04 | O16: 8.26 | P16: 9.04 | Q16: 0 | R16: =+(T16)+U16*0.5 -> 10.28 | S16: 9.83 | T16: 10.28 | U16: 0 | V16: =+(X16)+Y16*0.5 -> 9.48 | W16: 9.36 | X16: 9.48 | Y16: 0 | Z16: =+(AB16)+AC16*0.5 -> 10.19 | AA16: 9.15 | AB16: 10.19 | AC16: 0
A17: 11 | B17: Lowe, John | C17: P+P | D17: =+F17+J17+N17+R17+V17+Z17 -> 62.29 | E17: =+I17+M17+Q17+U17+Y17+AC17 -> 0 | F17: =+(H17)+I17*0.5 -> 6.94 | G17: 8.52 | H17: 6.94 | I17: 0 | J17: =+(L17)+M17*0.5 -> 9.71 | K17: 15.68 | L17: 9.71 | M17: 0 | N17: =+(P17)+Q17*0.5 -> 15.60 | O17: 14.69 | P17: 15.60 | Q17: 0 | R17: =+(T17)+U17*0.5 -> 14.78 | S17: 10.10 | T17: 14.78 | U17: 0 | V17: =+(X17)+Y17*0.5 -> 8.03 | W17: 10.88 | X17: 8.03 | Y17: 0 | Z17: =+(AB17)+AC17*0.5 -> 7.23 | AA17: 8.25 | AB17: 7.23 | AC17: 0
A18: 12 | B18: Rodriguez, Mike | C18: P+P | D18: =+F18+J18+N18+R18+V18+Z18 -> 62.81 | E18: =+I18+M18+Q18+U18+Y18+AC18 -> 0 | F18: =+(H18)+I18*0.5 -> 9.48 | G18: 13.31 | H18: 9.48 | I18: 0 | J18: =+(L18)+M18*0.5 -> 13.55 | K18: 11.88 | L18: 13.55 | M18: 0 | N18: =+(P18)+Q18*0.5 -> 10.64 | O18: 19.24 | P18: 10.64 | Q18: 0 | R18: =+(T18)+U18*0.5 -> 8.08 | S18: 11.83 | T18: 8.08 | U18: 0 | V18: =+(X18)+Y18*0.5 -> 13.48 | W18: 13.38 | X18: 13.48 | Y18: 0 | Z18: =+(AB18)+AC18*0.5 -> 7.58 | AA18: 10.52 | AB18: 7.58 | AC18: 0
A19: 13 | B19: Collins, Ken | C19: P+P | D19: =+F19+J19+N19+R19+V19+Z19 -> 65.48 | E19: =+I19+M19+Q19+U19+Y19+AC19 -> 0 | F19: =+(H19)+I19*0.5 -> 9.81 | G19: 8.41 | H19: 9.81 | I19: 0 | J19: =+(L19)+M19*0.5 -> 9.80 | K19: 9.04 | L19: 9.80 | M19: 0 | N19: =+(P19)+Q19*0.5 -> 11.57 | O19: 7.39 | P19: 11.57 | Q19: 0 | R19: =+(T19)+U19*0.5 -> 10.53 | S19: 10.12 | T19: 10.53 | U19: 0 | V19: =+(X19)+Y19*0.5 -> 13.58 | W19: 8.63 | X19: 13.58 | Y19: 0 | Z19: =+(AB19)+AC19*0.5 -> 10.19 | AA19: 6.45 | AB19: 10.19 | AC19: 0
A20: 14 | B20: Redford, Red | C20: P+P | D20: =+F20+J20+N20+R20+V20+Z20 -> 66.18 | E20: =+I20+M20+Q20+U20+Y20+AC20 -> 0 | F20: =+(H20)+I20*0.5 -> 17.55 | G20: 9.08 | H20: 17.55 | I20: 0 | J20: =+(L20)+M20*0.5 -> 11.00 | K20: 11.53 | L20: 11.00 | M20: 0 | N20: =+(P20)+Q20*0.5 -> 11.02 | O20: 20.21 | P20: 11.02 | Q20: 0 | R20: =+(T20)+U20*0.5 -> 7.81 | S20: 13.70 | T20: 7.81 | U20: 0 | V20: =+(X20)+Y20*0.5 -> 9.06 | W20: 18.72 | X20: 9.06 | Y20: 0 | Z20: =+(AB20)+AC20*0.5 -> 9.74 | AA20: 18.90 | AB20: 9.74 | AC20: 0
A21: 15 | B21: Lorenz, David | C21: P+A | D21: =+F21+J21+N21+R21+V21+Z21 -> 70.05 | E21: =+I21+M21+Q21+U21+Y21+AC21 -> 0 | F21: =+(H21)+I21*0.5 -> 9.01 | G21: 11.46 | H21: 9.01 | I21: 0 | J21: =+(L21)+M21*0.5 -> 16.58 | K21: 17.55 | L21: 16.58 | M21: 0 | N21: =+(P21)+Q21*0.5 -> 15.28 | O21: 25.47 | P21: 15.28 | Q21: 0 | R21: =+(T21)+U21*0.5 -> 10.22 | S21: 24.42 | T21: 10.22 | U21: 0 | V21: =+(X21)+Y21*0.5 -> 9.98 | W21: 18.44 | X21: 9.98 | Y21: 0 | Z21: =+(AB21)+AC21*0.5 -> 8.98 | AA21: 12.76 | AB21: 8.98 | AC21: 0
A22: 16 | B22: Wong, Hang | C22: P+A | D22: =+F22+J22+N22+R22+V22+Z22 -> 79.00 | E22: =+I22+M22+Q22+U22+Y22+AC22 -> 0 | F22: =+(H22)+I22*0.5 -> 8.76 | G22: 25.50 | H22: 8.76 | I22: 0 | J22: =+(L22)+M22*0.5 -> 14.73 | K22: 27.59 | L22: 14.73 | M22: 0 | N22: =+(P22)+Q22*0.5 -> 21.54 | O22: 33.87 | P22: 21.54 | Q22: 0 | R22: =+(T22)+U22*0.5 -> 10.63 | S22: 22.69 | T22: 10.63 | U22: 0 | V22: =+(X22)+Y22*0.5 -> 12.60 | W22: 23.81 | X22: 12.60 | Y22: 0 | Z22: =+(AB22)+AC22*0.5 -> 10.74 | AA22: 23.29 | AB22: 10.74 | AC22: 0
A23: 17 | B23: Huff, Scott | C23: P+A | D23: =+F23+J23+N23+R23+V23+Z23 -> 82.31 | E23: =+I23+M23+Q23+U23+Y23+AC23 -> 0 | F23: =+(H23)+I23*0.5 -> 16.59 | G23: 11.73 | H23: 16.59 | I23: 0 | J23: =+(L23)+M23*0.5 -> 17.56 | K23: 19.96 | L23: 17.56 | M23: 0 | N23: =+(P23)+Q23*0.5 -> 15.09 | O23: 22.56 | P23: 15.09 | Q23: 0 | R23: =+(T23)+U23*0.5 -> 11.01 | S23: 10.22 | T23: 11.01 | U23: 0 | V23: =+(X23)+Y23*0.5 -> 9.49 | W23: 16.30 | X23: 9.49 | Y23: 0 | Z23: =+(AB23)+AC23*0.5 -> 12.57 | AA23: 18.00 | AB23: 12.57 | AC23: 0
A24: 18 | B24: Durning, Will | C24: P+P | D24: =+F24+J24+N24+R24+V24+Z24 -> 82.77 | E24: =+I24+M24+Q24+U24+Y24+AC24 -> 0 | F24: =+(H24)+I24*0.5 -> 8.96 | G24: 20.17 | H24: 8.96 | I24: 0 | J24: =+(L24)+M24*0.5 -> 18.52 | K24: 24.04 | L24: 18.52 | M24: 0 | N24: =+(P24)+Q24*0.5 -> 20.90 | O24: 27.32 | P24: 20.90 | Q24: 0 | R24: =+(T24)+U24*0.5 -> 10.73 | S24: 13.94 | T24: 10.73 | U24: 0 | V24: =+(X24)+Y24*0.5 -> 11.90 | W24: 41.54 | X24: 11.90 | Y24: 0 | Z24: =+(AB24)+AC24*0.5 -> 11.76 | AA24: 10.91 | AB24: 11.76 | AC24: 0
A25: 19 | B25: Montgomery, Robert | C25: P+P | D25: =+F25+J25+N25+R25+V25+Z25 -> 86.38 | E25: =+I25+M25+Q25+U25+Y25+AC25 -> 0 | F25: =+(H25)+I25*0.5 -> 14.37 | G25: 13.93 | H25: 14.37 | I25: 0 | J25: =+(L25)+M25*0.5 -> 15.16 | K25: 17.02 | L25: 15.16 | M25: 0 | N25: =+(P25)+Q25*0.5 -> 11.95 | O25: 14.52 | P25: 11.95 | Q25: 0 | R25: =+(T25)+U25*0.5 -> 14.39 | S25: 10.38 | T25: 14.39 | U25: 0 | V25: =+(X25)+Y25*0.5 -> 17.39 | W25: 9.60 | X25: 17.39 | Y25: 0 | Z25: =+(AB25)+AC25*0.5 -> 13.12 | AA25: 8.12 | AB25: 13.12 | AC25: 0
A26: 20 | B26: Deleeuw, Dave | C26: P+P | D26: =+F26+J26+N26+R26+V26+Z26 -> 92.33 | E26: =+I26+M26+Q26+U26+Y26+AC26 -> 0 | F26: =+(H26)+I26*0.5 -> 10.97 | G26: 20.78 | H26: 10.97 | I26: 0 | J26: =+(L26)+M26*0.5 -> 17.68 | K26: 12.80 | L26: 17.68 | M26: 0 | N26: =+(P26)+Q26*0.5 -> 25.11 | O26: 14.53 | P26: 25.11 | Q26: 0 | R26: =+(T26)+U26*0.5 -> 12.10 | S26: 16.56 | T26: 12.10 | U26: 0 | V26: =+(X26)+Y26*0.5 -> 11.65 | W26: 13.31 | X26: 11.65 | Y26: 0 | Z26: =+(AB26)+AC26*0.5 -> 14.82 | AA26: 9.80 | AB26: 14.82 | AC26: 0
A27: 21 | B27: Harrison, Mike | C27: P+P | D27: =+F27+J27+N27+R27+V27+Z27 -> 92.83 | E27: =+I27+M27+Q27+U27+Y27+AC27 -> 0 | F27: =+(H27)+I27*0.5 -> 13.68 | G27: 27.18 | H27: 13.68 | I27: 0 | J27: =+(L27)+M27*0.5 -> 18.46 | K27: 35.40 | L27: 18.46 | M27: 0 | N27: =+(P27)+Q27*0.5 -> 20.50 | O27: 18.96 | P27: 20.50 | Q27: 0 | R27: =+(T27)+U27*0.5 -> 14.59 | S27: 21.70 | T27: 14.59 | U27: 0 | V27: =+(X27)+Y27*0.5 -> 12.51 | W27: 20.35 | X27: 12.51 | Y27: 0 | Z27: =+(AB27)+AC27*0.5 -> 13.09 | AA27: 21.99 | AB27: 13.09 | AC27: 0
A28: 22 | B28: Stone, Scott | C28: P+A | D28: =+F28+J28+N28+R28+V28+Z28 -> 105.61 | E28: =+I28+M28+Q28+U28+Y28+AC28 -> 0 | F28: =+(H28)+I28*0.5 -> 24.99 | G28: 11.80 | H28: 24.99 | I28: 0 | J28: =+(L28)+M28*0.5 -> 13.52 | K28: 15.71 | L28: 13.52 | M28: 0 | N28: =+(P28)+Q28*0.5 -> 21.31 | O28: 13.96 | P28: 21.31 | Q28: 0 | R28: =+(T28)+U28*0.5 -> 15.58 | S28: 13.22 | T28: 15.58 | U28: 0 | V28: =+(X28)+Y28*0.5 -> 18.66 | W28: 9.30 | X28: 18.66 | Y28: 0 | Z28: =+(AB28)+AC28*0.5 -> 11.55 | AA28: 15.06 | AB28: 11.55 | AC28: 0
A29: 23 | B29: Peters, Buddy | C29: P+P | D29: =+F29+J29+N29+R29+V29+Z29 -> 115.49 | E29: =+I29+M29+Q29+U29+Y29+AC29 -> 60 | F29: =+(H29)+I29*0.5 -> 17.20 | G29: 51.79 | H29: 17.20 | I29: 0 | J29: =+(L29)+M29*0.5 -> 14.60 | K29: 25.76 | L29: 14.60 | M29: 0 | N29: =+(P29)+Q29*0.5 -> 43.02 | O29: 10.00 | P29: 13.02 | Q29: 60 | R29: =+(T29)+U29*0.5 -> 14.18 | S29: 14.97 | T29: 14.18 | U29: 0 | V29: =+(X29)+Y29*0.5 -> 13.62 | W29: 15.65 | X29: 13.62 | Y29: 0 | Z29: =+(AB29)+AC29*0.5 -> 12.87 | AA29: 38.92 | AB29: 12.87 | AC29: 0
A30: 24 | B30: Burden, Pat | C30: P+P | D30: =+F30+J30+N30+R30+V30+Z30 -> 141.70 | E30: =+I30+M30+Q30+U30+Y30+AC30 -> 0 | F30: =+(H30)+I30*0.5 -> 32.39 | G30: 18.78 | H30: 32.39 | I30: 0 | J30: =+(L30)+M30*0.5 -> 18.88 | K30: 20.30 | L30: 18.88 | M30: 0 | N30: =+(P30)+Q30*0.5 -> 33.20 | O30: 16.98 | P30: 33.20 | Q30: 0 | R30: =+(T30)+U30*0.5 -> 16.98 | S30: 16.96 | T30: 16.98 | U30: 0 | V30: =+(X30)+Y30*0.5 -> 20.21 | W30: 17.32 | X30: 20.21 | Y30: 0 | Z30: =+(AB30)+AC30*0.5 -> 20.04 | AA30: 17.29 | AB30: 20.04 | AC30: 0
A31: 25 | B31: Nielsen, Todd | C31: P+P | D31: =+F31+J31+N31+R31+V31+Z31 -> 166.91 | E31: =+I31+M31+Q31+U31+Y31+AC31 -> 0 | F31: =+(H31)+I31*0.5 -> 47.36 | G31: 53.71 | H31: 47.36 | I31: 0 | J31: =+(L31)+M31*0.5 -> 30.82 | K31: 51.25 | L31: 30.82 | M31: 0 | N31: =+(P31)+Q31*0.5 -> 35.15 | O31: 50.12 | P31: 35.15 | Q31: 0 | R31: =+(T31)+U31*0.5 -> 21.15 | S31: 42.91 | T31: 21.15 | U31: 0 | V31: =+(X31)+Y31*0.5 -> 17.38 | W31: 29.67 | X31: 17.38 | Y31: 0 | Z31: =+(AB31)+AC31*0.5 -> 15.05 | AA31: 25.70 | AB31: 15.05 | AC31: 0
A32: 26 | B32: Bridges, David | C32: P+A | D32: =+F32+J32+N32+R32+V32+Z32 -> 182.32 | E32: =+I32+M32+Q32+U32+Y32+AC32 -> 0 | F32: =+(H32)+I32*0.5 -> 24.92 | G32: 22.80 | H32: 24.92 | I32: 0 | J32: =+(L32)+M32*0.5 -> 27.55 | K32: 21.01 | L32: 27.55 | M32: 0 | N32: =+(P32)+Q32*0.5 -> 51.66 | O32: 31.36 | P32: 51.66 | Q32: 0 | R32: =+(T32)+U32*0.5 -> 26.88 | S32: 21.93 | T32: 26.88 | U32: 0 | V32: =+(X32)+Y32*0.5 -> 25.75 | W32: 24.09 | X32: 25.75 | Y32: 0 | Z32: =+(AB32)+AC32*0.5 -> 25.56 | AA32: 20.62 | AB32: 25.56 | AC32: 0
A33: 27 | B33: McDermaid, Jen | C33: P+P | D33: =+F33+J33+N33+R33+V33+Z33 -> 187.06 | E33: =+I33+M33+Q33+U33+Y33+AC33 -> 0 | F33: =+(H33)+I33*0.5 -> 51.55 | G33: 66.01 | H33: 51.55 | I33: 0 | J33: =+(L33)+M33*0.5 -> 33.00 | K33: 34.26 | L33: 33.00 | M33: 0 | N33: =+(P33)+Q33*0.5 -> 27.11 | O33: 65.52 | P33: 27.11 | Q33: 0 | R33: =+(T33)+U33*0.5 -> 20.45 | S33: 26.52 | T33: 20.45 | U33: 0 | V33: =+(X33)+Y33*0.5 -> 25.76 | W33: 32.37 | X33: 25.76 | Y33: 0 | Z33: =+(AB33)+AC33*0.5 -> 29.19 | AA33: 26.69 | AB33: 29.19 | AC33: 0
A34: 1 | B34: Boyer, Steve | C34: PO | D34: =+F34+J34+N34+R34+V34+Z34 -> 160.47 | E34: =+I34+M34+Q34+U34+Y34+AC34 -> 0 | F34: =+(G34+H34)+I34*0.5 -> 21.04 | G34: 10.73 | H34: 10.31 | I34: 0 | J34: =+(K34+L34)+M34*0.5 -> 36.83 | K34: 22.71 | L34: 14.12 | M34: 0 | N34: =+(O34+P34)+Q34*0.5 -> 24.58 | O34: 9.44 | P34: 15.14 | Q34: 0 | R34: =+(S34+T34)+U34*0.5 -> 30.93 | S34: 16.95 | T34: 13.98 | U34: 0 | V34: =+(W34+X34)+Y34*0.5 -> 25.72 | W34: 16.42 | X34: 9.30 | Y34: 0 | Z34: =+(AA34+AB34)+AC34*0.5 -> 21.37 | AA34: 11.24 | AB34: 10.13 | AC34: 0
A35: 2 | B35: Vollmer, Phil | C35: PO | D35: =+F35+J35+N35+R35+V35+Z35 -> 162.56 | E35: =+I35+M35+Q35+U35+Y35+AC35 -> 0 | F35: =+(G35+H35)+I35*0.5 -> 32.01 | G35: 17.24 | H35: 14.77 | I35: 0 | J35: =+(K35+L35)+M35*0.5 -> 43.73 | K35: 15.35 | L35: 28.38 | M35: 0 | N35: =+(O35+P35)+Q35*0.5 -> 20.79 | O35: 9.62 | P35: 11.17 | Q35: 0 | R35: =+(S35+T35)+U35*0.5 -> 23.14 | S35: 9.07 | T35: 14.07 | U35: 0 | V35: =+(W35+X35)+Y35*0.5 -> 17.06 | W35: 8.88 | X35: 8.18 | Y35: 0 | Z35: =+(AA35+AB35)+AC35*0.5 -> 25.83 | AA35: 7.82 | AB35: 18.01 | AC35: 0
A36: 3 | B36: Lauritzen, Scott | C36: PO | D36: =+F36+J36+N36+R36+V36+Z36 -> 194.80 | E36: =+I36+M36+Q36+U36+Y36+AC36 -> 0 | F36: =+(G36+H36)+I36*0.5 -> 34.33 | G36: 16.53 | H36: 17.80 | I36: 0 | J36: =+(K36+L36)+M36*0.5 -> 32.80 | K36: 16.09 | L36: 16.71 | M36: 0 | N36: =+(O36+P36)+Q36*0.5 -> 54.96 | O36: 11.69 | P36: 43.27 | Q36: 0 | R36: =+(S36+T36)+U36*0.5 -> 24.87 | S36: 12.76 | T36: 12.11 | U36: 0 | V36: =+(W36+X36)+Y36*0.5 -> 20.99 | W36: 10.93 | X36: 10.06 | Y36: 0 | Z36: =+(AA36+AB36)+AC36*0.5 -> 26.85 | AA36: 13.72 | AB36: 13.13 | AC36: 0
A37: 4 | B37: Tuft, Tom | C37: PO | D37: =+F37+J37+N37+R37+V37+Z37 -> 210.65 | E37: =+I37+M37+Q37+U37+Y37+AC37 -> 0 | F37: =+(G37+H37)+I37*0.5 -> 34.19 | G37: 15.84 | H37: 18.35 | I37: 0 | J37: =+(K37+L37)+M37*0.5 -> 34.92 | K37: 15.05 | L37: 19.87 | M37: 0 | N37: =+(O37+P37)+Q37*0.5 -> 37.32 | O37: 20.76 | P37: 16.56 | Q37: 0 | R37: =+(S37+T37)+U37*0.5 -> 41.29 | S37: 26.52 | T37: 14.77 | U37: 0 | V37: =+(W37+X37)+Y37*0.5 -> 27.07 | W37: 15.22 | X37: 11.85 | Y37: 0 | Z37: =+(AA37+AB37)+AC37*0.5 -> 35.86 | AA37: 16.08 | AB37: 19.78 | AC37: 0
A38: 5 | B38: Phillips, RDan | C38: PO | D38: =+F38+J38+N38+R38+V38+Z38 -> 218.36 | E38: =+I38+M38+Q38+U38+Y38+AC38 -> 0 | F38: =+(G38+H38)+I38*0.5 -> 51.76 | G38: 31.42 | H38: 20.34 | I38: 0 | J38: =+(K38+L38)+M38*0.5 -> 37.77 | K38: 19.13 | L38: 18.64 | M38: 0 | N38: =+(O38+P38)+Q38*0.5 -> 33.28 | O38: 17.99 | P38: 15.29 | Q38: 0 | R38: =+(S38+T38)+U38*0.5 -> 40.92 | S38: 19.62 | T38: 21.30 | U38: 0 | V38: =+(W38+X38)+Y38*0.5 -> 33.82 | W38: 12.62 | X38: 21.20 | Y38: 0 | Z38: =+(AA38+AB38)+AC38*0.5 -> 20.81 | AA38: 11.17 | AB38: 9.64 | AC38: 0
A39: 6 | B39: Wickersham, Chase | C39: PO | D39: =+F39+J39+N39+R39+V39+Z39 -> 218.47 | E39: =+I39+M39+Q39+U39+Y39+AC39 -> 0 | F39: =+(G39+H39)+I39*0.5 -> 45.94 | G39: 25.03 | H39: 20.91 | I39: 0 | J39: =+(K39+L39)+M39*0.5 -> 33.14 | K39: 18.19 | L39: 14.95 | M39: 0 | N39: =+(O39+P39)+Q39*0.5 -> 40.18 | O39: 18.64 | P39: 21.54 | Q39: 0 | R39: =+(S39+T39)+U39*0.5 -> 34.58 | S39: 19.65 | T39: 14.93 | U39: 0 | V39: =+(W39+X39)+Y39*0.5 -> 25.81 | W39: 13.25 | X39: 12.56 | Y39: 0 | Z39: =+(AA39+AB39)+AC39*0.5 -> 38.82 | AA39: 22.22 | AB39: 16.60 | AC39: 0
A40: 7 | B40: Kirkham, Bart | C40: PO | D40: =+F40+J40+N40+R40+V40+Z40 -> 232.58 | E40: =+I40+M40+Q40+U40+Y40+AC40 -> 0 | F40: =+(G40+H40)+I40*0.5 -> 35.64 | G40: 15.50 | H40: 20.14 | I40: 0 | J40: =+(K40+L40)+M40*0.5 -> 57.27 | K40: 34.37 | L40: 22.90 | M40: 0 | N40: =+(O40+P40)+Q40*0.5 -> 31.01 | O40: 14.20 | P40: 16.81 | Q40: 0 | R40: =+(S40+T40)+U40*0.5 -> 46.44 | S40: 23.94 | T40: 22.50 | U40: 0 | V40: =+(W40+X40)+Y40*0.5 -> 27.37 | W40: 13.90 | X40: 13.47 | Y40: 0 | Z40: =+(AA40+AB40)+AC40*0.5 -> 34.85 | AA40: 19.49 | AB40: 15.36 | AC40: 0
A41: 8 | B41: Tucker, Ben | C41: PO | D41: =+F41+J41+N41+R41+V41+Z41 -> 232.62 | E41: =+I41+M41+Q41+U41+Y41+AC41 -> 0 | F41: =+(G41+H41)+I41*0.5 -> 26.82 | G41: 11.69 | H41: 15.13 | I41: 0 | J41: =+(K41+L41)+M41*0.5 -> 42.73 | K41: 21.01 | L41: 21.72 | M41: 0 | N41: =+(O41+P41)+Q41*0.5 -> 35.58 | O41: 20.86 | P41: 14.72 | Q41: 0 | R41: =+(S41+T41)+U41*0.5 -> 31.65 | S41: 17.34 | T41: 14.31 | U41: 0 | V41: =+(W41+X41)+Y41*0.5 -> 59.64 | W41: 34.84 | X41: 24.80 | Y41: 0 | Z41: =+(AA41+AB41)+AC41*0.5 -> 36.20 | AA41: 24.61 | AB41: 11.59 | AC41: 0
A42: 9 | B42: Hill, Randy | C42: PO | D42: =+F42+J42+N42+R42+V42+Z42 -> 244.29 | E42: =+I42+M42+Q42+U42+Y42+AC42 -> 0 | F42: =+(G42+H42)+I42*0.5 -> 60.17 | G42: 30.92 | H42: 29.25 | I42: 0 | J42: =+(K42+L42)+M42*0.5 -> 41.43 | K42: 24.13 | L42: 17.30 | M42: 0 | N42: =+(O42+P42)+Q42*0.5 -> 46.35 | O42: 24.43 | P42: 21.92 | Q42: 0 | R42: =+(S42+T42)+U42*0.5 -> 32.65 | S42: 18.68 | T42: 13.97 | U42: 0 | V42: =+(W42+X42)+Y42*0.5 -> 42.31 | W42: 25.89 | X42: 16.42 | Y42: 0 | Z42: =+(AA42+AB42)+AC42*0.5 -> 21.38 | AA42: 11.23 | AB42: 10.15 | AC42: 0
A43: 10 | B43: Dahl, Wes | C43: PO | D43: =+F43+J43+N43+R43+V43+Z43 -> 245.15 | E43: =+I43+M43+Q43+U43+Y43+AC43 -> 0 | F43: =+(G43+H43)+I43*0.5 -> 54.59 | G43: 34.65 | H43: 19.94 | I43: 0 | J43: =+(K43+L43)+M43*0.5 -> 50.33 | K43: 31.88 | L43: 18.45 | M43: 0 | N43: =+(O43+P43)+Q43*0.5 -> 51.58 | O43: 25.61 | P43: 25.97 | Q43: 0 | R43: =+(S43+T43)+U43*0.5 -> 29.87 | S43: 14.93 | T43: 14.94 | U43: 0 | V43: =+(W43+X43)+Y43*0.5 -> 26.56 | W43: 15.15 | X43: 11.41 | Y43: 0 | Z43: =+(AA43+AB43)+AC43*0.5 -> 32.22 | AA43: 18.21 | AB43: 14.01 | AC43: 0
A44: 11 | B44: Willes, Chris | C44: PO | D44: =+F44+J44+N44+R44+V44+Z44 -> 292.79 | E44: =+I44+M44+Q44+U44+Y44+AC44 -> 20 | F44: =+(G44+H44)+I44*0.5 -> 57.79 | G44: 11.66 | H44: 36.13 | I44: 20 | J44: =+(K44+L44)+M44*0.5 -> 44.08 | K44: 23.85 | L44: 20.23 | M44: 0 | N44: =+(O44+P44)+Q44*0.5 -> 52.28 | O44: 22.68 | P44: 29.60 | Q44: 0 | R44: =+(S44+T44)+U44*0.5 -> 46.07 | S44: 20.94 | T44: 25.13 | U44: 0 | V44: =+(W44+X44)+Y44*0.5 -> 53.43 | W44: 32.04 | X44: 21.39 | Y44: 0 | Z44: =+(AA44+AB44)+AC44*0.5 -> 39.14 | AA44: 18.47 | AB44: 20.67 | AC44: 0
A45: 12 | B45: Kirkham, Glade | C45: PO | D45: =+F45+J45+N45+R45+V45+Z45 -> 302.97 | E45: =+I45+M45+Q45+U45+Y45+AC45 -> 0 | F45: =+(G45+H45)+I45*0.5 -> 43.52 | G45: 22.43 | H45: 21.09 | I45: 0 | J45: =+(K45+L45)+M45*0.5 -> 60.86 | K45: 38.18 | L45: 22.68 | M45: 0 | N45: =+(O45+P45)+Q45*0.5 -> 59.09 | O45: 29.15 | P45: 29.94 | Q45: 0 | R45: =+(S45+T45)+U45*0.5 -> 52.41 | S45: 25.86 | T45: 26.55 | U45: 0 | V45: =+(W45+X45)+Y45*0.5 -> 47.70 | W45: 23.74 | X45: 23.96 | Y45: 0 | Z45: =+(AA45+AB45)+AC45*0.5 -> 39.39 | AA45: 20.22 | AB45: 19.17 | AC45: 0
A46: 13 | B46: Durham, Dan | C46: PO | D46: =+F46+J46+N46+R46+V46+Z46 -> 389.90 | E46: =+I46+M46+Q46+U46+Y46+AC46 -> 0 | F46: =+(G46+H46)+I46*0.5 -> 92.43 | G46: 42.79 | H46: 49.64 | I46: 0 | J46: =+(K46+L46)+M46*0.5 -> 69.82 | K46: 45.10 | L46: 24.72 | M46: 0 | N46: =+(O46+P46)+Q46*0.5 -> 64.31 | O46: 48.89 | P46: 15.42 | Q46: 0 | R46: =+(S46+T46)+U46*0.5 -> 71.62 | S46: 39.70 | T46: 31.92 | U46: 0 | V46: =+(W46+X46)+Y46*0.5 -> 49.41 | W46: 26.32 | X46: 23.09 | Y46: 0 | Z46: =+(AA46+AB46)+AC46*0.5 -> 42.31 | AA46: 22.16 | AB46: 20.15 | AC46: 0
A47: 14 | B47: Brownlee, Mike | C47: PO | D47: =+F47+J47+N47+R47+V47+Z47 -> 403.50 | E47: =+I47+M47+Q47+U47+Y47+AC47 -> 0 | F47: =+(G47+H47)+I47*0.5 -> 59.31 | G47: 35.47 | H47: 23.84 | I47: 0 | J47: =+(K47+L47)+M47*0.5 -> 58.44 | K47: 23.65 | L47: 34.79 | M47: 0 | N47: =+(O47+P47)+Q47*0.5 -> 106.24 | O47: 53.38 | P47: 52.86 | Q47: 0 | R47: =+(S47+T47)+U47*0.5 -> 85.08 | S47: 41.98 | T47: 43.10 | U47: 0 | V47: =+(W47+X47)+Y47*0.5 -> 52.46 | W47: 16.86 | X47: 35.60 | Y47: 0 | Z47: =+(AA47+AB47)+AC47*0.5 -> 41.97 | AA47: 24.18 | AB47: 17.79 | AC47: 0
A48: 15 | B48: Messinger, Olivia | C48: PO | D48: =+F48+J48+N48+R48+V48+Z48 -> 438.93 | E48: =+I48+M48+Q48+U48+Y48+AC48 -> 0 | F48: =+(G48+H48)+I48*0.5 -> 75.06 | G48: 37.76 | H48: 37.30 | I48: 0 | J48: =+(K48+L48)+M48*0.5 -> 66.74 | K48: 32.38 | L48: 34.36 | M48: 0 | N48: =+(O48+P48)+Q48*0.5 -> 75.63 | O48: 44.29 | P48: 31.34 | Q48: 0 | R48: =+(S48+T48)+U48*0.5 -> 86.32 | S48: 46.92 | T48: 39.40 | U48: 0 | V48: =+(W48+X48)+Y48*0.5 -> 73.57 | W48: 37.62 | X48: 35.95 | Y48: 0 | Z48: =+(AA48+AB48)+AC48*0.5 -> 61.61 | AA48: 33.03 | AB48: 28.58 | AC48: 0
A49: 16 | B49: Tucker, Jake | C49: PO | D49: =+F49+J49+N49+R49+V49+Z49 -> 467.18 | E49: =+I49+M49+Q49+U49+Y49+AC49 -> 0 | F49: =+(G49+H49)+I49*0.5 -> 97.56 | G49: 44.43 | H49: 53.13 | I49: 0 | J49: =+(K49+L49)+M49*0.5 -> 124.94 | K49: 47.01 | L49: 77.93 | M49: 0 | N49: =+(O49+P49)+Q49*0.5 -> 94.45 | O49: 67.60 | P49: 26.85 | Q49: 0 | R49: =+(S49+T49)+U49*0.5 -> 61.75 | S49: 31.72 | T49: 30.03 | U49: 0 | V49: =+(W49+X49)+Y49*0.5 -> 50.73 | W49: 23.40 | X49: 27.33 | Y49: 0 | Z49: =+(AA49+AB49)+AC49*0.5 -> 37.75 | AA49: 23.56 | AB49: 14.19 | AC49: 0
A50: 17 | B50: Kirkham, Devon (.22) | C50: PO | D50: =+F50+J50+N50+R50+V50+Z50 -> 503.17 | E50: =+I50+M50+Q50+U50+Y50+AC50 -> 0 | F50: =+(G50+H50)+I50*0.5 -> 85.01 | G50: 44.18 | H50: 40.83 | I50: 0 | J50: =+(K50+L50)+M50*0.5 -> 76.17 | K50: 35.75 | L50: 40.42 | M50: 0 | N50: =+(O50+P50)+Q50*0.5 -> 135.65 | O50: 74.49 | P50: 61.16 | Q50: 0 | R50: =+(S50+T50)+U50*0.5 -> 65.69 | S50: 42.65 | T50: 23.04 | U50: 0 | V50: =+(W50+X50)+Y50*0.5 -> 63.34 | W50: 29.83 | X50: 33.51 | Y50: 0 | Z50: =+(AA50+AB50)+AC50*0.5 -> 77.31 | AA50: 40.03 | AB50: 37.28 | AC50: 0
A51: 18 | B51: Messinger, Bonnie | C51: PO | D51: =+F51+J51+N51+R51+V51+Z51 -> 547.17 | E51: =+I51+M51+Q51+U51+Y51+AC51 -> 0 | F51: =+(G51+H51)+I51*0.5 -> 94.58 | G51: 42.62 | H51: 51.96 | I51: 0 | J51: =+(K51+L51)+M51*0.5 -> 82.87 | K51: 46.34 | L51: 36.53 | M51: 0 | N51: =+(O51+P51)+Q51*0.5 -> 102.15 | O51: 41.06 | P51: 61.09 | Q51: 0 | R51: =+(S51+T51)+U51*0.5 -> 103.71 | S51: 56.32 | T51: 47.39 | U51: 0 | V51: =+(W51+X51)+Y51*0.5 -> 93.20 | W51: 51.78 | X51: 41.42 | Y51: 0 | Z51: =+(AA51+AB51)+AC51*0.5 -> 70.66 | AA51: 35.04 | AB51: 35.62 | AC51: 0
A52: 19 | B52: Stone, Marylee | C52: PO | D52: =+F52+J52+N52+R52+V52+Z52 -> 1200.74 | E52: =+I52+M52+Q52+U52+Y52+AC52 -> 40 | F52: =+(G52+H52)+I52*0.5 -> 269.65 | G52: 145.80 | H52: 123.85 | I52: 0 | J52: =+(K52+L52)+M52*0.5 -> 284.73 | K52: 184.66 | L52: 100.07 | M52: 0 | N52: =+(O52+P52)+Q52*0.5 -> 279.49 | O52: 145.14 | P52: 134.35 | Q52: 0 | R52: =+(S52+T52)+U52*0.5 -> 170.21 | S52: 62.83 | T52: 92.38 | U52: 30 | V52: =+(W52+X52)+Y52*0.5 -> 139.39 | W52: 94.04 | X52: 40.35 | Y52: 10 | Z52: =+(AA52+AB52)+AC52*0.5 -> 57.27 | AA52: 32.40 | AB52: 24.87 | AC52: 0
A54: 1 | B54: Redford, Red | C54: RO | D54: =+F54+J54+N54+R54+V54+Z54 -> 219.05 | E54: =+I54+M54+Q54+U54+Y54+AC54 -> 0 | F54: =+(G54+H54)+I54*0.5 -> 32.31 | G54: 16.37 | H54: 15.94 | I54: 0 | J54: =+(K54+L54)+M54*0.5 -> 44.81 | K54: 22.55 | L54: 22.26 | M54: 0 | N54: =+(O54+P54)+Q54*0.5 -> 39.47 | O54: 16.54 | P54: 22.93 | Q54: 0 | R54: =+(S54+T54)+U54*0.5 -> 30.88 | S54: 14.45 | T54: 16.43 | U54: 0 | V54: =+(W54+X54)+Y54*0.5 -> 41.26 | W54: 25.32 | X54: 15.94 | Y54: 0 | Z54: =+(AA54+AB54)+AC54*0.5 -> 30.32 | AA54: 15.10 | AB54: 15.22 | AC54: 0
A55: Notes:
A56: xx | B56: Indicates that the Points Down value includes some kind of penalty (Procedural Error or Misses on Steel).
A57: PD | B57: = Points Down value is PD x 5 seconds added to the total stage time.
A58: *DIV | B58: = Divisions: PO = Pistol Only; RO = Revolver Only; P+P = Pistol-Pump Shotgun; R+P = Revolver-Pump Shotgun; P+A Pistol/Auto Shotgun; R+A = Revolver/Auto Shotgun
A60: DNF | B60: = Did Not Finish