A2: UDPL Match Results for Dec. 18, 2004 | J2: (Sorted by Division.)
A3: Handgun/Handgun-Shotgun Match - Handgun-Shotgun Results Only
F4: Click here for COF descriptions.
A5: Place | B5: Name | C5: *DIV | D5: Shoot | E5: Total PD | F5: Stage 1 | G5: String | H5: String | I5: PD | J5: Stage 2 | K5: String | L5: String | M5: PD | N5: Stage 3 | O5: String | P5: String | Q5: PD | R5: Stage 4 | S5: String | T5: String | U5: PD | V5: Stage 5 | W5: String | X5: String | Y5: PD | Z5: Stage 6 | AA5: String | AB5: String | AC5: PD
D6: Total | G6: 1 | H6: 2 | K6: 1 | L6: 2 | O6: 1 | P6: 2 | S6: 1 | T6: 2 | W6: 1 | X6: 2 | AA6: 1 | AB6: 2
A7: 1 | B7: Latham, Corey | C7: P+A | D7: =+F7+J7+N7+R7+V7+Z7 -> 111.47 | E7: =+I7+M7+Q7+U7+Y7+AC7 -> 0 | F7: =+(G7+H7)+I7*0.5 -> 26.76 | G7: 20.48 | H7: 6.28 | I7: 0 | J7: =+(K7+L7)+M7*0.5 -> 17.41 | K7: 10.36 | L7: 7.05 | M7: 0 | N7: =+(O7+P7)+Q7*0.5 -> 16.75 | O7: 8.37 | P7: 8.38 | Q7: 0 | R7: =+(S7+T7)+U7*0.5 -> 22.19 | S7: 8.84 | T7: 13.35 | U7: 0 | V7: =+(W7+X7)+Y7*0.5 -> 14.93 | W7: 8.35 | X7: 6.58 | Y7: 0 | Z7: =+(AA7+AB7)+AC7*0.5 -> 13.43 | AA7: 6.55 | AB7: 6.88 | AC7: 0
A8: 2 | B8: Zaccardi, Pat | C8: P+A | D8: =+F8+J8+N8+R8+V8+Z8 -> 113.47 | E8: =+I8+M8+Q8+U8+Y8+AC8 -> 0 | F8: =+(G8+H8)+I8*0.5 -> 15.92 | G8: 11.46 | H8: 4.46 | I8: 0 | J8: =+(K8+L8)+M8*0.5 -> 22.88 | K8: 14.95 | L8: 7.93 | M8: 0 | N8: =+(O8+P8)+Q8*0.5 -> 21.78 | O8: 15.63 | P8: 6.15 | Q8: 0 | R8: =+(S8+T8)+U8*0.5 -> 18.25 | S8: 13.20 | T8: 5.05 | U8: 0 | V8: =+(W8+X8)+Y8*0.5 -> 17.55 | W8: 9.98 | X8: 7.57 | Y8: 0 | Z8: =+(AA8+AB8)+AC8*0.5 -> 17.09 | AA8: 10.54 | AB8: 6.55 | AC8: 0
A9: 3 | B9: Theodore, Ari | C9: P+A | D9: =+F9+J9+N9+R9+V9+Z9 -> 115.34 | E9: =+I9+M9+Q9+U9+Y9+AC9 -> 0 | F9: =+(G9+H9)+I9*0.5 -> 17.56 | G9: 11.28 | H9: 6.28 | I9: 0 | J9: =+(K9+L9)+M9*0.5 -> 20.41 | K9: 12.67 | L9: 7.74 | M9: 0 | N9: =+(O9+P9)+Q9*0.5 -> 23.72 | O9: 11.77 | P9: 11.95 | Q9: 0 | R9: =+(S9+T9)+U9*0.5 -> 19.65 | S9: 12.80 | T9: 6.85 | U9: 0 | V9: =+(W9+X9)+Y9*0.5 -> 19.34 | W9: 11.69 | X9: 7.65 | Y9: 0 | Z9: =+(AA9+AB9)+AC9*0.5 -> 14.66 | AA9: 7.36 | AB9: 7.30 | AC9: 0
A10: 4 | B10: Zaccardi, Juke | C10: P+A | D10: =+F10+J10+N10+R10+V10+Z10 -> 130.01 | E10: =+I10+M10+Q10+U10+Y10+AC10 -> 0 | F10: =+(G10+H10)+I10*0.5 -> 19.53 | G10: 10.10 | H10: 9.43 | I10: 0 | J10: =+(K10+L10)+M10*0.5 -> 23.33 | K10: 16.66 | L10: 6.67 | M10: 0 | N10: =+(O10+P10)+Q10*0.5 -> 25.29 | O10: 15.88 | P10: 9.41 | Q10: 0 | R10: =+(S10+T10)+U10*0.5 -> 22.45 | S10: 10.79 | T10: 11.66 | U10: 0 | V10: =+(W10+X10)+Y10*0.5 -> 17.86 | W10: 10.33 | X10: 7.53 | Y10: 0 | Z10: =+(AA10+AB10)+AC10*0.5 -> 21.55 | AA10: 9.29 | AB10: 12.26 | AC10: 0
A11: 5 | B11: Huff, Blake | C11: P+A | D11: =+F11+J11+N11+R11+V11+Z11 -> 139.62 | E11: =+I11+M11+Q11+U11+Y11+AC11 -> 0 | F11: =+(G11+H11)+I11*0.5 -> 22.04 | G11: 14.84 | H11: 7.20 | I11: 0 | J11: =+(K11+L11)+M11*0.5 -> 24.50 | K11: 9.71 | L11: 14.79 | M11: 0 | N11: =+(O11+P11)+Q11*0.5 -> 25.60 | O11: 18.23 | P11: 7.37 | Q11: 0 | R11: =+(S11+T11)+U11*0.5 -> 19.35 | S11: 11.90 | T11: 7.45 | U11: 0 | V11: =+(W11+X11)+Y11*0.5 -> 27.29 | W11: 12.80 | X11: 14.49 | Y11: 0 | Z11: =+(AA11+AB11)+AC11*0.5 -> 20.84 | AA11: 11.20 | AB11: 9.64 | AC11: 0
A12: 6 | B12: Spicer, Robert | C12: P+A | D12: =+F12+J12+N12+R12+V12+Z12 -> 143.91 | E12: =+I12+M12+Q12+U12+Y12+AC12 -> 0 | F12: =+(G12+H12)+I12*0.5 -> 32.04 | G12: 21.80 | H12: 10.24 | I12: 0 | J12: =+(K12+L12)+M12*0.5 -> 18.98 | K12: 10.50 | L12: 8.48 | M12: 0 | N12: =+(O12+P12)+Q12*0.5 -> 24.56 | O12: 14.85 | P12: 9.71 | Q12: 0 | R12: =+(S12+T12)+U12*0.5 -> 17.20 | S12: 9.20 | T12: 8.00 | U12: 0 | V12: =+(W12+X12)+Y12*0.5 -> 25.90 | W12: 13.68 | X12: 12.22 | Y12: 0 | Z12: =+(AA12+AB12)+AC12*0.5 -> 25.23 | AA12: 14.58 | AB12: 10.65 | AC12: 0
A13: 7 | B13: Spicer, Richard | C13: P+A | D13: =+F13+J13+N13+R13+V13+Z13 -> 156.30 | E13: =+I13+M13+Q13+U13+Y13+AC13 -> 0 | F13: =+(G13+H13)+I13*0.5 -> 31.37 | G13: 24.14 | H13: 7.23 | I13: 0 | J13: =+(K13+L13)+M13*0.5 -> 24.25 | K13: 15.04 | L13: 9.21 | M13: 0 | N13: =+(O13+P13)+Q13*0.5 -> 21.56 | O13: 14.23 | P13: 7.33 | Q13: 0 | R13: =+(S13+T13)+U13*0.5 -> 25.19 | S13: 15.91 | T13: 9.28 | U13: 0 | V13: =+(W13+X13)+Y13*0.5 -> 24.97 | W13: 17.42 | X13: 7.55 | Y13: 0 | Z13: =+(AA13+AB13)+AC13*0.5 -> 28.96 | AA13: 17.23 | AB13: 11.73 | AC13: 0
A14: 8 | B14: Lorenz, David | C14: P+A | D14: =+F14+J14+N14+R14+V14+Z14 -> 180.15 | E14: =+I14+M14+Q14+U14+Y14+AC14 -> 0 | F14: =+(G14+H14)+I14*0.5 -> 20.47 | G14: 11.46 | H14: 9.01 | I14: 0 | J14: =+(K14+L14)+M14*0.5 -> 34.13 | K14: 17.55 | L14: 16.58 | M14: 0 | N14: =+(O14+P14)+Q14*0.5 -> 40.75 | O14: 25.47 | P14: 15.28 | Q14: 0 | R14: =+(S14+T14)+U14*0.5 -> 34.64 | S14: 24.42 | T14: 10.22 | U14: 0 | V14: =+(W14+X14)+Y14*0.5 -> 28.42 | W14: 18.44 | X14: 9.98 | Y14: 0 | Z14: =+(AA14+AB14)+AC14*0.5 -> 21.74 | AA14: 12.76 | AB14: 8.98 | AC14: 0
A15: 9 | B15: Huff, Scott | C15: P+A | D15: =+F15+J15+N15+R15+V15+Z15 -> 181.08 | E15: =+I15+M15+Q15+U15+Y15+AC15 -> 0 | F15: =+(G15+H15)+I15*0.5 -> 28.32 | G15: 11.73 | H15: 16.59 | I15: 0 | J15: =+(K15+L15)+M15*0.5 -> 37.52 | K15: 19.96 | L15: 17.56 | M15: 0 | N15: =+(O15+P15)+Q15*0.5 -> 37.65 | O15: 22.56 | P15: 15.09 | Q15: 0 | R15: =+(S15+T15)+U15*0.5 -> 21.23 | S15: 10.22 | T15: 11.01 | U15: 0 | V15: =+(W15+X15)+Y15*0.5 -> 25.79 | W15: 16.30 | X15: 9.49 | Y15: 0 | Z15: =+(AA15+AB15)+AC15*0.5 -> 30.57 | AA15: 18.00 | AB15: 12.57 | AC15: 0
A16: 10 | B16: Stone, Scott | C16: P+A | D16: =+F16+J16+N16+R16+V16+Z16 -> 184.66 | E16: =+I16+M16+Q16+U16+Y16+AC16 -> 0 | F16: =+(G16+H16)+I16*0.5 -> 36.79 | G16: 11.80 | H16: 24.99 | I16: 0 | J16: =+(K16+L16)+M16*0.5 -> 29.23 | K16: 15.71 | L16: 13.52 | M16: 0 | N16: =+(O16+P16)+Q16*0.5 -> 35.27 | O16: 13.96 | P16: 21.31 | Q16: 0 | R16: =+(S16+T16)+U16*0.5 -> 28.80 | S16: 13.22 | T16: 15.58 | U16: 0 | V16: =+(W16+X16)+Y16*0.5 -> 27.96 | W16: 9.30 | X16: 18.66 | Y16: 0 | Z16: =+(AA16+AB16)+AC16*0.5 -> 26.61 | AA16: 15.06 | AB16: 11.55 | AC16: 0
A17: 11 | B17: Wong, Hang | C17: P+A | D17: =+F17+J17+N17+R17+V17+Z17 -> 235.75 | E17: =+I17+M17+Q17+U17+Y17+AC17 -> 0 | F17: =+(G17+H17)+I17*0.5 -> 34.26 | G17: 25.50 | H17: 8.76 | I17: 0 | J17: =+(K17+L17)+M17*0.5 -> 42.32 | K17: 27.59 | L17: 14.73 | M17: 0 | N17: =+(O17+P17)+Q17*0.5 -> 55.41 | O17: 33.87 | P17: 21.54 | Q17: 0 | R17: =+(S17+T17)+U17*0.5 -> 33.32 | S17: 22.69 | T17: 10.63 | U17: 0 | V17: =+(W17+X17)+Y17*0.5 -> 36.41 | W17: 23.81 | X17: 12.60 | Y17: 0 | Z17: =+(AA17+AB17)+AC17*0.5 -> 34.03 | AA17: 23.29 | AB17: 10.74 | AC17: 0
A18: 12 | B18: Bridges, David | C18: P+A | D18: =+F18+J18+N18+R18+V18+Z18 -> 324.13 | E18: =+I18+M18+Q18+U18+Y18+AC18 -> 0 | F18: =+(G18+H18)+I18*0.5 -> 47.72 | G18: 22.80 | H18: 24.92 | I18: 0 | J18: =+(K18+L18)+M18*0.5 -> 48.56 | K18: 21.01 | L18: 27.55 | M18: 0 | N18: =+(O18+P18)+Q18*0.5 -> 83.02 | O18: 31.36 | P18: 51.66 | Q18: 0 | R18: =+(S18+T18)+U18*0.5 -> 48.81 | S18: 21.93 | T18: 26.88 | U18: 0 | V18: =+(W18+X18)+Y18*0.5 -> 49.84 | W18: 24.09 | X18: 25.75 | Y18: 0 | Z18: =+(AA18+AB18)+AC18*0.5 -> 46.18 | AA18: 20.62 | AB18: 25.56 | AC18: 0
A20: 1 | B20: Collins, Ken | C20: P+P | D20: =+F20+J20+N20+R20+V20+Z20 -> 115.52 | E20: =+I20+M20+Q20+U20+Y20+AC20 -> 0 | F20: =+(G20+H20)+I20*0.5 -> 18.22 | G20: 8.41 | H20: 9.81 | I20: 0 | J20: =+(K20+L20)+M20*0.5 -> 18.84 | K20: 9.04 | L20: 9.80 | M20: 0 | N20: =+(O20+P20)+Q20*0.5 -> 18.96 | O20: 7.39 | P20: 11.57 | Q20: 0 | R20: =+(S20+T20)+U20*0.5 -> 20.65 | S20: 10.12 | T20: 10.53 | U20: 0 | V20: =+(W20+X20)+Y20*0.5 -> 22.21 | W20: 8.63 | X20: 13.58 | Y20: 0 | Z20: =+(AA20+AB20)+AC20*0.5 -> 16.64 | AA20: 6.45 | AB20: 10.19 | AC20: 0
A21: 2 | B21: Ostler, Jeff | C21: P+P | D21: =+F21+J21+N21+R21+V21+Z21 -> 119.79 | E21: =+I21+M21+Q21+U21+Y21+AC21 -> 0 | F21: =+(G21+H21)+I21*0.5 -> 18.32 | G21: 10.83 | H21: 7.49 | I21: 0 | J21: =+(K21+L21)+M21*0.5 -> 23.07 | K21: 13.39 | L21: 9.68 | M21: 0 | N21: =+(O21+P21)+Q21*0.5 -> 22.36 | O21: 11.49 | P21: 10.87 | Q21: 0 | R21: =+(S21+T21)+U21*0.5 -> 15.75 | S21: 7.59 | T21: 8.16 | U21: 0 | V21: =+(W21+X21)+Y21*0.5 -> 21.90 | W21: 13.87 | X21: 8.03 | Y21: 0 | Z21: =+(AA21+AB21)+AC21*0.5 -> 18.39 | AA21: 11.31 | AB21: 7.08 | AC21: 0
A22: 3 | B22: Young, Ren | C22: P+P | D22: =+F22+J22+N22+R22+V22+Z22 -> 119.98 | E22: =+I22+M22+Q22+U22+Y22+AC22 -> 0 | F22: =+(G22+H22)+I22*0.5 -> 23.89 | G22: 11.66 | H22: 12.23 | I22: 0 | J22: =+(K22+L22)+M22*0.5 -> 20.50 | K22: 9.47 | L22: 11.03 | M22: 0 | N22: =+(O22+P22)+Q22*0.5 -> 17.30 | O22: 8.26 | P22: 9.04 | Q22: 0 | R22: =+(S22+T22)+U22*0.5 -> 20.11 | S22: 9.83 | T22: 10.28 | U22: 0 | V22: =+(W22+X22)+Y22*0.5 -> 18.84 | W22: 9.36 | X22: 9.48 | Y22: 0 | Z22: =+(AA22+AB22)+AC22*0.5 -> 19.34 | AA22: 9.15 | AB22: 10.19 | AC22: 0
A23: 4 | B23: Lowe, John | C23: P+P | D23: =+F23+J23+N23+R23+V23+Z23 -> 130.41 | E23: =+I23+M23+Q23+U23+Y23+AC23 -> 0 | F23: =+(G23+H23)+I23*0.5 -> 15.46 | G23: 8.52 | H23: 6.94 | I23: 0 | J23: =+(K23+L23)+M23*0.5 -> 25.39 | K23: 15.68 | L23: 9.71 | M23: 0 | N23: =+(O23+P23)+Q23*0.5 -> 30.29 | O23: 14.69 | P23: 15.60 | Q23: 0 | R23: =+(S23+T23)+U23*0.5 -> 24.88 | S23: 10.10 | T23: 14.78 | U23: 0 | V23: =+(W23+X23)+Y23*0.5 -> 18.91 | W23: 10.88 | X23: 8.03 | Y23: 0 | Z23: =+(AA23+AB23)+AC23*0.5 -> 15.48 | AA23: 8.25 | AB23: 7.23 | AC23: 0
A24: 5 | B24: Knapp, Chris | C24: P+P | D24: =+F24+J24+N24+R24+V24+Z24 -> 135.26 | E24: =+I24+M24+Q24+U24+Y24+AC24 -> 0 | F24: =+(G24+H24)+I24*0.5 -> 26.23 | G24: 16.58 | H24: 9.65 | I24: 0 | J24: =+(K24+L24)+M24*0.5 -> 18.00 | K24: 11.14 | L24: 6.86 | M24: 0 | N24: =+(O24+P24)+Q24*0.5 -> 25.80 | O24: 16.22 | P24: 9.58 | Q24: 0 | R24: =+(S24+T24)+U24*0.5 -> 16.11 | S24: 9.15 | T24: 6.96 | U24: 0 | V24: =+(W24+X24)+Y24*0.5 -> 31.31 | W24: 15.80 | X24: 15.51 | Y24: 0 | Z24: =+(AA24+AB24)+AC24*0.5 -> 17.81 | AA24: 9.54 | AB24: 8.27 | AC24: 0
A25: 6 | B25: Rodriguez, Mike | C25: P+P | D25: =+F25+J25+N25+R25+V25+Z25 -> 142.97 | E25: =+I25+M25+Q25+U25+Y25+AC25 -> 0 | F25: =+(G25+H25)+I25*0.5 -> 22.79 | G25: 13.31 | H25: 9.48 | I25: 0 | J25: =+(K25+L25)+M25*0.5 -> 25.43 | K25: 11.88 | L25: 13.55 | M25: 0 | N25: =+(O25+P25)+Q25*0.5 -> 29.88 | O25: 19.24 | P25: 10.64 | Q25: 0 | R25: =+(S25+T25)+U25*0.5 -> 19.91 | S25: 11.83 | T25: 8.08 | U25: 0 | V25: =+(W25+X25)+Y25*0.5 -> 26.86 | W25: 13.38 | X25: 13.48 | Y25: 0 | Z25: =+(AA25+AB25)+AC25*0.5 -> 18.10 | AA25: 10.52 | AB25: 7.58 | AC25: 0
A26: 7 | B26: Redford, Red | C26: P+P | D26: =+F26+J26+N26+R26+V26+Z26 -> 158.32 | E26: =+I26+M26+Q26+U26+Y26+AC26 -> 0 | F26: =+(G26+H26)+I26*0.5 -> 26.63 | G26: 9.08 | H26: 17.55 | I26: 0 | J26: =+(K26+L26)+M26*0.5 -> 22.53 | K26: 11.53 | L26: 11.00 | M26: 0 | N26: =+(O26+P26)+Q26*0.5 -> 31.23 | O26: 20.21 | P26: 11.02 | Q26: 0 | R26: =+(S26+T26)+U26*0.5 -> 21.51 | S26: 13.70 | T26: 7.81 | U26: 0 | V26: =+(W26+X26)+Y26*0.5 -> 27.78 | W26: 18.72 | X26: 9.06 | Y26: 0 | Z26: =+(AA26+AB26)+AC26*0.5 -> 28.64 | AA26: 18.90 | AB26: 9.74 | AC26: 0
A27: 8 | B27: Montgomery, Robert | C27: P+P | D27: =+F27+J27+N27+R27+V27+Z27 -> 159.95 | E27: =+I27+M27+Q27+U27+Y27+AC27 -> 0 | F27: =+(G27+H27)+I27*0.5 -> 28.30 | G27: 13.93 | H27: 14.37 | I27: 0 | J27: =+(K27+L27)+M27*0.5 -> 32.18 | K27: 17.02 | L27: 15.16 | M27: 0 | N27: =+(O27+P27)+Q27*0.5 -> 26.47 | O27: 14.52 | P27: 11.95 | Q27: 0 | R27: =+(S27+T27)+U27*0.5 -> 24.77 | S27: 10.38 | T27: 14.39 | U27: 0 | V27: =+(W27+X27)+Y27*0.5 -> 26.99 | W27: 9.60 | X27: 17.39 | Y27: 0 | Z27: =+(AA27+AB27)+AC27*0.5 -> 21.24 | AA27: 8.12 | AB27: 13.12 | AC27: 0
A28: 9 | B28: Deleeuw, Dave | C28: P+P | D28: =+F28+J28+N28+R28+V28+Z28 -> 180.11 | E28: =+I28+M28+Q28+U28+Y28+AC28 -> 0 | F28: =+(G28+H28)+I28*0.5 -> 31.75 | G28: 20.78 | H28: 10.97 | I28: 0 | J28: =+(K28+L28)+M28*0.5 -> 30.48 | K28: 12.80 | L28: 17.68 | M28: 0 | N28: =+(O28+P28)+Q28*0.5 -> 39.64 | O28: 14.53 | P28: 25.11 | Q28: 0 | R28: =+(S28+T28)+U28*0.5 -> 28.66 | S28: 16.56 | T28: 12.10 | U28: 0 | V28: =+(W28+X28)+Y28*0.5 -> 24.96 | W28: 13.31 | X28: 11.65 | Y28: 0 | Z28: =+(AA28+AB28)+AC28*0.5 -> 24.62 | AA28: 9.80 | AB28: 14.82 | AC28: 0
A29: 10 | B29: Durning, Will | C29: P+P | D29: =+F29+J29+N29+R29+V29+Z29 -> 220.69 | E29: =+I29+M29+Q29+U29+Y29+AC29 -> 0 | F29: =+(G29+H29)+I29*0.5 -> 29.13 | G29: 20.17 | H29: 8.96 | I29: 0 | J29: =+(K29+L29)+M29*0.5 -> 42.56 | K29: 24.04 | L29: 18.52 | M29: 0 | N29: =+(O29+P29)+Q29*0.5 -> 48.22 | O29: 27.32 | P29: 20.90 | Q29: 0 | R29: =+(S29+T29)+U29*0.5 -> 24.67 | S29: 13.94 | T29: 10.73 | U29: 0 | V29: =+(W29+X29)+Y29*0.5 -> 53.44 | W29: 41.54 | X29: 11.90 | Y29: 0 | Z29: =+(AA29+AB29)+AC29*0.5 -> 22.67 | AA29: 10.91 | AB29: 11.76 | AC29: 0
A30: 11 | B30: Harrison, Mike | C30: P+P | D30: =+F30+J30+N30+R30+V30+Z30 -> 238.41 | E30: =+I30+M30+Q30+U30+Y30+AC30 -> 0 | F30: =+(G30+H30)+I30*0.5 -> 40.86 | G30: 27.18 | H30: 13.68 | I30: 0 | J30: =+(K30+L30)+M30*0.5 -> 53.86 | K30: 35.40 | L30: 18.46 | M30: 0 | N30: =+(O30+P30)+Q30*0.5 -> 39.46 | O30: 18.96 | P30: 20.50 | Q30: 0 | R30: =+(S30+T30)+U30*0.5 -> 36.29 | S30: 21.70 | T30: 14.59 | U30: 0 | V30: =+(W30+X30)+Y30*0.5 -> 32.86 | W30: 20.35 | X30: 12.51 | Y30: 0 | Z30: =+(AA30+AB30)+AC30*0.5 -> 35.08 | AA30: 21.99 | AB30: 13.09 | AC30: 0
A31: 12 | B31: Burden, Pat | C31: P+P | D31: =+F31+J31+N31+R31+V31+Z31 -> 249.33 | E31: =+I31+M31+Q31+U31+Y31+AC31 -> 0 | F31: =+(G31+H31)+I31*0.5 -> 51.17 | G31: 18.78 | H31: 32.39 | I31: 0 | J31: =+(K31+L31)+M31*0.5 -> 39.18 | K31: 20.30 | L31: 18.88 | M31: 0 | N31: =+(O31+P31)+Q31*0.5 -> 50.18 | O31: 16.98 | P31: 33.20 | Q31: 0 | R31: =+(S31+T31)+U31*0.5 -> 33.94 | S31: 16.96 | T31: 16.98 | U31: 0 | V31: =+(W31+X31)+Y31*0.5 -> 37.53 | W31: 17.32 | X31: 20.21 | Y31: 0 | Z31: =+(AA31+AB31)+AC31*0.5 -> 37.33 | AA31: 17.29 | AB31: 20.04 | AC31: 0
A32: 13 | B32: Peters, Buddy | C32: P+P | D32: =+F32+J32+N32+R32+V32+Z32 -> 272.58 | E32: =+I32+M32+Q32+U32+Y32+AC32 -> 60 | F32: =+(G32+H32)+I32*0.5 -> 68.99 | G32: 51.79 | H32: 17.20 | I32: 0 | J32: =+(K32+L32)+M32*0.5 -> 40.36 | K32: 25.76 | L32: 14.60 | M32: 0 | N32: =+(O32+P32)+Q32*0.5 -> 53.02 | O32: 10.00 | P32: 13.02 | Q32: 60 | R32: =+(S32+T32)+U32*0.5 -> 29.15 | S32: 14.97 | T32: 14.18 | U32: 0 | V32: =+(W32+X32)+Y32*0.5 -> 29.27 | W32: 15.65 | X32: 13.62 | Y32: 0 | Z32: =+(AA32+AB32)+AC32*0.5 -> 51.79 | AA32: 38.92 | AB32: 12.87 | AC32: 0
A33: 14 | B33: Nielsen, Todd | C33: P+P | D33: =+F33+J33+N33+R33+V33+Z33 -> 420.27 | E33: =+I33+M33+Q33+U33+Y33+AC33 -> 0 | F33: =+(G33+H33)+I33*0.5 -> 101.07 | G33: 53.71 | H33: 47.36 | I33: 0 | J33: =+(K33+L33)+M33*0.5 -> 82.07 | K33: 51.25 | L33: 30.82 | M33: 0 | N33: =+(O33+P33)+Q33*0.5 -> 85.27 | O33: 50.12 | P33: 35.15 | Q33: 0 | R33: =+(S33+T33)+U33*0.5 -> 64.06 | S33: 42.91 | T33: 21.15 | U33: 0 | V33: =+(W33+X33)+Y33*0.5 -> 47.05 | W33: 29.67 | X33: 17.38 | Y33: 0 | Z33: =+(AA33+AB33)+AC33*0.5 -> 40.75 | AA33: 25.70 | AB33: 15.05 | AC33: 0
A34: 15 | B34: McDermaid, Jen | C34: P+P | D34: =+F34+J34+N34+R34+V34+Z34 -> 443.43 | E34: =+I34+M34+Q34+U34+Y34+AC34 -> 10 | F34: =+(G34+H34)+I34*0.5 -> 122.56 | G34: 66.01 | H34: 51.55 | I34: 10 | J34: =+(K34+L34)+M34*0.5 -> 67.26 | K34: 34.26 | L34: 33.00 | M34: 0 | N34: =+(O34+P34)+Q34*0.5 -> 92.63 | O34: 65.52 | P34: 27.11 | Q34: 0 | R34: =+(S34+T34)+U34*0.5 -> 46.97 | S34: 26.52 | T34: 20.45 | U34: 0 | V34: =+(W34+X34)+Y34*0.5 -> 58.13 | W34: 32.37 | X34: 25.76 | Y34: 0 | Z34: =+(AA34+AB34)+AC34*0.5 -> 55.88 | AA34: 26.69 | AB34: 29.19 | AC34: 0
A36: 1 | B36: Boyer, Steve | C36: PO | D36: =+F36+J36+N36+R36+V36+Z36 -> 160.47 | E36: =+I36+M36+Q36+U36+Y36+AC36 -> 0 | F36: =+(G36+H36)+I36*0.5 -> 21.04 | G36: 10.73 | H36: 10.31 | I36: 0 | J36: =+(K36+L36)+M36*0.5 -> 36.83 | K36: 22.71 | L36: 14.12 | M36: 0 | N36: =+(O36+P36)+Q36*0.5 -> 24.58 | O36: 9.44 | P36: 15.14 | Q36: 0 | R36: =+(S36+T36)+U36*0.5 -> 30.93 | S36: 16.95 | T36: 13.98 | U36: 0 | V36: =+(W36+X36)+Y36*0.5 -> 25.72 | W36: 16.42 | X36: 9.30 | Y36: 0 | Z36: =+(AA36+AB36)+AC36*0.5 -> 21.37 | AA36: 11.24 | AB36: 10.13 | AC36: 0
A37: 2 | B37: Vollmer, Phil | C37: PO | D37: =+F37+J37+N37+R37+V37+Z37 -> 162.56 | E37: =+I37+M37+Q37+U37+Y37+AC37 -> 0 | F37: =+(G37+H37)+I37*0.5 -> 32.01 | G37: 17.24 | H37: 14.77 | I37: 0 | J37: =+(K37+L37)+M37*0.5 -> 43.73 | K37: 15.35 | L37: 28.38 | M37: 0 | N37: =+(O37+P37)+Q37*0.5 -> 20.79 | O37: 9.62 | P37: 11.17 | Q37: 0 | R37: =+(S37+T37)+U37*0.5 -> 23.14 | S37: 9.07 | T37: 14.07 | U37: 0 | V37: =+(W37+X37)+Y37*0.5 -> 17.06 | W37: 8.88 | X37: 8.18 | Y37: 0 | Z37: =+(AA37+AB37)+AC37*0.5 -> 25.83 | AA37: 7.82 | AB37: 18.01 | AC37: 0
A38: 3 | B38: Lauritzen, Scott | C38: PO | D38: =+F38+J38+N38+R38+V38+Z38 -> 194.80 | E38: =+I38+M38+Q38+U38+Y38+AC38 -> 0 | F38: =+(G38+H38)+I38*0.5 -> 34.33 | G38: 16.53 | H38: 17.80 | I38: 0 | J38: =+(K38+L38)+M38*0.5 -> 32.80 | K38: 16.09 | L38: 16.71 | M38: 0 | N38: =+(O38+P38)+Q38*0.5 -> 54.96 | O38: 11.69 | P38: 43.27 | Q38: 0 | R38: =+(S38+T38)+U38*0.5 -> 24.87 | S38: 12.76 | T38: 12.11 | U38: 0 | V38: =+(W38+X38)+Y38*0.5 -> 20.99 | W38: 10.93 | X38: 10.06 | Y38: 0 | Z38: =+(AA38+AB38)+AC38*0.5 -> 26.85 | AA38: 13.72 | AB38: 13.13 | AC38: 0
A39: 4 | B39: Tuft, Tom | C39: PO | D39: =+F39+J39+N39+R39+V39+Z39 -> 210.65 | E39: =+I39+M39+Q39+U39+Y39+AC39 -> 0 | F39: =+(G39+H39)+I39*0.5 -> 34.19 | G39: 15.84 | H39: 18.35 | I39: 0 | J39: =+(K39+L39)+M39*0.5 -> 34.92 | K39: 15.05 | L39: 19.87 | M39: 0 | N39: =+(O39+P39)+Q39*0.5 -> 37.32 | O39: 20.76 | P39: 16.56 | Q39: 0 | R39: =+(S39+T39)+U39*0.5 -> 41.29 | S39: 26.52 | T39: 14.77 | U39: 0 | V39: =+(W39+X39)+Y39*0.5 -> 27.07 | W39: 15.22 | X39: 11.85 | Y39: 0 | Z39: =+(AA39+AB39)+AC39*0.5 -> 35.86 | AA39: 16.08 | AB39: 19.78 | AC39: 0
A40: 5 | B40: Phillips, RDan | C40: PO | D40: =+F40+J40+N40+R40+V40+Z40 -> 218.36 | E40: =+I40+M40+Q40+U40+Y40+AC40 -> 0 | F40: =+(G40+H40)+I40*0.5 -> 51.76 | G40: 31.42 | H40: 20.34 | I40: 0 | J40: =+(K40+L40)+M40*0.5 -> 37.77 | K40: 19.13 | L40: 18.64 | M40: 0 | N40: =+(O40+P40)+Q40*0.5 -> 33.28 | O40: 17.99 | P40: 15.29 | Q40: 0 | R40: =+(S40+T40)+U40*0.5 -> 40.92 | S40: 19.62 | T40: 21.30 | U40: 0 | V40: =+(W40+X40)+Y40*0.5 -> 33.82 | W40: 12.62 | X40: 21.20 | Y40: 0 | Z40: =+(AA40+AB40)+AC40*0.5 -> 20.81 | AA40: 11.17 | AB40: 9.64 | AC40: 0
A41: 6 | B41: Wickersham, Chase | C41: PO | D41: =+F41+J41+N41+R41+V41+Z41 -> 218.47 | E41: =+I41+M41+Q41+U41+Y41+AC41 -> 0 | F41: =+(G41+H41)+I41*0.5 -> 45.94 | G41: 25.03 | H41: 20.91 | I41: 0 | J41: =+(K41+L41)+M41*0.5 -> 33.14 | K41: 18.19 | L41: 14.95 | M41: 0 | N41: =+(O41+P41)+Q41*0.5 -> 40.18 | O41: 18.64 | P41: 21.54 | Q41: 0 | R41: =+(S41+T41)+U41*0.5 -> 34.58 | S41: 19.65 | T41: 14.93 | U41: 0 | V41: =+(W41+X41)+Y41*0.5 -> 25.81 | W41: 13.25 | X41: 12.56 | Y41: 0 | Z41: =+(AA41+AB41)+AC41*0.5 -> 38.82 | AA41: 22.22 | AB41: 16.60 | AC41: 0
A42: 7 | B42: Kirkham, Bart | C42: PO | D42: =+F42+J42+N42+R42+V42+Z42 -> 232.58 | E42: =+I42+M42+Q42+U42+Y42+AC42 -> 0 | F42: =+(G42+H42)+I42*0.5 -> 35.64 | G42: 15.50 | H42: 20.14 | I42: 0 | J42: =+(K42+L42)+M42*0.5 -> 57.27 | K42: 34.37 | L42: 22.90 | M42: 0 | N42: =+(O42+P42)+Q42*0.5 -> 31.01 | O42: 14.20 | P42: 16.81 | Q42: 0 | R42: =+(S42+T42)+U42*0.5 -> 46.44 | S42: 23.94 | T42: 22.50 | U42: 0 | V42: =+(W42+X42)+Y42*0.5 -> 27.37 | W42: 13.90 | X42: 13.47 | Y42: 0 | Z42: =+(AA42+AB42)+AC42*0.5 -> 34.85 | AA42: 19.49 | AB42: 15.36 | AC42: 0
A43: 8 | B43: Tucker, Ben | C43: PO | D43: =+F43+J43+N43+R43+V43+Z43 -> 232.62 | E43: =+I43+M43+Q43+U43+Y43+AC43 -> 0 | F43: =+(G43+H43)+I43*0.5 -> 26.82 | G43: 11.69 | H43: 15.13 | I43: 0 | J43: =+(K43+L43)+M43*0.5 -> 42.73 | K43: 21.01 | L43: 21.72 | M43: 0 | N43: =+(O43+P43)+Q43*0.5 -> 35.58 | O43: 20.86 | P43: 14.72 | Q43: 0 | R43: =+(S43+T43)+U43*0.5 -> 31.65 | S43: 17.34 | T43: 14.31 | U43: 0 | V43: =+(W43+X43)+Y43*0.5 -> 59.64 | W43: 34.84 | X43: 24.80 | Y43: 0 | Z43: =+(AA43+AB43)+AC43*0.5 -> 36.20 | AA43: 24.61 | AB43: 11.59 | AC43: 0
A44: 9 | B44: Hill, Randy | C44: PO | D44: =+F44+J44+N44+R44+V44+Z44 -> 244.29 | E44: =+I44+M44+Q44+U44+Y44+AC44 -> 0 | F44: =+(G44+H44)+I44*0.5 -> 60.17 | G44: 30.92 | H44: 29.25 | I44: 0 | J44: =+(K44+L44)+M44*0.5 -> 41.43 | K44: 24.13 | L44: 17.30 | M44: 0 | N44: =+(O44+P44)+Q44*0.5 -> 46.35 | O44: 24.43 | P44: 21.92 | Q44: 0 | R44: =+(S44+T44)+U44*0.5 -> 32.65 | S44: 18.68 | T44: 13.97 | U44: 0 | V44: =+(W44+X44)+Y44*0.5 -> 42.31 | W44: 25.89 | X44: 16.42 | Y44: 0 | Z44: =+(AA44+AB44)+AC44*0.5 -> 21.38 | AA44: 11.23 | AB44: 10.15 | AC44: 0
A45: 10 | B45: Dahl, Wes | C45: PO | D45: =+F45+J45+N45+R45+V45+Z45 -> 245.15 | E45: =+I45+M45+Q45+U45+Y45+AC45 -> 0 | F45: =+(G45+H45)+I45*0.5 -> 54.59 | G45: 34.65 | H45: 19.94 | I45: 0 | J45: =+(K45+L45)+M45*0.5 -> 50.33 | K45: 31.88 | L45: 18.45 | M45: 0 | N45: =+(O45+P45)+Q45*0.5 -> 51.58 | O45: 25.61 | P45: 25.97 | Q45: 0 | R45: =+(S45+T45)+U45*0.5 -> 29.87 | S45: 14.93 | T45: 14.94 | U45: 0 | V45: =+(W45+X45)+Y45*0.5 -> 26.56 | W45: 15.15 | X45: 11.41 | Y45: 0 | Z45: =+(AA45+AB45)+AC45*0.5 -> 32.22 | AA45: 18.21 | AB45: 14.01 | AC45: 0
A46: 11 | B46: Willes, Chris | C46: PO | D46: =+F46+J46+N46+R46+V46+Z46 -> 292.79 | E46: =+I46+M46+Q46+U46+Y46+AC46 -> 20 | F46: =+(G46+H46)+I46*0.5 -> 57.79 | G46: 11.66 | H46: 36.13 | I46: 20 | J46: =+(K46+L46)+M46*0.5 -> 44.08 | K46: 23.85 | L46: 20.23 | M46: 0 | N46: =+(O46+P46)+Q46*0.5 -> 52.28 | O46: 22.68 | P46: 29.60 | Q46: 0 | R46: =+(S46+T46)+U46*0.5 -> 46.07 | S46: 20.94 | T46: 25.13 | U46: 0 | V46: =+(W46+X46)+Y46*0.5 -> 53.43 | W46: 32.04 | X46: 21.39 | Y46: 0 | Z46: =+(AA46+AB46)+AC46*0.5 -> 39.14 | AA46: 18.47 | AB46: 20.67 | AC46: 0
A47: 12 | B47: Kirkham, Glade | C47: PO | D47: =+F47+J47+N47+R47+V47+Z47 -> 302.97 | E47: =+I47+M47+Q47+U47+Y47+AC47 -> 0 | F47: =+(G47+H47)+I47*0.5 -> 43.52 | G47: 22.43 | H47: 21.09 | I47: 0 | J47: =+(K47+L47)+M47*0.5 -> 60.86 | K47: 38.18 | L47: 22.68 | M47: 0 | N47: =+(O47+P47)+Q47*0.5 -> 59.09 | O47: 29.15 | P47: 29.94 | Q47: 0 | R47: =+(S47+T47)+U47*0.5 -> 52.41 | S47: 25.86 | T47: 26.55 | U47: 0 | V47: =+(W47+X47)+Y47*0.5 -> 47.70 | W47: 23.74 | X47: 23.96 | Y47: 0 | Z47: =+(AA47+AB47)+AC47*0.5 -> 39.39 | AA47: 20.22 | AB47: 19.17 | AC47: 0
A48: 13 | B48: Durham, Dan | C48: PO | D48: =+F48+J48+N48+R48+V48+Z48 -> 389.90 | E48: =+I48+M48+Q48+U48+Y48+AC48 -> 0 | F48: =+(G48+H48)+I48*0.5 -> 92.43 | G48: 42.79 | H48: 49.64 | I48: 0 | J48: =+(K48+L48)+M48*0.5 -> 69.82 | K48: 45.10 | L48: 24.72 | M48: 0 | N48: =+(O48+P48)+Q48*0.5 -> 64.31 | O48: 48.89 | P48: 15.42 | Q48: 0 | R48: =+(S48+T48)+U48*0.5 -> 71.62 | S48: 39.70 | T48: 31.92 | U48: 0 | V48: =+(W48+X48)+Y48*0.5 -> 49.41 | W48: 26.32 | X48: 23.09 | Y48: 0 | Z48: =+(AA48+AB48)+AC48*0.5 -> 42.31 | AA48: 22.16 | AB48: 20.15 | AC48: 0
A49: 14 | B49: Brownlee, Mike | C49: PO | D49: =+F49+J49+N49+R49+V49+Z49 -> 403.50 | E49: =+I49+M49+Q49+U49+Y49+AC49 -> 0 | F49: =+(G49+H49)+I49*0.5 -> 59.31 | G49: 35.47 | H49: 23.84 | I49: 0 | J49: =+(K49+L49)+M49*0.5 -> 58.44 | K49: 23.65 | L49: 34.79 | M49: 0 | N49: =+(O49+P49)+Q49*0.5 -> 106.24 | O49: 53.38 | P49: 52.86 | Q49: 0 | R49: =+(S49+T49)+U49*0.5 -> 85.08 | S49: 41.98 | T49: 43.10 | U49: 0 | V49: =+(W49+X49)+Y49*0.5 -> 52.46 | W49: 16.86 | X49: 35.60 | Y49: 0 | Z49: =+(AA49+AB49)+AC49*0.5 -> 41.97 | AA49: 24.18 | AB49: 17.79 | AC49: 0
A50: 15 | B50: Messinger, Olivia | C50: PO | D50: =+F50+J50+N50+R50+V50+Z50 -> 438.93 | E50: =+I50+M50+Q50+U50+Y50+AC50 -> 0 | F50: =+(G50+H50)+I50*0.5 -> 75.06 | G50: 37.76 | H50: 37.30 | I50: 0 | J50: =+(K50+L50)+M50*0.5 -> 66.74 | K50: 32.38 | L50: 34.36 | M50: 0 | N50: =+(O50+P50)+Q50*0.5 -> 75.63 | O50: 44.29 | P50: 31.34 | Q50: 0 | R50: =+(S50+T50)+U50*0.5 -> 86.32 | S50: 46.92 | T50: 39.40 | U50: 0 | V50: =+(W50+X50)+Y50*0.5 -> 73.57 | W50: 37.62 | X50: 35.95 | Y50: 0 | Z50: =+(AA50+AB50)+AC50*0.5 -> 61.61 | AA50: 33.03 | AB50: 28.58 | AC50: 0
A51: 16 | B51: Tucker, Jake | C51: PO | D51: =+F51+J51+N51+R51+V51+Z51 -> 467.18 | E51: =+I51+M51+Q51+U51+Y51+AC51 -> 0 | F51: =+(G51+H51)+I51*0.5 -> 97.56 | G51: 44.43 | H51: 53.13 | I51: 0 | J51: =+(K51+L51)+M51*0.5 -> 124.94 | K51: 47.01 | L51: 77.93 | M51: 0 | N51: =+(O51+P51)+Q51*0.5 -> 94.45 | O51: 67.60 | P51: 26.85 | Q51: 0 | R51: =+(S51+T51)+U51*0.5 -> 61.75 | S51: 31.72 | T51: 30.03 | U51: 0 | V51: =+(W51+X51)+Y51*0.5 -> 50.73 | W51: 23.40 | X51: 27.33 | Y51: 0 | Z51: =+(AA51+AB51)+AC51*0.5 -> 37.75 | AA51: 23.56 | AB51: 14.19 | AC51: 0
A52: 17 | B52: Kirkham, Devon (.22) | C52: PO | D52: =+F52+J52+N52+R52+V52+Z52 -> 503.17 | E52: =+I52+M52+Q52+U52+Y52+AC52 -> 0 | F52: =+(G52+H52)+I52*0.5 -> 85.01 | G52: 44.18 | H52: 40.83 | I52: 0 | J52: =+(K52+L52)+M52*0.5 -> 76.17 | K52: 35.75 | L52: 40.42 | M52: 0 | N52: =+(O52+P52)+Q52*0.5 -> 135.65 | O52: 74.49 | P52: 61.16 | Q52: 0 | R52: =+(S52+T52)+U52*0.5 -> 65.69 | S52: 42.65 | T52: 23.04 | U52: 0 | V52: =+(W52+X52)+Y52*0.5 -> 63.34 | W52: 29.83 | X52: 33.51 | Y52: 0 | Z52: =+(AA52+AB52)+AC52*0.5 -> 77.31 | AA52: 40.03 | AB52: 37.28 | AC52: 0
A53: 18 | B53: Messinger, Bonnie | C53: PO | D53: =+F53+J53+N53+R53+V53+Z53 -> 547.17 | E53: =+I53+M53+Q53+U53+Y53+AC53 -> 0 | F53: =+(G53+H53)+I53*0.5 -> 94.58 | G53: 42.62 | H53: 51.96 | I53: 0 | J53: =+(K53+L53)+M53*0.5 -> 82.87 | K53: 46.34 | L53: 36.53 | M53: 0 | N53: =+(O53+P53)+Q53*0.5 -> 102.15 | O53: 41.06 | P53: 61.09 | Q53: 0 | R53: =+(S53+T53)+U53*0.5 -> 103.71 | S53: 56.32 | T53: 47.39 | U53: 0 | V53: =+(W53+X53)+Y53*0.5 -> 93.20 | W53: 51.78 | X53: 41.42 | Y53: 0 | Z53: =+(AA53+AB53)+AC53*0.5 -> 70.66 | AA53: 35.04 | AB53: 35.62 | AC53: 0
A54: 19 | B54: Stone, Marylee | C54: PO | D54: =+F54+J54+N54+R54+V54+Z54 -> 1200.74 | E54: =+I54+M54+Q54+U54+Y54+AC54 -> 40 | F54: =+(G54+H54)+I54*0.5 -> 269.65 | G54: 145.80 | H54: 123.85 | I54: 0 | J54: =+(K54+L54)+M54*0.5 -> 284.73 | K54: 184.66 | L54: 100.07 | M54: 0 | N54: =+(O54+P54)+Q54*0.5 -> 279.49 | O54: 145.14 | P54: 134.35 | Q54: 0 | R54: =+(S54+T54)+U54*0.5 -> 170.21 | S54: 62.83 | T54: 92.38 | U54: 30 | V54: =+(W54+X54)+Y54*0.5 -> 139.39 | W54: 94.04 | X54: 40.35 | Y54: 10 | Z54: =+(AA54+AB54)+AC54*0.5 -> 57.27 | AA54: 32.40 | AB54: 24.87 | AC54: 0
A56: 1 | B56: Redford, Red | C56: RO | D56: =+F56+J56+N56+R56+V56+Z56 -> 219.05 | E56: =+I56+M56+Q56+U56+Y56+AC56 -> 0 | F56: =+(G56+H56)+I56*0.5 -> 32.31 | G56: 16.37 | H56: 15.94 | I56: 0 | J56: =+(K56+L56)+M56*0.5 -> 44.81 | K56: 22.55 | L56: 22.26 | M56: 0 | N56: =+(O56+P56)+Q56*0.5 -> 39.47 | O56: 16.54 | P56: 22.93 | Q56: 0 | R56: =+(S56+T56)+U56*0.5 -> 30.88 | S56: 14.45 | T56: 16.43 | U56: 0 | V56: =+(W56+X56)+Y56*0.5 -> 41.26 | W56: 25.32 | X56: 15.94 | Y56: 0 | Z56: =+(AA56+AB56)+AC56*0.5 -> 30.32 | AA56: 15.10 | AB56: 15.22 | AC56: 0
A57: Notes:
A58: xx | B58: Indicates that the Points Down value includes some kind of penalty (Procedural Error or Misses on Steel).
A59: PD | B59: = Points Down value is PD x 5 seconds added to the total stage time.
A60: *DIV | B60: = Divisions: PO = Pistol Only; RO = Revolver Only; P+P = Pistol-Pump Shotgun; R+P = Revolver-Pump Shotgun; P+A Pistol/Auto Shotgun; R+A = Revolver/Auto Shotgun
A62: DNF | B62: = Did Not Finish