A1: Utah Shooting Academy August 11, 2004
A2: OVERALL SCORES (Includes procedurals and hits on non-threat)
A3: Number | B3: Name | C3: Match | D3: Stage1 | E3: Stage 2 | F3: Stage 3 | G3: Stage 4
A4: 1 | B4: ='[August 1 2004.xls]S5'!$B$1 -> Ari T | C4: ='[August 1 2004.xls]S5'!$F$27 -> 80.62 | D4: ='[August 1 2004.xls]S5'!B$27 -> 6.56 | E4: ='[August 1 2004.xls]S5'!C$27 -> 2.84 | F4: ='[August 1 2004.xls]S5'!D$27 -> 17.55 | G4: ='[August 1 2004.xls]S5'!E$27 -> 53.67
A5: 2 | B5: ='[August 1 2004.xls]S4'!$B$1 -> Craig Outzen | C5: ='[August 1 2004.xls]S4'!$F$27 -> 85.72 | D5: ='[August 1 2004.xls]S4'!B$27 -> 8.06 | E5: ='[August 1 2004.xls]S4'!C$27 -> 3.21 | F5: ='[August 1 2004.xls]S4'!D$27 -> 21.63 | G5: ='[August 1 2004.xls]S4'!E$27 -> 52.82
A6: 3 | B6: ='[August 1 2004.xls]S12'!$B$1 -> Mike Rodriquez | C6: ='[August 1 2004.xls]S12'!$F$27 -> 104.90 | D6: ='[August 1 2004.xls]S12'!B$27 -> 11.41 | E6: ='[August 1 2004.xls]S12'!C$27 -> 6.18 | F6: ='[August 1 2004.xls]S12'!D$27 -> 27.95 | G6: ='[August 1 2004.xls]S12'!E$27 -> 59.36
A7: 4 | B7: ='[August 1 2004.xls]S13'!$B$1 -> John Diamond | C7: ='[August 1 2004.xls]S13'!$F$27 -> 114.21 | D7: ='[August 1 2004.xls]S13'!B$27 -> 11.10 | E7: ='[August 1 2004.xls]S13'!C$27 -> 5.91 | F7: ='[August 1 2004.xls]S13'!D$27 -> 34.22 | G7: ='[August 1 2004.xls]S13'!E$27 -> 62.98
A8: 5 | B8: ='[August 1 2004.xls]S6'!$B$1 -> Red Redford (Auto) | C8: ='[August 1 2004.xls]S6'!$F$27 -> 116.05 | D8: ='[August 1 2004.xls]S6'!B$27 -> 9.45 | E8: ='[August 1 2004.xls]S6'!C$27 -> 3.43 | F8: ='[August 1 2004.xls]S6'!D$27 -> 34.31 | G8: ='[August 1 2004.xls]S6'!E$27 -> 68.86
A9: 6 | B9: ='[August 1 2004.xls]S2'!$B$1 -> Randy Hill | C9: ='[August 1 2004.xls]S2'!$F$27 -> 116.47 | D9: ='[August 1 2004.xls]S2'!B$27 -> 11.77 | E9: ='[August 1 2004.xls]S2'!C$27 -> 3.51 | F9: ='[August 1 2004.xls]S2'!D$27 -> 25.13 | G9: ='[August 1 2004.xls]S2'!E$27 -> 76.06
A10: 7 | B10: ='[August 1 2004.xls]S8'!$B$1 -> Red Redford (Rev) | C10: ='[August 1 2004.xls]S8'!$F$27 -> 120.55 | D10: ='[August 1 2004.xls]S8'!B$27 -> 13.50 | E10: ='[August 1 2004.xls]S8'!C$27 -> 4.59 | F10: ='[August 1 2004.xls]S8'!D$27 -> 31.78 | G10: ='[August 1 2004.xls]S8'!E$27 -> 70.68
A11: 8 | B11: ='[August 1 2004.xls]S1'!$B$1 -> Roger Mousley | C11: ='[August 1 2004.xls]S1'!$F$27 -> 122.37 | D11: ='[August 1 2004.xls]S1'!B$27 -> 11.16 | E11: ='[August 1 2004.xls]S1'!C$27 -> 3.27 | F11: ='[August 1 2004.xls]S1'!D$27 -> 33.78 | G11: ='[August 1 2004.xls]S1'!E$27 -> 74.16
A12: 9 | B12: ='[August 1 2004.xls]S9'!$B$1 -> Dave Duncan | C12: ='[August 1 2004.xls]S9'!$F$27 -> 123.19 | D12: ='[August 1 2004.xls]S9'!B$27 -> 14.19 | E12: ='[August 1 2004.xls]S9'!C$27 -> 4.06 | F12: ='[August 1 2004.xls]S9'!D$27 -> 30.66 | G12: ='[August 1 2004.xls]S9'!E$27 -> 74.28
A13: 10 | B13: ='[August 1 2004.xls]S11'!$B$1 -> Carl Burney | C13: ='[August 1 2004.xls]S11'!$F$27 -> 130.11 | D13: ='[August 1 2004.xls]S11'!B$27 -> 12.44 | E13: ='[August 1 2004.xls]S11'!C$27 -> 5.57 | F13: ='[August 1 2004.xls]S11'!D$27 -> 27.35 | G13: ='[August 1 2004.xls]S11'!E$27 -> 84.75
A14: 11 | B14: ='[August 1 2004.xls]S7'!$B$1 -> Dave Duncan | C14: ='[August 1 2004.xls]S7'!$F$27 -> 139.51 | D14: ='[August 1 2004.xls]S7'!B$27 -> 19.10 | E14: ='[August 1 2004.xls]S7'!C$27 -> 4.48 | F14: ='[August 1 2004.xls]S7'!D$27 -> 33.35 | G14: ='[August 1 2004.xls]S7'!E$27 -> 82.58
A15: 12 | B15: ='[August 1 2004.xls]S3'!$B$1 -> Danimal | C15: ='[August 1 2004.xls]S3'!$F$27 -> 151.75 | D15: ='[August 1 2004.xls]S3'!B$27 -> 19.09 | E15: ='[August 1 2004.xls]S3'!C$27 -> 4.60 | F15: ='[August 1 2004.xls]S3'!D$27 -> 31.81 | G15: ='[August 1 2004.xls]S3'!E$27 -> 96.25
A16: 13 | B16: ='[August 1 2004.xls]S10'!$B$1 -> Erin Herring | C16: ='[August 1 2004.xls]S10'!$F$27 -> 162.60 | D16: ='[August 1 2004.xls]S10'!B$27 -> 20.23 | E16: ='[August 1 2004.xls]S10'!C$27 -> 3.93 | F16: ='[August 1 2004.xls]S10'!D$27 -> 43.24 | G16: ='[August 1 2004.xls]S10'!E$27 -> 95.20
A17: Overall Average: | C17: =SUM(C4:C16)/13 -> 120.61923076923077 | D17: =SUM(D4:D16)/13 -> 12.927692307692306 | E17: =SUM(E4:E16)/13 -> 4.2753846153846151 | F17: =SUM(F4:F16)/13 -> 30.2123076923077 | G17: =SUM(G4:G16)/13 -> 73.203846153846158
A18: RAW TIMES
A19: Number | B19: Name | C19: Match | D19: Stage1 | E19: Stage 2 | F19: Stage 3 | G19: Stage 4
A20: 1 | B20: ='[August 1 2004.xls]S5'!$B$1 -> Ari T | C20: ='[August 1 2004.xls]S5'!$F$23 -> 68.12 | D20: ='[August 1 2004.xls]S5'!B$23 -> 6.56 | E20: ='[August 1 2004.xls]S5'!C$23 -> 2.84 | F20: ='[August 1 2004.xls]S5'!D$23 -> 14.55 | G20: ='[August 1 2004.xls]S5'!E$23 -> 44.17
A21: 2 | B21: ='[August 1 2004.xls]S4'!$B$1 -> Craig Outzen | C21: ='[August 1 2004.xls]S4'!$F$23 -> 72.22 | D21: ='[August 1 2004.xls]S4'!B$23 -> 8.06 | E21: ='[August 1 2004.xls]S4'!C$23 -> 2.71 | F21: ='[August 1 2004.xls]S4'!D$23 -> 14.63 | G21: ='[August 1 2004.xls]S4'!E$23 -> 46.82
A22: 3 | B22: ='[August 1 2004.xls]S12'!$B$1 -> Mike Rodriquez | C22: ='[August 1 2004.xls]S12'!$F$23 -> 94.40 | D22: ='[August 1 2004.xls]S12'!B$23 -> 8.41 | E22: ='[August 1 2004.xls]S12'!C$23 -> 4.68 | F22: ='[August 1 2004.xls]S12'!D$23 -> 24.45 | G22: ='[August 1 2004.xls]S12'!E$23 -> 56.86
A23: 4 | B23: ='[August 1 2004.xls]S2'!$B$1 -> Randy Hill | C23: ='[August 1 2004.xls]S2'!$F$23 -> 100.97 | D23: ='[August 1 2004.xls]S2'!B$23 -> 10.77 | E23: ='[August 1 2004.xls]S2'!C$23 -> 3.51 | F23: ='[August 1 2004.xls]S2'!D$23 -> 19.13 | G23: ='[August 1 2004.xls]S2'!E$23 -> 67.56
A24: 5 | B24: ='[August 1 2004.xls]S13'!$B$1 -> John Diamond | C24: ='[August 1 2004.xls]S13'!$F$23 -> 102.71 | D24: ='[August 1 2004.xls]S13'!B$23 -> 9.60 | E24: ='[August 1 2004.xls]S13'!C$23 -> 5.91 | F24: ='[August 1 2004.xls]S13'!D$23 -> 27.22 | G24: ='[August 1 2004.xls]S13'!E$23 -> 59.98
A25: 6 | B25: ='[August 1 2004.xls]S1'!$B$1 -> Roger Mousley | C25: ='[August 1 2004.xls]S1'!$F$23 -> 103.87 | D25: ='[August 1 2004.xls]S1'!B$23 -> 8.66 | E25: ='[August 1 2004.xls]S1'!C$23 -> 2.77 | F25: ='[August 1 2004.xls]S1'!D$23 -> 27.78 | G25: ='[August 1 2004.xls]S1'!E$23 -> 64.66
A26: 7 | B26: ='[August 1 2004.xls]S6'!$B$1 -> Red Redford (Auto) | C26: ='[August 1 2004.xls]S6'!$F$23 -> 109.55 | D26: ='[August 1 2004.xls]S6'!B$23 -> 8.95 | E26: ='[August 1 2004.xls]S6'!C$23 -> 3.43 | F26: ='[August 1 2004.xls]S6'!D$23 -> 32.81 | G26: ='[August 1 2004.xls]S6'!E$23 -> 64.36
A27: 8 | B27: ='[August 1 2004.xls]S8'!$B$1 -> Red Redford (Rev) | C27: ='[August 1 2004.xls]S8'!$F$23 -> 110.05 | D27: ='[August 1 2004.xls]S8'!B$23 -> 13.00 | E27: ='[August 1 2004.xls]S8'!C$23 -> 4.09 | F27: ='[August 1 2004.xls]S8'!D$23 -> 26.78 | G27: ='[August 1 2004.xls]S8'!E$23 -> 66.18
A28: 9 | B28: ='[August 1 2004.xls]S9'!$B$1 -> Dave Duncan | C28: ='[August 1 2004.xls]S9'!$F$23 -> 113.19 | D28: ='[August 1 2004.xls]S9'!B$23 -> 10.69 | E28: ='[August 1 2004.xls]S9'!C$23 -> 4.06 | F28: ='[August 1 2004.xls]S9'!D$23 -> 26.66 | G28: ='[August 1 2004.xls]S9'!E$23 -> 71.78
A29: 10 | B29: ='[August 1 2004.xls]S11'!$B$1 -> Carl Burney | C29: ='[August 1 2004.xls]S11'!$F$23 -> 125.11 | D29: ='[August 1 2004.xls]S11'!B$23 -> 12.44 | E29: ='[August 1 2004.xls]S11'!C$23 -> 5.57 | F29: ='[August 1 2004.xls]S11'!D$23 -> 25.35 | G29: ='[August 1 2004.xls]S11'!E$23 -> 81.75
A30: 11 | B30: ='[August 1 2004.xls]S7'!$B$1 -> Dave Duncan | C30: ='[August 1 2004.xls]S7'!$F$23 -> 125.51 | D30: ='[August 1 2004.xls]S7'!B$23 -> 18.60 | E30: ='[August 1 2004.xls]S7'!C$23 -> 4.48 | F30: ='[August 1 2004.xls]S7'!D$23 -> 29.35 | G30: ='[August 1 2004.xls]S7'!E$23 -> 73.08
A31: 12 | B31: ='[August 1 2004.xls]S3'!$B$1 -> Danimal | C31: ='[August 1 2004.xls]S3'!$F$23 -> 127.75 | D31: ='[August 1 2004.xls]S3'!B$23 -> 18.59 | E31: ='[August 1 2004.xls]S3'!C$23 -> 3.60 | F31: ='[August 1 2004.xls]S3'!D$23 -> 26.31 | G31: ='[August 1 2004.xls]S3'!E$23 -> 79.25
A32: 13 | B32: ='[August 1 2004.xls]S10'!$B$1 -> Erin Herring | C32: ='[August 1 2004.xls]S10'!$F$23 -> 132.10 | D32: ='[August 1 2004.xls]S10'!B$23 -> 20.23 | E32: ='[August 1 2004.xls]S10'!C$23 -> 3.93 | F32: ='[August 1 2004.xls]S10'!D$23 -> 30.74 | G32: ='[August 1 2004.xls]S10'!E$23 -> 77.20
A33: Overall Average: | C33: =SUM(C20:C32)/13 -> 106.58076923076922 | D33: =SUM(D20:D32)/13 -> 11.889230769230769 | E33: =SUM(E20:E32)/13 -> 3.9676923076923076 | F33: =SUM(F20:F32)/13 -> 25.058461538461536 | G33: =SUM(G20:G32)/13 -> 65.665384615384625
A34: POINTS DOWN
A35: Number | B35: Name | C35: Match | D35: Stage1 | E35: Stage 2 | F35: Stage 3 | G35: Stage 4
A36: 1 | B36: ='[August 1 2004.xls]S11'!$B$1 -> Carl Burney | C36: ='[August 1 2004.xls]S11'!$F$24 -> 10 | D36: ='[August 1 2004.xls]S11'!B$24 -> 0 | E36: ='[August 1 2004.xls]S11'!C$24 -> 0 | F36: ='[August 1 2004.xls]S11'!D$24 -> 4 | G36: ='[August 1 2004.xls]S11'!E$24 -> 6
A37: 2 | B37: ='[August 1 2004.xls]S6'!$B$1 -> Red Redford (Auto) | C37: ='[August 1 2004.xls]S6'!$F$24 -> 13 | D37: ='[August 1 2004.xls]S6'!B$24 -> 1 | E37: ='[August 1 2004.xls]S6'!C$24 -> 0 | F37: ='[August 1 2004.xls]S6'!D$24 -> 3 | G37: ='[August 1 2004.xls]S6'!E$24 -> 9
A38: 3 | B38: ='[August 1 2004.xls]S12'!$B$1 -> Mike Rodriquez | C38: ='[August 1 2004.xls]S12'!$F$24 -> 19 | D38: ='[August 1 2004.xls]S12'!B$24 -> 6 | E38: ='[August 1 2004.xls]S12'!C$24 -> 3 | F38: ='[August 1 2004.xls]S12'!D$24 -> 5 | G38: ='[August 1 2004.xls]S12'!E$24 -> 5
A39: 4 | B39: ='[August 1 2004.xls]S9'!$B$1 -> Dave Duncan | C39: ='[August 1 2004.xls]S9'!$F$24 -> 20 | D39: ='[August 1 2004.xls]S9'!B$24 -> 7 | E39: ='[August 1 2004.xls]S9'!C$24 -> 0 | F39: ='[August 1 2004.xls]S9'!D$24 -> 8 | G39: ='[August 1 2004.xls]S9'!E$24 -> 5
A40: 5 | B40: ='[August 1 2004.xls]S8'!$B$1 -> Red Redford (Rev) | C40: ='[August 1 2004.xls]S8'!$F$24 -> 21 | D40: ='[August 1 2004.xls]S8'!B$24 -> 1 | E40: ='[August 1 2004.xls]S8'!C$24 -> 1 | F40: ='[August 1 2004.xls]S8'!D$24 -> 10 | G40: ='[August 1 2004.xls]S8'!E$24 -> 9
A41: 6 | B41: ='[August 1 2004.xls]S13'!$B$1 -> John Diamond | C41: ='[August 1 2004.xls]S13'!$F$24 -> 23 | D41: ='[August 1 2004.xls]S13'!B$24 -> 3 | E41: ='[August 1 2004.xls]S13'!C$24 -> 0 | F41: ='[August 1 2004.xls]S13'!D$24 -> 14 | G41: ='[August 1 2004.xls]S13'!E$24 -> 6
A42: 7 | B42: ='[August 1 2004.xls]S2'!$B$1 -> Randy Hill | C42: ='[August 1 2004.xls]S2'!$F$24 -> 25 | D42: ='[August 1 2004.xls]S2'!B$24 -> 2 | E42: ='[August 1 2004.xls]S2'!C$24 -> 0 | F42: ='[August 1 2004.xls]S2'!D$24 -> 6 | G42: ='[August 1 2004.xls]S2'!E$24 -> 17
A43: 8 | B43: ='[August 1 2004.xls]S5'!$B$1 -> Ari T | C43: ='[August 1 2004.xls]S5'!$F$24 -> 25 | D43: ='[August 1 2004.xls]S5'!B$24 -> 0 | E43: ='[August 1 2004.xls]S5'!C$24 -> 0 | F43: ='[August 1 2004.xls]S5'!D$24 -> 6 | G43: ='[August 1 2004.xls]S5'!E$24 -> 19
A44: 9 | B44: ='[August 1 2004.xls]S4'!$B$1 -> Craig Outzen | C44: ='[August 1 2004.xls]S4'!$F$24 -> 27 | D44: ='[August 1 2004.xls]S4'!B$24 -> 0 | E44: ='[August 1 2004.xls]S4'!C$24 -> 1 | F44: ='[August 1 2004.xls]S4'!D$24 -> 14 | G44: ='[August 1 2004.xls]S4'!E$24 -> 12
A45: 10 | B45: ='[August 1 2004.xls]S7'!$B$1 -> Dave Duncan | C45: ='[August 1 2004.xls]S7'!$F$24 -> 28 | D45: ='[August 1 2004.xls]S7'!B$24 -> 1 | E45: ='[August 1 2004.xls]S7'!C$24 -> 0 | F45: ='[August 1 2004.xls]S7'!D$24 -> 8 | G45: ='[August 1 2004.xls]S7'!E$24 -> 19
A46: 11 | B46: ='[August 1 2004.xls]S1'!$B$1 -> Roger Mousley | C46: ='[August 1 2004.xls]S1'!$F$24 -> 37 | D46: ='[August 1 2004.xls]S1'!B$24 -> 5 | E46: ='[August 1 2004.xls]S1'!C$24 -> 1 | F46: ='[August 1 2004.xls]S1'!D$24 -> 12 | G46: ='[August 1 2004.xls]S1'!E$24 -> 19
A47: 12 | B47: ='[August 1 2004.xls]S3'!$B$1 -> Danimal | C47: ='[August 1 2004.xls]S3'!$F$24 -> 48 | D47: ='[August 1 2004.xls]S3'!B$24 -> 1 | E47: ='[August 1 2004.xls]S3'!C$24 -> 2 | F47: ='[August 1 2004.xls]S3'!D$24 -> 11 | G47: ='[August 1 2004.xls]S3'!E$24 -> 34
A48: 13 | B48: ='[August 1 2004.xls]S10'!$B$1 -> Erin Herring | C48: ='[August 1 2004.xls]S10'!$F$24 -> 61 | D48: ='[August 1 2004.xls]S10'!B$24 -> 0 | E48: ='[August 1 2004.xls]S10'!C$24 -> 0 | F48: ='[August 1 2004.xls]S10'!D$24 -> 25 | G48: ='[August 1 2004.xls]S10'!E$24 -> 36
A49: Overall Average: | C49: =SUM(C36:C48)/13 -> 27.46153846153846 | D49: =SUM(D36:D48)/13 -> 2.0769230769230771 | E49: =SUM(E36:E48)/13 -> 0.61538461538461542 | F49: =SUM(F36:F48)/13 -> 9.6923076923076916 | G49: =SUM(G36:G48)/13 -> 15.076923076923077