A1: Utah Shooting Academy August 25, 2004
A2: OVERALL SCORES (Includes Points Down, procedurals and hits on non-threat)
A3: Number | B3: Name | C3: Score | D3: Stage 1 | E3: Stage 2 | F3: Stage 3 | G3: Stage 4
A4: 1 | B4: ='[August 25 2004.xls]S1'!$B$1 -> Bryan Mortenson | C4: ='[August 25 2004.xls]S1'!$F$27 -> 67.71 | D4: ='[August 25 2004.xls]S1'!B$27 -> 10.96 | E4: ='[August 25 2004.xls]S1'!C$27 -> 5.89 | F4: ='[August 25 2004.xls]S1'!D$27 -> 13.17 | G4: ='[August 25 2004.xls]S1'!E$27 -> 37.69
A5: 2 | B5: ='[August 25 2004.xls]S2'!$B$1 -> Chris Roach | C5: ='[August 25 2004.xls]S2'!$F$27 -> 68.14 | D5: ='[August 25 2004.xls]S2'!B$27 -> 8.33 | E5: ='[August 25 2004.xls]S2'!C$27 -> 5.97 | F5: ='[August 25 2004.xls]S2'!D$27 -> 13.00 | G5: ='[August 25 2004.xls]S2'!E$27 -> 40.84
A6: 3 | B6: ='[August 25 2004.xls]S4'!$B$1 -> Justin Park | C6: ='[August 25 2004.xls]S4'!$F$27 -> 82.04 | D6: ='[August 25 2004.xls]S4'!B$27 -> 8.71 | E6: ='[August 25 2004.xls]S4'!C$27 -> 6.21 | F6: ='[August 25 2004.xls]S4'!D$27 -> 11.65 | G6: ='[August 25 2004.xls]S4'!E$27 -> 55.47
A7: 4 | B7: ='[August 25 2004.xls]S3'!$B$1 -> R Dan | C7: ='[August 25 2004.xls]S3'!$F$27 -> 82.34 | D7: ='[August 25 2004.xls]S3'!B$27 -> 11.11 | E7: ='[August 25 2004.xls]S3'!C$27 -> 8.48 | F7: ='[August 25 2004.xls]S3'!D$27 -> 18.01 | G7: ='[August 25 2004.xls]S3'!E$27 -> 44.74
A8: 5 | B8: ='[August 25 2004.xls]S6'!$B$1 -> Dave Duncan | C8: ='[August 25 2004.xls]S6'!$F$27 -> 90.39 | D8: ='[August 25 2004.xls]S6'!B$27 -> 11.46 | E8: ='[August 25 2004.xls]S6'!C$27 -> 10.02 | F8: ='[August 25 2004.xls]S6'!D$27 -> 19.68 | G8: ='[August 25 2004.xls]S6'!E$27 -> 49.23
A9: 6 | B9: ='[August 25 2004.xls]S5'!$B$1 -> Neil Hood | C9: ='[August 25 2004.xls]S5'!$F$27 -> 90.56 | D9: ='[August 25 2004.xls]S5'!B$27 -> 13.63 | E9: ='[August 25 2004.xls]S5'!C$27 -> 6.93 | F9: ='[August 25 2004.xls]S5'!D$27 -> 12.07 | G9: ='[August 25 2004.xls]S5'!E$27 -> 57.93
A10: 7 | B10: ='[August 25 2004.xls]S7'!$B$1 -> Ren Young | C10: ='[August 25 2004.xls]S7'!$F$27 -> 95.48 | D10: ='[August 25 2004.xls]S7'!B$27 -> 14.67 | E10: ='[August 25 2004.xls]S7'!C$27 -> 16.94 | F10: ='[August 25 2004.xls]S7'!D$27 -> 17.04 | G10: ='[August 25 2004.xls]S7'!E$27 -> 46.83
A11: 8 | B11: ='[August 25 2004.xls]S8'!$B$1 -> Bill Dezell | C11: ='[August 25 2004.xls]S8'!$F$27 -> 103.20 | D11: ='[August 25 2004.xls]S8'!B$27 -> 11.93 | E11: ='[August 25 2004.xls]S8'!C$27 -> 10.25 | F11: ='[August 25 2004.xls]S8'!D$27 -> 20.30 | G11: ='[August 25 2004.xls]S8'!E$27 -> 60.72
A12: 9 | B12: ='[August 25 2004.xls]S9'!$B$1 -> Randy Hill | C12: ='[August 25 2004.xls]S9'!$F$27 -> 104.36 | D12: ='[August 25 2004.xls]S9'!B$27 -> 15.48 | E12: ='[August 25 2004.xls]S9'!C$27 -> 8.28 | F12: ='[August 25 2004.xls]S9'!D$27 -> 18.85 | G12: ='[August 25 2004.xls]S9'!E$27 -> 61.75
A13: 10 | B13: ='[August 25 2004.xls]S10'!$B$1 -> Danimal | C13: ='[August 25 2004.xls]S10'!$F$27 -> 104.60 | D13: ='[August 25 2004.xls]S10'!B$27 -> 12.59 | E13: ='[August 25 2004.xls]S10'!C$27 -> 11.69 | F13: ='[August 25 2004.xls]S10'!D$27 -> 25.79 | G13: ='[August 25 2004.xls]S10'!E$27 -> 54.53
A14: 11 | B14: ='[August 25 2004.xls]S11'!$B$1 -> Carl Burney | C14: ='[August 25 2004.xls]S11'!$F$27 -> 107.48 | D14: ='[August 25 2004.xls]S11'!B$27 -> 15.33 | E14: ='[August 25 2004.xls]S11'!C$27 -> 16.68 | F14: ='[August 25 2004.xls]S11'!D$27 -> 17.87 | G14: ='[August 25 2004.xls]S11'!E$27 -> 57.60
A15: 12 | B15: ='[August 25 2004.xls]S20'!$B$1 -> Carol Perez | C15: ='[August 25 2004.xls]S20'!$F$27 -> 110.72 | D15: ='[August 25 2004.xls]S20'!B$27 -> 23.03 | E15: ='[August 25 2004.xls]S20'!C$27 -> 13.86 | F15: ='[August 25 2004.xls]S20'!D$27 -> 21.23 | G15: ='[August 25 2004.xls]S20'!E$27 -> 52.60
A16: 13 | B16: ='[August 25 2004.xls]S12'!$B$1 -> Ken Thorne | C16: ='[August 25 2004.xls]S12'!$F$27 -> 110.93 | D16: ='[August 25 2004.xls]S12'!B$27 -> 15.88 | E16: ='[August 25 2004.xls]S12'!C$27 -> 9.77 | F16: ='[August 25 2004.xls]S12'!D$27 -> 18.80 | G16: ='[August 25 2004.xls]S12'!E$27 -> 66.48
A17: 14 | B17: ='[August 25 2004.xls]S13'!$B$1 -> Robert Carr | C17: ='[August 25 2004.xls]S13'!$F$27 -> 111.39 | D17: ='[August 25 2004.xls]S13'!B$27 -> 13.49 | E17: ='[August 25 2004.xls]S13'!C$27 -> 10.00 | F17: ='[August 25 2004.xls]S13'!D$27 -> 17.65 | G17: ='[August 25 2004.xls]S13'!E$27 -> 70.25
A18: 15 | B18: ='[August 25 2004.xls]S14'!$B$1 -> Dave Duncan | C18: ='[August 25 2004.xls]S14'!$F$27 -> 115.15 | D18: ='[August 25 2004.xls]S14'!B$27 -> 15.12 | E18: ='[August 25 2004.xls]S14'!C$27 -> 12.50 | F18: ='[August 25 2004.xls]S14'!D$27 -> 23.66 | G18: ='[August 25 2004.xls]S14'!E$27 -> 63.87
A19: 16 | B19: ='[August 25 2004.xls]S16'!$B$1 -> Matt Young | C19: ='[August 25 2004.xls]S16'!$F$27 -> 122.51 | D19: ='[August 25 2004.xls]S16'!B$27 -> 28.23 | E19: ='[August 25 2004.xls]S16'!C$27 -> 10.68 | F19: ='[August 25 2004.xls]S16'!D$27 -> 21.58 | G19: ='[August 25 2004.xls]S16'!E$27 -> 62.02
A20: 17 | B20: ='[August 25 2004.xls]S15'!$B$1 -> Ryan Thorne | C20: ='[August 25 2004.xls]S15'!$F$27 -> 131.70 | D20: ='[August 25 2004.xls]S15'!B$27 -> 20.57 | E20: ='[August 25 2004.xls]S15'!C$27 -> 23.92 | F20: ='[August 25 2004.xls]S15'!D$27 -> 24.17 | G20: ='[August 25 2004.xls]S15'!E$27 -> 63.04
A21: 18 | B21: ='[August 25 2004.xls]S17'!$B$1 -> Erin Herring | C21: ='[August 25 2004.xls]S17'!$F$27 -> 134.09 | D21: ='[August 25 2004.xls]S17'!B$27 -> 16.42 | E21: ='[August 25 2004.xls]S17'!C$27 -> 14.84 | F21: ='[August 25 2004.xls]S17'!D$27 -> 44.39 | G21: ='[August 25 2004.xls]S17'!E$27 -> 58.44
A22: 19 | B22: ='[August 25 2004.xls]S18'!$B$1 -> Thomas Hood | C22: ='[August 25 2004.xls]S18'!$F$27 -> 158.52 | D22: ='[August 25 2004.xls]S18'!B$27 -> 19.37 | E22: ='[August 25 2004.xls]S18'!C$27 -> 42.37 | F22: ='[August 25 2004.xls]S18'!D$27 -> 26.84 | G22: ='[August 25 2004.xls]S18'!E$27 -> 69.94
A23: 20 | B23: ='[August 25 2004.xls]S19'!$B$1 -> John Diamond | C23: ='[August 25 2004.xls]S19'!$F$27 -> 195.72 | D23: ='[August 25 2004.xls]S19'!B$27 -> 21.80 | E23: ='[August 25 2004.xls]S19'!C$27 -> 33.68 | F23: ='[August 25 2004.xls]S19'!D$27 -> 29.84 | G23: ='[August 25 2004.xls]S19'!E$27 -> 110.40
A24: S21 | B24: ='[August 25 2004.xls]S21'!$B$1 -> 0 | C24: ='[August 25 2004.xls]S21'!$F$27 -> 0.00 | D24: ='[August 25 2004.xls]S21'!B$27 -> 0.00 | E24: ='[August 25 2004.xls]S21'!C$27 -> 0.00 | F24: ='[August 25 2004.xls]S21'!D$27 -> 0.00 | G24: ='[August 25 2004.xls]S21'!E$27 -> 0.00
A25: S22 | B25: ='[August 25 2004.xls]S22'!$B$1 -> 0 | C25: ='[August 25 2004.xls]S22'!$F$27 -> 0.00 | D25: ='[August 25 2004.xls]S22'!B$27 -> 0.00 | E25: ='[August 25 2004.xls]S22'!C$27 -> 0.00 | F25: ='[August 25 2004.xls]S22'!D$27 -> 0.00 | G25: ='[August 25 2004.xls]S22'!E$27 -> 0.00
A26: S23 | B26: ='[August 25 2004.xls]S23'!$B$1 -> 0 | C26: ='[August 25 2004.xls]S23'!$F$27 -> 0.00 | D26: ='[August 25 2004.xls]S23'!B$27 -> 0.00 | E26: ='[August 25 2004.xls]S23'!C$27 -> 0.00 | F26: ='[August 25 2004.xls]S23'!D$27 -> 0.00 | G26: ='[August 25 2004.xls]S23'!E$27 -> 0.00
A27: S24 | B27: ='[August 25 2004.xls]S24'!$B$1 -> 0 | C27: ='[August 25 2004.xls]S24'!$F$27 -> 0.00 | D27: ='[August 25 2004.xls]S24'!B$27 -> 0.00 | E27: ='[August 25 2004.xls]S24'!C$27 -> 0.00 | F27: ='[August 25 2004.xls]S24'!D$27 -> 0.00 | G27: ='[August 25 2004.xls]S24'!E$27 -> 0.00
A28: S25 | B28: ='[August 25 2004.xls]S25'!$B$1 -> 0 | C28: ='[August 25 2004.xls]S25'!$F$27 -> 0.00 | D28: ='[August 25 2004.xls]S25'!B$27 -> 0.00 | E28: ='[August 25 2004.xls]S25'!C$27 -> 0.00 | F28: ='[August 25 2004.xls]S25'!D$27 -> 0.00 | G28: ='[August 25 2004.xls]S25'!E$27 -> 0.00
A29: =COUNTIF($C$4:$C$28,">0") -> 20 | B29: Average Score: | C29: =SUM(C4:C28)/$A$29 -> 109.35150000000002 | D29: =SUM(D4:D28)/$A$29 -> 15.4055 | E29: =SUM(E4:E28)/$A$29 -> 13.947999999999999 | F29: =SUM(F4:F28)/$A$29 -> 20.779499999999995 | G29: =SUM(G4:G28)/$A$29 -> 59.218500000000006
A30: RAW TIMES
A31: Number | B31: Name | C31: Time | D31: Stage 1 | E31: Stage 2 | F31: Stage 3 | G31: Stage 4
A32: 1 | B32: ='[August 25 2004.xls]S2'!$B$1 -> Chris Roach | C32: ='[August 25 2004.xls]S2'!$F$23 -> 57.14 | D32: ='[August 25 2004.xls]S2'!B$23 -> 8.33 | E32: ='[August 25 2004.xls]S2'!C$23 -> 4.97 | F32: ='[August 25 2004.xls]S2'!D$23 -> 11.00 | G32: ='[August 25 2004.xls]S2'!E$23 -> 32.84
A33: 2 | B33: ='[August 25 2004.xls]S1'!$B$1 -> Bryan Mortenson | C33: ='[August 25 2004.xls]S1'!$F$23 -> 59.71 | D33: ='[August 25 2004.xls]S1'!B$23 -> 10.96 | E33: ='[August 25 2004.xls]S1'!C$23 -> 5.89 | F33: ='[August 25 2004.xls]S1'!D$23 -> 13.17 | G33: ='[August 25 2004.xls]S1'!E$23 -> 29.69
A34: 3 | B34: ='[August 25 2004.xls]S4'!$B$1 -> Justin Park | C34: ='[August 25 2004.xls]S4'!$F$23 -> 68.04 | D34: ='[August 25 2004.xls]S4'!B$23 -> 8.71 | E34: ='[August 25 2004.xls]S4'!C$23 -> 5.71 | F34: ='[August 25 2004.xls]S4'!D$23 -> 11.15 | G34: ='[August 25 2004.xls]S4'!E$23 -> 42.47
A35: 4 | B35: ='[August 25 2004.xls]S10'!$B$1 -> Danimal | C35: ='[August 25 2004.xls]S10'!$F$23 -> 70.60 | D35: ='[August 25 2004.xls]S10'!B$23 -> 11.09 | E35: ='[August 25 2004.xls]S10'!C$23 -> 6.19 | F35: ='[August 25 2004.xls]S10'!D$23 -> 15.29 | G35: ='[August 25 2004.xls]S10'!E$23 -> 38.03
A36: 5 | B36: ='[August 25 2004.xls]S3'!$B$1 -> R Dan | C36: ='[August 25 2004.xls]S3'!$F$23 -> 72.84 | D36: ='[August 25 2004.xls]S3'!B$23 -> 11.11 | E36: ='[August 25 2004.xls]S3'!C$23 -> 8.48 | F36: ='[August 25 2004.xls]S3'!D$23 -> 18.01 | G36: ='[August 25 2004.xls]S3'!E$23 -> 35.24
A37: 6 | B37: ='[August 25 2004.xls]S7'!$B$1 -> Ren Young | C37: ='[August 25 2004.xls]S7'!$F$23 -> 76.98 | D37: ='[August 25 2004.xls]S7'!B$23 -> 12.17 | E37: ='[August 25 2004.xls]S7'!C$23 -> 15.44 | F37: ='[August 25 2004.xls]S7'!D$23 -> 12.04 | G37: ='[August 25 2004.xls]S7'!E$23 -> 37.33
A38: 7 | B38: ='[August 25 2004.xls]S6'!$B$1 -> Dave Duncan | C38: ='[August 25 2004.xls]S6'!$F$23 -> 80.89 | D38: ='[August 25 2004.xls]S6'!B$23 -> 11.46 | E38: ='[August 25 2004.xls]S6'!C$23 -> 8.52 | F38: ='[August 25 2004.xls]S6'!D$23 -> 16.18 | G38: ='[August 25 2004.xls]S6'!E$23 -> 44.73
A39: 8 | B39: ='[August 25 2004.xls]S20'!$B$1 -> Carol Perez | C39: ='[August 25 2004.xls]S20'!$F$23 -> 86.22 | D39: ='[August 25 2004.xls]S20'!B$23 -> 22.53 | E39: ='[August 25 2004.xls]S20'!C$23 -> 12.36 | F39: ='[August 25 2004.xls]S20'!D$23 -> 17.23 | G39: ='[August 25 2004.xls]S20'!E$23 -> 34.10
A40: 9 | B40: ='[August 25 2004.xls]S9'!$B$1 -> Randy Hill | C40: ='[August 25 2004.xls]S9'!$F$23 -> 88.36 | D40: ='[August 25 2004.xls]S9'!B$23 -> 14.48 | E40: ='[August 25 2004.xls]S9'!C$23 -> 7.28 | F40: ='[August 25 2004.xls]S9'!D$23 -> 17.85 | G40: ='[August 25 2004.xls]S9'!E$23 -> 48.75
A41: 10 | B41: ='[August 25 2004.xls]S8'!$B$1 -> Bill Dezell | C41: ='[August 25 2004.xls]S8'!$F$23 -> 88.70 | D41: ='[August 25 2004.xls]S8'!B$23 -> 8.93 | E41: ='[August 25 2004.xls]S8'!C$23 -> 10.25 | F41: ='[August 25 2004.xls]S8'!D$23 -> 19.80 | G41: ='[August 25 2004.xls]S8'!E$23 -> 49.72
A42: 11 | B42: ='[August 25 2004.xls]S5'!$B$1 -> Neil Hood | C42: ='[August 25 2004.xls]S5'!$F$23 -> 89.06 | D42: ='[August 25 2004.xls]S5'!B$23 -> 13.63 | E42: ='[August 25 2004.xls]S5'!C$23 -> 6.93 | F42: ='[August 25 2004.xls]S5'!D$23 -> 11.57 | G42: ='[August 25 2004.xls]S5'!E$23 -> 56.93
A43: 12 | B43: ='[August 25 2004.xls]S13'!$B$1 -> Robert Carr | C43: ='[August 25 2004.xls]S13'!$F$23 -> 89.39 | D43: ='[August 25 2004.xls]S13'!B$23 -> 12.99 | E43: ='[August 25 2004.xls]S13'!C$23 -> 8.50 | F43: ='[August 25 2004.xls]S13'!D$23 -> 16.15 | G43: ='[August 25 2004.xls]S13'!E$23 -> 51.75
A44: 13 | B44: ='[August 25 2004.xls]S11'!$B$1 -> Carl Burney | C44: ='[August 25 2004.xls]S11'!$F$23 -> 97.48 | D44: ='[August 25 2004.xls]S11'!B$23 -> 14.83 | E44: ='[August 25 2004.xls]S11'!C$23 -> 16.68 | F44: ='[August 25 2004.xls]S11'!D$23 -> 16.87 | G44: ='[August 25 2004.xls]S11'!E$23 -> 49.10
A45: 14 | B45: ='[August 25 2004.xls]S16'!$B$1 -> Matt Young | C45: ='[August 25 2004.xls]S16'!$F$23 -> 100.01 | D45: ='[August 25 2004.xls]S16'!B$23 -> 24.73 | E45: ='[August 25 2004.xls]S16'!C$23 -> 10.18 | F45: ='[August 25 2004.xls]S16'!D$23 -> 20.08 | G45: ='[August 25 2004.xls]S16'!E$23 -> 45.02
A46: 15 | B46: ='[August 25 2004.xls]S12'!$B$1 -> Ken Thorne | C46: ='[August 25 2004.xls]S12'!$F$23 -> 101.43 | D46: ='[August 25 2004.xls]S12'!B$23 -> 15.88 | E46: ='[August 25 2004.xls]S12'!C$23 -> 9.27 | F46: ='[August 25 2004.xls]S12'!D$23 -> 17.30 | G46: ='[August 25 2004.xls]S12'!E$23 -> 58.98
A47: 16 | B47: ='[August 25 2004.xls]S14'!$B$1 -> Dave Duncan | C47: ='[August 25 2004.xls]S14'!$F$23 -> 103.15 | D47: ='[August 25 2004.xls]S14'!B$23 -> 13.62 | E47: ='[August 25 2004.xls]S14'!C$23 -> 9.50 | F47: ='[August 25 2004.xls]S14'!D$23 -> 20.16 | G47: ='[August 25 2004.xls]S14'!E$23 -> 59.87
A48: 17 | B48: ='[August 25 2004.xls]S15'!$B$1 -> Ryan Thorne | C48: ='[August 25 2004.xls]S15'!$F$23 -> 109.20 | D48: ='[August 25 2004.xls]S15'!B$23 -> 20.57 | E48: ='[August 25 2004.xls]S15'!C$23 -> 22.42 | F48: ='[August 25 2004.xls]S15'!D$23 -> 19.67 | G48: ='[August 25 2004.xls]S15'!E$23 -> 46.54
A49: 18 | B49: ='[August 25 2004.xls]S17'!$B$1 -> Erin Herring | C49: ='[August 25 2004.xls]S17'!$F$23 -> 109.59 | D49: ='[August 25 2004.xls]S17'!B$23 -> 15.92 | E49: ='[August 25 2004.xls]S17'!C$23 -> 13.84 | F49: ='[August 25 2004.xls]S17'!D$23 -> 43.39 | G49: ='[August 25 2004.xls]S17'!E$23 -> 36.44
A50: 19 | B50: ='[August 25 2004.xls]S18'!$B$1 -> Thomas Hood | C50: ='[August 25 2004.xls]S18'!$F$23 -> 142.02 | D50: ='[August 25 2004.xls]S18'!B$23 -> 18.87 | E50: ='[August 25 2004.xls]S18'!C$23 -> 36.87 | F50: ='[August 25 2004.xls]S18'!D$23 -> 24.34 | G50: ='[August 25 2004.xls]S18'!E$23 -> 61.94
A51: 20 | B51: ='[August 25 2004.xls]S19'!$B$1 -> John Diamond | C51: ='[August 25 2004.xls]S19'!$F$23 -> 165.22 | D51: ='[August 25 2004.xls]S19'!B$23 -> 20.80 | E51: ='[August 25 2004.xls]S19'!C$23 -> 27.68 | F51: ='[August 25 2004.xls]S19'!D$23 -> 26.84 | G51: ='[August 25 2004.xls]S19'!E$23 -> 89.90
A52: S21 | B52: ='[August 25 2004.xls]S21'!$B$1 -> 0 | C52: ='[August 25 2004.xls]S21'!$F$23 -> 0.00 | D52: ='[August 25 2004.xls]S21'!B$23 -> 0.00 | E52: ='[August 25 2004.xls]S21'!C$23 -> 0.00 | F52: ='[August 25 2004.xls]S21'!D$23 -> 0.00 | G52: ='[August 25 2004.xls]S21'!E$23 -> 0.00
A53: S22 | B53: ='[August 25 2004.xls]S22'!$B$1 -> 0 | C53: ='[August 25 2004.xls]S22'!$F$23 -> 0.00 | D53: ='[August 25 2004.xls]S22'!B$23 -> 0.00 | E53: ='[August 25 2004.xls]S22'!C$23 -> 0.00 | F53: ='[August 25 2004.xls]S22'!D$23 -> 0.00 | G53: ='[August 25 2004.xls]S22'!E$23 -> 0.00
A54: S23 | B54: ='[August 25 2004.xls]S23'!$B$1 -> 0 | C54: ='[August 25 2004.xls]S23'!$F$23 -> 0.00 | D54: ='[August 25 2004.xls]S23'!B$23 -> 0.00 | E54: ='[August 25 2004.xls]S23'!C$23 -> 0.00 | F54: ='[August 25 2004.xls]S23'!D$23 -> 0.00 | G54: ='[August 25 2004.xls]S23'!E$23 -> 0.00
A55: S24 | B55: ='[August 25 2004.xls]S24'!$B$1 -> 0 | C55: ='[August 25 2004.xls]S24'!$F$23 -> 0.00 | D55: ='[August 25 2004.xls]S24'!B$23 -> 0.00 | E55: ='[August 25 2004.xls]S24'!C$23 -> 0.00 | F55: ='[August 25 2004.xls]S24'!D$23 -> 0.00 | G55: ='[August 25 2004.xls]S24'!E$23 -> 0.00
A56: S25 | B56: ='[August 25 2004.xls]S25'!$B$1 -> 0 | C56: ='[August 25 2004.xls]S25'!$F$23 -> 0.00 | D56: ='[August 25 2004.xls]S25'!B$23 -> 0.00 | E56: ='[August 25 2004.xls]S25'!C$23 -> 0.00 | F56: ='[August 25 2004.xls]S25'!D$23 -> 0.00 | G56: ='[August 25 2004.xls]S25'!E$23 -> 0.00
A57: Average Overall Time: | C57: =SUM(C32:C56)/$A$29 -> 92.801500000000004 | D57: =SUM(D32:D56)/$A$29 -> 14.580500000000001 | E57: =SUM(E32:E56)/$A$29 -> 12.348000000000003 | F57: =SUM(F32:F56)/$A$29 -> 18.404499999999999 | G57: =SUM(G32:G56)/$A$29 -> 47.468499999999999
A58: POINTS DOWN
A59: Number | B59: Name | C59: Points Down | D59: Stage 1 | E59: Stage 2 | F59: Stage 3 | G59: Stage 4
A60: 1 | B60: ='[August 25 2004.xls]S5'!$B$1 -> Neil Hood | C60: ='[August 25 2004.xls]S5'!$F$24 -> 3 | D60: ='[August 25 2004.xls]S5'!B$24 -> 0 | E60: ='[August 25 2004.xls]S5'!C$24 -> 0 | F60: ='[August 25 2004.xls]S5'!D$24 -> 1 | G60: ='[August 25 2004.xls]S5'!E$24 -> 2
A61: 2 | B61: ='[August 25 2004.xls]S1'!$B$1 -> Bryan Mortenson | C61: ='[August 25 2004.xls]S1'!$F$24 -> 16 | D61: ='[August 25 2004.xls]S1'!B$24 -> 0 | E61: ='[August 25 2004.xls]S1'!C$24 -> 0 | F61: ='[August 25 2004.xls]S1'!D$24 -> 0 | G61: ='[August 25 2004.xls]S1'!E$24 -> 16
A62: 3 | B62: ='[August 25 2004.xls]S3'!$B$1 -> R Dan | C62: ='[August 25 2004.xls]S3'!$F$24 -> 19 | D62: ='[August 25 2004.xls]S3'!B$24 -> 0 | E62: ='[August 25 2004.xls]S3'!C$24 -> 0 | F62: ='[August 25 2004.xls]S3'!D$24 -> 0 | G62: ='[August 25 2004.xls]S3'!E$24 -> 19
A63: 4 | B63: ='[August 25 2004.xls]S6'!$B$1 -> Dave Duncan | C63: ='[August 25 2004.xls]S6'!$F$24 -> 19 | D63: ='[August 25 2004.xls]S6'!B$24 -> 0 | E63: ='[August 25 2004.xls]S6'!C$24 -> 3 | F63: ='[August 25 2004.xls]S6'!D$24 -> 7 | G63: ='[August 25 2004.xls]S6'!E$24 -> 9
A64: 5 | B64: ='[August 25 2004.xls]S12'!$B$1 -> Ken Thorne | C64: ='[August 25 2004.xls]S12'!$F$24 -> 19 | D64: ='[August 25 2004.xls]S12'!B$24 -> 0 | E64: ='[August 25 2004.xls]S12'!C$24 -> 1 | F64: ='[August 25 2004.xls]S12'!D$24 -> 3 | G64: ='[August 25 2004.xls]S12'!E$24 -> 15
A65: 6 | B65: ='[August 25 2004.xls]S11'!$B$1 -> Carl Burney | C65: ='[August 25 2004.xls]S11'!$F$24 -> 20 | D65: ='[August 25 2004.xls]S11'!B$24 -> 1 | E65: ='[August 25 2004.xls]S11'!C$24 -> 0 | F65: ='[August 25 2004.xls]S11'!D$24 -> 2 | G65: ='[August 25 2004.xls]S11'!E$24 -> 17
A66: 7 | B66: ='[August 25 2004.xls]S2'!$B$1 -> Chris Roach | C66: ='[August 25 2004.xls]S2'!$F$24 -> 22 | D66: ='[August 25 2004.xls]S2'!B$24 -> 0 | E66: ='[August 25 2004.xls]S2'!C$24 -> 2 | F66: ='[August 25 2004.xls]S2'!D$24 -> 4 | G66: ='[August 25 2004.xls]S2'!E$24 -> 16
A67: 8 | B67: ='[August 25 2004.xls]S8'!$B$1 -> Bill Dezell | C67: ='[August 25 2004.xls]S8'!$F$24 -> 23 | D67: ='[August 25 2004.xls]S8'!B$24 -> 0 | E67: ='[August 25 2004.xls]S8'!C$24 -> 0 | F67: ='[August 25 2004.xls]S8'!D$24 -> 1 | G67: ='[August 25 2004.xls]S8'!E$24 -> 22
A68: 9 | B68: ='[August 25 2004.xls]S18'!$B$1 -> Thomas Hood | C68: ='[August 25 2004.xls]S18'!$F$24 -> 23 | D68: ='[August 25 2004.xls]S18'!B$24 -> 1 | E68: ='[August 25 2004.xls]S18'!C$24 -> 1 | F68: ='[August 25 2004.xls]S18'!D$24 -> 5 | G68: ='[August 25 2004.xls]S18'!E$24 -> 16
A69: 10 | B69: ='[August 25 2004.xls]S14'!$B$1 -> Dave Duncan | C69: ='[August 25 2004.xls]S14'!$F$24 -> 24 | D69: ='[August 25 2004.xls]S14'!B$24 -> 3 | E69: ='[August 25 2004.xls]S14'!C$24 -> 6 | F69: ='[August 25 2004.xls]S14'!D$24 -> 7 | G69: ='[August 25 2004.xls]S14'!E$24 -> 8
A70: 11 | B70: ='[August 25 2004.xls]S4'!$B$1 -> Justin Park | C70: ='[August 25 2004.xls]S4'!$F$24 -> 28 | D70: ='[August 25 2004.xls]S4'!B$24 -> 0 | E70: ='[August 25 2004.xls]S4'!C$24 -> 1 | F70: ='[August 25 2004.xls]S4'!D$24 -> 1 | G70: ='[August 25 2004.xls]S4'!E$24 -> 26
A71: 12 | B71: ='[August 25 2004.xls]S9'!$B$1 -> Randy Hill | C71: ='[August 25 2004.xls]S9'!$F$24 -> 32 | D71: ='[August 25 2004.xls]S9'!B$24 -> 2 | E71: ='[August 25 2004.xls]S9'!C$24 -> 2 | F71: ='[August 25 2004.xls]S9'!D$24 -> 2 | G71: ='[August 25 2004.xls]S9'!E$24 -> 26
A72: 13 | B72: ='[August 25 2004.xls]S7'!$B$1 -> Ren Young | C72: ='[August 25 2004.xls]S7'!$F$24 -> 37 | D72: ='[August 25 2004.xls]S7'!B$24 -> 5 | E72: ='[August 25 2004.xls]S7'!C$24 -> 3 | F72: ='[August 25 2004.xls]S7'!D$24 -> 10 | G72: ='[August 25 2004.xls]S7'!E$24 -> 19
A73: 14 | B73: ='[August 25 2004.xls]S13'!$B$1 -> Robert Carr | C73: ='[August 25 2004.xls]S13'!$F$24 -> 44 | D73: ='[August 25 2004.xls]S13'!B$24 -> 1 | E73: ='[August 25 2004.xls]S13'!C$24 -> 3 | F73: ='[August 25 2004.xls]S13'!D$24 -> 3 | G73: ='[August 25 2004.xls]S13'!E$24 -> 37
A74: 15 | B74: ='[August 25 2004.xls]S15'!$B$1 -> Ryan Thorne | C74: ='[August 25 2004.xls]S15'!$F$24 -> 45 | D74: ='[August 25 2004.xls]S15'!B$24 -> 0 | E74: ='[August 25 2004.xls]S15'!C$24 -> 3 | F74: ='[August 25 2004.xls]S15'!D$24 -> 9 | G74: ='[August 25 2004.xls]S15'!E$24 -> 33
A75: 16 | B75: ='[August 25 2004.xls]S16'!$B$1 -> Matt Young | C75: ='[August 25 2004.xls]S16'!$F$24 -> 45 | D75: ='[August 25 2004.xls]S16'!B$24 -> 7 | E75: ='[August 25 2004.xls]S16'!C$24 -> 1 | F75: ='[August 25 2004.xls]S16'!D$24 -> 3 | G75: ='[August 25 2004.xls]S16'!E$24 -> 34
A76: 17 | B76: ='[August 25 2004.xls]S17'!$B$1 -> Erin Herring | C76: ='[August 25 2004.xls]S17'!$F$24 -> 49 | D76: ='[August 25 2004.xls]S17'!B$24 -> 1 | E76: ='[August 25 2004.xls]S17'!C$24 -> 2 | F76: ='[August 25 2004.xls]S17'!D$24 -> 2 | G76: ='[August 25 2004.xls]S17'!E$24 -> 44
A77: 18 | B77: ='[August 25 2004.xls]S20'!$B$1 -> Carol Perez | C77: ='[August 25 2004.xls]S20'!$F$24 -> 49 | D77: ='[August 25 2004.xls]S20'!B$24 -> 1 | E77: ='[August 25 2004.xls]S20'!C$24 -> 3 | F77: ='[August 25 2004.xls]S20'!D$24 -> 8 | G77: ='[August 25 2004.xls]S20'!E$24 -> 37
A78: 19 | B78: ='[August 25 2004.xls]S19'!$B$1 -> John Diamond | C78: ='[August 25 2004.xls]S19'!$F$24 -> 51 | D78: ='[August 25 2004.xls]S19'!B$24 -> 2 | E78: ='[August 25 2004.xls]S19'!C$24 -> 2 | F78: ='[August 25 2004.xls]S19'!D$24 -> 6 | G78: ='[August 25 2004.xls]S19'!E$24 -> 41
A79: 20 | B79: ='[August 25 2004.xls]S10'!$B$1 -> Danimal | C79: ='[August 25 2004.xls]S10'!$F$24 -> 68 | D79: ='[August 25 2004.xls]S10'!B$24 -> 3 | E79: ='[August 25 2004.xls]S10'!C$24 -> 11 | F79: ='[August 25 2004.xls]S10'!D$24 -> 21 | G79: ='[August 25 2004.xls]S10'!E$24 -> 33
A80: S21 | B80: ='[August 25 2004.xls]S21'!$B$1 -> 0 | C80: ='[August 25 2004.xls]S21'!$F$24 -> 0 | D80: ='[August 25 2004.xls]S21'!B$24 -> 0 | E80: ='[August 25 2004.xls]S21'!C$24 -> 0 | F80: ='[August 25 2004.xls]S21'!D$24 -> 0 | G80: ='[August 25 2004.xls]S21'!E$24 -> 0
A81: S22 | B81: ='[August 25 2004.xls]S22'!$B$1 -> 0 | C81: ='[August 25 2004.xls]S22'!$F$24 -> 0 | D81: ='[August 25 2004.xls]S22'!B$24 -> 0 | E81: ='[August 25 2004.xls]S22'!C$24 -> 0 | F81: ='[August 25 2004.xls]S22'!D$24 -> 0 | G81: ='[August 25 2004.xls]S22'!E$24 -> 0
A82: S23 | B82: ='[August 25 2004.xls]S23'!$B$1 -> 0 | C82: ='[August 25 2004.xls]S23'!$F$24 -> 0 | D82: ='[August 25 2004.xls]S23'!B$24 -> 0 | E82: ='[August 25 2004.xls]S23'!C$24 -> 0 | F82: ='[August 25 2004.xls]S23'!D$24 -> 0 | G82: ='[August 25 2004.xls]S23'!E$24 -> 0
A83: S24 | B83: ='[August 25 2004.xls]S24'!$B$1 -> 0 | C83: ='[August 25 2004.xls]S24'!$F$24 -> 0 | D83: ='[August 25 2004.xls]S24'!B$24 -> 0 | E83: ='[August 25 2004.xls]S24'!C$24 -> 0 | F83: ='[August 25 2004.xls]S24'!D$24 -> 0 | G83: ='[August 25 2004.xls]S24'!E$24 -> 0
A84: S25 | B84: ='[August 25 2004.xls]S25'!$B$1 -> 0 | C84: ='[August 25 2004.xls]S25'!$F$24 -> 0 | D84: ='[August 25 2004.xls]S25'!B$24 -> 0 | E84: ='[August 25 2004.xls]S25'!C$24 -> 0 | F84: ='[August 25 2004.xls]S25'!D$24 -> 0 | G84: ='[August 25 2004.xls]S25'!E$24 -> 0
A85: Average Points Down: | C85: =SUM(C60:C84)/$A$29 -> 31.8 | D85: =SUM(D60:D84)/$A$29 -> 1.35 | E85: =SUM(E60:E84)/$A$29 -> 2.2 | F85: =SUM(F60:F84)/$A$29 -> 4.75 | G85: =SUM(G60:G84)/$A$29 -> 23.5