B1: UDPL 3-Gun Match - Results for May 15, 2004 held at the F.A.R.M.
B2: (Results listed by Time without regard to Division) | J2: To see a description of each Stage, click on the Stage #.
B3: Click here for results by DIVISION.
A4: Place | B4: Name | C4: Div * | D4: Shoot Total | E4: Total Points Down | F4: Stage 1 | G4: String 1 | H4: String 2 | I4: PD | J4: Stage 2 | K4: String 1 | L4: String 2 | M4: PD | N4: Stage 3 | O4: String 1 | P4: PD | Q4: Stage 4 | R4: String 1 | S4: String 2 | T4: PD | U4: Stage 5 | V4: String 1 | W4: String 2 | X4: String 3 | Y4: PD | Z4: Stage 6 | AA4: String 1 | AB4: PD | AC4: Stage 7 | AD4: String 1 | AE4: String 2 | AF4: String 3 | AG4: PD | AH4: Stage 8 | AI4: String 1 | AJ4: String 2 | AK4: String 3 | AL4: String 4 | AM4: PD
A5: 1 | B5: Theodore, Ari | C5: T | D5: =+F5+J5+N5+Q5+U5+Z5+AC5+AH5 -> 306.78 | E5: =+I5+M5+P5+T5+Y5+AB5+AG5+AM5 -> 26 | F5: =+(G5+H5)+(0.5*I5) -> 44.67 | G5: 15.89 | H5: 28.78 | I5: 0 | J5: =+(K5+L5)+0.5*M5 -> 38.74 | K5: 15.64 | L5: 17.10 | M5: 12 | N5: =+(O5)+0.5*P5 -> 45.00 | O5: 45.00 | P5: 0 | Q5: =+(R5+S5)+0.5*T5 -> 71.46 | R5: 39.45 | S5: 32.01 | T5: 0 | U5: =+(V5+W5+X5)+0.5*Y5 -> 11.13 | V5: 2.62 | W5: 2.88 | X5: 5.63 | Y5: 0 | Z5: =+(AA5)+0.5*AB5 -> 35.04 | AA5: 33.04 | AB5: 4 | AC5: =+(AD5+AE5+AF5)+0.5*AG5 -> 31.07 | AD5: 8.85 | AE5: 7.77 | AF5: 9.45 | AG5: 10 | AH5: =+(AI5+AJ5+AK5+AL5)+0.5*AM5 -> 29.67 | AI5: 13.77 | AJ5: 5.89 | AK5: 4.77 | AL5: 5.24 | AM5: 0
A6: 2 | B6: Correia, Larry | C6: O | D6: =+F6+J6+N6+Q6+U6+Z6+AC6+AH6 -> 328.88 | E6: =+I6+M6+P6+T6+Y6+AB6+AG6+AM6 -> 35 | F6: =+(G6+H6)+(0.5*I6) -> 48.70 | G6: 16.31 | H6: 32.39 | I6: 0 | J6: =+(K6+L6)+0.5*M6 -> 43.34 | K6: 17.07 | L6: 15.27 | M6: 22 | N6: =+(O6)+0.5*P6 -> 23.06 | O6: 23.06 | P6: 0 | Q6: =+(R6+S6)+0.5*T6 -> 84.40 | R6: 49.43 | S6: 34.97 | T6: 0 | U6: =+(V6+W6+X6)+0.5*Y6 -> 11.25 | V6: 3.65 | W6: 3.74 | X6: 3.86 | Y6: 0 | Z6: =+(AA6)+0.5*AB6 -> 50.25 | AA6: 43.75 | AB6: 13 | AC6: =+(AD6+AE6+AF6)+0.5*AG6 -> 32.36 | AD6: 12.01 | AE6: 11.44 | AF6: 8.91 | AG6: 0 | AH6: =+(AI6+AJ6+AK6+AL6)+0.5*AM6 -> 35.52 | AI6: 4.66 | AJ6: 16.07 | AK6: 7.01 | AL6: 7.78 | AM6: 0
A7: 3 | B7: Ostler, Jeff | C7: TRO | D7: =+F7+J7+N7+Q7+U7+Z7+AC7+AH7 -> 331.88 | E7: =+I7+M7+P7+T7+Y7+AB7+AG7+AM7 -> 12 | F7: =+(G7+H7)+(0.5*I7) -> 48.80 | G7: 17.31 | H7: 31.49 | I7: 0 | J7: =+(K7+L7)+0.5*M7 -> 45.09 | K7: 21.55 | L7: 20.54 | M7: 6 | N7: =+(O7)+0.5*P7 -> 50.52 | O7: 50.52 | P7: 0 | Q7: =+(R7+S7)+0.5*T7 -> 65.47 | R7: 33.74 | S7: 31.73 | T7: 0 | U7: =+(V7+W7+X7)+0.5*Y7 -> 11.36 | V7: 3.03 | W7: 2.80 | X7: 5.53 | Y7: 0 | Z7: =+(AA7)+0.5*AB7 -> 53.32 | AA7: 50.32 | AB7: 6 | AC7: =+(AD7+AE7+AF7)+0.5*AG7 -> 35.65 | AD7: 10.78 | AE7: 12.76 | AF7: 12.11 | AG7: 0 | AH7: =+(AI7+AJ7+AK7+AL7)+0.5*AM7 -> 21.67 | AI7: 9.56 | AJ7: 4.85 | AK7: 3.81 | AL7: 3.45 | AM7: 0
A8: 4 | B8: Lowe, John | C8: L | D8: =+F8+J8+N8+Q8+U8+Z8+AC8+AH8 -> 334.61 | E8: =+I8+M8+P8+T8+Y8+AB8+AG8+AM8 -> 27 | F8: =+(G8+H8)+(0.5*I8) -> 53.62 | G8: 19.67 | H8: 33.95 | I8: 0 | J8: =+(K8+L8)+0.5*M8 -> 43.19 | K8: 18.76 | L8: 16.43 | M8: 16 | N8: =+(O8)+0.5*P8 -> 48.86 | O8: 48.86 | P8: 0 | Q8: =+(R8+S8)+0.5*T8 -> 81.50 | R8: 38.31 | S8: 43.19 | T8: 0 | U8: =+(V8+W8+X8)+0.5*Y8 -> 17.45 | V8: 8.58 | W8: 4.47 | X8: 4.40 | Y8: 0 | Z8: =+(AA8)+0.5*AB8 -> 40.50 | AA8: 35.00 | AB8: 11 | AC8: =+(AD8+AE8+AF8)+0.5*AG8 -> 28.77 | AD8: 9.65 | AE8: 9.40 | AF8: 9.72 | AG8: 0 | AH8: =+(AI8+AJ8+AK8+AL8)+0.5*AM8 -> 20.72 | AI8: 7.58 | AJ8: 4.16 | AK8: 4.39 | AL8: 4.59 | AM8: 0
A9: 5 | B9: Stilwell, Mike | C9: TRO | D9: =+F9+J9+N9+Q9+U9+Z9+AC9+AH9 -> 369.56 | E9: =+I9+M9+P9+T9+Y9+AB9+AG9+AM9 -> 3 | F9: =+(G9+H9)+(0.5*I9) -> 57.92 | G9: 22.22 | H9: 35.70 | I9: 0 | J9: =+(K9+L9)+0.5*M9 -> 36.22 | K9: 17.53 | L9: 17.69 | M9: 2 | N9: =+(O9)+0.5*P9 -> 56.53 | O9: 56.53 | P9: 0 | Q9: =+(R9+S9)+0.5*T9 -> 83.45 | R9: 45.23 | S9: 38.22 | T9: 0 | U9: =+(V9+W9+X9)+0.5*Y9 -> 10.90 | V9: 2.97 | W9: 3.07 | X9: 4.86 | Y9: 0 | Z9: =+(AA9)+0.5*AB9 -> 52.02 | AA9: 51.52 | AB9: 1 | AC9: =+(AD9+AE9+AF9)+0.5*AG9 -> 32.23 | AD9: 9.21 | AE9: 10.72 | AF9: 12.30 | AG9: 0 | AH9: =+(AI9+AJ9+AK9+AL9)+0.5*AM9 -> 40.29 | AI9: 15.08 | AJ9: 13.20 | AK9: 7.12 | AL9: 4.89 | AM9: 0
A10: 6 | B10: Knapp, Chris | C10: TRO | D10: =+F10+J10+N10+Q10+U10+Z10+AC10+AH10 -> 388.67 | E10: =+I10+M10+P10+T10+Y10+AB10+AG10+AM10 -> 48 | F10: =+(G10+H10)+(0.5*I10) -> 57.03 | G10: 20.82 | H10: 36.21 | I10: 0 | J10: =+(K10+L10)+0.5*M10 -> 51.83 | K10: 23.41 | L10: 26.92 | M10: 3 | N10: =+(O10)+0.5*P10 -> 51.03 | O10: 51.03 | P10: 0 | Q10: =+(R10+S10)+0.5*T10 -> 86.23 | R10: 34.71 | S10: 51.52 | T10: 0 | U10: =+(V10+W10+X10)+0.5*Y10 -> 13.24 | V10: 4.20 | W10: 4.39 | X10: 4.65 | Y10: 0 | Z10: =+(AA10)+0.5*AB10 -> 43.33 | AA10: 35.83 | AB10: 15 | AC10: =+(AD10+AE10+AF10)+0.5*AG10 -> 55.65 | AD10: 15.21 | AE10: 11.83 | AF10: 13.61 | AG10: 30 | AH10: =+(AI10+AJ10+AK10+AL10)+0.5*AM10 -> 30.33 | AI10: 6.91 | AJ10: 14.33 | AK10: 4.51 | AL10: 4.58 | AM10: 0
A11: 7 | B11: Zaccardi, Juke | C11: TRO | D11: =+F11+J11+N11+Q11+U11+Z11+AC11+AH11 -> 396.93 | E11: =+I11+M11+P11+T11+Y11+AB11+AG11+AM11 -> 44 | F11: =+(G11+H11)+(0.5*I11) -> 54.22 | G11: 33.07 | H11: 21.15 | I11: 0 | J11: =+(K11+L11)+0.5*M11 -> 35.94 | K11: 13.77 | L11: 14.17 | M11: 16 | N11: =+(O11)+0.5*P11 -> 83.67 | O11: 83.67 | P11: 0 | Q11: =+(R11+S11)+0.5*T11 -> 83.75 | R11: 45.14 | S11: 38.61 | T11: 0 | U11: =+(V11+W11+X11)+0.5*Y11 -> 16.27 | V11: 3.92 | W11: 4.41 | X11: 7.94 | Y11: 0 | Z11: =+(AA11)+0.5*AB11 -> 45.20 | AA11: 36.20 | AB11: 18 | AC11: =+(AD11+AE11+AF11)+0.5*AG11 -> 48.92 | AD11: 22.35 | AE11: 13.39 | AF11: 13.18 | AG11: 0 | AH11: =+(AI11+AJ11+AK11+AL11)+0.5*AM11 -> 28.96 | AI11: 6.16 | AJ11: 7.36 | AK11: 4.74 | AL11: 5.70 | AM11: 10
A12: 8 | B12: Richards, Dave | C12: TRO | D12: =+F12+J12+N12+Q12+U12+Z12+AC12+AH12 -> 406.93 | E12: =+I12+M12+P12+T12+Y12+AB12+AG12+AM12 -> 19 | F12: =+(G12+H12)+(0.5*I12) -> 55.56 | G12: 27.04 | H12: 28.52 | I12: 0 | J12: =+(K12+L12)+0.5*M12 -> 36.87 | K12: 16.51 | L12: 15.36 | M12: 10 | N12: =+(O12)+0.5*P12 -> 81.52 | O12: 81.52 | P12: 0 | Q12: =+(R12+S12)+0.5*T12 -> 73.03 | R12: 34.17 | S12: 38.86 | T12: 0 | U12: =+(V12+W12+X12)+0.5*Y12 -> 11.22 | V12: 3.60 | W12: 2.68 | X12: 4.94 | Y12: 0 | Z12: =+(AA12)+0.5*AB12 -> 48.30 | AA12: 43.80 | AB12: 9 | AC12: =+(AD12+AE12+AF12)+0.5*AG12 -> 41.78 | AD12: 20.07 | AE12: 9.09 | AF12: 12.62 | AG12: 0 | AH12: =+(AI12+AJ12+AK12+AL12)+0.5*AM12 -> 58.65 | AI12: 18.71 | AJ12: 12.00 | AK12: 21.39 | AL12: 6.55 | AM12: 0
A13: 9 | B13: Roberts, Bruce | C13: TRO | D13: =+F13+J13+N13+Q13+U13+Z13+AC13+AH13 -> 414.18 | E13: =+I13+M13+P13+T13+Y13+AB13+AG13+AM13 -> 47 | F13: =+(G13+H13)+(0.5*I13) -> 51.66 | G13: 23.16 | H13: 28.50 | I13: 0 | J13: =+(K13+L13)+0.5*M13 -> 60.82 | K13: 25.02 | L13: 22.30 | M13: 27 | N13: =+(O13)+0.5*P13 -> 67.87 | O13: 67.87 | P13: 0 | Q13: =+(R13+S13)+0.5*T13 -> 104.76 | R13: 63.37 | S13: 41.39 | T13: 0 | U13: =+(V13+W13+X13)+0.5*Y13 -> 16.94 | V13: 3.95 | W13: 3.46 | X13: 9.53 | Y13: 0 | Z13: =+(AA13)+0.5*AB13 -> 44.55 | AA13: 34.55 | AB13: 20 | AC13: =+(AD13+AE13+AF13)+0.5*AG13 -> 43.10 | AD13: 18.09 | AE13: 13.98 | AF13: 11.03 | AG13: 0 | AH13: =+(AI13+AJ13+AK13+AL13)+0.5*AM13 -> 24.48 | AI13: 8.36 | AJ13: 4.68 | AK13: 7.27 | AL13: 4.17 | AM13: 0
A14: 10 | B14: Brown, Jason | C14: L | D14: =+F14+J14+N14+Q14+U14+Z14+AC14+AH14 -> 414.42 | E14: =+I14+M14+P14+T14+Y14+AB14+AG14+AM14 -> 56 | F14: =+(G14+H14)+(0.5*I14) -> 72.80 | G14: 35.34 | H14: 37.46 | I14: 0 | J14: =+(K14+L14)+0.5*M14 -> 45.40 | K14: 20.09 | L14: 20.81 | M14: 9 | N14: =+(O14)+0.5*P14 -> 79.30 | O14: 79.30 | P14: 0 | Q14: =+(R14+S14)+0.5*T14 -> 81.30 | R14: 43.39 | S14: 37.91 | T14: 0 | U14: =+(V14+W14+X14)+0.5*Y14 -> 14.62 | V14: 4.05 | W14: 3.63 | X14: 6.94 | Y14: 0 | Z14: =+(AA14)+0.5*AB14 -> 50.03 | AA14: 36.53 | AB14: 27 | AC14: =+(AD14+AE14+AF14)+0.5*AG14 -> 42.90 | AD14: 11.29 | AE14: 10.17 | AF14: 11.44 | AG14: 20 | AH14: =+(AI14+AJ14+AK14+AL14)+0.5*AM14 -> 28.07 | AI14: 11.36 | AJ14: 6.37 | AK14: 4.56 | AL14: 5.78 | AM14: 0
A15: 11 | B15: Collins, Ken | C15: O | D15: =+F15+J15+N15+Q15+U15+Z15+AC15+AH15 -> 416.17 | E15: =+I15+M15+P15+T15+Y15+AB15+AG15+AM15 -> 32 | F15: =+(G15+H15)+(0.5*I15) -> 64.44 | G15: 33.49 | H15: 30.95 | I15: 0 | J15: =+(K15+L15)+0.5*M15 -> 46.13 | K15: 21.72 | L15: 19.91 | M15: 9 | N15: =+(O15)+0.5*P15 -> 75.52 | O15: 75.52 | P15: 0 | Q15: =+(R15+S15)+0.5*T15 -> 83.02 | R15: 44.88 | S15: 38.14 | T15: 0 | U15: =+(V15+W15+X15)+0.5*Y15 -> 19.89 | V15: 3.33 | W15: 4.85 | X15: 11.71 | Y15: 0 | Z15: =+(AA15)+0.5*AB15 -> 68.52 | AA15: 57.02 | AB15: 23 | AC15: =+(AD15+AE15+AF15)+0.5*AG15 -> 26.39 | AD15: 8.82 | AE15: 9.47 | AF15: 8.10 | AG15: 0 | AH15: =+(AI15+AJ15+AK15+AL15)+0.5*AM15 -> 32.26 | AI15: 12.17 | AJ15: 7.80 | AK15: 6.26 | AL15: 6.03 | AM15: 0
A16: 12 | B16: Zaccardi, Pat | C16: L | D16: =+F16+J16+N16+Q16+U16+Z16+AC16+AH16 -> 426.11 | E16: =+I16+M16+P16+T16+Y16+AB16+AG16+AM16 -> 68 | F16: =+(G16+H16)+(0.5*I16) -> 58.38 | G16: 32.90 | H16: 25.48 | I16: 0 | J16: =+(K16+L16)+0.5*M16 -> 44.28 | K16: 19.17 | L16: 17.61 | M16: 15 | N16: =+(O16)+0.5*P16 -> 72.14 | O16: 72.14 | P16: 0 | Q16: =+(R16+S16)+0.5*T16 -> 94.54 | R16: 49.63 | S16: 44.91 | T16: 0 | U16: =+(V16+W16+X16)+0.5*Y16 -> 16.55 | V16: 4.36 | W16: 4.24 | X16: 7.95 | Y16: 0 | Z16: =+(AA16)+0.5*AB16 -> 59.02 | AA16: 37.52 | AB16: 43 | AC16: =+(AD16+AE16+AF16)+0.5*AG16 -> 35.33 | AD16: 12.96 | AE16: 10.08 | AF16: 12.29 | AG16: 0 | AH16: =+(AI16+AJ16+AK16+AL16)+0.5*AM16 -> 45.87 | AI16: 16.44 | AJ16: 10.41 | AK16: 7.80 | AL16: 6.22 | AM16: 10
A17: 13 | B17: Mousley, Roger | C17: L | D17: =+F17+J17+N17+Q17+U17+Z17+AC17+AH17 -> 430.49 | E17: =+I17+M17+P17+T17+Y17+AB17+AG17+AM17 -> 56 | F17: =+(G17+H17)+(0.5*I17) -> 71.09 | G17: 26.07 | H17: 45.02 | I17: 0 | J17: =+(K17+L17)+0.5*M17 -> 46.39 | K17: 20.09 | L17: 18.80 | M17: 15 | N17: =+(O17)+0.5*P17 -> 58.96 | O17: 58.96 | P17: 0 | Q17: =+(R17+S17)+0.5*T17 -> 85.81 | R17: 43.14 | S17: 42.67 | T17: 0 | U17: =+(V17+W17+X17)+0.5*Y17 -> 12.41 | V17: 3.09 | W17: 2.91 | X17: 6.41 | Y17: 0 | Z17: =+(AA17)+0.5*AB17 -> 44.43 | AA17: 33.93 | AB17: 21 | AC17: =+(AD17+AE17+AF17)+0.5*AG17 -> 53.85 | AD17: 11.18 | AE17: 19.68 | AF17: 12.99 | AG17: 20 | AH17: =+(AI17+AJ17+AK17+AL17)+0.5*AM17 -> 57.55 | AI17: 10.00 | AJ17: 12.45 | AK17: 23.12 | AL17: 11.98 | AM17: 0
A18: 14 | B18: Scott, Alan | C18: TRO | D18: =+F18+J18+N18+Q18+U18+Z18+AC18+AH18 -> 483.49 | E18: =+I18+M18+P18+T18+Y18+AB18+AG18+AM18 -> 60 | F18: =+(G18+H18)+(0.5*I18) -> 75.27 | G18: 35.83 | H18: 39.44 | I18: 0 | J18: =+(K18+L18)+0.5*M18 -> 50.62 | K18: 21.82 | L18: 19.80 | M18: 18 | N18: =+(O18)+0.5*P18 -> 80.34 | O18: 80.34 | P18: 0 | Q18: =+(R18+S18)+0.5*T18 -> 89.93 | R18: 47.47 | S18: 42.46 | T18: 0 | U18: =+(V18+W18+X18)+0.5*Y18 -> 16.46 | V18: 4.96 | W18: 5.20 | X18: 6.30 | Y18: 0 | Z18: =+(AA18)+0.5*AB18 -> 39.40 | AA18: 33.40 | AB18: 12 | AC18: =+(AD18+AE18+AF18)+0.5*AG18 -> 78.21 | AD18: 13.71 | AE18: 22.75 | AF18: 26.75 | AG18: 30 | AH18: =+(AI18+AJ18+AK18+AL18)+0.5*AM18 -> 53.26 | AI18: 9.47 | AJ18: 7.06 | AK18: 8.57 | AL18: 28.16 | AM18: 0
A19: 15 | B19: Simpson, Harold | C19: TRO | D19: =+F19+J19+N19+Q19+U19+Z19+AC19+AH19 -> 489.35 | E19: =+I19+M19+P19+T19+Y19+AB19+AG19+AM19 -> 13 | F19: =+(G19+H19)+(0.5*I19) -> 81.08 | G19: 35.56 | H19: 45.52 | I19: 0 | J19: =+(K19+L19)+0.5*M19 -> 60.69 | K19: 32.94 | L19: 22.75 | M19: 10 | N19: =+(O19)+0.5*P19 -> 87.63 | O19: 87.63 | P19: 0 | Q19: =+(R19+S19)+0.5*T19 -> 105.79 | R19: 48.60 | S19: 57.19 | T19: 0 | U19: =+(V19+W19+X19)+0.5*Y19 -> 16.18 | V19: 5.19 | W19: 4.55 | X19: 6.44 | Y19: 0 | Z19: =+(AA19)+0.5*AB19 -> 57.25 | AA19: 55.75 | AB19: 3 | AC19: =+(AD19+AE19+AF19)+0.5*AG19 -> 39.68 | AD19: 14.31 | AE19: 12.65 | AF19: 12.72 | AG19: 0 | AH19: =+(AI19+AJ19+AK19+AL19)+0.5*AM19 -> 41.05 | AI19: 11.61 | AJ19: 13.17 | AK19: 11.58 | AL19: 4.69 | AM19: 0
A20: 16 | B20: Gurr, Gene | C20: TRO | D20: =+F20+J20+N20+Q20+U20+Z20+AC20+AH20 -> 506.90 | E20: =+I20+M20+P20+T20+Y20+AB20+AG20+AM20 -> 24 | F20: =+(G20+H20)+(0.5*I20) -> 75.53 | G20: 31.87 | H20: 43.66 | I20: 0 | J20: =+(K20+L20)+0.5*M20 -> 50.12 | K20: 21.03 | L20: 24.09 | M20: 10 | N20: =+(O20)+0.5*P20 -> 76.69 | O20: 76.69 | P20: 0 | Q20: =+(R20+S20)+0.5*T20 -> 111.93 | R20: 57.17 | S20: 54.76 | T20: 0 | U20: =+(V20+W20+X20)+0.5*Y20 -> 17.12 | V20: 4.83 | W20: 4.14 | X20: 8.15 | Y20: 0 | Z20: =+(AA20)+0.5*AB20 -> 52.42 | AA20: 50.42 | AB20: 4 | AC20: =+(AD20+AE20+AF20)+0.5*AG20 -> 76.46 | AD20: 26.39 | AE20: 23.64 | AF20: 21.43 | AG20: 10 | AH20: =+(AI20+AJ20+AK20+AL20)+0.5*AM20 -> 46.63 | AI20: 14.62 | AJ20: 13.27 | AK20: 11.33 | AL20: 7.41 | AM20: 0
A21: 17 | B21: Scott, Michael | C21: TRO | D21: =+F21+J21+N21+Q21+U21+Z21+AC21+AH21 -> 516.21 | E21: =+I21+M21+P21+T21+Y21+AB21+AG21+AM21 -> 80 | F21: =+(G21+H21)+(0.5*I21) -> 89.42 | G21: 34.82 | H21: 54.60 | I21: 0 | J21: =+(K21+L21)+0.5*M21 -> 52.11 | K21: 19.24 | L21: 17.37 | M21: 31 | N21: =+(O21)+0.5*P21 -> 95.91 | O21: 95.91 | P21: 0 | Q21: =+(R21+S21)+0.5*T21 -> 97.47 | R21: 52.04 | S21: 45.43 | T21: 0 | U21: =+(V21+W21+X21)+0.5*Y21 -> 21.64 | V21: 6.60 | W21: 7.56 | X21: 7.48 | Y21: 0 | Z21: =+(AA21)+0.5*AB21 -> 60.50 | AA21: 46.00 | AB21: 29 | AC21: =+(AD21+AE21+AF21)+0.5*AG21 -> 63.95 | AD21: 16.66 | AE21: 22.42 | AF21: 14.87 | AG21: 20 | AH21: =+(AI21+AJ21+AK21+AL21)+0.5*AM21 -> 35.21 | AI21: 10.32 | AJ21: 10.02 | AK21: 5.38 | AL21: 9.49 | AM21: 0
A22: 18 | B22: Beck, Dave | C22: L | D22: =+F22+J22+N22+Q22+U22+Z22+AC22+AH22 -> 534.27 | E22: =+I22+M22+P22+T22+Y22+AB22+AG22+AM22 -> 47 | F22: =+(G22+H22)+(0.5*I22) -> 65.47 | G22: 15.41 | H22: 50.06 | I22: 0 | J22: =+(K22+L22)+0.5*M22 -> 54.22 | K22: 20.32 | L22: 24.40 | M22: 19 | N22: =+(O22)+0.5*P22 -> 56.50 | O22: 56.50 | P22: 0 | Q22: =+(R22+S22)+0.5*T22 -> 111.10 | R22: 58.71 | S22: 52.39 | T22: 0 | U22: =+(V22+W22+X22)+0.5*Y22 -> 23.22 | V22: 4.08 | W22: 8.30 | X22: 10.84 | Y22: 0 | Z22: =+(AA22)+0.5*AB22 -> 67.87 | AA22: 63.87 | AB22: 8 | AC22: =+(AD22+AE22+AF22)+0.5*AG22 -> 43.42 | AD22: 18.40 | AE22: 13.52 | AF22: 11.50 | AG22: 0 | AH22: =+(AI22+AJ22+AK22+AL22)+0.5*AM22 -> 112.47 | AI22: 21.96 | AJ22: 30.00 | AK22: 30.00 | AL22: 20.51 | AM22: 20
A23: 19 | B23: Stone, Scott | C23: T | D23: =+F23+J23+N23+Q23+U23+Z23+AC23+AH23 -> 592.51 | E23: =+I23+M23+P23+T23+Y23+AB23+AG23+AM23 -> 166 | F23: =+(G23+H23)+(0.5*I23) -> 59.02 | G23: 23.04 | H23: 35.98 | I23: 0 | J23: =+(K23+L23)+0.5*M23 -> 54.20 | K23: 20.44 | L23: 23.26 | M23: 21 | N23: =+(O23)+0.5*P23 -> 70.49 | O23: 70.49 | P23: 0 | Q23: =+(R23+S23)+0.5*T23 -> 143.46 | R23: 53.43 | S23: 60.03 | T23: 60 | U23: =+(V23+W23+X23)+0.5*Y23 -> 19.19 | V23: 6.96 | W23: 4.15 | X23: 8.08 | Y23: 0 | Z23: =+(AA23)+0.5*AB23 -> 74.02 | AA23: 61.52 | AB23: 25 | AC23: =+(AD23+AE23+AF23)+0.5*AG23 -> 53.28 | AD23: 19.96 | AE23: 13.14 | AF23: 10.18 | AG23: 20 | AH23: =+(AI23+AJ23+AK23+AL23)+0.5*AM23 -> 118.85 | AI23: 33.30 | AJ23: 30.94 | AK23: 19.23 | AL23: 15.38 | AM23: 40
A24: 20 | B24: Ostler, Jay | C24: T | D24: =+F24+J24+N24+Q24+U24+Z24+AC24+AH24 -> 597.99 | E24: =+I24+M24+P24+T24+Y24+AB24+AG24+AM24 -> 36 | F24: =+(G24+H24)+(0.5*I24) -> 100.86 | G24: 43.12 | H24: 57.74 | I24: 0 | J24: =+(K24+L24)+0.5*M24 -> 67.16 | K24: 32.94 | L24: 30.22 | M24: 8 | N24: =+(O24)+0.5*P24 -> 88.92 | O24: 88.92 | P24: 0 | Q24: =+(R24+S24)+0.5*T24 -> 106.71 | R24: 52.12 | S24: 54.59 | T24: 0 | U24: =+(V24+W24+X24)+0.5*Y24 -> 22.86 | V24: 5.30 | W24: 6.71 | X24: 10.85 | Y24: 0 | Z24: =+(AA24)+0.5*AB24 -> 87.96 | AA24: 78.96 | AB24: 18 | AC24: =+(AD24+AE24+AF24)+0.5*AG24 -> 63.13 | AD24: 24.13 | AE24: 17.86 | AF24: 16.14 | AG24: 10 | AH24: =+(AI24+AJ24+AK24+AL24)+0.5*AM24 -> 60.39 | AI24: 11.99 | AJ24: 15.52 | AK24: 6.99 | AL24: 25.89 | AM24: 0
A25: 21 | B25: Correia, Jack | C25: L | D25: =+F25+J25+N25+Q25+U25+Z25+AC25+AH25 -> 601.86 | E25: =+I25+M25+P25+T25+Y25+AB25+AG25+AM25 -> 113 | F25: =+(G25+H25)+(0.5*I25) -> 112.79 | G25: 29.88 | H25: 82.91 | I25: 0 | J25: =+(K25+L25)+0.5*M25 -> 59.47 | K25: 21.28 | L25: 19.19 | M25: 38 | N25: =+(O25)+0.5*P25 -> 92.97 | O25: 92.97 | P25: 0 | Q25: =+(R25+S25)+0.5*T25 -> 84.99 | R25: 39.87 | S25: 45.12 | T25: 0 | U25: =+(V25+W25+X25)+0.5*Y25 -> 45.39 | V25: 22.77 | W25: 5.52 | X25: 12.10 | Y25: 10 | Z25: =+(AA25)+0.5*AB25 -> 90.98 | AA25: 68.48 | AB25: 45 | AC25: =+(AD25+AE25+AF25)+0.5*AG25 -> 70.11 | AD25: 21.84 | AE25: 19.20 | AF25: 19.07 | AG25: 20 | AH25: =+(AI25+AJ25+AK25+AL25)+0.5*AM25 -> 45.16 | AI25: 25.76 | AJ25: 5.90 | AK25: 4.64 | AL25: 8.86 | AM25: 0
A26: 22 | B26: Black, Jim | C26: L | D26: =+F26+J26+N26+Q26+U26+Z26+AC26+AH26 -> 601.94 | E26: =+I26+M26+P26+T26+Y26+AB26+AG26+AM26 -> 91 | F26: =+(G26+H26)+(0.5*I26) -> 82.23 | G26: 35.47 | H26: 46.76 | I26: 0 | J26: =+(K26+L26)+0.5*M26 -> 61.89 | K26: 25.21 | L26: 23.68 | M26: 26 | N26: =+(O26)+0.5*P26 -> 137.19 | O26: 137.19 | P26: 0 | Q26: =+(R26+S26)+0.5*T26 -> 94.38 | R26: 49.69 | S26: 44.69 | T26: 0 | U26: =+(V26+W26+X26)+0.5*Y26 -> 18.05 | V26: 6.30 | W26: 7.56 | X26: 4.19 | Y26: 0 | Z26: =+(AA26)+0.5*AB26 -> 68.43 | AA26: 45.93 | AB26: 45 | AC26: =+(AD26+AE26+AF26)+0.5*AG26 -> 82.73 | AD26: 22.32 | AE26: 29.60 | AF26: 20.81 | AG26: 20 | AH26: =+(AI26+AJ26+AK26+AL26)+0.5*AM26 -> 57.04 | AI26: 19.45 | AJ26: 19.38 | AK26: 9.60 | AL26: 8.61 | AM26: 0
A27: 23 | B27: Roberts, Jay | C27: TRO | D27: =+F27+J27+N27+Q27+U27+Z27+AC27+AH27 -> 614.57 | E27: =+I27+M27+P27+T27+Y27+AB27+AG27+AM27 -> 50 | F27: =+(G27+H27)+(0.5*I27) -> 64.51 | G27: 32.93 | H27: 31.58 | I27: 0 | J27: =+(K27+L27)+0.5*M27 -> 67.41 | K27: 29.84 | L27: 21.57 | M27: 32 | N27: =+(O27)+0.5*P27 -> 106.01 | O27: 106.01 | P27: 0 | Q27: =+(R27+S27)+0.5*T27 -> 102.40 | R27: 53.75 | S27: 48.65 | T27: 0 | U27: =+(V27+W27+X27)+0.5*Y27 -> 20.20 | V27: 5.19 | W27: 5.42 | X27: 9.59 | Y27: 0 | Z27: =+(AA27)+0.5*AB27 -> 106.81 | AA27: 102.81 | AB27: 8 | AC27: =+(AD27+AE27+AF27)+0.5*AG27 -> 76.73 | AD27: 40.59 | AE27: 14.40 | AF27: 16.74 | AG27: 10 | AH27: =+(AI27+AJ27+AK27+AL27)+0.5*AM27 -> 70.50 | AI27: 16.64 | AJ27: 9.43 | AK27: 23.09 | AL27: 21.34 | AM27: 0
A28: 24 | B28: Brown, Michael | C28: T | D28: =+F28+J28+N28+Q28+U28+Z28+AC28+AH28 -> 717.36 | E28: =+I28+M28+P28+T28+Y28+AB28+AG28+AM28 -> 160 | F28: =+(G28+H28)+(0.5*I28) -> 73.87 | G28: 34.34 | H28: 39.53 | I28: 0 | J28: =+(K28+L28)+0.5*M28 -> 90.53 | K28: 44.43 | L28: 35.60 | M28: 21 | N28: =+(O28)+0.5*P28 -> 93.27 | O28: 93.27 | P28: 0 | Q28: =+(R28+S28)+0.5*T28 -> 173.31 | R28: 62.02 | S28: 71.29 | T28: 80 | U28: =+(V28+W28+X28)+0.5*Y28 -> 19.52 | V28: 7.46 | W28: 5.16 | X28: 6.90 | Y28: 0 | Z28: =+(AA28)+0.5*AB28 -> 76.80 | AA28: 67.30 | AB28: 19 | AC28: =+(AD28+AE28+AF28)+0.5*AG28 -> 89.17 | AD28: 26.14 | AE28: 29.11 | AF28: 28.92 | AG28: 10 | AH28: =+(AI28+AJ28+AK28+AL28)+0.5*AM28 -> 100.89 | AI28: 21.14 | AJ28: 15.34 | AK28: 21.61 | AL28: 27.80 | AM28: 30
A29: 25 | B29: Pribyl, Guy | C29: T | D29: =+F29+J29+N29+Q29+U29+Z29+AC29+AH29 -> 724.25 | E29: =+I29+M29+P29+T29+Y29+AB29+AG29+AM29 -> 140 | F29: =+(G29+H29)+(0.5*I29) -> 103.00 | G29: 43.46 | H29: 59.54 | I29: 0 | J29: =+(K29+L29)+0.5*M29 -> 72.10 | K29: 28.41 | L29: 25.69 | M29: 36 | N29: =+(O29)+0.5*P29 -> 100.48 | O29: 100.48 | P29: 0 | Q29: =+(R29+S29)+0.5*T29 -> 157.07 | R29: 69.90 | S29: 57.17 | T29: 60 | U29: =+(V29+W29+X29)+0.5*Y29 -> 23.74 | V29: 6.90 | W29: 7.46 | X29: 9.38 | Y29: 0 | Z29: =+(AA29)+0.5*AB29 -> 116.69 | AA29: 109.69 | AB29: 14 | AC29: =+(AD29+AE29+AF29)+0.5*AG29 -> 84.06 | AD29: 27.29 | AE29: 23.03 | AF29: 23.74 | AG29: 20 | AH29: =+(AI29+AJ29+AK29+AL29)+0.5*AM29 -> 67.11 | AI29: 13.78 | AJ29: 17.94 | AK29: 20.76 | AL29: 9.63 | AM29: 10
A30: 26 | B30: Fentenberger, Matt | C30: TRO | D30: =+F30+J30+N30+Q30+U30+Z30+AC30+AH30 -> 730.49 | E30: =+I30+M30+P30+T30+Y30+AB30+AG30+AM30 -> 181 | F30: =+(G30+H30)+(0.5*I30) -> 126.89 | G30: 54.16 | H30: 72.73 | I30: 0 | J30: =+(K30+L30)+0.5*M30 -> 77.65 | K30: 32.90 | L30: 26.75 | M30: 36 | N30: =+(O30)+0.5*P30 -> 102.37 | O30: 42.37 | P30: 120 | Q30: =+(R30+S30)+0.5*T30 -> 144.63 | R30: 72.10 | S30: 72.53 | T30: 0 | U30: =+(V30+W30+X30)+0.5*Y30 -> 21.41 | V30: 6.77 | W30: 5.92 | X30: 8.72 | Y30: 0 | Z30: =+(AA30)+0.5*AB30 -> 76.65 | AA30: 74.15 | AB30: 5 | AC30: =+(AD30+AE30+AF30)+0.5*AG30 -> 81.45 | AD30: 34.74 | AE30: 25.74 | AF30: 20.97 | AG30: 0 | AH30: =+(AI30+AJ30+AK30+AL30)+0.5*AM30 -> 99.44 | AI30: 30.00 | AJ30: 19.03 | AK30: 30.00 | AL30: 10.41 | AM30: 20
A31: 27 | B31: Crawford, George | C31: T | D31: =+F31+J31+N31+Q31+U31+Z31+AC31+AH31 -> 800.13 | E31: =+I31+M31+P31+T31+Y31+AB31+AG31+AM31 -> 30 | F31: =+(G31+H31)+(0.5*I31) -> 112.98 | G31: 58.50 | H31: 54.48 | I31: 0 | J31: =+(K31+L31)+0.5*M31 -> 72.50 | K31: 38.53 | L31: 32.47 | M31: 3 | N31: =+(O31)+0.5*P31 -> 142.50 | O31: 142.50 | P31: 0 | Q31: =+(R31+S31)+0.5*T31 -> 153.50 | R31: 70.72 | S31: 82.78 | T31: 0 | U31: =+(V31+W31+X31)+0.5*Y31 -> 39.12 | V31: 11.54 | W31: 10.69 | X31: 16.89 | Y31: 0 | Z31: =+(AA31)+0.5*AB31 -> 102.46 | AA31: 98.96 | AB31: 7 | AC31: =+(AD31+AE31+AF31)+0.5*AG31 -> 90.17 | AD31: 26.70 | AE31: 37.76 | AF31: 20.71 | AG31: 10 | AH31: =+(AI31+AJ31+AK31+AL31)+0.5*AM31 -> 86.90 | AI31: 14.33 | AJ31: 31.72 | AK31: 26.73 | AL31: 9.12 | AM31: 10
A32: 28 | B32: Wong, Hang | C32: TRO | D32: =+F32+J32+N32+Q32+U32+Z32+AC32+AH32 -> 830.27 | E32: =+I32+M32+P32+T32+Y32+AB32+AG32+AM32 -> 140 | F32: =+(G32+H32)+(0.5*I32) -> 133.50 | G32: 72.12 | H32: 61.38 | I32: 0 | J32: =+(K32+L32)+0.5*M32 -> 75.27 | K32: 21.04 | L32: 23.23 | M32: =8+2+14+8+6+10+9+5 -> 62 | N32: =+(O32)+0.5*P32 -> 125.76 | O32: 125.76 | P32: 0 | Q32: =+(R32+S32)+0.5*T32 -> 119.70 | R32: 62.14 | S32: 57.56 | T32: 0 | U32: =+(V32+W32+X32)+0.5*Y32 -> 80.55 | V32: 7.67 | W32: 32.64 | X32: 35.24 | Y32: 10 | Z32: =+(AA32)+0.5*AB32 -> 57.14 | AA32: 38.14 | AB32: 38 | AC32: =+(AD32+AE32+AF32)+0.5*AG32 -> 111.55 | AD32: 38.70 | AE32: 33.00 | AF32: 29.85 | AG32: 20 | AH32: =+(AI32+AJ32+AK32+AL32)+0.5*AM32 -> 126.80 | AI32: 23.93 | AJ32: 42.44 | AK32: 32.54 | AL32: 22.89 | AM32: 10
A33: 29 | B33: Pribyl, Steve | C33: T | D33: =+F33+J33+N33+Q33+U33+Z33+AC33+AH33 -> 1053.73 | E33: =+I33+M33+P33+T33+Y33+AB33+AG33+AM33 -> 214 | F33: =+(G33+H33)+(0.5*I33) -> 117.96 | G33: 49.61 | H33: 68.35 | I33: 0 | J33: =+(K33+L33)+0.5*M33 -> 100.70 | K33: 45.14 | L33: 38.56 | M33: 34 | N33: =+(O33)+0.5*P33 -> 146.00 | O33: 146.00 | P33: 0 | Q33: =+(R33+S33)+0.5*T33 -> 180.81 | R33: 63.54 | S33: 72.27 | T33: 90 | U33: =+(V33+W33+X33)+0.5*Y33 -> 43.41 | V33: 7.71 | W33: 6.92 | X33: 28.78 | Y33: 0 | Z33: =+(AA33)+0.5*AB33 -> 145.00 | AA33: 130.00 | AB33: 30 | AC33: =+(AD33+AE33+AF33)+0.5*AG33 -> 200.58 | AD33: 48.31 | AE33: 88.87 | AF33: 58.40 | AG33: 10 | AH33: =+(AI33+AJ33+AK33+AL33)+0.5*AM33 -> 119.27 | AI33: 31.17 | AJ33: 20.02 | AK33: 19.53 | AL33: 23.55 | AM33: 50
A34: 30 | B34: Huff, Blake | C34: TRO | D34: DNF | E34: DNF | F34: DNF | J34: DNF | N34: DNF | Q34: DNF | U34: =+(V34+W34+X34)+0.5*Y34 -> 15.63 | V34: 3.01 | W34: 3.79 | X34: 8.83 | Y34: 0 | Z34: =+(AA34)+0.5*AB34 -> 64.46 | AA34: 60.96 | AB34: 7 | AC34: =+(AD34+AE34+AF34)+0.5*AG34 -> 29.01 | AD34: 10.19 | AE34: 7.04 | AF34: 11.78 | AG34: 0 | AH34: =+(AI34+AJ34+AK34+AL34)+0.5*AM34 -> 69.16 | AI34: 13.30 | AJ34: 7.02 | AK34: 25.36 | AL34: 18.48 | AM34: 10
A35: Notes:
A36: - | B36: Div * - Refer to the UDPL 3-Gun Division Specifications for specifics on each Division.
B37: L = | C37: LIMITED
B38: T = | C38: TACTICAL
B39: TRO = | C39: TACTICAL RIFLE-OPTICAL
B40: O = | C40: OPEN
A41: PD | B41: = Points Down = .5 seconds x Points Down. PD Total is added to the total Stage time.
A42: XX | B42: = Indicates that the Points Down value includes some kind of penalty (Procedural Error, Hits on Non-Threat, Misses on Steel (5 seconds each), etc.).
A43: DNF | B43: = Did Not Finish
A44: NS | B44: = No Score was recorded for this string. Shooter placed lower than indicated.
A45: ? | B45: = Shooter did not indicate which Division he should be scored in.