B1: UDPL 3-Gun Match - Results for May 15, 2004 held at the F.A.R.M.
B2: (Results listed by Division) | J2: To see a description of each Stage, click on the Stage #.
B3: Click here for results by TIME.
A4: Place | B4: Name | C4: Div * | D4: Shoot Total | E4: Total Points Down | F4: Stage 1 | G4: String 1 | H4: String 2 | I4: PD | J4: Stage 2 | K4: String 1 | L4: String 2 | M4: PD | N4: Stage 3 | O4: String 1 | P4: PD | Q4: Stage 4 | R4: String 1 | S4: String 2 | T4: PD | U4: Stage 5 | V4: String 1 | W4: String 2 | X4: String 3 | Y4: PD | Z4: Stage 6 | AA4: String 1 | AB4: PD | AC4: Stage 7 | AD4: String 1 | AE4: String 2 | AF4: String 3 | AG4: PD | AH4: Stage 8 | AI4: String 1 | AJ4: String 2 | AK4: String 3 | AL4: String 4 | AM4: PD
A5: 1 | B5: Lowe, John | C5: L | D5: =+F5+J5+N5+Q5+U5+Z5+AC5+AH5 -> 334.61 | E5: =+I5+M5+P5+T5+Y5+AB5+AG5+AM5 -> 27 | F5: =+(G5+H5)+(0.5*I5) -> 53.62 | G5: 19.67 | H5: 33.95 | I5: 0 | J5: =+(K5+L5)+0.5*M5 -> 43.19 | K5: 18.76 | L5: 16.43 | M5: 16 | N5: =+(O5)+0.5*P5 -> 48.86 | O5: 48.86 | P5: 0 | Q5: =+(R5+S5)+0.5*T5 -> 81.50 | R5: 38.31 | S5: 43.19 | T5: 0 | U5: =+(V5+W5+X5)+0.5*Y5 -> 17.45 | V5: 8.58 | W5: 4.47 | X5: 4.40 | Y5: 0 | Z5: =+(AA5)+0.5*AB5 -> 40.50 | AA5: 35.00 | AB5: 11 | AC5: =+(AD5+AE5+AF5)+0.5*AG5 -> 28.77 | AD5: 9.65 | AE5: 9.40 | AF5: 9.72 | AG5: 0 | AH5: =+(AI5+AJ5+AK5+AL5)+0.5*AM5 -> 20.72 | AI5: 7.58 | AJ5: 4.16 | AK5: 4.39 | AL5: 4.59 | AM5: 0
A6: 2 | B6: Brown, Jason | C6: L | D6: =+F6+J6+N6+Q6+U6+Z6+AC6+AH6 -> 414.42 | E6: =+I6+M6+P6+T6+Y6+AB6+AG6+AM6 -> 56 | F6: =+(G6+H6)+(0.5*I6) -> 72.80 | G6: 35.34 | H6: 37.46 | I6: 0 | J6: =+(K6+L6)+0.5*M6 -> 45.40 | K6: 20.09 | L6: 20.81 | M6: 9 | N6: =+(O6)+0.5*P6 -> 79.30 | O6: 79.30 | P6: 0 | Q6: =+(R6+S6)+0.5*T6 -> 81.30 | R6: 43.39 | S6: 37.91 | T6: 0 | U6: =+(V6+W6+X6)+0.5*Y6 -> 14.62 | V6: 4.05 | W6: 3.63 | X6: 6.94 | Y6: 0 | Z6: =+(AA6)+0.5*AB6 -> 50.03 | AA6: 36.53 | AB6: 27 | AC6: =+(AD6+AE6+AF6)+0.5*AG6 -> 42.90 | AD6: 11.29 | AE6: 10.17 | AF6: 11.44 | AG6: 20 | AH6: =+(AI6+AJ6+AK6+AL6)+0.5*AM6 -> 28.07 | AI6: 11.36 | AJ6: 6.37 | AK6: 4.56 | AL6: 5.78 | AM6: 0
A7: 3 | B7: Zaccardi, Pat | C7: L | D7: =+F7+J7+N7+Q7+U7+Z7+AC7+AH7 -> 426.11 | E7: =+I7+M7+P7+T7+Y7+AB7+AG7+AM7 -> 68 | F7: =+(G7+H7)+(0.5*I7) -> 58.38 | G7: 32.90 | H7: 25.48 | I7: 0 | J7: =+(K7+L7)+0.5*M7 -> 44.28 | K7: 19.17 | L7: 17.61 | M7: 15 | N7: =+(O7)+0.5*P7 -> 72.14 | O7: 72.14 | P7: 0 | Q7: =+(R7+S7)+0.5*T7 -> 94.54 | R7: 49.63 | S7: 44.91 | T7: 0 | U7: =+(V7+W7+X7)+0.5*Y7 -> 16.55 | V7: 4.36 | W7: 4.24 | X7: 7.95 | Y7: 0 | Z7: =+(AA7)+0.5*AB7 -> 59.02 | AA7: 37.52 | AB7: 43 | AC7: =+(AD7+AE7+AF7)+0.5*AG7 -> 35.33 | AD7: 12.96 | AE7: 10.08 | AF7: 12.29 | AG7: 0 | AH7: =+(AI7+AJ7+AK7+AL7)+0.5*AM7 -> 45.87 | AI7: 16.44 | AJ7: 10.41 | AK7: 7.80 | AL7: 6.22 | AM7: 10
A8: 4 | B8: Mousley, Roger | C8: L | D8: =+F8+J8+N8+Q8+U8+Z8+AC8+AH8 -> 430.49 | E8: =+I8+M8+P8+T8+Y8+AB8+AG8+AM8 -> 56 | F8: =+(G8+H8)+(0.5*I8) -> 71.09 | G8: 26.07 | H8: 45.02 | I8: 0 | J8: =+(K8+L8)+0.5*M8 -> 46.39 | K8: 20.09 | L8: 18.80 | M8: 15 | N8: =+(O8)+0.5*P8 -> 58.96 | O8: 58.96 | P8: 0 | Q8: =+(R8+S8)+0.5*T8 -> 85.81 | R8: 43.14 | S8: 42.67 | T8: 0 | U8: =+(V8+W8+X8)+0.5*Y8 -> 12.41 | V8: 3.09 | W8: 2.91 | X8: 6.41 | Y8: 0 | Z8: =+(AA8)+0.5*AB8 -> 44.43 | AA8: 33.93 | AB8: 21 | AC8: =+(AD8+AE8+AF8)+0.5*AG8 -> 53.85 | AD8: 11.18 | AE8: 19.68 | AF8: 12.99 | AG8: 20 | AH8: =+(AI8+AJ8+AK8+AL8)+0.5*AM8 -> 57.55 | AI8: 10.00 | AJ8: 12.45 | AK8: 23.12 | AL8: 11.98 | AM8: 0
A9: 5 | B9: Beck, Dave | C9: L | D9: =+F9+J9+N9+Q9+U9+Z9+AC9+AH9 -> 534.27 | E9: =+I9+M9+P9+T9+Y9+AB9+AG9+AM9 -> 47 | F9: =+(G9+H9)+(0.5*I9) -> 65.47 | G9: 15.41 | H9: 50.06 | I9: 0 | J9: =+(K9+L9)+0.5*M9 -> 54.22 | K9: 20.32 | L9: 24.40 | M9: 19 | N9: =+(O9)+0.5*P9 -> 56.50 | O9: 56.50 | P9: 0 | Q9: =+(R9+S9)+0.5*T9 -> 111.10 | R9: 58.71 | S9: 52.39 | T9: 0 | U9: =+(V9+W9+X9)+0.5*Y9 -> 23.22 | V9: 4.08 | W9: 8.30 | X9: 10.84 | Y9: 0 | Z9: =+(AA9)+0.5*AB9 -> 67.87 | AA9: 63.87 | AB9: 8 | AC9: =+(AD9+AE9+AF9)+0.5*AG9 -> 43.42 | AD9: 18.40 | AE9: 13.52 | AF9: 11.50 | AG9: 0 | AH9: =+(AI9+AJ9+AK9+AL9)+0.5*AM9 -> 112.47 | AI9: 21.96 | AJ9: 30.00 | AK9: 30.00 | AL9: 20.51 | AM9: 20
A10: 6 | B10: Correia, Jack | C10: L | D10: =+F10+J10+N10+Q10+U10+Z10+AC10+AH10 -> 601.86 | E10: =+I10+M10+P10+T10+Y10+AB10+AG10+AM10 -> 113 | F10: =+(G10+H10)+(0.5*I10) -> 112.79 | G10: 29.88 | H10: 82.91 | I10: 0 | J10: =+(K10+L10)+0.5*M10 -> 59.47 | K10: 21.28 | L10: 19.19 | M10: 38 | N10: =+(O10)+0.5*P10 -> 92.97 | O10: 92.97 | P10: 0 | Q10: =+(R10+S10)+0.5*T10 -> 84.99 | R10: 39.87 | S10: 45.12 | T10: 0 | U10: =+(V10+W10+X10)+0.5*Y10 -> 45.39 | V10: 22.77 | W10: 5.52 | X10: 12.10 | Y10: 10 | Z10: =+(AA10)+0.5*AB10 -> 90.98 | AA10: 68.48 | AB10: 45 | AC10: =+(AD10+AE10+AF10)+0.5*AG10 -> 70.11 | AD10: 21.84 | AE10: 19.20 | AF10: 19.07 | AG10: 20 | AH10: =+(AI10+AJ10+AK10+AL10)+0.5*AM10 -> 45.16 | AI10: 25.76 | AJ10: 5.90 | AK10: 4.64 | AL10: 8.86 | AM10: 0
A11: 7 | B11: Black, Jim | C11: L | D11: =+F11+J11+N11+Q11+U11+Z11+AC11+AH11 -> 601.94 | E11: =+I11+M11+P11+T11+Y11+AB11+AG11+AM11 -> 91 | F11: =+(G11+H11)+(0.5*I11) -> 82.23 | G11: 35.47 | H11: 46.76 | I11: 0 | J11: =+(K11+L11)+0.5*M11 -> 61.89 | K11: 25.21 | L11: 23.68 | M11: 26 | N11: =+(O11)+0.5*P11 -> 137.19 | O11: 137.19 | P11: 0 | Q11: =+(R11+S11)+0.5*T11 -> 94.38 | R11: 49.69 | S11: 44.69 | T11: 0 | U11: =+(V11+W11+X11)+0.5*Y11 -> 18.05 | V11: 6.30 | W11: 7.56 | X11: 4.19 | Y11: 0 | Z11: =+(AA11)+0.5*AB11 -> 68.43 | AA11: 45.93 | AB11: 45 | AC11: =+(AD11+AE11+AF11)+0.5*AG11 -> 82.73 | AD11: 22.32 | AE11: 29.60 | AF11: 20.81 | AG11: 20 | AH11: =+(AI11+AJ11+AK11+AL11)+0.5*AM11 -> 57.04 | AI11: 19.45 | AJ11: 19.38 | AK11: 9.60 | AL11: 8.61 | AM11: 0
A13: 1 | B13: Correia, Larry | C13: O | D13: =+F13+J13+N13+Q13+U13+Z13+AC13+AH13 -> 328.88 | E13: =+I13+M13+P13+T13+Y13+AB13+AG13+AM13 -> 35 | F13: =+(G13+H13)+(0.5*I13) -> 48.70 | G13: 16.31 | H13: 32.39 | I13: 0 | J13: =+(K13+L13)+0.5*M13 -> 43.34 | K13: 17.07 | L13: 15.27 | M13: 22 | N13: =+(O13)+0.5*P13 -> 23.06 | O13: 23.06 | P13: 0 | Q13: =+(R13+S13)+0.5*T13 -> 84.40 | R13: 49.43 | S13: 34.97 | T13: 0 | U13: =+(V13+W13+X13)+0.5*Y13 -> 11.25 | V13: 3.65 | W13: 3.74 | X13: 3.86 | Y13: 0 | Z13: =+(AA13)+0.5*AB13 -> 50.25 | AA13: 43.75 | AB13: 13 | AC13: =+(AD13+AE13+AF13)+0.5*AG13 -> 32.36 | AD13: 12.01 | AE13: 11.44 | AF13: 8.91 | AG13: 0 | AH13: =+(AI13+AJ13+AK13+AL13)+0.5*AM13 -> 35.52 | AI13: 4.66 | AJ13: 16.07 | AK13: 7.01 | AL13: 7.78 | AM13: 0
A14: 2 | B14: Collins, Ken | C14: O | D14: =+F14+J14+N14+Q14+U14+Z14+AC14+AH14 -> 416.17 | E14: =+I14+M14+P14+T14+Y14+AB14+AG14+AM14 -> 32 | F14: =+(G14+H14)+(0.5*I14) -> 64.44 | G14: 33.49 | H14: 30.95 | I14: 0 | J14: =+(K14+L14)+0.5*M14 -> 46.13 | K14: 21.72 | L14: 19.91 | M14: 9 | N14: =+(O14)+0.5*P14 -> 75.52 | O14: 75.52 | P14: 0 | Q14: =+(R14+S14)+0.5*T14 -> 83.02 | R14: 44.88 | S14: 38.14 | T14: 0 | U14: =+(V14+W14+X14)+0.5*Y14 -> 19.89 | V14: 3.33 | W14: 4.85 | X14: 11.71 | Y14: 0 | Z14: =+(AA14)+0.5*AB14 -> 68.52 | AA14: 57.02 | AB14: 23 | AC14: =+(AD14+AE14+AF14)+0.5*AG14 -> 26.39 | AD14: 8.82 | AE14: 9.47 | AF14: 8.10 | AG14: 0 | AH14: =+(AI14+AJ14+AK14+AL14)+0.5*AM14 -> 32.26 | AI14: 12.17 | AJ14: 7.80 | AK14: 6.26 | AL14: 6.03 | AM14: 0
A16: 1 | B16: Theodore, Ari | C16: T | D16: =+F16+J16+N16+Q16+U16+Z16+AC16+AH16 -> 306.78 | E16: =+I16+M16+P16+T16+Y16+AB16+AG16+AM16 -> 26 | F16: =+(G16+H16)+(0.5*I16) -> 44.67 | G16: 15.89 | H16: 28.78 | I16: 0 | J16: =+(K16+L16)+0.5*M16 -> 38.74 | K16: 15.64 | L16: 17.10 | M16: 12 | N16: =+(O16)+0.5*P16 -> 45.00 | O16: 45.00 | P16: 0 | Q16: =+(R16+S16)+0.5*T16 -> 71.46 | R16: 39.45 | S16: 32.01 | T16: 0 | U16: =+(V16+W16+X16)+0.5*Y16 -> 11.13 | V16: 2.62 | W16: 2.88 | X16: 5.63 | Y16: 0 | Z16: =+(AA16)+0.5*AB16 -> 35.04 | AA16: 33.04 | AB16: 4 | AC16: =+(AD16+AE16+AF16)+0.5*AG16 -> 31.07 | AD16: 8.85 | AE16: 7.77 | AF16: 9.45 | AG16: 10 | AH16: =+(AI16+AJ16+AK16+AL16)+0.5*AM16 -> 29.67 | AI16: 13.77 | AJ16: 5.89 | AK16: 4.77 | AL16: 5.24 | AM16: 0
A17: 2 | B17: Stone, Scott | C17: T | D17: =+F17+J17+N17+Q17+U17+Z17+AC17+AH17 -> 592.51 | E17: =+I17+M17+P17+T17+Y17+AB17+AG17+AM17 -> 166 | F17: =+(G17+H17)+(0.5*I17) -> 59.02 | G17: 23.04 | H17: 35.98 | I17: 0 | J17: =+(K17+L17)+0.5*M17 -> 54.20 | K17: 20.44 | L17: 23.26 | M17: 21 | N17: =+(O17)+0.5*P17 -> 70.49 | O17: 70.49 | P17: 0 | Q17: =+(R17+S17)+0.5*T17 -> 143.46 | R17: 53.43 | S17: 60.03 | T17: 60 | U17: =+(V17+W17+X17)+0.5*Y17 -> 19.19 | V17: 6.96 | W17: 4.15 | X17: 8.08 | Y17: 0 | Z17: =+(AA17)+0.5*AB17 -> 74.02 | AA17: 61.52 | AB17: 25 | AC17: =+(AD17+AE17+AF17)+0.5*AG17 -> 53.28 | AD17: 19.96 | AE17: 13.14 | AF17: 10.18 | AG17: 20 | AH17: =+(AI17+AJ17+AK17+AL17)+0.5*AM17 -> 118.85 | AI17: 33.30 | AJ17: 30.94 | AK17: 19.23 | AL17: 15.38 | AM17: 40
A18: 3 | B18: Ostler, Jay | C18: T | D18: =+F18+J18+N18+Q18+U18+Z18+AC18+AH18 -> 597.99 | E18: =+I18+M18+P18+T18+Y18+AB18+AG18+AM18 -> 36 | F18: =+(G18+H18)+(0.5*I18) -> 100.86 | G18: 43.12 | H18: 57.74 | I18: 0 | J18: =+(K18+L18)+0.5*M18 -> 67.16 | K18: 32.94 | L18: 30.22 | M18: 8 | N18: =+(O18)+0.5*P18 -> 88.92 | O18: 88.92 | P18: 0 | Q18: =+(R18+S18)+0.5*T18 -> 106.71 | R18: 52.12 | S18: 54.59 | T18: 0 | U18: =+(V18+W18+X18)+0.5*Y18 -> 22.86 | V18: 5.30 | W18: 6.71 | X18: 10.85 | Y18: 0 | Z18: =+(AA18)+0.5*AB18 -> 87.96 | AA18: 78.96 | AB18: 18 | AC18: =+(AD18+AE18+AF18)+0.5*AG18 -> 63.13 | AD18: 24.13 | AE18: 17.86 | AF18: 16.14 | AG18: 10 | AH18: =+(AI18+AJ18+AK18+AL18)+0.5*AM18 -> 60.39 | AI18: 11.99 | AJ18: 15.52 | AK18: 6.99 | AL18: 25.89 | AM18: 0
A19: 4 | B19: Brown, Michael | C19: T | D19: =+F19+J19+N19+Q19+U19+Z19+AC19+AH19 -> 717.36 | E19: =+I19+M19+P19+T19+Y19+AB19+AG19+AM19 -> 160 | F19: =+(G19+H19)+(0.5*I19) -> 73.87 | G19: 34.34 | H19: 39.53 | I19: 0 | J19: =+(K19+L19)+0.5*M19 -> 90.53 | K19: 44.43 | L19: 35.60 | M19: 21 | N19: =+(O19)+0.5*P19 -> 93.27 | O19: 93.27 | P19: 0 | Q19: =+(R19+S19)+0.5*T19 -> 173.31 | R19: 62.02 | S19: 71.29 | T19: 80 | U19: =+(V19+W19+X19)+0.5*Y19 -> 19.52 | V19: 7.46 | W19: 5.16 | X19: 6.90 | Y19: 0 | Z19: =+(AA19)+0.5*AB19 -> 76.80 | AA19: 67.30 | AB19: 19 | AC19: =+(AD19+AE19+AF19)+0.5*AG19 -> 89.17 | AD19: 26.14 | AE19: 29.11 | AF19: 28.92 | AG19: 10 | AH19: =+(AI19+AJ19+AK19+AL19)+0.5*AM19 -> 100.89 | AI19: 21.14 | AJ19: 15.34 | AK19: 21.61 | AL19: 27.80 | AM19: 30
A20: 5 | B20: Pribyl, Guy | C20: T | D20: =+F20+J20+N20+Q20+U20+Z20+AC20+AH20 -> 724.25 | E20: =+I20+M20+P20+T20+Y20+AB20+AG20+AM20 -> 140 | F20: =+(G20+H20)+(0.5*I20) -> 103.00 | G20: 43.46 | H20: 59.54 | I20: 0 | J20: =+(K20+L20)+0.5*M20 -> 72.10 | K20: 28.41 | L20: 25.69 | M20: 36 | N20: =+(O20)+0.5*P20 -> 100.48 | O20: 100.48 | P20: 0 | Q20: =+(R20+S20)+0.5*T20 -> 157.07 | R20: 69.90 | S20: 57.17 | T20: 60 | U20: =+(V20+W20+X20)+0.5*Y20 -> 23.74 | V20: 6.90 | W20: 7.46 | X20: 9.38 | Y20: 0 | Z20: =+(AA20)+0.5*AB20 -> 116.69 | AA20: 109.69 | AB20: 14 | AC20: =+(AD20+AE20+AF20)+0.5*AG20 -> 84.06 | AD20: 27.29 | AE20: 23.03 | AF20: 23.74 | AG20: 20 | AH20: =+(AI20+AJ20+AK20+AL20)+0.5*AM20 -> 67.11 | AI20: 13.78 | AJ20: 17.94 | AK20: 20.76 | AL20: 9.63 | AM20: 10
A21: 6 | B21: Crawford, George | C21: T | D21: =+F21+J21+N21+Q21+U21+Z21+AC21+AH21 -> 800.13 | E21: =+I21+M21+P21+T21+Y21+AB21+AG21+AM21 -> 30 | F21: =+(G21+H21)+(0.5*I21) -> 112.98 | G21: 58.50 | H21: 54.48 | I21: 0 | J21: =+(K21+L21)+0.5*M21 -> 72.50 | K21: 38.53 | L21: 32.47 | M21: 3 | N21: =+(O21)+0.5*P21 -> 142.50 | O21: 142.50 | P21: 0 | Q21: =+(R21+S21)+0.5*T21 -> 153.50 | R21: 70.72 | S21: 82.78 | T21: 0 | U21: =+(V21+W21+X21)+0.5*Y21 -> 39.12 | V21: 11.54 | W21: 10.69 | X21: 16.89 | Y21: 0 | Z21: =+(AA21)+0.5*AB21 -> 102.46 | AA21: 98.96 | AB21: 7 | AC21: =+(AD21+AE21+AF21)+0.5*AG21 -> 90.17 | AD21: 26.70 | AE21: 37.76 | AF21: 20.71 | AG21: 10 | AH21: =+(AI21+AJ21+AK21+AL21)+0.5*AM21 -> 86.90 | AI21: 14.33 | AJ21: 31.72 | AK21: 26.73 | AL21: 9.12 | AM21: 10
A22: 7 | B22: Pribyl, Steve | C22: T | D22: =+F22+J22+N22+Q22+U22+Z22+AC22+AH22 -> 1053.73 | E22: =+I22+M22+P22+T22+Y22+AB22+AG22+AM22 -> 214 | F22: =+(G22+H22)+(0.5*I22) -> 117.96 | G22: 49.61 | H22: 68.35 | I22: 0 | J22: =+(K22+L22)+0.5*M22 -> 100.70 | K22: 45.14 | L22: 38.56 | M22: 34 | N22: =+(O22)+0.5*P22 -> 146.00 | O22: 146.00 | P22: 0 | Q22: =+(R22+S22)+0.5*T22 -> 180.81 | R22: 63.54 | S22: 72.27 | T22: 90 | U22: =+(V22+W22+X22)+0.5*Y22 -> 43.41 | V22: 7.71 | W22: 6.92 | X22: 28.78 | Y22: 0 | Z22: =+(AA22)+0.5*AB22 -> 145.00 | AA22: 130.00 | AB22: 30 | AC22: =+(AD22+AE22+AF22)+0.5*AG22 -> 200.58 | AD22: 48.31 | AE22: 88.87 | AF22: 58.40 | AG22: 10 | AH22: =+(AI22+AJ22+AK22+AL22)+0.5*AM22 -> 119.27 | AI22: 31.17 | AJ22: 20.02 | AK22: 19.53 | AL22: 23.55 | AM22: 50
A24: 1 | B24: Ostler, Jeff | C24: TRO | D24: =+F24+J24+N24+Q24+U24+Z24+AC24+AH24 -> 331.88 | E24: =+I24+M24+P24+T24+Y24+AB24+AG24+AM24 -> 12 | F24: =+(G24+H24)+(0.5*I24) -> 48.80 | G24: 17.31 | H24: 31.49 | I24: 0 | J24: =+(K24+L24)+0.5*M24 -> 45.09 | K24: 21.55 | L24: 20.54 | M24: 6 | N24: =+(O24)+0.5*P24 -> 50.52 | O24: 50.52 | P24: 0 | Q24: =+(R24+S24)+0.5*T24 -> 65.47 | R24: 33.74 | S24: 31.73 | T24: 0 | U24: =+(V24+W24+X24)+0.5*Y24 -> 11.36 | V24: 3.03 | W24: 2.80 | X24: 5.53 | Y24: 0 | Z24: =+(AA24)+0.5*AB24 -> 53.32 | AA24: 50.32 | AB24: 6 | AC24: =+(AD24+AE24+AF24)+0.5*AG24 -> 35.65 | AD24: 10.78 | AE24: 12.76 | AF24: 12.11 | AG24: 0 | AH24: =+(AI24+AJ24+AK24+AL24)+0.5*AM24 -> 21.67 | AI24: 9.56 | AJ24: 4.85 | AK24: 3.81 | AL24: 3.45 | AM24: 0
A25: 2 | B25: Stilwell, Mike | C25: TRO | D25: =+F25+J25+N25+Q25+U25+Z25+AC25+AH25 -> 369.56 | E25: =+I25+M25+P25+T25+Y25+AB25+AG25+AM25 -> 3 | F25: =+(G25+H25)+(0.5*I25) -> 57.92 | G25: 22.22 | H25: 35.70 | I25: 0 | J25: =+(K25+L25)+0.5*M25 -> 36.22 | K25: 17.53 | L25: 17.69 | M25: 2 | N25: =+(O25)+0.5*P25 -> 56.53 | O25: 56.53 | P25: 0 | Q25: =+(R25+S25)+0.5*T25 -> 83.45 | R25: 45.23 | S25: 38.22 | T25: 0 | U25: =+(V25+W25+X25)+0.5*Y25 -> 10.90 | V25: 2.97 | W25: 3.07 | X25: 4.86 | Y25: 0 | Z25: =+(AA25)+0.5*AB25 -> 52.02 | AA25: 51.52 | AB25: 1 | AC25: =+(AD25+AE25+AF25)+0.5*AG25 -> 32.23 | AD25: 9.21 | AE25: 10.72 | AF25: 12.30 | AG25: 0 | AH25: =+(AI25+AJ25+AK25+AL25)+0.5*AM25 -> 40.29 | AI25: 15.08 | AJ25: 13.20 | AK25: 7.12 | AL25: 4.89 | AM25: 0
A26: 3 | B26: Knapp, Chris | C26: TRO | D26: =+F26+J26+N26+Q26+U26+Z26+AC26+AH26 -> 388.67 | E26: =+I26+M26+P26+T26+Y26+AB26+AG26+AM26 -> 48 | F26: =+(G26+H26)+(0.5*I26) -> 57.03 | G26: 20.82 | H26: 36.21 | I26: 0 | J26: =+(K26+L26)+0.5*M26 -> 51.83 | K26: 23.41 | L26: 26.92 | M26: 3 | N26: =+(O26)+0.5*P26 -> 51.03 | O26: 51.03 | P26: 0 | Q26: =+(R26+S26)+0.5*T26 -> 86.23 | R26: 34.71 | S26: 51.52 | T26: 0 | U26: =+(V26+W26+X26)+0.5*Y26 -> 13.24 | V26: 4.20 | W26: 4.39 | X26: 4.65 | Y26: 0 | Z26: =+(AA26)+0.5*AB26 -> 43.33 | AA26: 35.83 | AB26: 15 | AC26: =+(AD26+AE26+AF26)+0.5*AG26 -> 55.65 | AD26: 15.21 | AE26: 11.83 | AF26: 13.61 | AG26: 30 | AH26: =+(AI26+AJ26+AK26+AL26)+0.5*AM26 -> 30.33 | AI26: 6.91 | AJ26: 14.33 | AK26: 4.51 | AL26: 4.58 | AM26: 0
A27: 4 | B27: Zaccardi, Juke | C27: TRO | D27: =+F27+J27+N27+Q27+U27+Z27+AC27+AH27 -> 396.93 | E27: =+I27+M27+P27+T27+Y27+AB27+AG27+AM27 -> 44 | F27: =+(G27+H27)+(0.5*I27) -> 54.22 | G27: 33.07 | H27: 21.15 | I27: 0 | J27: =+(K27+L27)+0.5*M27 -> 35.94 | K27: 13.77 | L27: 14.17 | M27: 16 | N27: =+(O27)+0.5*P27 -> 83.67 | O27: 83.67 | P27: 0 | Q27: =+(R27+S27)+0.5*T27 -> 83.75 | R27: 45.14 | S27: 38.61 | T27: 0 | U27: =+(V27+W27+X27)+0.5*Y27 -> 16.27 | V27: 3.92 | W27: 4.41 | X27: 7.94 | Y27: 0 | Z27: =+(AA27)+0.5*AB27 -> 45.20 | AA27: 36.20 | AB27: 18 | AC27: =+(AD27+AE27+AF27)+0.5*AG27 -> 48.92 | AD27: 22.35 | AE27: 13.39 | AF27: 13.18 | AG27: 0 | AH27: =+(AI27+AJ27+AK27+AL27)+0.5*AM27 -> 28.96 | AI27: 6.16 | AJ27: 7.36 | AK27: 4.74 | AL27: 5.70 | AM27: 10
A28: 5 | B28: Richards, Dave | C28: TRO | D28: =+F28+J28+N28+Q28+U28+Z28+AC28+AH28 -> 406.93 | E28: =+I28+M28+P28+T28+Y28+AB28+AG28+AM28 -> 19 | F28: =+(G28+H28)+(0.5*I28) -> 55.56 | G28: 27.04 | H28: 28.52 | I28: 0 | J28: =+(K28+L28)+0.5*M28 -> 36.87 | K28: 16.51 | L28: 15.36 | M28: 10 | N28: =+(O28)+0.5*P28 -> 81.52 | O28: 81.52 | P28: 0 | Q28: =+(R28+S28)+0.5*T28 -> 73.03 | R28: 34.17 | S28: 38.86 | T28: 0 | U28: =+(V28+W28+X28)+0.5*Y28 -> 11.22 | V28: 3.60 | W28: 2.68 | X28: 4.94 | Y28: 0 | Z28: =+(AA28)+0.5*AB28 -> 48.30 | AA28: 43.80 | AB28: 9 | AC28: =+(AD28+AE28+AF28)+0.5*AG28 -> 41.78 | AD28: 20.07 | AE28: 9.09 | AF28: 12.62 | AG28: 0 | AH28: =+(AI28+AJ28+AK28+AL28)+0.5*AM28 -> 58.65 | AI28: 18.71 | AJ28: 12.00 | AK28: 21.39 | AL28: 6.55 | AM28: 0
A29: 6 | B29: Roberts, Bruce | C29: TRO | D29: =+F29+J29+N29+Q29+U29+Z29+AC29+AH29 -> 414.18 | E29: =+I29+M29+P29+T29+Y29+AB29+AG29+AM29 -> 47 | F29: =+(G29+H29)+(0.5*I29) -> 51.66 | G29: 23.16 | H29: 28.50 | I29: 0 | J29: =+(K29+L29)+0.5*M29 -> 60.82 | K29: 25.02 | L29: 22.30 | M29: 27 | N29: =+(O29)+0.5*P29 -> 67.87 | O29: 67.87 | P29: 0 | Q29: =+(R29+S29)+0.5*T29 -> 104.76 | R29: 63.37 | S29: 41.39 | T29: 0 | U29: =+(V29+W29+X29)+0.5*Y29 -> 16.94 | V29: 3.95 | W29: 3.46 | X29: 9.53 | Y29: 0 | Z29: =+(AA29)+0.5*AB29 -> 44.55 | AA29: 34.55 | AB29: 20 | AC29: =+(AD29+AE29+AF29)+0.5*AG29 -> 43.10 | AD29: 18.09 | AE29: 13.98 | AF29: 11.03 | AG29: 0 | AH29: =+(AI29+AJ29+AK29+AL29)+0.5*AM29 -> 24.48 | AI29: 8.36 | AJ29: 4.68 | AK29: 7.27 | AL29: 4.17 | AM29: 0
A30: 7 | B30: Scott, Alan | C30: TRO | D30: =+F30+J30+N30+Q30+U30+Z30+AC30+AH30 -> 483.49 | E30: =+I30+M30+P30+T30+Y30+AB30+AG30+AM30 -> 60 | F30: =+(G30+H30)+(0.5*I30) -> 75.27 | G30: 35.83 | H30: 39.44 | I30: 0 | J30: =+(K30+L30)+0.5*M30 -> 50.62 | K30: 21.82 | L30: 19.80 | M30: 18 | N30: =+(O30)+0.5*P30 -> 80.34 | O30: 80.34 | P30: 0 | Q30: =+(R30+S30)+0.5*T30 -> 89.93 | R30: 47.47 | S30: 42.46 | T30: 0 | U30: =+(V30+W30+X30)+0.5*Y30 -> 16.46 | V30: 4.96 | W30: 5.20 | X30: 6.30 | Y30: 0 | Z30: =+(AA30)+0.5*AB30 -> 39.40 | AA30: 33.40 | AB30: 12 | AC30: =+(AD30+AE30+AF30)+0.5*AG30 -> 78.21 | AD30: 13.71 | AE30: 22.75 | AF30: 26.75 | AG30: 30 | AH30: =+(AI30+AJ30+AK30+AL30)+0.5*AM30 -> 53.26 | AI30: 9.47 | AJ30: 7.06 | AK30: 8.57 | AL30: 28.16 | AM30: 0
A31: 8 | B31: Simpson, Harold | C31: TRO | D31: =+F31+J31+N31+Q31+U31+Z31+AC31+AH31 -> 489.35 | E31: =+I31+M31+P31+T31+Y31+AB31+AG31+AM31 -> 13 | F31: =+(G31+H31)+(0.5*I31) -> 81.08 | G31: 35.56 | H31: 45.52 | I31: 0 | J31: =+(K31+L31)+0.5*M31 -> 60.69 | K31: 32.94 | L31: 22.75 | M31: 10 | N31: =+(O31)+0.5*P31 -> 87.63 | O31: 87.63 | P31: 0 | Q31: =+(R31+S31)+0.5*T31 -> 105.79 | R31: 48.60 | S31: 57.19 | T31: 0 | U31: =+(V31+W31+X31)+0.5*Y31 -> 16.18 | V31: 5.19 | W31: 4.55 | X31: 6.44 | Y31: 0 | Z31: =+(AA31)+0.5*AB31 -> 57.25 | AA31: 55.75 | AB31: 3 | AC31: =+(AD31+AE31+AF31)+0.5*AG31 -> 39.68 | AD31: 14.31 | AE31: 12.65 | AF31: 12.72 | AG31: 0 | AH31: =+(AI31+AJ31+AK31+AL31)+0.5*AM31 -> 41.05 | AI31: 11.61 | AJ31: 13.17 | AK31: 11.58 | AL31: 4.69 | AM31: 0
A32: 9 | B32: Gurr, Gene | C32: TRO | D32: =+F32+J32+N32+Q32+U32+Z32+AC32+AH32 -> 506.90 | E32: =+I32+M32+P32+T32+Y32+AB32+AG32+AM32 -> 24 | F32: =+(G32+H32)+(0.5*I32) -> 75.53 | G32: 31.87 | H32: 43.66 | I32: 0 | J32: =+(K32+L32)+0.5*M32 -> 50.12 | K32: 21.03 | L32: 24.09 | M32: 10 | N32: =+(O32)+0.5*P32 -> 76.69 | O32: 76.69 | P32: 0 | Q32: =+(R32+S32)+0.5*T32 -> 111.93 | R32: 57.17 | S32: 54.76 | T32: 0 | U32: =+(V32+W32+X32)+0.5*Y32 -> 17.12 | V32: 4.83 | W32: 4.14 | X32: 8.15 | Y32: 0 | Z32: =+(AA32)+0.5*AB32 -> 52.42 | AA32: 50.42 | AB32: 4 | AC32: =+(AD32+AE32+AF32)+0.5*AG32 -> 76.46 | AD32: 26.39 | AE32: 23.64 | AF32: 21.43 | AG32: 10 | AH32: =+(AI32+AJ32+AK32+AL32)+0.5*AM32 -> 46.63 | AI32: 14.62 | AJ32: 13.27 | AK32: 11.33 | AL32: 7.41 | AM32: 0
A33: 10 | B33: Scott, Michael | C33: TRO | D33: =+F33+J33+N33+Q33+U33+Z33+AC33+AH33 -> 516.21 | E33: =+I33+M33+P33+T33+Y33+AB33+AG33+AM33 -> 80 | F33: =+(G33+H33)+(0.5*I33) -> 89.42 | G33: 34.82 | H33: 54.60 | I33: 0 | J33: =+(K33+L33)+0.5*M33 -> 52.11 | K33: 19.24 | L33: 17.37 | M33: 31 | N33: =+(O33)+0.5*P33 -> 95.91 | O33: 95.91 | P33: 0 | Q33: =+(R33+S33)+0.5*T33 -> 97.47 | R33: 52.04 | S33: 45.43 | T33: 0 | U33: =+(V33+W33+X33)+0.5*Y33 -> 21.64 | V33: 6.60 | W33: 7.56 | X33: 7.48 | Y33: 0 | Z33: =+(AA33)+0.5*AB33 -> 60.50 | AA33: 46.00 | AB33: 29 | AC33: =+(AD33+AE33+AF33)+0.5*AG33 -> 63.95 | AD33: 16.66 | AE33: 22.42 | AF33: 14.87 | AG33: 20 | AH33: =+(AI33+AJ33+AK33+AL33)+0.5*AM33 -> 35.21 | AI33: 10.32 | AJ33: 10.02 | AK33: 5.38 | AL33: 9.49 | AM33: 0
A34: 11 | B34: Roberts, Jay | C34: TRO | D34: =+F34+J34+N34+Q34+U34+Z34+AC34+AH34 -> 614.57 | E34: =+I34+M34+P34+T34+Y34+AB34+AG34+AM34 -> 50 | F34: =+(G34+H34)+(0.5*I34) -> 64.51 | G34: 32.93 | H34: 31.58 | I34: 0 | J34: =+(K34+L34)+0.5*M34 -> 67.41 | K34: 29.84 | L34: 21.57 | M34: 32 | N34: =+(O34)+0.5*P34 -> 106.01 | O34: 106.01 | P34: 0 | Q34: =+(R34+S34)+0.5*T34 -> 102.40 | R34: 53.75 | S34: 48.65 | T34: 0 | U34: =+(V34+W34+X34)+0.5*Y34 -> 20.20 | V34: 5.19 | W34: 5.42 | X34: 9.59 | Y34: 0 | Z34: =+(AA34)+0.5*AB34 -> 106.81 | AA34: 102.81 | AB34: 8 | AC34: =+(AD34+AE34+AF34)+0.5*AG34 -> 76.73 | AD34: 40.59 | AE34: 14.40 | AF34: 16.74 | AG34: 10 | AH34: =+(AI34+AJ34+AK34+AL34)+0.5*AM34 -> 70.50 | AI34: 16.64 | AJ34: 9.43 | AK34: 23.09 | AL34: 21.34 | AM34: 0
A35: 12 | B35: Fentenberger, Matt | C35: TRO | D35: =+F35+J35+N35+Q35+U35+Z35+AC35+AH35 -> 730.49 | E35: =+I35+M35+P35+T35+Y35+AB35+AG35+AM35 -> 181 | F35: =+(G35+H35)+(0.5*I35) -> 126.89 | G35: 54.16 | H35: 72.73 | I35: 0 | J35: =+(K35+L35)+0.5*M35 -> 77.65 | K35: 32.90 | L35: 26.75 | M35: 36 | N35: =+(O35)+0.5*P35 -> 102.37 | O35: 42.37 | P35: 120 | Q35: =+(R35+S35)+0.5*T35 -> 144.63 | R35: 72.10 | S35: 72.53 | T35: 0 | U35: =+(V35+W35+X35)+0.5*Y35 -> 21.41 | V35: 6.77 | W35: 5.92 | X35: 8.72 | Y35: 0 | Z35: =+(AA35)+0.5*AB35 -> 76.65 | AA35: 74.15 | AB35: 5 | AC35: =+(AD35+AE35+AF35)+0.5*AG35 -> 81.45 | AD35: 34.74 | AE35: 25.74 | AF35: 20.97 | AG35: 0 | AH35: =+(AI35+AJ35+AK35+AL35)+0.5*AM35 -> 99.44 | AI35: 30.00 | AJ35: 19.03 | AK35: 30.00 | AL35: 10.41 | AM35: 20
A36: 13 | B36: Wong, Hang | C36: TRO | D36: =+F36+J36+N36+Q36+U36+Z36+AC36+AH36 -> 830.27 | E36: =+I36+M36+P36+T36+Y36+AB36+AG36+AM36 -> 140 | F36: =+(G36+H36)+(0.5*I36) -> 133.50 | G36: 72.12 | H36: 61.38 | I36: 0 | J36: =+(K36+L36)+0.5*M36 -> 75.27 | K36: 21.04 | L36: 23.23 | M36: =8+2+14+8+6+10+9+5 -> 62 | N36: =+(O36)+0.5*P36 -> 125.76 | O36: 125.76 | P36: 0 | Q36: =+(R36+S36)+0.5*T36 -> 119.70 | R36: 62.14 | S36: 57.56 | T36: 0 | U36: =+(V36+W36+X36)+0.5*Y36 -> 80.55 | V36: 7.67 | W36: 32.64 | X36: 35.24 | Y36: 10 | Z36: =+(AA36)+0.5*AB36 -> 57.14 | AA36: 38.14 | AB36: 38 | AC36: =+(AD36+AE36+AF36)+0.5*AG36 -> 111.55 | AD36: 38.70 | AE36: 33.00 | AF36: 29.85 | AG36: 20 | AH36: =+(AI36+AJ36+AK36+AL36)+0.5*AM36 -> 126.80 | AI36: 23.93 | AJ36: 42.44 | AK36: 32.54 | AL36: 22.89 | AM36: 10
A37: 14 | B37: Huff, Blake | C37: TRO | D37: DNF | E37: DNF | F37: DNF | J37: DNF | N37: DNF | Q37: DNF | U37: =+(V37+W37+X37)+0.5*Y37 -> 15.63 | V37: 3.01 | W37: 3.79 | X37: 8.83 | Y37: 0 | Z37: =+(AA37)+0.5*AB37 -> 64.46 | AA37: 60.96 | AB37: 7 | AC37: =+(AD37+AE37+AF37)+0.5*AG37 -> 29.01 | AD37: 10.19 | AE37: 7.04 | AF37: 11.78 | AG37: 0 | AH37: =+(AI37+AJ37+AK37+AL37)+0.5*AM37 -> 69.16 | AI37: 13.30 | AJ37: 7.02 | AK37: 25.36 | AL37: 18.48 | AM37: 10
A38: Notes:
A39: - | B39: Div * - Refer to the UDPL 3-Gun Division Specifications for specifics on each Division.
B40: L = | C40: LIMITED
B41: T = | C41: TACTICAL
B42: TRO = | C42: TACTICAL RIFLE-OPTICAL
B43: O = | C43: OPEN
A44: PD | B44: = Points Down = .5 seconds x Points Down. PD Total is added to the total Stage time.
A45: XX | B45: = Indicates that the Points Down value includes some kind of penalty (Procedural Error, Hits on Non-Threat, Misses on Steel (5 seconds each), etc.).
A46: DNF | B46: = Did Not Finish
A47: NS | B47: = No Score was recorded for this string. Shooter placed lower than indicated.
A48: ? | B48: = Shooter did not indicate which Division he should be scored in.