B1: Corporate Games Pistol Shoot - 2004
B2: Results for May 12th, 2004
B3: Click on the Stage # to view the Course of Fire.
A4: Place | B4: Name | C4: Organization | D4: Shoot Total | E4: Total Points Down | F4: Stage 1 | G4: String 1 | H4: Points Down | I4: Stage 2 | J4: String 1 | K4: String 2 | L4: Points Down | M4: Stage 3 | N4: String 1 | O4: Points Down
A5: 1 | B5: Stilwell, Michael | C5: Nu Skin | D5: =+F5+I5+M5 -> 68.94 | E5: =+H5+L5+O5 -> 12 | F5: =+G5+(H5*0.5) -> 24.16 | G5: 22.16 | H5: 4 | I5: =+J5+K5+(L5*0.5) -> 35.20 | J5: 12.45 | K5: 19.25 | L5: 7 | M5: =+N5+(O5*0.5) -> 9.58 | N5: 9.08 | O5: 1
A6: NC | B6: Zaccardi, Pat | C6: Range Masters | D6: =+F6+I6+M6 -> 74.55 | E6: =+H6+L6+O6 -> 18 | F6: =+G6+(H6*0.5) -> 26.40 | G6: 24.90 | H6: 3 | I6: =+J6+K6+(L6*0.5) -> 37.84 | J6: 13.40 | K6: 16.94 | L6: 15 | M6: =+N6+(O6*0.5) -> 10.31 | N6: 10.31 | O6: 0
A7: 2 | B7: Taylor, Joshua | C7: Nu Skin | D7: =+F7+I7+M7 -> 74.71 | E7: =+H7+L7+O7 -> 10 | F7: =+G7+(H7*0.5) -> 24.65 | G7: 23.15 | H7: 3 | I7: =+J7+K7+(L7*0.5) -> 36.34 | J7: 16.23 | K7: 19.61 | L7: 1 | M7: =+N7+(O7*0.5) -> 13.72 | N7: 10.72 | O7: 6
A8: 3 | B8: Adams, Kyle | C8: Provo City Power | D8: =+F8+I8+M8 -> 93.20 | E8: =+H8+L8+O8 -> 14 | F8: =+G8+(H8*0.5) -> 30.22 | G8: 26.72 | H8: 7 | I8: =+J8+K8+(L8*0.5) -> 48.41 | J8: 22.62 | K8: 22.29 | L8: 7 | M8: =+N8+(O8*0.5) -> 14.57 | N8: 14.57 | O8: 0
A9: 4 | B9: Jones, Brad | C9: Nu Skin | D9: =+F9+I9+M9 -> 94.04 | E9: =+H9+L9+O9 -> 31 | F9: =+G9+(H9*0.5) -> 36.18 | G9: 36.18 | H9: 0 | I9: =+J9+K9+(L9*0.5) -> 37.92 | J9: 12.17 | K9: 15.75 | L9: 20 | M9: =+N9+(O9*0.5) -> 19.94 | N9: 14.44 | O9: 11
A10: 5 | B10: Yei, David | C10: Provo City | D10: =+F10+I10+M10 -> 99.78 | E10: =+H10+L10+O10 -> 27 | F10: =+G10+(H10*0.5) -> 31.07 | G10: 27.07 | H10: 8 | I10: =+J10+K10+(L10*0.5) -> 49.82 | J10: 22.39 | K10: 19.43 | L10: 16 | M10: =+N10+(O10*0.5) -> 18.89 | N10: 17.39 | O10: 3
A11: 6 | B11: Larsen, Tom | C11: Novell | D11: =+F11+I11+M11 -> 104.07 | E11: =+H11+L11+O11 -> 43 | F11: =+G11+(H11*0.5) -> 35.32 | G11: 31.82 | H11: 7 | I11: =+J11+K11+(L11*0.5) -> 52.41 | J11: 19.94 | K11: 17.47 | L11: 30 | M11: =+N11+(O11*0.5) -> 16.34 | N11: 13.34 | O11: 6
A12: 7 | B12: Marlow, Dave | C12: Nu Skin | D12: =+F12+I12+M12 -> 105.70 | E12: =+H12+L12+O12 -> 27 | F12: =+G12+(H12*0.5) -> 44.39 | G12: 37.89 | H12: 13 | I12: =+J12+K12+(L12*0.5) -> 47.89 | J12: 19.41 | K12: 21.48 | L12: 14 | M12: =+N12+(O12*0.5) -> 13.42 | N12: 13.42 | O12: 0
A13: 8 | B13: Finlinson, Jason | C13: Provo City | D13: =+F13+I13+M13 -> 107.02 | E13: =+H13+L13+O13 -> 12 | F13: =+G13+(H13*0.5) -> 44.33 | G13: 38.33 | H13: 12 | I13: =+J13+K13+(L13*0.5) -> 45.31 | J13: 22.45 | K13: 22.86 | L13: 0 | M13: =+N13+(O13*0.5) -> 17.38 | N13: 17.38 | O13: 0
A14: 9 | B14: Richards, Rhead | C14: Nu Skin | D14: =+F14+I14+M14 -> 108.54 | E14: =+H14+L14+O14 -> 29 | F14: =+G14+(H14*0.5) -> 44.62 | G14: 40.12 | H14: 9 | I14: =+J14+K14+(L14*0.5) -> 44.73 | J14: 17.45 | K14: 20.28 | L14: 14 | M14: =+N14+(O14*0.5) -> 19.19 | N14: 16.19 | O14: 6
A15: 10 | B15: Bolinder, Jim | C15: Nu Skin | D15: =+F15+I15+M15 -> 113.52 | E15: =+H15+L15+O15 -> 31 | F15: =+G15+(H15*0.5) -> 53.44 | G15: 43.94 | H15: 19 | I15: =+J15+K15+(L15*0.5) -> 45.08 | J15: 17.31 | K15: 22.77 | L15: 10 | M15: =+N15+(O15*0.5) -> 15.00 | N15: 14.00 | O15: 2
A16: 11 | B16: Daniels, Robert | C16: IHC | D16: =+F16+I16+M16 -> 119.49 | E16: =+H16+L16+O16 -> 81 | F16: =+G16+(H16*0.5) -> 53.28 | G16: 26.78 | H16: 53 | I16: =+J16+K16+(L16*0.5) -> 51.24 | J16: 16.72 | K16: 20.52 | L16: 28 | M16: =+N16+(O16*0.5) -> 14.97 | N16: 14.97 | O16: 0
A17: 12 | B17: Smith, Jason | C17: Provo City Power | D17: =+F17+I17+M17 -> 124.40 | E17: =+H17+L17+O17 -> 43 | F17: =+G17+(H17*0.5) -> 48.80 | G17: 47.80 | H17: 2 | I17: =+J17+K17+(L17*0.5) -> 56.52 | J17: 16.95 | K17: 19.07 | L17: 41 | M17: =+N17+(O17*0.5) -> 19.08 | N17: 19.08 | O17: 0
A18: 13 | B18: Johnson, Bruce | C18: IHC | D18: =+F18+I18+M18 -> 134.61 | E18: =+H18+L18+O18 -> 34 | F18: =+G18+(H18*0.5) -> 54.93 | G18: 50.93 | H18: 8 | I18: =+J18+K18+(L18*0.5) -> 58.07 | J18: 20.79 | K18: 26.28 | L18: 22 | M18: =+N18+(O18*0.5) -> 21.61 | N18: 19.61 | O18: 4
A19: 14 | B19: Ostler, Darrell | C19: Novell | D19: =+F19+I19+M19 -> 135.52 | E19: =+H19+L19+O19 -> 27 | F19: =+G19+(H19*0.5) -> 54.59 | G19: 51.59 | H19: 6 | I19: =+J19+K19+(L19*0.5) -> 52.49 | J19: 18.46 | K19: 24.03 | L19: 20 | M19: =+N19+(O19*0.5) -> 28.44 | N19: 27.94 | O19: 1
A20: 15 | B20: Hutchison, Dean | C20: Provo City Parks | D20: =+F20+I20+M20 -> 135.61 | E20: =+H20+L20+O20 -> 27 | F20: =+G20+(H20*0.5) -> 49.14 | G20: 45.14 | H20: 8 | I20: =+J20+K20+(L20*0.5) -> 68.73 | J20: 33.64 | K20: 26.59 | L20: 17 | M20: =+N20+(O20*0.5) -> 17.74 | N20: 16.74 | O20: 2
A21: 16 | B21: Nielson, Mike | C21: IHC | D21: =+F21+I21+M21 -> 153.07 | E21: =+H21+L21+O21 -> 99 | F21: =+G21+(H21*0.5) -> 60.02 | G21: 32.52 | H21: 55 | I21: =+J21+K21+(L21*0.5) -> 64.89 | J21: 22.62 | K21: 30.77 | L21: 23 | M21: =+N21+(O21*0.5) -> 28.16 | N21: 17.66 | O21: 21
A22: 17 | B22: West, Dave | C22: Provo City Power | D22: =+F22+I22+M22 -> 155.46 | E22: =+H22+L22+O22 -> 6 | F22: =+G22+(H22*0.5) -> 70.68 | G22: 70.18 | H22: 1 | I22: =+J22+K22+(L22*0.5) -> 58.81 | J22: 30.63 | K22: 25.68 | L22: 5 | M22: =+N22+(O22*0.5) -> 25.97 | N22: 25.97 | O22: 0
A23: 18 | B23: Cather, Dan | C23: Provo City | D23: =+F23+I23+M23 -> 171.62 | E23: =+H23+L23+O23 -> 55 | F23: =+G23+(H23*0.5) -> 57.48 | G23: 46.98 | H23: 21 | I23: =+J23+K23+(L23*0.5) -> 83.20 | J23: 36.36 | K23: 29.84 | L23: 34 | M23: =+N23+(O23*0.5) -> 30.94 | N23: 30.94 | O23: 0
A24: 19 | B24: Johnson, Ken | C24: Provo City Power | D24: =+F24+I24+M24 -> 203.40 | E24: =+H24+L24+O24 -> 38 | F24: =+G24+(H24*0.5) -> 78.50 | G24: 71.00 | H24: 15 | I24: =+J24+K24+(L24*0.5) -> 83.89 | J24: 29.23 | K24: 48.16 | L24: 13 | M24: =+N24+(O24*0.5) -> 41.01 | N24: 36.01 | O24: 10
A25: 20 | B25: Hardy, Brett | C25: Provo City Power | D25: =+F25+I25+M25 -> 217.92 | E25: =+H25+L25+O25 -> 43 | F25: =+G25+(H25*0.5) -> 79.21 | G25: 77.21 | H25: 4 | I25: =+J25+K25+(L25*0.5) -> 110.85 | J25: 26.62 | K25: 64.73 | L25: 39 | M25: =+N25+(O25*0.5) -> 27.86 | N25: 27.86 | O25: 0
A27: Notes:
A28: NC | B28: - Not Considered for medal placement. Although hosting the competition, Range Masters was not formally registered as a competing company. For that reason, Pat did not qualify for a medal.
A29: X | B29: - Indicates that the Points Down value contains some type of penalty (Procedural = 6 PD, "Hit on Non-Threat" = 10 PD, or 'Miss-On-Steel ' = 10PD).
B30: Special recognition is given to those who acted as Safety Officers for the competition. Note that all SOs are members of the Utah County based Utah Defensive Pistol League (UDPL):
B31: Ken Collins | C31: Kent Redford | D31: Kyle Adams | F31: Mike Stilwell
B32: Noel Redford | C32: Pat Zaccardi | D32: Steve Redford