A2: Utah State IDPA Match - 2003 Results | H2: (Sorted by Division without regard for Classification.)
B3: Held on September 13, 2003 | G3: 1 | J3: 2 | M3: 3 | P3: 4 | T3: 5 | W3: 6 | AA3: 7 | AD3: 8 | AG3: 9
A4: Place | B4: Name (Last, First) | D4: (Div-Class) | E4: Shoot Total | F4: Total PD | G4: Stage 1 | H4: String 1 | I4: Points Down | J4: Stage 2 | K4: String 1 | L4: Points Down | M4: Stage 3 | N4: String 1 | O4: Points Down | P4: Stage 4 | Q4: String 1 | R4: String 2 | S4: Points Down | T4: Stage 5 | U4: String 1 | V4: Points Down | W4: Stage 6 | X4: String 1 | Y4: String 2 | Z4: Points Down | AA4: Stage 7 | AB4: String 1 | AC4: Points Down | AD4: Stage 8 | AE4: String 1 | AF4: Points Down | AG4: Stage 9 | AH4: String 1 | AI4: String 2 | AJ4: Points Down
A5: SSP-
A6: 1 | B6: Mahoney, | C6: Chuck | D6: SSP-MA | E6: =+G6+J6+M6+P6+T6+W6+AA6+AD6+AG6 -> 152.72 | F6: =+I6+L6+O6+S6+V6+Z6+AC6+AF6+AJ6 -> 23 | G6: =+H6+0.5*I6 -> 21.06 | H6: 18.06 | I6: 6 | J6: =+K6+0.5*L6 -> 11.33 | K6: 10.83 | L6: 1 | M6: =+N6+0.5*O6 -> 20.36 | N6: 18.86 | O6: 3 | P6: =+Q6+R6+0.5*S6 -> 20.01 | Q6: 10.88 | R6: 9.13 | S6: 0 | T6: =+U6+0.5*V6 -> 6.74 | U6: 5.24 | V6: 3 | W6: =+X6+Y6+0.5*Z6 -> 22.84 | X6: 4.15 | Y6: 17.19 | Z6: 3 | AA6: =+AB6+0.5*AC6 -> 20.52 | AB6: 18.52 | AC6: 4 | AD6: =+AE6+0.5*AF6 -> 15.99 | AE6: 14.99 | AF6: 2 | AG6: =+AH6+AI6+0.5*AJ6 -> 13.87 | AH6: 7.61 | AI6: 5.76 | AJ6: 1
A7: 2 | B7: Koski, | C7: Steve | D7: SSP-MA | E7: =+G7+J7+M7+P7+T7+W7+AA7+AD7+AG7 -> 173.51 | F7: =+I7+L7+O7+S7+V7+Z7+AC7+AF7+AJ7 -> 17 | G7: =+H7+0.5*I7 -> 24.47 | H7: 24.47 | I7: 0 | J7: =+K7+0.5*L7 -> 16.09 | K7: 13.09 | L7: 6 | M7: =+N7+0.5*O7 -> 27.31 | N7: 26.31 | O7: 2 | P7: =+Q7+R7+0.5*S7 -> 17.78 | Q7: 9.55 | R7: 8.23 | S7: 0 | T7: =+U7+0.5*V7 -> 6.89 | U7: 6.89 | V7: 0 | W7: =+X7+Y7+0.5*Z7 -> 25.11 | X7: 5.82 | Y7: 18.79 | Z7: 1 | AA7: =+AB7+0.5*AC7 -> 23.70 | AB7: 21.70 | AC7: 4 | AD7: =+AE7+0.5*AF7 -> 16.76 | AE7: 16.26 | AF7: 1 | AG7: =+AH7+AI7+0.5*AJ7 -> 15.40 | AH7: 7.53 | AI7: 6.37 | AJ7: 3
A8: 3 | B8: Boender, | C8: David | D8: SSP-EX | E8: =+G8+J8+M8+P8+T8+W8+AA8+AD8+AG8 -> 200.46 | F8: =+I8+L8+O8+S8+V8+Z8+AC8+AF8+AJ8 -> 32 | G8: =+H8+0.5*I8 -> 18.00 | H8: 18.00 | I8: 0 | J8: =+K8+0.5*L8 -> 23.27 | K8: 21.77 | L8: 3 | M8: =+N8+0.5*O8 -> 30.27 | N8: 27.27 | O8: 6 | P8: =+Q8+R8+0.5*S8 -> 21.98 | Q8: 11.79 | R8: 9.19 | S8: 2 | T8: =+U8+0.5*V8 -> 8.05 | U8: 7.05 | V8: 2 | W8: =+X8+Y8+0.5*Z8 -> 27.14 | X8: 3.73 | Y8: 19.41 | Z8: 8 | AA8: =+AB8+0.5*AC8 -> 29.29 | AB8: 24.29 | AC8: 10 | AD8: =+AE8+0.5*AF8 -> 22.28 | AE8: 22.28 | AF8: 0 | AG8: =+AH8+AI8+0.5*AJ8 -> 20.18 | AH8: 10.77 | AI8: 8.91 | AJ8: 1
A9: 4 | B9: Lowe, | C9: John | D9: SSP-MA | E9: =+G9+J9+M9+P9+T9+W9+AA9+AD9+AG9 -> 202.67 | F9: =+I9+L9+O9+S9+V9+Z9+AC9+AF9+AJ9 -> 28 | G9: =+H9+0.5*I9 -> 37.80 | H9: 37.80 | I9: 0 | J9: =+K9+0.5*L9 -> 16.84 | K9: 15.84 | L9: 2 | M9: =+N9+0.5*O9 -> 28.78 | N9: 27.28 | O9: 3 | P9: =+Q9+R9+0.5*S9 -> 23.55 | Q9: 13.98 | R9: 9.07 | S9: 1 | T9: =+U9+0.5*V9 -> 6.24 | U9: 6.24 | V9: 0 | W9: =+X9+Y9+0.5*Z9 -> 29.65 | X9: 4.65 | Y9: 21.50 | Z9: 7 | AA9: =+AB9+0.5*AC9 -> 21.02 | AB9: 18.02 | AC9: 6 | AD9: =+AE9+0.5*AF9 -> 20.08 | AE9: 17.08 | AF9: 6 | AG9: =+AH9+AI9+0.5*AJ9 -> 18.71 | AH9: 9.44 | AI9: 7.77 | AJ9: 3
A10: 5 | B10: Vollmer, | C10: Philip | D10: SSP-EX | E10: =+G10+J10+M10+P10+T10+W10+AA10+AD10+AG10 -> 214.05 | F10: =+I10+L10+O10+S10+V10+Z10+AC10+AF10+AJ10 -> 34 | G10: =+H10+0.5*I10 -> 22.90 | H10: 22.90 | I10: 0 | J10: =+K10+0.5*L10 -> 19.51 | K10: 17.51 | L10: 4 | M10: =+N10+0.5*O10 -> 38.00 | N10: 32.00 | O10: 12 | P10: =+Q10+R10+0.5*S10 -> 25.31 | Q10: 11.53 | R10: 11.28 | S10: 5 | T10: =+U10+0.5*V10 -> 8.96 | U10: 6.96 | V10: 4 | W10: =+X10+Y10+0.5*Z10 -> 32.11 | X10: 6.64 | Y10: 22.47 | Z10: 6 | AA10: =+AB10+0.5*AC10 -> 25.32 | AB10: 24.32 | AC10: 2 | AD10: =+AE10+0.5*AF10 -> 21.45 | AE10: 21.45 | AF10: 0 | AG10: =+AH10+AI10+0.5*AJ10 -> 20.49 | AH10: 11.69 | AI10: 8.30 | AJ10: 1
A11: 6 | B11: Sexton, | C11: Mike | D11: SSP-EX | E11: =+G11+J11+M11+P11+T11+W11+AA11+AD11+AG11 -> 216.82 | F11: =+I11+L11+O11+S11+V11+Z11+AC11+AF11+AJ11 -> 44 | G11: =+H11+0.5*I11 -> 26.40 | H11: 25.90 | I11: 1 | J11: =+K11+0.5*L11 -> 16.27 | K11: 15.27 | L11: 2 | M11: =+N11+0.5*O11 -> 41.77 | N11: 33.77 | O11: 16 | P11: =+Q11+R11+0.5*S11 -> 22.62 | Q11: 11.99 | R11: 10.13 | S11: 1 | T11: =+U11+0.5*V11 -> 7.25 | U11: 6.25 | V11: 2 | W11: =+X11+Y11+0.5*Z11 -> 31.59 | X11: 6.05 | Y11: 19.04 | Z11: 13 | AA11: =+AB11+0.5*AC11 -> 25.63 | AB11: 24.63 | AC11: 2 | AD11: =+AE11+0.5*AF11 -> 26.87 | AE11: 23.87 | AF11: 6 | AG11: =+AH11+AI11+0.5*AJ11 -> 18.42 | AH11: 9.19 | AI11: 8.73 | AJ11: 1
A12: 7 | B12: Vilos, | C12: Mitch | D12: SSP-EX | E12: =+G12+J12+M12+P12+T12+W12+AA12+AD12+AG12 -> 222.62 | F12: =+I12+L12+O12+S12+V12+Z12+AC12+AF12+AJ12 -> 25 | G12: =+H12+0.5*I12 -> 26.16 | H12: 25.16 | I12: 2 | J12: =+K12+0.5*L12 -> 15.30 | K12: 15.30 | L12: 0 | M12: =+N12+0.5*O12 -> 31.32 | N12: 31.32 | O12: 0 | P12: =+Q12+R12+0.5*S12 -> 31.29 | Q12: 14.17 | R12: 12.62 | S12: 9 | T12: =+U12+0.5*V12 -> 16.61 | U12: 11.11 | V12: 11 | W12: =+X12+Y12+0.5*Z12 -> 26.00 | X12: 5.03 | Y12: 20.97 | Z12: 0 | AA12: =+AB12+0.5*AC12 -> 25.59 | AB12: 25.09 | AC12: 1 | AD12: =+AE12+0.5*AF12 -> 30.66 | AE12: 30.16 | AF12: 1 | AG12: =+AH12+AI12+0.5*AJ12 -> 19.69 | AH12: 10.92 | AI12: 8.27 | AJ12: 1
A13: 8 | B13: Roubinet, | C13: P. J. | D13: SSP-SS | E13: =+G13+J13+M13+P13+T13+W13+AA13+AD13+AG13 -> 224.93 | F13: =+I13+L13+O13+S13+V13+Z13+AC13+AF13+AJ13 -> 31 | G13: =+H13+0.5*I13 -> 28.16 | H13: 27.66 | I13: 1 | J13: =+K13+0.5*L13 -> 14.01 | K13: 12.01 | L13: 4 | M13: =+N13+0.5*O13 -> 40.68 | N13: 36.18 | O13: 9 | P13: =+Q13+R13+0.5*S13 -> 26.79 | Q13: 15.01 | R13: 11.28 | S13: 1 | T13: =+U13+0.5*V13 -> 9.76 | U13: 9.76 | V13: 0 | W13: =+X13+Y13+0.5*Z13 -> 31.12 | X13: 5.19 | Y13: 22.93 | Z13: 6 | AA13: =+AB13+0.5*AC13 -> 27.83 | AB13: 27.83 | AC13: 0 | AD13: =+AE13+0.5*AF13 -> 29.02 | AE13: 24.52 | AF13: 9 | AG13: =+AH13+AI13+0.5*AJ13 -> 17.56 | AH13: 9.97 | AI13: 7.09 | AJ13: 1
A14: 9 | B14: Richards, | C14: Dave | D14: SSP-EX | E14: =+G14+J14+M14+P14+T14+W14+AA14+AD14+AG14 -> 231.06 | F14: =+I14+L14+O14+S14+V14+Z14+AC14+AF14+AJ14 -> 53 | G14: =+H14+0.5*I14 -> 21.98 | H14: 21.48 | I14: 1 | J14: =+K14+0.5*L14 -> 28.51 | K14: 18.51 | L14: 20 | M14: =+N14+0.5*O14 -> 36.83 | N14: 28.83 | O14: 16 | P14: =+Q14+R14+0.5*S14 -> 28.34 | Q14: 15.28 | R14: 10.06 | S14: 6 | T14: =+U14+0.5*V14 -> 8.30 | U14: 7.80 | V14: 1 | W14: =+X14+Y14+0.5*Z14 -> 31.82 | X14: 5.40 | Y14: 23.92 | Z14: 5 | AA14: =+AB14+0.5*AC14 -> 30.29 | AB14: 29.79 | AC14: 1 | AD14: =+AE14+0.5*AF14 -> 20.22 | AE14: 19.72 | AF14: 1 | AG14: =+AH14+AI14+0.5*AJ14 -> 24.77 | AH14: 13.87 | AI14: 9.90 | AJ14: 2
A15: 10 | B15: Mahoney, | C15: Joni | D15: SSP-SS | E15: =+G15+J15+M15+P15+T15+W15+AA15+AD15+AG15 -> 263.29 | F15: =+I15+L15+O15+S15+V15+Z15+AC15+AF15+AJ15 -> 62 | G15: =+H15+0.5*I15 -> 30.50 | H15: 29.50 | I15: 2 | J15: =+K15+0.5*L15 -> 19.13 | K15: 16.63 | L15: 5 | M15: =+N15+0.5*O15 -> 45.69 | N15: 40.19 | O15: 11 | P15: =+Q15+R15+0.5*S15 -> 27.80 | Q15: 13.63 | R15: 13.67 | S15: 1 | T15: =+U15+0.5*V15 -> 10.60 | U15: 9.10 | V15: 3 | W15: =+X15+Y15+0.5*Z15 -> 46.21 | X15: 5.31 | Y15: 27.90 | Z15: 26 | AA15: =+AB15+0.5*AC15 -> 31.83 | AB15: 27.33 | AC15: 9 | AD15: =+AE15+0.5*AF15 -> 29.26 | AE15: 26.76 | AF15: 5 | AG15: =+AH15+AI15+0.5*AJ15 -> 22.27 | AH15: 12.03 | AI15: 10.24 | AJ15: 0
A16: 11 | B16: Spicer, | C16: Richard | D16: SSP-SS | E16: =+G16+J16+M16+P16+T16+W16+AA16+AD16+AG16 -> 270.08 | F16: =+I16+L16+O16+S16+V16+Z16+AC16+AF16+AJ16 -> 30 | G16: =+H16+0.5*I16 -> 39.42 | H16: 38.92 | I16: 1 | J16: =+K16+0.5*L16 -> 21.68 | K16: 20.68 | L16: 2 | M16: =+N16+0.5*O16 -> 32.12 | N16: 30.62 | O16: 3 | P16: =+Q16+R16+0.5*S16 -> 29.15 | Q16: 15.78 | R16: 12.37 | S16: 2 | T16: =+U16+0.5*V16 -> 8.46 | U16: 8.46 | V16: 0 | W16: =+X16+Y16+0.5*Z16 -> 35.12 | X16: 6.26 | Y16: 25.36 | Z16: 7 | AA16: =+AB16+0.5*AC16 -> 37.32 | AB16: 30.82 | AC16: 13 | AD16: =+AE16+0.5*AF16 -> 42.98 | AE16: 41.98 | AF16: 2 | AG16: =+AH16+AI16+0.5*AJ16 -> 23.83 | AH16: 13.66 | AI16: 10.17 | AJ16: 0
A17: 12 | B17: Spicer, | C17: Robert L. | D17: SSP-SS | E17: =+G17+J17+M17+P17+T17+W17+AA17+AD17+AG17 -> 272.68 | F17: =+I17+L17+O17+S17+V17+Z17+AC17+AF17+AJ17 -> 56 | G17: =+H17+0.5*I17 -> 25.85 | H17: 25.85 | I17: 0 | J17: =+K17+0.5*L17 -> 21.50 | K17: 19.00 | L17: 5 | M17: =+N17+0.5*O17 -> 36.33 | N17: 34.33 | O17: 4 | P17: =+Q17+R17+0.5*S17 -> 56.89 | Q17: 31.56 | R17: 13.33 | S17: 24 | T17: =+U17+0.5*V17 -> 14.34 | U17: 9.84 | V17: 9 | W17: =+X17+Y17+0.5*Z17 -> 36.88 | X17: 6.24 | Y17: 29.14 | Z17: 3 | AA17: =+AB17+0.5*AC17 -> 27.27 | AB17: 26.27 | AC17: 2 | AD17: =+AE17+0.5*AF17 -> 29.35 | AE17: 29.35 | AF17: 0 | AG17: =+AH17+AI17+0.5*AJ17 -> 24.27 | AH17: 10.82 | AI17: 8.95 | AJ17: 9
A18: 13 | B18: Thomas, | C18: Kevin | D18: SSP-SS | E18: =+G18+J18+M18+P18+T18+W18+AA18+AD18+AG18 -> 273.21 | F18: =+I18+L18+O18+S18+V18+Z18+AC18+AF18+AJ18 -> 64 | G18: =+H18+0.5*I18 -> 50.26 | H18: 44.26 | I18: 12 | J18: =+K18+0.5*L18 -> 14.45 | K18: 13.95 | L18: 1 | M18: =+N18+0.5*O18 -> 59.30 | N18: 46.80 | O18: 25 | P18: =+Q18+R18+0.5*S18 -> 28.60 | Q18: 16.31 | R18: 9.29 | S18: 6 | T18: =+U18+0.5*V18 -> 9.16 | U18: 8.16 | V18: 2 | W18: =+X18+Y18+0.5*Z18 -> 30.03 | X18: 5.41 | Y18: 24.12 | Z18: 1 | AA18: =+AB18+0.5*AC18 -> 35.54 | AB18: 29.54 | AC18: 12 | AD18: =+AE18+0.5*AF18 -> 26.20 | AE18: 25.70 | AF18: 1 | AG18: =+AH18+AI18+0.5*AJ18 -> 19.67 | AH18: 9.81 | AI18: 7.86 | AJ18: 4
A19: 14 | B19: Jorgensen, | C19: John Q | D19: SSP-SS | E19: =+G19+J19+M19+P19+T19+W19+AA19+AD19+AG19 -> 276.42 | F19: =+I19+L19+O19+S19+V19+Z19+AC19+AF19+AJ19 -> 111 | G19: =+H19+0.5*I19 -> 27.98 | H19: 25.48 | I19: 5 | J19: =+K19+0.5*L19 -> 21.61 | K19: 20.11 | L19: 3 | M19: =+N19+0.5*O19 -> 42.83 | N19: 34.83 | O19: 16 | P19: =+Q19+R19+0.5*S19 -> 35.56 | Q19: 14.82 | R19: 13.24 | S19: 15 | T19: =+U19+0.5*V19 -> 10.29 | U19: 8.79 | V19: 3 | W19: =+X19+Y19+0.5*Z19 -> 38.98 | X19: 5.01 | Y19: 25.47 | Z19: 17 | AA19: =+AB19+0.5*AC19 -> 42.85 | AB19: 26.85 | AC19: 32 | AD19: =+AE19+0.5*AF19 -> 32.11 | AE19: 26.61 | AF19: 11 | AG19: =+AH19+AI19+0.5*AJ19 -> 24.21 | AH19: 11.74 | AI19: 7.97 | AJ19: 9
A20: 15 | B20: Andersen, | C20: Welden | D20: SSP-SS | E20: =+G20+J20+M20+P20+T20+W20+AA20+AD20+AG20 -> 280.23 | F20: =+I20+L20+O20+S20+V20+Z20+AC20+AF20+AJ20 -> 33 | G20: =+H20+0.5*I20 -> 33.50 | H20: 33.50 | I20: 0 | J20: =+K20+0.5*L20 -> 28.88 | K20: 28.38 | L20: 1 | M20: =+N20+0.5*O20 -> 50.23 | N20: 42.23 | O20: 16 | P20: =+Q20+R20+0.5*S20 -> 28.64 | Q20: 16.41 | R20: 12.23 | S20: 0 | T20: =+U20+0.5*V20 -> 11.39 | U20: 11.39 | V20: 0 | W20: =+X20+Y20+0.5*Z20 -> 41.24 | X20: 4.76 | Y20: 32.48 | Z20: 8 | AA20: =+AB20+0.5*AC20 -> 40.22 | AB20: 37.22 | AC20: 6 | AD20: =+AE20+0.5*AF20 -> 22.79 | AE20: 21.79 | AF20: 2 | AG20: =+AH20+AI20+0.5*AJ20 -> 23.34 | AH20: 14.29 | AI20: 9.05 | AJ20: 0
A21: 16 | B21: Nelson, | C21: John | D21: SSP-SS | E21: =+G21+J21+M21+P21+T21+W21+AA21+AD21+AG21 -> 280.75 | F21: =+I21+L21+O21+S21+V21+Z21+AC21+AF21+AJ21 -> 95 | G21: =+H21+0.5*I21 -> 38.74 | H21: 38.74 | I21: 0 | J21: =+K21+0.5*L21 -> 18.72 | K21: 17.22 | L21: 3 | M21: =+N21+0.5*O21 -> 34.75 | N21: 29.75 | O21: 10 | P21: =+Q21+R21+0.5*S21 -> 36.27 | Q21: 17.10 | R21: 15.17 | S21: 8 | T21: =+U21+0.5*V21 -> 36.98 | U21: 11.48 | V21: 51 | W21: =+X21+Y21+0.5*Z21 -> 36.66 | X21: 6.52 | Y21: 23.14 | Z21: 14 | AA21: =+AB21+0.5*AC21 -> 29.12 | AB21: 28.12 | AC21: 2 | AD21: =+AE21+0.5*AF21 -> 29.78 | AE21: 26.78 | AF21: 6 | AG21: =+AH21+AI21+0.5*AJ21 -> 19.73 | AH21: 10.76 | AI21: 8.47 | AJ21: 1
A22: 17 | B22: Bautista, | C22: Roy | D22: SSP-SS | E22: =+G22+J22+M22+P22+T22+W22+AA22+AD22+AG22 -> 282.48 | F22: =+I22+L22+O22+S22+V22+Z22+AC22+AF22+AJ22 -> 63 | G22: =+H22+0.5*I22 -> 32.53 | H22: 32.53 | I22: 0 | J22: =+K22+0.5*L22 -> 19.53 | K22: 19.53 | L22: 0 | M22: =+N22+0.5*O22 -> 62.09 | N22: 58.59 | O22: 7 | P22: =+Q22+R22+0.5*S22 -> 27.82 | Q22: 11.81 | R22: 12.51 | S22: 7 | T22: =+U22+0.5*V22 -> 12.68 | U22: 6.68 | V22: 12 | W22: =+X22+Y22+0.5*Z22 -> 34.36 | X22: 4.69 | Y22: 27.17 | Z22: 5 | AA22: =+AB22+0.5*AC22 -> 26.60 | AB22: 21.60 | AC22: 10 | AD22: =+AE22+0.5*AF22 -> 31.67 | AE22: 24.17 | AF22: 15 | AG22: =+AH22+AI22+0.5*AJ22 -> 35.20 | AH22: 15.53 | AI22: 16.17 | AJ22: 7
A23: 18 | B23: Carlson, | C23: Paul | D23: SSP-MM | E23: =+G23+J23+M23+P23+T23+W23+AA23+AD23+AG23 -> 293.78 | F23: =+I23+L23+O23+S23+V23+Z23+AC23+AF23+AJ23 -> 73 | G23: =+H23+0.5*I23 -> 51.30 | H23: 48.30 | I23: 6 | J23: =+K23+0.5*L23 -> 17.69 | K23: 13.69 | L23: 8 | M23: =+N23+0.5*O23 -> 56.80 | N23: 53.80 | O23: 6 | P23: =+Q23+R23+0.5*S23 -> 31.94 | Q23: 16.18 | R23: 12.26 | S23: 7 | T23: =+U23+0.5*V23 -> 9.17 | U23: 8.17 | V23: 2 | W23: =+X23+Y23+0.5*Z23 -> 44.67 | X23: 4.08 | Y23: 28.59 | Z23: 24 | AA23: =+AB23+0.5*AC23 -> 30.12 | AB23: 26.62 | AC23: 7 | AD23: =+AE23+0.5*AF23 -> 31.28 | AE23: 25.28 | AF23: 12 | AG23: =+AH23+AI23+0.5*AJ23 -> 20.81 | AH23: 11.12 | AI23: 9.19 | AJ23: 1
A24: 19 | B24: Boyer, | C24: Stephen | D24: SSP-MM | E24: =+G24+J24+M24+P24+T24+W24+AA24+AD24+AG24 -> 297.82 | F24: =+I24+L24+O24+S24+V24+Z24+AC24+AF24+AJ24 -> 18 | G24: =+H24+0.5*I24 -> 34.38 | H24: 33.88 | I24: 1 | J24: =+K24+0.5*L24 -> 24.85 | K24: 24.35 | L24: 1 | M24: =+N24+0.5*O24 -> 51.71 | N24: 47.21 | O24: 9 | P24: =+Q24+R24+0.5*S24 -> 33.67 | Q24: 19.17 | R24: 14.50 | S24: 0 | T24: =+U24+0.5*V24 -> 9.97 | U24: 9.97 | V24: 0 | W24: =+X24+Y24+0.5*Z24 -> 40.44 | X24: 6.18 | Y24: 32.76 | Z24: 3 | AA24: =+AB24+0.5*AC24 -> 42.57 | AB24: 41.07 | AC24: 3 | AD24: =+AE24+0.5*AF24 -> 37.41 | AE24: 36.91 | AF24: 1 | AG24: =+AH24+AI24+0.5*AJ24 -> 22.82 | AH24: 12.41 | AI24: 10.41 | AJ24: 0
A25: 20 | B25: Maloy, | C25: Cory A | D25: SSP-MM | E25: =+G25+J25+M25+P25+T25+W25+AA25+AD25+AG25 -> 305.14 | F25: =+I25+L25+O25+S25+V25+Z25+AC25+AF25+AJ25 -> 58 | G25: =+H25+0.5*I25 -> 27.95 | H25: 27.45 | I25: 1 | J25: =+K25+0.5*L25 -> 23.50 | K25: 22.00 | L25: 3 | M25: =+N25+0.5*O25 -> 53.26 | N25: 44.26 | O25: 18 | P25: =+Q25+R25+0.5*S25 -> 33.84 | Q25: 17.27 | R25: 15.57 | S25: 2 | T25: =+U25+0.5*V25 -> 13.07 | U25: 12.57 | V25: 1 | W25: =+X25+Y25+0.5*Z25 -> 41.21 | X25: 7.45 | Y25: 29.76 | Z25: 8 | AA25: =+AB25+0.5*AC25 -> 37.05 | AB25: 33.55 | AC25: 7 | AD25: =+AE25+0.5*AF25 -> 40.77 | AE25: 35.27 | AF25: 11 | AG25: =+AH25+AI25+0.5*AJ25 -> 34.49 | AH25: 16.18 | AI25: 14.81 | AJ25: 7
A26: 21 | B26: Jespersen, | C26: Chad | D26: SSP-MM | E26: =+G26+J26+M26+P26+T26+W26+AA26+AD26+AG26 -> 321.49 | F26: =+I26+L26+O26+S26+V26+Z26+AC26+AF26+AJ26 -> 83 | G26: =+H26+0.5*I26 -> 47.65 | H26: 46.65 | I26: 2 | J26: =+K26+0.5*L26 -> 27.12 | K26: 24.62 | L26: 5 | M26: =+N26+0.5*O26 -> 46.85 | N26: 46.35 | O26: 1 | P26: =+Q26+R26+0.5*S26 -> 43.14 | Q26: 16.48 | R26: 14.66 | S26: 24 | T26: =+U26+0.5*V26 -> 12.20 | U26: 12.20 | V26: 0 | W26: =+X26+Y26+0.5*Z26 -> 39.35 | X26: 7.75 | Y26: 30.10 | Z26: 3 | AA26: =+AB26+0.5*AC26 -> 42.90 | AB26: 31.40 | AC26: 23 | AD26: =+AE26+0.5*AF26 -> 35.82 | AE26: 23.32 | AF26: 25 | AG26: =+AH26+AI26+0.5*AJ26 -> 26.46 | AH26: 11.66 | AI26: 14.80 | AJ26: 0
A27: 22 | B27: Cosper, | C27: Chris | D27: SSP-MM | E27: =+G27+J27+M27+P27+T27+W27+AA27+AD27+AG27 -> 327.49 | F27: =+I27+L27+O27+S27+V27+Z27+AC27+AF27+AJ27 -> 71 | G27: =+H27+0.5*I27 -> 32.31 | H27: 31.81 | I27: 1 | J27: =+K27+0.5*L27 -> 22.86 | K27: 21.86 | L27: 2 | M27: =+N27+0.5*O27 -> 44.38 | N27: 34.88 | O27: 19 | P27: =+Q27+R27+0.5*S27 -> 31.76 | Q27: 14.25 | R27: 12.01 | S27: 11 | T27: =+U27+0.5*V27 -> 9.71 | U27: 9.21 | V27: 1 | W27: =+X27+Y27+0.5*Z27 -> 48.85 | X27: 12.34 | Y27: 29.51 | Z27: 14 | AA27: =+AB27+0.5*AC27 -> 37.79 | AB27: 37.29 | AC27: 1 | AD27: =+AE27+0.5*AF27 -> 70.96 | AE27: 62.96 | AF27: 16 | AG27: =+AH27+AI27+0.5*AJ27 -> 28.87 | AH27: 15.82 | AI27: 10.05 | AJ27: 6
A28: 23 | B28: Wilkins, | C28: Lance | D28: SSP-SS | E28: =+G28+J28+M28+P28+T28+W28+AA28+AD28+AG28 -> 328.20 | F28: =+I28+L28+O28+S28+V28+Z28+AC28+AF28+AJ28 -> 116 | G28: =+H28+0.5*I28 -> 43.22 | H28: 43.22 | I28: 0 | J28: =+K28+0.5*L28 -> 22.83 | K28: 19.33 | L28: 7 | M28: =+N28+0.5*O28 -> 57.65 | N28: 35.15 | O28: 45 | P28: =+Q28+R28+0.5*S28 -> 31.18 | Q28: 17.43 | R28: 13.25 | S28: 1 | T28: =+U28+0.5*V28 -> 24.47 | U28: 8.97 | V28: 31 | W28: =+X28+Y28+0.5*Z28 -> 41.79 | X28: 5.60 | Y28: 28.19 | Z28: 16 | AA28: =+AB28+0.5*AC28 -> 36.58 | AB28: 33.58 | AC28: 6 | AD28: =+AE28+0.5*AF28 -> 48.69 | AE28: 44.19 | AF28: 9 | AG28: =+AH28+AI28+0.5*AJ28 -> 21.79 | AH28: 13.13 | AI28: 8.16 | AJ28: 1
A29: 24 | B29: Redford, | C29: Noel | D29: SSP-MM | E29: =+G29+J29+M29+P29+T29+W29+AA29+AD29+AG29 -> 329.16 | F29: =+I29+L29+O29+S29+V29+Z29+AC29+AF29+AJ29 -> 61 | G29: =+H29+0.5*I29 -> 35.31 | H29: 34.31 | I29: 2 | J29: =+K29+0.5*L29 -> 29.78 | K29: 26.78 | L29: 6 | M29: =+N29+0.5*O29 -> 54.84 | N29: 48.34 | O29: 13 | P29: =+Q29+R29+0.5*S29 -> 28.42 | Q29: 14.92 | R29: 12.50 | S29: 2 | T29: =+U29+0.5*V29 -> 15.07 | U29: 8.07 | V29: 14 | W29: =+X29+Y29+0.5*Z29 -> 47.23 | X29: 8.59 | Y29: 32.64 | Z29: 12 | AA29: =+AB29+0.5*AC29 -> 38.66 | AB29: 37.16 | AC29: 3 | AD29: =+AE29+0.5*AF29 -> 53.04 | AE29: 52.04 | AF29: 2 | AG29: =+AH29+AI29+0.5*AJ29 -> 26.81 | AH29: 11.72 | AI29: 11.59 | AJ29: 7
A30: 25 | B30: Huggins, | C30: Chip | D30: SSP-MM | E30: =+G30+J30+M30+P30+T30+W30+AA30+AD30+AG30 -> 329.84 | F30: =+I30+L30+O30+S30+V30+Z30+AC30+AF30+AJ30 -> 96 | G30: =+H30+0.5*I30 -> 27.69 | H30: 22.69 | I30: 10 | J30: =+K30+0.5*L30 -> 29.12 | K30: 21.12 | L30: 16 | M30: =+N30+0.5*O30 -> 55.26 | N30: 51.26 | O30: 8 | P30: =+Q30+R30+0.5*S30 -> 34.80 | Q30: 14.57 | R30: 12.73 | S30: 15 | T30: =+U30+0.5*V30 -> 15.59 | U30: 9.59 | V30: 12 | W30: =+X30+Y30+0.5*Z30 -> 55.89 | X30: 7.01 | Y30: 42.88 | Z30: 12 | AA30: =+AB30+0.5*AC30 -> 35.24 | AB30: 31.74 | AC30: 7 | AD30: =+AE30+0.5*AF30 -> 47.16 | AE30: 39.66 | AF30: 15 | AG30: =+AH30+AI30+0.5*AJ30 -> 29.09 | AH30: 15.78 | AI30: 12.81 | AJ30: 1
A31: 26 | B31: Roubinet, | C31: Paul | D31: SSP-MM | E31: =+G31+J31+M31+P31+T31+W31+AA31+AD31+AG31 -> 332.57 | F31: =+I31+L31+O31+S31+V31+Z31+AC31+AF31+AJ31 -> 27 | G31: =+H31+0.5*I31 -> 48.32 | H31: 47.32 | I31: 2 | J31: =+K31+0.5*L31 -> 22.26 | K31: 22.26 | L31: 0 | M31: =+N31+0.5*O31 -> 56.09 | N31: 54.59 | O31: 3 | P31: =+Q31+R31+0.5*S31 -> 46.30 | Q31: 21.59 | R31: 19.21 | S31: 11 | T31: =+U31+0.5*V31 -> 10.39 | U31: 10.39 | V31: 0 | W31: =+X31+Y31+0.5*Z31 -> 55.24 | X31: 6.88 | Y31: 45.86 | Z31: 5 | AA31: =+AB31+0.5*AC31 -> 38.57 | AB31: 38.07 | AC31: 1 | AD31: =+AE31+0.5*AF31 -> 34.58 | AE31: 33.58 | AF31: 2 | AG31: =+AH31+AI31+0.5*AJ31 -> 20.82 | AH31: 9.52 | AI31: 9.80 | AJ31: 3
A32: 27 | B32: Wimberly, | C32: Jeff | D32: SSP-MM | E32: =+G32+J32+M32+P32+T32+W32+AA32+AD32+AG32 -> 336.61 | F32: =+I32+L32+O32+S32+V32+Z32+AC32+AF32+AJ32 -> 53 | G32: =+H32+0.5*I32 -> 51.16 | H32: 50.66 | I32: 1 | J32: =+K32+0.5*L32 -> 23.35 | K32: 22.85 | L32: 1 | M32: =+N32+0.5*O32 -> 48.68 | N32: 41.68 | O32: 14 | P32: =+Q32+R32+0.5*S32 -> 56.58 | Q32: 18.22 | R32: 28.36 | S32: 20 | T32: =+U32+0.5*V32 -> 11.15 | U32: 10.15 | V32: 2 | W32: =+X32+Y32+0.5*Z32 -> 37.22 | X32: 6.37 | Y32: 29.35 | Z32: 3 | AA32: =+AB32+0.5*AC32 -> 41.38 | AB32: 41.38 | AC32: 0 | AD32: =+AE32+0.5*AF32 -> 36.94 | AE32: 32.94 | AF32: 8 | AG32: =+AH32+AI32+0.5*AJ32 -> 30.15 | AH32: 15.44 | AI32: 12.71 | AJ32: 4
A33: 28 | B33: Decker, | C33: Dennis | D33: SSP-MM | E33: =+G33+J33+M33+P33+T33+W33+AA33+AD33+AG33 -> 342.05 | F33: =+I33+L33+O33+S33+V33+Z33+AC33+AF33+AJ33 -> 64 | G33: =+H33+0.5*I33 -> 41.17 | H33: 41.17 | I33: 0 | J33: =+K33+0.5*L33 -> 24.47 | K33: 22.97 | L33: 3 | M33: =+N33+0.5*O33 -> 56.38 | N33: 43.38 | O33: 26 | P33: =+Q33+R33+0.5*S33 -> 43.46 | Q33: 19.17 | R33: 18.29 | S33: 12 | T33: =+U33+0.5*V33 -> 8.04 | U33: 8.04 | V33: 0 | W33: =+X33+Y33+0.5*Z33 -> 66.07 | X33: 6.43 | Y33: 54.14 | Z33: 11 | AA33: =+AB33+0.5*AC33 -> 50.48 | AB33: 46.98 | AC33: 7 | AD33: =+AE33+0.5*AF33 -> 27.47 | AE33: 24.97 | AF33: 5 | AG33: =+AH33+AI33+0.5*AJ33 -> 24.51 | AH33: 12.87 | AI33: 11.64 | AJ33: 0
A34: 29 | B34: Sterling, | C34: Scott | D34: SSP-MM | E34: =+G34+J34+M34+P34+T34+W34+AA34+AD34+AG34 -> 367.51 | F34: =+I34+L34+O34+S34+V34+Z34+AC34+AF34+AJ34 -> 17 | G34: =+H34+0.5*I34 -> 41.89 | H34: 41.89 | I34: 0 | J34: =+K34+0.5*L34 -> 28.21 | K34: 24.71 | L34: 7 | M34: =+N34+0.5*O34 -> 56.25 | N34: 54.25 | O34: 4 | P34: =+Q34+R34+0.5*S34 -> 56.60 | Q34: 21.79 | R34: 33.31 | S34: 3 | T34: =+U34+0.5*V34 -> 9.39 | U34: 9.39 | V34: 0 | W34: =+X34+Y34+0.5*Z34 -> 50.16 | X34: 9.34 | Y34: 40.82 | Z34: 0 | AA34: =+AB34+0.5*AC34 -> 49.87 | AB34: 49.87 | AC34: 0 | AD34: =+AE34+0.5*AF34 -> 46.41 | AE34: 45.91 | AF34: 1 | AG34: =+AH34+AI34+0.5*AJ34 -> 28.73 | AH34: 14.74 | AI34: 12.99 | AJ34: 2
A35: 30 | B35: Allen, | C35: Susan M. | D35: SSP-NV | E35: =+G35+J35+M35+P35+T35+W35+AA35+AD35+AG35 -> 386.22 | F35: =+I35+L35+O35+S35+V35+Z35+AC35+AF35+AJ35 -> 100 | G35: =+H35+0.5*I35 -> 46.62 | H35: 45.62 | I35: 2 | J35: =+K35+0.5*L35 -> 33.70 | K35: 31.20 | L35: 5 | M35: =+N35+0.5*O35 -> 56.47 | N35: 40.47 | O35: 32 | P35: =+Q35+R35+0.5*S35 -> 46.21 | Q35: 23.19 | R35: 19.52 | S35: 7 | T35: =+U35+0.5*V35 -> 19.62 | U35: 11.12 | V35: 17 | W35: =+X35+Y35+0.5*Z35 -> 62.64 | X35: 10.61 | Y35: 42.53 | Z35: 19 | AA35: =+AB35+0.5*AC35 -> 41.13 | AB35: 36.63 | AC35: 9 | AD35: =+AE35+0.5*AF35 -> 45.11 | AE35: 44.11 | AF35: 2 | AG35: =+AH35+AI35+0.5*AJ35 -> 34.72 | AH35: 15.05 | AI35: 16.17 | AJ35: 7
A36: 31 | B36: Bier, | C36: Gabriel | D36: SSP-MM | E36: DQ | F36: DQ | G36: =+H36+0.5*I36 -> 36.47 | H36: 34.97 | I36: 3 | J36: =+K36+0.5*L36 -> 25.62 | K36: 24.62 | L36: 2 | M36: =+N36+0.5*O36 -> 43.93 | N36: 42.43 | O36: 3 | P36: =+Q36+R36+0.5*S36 -> 41.51 | Q36: 20.76 | R36: 19.25 | S36: 3 | T36: =+U36+0.5*V36 -> 18.05 | U36: 17.05 | V36: 2 | W36: DQ | X36: 8.17 | AA36: =+AB36+0.5*AC36 -> 0.00 | AD36: =+AE36+0.5*AF36 -> 0.00 | AG36: =+AH36+AI36+0.5*AJ36 -> 0.00
A37: SSR-
A38: 1 | B38: Mousley, | C38: Roger | D38: SSR-EX | E38: =+G38+J38+M38+P38+T38+W38+AA38+AD38+AG38 -> 253.35 | F38: =+I38+L38+O38+S38+V38+Z38+AC38+AF38+AJ38 -> 26 | G38: =+H38+0.5*I38 -> 29.61 | H38: 29.11 | I38: 1 | J38: =+K38+0.5*L38 -> 19.24 | K38: 15.74 | L38: 7 | M38: =+N38+0.5*O38 -> 42.55 | N38: 40.55 | O38: 4 | P38: =+Q38+R38+0.5*S38 -> 25.80 | Q38: 13.51 | R38: 11.79 | S38: 1 | T38: =+U38+0.5*V38 -> 8.35 | U38: 7.85 | V38: 1 | W38: =+X38+Y38+0.5*Z38 -> 45.44 | X38: 5.12 | Y38: 35.82 | Z38: 9 | AA38: =+AB38+0.5*AC38 -> 32.65 | AB38: 32.15 | AC38: 1 | AD38: =+AE38+0.5*AF38 -> 22.29 | AE38: 22.29 | AF38: 0 | AG38: =+AH38+AI38+0.5*AJ38 -> 27.42 | AH38: 11.97 | AI38: 14.45 | AJ38: 2
A39: 2 | B39: Carter, | C39: Theo | D39: SSR-SS | E39: =+G39+J39+M39+P39+T39+W39+AA39+AD39+AG39 -> 266.02 | F39: =+I39+L39+O39+S39+V39+Z39+AC39+AF39+AJ39 -> 49 | G39: =+H39+0.5*I39 -> 28.38 | H39: 27.88 | I39: 1 | J39: =+K39+0.5*L39 -> 17.68 | K39: 15.18 | L39: 5 | M39: =+N39+0.5*O39 -> 42.41 | N39: 32.91 | O39: 19 | P39: =+Q39+R39+0.5*S39 -> 27.23 | Q39: 13.00 | R39: 11.73 | S39: 5 | T39: =+U39+0.5*V39 -> 7.38 | U39: 6.88 | V39: 1 | W39: =+X39+Y39+0.5*Z39 -> 45.92 | X39: 5.41 | Y39: 38.01 | Z39: 5 | AA39: =+AB39+0.5*AC39 -> 38.97 | AB39: 37.97 | AC39: 2 | AD39: =+AE39+0.5*AF39 -> 28.88 | AE39: 26.38 | AF39: 5 | AG39: =+AH39+AI39+0.5*AJ39 -> 29.17 | AH39: 13.07 | AI39: 13.10 | AJ39: 6
A40: 3 | B40: Veldboon, | C40: Terry | D40: SSR-EX | E40: =+G40+J40+M40+P40+T40+W40+AA40+AD40+AG40 -> 275.41 | F40: =+I40+L40+O40+S40+V40+Z40+AC40+AF40+AJ40 -> 33 | G40: =+H40+0.5*I40 -> 29.02 | H40: 28.02 | I40: 2 | J40: =+K40+0.5*L40 -> 28.13 | K40: 28.13 | L40: 0 | M40: =+N40+0.5*O40 -> 38.13 | N40: 33.13 | O40: 10 | P40: =+Q40+R40+0.5*S40 -> 29.56 | Q40: 16.13 | R40: 12.43 | S40: 2 | T40: =+U40+0.5*V40 -> 8.00 | U40: 7.50 | V40: 1 | W40: =+X40+Y40+0.5*Z40 -> 42.10 | X40: 5.42 | Y40: 34.68 | Z40: 4 | AA40: =+AB40+0.5*AC40 -> 42.98 | AB40: 37.48 | AC40: 11 | AD40: =+AE40+0.5*AF40 -> 24.72 | AE40: 24.72 | AF40: 0 | AG40: =+AH40+AI40+0.5*AJ40 -> 32.77 | AH40: 15.72 | AI40: 15.55 | AJ40: 3
A41: 4 | B41: Mingo, | C41: John | D41: SSR-SS | E41: =+G41+J41+M41+P41+T41+W41+AA41+AD41+AG41 -> 298.90 | F41: =+I41+L41+O41+S41+V41+Z41+AC41+AF41+AJ41 -> 47 | G41: =+H41+0.5*I41 -> 44.22 | H41: 42.72 | I41: 3 | J41: =+K41+0.5*L41 -> 20.50 | K41: 18.50 | L41: 4 | M41: =+N41+0.5*O41 -> 40.94 | N41: 30.94 | O41: 20 | P41: =+Q41+R41+0.5*S41 -> 28.42 | Q41: 13.02 | R41: 12.40 | S41: 6 | T41: =+U41+0.5*V41 -> 11.40 | U41: 10.90 | V41: 1 | W41: =+X41+Y41+0.5*Z41 -> 48.52 | X41: 6.53 | Y41: 41.49 | Z41: 1 | AA41: =+AB41+0.5*AC41 -> 46.80 | AB41: 43.30 | AC41: 7 | AD41: =+AE41+0.5*AF41 -> 28.55 | AE41: 26.05 | AF41: 5 | AG41: =+AH41+AI41+0.5*AJ41 -> 29.55 | AH41: 15.63 | AI41: 13.92 | AJ41: 0
A42: 5 | B42: Beckham, | C42: Scott | D42: SSR-SS | E42: =+G42+J42+M42+P42+T42+W42+AA42+AD42+AG42 -> 317.43 | F42: =+I42+L42+O42+S42+V42+Z42+AC42+AF42+AJ42 -> 38 | G42: =+H42+0.5*I42 -> 34.03 | H42: 32.03 | I42: 4 | J42: =+K42+0.5*L42 -> 20.31 | K42: 19.81 | L42: 1 | M42: =+N42+0.5*O42 -> 54.10 | N42: 53.10 | O42: 2 | P42: =+Q42+R42+0.5*S42 -> 35.14 | Q42: 18.14 | R42: 13.50 | S42: 7 | T42: =+U42+0.5*V42 -> 10.72 | U42: 8.22 | V42: 5 | W42: =+X42+Y42+0.5*Z42 -> 53.60 | X42: 5.80 | Y42: 42.30 | Z42: 11 | AA42: =+AB42+0.5*AC42 -> 39.61 | AB42: 38.11 | AC42: 3 | AD42: =+AE42+0.5*AF42 -> 35.39 | AE42: 33.89 | AF42: 3 | AG42: =+AH42+AI42+0.5*AJ42 -> 34.53 | AH42: 19.36 | AI42: 14.17 | AJ42: 2
A44: Legend/Notes:
A45: X | B45: = Shooters who received trophies for their specific Division/Classification.
A46: Xx Xx | B46: = Shooters who acted as SOs or were part of the Match Staff.
A47: DQ | B47: = Shooter was disqualified for some reason.
A48: XX | B48: = Points Down value included some sore of penalty (Procedural, Hit On Non-threat, Failure to Neutralize, etc.)
A49: XXX.XX | B49: = Because these shooters took 1st place in their specific Div/Class and there were more than 10 shooters competing in their classification, they were automatically advanced to the next highest classification.
B51: All of the individual scores were verified on 9/16/03. Some corrections may have resulted in minor placing changes, but none affected the final trophy winning results.