C2: Utah State IDPA Match - 2003 Results | J2: (Sorted by Time without regard for Division/Classification.)
B3: Held on September 13, 2003 | I3: 1 | L3: 2 | O3: 3 | R3: 4 | V3: 5 | Y3: 6 | AC3: 7 | AF3: 8 | AI3: 9
A4: Shooter # | B4: Squad | C4: Place | D4: Name (Last, First) | F4: (Div-Class) | G4: Shoot Total | H4: Total PD | I4: Stage 1 | J4: String 1 | K4: Points Down | L4: Stage 2 | M4: String 1 | N4: Points Down | O4: Stage 3 | P4: String 1 | Q4: Points Down | R4: Stage 4 | S4: String 1 | T4: String 2 | U4: Points Down | V4: Stage 5 | W4: String 1 | X4: Points Down | Y4: Stage 6 | Z4: String 1 | AA4: String 2 | AB4: Points Down | AC4: Stage 7 | AD4: String 1 | AE4: Points Down | AF4: Stage 8 | AG4: String 1 | AH4: Points Down | AI4: Stage 9 | AJ4: String 1 | AK4: String 2 | AL4: Points Down
A5: 41 | B5: 6 | C5: 1 | D5: Mahoney, | E5: Chuck | F5: SSP-MA | G5: =+I5+L5+O5+R5+V5+Y5+AC5+AF5+AI5 -> 152.72 | H5: =+K5+N5+Q5+U5+X5+AB5+AE5+AH5+AL5 -> 23 | I5: =+J5+0.5*K5 -> 21.06 | J5: 18.06 | K5: 6 | L5: =+M5+0.5*N5 -> 11.33 | M5: 10.83 | N5: 1 | O5: =+P5+0.5*Q5 -> 20.36 | P5: 18.86 | Q5: 3 | R5: =+S5+T5+0.5*U5 -> 20.01 | S5: 10.88 | T5: 9.13 | U5: 0 | V5: =+W5+0.5*X5 -> 6.74 | W5: 5.24 | X5: 3 | Y5: =+Z5+AA5+0.5*AB5 -> 22.84 | Z5: 4.15 | AA5: 17.19 | AB5: 3 | AC5: =+AD5+0.5*AE5 -> 20.52 | AD5: 18.52 | AE5: 4 | AF5: =+AG5+0.5*AH5 -> 15.99 | AG5: 14.99 | AH5: 2 | AI5: =+AJ5+AK5+0.5*AL5 -> 13.87 | AJ5: 7.61 | AK5: 5.76 | AL5: 1
A6: 3 | B6: 1 | C6: 2 | D6: Edwards, | E6: Lance | F6: ESP-EX | G6: =+I6+L6+O6+R6+V6+Y6+AC6+AF6+AI6 -> 158.75 | H6: =+K6+N6+Q6+U6+X6+AB6+AE6+AH6+AL6 -> 30 | I6: =+J6+0.5*K6 -> 18.60 | J6: 18.60 | K6: 0 | L6: =+M6+0.5*N6 -> 14.86 | M6: 11.86 | N6: 6 | O6: =+P6+0.5*Q6 -> 24.40 | P6: 21.40 | Q6: 6 | R6: =+S6+T6+0.5*U6 -> 22.81 | S6: 14.60 | T6: 8.21 | U6: 0 | V6: =+W6+0.5*X6 -> 6.00 | W6: 6.00 | X6: 0 | Y6: =+Z6+AA6+0.5*AB6 -> 23.53 | Z6: 3.87 | AA6: 18.16 | AB6: 3 | AC6: =+AD6+0.5*AE6 -> 19.67 | AD6: 15.67 | AE6: 8 | AF6: =+AG6+0.5*AH6 -> 14.20 | AG6: 13.20 | AH6: 2 | AI6: =+AJ6+AK6+0.5*AL6 -> 14.68 | AJ6: 6.79 | AK6: 5.39 | AL6: 5
A7: 75 | B7: 8 | C7: 3 | D7: Boshard, | E7: David | F7: ESP-MA | G7: =+I7+L7+O7+R7+V7+Y7+AC7+AF7+AI7 -> 163.85 | H7: =+K7+N7+Q7+U7+X7+AB7+AE7+AH7+AL7 -> 17 | I7: =+J7+0.5*K7 -> 16.10 | J7: 15.60 | K7: 1 | L7: =+M7+0.5*N7 -> 14.97 | M7: 13.97 | N7: 2 | O7: =+P7+0.5*Q7 -> 25.83 | P7: 24.33 | Q7: 3 | R7: =+S7+T7+0.5*U7 -> 22.38 | S7: 10.66 | T7: 10.72 | U7: 2 | V7: =+W7+0.5*X7 -> 8.56 | W7: 7.56 | X7: 2 | Y7: =+Z7+AA7+0.5*AB7 -> 25.99 | Z7: 4.24 | AA7: 18.25 | AB7: 7 | AC7: =+AD7+0.5*AE7 -> 17.29 | AD7: 17.29 | AE7: 0 | AF7: =+AG7+0.5*AH7 -> 15.82 | AG7: 15.82 | AH7: 0 | AI7: =+AJ7+AK7+0.5*AL7 -> 16.91 | AJ7: 9.81 | AK7: 7.10 | AL7: 0
A8: 5 | B8: 1 | C8: 4 | D8: Koski, | E8: Steve | F8: SSP-MA | G8: =+I8+L8+O8+R8+V8+Y8+AC8+AF8+AI8 -> 173.51 | H8: =+K8+N8+Q8+U8+X8+AB8+AE8+AH8+AL8 -> 17 | I8: =+J8+0.5*K8 -> 24.47 | J8: 24.47 | K8: 0 | L8: =+M8+0.5*N8 -> 16.09 | M8: 13.09 | N8: 6 | O8: =+P8+0.5*Q8 -> 27.31 | P8: 26.31 | Q8: 2 | R8: =+S8+T8+0.5*U8 -> 17.78 | S8: 9.55 | T8: 8.23 | U8: 0 | V8: =+W8+0.5*X8 -> 6.89 | W8: 6.89 | X8: 0 | Y8: =+Z8+AA8+0.5*AB8 -> 25.11 | Z8: 5.82 | AA8: 18.79 | AB8: 1 | AC8: =+AD8+0.5*AE8 -> 23.70 | AD8: 21.70 | AE8: 4 | AF8: =+AG8+0.5*AH8 -> 16.76 | AG8: 16.26 | AH8: 1 | AI8: =+AJ8+AK8+0.5*AL8 -> 15.40 | AJ8: 7.53 | AK8: 6.37 | AL8: 3
A9: 59 | B9: 0 | C9: 5 | D9: Tran, | E9: Hung | F9: CDP-SS | G9: =+I9+L9+O9+R9+V9+Y9+AC9+AF9+AI9 -> 175.80 | H9: =+K9+N9+Q9+U9+X9+AB9+AE9+AH9+AL9 -> 63 | I9: =+J9+0.5*K9 -> 21.80 | J9: 20.30 | K9: 3 | L9: =+M9+0.5*N9 -> 14.91 | M9: 10.41 | N9: 9 | O9: =+P9+0.5*Q9 -> 30.56 | P9: 24.56 | Q9: 12 | R9: =+S9+T9+0.5*U9 -> 20.09 | S9: 9.40 | T9: 7.69 | U9: 6 | V9: =+W9+0.5*X9 -> 9.10 | W9: 7.10 | X9: 4 | Y9: =+Z9+AA9+0.5*AB9 -> 23.34 | Z9: 3.60 | AA9: 17.24 | AB9: 5 | AC9: =+AD9+0.5*AE9 -> 20.21 | AD9: 14.71 | AE9: 11 | AF9: =+AG9+0.5*AH9 -> 17.94 | AG9: 16.94 | AH9: 2 | AI9: =+AJ9+AK9+0.5*AL9 -> 17.85 | AJ9: 7.28 | AK9: 5.07 | AL9: 11
A10: 61 | B10: 9 | C10: 6 | D10: Latham, | E10: Cory | F10: CDP-EX | G10: =+I10+L10+O10+R10+V10+Y10+AC10+AF10+AI10 -> 178.65 | H10: =+K10+N10+Q10+U10+X10+AB10+AE10+AH10+AL10 -> 28 | I10: =+J10+0.5*K10 -> 22.46 | J10: 21.46 | K10: 2 | L10: =+M10+0.5*N10 -> 16.71 | M10: 15.71 | N10: 2 | O10: =+P10+0.5*Q10 -> 24.78 | P10: 21.78 | Q10: 6 | R10: =+S10+T10+0.5*U10 -> 21.88 | S10: 10.98 | T10: 8.40 | U10: 5 | V10: =+W10+0.5*X10 -> 8.68 | W10: 8.18 | X10: 1 | Y10: =+Z10+AA10+0.5*AB10 -> 27.49 | Z10: 4.46 | AA10: 20.03 | AB10: 6 | AC10: =+AD10+0.5*AE10 -> 20.18 | AD10: 20.18 | AE10: 0 | AF10: =+AG10+0.5*AH10 -> 21.47 | AG10: 18.47 | AH10: 6 | AI10: =+AJ10+AK10+0.5*AL10 -> 15.00 | AJ10: 8.26 | AK10: 6.74 | AL10: 0
A11: 60 | B11: 9 | C11: 7 | D11: Griffiths, | E11: Todd | F11: CDP-EX | G11: =+I11+L11+O11+R11+V11+Y11+AC11+AF11+AI11 -> 187.80 | H11: =+K11+N11+Q11+U11+X11+AB11+AE11+AH11+AL11 -> 38 | I11: =+J11+0.5*K11 -> 20.06 | J11: 17.56 | K11: 5 | L11: =+M11+0.5*N11 -> 15.44 | M11: 14.94 | N11: 1 | O11: =+P11+0.5*Q11 -> 30.12 | P11: 27.62 | Q11: 5 | R11: =+S11+T11+0.5*U11 -> 20.76 | S11: 10.45 | T11: 9.31 | U11: 2 | V11: =+W11+0.5*X11 -> 7.49 | W11: 6.99 | X11: 1 | Y11: =+Z11+AA11+0.5*AB11 -> 36.06 | Z11: 3.99 | AA11: 29.57 | AB11: 5 | AC11: =+AD11+0.5*AE11 -> 20.70 | AD11: 18.70 | AE11: 4 | AF11: =+AG11+0.5*AH11 -> 20.96 | AG11: 14.46 | AH11: 13 | AI11: =+AJ11+AK11+0.5*AL11 -> 16.21 | AJ11: 8.29 | AK11: 6.92 | AL11: 2
A12: 12 | B12: 2 | C12: 8 | D12: Theodore, | E12: Ari | F12: CDP-EX | G12: =+I12+L12+O12+R12+V12+Y12+AC12+AF12+AI12 -> 195.27 | H12: =+K12+N12+Q12+U12+X12+AB12+AE12+AH12+AL12 -> 33 | I12: =+J12+0.5*K12 -> 22.13 | J12: 21.13 | K12: 2 | L12: =+M12+0.5*N12 -> 14.06 | M12: 14.06 | N12: 0 | O12: =+P12+0.5*Q12 -> 35.45 | P12: 32.45 | Q12: 6 | R12: =+S12+T12+0.5*U12 -> 25.05 | S12: 12.60 | T12: 10.95 | U12: 3 | V12: =+W12+0.5*X12 -> 8.77 | W12: 6.77 | X12: 4 | Y12: =+Z12+AA12+0.5*AB12 -> 30.84 | Z12: 4.69 | AA12: 22.15 | AB12: 8 | AC12: =+AD12+0.5*AE12 -> 19.56 | AD12: 19.06 | AE12: 1 | AF12: =+AG12+0.5*AH12 -> 22.31 | AG12: 18.81 | AH12: 7 | AI12: =+AJ12+AK12+0.5*AL12 -> 17.10 | AJ12: 9.94 | AK12: 6.16 | AL12: 2
A13: 79 | B13: 0 | C13: 9 | D13: Zaccardi, | E13: Pat | F13: ESP-SS | G13: =+I13+L13+O13+R13+V13+Y13+AC13+AF13+AI13 -> 196.74 | H13: =+K13+N13+Q13+U13+X13+AB13+AE13+AH13+AL13 -> 39 | I13: =+J13+0.5*K13 -> 24.67 | J13: 23.67 | K13: 2 | L13: =+M13+0.5*N13 -> 14.95 | M13: 13.45 | N13: 3 | O13: =+P13+0.5*Q13 -> 31.40 | P13: 25.40 | Q13: 12 | R13: =+S13+T13+0.5*U13 -> 23.04 | S13: 10.17 | T13: 8.37 | U13: 9 | V13: =+W13+0.5*X13 -> 8.75 | W13: 8.75 | X13: 0 | Y13: =+Z13+AA13+0.5*AB13 -> 24.45 | Z13: 5.41 | AA13: 17.54 | AB13: 3 | AC13: =+AD13+0.5*AE13 -> 28.71 | AD13: 27.71 | AE13: 2 | AF13: =+AG13+0.5*AH13 -> 20.66 | AG13: 19.66 | AH13: 2 | AI13: =+AJ13+AK13+0.5*AL13 -> 20.11 | AJ13: 10.18 | AK13: 6.93 | AL13: 6
A14: 72 | B14: 1 | C14: 10 | D14: Lepley, | E14: Alex | F14: CDP-EX | G14: =+I14+L14+O14+R14+V14+Y14+AC14+AF14+AI14 -> 196.99 | H14: =+K14+N14+Q14+U14+X14+AB14+AE14+AH14+AL14 -> 29 | I14: =+J14+0.5*K14 -> 19.76 | J14: 19.26 | K14: 1 | L14: =+M14+0.5*N14 -> 17.21 | M14: 14.21 | N14: 6 | O14: =+P14+0.5*Q14 -> 30.53 | P14: 28.53 | Q14: 4 | R14: =+S14+T14+0.5*U14 -> 24.03 | S14: 12.88 | T14: 9.15 | U14: 4 | V14: =+W14+0.5*X14 -> 8.94 | W14: 7.94 | X14: 2 | Y14: =+Z14+AA14+0.5*AB14 -> 28.94 | Z14: 4.66 | AA14: 21.78 | AB14: 5 | AC14: =+AD14+0.5*AE14 -> 22.80 | AD14: 21.80 | AE14: 2 | AF14: =+AG14+0.5*AH14 -> 24.91 | AG14: 22.91 | AH14: 4 | AI14: =+AJ14+AK14+0.5*AL14 -> 19.87 | AJ14: 9.42 | AK14: 9.95 | AL14: 1
A15: 30 | B15: 0 | C15: 11 | D15: Boender, | E15: David | F15: SSP-EX | G15: =+I15+L15+O15+R15+V15+Y15+AC15+AF15+AI15 -> 200.46 | H15: =+K15+N15+Q15+U15+X15+AB15+AE15+AH15+AL15 -> 32 | I15: =+J15+0.5*K15 -> 18.00 | J15: 18.00 | K15: 0 | L15: =+M15+0.5*N15 -> 23.27 | M15: 21.77 | N15: 3 | O15: =+P15+0.5*Q15 -> 30.27 | P15: 27.27 | Q15: 6 | R15: =+S15+T15+0.5*U15 -> 21.98 | S15: 11.79 | T15: 9.19 | U15: 2 | V15: =+W15+0.5*X15 -> 8.05 | W15: 7.05 | X15: 2 | Y15: =+Z15+AA15+0.5*AB15 -> 27.14 | Z15: 3.73 | AA15: 19.41 | AB15: 8 | AC15: =+AD15+0.5*AE15 -> 29.29 | AD15: 24.29 | AE15: 10 | AF15: =+AG15+0.5*AH15 -> 22.28 | AG15: 22.28 | AH15: 0 | AI15: =+AJ15+AK15+0.5*AL15 -> 20.18 | AJ15: 10.77 | AK15: 8.91 | AL15: 1
A16: 40 | B16: 6 | C16: 12 | D16: Lowe, | E16: John | F16: SSP-MA | G16: =+I16+L16+O16+R16+V16+Y16+AC16+AF16+AI16 -> 202.67 | H16: =+K16+N16+Q16+U16+X16+AB16+AE16+AH16+AL16 -> 28 | I16: =+J16+0.5*K16 -> 37.80 | J16: 37.80 | K16: 0 | L16: =+M16+0.5*N16 -> 16.84 | M16: 15.84 | N16: 2 | O16: =+P16+0.5*Q16 -> 28.78 | P16: 27.28 | Q16: 3 | R16: =+S16+T16+0.5*U16 -> 23.55 | S16: 13.98 | T16: 9.07 | U16: 1 | V16: =+W16+0.5*X16 -> 6.24 | W16: 6.24 | X16: 0 | Y16: =+Z16+AA16+0.5*AB16 -> 29.65 | Z16: 4.65 | AA16: 21.50 | AB16: 7 | AC16: =+AD16+0.5*AE16 -> 21.02 | AD16: 18.02 | AE16: 6 | AF16: =+AG16+0.5*AH16 -> 20.08 | AG16: 17.08 | AH16: 6 | AI16: =+AJ16+AK16+0.5*AL16 -> 18.71 | AJ16: 9.44 | AK16: 7.77 | AL16: 3
A17: 81 | B17: 1 | C17: 13 | D17: Ward, | E17: Dan | F17: CDP-EX | G17: =+I17+L17+O17+R17+V17+Y17+AC17+AF17+AI17 -> 203.31 | H17: =+K17+N17+Q17+U17+X17+AB17+AE17+AH17+AL17 -> 34 | I17: =+J17+0.5*K17 -> 24.05 | J17: 23.05 | K17: 2 | L17: =+M17+0.5*N17 -> 15.84 | M17: 14.34 | N17: 3 | O17: =+P17+0.5*Q17 -> 30.81 | P17: 28.31 | Q17: 5 | R17: =+S17+T17+0.5*U17 -> 23.66 | S17: 10.63 | T17: 10.03 | U17: 6 | V17: =+W17+0.5*X17 -> 9.80 | W17: 8.30 | X17: 3 | Y17: =+Z17+AA17+0.5*AB17 -> 31.03 | Z17: 5.48 | AA17: 24.55 | AB17: 2 | AC17: =+AD17+0.5*AE17 -> 25.47 | AD17: 19.97 | AE17: 11 | AF17: =+AG17+0.5*AH17 -> 23.79 | AG17: 22.79 | AH17: 2 | AI17: =+AJ17+AK17+0.5*AL17 -> 18.86 | AJ17: 11.81 | AK17: 7.05 | AL17: 0
A18: 57 | B18: 8 | C18: 14 | D18: Gelo, | E18: Ivan | F18: ESP-MA | G18: =+I18+L18+O18+R18+V18+Y18+AC18+AF18+AI18 -> 207.71 | H18: =+K18+N18+Q18+U18+X18+AB18+AE18+AH18+AL18 -> 77 | I18: =+J18+0.5*K18 -> 25.63 | J18: 25.13 | K18: 1 | L18: =+M18+0.5*N18 -> 16.58 | M18: 16.08 | N18: 1 | O18: =+P18+0.5*Q18 -> 42.38 | P18: 21.38 | Q18: 42 | R18: =+S18+T18+0.5*U18 -> 25.50 | S18: 10.78 | T18: 14.72 | U18: 0 | V18: =+W18+0.5*X18 -> 18.72 | W18: 8.72 | X18: 20 | Y18: =+Z18+AA18+0.5*AB18 -> 25.70 | Z18: 4.84 | AA18: 18.86 | AB18: 4 | AC18: =+AD18+0.5*AE18 -> 19.69 | AD18: 18.19 | AE18: 3 | AF18: =+AG18+0.5*AH18 -> 17.27 | AG18: 16.27 | AH18: 2 | AI18: =+AJ18+AK18+0.5*AL18 -> 16.24 | AJ18: 8.28 | AK18: 5.96 | AL18: 4
A19: 63 | B19: 9 | C19: 15 | D19: Vollmer, | E19: Philip | F19: SSP-EX | G19: =+I19+L19+O19+R19+V19+Y19+AC19+AF19+AI19 -> 214.05 | H19: =+K19+N19+Q19+U19+X19+AB19+AE19+AH19+AL19 -> 34 | I19: =+J19+0.5*K19 -> 22.90 | J19: 22.90 | K19: 0 | L19: =+M19+0.5*N19 -> 19.51 | M19: 17.51 | N19: 4 | O19: =+P19+0.5*Q19 -> 38.00 | P19: 32.00 | Q19: 12 | R19: =+S19+T19+0.5*U19 -> 25.31 | S19: 11.53 | T19: 11.28 | U19: 5 | V19: =+W19+0.5*X19 -> 8.96 | W19: 6.96 | X19: 4 | Y19: =+Z19+AA19+0.5*AB19 -> 32.11 | Z19: 6.64 | AA19: 22.47 | AB19: 6 | AC19: =+AD19+0.5*AE19 -> 25.32 | AD19: 24.32 | AE19: 2 | AF19: =+AG19+0.5*AH19 -> 21.45 | AG19: 21.45 | AH19: 0 | AI19: =+AJ19+AK19+0.5*AL19 -> 20.49 | AJ19: 11.69 | AK19: 8.30 | AL19: 1
A20: 56 | B20: 8 | C20: 16 | D20: Watson, | E20: Steven | F20: CDP-EX | G20: =+I20+L20+O20+R20+V20+Y20+AC20+AF20+AI20 -> 216.46 | H20: =+K20+N20+Q20+U20+X20+AB20+AE20+AH20+AL20 -> 32 | I20: =+J20+0.5*K20 -> 26.66 | J20: 26.16 | K20: 1 | L20: =+M20+0.5*N20 -> 18.61 | M20: 17.61 | N20: 2 | O20: =+P20+0.5*Q20 -> 32.81 | P20: 26.81 | Q20: 12 | R20: =+S20+T20+0.5*U20 -> 25.60 | S20: 13.38 | T20: 9.72 | U20: 5 | V20: =+W20+0.5*X20 -> 6.41 | W20: 6.41 | X20: 0 | Y20: =+Z20+AA20+0.5*AB20 -> 40.83 | Z20: 4.14 | AA20: 35.69 | AB20: 2 | AC20: =+AD20+0.5*AE20 -> 22.09 | AD20: 21.59 | AE20: 1 | AF20: =+AG20+0.5*AH20 -> 27.28 | AG20: 23.28 | AH20: 8 | AI20: =+AJ20+AK20+0.5*AL20 -> 16.17 | AJ20: 8.42 | AK20: 7.25 | AL20: 1
A21: 76 | B21: 5 | C21: 17 | D21: Sexton, | E21: Mike | F21: SSP-EX | G21: =+I21+L21+O21+R21+V21+Y21+AC21+AF21+AI21 -> 216.82 | H21: =+K21+N21+Q21+U21+X21+AB21+AE21+AH21+AL21 -> 44 | I21: =+J21+0.5*K21 -> 26.40 | J21: 25.90 | K21: 1 | L21: =+M21+0.5*N21 -> 16.27 | M21: 15.27 | N21: 2 | O21: =+P21+0.5*Q21 -> 41.77 | P21: 33.77 | Q21: 16 | R21: =+S21+T21+0.5*U21 -> 22.62 | S21: 11.99 | T21: 10.13 | U21: 1 | V21: =+W21+0.5*X21 -> 7.25 | W21: 6.25 | X21: 2 | Y21: =+Z21+AA21+0.5*AB21 -> 31.59 | Z21: 6.05 | AA21: 19.04 | AB21: 13 | AC21: =+AD21+0.5*AE21 -> 25.63 | AD21: 24.63 | AE21: 2 | AF21: =+AG21+0.5*AH21 -> 26.87 | AG21: 23.87 | AH21: 6 | AI21: =+AJ21+AK21+0.5*AL21 -> 18.42 | AJ21: 9.19 | AK21: 8.73 | AL21: 1
A22: 70 | B22: 0 | C22: 18 | D22: Vilos, | E22: Mitch | F22: SSP-EX | G22: =+I22+L22+O22+R22+V22+Y22+AC22+AF22+AI22 -> 222.62 | H22: =+K22+N22+Q22+U22+X22+AB22+AE22+AH22+AL22 -> 25 | I22: =+J22+0.5*K22 -> 26.16 | J22: 25.16 | K22: 2 | L22: =+M22+0.5*N22 -> 15.30 | M22: 15.30 | N22: 0 | O22: =+P22+0.5*Q22 -> 31.32 | P22: 31.32 | Q22: 0 | R22: =+S22+T22+0.5*U22 -> 31.29 | S22: 14.17 | T22: 12.62 | U22: 9 | V22: =+W22+0.5*X22 -> 16.61 | W22: 11.11 | X22: 11 | Y22: =+Z22+AA22+0.5*AB22 -> 26.00 | Z22: 5.03 | AA22: 20.97 | AB22: 0 | AC22: =+AD22+0.5*AE22 -> 25.59 | AD22: 25.09 | AE22: 1 | AF22: =+AG22+0.5*AH22 -> 30.66 | AG22: 30.16 | AH22: 1 | AI22: =+AJ22+AK22+0.5*AL22 -> 19.69 | AJ22: 10.92 | AK22: 8.27 | AL22: 1
A23: 6 | B23: 1 | C23: 19 | D23: Greathouse, | E23: Joseph | F23: ESP-SS | G23: =+I23+L23+O23+R23+V23+Y23+AC23+AF23+AI23 -> 223.96 | H23: =+K23+N23+Q23+U23+X23+AB23+AE23+AH23+AL23 -> 43 | I23: =+J23+0.5*K23 -> 26.71 | J23: 26.71 | K23: 0 | L23: =+M23+0.5*N23 -> 21.85 | M23: 14.85 | N23: 14 | O23: =+P23+0.5*Q23 -> 36.55 | P23: 32.55 | Q23: 8 | R23: =+S23+T23+0.5*U23 -> 25.87 | S23: 13.04 | T23: 9.33 | U23: 7 | V23: =+W23+0.5*X23 -> 9.33 | W23: 7.83 | X23: 3 | Y23: =+Z23+AA23+0.5*AB23 -> 34.56 | Z23: 4.72 | AA23: 27.34 | AB23: 5 | AC23: =+AD23+0.5*AE23 -> 26.58 | AD23: 26.08 | AE23: 1 | AF23: =+AG23+0.5*AH23 -> 24.13 | AG23: 22.63 | AH23: 3 | AI23: =+AJ23+AK23+0.5*AL23 -> 18.38 | AJ23: 10.07 | AK23: 7.31 | AL23: 2
A24: 54 | B24: 8 | C24: 20 | D24: Collins, | E24: Ken | F24: ESP-SS | G24: =+I24+L24+O24+R24+V24+Y24+AC24+AF24+AI24 -> 224.24 | H24: =+K24+N24+Q24+U24+X24+AB24+AE24+AH24+AL24 -> 40 | I24: =+J24+0.5*K24 -> 27.48 | J24: 26.98 | K24: 1 | L24: =+M24+0.5*N24 -> 14.16 | M24: 13.16 | N24: 2 | O24: =+P24+0.5*Q24 -> 39.49 | P24: 35.99 | Q24: 7 | R24: =+S24+T24+0.5*U24 -> 32.18 | S24: 14.14 | T24: 10.54 | U24: 15 | V24: =+W24+0.5*X24 -> 8.29 | W24: 7.29 | X24: 2 | Y24: =+Z24+AA24+0.5*AB24 -> 26.03 | Z24: 5.24 | AA24: 18.29 | AB24: 5 | AC24: =+AD24+0.5*AE24 -> 32.16 | AD24: 31.16 | AE24: 2 | AF24: =+AG24+0.5*AH24 -> 20.58 | AG24: 20.58 | AH24: 0 | AI24: =+AJ24+AK24+0.5*AL24 -> 23.87 | AJ24: 10.95 | AK24: 9.92 | AL24: 6
A25: 29 | B25: 0 | C25: 21 | D25: Roubinet, | E25: P. J. | F25: SSP-SS | G25: =+I25+L25+O25+R25+V25+Y25+AC25+AF25+AI25 -> 224.93 | H25: =+K25+N25+Q25+U25+X25+AB25+AE25+AH25+AL25 -> 31 | I25: =+J25+0.5*K25 -> 28.16 | J25: 27.66 | K25: 1 | L25: =+M25+0.5*N25 -> 14.01 | M25: 12.01 | N25: 4 | O25: =+P25+0.5*Q25 -> 40.68 | P25: 36.18 | Q25: 9 | R25: =+S25+T25+0.5*U25 -> 26.79 | S25: 15.01 | T25: 11.28 | U25: 1 | V25: =+W25+0.5*X25 -> 9.76 | W25: 9.76 | X25: 0 | Y25: =+Z25+AA25+0.5*AB25 -> 31.12 | Z25: 5.19 | AA25: 22.93 | AB25: 6 | AC25: =+AD25+0.5*AE25 -> 27.83 | AD25: 27.83 | AE25: 0 | AF25: =+AG25+0.5*AH25 -> 29.02 | AG25: 24.52 | AH25: 9 | AI25: =+AJ25+AK25+0.5*AL25 -> 17.56 | AJ25: 9.97 | AK25: 7.09 | AL25: 1
A26: 71 | B26: 1 | C26: 22 | D26: Peterson, | E26: Todd | F26: ESP-SS | G26: =+I26+L26+O26+R26+V26+Y26+AC26+AF26+AI26 -> 225.67 | H26: =+K26+N26+Q26+U26+X26+AB26+AE26+AH26+AL26 -> 47 | I26: =+J26+0.5*K26 -> 27.24 | J26: 27.24 | K26: 0 | L26: =+M26+0.5*N26 -> 17.74 | M26: 17.24 | N26: 1 | O26: =+P26+0.5*Q26 -> 39.24 | P26: 39.24 | Q26: 0 | R26: =+S26+T26+0.5*U26 -> 27.38 | S26: 7.82 | T26: 11.56 | U26: 16 | V26: =+W26+0.5*X26 -> 7.27 | W26: 7.27 | X26: 0 | Y26: =+Z26+AA26+0.5*AB26 -> 30.36 | Z26: 4.97 | AA26: 23.39 | AB26: 4 | AC26: =+AD26+0.5*AE26 -> 32.67 | AD26: 27.17 | AE26: 11 | AF26: =+AG26+0.5*AH26 -> 24.00 | AG26: 20.00 | AH26: 8 | AI26: =+AJ26+AK26+0.5*AL26 -> 19.77 | AJ26: 8.11 | AK26: 8.16 | AL26: 7
A27: 7 | B27: 3 | C27: 23 | D27: Richards, | E27: Dave | F27: SSP-EX | G27: =+I27+L27+O27+R27+V27+Y27+AC27+AF27+AI27 -> 231.06 | H27: =+K27+N27+Q27+U27+X27+AB27+AE27+AH27+AL27 -> 53 | I27: =+J27+0.5*K27 -> 21.98 | J27: 21.48 | K27: 1 | L27: =+M27+0.5*N27 -> 28.51 | M27: 18.51 | N27: 20 | O27: =+P27+0.5*Q27 -> 36.83 | P27: 28.83 | Q27: 16 | R27: =+S27+T27+0.5*U27 -> 28.34 | S27: 15.28 | T27: 10.06 | U27: 6 | V27: =+W27+0.5*X27 -> 8.30 | W27: 7.80 | X27: 1 | Y27: =+Z27+AA27+0.5*AB27 -> 31.82 | Z27: 5.40 | AA27: 23.92 | AB27: 5 | AC27: =+AD27+0.5*AE27 -> 30.29 | AD27: 29.79 | AE27: 1 | AF27: =+AG27+0.5*AH27 -> 20.22 | AG27: 19.72 | AH27: 1 | AI27: =+AJ27+AK27+0.5*AL27 -> 24.77 | AJ27: 13.87 | AK27: 9.90 | AL27: 2
A28: 67 | B28: 6 | C28: 24 | D28: Correia, | E28: Larry | F28: CDP-SS | G28: =+I28+L28+O28+R28+V28+Y28+AC28+AF28+AI28 -> 235.69 | H28: =+K28+N28+Q28+U28+X28+AB28+AE28+AH28+AL28 -> 79 | I28: =+J28+0.5*K28 -> 31.72 | J28: 28.22 | K28: 7 | L28: =+M28+0.5*N28 -> 19.87 | M28: 15.87 | N28: 8 | O28: =+P28+0.5*Q28 -> 27.05 | P28: 26.05 | Q28: 2 | R28: =+S28+T28+0.5*U28 -> 24.96 | S28: 8.60 | T28: 10.86 | U28: 11 | V28: =+W28+0.5*X28 -> 8.53 | W28: 6.53 | X28: 4 | Y28: =+Z28+AA28+0.5*AB28 -> 35.23 | Z28: 5.07 | AA28: 24.66 | AB28: 11 | AC28: =+AD28+0.5*AE28 -> 34.49 | AD28: 24.99 | AE28: 19 | AF28: =+AG28+0.5*AH28 -> 32.39 | AG28: 24.89 | AH28: 15 | AI28: =+AJ28+AK28+0.5*AL28 -> 21.45 | AJ28: 11.98 | AK28: 8.47 | AL28: 2
A29: 9 | B29: 0 | C29: 25 | D29: Haslem, | E29: Alan | F29: CDP-EX | G29: =+I29+L29+O29+R29+V29+Y29+AC29+AF29+AI29 -> 239.20 | H29: =+K29+N29+Q29+U29+X29+AB29+AE29+AH29+AL29 -> 15 | I29: =+J29+0.5*K29 -> 26.35 | J29: 24.85 | K29: 3 | L29: =+M29+0.5*N29 -> 18.40 | M29: 17.90 | N29: 1 | O29: =+P29+0.5*Q29 -> 35.73 | P29: 35.23 | Q29: 1 | R29: =+S29+T29+0.5*U29 -> 28.02 | S29: 14.83 | T29: 13.19 | U29: 0 | V29: =+W29+0.5*X29 -> 19.54 | W29: 17.54 | X29: 4 | Y29: =+Z29+AA29+0.5*AB29 -> 35.19 | Z29: 5.68 | AA29: 29.01 | AB29: 1 | AC29: =+AD29+0.5*AE29 -> 29.97 | AD29: 28.97 | AE29: 2 | AF29: =+AG29+0.5*AH29 -> 27.67 | AG29: 27.17 | AH29: 1 | AI29: =+AJ29+AK29+0.5*AL29 -> 18.33 | AJ29: 9.50 | AK29: 7.83 | AL29: 2
A30: 82 | B30: 0 | C30: 26 | D30: Zaccardi, | E30: Juke | F30: ESP-MM | G30: =+I30+L30+O30+R30+V30+Y30+AC30+AF30+AI30 -> 242.29 | H30: =+K30+N30+Q30+U30+X30+AB30+AE30+AH30+AL30 -> 50 | I30: =+J30+0.5*K30 -> 26.04 | J30: 25.54 | K30: 1 | L30: =+M30+0.5*N30 -> 21.20 | M30: 15.20 | N30: 12 | O30: =+P30+0.5*Q30 -> 39.83 | P30: 31.83 | Q30: 16 | R30: =+S30+T30+0.5*U30 -> 26.00 | S30: 14.10 | T30: 11.90 | U30: 0 | V30: =+W30+0.5*X30 -> 8.80 | W30: 8.30 | X30: 1 | Y30: =+Z30+AA30+0.5*AB30 -> 33.06 | Z30: 5.72 | AA30: 23.84 | AB30: 7 | AC30: =+AD30+0.5*AE30 -> 35.41 | AD30: 29.91 | AE30: 11 | AF30: =+AG30+0.5*AH30 -> 26.96 | AG30: 26.96 | AH30: 0 | AI30: =+AJ30+AK30+0.5*AL30 -> 24.99 | AJ30: 14.39 | AK30: 9.60 | AL30: 2
A31: 15 | B31: 0 | C31: 27 | D31: Coleman, | E31: Steve | F31: CDP-SS | G31: =+I31+L31+O31+R31+V31+Y31+AC31+AF31+AI31 -> 244.33 | H31: =+K31+N31+Q31+U31+X31+AB31+AE31+AH31+AL31 -> 48 | I31: =+J31+0.5*K31 -> 22.81 | J31: 22.31 | K31: 1 | L31: =+M31+0.5*N31 -> 19.88 | M31: 15.88 | N31: 8 | O31: =+P31+0.5*Q31 -> 44.37 | P31: 37.87 | Q31: 13 | R31: =+S31+T31+0.5*U31 -> 24.15 | S31: 12.94 | T31: 10.21 | U31: 2 | V31: =+W31+0.5*X31 -> 8.68 | W31: 8.68 | X31: 0 | Y31: =+Z31+AA31+0.5*AB31 -> 37.58 | Z31: 6.02 | AA31: 23.56 | AB31: 16 | AC31: =+AD31+0.5*AE31 -> 37.62 | AD31: 37.12 | AE31: 1 | AF31: =+AG31+0.5*AH31 -> 30.90 | AG31: 27.90 | AH31: 6 | AI31: =+AJ31+AK31+0.5*AL31 -> 18.34 | AJ31: 10.55 | AK31: 7.29 | AL31: 1
A32: 45 | B32: 7 | C32: 28 | D32: Parks, | E32: Justin | F32: ESP-SS | G32: =+I32+L32+O32+R32+V32+Y32+AC32+AF32+AI32 -> 246.49 | H32: =+K32+N32+Q32+U32+X32+AB32+AE32+AH32+AL32 -> 55 | I32: =+J32+0.5*K32 -> 31.10 | J32: 30.60 | K32: 1 | L32: =+M32+0.5*N32 -> 19.11 | M32: 16.11 | N32: 6 | O32: =+P32+0.5*Q32 -> 40.40 | P32: 33.90 | Q32: 13 | R32: =+S32+T32+0.5*U32 -> 31.17 | S32: 15.88 | T32: 11.79 | U32: 7 | V32: =+W32+0.5*X32 -> 7.26 | W32: 5.76 | X32: 3 | Y32: =+Z32+AA32+0.5*AB32 -> 36.44 | Z32: 4.93 | AA32: 24.01 | AB32: 15 | AC32: =+AD32+0.5*AE32 -> 32.74 | AD32: 29.74 | AE32: 6 | AF32: =+AG32+0.5*AH32 -> 32.26 | AG32: 31.26 | AH32: 2 | AI32: =+AJ32+AK32+0.5*AL32 -> 16.01 | AJ32: 8.04 | AK32: 6.97 | AL32: 2
A33: 77 | B33: 7 | C33: 29 | D33: Mortenson, | E33: Bryan | F33: ESP-SS | G33: =+I33+L33+O33+R33+V33+Y33+AC33+AF33+AI33 -> 249.91 | H33: =+K33+N33+Q33+U33+X33+AB33+AE33+AH33+AL33 -> 48 | I33: =+J33+0.5*K33 -> 28.70 | J33: 28.20 | K33: 1 | L33: =+M33+0.5*N33 -> 24.60 | M33: 17.10 | N33: 15 | O33: =+P33+0.5*Q33 -> 50.36 | P33: 41.36 | Q33: 18 | R33: =+S33+T33+0.5*U33 -> 30.44 | S33: 16.36 | T33: 13.58 | U33: 1 | V33: =+W33+0.5*X33 -> 9.11 | W33: 6.11 | X33: 6 | Y33: =+Z33+AA33+0.5*AB33 -> 32.10 | Z33: 6.18 | AA33: 23.42 | AB33: 5 | AC33: =+AD33+0.5*AE33 -> 27.03 | AD33: 26.53 | AE33: 1 | AF33: =+AG33+0.5*AH33 -> 29.30 | AG33: 29.30 | AH33: 0 | AI33: =+AJ33+AK33+0.5*AL33 -> 18.27 | AJ33: 9.83 | AK33: 7.94 | AL33: 1
A34: 69 | B34: 9 | C34: 30 | D34: Haslem, | E34: Kent | F34: CDP-SS | G34: =+I34+L34+O34+R34+V34+Y34+AC34+AF34+AI34 -> 250.57 | H34: =+K34+N34+Q34+U34+X34+AB34+AE34+AH34+AL34 -> 33 | I34: =+J34+0.5*K34 -> 24.14 | J34: 23.14 | K34: 2 | L34: =+M34+0.5*N34 -> 19.39 | M34: 18.89 | N34: 1 | O34: =+P34+0.5*Q34 -> 39.73 | P34: 35.23 | Q34: 9 | R34: =+S34+T34+0.5*U34 -> 31.90 | S34: 15.72 | T34: 15.68 | U34: 1 | V34: =+W34+0.5*X34 -> 6.64 | W34: 6.14 | X34: 1 | Y34: =+Z34+AA34+0.5*AB34 -> 44.08 | Z34: 5.33 | AA34: 32.75 | AB34: 12 | AC34: =+AD34+0.5*AE34 -> 33.49 | AD34: 30.99 | AE34: 5 | AF34: =+AG34+0.5*AH34 -> 28.58 | AG34: 28.08 | AH34: 1 | AI34: =+AJ34+AK34+0.5*AL34 -> 22.62 | AJ34: 12.18 | AK34: 9.94 | AL34: 1
A35: 21 | B35: 3 | C35: 31 | D35: Mousley, | E35: Roger | F35: SSR-EX | G35: =+I35+L35+O35+R35+V35+Y35+AC35+AF35+AI35 -> 253.35 | H35: =+K35+N35+Q35+U35+X35+AB35+AE35+AH35+AL35 -> 26 | I35: =+J35+0.5*K35 -> 29.61 | J35: 29.11 | K35: 1 | L35: =+M35+0.5*N35 -> 19.24 | M35: 15.74 | N35: 7 | O35: =+P35+0.5*Q35 -> 42.55 | P35: 40.55 | Q35: 4 | R35: =+S35+T35+0.5*U35 -> 25.80 | S35: 13.51 | T35: 11.79 | U35: 1 | V35: =+W35+0.5*X35 -> 8.35 | W35: 7.85 | X35: 1 | Y35: =+Z35+AA35+0.5*AB35 -> 45.44 | Z35: 5.12 | AA35: 35.82 | AB35: 9 | AC35: =+AD35+0.5*AE35 -> 32.65 | AD35: 32.15 | AE35: 1 | AF35: =+AG35+0.5*AH35 -> 22.29 | AG35: 22.29 | AH35: 0 | AI35: =+AJ35+AK35+0.5*AL35 -> 27.42 | AJ35: 11.97 | AK35: 14.45 | AL35: 2
A36: 39 | B36: 6 | C36: 32 | D36: Smith, | E36: Burton | F36: CDP-SS | G36: =+I36+L36+O36+R36+V36+Y36+AC36+AF36+AI36 -> 257.46 | H36: =+K36+N36+Q36+U36+X36+AB36+AE36+AH36+AL36 -> 49 | I36: =+J36+0.5*K36 -> 32.50 | J36: 31.00 | K36: 3 | L36: =+M36+0.5*N36 -> 25.62 | M36: 22.12 | N36: 7 | O36: =+P36+0.5*Q36 -> 44.03 | P36: 36.03 | Q36: 16 | R36: =+S36+T36+0.5*U36 -> 30.16 | S36: 16.08 | T36: 13.08 | U36: 2 | V36: =+W36+0.5*X36 -> 7.40 | W36: 6.40 | X36: 2 | Y36: =+Z36+AA36+0.5*AB36 -> 39.84 | Z36: 4.99 | AA36: 32.85 | AB36: 4 | AC36: =+AD36+0.5*AE36 -> 24.56 | AD36: 24.06 | AE36: 1 | AF36: =+AG36+0.5*AH36 -> 32.52 | AG36: 28.52 | AH36: 8 | AI36: =+AJ36+AK36+0.5*AL36 -> 20.83 | AJ36: 9.97 | AK36: 7.86 | AL36: 6
A37: 42 | B37: 6 | C37: 33 | D37: Mahoney, | E37: Joni | F37: SSP-SS | G37: =+I37+L37+O37+R37+V37+Y37+AC37+AF37+AI37 -> 263.29 | H37: =+K37+N37+Q37+U37+X37+AB37+AE37+AH37+AL37 -> 62 | I37: =+J37+0.5*K37 -> 30.50 | J37: 29.50 | K37: 2 | L37: =+M37+0.5*N37 -> 19.13 | M37: 16.63 | N37: 5 | O37: =+P37+0.5*Q37 -> 45.69 | P37: 40.19 | Q37: 11 | R37: =+S37+T37+0.5*U37 -> 27.80 | S37: 13.63 | T37: 13.67 | U37: 1 | V37: =+W37+0.5*X37 -> 10.60 | W37: 9.10 | X37: 3 | Y37: =+Z37+AA37+0.5*AB37 -> 46.21 | Z37: 5.31 | AA37: 27.90 | AB37: 26 | AC37: =+AD37+0.5*AE37 -> 31.83 | AD37: 27.33 | AE37: 9 | AF37: =+AG37+0.5*AH37 -> 29.26 | AG37: 26.76 | AH37: 5 | AI37: =+AJ37+AK37+0.5*AL37 -> 22.27 | AJ37: 12.03 | AK37: 10.24 | AL37: 0
A38: 27 | B38: 4 | C38: 34 | D38: Porter, | E38: Alma | F38: CDP-SS | G38: =+I38+L38+O38+R38+V38+Y38+AC38+AF38+AI38 -> 265.09 | H38: =+K38+N38+Q38+U38+X38+AB38+AE38+AH38+AL38 -> 54 | I38: =+J38+0.5*K38 -> 34.21 | J38: 33.71 | K38: 1 | L38: =+M38+0.5*N38 -> 17.71 | M38: 17.71 | N38: 0 | O38: =+P38+0.5*Q38 -> 48.37 | P38: 39.37 | Q38: 18 | R38: =+S38+T38+0.5*U38 -> 31.82 | S38: 16.35 | T38: 13.97 | U38: 3 | V38: =+W38+0.5*X38 -> 12.62 | W38: 9.12 | X38: 7 | Y38: =+Z38+AA38+0.5*AB38 -> 40.10 | Z38: 4.63 | AA38: 27.97 | AB38: 15 | AC38: =+AD38+0.5*AE38 -> 28.33 | AD38: 24.33 | AE38: 8 | AF38: =+AG38+0.5*AH38 -> 30.14 | AG38: 29.64 | AH38: 1 | AI38: =+AJ38+AK38+0.5*AL38 -> 21.79 | AJ38: 11.56 | AK38: 9.73 | AL38: 1
A39: 48 | B39: 7 | C39: 35 | D39: Carter, | E39: Theo | F39: SSR-SS | G39: =+I39+L39+O39+R39+V39+Y39+AC39+AF39+AI39 -> 266.02 | H39: =+K39+N39+Q39+U39+X39+AB39+AE39+AH39+AL39 -> 49 | I39: =+J39+0.5*K39 -> 28.38 | J39: 27.88 | K39: 1 | L39: =+M39+0.5*N39 -> 17.68 | M39: 15.18 | N39: 5 | O39: =+P39+0.5*Q39 -> 42.41 | P39: 32.91 | Q39: 19 | R39: =+S39+T39+0.5*U39 -> 27.23 | S39: 13.00 | T39: 11.73 | U39: 5 | V39: =+W39+0.5*X39 -> 7.38 | W39: 6.88 | X39: 1 | Y39: =+Z39+AA39+0.5*AB39 -> 45.92 | Z39: 5.41 | AA39: 38.01 | AB39: 5 | AC39: =+AD39+0.5*AE39 -> 38.97 | AD39: 37.97 | AE39: 2 | AF39: =+AG39+0.5*AH39 -> 28.88 | AG39: 26.38 | AH39: 5 | AI39: =+AJ39+AK39+0.5*AL39 -> 29.17 | AJ39: 13.07 | AK39: 13.10 | AL39: 6
A40: 18 | B40: 3 | C40: 36 | D40: Berry, | E40: Robert | F40: CDP-SS | G40: =+I40+L40+O40+R40+V40+Y40+AC40+AF40+AI40 -> 266.49 | H40: =+K40+N40+Q40+U40+X40+AB40+AE40+AH40+AL40 -> 28 | I40: =+J40+0.5*K40 -> 42.10 | J40: 42.10 | K40: 0 | L40: =+M40+0.5*N40 -> 26.16 | M40: 23.16 | N40: 6 | O40: =+P40+0.5*Q40 -> 39.37 | P40: 35.87 | Q40: 7 | R40: =+S40+T40+0.5*U40 -> 29.21 | S40: 12.58 | T40: 15.13 | U40: 3 | V40: =+W40+0.5*X40 -> 10.76 | W40: 10.76 | X40: 0 | Y40: =+Z40+AA40+0.5*AB40 -> 41.19 | Z40: 6.19 | AA40: 34.50 | AB40: 1 | AC40: =+AD40+0.5*AE40 -> 25.01 | AD40: 24.51 | AE40: 1 | AF40: =+AG40+0.5*AH40 -> 29.31 | AG40: 25.31 | AH40: 8 | AI40: =+AJ40+AK40+0.5*AL40 -> 23.38 | AJ40: 13.01 | AK40: 9.37 | AL40: 2
A41: 24 | B41: 4 | C41: 37 | D41: Katz, | E41: Eric | F41: ESP-MM | G41: =+I41+L41+O41+R41+V41+Y41+AC41+AF41+AI41 -> 266.79 | H41: =+K41+N41+Q41+U41+X41+AB41+AE41+AH41+AL41 -> 72 | I41: =+J41+0.5*K41 -> 41.98 | J41: 40.48 | K41: 3 | L41: =+M41+0.5*N41 -> 21.92 | M41: 20.42 | N41: 3 | O41: =+P41+0.5*Q41 -> 46.96 | P41: 33.96 | Q41: 26 | R41: =+S41+T41+0.5*U41 -> 28.15 | S41: 14.78 | T41: 12.87 | U41: 1 | V41: =+W41+0.5*X41 -> 9.99 | W41: 9.49 | X41: 1 | Y41: =+Z41+AA41+0.5*AB41 -> 35.81 | Z41: 5.46 | AA41: 22.35 | AB41: 16 | AC41: =+AD41+0.5*AE41 -> 33.42 | AD41: 26.92 | AE41: 13 | AF41: =+AG41+0.5*AH41 -> 26.14 | AG41: 23.14 | AH41: 6 | AI41: =+AJ41+AK41+0.5*AL41 -> 22.42 | AJ41: 11.11 | AK41: 9.81 | AL41: 3
A42: 11 | B42: 2 | C42: 38 | D42: Spicer, | E42: Richard | F42: SSP-SS | G42: =+I42+L42+O42+R42+V42+Y42+AC42+AF42+AI42 -> 270.08 | H42: =+K42+N42+Q42+U42+X42+AB42+AE42+AH42+AL42 -> 30 | I42: =+J42+0.5*K42 -> 39.42 | J42: 38.92 | K42: 1 | L42: =+M42+0.5*N42 -> 21.68 | M42: 20.68 | N42: 2 | O42: =+P42+0.5*Q42 -> 32.12 | P42: 30.62 | Q42: 3 | R42: =+S42+T42+0.5*U42 -> 29.15 | S42: 15.78 | T42: 12.37 | U42: 2 | V42: =+W42+0.5*X42 -> 8.46 | W42: 8.46 | X42: 0 | Y42: =+Z42+AA42+0.5*AB42 -> 35.12 | Z42: 6.26 | AA42: 25.36 | AB42: 7 | AC42: =+AD42+0.5*AE42 -> 37.32 | AD42: 30.82 | AE42: 13 | AF42: =+AG42+0.5*AH42 -> 42.98 | AG42: 41.98 | AH42: 2 | AI42: =+AJ42+AK42+0.5*AL42 -> 23.83 | AJ42: 13.66 | AK42: 10.17 | AL42: 0
A43: 55 | B43: 8 | C43: 39 | D43: Rodriguez, | E43: Mike | F43: CDP-SS | G43: =+I43+L43+O43+R43+V43+Y43+AC43+AF43+AI43 -> 270.47 | H43: =+K43+N43+Q43+U43+X43+AB43+AE43+AH43+AL43 -> 52 | I43: =+J43+0.5*K43 -> 30.53 | J43: 30.03 | K43: 1 | L43: =+M43+0.5*N43 -> 22.59 | M43: 16.59 | N43: 12 | O43: =+P43+0.5*Q43 -> 40.21 | P43: 38.21 | Q43: 4 | R43: =+S43+T43+0.5*U43 -> 29.19 | S43: 14.07 | T43: 15.12 | U43: 0 | V43: =+W43+0.5*X43 -> 10.53 | W43: 7.03 | X43: 7 | Y43: =+Z43+AA43+0.5*AB43 -> 37.14 | Z43: 6.71 | AA43: 26.43 | AB43: 8 | AC43: =+AD43+0.5*AE43 -> 37.86 | AD43: 33.86 | AE43: 8 | AF43: =+AG43+0.5*AH43 -> 42.46 | AG43: 37.46 | AH43: 10 | AI43: =+AJ43+AK43+0.5*AL43 -> 19.96 | AJ43: 10.99 | AK43: 7.97 | AL43: 2
A44: 10 | B44: 2 | C44: 40 | D44: Spicer, | E44: Robert L. | F44: SSP-SS | G44: =+I44+L44+O44+R44+V44+Y44+AC44+AF44+AI44 -> 272.68 | H44: =+K44+N44+Q44+U44+X44+AB44+AE44+AH44+AL44 -> 56 | I44: =+J44+0.5*K44 -> 25.85 | J44: 25.85 | K44: 0 | L44: =+M44+0.5*N44 -> 21.50 | M44: 19.00 | N44: 5 | O44: =+P44+0.5*Q44 -> 36.33 | P44: 34.33 | Q44: 4 | R44: =+S44+T44+0.5*U44 -> 56.89 | S44: 31.56 | T44: 13.33 | U44: 24 | V44: =+W44+0.5*X44 -> 14.34 | W44: 9.84 | X44: 9 | Y44: =+Z44+AA44+0.5*AB44 -> 36.88 | Z44: 6.24 | AA44: 29.14 | AB44: 3 | AC44: =+AD44+0.5*AE44 -> 27.27 | AD44: 26.27 | AE44: 2 | AF44: =+AG44+0.5*AH44 -> 29.35 | AG44: 29.35 | AH44: 0 | AI44: =+AJ44+AK44+0.5*AL44 -> 24.27 | AJ44: 10.82 | AK44: 8.95 | AL44: 9
A45: 46 | B45: 7 | C45: 41 | D45: Roach, | E45: Chris | F45: CDP-MM | G45: =+I45+L45+O45+R45+V45+Y45+AC45+AF45+AI45 -> 272.78 | H45: =+K45+N45+Q45+U45+X45+AB45+AE45+AH45+AL45 -> 100 | I45: =+J45+0.5*K45 -> 32.86 | J45: 31.36 | K45: 3 | L45: =+M45+0.5*N45 -> 24.49 | M45: 18.49 | N45: 12 | O45: =+P45+0.5*Q45 -> 49.00 | P45: 41.50 | Q45: 15 | R45: =+S45+T45+0.5*U45 -> 26.61 | S45: 13.94 | T45: 10.17 | U45: 5 | V45: =+W45+0.5*X45 -> 9.53 | W45: 7.53 | X45: 4 | Y45: =+Z45+AA45+0.5*AB45 -> 43.60 | Z45: 5.67 | AA45: 26.43 | AB45: 23 | AC45: =+AD45+0.5*AE45 -> 40.00 | AD45: 25.50 | AE45: 29 | AF45: =+AG45+0.5*AH45 -> 31.78 | AG45: 27.28 | AH45: 9 | AI45: =+AJ45+AK45+0.5*AL45 -> 14.91 | AJ45: 8.54 | AK45: 6.37 | AL45: 0
A46: 13 | B46: 2 | C46: 42 | D46: Thomas, | E46: Kevin | F46: SSP-SS | G46: =+I46+L46+O46+R46+V46+Y46+AC46+AF46+AI46 -> 273.21 | H46: =+K46+N46+Q46+U46+X46+AB46+AE46+AH46+AL46 -> 64 | I46: =+J46+0.5*K46 -> 50.26 | J46: 44.26 | K46: 12 | L46: =+M46+0.5*N46 -> 14.45 | M46: 13.95 | N46: 1 | O46: =+P46+0.5*Q46 -> 59.30 | P46: 46.80 | Q46: 25 | R46: =+S46+T46+0.5*U46 -> 28.60 | S46: 16.31 | T46: 9.29 | U46: 6 | V46: =+W46+0.5*X46 -> 9.16 | W46: 8.16 | X46: 2 | Y46: =+Z46+AA46+0.5*AB46 -> 30.03 | Z46: 5.41 | AA46: 24.12 | AB46: 1 | AC46: =+AD46+0.5*AE46 -> 35.54 | AD46: 29.54 | AE46: 12 | AF46: =+AG46+0.5*AH46 -> 26.20 | AG46: 25.70 | AH46: 1 | AI46: =+AJ46+AK46+0.5*AL46 -> 19.67 | AJ46: 9.81 | AK46: 7.86 | AL46: 4
A47: 37 | B47: 0 | C47: 43 | D47: Rimer, | E47: Clayton | F47: CDP-MM | G47: =+I47+L47+O47+R47+V47+Y47+AC47+AF47+AI47 -> 274.76 | H47: =+K47+N47+Q47+U47+X47+AB47+AE47+AH47+AL47 -> 35 | I47: =+J47+0.5*K47 -> 24.71 | J47: 24.21 | K47: 1 | L47: =+M47+0.5*N47 -> 24.18 | M47: 23.68 | N47: 1 | O47: =+P47+0.5*Q47 -> 46.28 | P47: 39.28 | Q47: 14 | R47: =+S47+T47+0.5*U47 -> 31.70 | S47: 18.22 | T47: 12.48 | U47: 2 | V47: =+W47+0.5*X47 -> 14.02 | W47: 13.02 | X47: 2 | Y47: =+Z47+AA47+0.5*AB47 -> 43.56 | Z47: 7.72 | AA47: 34.34 | AB47: 3 | AC47: =+AD47+0.5*AE47 -> 34.89 | AD47: 30.89 | AE47: 8 | AF47: =+AG47+0.5*AH47 -> 35.85 | AG47: 35.85 | AH47: 0 | AI47: =+AJ47+AK47+0.5*AL47 -> 19.57 | AJ47: 8.87 | AK47: 8.70 | AL47: 4
A48: 26 | B48: 4 | C48: 44 | D48: Veldboon, | E48: Terry | F48: SSR-EX | G48: =+I48+L48+O48+R48+V48+Y48+AC48+AF48+AI48 -> 275.41 | H48: =+K48+N48+Q48+U48+X48+AB48+AE48+AH48+AL48 -> 33 | I48: =+J48+0.5*K48 -> 29.02 | J48: 28.02 | K48: 2 | L48: =+M48+0.5*N48 -> 28.13 | M48: 28.13 | N48: 0 | O48: =+P48+0.5*Q48 -> 38.13 | P48: 33.13 | Q48: 10 | R48: =+S48+T48+0.5*U48 -> 29.56 | S48: 16.13 | T48: 12.43 | U48: 2 | V48: =+W48+0.5*X48 -> 8.00 | W48: 7.50 | X48: 1 | Y48: =+Z48+AA48+0.5*AB48 -> 42.10 | Z48: 5.42 | AA48: 34.68 | AB48: 4 | AC48: =+AD48+0.5*AE48 -> 42.98 | AD48: 37.48 | AE48: 11 | AF48: =+AG48+0.5*AH48 -> 24.72 | AG48: 24.72 | AH48: 0 | AI48: =+AJ48+AK48+0.5*AL48 -> 32.77 | AJ48: 15.72 | AK48: 15.55 | AL48: 3
A49: 49 | B49: 7 | C49: 45 | D49: Jorgensen, | E49: John Q | F49: SSP-SS | G49: =+I49+L49+O49+R49+V49+Y49+AC49+AF49+AI49 -> 276.42 | H49: =+K49+N49+Q49+U49+X49+AB49+AE49+AH49+AL49 -> 111 | I49: =+J49+0.5*K49 -> 27.98 | J49: 25.48 | K49: 5 | L49: =+M49+0.5*N49 -> 21.61 | M49: 20.11 | N49: 3 | O49: =+P49+0.5*Q49 -> 42.83 | P49: 34.83 | Q49: 16 | R49: =+S49+T49+0.5*U49 -> 35.56 | S49: 14.82 | T49: 13.24 | U49: 15 | V49: =+W49+0.5*X49 -> 10.29 | W49: 8.79 | X49: 3 | Y49: =+Z49+AA49+0.5*AB49 -> 38.98 | Z49: 5.01 | AA49: 25.47 | AB49: 17 | AC49: =+AD49+0.5*AE49 -> 42.85 | AD49: 26.85 | AE49: 32 | AF49: =+AG49+0.5*AH49 -> 32.11 | AG49: 26.61 | AH49: 11 | AI49: =+AJ49+AK49+0.5*AL49 -> 24.21 | AJ49: 11.74 | AK49: 7.97 | AL49: 9
A50: 64 | B50: 9 | C50: 46 | D50: Hood, | E50: Neil | F50: CDP-MM | G50: =+I50+L50+O50+R50+V50+Y50+AC50+AF50+AI50 -> 279.87 | H50: =+K50+N50+Q50+U50+X50+AB50+AE50+AH50+AL50 -> 65 | I50: =+J50+0.5*K50 -> 29.11 | J50: 27.61 | K50: 3 | L50: =+M50+0.5*N50 -> 21.94 | M50: 17.44 | N50: 9 | O50: =+P50+0.5*Q50 -> 39.27 | P50: 37.27 | Q50: 4 | R50: =+S50+T50+0.5*U50 -> 29.51 | S50: 16.35 | T50: 13.16 | U50: 0 | V50: =+W50+0.5*X50 -> 12.38 | W50: 11.88 | X50: 1 | Y50: =+Z50+AA50+0.5*AB50 -> 39.50 | Z50: 4.63 | AA50: 29.87 | AB50: 10 | AC50: =+AD50+0.5*AE50 -> 45.83 | AD50: 30.33 | AE50: 31 | AF50: =+AG50+0.5*AH50 -> 35.66 | AG50: 32.66 | AH50: 6 | AI50: =+AJ50+AK50+0.5*AL50 -> 26.67 | AJ50: 12.80 | AK50: 13.37 | AL50: 1
A51: 2 | B51: 0 | C51: 47 | D51: Andersen, | E51: Welden | F51: SSP-SS | G51: =+I51+L51+O51+R51+V51+Y51+AC51+AF51+AI51 -> 280.23 | H51: =+K51+N51+Q51+U51+X51+AB51+AE51+AH51+AL51 -> 33 | I51: =+J51+0.5*K51 -> 33.50 | J51: 33.50 | K51: 0 | L51: =+M51+0.5*N51 -> 28.88 | M51: 28.38 | N51: 1 | O51: =+P51+0.5*Q51 -> 50.23 | P51: 42.23 | Q51: 16 | R51: =+S51+T51+0.5*U51 -> 28.64 | S51: 16.41 | T51: 12.23 | U51: 0 | V51: =+W51+0.5*X51 -> 11.39 | W51: 11.39 | X51: 0 | Y51: =+Z51+AA51+0.5*AB51 -> 41.24 | Z51: 4.76 | AA51: 32.48 | AB51: 8 | AC51: =+AD51+0.5*AE51 -> 40.22 | AD51: 37.22 | AE51: 6 | AF51: =+AG51+0.5*AH51 -> 22.79 | AG51: 21.79 | AH51: 2 | AI51: =+AJ51+AK51+0.5*AL51 -> 23.34 | AJ51: 14.29 | AK51: 9.05 | AL51: 0
A52: 32 | B52: 5 | C52: 48 | D52: Nelson, | E52: John | F52: SSP-SS | G52: =+I52+L52+O52+R52+V52+Y52+AC52+AF52+AI52 -> 280.75 | H52: =+K52+N52+Q52+U52+X52+AB52+AE52+AH52+AL52 -> 95 | I52: =+J52+0.5*K52 -> 38.74 | J52: 38.74 | K52: 0 | L52: =+M52+0.5*N52 -> 18.72 | M52: 17.22 | N52: 3 | O52: =+P52+0.5*Q52 -> 34.75 | P52: 29.75 | Q52: 10 | R52: =+S52+T52+0.5*U52 -> 36.27 | S52: 17.10 | T52: 15.17 | U52: 8 | V52: =+W52+0.5*X52 -> 36.98 | W52: 11.48 | X52: 51 | Y52: =+Z52+AA52+0.5*AB52 -> 36.66 | Z52: 6.52 | AA52: 23.14 | AB52: 14 | AC52: =+AD52+0.5*AE52 -> 29.12 | AD52: 28.12 | AE52: 2 | AF52: =+AG52+0.5*AH52 -> 29.78 | AG52: 26.78 | AH52: 6 | AI52: =+AJ52+AK52+0.5*AL52 -> 19.73 | AJ52: 10.76 | AK52: 8.47 | AL52: 1
A53: 1 | B53: 0 | C53: 49 | D53: Bautista, | E53: Roy | F53: SSP-SS | G53: =+I53+L53+O53+R53+V53+Y53+AC53+AF53+AI53 -> 282.48 | H53: =+K53+N53+Q53+U53+X53+AB53+AE53+AH53+AL53 -> 63 | I53: =+J53+0.5*K53 -> 32.53 | J53: 32.53 | K53: 0 | L53: =+M53+0.5*N53 -> 19.53 | M53: 19.53 | N53: 0 | O53: =+P53+0.5*Q53 -> 62.09 | P53: 58.59 | Q53: 7 | R53: =+S53+T53+0.5*U53 -> 27.82 | S53: 11.81 | T53: 12.51 | U53: 7 | V53: =+W53+0.5*X53 -> 12.68 | W53: 6.68 | X53: 12 | Y53: =+Z53+AA53+0.5*AB53 -> 34.36 | Z53: 4.69 | AA53: 27.17 | AB53: 5 | AC53: =+AD53+0.5*AE53 -> 26.60 | AD53: 21.60 | AE53: 10 | AF53: =+AG53+0.5*AH53 -> 31.67 | AG53: 24.17 | AH53: 15 | AI53: =+AJ53+AK53+0.5*AL53 -> 35.20 | AJ53: 15.53 | AK53: 16.17 | AL53: 7
A54: 19 | B54: 3 | C54: 50 | D54: Colby, | E54: William | F54: CDP-SS | G54: =+I54+L54+O54+R54+V54+Y54+AC54+AF54+AI54 -> 290.56 | H54: =+K54+N54+Q54+U54+X54+AB54+AE54+AH54+AL54 -> 55 | I54: =+J54+0.5*K54 -> 34.96 | J54: 34.46 | K54: 1 | L54: =+M54+0.5*N54 -> 31.07 | M54: 27.07 | N54: 8 | O54: =+P54+0.5*Q54 -> 45.30 | P54: 41.80 | Q54: 7 | R54: =+S54+T54+0.5*U54 -> 28.16 | S54: 14.00 | T54: 12.16 | U54: 4 | V54: =+W54+0.5*X54 -> 10.10 | W54: 10.10 | X54: 0 | Y54: =+Z54+AA54+0.5*AB54 -> 47.50 | Z54: 6.16 | AA54: 34.84 | AB54: 13 | AC54: =+AD54+0.5*AE54 -> 32.49 | AD54: 31.99 | AE54: 1 | AF54: =+AG54+0.5*AH54 -> 39.16 | AG54: 29.66 | AH54: 19 | AI54: =+AJ54+AK54+0.5*AL54 -> 21.82 | AJ54: 11.37 | AK54: 9.45 | AL54: 2
A55: 28 | B55: 4 | C55: 51 | D55: Badger, | E55: Jeff | F55: CDP-MM | G55: =+I55+L55+O55+R55+V55+Y55+AC55+AF55+AI55 -> 291.39 | H55: =+K55+N55+Q55+U55+X55+AB55+AE55+AH55+AL55 -> 64 | I55: =+J55+0.5*K55 -> 30.98 | J55: 29.98 | K55: 2 | L55: =+M55+0.5*N55 -> 25.43 | M55: 25.43 | N55: 0 | O55: =+P55+0.5*Q55 -> 49.90 | P55: 28.40 | Q55: 43 | R55: =+S55+T55+0.5*U55 -> 36.81 | S55: 20.07 | T55: 15.24 | U55: 3 | V55: =+W55+0.5*X55 -> 10.56 | W55: 8.56 | X55: 4 | Y55: =+Z55+AA55+0.5*AB55 -> 50.84 | Z55: 7.58 | AA55: 39.76 | AB55: 7 | AC55: =+AD55+0.5*AE55 -> 26.00 | AD55: 25.50 | AE55: 1 | AF55: =+AG55+0.5*AH55 -> 33.09 | AG55: 32.59 | AH55: 1 | AI55: =+AJ55+AK55+0.5*AL55 -> 27.78 | AJ55: 14.78 | AK55: 11.50 | AL55: 3
A56: 23 | B56: 0 | C56: 52 | D56: Attryde, | E56: Ed | F56: CDP-MM | G56: =+I56+L56+O56+R56+V56+Y56+AC56+AF56+AI56 -> 293.01 | H56: =+K56+N56+Q56+U56+X56+AB56+AE56+AH56+AL56 -> 13 | I56: =+J56+0.5*K56 -> 34.54 | J56: 33.54 | K56: 2 | L56: =+M56+0.5*N56 -> 23.87 | M56: 23.87 | N56: 0 | O56: =+P56+0.5*Q56 -> 36.96 | P56: 36.46 | Q56: 1 | R56: =+S56+T56+0.5*U56 -> 34.48 | S56: 17.75 | T56: 16.73 | U56: 0 | V56: =+W56+0.5*X56 -> 6.71 | W56: 5.71 | X56: 2 | Y56: =+Z56+AA56+0.5*AB56 -> 53.43 | Z56: 10.26 | AA56: 40.67 | AB56: 5 | AC56: =+AD56+0.5*AE56 -> 32.23 | AD56: 31.73 | AE56: 1 | AF56: =+AG56+0.5*AH56 -> 37.15 | AG56: 36.15 | AH56: 2 | AI56: =+AJ56+AK56+0.5*AL56 -> 33.64 | AJ56: 19.09 | AK56: 14.55 | AL56: 0
A57: 20 | B57: 3 | C57: 53 | D57: Carlson, | E57: Paul | F57: SSP-MM | G57: =+I57+L57+O57+R57+V57+Y57+AC57+AF57+AI57 -> 293.78 | H57: =+K57+N57+Q57+U57+X57+AB57+AE57+AH57+AL57 -> 73 | I57: =+J57+0.5*K57 -> 51.30 | J57: 48.30 | K57: 6 | L57: =+M57+0.5*N57 -> 17.69 | M57: 13.69 | N57: 8 | O57: =+P57+0.5*Q57 -> 56.80 | P57: 53.80 | Q57: 6 | R57: =+S57+T57+0.5*U57 -> 31.94 | S57: 16.18 | T57: 12.26 | U57: 7 | V57: =+W57+0.5*X57 -> 9.17 | W57: 8.17 | X57: 2 | Y57: =+Z57+AA57+0.5*AB57 -> 44.67 | Z57: 4.08 | AA57: 28.59 | AB57: 24 | AC57: =+AD57+0.5*AE57 -> 30.12 | AD57: 26.62 | AE57: 7 | AF57: =+AG57+0.5*AH57 -> 31.28 | AG57: 25.28 | AH57: 12 | AI57: =+AJ57+AK57+0.5*AL57 -> 20.81 | AJ57: 11.12 | AK57: 9.19 | AL57: 1
A58: 52 | B58: 0 | C58: 54 | D58: Rupert, | E58: Frank | F58: CDP-SS | G58: =+I58+L58+O58+R58+V58+Y58+AC58+AF58+AI58 -> 296.72 | H58: =+K58+N58+Q58+U58+X58+AB58+AE58+AH58+AL58 -> 43 | I58: =+J58+0.5*K58 -> 31.57 | J58: 31.07 | K58: 1 | L58: =+M58+0.5*N58 -> 32.33 | M58: 30.33 | N58: 4 | O58: =+P58+0.5*Q58 -> 63.92 | P58: 57.92 | Q58: 12 | R58: =+S58+T58+0.5*U58 -> 28.73 | S58: 14.68 | T58: 10.55 | U58: 7 | V58: =+W58+0.5*X58 -> 10.78 | W58: 9.78 | X58: 2 | Y58: =+Z58+AA58+0.5*AB58 -> 50.02 | Z58: 7.38 | AA58: 36.14 | AB58: 13 | AC58: =+AD58+0.5*AE58 -> 30.25 | AD58: 29.25 | AE58: 2 | AF58: =+AG58+0.5*AH58 -> 26.65 | AG58: 26.65 | AH58: 0 | AI58: =+AJ58+AK58+0.5*AL58 -> 22.47 | AJ58: 11.74 | AK58: 9.73 | AL58: 2
A59: 68 | B59: 8 | C59: 55 | D59: Boyer, | E59: Stephen | F59: SSP-MM | G59: =+I59+L59+O59+R59+V59+Y59+AC59+AF59+AI59 -> 297.82 | H59: =+K59+N59+Q59+U59+X59+AB59+AE59+AH59+AL59 -> 18 | I59: =+J59+0.5*K59 -> 34.38 | J59: 33.88 | K59: 1 | L59: =+M59+0.5*N59 -> 24.85 | M59: 24.35 | N59: 1 | O59: =+P59+0.5*Q59 -> 51.71 | P59: 47.21 | Q59: 9 | R59: =+S59+T59+0.5*U59 -> 33.67 | S59: 19.17 | T59: 14.50 | U59: 0 | V59: =+W59+0.5*X59 -> 9.97 | W59: 9.97 | X59: 0 | Y59: =+Z59+AA59+0.5*AB59 -> 40.44 | Z59: 6.18 | AA59: 32.76 | AB59: 3 | AC59: =+AD59+0.5*AE59 -> 42.57 | AD59: 41.07 | AE59: 3 | AF59: =+AG59+0.5*AH59 -> 37.41 | AG59: 36.91 | AH59: 1 | AI59: =+AJ59+AK59+0.5*AL59 -> 22.82 | AJ59: 12.41 | AK59: 10.41 | AL59: 0
A60: 34 | B60: 5 | C60: 56 | D60: Mingo, | E60: John | F60: SSR-SS | G60: =+I60+L60+O60+R60+V60+Y60+AC60+AF60+AI60 -> 298.90 | H60: =+K60+N60+Q60+U60+X60+AB60+AE60+AH60+AL60 -> 47 | I60: =+J60+0.5*K60 -> 44.22 | J60: 42.72 | K60: 3 | L60: =+M60+0.5*N60 -> 20.50 | M60: 18.50 | N60: 4 | O60: =+P60+0.5*Q60 -> 40.94 | P60: 30.94 | Q60: 20 | R60: =+S60+T60+0.5*U60 -> 28.42 | S60: 13.02 | T60: 12.40 | U60: 6 | V60: =+W60+0.5*X60 -> 11.40 | W60: 10.90 | X60: 1 | Y60: =+Z60+AA60+0.5*AB60 -> 48.52 | Z60: 6.53 | AA60: 41.49 | AB60: 1 | AC60: =+AD60+0.5*AE60 -> 46.80 | AD60: 43.30 | AE60: 7 | AF60: =+AG60+0.5*AH60 -> 28.55 | AG60: 26.05 | AH60: 5 | AI60: =+AJ60+AK60+0.5*AL60 -> 29.55 | AJ60: 15.63 | AK60: 13.92 | AL60: 0
A61: 4 | B61: 2 | C61: 57 | D61: Tekmitchov, | E61: George | F61: CDP-EX | G61: =+I61+L61+O61+R61+V61+Y61+AC61+AF61+AI61 -> 300.04 | H61: =+K61+N61+Q61+U61+X61+AB61+AE61+AH61+AL61 -> 52 | I61: =+J61+0.5*K61 -> 51.47 | J61: 47.97 | K61: 7 | L61: =+M61+0.5*N61 -> 21.88 | M61: 21.88 | N61: 0 | O61: =+P61+0.5*Q61 -> 48.19 | P61: 42.69 | Q61: 11 | R61: =+S61+T61+0.5*U61 -> 35.20 | S61: 16.80 | T61: 13.90 | U61: 9 | V61: =+W61+0.5*X61 -> 9.15 | W61: 8.65 | X61: 1 | Y61: =+Z61+AA61+0.5*AB61 -> 36.15 | Z61: 4.98 | AA61: 27.67 | AB61: 7 | AC61: =+AD61+0.5*AE61 -> 44.12 | AD61: 37.12 | AE61: 14 | AF61: =+AG61+0.5*AH61 -> 33.59 | AG61: 32.59 | AH61: 2 | AI61: =+AJ61+AK61+0.5*AL61 -> 20.29 | AJ61: 10.97 | AK61: 8.82 | AL61: 1
A62: 35 | B62: 5 | C62: 58 | D62: Bowling, | E62: William | F62: CDP-MM | G62: =+I62+L62+O62+R62+V62+Y62+AC62+AF62+AI62 -> 305.10 | H62: =+K62+N62+Q62+U62+X62+AB62+AE62+AH62+AL62 -> 37 | I62: =+J62+0.5*K62 -> 43.42 | J62: 42.92 | K62: 1 | L62: =+M62+0.5*N62 -> 22.37 | M62: 21.37 | N62: 2 | O62: =+P62+0.5*Q62 -> 48.14 | P62: 38.14 | Q62: 20 | R62: =+S62+T62+0.5*U62 -> 38.71 | S62: 24.02 | T62: 14.19 | U62: 1 | V62: =+W62+0.5*X62 -> 11.95 | W62: 10.45 | X62: 3 | Y62: =+Z62+AA62+0.5*AB62 -> 45.81 | Z62: 9.16 | AA62: 33.15 | AB62: 7 | AC62: =+AD62+0.5*AE62 -> 36.66 | AD62: 35.66 | AE62: 2 | AF62: =+AG62+0.5*AH62 -> 32.60 | AG62: 32.10 | AH62: 1 | AI62: =+AJ62+AK62+0.5*AL62 -> 25.44 | AJ62: 14.57 | AK62: 10.87 | AL62: 0
A63: 16 | B63: 0 | C63: 59 | D63: Maloy, | E63: Cory A | F63: SSP-MM | G63: =+I63+L63+O63+R63+V63+Y63+AC63+AF63+AI63 -> 305.14 | H63: =+K63+N63+Q63+U63+X63+AB63+AE63+AH63+AL63 -> 58 | I63: =+J63+0.5*K63 -> 27.95 | J63: 27.45 | K63: 1 | L63: =+M63+0.5*N63 -> 23.50 | M63: 22.00 | N63: 3 | O63: =+P63+0.5*Q63 -> 53.26 | P63: 44.26 | Q63: 18 | R63: =+S63+T63+0.5*U63 -> 33.84 | S63: 17.27 | T63: 15.57 | U63: 2 | V63: =+W63+0.5*X63 -> 13.07 | W63: 12.57 | X63: 1 | Y63: =+Z63+AA63+0.5*AB63 -> 41.21 | Z63: 7.45 | AA63: 29.76 | AB63: 8 | AC63: =+AD63+0.5*AE63 -> 37.05 | AD63: 33.55 | AE63: 7 | AF63: =+AG63+0.5*AH63 -> 40.77 | AG63: 35.27 | AH63: 11 | AI63: =+AJ63+AK63+0.5*AL63 -> 34.49 | AJ63: 16.18 | AK63: 14.81 | AL63: 7
A64: 25 | B64: 4 | C64: 60 | D64: Halliday, | E64: Mark | F64: CDP-MM | G64: =+I64+L64+O64+R64+V64+Y64+AC64+AF64+AI64 -> 306.80 | H64: =+K64+N64+Q64+U64+X64+AB64+AE64+AH64+AL64 -> 38 | I64: =+J64+0.5*K64 -> 62.68 | J64: 62.68 | K64: 0 | L64: =+M64+0.5*N64 -> 23.11 | M64: 20.61 | N64: 5 | O64: =+P64+0.5*Q64 -> 47.06 | P64: 44.56 | Q64: 5 | R64: =+S64+T64+0.5*U64 -> 33.11 | S64: 19.15 | T64: 13.96 | U64: 0 | V64: =+W64+0.5*X64 -> 11.31 | W64: 9.31 | X64: 4 | Y64: =+Z64+AA64+0.5*AB64 -> 37.69 | Z64: 5.67 | AA64: 28.02 | AB64: 8 | AC64: =+AD64+0.5*AE64 -> 38.35 | AD64: 34.85 | AE64: 7 | AF64: =+AG64+0.5*AH64 -> 32.61 | AG64: 30.11 | AH64: 5 | AI64: =+AJ64+AK64+0.5*AL64 -> 20.88 | AJ64: 9.17 | AK64: 9.71 | AL64: 4
A65: 44 | B65: 0 | C65: 61 | D65: Balay, | E65: Danny | F65: CDP-MM | G65: =+I65+L65+O65+R65+V65+Y65+AC65+AF65+AI65 -> 307.39 | H65: =+K65+N65+Q65+U65+X65+AB65+AE65+AH65+AL65 -> 120 | I65: =+J65+0.5*K65 -> 34.40 | J65: 34.40 | K65: 0 | L65: =+M65+0.5*N65 -> 23.26 | M65: 17.26 | N65: 12 | O65: =+P65+0.5*Q65 -> 63.17 | P65: 48.67 | Q65: 29 | R65: =+S65+T65+0.5*U65 -> 41.16 | S65: 5.43 | T65: 13.73 | U65: 44 | V65: =+W65+0.5*X65 -> 14.25 | W65: 8.25 | X65: 12 | Y65: =+Z65+AA65+0.5*AB65 -> 40.32 | Z65: 7.53 | AA65: 28.29 | AB65: 9 | AC65: =+AD65+0.5*AE65 -> 33.00 | AD65: 27.00 | AE65: 12 | AF65: =+AG65+0.5*AH65 -> 34.60 | AG65: 34.10 | AH65: 1 | AI65: =+AJ65+AK65+0.5*AL65 -> 23.23 | AJ65: 12.27 | AK65: 10.46 | AL65: 1
A66: 47 | B66: 7 | C66: 62 | D66: Beckham, | E66: Scott | F66: SSR-SS | G66: =+I66+L66+O66+R66+V66+Y66+AC66+AF66+AI66 -> 317.43 | H66: =+K66+N66+Q66+U66+X66+AB66+AE66+AH66+AL66 -> 38 | I66: =+J66+0.5*K66 -> 34.03 | J66: 32.03 | K66: 4 | L66: =+M66+0.5*N66 -> 20.31 | M66: 19.81 | N66: 1 | O66: =+P66+0.5*Q66 -> 54.10 | P66: 53.10 | Q66: 2 | R66: =+S66+T66+0.5*U66 -> 35.14 | S66: 18.14 | T66: 13.50 | U66: 7 | V66: =+W66+0.5*X66 -> 10.72 | W66: 8.22 | X66: 5 | Y66: =+Z66+AA66+0.5*AB66 -> 53.60 | Z66: 5.80 | AA66: 42.30 | AB66: 11 | AC66: =+AD66+0.5*AE66 -> 39.61 | AD66: 38.11 | AE66: 3 | AF66: =+AG66+0.5*AH66 -> 35.39 | AG66: 33.89 | AH66: 3 | AI66: =+AJ66+AK66+0.5*AL66 -> 34.53 | AJ66: 19.36 | AK66: 14.17 | AL66: 2
A67: 17 | B67: 3 | C67: 63 | D67: Jespersen, | E67: Chad | F67: SSP-MM | G67: =+I67+L67+O67+R67+V67+Y67+AC67+AF67+AI67 -> 321.49 | H67: =+K67+N67+Q67+U67+X67+AB67+AE67+AH67+AL67 -> 83 | I67: =+J67+0.5*K67 -> 47.65 | J67: 46.65 | K67: 2 | L67: =+M67+0.5*N67 -> 27.12 | M67: 24.62 | N67: 5 | O67: =+P67+0.5*Q67 -> 46.85 | P67: 46.35 | Q67: 1 | R67: =+S67+T67+0.5*U67 -> 43.14 | S67: 16.48 | T67: 14.66 | U67: 24 | V67: =+W67+0.5*X67 -> 12.20 | W67: 12.20 | X67: 0 | Y67: =+Z67+AA67+0.5*AB67 -> 39.35 | Z67: 7.75 | AA67: 30.10 | AB67: 3 | AC67: =+AD67+0.5*AE67 -> 42.90 | AD67: 31.40 | AE67: 23 | AF67: =+AG67+0.5*AH67 -> 35.82 | AG67: 23.32 | AH67: 25 | AI67: =+AJ67+AK67+0.5*AL67 -> 26.46 | AJ67: 11.66 | AK67: 14.80 | AL67: 0
A68: 73 | B68: 0 | C68: 64 | D68: Cosper, | E68: Chris | F68: SSP-MM | G68: =+I68+L68+O68+R68+V68+Y68+AC68+AF68+AI68 -> 327.49 | H68: =+K68+N68+Q68+U68+X68+AB68+AE68+AH68+AL68 -> 71 | I68: =+J68+0.5*K68 -> 32.31 | J68: 31.81 | K68: 1 | L68: =+M68+0.5*N68 -> 22.86 | M68: 21.86 | N68: 2 | O68: =+P68+0.5*Q68 -> 44.38 | P68: 34.88 | Q68: 19 | R68: =+S68+T68+0.5*U68 -> 31.76 | S68: 14.25 | T68: 12.01 | U68: 11 | V68: =+W68+0.5*X68 -> 9.71 | W68: 9.21 | X68: 1 | Y68: =+Z68+AA68+0.5*AB68 -> 48.85 | Z68: 12.34 | AA68: 29.51 | AB68: 14 | AC68: =+AD68+0.5*AE68 -> 37.79 | AD68: 37.29 | AE68: 1 | AF68: =+AG68+0.5*AH68 -> 70.96 | AG68: 62.96 | AH68: 16 | AI68: =+AJ68+AK68+0.5*AL68 -> 28.87 | AJ68: 15.82 | AK68: 10.05 | AL68: 6
A69: 38 | B69: 6 | C69: 65 | D69: Wilkins, | E69: Lance | F69: SSP-SS | G69: =+I69+L69+O69+R69+V69+Y69+AC69+AF69+AI69 -> 328.20 | H69: =+K69+N69+Q69+U69+X69+AB69+AE69+AH69+AL69 -> 116 | I69: =+J69+0.5*K69 -> 43.22 | J69: 43.22 | K69: 0 | L69: =+M69+0.5*N69 -> 22.83 | M69: 19.33 | N69: 7 | O69: =+P69+0.5*Q69 -> 57.65 | P69: 35.15 | Q69: 45 | R69: =+S69+T69+0.5*U69 -> 31.18 | S69: 17.43 | T69: 13.25 | U69: 1 | V69: =+W69+0.5*X69 -> 24.47 | W69: 8.97 | X69: 31 | Y69: =+Z69+AA69+0.5*AB69 -> 41.79 | Z69: 5.60 | AA69: 28.19 | AB69: 16 | AC69: =+AD69+0.5*AE69 -> 36.58 | AD69: 33.58 | AE69: 6 | AF69: =+AG69+0.5*AH69 -> 48.69 | AG69: 44.19 | AH69: 9 | AI69: =+AJ69+AK69+0.5*AL69 -> 21.79 | AJ69: 13.13 | AK69: 8.16 | AL69: 1
A70: 80 | B70: 0 | C70: 66 | D70: Redford, | E70: Noel | F70: SSP-MM | G70: =+I70+L70+O70+R70+V70+Y70+AC70+AF70+AI70 -> 329.16 | H70: =+K70+N70+Q70+U70+X70+AB70+AE70+AH70+AL70 -> 61 | I70: =+J70+0.5*K70 -> 35.31 | J70: 34.31 | K70: 2 | L70: =+M70+0.5*N70 -> 29.78 | M70: 26.78 | N70: 6 | O70: =+P70+0.5*Q70 -> 54.84 | P70: 48.34 | Q70: 13 | R70: =+S70+T70+0.5*U70 -> 28.42 | S70: 14.92 | T70: 12.50 | U70: 2 | V70: =+W70+0.5*X70 -> 15.07 | W70: 8.07 | X70: 14 | Y70: =+Z70+AA70+0.5*AB70 -> 47.23 | Z70: 8.59 | AA70: 32.64 | AB70: 12 | AC70: =+AD70+0.5*AE70 -> 38.66 | AD70: 37.16 | AE70: 3 | AF70: =+AG70+0.5*AH70 -> 53.04 | AG70: 52.04 | AH70: 2 | AI70: =+AJ70+AK70+0.5*AL70 -> 26.81 | AJ70: 11.72 | AK70: 11.59 | AL70: 7
A71: 51 | B71: 0 | C71: 67 | D71: Huggins, | E71: Chip | F71: SSP-MM | G71: =+I71+L71+O71+R71+V71+Y71+AC71+AF71+AI71 -> 329.84 | H71: =+K71+N71+Q71+U71+X71+AB71+AE71+AH71+AL71 -> 96 | I71: =+J71+0.5*K71 -> 27.69 | J71: 22.69 | K71: 10 | L71: =+M71+0.5*N71 -> 29.12 | M71: 21.12 | N71: 16 | O71: =+P71+0.5*Q71 -> 55.26 | P71: 51.26 | Q71: 8 | R71: =+S71+T71+0.5*U71 -> 34.80 | S71: 14.57 | T71: 12.73 | U71: 15 | V71: =+W71+0.5*X71 -> 15.59 | W71: 9.59 | X71: 12 | Y71: =+Z71+AA71+0.5*AB71 -> 55.89 | Z71: 7.01 | AA71: 42.88 | AB71: 12 | AC71: =+AD71+0.5*AE71 -> 35.24 | AD71: 31.74 | AE71: 7 | AF71: =+AG71+0.5*AH71 -> 47.16 | AG71: 39.66 | AH71: 15 | AI71: =+AJ71+AK71+0.5*AL71 -> 29.09 | AJ71: 15.78 | AK71: 12.81 | AL71: 1
A72: 22 | B72: 0 | C72: 68 | D72: Roubinet, | E72: Paul | F72: SSP-MM | G72: =+I72+L72+O72+R72+V72+Y72+AC72+AF72+AI72 -> 332.57 | H72: =+K72+N72+Q72+U72+X72+AB72+AE72+AH72+AL72 -> 27 | I72: =+J72+0.5*K72 -> 48.32 | J72: 47.32 | K72: 2 | L72: =+M72+0.5*N72 -> 22.26 | M72: 22.26 | N72: 0 | O72: =+P72+0.5*Q72 -> 56.09 | P72: 54.59 | Q72: 3 | R72: =+S72+T72+0.5*U72 -> 46.30 | S72: 21.59 | T72: 19.21 | U72: 11 | V72: =+W72+0.5*X72 -> 10.39 | W72: 10.39 | X72: 0 | Y72: =+Z72+AA72+0.5*AB72 -> 55.24 | Z72: 6.88 | AA72: 45.86 | AB72: 5 | AC72: =+AD72+0.5*AE72 -> 38.57 | AD72: 38.07 | AE72: 1 | AF72: =+AG72+0.5*AH72 -> 34.58 | AG72: 33.58 | AH72: 2 | AI72: =+AJ72+AK72+0.5*AL72 -> 20.82 | AJ72: 9.52 | AK72: 9.80 | AL72: 3
A73: 8 | B73: 0 | C73: 69 | D73: Carr, | E73: Robert | F73: CDP-MM | G73: =+I73+L73+O73+R73+V73+Y73+AC73+AF73+AI73 -> 333.44 | H73: =+K73+N73+Q73+U73+X73+AB73+AE73+AH73+AL73 -> 51 | I73: =+J73+0.5*K73 -> 33.65 | J73: 32.65 | K73: 2 | L73: =+M73+0.5*N73 -> 30.45 | M73: 29.45 | N73: 2 | O73: =+P73+0.5*Q73 -> 63.48 | P73: 59.98 | Q73: 7 | R73: =+S73+T73+0.5*U73 -> 30.45 | S73: 16.69 | T73: 11.76 | U73: 4 | V73: =+W73+0.5*X73 -> 12.05 | W73: 11.55 | X73: 1 | Y73: =+Z73+AA73+0.5*AB73 -> 55.97 | Z73: 10.25 | AA73: 36.22 | AB73: 19 | AC73: =+AD73+0.5*AE73 -> 42.99 | AD73: 40.49 | AE73: 5 | AF73: =+AG73+0.5*AH73 -> 38.05 | AG73: 33.05 | AH73: 10 | AI73: =+AJ73+AK73+0.5*AL73 -> 26.35 | AJ73: 15.17 | AK73: 10.68 | AL73: 1
A74: 14 | B74: 2 | C74: 70 | D74: Wimberly, | E74: Jeff | F74: SSP-MM | G74: =+I74+L74+O74+R74+V74+Y74+AC74+AF74+AI74 -> 336.61 | H74: =+K74+N74+Q74+U74+X74+AB74+AE74+AH74+AL74 -> 53 | I74: =+J74+0.5*K74 -> 51.16 | J74: 50.66 | K74: 1 | L74: =+M74+0.5*N74 -> 23.35 | M74: 22.85 | N74: 1 | O74: =+P74+0.5*Q74 -> 48.68 | P74: 41.68 | Q74: 14 | R74: =+S74+T74+0.5*U74 -> 56.58 | S74: 18.22 | T74: 28.36 | U74: 20 | V74: =+W74+0.5*X74 -> 11.15 | W74: 10.15 | X74: 2 | Y74: =+Z74+AA74+0.5*AB74 -> 37.22 | Z74: 6.37 | AA74: 29.35 | AB74: 3 | AC74: =+AD74+0.5*AE74 -> 41.38 | AD74: 41.38 | AE74: 0 | AF74: =+AG74+0.5*AH74 -> 36.94 | AG74: 32.94 | AH74: 8 | AI74: =+AJ74+AK74+0.5*AL74 -> 30.15 | AJ74: 15.44 | AK74: 12.71 | AL74: 4
A75: 62 | B75: 9 | C75: 71 | D75: Decker, | E75: Dennis | F75: SSP-MM | G75: =+I75+L75+O75+R75+V75+Y75+AC75+AF75+AI75 -> 342.05 | H75: =+K75+N75+Q75+U75+X75+AB75+AE75+AH75+AL75 -> 64 | I75: =+J75+0.5*K75 -> 41.17 | J75: 41.17 | K75: 0 | L75: =+M75+0.5*N75 -> 24.47 | M75: 22.97 | N75: 3 | O75: =+P75+0.5*Q75 -> 56.38 | P75: 43.38 | Q75: 26 | R75: =+S75+T75+0.5*U75 -> 43.46 | S75: 19.17 | T75: 18.29 | U75: 12 | V75: =+W75+0.5*X75 -> 8.04 | W75: 8.04 | X75: 0 | Y75: =+Z75+AA75+0.5*AB75 -> 66.07 | Z75: 6.43 | AA75: 54.14 | AB75: 11 | AC75: =+AD75+0.5*AE75 -> 50.48 | AD75: 46.98 | AE75: 7 | AF75: =+AG75+0.5*AH75 -> 27.47 | AG75: 24.97 | AH75: 5 | AI75: =+AJ75+AK75+0.5*AL75 -> 24.51 | AJ75: 12.87 | AK75: 11.64 | AL75: 0
A76: 66 | B76: 7 | C76: 72 | D76: Sterling, | E76: Scott | F76: SSP-MM | G76: =+I76+L76+O76+R76+V76+Y76+AC76+AF76+AI76 -> 367.51 | H76: =+K76+N76+Q76+U76+X76+AB76+AE76+AH76+AL76 -> 17 | I76: =+J76+0.5*K76 -> 41.89 | J76: 41.89 | K76: 0 | L76: =+M76+0.5*N76 -> 28.21 | M76: 24.71 | N76: 7 | O76: =+P76+0.5*Q76 -> 56.25 | P76: 54.25 | Q76: 4 | R76: =+S76+T76+0.5*U76 -> 56.60 | S76: 21.79 | T76: 33.31 | U76: 3 | V76: =+W76+0.5*X76 -> 9.39 | W76: 9.39 | X76: 0 | Y76: =+Z76+AA76+0.5*AB76 -> 50.16 | Z76: 9.34 | AA76: 40.82 | AB76: 0 | AC76: =+AD76+0.5*AE76 -> 49.87 | AD76: 49.87 | AE76: 0 | AF76: =+AG76+0.5*AH76 -> 46.41 | AG76: 45.91 | AH76: 1 | AI76: =+AJ76+AK76+0.5*AL76 -> 28.73 | AJ76: 14.74 | AK76: 12.99 | AL76: 2
A77: 36 | B77: 0 | C77: 73* | D77: Dunn, | E77: Rusty | F77: CDP-MM | G77: =+I77+L77+O77+R77+V77+Y77+AC77+AF77+AI77 -> 368.17 | H77: =+K77+N77+Q77+U77+X77+AB77+AE77+AH77+AL77 -> 156 | I77: =+J77+0.5*K77 -> 35.00 | J77: 31.00 | K77: 8 | L77: =+M77+0.5*N77 -> 26.18 | M77: 21.68 | N77: 9 | O77: =+P77+0.5*Q77 -> 57.29 | P77: 51.29 | Q77: 12 | R77: =+S77+T77+0.5*U77 -> 40.58 | S77: 16.73 | T77: 14.35 | U77: 19 | V77: =+W77+0.5*X77 -> 28.99 | W77: 8.99 | X77: 40 | Y77: =+Z77+AA77+0.5*AB77 -> 45.06 | Z77: 5.57 | AA77: 30.49 | AB77: 18 | AC77: =+AD77+0.5*AE77 -> 46.93 | AD77: 32.93 | AE77: 28 | AF77: =+AG77+0.5*AH77 -> 50.11 | AG77: 45.61 | AH77: 9 | AI77: =+AJ77+AK77+0.5*AL77 -> 38.03 | AJ77: 14.79 | AK77: 16.74 | AL77: 13
A78: 33 | B78: 5 | C78: 74 | D78: Allen, | E78: Susan M. | F78: SSP-NV | G78: =+I78+L78+O78+R78+V78+Y78+AC78+AF78+AI78 -> 386.22 | H78: =+K78+N78+Q78+U78+X78+AB78+AE78+AH78+AL78 -> 100 | I78: =+J78+0.5*K78 -> 46.62 | J78: 45.62 | K78: 2 | L78: =+M78+0.5*N78 -> 33.70 | M78: 31.20 | N78: 5 | O78: =+P78+0.5*Q78 -> 56.47 | P78: 40.47 | Q78: 32 | R78: =+S78+T78+0.5*U78 -> 46.21 | S78: 23.19 | T78: 19.52 | U78: 7 | V78: =+W78+0.5*X78 -> 19.62 | W78: 11.12 | X78: 17 | Y78: =+Z78+AA78+0.5*AB78 -> 62.64 | Z78: 10.61 | AA78: 42.53 | AB78: 19 | AC78: =+AD78+0.5*AE78 -> 41.13 | AD78: 36.63 | AE78: 9 | AF78: =+AG78+0.5*AH78 -> 45.11 | AG78: 44.11 | AH78: 2 | AI78: =+AJ78+AK78+0.5*AL78 -> 34.72 | AJ78: 15.05 | AK78: 16.17 | AL78: 7
A79: 31 | B79: 5 | C79: 75 | D79: Redocto, | E79: Leonardo | F79: CDP-MM | G79: =+I79+L79+O79+R79+V79+Y79+AC79+AF79+AI79 -> 398.53 | H79: =+K79+N79+Q79+U79+X79+AB79+AE79+AH79+AL79 -> 78 | I79: =+J79+0.5*K79 -> 46.91 | J79: 44.91 | K79: 4 | L79: =+M79+0.5*N79 -> 31.40 | M79: 28.90 | N79: 5 | O79: =+P79+0.5*Q79 -> 58.96 | P79: 53.46 | Q79: 11 | R79: =+S79+T79+0.5*U79 -> 44.19 | S79: 20.59 | T79: 22.10 | U79: 3 | V79: =+W79+0.5*X79 -> 10.39 | W79: 9.89 | X79: 1 | Y79: =+Z79+AA79+0.5*AB79 -> 62.12 | Z79: 11.33 | AA79: 43.29 | AB79: 15 | AC79: =+AD79+0.5*AE79 -> 54.51 | AD79: 51.51 | AE79: 6 | AF79: =+AG79+0.5*AH79 -> 56.47 | AG79: 42.47 | AH79: 28 | AI79: =+AJ79+AK79+0.5*AL79 -> 33.58 | AJ79: 16.38 | AK79: 14.70 | AL79: 5
A80: 58 | B80: 0 | C80: 76 | D80: Jelin, | E80: Barry | F80: CDP-MM | G80: =+I80+L80+O80+R80+V80+Y80+AC80+AF80+AI80 -> 430.29 | H80: =+K80+N80+Q80+U80+X80+AB80+AE80+AH80+AL80 -> 158 | I80: =+J80+0.5*K80 -> 37.71 | J80: 37.21 | K80: 1 | L80: =+M80+0.5*N80 -> 41.96 | M80: 31.46 | N80: 21 | O80: =+P80+0.5*Q80 -> 78.52 | P80: 55.02 | Q80: 47 | R80: =+S80+T80+0.5*U80 -> 67.79 | S80: 39.77 | T80: 23.52 | U80: 9 | V80: =+W80+0.5*X80 -> 13.45 | W80: 10.45 | X80: 6 | Y80: =+Z80+AA80+0.5*AB80 -> 53.44 | Z80: 8.12 | AA80: 33.82 | AB80: 23 | AC80: =+AD80+0.5*AE80 -> 56.90 | AD80: 43.90 | AE80: 26 | AF80: =+AG80+0.5*AH80 -> 49.94 | AG80: 41.44 | AH80: 17 | AI80: =+AJ80+AK80+0.5*AL80 -> 30.58 | AJ80: 14.08 | AK80: 12.50 | AL80: 8
A81: 43 | B81: 0 | C81: 77 | D81: Bier, | E81: Gabriel | F81: SSP-MM | G81: DQ | H81: DQ | I81: =+J81+0.5*K81 -> 36.47 | J81: 34.97 | K81: 3 | L81: =+M81+0.5*N81 -> 25.62 | M81: 24.62 | N81: 2 | O81: =+P81+0.5*Q81 -> 43.93 | P81: 42.43 | Q81: 3 | R81: =+S81+T81+0.5*U81 -> 41.51 | S81: 20.76 | T81: 19.25 | U81: 3 | V81: =+W81+0.5*X81 -> 18.05 | W81: 17.05 | X81: 2 | Y81: DQ | Z81: 8.17 | AC81: =+AD81+0.5*AE81 -> 0.00 | AF81: =+AG81+0.5*AH81 -> 0.00 | AI81: =+AJ81+AK81+0.5*AL81 -> 0.00
C83: Legend/Notes:
C84: X | D84: = Shooters who received trophies for their specific Division/Classification.
C85: Xx Xx | D85: = Shooters who acted as SOs or were part of the Match Staff.
C86: DQ | D86: = Shooter was disqualified for some reason.
C87: XX | D87: = Points Down value included some sore of penalty (Procedural, Hit On Non-threat, Failure to Neutralize, etc.)
C88: XXX.XX | D88: = Because these shooters took 1st place in their specific Div/Class, and there were more than 10 shooters competing in their classification, they were automatically advanced to the next highest classification.
C89: 73* | D89: = Although signed off by the shooter and the SO, Rusty Dunn's score sheet for Stage 1 did not have a time for the stage. As a result, his placing is based on an arbitrary time for Stage 1 (31.00). A value that is plus or minus 20 seconds from the 31.00 seconds given, would not have affected his Div/Class placing.
D91: All of the individual scores were verified on 9/16/03. Some corrections may have resulted in minor placing changes, but none affected the final trophy winning results.