A2: Utah State IDPA Match - 2003 Results | H2: (Sorted by Division/Classification.)
B3: Held on September 13, 2003 | G3: 1 | J3: 2 | M3: 3 | P3: 4 | T3: 5 | W3: 6 | AA3: 7 | AD3: 8 | AG3: 9
A4: Place | B4: Name (Last, First) | D4: (Div-Class) | E4: Shoot Total | F4: Total PD | G4: Stage 1 | H4: String 1 | I4: Points Down | J4: Stage 2 | K4: String 1 | L4: Points Down | M4: Stage 3 | N4: String 1 | O4: Points Down | P4: Stage 4 | Q4: String 1 | R4: String 2 | S4: Points Down | T4: Stage 5 | U4: String 1 | V4: Points Down | W4: Stage 6 | X4: String 1 | Y4: String 2 | Z4: Points Down | AA4: Stage 7 | AB4: String 1 | AC4: Points Down | AD4: Stage 8 | AE4: String 1 | AF4: Points Down | AG4: Stage 9 | AH4: String 1 | AI4: String 2 | AJ4: Points Down
B6: Griffiths | C6: Todd | D6: CDP-EX | E6: =+G6+J6+M6+P6+T6+W6+AA6+AD6+AG6 -> #REF! | F6: =+I6+L6+O6+S6+V6+Z6+AC6+AF6+AJ6 -> 0 | G6: =+H6+0.5*I6 -> 0.00 | J6: =+K6+0.5*L6 -> 0.00 | M6: =+N6+0.5*O6 -> 0.00 | P6: =+Q6+R6+0.5*S6 -> 0.00 | T6: =+U6+0.5*V6 -> 0.00 | W6: =+X6+Y6+0.5*Z6 -> 0.00 | AA6: =+AB6+0.5*AC6 -> 0.00 | AD6: =+AE6+#REF!+0.5*AF6 -> #REF! | AG6: =+AH6+AI6+0.5*AJ6 -> 0.00
B7: Haslem | C7: Alan | D7: CDP-EX | E7: =+G7+J7+M7+P7+T7+W7+AA7+AD7+AG7 -> #REF! | F7: =+I7+L7+O7+S7+V7+Z7+AC7+AF7+AJ7 -> 0 | G7: =+H7+0.5*I7 -> 0.00 | J7: =+K7+0.5*L7 -> 0.00 | M7: =+N7+0.5*O7 -> 0.00 | P7: =+Q7+R7+0.5*S7 -> 0.00 | T7: =+U7+0.5*V7 -> 0.00 | W7: =+X7+Y7+0.5*Z7 -> 0.00 | AA7: =+AB7+0.5*AC7 -> 0.00 | AD7: =+AE7+#REF!+0.5*AF7 -> #REF! | AG7: =+AH7+AI7+0.5*AJ7 -> 0.00
B8: Latham | C8: Cory | D8: CDP-EX | E8: =+G8+J8+M8+P8+T8+W8+AA8+AD8+AG8 -> #REF! | F8: =+I8+L8+O8+S8+V8+Z8+AC8+AF8+AJ8 -> 0 | G8: =+H8+0.5*I8 -> 0.00 | J8: =+K8+0.5*L8 -> 0.00 | M8: =+N8+0.5*O8 -> 0.00 | P8: =+Q8+R8+0.5*S8 -> 0.00 | T8: =+U8+0.5*V8 -> 0.00 | W8: =+X8+Y8+0.5*Z8 -> 0.00 | AA8: =+AB8+0.5*AC8 -> 0.00 | AD8: =+AE8+#REF!+0.5*AF8 -> #REF! | AG8: =+AH8+AI8+0.5*AJ8 -> 0.00
B9: Lepley | C9: Alex | D9: CDP-EX | E9: =+G9+J9+M9+P9+T9+W9+AA9+AD9+AG9 -> #REF! | F9: =+I9+L9+O9+S9+V9+Z9+AC9+AF9+AJ9 -> 0 | G9: =+H9+0.5*I9 -> 0.00 | J9: =+K9+0.5*L9 -> 0.00 | M9: =+N9+0.5*O9 -> 0.00 | P9: =+Q9+R9+0.5*S9 -> 0.00 | T9: =+U9+0.5*V9 -> 0.00 | W9: =+X9+Y9+0.5*Z9 -> 0.00 | AA9: =+AB9+0.5*AC9 -> 0.00 | AD9: =+AE9+#REF!+0.5*AF9 -> #REF! | AG9: =+AH9+AI9+0.5*AJ9 -> 0.00
B10: Tekmitchov | C10: George | D10: CDP-EX | E10: =+G10+J10+M10+P10+T10+W10+AA10+AD10+AG10 -> #REF! | F10: =+I10+L10+O10+S10+V10+Z10+AC10+AF10+AJ10 -> 0 | G10: =+H10+0.5*I10 -> 0.00 | J10: =+K10+0.5*L10 -> 0.00 | M10: =+N10+0.5*O10 -> 0.00 | P10: =+Q10+R10+0.5*S10 -> 0.00 | T10: =+U10+0.5*V10 -> 0.00 | W10: =+X10+Y10+0.5*Z10 -> 0.00 | AA10: =+AB10+0.5*AC10 -> 0.00 | AD10: =+AE10+#REF!+0.5*AF10 -> #REF! | AG10: =+AH10+AI10+0.5*AJ10 -> 0.00
B11: Theodore | C11: Ari | D11: CDP-EX | E11: =+G11+J11+M11+P11+T11+W11+AA11+AD11+AG11 -> #REF! | F11: =+I11+L11+O11+S11+V11+Z11+AC11+AF11+AJ11 -> 0 | G11: =+H11+0.5*I11 -> 0.00 | J11: =+K11+0.5*L11 -> 0.00 | M11: =+N11+0.5*O11 -> 0.00 | P11: =+Q11+R11+0.5*S11 -> 0.00 | T11: =+U11+0.5*V11 -> 0.00 | W11: =+X11+Y11+0.5*Z11 -> 0.00 | AA11: =+AB11+0.5*AC11 -> 0.00 | AD11: =+AE11+#REF!+0.5*AF11 -> #REF! | AG11: =+AH11+AI11+0.5*AJ11 -> 0.00
B12: Ward | C12: Dan | D12: CDP-EX | E12: =+G12+J12+M12+P12+T12+W12+AA12+AD12+AG12 -> #REF! | F12: =+I12+L12+O12+S12+V12+Z12+AC12+AF12+AJ12 -> 0 | G12: =+H12+0.5*I12 -> 0.00 | J12: =+K12+0.5*L12 -> 0.00 | M12: =+N12+0.5*O12 -> 0.00 | P12: =+Q12+R12+0.5*S12 -> 0.00 | T12: =+U12+0.5*V12 -> 0.00 | W12: =+X12+Y12+0.5*Z12 -> 0.00 | AA12: =+AB12+0.5*AC12 -> 0.00 | AD12: =+AE12+#REF!+0.5*AF12 -> #REF! | AG12: =+AH12+AI12+0.5*AJ12 -> 0.00
B13: Watson | C13: Steven | D13: CDP-EX | E13: =+G13+J13+M13+P13+T13+W13+AA13+AD13+AG13 -> #REF! | F13: =+I13+L13+O13+S13+V13+Z13+AC13+AF13+AJ13 -> 0 | G13: =+H13+0.5*I13 -> 0.00 | J13: =+K13+0.5*L13 -> 0.00 | M13: =+N13+0.5*O13 -> 0.00 | P13: =+Q13+R13+0.5*S13 -> 0.00 | T13: =+U13+0.5*V13 -> 0.00 | W13: =+X13+Y13+0.5*Z13 -> 0.00 | AA13: =+AB13+0.5*AC13 -> 0.00 | AD13: =+AE13+#REF!+0.5*AF13 -> #REF! | AG13: =+AH13+AI13+0.5*AJ13 -> 0.00
B15: Attryde | C15: Ed | D15: CDP-MM | E15: =+G15+J15+M15+P15+T15+W15+AA15+AD15+AG15 -> #REF! | F15: =+I15+L15+O15+S15+V15+Z15+AC15+AF15+AJ15 -> 0 | G15: =+H15+0.5*I15 -> 0.00 | J15: =+K15+0.5*L15 -> 0.00 | M15: =+N15+0.5*O15 -> 0.00 | P15: =+Q15+R15+0.5*S15 -> 0.00 | T15: =+U15+0.5*V15 -> 0.00 | W15: =+X15+Y15+0.5*Z15 -> 0.00 | AA15: =+AB15+0.5*AC15 -> 0.00 | AD15: =+AE15+#REF!+0.5*AF15 -> #REF! | AG15: =+AH15+AI15+0.5*AJ15 -> 0.00
B16: Badger | C16: Jeff | D16: CDP-MM | E16: =+G16+J16+M16+P16+T16+W16+AA16+AD16+AG16 -> #REF! | F16: =+I16+L16+O16+S16+V16+Z16+AC16+AF16+AJ16 -> 0 | G16: =+H16+0.5*I16 -> 0.00 | J16: =+K16+0.5*L16 -> 0.00 | M16: =+N16+0.5*O16 -> 0.00 | P16: =+Q16+R16+0.5*S16 -> 0.00 | T16: =+U16+0.5*V16 -> 0.00 | W16: =+X16+Y16+0.5*Z16 -> 0.00 | AA16: =+AB16+0.5*AC16 -> 0.00 | AD16: =+AE16+#REF!+0.5*AF16 -> #REF! | AG16: =+AH16+AI16+0.5*AJ16 -> 0.00
B17: Balay | C17: Danny | D17: CDP-MM | E17: =+G17+J17+M17+P17+T17+W17+AA17+AD17+AG17 -> #REF! | F17: =+I17+L17+O17+S17+V17+Z17+AC17+AF17+AJ17 -> 0 | G17: =+H17+0.5*I17 -> 0.00 | J17: =+K17+0.5*L17 -> 0.00 | M17: =+N17+0.5*O17 -> 0.00 | P17: =+Q17+R17+0.5*S17 -> 0.00 | T17: =+U17+0.5*V17 -> 0.00 | W17: =+X17+Y17+0.5*Z17 -> 0.00 | AA17: =+AB17+0.5*AC17 -> 0.00 | AD17: =+AE17+#REF!+0.5*AF17 -> #REF! | AG17: =+AH17+AI17+0.5*AJ17 -> 0.00
B18: Bowling | C18: William | D18: CDP-MM | E18: =+G18+J18+M18+P18+T18+W18+AA18+AD18+AG18 -> #REF! | F18: =+I18+L18+O18+S18+V18+Z18+AC18+AF18+AJ18 -> 0 | G18: =+H18+0.5*I18 -> 0.00 | J18: =+K18+0.5*L18 -> 0.00 | M18: =+N18+0.5*O18 -> 0.00 | P18: =+Q18+R18+0.5*S18 -> 0.00 | T18: =+U18+0.5*V18 -> 0.00 | W18: =+X18+Y18+0.5*Z18 -> 0.00 | AA18: =+AB18+0.5*AC18 -> 0.00 | AD18: =+AE18+#REF!+0.5*AF18 -> #REF! | AG18: =+AH18+AI18+0.5*AJ18 -> 0.00
B19: Carr | C19: Robert | D19: CDP-MM | E19: =+G19+J19+M19+P19+T19+W19+AA19+AD19+AG19 -> #REF! | F19: =+I19+L19+O19+S19+V19+Z19+AC19+AF19+AJ19 -> 0 | G19: =+H19+0.5*I19 -> 0.00 | J19: =+K19+0.5*L19 -> 0.00 | M19: =+N19+0.5*O19 -> 0.00 | P19: =+Q19+R19+0.5*S19 -> 0.00 | T19: =+U19+0.5*V19 -> 0.00 | W19: =+X19+Y19+0.5*Z19 -> 0.00 | AA19: =+AB19+0.5*AC19 -> 0.00 | AD19: =+AE19+#REF!+0.5*AF19 -> #REF! | AG19: =+AH19+AI19+0.5*AJ19 -> 0.00
B20: Dunn | C20: Rusty | D20: CDP-MM | E20: =+G20+J20+M20+P20+T20+W20+AA20+AD20+AG20 -> #REF! | F20: =+I20+L20+O20+S20+V20+Z20+AC20+AF20+AJ20 -> 0 | G20: =+H20+0.5*I20 -> 0.00 | J20: =+K20+0.5*L20 -> 0.00 | M20: =+N20+0.5*O20 -> 0.00 | P20: =+Q20+R20+0.5*S20 -> 0.00 | T20: =+U20+0.5*V20 -> 0.00 | W20: =+X20+Y20+0.5*Z20 -> 0.00 | AA20: =+AB20+0.5*AC20 -> 0.00 | AD20: =+AE20+#REF!+0.5*AF20 -> #REF! | AG20: =+AH20+AI20+0.5*AJ20 -> 0.00
B21: Halliday | C21: Mark | D21: CDP-MM | E21: =+G21+J21+M21+P21+T21+W21+AA21+AD21+AG21 -> #REF! | F21: =+I21+L21+O21+S21+V21+Z21+AC21+AF21+AJ21 -> 0 | G21: =+H21+0.5*I21 -> 0.00 | J21: =+K21+0.5*L21 -> 0.00 | M21: =+N21+0.5*O21 -> 0.00 | P21: =+Q21+R21+0.5*S21 -> 0.00 | T21: =+U21+0.5*V21 -> 0.00 | W21: =+X21+Y21+0.5*Z21 -> 0.00 | AA21: =+AB21+0.5*AC21 -> 0.00 | AD21: =+AE21+#REF!+0.5*AF21 -> #REF! | AG21: =+AH21+AI21+0.5*AJ21 -> 0.00
B22: Hood | C22: Neil | D22: CDP-MM | E22: =+G22+J22+M22+P22+T22+W22+AA22+AD22+AG22 -> #REF! | F22: =+I22+L22+O22+S22+V22+Z22+AC22+AF22+AJ22 -> 0 | G22: =+H22+0.5*I22 -> 0.00 | J22: =+K22+0.5*L22 -> 0.00 | M22: =+N22+0.5*O22 -> 0.00 | P22: =+Q22+R22+0.5*S22 -> 0.00 | T22: =+U22+0.5*V22 -> 0.00 | W22: =+X22+Y22+0.5*Z22 -> 0.00 | AA22: =+AB22+0.5*AC22 -> 0.00 | AD22: =+AE22+#REF!+0.5*AF22 -> #REF! | AG22: =+AH22+AI22+0.5*AJ22 -> 0.00
B23: Jelin | C23: Barry | D23: CDP-MM | E23: =+G23+J23+M23+P23+T23+W23+AA23+AD23+AG23 -> #REF! | F23: =+I23+L23+O23+S23+V23+Z23+AC23+AF23+AJ23 -> 0 | G23: =+H23+0.5*I23 -> 0.00 | J23: =+K23+0.5*L23 -> 0.00 | M23: =+N23+0.5*O23 -> 0.00 | P23: =+Q23+R23+0.5*S23 -> 0.00 | T23: =+U23+0.5*V23 -> 0.00 | W23: =+X23+Y23+0.5*Z23 -> 0.00 | AA23: =+AB23+0.5*AC23 -> 0.00 | AD23: =+AE23+#REF!+0.5*AF23 -> #REF! | AG23: =+AH23+AI23+0.5*AJ23 -> 0.00
B24: Redocto | C24: Leonardo | D24: CDP-MM | E24: =+G24+J24+M24+P24+T24+W24+AA24+AD24+AG24 -> 10.39 | F24: =+I24+L24+O24+S24+V24+Z24+AC24+AF24+AJ24 -> 1 | G24: =+H24+0.5*I24 -> 0.00 | J24: =+K24+0.5*L24 -> 0.00 | M24: =+N24+0.5*O24 -> 0.00 | P24: =+Q24+R24+0.5*S24 -> 0.00 | T24: =+U24+0.5*V24 -> 10.39 | U24: 9.89 | V24: 1 | W24: =+X24+Y24+0.5*Z24 -> 0.00 | AA24: =+AB24+0.5*AC24 -> 0.00 | AD24: =+AE24+0.5*AF24 -> 0.00 | AG24: =+AH24+AI24+0.5*AJ24 -> 0.00
B25: Rimer | C25: Clayton | D25: CDP-MM | E25: =+G25+J25+M25+P25+T25+W25+AA25+AD25+AG25 -> #REF! | F25: =+I25+L25+O25+S25+V25+Z25+AC25+AF25+AJ25 -> 0 | G25: =+H25+0.5*I25 -> 0.00 | J25: =+K25+0.5*L25 -> 0.00 | M25: =+N25+0.5*O25 -> 0.00 | P25: =+Q25+R25+0.5*S25 -> 0.00 | T25: =+U25+0.5*V25 -> 0.00 | W25: =+X25+Y25+0.5*Z25 -> 0.00 | AA25: =+AB25+0.5*AC25 -> 0.00 | AD25: =+AE25+#REF!+0.5*AF25 -> #REF! | AG25: =+AH25+AI25+0.5*AJ25 -> 0.00
B26: Roach | C26: Chris | D26: CDP-MM | E26: =+G26+J26+M26+P26+T26+W26+AA26+AD26+AG26 -> #REF! | F26: =+I26+L26+O26+S26+V26+Z26+AC26+AF26+AJ26 -> 0 | G26: =+H26+0.5*I26 -> 0.00 | J26: =+K26+0.5*L26 -> 0.00 | M26: =+N26+0.5*O26 -> 0.00 | P26: =+Q26+R26+0.5*S26 -> 0.00 | T26: =+U26+0.5*V26 -> 0.00 | W26: =+X26+Y26+0.5*Z26 -> 0.00 | AA26: =+AB26+0.5*AC26 -> 0.00 | AD26: =+AE26+#REF!+0.5*AF26 -> #REF! | AG26: =+AH26+AI26+0.5*AJ26 -> 0.00
B28: Berry | C28: Robert | D28: CDP-SS | E28: =+G28+J28+M28+P28+T28+W28+AA28+AD28+AG28 -> #REF! | F28: =+I28+L28+O28+S28+V28+Z28+AC28+AF28+AJ28 -> 0 | G28: =+H28+0.5*I28 -> 0.00 | J28: =+K28+0.5*L28 -> 0.00 | M28: =+N28+0.5*O28 -> 0.00 | P28: =+Q28+R28+0.5*S28 -> 0.00 | T28: =+U28+0.5*V28 -> 0.00 | W28: =+X28+Y28+0.5*Z28 -> 0.00 | AA28: =+AB28+0.5*AC28 -> 0.00 | AD28: =+AE28+#REF!+0.5*AF28 -> #REF! | AG28: =+AH28+AI28+0.5*AJ28 -> 0.00
B29: Colby | C29: William | D29: CDP-SS | E29: =+G29+J29+M29+P29+T29+W29+AA29+AD29+AG29 -> #REF! | F29: =+I29+L29+O29+S29+V29+Z29+AC29+AF29+AJ29 -> 0 | G29: =+H29+0.5*I29 -> 0.00 | J29: =+K29+0.5*L29 -> 0.00 | M29: =+N29+0.5*O29 -> 0.00 | P29: =+Q29+R29+0.5*S29 -> 0.00 | T29: =+U29+0.5*V29 -> 0.00 | W29: =+X29+Y29+0.5*Z29 -> 0.00 | AA29: =+AB29+0.5*AC29 -> 0.00 | AD29: =+AE29+#REF!+0.5*AF29 -> #REF! | AG29: =+AH29+AI29+0.5*AJ29 -> 0.00
B30: Coleman | C30: Steve | D30: CDP-SS | E30: =+G30+J30+M30+P30+T30+W30+AA30+AD30+AG30 -> #REF! | F30: =+I30+L30+O30+S30+V30+Z30+AC30+AF30+AJ30 -> 0 | G30: =+H30+0.5*I30 -> 0.00 | J30: =+K30+0.5*L30 -> 0.00 | M30: =+N30+0.5*O30 -> 0.00 | P30: =+Q30+R30+0.5*S30 -> 0.00 | T30: =+U30+0.5*V30 -> 0.00 | W30: =+X30+Y30+0.5*Z30 -> 0.00 | AA30: =+AB30+0.5*AC30 -> 0.00 | AD30: =+AE30+#REF!+0.5*AF30 -> #REF! | AG30: =+AH30+AI30+0.5*AJ30 -> 0.00
B31: Correia | C31: Larry | D31: CDP-SS | E31: =+G31+J31+M31+P31+T31+W31+AA31+AD31+AG31 -> #REF! | F31: =+I31+L31+O31+S31+V31+Z31+AC31+AF31+AJ31 -> 0 | G31: =+H31+0.5*I31 -> 0.00 | J31: =+K31+0.5*L31 -> 0.00 | M31: =+N31+0.5*O31 -> 0.00 | P31: =+Q31+R31+0.5*S31 -> 0.00 | T31: =+U31+0.5*V31 -> 0.00 | W31: =+X31+Y31+0.5*Z31 -> 0.00 | AA31: =+AB31+0.5*AC31 -> 0.00 | AD31: =+AE31+#REF!+0.5*AF31 -> #REF! | AG31: =+AH31+AI31+0.5*AJ31 -> 0.00
B32: Haslem | C32: Kent | D32: CDP-SS | E32: =+G32+J32+M32+P32+T32+W32+AA32+AD32+AG32 -> #REF! | F32: =+I32+L32+O32+S32+V32+Z32+AC32+AF32+AJ32 -> 0 | G32: =+H32+0.5*I32 -> 0.00 | J32: =+K32+0.5*L32 -> 0.00 | M32: =+N32+0.5*O32 -> 0.00 | P32: =+Q32+R32+0.5*S32 -> 0.00 | T32: =+U32+0.5*V32 -> 0.00 | W32: =+X32+Y32+0.5*Z32 -> 0.00 | AA32: =+AB32+0.5*AC32 -> 0.00 | AD32: =+AE32+#REF!+0.5*AF32 -> #REF! | AG32: =+AH32+AI32+0.5*AJ32 -> 0.00
B33: Porter | C33: Alma | D33: CDP-SS | E33: =+G33+J33+M33+P33+T33+W33+AA33+AD33+AG33 -> #REF! | F33: =+I33+L33+O33+S33+V33+Z33+AC33+AF33+AJ33 -> 0 | G33: =+H33+0.5*I33 -> 0.00 | J33: =+K33+0.5*L33 -> 0.00 | M33: =+N33+0.5*O33 -> 0.00 | P33: =+Q33+R33+0.5*S33 -> 0.00 | T33: =+U33+0.5*V33 -> 0.00 | W33: =+X33+Y33+0.5*Z33 -> 0.00 | AA33: =+AB33+0.5*AC33 -> 0.00 | AD33: =+AE33+#REF!+0.5*AF33 -> #REF! | AG33: =+AH33+AI33+0.5*AJ33 -> 0.00
B34: Rodriguez | C34: Mike | D34: CDP-SS | E34: =+G34+J34+M34+P34+T34+W34+AA34+AD34+AG34 -> #REF! | F34: =+I34+L34+O34+S34+V34+Z34+AC34+AF34+AJ34 -> 0 | G34: =+H34+0.5*I34 -> 0.00 | J34: =+K34+0.5*L34 -> 0.00 | M34: =+N34+0.5*O34 -> 0.00 | P34: =+Q34+R34+0.5*S34 -> 0.00 | T34: =+U34+0.5*V34 -> 0.00 | W34: =+X34+Y34+0.5*Z34 -> 0.00 | AA34: =+AB34+0.5*AC34 -> 0.00 | AD34: =+AE34+#REF!+0.5*AF34 -> #REF! | AG34: =+AH34+AI34+0.5*AJ34 -> 0.00
B35: Rupert | C35: Frank | D35: CDP-SS | E35: =+G35+J35+M35+P35+T35+W35+AA35+AD35+AG35 -> #REF! | F35: =+I35+L35+O35+S35+V35+Z35+AC35+AF35+AJ35 -> 0 | G35: =+H35+0.5*I35 -> 0.00 | J35: =+K35+0.5*L35 -> 0.00 | M35: =+N35+0.5*O35 -> 0.00 | P35: =+Q35+R35+0.5*S35 -> 0.00 | T35: =+U35+0.5*V35 -> 0.00 | W35: =+X35+Y35+0.5*Z35 -> 0.00 | AA35: =+AB35+0.5*AC35 -> 0.00 | AD35: =+AE35+#REF!+0.5*AF35 -> #REF! | AG35: =+AH35+AI35+0.5*AJ35 -> 0.00
B36: Smith | C36: Burton | D36: CDP-SS | E36: =+G36+J36+M36+P36+T36+W36+AA36+AD36+AG36 -> #REF! | F36: =+I36+L36+O36+S36+V36+Z36+AC36+AF36+AJ36 -> 0 | G36: =+H36+0.5*I36 -> 0.00 | J36: =+K36+0.5*L36 -> 0.00 | M36: =+N36+0.5*O36 -> 0.00 | P36: =+Q36+R36+0.5*S36 -> 0.00 | T36: =+U36+0.5*V36 -> 0.00 | W36: =+X36+Y36+0.5*Z36 -> 0.00 | AA36: =+AB36+0.5*AC36 -> 0.00 | AD36: =+AE36+#REF!+0.5*AF36 -> #REF! | AG36: =+AH36+AI36+0.5*AJ36 -> 0.00
B37: Tran | C37: Hung | D37: CDP-SS | E37: =+G37+J37+M37+P37+T37+W37+AA37+AD37+AG37 -> #REF! | F37: =+I37+L37+O37+S37+V37+Z37+AC37+AF37+AJ37 -> 0 | G37: =+H37+0.5*I37 -> 0.00 | J37: =+K37+0.5*L37 -> 0.00 | M37: =+N37+0.5*O37 -> 0.00 | P37: =+Q37+R37+0.5*S37 -> 0.00 | T37: =+U37+0.5*V37 -> 0.00 | W37: =+X37+Y37+0.5*Z37 -> 0.00 | AA37: =+AB37+0.5*AC37 -> 0.00 | AD37: =+AE37+#REF!+0.5*AF37 -> #REF! | AG37: =+AH37+AI37+0.5*AJ37 -> 0.00
B39: Edwards | C39: Lance | D39: ESP-EX | E39: =+G39+J39+M39+P39+T39+W39+AA39+AD39+AG39 -> #REF! | F39: =+I39+L39+O39+S39+V39+Z39+AC39+AF39+AJ39 -> 0 | G39: =+H39+0.5*I39 -> 0.00 | J39: =+K39+0.5*L39 -> 0.00 | M39: =+N39+0.5*O39 -> 0.00 | P39: =+Q39+R39+0.5*S39 -> 0.00 | T39: =+U39+0.5*V39 -> 0.00 | W39: =+X39+Y39+0.5*Z39 -> 0.00 | AA39: =+AB39+0.5*AC39 -> 0.00 | AD39: =+AE39+#REF!+0.5*AF39 -> #REF! | AG39: =+AH39+AI39+0.5*AJ39 -> 0.00
B41: Boshard | C41: David | D41: ESP-MA | E41: =+G41+J41+M41+P41+T41+W41+AA41+AD41+AG41 -> #REF! | F41: =+I41+L41+O41+S41+V41+Z41+AC41+AF41+AJ41 -> 0 | G41: =+H41+0.5*I41 -> 0.00 | J41: =+K41+0.5*L41 -> 0.00 | M41: =+N41+0.5*O41 -> 0.00 | P41: =+Q41+R41+0.5*S41 -> 0.00 | T41: =+U41+0.5*V41 -> 0.00 | W41: =+X41+Y41+0.5*Z41 -> 0.00 | AA41: =+AB41+0.5*AC41 -> 0.00 | AD41: =+AE41+#REF!+0.5*AF41 -> #REF! | AG41: =+AH41+AI41+0.5*AJ41 -> 0.00
B42: Gelo | C42: Ivan | D42: ESP-MA | E42: =+G42+J42+M42+P42+T42+W42+AA42+AD42+AG42 -> #REF! | F42: =+I42+L42+O42+S42+V42+Z42+AC42+AF42+AJ42 -> 0 | G42: =+H42+0.5*I42 -> 0.00 | J42: =+K42+0.5*L42 -> 0.00 | M42: =+N42+0.5*O42 -> 0.00 | P42: =+Q42+R42+0.5*S42 -> 0.00 | T42: =+U42+0.5*V42 -> 0.00 | W42: =+X42+Y42+0.5*Z42 -> 0.00 | AA42: =+AB42+0.5*AC42 -> 0.00 | AD42: =+AE42+#REF!+0.5*AF42 -> #REF! | AG42: =+AH42+AI42+0.5*AJ42 -> 0.00
B44: Katz | C44: Eric | D44: ESP-MM | E44: =+G44+J44+M44+P44+T44+W44+AA44+AD44+AG44 -> #REF! | F44: =+I44+L44+O44+S44+V44+Z44+AC44+AF44+AJ44 -> 0 | G44: =+H44+0.5*I44 -> 0.00 | J44: =+K44+0.5*L44 -> 0.00 | M44: =+N44+0.5*O44 -> 0.00 | P44: =+Q44+R44+0.5*S44 -> 0.00 | T44: =+U44+0.5*V44 -> 0.00 | W44: =+X44+Y44+0.5*Z44 -> 0.00 | AA44: =+AB44+0.5*AC44 -> 0.00 | AD44: =+AE44+#REF!+0.5*AF44 -> #REF! | AG44: =+AH44+AI44+0.5*AJ44 -> 0.00
B45: Zaccardi | C45: Juke | D45: ESP-MM | E45: =+G45+J45+M45+P45+T45+W45+AA45+AD45+AG45 -> #REF! | F45: =+I45+L45+O45+S45+V45+Z45+AC45+AF45+AJ45 -> 0 | G45: =+H45+0.5*I45 -> 0.00 | J45: =+K45+0.5*L45 -> 0.00 | M45: =+N45+0.5*O45 -> 0.00 | P45: =+Q45+R45+0.5*S45 -> 0.00 | T45: =+U45+0.5*V45 -> 0.00 | W45: =+X45+Y45+0.5*Z45 -> 0.00 | AA45: =+AB45+0.5*AC45 -> 0.00 | AD45: =+AE45+#REF!+0.5*AF45 -> #REF! | AG45: =+AH45+AI45+0.5*AJ45 -> 0.00
B47: Collins | C47: Ken | D47: ESP-SS | E47: =+G47+J47+M47+P47+T47+W47+AA47+AD47+AG47 -> #REF! | F47: =+I47+L47+O47+S47+V47+Z47+AC47+AF47+AJ47 -> 0 | G47: =+H47+0.5*I47 -> 0.00 | J47: =+K47+0.5*L47 -> 0.00 | M47: =+N47+0.5*O47 -> 0.00 | P47: =+Q47+R47+0.5*S47 -> 0.00 | T47: =+U47+0.5*V47 -> 0.00 | W47: =+X47+Y47+0.5*Z47 -> 0.00 | AA47: =+AB47+0.5*AC47 -> 0.00 | AD47: =+AE47+#REF!+0.5*AF47 -> #REF! | AG47: =+AH47+AI47+0.5*AJ47 -> 0.00
B48: Greathouse | C48: Joseph | D48: ESP-SS | E48: =+G48+J48+M48+P48+T48+W48+AA48+AD48+AG48 -> #REF! | F48: =+I48+L48+O48+S48+V48+Z48+AC48+AF48+AJ48 -> 0 | G48: =+H48+0.5*I48 -> 0.00 | J48: =+K48+0.5*L48 -> 0.00 | M48: =+N48+0.5*O48 -> 0.00 | P48: =+Q48+R48+0.5*S48 -> 0.00 | T48: =+U48+0.5*V48 -> 0.00 | W48: =+X48+Y48+0.5*Z48 -> 0.00 | AA48: =+AB48+0.5*AC48 -> 0.00 | AD48: =+AE48+#REF!+0.5*AF48 -> #REF! | AG48: =+AH48+AI48+0.5*AJ48 -> 0.00
B49: Mortenseon | C49: Bryan | D49: ESP-SS | E49: =+G49+J49+M49+P49+T49+W49+AA49+AD49+AG49 -> #REF! | F49: =+I49+L49+O49+S49+V49+Z49+AC49+AF49+AJ49 -> 0 | G49: =+H49+0.5*I49 -> 0.00 | J49: =+K49+0.5*L49 -> 0.00 | M49: =+N49+0.5*O49 -> 0.00 | P49: =+Q49+R49+0.5*S49 -> 0.00 | T49: =+U49+0.5*V49 -> 0.00 | W49: =+X49+Y49+0.5*Z49 -> 0.00 | AA49: =+AB49+0.5*AC49 -> 0.00 | AD49: =+AE49+#REF!+0.5*AF49 -> #REF! | AG49: =+AH49+AI49+0.5*AJ49 -> 0.00
B50: Parks | C50: Justin | D50: ESP-SS | E50: =+G50+J50+M50+P50+T50+W50+AA50+AD50+AG50 -> #REF! | F50: =+I50+L50+O50+S50+V50+Z50+AC50+AF50+AJ50 -> 0 | G50: =+H50+0.5*I50 -> 0.00 | J50: =+K50+0.5*L50 -> 0.00 | M50: =+N50+0.5*O50 -> 0.00 | P50: =+Q50+R50+0.5*S50 -> 0.00 | T50: =+U50+0.5*V50 -> 0.00 | W50: =+X50+Y50+0.5*Z50 -> 0.00 | AA50: =+AB50+0.5*AC50 -> 0.00 | AD50: =+AE50+#REF!+0.5*AF50 -> #REF! | AG50: =+AH50+AI50+0.5*AJ50 -> 0.00
B51: Peterson | C51: Todd | D51: ESP-SS | E51: =+G51+J51+M51+P51+T51+W51+AA51+AD51+AG51 -> #REF! | F51: =+I51+L51+O51+S51+V51+Z51+AC51+AF51+AJ51 -> 0 | G51: =+H51+0.5*I51 -> 0.00 | J51: =+K51+0.5*L51 -> 0.00 | M51: =+N51+0.5*O51 -> 0.00 | P51: =+Q51+R51+0.5*S51 -> 0.00 | T51: =+U51+0.5*V51 -> 0.00 | W51: =+X51+Y51+0.5*Z51 -> 0.00 | AA51: =+AB51+0.5*AC51 -> 0.00 | AD51: =+AE51+#REF!+0.5*AF51 -> #REF! | AG51: =+AH51+AI51+0.5*AJ51 -> 0.00
B52: Zaccardi | C52: Pat | D52: ESP-SS | E52: =+G52+J52+M52+P52+T52+W52+AA52+AD52+AG52 -> #REF! | F52: =+I52+L52+O52+S52+V52+Z52+AC52+AF52+AJ52 -> 0 | G52: =+H52+0.5*I52 -> 0.00 | J52: =+K52+0.5*L52 -> 0.00 | M52: =+N52+0.5*O52 -> 0.00 | P52: =+Q52+R52+0.5*S52 -> 0.00 | T52: =+U52+0.5*V52 -> 0.00 | W52: =+X52+Y52+0.5*Z52 -> 0.00 | AA52: =+AB52+0.5*AC52 -> 0.00 | AD52: =+AE52+#REF!+0.5*AF52 -> #REF! | AG52: =+AH52+AI52+0.5*AJ52 -> 0.00
A53: SSP-MA
A54: 1 | B54: Mahoney, | C54: Chuck | D54: SSP-MA | E54: =+G54+J54+M54+P54+T54+W54+AA54+AD54+AG54 -> 152.72 | F54: =+I54+L54+O54+S54+V54+Z54+AC54+AF54+AJ54 -> 23 | G54: =+H54+0.5*I54 -> 21.06 | H54: 18.06 | I54: 6 | J54: =+K54+0.5*L54 -> 11.33 | K54: 10.83 | L54: 1 | M54: =+N54+0.5*O54 -> 20.36 | N54: 18.86 | O54: 3 | P54: =+Q54+R54+0.5*S54 -> 20.01 | Q54: 10.88 | R54: 9.13 | S54: 0 | T54: =+U54+0.5*V54 -> 6.74 | U54: 5.24 | V54: 3 | W54: =+X54+Y54+0.5*Z54 -> 22.84 | X54: 4.15 | Y54: 17.19 | Z54: 3 | AA54: =+AB54+0.5*AC54 -> 20.52 | AB54: 18.52 | AC54: 4 | AD54: =+AE54+0.5*AF54 -> 15.99 | AE54: 14.99 | AF54: 2 | AG54: =+AH54+AI54+0.5*AJ54 -> 13.87 | AH54: 7.61 | AI54: 5.76 | AJ54: 1
A55: 2 | B55: Koski, | C55: Steve | D55: SSP-MA | E55: =+G55+J55+M55+P55+T55+W55+AA55+AD55+AG55 -> 173.51 | F55: =+I55+L55+O55+S55+V55+Z55+AC55+AF55+AJ55 -> 17 | G55: =+H55+0.5*I55 -> 24.47 | H55: 24.47 | I55: 0 | J55: =+K55+0.5*L55 -> 16.09 | K55: 13.09 | L55: 6 | M55: =+N55+0.5*O55 -> 27.31 | N55: 26.31 | O55: 2 | P55: =+Q55+R55+0.5*S55 -> 17.78 | Q55: 9.55 | R55: 8.23 | S55: 0 | T55: =+U55+0.5*V55 -> 6.89 | U55: 6.89 | V55: 0 | W55: =+X55+Y55+0.5*Z55 -> 25.11 | X55: 5.82 | Y55: 18.79 | Z55: 1 | AA55: =+AB55+0.5*AC55 -> 23.70 | AB55: 21.70 | AC55: 4 | AD55: =+AE55+0.5*AF55 -> 16.76 | AE55: 16.26 | AF55: 1 | AG55: =+AH55+AI55+0.5*AJ55 -> 15.40 | AH55: 7.53 | AI55: 6.37 | AJ55: 3
A56: 3 | B56: Lowe, | C56: John | D56: SSP-MA | E56: =+G56+J56+M56+P56+T56+W56+AA56+AD56+AG56 -> 202.67 | F56: =+I56+L56+O56+S56+V56+Z56+AC56+AF56+AJ56 -> 28 | G56: =+H56+0.5*I56 -> 37.80 | H56: 37.80 | I56: 0 | J56: =+K56+0.5*L56 -> 16.84 | K56: 15.84 | L56: 2 | M56: =+N56+0.5*O56 -> 28.78 | N56: 27.28 | O56: 3 | P56: =+Q56+R56+0.5*S56 -> 23.55 | Q56: 13.98 | R56: 9.07 | S56: 1 | T56: =+U56+0.5*V56 -> 6.24 | U56: 6.24 | V56: 0 | W56: =+X56+Y56+0.5*Z56 -> 29.65 | X56: 4.65 | Y56: 21.50 | Z56: 7 | AA56: =+AB56+0.5*AC56 -> 21.02 | AB56: 18.02 | AC56: 6 | AD56: =+AE56+0.5*AF56 -> 20.08 | AE56: 17.08 | AF56: 6 | AG56: =+AH56+AI56+0.5*AJ56 -> 18.71 | AH56: 9.44 | AI56: 7.77 | AJ56: 3
A57: SSP-EX
B58: Montgomery | C58: Robert | D58: SSP-EX | E58: =+G58+J58+M58+P58+T58+W58+AA58+AD58+AG58 -> 0.00 | F58: =+I58+L58+O58+S58+V58+Z58+AC58+AF58+AJ58 -> 0 | G58: =+H58+0.5*I58 -> 0.00 | J58: =+K58+0.5*L58 -> 0.00 | M58: =+N58+0.5*O58 -> 0.00 | P58: =+Q58+R58+0.5*S58 -> 0.00 | T58: =+U58+0.5*V58 -> 0.00 | W58: =+X58+Y58+0.5*Z58 -> 0.00 | AA58: =+AB58+0.5*AC58 -> 0.00 | AD58: =+AE58+0.5*AF58 -> 0.00 | AG58: =+AH58+AI58+0.5*AJ58 -> 0.00
A59: 1 | B59: Boender, | C59: David | D59: SSP-EX | E59: =+G59+J59+M59+P59+T59+W59+AA59+AD59+AG59 -> 200.46 | F59: =+I59+L59+O59+S59+V59+Z59+AC59+AF59+AJ59 -> 32 | G59: =+H59+0.5*I59 -> 18.00 | H59: 18.00 | I59: 0 | J59: =+K59+0.5*L59 -> 23.27 | K59: 21.77 | L59: 3 | M59: =+N59+0.5*O59 -> 30.27 | N59: 27.27 | O59: 6 | P59: =+Q59+R59+0.5*S59 -> 21.98 | Q59: 11.79 | R59: 9.19 | S59: 2 | T59: =+U59+0.5*V59 -> 8.05 | U59: 7.05 | V59: 2 | W59: =+X59+Y59+0.5*Z59 -> 27.14 | X59: 3.73 | Y59: 19.41 | Z59: 8 | AA59: =+AB59+0.5*AC59 -> 29.29 | AB59: 24.29 | AC59: 10 | AD59: =+AE59+0.5*AF59 -> 22.28 | AE59: 22.28 | AF59: 0 | AG59: =+AH59+AI59+0.5*AJ59 -> 20.18 | AH59: 10.77 | AI59: 8.91 | AJ59: 1
A60: 2 | B60: Vollmer, | C60: Philip | D60: SSP-EX | E60: =+G60+J60+M60+P60+T60+W60+AA60+AD60+AG60 -> 214.05 | F60: =+I60+L60+O60+S60+V60+Z60+AC60+AF60+AJ60 -> 34 | G60: =+H60+0.5*I60 -> 22.90 | H60: 22.90 | I60: 0 | J60: =+K60+0.5*L60 -> 19.51 | K60: 17.51 | L60: 4 | M60: =+N60+0.5*O60 -> 38.00 | N60: 32.00 | O60: 12 | P60: =+Q60+R60+0.5*S60 -> 25.31 | Q60: 11.53 | R60: 11.28 | S60: 5 | T60: =+U60+0.5*V60 -> 8.96 | U60: 6.96 | V60: 4 | W60: =+X60+Y60+0.5*Z60 -> 32.11 | X60: 6.64 | Y60: 22.47 | Z60: 6 | AA60: =+AB60+0.5*AC60 -> 25.32 | AB60: 24.32 | AC60: 2 | AD60: =+AE60+0.5*AF60 -> 21.45 | AE60: 21.45 | AF60: 0 | AG60: =+AH60+AI60+0.5*AJ60 -> 20.49 | AH60: 11.69 | AI60: 8.30 | AJ60: 1
A61: 3 | B61: Sexton, | C61: Mike | D61: SSP-EX | E61: =+G61+J61+M61+P61+T61+W61+AA61+AD61+AG61 -> 216.82 | F61: =+I61+L61+O61+S61+V61+Z61+AC61+AF61+AJ61 -> 44 | G61: =+H61+0.5*I61 -> 26.40 | H61: 25.90 | I61: 1 | J61: =+K61+0.5*L61 -> 16.27 | K61: 15.27 | L61: 2 | M61: =+N61+0.5*O61 -> 41.77 | N61: 33.77 | O61: 16 | P61: =+Q61+R61+0.5*S61 -> 22.62 | Q61: 11.99 | R61: 10.13 | S61: 1 | T61: =+U61+0.5*V61 -> 7.25 | U61: 6.25 | V61: 2 | W61: =+X61+Y61+0.5*Z61 -> 31.59 | X61: 6.05 | Y61: 19.04 | Z61: 13 | AA61: =+AB61+0.5*AC61 -> 25.63 | AB61: 24.63 | AC61: 2 | AD61: =+AE61+0.5*AF61 -> 26.87 | AE61: 23.87 | AF61: 6 | AG61: =+AH61+AI61+0.5*AJ61 -> 18.42 | AH61: 9.19 | AI61: 8.73 | AJ61: 1
A62: 4 | B62: Vilos, | C62: Mitch | D62: SSP-EX | E62: =+G62+J62+M62+P62+T62+W62+AA62+AD62+AG62 -> 222.62 | F62: =+I62+L62+O62+S62+V62+Z62+AC62+AF62+AJ62 -> 25 | G62: =+H62+0.5*I62 -> 26.16 | H62: 25.16 | I62: 2 | J62: =+K62+0.5*L62 -> 15.30 | K62: 15.30 | L62: 0 | M62: =+N62+0.5*O62 -> 31.32 | N62: 31.32 | O62: 0 | P62: =+Q62+R62+0.5*S62 -> 31.29 | Q62: 14.17 | R62: 12.62 | S62: 9 | T62: =+U62+0.5*V62 -> 16.61 | U62: 11.11 | V62: 11 | W62: =+X62+Y62+0.5*Z62 -> 26.00 | X62: 5.03 | Y62: 20.97 | Z62: 0 | AA62: =+AB62+0.5*AC62 -> 25.59 | AB62: 25.09 | AC62: 1 | AD62: =+AE62+0.5*AF62 -> 30.66 | AE62: 30.16 | AF62: 1 | AG62: =+AH62+AI62+0.5*AJ62 -> 19.69 | AH62: 10.92 | AI62: 8.27 | AJ62: 1
A63: 5 | B63: Richards, | C63: Dave | D63: SSP-EX | E63: =+G63+J63+M63+P63+T63+W63+AA63+AD63+AG63 -> 231.06 | F63: =+I63+L63+O63+S63+V63+Z63+AC63+AF63+AJ63 -> 53 | G63: =+H63+0.5*I63 -> 21.98 | H63: 21.48 | I63: 1 | J63: =+K63+0.5*L63 -> 28.51 | K63: 18.51 | L63: 20 | M63: =+N63+0.5*O63 -> 36.83 | N63: 28.83 | O63: 16 | P63: =+Q63+R63+0.5*S63 -> 28.34 | Q63: 15.28 | R63: 10.06 | S63: 6 | T63: =+U63+0.5*V63 -> 8.30 | U63: 7.80 | V63: 1 | W63: =+X63+Y63+0.5*Z63 -> 31.82 | X63: 5.40 | Y63: 23.92 | Z63: 5 | AA63: =+AB63+0.5*AC63 -> 30.29 | AB63: 29.79 | AC63: 1 | AD63: =+AE63+0.5*AF63 -> 20.22 | AE63: 19.72 | AF63: 1 | AG63: =+AH63+AI63+0.5*AJ63 -> 24.77 | AH63: 13.87 | AI63: 9.90 | AJ63: 2
A64: SSP-SS
B65: Torres | C65: Tony | D65: SSP-SS | E65: =+G65+J65+M65+P65+T65+W65+AA65+AD65+AG65 -> 0.00 | F65: =+I65+L65+O65+S65+V65+Z65+AC65+AF65+AJ65 -> 0 | G65: =+H65+0.5*I65 -> 0.00 | J65: =+K65+0.5*L65 -> 0.00 | M65: =+N65+0.5*O65 -> 0.00 | P65: =+Q65+R65+0.5*S65 -> 0.00 | T65: =+U65+0.5*V65 -> 0.00 | W65: =+X65+Y65+0.5*Z65 -> 0.00 | AA65: =+AB65+0.5*AC65 -> 0.00 | AD65: =+AE65+0.5*AF65 -> 0.00 | AG65: =+AH65+AI65+0.5*AJ65 -> 0.00
A66: 1 | B66: Roubinet, | C66: P. J. | D66: SSP-SS | E66: =+G66+J66+M66+P66+T66+W66+AA66+AD66+AG66 -> 224.93 | F66: =+I66+L66+O66+S66+V66+Z66+AC66+AF66+AJ66 -> 31 | G66: =+H66+0.5*I66 -> 28.16 | H66: 27.66 | I66: 1 | J66: =+K66+0.5*L66 -> 14.01 | K66: 12.01 | L66: 4 | M66: =+N66+0.5*O66 -> 40.68 | N66: 36.18 | O66: 9 | P66: =+Q66+R66+0.5*S66 -> 26.79 | Q66: 15.01 | R66: 11.28 | S66: 1 | T66: =+U66+0.5*V66 -> 9.76 | U66: 9.76 | V66: 0 | W66: =+X66+Y66+0.5*Z66 -> 31.12 | X66: 5.19 | Y66: 22.93 | Z66: 6 | AA66: =+AB66+0.5*AC66 -> 27.83 | AB66: 27.83 | AC66: 0 | AD66: =+AE66+0.5*AF66 -> 29.02 | AE66: 24.52 | AF66: 9 | AG66: =+AH66+AI66+0.5*AJ66 -> 17.56 | AH66: 9.97 | AI66: 7.09 | AJ66: 1
A67: 2 | B67: Mahoney, | C67: Joni | D67: SSP-SS | E67: =+G67+J67+M67+P67+T67+W67+AA67+AD67+AG67 -> 263.29 | F67: =+I67+L67+O67+S67+V67+Z67+AC67+AF67+AJ67 -> 62 | G67: =+H67+0.5*I67 -> 30.50 | H67: 29.50 | I67: 2 | J67: =+K67+0.5*L67 -> 19.13 | K67: 16.63 | L67: 5 | M67: =+N67+0.5*O67 -> 45.69 | N67: 40.19 | O67: 11 | P67: =+Q67+R67+0.5*S67 -> 27.80 | Q67: 13.63 | R67: 13.67 | S67: 1 | T67: =+U67+0.5*V67 -> 10.60 | U67: 9.10 | V67: 3 | W67: =+X67+Y67+0.5*Z67 -> 46.21 | X67: 5.31 | Y67: 27.90 | Z67: 26 | AA67: =+AB67+0.5*AC67 -> 31.83 | AB67: 27.33 | AC67: 9 | AD67: =+AE67+0.5*AF67 -> 29.26 | AE67: 26.76 | AF67: 5 | AG67: =+AH67+AI67+0.5*AJ67 -> 22.27 | AH67: 12.03 | AI67: 10.24 | AJ67: 0
A68: 3 | B68: Spicer, | C68: Richard | D68: SSP-SS | E68: =+G68+J68+M68+P68+T68+W68+AA68+AD68+AG68 -> 270.08 | F68: =+I68+L68+O68+S68+V68+Z68+AC68+AF68+AJ68 -> 30 | G68: =+H68+0.5*I68 -> 39.42 | H68: 38.92 | I68: 1 | J68: =+K68+0.5*L68 -> 21.68 | K68: 20.68 | L68: 2 | M68: =+N68+0.5*O68 -> 32.12 | N68: 30.62 | O68: 3 | P68: =+Q68+R68+0.5*S68 -> 29.15 | Q68: 15.78 | R68: 12.37 | S68: 2 | T68: =+U68+0.5*V68 -> 8.46 | U68: 8.46 | V68: 0 | W68: =+X68+Y68+0.5*Z68 -> 35.12 | X68: 6.26 | Y68: 25.36 | Z68: 7 | AA68: =+AB68+0.5*AC68 -> 37.32 | AB68: 30.82 | AC68: 13 | AD68: =+AE68+0.5*AF68 -> 42.98 | AE68: 41.98 | AF68: 2 | AG68: =+AH68+AI68+0.5*AJ68 -> 23.83 | AH68: 13.66 | AI68: 10.17 | AJ68: 0
A69: 4 | B69: Spicer, | C69: Robert L. | D69: SSP-SS | E69: =+G69+J69+M69+P69+T69+W69+AA69+AD69+AG69 -> 272.68 | F69: =+I69+L69+O69+S69+V69+Z69+AC69+AF69+AJ69 -> 56 | G69: =+H69+0.5*I69 -> 25.85 | H69: 25.85 | I69: 0 | J69: =+K69+0.5*L69 -> 21.50 | K69: 19.00 | L69: 5 | M69: =+N69+0.5*O69 -> 36.33 | N69: 34.33 | O69: 4 | P69: =+Q69+R69+0.5*S69 -> 56.89 | Q69: 31.56 | R69: 13.33 | S69: 24 | T69: =+U69+0.5*V69 -> 14.34 | U69: 9.84 | V69: 9 | W69: =+X69+Y69+0.5*Z69 -> 36.88 | X69: 6.24 | Y69: 29.14 | Z69: 3 | AA69: =+AB69+0.5*AC69 -> 27.27 | AB69: 26.27 | AC69: 2 | AD69: =+AE69+0.5*AF69 -> 29.35 | AE69: 29.35 | AF69: 0 | AG69: =+AH69+AI69+0.5*AJ69 -> 24.27 | AH69: 10.82 | AI69: 8.95 | AJ69: 9
A70: 5 | B70: Thomas, | C70: Kevin | D70: SSP-SS | E70: =+G70+J70+M70+P70+T70+W70+AA70+AD70+AG70 -> 273.21 | F70: =+I70+L70+O70+S70+V70+Z70+AC70+AF70+AJ70 -> 64 | G70: =+H70+0.5*I70 -> 50.26 | H70: 44.26 | I70: 12 | J70: =+K70+0.5*L70 -> 14.45 | K70: 13.95 | L70: 1 | M70: =+N70+0.5*O70 -> 59.30 | N70: 46.80 | O70: 25 | P70: =+Q70+R70+0.5*S70 -> 28.60 | Q70: 16.31 | R70: 9.29 | S70: 6 | T70: =+U70+0.5*V70 -> 9.16 | U70: 8.16 | V70: 2 | W70: =+X70+Y70+0.5*Z70 -> 30.03 | X70: 5.41 | Y70: 24.12 | Z70: 1 | AA70: =+AB70+0.5*AC70 -> 35.54 | AB70: 29.54 | AC70: 12 | AD70: =+AE70+0.5*AF70 -> 26.20 | AE70: 25.70 | AF70: 1 | AG70: =+AH70+AI70+0.5*AJ70 -> 19.67 | AH70: 9.81 | AI70: 7.86 | AJ70: 4
A71: 6 | B71: Jorgensen, | C71: John Q | D71: SSP-SS | E71: =+G71+J71+M71+P71+T71+W71+AA71+AD71+AG71 -> 276.42 | F71: =+I71+L71+O71+S71+V71+Z71+AC71+AF71+AJ71 -> 111 | G71: =+H71+0.5*I71 -> 27.98 | H71: 25.48 | I71: 5 | J71: =+K71+0.5*L71 -> 21.61 | K71: 20.11 | L71: 3 | M71: =+N71+0.5*O71 -> 42.83 | N71: 34.83 | O71: 16 | P71: =+Q71+R71+0.5*S71 -> 35.56 | Q71: 14.82 | R71: 13.24 | S71: 15 | T71: =+U71+0.5*V71 -> 10.29 | U71: 8.79 | V71: 3 | W71: =+X71+Y71+0.5*Z71 -> 38.98 | X71: 5.01 | Y71: 25.47 | Z71: 17 | AA71: =+AB71+0.5*AC71 -> 42.85 | AB71: 26.85 | AC71: 32 | AD71: =+AE71+0.5*AF71 -> 32.11 | AE71: 26.61 | AF71: 11 | AG71: =+AH71+AI71+0.5*AJ71 -> 24.21 | AH71: 11.74 | AI71: 7.97 | AJ71: 9
A72: 7 | B72: Andersen, | C72: Welden | D72: SSP-SS | E72: =+G72+J72+M72+P72+T72+W72+AA72+AD72+AG72 -> 280.23 | F72: =+I72+L72+O72+S72+V72+Z72+AC72+AF72+AJ72 -> 33 | G72: =+H72+0.5*I72 -> 33.50 | H72: 33.50 | I72: 0 | J72: =+K72+0.5*L72 -> 28.88 | K72: 28.38 | L72: 1 | M72: =+N72+0.5*O72 -> 50.23 | N72: 42.23 | O72: 16 | P72: =+Q72+R72+0.5*S72 -> 28.64 | Q72: 16.41 | R72: 12.23 | S72: 0 | T72: =+U72+0.5*V72 -> 11.39 | U72: 11.39 | V72: 0 | W72: =+X72+Y72+0.5*Z72 -> 41.24 | X72: 4.76 | Y72: 32.48 | Z72: 8 | AA72: =+AB72+0.5*AC72 -> 40.22 | AB72: 37.22 | AC72: 6 | AD72: =+AE72+0.5*AF72 -> 22.79 | AE72: 21.79 | AF72: 2 | AG72: =+AH72+AI72+0.5*AJ72 -> 23.34 | AH72: 14.29 | AI72: 9.05 | AJ72: 0
A73: 8 | B73: Nelson, | C73: John | D73: SSP-SS | E73: =+G73+J73+M73+P73+T73+W73+AA73+AD73+AG73 -> 280.75 | F73: =+I73+L73+O73+S73+V73+Z73+AC73+AF73+AJ73 -> 95 | G73: =+H73+0.5*I73 -> 38.74 | H73: 38.74 | I73: 0 | J73: =+K73+0.5*L73 -> 18.72 | K73: 17.22 | L73: 3 | M73: =+N73+0.5*O73 -> 34.75 | N73: 29.75 | O73: 10 | P73: =+Q73+R73+0.5*S73 -> 36.27 | Q73: 17.10 | R73: 15.17 | S73: 8 | T73: =+U73+0.5*V73 -> 36.98 | U73: 11.48 | V73: 51 | W73: =+X73+Y73+0.5*Z73 -> 36.66 | X73: 6.52 | Y73: 23.14 | Z73: 14 | AA73: =+AB73+0.5*AC73 -> 29.12 | AB73: 28.12 | AC73: 2 | AD73: =+AE73+0.5*AF73 -> 29.78 | AE73: 26.78 | AF73: 6 | AG73: =+AH73+AI73+0.5*AJ73 -> 19.73 | AH73: 10.76 | AI73: 8.47 | AJ73: 1
A74: 9 | B74: Bautista, | C74: Roy | D74: SSP-SS | E74: =+G74+J74+M74+P74+T74+W74+AA74+AD74+AG74 -> 282.48 | F74: =+I74+L74+O74+S74+V74+Z74+AC74+AF74+AJ74 -> 63 | G74: =+H74+0.5*I74 -> 32.53 | H74: 32.53 | I74: 0 | J74: =+K74+0.5*L74 -> 19.53 | K74: 19.53 | L74: 0 | M74: =+N74+0.5*O74 -> 62.09 | N74: 58.59 | O74: 7 | P74: =+Q74+R74+0.5*S74 -> 27.82 | Q74: 11.81 | R74: 12.51 | S74: 7 | T74: =+U74+0.5*V74 -> 12.68 | U74: 6.68 | V74: 12 | W74: =+X74+Y74+0.5*Z74 -> 34.36 | X74: 4.69 | Y74: 27.17 | Z74: 5 | AA74: =+AB74+0.5*AC74 -> 26.60 | AB74: 21.60 | AC74: 10 | AD74: =+AE74+0.5*AF74 -> 31.67 | AE74: 24.17 | AF74: 15 | AG74: =+AH74+AI74+0.5*AJ74 -> 35.20 | AH74: 15.53 | AI74: 16.17 | AJ74: 7
A75: 10 | B75: Wilkins, | C75: Lance | D75: SSP-SS | E75: =+G75+J75+M75+P75+T75+W75+AA75+AD75+AG75 -> 328.20 | F75: =+I75+L75+O75+S75+V75+Z75+AC75+AF75+AJ75 -> 116 | G75: =+H75+0.5*I75 -> 43.22 | H75: 43.22 | I75: 0 | J75: =+K75+0.5*L75 -> 22.83 | K75: 19.33 | L75: 7 | M75: =+N75+0.5*O75 -> 57.65 | N75: 35.15 | O75: 45 | P75: =+Q75+R75+0.5*S75 -> 31.18 | Q75: 17.43 | R75: 13.25 | S75: 1 | T75: =+U75+0.5*V75 -> 24.47 | U75: 8.97 | V75: 31 | W75: =+X75+Y75+0.5*Z75 -> 41.79 | X75: 5.60 | Y75: 28.19 | Z75: 16 | AA75: =+AB75+0.5*AC75 -> 36.58 | AB75: 33.58 | AC75: 6 | AD75: =+AE75+0.5*AF75 -> 48.69 | AE75: 44.19 | AF75: 9 | AG75: =+AH75+AI75+0.5*AJ75 -> 21.79 | AH75: 13.13 | AI75: 8.16 | AJ75: 1
A76: SSP-MM
B77: Keyser | C77: Travis | D77: SSP-MM | E77: =+G77+J77+M77+P77+T77+W77+AA77+AD77+AG77 -> 0.00 | F77: =+I77+L77+O77+S77+V77+Z77+AC77+AF77+AJ77 -> 0 | G77: =+H77+0.5*I77 -> 0.00 | J77: =+K77+0.5*L77 -> 0.00 | M77: =+N77+0.5*O77 -> 0.00 | P77: =+Q77+R77+0.5*S77 -> 0.00 | T77: =+U77+0.5*V77 -> 0.00 | W77: =+X77+Y77+0.5*Z77 -> 0.00 | AA77: =+AB77+0.5*AC77 -> 0.00 | AD77: =+AE77+0.5*AF77 -> 0.00 | AG77: =+AH77+AI77+0.5*AJ77 -> 0.00
B78: Konnick | C78: Ron | D78: SSP-MM | E78: =+G78+J78+M78+P78+T78+W78+AA78+AD78+AG78 -> 0.00 | F78: =+I78+L78+O78+S78+V78+Z78+AC78+AF78+AJ78 -> 0 | G78: =+H78+0.5*I78 -> 0.00 | J78: =+K78+0.5*L78 -> 0.00 | M78: =+N78+0.5*O78 -> 0.00 | P78: =+Q78+R78+0.5*S78 -> 0.00 | T78: =+U78+0.5*V78 -> 0.00 | W78: =+X78+Y78+0.5*Z78 -> 0.00 | AA78: =+AB78+0.5*AC78 -> 0.00 | AD78: =+AE78+0.5*AF78 -> 0.00 | AG78: =+AH78+AI78+0.5*AJ78 -> 0.00
A79: 1 | B79: Carlson, | C79: Paul | D79: SSP-MM | E79: =+G79+J79+M79+P79+T79+W79+AA79+AD79+AG79 -> 293.78 | F79: =+I79+L79+O79+S79+V79+Z79+AC79+AF79+AJ79 -> 73 | G79: =+H79+0.5*I79 -> 51.30 | H79: 48.30 | I79: 6 | J79: =+K79+0.5*L79 -> 17.69 | K79: 13.69 | L79: 8 | M79: =+N79+0.5*O79 -> 56.80 | N79: 53.80 | O79: 6 | P79: =+Q79+R79+0.5*S79 -> 31.94 | Q79: 16.18 | R79: 12.26 | S79: 7 | T79: =+U79+0.5*V79 -> 9.17 | U79: 8.17 | V79: 2 | W79: =+X79+Y79+0.5*Z79 -> 44.67 | X79: 4.08 | Y79: 28.59 | Z79: 24 | AA79: =+AB79+0.5*AC79 -> 30.12 | AB79: 26.62 | AC79: 7 | AD79: =+AE79+0.5*AF79 -> 31.28 | AE79: 25.28 | AF79: 12 | AG79: =+AH79+AI79+0.5*AJ79 -> 20.81 | AH79: 11.12 | AI79: 9.19 | AJ79: 1
A80: 2 | B80: Boyer, | C80: Stephen | D80: SSP-MM | E80: =+G80+J80+M80+P80+T80+W80+AA80+AD80+AG80 -> 297.82 | F80: =+I80+L80+O80+S80+V80+Z80+AC80+AF80+AJ80 -> 18 | G80: =+H80+0.5*I80 -> 34.38 | H80: 33.88 | I80: 1 | J80: =+K80+0.5*L80 -> 24.85 | K80: 24.35 | L80: 1 | M80: =+N80+0.5*O80 -> 51.71 | N80: 47.21 | O80: 9 | P80: =+Q80+R80+0.5*S80 -> 33.67 | Q80: 19.17 | R80: 14.50 | S80: 0 | T80: =+U80+0.5*V80 -> 9.97 | U80: 9.97 | V80: 0 | W80: =+X80+Y80+0.5*Z80 -> 40.44 | X80: 6.18 | Y80: 32.76 | Z80: 3 | AA80: =+AB80+0.5*AC80 -> 42.57 | AB80: 41.07 | AC80: 3 | AD80: =+AE80+0.5*AF80 -> 37.41 | AE80: 36.91 | AF80: 1 | AG80: =+AH80+AI80+0.5*AJ80 -> 22.82 | AH80: 12.41 | AI80: 10.41 | AJ80: 0
A81: 3 | B81: Maloy, | C81: Cory A. | D81: SSP-MM | E81: =+G81+J81+M81+P81+T81+W81+AA81+AD81+AG81 -> 305.14 | F81: =+I81+L81+O81+S81+V81+Z81+AC81+AF81+AJ81 -> 58 | G81: =+H81+0.5*I81 -> 27.95 | H81: 27.45 | I81: 1 | J81: =+K81+0.5*L81 -> 23.50 | K81: 22.00 | L81: 3 | M81: =+N81+0.5*O81 -> 53.26 | N81: 44.26 | O81: 18 | P81: =+Q81+R81+0.5*S81 -> 33.84 | Q81: 17.27 | R81: 15.57 | S81: 2 | T81: =+U81+0.5*V81 -> 13.07 | U81: 12.57 | V81: 1 | W81: =+X81+Y81+0.5*Z81 -> 41.21 | X81: 7.45 | Y81: 29.76 | Z81: 8 | AA81: =+AB81+0.5*AC81 -> 37.05 | AB81: 33.55 | AC81: 7 | AD81: =+AE81+0.5*AF81 -> 40.77 | AE81: 35.27 | AF81: 11 | AG81: =+AH81+AI81+0.5*AJ81 -> 34.49 | AH81: 16.18 | AI81: 14.81 | AJ81: 7
A82: 4 | B82: Jespersen, | C82: Chad | D82: SSP-MM | E82: =+G82+J82+M82+P82+T82+W82+AA82+AD82+AG82 -> 321.49 | F82: =+I82+L82+O82+S82+V82+Z82+AC82+AF82+AJ82 -> 83 | G82: =+H82+0.5*I82 -> 47.65 | H82: 46.65 | I82: 2 | J82: =+K82+0.5*L82 -> 27.12 | K82: 24.62 | L82: 5 | M82: =+N82+0.5*O82 -> 46.85 | N82: 46.35 | O82: 1 | P82: =+Q82+R82+0.5*S82 -> 43.14 | Q82: 16.48 | R82: 14.66 | S82: 24 | T82: =+U82+0.5*V82 -> 12.20 | U82: 12.20 | V82: 0 | W82: =+X82+Y82+0.5*Z82 -> 39.35 | X82: 7.75 | Y82: 30.10 | Z82: 3 | AA82: =+AB82+0.5*AC82 -> 42.90 | AB82: 31.40 | AC82: 23 | AD82: =+AE82+0.5*AF82 -> 35.82 | AE82: 23.32 | AF82: 25 | AG82: =+AH82+AI82+0.5*AJ82 -> 26.46 | AH82: 11.66 | AI82: 14.80 | AJ82: 0
A83: 5 | B83: Cosper, | C83: Chris | D83: SSP-MM | E83: =+G83+J83+M83+P83+T83+W83+AA83+AD83+AG83 -> 327.49 | F83: =+I83+L83+O83+S83+V83+Z83+AC83+AF83+AJ83 -> 71 | G83: =+H83+0.5*I83 -> 32.31 | H83: 31.81 | I83: 1 | J83: =+K83+0.5*L83 -> 22.86 | K83: 21.86 | L83: 2 | M83: =+N83+0.5*O83 -> 44.38 | N83: 34.88 | O83: 19 | P83: =+Q83+R83+0.5*S83 -> 31.76 | Q83: 14.25 | R83: 12.01 | S83: 11 | T83: =+U83+0.5*V83 -> 9.71 | U83: 9.21 | V83: 1 | W83: =+X83+Y83+0.5*Z83 -> 48.85 | X83: 12.34 | Y83: 29.51 | Z83: 14 | AA83: =+AB83+0.5*AC83 -> 37.79 | AB83: 37.29 | AC83: 1 | AD83: =+AE83+0.5*AF83 -> 70.96 | AE83: 62.96 | AF83: 16 | AG83: =+AH83+AI83+0.5*AJ83 -> 28.87 | AH83: 15.82 | AI83: 10.05 | AJ83: 6
A84: 6 | B84: Redford, | C84: Noel | D84: SSP-MM | E84: =+G84+J84+M84+P84+T84+W84+AA84+AD84+AG84 -> 329.16 | F84: =+I84+L84+O84+S84+V84+Z84+AC84+AF84+AJ84 -> 61 | G84: =+H84+0.5*I84 -> 35.31 | H84: 34.31 | I84: 2 | J84: =+K84+0.5*L84 -> 29.78 | K84: 26.78 | L84: 6 | M84: =+N84+0.5*O84 -> 54.84 | N84: 48.34 | O84: 13 | P84: =+Q84+R84+0.5*S84 -> 28.42 | Q84: 14.92 | R84: 12.50 | S84: 2 | T84: =+U84+0.5*V84 -> 15.07 | U84: 8.07 | V84: 14 | W84: =+X84+Y84+0.5*Z84 -> 47.23 | X84: 8.59 | Y84: 32.64 | Z84: 12 | AA84: =+AB84+0.5*AC84 -> 38.66 | AB84: 37.16 | AC84: 3 | AD84: =+AE84+0.5*AF84 -> 53.04 | AE84: 52.04 | AF84: 2 | AG84: =+AH84+AI84+0.5*AJ84 -> 26.81 | AH84: 11.72 | AI84: 11.59 | AJ84: 7
A85: 7 | B85: Huggins, | C85: Chip | D85: SSP-MM | E85: =+G85+J85+M85+P85+T85+W85+AA85+AD85+AG85 -> 329.84 | F85: =+I85+L85+O85+S85+V85+Z85+AC85+AF85+AJ85 -> 96 | G85: =+H85+0.5*I85 -> 27.69 | H85: 22.69 | I85: 10 | J85: =+K85+0.5*L85 -> 29.12 | K85: 21.12 | L85: 16 | M85: =+N85+0.5*O85 -> 55.26 | N85: 51.26 | O85: 8 | P85: =+Q85+R85+0.5*S85 -> 34.80 | Q85: 14.57 | R85: 12.73 | S85: 15 | T85: =+U85+0.5*V85 -> 15.59 | U85: 9.59 | V85: 12 | W85: =+X85+Y85+0.5*Z85 -> 55.89 | X85: 7.01 | Y85: 42.88 | Z85: 12 | AA85: =+AB85+0.5*AC85 -> 35.24 | AB85: 31.74 | AC85: 7 | AD85: =+AE85+0.5*AF85 -> 47.16 | AE85: 39.66 | AF85: 15 | AG85: =+AH85+AI85+0.5*AJ85 -> 29.09 | AH85: 15.78 | AI85: 12.81 | AJ85: 1
A86: 8 | B86: Roubinet, | C86: Paul | D86: SSP-MM | E86: =+G86+J86+M86+P86+T86+W86+AA86+AD86+AG86 -> 332.57 | F86: =+I86+L86+O86+S86+V86+Z86+AC86+AF86+AJ86 -> 27 | G86: =+H86+0.5*I86 -> 48.32 | H86: 47.32 | I86: 2 | J86: =+K86+0.5*L86 -> 22.26 | K86: 22.26 | L86: 0 | M86: =+N86+0.5*O86 -> 56.09 | N86: 54.59 | O86: 3 | P86: =+Q86+R86+0.5*S86 -> 46.30 | Q86: 21.59 | R86: 19.21 | S86: 11 | T86: =+U86+0.5*V86 -> 10.39 | U86: 10.39 | V86: 0 | W86: =+X86+Y86+0.5*Z86 -> 55.24 | X86: 6.88 | Y86: 45.86 | Z86: 5 | AA86: =+AB86+0.5*AC86 -> 38.57 | AB86: 38.07 | AC86: 1 | AD86: =+AE86+0.5*AF86 -> 34.58 | AE86: 33.58 | AF86: 2 | AG86: =+AH86+AI86+0.5*AJ86 -> 20.82 | AH86: 9.52 | AI86: 9.80 | AJ86: 3
A87: 9 | B87: Wimberly, | C87: Jeff | D87: SSP-MM | E87: =+G87+J87+M87+P87+T87+W87+AA87+AD87+AG87 -> 336.61 | F87: =+I87+L87+O87+S87+V87+Z87+AC87+AF87+AJ87 -> 53 | G87: =+H87+0.5*I87 -> 51.16 | H87: 50.66 | I87: 1 | J87: =+K87+0.5*L87 -> 23.35 | K87: 22.85 | L87: 1 | M87: =+N87+0.5*O87 -> 48.68 | N87: 41.68 | O87: 14 | P87: =+Q87+R87+0.5*S87 -> 56.58 | Q87: 18.22 | R87: 28.36 | S87: 20 | T87: =+U87+0.5*V87 -> 11.15 | U87: 10.15 | V87: 2 | W87: =+X87+Y87+0.5*Z87 -> 37.22 | X87: 6.37 | Y87: 29.35 | Z87: 3 | AA87: =+AB87+0.5*AC87 -> 41.38 | AB87: 41.38 | AC87: 0 | AD87: =+AE87+0.5*AF87 -> 36.94 | AE87: 32.94 | AF87: 8 | AG87: =+AH87+AI87+0.5*AJ87 -> 30.15 | AH87: 15.44 | AI87: 12.71 | AJ87: 4
A88: 10 | B88: Decker, | C88: Dennis | D88: SSP-MM | E88: =+G88+J88+M88+P88+T88+W88+AA88+AD88+AG88 -> 342.05 | F88: =+I88+L88+O88+S88+V88+Z88+AC88+AF88+AJ88 -> 64 | G88: =+H88+0.5*I88 -> 41.17 | H88: 41.17 | I88: 0 | J88: =+K88+0.5*L88 -> 24.47 | K88: 22.97 | L88: 3 | M88: =+N88+0.5*O88 -> 56.38 | N88: 43.38 | O88: 26 | P88: =+Q88+R88+0.5*S88 -> 43.46 | Q88: 19.17 | R88: 18.29 | S88: 12 | T88: =+U88+0.5*V88 -> 8.04 | U88: 8.04 | V88: 0 | W88: =+X88+Y88+0.5*Z88 -> 66.07 | X88: 6.43 | Y88: 54.14 | Z88: 11 | AA88: =+AB88+0.5*AC88 -> 50.48 | AB88: 46.98 | AC88: 7 | AD88: =+AE88+0.5*AF88 -> 27.47 | AE88: 24.97 | AF88: 5 | AG88: =+AH88+AI88+0.5*AJ88 -> 24.51 | AH88: 12.87 | AI88: 11.64 | AJ88: 0
A89: 11 | B89: Sterling, | C89: Scott | D89: SSP-MM | E89: =+G89+J89+M89+P89+T89+W89+AA89+AD89+AG89 -> 367.51 | F89: =+I89+L89+O89+S89+V89+Z89+AC89+AF89+AJ89 -> 17 | G89: =+H89+0.5*I89 -> 41.89 | H89: 41.89 | I89: 0 | J89: =+K89+0.5*L89 -> 28.21 | K89: 24.71 | L89: 7 | M89: =+N89+0.5*O89 -> 56.25 | N89: 54.25 | O89: 4 | P89: =+Q89+R89+0.5*S89 -> 56.60 | Q89: 21.79 | R89: 33.31 | S89: 3 | T89: =+U89+0.5*V89 -> 9.39 | U89: 9.39 | V89: 0 | W89: =+X89+Y89+0.5*Z89 -> 50.16 | X89: 9.34 | Y89: 40.82 | Z89: 0 | AA89: =+AB89+0.5*AC89 -> 49.87 | AB89: 49.87 | AC89: 0 | AD89: =+AE89+0.5*AF89 -> 46.41 | AE89: 45.91 | AF89: 1 | AG89: =+AH89+AI89+0.5*AJ89 -> 28.73 | AH89: 14.74 | AI89: 12.99 | AJ89: 2
A90: 12 | B90: Bier, | C90: Gabriel | D90: SSP-MM | E90: DQ | F90: DQ | G90: =+H90+0.5*I90 -> 36.47 | H90: 34.97 | I90: 3 | J90: =+K90+0.5*L90 -> 25.62 | K90: 24.62 | L90: 2 | M90: =+N90+0.5*O90 -> 43.93 | N90: 42.43 | O90: 3 | P90: =+Q90+R90+0.5*S90 -> 41.51 | Q90: 20.76 | R90: 19.25 | S90: 3 | T90: =+U90+0.5*V90 -> 18.05 | U90: 17.05 | V90: 2 | W90: DQ | X90: 8.17 | AA90: =+AB90+0.5*AC90 -> 0.00 | AD90: =+AE90+0.5*AF90 -> 0.00 | AG90: =+AH90+AI90+0.5*AJ90 -> 0.00
A91: SSP-NV
A92: 1 | B92: Allen, | C92: Susan M. | D92: SSP-NV | E92: =+G92+J92+M92+P92+T92+W92+AA92+AD92+AG92 -> 386.22 | F92: =+I92+L92+O92+S92+V92+Z92+AC92+AF92+AJ92 -> 100 | G92: =+H92+0.5*I92 -> 46.62 | H92: 45.62 | I92: 2 | J92: =+K92+0.5*L92 -> 33.70 | K92: 31.20 | L92: 5 | M92: =+N92+0.5*O92 -> 56.47 | N92: 40.47 | O92: 32 | P92: =+Q92+R92+0.5*S92 -> 46.21 | Q92: 23.19 | R92: 19.52 | S92: 7 | T92: =+U92+0.5*V92 -> 19.62 | U92: 11.12 | V92: 17 | W92: =+X92+Y92+0.5*Z92 -> 62.64 | X92: 10.61 | Y92: 42.53 | Z92: 19 | AA92: =+AB92+0.5*AC92 -> 41.13 | AB92: 36.63 | AC92: 9 | AD92: =+AE92+0.5*AF92 -> 45.11 | AE92: 44.11 | AF92: 2 | AG92: =+AH92+AI92+0.5*AJ92 -> 34.72 | AH92: 15.05 | AI92: 16.17 | AJ92: 7
A93: SSR-EX
A94: 1 | B94: Mousley, | C94: Roger | D94: SSR-EX | E94: =+G94+J94+M94+P94+T94+W94+AA94+AD94+AG94 -> 253.35 | F94: =+I94+L94+O94+S94+V94+Z94+AC94+AF94+AJ94 -> 26 | G94: =+H94+0.5*I94 -> 29.61 | H94: 29.11 | I94: 1 | J94: =+K94+0.5*L94 -> 19.24 | K94: 15.74 | L94: 7 | M94: =+N94+0.5*O94 -> 42.55 | N94: 40.55 | O94: 4 | P94: =+Q94+R94+0.5*S94 -> 25.80 | Q94: 13.51 | R94: 11.79 | S94: 1 | T94: =+U94+0.5*V94 -> 8.35 | U94: 7.85 | V94: 1 | W94: =+X94+Y94+0.5*Z94 -> 45.44 | X94: 5.12 | Y94: 35.82 | Z94: 9 | AA94: =+AB94+0.5*AC94 -> 32.65 | AB94: 32.15 | AC94: 1 | AD94: =+AE94+0.5*AF94 -> 22.29 | AE94: 22.29 | AF94: 0 | AG94: =+AH94+AI94+0.5*AJ94 -> 27.42 | AH94: 11.97 | AI94: 14.45 | AJ94: 2
A95: 2 | B95: Veldboon, | C95: Terry | D95: SSR-EX | E95: =+G95+J95+M95+P95+T95+W95+AA95+AD95+AG95 -> 275.41 | F95: =+I95+L95+O95+S95+V95+Z95+AC95+AF95+AJ95 -> 33 | G95: =+H95+0.5*I95 -> 29.02 | H95: 28.02 | I95: 2 | J95: =+K95+0.5*L95 -> 28.13 | K95: 28.13 | L95: 0 | M95: =+N95+0.5*O95 -> 38.13 | N95: 33.13 | O95: 10 | P95: =+Q95+R95+0.5*S95 -> 29.56 | Q95: 16.13 | R95: 12.43 | S95: 2 | T95: =+U95+0.5*V95 -> 8.00 | U95: 7.50 | V95: 1 | W95: =+X95+Y95+0.5*Z95 -> 42.10 | X95: 5.42 | Y95: 34.68 | Z95: 4 | AA95: =+AB95+0.5*AC95 -> 42.98 | AB95: 37.48 | AC95: 11 | AD95: =+AE95+0.5*AF95 -> 24.72 | AE95: 24.72 | AF95: 0 | AG95: =+AH95+AI95+0.5*AJ95 -> 32.77 | AH95: 15.72 | AI95: 15.55 | AJ95: 3
A96: SSR-SS
A97: 1 | B97: Carter, | C97: Theo | D97: SSR-SS | E97: =+G97+J97+M97+P97+T97+W97+AA97+AD97+AG97 -> 266.02 | F97: =+I97+L97+O97+S97+V97+Z97+AC97+AF97+AJ97 -> 49 | G97: =+H97+0.5*I97 -> 28.38 | H97: 27.88 | I97: 1 | J97: =+K97+0.5*L97 -> 17.68 | K97: 15.18 | L97: 5 | M97: =+N97+0.5*O97 -> 42.41 | N97: 32.91 | O97: 19 | P97: =+Q97+R97+0.5*S97 -> 27.23 | Q97: 13.00 | R97: 11.73 | S97: 5 | T97: =+U97+0.5*V97 -> 7.38 | U97: 6.88 | V97: 1 | W97: =+X97+Y97+0.5*Z97 -> 45.92 | X97: 5.41 | Y97: 38.01 | Z97: 5 | AA97: =+AB97+0.5*AC97 -> 38.97 | AB97: 37.97 | AC97: 2 | AD97: =+AE97+0.5*AF97 -> 28.88 | AE97: 26.38 | AF97: 5 | AG97: =+AH97+AI97+0.5*AJ97 -> 29.17 | AH97: 13.07 | AI97: 13.10 | AJ97: 6
A98: 2 | B98: Mingo, | C98: John | D98: SSR-SS | E98: =+G98+J98+M98+P98+T98+W98+AA98+AD98+AG98 -> 298.90 | F98: =+I98+L98+O98+S98+V98+Z98+AC98+AF98+AJ98 -> 47 | G98: =+H98+0.5*I98 -> 44.22 | H98: 42.72 | I98: 3 | J98: =+K98+0.5*L98 -> 20.50 | K98: 18.50 | L98: 4 | M98: =+N98+0.5*O98 -> 40.94 | N98: 30.94 | O98: 20 | P98: =+Q98+R98+0.5*S98 -> 28.42 | Q98: 13.02 | R98: 12.40 | S98: 6 | T98: =+U98+0.5*V98 -> 11.40 | U98: 10.90 | V98: 1 | W98: =+X98+Y98+0.5*Z98 -> 48.52 | X98: 6.53 | Y98: 41.49 | Z98: 1 | AA98: =+AB98+0.5*AC98 -> 46.80 | AB98: 43.30 | AC98: 7 | AD98: =+AE98+0.5*AF98 -> 28.55 | AE98: 26.05 | AF98: 5 | AG98: =+AH98+AI98+0.5*AJ98 -> 29.55 | AH98: 15.63 | AI98: 13.92 | AJ98: 0
A99: 3 | B99: Beckham, | C99: Scott | D99: SSR-SS | E99: =+G99+J99+M99+P99+T99+W99+AA99+AD99+AG99 -> 317.43 | F99: =+I99+L99+O99+S99+V99+Z99+AC99+AF99+AJ99 -> 38 | G99: =+H99+0.5*I99 -> 34.03 | H99: 32.03 | I99: 4 | J99: =+K99+0.5*L99 -> 20.31 | K99: 19.81 | L99: 1 | M99: =+N99+0.5*O99 -> 54.10 | N99: 53.10 | O99: 2 | P99: =+Q99+R99+0.5*S99 -> 35.14 | Q99: 18.14 | R99: 13.50 | S99: 7 | T99: =+U99+0.5*V99 -> 10.72 | U99: 8.22 | V99: 5 | W99: =+X99+Y99+0.5*Z99 -> 53.60 | X99: 5.80 | Y99: 42.30 | Z99: 11 | AA99: =+AB99+0.5*AC99 -> 39.61 | AB99: 38.11 | AC99: 3 | AD99: =+AE99+0.5*AF99 -> 35.39 | AE99: 33.89 | AF99: 3 | AG99: =+AH99+AI99+0.5*AJ99 -> 34.53 | AH99: 19.36 | AI99: 14.17 | AJ99: 2
B100: Redford | C100: Red | D100: SSR-SS | E100: =+G100+J100+M100+P100+T100+W100+AA100+AD100+AG100 -> 0.00 | F100: =+I100+L100+O100+S100+V100+Z100+AC100+AF100+AJ100 -> 0 | G100: =+H100+0.5*I100 -> 0.00 | J100: =+K100+0.5*L100 -> 0.00 | M100: =+N100+0.5*O100 -> 0.00 | P100: =+Q100+R100+0.5*S100 -> 0.00 | T100: =+U100+0.5*V100 -> 0.00 | W100: =+X100+Y100+0.5*Z100 -> 0.00 | AA100: =+AB100+0.5*AC100 -> 0.00 | AD100: =+AE100+0.5*AF100 -> 0.00 | AG100: =+AH100+AI100+0.5*AJ100 -> 0.00
B103: Daly | C103: Jay | E103: =+G103+J103+M103+P103+T103+W103+AA103+AD103+AG103 -> 0.00 | F103: =+I103+L103+O103+S103+V103+Z103+AC103+AF103+AJ103 -> 0 | G103: =+H103+0.5*I103 -> 0.00 | J103: =+K103+0.5*L103 -> 0.00 | M103: =+N103+0.5*O103 -> 0.00 | P103: =+Q103+R103+0.5*S103 -> 0.00 | T103: =+U103+0.5*V103 -> 0.00 | W103: =+X103+Y103+0.5*Z103 -> 0.00 | AA103: =+AB103+0.5*AC103 -> 0.00 | AD103: =+AE103+0.5*AF103 -> 0.00 | AG103: =+AH103+AI103+0.5*AJ103 -> 0.00
B104: McClure | C104: Doug | E104: =+G104+J104+M104+P104+T104+W104+AA104+AD104+AG104 -> 0.00 | F104: =+I104+L104+O104+S104+V104+Z104+AC104+AF104+AJ104 -> 0 | G104: =+H104+0.5*I104 -> 0.00 | J104: =+K104+0.5*L104 -> 0.00 | M104: =+N104+0.5*O104 -> 0.00 | P104: =+Q104+R104+0.5*S104 -> 0.00 | T104: =+U104+0.5*V104 -> 0.00 | W104: =+X104+Y104+0.5*Z104 -> 0.00 | AA104: =+AB104+0.5*AC104 -> 0.00 | AD104: =+AE104+0.5*AF104 -> 0.00 | AG104: =+AH104+AI104+0.5*AJ104 -> 0.00
A106: Legend/Notes:
A107: X | B107: = Shooters who received trophies for their specific Division/Classification.
A108: Xx Xx | B108: = Shooters who acted as SOs or were part of the Match Staff.
A109: DQ | B109: = Shooter was disqualified for some reason.
A110: XX | B110: = Points Down value included some sore of penalty (Procedural, Hit On Non-threat, Failure to Neutralize, etc.)
A111: XXX.XX | B111: = Because these shooters took 1st place in their specific Div/Class and there were more than 10 shooters competing in their classification, they were automatically advanced to the next highest classification.
B113: All of the individual scores were verified on 9/16/03. Some corrections may have resulted in minor placing changes, but none affected the final trophy winning results.