A2: Utah State IDPA Match - 2003 Results | H2: (Sorted by Division without regard for Classification.)
B3: Held on September 13, 2003 | G3: 1 | J3: 2 | M3: 3 | P3: 4 | T3: 5 | W3: 6 | AA3: 7 | AD3: 8 | AG3: 9
A4: Place | B4: Name (Last, First) | D4: (Div-Class) | E4: Shoot Total | F4: Total PD | G4: Stage 1 | H4: String 1 | I4: Points Down | J4: Stage 2 | K4: String 1 | L4: Points Down | M4: Stage 3 | N4: String 1 | O4: Points Down | P4: Stage 4 | Q4: String 1 | R4: String 2 | S4: Points Down | T4: Stage 5 | U4: String 1 | V4: Points Down | W4: Stage 6 | X4: String 1 | Y4: String 2 | Z4: Points Down | AA4: Stage 7 | AB4: String 1 | AC4: Points Down | AD4: Stage 8 | AE4: String 1 | AF4: Points Down | AG4: Stage 9 | AH4: String 1 | AI4: String 2 | AJ4: Points Down
A5: CDP-
A6: 1 | B6: Tran, | C6: Hung | D6: CDP-SS | E6: =+G6+J6+M6+P6+T6+W6+AA6+AD6+AG6 -> 175.80 | F6: =+I6+L6+O6+S6+V6+Z6+AC6+AF6+AJ6 -> 63 | G6: =+H6+0.5*I6 -> 21.80 | H6: 20.30 | I6: 3 | J6: =+K6+0.5*L6 -> 14.91 | K6: 10.41 | L6: 9 | M6: =+N6+0.5*O6 -> 30.56 | N6: 24.56 | O6: 12 | P6: =+Q6+R6+0.5*S6 -> 20.09 | Q6: 9.40 | R6: 7.69 | S6: 6 | T6: =+U6+0.5*V6 -> 9.10 | U6: 7.10 | V6: 4 | W6: =+X6+Y6+0.5*Z6 -> 23.34 | X6: 3.60 | Y6: 17.24 | Z6: 5 | AA6: =+AB6+0.5*AC6 -> 20.21 | AB6: 14.71 | AC6: 11 | AD6: =+AE6+0.5*AF6 -> 17.94 | AE6: 16.94 | AF6: 2 | AG6: =+AH6+AI6+0.5*AJ6 -> 17.85 | AH6: 7.28 | AI6: 5.07 | AJ6: 11
A7: 2 | B7: Latham, | C7: Cory | D7: CDP-EX | E7: =+G7+J7+M7+P7+T7+W7+AA7+AD7+AG7 -> 178.65 | F7: =+I7+L7+O7+S7+V7+Z7+AC7+AF7+AJ7 -> 28 | G7: =+H7+0.5*I7 -> 22.46 | H7: 21.46 | I7: 2 | J7: =+K7+0.5*L7 -> 16.71 | K7: 15.71 | L7: 2 | M7: =+N7+0.5*O7 -> 24.78 | N7: 21.78 | O7: 6 | P7: =+Q7+R7+0.5*S7 -> 21.88 | Q7: 10.98 | R7: 8.40 | S7: 5 | T7: =+U7+0.5*V7 -> 8.68 | U7: 8.18 | V7: 1 | W7: =+X7+Y7+0.5*Z7 -> 27.49 | X7: 4.46 | Y7: 20.03 | Z7: 6 | AA7: =+AB7+0.5*AC7 -> 20.18 | AB7: 20.18 | AC7: 0 | AD7: =+AE7+0.5*AF7 -> 21.47 | AE7: 18.47 | AF7: 6 | AG7: =+AH7+AI7+0.5*AJ7 -> 15.00 | AH7: 8.26 | AI7: 6.74 | AJ7: 0
A8: 3 | B8: Griffiths, | C8: Todd | D8: CDP-EX | E8: =+G8+J8+M8+P8+T8+W8+AA8+AD8+AG8 -> 187.80 | F8: =+I8+L8+O8+S8+V8+Z8+AC8+AF8+AJ8 -> 38 | G8: =+H8+0.5*I8 -> 20.06 | H8: 17.56 | I8: 5 | J8: =+K8+0.5*L8 -> 15.44 | K8: 14.94 | L8: 1 | M8: =+N8+0.5*O8 -> 30.12 | N8: 27.62 | O8: 5 | P8: =+Q8+R8+0.5*S8 -> 20.76 | Q8: 10.45 | R8: 9.31 | S8: 2 | T8: =+U8+0.5*V8 -> 7.49 | U8: 6.99 | V8: 1 | W8: =+X8+Y8+0.5*Z8 -> 36.06 | X8: 3.99 | Y8: 29.57 | Z8: 5 | AA8: =+AB8+0.5*AC8 -> 20.70 | AB8: 18.70 | AC8: 4 | AD8: =+AE8+0.5*AF8 -> 20.96 | AE8: 14.46 | AF8: 13 | AG8: =+AH8+AI8+0.5*AJ8 -> 16.21 | AH8: 8.29 | AI8: 6.92 | AJ8: 2
A9: 4 | B9: Theodore, | C9: Ari | D9: CDP-EX | E9: =+G9+J9+M9+P9+T9+W9+AA9+AD9+AG9 -> 195.27 | F9: =+I9+L9+O9+S9+V9+Z9+AC9+AF9+AJ9 -> 33 | G9: =+H9+0.5*I9 -> 22.13 | H9: 21.13 | I9: 2 | J9: =+K9+0.5*L9 -> 14.06 | K9: 14.06 | L9: 0 | M9: =+N9+0.5*O9 -> 35.45 | N9: 32.45 | O9: 6 | P9: =+Q9+R9+0.5*S9 -> 25.05 | Q9: 12.60 | R9: 10.95 | S9: 3 | T9: =+U9+0.5*V9 -> 8.77 | U9: 6.77 | V9: 4 | W9: =+X9+Y9+0.5*Z9 -> 30.84 | X9: 4.69 | Y9: 22.15 | Z9: 8 | AA9: =+AB9+0.5*AC9 -> 19.56 | AB9: 19.06 | AC9: 1 | AD9: =+AE9+0.5*AF9 -> 22.31 | AE9: 18.81 | AF9: 7 | AG9: =+AH9+AI9+0.5*AJ9 -> 17.10 | AH9: 9.94 | AI9: 6.16 | AJ9: 2
A10: 5 | B10: Lepley, | C10: Alex | D10: CDP-EX | E10: =+G10+J10+M10+P10+T10+W10+AA10+AD10+AG10 -> 196.99 | F10: =+I10+L10+O10+S10+V10+Z10+AC10+AF10+AJ10 -> 29 | G10: =+H10+0.5*I10 -> 19.76 | H10: 19.26 | I10: 1 | J10: =+K10+0.5*L10 -> 17.21 | K10: 14.21 | L10: 6 | M10: =+N10+0.5*O10 -> 30.53 | N10: 28.53 | O10: 4 | P10: =+Q10+R10+0.5*S10 -> 24.03 | Q10: 12.88 | R10: 9.15 | S10: 4 | T10: =+U10+0.5*V10 -> 8.94 | U10: 7.94 | V10: 2 | W10: =+X10+Y10+0.5*Z10 -> 28.94 | X10: 4.66 | Y10: 21.78 | Z10: 5 | AA10: =+AB10+0.5*AC10 -> 22.80 | AB10: 21.80 | AC10: 2 | AD10: =+AE10+0.5*AF10 -> 24.91 | AE10: 22.91 | AF10: 4 | AG10: =+AH10+AI10+0.5*AJ10 -> 19.87 | AH10: 9.42 | AI10: 9.95 | AJ10: 1
A11: 6 | B11: Ward, | C11: Dan | D11: CDP-EX | E11: =+G11+J11+M11+P11+T11+W11+AA11+AD11+AG11 -> 203.31 | F11: =+I11+L11+O11+S11+V11+Z11+AC11+AF11+AJ11 -> 34 | G11: =+H11+0.5*I11 -> 24.05 | H11: 23.05 | I11: 2 | J11: =+K11+0.5*L11 -> 15.84 | K11: 14.34 | L11: 3 | M11: =+N11+0.5*O11 -> 30.81 | N11: 28.31 | O11: 5 | P11: =+Q11+R11+0.5*S11 -> 23.66 | Q11: 10.63 | R11: 10.03 | S11: 6 | T11: =+U11+0.5*V11 -> 9.80 | U11: 8.30 | V11: 3 | W11: =+X11+Y11+0.5*Z11 -> 31.03 | X11: 5.48 | Y11: 24.55 | Z11: 2 | AA11: =+AB11+0.5*AC11 -> 25.47 | AB11: 19.97 | AC11: 11 | AD11: =+AE11+0.5*AF11 -> 23.79 | AE11: 22.79 | AF11: 2 | AG11: =+AH11+AI11+0.5*AJ11 -> 18.86 | AH11: 11.81 | AI11: 7.05 | AJ11: 0
A12: 7 | B12: Watson, | C12: Steven | D12: CDP-EX | E12: =+G12+J12+M12+P12+T12+W12+AA12+AD12+AG12 -> 216.46 | F12: =+I12+L12+O12+S12+V12+Z12+AC12+AF12+AJ12 -> 32 | G12: =+H12+0.5*I12 -> 26.66 | H12: 26.16 | I12: 1 | J12: =+K12+0.5*L12 -> 18.61 | K12: 17.61 | L12: 2 | M12: =+N12+0.5*O12 -> 32.81 | N12: 26.81 | O12: 12 | P12: =+Q12+R12+0.5*S12 -> 25.60 | Q12: 13.38 | R12: 9.72 | S12: 5 | T12: =+U12+0.5*V12 -> 6.41 | U12: 6.41 | V12: 0 | W12: =+X12+Y12+0.5*Z12 -> 40.83 | X12: 4.14 | Y12: 35.69 | Z12: 2 | AA12: =+AB12+0.5*AC12 -> 22.09 | AB12: 21.59 | AC12: 1 | AD12: =+AE12+0.5*AF12 -> 27.28 | AE12: 23.28 | AF12: 8 | AG12: =+AH12+AI12+0.5*AJ12 -> 16.17 | AH12: 8.42 | AI12: 7.25 | AJ12: 1
A13: 8 | B13: Correia, | C13: Larry | D13: CDP-SS | E13: =+G13+J13+M13+P13+T13+W13+AA13+AD13+AG13 -> 235.69 | F13: =+I13+L13+O13+S13+V13+Z13+AC13+AF13+AJ13 -> 79 | G13: =+H13+0.5*I13 -> 31.72 | H13: 28.22 | I13: 7 | J13: =+K13+0.5*L13 -> 19.87 | K13: 15.87 | L13: 8 | M13: =+N13+0.5*O13 -> 27.05 | N13: 26.05 | O13: 2 | P13: =+Q13+R13+0.5*S13 -> 24.96 | Q13: 8.60 | R13: 10.86 | S13: 11 | T13: =+U13+0.5*V13 -> 8.53 | U13: 6.53 | V13: 4 | W13: =+X13+Y13+0.5*Z13 -> 35.23 | X13: 5.07 | Y13: 24.66 | Z13: 11 | AA13: =+AB13+0.5*AC13 -> 34.49 | AB13: 24.99 | AC13: 19 | AD13: =+AE13+0.5*AF13 -> 32.39 | AE13: 24.89 | AF13: 15 | AG13: =+AH13+AI13+0.5*AJ13 -> 21.45 | AH13: 11.98 | AI13: 8.47 | AJ13: 2
A14: 9 | B14: Haslem, | C14: Alan | D14: CDP-EX | E14: =+G14+J14+M14+P14+T14+W14+AA14+AD14+AG14 -> 239.20 | F14: =+I14+L14+O14+S14+V14+Z14+AC14+AF14+AJ14 -> 15 | G14: =+H14+0.5*I14 -> 26.35 | H14: 24.85 | I14: 3 | J14: =+K14+0.5*L14 -> 18.40 | K14: 17.90 | L14: 1 | M14: =+N14+0.5*O14 -> 35.73 | N14: 35.23 | O14: 1 | P14: =+Q14+R14+0.5*S14 -> 28.02 | Q14: 14.83 | R14: 13.19 | S14: 0 | T14: =+U14+0.5*V14 -> 19.54 | U14: 17.54 | V14: 4 | W14: =+X14+Y14+0.5*Z14 -> 35.19 | X14: 5.68 | Y14: 29.01 | Z14: 1 | AA14: =+AB14+0.5*AC14 -> 29.97 | AB14: 28.97 | AC14: 2 | AD14: =+AE14+0.5*AF14 -> 27.67 | AE14: 27.17 | AF14: 1 | AG14: =+AH14+AI14+0.5*AJ14 -> 18.33 | AH14: 9.50 | AI14: 7.83 | AJ14: 2
A15: 10 | B15: Coleman, | C15: Steve | D15: CDP-SS | E15: =+G15+J15+M15+P15+T15+W15+AA15+AD15+AG15 -> 244.33 | F15: =+I15+L15+O15+S15+V15+Z15+AC15+AF15+AJ15 -> 48 | G15: =+H15+0.5*I15 -> 22.81 | H15: 22.31 | I15: 1 | J15: =+K15+0.5*L15 -> 19.88 | K15: 15.88 | L15: 8 | M15: =+N15+0.5*O15 -> 44.37 | N15: 37.87 | O15: 13 | P15: =+Q15+R15+0.5*S15 -> 24.15 | Q15: 12.94 | R15: 10.21 | S15: 2 | T15: =+U15+0.5*V15 -> 8.68 | U15: 8.68 | V15: 0 | W15: =+X15+Y15+0.5*Z15 -> 37.58 | X15: 6.02 | Y15: 23.56 | Z15: 16 | AA15: =+AB15+0.5*AC15 -> 37.62 | AB15: 37.12 | AC15: 1 | AD15: =+AE15+0.5*AF15 -> 30.90 | AE15: 27.90 | AF15: 6 | AG15: =+AH15+AI15+0.5*AJ15 -> 18.34 | AH15: 10.55 | AI15: 7.29 | AJ15: 1
A16: 11 | B16: Haslem, | C16: Kent | D16: CDP-SS | E16: =+G16+J16+M16+P16+T16+W16+AA16+AD16+AG16 -> 250.57 | F16: =+I16+L16+O16+S16+V16+Z16+AC16+AF16+AJ16 -> 33 | G16: =+H16+0.5*I16 -> 24.14 | H16: 23.14 | I16: 2 | J16: =+K16+0.5*L16 -> 19.39 | K16: 18.89 | L16: 1 | M16: =+N16+0.5*O16 -> 39.73 | N16: 35.23 | O16: 9 | P16: =+Q16+R16+0.5*S16 -> 31.90 | Q16: 15.72 | R16: 15.68 | S16: 1 | T16: =+U16+0.5*V16 -> 6.64 | U16: 6.14 | V16: 1 | W16: =+X16+Y16+0.5*Z16 -> 44.08 | X16: 5.33 | Y16: 32.75 | Z16: 12 | AA16: =+AB16+0.5*AC16 -> 33.49 | AB16: 30.99 | AC16: 5 | AD16: =+AE16+0.5*AF16 -> 28.58 | AE16: 28.08 | AF16: 1 | AG16: =+AH16+AI16+0.5*AJ16 -> 22.62 | AH16: 12.18 | AI16: 9.94 | AJ16: 1
A17: 12 | B17: Smith, | C17: Burton | D17: CDP-SS | E17: =+G17+J17+M17+P17+T17+W17+AA17+AD17+AG17 -> 257.46 | F17: =+I17+L17+O17+S17+V17+Z17+AC17+AF17+AJ17 -> 49 | G17: =+H17+0.5*I17 -> 32.50 | H17: 31.00 | I17: 3 | J17: =+K17+0.5*L17 -> 25.62 | K17: 22.12 | L17: 7 | M17: =+N17+0.5*O17 -> 44.03 | N17: 36.03 | O17: 16 | P17: =+Q17+R17+0.5*S17 -> 30.16 | Q17: 16.08 | R17: 13.08 | S17: 2 | T17: =+U17+0.5*V17 -> 7.40 | U17: 6.40 | V17: 2 | W17: =+X17+Y17+0.5*Z17 -> 39.84 | X17: 4.99 | Y17: 32.85 | Z17: 4 | AA17: =+AB17+0.5*AC17 -> 24.56 | AB17: 24.06 | AC17: 1 | AD17: =+AE17+0.5*AF17 -> 32.52 | AE17: 28.52 | AF17: 8 | AG17: =+AH17+AI17+0.5*AJ17 -> 20.83 | AH17: 9.97 | AI17: 7.86 | AJ17: 6
A18: 13 | B18: Porter, | C18: Alma | D18: CDP-SS | E18: =+G18+J18+M18+P18+T18+W18+AA18+AD18+AG18 -> 265.09 | F18: =+I18+L18+O18+S18+V18+Z18+AC18+AF18+AJ18 -> 54 | G18: =+H18+0.5*I18 -> 34.21 | H18: 33.71 | I18: 1 | J18: =+K18+0.5*L18 -> 17.71 | K18: 17.71 | L18: 0 | M18: =+N18+0.5*O18 -> 48.37 | N18: 39.37 | O18: 18 | P18: =+Q18+R18+0.5*S18 -> 31.82 | Q18: 16.35 | R18: 13.97 | S18: 3 | T18: =+U18+0.5*V18 -> 12.62 | U18: 9.12 | V18: 7 | W18: =+X18+Y18+0.5*Z18 -> 40.10 | X18: 4.63 | Y18: 27.97 | Z18: 15 | AA18: =+AB18+0.5*AC18 -> 28.33 | AB18: 24.33 | AC18: 8 | AD18: =+AE18+0.5*AF18 -> 30.14 | AE18: 29.64 | AF18: 1 | AG18: =+AH18+AI18+0.5*AJ18 -> 21.79 | AH18: 11.56 | AI18: 9.73 | AJ18: 1
A19: 14 | B19: Berry, | C19: Robert | D19: CDP-SS | E19: =+G19+J19+M19+P19+T19+W19+AA19+AD19+AG19 -> 266.49 | F19: =+I19+L19+O19+S19+V19+Z19+AC19+AF19+AJ19 -> 28 | G19: =+H19+0.5*I19 -> 42.10 | H19: 42.10 | I19: 0 | J19: =+K19+0.5*L19 -> 26.16 | K19: 23.16 | L19: 6 | M19: =+N19+0.5*O19 -> 39.37 | N19: 35.87 | O19: 7 | P19: =+Q19+R19+0.5*S19 -> 29.21 | Q19: 12.58 | R19: 15.13 | S19: 3 | T19: =+U19+0.5*V19 -> 10.76 | U19: 10.76 | V19: 0 | W19: =+X19+Y19+0.5*Z19 -> 41.19 | X19: 6.19 | Y19: 34.50 | Z19: 1 | AA19: =+AB19+0.5*AC19 -> 25.01 | AB19: 24.51 | AC19: 1 | AD19: =+AE19+0.5*AF19 -> 29.31 | AE19: 25.31 | AF19: 8 | AG19: =+AH19+AI19+0.5*AJ19 -> 23.38 | AH19: 13.01 | AI19: 9.37 | AJ19: 2
A20: 15 | B20: Rodriguez, | C20: Mike | D20: CDP-SS | E20: =+G20+J20+M20+P20+T20+W20+AA20+AD20+AG20 -> 270.47 | F20: =+I20+L20+O20+S20+V20+Z20+AC20+AF20+AJ20 -> 52 | G20: =+H20+0.5*I20 -> 30.53 | H20: 30.03 | I20: 1 | J20: =+K20+0.5*L20 -> 22.59 | K20: 16.59 | L20: 12 | M20: =+N20+0.5*O20 -> 40.21 | N20: 38.21 | O20: 4 | P20: =+Q20+R20+0.5*S20 -> 29.19 | Q20: 14.07 | R20: 15.12 | S20: 0 | T20: =+U20+0.5*V20 -> 10.53 | U20: 7.03 | V20: 7 | W20: =+X20+Y20+0.5*Z20 -> 37.14 | X20: 6.71 | Y20: 26.43 | Z20: 8 | AA20: =+AB20+0.5*AC20 -> 37.86 | AB20: 33.86 | AC20: 8 | AD20: =+AE20+0.5*AF20 -> 42.46 | AE20: 37.46 | AF20: 10 | AG20: =+AH20+AI20+0.5*AJ20 -> 19.96 | AH20: 10.99 | AI20: 7.97 | AJ20: 2
A21: 16 | B21: Roach, | C21: Chris | D21: CDP-MM | E21: =+G21+J21+M21+P21+T21+W21+AA21+AD21+AG21 -> 272.78 | F21: =+I21+L21+O21+S21+V21+Z21+AC21+AF21+AJ21 -> 100 | G21: =+H21+0.5*I21 -> 32.86 | H21: 31.36 | I21: 3 | J21: =+K21+0.5*L21 -> 24.49 | K21: 18.49 | L21: 12 | M21: =+N21+0.5*O21 -> 49.00 | N21: 41.50 | O21: 15 | P21: =+Q21+R21+0.5*S21 -> 26.61 | Q21: 13.94 | R21: 10.17 | S21: 5 | T21: =+U21+0.5*V21 -> 9.53 | U21: 7.53 | V21: 4 | W21: =+X21+Y21+0.5*Z21 -> 43.60 | X21: 5.67 | Y21: 26.43 | Z21: 23 | AA21: =+AB21+0.5*AC21 -> 40.00 | AB21: 25.50 | AC21: 29 | AD21: =+AE21+0.5*AF21 -> 31.78 | AE21: 27.28 | AF21: 9 | AG21: =+AH21+AI21+0.5*AJ21 -> 14.91 | AH21: 8.54 | AI21: 6.37 | AJ21: 0
A22: 17 | B22: Rimer, | C22: Clayton | D22: CDP-MM | E22: =+G22+J22+M22+P22+T22+W22+AA22+AD22+AG22 -> 274.76 | F22: =+I22+L22+O22+S22+V22+Z22+AC22+AF22+AJ22 -> 35 | G22: =+H22+0.5*I22 -> 24.71 | H22: 24.21 | I22: 1 | J22: =+K22+0.5*L22 -> 24.18 | K22: 23.68 | L22: 1 | M22: =+N22+0.5*O22 -> 46.28 | N22: 39.28 | O22: 14 | P22: =+Q22+R22+0.5*S22 -> 31.70 | Q22: 18.22 | R22: 12.48 | S22: 2 | T22: =+U22+0.5*V22 -> 14.02 | U22: 13.02 | V22: 2 | W22: =+X22+Y22+0.5*Z22 -> 43.56 | X22: 7.72 | Y22: 34.34 | Z22: 3 | AA22: =+AB22+0.5*AC22 -> 34.89 | AB22: 30.89 | AC22: 8 | AD22: =+AE22+0.5*AF22 -> 35.85 | AE22: 35.85 | AF22: 0 | AG22: =+AH22+AI22+0.5*AJ22 -> 19.57 | AH22: 8.87 | AI22: 8.70 | AJ22: 4
A23: 18 | B23: Hood, | C23: Neil | D23: CDP-MM | E23: =+G23+J23+M23+P23+T23+W23+AA23+AD23+AG23 -> 279.87 | F23: =+I23+L23+O23+S23+V23+Z23+AC23+AF23+AJ23 -> 65 | G23: =+H23+0.5*I23 -> 29.11 | H23: 27.61 | I23: 3 | J23: =+K23+0.5*L23 -> 21.94 | K23: 17.44 | L23: 9 | M23: =+N23+0.5*O23 -> 39.27 | N23: 37.27 | O23: 4 | P23: =+Q23+R23+0.5*S23 -> 29.51 | Q23: 16.35 | R23: 13.16 | S23: 0 | T23: =+U23+0.5*V23 -> 12.38 | U23: 11.88 | V23: 1 | W23: =+X23+Y23+0.5*Z23 -> 39.50 | X23: 4.63 | Y23: 29.87 | Z23: 10 | AA23: =+AB23+0.5*AC23 -> 45.83 | AB23: 30.33 | AC23: 31 | AD23: =+AE23+0.5*AF23 -> 35.66 | AE23: 32.66 | AF23: 6 | AG23: =+AH23+AI23+0.5*AJ23 -> 26.67 | AH23: 12.80 | AI23: 13.37 | AJ23: 1
A24: 19 | B24: Colby, | C24: William | D24: CDP-SS | E24: =+G24+J24+M24+P24+T24+W24+AA24+AD24+AG24 -> 290.56 | F24: =+I24+L24+O24+S24+V24+Z24+AC24+AF24+AJ24 -> 55 | G24: =+H24+0.5*I24 -> 34.96 | H24: 34.46 | I24: 1 | J24: =+K24+0.5*L24 -> 31.07 | K24: 27.07 | L24: 8 | M24: =+N24+0.5*O24 -> 45.30 | N24: 41.80 | O24: 7 | P24: =+Q24+R24+0.5*S24 -> 28.16 | Q24: 14.00 | R24: 12.16 | S24: 4 | T24: =+U24+0.5*V24 -> 10.10 | U24: 10.10 | V24: 0 | W24: =+X24+Y24+0.5*Z24 -> 47.50 | X24: 6.16 | Y24: 34.84 | Z24: 13 | AA24: =+AB24+0.5*AC24 -> 32.49 | AB24: 31.99 | AC24: 1 | AD24: =+AE24+0.5*AF24 -> 39.16 | AE24: 29.66 | AF24: 19 | AG24: =+AH24+AI24+0.5*AJ24 -> 21.82 | AH24: 11.37 | AI24: 9.45 | AJ24: 2
A25: 20 | B25: Badger, | C25: Jeff | D25: CDP-MM | E25: =+G25+J25+M25+P25+T25+W25+AA25+AD25+AG25 -> 291.39 | F25: =+I25+L25+O25+S25+V25+Z25+AC25+AF25+AJ25 -> 64 | G25: =+H25+0.5*I25 -> 30.98 | H25: 29.98 | I25: 2 | J25: =+K25+0.5*L25 -> 25.43 | K25: 25.43 | L25: 0 | M25: =+N25+0.5*O25 -> 49.90 | N25: 28.40 | O25: 43 | P25: =+Q25+R25+0.5*S25 -> 36.81 | Q25: 20.07 | R25: 15.24 | S25: 3 | T25: =+U25+0.5*V25 -> 10.56 | U25: 8.56 | V25: 4 | W25: =+X25+Y25+0.5*Z25 -> 50.84 | X25: 7.58 | Y25: 39.76 | Z25: 7 | AA25: =+AB25+0.5*AC25 -> 26.00 | AB25: 25.50 | AC25: 1 | AD25: =+AE25+0.5*AF25 -> 33.09 | AE25: 32.59 | AF25: 1 | AG25: =+AH25+AI25+0.5*AJ25 -> 27.78 | AH25: 14.78 | AI25: 11.50 | AJ25: 3
A26: 21 | B26: Attryde, | C26: Ed | D26: CDP-MM | E26: =+G26+J26+M26+P26+T26+W26+AA26+AD26+AG26 -> 293.01 | F26: =+I26+L26+O26+S26+V26+Z26+AC26+AF26+AJ26 -> 13 | G26: =+H26+0.5*I26 -> 34.54 | H26: 33.54 | I26: 2 | J26: =+K26+0.5*L26 -> 23.87 | K26: 23.87 | L26: 0 | M26: =+N26+0.5*O26 -> 36.96 | N26: 36.46 | O26: 1 | P26: =+Q26+R26+0.5*S26 -> 34.48 | Q26: 17.75 | R26: 16.73 | S26: 0 | T26: =+U26+0.5*V26 -> 6.71 | U26: 5.71 | V26: 2 | W26: =+X26+Y26+0.5*Z26 -> 53.43 | X26: 10.26 | Y26: 40.67 | Z26: 5 | AA26: =+AB26+0.5*AC26 -> 32.23 | AB26: 31.73 | AC26: 1 | AD26: =+AE26+0.5*AF26 -> 37.15 | AE26: 36.15 | AF26: 2 | AG26: =+AH26+AI26+0.5*AJ26 -> 33.64 | AH26: 19.09 | AI26: 14.55 | AJ26: 0
A27: 22 | B27: Rupert, | C27: Frank | D27: CDP-SS | E27: =+G27+J27+M27+P27+T27+W27+AA27+AD27+AG27 -> 296.72 | F27: =+I27+L27+O27+S27+V27+Z27+AC27+AF27+AJ27 -> 43 | G27: =+H27+0.5*I27 -> 31.57 | H27: 31.07 | I27: 1 | J27: =+K27+0.5*L27 -> 32.33 | K27: 30.33 | L27: 4 | M27: =+N27+0.5*O27 -> 63.92 | N27: 57.92 | O27: 12 | P27: =+Q27+R27+0.5*S27 -> 28.73 | Q27: 14.68 | R27: 10.55 | S27: 7 | T27: =+U27+0.5*V27 -> 10.78 | U27: 9.78 | V27: 2 | W27: =+X27+Y27+0.5*Z27 -> 50.02 | X27: 7.38 | Y27: 36.14 | Z27: 13 | AA27: =+AB27+0.5*AC27 -> 30.25 | AB27: 29.25 | AC27: 2 | AD27: =+AE27+0.5*AF27 -> 26.65 | AE27: 26.65 | AF27: 0 | AG27: =+AH27+AI27+0.5*AJ27 -> 22.47 | AH27: 11.74 | AI27: 9.73 | AJ27: 2
A28: 23 | B28: Tekmitchov, | C28: George | D28: CDP-EX | E28: =+G28+J28+M28+P28+T28+W28+AA28+AD28+AG28 -> 300.04 | F28: =+I28+L28+O28+S28+V28+Z28+AC28+AF28+AJ28 -> 52 | G28: =+H28+0.5*I28 -> 51.47 | H28: 47.97 | I28: 7 | J28: =+K28+0.5*L28 -> 21.88 | K28: 21.88 | L28: 0 | M28: =+N28+0.5*O28 -> 48.19 | N28: 42.69 | O28: 11 | P28: =+Q28+R28+0.5*S28 -> 35.20 | Q28: 16.80 | R28: 13.90 | S28: 9 | T28: =+U28+0.5*V28 -> 9.15 | U28: 8.65 | V28: 1 | W28: =+X28+Y28+0.5*Z28 -> 36.15 | X28: 4.98 | Y28: 27.67 | Z28: 7 | AA28: =+AB28+0.5*AC28 -> 44.12 | AB28: 37.12 | AC28: 14 | AD28: =+AE28+0.5*AF28 -> 33.59 | AE28: 32.59 | AF28: 2 | AG28: =+AH28+AI28+0.5*AJ28 -> 20.29 | AH28: 10.97 | AI28: 8.82 | AJ28: 1
A29: 24 | B29: Bowling, | C29: William | D29: CDP-MM | E29: =+G29+J29+M29+P29+T29+W29+AA29+AD29+AG29 -> 305.10 | F29: =+I29+L29+O29+S29+V29+Z29+AC29+AF29+AJ29 -> 37 | G29: =+H29+0.5*I29 -> 43.42 | H29: 42.92 | I29: 1 | J29: =+K29+0.5*L29 -> 22.37 | K29: 21.37 | L29: 2 | M29: =+N29+0.5*O29 -> 48.14 | N29: 38.14 | O29: 20 | P29: =+Q29+R29+0.5*S29 -> 38.71 | Q29: 24.02 | R29: 14.19 | S29: 1 | T29: =+U29+0.5*V29 -> 11.95 | U29: 10.45 | V29: 3 | W29: =+X29+Y29+0.5*Z29 -> 45.81 | X29: 9.16 | Y29: 33.15 | Z29: 7 | AA29: =+AB29+0.5*AC29 -> 36.66 | AB29: 35.66 | AC29: 2 | AD29: =+AE29+0.5*AF29 -> 32.60 | AE29: 32.10 | AF29: 1 | AG29: =+AH29+AI29+0.5*AJ29 -> 25.44 | AH29: 14.57 | AI29: 10.87 | AJ29: 0
A30: 25 | B30: Halliday, | C30: Mark | D30: CDP-MM | E30: =+G30+J30+M30+P30+T30+W30+AA30+AD30+AG30 -> 306.80 | F30: =+I30+L30+O30+S30+V30+Z30+AC30+AF30+AJ30 -> 38 | G30: =+H30+0.5*I30 -> 62.68 | H30: 62.68 | I30: 0 | J30: =+K30+0.5*L30 -> 23.11 | K30: 20.61 | L30: 5 | M30: =+N30+0.5*O30 -> 47.06 | N30: 44.56 | O30: 5 | P30: =+Q30+R30+0.5*S30 -> 33.11 | Q30: 19.15 | R30: 13.96 | S30: 0 | T30: =+U30+0.5*V30 -> 11.31 | U30: 9.31 | V30: 4 | W30: =+X30+Y30+0.5*Z30 -> 37.69 | X30: 5.67 | Y30: 28.02 | Z30: 8 | AA30: =+AB30+0.5*AC30 -> 38.35 | AB30: 34.85 | AC30: 7 | AD30: =+AE30+0.5*AF30 -> 32.61 | AE30: 30.11 | AF30: 5 | AG30: =+AH30+AI30+0.5*AJ30 -> 20.88 | AH30: 9.17 | AI30: 9.71 | AJ30: 4
A31: 26 | B31: Balay, | C31: Danny | D31: CDP-MM | E31: =+G31+J31+M31+P31+T31+W31+AA31+AD31+AG31 -> 307.39 | F31: =+I31+L31+O31+S31+V31+Z31+AC31+AF31+AJ31 -> 120 | G31: =+H31+0.5*I31 -> 34.40 | H31: 34.40 | I31: 0 | J31: =+K31+0.5*L31 -> 23.26 | K31: 17.26 | L31: 12 | M31: =+N31+0.5*O31 -> 63.17 | N31: 48.67 | O31: 29 | P31: =+Q31+R31+0.5*S31 -> 41.16 | Q31: 5.43 | R31: 13.73 | S31: 44 | T31: =+U31+0.5*V31 -> 14.25 | U31: 8.25 | V31: 12 | W31: =+X31+Y31+0.5*Z31 -> 40.32 | X31: 7.53 | Y31: 28.29 | Z31: 9 | AA31: =+AB31+0.5*AC31 -> 33.00 | AB31: 27.00 | AC31: 12 | AD31: =+AE31+0.5*AF31 -> 34.60 | AE31: 34.10 | AF31: 1 | AG31: =+AH31+AI31+0.5*AJ31 -> 23.23 | AH31: 12.27 | AI31: 10.46 | AJ31: 1
A32: 27 | B32: Carr, | C32: Robert | D32: CDP-MM | E32: =+G32+J32+M32+P32+T32+W32+AA32+AD32+AG32 -> 333.44 | F32: =+I32+L32+O32+S32+V32+Z32+AC32+AF32+AJ32 -> 51 | G32: =+H32+0.5*I32 -> 33.65 | H32: 32.65 | I32: 2 | J32: =+K32+0.5*L32 -> 30.45 | K32: 29.45 | L32: 2 | M32: =+N32+0.5*O32 -> 63.48 | N32: 59.98 | O32: 7 | P32: =+Q32+R32+0.5*S32 -> 30.45 | Q32: 16.69 | R32: 11.76 | S32: 4 | T32: =+U32+0.5*V32 -> 12.05 | U32: 11.55 | V32: 1 | W32: =+X32+Y32+0.5*Z32 -> 55.97 | X32: 10.25 | Y32: 36.22 | Z32: 19 | AA32: =+AB32+0.5*AC32 -> 42.99 | AB32: 40.49 | AC32: 5 | AD32: =+AE32+0.5*AF32 -> 38.05 | AE32: 33.05 | AF32: 10 | AG32: =+AH32+AI32+0.5*AJ32 -> 26.35 | AH32: 15.17 | AI32: 10.68 | AJ32: 1
A33: 28* | B33: Dunn, | C33: Rusty | D33: CDP-MM | E33: =+G33+J33+M33+P33+T33+W33+AA33+AD33+AG33 -> 368.17 | F33: =+I33+L33+O33+S33+V33+Z33+AC33+AF33+AJ33 -> 156 | G33: =+H33+0.5*I33 -> 35.00 | H33: 31.00 | I33: 8 | J33: =+K33+0.5*L33 -> 26.18 | K33: 21.68 | L33: 9 | M33: =+N33+0.5*O33 -> 57.29 | N33: 51.29 | O33: 12 | P33: =+Q33+R33+0.5*S33 -> 40.58 | Q33: 16.73 | R33: 14.35 | S33: 19 | T33: =+U33+0.5*V33 -> 28.99 | U33: 8.99 | V33: 40 | W33: =+X33+Y33+0.5*Z33 -> 45.06 | X33: 5.57 | Y33: 30.49 | Z33: 18 | AA33: =+AB33+0.5*AC33 -> 46.93 | AB33: 32.93 | AC33: 28 | AD33: =+AE33+0.5*AF33 -> 50.11 | AE33: 45.61 | AF33: 9 | AG33: =+AH33+AI33+0.5*AJ33 -> 38.03 | AH33: 14.79 | AI33: 16.74 | AJ33: 13
A34: 29 | B34: Redocto, | C34: Leonardo | D34: CDP-MM | E34: =+G34+J34+M34+P34+T34+W34+AA34+AD34+AG34 -> 398.53 | F34: =+I34+L34+O34+S34+V34+Z34+AC34+AF34+AJ34 -> 78 | G34: =+H34+0.5*I34 -> 46.91 | H34: 44.91 | I34: 4 | J34: =+K34+0.5*L34 -> 31.40 | K34: 28.90 | L34: 5 | M34: =+N34+0.5*O34 -> 58.96 | N34: 53.46 | O34: 11 | P34: =+Q34+R34+0.5*S34 -> 44.19 | Q34: 20.59 | R34: 22.10 | S34: 3 | T34: =+U34+0.5*V34 -> 10.39 | U34: 9.89 | V34: 1 | W34: =+X34+Y34+0.5*Z34 -> 62.12 | X34: 11.33 | Y34: 43.29 | Z34: 15 | AA34: =+AB34+0.5*AC34 -> 54.51 | AB34: 51.51 | AC34: 6 | AD34: =+AE34+0.5*AF34 -> 56.47 | AE34: 42.47 | AF34: 28 | AG34: =+AH34+AI34+0.5*AJ34 -> 33.58 | AH34: 16.38 | AI34: 14.70 | AJ34: 5
A35: 30 | B35: Jelin, | C35: Barry | D35: CDP-MM | E35: =+G35+J35+M35+P35+T35+W35+AA35+AD35+AG35 -> 430.29 | F35: =+I35+L35+O35+S35+V35+Z35+AC35+AF35+AJ35 -> 158 | G35: =+H35+0.5*I35 -> 37.71 | H35: 37.21 | I35: 1 | J35: =+K35+0.5*L35 -> 41.96 | K35: 31.46 | L35: 21 | M35: =+N35+0.5*O35 -> 78.52 | N35: 55.02 | O35: 47 | P35: =+Q35+R35+0.5*S35 -> 67.79 | Q35: 39.77 | R35: 23.52 | S35: 9 | T35: =+U35+0.5*V35 -> 13.45 | U35: 10.45 | V35: 6 | W35: =+X35+Y35+0.5*Z35 -> 53.44 | X35: 8.12 | Y35: 33.82 | Z35: 23 | AA35: =+AB35+0.5*AC35 -> 56.90 | AB35: 43.90 | AC35: 26 | AD35: =+AE35+0.5*AF35 -> 49.94 | AE35: 41.44 | AF35: 17 | AG35: =+AH35+AI35+0.5*AJ35 -> 30.58 | AH35: 14.08 | AI35: 12.50 | AJ35: 8
A36: ESP-
A37: 1 | B37: Edwards, | C37: Lance | D37: ESP-EX | E37: =+G37+J37+M37+P37+T37+W37+AA37+AD37+AG37 -> 158.75 | F37: =+I37+L37+O37+S37+V37+Z37+AC37+AF37+AJ37 -> 30 | G37: =+H37+0.5*I37 -> 18.60 | H37: 18.60 | I37: 0 | J37: =+K37+0.5*L37 -> 14.86 | K37: 11.86 | L37: 6 | M37: =+N37+0.5*O37 -> 24.40 | N37: 21.40 | O37: 6 | P37: =+Q37+R37+0.5*S37 -> 22.81 | Q37: 14.60 | R37: 8.21 | S37: 0 | T37: =+U37+0.5*V37 -> 6.00 | U37: 6.00 | V37: 0 | W37: =+X37+Y37+0.5*Z37 -> 23.53 | X37: 3.87 | Y37: 18.16 | Z37: 3 | AA37: =+AB37+0.5*AC37 -> 19.67 | AB37: 15.67 | AC37: 8 | AD37: =+AE37+0.5*AF37 -> 14.20 | AE37: 13.20 | AF37: 2 | AG37: =+AH37+AI37+0.5*AJ37 -> 14.68 | AH37: 6.79 | AI37: 5.39 | AJ37: 5
A38: 2 | B38: Boshard, | C38: David | D38: ESP-MA | E38: =+G38+J38+M38+P38+T38+W38+AA38+AD38+AG38 -> 163.85 | F38: =+I38+L38+O38+S38+V38+Z38+AC38+AF38+AJ38 -> 17 | G38: =+H38+0.5*I38 -> 16.10 | H38: 15.60 | I38: 1 | J38: =+K38+0.5*L38 -> 14.97 | K38: 13.97 | L38: 2 | M38: =+N38+0.5*O38 -> 25.83 | N38: 24.33 | O38: 3 | P38: =+Q38+R38+0.5*S38 -> 22.38 | Q38: 10.66 | R38: 10.72 | S38: 2 | T38: =+U38+0.5*V38 -> 8.56 | U38: 7.56 | V38: 2 | W38: =+X38+Y38+0.5*Z38 -> 25.99 | X38: 4.24 | Y38: 18.25 | Z38: 7 | AA38: =+AB38+0.5*AC38 -> 17.29 | AB38: 17.29 | AC38: 0 | AD38: =+AE38+0.5*AF38 -> 15.82 | AE38: 15.82 | AF38: 0 | AG38: =+AH38+AI38+0.5*AJ38 -> 16.91 | AH38: 9.81 | AI38: 7.10 | AJ38: 0
A39: 3 | B39: Zaccardi, | C39: Pat | D39: ESP-SS | E39: =+G39+J39+M39+P39+T39+W39+AA39+AD39+AG39 -> 196.74 | F39: =+I39+L39+O39+S39+V39+Z39+AC39+AF39+AJ39 -> 39 | G39: =+H39+0.5*I39 -> 24.67 | H39: 23.67 | I39: 2 | J39: =+K39+0.5*L39 -> 14.95 | K39: 13.45 | L39: 3 | M39: =+N39+0.5*O39 -> 31.40 | N39: 25.40 | O39: 12 | P39: =+Q39+R39+0.5*S39 -> 23.04 | Q39: 10.17 | R39: 8.37 | S39: 9 | T39: =+U39+0.5*V39 -> 8.75 | U39: 8.75 | V39: 0 | W39: =+X39+Y39+0.5*Z39 -> 24.45 | X39: 5.41 | Y39: 17.54 | Z39: 3 | AA39: =+AB39+0.5*AC39 -> 28.71 | AB39: 27.71 | AC39: 2 | AD39: =+AE39+0.5*AF39 -> 20.66 | AE39: 19.66 | AF39: 2 | AG39: =+AH39+AI39+0.5*AJ39 -> 20.11 | AH39: 10.18 | AI39: 6.93 | AJ39: 6
A40: 4 | B40: Gelo, | C40: Ivan | D40: ESP-MA | E40: =+G40+J40+M40+P40+T40+W40+AA40+AD40+AG40 -> 207.71 | F40: =+I40+L40+O40+S40+V40+Z40+AC40+AF40+AJ40 -> 77 | G40: =+H40+0.5*I40 -> 25.63 | H40: 25.13 | I40: 1 | J40: =+K40+0.5*L40 -> 16.58 | K40: 16.08 | L40: 1 | M40: =+N40+0.5*O40 -> 42.38 | N40: 21.38 | O40: 42 | P40: =+Q40+R40+0.5*S40 -> 25.50 | Q40: 10.78 | R40: 14.72 | S40: 0 | T40: =+U40+0.5*V40 -> 18.72 | U40: 8.72 | V40: 20 | W40: =+X40+Y40+0.5*Z40 -> 25.70 | X40: 4.84 | Y40: 18.86 | Z40: 4 | AA40: =+AB40+0.5*AC40 -> 19.69 | AB40: 18.19 | AC40: 3 | AD40: =+AE40+0.5*AF40 -> 17.27 | AE40: 16.27 | AF40: 2 | AG40: =+AH40+AI40+0.5*AJ40 -> 16.24 | AH40: 8.28 | AI40: 5.96 | AJ40: 4
A41: 5 | B41: Greathouse, | C41: Joseph | D41: ESP-SS | E41: =+G41+J41+M41+P41+T41+W41+AA41+AD41+AG41 -> 223.96 | F41: =+I41+L41+O41+S41+V41+Z41+AC41+AF41+AJ41 -> 43 | G41: =+H41+0.5*I41 -> 26.71 | H41: 26.71 | I41: 0 | J41: =+K41+0.5*L41 -> 21.85 | K41: 14.85 | L41: 14 | M41: =+N41+0.5*O41 -> 36.55 | N41: 32.55 | O41: 8 | P41: =+Q41+R41+0.5*S41 -> 25.87 | Q41: 13.04 | R41: 9.33 | S41: 7 | T41: =+U41+0.5*V41 -> 9.33 | U41: 7.83 | V41: 3 | W41: =+X41+Y41+0.5*Z41 -> 34.56 | X41: 4.72 | Y41: 27.34 | Z41: 5 | AA41: =+AB41+0.5*AC41 -> 26.58 | AB41: 26.08 | AC41: 1 | AD41: =+AE41+0.5*AF41 -> 24.13 | AE41: 22.63 | AF41: 3 | AG41: =+AH41+AI41+0.5*AJ41 -> 18.38 | AH41: 10.07 | AI41: 7.31 | AJ41: 2
A42: 6 | B42: Collins, | C42: Ken | D42: ESP-SS | E42: =+G42+J42+M42+P42+T42+W42+AA42+AD42+AG42 -> 224.24 | F42: =+I42+L42+O42+S42+V42+Z42+AC42+AF42+AJ42 -> 40 | G42: =+H42+0.5*I42 -> 27.48 | H42: 26.98 | I42: 1 | J42: =+K42+0.5*L42 -> 14.16 | K42: 13.16 | L42: 2 | M42: =+N42+0.5*O42 -> 39.49 | N42: 35.99 | O42: 7 | P42: =+Q42+R42+0.5*S42 -> 32.18 | Q42: 14.14 | R42: 10.54 | S42: 15 | T42: =+U42+0.5*V42 -> 8.29 | U42: 7.29 | V42: 2 | W42: =+X42+Y42+0.5*Z42 -> 26.03 | X42: 5.24 | Y42: 18.29 | Z42: 5 | AA42: =+AB42+0.5*AC42 -> 32.16 | AB42: 31.16 | AC42: 2 | AD42: =+AE42+0.5*AF42 -> 20.58 | AE42: 20.58 | AF42: 0 | AG42: =+AH42+AI42+0.5*AJ42 -> 23.87 | AH42: 10.95 | AI42: 9.92 | AJ42: 6
A43: 7 | B43: Peterson, | C43: Todd | D43: ESP-SS | E43: =+G43+J43+M43+P43+T43+W43+AA43+AD43+AG43 -> 225.67 | F43: =+I43+L43+O43+S43+V43+Z43+AC43+AF43+AJ43 -> 47 | G43: =+H43+0.5*I43 -> 27.24 | H43: 27.24 | I43: 0 | J43: =+K43+0.5*L43 -> 17.74 | K43: 17.24 | L43: 1 | M43: =+N43+0.5*O43 -> 39.24 | N43: 39.24 | O43: 0 | P43: =+Q43+R43+0.5*S43 -> 27.38 | Q43: 7.82 | R43: 11.56 | S43: 16 | T43: =+U43+0.5*V43 -> 7.27 | U43: 7.27 | V43: 0 | W43: =+X43+Y43+0.5*Z43 -> 30.36 | X43: 4.97 | Y43: 23.39 | Z43: 4 | AA43: =+AB43+0.5*AC43 -> 32.67 | AB43: 27.17 | AC43: 11 | AD43: =+AE43+0.5*AF43 -> 24.00 | AE43: 20.00 | AF43: 8 | AG43: =+AH43+AI43+0.5*AJ43 -> 19.77 | AH43: 8.11 | AI43: 8.16 | AJ43: 7
A44: 8 | B44: Zaccardi, | C44: Juke | D44: ESP-MM | E44: =+G44+J44+M44+P44+T44+W44+AA44+AD44+AG44 -> 242.29 | F44: =+I44+L44+O44+S44+V44+Z44+AC44+AF44+AJ44 -> 50 | G44: =+H44+0.5*I44 -> 26.04 | H44: 25.54 | I44: 1 | J44: =+K44+0.5*L44 -> 21.20 | K44: 15.20 | L44: 12 | M44: =+N44+0.5*O44 -> 39.83 | N44: 31.83 | O44: 16 | P44: =+Q44+R44+0.5*S44 -> 26.00 | Q44: 14.10 | R44: 11.90 | S44: 0 | T44: =+U44+0.5*V44 -> 8.80 | U44: 8.30 | V44: 1 | W44: =+X44+Y44+0.5*Z44 -> 33.06 | X44: 5.72 | Y44: 23.84 | Z44: 7 | AA44: =+AB44+0.5*AC44 -> 35.41 | AB44: 29.91 | AC44: 11 | AD44: =+AE44+0.5*AF44 -> 26.96 | AE44: 26.96 | AF44: 0 | AG44: =+AH44+AI44+0.5*AJ44 -> 24.99 | AH44: 14.39 | AI44: 9.60 | AJ44: 2
A45: 9 | B45: Parks, | C45: Justin | D45: ESP-SS | E45: =+G45+J45+M45+P45+T45+W45+AA45+AD45+AG45 -> 246.49 | F45: =+I45+L45+O45+S45+V45+Z45+AC45+AF45+AJ45 -> 55 | G45: =+H45+0.5*I45 -> 31.10 | H45: 30.60 | I45: 1 | J45: =+K45+0.5*L45 -> 19.11 | K45: 16.11 | L45: 6 | M45: =+N45+0.5*O45 -> 40.40 | N45: 33.90 | O45: 13 | P45: =+Q45+R45+0.5*S45 -> 31.17 | Q45: 15.88 | R45: 11.79 | S45: 7 | T45: =+U45+0.5*V45 -> 7.26 | U45: 5.76 | V45: 3 | W45: =+X45+Y45+0.5*Z45 -> 36.44 | X45: 4.93 | Y45: 24.01 | Z45: 15 | AA45: =+AB45+0.5*AC45 -> 32.74 | AB45: 29.74 | AC45: 6 | AD45: =+AE45+0.5*AF45 -> 32.26 | AE45: 31.26 | AF45: 2 | AG45: =+AH45+AI45+0.5*AJ45 -> 16.01 | AH45: 8.04 | AI45: 6.97 | AJ45: 2
A46: 10 | B46: Mortenson, | C46: Bryan | D46: ESP-SS | E46: =+G46+J46+M46+P46+T46+W46+AA46+AD46+AG46 -> 249.91 | F46: =+I46+L46+O46+S46+V46+Z46+AC46+AF46+AJ46 -> 48 | G46: =+H46+0.5*I46 -> 28.70 | H46: 28.20 | I46: 1 | J46: =+K46+0.5*L46 -> 24.60 | K46: 17.10 | L46: 15 | M46: =+N46+0.5*O46 -> 50.36 | N46: 41.36 | O46: 18 | P46: =+Q46+R46+0.5*S46 -> 30.44 | Q46: 16.36 | R46: 13.58 | S46: 1 | T46: =+U46+0.5*V46 -> 9.11 | U46: 6.11 | V46: 6 | W46: =+X46+Y46+0.5*Z46 -> 32.10 | X46: 6.18 | Y46: 23.42 | Z46: 5 | AA46: =+AB46+0.5*AC46 -> 27.03 | AB46: 26.53 | AC46: 1 | AD46: =+AE46+0.5*AF46 -> 29.30 | AE46: 29.30 | AF46: 0 | AG46: =+AH46+AI46+0.5*AJ46 -> 18.27 | AH46: 9.83 | AI46: 7.94 | AJ46: 1
A47: 11 | B47: Katz, | C47: Eric | D47: ESP-MM | E47: =+G47+J47+M47+P47+T47+W47+AA47+AD47+AG47 -> 266.79 | F47: =+I47+L47+O47+S47+V47+Z47+AC47+AF47+AJ47 -> 72 | G47: =+H47+0.5*I47 -> 41.98 | H47: 40.48 | I47: 3 | J47: =+K47+0.5*L47 -> 21.92 | K47: 20.42 | L47: 3 | M47: =+N47+0.5*O47 -> 46.96 | N47: 33.96 | O47: 26 | P47: =+Q47+R47+0.5*S47 -> 28.15 | Q47: 14.78 | R47: 12.87 | S47: 1 | T47: =+U47+0.5*V47 -> 9.99 | U47: 9.49 | V47: 1 | W47: =+X47+Y47+0.5*Z47 -> 35.81 | X47: 5.46 | Y47: 22.35 | Z47: 16 | AA47: =+AB47+0.5*AC47 -> 33.42 | AB47: 26.92 | AC47: 13 | AD47: =+AE47+0.5*AF47 -> 26.14 | AE47: 23.14 | AF47: 6 | AG47: =+AH47+AI47+0.5*AJ47 -> 22.42 | AH47: 11.11 | AI47: 9.81 | AJ47: 3
A49: Legend/Notes:
A50: X | B50: = Shooters who received trophies for their specific Division/Classification.
A51: Xx Xx | B51: = Shooters who acted as SOs or were part of the Match Staff.
A52: DQ | B52: = Shooter was disqualified for some reason.
A53: XX | B53: = Points Down value included some sore of penalty (Procedural, Hit On Non-threat, Failure to Neutralize, etc.)
A54: XXX.XX | B54: = Because these shooters took 1st place in their specific Div/Class, and there were more than 10 shooters competing in their classification, they were automatically advanced to the next highest classification.
A55: 28* | B55: = Although signed off by the shooter and the SO, Rusty Dunn's score sheet for Stage 1 did not have a time for the stage. As a result, his placing is based on an arbitrary time for Stage 1 (31.00). A value that is plus or minus 20 seconds from the 31.00 seconds given, would not have affected his placing.
B57: All of the individual scores were verified on 9/16/03. Some corrections may have resulted in minor placing changes, but none affected the final trophy winning results.