A2: Utah State IDPA Match - 2003 Results | H2: (Sorted by Division/Classification.)
B3: Held on September 13, 2003 | G3: 1 | J3: 2 | M3: 3 | P3: 4 | T3: 5 | W3: 6 | AA3: 7 | AD3: 8 | AG3: 9
A4: Place | B4: Name (Last, First) | D4: (Div-Class) | E4: Shoot Total | F4: Total PD | G4: Stage 1 | H4: String 1 | I4: Points Down | J4: Stage 2 | K4: String 1 | L4: Points Down | M4: Stage 3 | N4: String 1 | O4: Points Down | P4: Stage 4 | Q4: String 1 | R4: String 2 | S4: Points Down | T4: Stage 5 | U4: String 1 | V4: Points Down | W4: Stage 6 | X4: String 1 | Y4: String 2 | Z4: Points Down | AA4: Stage 7 | AB4: String 1 | AC4: Points Down | AD4: Stage 8 | AE4: String 1 | AF4: Points Down | AG4: Stage 9 | AH4: String 1 | AI4: String 2 | AJ4: Points Down
A5: CDP-EX
A6: 1 | B6: Latham, | C6: Cory | D6: CDP-EX | E6: =+G6+J6+M6+P6+T6+W6+AA6+AD6+AG6 -> 178.65 | F6: =+I6+L6+O6+S6+V6+Z6+AC6+AF6+AJ6 -> 28 | G6: =+H6+0.5*I6 -> 22.46 | H6: 21.46 | I6: 2 | J6: =+K6+0.5*L6 -> 16.71 | K6: 15.71 | L6: 2 | M6: =+N6+0.5*O6 -> 24.78 | N6: 21.78 | O6: 6 | P6: =+Q6+R6+0.5*S6 -> 21.88 | Q6: 10.98 | R6: 8.40 | S6: 5 | T6: =+U6+0.5*V6 -> 8.68 | U6: 8.18 | V6: 1 | W6: =+X6+Y6+0.5*Z6 -> 27.49 | X6: 4.46 | Y6: 20.03 | Z6: 6 | AA6: =+AB6+0.5*AC6 -> 20.18 | AB6: 20.18 | AC6: 0 | AD6: =+AE6+0.5*AF6 -> 21.47 | AE6: 18.47 | AF6: 6 | AG6: =+AH6+AI6+0.5*AJ6 -> 15.00 | AH6: 8.26 | AI6: 6.74 | AJ6: 0
A7: 2 | B7: Griffiths, | C7: Todd | D7: CDP-EX | E7: =+G7+J7+M7+P7+T7+W7+AA7+AD7+AG7 -> 187.80 | F7: =+I7+L7+O7+S7+V7+Z7+AC7+AF7+AJ7 -> 38 | G7: =+H7+0.5*I7 -> 20.06 | H7: 17.56 | I7: 5 | J7: =+K7+0.5*L7 -> 15.44 | K7: 14.94 | L7: 1 | M7: =+N7+0.5*O7 -> 30.12 | N7: 27.62 | O7: 5 | P7: =+Q7+R7+0.5*S7 -> 20.76 | Q7: 10.45 | R7: 9.31 | S7: 2 | T7: =+U7+0.5*V7 -> 7.49 | U7: 6.99 | V7: 1 | W7: =+X7+Y7+0.5*Z7 -> 36.06 | X7: 3.99 | Y7: 29.57 | Z7: 5 | AA7: =+AB7+0.5*AC7 -> 20.70 | AB7: 18.70 | AC7: 4 | AD7: =+AE7+0.5*AF7 -> 20.96 | AE7: 14.46 | AF7: 13 | AG7: =+AH7+AI7+0.5*AJ7 -> 16.21 | AH7: 8.29 | AI7: 6.92 | AJ7: 2
A8: 3 | B8: Theodore, | C8: Ari | D8: CDP-EX | E8: =+G8+J8+M8+P8+T8+W8+AA8+AD8+AG8 -> 195.27 | F8: =+I8+L8+O8+S8+V8+Z8+AC8+AF8+AJ8 -> 33 | G8: =+H8+0.5*I8 -> 22.13 | H8: 21.13 | I8: 2 | J8: =+K8+0.5*L8 -> 14.06 | K8: 14.06 | L8: 0 | M8: =+N8+0.5*O8 -> 35.45 | N8: 32.45 | O8: 6 | P8: =+Q8+R8+0.5*S8 -> 25.05 | Q8: 12.60 | R8: 10.95 | S8: 3 | T8: =+U8+0.5*V8 -> 8.77 | U8: 6.77 | V8: 4 | W8: =+X8+Y8+0.5*Z8 -> 30.84 | X8: 4.69 | Y8: 22.15 | Z8: 8 | AA8: =+AB8+0.5*AC8 -> 19.56 | AB8: 19.06 | AC8: 1 | AD8: =+AE8+0.5*AF8 -> 22.31 | AE8: 18.81 | AF8: 7 | AG8: =+AH8+AI8+0.5*AJ8 -> 17.10 | AH8: 9.94 | AI8: 6.16 | AJ8: 2
A9: 4 | B9: Lepley, | C9: Alex | D9: CDP-EX | E9: =+G9+J9+M9+P9+T9+W9+AA9+AD9+AG9 -> 196.99 | F9: =+I9+L9+O9+S9+V9+Z9+AC9+AF9+AJ9 -> 29 | G9: =+H9+0.5*I9 -> 19.76 | H9: 19.26 | I9: 1 | J9: =+K9+0.5*L9 -> 17.21 | K9: 14.21 | L9: 6 | M9: =+N9+0.5*O9 -> 30.53 | N9: 28.53 | O9: 4 | P9: =+Q9+R9+0.5*S9 -> 24.03 | Q9: 12.88 | R9: 9.15 | S9: 4 | T9: =+U9+0.5*V9 -> 8.94 | U9: 7.94 | V9: 2 | W9: =+X9+Y9+0.5*Z9 -> 28.94 | X9: 4.66 | Y9: 21.78 | Z9: 5 | AA9: =+AB9+0.5*AC9 -> 22.80 | AB9: 21.80 | AC9: 2 | AD9: =+AE9+0.5*AF9 -> 24.91 | AE9: 22.91 | AF9: 4 | AG9: =+AH9+AI9+0.5*AJ9 -> 19.87 | AH9: 9.42 | AI9: 9.95 | AJ9: 1
A10: 5 | B10: Ward, | C10: Dan | D10: CDP-EX | E10: =+G10+J10+M10+P10+T10+W10+AA10+AD10+AG10 -> 203.31 | F10: =+I10+L10+O10+S10+V10+Z10+AC10+AF10+AJ10 -> 34 | G10: =+H10+0.5*I10 -> 24.05 | H10: 23.05 | I10: 2 | J10: =+K10+0.5*L10 -> 15.84 | K10: 14.34 | L10: 3 | M10: =+N10+0.5*O10 -> 30.81 | N10: 28.31 | O10: 5 | P10: =+Q10+R10+0.5*S10 -> 23.66 | Q10: 10.63 | R10: 10.03 | S10: 6 | T10: =+U10+0.5*V10 -> 9.80 | U10: 8.30 | V10: 3 | W10: =+X10+Y10+0.5*Z10 -> 31.03 | X10: 5.48 | Y10: 24.55 | Z10: 2 | AA10: =+AB10+0.5*AC10 -> 25.47 | AB10: 19.97 | AC10: 11 | AD10: =+AE10+0.5*AF10 -> 23.79 | AE10: 22.79 | AF10: 2 | AG10: =+AH10+AI10+0.5*AJ10 -> 18.86 | AH10: 11.81 | AI10: 7.05 | AJ10: 0
A11: 6 | B11: Watson, | C11: Steven | D11: CDP-EX | E11: =+G11+J11+M11+P11+T11+W11+AA11+AD11+AG11 -> 216.46 | F11: =+I11+L11+O11+S11+V11+Z11+AC11+AF11+AJ11 -> 32 | G11: =+H11+0.5*I11 -> 26.66 | H11: 26.16 | I11: 1 | J11: =+K11+0.5*L11 -> 18.61 | K11: 17.61 | L11: 2 | M11: =+N11+0.5*O11 -> 32.81 | N11: 26.81 | O11: 12 | P11: =+Q11+R11+0.5*S11 -> 25.60 | Q11: 13.38 | R11: 9.72 | S11: 5 | T11: =+U11+0.5*V11 -> 6.41 | U11: 6.41 | V11: 0 | W11: =+X11+Y11+0.5*Z11 -> 40.83 | X11: 4.14 | Y11: 35.69 | Z11: 2 | AA11: =+AB11+0.5*AC11 -> 22.09 | AB11: 21.59 | AC11: 1 | AD11: =+AE11+0.5*AF11 -> 27.28 | AE11: 23.28 | AF11: 8 | AG11: =+AH11+AI11+0.5*AJ11 -> 16.17 | AH11: 8.42 | AI11: 7.25 | AJ11: 1
A12: 7 | B12: Haslem, | C12: Alan | D12: CDP-EX | E12: =+G12+J12+M12+P12+T12+W12+AA12+AD12+AG12 -> 239.20 | F12: =+I12+L12+O12+S12+V12+Z12+AC12+AF12+AJ12 -> 15 | G12: =+H12+0.5*I12 -> 26.35 | H12: 24.85 | I12: 3 | J12: =+K12+0.5*L12 -> 18.40 | K12: 17.90 | L12: 1 | M12: =+N12+0.5*O12 -> 35.73 | N12: 35.23 | O12: 1 | P12: =+Q12+R12+0.5*S12 -> 28.02 | Q12: 14.83 | R12: 13.19 | S12: 0 | T12: =+U12+0.5*V12 -> 19.54 | U12: 17.54 | V12: 4 | W12: =+X12+Y12+0.5*Z12 -> 35.19 | X12: 5.68 | Y12: 29.01 | Z12: 1 | AA12: =+AB12+0.5*AC12 -> 29.97 | AB12: 28.97 | AC12: 2 | AD12: =+AE12+0.5*AF12 -> 27.67 | AE12: 27.17 | AF12: 1 | AG12: =+AH12+AI12+0.5*AJ12 -> 18.33 | AH12: 9.50 | AI12: 7.83 | AJ12: 2
A13: 8 | B13: Tekmitchov, | C13: George | D13: CDP-EX | E13: =+G13+J13+M13+P13+T13+W13+AA13+AD13+AG13 -> 300.04 | F13: =+I13+L13+O13+S13+V13+Z13+AC13+AF13+AJ13 -> 52 | G13: =+H13+0.5*I13 -> 51.47 | H13: 47.97 | I13: 7 | J13: =+K13+0.5*L13 -> 21.88 | K13: 21.88 | L13: 0 | M13: =+N13+0.5*O13 -> 48.19 | N13: 42.69 | O13: 11 | P13: =+Q13+R13+0.5*S13 -> 35.20 | Q13: 16.80 | R13: 13.90 | S13: 9 | T13: =+U13+0.5*V13 -> 9.15 | U13: 8.65 | V13: 1 | W13: =+X13+Y13+0.5*Z13 -> 36.15 | X13: 4.98 | Y13: 27.67 | Z13: 7 | AA13: =+AB13+0.5*AC13 -> 44.12 | AB13: 37.12 | AC13: 14 | AD13: =+AE13+0.5*AF13 -> 33.59 | AE13: 32.59 | AF13: 2 | AG13: =+AH13+AI13+0.5*AJ13 -> 20.29 | AH13: 10.97 | AI13: 8.82 | AJ13: 1
A14: CDP-SS
A15: 1 | B15: Tran, | C15: Hung | D15: CDP-SS | E15: =+G15+J15+M15+P15+T15+W15+AA15+AD15+AG15 -> 175.80 | F15: =+I15+L15+O15+S15+V15+Z15+AC15+AF15+AJ15 -> 63 | G15: =+H15+0.5*I15 -> 21.80 | H15: 20.30 | I15: 3 | J15: =+K15+0.5*L15 -> 14.91 | K15: 10.41 | L15: 9 | M15: =+N15+0.5*O15 -> 30.56 | N15: 24.56 | O15: 12 | P15: =+Q15+R15+0.5*S15 -> 20.09 | Q15: 9.40 | R15: 7.69 | S15: 6 | T15: =+U15+0.5*V15 -> 9.10 | U15: 7.10 | V15: 4 | W15: =+X15+Y15+0.5*Z15 -> 23.34 | X15: 3.60 | Y15: 17.24 | Z15: 5 | AA15: =+AB15+0.5*AC15 -> 20.21 | AB15: 14.71 | AC15: 11 | AD15: =+AE15+0.5*AF15 -> 17.94 | AE15: 16.94 | AF15: 2 | AG15: =+AH15+AI15+0.5*AJ15 -> 17.85 | AH15: 7.28 | AI15: 5.07 | AJ15: 11
A16: 2 | B16: Correia, | C16: Larry | D16: CDP-SS | E16: =+G16+J16+M16+P16+T16+W16+AA16+AD16+AG16 -> 235.69 | F16: =+I16+L16+O16+S16+V16+Z16+AC16+AF16+AJ16 -> 79 | G16: =+H16+0.5*I16 -> 31.72 | H16: 28.22 | I16: 7 | J16: =+K16+0.5*L16 -> 19.87 | K16: 15.87 | L16: 8 | M16: =+N16+0.5*O16 -> 27.05 | N16: 26.05 | O16: 2 | P16: =+Q16+R16+0.5*S16 -> 24.96 | Q16: 8.60 | R16: 10.86 | S16: 11 | T16: =+U16+0.5*V16 -> 8.53 | U16: 6.53 | V16: 4 | W16: =+X16+Y16+0.5*Z16 -> 35.23 | X16: 5.07 | Y16: 24.66 | Z16: 11 | AA16: =+AB16+0.5*AC16 -> 34.49 | AB16: 24.99 | AC16: 19 | AD16: =+AE16+0.5*AF16 -> 32.39 | AE16: 24.89 | AF16: 15 | AG16: =+AH16+AI16+0.5*AJ16 -> 21.45 | AH16: 11.98 | AI16: 8.47 | AJ16: 2
A17: 3 | B17: Coleman, | C17: Steve | D17: CDP-SS | E17: =+G17+J17+M17+P17+T17+W17+AA17+AD17+AG17 -> 244.33 | F17: =+I17+L17+O17+S17+V17+Z17+AC17+AF17+AJ17 -> 48 | G17: =+H17+0.5*I17 -> 22.81 | H17: 22.31 | I17: 1 | J17: =+K17+0.5*L17 -> 19.88 | K17: 15.88 | L17: 8 | M17: =+N17+0.5*O17 -> 44.37 | N17: 37.87 | O17: 13 | P17: =+Q17+R17+0.5*S17 -> 24.15 | Q17: 12.94 | R17: 10.21 | S17: 2 | T17: =+U17+0.5*V17 -> 8.68 | U17: 8.68 | V17: 0 | W17: =+X17+Y17+0.5*Z17 -> 37.58 | X17: 6.02 | Y17: 23.56 | Z17: 16 | AA17: =+AB17+0.5*AC17 -> 37.62 | AB17: 37.12 | AC17: 1 | AD17: =+AE17+0.5*AF17 -> 30.90 | AE17: 27.90 | AF17: 6 | AG17: =+AH17+AI17+0.5*AJ17 -> 18.34 | AH17: 10.55 | AI17: 7.29 | AJ17: 1
A18: 4 | B18: Haslem, | C18: Kent | D18: CDP-SS | E18: =+G18+J18+M18+P18+T18+W18+AA18+AD18+AG18 -> 250.57 | F18: =+I18+L18+O18+S18+V18+Z18+AC18+AF18+AJ18 -> 33 | G18: =+H18+0.5*I18 -> 24.14 | H18: 23.14 | I18: 2 | J18: =+K18+0.5*L18 -> 19.39 | K18: 18.89 | L18: 1 | M18: =+N18+0.5*O18 -> 39.73 | N18: 35.23 | O18: 9 | P18: =+Q18+R18+0.5*S18 -> 31.90 | Q18: 15.72 | R18: 15.68 | S18: 1 | T18: =+U18+0.5*V18 -> 6.64 | U18: 6.14 | V18: 1 | W18: =+X18+Y18+0.5*Z18 -> 44.08 | X18: 5.33 | Y18: 32.75 | Z18: 12 | AA18: =+AB18+0.5*AC18 -> 33.49 | AB18: 30.99 | AC18: 5 | AD18: =+AE18+0.5*AF18 -> 28.58 | AE18: 28.08 | AF18: 1 | AG18: =+AH18+AI18+0.5*AJ18 -> 22.62 | AH18: 12.18 | AI18: 9.94 | AJ18: 1
A19: 5 | B19: Smith, | C19: Burton | D19: CDP-SS | E19: =+G19+J19+M19+P19+T19+W19+AA19+AD19+AG19 -> 257.46 | F19: =+I19+L19+O19+S19+V19+Z19+AC19+AF19+AJ19 -> 49 | G19: =+H19+0.5*I19 -> 32.50 | H19: 31.00 | I19: 3 | J19: =+K19+0.5*L19 -> 25.62 | K19: 22.12 | L19: 7 | M19: =+N19+0.5*O19 -> 44.03 | N19: 36.03 | O19: 16 | P19: =+Q19+R19+0.5*S19 -> 30.16 | Q19: 16.08 | R19: 13.08 | S19: 2 | T19: =+U19+0.5*V19 -> 7.40 | U19: 6.40 | V19: 2 | W19: =+X19+Y19+0.5*Z19 -> 39.84 | X19: 4.99 | Y19: 32.85 | Z19: 4 | AA19: =+AB19+0.5*AC19 -> 24.56 | AB19: 24.06 | AC19: 1 | AD19: =+AE19+0.5*AF19 -> 32.52 | AE19: 28.52 | AF19: 8 | AG19: =+AH19+AI19+0.5*AJ19 -> 20.83 | AH19: 9.97 | AI19: 7.86 | AJ19: 6
A20: 6 | B20: Porter, | C20: Alma | D20: CDP-SS | E20: =+G20+J20+M20+P20+T20+W20+AA20+AD20+AG20 -> 265.09 | F20: =+I20+L20+O20+S20+V20+Z20+AC20+AF20+AJ20 -> 54 | G20: =+H20+0.5*I20 -> 34.21 | H20: 33.71 | I20: 1 | J20: =+K20+0.5*L20 -> 17.71 | K20: 17.71 | L20: 0 | M20: =+N20+0.5*O20 -> 48.37 | N20: 39.37 | O20: 18 | P20: =+Q20+R20+0.5*S20 -> 31.82 | Q20: 16.35 | R20: 13.97 | S20: 3 | T20: =+U20+0.5*V20 -> 12.62 | U20: 9.12 | V20: 7 | W20: =+X20+Y20+0.5*Z20 -> 40.10 | X20: 4.63 | Y20: 27.97 | Z20: 15 | AA20: =+AB20+0.5*AC20 -> 28.33 | AB20: 24.33 | AC20: 8 | AD20: =+AE20+0.5*AF20 -> 30.14 | AE20: 29.64 | AF20: 1 | AG20: =+AH20+AI20+0.5*AJ20 -> 21.79 | AH20: 11.56 | AI20: 9.73 | AJ20: 1
A21: 7 | B21: Berry, | C21: Robert | D21: CDP-SS | E21: =+G21+J21+M21+P21+T21+W21+AA21+AD21+AG21 -> 266.49 | F21: =+I21+L21+O21+S21+V21+Z21+AC21+AF21+AJ21 -> 28 | G21: =+H21+0.5*I21 -> 42.10 | H21: 42.10 | I21: 0 | J21: =+K21+0.5*L21 -> 26.16 | K21: 23.16 | L21: 6 | M21: =+N21+0.5*O21 -> 39.37 | N21: 35.87 | O21: 7 | P21: =+Q21+R21+0.5*S21 -> 29.21 | Q21: 12.58 | R21: 15.13 | S21: 3 | T21: =+U21+0.5*V21 -> 10.76 | U21: 10.76 | V21: 0 | W21: =+X21+Y21+0.5*Z21 -> 41.19 | X21: 6.19 | Y21: 34.50 | Z21: 1 | AA21: =+AB21+0.5*AC21 -> 25.01 | AB21: 24.51 | AC21: 1 | AD21: =+AE21+0.5*AF21 -> 29.31 | AE21: 25.31 | AF21: 8 | AG21: =+AH21+AI21+0.5*AJ21 -> 23.38 | AH21: 13.01 | AI21: 9.37 | AJ21: 2
A22: 8 | B22: Rodriguez, | C22: Mike | D22: CDP-SS | E22: =+G22+J22+M22+P22+T22+W22+AA22+AD22+AG22 -> 270.47 | F22: =+I22+L22+O22+S22+V22+Z22+AC22+AF22+AJ22 -> 52 | G22: =+H22+0.5*I22 -> 30.53 | H22: 30.03 | I22: 1 | J22: =+K22+0.5*L22 -> 22.59 | K22: 16.59 | L22: 12 | M22: =+N22+0.5*O22 -> 40.21 | N22: 38.21 | O22: 4 | P22: =+Q22+R22+0.5*S22 -> 29.19 | Q22: 14.07 | R22: 15.12 | S22: 0 | T22: =+U22+0.5*V22 -> 10.53 | U22: 7.03 | V22: 7 | W22: =+X22+Y22+0.5*Z22 -> 37.14 | X22: 6.71 | Y22: 26.43 | Z22: 8 | AA22: =+AB22+0.5*AC22 -> 37.86 | AB22: 33.86 | AC22: 8 | AD22: =+AE22+0.5*AF22 -> 42.46 | AE22: 37.46 | AF22: 10 | AG22: =+AH22+AI22+0.5*AJ22 -> 19.96 | AH22: 10.99 | AI22: 7.97 | AJ22: 2
A23: 9 | B23: Colby, | C23: William | D23: CDP-SS | E23: =+G23+J23+M23+P23+T23+W23+AA23+AD23+AG23 -> 290.56 | F23: =+I23+L23+O23+S23+V23+Z23+AC23+AF23+AJ23 -> 55 | G23: =+H23+0.5*I23 -> 34.96 | H23: 34.46 | I23: 1 | J23: =+K23+0.5*L23 -> 31.07 | K23: 27.07 | L23: 8 | M23: =+N23+0.5*O23 -> 45.30 | N23: 41.80 | O23: 7 | P23: =+Q23+R23+0.5*S23 -> 28.16 | Q23: 14.00 | R23: 12.16 | S23: 4 | T23: =+U23+0.5*V23 -> 10.10 | U23: 10.10 | V23: 0 | W23: =+X23+Y23+0.5*Z23 -> 47.50 | X23: 6.16 | Y23: 34.84 | Z23: 13 | AA23: =+AB23+0.5*AC23 -> 32.49 | AB23: 31.99 | AC23: 1 | AD23: =+AE23+0.5*AF23 -> 39.16 | AE23: 29.66 | AF23: 19 | AG23: =+AH23+AI23+0.5*AJ23 -> 21.82 | AH23: 11.37 | AI23: 9.45 | AJ23: 2
A24: 10 | B24: Rupert, | C24: Frank | D24: CDP-SS | E24: =+G24+J24+M24+P24+T24+W24+AA24+AD24+AG24 -> 296.72 | F24: =+I24+L24+O24+S24+V24+Z24+AC24+AF24+AJ24 -> 43 | G24: =+H24+0.5*I24 -> 31.57 | H24: 31.07 | I24: 1 | J24: =+K24+0.5*L24 -> 32.33 | K24: 30.33 | L24: 4 | M24: =+N24+0.5*O24 -> 63.92 | N24: 57.92 | O24: 12 | P24: =+Q24+R24+0.5*S24 -> 28.73 | Q24: 14.68 | R24: 10.55 | S24: 7 | T24: =+U24+0.5*V24 -> 10.78 | U24: 9.78 | V24: 2 | W24: =+X24+Y24+0.5*Z24 -> 50.02 | X24: 7.38 | Y24: 36.14 | Z24: 13 | AA24: =+AB24+0.5*AC24 -> 30.25 | AB24: 29.25 | AC24: 2 | AD24: =+AE24+0.5*AF24 -> 26.65 | AE24: 26.65 | AF24: 0 | AG24: =+AH24+AI24+0.5*AJ24 -> 22.47 | AH24: 11.74 | AI24: 9.73 | AJ24: 2
A25: CDP-MM
A26: 1 | B26: Roach, | C26: Chris | D26: CDP-MM | E26: =+G26+J26+M26+P26+T26+W26+AA26+AD26+AG26 -> 272.78 | F26: =+I26+L26+O26+S26+V26+Z26+AC26+AF26+AJ26 -> 100 | G26: =+H26+0.5*I26 -> 32.86 | H26: 31.36 | I26: 3 | J26: =+K26+0.5*L26 -> 24.49 | K26: 18.49 | L26: 12 | M26: =+N26+0.5*O26 -> 49.00 | N26: 41.50 | O26: 15 | P26: =+Q26+R26+0.5*S26 -> 26.61 | Q26: 13.94 | R26: 10.17 | S26: 5 | T26: =+U26+0.5*V26 -> 9.53 | U26: 7.53 | V26: 4 | W26: =+X26+Y26+0.5*Z26 -> 43.60 | X26: 5.67 | Y26: 26.43 | Z26: 23 | AA26: =+AB26+0.5*AC26 -> 40.00 | AB26: 25.50 | AC26: 29 | AD26: =+AE26+0.5*AF26 -> 31.78 | AE26: 27.28 | AF26: 9 | AG26: =+AH26+AI26+0.5*AJ26 -> 14.91 | AH26: 8.54 | AI26: 6.37 | AJ26: 0
A27: 2 | B27: Rimer, | C27: Clayton | D27: CDP-MM | E27: =+G27+J27+M27+P27+T27+W27+AA27+AD27+AG27 -> 274.76 | F27: =+I27+L27+O27+S27+V27+Z27+AC27+AF27+AJ27 -> 35 | G27: =+H27+0.5*I27 -> 24.71 | H27: 24.21 | I27: 1 | J27: =+K27+0.5*L27 -> 24.18 | K27: 23.68 | L27: 1 | M27: =+N27+0.5*O27 -> 46.28 | N27: 39.28 | O27: 14 | P27: =+Q27+R27+0.5*S27 -> 31.70 | Q27: 18.22 | R27: 12.48 | S27: 2 | T27: =+U27+0.5*V27 -> 14.02 | U27: 13.02 | V27: 2 | W27: =+X27+Y27+0.5*Z27 -> 43.56 | X27: 7.72 | Y27: 34.34 | Z27: 3 | AA27: =+AB27+0.5*AC27 -> 34.89 | AB27: 30.89 | AC27: 8 | AD27: =+AE27+0.5*AF27 -> 35.85 | AE27: 35.85 | AF27: 0 | AG27: =+AH27+AI27+0.5*AJ27 -> 19.57 | AH27: 8.87 | AI27: 8.70 | AJ27: 4
A28: 3 | B28: Hood, | C28: Neil | D28: CDP-MM | E28: =+G28+J28+M28+P28+T28+W28+AA28+AD28+AG28 -> 279.87 | F28: =+I28+L28+O28+S28+V28+Z28+AC28+AF28+AJ28 -> 65 | G28: =+H28+0.5*I28 -> 29.11 | H28: 27.61 | I28: 3 | J28: =+K28+0.5*L28 -> 21.94 | K28: 17.44 | L28: 9 | M28: =+N28+0.5*O28 -> 39.27 | N28: 37.27 | O28: 4 | P28: =+Q28+R28+0.5*S28 -> 29.51 | Q28: 16.35 | R28: 13.16 | S28: 0 | T28: =+U28+0.5*V28 -> 12.38 | U28: 11.88 | V28: 1 | W28: =+X28+Y28+0.5*Z28 -> 39.50 | X28: 4.63 | Y28: 29.87 | Z28: 10 | AA28: =+AB28+0.5*AC28 -> 45.83 | AB28: 30.33 | AC28: 31 | AD28: =+AE28+0.5*AF28 -> 35.66 | AE28: 32.66 | AF28: 6 | AG28: =+AH28+AI28+0.5*AJ28 -> 26.67 | AH28: 12.80 | AI28: 13.37 | AJ28: 1
A29: 4 | B29: Badger, | C29: Jeff | D29: CDP-MM | E29: =+G29+J29+M29+P29+T29+W29+AA29+AD29+AG29 -> 291.39 | F29: =+I29+L29+O29+S29+V29+Z29+AC29+AF29+AJ29 -> 64 | G29: =+H29+0.5*I29 -> 30.98 | H29: 29.98 | I29: 2 | J29: =+K29+0.5*L29 -> 25.43 | K29: 25.43 | L29: 0 | M29: =+N29+0.5*O29 -> 49.90 | N29: 28.40 | O29: 43 | P29: =+Q29+R29+0.5*S29 -> 36.81 | Q29: 20.07 | R29: 15.24 | S29: 3 | T29: =+U29+0.5*V29 -> 10.56 | U29: 8.56 | V29: 4 | W29: =+X29+Y29+0.5*Z29 -> 50.84 | X29: 7.58 | Y29: 39.76 | Z29: 7 | AA29: =+AB29+0.5*AC29 -> 26.00 | AB29: 25.50 | AC29: 1 | AD29: =+AE29+0.5*AF29 -> 33.09 | AE29: 32.59 | AF29: 1 | AG29: =+AH29+AI29+0.5*AJ29 -> 27.78 | AH29: 14.78 | AI29: 11.50 | AJ29: 3
A30: 5 | B30: Attryde, | C30: Ed | D30: CDP-MM | E30: =+G30+J30+M30+P30+T30+W30+AA30+AD30+AG30 -> 293.01 | F30: =+I30+L30+O30+S30+V30+Z30+AC30+AF30+AJ30 -> 13 | G30: =+H30+0.5*I30 -> 34.54 | H30: 33.54 | I30: 2 | J30: =+K30+0.5*L30 -> 23.87 | K30: 23.87 | L30: 0 | M30: =+N30+0.5*O30 -> 36.96 | N30: 36.46 | O30: 1 | P30: =+Q30+R30+0.5*S30 -> 34.48 | Q30: 17.75 | R30: 16.73 | S30: 0 | T30: =+U30+0.5*V30 -> 6.71 | U30: 5.71 | V30: 2 | W30: =+X30+Y30+0.5*Z30 -> 53.43 | X30: 10.26 | Y30: 40.67 | Z30: 5 | AA30: =+AB30+0.5*AC30 -> 32.23 | AB30: 31.73 | AC30: 1 | AD30: =+AE30+0.5*AF30 -> 37.15 | AE30: 36.15 | AF30: 2 | AG30: =+AH30+AI30+0.5*AJ30 -> 33.64 | AH30: 19.09 | AI30: 14.55 | AJ30: 0
A31: 6 | B31: Bowling, | C31: William | D31: CDP-MM | E31: =+G31+J31+M31+P31+T31+W31+AA31+AD31+AG31 -> 305.10 | F31: =+I31+L31+O31+S31+V31+Z31+AC31+AF31+AJ31 -> 37 | G31: =+H31+0.5*I31 -> 43.42 | H31: 42.92 | I31: 1 | J31: =+K31+0.5*L31 -> 22.37 | K31: 21.37 | L31: 2 | M31: =+N31+0.5*O31 -> 48.14 | N31: 38.14 | O31: 20 | P31: =+Q31+R31+0.5*S31 -> 38.71 | Q31: 24.02 | R31: 14.19 | S31: 1 | T31: =+U31+0.5*V31 -> 11.95 | U31: 10.45 | V31: 3 | W31: =+X31+Y31+0.5*Z31 -> 45.81 | X31: 9.16 | Y31: 33.15 | Z31: 7 | AA31: =+AB31+0.5*AC31 -> 36.66 | AB31: 35.66 | AC31: 2 | AD31: =+AE31+0.5*AF31 -> 32.60 | AE31: 32.10 | AF31: 1 | AG31: =+AH31+AI31+0.5*AJ31 -> 25.44 | AH31: 14.57 | AI31: 10.87 | AJ31: 0
A32: 7 | B32: Halliday, | C32: Mark | D32: CDP-MM | E32: =+G32+J32+M32+P32+T32+W32+AA32+AD32+AG32 -> 306.80 | F32: =+I32+L32+O32+S32+V32+Z32+AC32+AF32+AJ32 -> 38 | G32: =+H32+0.5*I32 -> 62.68 | H32: 62.68 | I32: 0 | J32: =+K32+0.5*L32 -> 23.11 | K32: 20.61 | L32: 5 | M32: =+N32+0.5*O32 -> 47.06 | N32: 44.56 | O32: 5 | P32: =+Q32+R32+0.5*S32 -> 33.11 | Q32: 19.15 | R32: 13.96 | S32: 0 | T32: =+U32+0.5*V32 -> 11.31 | U32: 9.31 | V32: 4 | W32: =+X32+Y32+0.5*Z32 -> 37.69 | X32: 5.67 | Y32: 28.02 | Z32: 8 | AA32: =+AB32+0.5*AC32 -> 38.35 | AB32: 34.85 | AC32: 7 | AD32: =+AE32+0.5*AF32 -> 32.61 | AE32: 30.11 | AF32: 5 | AG32: =+AH32+AI32+0.5*AJ32 -> 20.88 | AH32: 9.17 | AI32: 9.71 | AJ32: 4
A33: 8 | B33: Balay, | C33: Danny | D33: CDP-MM | E33: =+G33+J33+M33+P33+T33+W33+AA33+AD33+AG33 -> 307.39 | F33: =+I33+L33+O33+S33+V33+Z33+AC33+AF33+AJ33 -> 120 | G33: =+H33+0.5*I33 -> 34.40 | H33: 34.40 | I33: 0 | J33: =+K33+0.5*L33 -> 23.26 | K33: 17.26 | L33: 12 | M33: =+N33+0.5*O33 -> 63.17 | N33: 48.67 | O33: 29 | P33: =+Q33+R33+0.5*S33 -> 41.16 | Q33: 5.43 | R33: 13.73 | S33: 44 | T33: =+U33+0.5*V33 -> 14.25 | U33: 8.25 | V33: 12 | W33: =+X33+Y33+0.5*Z33 -> 40.32 | X33: 7.53 | Y33: 28.29 | Z33: 9 | AA33: =+AB33+0.5*AC33 -> 33.00 | AB33: 27.00 | AC33: 12 | AD33: =+AE33+0.5*AF33 -> 34.60 | AE33: 34.10 | AF33: 1 | AG33: =+AH33+AI33+0.5*AJ33 -> 23.23 | AH33: 12.27 | AI33: 10.46 | AJ33: 1
A34: 9 | B34: Carr, | C34: Robert | D34: CDP-MM | E34: =+G34+J34+M34+P34+T34+W34+AA34+AD34+AG34 -> 333.44 | F34: =+I34+L34+O34+S34+V34+Z34+AC34+AF34+AJ34 -> 51 | G34: =+H34+0.5*I34 -> 33.65 | H34: 32.65 | I34: 2 | J34: =+K34+0.5*L34 -> 30.45 | K34: 29.45 | L34: 2 | M34: =+N34+0.5*O34 -> 63.48 | N34: 59.98 | O34: 7 | P34: =+Q34+R34+0.5*S34 -> 30.45 | Q34: 16.69 | R34: 11.76 | S34: 4 | T34: =+U34+0.5*V34 -> 12.05 | U34: 11.55 | V34: 1 | W34: =+X34+Y34+0.5*Z34 -> 55.97 | X34: 10.25 | Y34: 36.22 | Z34: 19 | AA34: =+AB34+0.5*AC34 -> 42.99 | AB34: 40.49 | AC34: 5 | AD34: =+AE34+0.5*AF34 -> 38.05 | AE34: 33.05 | AF34: 10 | AG34: =+AH34+AI34+0.5*AJ34 -> 26.35 | AH34: 15.17 | AI34: 10.68 | AJ34: 1
A35: 10* | B35: Dunn, | C35: Rusty | D35: CDP-MM | E35: =+G35+J35+M35+P35+T35+W35+AA35+AD35+AG35 -> 368.17 | F35: =+I35+L35+O35+S35+V35+Z35+AC35+AF35+AJ35 -> 156 | G35: =+H35+0.5*I35 -> 35.00 | H35: 31.00 | I35: 8 | J35: =+K35+0.5*L35 -> 26.18 | K35: 21.68 | L35: 9 | M35: =+N35+0.5*O35 -> 57.29 | N35: 51.29 | O35: 12 | P35: =+Q35+R35+0.5*S35 -> 40.58 | Q35: 16.73 | R35: 14.35 | S35: 19 | T35: =+U35+0.5*V35 -> 28.99 | U35: 8.99 | V35: 40 | W35: =+X35+Y35+0.5*Z35 -> 45.06 | X35: 5.57 | Y35: 30.49 | Z35: 18 | AA35: =+AB35+0.5*AC35 -> 46.93 | AB35: 32.93 | AC35: 28 | AD35: =+AE35+0.5*AF35 -> 50.11 | AE35: 45.61 | AF35: 9 | AG35: =+AH35+AI35+0.5*AJ35 -> 38.03 | AH35: 14.79 | AI35: 16.74 | AJ35: 13
A36: 11 | B36: Redocto, | C36: Leonardo | D36: CDP-MM | E36: =+G36+J36+M36+P36+T36+W36+AA36+AD36+AG36 -> 398.53 | F36: =+I36+L36+O36+S36+V36+Z36+AC36+AF36+AJ36 -> 78 | G36: =+H36+0.5*I36 -> 46.91 | H36: 44.91 | I36: 4 | J36: =+K36+0.5*L36 -> 31.40 | K36: 28.90 | L36: 5 | M36: =+N36+0.5*O36 -> 58.96 | N36: 53.46 | O36: 11 | P36: =+Q36+R36+0.5*S36 -> 44.19 | Q36: 20.59 | R36: 22.10 | S36: 3 | T36: =+U36+0.5*V36 -> 10.39 | U36: 9.89 | V36: 1 | W36: =+X36+Y36+0.5*Z36 -> 62.12 | X36: 11.33 | Y36: 43.29 | Z36: 15 | AA36: =+AB36+0.5*AC36 -> 54.51 | AB36: 51.51 | AC36: 6 | AD36: =+AE36+0.5*AF36 -> 56.47 | AE36: 42.47 | AF36: 28 | AG36: =+AH36+AI36+0.5*AJ36 -> 33.58 | AH36: 16.38 | AI36: 14.70 | AJ36: 5
A37: 12 | B37: Jelin, | C37: Barry | D37: CDP-MM | E37: =+G37+J37+M37+P37+T37+W37+AA37+AD37+AG37 -> 430.29 | F37: =+I37+L37+O37+S37+V37+Z37+AC37+AF37+AJ37 -> 158 | G37: =+H37+0.5*I37 -> 37.71 | H37: 37.21 | I37: 1 | J37: =+K37+0.5*L37 -> 41.96 | K37: 31.46 | L37: 21 | M37: =+N37+0.5*O37 -> 78.52 | N37: 55.02 | O37: 47 | P37: =+Q37+R37+0.5*S37 -> 67.79 | Q37: 39.77 | R37: 23.52 | S37: 9 | T37: =+U37+0.5*V37 -> 13.45 | U37: 10.45 | V37: 6 | W37: =+X37+Y37+0.5*Z37 -> 53.44 | X37: 8.12 | Y37: 33.82 | Z37: 23 | AA37: =+AB37+0.5*AC37 -> 56.90 | AB37: 43.90 | AC37: 26 | AD37: =+AE37+0.5*AF37 -> 49.94 | AE37: 41.44 | AF37: 17 | AG37: =+AH37+AI37+0.5*AJ37 -> 30.58 | AH37: 14.08 | AI37: 12.50 | AJ37: 8
A38: ESP-MA
A39: 1 | B39: Boshard, | C39: David | D39: ESP-MA | E39: =+G39+J39+M39+P39+T39+W39+AA39+AD39+AG39 -> 163.85 | F39: =+I39+L39+O39+S39+V39+Z39+AC39+AF39+AJ39 -> 17 | G39: =+H39+0.5*I39 -> 16.10 | H39: 15.60 | I39: 1 | J39: =+K39+0.5*L39 -> 14.97 | K39: 13.97 | L39: 2 | M39: =+N39+0.5*O39 -> 25.83 | N39: 24.33 | O39: 3 | P39: =+Q39+R39+0.5*S39 -> 22.38 | Q39: 10.66 | R39: 10.72 | S39: 2 | T39: =+U39+0.5*V39 -> 8.56 | U39: 7.56 | V39: 2 | W39: =+X39+Y39+0.5*Z39 -> 25.99 | X39: 4.24 | Y39: 18.25 | Z39: 7 | AA39: =+AB39+0.5*AC39 -> 17.29 | AB39: 17.29 | AC39: 0 | AD39: =+AE39+0.5*AF39 -> 15.82 | AE39: 15.82 | AF39: 0 | AG39: =+AH39+AI39+0.5*AJ39 -> 16.91 | AH39: 9.81 | AI39: 7.10 | AJ39: 0
A40: 2 | B40: Gelo, | C40: Ivan | D40: ESP-MA | E40: =+G40+J40+M40+P40+T40+W40+AA40+AD40+AG40 -> 207.71 | F40: =+I40+L40+O40+S40+V40+Z40+AC40+AF40+AJ40 -> 77 | G40: =+H40+0.5*I40 -> 25.63 | H40: 25.13 | I40: 1 | J40: =+K40+0.5*L40 -> 16.58 | K40: 16.08 | L40: 1 | M40: =+N40+0.5*O40 -> 42.38 | N40: 21.38 | O40: 42 | P40: =+Q40+R40+0.5*S40 -> 25.50 | Q40: 10.78 | R40: 14.72 | S40: 0 | T40: =+U40+0.5*V40 -> 18.72 | U40: 8.72 | V40: 20 | W40: =+X40+Y40+0.5*Z40 -> 25.70 | X40: 4.84 | Y40: 18.86 | Z40: 4 | AA40: =+AB40+0.5*AC40 -> 19.69 | AB40: 18.19 | AC40: 3 | AD40: =+AE40+0.5*AF40 -> 17.27 | AE40: 16.27 | AF40: 2 | AG40: =+AH40+AI40+0.5*AJ40 -> 16.24 | AH40: 8.28 | AI40: 5.96 | AJ40: 4
A41: ESP-EX
A42: 1 | B42: Edwards, | C42: Lance | D42: ESP-EX | E42: =+G42+J42+M42+P42+T42+W42+AA42+AD42+AG42 -> 158.75 | F42: =+I42+L42+O42+S42+V42+Z42+AC42+AF42+AJ42 -> 30 | G42: =+H42+0.5*I42 -> 18.60 | H42: 18.60 | I42: 0 | J42: =+K42+0.5*L42 -> 14.86 | K42: 11.86 | L42: 6 | M42: =+N42+0.5*O42 -> 24.40 | N42: 21.40 | O42: 6 | P42: =+Q42+R42+0.5*S42 -> 22.81 | Q42: 14.60 | R42: 8.21 | S42: 0 | T42: =+U42+0.5*V42 -> 6.00 | U42: 6.00 | V42: 0 | W42: =+X42+Y42+0.5*Z42 -> 23.53 | X42: 3.87 | Y42: 18.16 | Z42: 3 | AA42: =+AB42+0.5*AC42 -> 19.67 | AB42: 15.67 | AC42: 8 | AD42: =+AE42+0.5*AF42 -> 14.20 | AE42: 13.20 | AF42: 2 | AG42: =+AH42+AI42+0.5*AJ42 -> 14.68 | AH42: 6.79 | AI42: 5.39 | AJ42: 5
A43: ESP-SS
A44: 1 | B44: Zaccardi, | C44: Pat | D44: ESP-SS | E44: =+G44+J44+M44+P44+T44+W44+AA44+AD44+AG44 -> 196.74 | F44: =+I44+L44+O44+S44+V44+Z44+AC44+AF44+AJ44 -> 39 | G44: =+H44+0.5*I44 -> 24.67 | H44: 23.67 | I44: 2 | J44: =+K44+0.5*L44 -> 14.95 | K44: 13.45 | L44: 3 | M44: =+N44+0.5*O44 -> 31.40 | N44: 25.40 | O44: 12 | P44: =+Q44+R44+0.5*S44 -> 23.04 | Q44: 10.17 | R44: 8.37 | S44: 9 | T44: =+U44+0.5*V44 -> 8.75 | U44: 8.75 | V44: 0 | W44: =+X44+Y44+0.5*Z44 -> 24.45 | X44: 5.41 | Y44: 17.54 | Z44: 3 | AA44: =+AB44+0.5*AC44 -> 28.71 | AB44: 27.71 | AC44: 2 | AD44: =+AE44+0.5*AF44 -> 20.66 | AE44: 19.66 | AF44: 2 | AG44: =+AH44+AI44+0.5*AJ44 -> 20.11 | AH44: 10.18 | AI44: 6.93 | AJ44: 6
A45: 2 | B45: Greathouse, | C45: Joseph | D45: ESP-SS | E45: =+G45+J45+M45+P45+T45+W45+AA45+AD45+AG45 -> 223.96 | F45: =+I45+L45+O45+S45+V45+Z45+AC45+AF45+AJ45 -> 43 | G45: =+H45+0.5*I45 -> 26.71 | H45: 26.71 | I45: 0 | J45: =+K45+0.5*L45 -> 21.85 | K45: 14.85 | L45: 14 | M45: =+N45+0.5*O45 -> 36.55 | N45: 32.55 | O45: 8 | P45: =+Q45+R45+0.5*S45 -> 25.87 | Q45: 13.04 | R45: 9.33 | S45: 7 | T45: =+U45+0.5*V45 -> 9.33 | U45: 7.83 | V45: 3 | W45: =+X45+Y45+0.5*Z45 -> 34.56 | X45: 4.72 | Y45: 27.34 | Z45: 5 | AA45: =+AB45+0.5*AC45 -> 26.58 | AB45: 26.08 | AC45: 1 | AD45: =+AE45+0.5*AF45 -> 24.13 | AE45: 22.63 | AF45: 3 | AG45: =+AH45+AI45+0.5*AJ45 -> 18.38 | AH45: 10.07 | AI45: 7.31 | AJ45: 2
A46: 3 | B46: Collins, | C46: Ken | D46: ESP-SS | E46: =+G46+J46+M46+P46+T46+W46+AA46+AD46+AG46 -> 224.24 | F46: =+I46+L46+O46+S46+V46+Z46+AC46+AF46+AJ46 -> 40 | G46: =+H46+0.5*I46 -> 27.48 | H46: 26.98 | I46: 1 | J46: =+K46+0.5*L46 -> 14.16 | K46: 13.16 | L46: 2 | M46: =+N46+0.5*O46 -> 39.49 | N46: 35.99 | O46: 7 | P46: =+Q46+R46+0.5*S46 -> 32.18 | Q46: 14.14 | R46: 10.54 | S46: 15 | T46: =+U46+0.5*V46 -> 8.29 | U46: 7.29 | V46: 2 | W46: =+X46+Y46+0.5*Z46 -> 26.03 | X46: 5.24 | Y46: 18.29 | Z46: 5 | AA46: =+AB46+0.5*AC46 -> 32.16 | AB46: 31.16 | AC46: 2 | AD46: =+AE46+0.5*AF46 -> 20.58 | AE46: 20.58 | AF46: 0 | AG46: =+AH46+AI46+0.5*AJ46 -> 23.87 | AH46: 10.95 | AI46: 9.92 | AJ46: 6
A47: 4 | B47: Peterson, | C47: Todd | D47: ESP-SS | E47: =+G47+J47+M47+P47+T47+W47+AA47+AD47+AG47 -> 225.67 | F47: =+I47+L47+O47+S47+V47+Z47+AC47+AF47+AJ47 -> 47 | G47: =+H47+0.5*I47 -> 27.24 | H47: 27.24 | I47: 0 | J47: =+K47+0.5*L47 -> 17.74 | K47: 17.24 | L47: 1 | M47: =+N47+0.5*O47 -> 39.24 | N47: 39.24 | O47: 0 | P47: =+Q47+R47+0.5*S47 -> 27.38 | Q47: 7.82 | R47: 11.56 | S47: 16 | T47: =+U47+0.5*V47 -> 7.27 | U47: 7.27 | V47: 0 | W47: =+X47+Y47+0.5*Z47 -> 30.36 | X47: 4.97 | Y47: 23.39 | Z47: 4 | AA47: =+AB47+0.5*AC47 -> 32.67 | AB47: 27.17 | AC47: 11 | AD47: =+AE47+0.5*AF47 -> 24.00 | AE47: 20.00 | AF47: 8 | AG47: =+AH47+AI47+0.5*AJ47 -> 19.77 | AH47: 8.11 | AI47: 8.16 | AJ47: 7
A48: 5 | B48: Parks, | C48: Justin | D48: ESP-SS | E48: =+G48+J48+M48+P48+T48+W48+AA48+AD48+AG48 -> 246.49 | F48: =+I48+L48+O48+S48+V48+Z48+AC48+AF48+AJ48 -> 55 | G48: =+H48+0.5*I48 -> 31.10 | H48: 30.60 | I48: 1 | J48: =+K48+0.5*L48 -> 19.11 | K48: 16.11 | L48: 6 | M48: =+N48+0.5*O48 -> 40.40 | N48: 33.90 | O48: 13 | P48: =+Q48+R48+0.5*S48 -> 31.17 | Q48: 15.88 | R48: 11.79 | S48: 7 | T48: =+U48+0.5*V48 -> 7.26 | U48: 5.76 | V48: 3 | W48: =+X48+Y48+0.5*Z48 -> 36.44 | X48: 4.93 | Y48: 24.01 | Z48: 15 | AA48: =+AB48+0.5*AC48 -> 32.74 | AB48: 29.74 | AC48: 6 | AD48: =+AE48+0.5*AF48 -> 32.26 | AE48: 31.26 | AF48: 2 | AG48: =+AH48+AI48+0.5*AJ48 -> 16.01 | AH48: 8.04 | AI48: 6.97 | AJ48: 2
A49: 6 | B49: Mortenson, | C49: Bryan | D49: ESP-SS | E49: =+G49+J49+M49+P49+T49+W49+AA49+AD49+AG49 -> 249.91 | F49: =+I49+L49+O49+S49+V49+Z49+AC49+AF49+AJ49 -> 48 | G49: =+H49+0.5*I49 -> 28.70 | H49: 28.20 | I49: 1 | J49: =+K49+0.5*L49 -> 24.60 | K49: 17.10 | L49: 15 | M49: =+N49+0.5*O49 -> 50.36 | N49: 41.36 | O49: 18 | P49: =+Q49+R49+0.5*S49 -> 30.44 | Q49: 16.36 | R49: 13.58 | S49: 1 | T49: =+U49+0.5*V49 -> 9.11 | U49: 6.11 | V49: 6 | W49: =+X49+Y49+0.5*Z49 -> 32.10 | X49: 6.18 | Y49: 23.42 | Z49: 5 | AA49: =+AB49+0.5*AC49 -> 27.03 | AB49: 26.53 | AC49: 1 | AD49: =+AE49+0.5*AF49 -> 29.30 | AE49: 29.30 | AF49: 0 | AG49: =+AH49+AI49+0.5*AJ49 -> 18.27 | AH49: 9.83 | AI49: 7.94 | AJ49: 1
A50: ESP-MM
A51: 1 | B51: Zaccardi, | C51: Juke | D51: ESP-MM | E51: =+G51+J51+M51+P51+T51+W51+AA51+AD51+AG51 -> 242.29 | F51: =+I51+L51+O51+S51+V51+Z51+AC51+AF51+AJ51 -> 50 | G51: =+H51+0.5*I51 -> 26.04 | H51: 25.54 | I51: 1 | J51: =+K51+0.5*L51 -> 21.20 | K51: 15.20 | L51: 12 | M51: =+N51+0.5*O51 -> 39.83 | N51: 31.83 | O51: 16 | P51: =+Q51+R51+0.5*S51 -> 26.00 | Q51: 14.10 | R51: 11.90 | S51: 0 | T51: =+U51+0.5*V51 -> 8.80 | U51: 8.30 | V51: 1 | W51: =+X51+Y51+0.5*Z51 -> 33.06 | X51: 5.72 | Y51: 23.84 | Z51: 7 | AA51: =+AB51+0.5*AC51 -> 35.41 | AB51: 29.91 | AC51: 11 | AD51: =+AE51+0.5*AF51 -> 26.96 | AE51: 26.96 | AF51: 0 | AG51: =+AH51+AI51+0.5*AJ51 -> 24.99 | AH51: 14.39 | AI51: 9.60 | AJ51: 2
A52: 2 | B52: Katz, | C52: Eric | D52: ESP-MM | E52: =+G52+J52+M52+P52+T52+W52+AA52+AD52+AG52 -> 266.79 | F52: =+I52+L52+O52+S52+V52+Z52+AC52+AF52+AJ52 -> 72 | G52: =+H52+0.5*I52 -> 41.98 | H52: 40.48 | I52: 3 | J52: =+K52+0.5*L52 -> 21.92 | K52: 20.42 | L52: 3 | M52: =+N52+0.5*O52 -> 46.96 | N52: 33.96 | O52: 26 | P52: =+Q52+R52+0.5*S52 -> 28.15 | Q52: 14.78 | R52: 12.87 | S52: 1 | T52: =+U52+0.5*V52 -> 9.99 | U52: 9.49 | V52: 1 | W52: =+X52+Y52+0.5*Z52 -> 35.81 | X52: 5.46 | Y52: 22.35 | Z52: 16 | AA52: =+AB52+0.5*AC52 -> 33.42 | AB52: 26.92 | AC52: 13 | AD52: =+AE52+0.5*AF52 -> 26.14 | AE52: 23.14 | AF52: 6 | AG52: =+AH52+AI52+0.5*AJ52 -> 22.42 | AH52: 11.11 | AI52: 9.81 | AJ52: 3
A54: Legend/Notes:
A55: X | B55: = Shooters who received trophies for their specific Division/Classification.
A56: Xx Xx | B56: = Shooters who acted as SOs or were part of the Match Staff.
A57: DQ | B57: = Shooter was disqualified for some reason.
A58: XX | B58: = Points Down value included some sore of penalty (Procedural, Hit On Non-threat, Failure to Neutralize, etc.)
A59: XXX.XX | B59: = Because these shooters took 1st place in their specific Div/Class, and there were more than 10 shooters competing in their classification, they were automatically advanced to the next highest classification.
A60: 10* | B60: = Although signed off by the shooter and the SO, Rusty Dunn's score sheet for Stage 1 did not have a time for the stage. As a result, his placing is based on an arbitrary time for Stage 1 (31.00). A value that is plus or minus 20 seconds from the 31.00 seconds given, would not have affected his placing.
B62: All of the individual scores were verified on 9/16/03. Some corrections may have resulted in minor placing changes, but none affected the final trophy winning results.