A2: Utah State IDPA Match - 2003 Results | I2: (Sorted by Total Points Down without regard for Division/Classification.)
B3: Held on September 13, 2003 | G3: 1 | J3: 2 | M3: 3 | P3: 4 | T3: 5 | W3: 6 | AA3: 7 | AD3: 8 | AG3: 9
A4: Place | B4: Name (Last, First) | D4: (Div-Class) | E4: Shoot Total | F4: Total PD | G4: Stage 1 | H4: String 1 | I4: Points Down | J4: Stage 2 | K4: String 1 | L4: Points Down | M4: Stage 3 | N4: String 1 | O4: Points Down | P4: Stage 4 | Q4: String 1 | R4: String 2 | S4: Points Down | T4: Stage 5 | U4: String 1 | V4: Points Down | W4: Stage 6 | X4: String 1 | Y4: String 2 | Z4: Points Down | AA4: Stage 7 | AB4: String 1 | AC4: Points Down | AD4: Stage 8 | AE4: String 1 | AF4: Points Down | AG4: Stage 9 | AH4: String 1 | AI4: String 2 | AJ4: Points Down
A5: 1 | B5: Attryde, | C5: Ed | D5: CDP-MM | E5: =+G5+J5+M5+P5+T5+W5+AA5+AD5+AG5 -> 293.01 | F5: =+I5+L5+O5+S5+V5+Z5+AC5+AF5+AJ5 -> 13 | G5: =+H5+0.5*I5 -> 34.54 | H5: 33.54 | I5: 2 | J5: =+K5+0.5*L5 -> 23.87 | K5: 23.87 | L5: 0 | M5: =+N5+0.5*O5 -> 36.96 | N5: 36.46 | O5: 1 | P5: =+Q5+R5+0.5*S5 -> 34.48 | Q5: 17.75 | R5: 16.73 | S5: 0 | T5: =+U5+0.5*V5 -> 6.71 | U5: 5.71 | V5: 2 | W5: =+X5+Y5+0.5*Z5 -> 53.43 | X5: 10.26 | Y5: 40.67 | Z5: 5 | AA5: =+AB5+0.5*AC5 -> 32.23 | AB5: 31.73 | AC5: 1 | AD5: =+AE5+0.5*AF5 -> 37.15 | AE5: 36.15 | AF5: 2 | AG5: =+AH5+AI5+0.5*AJ5 -> 33.64 | AH5: 19.09 | AI5: 14.55 | AJ5: 0
A6: 2 | B6: Haslem, | C6: Alan | D6: CDP-EX | E6: =+G6+J6+M6+P6+T6+W6+AA6+AD6+AG6 -> 239.20 | F6: =+I6+L6+O6+S6+V6+Z6+AC6+AF6+AJ6 -> 15 | G6: =+H6+0.5*I6 -> 26.35 | H6: 24.85 | I6: 3 | J6: =+K6+0.5*L6 -> 18.40 | K6: 17.90 | L6: 1 | M6: =+N6+0.5*O6 -> 35.73 | N6: 35.23 | O6: 1 | P6: =+Q6+R6+0.5*S6 -> 28.02 | Q6: 14.83 | R6: 13.19 | S6: 0 | T6: =+U6+0.5*V6 -> 19.54 | U6: 17.54 | V6: 4 | W6: =+X6+Y6+0.5*Z6 -> 35.19 | X6: 5.68 | Y6: 29.01 | Z6: 1 | AA6: =+AB6+0.5*AC6 -> 29.97 | AB6: 28.97 | AC6: 2 | AD6: =+AE6+0.5*AF6 -> 27.67 | AE6: 27.17 | AF6: 1 | AG6: =+AH6+AI6+0.5*AJ6 -> 18.33 | AH6: 9.50 | AI6: 7.83 | AJ6: 2
A7: 3 | B7: Boshard, | C7: David | D7: ESP-MA | E7: =+G7+J7+M7+P7+T7+W7+AA7+AD7+AG7 -> 163.85 | F7: =+I7+L7+O7+S7+V7+Z7+AC7+AF7+AJ7 -> 17 | G7: =+H7+0.5*I7 -> 16.10 | H7: 15.60 | I7: 1 | J7: =+K7+0.5*L7 -> 14.97 | K7: 13.97 | L7: 2 | M7: =+N7+0.5*O7 -> 25.83 | N7: 24.33 | O7: 3 | P7: =+Q7+R7+0.5*S7 -> 22.38 | Q7: 10.66 | R7: 10.72 | S7: 2 | T7: =+U7+0.5*V7 -> 8.56 | U7: 7.56 | V7: 2 | W7: =+X7+Y7+0.5*Z7 -> 25.99 | X7: 4.24 | Y7: 18.25 | Z7: 7 | AA7: =+AB7+0.5*AC7 -> 17.29 | AB7: 17.29 | AC7: 0 | AD7: =+AE7+0.5*AF7 -> 15.82 | AE7: 15.82 | AF7: 0 | AG7: =+AH7+AI7+0.5*AJ7 -> 16.91 | AH7: 9.81 | AI7: 7.10 | AJ7: 0
A8: 4 | B8: Koski, | C8: Steve | D8: SSP-MA | E8: =+G8+J8+M8+P8+T8+W8+AA8+AD8+AG8 -> 173.51 | F8: =+I8+L8+O8+S8+V8+Z8+AC8+AF8+AJ8 -> 17 | G8: =+H8+0.5*I8 -> 24.47 | H8: 24.47 | I8: 0 | J8: =+K8+0.5*L8 -> 16.09 | K8: 13.09 | L8: 6 | M8: =+N8+0.5*O8 -> 27.31 | N8: 26.31 | O8: 2 | P8: =+Q8+R8+0.5*S8 -> 17.78 | Q8: 9.55 | R8: 8.23 | S8: 0 | T8: =+U8+0.5*V8 -> 6.89 | U8: 6.89 | V8: 0 | W8: =+X8+Y8+0.5*Z8 -> 25.11 | X8: 5.82 | Y8: 18.79 | Z8: 1 | AA8: =+AB8+0.5*AC8 -> 23.70 | AB8: 21.70 | AC8: 4 | AD8: =+AE8+0.5*AF8 -> 16.76 | AE8: 16.26 | AF8: 1 | AG8: =+AH8+AI8+0.5*AJ8 -> 15.40 | AH8: 7.53 | AI8: 6.37 | AJ8: 3
A9: 5 | B9: Sterling, | C9: Scott | D9: SSP-MM | E9: =+G9+J9+M9+P9+T9+W9+AA9+AD9+AG9 -> 367.51 | F9: =+I9+L9+O9+S9+V9+Z9+AC9+AF9+AJ9 -> 17 | G9: =+H9+0.5*I9 -> 41.89 | H9: 41.89 | I9: 0 | J9: =+K9+0.5*L9 -> 28.21 | K9: 24.71 | L9: 7 | M9: =+N9+0.5*O9 -> 56.25 | N9: 54.25 | O9: 4 | P9: =+Q9+R9+0.5*S9 -> 56.60 | Q9: 21.79 | R9: 33.31 | S9: 3 | T9: =+U9+0.5*V9 -> 9.39 | U9: 9.39 | V9: 0 | W9: =+X9+Y9+0.5*Z9 -> 50.16 | X9: 9.34 | Y9: 40.82 | Z9: 0 | AA9: =+AB9+0.5*AC9 -> 49.87 | AB9: 49.87 | AC9: 0 | AD9: =+AE9+0.5*AF9 -> 46.41 | AE9: 45.91 | AF9: 1 | AG9: =+AH9+AI9+0.5*AJ9 -> 28.73 | AH9: 14.74 | AI9: 12.99 | AJ9: 2
A10: 6 | B10: Boyer, | C10: Stephen | D10: SSP-MM | E10: =+G10+J10+M10+P10+T10+W10+AA10+AD10+AG10 -> 297.82 | F10: =+I10+L10+O10+S10+V10+Z10+AC10+AF10+AJ10 -> 18 | G10: =+H10+0.5*I10 -> 34.38 | H10: 33.88 | I10: 1 | J10: =+K10+0.5*L10 -> 24.85 | K10: 24.35 | L10: 1 | M10: =+N10+0.5*O10 -> 51.71 | N10: 47.21 | O10: 9 | P10: =+Q10+R10+0.5*S10 -> 33.67 | Q10: 19.17 | R10: 14.50 | S10: 0 | T10: =+U10+0.5*V10 -> 9.97 | U10: 9.97 | V10: 0 | W10: =+X10+Y10+0.5*Z10 -> 40.44 | X10: 6.18 | Y10: 32.76 | Z10: 3 | AA10: =+AB10+0.5*AC10 -> 42.57 | AB10: 41.07 | AC10: 3 | AD10: =+AE10+0.5*AF10 -> 37.41 | AE10: 36.91 | AF10: 1 | AG10: =+AH10+AI10+0.5*AJ10 -> 22.82 | AH10: 12.41 | AI10: 10.41 | AJ10: 0
A11: 7 | B11: Mahoney, | C11: Chuck | D11: SSP-MA | E11: =+G11+J11+M11+P11+T11+W11+AA11+AD11+AG11 -> 152.72 | F11: =+I11+L11+O11+S11+V11+Z11+AC11+AF11+AJ11 -> 23 | G11: =+H11+0.5*I11 -> 21.06 | H11: 18.06 | I11: 6 | J11: =+K11+0.5*L11 -> 11.33 | K11: 10.83 | L11: 1 | M11: =+N11+0.5*O11 -> 20.36 | N11: 18.86 | O11: 3 | P11: =+Q11+R11+0.5*S11 -> 20.01 | Q11: 10.88 | R11: 9.13 | S11: 0 | T11: =+U11+0.5*V11 -> 6.74 | U11: 5.24 | V11: 3 | W11: =+X11+Y11+0.5*Z11 -> 22.84 | X11: 4.15 | Y11: 17.19 | Z11: 3 | AA11: =+AB11+0.5*AC11 -> 20.52 | AB11: 18.52 | AC11: 4 | AD11: =+AE11+0.5*AF11 -> 15.99 | AE11: 14.99 | AF11: 2 | AG11: =+AH11+AI11+0.5*AJ11 -> 13.87 | AH11: 7.61 | AI11: 5.76 | AJ11: 1
A12: 8 | B12: Vilos, | C12: Mitch | D12: SSP-EX | E12: =+G12+J12+M12+P12+T12+W12+AA12+AD12+AG12 -> 222.62 | F12: =+I12+L12+O12+S12+V12+Z12+AC12+AF12+AJ12 -> 25 | G12: =+H12+0.5*I12 -> 26.16 | H12: 25.16 | I12: 2 | J12: =+K12+0.5*L12 -> 15.30 | K12: 15.30 | L12: 0 | M12: =+N12+0.5*O12 -> 31.32 | N12: 31.32 | O12: 0 | P12: =+Q12+R12+0.5*S12 -> 31.29 | Q12: 14.17 | R12: 12.62 | S12: 9 | T12: =+U12+0.5*V12 -> 16.61 | U12: 11.11 | V12: 11 | W12: =+X12+Y12+0.5*Z12 -> 26.00 | X12: 5.03 | Y12: 20.97 | Z12: 0 | AA12: =+AB12+0.5*AC12 -> 25.59 | AB12: 25.09 | AC12: 1 | AD12: =+AE12+0.5*AF12 -> 30.66 | AE12: 30.16 | AF12: 1 | AG12: =+AH12+AI12+0.5*AJ12 -> 19.69 | AH12: 10.92 | AI12: 8.27 | AJ12: 1
A13: 9 | B13: Mousley, | C13: Roger | D13: SSR-EX | E13: =+G13+J13+M13+P13+T13+W13+AA13+AD13+AG13 -> 253.35 | F13: =+I13+L13+O13+S13+V13+Z13+AC13+AF13+AJ13 -> 26 | G13: =+H13+0.5*I13 -> 29.61 | H13: 29.11 | I13: 1 | J13: =+K13+0.5*L13 -> 19.24 | K13: 15.74 | L13: 7 | M13: =+N13+0.5*O13 -> 42.55 | N13: 40.55 | O13: 4 | P13: =+Q13+R13+0.5*S13 -> 25.80 | Q13: 13.51 | R13: 11.79 | S13: 1 | T13: =+U13+0.5*V13 -> 8.35 | U13: 7.85 | V13: 1 | W13: =+X13+Y13+0.5*Z13 -> 45.44 | X13: 5.12 | Y13: 35.82 | Z13: 9 | AA13: =+AB13+0.5*AC13 -> 32.65 | AB13: 32.15 | AC13: 1 | AD13: =+AE13+0.5*AF13 -> 22.29 | AE13: 22.29 | AF13: 0 | AG13: =+AH13+AI13+0.5*AJ13 -> 27.42 | AH13: 11.97 | AI13: 14.45 | AJ13: 2
A14: 10 | B14: Roubinet, | C14: Paul | D14: SSP-MM | E14: =+G14+J14+M14+P14+T14+W14+AA14+AD14+AG14 -> 332.57 | F14: =+I14+L14+O14+S14+V14+Z14+AC14+AF14+AJ14 -> 27 | G14: =+H14+0.5*I14 -> 48.32 | H14: 47.32 | I14: 2 | J14: =+K14+0.5*L14 -> 22.26 | K14: 22.26 | L14: 0 | M14: =+N14+0.5*O14 -> 56.09 | N14: 54.59 | O14: 3 | P14: =+Q14+R14+0.5*S14 -> 46.30 | Q14: 21.59 | R14: 19.21 | S14: 11 | T14: =+U14+0.5*V14 -> 10.39 | U14: 10.39 | V14: 0 | W14: =+X14+Y14+0.5*Z14 -> 55.24 | X14: 6.88 | Y14: 45.86 | Z14: 5 | AA14: =+AB14+0.5*AC14 -> 38.57 | AB14: 38.07 | AC14: 1 | AD14: =+AE14+0.5*AF14 -> 34.58 | AE14: 33.58 | AF14: 2 | AG14: =+AH14+AI14+0.5*AJ14 -> 20.82 | AH14: 9.52 | AI14: 9.80 | AJ14: 3
A15: 11 | B15: Latham, | C15: Cory | D15: CDP-EX | E15: =+G15+J15+M15+P15+T15+W15+AA15+AD15+AG15 -> 178.65 | F15: =+I15+L15+O15+S15+V15+Z15+AC15+AF15+AJ15 -> 28 | G15: =+H15+0.5*I15 -> 22.46 | H15: 21.46 | I15: 2 | J15: =+K15+0.5*L15 -> 16.71 | K15: 15.71 | L15: 2 | M15: =+N15+0.5*O15 -> 24.78 | N15: 21.78 | O15: 6 | P15: =+Q15+R15+0.5*S15 -> 21.88 | Q15: 10.98 | R15: 8.40 | S15: 5 | T15: =+U15+0.5*V15 -> 8.68 | U15: 8.18 | V15: 1 | W15: =+X15+Y15+0.5*Z15 -> 27.49 | X15: 4.46 | Y15: 20.03 | Z15: 6 | AA15: =+AB15+0.5*AC15 -> 20.18 | AB15: 20.18 | AC15: 0 | AD15: =+AE15+0.5*AF15 -> 21.47 | AE15: 18.47 | AF15: 6 | AG15: =+AH15+AI15+0.5*AJ15 -> 15.00 | AH15: 8.26 | AI15: 6.74 | AJ15: 0
A16: 12 | B16: Lowe, | C16: John | D16: SSP-MA | E16: =+G16+J16+M16+P16+T16+W16+AA16+AD16+AG16 -> 202.67 | F16: =+I16+L16+O16+S16+V16+Z16+AC16+AF16+AJ16 -> 28 | G16: =+H16+0.5*I16 -> 37.80 | H16: 37.80 | I16: 0 | J16: =+K16+0.5*L16 -> 16.84 | K16: 15.84 | L16: 2 | M16: =+N16+0.5*O16 -> 28.78 | N16: 27.28 | O16: 3 | P16: =+Q16+R16+0.5*S16 -> 23.55 | Q16: 13.98 | R16: 9.07 | S16: 1 | T16: =+U16+0.5*V16 -> 6.24 | U16: 6.24 | V16: 0 | W16: =+X16+Y16+0.5*Z16 -> 29.65 | X16: 4.65 | Y16: 21.50 | Z16: 7 | AA16: =+AB16+0.5*AC16 -> 21.02 | AB16: 18.02 | AC16: 6 | AD16: =+AE16+0.5*AF16 -> 20.08 | AE16: 17.08 | AF16: 6 | AG16: =+AH16+AI16+0.5*AJ16 -> 18.71 | AH16: 9.44 | AI16: 7.77 | AJ16: 3
A17: 13 | B17: Berry, | C17: Robert | D17: CDP-SS | E17: =+G17+J17+M17+P17+T17+W17+AA17+AD17+AG17 -> 266.49 | F17: =+I17+L17+O17+S17+V17+Z17+AC17+AF17+AJ17 -> 28 | G17: =+H17+0.5*I17 -> 42.10 | H17: 42.10 | I17: 0 | J17: =+K17+0.5*L17 -> 26.16 | K17: 23.16 | L17: 6 | M17: =+N17+0.5*O17 -> 39.37 | N17: 35.87 | O17: 7 | P17: =+Q17+R17+0.5*S17 -> 29.21 | Q17: 12.58 | R17: 15.13 | S17: 3 | T17: =+U17+0.5*V17 -> 10.76 | U17: 10.76 | V17: 0 | W17: =+X17+Y17+0.5*Z17 -> 41.19 | X17: 6.19 | Y17: 34.50 | Z17: 1 | AA17: =+AB17+0.5*AC17 -> 25.01 | AB17: 24.51 | AC17: 1 | AD17: =+AE17+0.5*AF17 -> 29.31 | AE17: 25.31 | AF17: 8 | AG17: =+AH17+AI17+0.5*AJ17 -> 23.38 | AH17: 13.01 | AI17: 9.37 | AJ17: 2
A18: 14 | B18: Lepley, | C18: Alex | D18: CDP-EX | E18: =+G18+J18+M18+P18+T18+W18+AA18+AD18+AG18 -> 196.99 | F18: =+I18+L18+O18+S18+V18+Z18+AC18+AF18+AJ18 -> 29 | G18: =+H18+0.5*I18 -> 19.76 | H18: 19.26 | I18: 1 | J18: =+K18+0.5*L18 -> 17.21 | K18: 14.21 | L18: 6 | M18: =+N18+0.5*O18 -> 30.53 | N18: 28.53 | O18: 4 | P18: =+Q18+R18+0.5*S18 -> 24.03 | Q18: 12.88 | R18: 9.15 | S18: 4 | T18: =+U18+0.5*V18 -> 8.94 | U18: 7.94 | V18: 2 | W18: =+X18+Y18+0.5*Z18 -> 28.94 | X18: 4.66 | Y18: 21.78 | Z18: 5 | AA18: =+AB18+0.5*AC18 -> 22.80 | AB18: 21.80 | AC18: 2 | AD18: =+AE18+0.5*AF18 -> 24.91 | AE18: 22.91 | AF18: 4 | AG18: =+AH18+AI18+0.5*AJ18 -> 19.87 | AH18: 9.42 | AI18: 9.95 | AJ18: 1
A19: 15 | B19: Edwards, | C19: Lance | D19: ESP-EX | E19: =+G19+J19+M19+P19+T19+W19+AA19+AD19+AG19 -> 158.75 | F19: =+I19+L19+O19+S19+V19+Z19+AC19+AF19+AJ19 -> 30 | G19: =+H19+0.5*I19 -> 18.60 | H19: 18.60 | I19: 0 | J19: =+K19+0.5*L19 -> 14.86 | K19: 11.86 | L19: 6 | M19: =+N19+0.5*O19 -> 24.40 | N19: 21.40 | O19: 6 | P19: =+Q19+R19+0.5*S19 -> 22.81 | Q19: 14.60 | R19: 8.21 | S19: 0 | T19: =+U19+0.5*V19 -> 6.00 | U19: 6.00 | V19: 0 | W19: =+X19+Y19+0.5*Z19 -> 23.53 | X19: 3.87 | Y19: 18.16 | Z19: 3 | AA19: =+AB19+0.5*AC19 -> 19.67 | AB19: 15.67 | AC19: 8 | AD19: =+AE19+0.5*AF19 -> 14.20 | AE19: 13.20 | AF19: 2 | AG19: =+AH19+AI19+0.5*AJ19 -> 14.68 | AH19: 6.79 | AI19: 5.39 | AJ19: 5
A20: 16 | B20: Spicer, | C20: Richard | D20: SSP-SS | E20: =+G20+J20+M20+P20+T20+W20+AA20+AD20+AG20 -> 270.08 | F20: =+I20+L20+O20+S20+V20+Z20+AC20+AF20+AJ20 -> 30 | G20: =+H20+0.5*I20 -> 39.42 | H20: 38.92 | I20: 1 | J20: =+K20+0.5*L20 -> 21.68 | K20: 20.68 | L20: 2 | M20: =+N20+0.5*O20 -> 32.12 | N20: 30.62 | O20: 3 | P20: =+Q20+R20+0.5*S20 -> 29.15 | Q20: 15.78 | R20: 12.37 | S20: 2 | T20: =+U20+0.5*V20 -> 8.46 | U20: 8.46 | V20: 0 | W20: =+X20+Y20+0.5*Z20 -> 35.12 | X20: 6.26 | Y20: 25.36 | Z20: 7 | AA20: =+AB20+0.5*AC20 -> 37.32 | AB20: 30.82 | AC20: 13 | AD20: =+AE20+0.5*AF20 -> 42.98 | AE20: 41.98 | AF20: 2 | AG20: =+AH20+AI20+0.5*AJ20 -> 23.83 | AH20: 13.66 | AI20: 10.17 | AJ20: 0
A21: 17 | B21: Roubinet, | C21: P. J. | D21: SSP-SS | E21: =+G21+J21+M21+P21+T21+W21+AA21+AD21+AG21 -> 224.93 | F21: =+I21+L21+O21+S21+V21+Z21+AC21+AF21+AJ21 -> 31 | G21: =+H21+0.5*I21 -> 28.16 | H21: 27.66 | I21: 1 | J21: =+K21+0.5*L21 -> 14.01 | K21: 12.01 | L21: 4 | M21: =+N21+0.5*O21 -> 40.68 | N21: 36.18 | O21: 9 | P21: =+Q21+R21+0.5*S21 -> 26.79 | Q21: 15.01 | R21: 11.28 | S21: 1 | T21: =+U21+0.5*V21 -> 9.76 | U21: 9.76 | V21: 0 | W21: =+X21+Y21+0.5*Z21 -> 31.12 | X21: 5.19 | Y21: 22.93 | Z21: 6 | AA21: =+AB21+0.5*AC21 -> 27.83 | AB21: 27.83 | AC21: 0 | AD21: =+AE21+0.5*AF21 -> 29.02 | AE21: 24.52 | AF21: 9 | AG21: =+AH21+AI21+0.5*AJ21 -> 17.56 | AH21: 9.97 | AI21: 7.09 | AJ21: 1
A22: 18 | B22: Boender, | C22: David | D22: SSP-EX | E22: =+G22+J22+M22+P22+T22+W22+AA22+AD22+AG22 -> 200.46 | F22: =+I22+L22+O22+S22+V22+Z22+AC22+AF22+AJ22 -> 32 | G22: =+H22+0.5*I22 -> 18.00 | H22: 18.00 | I22: 0 | J22: =+K22+0.5*L22 -> 23.27 | K22: 21.77 | L22: 3 | M22: =+N22+0.5*O22 -> 30.27 | N22: 27.27 | O22: 6 | P22: =+Q22+R22+0.5*S22 -> 21.98 | Q22: 11.79 | R22: 9.19 | S22: 2 | T22: =+U22+0.5*V22 -> 8.05 | U22: 7.05 | V22: 2 | W22: =+X22+Y22+0.5*Z22 -> 27.14 | X22: 3.73 | Y22: 19.41 | Z22: 8 | AA22: =+AB22+0.5*AC22 -> 29.29 | AB22: 24.29 | AC22: 10 | AD22: =+AE22+0.5*AF22 -> 22.28 | AE22: 22.28 | AF22: 0 | AG22: =+AH22+AI22+0.5*AJ22 -> 20.18 | AH22: 10.77 | AI22: 8.91 | AJ22: 1
A23: 19 | B23: Watson, | C23: Steven | D23: CDP-EX | E23: =+G23+J23+M23+P23+T23+W23+AA23+AD23+AG23 -> 216.46 | F23: =+I23+L23+O23+S23+V23+Z23+AC23+AF23+AJ23 -> 32 | G23: =+H23+0.5*I23 -> 26.66 | H23: 26.16 | I23: 1 | J23: =+K23+0.5*L23 -> 18.61 | K23: 17.61 | L23: 2 | M23: =+N23+0.5*O23 -> 32.81 | N23: 26.81 | O23: 12 | P23: =+Q23+R23+0.5*S23 -> 25.60 | Q23: 13.38 | R23: 9.72 | S23: 5 | T23: =+U23+0.5*V23 -> 6.41 | U23: 6.41 | V23: 0 | W23: =+X23+Y23+0.5*Z23 -> 40.83 | X23: 4.14 | Y23: 35.69 | Z23: 2 | AA23: =+AB23+0.5*AC23 -> 22.09 | AB23: 21.59 | AC23: 1 | AD23: =+AE23+0.5*AF23 -> 27.28 | AE23: 23.28 | AF23: 8 | AG23: =+AH23+AI23+0.5*AJ23 -> 16.17 | AH23: 8.42 | AI23: 7.25 | AJ23: 1
A24: 20 | B24: Theodore, | C24: Ari | D24: CDP-EX | E24: =+G24+J24+M24+P24+T24+W24+AA24+AD24+AG24 -> 195.27 | F24: =+I24+L24+O24+S24+V24+Z24+AC24+AF24+AJ24 -> 33 | G24: =+H24+0.5*I24 -> 22.13 | H24: 21.13 | I24: 2 | J24: =+K24+0.5*L24 -> 14.06 | K24: 14.06 | L24: 0 | M24: =+N24+0.5*O24 -> 35.45 | N24: 32.45 | O24: 6 | P24: =+Q24+R24+0.5*S24 -> 25.05 | Q24: 12.60 | R24: 10.95 | S24: 3 | T24: =+U24+0.5*V24 -> 8.77 | U24: 6.77 | V24: 4 | W24: =+X24+Y24+0.5*Z24 -> 30.84 | X24: 4.69 | Y24: 22.15 | Z24: 8 | AA24: =+AB24+0.5*AC24 -> 19.56 | AB24: 19.06 | AC24: 1 | AD24: =+AE24+0.5*AF24 -> 22.31 | AE24: 18.81 | AF24: 7 | AG24: =+AH24+AI24+0.5*AJ24 -> 17.10 | AH24: 9.94 | AI24: 6.16 | AJ24: 2
A25: 21 | B25: Haslem, | C25: Kent | D25: CDP-SS | E25: =+G25+J25+M25+P25+T25+W25+AA25+AD25+AG25 -> 250.57 | F25: =+I25+L25+O25+S25+V25+Z25+AC25+AF25+AJ25 -> 33 | G25: =+H25+0.5*I25 -> 24.14 | H25: 23.14 | I25: 2 | J25: =+K25+0.5*L25 -> 19.39 | K25: 18.89 | L25: 1 | M25: =+N25+0.5*O25 -> 39.73 | N25: 35.23 | O25: 9 | P25: =+Q25+R25+0.5*S25 -> 31.90 | Q25: 15.72 | R25: 15.68 | S25: 1 | T25: =+U25+0.5*V25 -> 6.64 | U25: 6.14 | V25: 1 | W25: =+X25+Y25+0.5*Z25 -> 44.08 | X25: 5.33 | Y25: 32.75 | Z25: 12 | AA25: =+AB25+0.5*AC25 -> 33.49 | AB25: 30.99 | AC25: 5 | AD25: =+AE25+0.5*AF25 -> 28.58 | AE25: 28.08 | AF25: 1 | AG25: =+AH25+AI25+0.5*AJ25 -> 22.62 | AH25: 12.18 | AI25: 9.94 | AJ25: 1
A26: 22 | B26: Veldboon, | C26: Terry | D26: SSR-EX | E26: =+G26+J26+M26+P26+T26+W26+AA26+AD26+AG26 -> 275.41 | F26: =+I26+L26+O26+S26+V26+Z26+AC26+AF26+AJ26 -> 33 | G26: =+H26+0.5*I26 -> 29.02 | H26: 28.02 | I26: 2 | J26: =+K26+0.5*L26 -> 28.13 | K26: 28.13 | L26: 0 | M26: =+N26+0.5*O26 -> 38.13 | N26: 33.13 | O26: 10 | P26: =+Q26+R26+0.5*S26 -> 29.56 | Q26: 16.13 | R26: 12.43 | S26: 2 | T26: =+U26+0.5*V26 -> 8.00 | U26: 7.50 | V26: 1 | W26: =+X26+Y26+0.5*Z26 -> 42.10 | X26: 5.42 | Y26: 34.68 | Z26: 4 | AA26: =+AB26+0.5*AC26 -> 42.98 | AB26: 37.48 | AC26: 11 | AD26: =+AE26+0.5*AF26 -> 24.72 | AE26: 24.72 | AF26: 0 | AG26: =+AH26+AI26+0.5*AJ26 -> 32.77 | AH26: 15.72 | AI26: 15.55 | AJ26: 3
A27: 23 | B27: Andersen, | C27: Welden | D27: SSP-SS | E27: =+G27+J27+M27+P27+T27+W27+AA27+AD27+AG27 -> 280.23 | F27: =+I27+L27+O27+S27+V27+Z27+AC27+AF27+AJ27 -> 33 | G27: =+H27+0.5*I27 -> 33.50 | H27: 33.50 | I27: 0 | J27: =+K27+0.5*L27 -> 28.88 | K27: 28.38 | L27: 1 | M27: =+N27+0.5*O27 -> 50.23 | N27: 42.23 | O27: 16 | P27: =+Q27+R27+0.5*S27 -> 28.64 | Q27: 16.41 | R27: 12.23 | S27: 0 | T27: =+U27+0.5*V27 -> 11.39 | U27: 11.39 | V27: 0 | W27: =+X27+Y27+0.5*Z27 -> 41.24 | X27: 4.76 | Y27: 32.48 | Z27: 8 | AA27: =+AB27+0.5*AC27 -> 40.22 | AB27: 37.22 | AC27: 6 | AD27: =+AE27+0.5*AF27 -> 22.79 | AE27: 21.79 | AF27: 2 | AG27: =+AH27+AI27+0.5*AJ27 -> 23.34 | AH27: 14.29 | AI27: 9.05 | AJ27: 0
A28: 24 | B28: Ward, | C28: Dan | D28: CDP-EX | E28: =+G28+J28+M28+P28+T28+W28+AA28+AD28+AG28 -> 203.31 | F28: =+I28+L28+O28+S28+V28+Z28+AC28+AF28+AJ28 -> 34 | G28: =+H28+0.5*I28 -> 24.05 | H28: 23.05 | I28: 2 | J28: =+K28+0.5*L28 -> 15.84 | K28: 14.34 | L28: 3 | M28: =+N28+0.5*O28 -> 30.81 | N28: 28.31 | O28: 5 | P28: =+Q28+R28+0.5*S28 -> 23.66 | Q28: 10.63 | R28: 10.03 | S28: 6 | T28: =+U28+0.5*V28 -> 9.80 | U28: 8.30 | V28: 3 | W28: =+X28+Y28+0.5*Z28 -> 31.03 | X28: 5.48 | Y28: 24.55 | Z28: 2 | AA28: =+AB28+0.5*AC28 -> 25.47 | AB28: 19.97 | AC28: 11 | AD28: =+AE28+0.5*AF28 -> 23.79 | AE28: 22.79 | AF28: 2 | AG28: =+AH28+AI28+0.5*AJ28 -> 18.86 | AH28: 11.81 | AI28: 7.05 | AJ28: 0
A29: 25 | B29: Vollmer, | C29: Philip | D29: SSP-EX | E29: =+G29+J29+M29+P29+T29+W29+AA29+AD29+AG29 -> 214.05 | F29: =+I29+L29+O29+S29+V29+Z29+AC29+AF29+AJ29 -> 34 | G29: =+H29+0.5*I29 -> 22.90 | H29: 22.90 | I29: 0 | J29: =+K29+0.5*L29 -> 19.51 | K29: 17.51 | L29: 4 | M29: =+N29+0.5*O29 -> 38.00 | N29: 32.00 | O29: 12 | P29: =+Q29+R29+0.5*S29 -> 25.31 | Q29: 11.53 | R29: 11.28 | S29: 5 | T29: =+U29+0.5*V29 -> 8.96 | U29: 6.96 | V29: 4 | W29: =+X29+Y29+0.5*Z29 -> 32.11 | X29: 6.64 | Y29: 22.47 | Z29: 6 | AA29: =+AB29+0.5*AC29 -> 25.32 | AB29: 24.32 | AC29: 2 | AD29: =+AE29+0.5*AF29 -> 21.45 | AE29: 21.45 | AF29: 0 | AG29: =+AH29+AI29+0.5*AJ29 -> 20.49 | AH29: 11.69 | AI29: 8.30 | AJ29: 1
A30: 26 | B30: Rimer, | C30: Clayton | D30: CDP-MM | E30: =+G30+J30+M30+P30+T30+W30+AA30+AD30+AG30 -> 274.76 | F30: =+I30+L30+O30+S30+V30+Z30+AC30+AF30+AJ30 -> 35 | G30: =+H30+0.5*I30 -> 24.71 | H30: 24.21 | I30: 1 | J30: =+K30+0.5*L30 -> 24.18 | K30: 23.68 | L30: 1 | M30: =+N30+0.5*O30 -> 46.28 | N30: 39.28 | O30: 14 | P30: =+Q30+R30+0.5*S30 -> 31.70 | Q30: 18.22 | R30: 12.48 | S30: 2 | T30: =+U30+0.5*V30 -> 14.02 | U30: 13.02 | V30: 2 | W30: =+X30+Y30+0.5*Z30 -> 43.56 | X30: 7.72 | Y30: 34.34 | Z30: 3 | AA30: =+AB30+0.5*AC30 -> 34.89 | AB30: 30.89 | AC30: 8 | AD30: =+AE30+0.5*AF30 -> 35.85 | AE30: 35.85 | AF30: 0 | AG30: =+AH30+AI30+0.5*AJ30 -> 19.57 | AH30: 8.87 | AI30: 8.70 | AJ30: 4
A31: 27 | B31: Bowling, | C31: William | D31: CDP-MM | E31: =+G31+J31+M31+P31+T31+W31+AA31+AD31+AG31 -> 305.10 | F31: =+I31+L31+O31+S31+V31+Z31+AC31+AF31+AJ31 -> 37 | G31: =+H31+0.5*I31 -> 43.42 | H31: 42.92 | I31: 1 | J31: =+K31+0.5*L31 -> 22.37 | K31: 21.37 | L31: 2 | M31: =+N31+0.5*O31 -> 48.14 | N31: 38.14 | O31: 20 | P31: =+Q31+R31+0.5*S31 -> 38.71 | Q31: 24.02 | R31: 14.19 | S31: 1 | T31: =+U31+0.5*V31 -> 11.95 | U31: 10.45 | V31: 3 | W31: =+X31+Y31+0.5*Z31 -> 45.81 | X31: 9.16 | Y31: 33.15 | Z31: 7 | AA31: =+AB31+0.5*AC31 -> 36.66 | AB31: 35.66 | AC31: 2 | AD31: =+AE31+0.5*AF31 -> 32.60 | AE31: 32.10 | AF31: 1 | AG31: =+AH31+AI31+0.5*AJ31 -> 25.44 | AH31: 14.57 | AI31: 10.87 | AJ31: 0
A32: 28 | B32: Griffiths, | C32: Todd | D32: CDP-EX | E32: =+G32+J32+M32+P32+T32+W32+AA32+AD32+AG32 -> 187.80 | F32: =+I32+L32+O32+S32+V32+Z32+AC32+AF32+AJ32 -> 38 | G32: =+H32+0.5*I32 -> 20.06 | H32: 17.56 | I32: 5 | J32: =+K32+0.5*L32 -> 15.44 | K32: 14.94 | L32: 1 | M32: =+N32+0.5*O32 -> 30.12 | N32: 27.62 | O32: 5 | P32: =+Q32+R32+0.5*S32 -> 20.76 | Q32: 10.45 | R32: 9.31 | S32: 2 | T32: =+U32+0.5*V32 -> 7.49 | U32: 6.99 | V32: 1 | W32: =+X32+Y32+0.5*Z32 -> 36.06 | X32: 3.99 | Y32: 29.57 | Z32: 5 | AA32: =+AB32+0.5*AC32 -> 20.70 | AB32: 18.70 | AC32: 4 | AD32: =+AE32+0.5*AF32 -> 20.96 | AE32: 14.46 | AF32: 13 | AG32: =+AH32+AI32+0.5*AJ32 -> 16.21 | AH32: 8.29 | AI32: 6.92 | AJ32: 2
A33: 29 | B33: Halliday, | C33: Mark | D33: CDP-MM | E33: =+G33+J33+M33+P33+T33+W33+AA33+AD33+AG33 -> 306.80 | F33: =+I33+L33+O33+S33+V33+Z33+AC33+AF33+AJ33 -> 38 | G33: =+H33+0.5*I33 -> 62.68 | H33: 62.68 | I33: 0 | J33: =+K33+0.5*L33 -> 23.11 | K33: 20.61 | L33: 5 | M33: =+N33+0.5*O33 -> 47.06 | N33: 44.56 | O33: 5 | P33: =+Q33+R33+0.5*S33 -> 33.11 | Q33: 19.15 | R33: 13.96 | S33: 0 | T33: =+U33+0.5*V33 -> 11.31 | U33: 9.31 | V33: 4 | W33: =+X33+Y33+0.5*Z33 -> 37.69 | X33: 5.67 | Y33: 28.02 | Z33: 8 | AA33: =+AB33+0.5*AC33 -> 38.35 | AB33: 34.85 | AC33: 7 | AD33: =+AE33+0.5*AF33 -> 32.61 | AE33: 30.11 | AF33: 5 | AG33: =+AH33+AI33+0.5*AJ33 -> 20.88 | AH33: 9.17 | AI33: 9.71 | AJ33: 4
A34: 30 | B34: Beckham, | C34: Scott | D34: SSR-SS | E34: =+G34+J34+M34+P34+T34+W34+AA34+AD34+AG34 -> 317.43 | F34: =+I34+L34+O34+S34+V34+Z34+AC34+AF34+AJ34 -> 38 | G34: =+H34+0.5*I34 -> 34.03 | H34: 32.03 | I34: 4 | J34: =+K34+0.5*L34 -> 20.31 | K34: 19.81 | L34: 1 | M34: =+N34+0.5*O34 -> 54.10 | N34: 53.10 | O34: 2 | P34: =+Q34+R34+0.5*S34 -> 35.14 | Q34: 18.14 | R34: 13.50 | S34: 7 | T34: =+U34+0.5*V34 -> 10.72 | U34: 8.22 | V34: 5 | W34: =+X34+Y34+0.5*Z34 -> 53.60 | X34: 5.80 | Y34: 42.30 | Z34: 11 | AA34: =+AB34+0.5*AC34 -> 39.61 | AB34: 38.11 | AC34: 3 | AD34: =+AE34+0.5*AF34 -> 35.39 | AE34: 33.89 | AF34: 3 | AG34: =+AH34+AI34+0.5*AJ34 -> 34.53 | AH34: 19.36 | AI34: 14.17 | AJ34: 2
A35: 31 | B35: Zaccardi, | C35: Pat | D35: ESP-SS | E35: =+G35+J35+M35+P35+T35+W35+AA35+AD35+AG35 -> 196.74 | F35: =+I35+L35+O35+S35+V35+Z35+AC35+AF35+AJ35 -> 39 | G35: =+H35+0.5*I35 -> 24.67 | H35: 23.67 | I35: 2 | J35: =+K35+0.5*L35 -> 14.95 | K35: 13.45 | L35: 3 | M35: =+N35+0.5*O35 -> 31.40 | N35: 25.40 | O35: 12 | P35: =+Q35+R35+0.5*S35 -> 23.04 | Q35: 10.17 | R35: 8.37 | S35: 9 | T35: =+U35+0.5*V35 -> 8.75 | U35: 8.75 | V35: 0 | W35: =+X35+Y35+0.5*Z35 -> 24.45 | X35: 5.41 | Y35: 17.54 | Z35: 3 | AA35: =+AB35+0.5*AC35 -> 28.71 | AB35: 27.71 | AC35: 2 | AD35: =+AE35+0.5*AF35 -> 20.66 | AE35: 19.66 | AF35: 2 | AG35: =+AH35+AI35+0.5*AJ35 -> 20.11 | AH35: 10.18 | AI35: 6.93 | AJ35: 6
A36: 32 | B36: Collins, | C36: Ken | D36: ESP-SS | E36: =+G36+J36+M36+P36+T36+W36+AA36+AD36+AG36 -> 224.24 | F36: =+I36+L36+O36+S36+V36+Z36+AC36+AF36+AJ36 -> 40 | G36: =+H36+0.5*I36 -> 27.48 | H36: 26.98 | I36: 1 | J36: =+K36+0.5*L36 -> 14.16 | K36: 13.16 | L36: 2 | M36: =+N36+0.5*O36 -> 39.49 | N36: 35.99 | O36: 7 | P36: =+Q36+R36+0.5*S36 -> 32.18 | Q36: 14.14 | R36: 10.54 | S36: 15 | T36: =+U36+0.5*V36 -> 8.29 | U36: 7.29 | V36: 2 | W36: =+X36+Y36+0.5*Z36 -> 26.03 | X36: 5.24 | Y36: 18.29 | Z36: 5 | AA36: =+AB36+0.5*AC36 -> 32.16 | AB36: 31.16 | AC36: 2 | AD36: =+AE36+0.5*AF36 -> 20.58 | AE36: 20.58 | AF36: 0 | AG36: =+AH36+AI36+0.5*AJ36 -> 23.87 | AH36: 10.95 | AI36: 9.92 | AJ36: 6
A37: 33 | B37: Greathouse, | C37: Joseph | D37: ESP-SS | E37: =+G37+J37+M37+P37+T37+W37+AA37+AD37+AG37 -> 223.96 | F37: =+I37+L37+O37+S37+V37+Z37+AC37+AF37+AJ37 -> 43 | G37: =+H37+0.5*I37 -> 26.71 | H37: 26.71 | I37: 0 | J37: =+K37+0.5*L37 -> 21.85 | K37: 14.85 | L37: 14 | M37: =+N37+0.5*O37 -> 36.55 | N37: 32.55 | O37: 8 | P37: =+Q37+R37+0.5*S37 -> 25.87 | Q37: 13.04 | R37: 9.33 | S37: 7 | T37: =+U37+0.5*V37 -> 9.33 | U37: 7.83 | V37: 3 | W37: =+X37+Y37+0.5*Z37 -> 34.56 | X37: 4.72 | Y37: 27.34 | Z37: 5 | AA37: =+AB37+0.5*AC37 -> 26.58 | AB37: 26.08 | AC37: 1 | AD37: =+AE37+0.5*AF37 -> 24.13 | AE37: 22.63 | AF37: 3 | AG37: =+AH37+AI37+0.5*AJ37 -> 18.38 | AH37: 10.07 | AI37: 7.31 | AJ37: 2
A38: 34 | B38: Rupert, | C38: Frank | D38: CDP-SS | E38: =+G38+J38+M38+P38+T38+W38+AA38+AD38+AG38 -> 296.72 | F38: =+I38+L38+O38+S38+V38+Z38+AC38+AF38+AJ38 -> 43 | G38: =+H38+0.5*I38 -> 31.57 | H38: 31.07 | I38: 1 | J38: =+K38+0.5*L38 -> 32.33 | K38: 30.33 | L38: 4 | M38: =+N38+0.5*O38 -> 63.92 | N38: 57.92 | O38: 12 | P38: =+Q38+R38+0.5*S38 -> 28.73 | Q38: 14.68 | R38: 10.55 | S38: 7 | T38: =+U38+0.5*V38 -> 10.78 | U38: 9.78 | V38: 2 | W38: =+X38+Y38+0.5*Z38 -> 50.02 | X38: 7.38 | Y38: 36.14 | Z38: 13 | AA38: =+AB38+0.5*AC38 -> 30.25 | AB38: 29.25 | AC38: 2 | AD38: =+AE38+0.5*AF38 -> 26.65 | AE38: 26.65 | AF38: 0 | AG38: =+AH38+AI38+0.5*AJ38 -> 22.47 | AH38: 11.74 | AI38: 9.73 | AJ38: 2
A39: 35 | B39: Sexton, | C39: Mike | D39: SSP-EX | E39: =+G39+J39+M39+P39+T39+W39+AA39+AD39+AG39 -> 216.82 | F39: =+I39+L39+O39+S39+V39+Z39+AC39+AF39+AJ39 -> 44 | G39: =+H39+0.5*I39 -> 26.40 | H39: 25.90 | I39: 1 | J39: =+K39+0.5*L39 -> 16.27 | K39: 15.27 | L39: 2 | M39: =+N39+0.5*O39 -> 41.77 | N39: 33.77 | O39: 16 | P39: =+Q39+R39+0.5*S39 -> 22.62 | Q39: 11.99 | R39: 10.13 | S39: 1 | T39: =+U39+0.5*V39 -> 7.25 | U39: 6.25 | V39: 2 | W39: =+X39+Y39+0.5*Z39 -> 31.59 | X39: 6.05 | Y39: 19.04 | Z39: 13 | AA39: =+AB39+0.5*AC39 -> 25.63 | AB39: 24.63 | AC39: 2 | AD39: =+AE39+0.5*AF39 -> 26.87 | AE39: 23.87 | AF39: 6 | AG39: =+AH39+AI39+0.5*AJ39 -> 18.42 | AH39: 9.19 | AI39: 8.73 | AJ39: 1
A40: 36 | B40: Peterson, | C40: Todd | D40: ESP-SS | E40: =+G40+J40+M40+P40+T40+W40+AA40+AD40+AG40 -> 225.67 | F40: =+I40+L40+O40+S40+V40+Z40+AC40+AF40+AJ40 -> 47 | G40: =+H40+0.5*I40 -> 27.24 | H40: 27.24 | I40: 0 | J40: =+K40+0.5*L40 -> 17.74 | K40: 17.24 | L40: 1 | M40: =+N40+0.5*O40 -> 39.24 | N40: 39.24 | O40: 0 | P40: =+Q40+R40+0.5*S40 -> 27.38 | Q40: 7.82 | R40: 11.56 | S40: 16 | T40: =+U40+0.5*V40 -> 7.27 | U40: 7.27 | V40: 0 | W40: =+X40+Y40+0.5*Z40 -> 30.36 | X40: 4.97 | Y40: 23.39 | Z40: 4 | AA40: =+AB40+0.5*AC40 -> 32.67 | AB40: 27.17 | AC40: 11 | AD40: =+AE40+0.5*AF40 -> 24.00 | AE40: 20.00 | AF40: 8 | AG40: =+AH40+AI40+0.5*AJ40 -> 19.77 | AH40: 8.11 | AI40: 8.16 | AJ40: 7
A41: 37 | B41: Mingo, | C41: John | D41: SSR-SS | E41: =+G41+J41+M41+P41+T41+W41+AA41+AD41+AG41 -> 298.90 | F41: =+I41+L41+O41+S41+V41+Z41+AC41+AF41+AJ41 -> 47 | G41: =+H41+0.5*I41 -> 44.22 | H41: 42.72 | I41: 3 | J41: =+K41+0.5*L41 -> 20.50 | K41: 18.50 | L41: 4 | M41: =+N41+0.5*O41 -> 40.94 | N41: 30.94 | O41: 20 | P41: =+Q41+R41+0.5*S41 -> 28.42 | Q41: 13.02 | R41: 12.40 | S41: 6 | T41: =+U41+0.5*V41 -> 11.40 | U41: 10.90 | V41: 1 | W41: =+X41+Y41+0.5*Z41 -> 48.52 | X41: 6.53 | Y41: 41.49 | Z41: 1 | AA41: =+AB41+0.5*AC41 -> 46.80 | AB41: 43.30 | AC41: 7 | AD41: =+AE41+0.5*AF41 -> 28.55 | AE41: 26.05 | AF41: 5 | AG41: =+AH41+AI41+0.5*AJ41 -> 29.55 | AH41: 15.63 | AI41: 13.92 | AJ41: 0
A42: 38 | B42: Coleman, | C42: Steve | D42: CDP-SS | E42: =+G42+J42+M42+P42+T42+W42+AA42+AD42+AG42 -> 244.33 | F42: =+I42+L42+O42+S42+V42+Z42+AC42+AF42+AJ42 -> 48 | G42: =+H42+0.5*I42 -> 22.81 | H42: 22.31 | I42: 1 | J42: =+K42+0.5*L42 -> 19.88 | K42: 15.88 | L42: 8 | M42: =+N42+0.5*O42 -> 44.37 | N42: 37.87 | O42: 13 | P42: =+Q42+R42+0.5*S42 -> 24.15 | Q42: 12.94 | R42: 10.21 | S42: 2 | T42: =+U42+0.5*V42 -> 8.68 | U42: 8.68 | V42: 0 | W42: =+X42+Y42+0.5*Z42 -> 37.58 | X42: 6.02 | Y42: 23.56 | Z42: 16 | AA42: =+AB42+0.5*AC42 -> 37.62 | AB42: 37.12 | AC42: 1 | AD42: =+AE42+0.5*AF42 -> 30.90 | AE42: 27.90 | AF42: 6 | AG42: =+AH42+AI42+0.5*AJ42 -> 18.34 | AH42: 10.55 | AI42: 7.29 | AJ42: 1
A43: 39 | B43: Mortenson, | C43: Bryan | D43: ESP-SS | E43: =+G43+J43+M43+P43+T43+W43+AA43+AD43+AG43 -> 249.91 | F43: =+I43+L43+O43+S43+V43+Z43+AC43+AF43+AJ43 -> 48 | G43: =+H43+0.5*I43 -> 28.70 | H43: 28.20 | I43: 1 | J43: =+K43+0.5*L43 -> 24.60 | K43: 17.10 | L43: 15 | M43: =+N43+0.5*O43 -> 50.36 | N43: 41.36 | O43: 18 | P43: =+Q43+R43+0.5*S43 -> 30.44 | Q43: 16.36 | R43: 13.58 | S43: 1 | T43: =+U43+0.5*V43 -> 9.11 | U43: 6.11 | V43: 6 | W43: =+X43+Y43+0.5*Z43 -> 32.10 | X43: 6.18 | Y43: 23.42 | Z43: 5 | AA43: =+AB43+0.5*AC43 -> 27.03 | AB43: 26.53 | AC43: 1 | AD43: =+AE43+0.5*AF43 -> 29.30 | AE43: 29.30 | AF43: 0 | AG43: =+AH43+AI43+0.5*AJ43 -> 18.27 | AH43: 9.83 | AI43: 7.94 | AJ43: 1
A44: 40 | B44: Smith, | C44: Burton | D44: CDP-SS | E44: =+G44+J44+M44+P44+T44+W44+AA44+AD44+AG44 -> 257.46 | F44: =+I44+L44+O44+S44+V44+Z44+AC44+AF44+AJ44 -> 49 | G44: =+H44+0.5*I44 -> 32.50 | H44: 31.00 | I44: 3 | J44: =+K44+0.5*L44 -> 25.62 | K44: 22.12 | L44: 7 | M44: =+N44+0.5*O44 -> 44.03 | N44: 36.03 | O44: 16 | P44: =+Q44+R44+0.5*S44 -> 30.16 | Q44: 16.08 | R44: 13.08 | S44: 2 | T44: =+U44+0.5*V44 -> 7.40 | U44: 6.40 | V44: 2 | W44: =+X44+Y44+0.5*Z44 -> 39.84 | X44: 4.99 | Y44: 32.85 | Z44: 4 | AA44: =+AB44+0.5*AC44 -> 24.56 | AB44: 24.06 | AC44: 1 | AD44: =+AE44+0.5*AF44 -> 32.52 | AE44: 28.52 | AF44: 8 | AG44: =+AH44+AI44+0.5*AJ44 -> 20.83 | AH44: 9.97 | AI44: 7.86 | AJ44: 6
A45: 41 | B45: Carter, | C45: Theo | D45: SSR-SS | E45: =+G45+J45+M45+P45+T45+W45+AA45+AD45+AG45 -> 266.02 | F45: =+I45+L45+O45+S45+V45+Z45+AC45+AF45+AJ45 -> 49 | G45: =+H45+0.5*I45 -> 28.38 | H45: 27.88 | I45: 1 | J45: =+K45+0.5*L45 -> 17.68 | K45: 15.18 | L45: 5 | M45: =+N45+0.5*O45 -> 42.41 | N45: 32.91 | O45: 19 | P45: =+Q45+R45+0.5*S45 -> 27.23 | Q45: 13.00 | R45: 11.73 | S45: 5 | T45: =+U45+0.5*V45 -> 7.38 | U45: 6.88 | V45: 1 | W45: =+X45+Y45+0.5*Z45 -> 45.92 | X45: 5.41 | Y45: 38.01 | Z45: 5 | AA45: =+AB45+0.5*AC45 -> 38.97 | AB45: 37.97 | AC45: 2 | AD45: =+AE45+0.5*AF45 -> 28.88 | AE45: 26.38 | AF45: 5 | AG45: =+AH45+AI45+0.5*AJ45 -> 29.17 | AH45: 13.07 | AI45: 13.10 | AJ45: 6
A46: 42 | B46: Zaccardi, | C46: Juke | D46: ESP-MM | E46: =+G46+J46+M46+P46+T46+W46+AA46+AD46+AG46 -> 242.29 | F46: =+I46+L46+O46+S46+V46+Z46+AC46+AF46+AJ46 -> 50 | G46: =+H46+0.5*I46 -> 26.04 | H46: 25.54 | I46: 1 | J46: =+K46+0.5*L46 -> 21.20 | K46: 15.20 | L46: 12 | M46: =+N46+0.5*O46 -> 39.83 | N46: 31.83 | O46: 16 | P46: =+Q46+R46+0.5*S46 -> 26.00 | Q46: 14.10 | R46: 11.90 | S46: 0 | T46: =+U46+0.5*V46 -> 8.80 | U46: 8.30 | V46: 1 | W46: =+X46+Y46+0.5*Z46 -> 33.06 | X46: 5.72 | Y46: 23.84 | Z46: 7 | AA46: =+AB46+0.5*AC46 -> 35.41 | AB46: 29.91 | AC46: 11 | AD46: =+AE46+0.5*AF46 -> 26.96 | AE46: 26.96 | AF46: 0 | AG46: =+AH46+AI46+0.5*AJ46 -> 24.99 | AH46: 14.39 | AI46: 9.60 | AJ46: 2
A47: 43 | B47: Carr, | C47: Robert | D47: CDP-MM | E47: =+G47+J47+M47+P47+T47+W47+AA47+AD47+AG47 -> 333.44 | F47: =+I47+L47+O47+S47+V47+Z47+AC47+AF47+AJ47 -> 51 | G47: =+H47+0.5*I47 -> 33.65 | H47: 32.65 | I47: 2 | J47: =+K47+0.5*L47 -> 30.45 | K47: 29.45 | L47: 2 | M47: =+N47+0.5*O47 -> 63.48 | N47: 59.98 | O47: 7 | P47: =+Q47+R47+0.5*S47 -> 30.45 | Q47: 16.69 | R47: 11.76 | S47: 4 | T47: =+U47+0.5*V47 -> 12.05 | U47: 11.55 | V47: 1 | W47: =+X47+Y47+0.5*Z47 -> 55.97 | X47: 10.25 | Y47: 36.22 | Z47: 19 | AA47: =+AB47+0.5*AC47 -> 42.99 | AB47: 40.49 | AC47: 5 | AD47: =+AE47+0.5*AF47 -> 38.05 | AE47: 33.05 | AF47: 10 | AG47: =+AH47+AI47+0.5*AJ47 -> 26.35 | AH47: 15.17 | AI47: 10.68 | AJ47: 1
A48: 44 | B48: Rodriguez, | C48: Mike | D48: CDP-SS | E48: =+G48+J48+M48+P48+T48+W48+AA48+AD48+AG48 -> 270.47 | F48: =+I48+L48+O48+S48+V48+Z48+AC48+AF48+AJ48 -> 52 | G48: =+H48+0.5*I48 -> 30.53 | H48: 30.03 | I48: 1 | J48: =+K48+0.5*L48 -> 22.59 | K48: 16.59 | L48: 12 | M48: =+N48+0.5*O48 -> 40.21 | N48: 38.21 | O48: 4 | P48: =+Q48+R48+0.5*S48 -> 29.19 | Q48: 14.07 | R48: 15.12 | S48: 0 | T48: =+U48+0.5*V48 -> 10.53 | U48: 7.03 | V48: 7 | W48: =+X48+Y48+0.5*Z48 -> 37.14 | X48: 6.71 | Y48: 26.43 | Z48: 8 | AA48: =+AB48+0.5*AC48 -> 37.86 | AB48: 33.86 | AC48: 8 | AD48: =+AE48+0.5*AF48 -> 42.46 | AE48: 37.46 | AF48: 10 | AG48: =+AH48+AI48+0.5*AJ48 -> 19.96 | AH48: 10.99 | AI48: 7.97 | AJ48: 2
A49: 45 | B49: Tekmitchov, | C49: George | D49: CDP-EX | E49: =+G49+J49+M49+P49+T49+W49+AA49+AD49+AG49 -> 300.04 | F49: =+I49+L49+O49+S49+V49+Z49+AC49+AF49+AJ49 -> 52 | G49: =+H49+0.5*I49 -> 51.47 | H49: 47.97 | I49: 7 | J49: =+K49+0.5*L49 -> 21.88 | K49: 21.88 | L49: 0 | M49: =+N49+0.5*O49 -> 48.19 | N49: 42.69 | O49: 11 | P49: =+Q49+R49+0.5*S49 -> 35.20 | Q49: 16.80 | R49: 13.90 | S49: 9 | T49: =+U49+0.5*V49 -> 9.15 | U49: 8.65 | V49: 1 | W49: =+X49+Y49+0.5*Z49 -> 36.15 | X49: 4.98 | Y49: 27.67 | Z49: 7 | AA49: =+AB49+0.5*AC49 -> 44.12 | AB49: 37.12 | AC49: 14 | AD49: =+AE49+0.5*AF49 -> 33.59 | AE49: 32.59 | AF49: 2 | AG49: =+AH49+AI49+0.5*AJ49 -> 20.29 | AH49: 10.97 | AI49: 8.82 | AJ49: 1
A50: 46 | B50: Richards, | C50: Dave | D50: SSP-EX | E50: =+G50+J50+M50+P50+T50+W50+AA50+AD50+AG50 -> 231.06 | F50: =+I50+L50+O50+S50+V50+Z50+AC50+AF50+AJ50 -> 53 | G50: =+H50+0.5*I50 -> 21.98 | H50: 21.48 | I50: 1 | J50: =+K50+0.5*L50 -> 28.51 | K50: 18.51 | L50: 20 | M50: =+N50+0.5*O50 -> 36.83 | N50: 28.83 | O50: 16 | P50: =+Q50+R50+0.5*S50 -> 28.34 | Q50: 15.28 | R50: 10.06 | S50: 6 | T50: =+U50+0.5*V50 -> 8.30 | U50: 7.80 | V50: 1 | W50: =+X50+Y50+0.5*Z50 -> 31.82 | X50: 5.40 | Y50: 23.92 | Z50: 5 | AA50: =+AB50+0.5*AC50 -> 30.29 | AB50: 29.79 | AC50: 1 | AD50: =+AE50+0.5*AF50 -> 20.22 | AE50: 19.72 | AF50: 1 | AG50: =+AH50+AI50+0.5*AJ50 -> 24.77 | AH50: 13.87 | AI50: 9.90 | AJ50: 2
A51: 47 | B51: Wimberly, | C51: Jeff | D51: SSP-MM | E51: =+G51+J51+M51+P51+T51+W51+AA51+AD51+AG51 -> 336.61 | F51: =+I51+L51+O51+S51+V51+Z51+AC51+AF51+AJ51 -> 53 | G51: =+H51+0.5*I51 -> 51.16 | H51: 50.66 | I51: 1 | J51: =+K51+0.5*L51 -> 23.35 | K51: 22.85 | L51: 1 | M51: =+N51+0.5*O51 -> 48.68 | N51: 41.68 | O51: 14 | P51: =+Q51+R51+0.5*S51 -> 56.58 | Q51: 18.22 | R51: 28.36 | S51: 20 | T51: =+U51+0.5*V51 -> 11.15 | U51: 10.15 | V51: 2 | W51: =+X51+Y51+0.5*Z51 -> 37.22 | X51: 6.37 | Y51: 29.35 | Z51: 3 | AA51: =+AB51+0.5*AC51 -> 41.38 | AB51: 41.38 | AC51: 0 | AD51: =+AE51+0.5*AF51 -> 36.94 | AE51: 32.94 | AF51: 8 | AG51: =+AH51+AI51+0.5*AJ51 -> 30.15 | AH51: 15.44 | AI51: 12.71 | AJ51: 4
A52: 48 | B52: Porter, | C52: Alma | D52: CDP-SS | E52: =+G52+J52+M52+P52+T52+W52+AA52+AD52+AG52 -> 265.09 | F52: =+I52+L52+O52+S52+V52+Z52+AC52+AF52+AJ52 -> 54 | G52: =+H52+0.5*I52 -> 34.21 | H52: 33.71 | I52: 1 | J52: =+K52+0.5*L52 -> 17.71 | K52: 17.71 | L52: 0 | M52: =+N52+0.5*O52 -> 48.37 | N52: 39.37 | O52: 18 | P52: =+Q52+R52+0.5*S52 -> 31.82 | Q52: 16.35 | R52: 13.97 | S52: 3 | T52: =+U52+0.5*V52 -> 12.62 | U52: 9.12 | V52: 7 | W52: =+X52+Y52+0.5*Z52 -> 40.10 | X52: 4.63 | Y52: 27.97 | Z52: 15 | AA52: =+AB52+0.5*AC52 -> 28.33 | AB52: 24.33 | AC52: 8 | AD52: =+AE52+0.5*AF52 -> 30.14 | AE52: 29.64 | AF52: 1 | AG52: =+AH52+AI52+0.5*AJ52 -> 21.79 | AH52: 11.56 | AI52: 9.73 | AJ52: 1
A53: 49 | B53: Parks, | C53: Justin | D53: ESP-SS | E53: =+G53+J53+M53+P53+T53+W53+AA53+AD53+AG53 -> 246.49 | F53: =+I53+L53+O53+S53+V53+Z53+AC53+AF53+AJ53 -> 55 | G53: =+H53+0.5*I53 -> 31.10 | H53: 30.60 | I53: 1 | J53: =+K53+0.5*L53 -> 19.11 | K53: 16.11 | L53: 6 | M53: =+N53+0.5*O53 -> 40.40 | N53: 33.90 | O53: 13 | P53: =+Q53+R53+0.5*S53 -> 31.17 | Q53: 15.88 | R53: 11.79 | S53: 7 | T53: =+U53+0.5*V53 -> 7.26 | U53: 5.76 | V53: 3 | W53: =+X53+Y53+0.5*Z53 -> 36.44 | X53: 4.93 | Y53: 24.01 | Z53: 15 | AA53: =+AB53+0.5*AC53 -> 32.74 | AB53: 29.74 | AC53: 6 | AD53: =+AE53+0.5*AF53 -> 32.26 | AE53: 31.26 | AF53: 2 | AG53: =+AH53+AI53+0.5*AJ53 -> 16.01 | AH53: 8.04 | AI53: 6.97 | AJ53: 2
A54: 50 | B54: Colby, | C54: William | D54: CDP-SS | E54: =+G54+J54+M54+P54+T54+W54+AA54+AD54+AG54 -> 290.56 | F54: =+I54+L54+O54+S54+V54+Z54+AC54+AF54+AJ54 -> 55 | G54: =+H54+0.5*I54 -> 34.96 | H54: 34.46 | I54: 1 | J54: =+K54+0.5*L54 -> 31.07 | K54: 27.07 | L54: 8 | M54: =+N54+0.5*O54 -> 45.30 | N54: 41.80 | O54: 7 | P54: =+Q54+R54+0.5*S54 -> 28.16 | Q54: 14.00 | R54: 12.16 | S54: 4 | T54: =+U54+0.5*V54 -> 10.10 | U54: 10.10 | V54: 0 | W54: =+X54+Y54+0.5*Z54 -> 47.50 | X54: 6.16 | Y54: 34.84 | Z54: 13 | AA54: =+AB54+0.5*AC54 -> 32.49 | AB54: 31.99 | AC54: 1 | AD54: =+AE54+0.5*AF54 -> 39.16 | AE54: 29.66 | AF54: 19 | AG54: =+AH54+AI54+0.5*AJ54 -> 21.82 | AH54: 11.37 | AI54: 9.45 | AJ54: 2
A55: 51 | B55: Spicer, | C55: Robert L. | D55: SSP-SS | E55: =+G55+J55+M55+P55+T55+W55+AA55+AD55+AG55 -> 272.68 | F55: =+I55+L55+O55+S55+V55+Z55+AC55+AF55+AJ55 -> 56 | G55: =+H55+0.5*I55 -> 25.85 | H55: 25.85 | I55: 0 | J55: =+K55+0.5*L55 -> 21.50 | K55: 19.00 | L55: 5 | M55: =+N55+0.5*O55 -> 36.33 | N55: 34.33 | O55: 4 | P55: =+Q55+R55+0.5*S55 -> 56.89 | Q55: 31.56 | R55: 13.33 | S55: 24 | T55: =+U55+0.5*V55 -> 14.34 | U55: 9.84 | V55: 9 | W55: =+X55+Y55+0.5*Z55 -> 36.88 | X55: 6.24 | Y55: 29.14 | Z55: 3 | AA55: =+AB55+0.5*AC55 -> 27.27 | AB55: 26.27 | AC55: 2 | AD55: =+AE55+0.5*AF55 -> 29.35 | AE55: 29.35 | AF55: 0 | AG55: =+AH55+AI55+0.5*AJ55 -> 24.27 | AH55: 10.82 | AI55: 8.95 | AJ55: 9
A56: 52 | B56: Maloy, | C56: Cory A | D56: SSP-MM | E56: =+G56+J56+M56+P56+T56+W56+AA56+AD56+AG56 -> 305.14 | F56: =+I56+L56+O56+S56+V56+Z56+AC56+AF56+AJ56 -> 58 | G56: =+H56+0.5*I56 -> 27.95 | H56: 27.45 | I56: 1 | J56: =+K56+0.5*L56 -> 23.50 | K56: 22.00 | L56: 3 | M56: =+N56+0.5*O56 -> 53.26 | N56: 44.26 | O56: 18 | P56: =+Q56+R56+0.5*S56 -> 33.84 | Q56: 17.27 | R56: 15.57 | S56: 2 | T56: =+U56+0.5*V56 -> 13.07 | U56: 12.57 | V56: 1 | W56: =+X56+Y56+0.5*Z56 -> 41.21 | X56: 7.45 | Y56: 29.76 | Z56: 8 | AA56: =+AB56+0.5*AC56 -> 37.05 | AB56: 33.55 | AC56: 7 | AD56: =+AE56+0.5*AF56 -> 40.77 | AE56: 35.27 | AF56: 11 | AG56: =+AH56+AI56+0.5*AJ56 -> 34.49 | AH56: 16.18 | AI56: 14.81 | AJ56: 7
A57: 53 | B57: Redford, | C57: Noel | D57: SSP-MM | E57: =+G57+J57+M57+P57+T57+W57+AA57+AD57+AG57 -> 329.16 | F57: =+I57+L57+O57+S57+V57+Z57+AC57+AF57+AJ57 -> 61 | G57: =+H57+0.5*I57 -> 35.31 | H57: 34.31 | I57: 2 | J57: =+K57+0.5*L57 -> 29.78 | K57: 26.78 | L57: 6 | M57: =+N57+0.5*O57 -> 54.84 | N57: 48.34 | O57: 13 | P57: =+Q57+R57+0.5*S57 -> 28.42 | Q57: 14.92 | R57: 12.50 | S57: 2 | T57: =+U57+0.5*V57 -> 15.07 | U57: 8.07 | V57: 14 | W57: =+X57+Y57+0.5*Z57 -> 47.23 | X57: 8.59 | Y57: 32.64 | Z57: 12 | AA57: =+AB57+0.5*AC57 -> 38.66 | AB57: 37.16 | AC57: 3 | AD57: =+AE57+0.5*AF57 -> 53.04 | AE57: 52.04 | AF57: 2 | AG57: =+AH57+AI57+0.5*AJ57 -> 26.81 | AH57: 11.72 | AI57: 11.59 | AJ57: 7
A58: 54 | B58: Mahoney, | C58: Joni | D58: SSP-SS | E58: =+G58+J58+M58+P58+T58+W58+AA58+AD58+AG58 -> 263.29 | F58: =+I58+L58+O58+S58+V58+Z58+AC58+AF58+AJ58 -> 62 | G58: =+H58+0.5*I58 -> 30.50 | H58: 29.50 | I58: 2 | J58: =+K58+0.5*L58 -> 19.13 | K58: 16.63 | L58: 5 | M58: =+N58+0.5*O58 -> 45.69 | N58: 40.19 | O58: 11 | P58: =+Q58+R58+0.5*S58 -> 27.80 | Q58: 13.63 | R58: 13.67 | S58: 1 | T58: =+U58+0.5*V58 -> 10.60 | U58: 9.10 | V58: 3 | W58: =+X58+Y58+0.5*Z58 -> 46.21 | X58: 5.31 | Y58: 27.90 | Z58: 26 | AA58: =+AB58+0.5*AC58 -> 31.83 | AB58: 27.33 | AC58: 9 | AD58: =+AE58+0.5*AF58 -> 29.26 | AE58: 26.76 | AF58: 5 | AG58: =+AH58+AI58+0.5*AJ58 -> 22.27 | AH58: 12.03 | AI58: 10.24 | AJ58: 0
A59: 55 | B59: Tran, | C59: Hung | D59: CDP-SS | E59: =+G59+J59+M59+P59+T59+W59+AA59+AD59+AG59 -> 175.80 | F59: =+I59+L59+O59+S59+V59+Z59+AC59+AF59+AJ59 -> 63 | G59: =+H59+0.5*I59 -> 21.80 | H59: 20.30 | I59: 3 | J59: =+K59+0.5*L59 -> 14.91 | K59: 10.41 | L59: 9 | M59: =+N59+0.5*O59 -> 30.56 | N59: 24.56 | O59: 12 | P59: =+Q59+R59+0.5*S59 -> 20.09 | Q59: 9.40 | R59: 7.69 | S59: 6 | T59: =+U59+0.5*V59 -> 9.10 | U59: 7.10 | V59: 4 | W59: =+X59+Y59+0.5*Z59 -> 23.34 | X59: 3.60 | Y59: 17.24 | Z59: 5 | AA59: =+AB59+0.5*AC59 -> 20.21 | AB59: 14.71 | AC59: 11 | AD59: =+AE59+0.5*AF59 -> 17.94 | AE59: 16.94 | AF59: 2 | AG59: =+AH59+AI59+0.5*AJ59 -> 17.85 | AH59: 7.28 | AI59: 5.07 | AJ59: 11
A60: 56 | B60: Bautista, | C60: Roy | D60: SSP-SS | E60: =+G60+J60+M60+P60+T60+W60+AA60+AD60+AG60 -> 282.48 | F60: =+I60+L60+O60+S60+V60+Z60+AC60+AF60+AJ60 -> 63 | G60: =+H60+0.5*I60 -> 32.53 | H60: 32.53 | I60: 0 | J60: =+K60+0.5*L60 -> 19.53 | K60: 19.53 | L60: 0 | M60: =+N60+0.5*O60 -> 62.09 | N60: 58.59 | O60: 7 | P60: =+Q60+R60+0.5*S60 -> 27.82 | Q60: 11.81 | R60: 12.51 | S60: 7 | T60: =+U60+0.5*V60 -> 12.68 | U60: 6.68 | V60: 12 | W60: =+X60+Y60+0.5*Z60 -> 34.36 | X60: 4.69 | Y60: 27.17 | Z60: 5 | AA60: =+AB60+0.5*AC60 -> 26.60 | AB60: 21.60 | AC60: 10 | AD60: =+AE60+0.5*AF60 -> 31.67 | AE60: 24.17 | AF60: 15 | AG60: =+AH60+AI60+0.5*AJ60 -> 35.20 | AH60: 15.53 | AI60: 16.17 | AJ60: 7
A61: 57 | B61: Thomas, | C61: Kevin | D61: SSP-SS | E61: =+G61+J61+M61+P61+T61+W61+AA61+AD61+AG61 -> 273.21 | F61: =+I61+L61+O61+S61+V61+Z61+AC61+AF61+AJ61 -> 64 | G61: =+H61+0.5*I61 -> 50.26 | H61: 44.26 | I61: 12 | J61: =+K61+0.5*L61 -> 14.45 | K61: 13.95 | L61: 1 | M61: =+N61+0.5*O61 -> 59.30 | N61: 46.80 | O61: 25 | P61: =+Q61+R61+0.5*S61 -> 28.60 | Q61: 16.31 | R61: 9.29 | S61: 6 | T61: =+U61+0.5*V61 -> 9.16 | U61: 8.16 | V61: 2 | W61: =+X61+Y61+0.5*Z61 -> 30.03 | X61: 5.41 | Y61: 24.12 | Z61: 1 | AA61: =+AB61+0.5*AC61 -> 35.54 | AB61: 29.54 | AC61: 12 | AD61: =+AE61+0.5*AF61 -> 26.20 | AE61: 25.70 | AF61: 1 | AG61: =+AH61+AI61+0.5*AJ61 -> 19.67 | AH61: 9.81 | AI61: 7.86 | AJ61: 4
A62: 58 | B62: Badger, | C62: Jeff | D62: CDP-MM | E62: =+G62+J62+M62+P62+T62+W62+AA62+AD62+AG62 -> 291.39 | F62: =+I62+L62+O62+S62+V62+Z62+AC62+AF62+AJ62 -> 64 | G62: =+H62+0.5*I62 -> 30.98 | H62: 29.98 | I62: 2 | J62: =+K62+0.5*L62 -> 25.43 | K62: 25.43 | L62: 0 | M62: =+N62+0.5*O62 -> 49.90 | N62: 28.40 | O62: 43 | P62: =+Q62+R62+0.5*S62 -> 36.81 | Q62: 20.07 | R62: 15.24 | S62: 3 | T62: =+U62+0.5*V62 -> 10.56 | U62: 8.56 | V62: 4 | W62: =+X62+Y62+0.5*Z62 -> 50.84 | X62: 7.58 | Y62: 39.76 | Z62: 7 | AA62: =+AB62+0.5*AC62 -> 26.00 | AB62: 25.50 | AC62: 1 | AD62: =+AE62+0.5*AF62 -> 33.09 | AE62: 32.59 | AF62: 1 | AG62: =+AH62+AI62+0.5*AJ62 -> 27.78 | AH62: 14.78 | AI62: 11.50 | AJ62: 3
A63: 59 | B63: Decker, | C63: Dennis | D63: SSP-MM | E63: =+G63+J63+M63+P63+T63+W63+AA63+AD63+AG63 -> 342.05 | F63: =+I63+L63+O63+S63+V63+Z63+AC63+AF63+AJ63 -> 64 | G63: =+H63+0.5*I63 -> 41.17 | H63: 41.17 | I63: 0 | J63: =+K63+0.5*L63 -> 24.47 | K63: 22.97 | L63: 3 | M63: =+N63+0.5*O63 -> 56.38 | N63: 43.38 | O63: 26 | P63: =+Q63+R63+0.5*S63 -> 43.46 | Q63: 19.17 | R63: 18.29 | S63: 12 | T63: =+U63+0.5*V63 -> 8.04 | U63: 8.04 | V63: 0 | W63: =+X63+Y63+0.5*Z63 -> 66.07 | X63: 6.43 | Y63: 54.14 | Z63: 11 | AA63: =+AB63+0.5*AC63 -> 50.48 | AB63: 46.98 | AC63: 7 | AD63: =+AE63+0.5*AF63 -> 27.47 | AE63: 24.97 | AF63: 5 | AG63: =+AH63+AI63+0.5*AJ63 -> 24.51 | AH63: 12.87 | AI63: 11.64 | AJ63: 0
A64: 60 | B64: Hood, | C64: Neil | D64: CDP-MM | E64: =+G64+J64+M64+P64+T64+W64+AA64+AD64+AG64 -> 279.87 | F64: =+I64+L64+O64+S64+V64+Z64+AC64+AF64+AJ64 -> 65 | G64: =+H64+0.5*I64 -> 29.11 | H64: 27.61 | I64: 3 | J64: =+K64+0.5*L64 -> 21.94 | K64: 17.44 | L64: 9 | M64: =+N64+0.5*O64 -> 39.27 | N64: 37.27 | O64: 4 | P64: =+Q64+R64+0.5*S64 -> 29.51 | Q64: 16.35 | R64: 13.16 | S64: 0 | T64: =+U64+0.5*V64 -> 12.38 | U64: 11.88 | V64: 1 | W64: =+X64+Y64+0.5*Z64 -> 39.50 | X64: 4.63 | Y64: 29.87 | Z64: 10 | AA64: =+AB64+0.5*AC64 -> 45.83 | AB64: 30.33 | AC64: 31 | AD64: =+AE64+0.5*AF64 -> 35.66 | AE64: 32.66 | AF64: 6 | AG64: =+AH64+AI64+0.5*AJ64 -> 26.67 | AH64: 12.80 | AI64: 13.37 | AJ64: 1
A65: 61 | B65: Cosper, | C65: Chris | D65: SSP-MM | E65: =+G65+J65+M65+P65+T65+W65+AA65+AD65+AG65 -> 327.49 | F65: =+I65+L65+O65+S65+V65+Z65+AC65+AF65+AJ65 -> 71 | G65: =+H65+0.5*I65 -> 32.31 | H65: 31.81 | I65: 1 | J65: =+K65+0.5*L65 -> 22.86 | K65: 21.86 | L65: 2 | M65: =+N65+0.5*O65 -> 44.38 | N65: 34.88 | O65: 19 | P65: =+Q65+R65+0.5*S65 -> 31.76 | Q65: 14.25 | R65: 12.01 | S65: 11 | T65: =+U65+0.5*V65 -> 9.71 | U65: 9.21 | V65: 1 | W65: =+X65+Y65+0.5*Z65 -> 48.85 | X65: 12.34 | Y65: 29.51 | Z65: 14 | AA65: =+AB65+0.5*AC65 -> 37.79 | AB65: 37.29 | AC65: 1 | AD65: =+AE65+0.5*AF65 -> 70.96 | AE65: 62.96 | AF65: 16 | AG65: =+AH65+AI65+0.5*AJ65 -> 28.87 | AH65: 15.82 | AI65: 10.05 | AJ65: 6
A66: 62 | B66: Katz, | C66: Eric | D66: ESP-MM | E66: =+G66+J66+M66+P66+T66+W66+AA66+AD66+AG66 -> 266.79 | F66: =+I66+L66+O66+S66+V66+Z66+AC66+AF66+AJ66 -> 72 | G66: =+H66+0.5*I66 -> 41.98 | H66: 40.48 | I66: 3 | J66: =+K66+0.5*L66 -> 21.92 | K66: 20.42 | L66: 3 | M66: =+N66+0.5*O66 -> 46.96 | N66: 33.96 | O66: 26 | P66: =+Q66+R66+0.5*S66 -> 28.15 | Q66: 14.78 | R66: 12.87 | S66: 1 | T66: =+U66+0.5*V66 -> 9.99 | U66: 9.49 | V66: 1 | W66: =+X66+Y66+0.5*Z66 -> 35.81 | X66: 5.46 | Y66: 22.35 | Z66: 16 | AA66: =+AB66+0.5*AC66 -> 33.42 | AB66: 26.92 | AC66: 13 | AD66: =+AE66+0.5*AF66 -> 26.14 | AE66: 23.14 | AF66: 6 | AG66: =+AH66+AI66+0.5*AJ66 -> 22.42 | AH66: 11.11 | AI66: 9.81 | AJ66: 3
A67: 63 | B67: Carlson, | C67: Paul | D67: SSP-MM | E67: =+G67+J67+M67+P67+T67+W67+AA67+AD67+AG67 -> 293.78 | F67: =+I67+L67+O67+S67+V67+Z67+AC67+AF67+AJ67 -> 73 | G67: =+H67+0.5*I67 -> 51.30 | H67: 48.30 | I67: 6 | J67: =+K67+0.5*L67 -> 17.69 | K67: 13.69 | L67: 8 | M67: =+N67+0.5*O67 -> 56.80 | N67: 53.80 | O67: 6 | P67: =+Q67+R67+0.5*S67 -> 31.94 | Q67: 16.18 | R67: 12.26 | S67: 7 | T67: =+U67+0.5*V67 -> 9.17 | U67: 8.17 | V67: 2 | W67: =+X67+Y67+0.5*Z67 -> 44.67 | X67: 4.08 | Y67: 28.59 | Z67: 24 | AA67: =+AB67+0.5*AC67 -> 30.12 | AB67: 26.62 | AC67: 7 | AD67: =+AE67+0.5*AF67 -> 31.28 | AE67: 25.28 | AF67: 12 | AG67: =+AH67+AI67+0.5*AJ67 -> 20.81 | AH67: 11.12 | AI67: 9.19 | AJ67: 1
A68: 64 | B68: Gelo, | C68: Ivan | D68: ESP-MA | E68: =+G68+J68+M68+P68+T68+W68+AA68+AD68+AG68 -> 207.71 | F68: =+I68+L68+O68+S68+V68+Z68+AC68+AF68+AJ68 -> 77 | G68: =+H68+0.5*I68 -> 25.63 | H68: 25.13 | I68: 1 | J68: =+K68+0.5*L68 -> 16.58 | K68: 16.08 | L68: 1 | M68: =+N68+0.5*O68 -> 42.38 | N68: 21.38 | O68: 42 | P68: =+Q68+R68+0.5*S68 -> 25.50 | Q68: 10.78 | R68: 14.72 | S68: 0 | T68: =+U68+0.5*V68 -> 18.72 | U68: 8.72 | V68: 20 | W68: =+X68+Y68+0.5*Z68 -> 25.70 | X68: 4.84 | Y68: 18.86 | Z68: 4 | AA68: =+AB68+0.5*AC68 -> 19.69 | AB68: 18.19 | AC68: 3 | AD68: =+AE68+0.5*AF68 -> 17.27 | AE68: 16.27 | AF68: 2 | AG68: =+AH68+AI68+0.5*AJ68 -> 16.24 | AH68: 8.28 | AI68: 5.96 | AJ68: 4
A69: 65 | B69: Redocto, | C69: Leonardo | D69: CDP-MM | E69: =+G69+J69+M69+P69+T69+W69+AA69+AD69+AG69 -> 398.53 | F69: =+I69+L69+O69+S69+V69+Z69+AC69+AF69+AJ69 -> 78 | G69: =+H69+0.5*I69 -> 46.91 | H69: 44.91 | I69: 4 | J69: =+K69+0.5*L69 -> 31.40 | K69: 28.90 | L69: 5 | M69: =+N69+0.5*O69 -> 58.96 | N69: 53.46 | O69: 11 | P69: =+Q69+R69+0.5*S69 -> 44.19 | Q69: 20.59 | R69: 22.10 | S69: 3 | T69: =+U69+0.5*V69 -> 10.39 | U69: 9.89 | V69: 1 | W69: =+X69+Y69+0.5*Z69 -> 62.12 | X69: 11.33 | Y69: 43.29 | Z69: 15 | AA69: =+AB69+0.5*AC69 -> 54.51 | AB69: 51.51 | AC69: 6 | AD69: =+AE69+0.5*AF69 -> 56.47 | AE69: 42.47 | AF69: 28 | AG69: =+AH69+AI69+0.5*AJ69 -> 33.58 | AH69: 16.38 | AI69: 14.70 | AJ69: 5
A70: 66 | B70: Correia, | C70: Larry | D70: CDP-SS | E70: =+G70+J70+M70+P70+T70+W70+AA70+AD70+AG70 -> 235.69 | F70: =+I70+L70+O70+S70+V70+Z70+AC70+AF70+AJ70 -> 79 | G70: =+H70+0.5*I70 -> 31.72 | H70: 28.22 | I70: 7 | J70: =+K70+0.5*L70 -> 19.87 | K70: 15.87 | L70: 8 | M70: =+N70+0.5*O70 -> 27.05 | N70: 26.05 | O70: 2 | P70: =+Q70+R70+0.5*S70 -> 24.96 | Q70: 8.60 | R70: 10.86 | S70: 11 | T70: =+U70+0.5*V70 -> 8.53 | U70: 6.53 | V70: 4 | W70: =+X70+Y70+0.5*Z70 -> 35.23 | X70: 5.07 | Y70: 24.66 | Z70: 11 | AA70: =+AB70+0.5*AC70 -> 34.49 | AB70: 24.99 | AC70: 19 | AD70: =+AE70+0.5*AF70 -> 32.39 | AE70: 24.89 | AF70: 15 | AG70: =+AH70+AI70+0.5*AJ70 -> 21.45 | AH70: 11.98 | AI70: 8.47 | AJ70: 2
A71: 67 | B71: Jespersen, | C71: Chad | D71: SSP-MM | E71: =+G71+J71+M71+P71+T71+W71+AA71+AD71+AG71 -> 321.49 | F71: =+I71+L71+O71+S71+V71+Z71+AC71+AF71+AJ71 -> 83 | G71: =+H71+0.5*I71 -> 47.65 | H71: 46.65 | I71: 2 | J71: =+K71+0.5*L71 -> 27.12 | K71: 24.62 | L71: 5 | M71: =+N71+0.5*O71 -> 46.85 | N71: 46.35 | O71: 1 | P71: =+Q71+R71+0.5*S71 -> 43.14 | Q71: 16.48 | R71: 14.66 | S71: 24 | T71: =+U71+0.5*V71 -> 12.20 | U71: 12.20 | V71: 0 | W71: =+X71+Y71+0.5*Z71 -> 39.35 | X71: 7.75 | Y71: 30.10 | Z71: 3 | AA71: =+AB71+0.5*AC71 -> 42.90 | AB71: 31.40 | AC71: 23 | AD71: =+AE71+0.5*AF71 -> 35.82 | AE71: 23.32 | AF71: 25 | AG71: =+AH71+AI71+0.5*AJ71 -> 26.46 | AH71: 11.66 | AI71: 14.80 | AJ71: 0
A72: 68 | B72: Nelson, | C72: John | D72: SSP-SS | E72: =+G72+J72+M72+P72+T72+W72+AA72+AD72+AG72 -> 280.75 | F72: =+I72+L72+O72+S72+V72+Z72+AC72+AF72+AJ72 -> 95 | G72: =+H72+0.5*I72 -> 38.74 | H72: 38.74 | I72: 0 | J72: =+K72+0.5*L72 -> 18.72 | K72: 17.22 | L72: 3 | M72: =+N72+0.5*O72 -> 34.75 | N72: 29.75 | O72: 10 | P72: =+Q72+R72+0.5*S72 -> 36.27 | Q72: 17.10 | R72: 15.17 | S72: 8 | T72: =+U72+0.5*V72 -> 36.98 | U72: 11.48 | V72: 51 | W72: =+X72+Y72+0.5*Z72 -> 36.66 | X72: 6.52 | Y72: 23.14 | Z72: 14 | AA72: =+AB72+0.5*AC72 -> 29.12 | AB72: 28.12 | AC72: 2 | AD72: =+AE72+0.5*AF72 -> 29.78 | AE72: 26.78 | AF72: 6 | AG72: =+AH72+AI72+0.5*AJ72 -> 19.73 | AH72: 10.76 | AI72: 8.47 | AJ72: 1
A73: 69 | B73: Huggins, | C73: Chip | D73: SSP-MM | E73: =+G73+J73+M73+P73+T73+W73+AA73+AD73+AG73 -> 329.84 | F73: =+I73+L73+O73+S73+V73+Z73+AC73+AF73+AJ73 -> 96 | G73: =+H73+0.5*I73 -> 27.69 | H73: 22.69 | I73: 10 | J73: =+K73+0.5*L73 -> 29.12 | K73: 21.12 | L73: 16 | M73: =+N73+0.5*O73 -> 55.26 | N73: 51.26 | O73: 8 | P73: =+Q73+R73+0.5*S73 -> 34.80 | Q73: 14.57 | R73: 12.73 | S73: 15 | T73: =+U73+0.5*V73 -> 15.59 | U73: 9.59 | V73: 12 | W73: =+X73+Y73+0.5*Z73 -> 55.89 | X73: 7.01 | Y73: 42.88 | Z73: 12 | AA73: =+AB73+0.5*AC73 -> 35.24 | AB73: 31.74 | AC73: 7 | AD73: =+AE73+0.5*AF73 -> 47.16 | AE73: 39.66 | AF73: 15 | AG73: =+AH73+AI73+0.5*AJ73 -> 29.09 | AH73: 15.78 | AI73: 12.81 | AJ73: 1
A74: 70 | B74: Roach, | C74: Chris | D74: CDP-MM | E74: =+G74+J74+M74+P74+T74+W74+AA74+AD74+AG74 -> 272.78 | F74: =+I74+L74+O74+S74+V74+Z74+AC74+AF74+AJ74 -> 100 | G74: =+H74+0.5*I74 -> 32.86 | H74: 31.36 | I74: 3 | J74: =+K74+0.5*L74 -> 24.49 | K74: 18.49 | L74: 12 | M74: =+N74+0.5*O74 -> 49.00 | N74: 41.50 | O74: 15 | P74: =+Q74+R74+0.5*S74 -> 26.61 | Q74: 13.94 | R74: 10.17 | S74: 5 | T74: =+U74+0.5*V74 -> 9.53 | U74: 7.53 | V74: 4 | W74: =+X74+Y74+0.5*Z74 -> 43.60 | X74: 5.67 | Y74: 26.43 | Z74: 23 | AA74: =+AB74+0.5*AC74 -> 40.00 | AB74: 25.50 | AC74: 29 | AD74: =+AE74+0.5*AF74 -> 31.78 | AE74: 27.28 | AF74: 9 | AG74: =+AH74+AI74+0.5*AJ74 -> 14.91 | AH74: 8.54 | AI74: 6.37 | AJ74: 0
A75: 71 | B75: Allen, | C75: Susan M. | D75: SSP-NV | E75: =+G75+J75+M75+P75+T75+W75+AA75+AD75+AG75 -> 386.22 | F75: =+I75+L75+O75+S75+V75+Z75+AC75+AF75+AJ75 -> 100 | G75: =+H75+0.5*I75 -> 46.62 | H75: 45.62 | I75: 2 | J75: =+K75+0.5*L75 -> 33.70 | K75: 31.20 | L75: 5 | M75: =+N75+0.5*O75 -> 56.47 | N75: 40.47 | O75: 32 | P75: =+Q75+R75+0.5*S75 -> 46.21 | Q75: 23.19 | R75: 19.52 | S75: 7 | T75: =+U75+0.5*V75 -> 19.62 | U75: 11.12 | V75: 17 | W75: =+X75+Y75+0.5*Z75 -> 62.64 | X75: 10.61 | Y75: 42.53 | Z75: 19 | AA75: =+AB75+0.5*AC75 -> 41.13 | AB75: 36.63 | AC75: 9 | AD75: =+AE75+0.5*AF75 -> 45.11 | AE75: 44.11 | AF75: 2 | AG75: =+AH75+AI75+0.5*AJ75 -> 34.72 | AH75: 15.05 | AI75: 16.17 | AJ75: 7
A76: 72 | B76: Jorgensen, | C76: John Q | D76: SSP-SS | E76: =+G76+J76+M76+P76+T76+W76+AA76+AD76+AG76 -> 276.42 | F76: =+I76+L76+O76+S76+V76+Z76+AC76+AF76+AJ76 -> 111 | G76: =+H76+0.5*I76 -> 27.98 | H76: 25.48 | I76: 5 | J76: =+K76+0.5*L76 -> 21.61 | K76: 20.11 | L76: 3 | M76: =+N76+0.5*O76 -> 42.83 | N76: 34.83 | O76: 16 | P76: =+Q76+R76+0.5*S76 -> 35.56 | Q76: 14.82 | R76: 13.24 | S76: 15 | T76: =+U76+0.5*V76 -> 10.29 | U76: 8.79 | V76: 3 | W76: =+X76+Y76+0.5*Z76 -> 38.98 | X76: 5.01 | Y76: 25.47 | Z76: 17 | AA76: =+AB76+0.5*AC76 -> 42.85 | AB76: 26.85 | AC76: 32 | AD76: =+AE76+0.5*AF76 -> 32.11 | AE76: 26.61 | AF76: 11 | AG76: =+AH76+AI76+0.5*AJ76 -> 24.21 | AH76: 11.74 | AI76: 7.97 | AJ76: 9
A77: 73 | B77: Wilkins, | C77: Lance | D77: SSP-SS | E77: =+G77+J77+M77+P77+T77+W77+AA77+AD77+AG77 -> 328.20 | F77: =+I77+L77+O77+S77+V77+Z77+AC77+AF77+AJ77 -> 116 | G77: =+H77+0.5*I77 -> 43.22 | H77: 43.22 | I77: 0 | J77: =+K77+0.5*L77 -> 22.83 | K77: 19.33 | L77: 7 | M77: =+N77+0.5*O77 -> 57.65 | N77: 35.15 | O77: 45 | P77: =+Q77+R77+0.5*S77 -> 31.18 | Q77: 17.43 | R77: 13.25 | S77: 1 | T77: =+U77+0.5*V77 -> 24.47 | U77: 8.97 | V77: 31 | W77: =+X77+Y77+0.5*Z77 -> 41.79 | X77: 5.60 | Y77: 28.19 | Z77: 16 | AA77: =+AB77+0.5*AC77 -> 36.58 | AB77: 33.58 | AC77: 6 | AD77: =+AE77+0.5*AF77 -> 48.69 | AE77: 44.19 | AF77: 9 | AG77: =+AH77+AI77+0.5*AJ77 -> 21.79 | AH77: 13.13 | AI77: 8.16 | AJ77: 1
A78: 74 | B78: Balay, | C78: Danny | D78: CDP-MM | E78: =+G78+J78+M78+P78+T78+W78+AA78+AD78+AG78 -> 307.39 | F78: =+I78+L78+O78+S78+V78+Z78+AC78+AF78+AJ78 -> 120 | G78: =+H78+0.5*I78 -> 34.40 | H78: 34.40 | I78: 0 | J78: =+K78+0.5*L78 -> 23.26 | K78: 17.26 | L78: 12 | M78: =+N78+0.5*O78 -> 63.17 | N78: 48.67 | O78: 29 | P78: =+Q78+R78+0.5*S78 -> 41.16 | Q78: 5.43 | R78: 13.73 | S78: 44 | T78: =+U78+0.5*V78 -> 14.25 | U78: 8.25 | V78: 12 | W78: =+X78+Y78+0.5*Z78 -> 40.32 | X78: 7.53 | Y78: 28.29 | Z78: 9 | AA78: =+AB78+0.5*AC78 -> 33.00 | AB78: 27.00 | AC78: 12 | AD78: =+AE78+0.5*AF78 -> 34.60 | AE78: 34.10 | AF78: 1 | AG78: =+AH78+AI78+0.5*AJ78 -> 23.23 | AH78: 12.27 | AI78: 10.46 | AJ78: 1
A79: 75* | B79: Dunn, | C79: Rusty | D79: CDP-MM | E79: =+G79+J79+M79+P79+T79+W79+AA79+AD79+AG79 -> 368.17 | F79: =+I79+L79+O79+S79+V79+Z79+AC79+AF79+AJ79 -> 156 | G79: =+H79+0.5*I79 -> 35.00 | H79: 31.00 | I79: 8 | J79: =+K79+0.5*L79 -> 26.18 | K79: 21.68 | L79: 9 | M79: =+N79+0.5*O79 -> 57.29 | N79: 51.29 | O79: 12 | P79: =+Q79+R79+0.5*S79 -> 40.58 | Q79: 16.73 | R79: 14.35 | S79: 19 | T79: =+U79+0.5*V79 -> 28.99 | U79: 8.99 | V79: 40 | W79: =+X79+Y79+0.5*Z79 -> 45.06 | X79: 5.57 | Y79: 30.49 | Z79: 18 | AA79: =+AB79+0.5*AC79 -> 46.93 | AB79: 32.93 | AC79: 28 | AD79: =+AE79+0.5*AF79 -> 50.11 | AE79: 45.61 | AF79: 9 | AG79: =+AH79+AI79+0.5*AJ79 -> 38.03 | AH79: 14.79 | AI79: 16.74 | AJ79: 13
A80: 76 | B80: Jelin, | C80: Barry | D80: CDP-MM | E80: =+G80+J80+M80+P80+T80+W80+AA80+AD80+AG80 -> 430.29 | F80: =+I80+L80+O80+S80+V80+Z80+AC80+AF80+AJ80 -> 158 | G80: =+H80+0.5*I80 -> 37.71 | H80: 37.21 | I80: 1 | J80: =+K80+0.5*L80 -> 41.96 | K80: 31.46 | L80: 21 | M80: =+N80+0.5*O80 -> 78.52 | N80: 55.02 | O80: 47 | P80: =+Q80+R80+0.5*S80 -> 67.79 | Q80: 39.77 | R80: 23.52 | S80: 9 | T80: =+U80+0.5*V80 -> 13.45 | U80: 10.45 | V80: 6 | W80: =+X80+Y80+0.5*Z80 -> 53.44 | X80: 8.12 | Y80: 33.82 | Z80: 23 | AA80: =+AB80+0.5*AC80 -> 56.90 | AB80: 43.90 | AC80: 26 | AD80: =+AE80+0.5*AF80 -> 49.94 | AE80: 41.44 | AF80: 17 | AG80: =+AH80+AI80+0.5*AJ80 -> 30.58 | AH80: 14.08 | AI80: 12.50 | AJ80: 8
A81: 77 | B81: Bier, | C81: Gabriel | D81: SSP-MM | E81: DQ | F81: DQ | G81: =+H81+0.5*I81 -> 36.47 | H81: 34.97 | I81: 3 | J81: =+K81+0.5*L81 -> 25.62 | K81: 24.62 | L81: 2 | M81: =+N81+0.5*O81 -> 43.93 | N81: 42.43 | O81: 3 | P81: =+Q81+R81+0.5*S81 -> 41.51 | Q81: 20.76 | R81: 19.25 | S81: 3 | T81: =+U81+0.5*V81 -> 18.05 | U81: 17.05 | V81: 2 | W81: DQ | X81: 8.17 | AA81: =+AB81+0.5*AC81 -> 0.00 | AD81: =+AE81+0.5*AF81 -> 0.00 | AG81: =+AH81+AI81+0.5*AJ81 -> 0.00
A83: Legend/Notes:
A84: X | B84: = Shooters who received trophies for their specific Division/Classification.
A85: Xx Xx | B85: = Shooters who acted as SOs or were part of the Match Staff.
A86: DQ | B86: = Shooter was disqualified for some reason.
A87: XX | B87: = Points Down value included some sore of penalty (Procedural, Hit On Non-threat, Failure to Neutralize, etc.)
A88: XXX.XX | B88: = Because these shooters took 1st place in their specific Div/Class, and there were more than 10 shooters competing in their classification, they were automatically advanced to the next highest classification.
A89: 75* | B89: = Although signed off by the shooter and the SO, Rusty Dunn's score sheet for Stage 1 did not have a time for the stage. As a result, his placing is based on an arbitrary time for Stage 1 (31.00). A value that is plus or minus 20 seconds from the 31.00 seconds given, would not have affected his Div/Class placing.
B91: All of the individual scores were verified on 9/16/03. Some corrections may have resulted in minor placing changes, but none affected the final trophy winning results.