A1: Utah Shooting Academy March 2004
A2: TOTAL MATCH SCORES (Including Points Down and Penalties) Note: Stage 1 had a par time and only Points Down values are entered. Click on Stage # to view COF.
A3: Place | B3: Name | C3: Match | D3: Stage1 | E3: Stage 2 | F3: Stage 3 | G3: Stage4
A4: 1 | B4: Red Redford (Auto) | C4: =+SUM(D4:G4) -> 37.40 | D4: 1.00 | E4: 30.61 | F4: 5.79
A5: 2 | B5: Kip Peterson | C5: =+SUM(D5:G5) -> 37.65 | D5: 1.00 | E5: 29.74 | F5: 6.91
A6: 3 | B6: Ari T | C6: =+SUM(D6:G6) -> 40.35 | D6: 0.00 | E6: 33.84 | F6: 6.51
A7: 4 | B7: Milos Krivka | C7: =+SUM(D7:G7) -> 40.50 | D7: 0.00 | E7: 33.91 | F7: 6.59
A8: 5 | B8: Les Langford | C8: =+SUM(D8:G8) -> 40.58 | D8: 1.00 | E8: 33.77 | F8: 5.81
A9: 6 | B9: Dave Duncan(Glock) | C9: =+SUM(D9:G9) -> 41.09 | D9: 0.00 | E9: 34.10 | F9: 6.99
A10: 7 | B10: Red Redford (Rev.) | C10: =+SUM(D10:G10) -> 43.54 | D10: 0.50 | E10: 36.72 | F10: 6.32
A11: 8 | B11: Alan Scott | C11: =+SUM(D11:G11) -> 44.75 | D11: 3.00 | E11: 33.13 | F11: 8.62
A12: 9 | B12: Brent Adams | C12: =+SUM(D12:G12) -> 45.51 | D12: 4.00 | E12: 33.19 | F12: 8.32
A13: 10 | B13: Bryan Mortenson | C13: =+SUM(D13:G13) -> 46.12 | D13: 11.00 | E13: 29.37 | F13: 5.75
A14: 11 | B14: Gill Brown | C14: =+SUM(D14:G14) -> 47.14 | D14: 5.00 | E14: 34.09 | F14: 8.05
A15: 12 | B15: Neil Hood | C15: =+SUM(D15:G15) -> 48.22 | D15: 0.50 | E15: 40.10 | F15: 7.62
A16: 13 | B16: Rob Peterson | C16: =+SUM(D16:G16) -> 49.53 | D16: 1.00 | E16: 38.67 | F16: 9.86
A17: 14 | B17: Justin Jacobson | C17: =+SUM(D17:G17) -> 50.09 | D17: 5.00 | E17: 37.88 | F17: 7.21
A18: 15 | B18: Creatch Dezell | C18: =+SUM(D18:G18) -> 50.30 | D18: 3.00 | E18: 39.62 | F18: 7.68
A19: 16 | B19: Justin Park | C19: =+SUM(D19:G19) -> 51.67 | D19: 8.50 | E19: 36.87 | F19: 6.30
A20: 17 | B20: Mike Rodriquez | C20: =+SUM(D20:G20) -> 51.74 | D20: 8.00 | E20: 37.40 | F20: 6.34
A21: 18 | B21: Dave Duncan(Spr.) | C21: =+SUM(D21:G21) -> 51.83 | D21: 2.00 | E21: 43.60 | F21: 6.23
A22: 19 | B22: Michael Scott | C22: =+SUM(D22:G22) -> 57.11 | D22: 1.50 | E22: 49.91 | F22: 5.70
A23: 20 | B23: Mike Brownlee | C23: =+SUM(D23:G23) -> 57.14 | D23: 14.50 | E23: 36.26 | F23: 6.38
A24: 21 | B24: Scott Asbell | C24: =+SUM(D24:G24) -> 58.08 | D24: 1.50 | E24: 44.27 | F24: 12.31
A25: 22 | B25: Carl Burney | C25: =+SUM(D25:G25) -> 60.19 | D25: 0.50 | E25: 53.15 | F25: 6.54
A26: 23 | B26: Jesse Christensen | C26: =+SUM(D26:G26) -> 60.55 | D26: 4.00 | E26: 50.51 | F26: 6.04
A27: 24 | B27: John Diamond | C27: =+SUM(D27:G27) -> 67.17 | D27: 15.50 | E27: 40.60 | F27: 11.07
A28: 25 | B28: Ken Thorne | C28: =+SUM(D28:G28) -> 67.66 | D28: 12.50 | E28: 45.99 | F28: 9.17
A29: 26 | B29: Bill Dezell | C29: =+SUM(D29:G29) -> 69.62 | D29: 3.50 | E29: 55.62 | F29: 10.50
A30: 27 | B30: Tim Ross | C30: =+SUM(D30:G30) -> 71.93 | D30: 10.00 | E30: 52.01 | F30: 9.92
A31: 28 | B31: Ryan Thorne | C31: =+SUM(D31:G31) -> 74.62 | D31: 6.00 | E31: 61.41 | F31: 7.21
A32: 29 | B32: Roger Cox | C32: =+SUM(D32:G32) -> 78.42 | D32: 6.00 | E32: 57.95 | F32: 14.47
A33: 30 | B33: Ben Bruenderman | C33: =+SUM(D33:G33) -> 83.49 | D33: 10.00 | E33: 65.67 | F33: 7.82
A34: 31 | B34: Anne Roach | C34: =+SUM(D34:G34) -> 88.09 | D34: 3.50 | E34: 77.30 | F34: 7.29
A35: 32 | B35: Carol Perez | C35: =+SUM(D35:G35) -> 98.89 | D35: 14.00 | E35: 73.12 | F35: 11.77
A36: Overall Match Average: | C36: =AVERAGE(C4:C35) -> 56.592812500000001 | D36: =AVERAGE(D4:D35) -> 4.921875 | E36: =AVERAGE(E4:E35) -> 43.761875000000003 | F36: =AVERAGE(F4:F35) -> 7.9090625000000001
A37: RAW TIMES (Note: Stage 1 had a par time.)
A38: Place | B38: Name | C38: Match | D38: Stage1 | E38: Stage 2 | F38: Stage 3 | G38: Stage4
A39: 1 | B39: Red Redford (Auto) | C39: =+SUM(D39:G39) -> 31.40 | D39: N/A | E39: 26.61 | F39: 4.79
A40: 2 | B40: John Diamond | C40: =+SUM(D40:G40) -> 31.67 | D40: N/A | E40: 26.10 | F40: 5.57
A41: 3 | B41: Bryan Mortenson | C41: =+SUM(D41:G41) -> 32.12 | D41: N/A | E41: 26.37 | F41: 5.75
A42: 4 | B42: Kip Peterson | C42: =+SUM(D42:G42) -> 33.15 | D42: N/A | E42: 27.74 | F42: 5.41
A43: 5 | B43: Alan Scott | C43: =+SUM(D43:G43) -> 33.75 | D43: N/A | E43: 29.63 | F43: 4.12
A44: 6 | B44: Les Langford | C44: =+SUM(D44:G44) -> 34.58 | D44: N/A | E44: 28.77 | F44: 5.81
A45: 7 | B45: Mike Brownlee | C45: =+SUM(D45:G45) -> 35.14 | D45: N/A | E45: 30.26 | F45: 4.88
A46: 8 | B46: Ari T | C46: =+SUM(D46:G46) -> 35.85 | D46: N/A | E46: 31.34 | F46: 4.51
A47: 9 | B47: Milos Krivka | C47: =+SUM(D47:G47) -> 36.50 | D47: N/A | E47: 30.91 | F47: 5.59
A48: 10 | B48: Brent Adams | C48: =+SUM(D48:G48) -> 36.51 | D48: N/A | E48: 31.19 | F48: 5.32
A49: 11 | B49: Gill Brown | C49: =+SUM(D49:G49) -> 37.14 | D49: N/A | E49: 32.09 | F49: 5.05
A50: 12 | B50: Dave Duncan(Glock) | C50: =+SUM(D50:G50) -> 37.59 | D50: N/A | E50: 32.10 | F50: 5.49
A51: 13 | B51: Mike Rodriquez | C51: =+SUM(D51:G51) -> 37.74 | D51: N/A | E51: 33.90 | F51: 3.84
A52: 14 | B52: Justin Jacobson | C52: =+SUM(D52:G52) -> 38.59 | D52: N/A | E52: 33.38 | F52: 5.21
A53: 15 | B53: Justin Park | C53: =+SUM(D53:G53) -> 39.67 | D53: N/A | E53: 33.87 | F53: 5.80
A54: 16 | B54: Neil Hood | C54: =+SUM(D54:G54) -> 40.22 | D54: N/A | E54: 35.10 | F54: 5.12
A55: 17 | B55: Creatch Dezell | C55: =+SUM(D55:G55) -> 41.30 | D55: N/A | E55: 35.62 | F55: 5.68
A56: 18 | B56: Dave Duncan(Spr.) | C56: =+SUM(D56:G56) -> 41.33 | D56: N/A | E56: 35.10 | F56: 6.23
A57: 19 | B57: Red Redford (Rev.) | C57: =+SUM(D57:G57) -> 41.54 | D57: N/A | E57: 36.22 | F57: 5.32
A58: 20 | B58: Rob Peterson | C58: =+SUM(D58:G58) -> 42.03 | D58: N/A | E58: 36.17 | F58: 5.86
A59: 21 | B59: Ken Thorne | C59: =+SUM(D59:G59) -> 45.16 | D59: N/A | E59: 40.49 | F59: 4.67
A60: 22 | B60: Scott Asbell | C60: =+SUM(D60:G60) -> 46.08 | D60: N/A | E60: 40.27 | F60: 5.81
A61: 23 | B61: Michael Scott | C61: =+SUM(D61:G61) -> 46.61 | D61: N/A | E61: 41.91 | F61: 4.70
A62: 24 | B62: Jesse Christensen | C62: =+SUM(D62:G62) -> 48.55 | D62: N/A | E62: 44.01 | F62: 4.54
A63: 25 | B63: Bill Dezell | C63: =+SUM(D63:G63) -> 52.62 | D63: N/A | E63: 45.12 | F63: 7.50
A64: 26 | B64: Carol Perez | C64: =+SUM(D64:G64) -> 55.89 | D64: N/A | E64: 49.12 | F64: 6.77
A65: 27 | B65: Tim Ross | C65: =+SUM(D65:G65) -> 55.93 | D65: N/A | E65: 49.01 | F65: 6.92
A66: 28 | B66: Roger Cox | C66: =+SUM(D66:G66) -> 56.42 | D66: N/A | E66: 48.95 | F66: 7.47
A67: 29 | B67: Carl Burney | C67: =+SUM(D67:G67) -> 58.19 | D67: N/A | E67: 51.65 | F67: 6.54
A68: 30 | B68: Ben Bruenderman | C68: =+SUM(D68:G68) -> 58.49 | D68: N/A | E68: 53.67 | F68: 4.82
A69: 31 | B69: Ryan Thorne | C69: =+SUM(D69:G69) -> 62.12 | D69: N/A | E69: 56.91 | F69: 5.21
A70: 32 | B70: Anne Roach | C70: =+SUM(D70:G70) -> 78.59 | D70: N/A | E70: 71.80 | F70: 6.79
A71: Overall Raw Time Average: | C71: =AVERAGE(C39:C70) -> 43.827187500000001 | D71: N/A | E71: =SUM(E39:E70)/32 -> 38.293125000000003 | F71: =SUM(F39:F70)/32 -> 5.5340625000000001
A72: POINTS DOWN
A73: Place | B73: Name | C73: Match | D73: Stage1 | E73: Stage 2 | F73: Stage 3 | G73: Stage4
A74: 1 | B74: Carl Burney | C74: =+SUM(D74:G74) -> 4 | D74: 1 | E74: 3 | F74: 0
A75: 2 | B75: Red Redford (Rev.) | C75: =+SUM(D75:G75) -> 4 | D75: 1 | E75: 1 | F75: 2
A76: 3 | B76: Milos Krivka | C76: =+SUM(D76:G76) -> 5 | D76: 0 | E76: 3 | F76: 2
A77: 4 | B77: Dave Duncan(Glock) | C77: =+SUM(D77:G77) -> 7 | D77: 0 | E77: 4 | F77: 3
A78: 5 | B78: Bryan Mortenson | C78: =+SUM(D78:G78) -> 8 | D78: 2 | E78: 6 | F78: 0
A79: 6 | B79: Kip Peterson | C79: =+SUM(D79:G79) -> 9 | D79: 2 | E79: 4 | F79: 3
A80: 7 | B80: Ari T | C80: =+SUM(D80:G80) -> 11 | D80: 0 | E80: 7 | F80: 4
A81: 8 | B81: Les Langford | C81: =+SUM(D81:G81) -> 12 | D81: 2 | E81: 10 | F81: 0
A82: 9 | B82: Red Redford (Auto) | C82: =+SUM(D82:G82) -> 12 | D82: 2 | E82: 8 | F82: 2
A83: 10 | B83: Justin Park | C83: =+SUM(D83:G83) -> 14 | D83: 7 | E83: 6 | F83: 1
A84: 11 | B84: Rob Peterson | C84: =+SUM(D84:G84) -> 15 | D84: 2 | E84: 5 | F84: 8
A85: 12 | B85: Neil Hood | C85: =+SUM(D85:G85) -> 16 | D85: 1 | E85: 10 | F85: 5
A86: 13 | B86: Creatch Dezell | C86: =+SUM(D86:G86) -> 18 | D86: 6 | E86: 8 | F86: 4
A87: 14 | B87: Gill Brown | C87: =+SUM(D87:G87) -> 20 | D87: 10 | E87: 4 | F87: 6
A88: 15 | B88: Brent Adams | C88: =+SUM(D88:G88) -> 20 | D88: 8 | E88: 6 | F88: 6
A89: 16 | B89: Michael Scott | C89: =+SUM(D89:G89) -> 21 | D89: 3 | E89: 16 | F89: 2
A90: 17 | B90: Dave Duncan(Spr.) | C90: =+SUM(D90:G90) -> 21 | D90: 4 | E90: 17 | F90: 0
A91: 18 | B91: Alan Scott | C91: =+SUM(D91:G91) -> 22 | D91: 6 | E91: 7 | F91: 9
A92: 19 | B92: Justin Jacobson | C92: =+SUM(D92:G92) -> 23 | D92: 10 | E92: 9 | F92: 4
A93: 20 | B93: Scott Asbell | C93: =+SUM(D93:G93) -> 24 | D93: 3 | E93: 8 | F93: 13
A94: 21 | B94: Jesse Christensen | C94: =+SUM(D94:G94) -> 24 | D94: 8 | E94: 13 | F94: 3
A95: 22 | B95: Ryan Thorne | C95: =+SUM(D95:G95) -> 25 | D95: 12 | E95: 9 | F95: 4
A96: 23 | B96: Anne Roach | C96: =+SUM(D96:G96) -> 25 | D96: 7 | E96: 13 | F96: 5
A97: 24 | B97: Mike Rodriquez | C97: =+SUM(D97:G97) -> 28 | D97: 16 | E97: 7 | F97: 5
A98: 25 | B98: Tim Ross | C98: =+SUM(D98:G98) -> 32 | D98: 20 | E98: 6 | F98: 6
A99: 26 | B99: Mike Brownlee | C99: =+SUM(D99:G99) -> 34 | D99: 19 | E99: 12 | F99: 3
A100: 27 | B100: Bill Dezell | C100: =+SUM(D100:G100) -> 34 | D100: 7 | E100: 21 | F100: 6
A101: 28 | B101: Ken Thorne | C101: =+SUM(D101:G101) -> 35 | D101: 15 | E101: 11 | F101: 9
A102: 29 | B102: Roger Cox | C102: =+SUM(D102:G102) -> 44 | D102: 12 | E102: 18 | F102: 14
A103: 30 | B103: Ben Bruenderman | C103: =+SUM(D103:G103) -> 50 | D103: 20 | E103: 24 | F103: 6
A104: 31 | B104: John Diamond | C104: =+SUM(D104:G104) -> 61 | D104: 21 | E104: 29 | F104: 11
A105: 32 | B105: Carol Perez | C105: =+SUM(D105:G105) -> 86 | D105: 28 | E105: 48 | F105: 10
A106: Overall Points Down Average: | C106: =SUM(C74:C105)/32 -> 23.875 | D106: =SUM(D74:D105)/32 -> 7.96875 | E106: =SUM(E74:E105)/32 -> 11.03125 | F106: =SUM(F74:F105)/32 -> 4.875