A1: Utah Shooting Academy Dec. 15, 2004
A2: SCORES (Including points down and penalties)
A3: Number | B3: Name | C3: Match | D3: Stage 1 | E3: Stage 2 | F3: Stage 3 | G3: Stage 4
A4: 1 | B4: =[match_scoresheet.xls]S3!$B$1 -> Ari Theodore | C4: =[match_scoresheet.xls]S3!$F$28 -> 65.73 | D4: =[match_scoresheet.xls]S3!B$28 -> 16.69 | E4: =[match_scoresheet.xls]S3!C$28 -> 21.74 | F4: =[match_scoresheet.xls]S3!D$28 -> 10.55 | G4: =[match_scoresheet.xls]S3!E$28 -> 16.75
A5: 2 | B5: =[match_scoresheet.xls]S1!$B$1 -> Chris Roach | C5: =[match_scoresheet.xls]S1!$F$28 -> 71.60 | D5: =[match_scoresheet.xls]S1!B$28 -> 17.92 | E5: =[match_scoresheet.xls]S1!C$28 -> 18.75 | F5: =[match_scoresheet.xls]S1!D$28 -> 12.77 | G5: =[match_scoresheet.xls]S1!E$28 -> 22.16
A6: 3 | B6: =[match_scoresheet.xls]S2!$B$1 -> Justin Park | C6: =[match_scoresheet.xls]S2!$F$28 -> 80.01 | D6: =[match_scoresheet.xls]S2!B$28 -> 22.85 | E6: =[match_scoresheet.xls]S2!C$28 -> 20.07 | F6: =[match_scoresheet.xls]S2!D$28 -> 17.79 | G6: =[match_scoresheet.xls]S2!E$28 -> 19.30
A7: 4 | B7: =[match_scoresheet.xls]S17!$B$1 -> Les Langford | C7: =[match_scoresheet.xls]S17!$F$28 -> 81.01 | D7: =[match_scoresheet.xls]S17!B$28 -> 20.10 | E7: =[match_scoresheet.xls]S17!C$28 -> 30.50 | F7: =[match_scoresheet.xls]S17!D$28 -> 16.49 | G7: =[match_scoresheet.xls]S17!E$28 -> 13.92
A8: 5 | B8: =[match_scoresheet.xls]S11!$B$1 -> Red (Auto) | C8: =[match_scoresheet.xls]S11!$F$27 -> 83.24 | D8: =[match_scoresheet.xls]S11!B$27 -> 24.55 | E8: =[match_scoresheet.xls]S11!C$27 -> 23.94 | F8: =[match_scoresheet.xls]S11!D$27 -> 11.06 | G8: =[match_scoresheet.xls]S11!E$27 -> 23.69
A9: 6 | B9: =[match_scoresheet.xls]S6!$B$1 -> Dave Duncan | C9: =[match_scoresheet.xls]S6!$F$28 -> 92.34 | D9: =[match_scoresheet.xls]S6!B$28 -> 24.95 | E9: =[match_scoresheet.xls]S6!C$28 -> 29.23 | F9: =[match_scoresheet.xls]S6!D$28 -> 19.56 | G9: =[match_scoresheet.xls]S6!E$28 -> 18.60
A10: 7 | B10: =[match_scoresheet.xls]S5!$B$1 -> Dave Beck | C10: =[match_scoresheet.xls]S5!$F$28 -> 98.56 | D10: =[match_scoresheet.xls]S5!B$28 -> 24.34 | E10: =[match_scoresheet.xls]S5!C$28 -> 19.47 | F10: =[match_scoresheet.xls]S5!D$28 -> 14.18 | G10: =[match_scoresheet.xls]S5!E$28 -> 40.57
A11: 8 | B11: =[match_scoresheet.xls]S4!$B$1 -> Juke Zaccardi | C11: =[match_scoresheet.xls]S4!$F$28 -> 104.90 | D11: =[match_scoresheet.xls]S4!B$28 -> 18.40 | E11: =[match_scoresheet.xls]S4!C$28 -> 17.03 | F11: =[match_scoresheet.xls]S4!D$28 -> 13.80 | G11: =[match_scoresheet.xls]S4!E$28 -> 55.67
A12: 9 | B12: =[match_scoresheet.xls]S15!$B$1 -> Red (Revolver) | C12: =[match_scoresheet.xls]S15!$F$28 -> 114.09 | D12: =[match_scoresheet.xls]S15!B$28 -> 24.57 | E12: =[match_scoresheet.xls]S15!C$28 -> 30.57 | F12: =[match_scoresheet.xls]S15!D$28 -> 28.05 | G12: =[match_scoresheet.xls]S15!E$28 -> 30.90
A13: 10 | B13: =[match_scoresheet.xls]S12!$B$1 -> R Dan | C13: =[match_scoresheet.xls]S12!$F$28 -> 118.42 | D13: =[match_scoresheet.xls]S12!B$28 -> 15.99 | E13: =[match_scoresheet.xls]S12!C$28 -> 25.99 | F13: =[match_scoresheet.xls]S12!D$28 -> 26.81 | G13: =[match_scoresheet.xls]S12!E$28 -> 49.63
A14: 11 | B14: =[match_scoresheet.xls]S13!$B$1 -> Ken Thorne | C14: =[match_scoresheet.xls]S13!$F$28 -> 129.30 | D14: =[match_scoresheet.xls]S13!B$28 -> 33.03 | E14: =[match_scoresheet.xls]S13!C$28 -> 38.50 | F14: =[match_scoresheet.xls]S13!D$28 -> 26.09 | G14: =[match_scoresheet.xls]S13!E$28 -> 31.68
A15: 12 | B15: =[match_scoresheet.xls]S7!$B$1 -> David Lorenz | C15: =[match_scoresheet.xls]S7!$F$28 -> 130.47 | D15: =[match_scoresheet.xls]S7!B$28 -> 29.51 | E15: =[match_scoresheet.xls]S7!C$28 -> 30.23 | F15: =[match_scoresheet.xls]S7!D$28 -> 13.51 | G15: =[match_scoresheet.xls]S7!E$28 -> 57.22
A16: 13 | B16: =[match_scoresheet.xls]S14!$B$1 -> Ryan Thorne | C16: =[match_scoresheet.xls]S14!$F$28 -> 150.91 | D16: =[match_scoresheet.xls]S14!B$28 -> 37.10 | E16: =[match_scoresheet.xls]S14!C$28 -> 35.74 | F16: =[match_scoresheet.xls]S14!D$28 -> 14.01 | G16: =[match_scoresheet.xls]S14!E$28 -> 64.06
A17: 14 | B17: =[match_scoresheet.xls]S18!$B$1 -> Neil Hood | C17: =[match_scoresheet.xls]S18!$F$28 -> 160.15 | D17: =[match_scoresheet.xls]S18!B$28 -> 21.73 | E17: =[match_scoresheet.xls]S18!C$28 -> 23.74 | F17: =[match_scoresheet.xls]S18!D$28 -> 27.10 | G17: =[match_scoresheet.xls]S18!E$28 -> 87.58
A18: 15 | B18: =[match_scoresheet.xls]S16!$B$1 -> Carol Perez | C18: =[match_scoresheet.xls]S16!$F$27 -> 222.375 | D18: =[match_scoresheet.xls]S16!B$27 -> 45.814999999999998 | E18: =[match_scoresheet.xls]S16!C$27 -> 47.61 | F18: =[match_scoresheet.xls]S16!D$27 -> 44.97 | G18: =[match_scoresheet.xls]S16!E$27 -> 83.98
A19: 16 | B19: =[match_scoresheet.xls]S8!$B$1 -> Jennifer M. | C19: =[match_scoresheet.xls]S8!$F$28 -> 243.91 | D19: =[match_scoresheet.xls]S8!B$28 -> 33.36 | E19: =[match_scoresheet.xls]S8!C$28 -> 42.54 | F19: =[match_scoresheet.xls]S8!D$28 -> 77.51 | G19: =[match_scoresheet.xls]S8!E$28 -> 90.50
A20: 17 | B20: =[match_scoresheet.xls]S9!$B$1 -> Stephen Duncan | C20: =[match_scoresheet.xls]S9!$F$27 -> 265.75 | D20: =[match_scoresheet.xls]S9!B$27 -> 53.96 | E20: =[match_scoresheet.xls]S9!C$27 -> 50.56 | F20: =[match_scoresheet.xls]S9!D$27 -> 92.62 | G20: =[match_scoresheet.xls]S9!E$27 -> 68.61
A21: 18 | B21: =[match_scoresheet.xls]S10!$B$1 -> Sam Olschewski | C21: =[match_scoresheet.xls]S10!$F$28 -> 328.58 | D21: =[match_scoresheet.xls]S10!B$28 -> 101.44 | E21: =[match_scoresheet.xls]S10!C$28 -> 59.21 | F21: =[match_scoresheet.xls]S10!D$28 -> 70.17 | G21: =[match_scoresheet.xls]S10!E$28 -> 97.76
A22: S19 | B22: =[match_scoresheet.xls]S19!$B$1 -> 0 | C22: =[match_scoresheet.xls]S19!$F$27 -> 0.00 | D22: =[match_scoresheet.xls]S19!B$27 -> 0.00 | E22: =[match_scoresheet.xls]S19!C$27 -> 0.00 | F22: =[match_scoresheet.xls]S19!D$27 -> 0.00 | G22: =[match_scoresheet.xls]S19!E$27 -> 0.00
A23: S20 | B23: =[match_scoresheet.xls]S20!$B$1 -> 0 | C23: =[match_scoresheet.xls]S20!$F$27 -> 0.00 | D23: =[match_scoresheet.xls]S20!B$27 -> 0.00 | E23: =[match_scoresheet.xls]S20!C$27 -> 0.00 | F23: =[match_scoresheet.xls]S20!D$27 -> 0.00 | G23: =[match_scoresheet.xls]S20!E$27 -> 0.00
A24: S21 | B24: =[match_scoresheet.xls]S21!$B$1 -> 0 | C24: =[match_scoresheet.xls]S21!$F$27 -> 0.00 | D24: =[match_scoresheet.xls]S21!B$27 -> 0.00 | E24: =[match_scoresheet.xls]S21!C$27 -> 0.00 | F24: =[match_scoresheet.xls]S21!D$27 -> 0.00 | G24: =[match_scoresheet.xls]S21!E$27 -> 0.00
A25: S22 | B25: =[match_scoresheet.xls]S22!$B$1 -> 0 | C25: =[match_scoresheet.xls]S22!$F$27 -> 0.00 | D25: =[match_scoresheet.xls]S22!B$27 -> 0.00 | E25: =[match_scoresheet.xls]S22!C$27 -> 0.00 | F25: =[match_scoresheet.xls]S22!D$27 -> 0.00 | G25: =[match_scoresheet.xls]S22!E$27 -> 0.00
A26: S23 | B26: =[match_scoresheet.xls]S23!$B$1 -> 0 | C26: =[match_scoresheet.xls]S23!$F$27 -> 0.00 | D26: =[match_scoresheet.xls]S23!B$27 -> 0.00 | E26: =[match_scoresheet.xls]S23!C$27 -> 0.00 | F26: =[match_scoresheet.xls]S23!D$27 -> 0.00 | G26: =[match_scoresheet.xls]S23!E$27 -> 0.00
A27: S24 | B27: =[match_scoresheet.xls]S24!$B$1 -> 0 | C27: =[match_scoresheet.xls]S24!$F$27 -> 0.00 | D27: =[match_scoresheet.xls]S24!B$27 -> 0.00 | E27: =[match_scoresheet.xls]S24!C$27 -> 0.00 | F27: =[match_scoresheet.xls]S24!D$27 -> 0.00 | G27: =[match_scoresheet.xls]S24!E$27 -> 0.00
A28: S25 | B28: =[match_scoresheet.xls]S25!$B$1 -> 0 | C28: =[match_scoresheet.xls]S25!$F$27 -> 0.00 | D28: =[match_scoresheet.xls]S25!B$27 -> 0.00 | E28: =[match_scoresheet.xls]S25!C$27 -> 0.00 | F28: =[match_scoresheet.xls]S25!D$27 -> 0.00 | G28: =[match_scoresheet.xls]S25!E$27 -> 0.00
A29: =COUNTIF($C$4:$C$28,">0") -> 18 | B29: Overall Average: | C29: =SUM(C4:C28)/$A$29 -> 141.18583333333333 | D29: =SUM(D4:D28)/$A$29 -> 31.461388888888891 | E29: =SUM(E4:E28)/$A$29 -> 31.412222222222226 | F29: =SUM(F4:F28)/$A$29 -> 29.835555555555555 | G29: =SUM(G4:G28)/$A$29 -> 48.476666666666667
A30: RAW TIMES
A31: Place | B31: Name | C31: Match | D31: Stage 1 | E31: Stage 2 | F31: Stage 3 | G31: Stage 4
A32: 1 | B32: =[match_scoresheet.xls]S3!$B$1 -> Ari Theodore | C32: =[match_scoresheet.xls]S3!$F$24 -> 52.73 | D32: =[match_scoresheet.xls]S3!B$24 -> 15.19 | E32: =[match_scoresheet.xls]S3!C$24 -> 10.24 | F32: =[match_scoresheet.xls]S3!D$24 -> 10.55 | G32: =[match_scoresheet.xls]S3!E$24 -> 16.75
A33: 2 | B33: =[match_scoresheet.xls]S2!$B$1 -> Justin Park | C33: =[match_scoresheet.xls]S2!$F$24 -> 66.51 | D33: =[match_scoresheet.xls]S2!B$24 -> 14.85 | E33: =[match_scoresheet.xls]S2!C$24 -> 14.57 | F33: =[match_scoresheet.xls]S2!D$24 -> 17.79 | G33: =[match_scoresheet.xls]S2!E$24 -> 19.30
A34: 3 | B34: =[match_scoresheet.xls]S1!$B$1 -> Chris Roach | C34: =[match_scoresheet.xls]S1!$F$24 -> 67.60 | D34: =[match_scoresheet.xls]S1!B$24 -> 15.92 | E34: =[match_scoresheet.xls]S1!C$24 -> 16.75 | F34: =[match_scoresheet.xls]S1!D$24 -> 12.77 | G34: =[match_scoresheet.xls]S1!E$24 -> 22.16
A35: 4 | B35: =[match_scoresheet.xls]S11!$B$1 -> Red (Auto) | C35: =[match_scoresheet.xls]S11!$F$23 -> 69.56 | D35: =[match_scoresheet.xls]S11!B$23 -> 17.37 | E35: =[match_scoresheet.xls]S11!C$23 -> 17.44 | F35: =[match_scoresheet.xls]S11!D$23 -> 11.06 | G35: =[match_scoresheet.xls]S11!E$23 -> 23.69
A36: 5 | B36: =[match_scoresheet.xls]S17!$B$1 -> Les Langford | C36: =[match_scoresheet.xls]S17!$F$24 -> 71.51 | D36: =[match_scoresheet.xls]S17!B$24 -> 18.60 | E36: =[match_scoresheet.xls]S17!C$24 -> 22.50 | F36: =[match_scoresheet.xls]S17!D$24 -> 16.49 | G36: =[match_scoresheet.xls]S17!E$24 -> 13.92
A37: 6 | B37: =[match_scoresheet.xls]S6!$B$1 -> Dave Duncan | C37: =[match_scoresheet.xls]S6!$F$24 -> 77.34 | D37: =[match_scoresheet.xls]S6!B$24 -> 22.45 | E37: =[match_scoresheet.xls]S6!C$24 -> 16.73 | F37: =[match_scoresheet.xls]S6!D$24 -> 19.56 | G37: =[match_scoresheet.xls]S6!E$24 -> 18.60
A38: 7 | B38: =[match_scoresheet.xls]S4!$B$1 -> Juke Zaccardi | C38: =[match_scoresheet.xls]S4!$F$24 -> 77.40 | D38: =[match_scoresheet.xls]S4!B$24 -> 14.90 | E38: =[match_scoresheet.xls]S4!C$24 -> 13.03 | F38: =[match_scoresheet.xls]S4!D$24 -> 13.80 | G38: =[match_scoresheet.xls]S4!E$24 -> 35.67
A39: 8 | B39: =[match_scoresheet.xls]S5!$B$1 -> Dave Beck | C39: =[match_scoresheet.xls]S5!$F$24 -> 89.06 | D39: =[match_scoresheet.xls]S5!B$24 -> 19.84 | E39: =[match_scoresheet.xls]S5!C$24 -> 14.47 | F39: =[match_scoresheet.xls]S5!D$24 -> 14.18 | G39: =[match_scoresheet.xls]S5!E$24 -> 40.57
A40: 9 | B40: =[match_scoresheet.xls]S15!$B$1 -> Red (Revolver) | C40: =[match_scoresheet.xls]S15!$F$24 -> 104.09 | D40: =[match_scoresheet.xls]S15!B$24 -> 20.57 | E40: =[match_scoresheet.xls]S15!C$24 -> 24.57 | F40: =[match_scoresheet.xls]S15!D$24 -> 28.05 | G40: =[match_scoresheet.xls]S15!E$24 -> 30.90
A41: 10 | B41: =[match_scoresheet.xls]S12!$B$1 -> R Dan | C41: =[match_scoresheet.xls]S12!$F$24 -> 105.92 | D41: =[match_scoresheet.xls]S12!B$24 -> 11.99 | E41: =[match_scoresheet.xls]S12!C$24 -> 17.49 | F41: =[match_scoresheet.xls]S12!D$24 -> 26.81 | G41: =[match_scoresheet.xls]S12!E$24 -> 49.63
A42: 11 | B42: =[match_scoresheet.xls]S7!$B$1 -> David Lorenz | C42: =[match_scoresheet.xls]S7!$F$24 -> 107.47 | D42: =[match_scoresheet.xls]S7!B$24 -> 23.01 | E42: =[match_scoresheet.xls]S7!C$24 -> 16.23 | F42: =[match_scoresheet.xls]S7!D$24 -> 13.51 | G42: =[match_scoresheet.xls]S7!E$24 -> 54.72
A43: 12 | B43: =[match_scoresheet.xls]S13!$B$1 -> Ken Thorne | C43: =[match_scoresheet.xls]S13!$F$24 -> 115.30 | D43: =[match_scoresheet.xls]S13!B$24 -> 27.53 | E43: =[match_scoresheet.xls]S13!C$24 -> 30.00 | F43: =[match_scoresheet.xls]S13!D$24 -> 26.09 | G43: =[match_scoresheet.xls]S13!E$24 -> 31.68
A44: 13 | B44: =[match_scoresheet.xls]S14!$B$1 -> Ryan Thorne | C44: =[match_scoresheet.xls]S14!$F$24 -> 133.41 | D44: =[match_scoresheet.xls]S14!B$24 -> 31.60 | E44: =[match_scoresheet.xls]S14!C$24 -> 23.74 | F44: =[match_scoresheet.xls]S14!D$24 -> 14.01 | G44: =[match_scoresheet.xls]S14!E$24 -> 64.06
A45: 14 | B45: =[match_scoresheet.xls]S18!$B$1 -> Neil Hood | C45: =[match_scoresheet.xls]S18!$F$24 -> 155.65 | D45: =[match_scoresheet.xls]S18!B$24 -> 21.23 | E45: =[match_scoresheet.xls]S18!C$24 -> 19.74 | F45: =[match_scoresheet.xls]S18!D$24 -> 27.10 | G45: =[match_scoresheet.xls]S18!E$24 -> 87.58
A46: 15 | B46: =[match_scoresheet.xls]S16!$B$1 -> Carol Perez | C46: =[match_scoresheet.xls]S16!$F$23 -> 194.61 | D46: =[match_scoresheet.xls]S16!B$23 -> 37.05 | E46: =[match_scoresheet.xls]S16!C$23 -> 28.61 | F46: =[match_scoresheet.xls]S16!D$23 -> 44.97 | G46: =[match_scoresheet.xls]S16!E$23 -> 83.98
A47: 16 | B47: =[match_scoresheet.xls]S8!$B$1 -> Jennifer M. | C47: =[match_scoresheet.xls]S8!$F$24 -> 229.91 | D47: =[match_scoresheet.xls]S8!B$24 -> 31.86 | E47: =[match_scoresheet.xls]S8!C$24 -> 30.04 | F47: =[match_scoresheet.xls]S8!D$24 -> 77.51 | G47: =[match_scoresheet.xls]S8!E$24 -> 90.50
A48: 17 | B48: =[match_scoresheet.xls]S9!$B$1 -> Stephen Duncan | C48: =[match_scoresheet.xls]S9!$F$23 -> 248.56 | D48: =[match_scoresheet.xls]S9!B$23 -> 42.77 | E48: =[match_scoresheet.xls]S9!C$23 -> 44.56 | F48: =[match_scoresheet.xls]S9!D$23 -> 92.62 | G48: =[match_scoresheet.xls]S9!E$23 -> 68.61
A49: 18 | B49: =[match_scoresheet.xls]S10!$B$1 -> Sam Olschewski | C49: =[match_scoresheet.xls]S10!$F$24 -> 322.58 | D49: =[match_scoresheet.xls]S10!B$24 -> 95.44 | E49: =[match_scoresheet.xls]S10!C$24 -> 59.21 | F49: =[match_scoresheet.xls]S10!D$24 -> 70.17 | G49: =[match_scoresheet.xls]S10!E$24 -> 97.76
A50: S19 | B50: =[match_scoresheet.xls]S19!$B$1 -> 0 | C50: =[match_scoresheet.xls]S19!$F$23 -> 0.00 | D50: =[match_scoresheet.xls]S19!B$23 -> 0.00 | E50: =[match_scoresheet.xls]S19!C$23 -> 0.00 | F50: =[match_scoresheet.xls]S19!D$23 -> 0.00 | G50: =[match_scoresheet.xls]S19!E$23 -> 0.00
A51: S20 | B51: =[match_scoresheet.xls]S20!$B$1 -> 0 | C51: =[match_scoresheet.xls]S20!$F$23 -> 0.00 | D51: =[match_scoresheet.xls]S20!B$23 -> 0.00 | E51: =[match_scoresheet.xls]S20!C$23 -> 0.00 | F51: =[match_scoresheet.xls]S20!D$23 -> 0.00 | G51: =[match_scoresheet.xls]S20!E$23 -> 0.00
A52: S21 | B52: =[match_scoresheet.xls]S21!$B$1 -> 0 | C52: =[match_scoresheet.xls]S21!$F$23 -> 0.00 | D52: =[match_scoresheet.xls]S21!B$23 -> 0.00 | E52: =[match_scoresheet.xls]S21!C$23 -> 0.00 | F52: =[match_scoresheet.xls]S21!D$23 -> 0.00 | G52: =[match_scoresheet.xls]S21!E$23 -> 0.00
A53: S22 | B53: =[match_scoresheet.xls]S22!$B$1 -> 0 | C53: =[match_scoresheet.xls]S22!$F$23 -> 0.00 | D53: =[match_scoresheet.xls]S22!B$23 -> 0.00 | E53: =[match_scoresheet.xls]S22!C$23 -> 0.00 | F53: =[match_scoresheet.xls]S22!D$23 -> 0.00 | G53: =[match_scoresheet.xls]S22!E$23 -> 0.00
A54: S23 | B54: =[match_scoresheet.xls]S23!$B$1 -> 0 | C54: =[match_scoresheet.xls]S23!$F$23 -> 0.00 | D54: =[match_scoresheet.xls]S23!B$23 -> 0.00 | E54: =[match_scoresheet.xls]S23!C$23 -> 0.00 | F54: =[match_scoresheet.xls]S23!D$23 -> 0.00 | G54: =[match_scoresheet.xls]S23!E$23 -> 0.00
A55: S24 | B55: =[match_scoresheet.xls]S24!$B$1 -> 0 | C55: =[match_scoresheet.xls]S24!$F$23 -> 0.00 | D55: =[match_scoresheet.xls]S24!B$23 -> 0.00 | E55: =[match_scoresheet.xls]S24!C$23 -> 0.00 | F55: =[match_scoresheet.xls]S24!D$23 -> 0.00 | G55: =[match_scoresheet.xls]S24!E$23 -> 0.00
A56: S25 | B56: =[match_scoresheet.xls]S25!$B$1 -> 0 | C56: =[match_scoresheet.xls]S25!$F$23 -> 0.00 | D56: =[match_scoresheet.xls]S25!B$23 -> 0.00 | E56: =[match_scoresheet.xls]S25!C$23 -> 0.00 | F56: =[match_scoresheet.xls]S25!D$23 -> 0.00 | G56: =[match_scoresheet.xls]S25!E$23 -> 0.00
A57: Overall Average: | C57: =SUM(C32:C56)/$A$29 -> 127.17833333333336 | D57: =SUM(D32:D56)/$A$29 -> 26.787222222222223 | E57: =SUM(E32:E56)/$A$29 -> 23.328888888888891 | F57: =SUM(F32:F56)/$A$29 -> 29.835555555555555 | G57: =SUM(G32:G56)/$A$29 -> 47.226666666666659
A58: POINTS DOWN
A59: Place | B59: Name | C59: Match | D59: Stage 1 | E59: Stage 2 | F59: Stage 3 | G59: Stage 4
A60: 1 | B60: =[match_scoresheet.xls]S1!$B$1 -> Chris Roach | C60: =[match_scoresheet.xls]S1!$F$25 -> 8 | D60: =[match_scoresheet.xls]S1!B$25 -> 4 | E60: =[match_scoresheet.xls]S1!C$25 -> 4 | F60: =[match_scoresheet.xls]S1!D$25 -> 0 | G60: =[match_scoresheet.xls]S1!E$25 -> 0
A61: 2 | B61: =[match_scoresheet.xls]S18!$B$1 -> Neil Hood | C61: =[match_scoresheet.xls]S18!$F$25 -> 9 | D61: =[match_scoresheet.xls]S18!B$25 -> 1 | E61: =[match_scoresheet.xls]S18!C$25 -> 8 | F61: =[match_scoresheet.xls]S18!D$25 -> 0 | G61: =[match_scoresheet.xls]S18!E$25 -> 0
A62: 3 | B62: =[match_scoresheet.xls]S10!$B$1 -> Sam Olschewski | C62: =[match_scoresheet.xls]S10!$F$25 -> 12 | D62: =[match_scoresheet.xls]S10!B$25 -> 12 | E62: =[match_scoresheet.xls]S10!C$25 -> 0 | F62: =[match_scoresheet.xls]S10!D$25 -> 0 | G62: =[match_scoresheet.xls]S10!E$25 -> 0
A63: 4 | B63: =[match_scoresheet.xls]S5!$B$1 -> Dave Beck | C63: =[match_scoresheet.xls]S5!$F$25 -> 19 | D63: =[match_scoresheet.xls]S5!B$25 -> 9 | E63: =[match_scoresheet.xls]S5!C$25 -> 10 | F63: =[match_scoresheet.xls]S5!D$25 -> 0 | G63: =[match_scoresheet.xls]S5!E$25 -> 0
A64: 5 | B64: =[match_scoresheet.xls]S17!$B$1 -> Les Langford | C64: =[match_scoresheet.xls]S17!$F$25 -> 19 | D64: =[match_scoresheet.xls]S17!B$25 -> 3 | E64: =[match_scoresheet.xls]S17!C$25 -> 16 | F64: =[match_scoresheet.xls]S17!D$25 -> 0 | G64: =[match_scoresheet.xls]S17!E$25 -> 0
A65: 6 | B65: =[match_scoresheet.xls]S15!$B$1 -> Red (Revolver) | C65: =[match_scoresheet.xls]S15!$F$25 -> 20 | D65: =[match_scoresheet.xls]S15!B$25 -> 8 | E65: =[match_scoresheet.xls]S15!C$25 -> 12 | F65: =[match_scoresheet.xls]S15!D$25 -> 0 | G65: =[match_scoresheet.xls]S15!E$25 -> 0
A66: 7 | B66: =[match_scoresheet.xls]S12!$B$1 -> R Dan | C66: =[match_scoresheet.xls]S12!$F$25 -> 25 | D66: =[match_scoresheet.xls]S12!B$25 -> 8 | E66: =[match_scoresheet.xls]S12!C$25 -> 17 | F66: =[match_scoresheet.xls]S12!D$25 -> 0 | G66: =[match_scoresheet.xls]S12!E$25 -> 0
A67: 8 | B67: =[match_scoresheet.xls]S3!$B$1 -> Ari Theodore | C67: =[match_scoresheet.xls]S3!$F$25 -> 26 | D67: =[match_scoresheet.xls]S3!B$25 -> 3 | E67: =[match_scoresheet.xls]S3!C$25 -> 23 | F67: =[match_scoresheet.xls]S3!D$25 -> 0 | G67: =[match_scoresheet.xls]S3!E$25 -> 0
A68: 9 | B68: =[match_scoresheet.xls]S2!$B$1 -> Justin Park | C68: =[match_scoresheet.xls]S2!$F$25 -> 27 | D68: =[match_scoresheet.xls]S2!B$25 -> 16 | E68: =[match_scoresheet.xls]S2!C$25 -> 11 | F68: =[match_scoresheet.xls]S2!D$25 -> 0 | G68: =[match_scoresheet.xls]S2!E$25 -> 0
A69: 10 | B69: =[match_scoresheet.xls]S11!$B$1 -> Red (Auto) | C69: =[match_scoresheet.xls]S11!$F$24 -> 27.36 | D69: =[match_scoresheet.xls]S11!B$24 -> 14.36 | E69: =[match_scoresheet.xls]S11!C$24 -> 13 | F69: =[match_scoresheet.xls]S11!D$24 -> 0 | G69: =[match_scoresheet.xls]S11!E$24 -> 0
A70: 11 | B70: =[match_scoresheet.xls]S8!$B$1 -> Jennifer M. | C70: =[match_scoresheet.xls]S8!$F$25 -> 28 | D70: =[match_scoresheet.xls]S8!B$25 -> 3 | E70: =[match_scoresheet.xls]S8!C$25 -> 25 | F70: =[match_scoresheet.xls]S8!D$25 -> 0 | G70: =[match_scoresheet.xls]S8!E$25 -> 0
A71: 12 | B71: =[match_scoresheet.xls]S13!$B$1 -> Ken Thorne | C71: =[match_scoresheet.xls]S13!$F$25 -> 28 | D71: =[match_scoresheet.xls]S13!B$25 -> 11 | E71: =[match_scoresheet.xls]S13!C$25 -> 17 | F71: =[match_scoresheet.xls]S13!D$25 -> 0 | G71: =[match_scoresheet.xls]S13!E$25 -> 0
A72: 13 | B72: =[match_scoresheet.xls]S6!$B$1 -> Dave Duncan | C72: =[match_scoresheet.xls]S6!$F$25 -> 30 | D72: =[match_scoresheet.xls]S6!B$25 -> 5 | E72: =[match_scoresheet.xls]S6!C$25 -> 25 | F72: =[match_scoresheet.xls]S6!D$25 -> 0 | G72: =[match_scoresheet.xls]S6!E$25 -> 0
A73: 14 | B73: =[match_scoresheet.xls]S9!$B$1 -> Stephen Duncan | C73: =[match_scoresheet.xls]S9!$F$24 -> 34.38 | D73: =[match_scoresheet.xls]S9!B$24 -> 22.38 | E73: =[match_scoresheet.xls]S9!C$24 -> 12 | F73: =[match_scoresheet.xls]S9!D$24 -> 0 | G73: =[match_scoresheet.xls]S9!E$24 -> 0
A74: 15 | B74: =[match_scoresheet.xls]S14!$B$1 -> Ryan Thorne | C74: =[match_scoresheet.xls]S14!$F$25 -> 35 | D74: =[match_scoresheet.xls]S14!B$25 -> 11 | E74: =[match_scoresheet.xls]S14!C$25 -> 24 | F74: =[match_scoresheet.xls]S14!D$25 -> 0 | G74: =[match_scoresheet.xls]S14!E$25 -> 0
A75: 16 | B75: =[match_scoresheet.xls]S7!$B$1 -> David Lorenz | C75: =[match_scoresheet.xls]S7!$F$25 -> 46 | D75: =[match_scoresheet.xls]S7!B$25 -> 13 | E75: =[match_scoresheet.xls]S7!C$25 -> 28 | F75: =[match_scoresheet.xls]S7!D$25 -> 0 | G75: =[match_scoresheet.xls]S7!E$25 -> 5
A76: 17 | B76: =[match_scoresheet.xls]S4!$B$1 -> Juke Zaccardi | C76: =[match_scoresheet.xls]S4!$F$25 -> 55 | D76: =[match_scoresheet.xls]S4!B$25 -> 7 | E76: =[match_scoresheet.xls]S4!C$25 -> 8 | F76: =[match_scoresheet.xls]S4!D$25 -> 0 | G76: =[match_scoresheet.xls]S4!E$25 -> 40
A77: 18 | B77: =[match_scoresheet.xls]S16!$B$1 -> Carol Perez | C77: =[match_scoresheet.xls]S16!$F$24 -> 55.53 | D77: =[match_scoresheet.xls]S16!B$24 -> 17.53 | E77: =[match_scoresheet.xls]S16!C$24 -> 38 | F77: =[match_scoresheet.xls]S16!D$24 -> 0 | G77: =[match_scoresheet.xls]S16!E$24 -> 0
A78: S19 | B78: =[match_scoresheet.xls]S19!$B$1 -> 0 | C78: =[match_scoresheet.xls]S19!$F$24 -> 0 | D78: =[match_scoresheet.xls]S19!B$24 -> 0 | E78: =[match_scoresheet.xls]S19!C$24 -> 0 | F78: =[match_scoresheet.xls]S19!D$24 -> 0 | G78: =[match_scoresheet.xls]S19!E$24 -> 0
A79: S20 | B79: =[match_scoresheet.xls]S20!$B$1 -> 0 | C79: =[match_scoresheet.xls]S20!$F$24 -> 0 | D79: =[match_scoresheet.xls]S20!B$24 -> 0 | E79: =[match_scoresheet.xls]S20!C$24 -> 0 | F79: =[match_scoresheet.xls]S20!D$24 -> 0 | G79: =[match_scoresheet.xls]S20!E$24 -> 0
A80: S21 | B80: =[match_scoresheet.xls]S21!$B$1 -> 0 | C80: =[match_scoresheet.xls]S21!$F$24 -> 0 | D80: =[match_scoresheet.xls]S21!B$24 -> 0 | E80: =[match_scoresheet.xls]S21!C$24 -> 0 | F80: =[match_scoresheet.xls]S21!D$24 -> 0 | G80: =[match_scoresheet.xls]S21!E$24 -> 0
A81: S22 | B81: =[match_scoresheet.xls]S22!$B$1 -> 0 | C81: =[match_scoresheet.xls]S22!$F$24 -> 0 | D81: =[match_scoresheet.xls]S22!B$24 -> 0 | E81: =[match_scoresheet.xls]S22!C$24 -> 0 | F81: =[match_scoresheet.xls]S22!D$24 -> 0 | G81: =[match_scoresheet.xls]S22!E$24 -> 0
A82: S23 | B82: =[match_scoresheet.xls]S23!$B$1 -> 0 | C82: =[match_scoresheet.xls]S23!$F$24 -> 0 | D82: =[match_scoresheet.xls]S23!B$24 -> 0 | E82: =[match_scoresheet.xls]S23!C$24 -> 0 | F82: =[match_scoresheet.xls]S23!D$24 -> 0 | G82: =[match_scoresheet.xls]S23!E$24 -> 0
A83: S24 | B83: =[match_scoresheet.xls]S24!$B$1 -> 0 | C83: =[match_scoresheet.xls]S24!$F$24 -> 0 | D83: =[match_scoresheet.xls]S24!B$24 -> 0 | E83: =[match_scoresheet.xls]S24!C$24 -> 0 | F83: =[match_scoresheet.xls]S24!D$24 -> 0 | G83: =[match_scoresheet.xls]S24!E$24 -> 0
A84: S25 | B84: =[match_scoresheet.xls]S25!$B$1 -> 0 | C84: =[match_scoresheet.xls]S25!$F$24 -> 0 | D84: =[match_scoresheet.xls]S25!B$24 -> 0 | E84: =[match_scoresheet.xls]S25!C$24 -> 0 | F84: =[match_scoresheet.xls]S25!D$24 -> 0 | G84: =[match_scoresheet.xls]S25!E$24 -> 0
A85: Overall Average: | C85: =SUM(C60:C84)/$A$29 -> 28.015000000000001 | D85: =SUM(D60:D84)/$A$29 -> 9.3483333333333345 | E85: =SUM(E60:E84)/$A$29 -> 16.166666666666668 | F85: =SUM(F60:F84)/$A$29 -> 0 | G85: =SUM(G60:G84)/$A$29 -> 2.5