B1: Utah State IDPA Match - 2004 Results | C1: 2004 Utah State IDPA Championship Match
B2: Held on September 25, 2004 | F2: (Sorted by POINTS DOWN including penalties without regard to Div/Class.) | T2: 5 | W2: 6 | Z2: 7 | AE2: 8
A3: Shooter # | B3: Squad | C3: Place | D3: Name (Last, First) | E3: Div/Class | F3: Shoot Total | G3: Total PD | H3: Stage 1 | I3: String 1 | J3: Points Down | K3: Stage 2 | L3: String 1 | M3: Points Down | N3: Stage 3 | O3: String 1 | P3: Points Down | Q3: Stage 4 | R3: String 1 | S3: Points Down | T3: Stage 5 | U3: String 1 | V3: Points Down | W3: Stage 6 | X3: String 1 | Y3: Points Down | Z3: Stage 7 | AA3: String 1 | AB3: String 2 | AC3: String 3 | AD3: Points Down | AE3: Stage 8 | AF3: String 1 | AG3: Points Down
A4: 79 | B4: S9 | C4: 2 | D4: Zaccardi, Pat | E4: ESP-SS | F4: =+H4+K4+N4+Q4+T4+W4+Z4+AE4 -> 178.82 | G4: =+J4+M4+P4+S4+V4+Y4+AD4+AG4 -> 39 | H4: =+I4+0.5*J4 -> 20.67 | I4: 20.17 | J4: 1 | K4: =+L4+0.5*M4 -> 28.85 | L4: 24.85 | M4: =1+2+2+3 -> 8 | N4: =+O4+0.5*P4 -> 23.01 | O4: 19.01 | P4: =5+2+1 -> 8 | Q4: =+R4+(0.5*S4) -> 24.13 | R4: 23.63 | S4: 1 | T4: =+U4+0.5*V4 -> 23.77 | U4: 21.77 | V4: =2+1+1 -> 4 | W4: =+X4+(0.5*Y4) -> 18.42 | X4: 16.92 | Y4: =1+2 -> 3 | Z4: =+(AA4+AB4+AC4)+0.5*AD4 -> 16.90 | AA4: 4.43 | AB4: 4.86 | AC4: 3.61 | AD4: =3+2+3 -> 8 | AE4: =+AF4+0.5*AG4 -> 23.07 | AF4: 20.07 | AG4: =1+0+5+0+0+0 -> 6
A5: 42 | B5: S9 | C5: 4 | D5: Lowe, John | E5: CDP-EX | F5: =+H5+K5+N5+Q5+T5+W5+Z5+AE5 -> 203.02 | G5: =+J5+M5+P5+S5+V5+Y5+AD5+AG5 -> 39 | H5: =+I5+0.5*J5 -> 31.41 | I5: 30.91 | J5: 1 | K5: =+L5+0.5*M5 -> 31.08 | L5: 28.58 | M5: =1+1+2+1 -> 5 | N5: =+O5+0.5*P5 -> 22.70 | O5: 20.70 | P5: =1+1+1+1 -> 4 | Q5: =+R5+(0.5*S5) -> 25.85 | R5: 22.35 | S5: =1+1+4+1 -> 7 | T5: =+U5+0.5*V5 -> 27.98 | U5: 25.98 | V5: =1+1+1+1 -> 4 | W5: =+X5+(0.5*Y5) -> 16.49 | X5: 15.99 | Y5: 1 | Z5: =+(AA5+AB5+AC5)+0.5*AD5 -> 18.46 | AA5: 4.97 | AB5: 4.90 | AC5: 4.09 | AD5: =6+3 -> 9 | AE5: =+AF5+0.5*AG5 -> 29.05 | AF5: 25.05 | AG5: =1+1+0+4+2+0 -> 8
A6: 21 | B6: 5 | C6: 1 | D6: Edwards, Lance | E6: ESP-EX | F6: =+H6+K6+N6+Q6+T6+W6+Z6+AE6 -> 161.35 | G6: =+J6+M6+P6+S6+V6+Y6+AD6+AG6 -> 46 | H6: =+I6+0.5*J6 -> 19.08 | I6: 15.08 | J6: =1+1+6 -> 8 | K6: =+L6+0.5*M6 -> 21.38 | L6: 20.88 | M6: =1+0+0+0+0+0+0+0 -> 1 | N6: =+O6+0.5*P6 -> 18.89 | O6: 16.39 | P6: =1+3+1 -> 5 | Q6: =+R6+(0.5*S6) -> 23.94 | R6: 18.94 | S6: =5+1+2+1+1 -> 10 | T6: =+U6+0.5*V6 -> 26.22 | U6: 21.72 | V6: =1+1+2+2+1+2 -> 9 | W6: =+X6+(0.5*Y6) -> 13.98 | X6: 13.98 | Y6: 0 | Z6: =+(AA6+AB6+AC6)+0.5*AD6 -> 12.14 | AA6: 2.89 | AB6: 3.45 | AC6: 3.30 | AD6: =2+3 -> 5 | AE6: =+AF6+0.5*AG6 -> 25.72 | AF6: 21.72 | AG6: =1+3+4 -> 8
A7: 72 | B7: 5 | C7: 2 | D7: Ward, Dan | E7: CDP-EX | F7: =+H7+K7+N7+Q7+T7+W7+Z7+AE7 -> 188.48 | G7: =+J7+M7+P7+S7+V7+Y7+AD7+AG7 -> 46 | H7: =+I7+0.5*J7 -> 26.19 | I7: 24.19 | J7: =1+0+0+1+0+2+0+0+0 -> 4 | K7: =+L7+0.5*M7 -> 25.80 | L7: 24.30 | M7: =1+0+0+1+0+0+1+0 -> 3 | N7: =+O7+0.5*P7 -> 20.77 | O7: 15.77 | P7: =6+2+1+1 -> 10 | Q7: =+R7+(0.5*S7) -> 22.52 | R7: 20.52 | S7: =1+1+2 -> 4 | T7: =+U7+0.5*V7 -> 27.43 | U7: 23.43 | V7: =1+1+2+2+1+1 -> 8 | W7: =+X7+(0.5*Y7) -> 18.69 | X7: 18.69 | Y7: 0 | Z7: =+(AA7+AB7+AC7)+0.5*AD7 -> 22.08 | AA7: 5.83 | AB7: 5.26 | AC7: 4.99 | AD7: =6+2+4 -> 12 | AE7: =+AF7+0.5*AG7 -> 25.00 | AF7: 22.50 | AG7: 5
A8: 40 | B8: 5 | C8: 1 | D8: Latham, Corey | E8: CDP-EX | F8: =+H8+K8+N8+Q8+T8+W8+Z8+AE8 -> 188.23 | G8: =+J8+M8+P8+S8+V8+Y8+AD8+AG8 -> 48 | H8: =+I8+0.5*J8 -> 25.01 | I8: 24.51 | J8: 1 | K8: =+L8+0.5*M8 -> 25.08 | L8: 22.08 | M8: =0+1+0+1+1+2+1+0 -> 6 | N8: =+O8+0.5*P8 -> 28.31 | O8: 18.31 | P8: =8+6+1+5 -> 20 | Q8: =+R8+(0.5*S8) -> 23.28 | R8: 22.28 | S8: =1+1 -> 2 | T8: =+U8+0.5*V8 -> 29.89 | U8: 27.89 | V8: =1+1+1+1 -> 4 | W8: =+X8+(0.5*Y8) -> 16.22 | X8: 15.22 | Y8: =1+1 -> 2 | Z8: =+(AA8+AB8+AC8)+0.5*AD8 -> 12.09 | AA8: 3.31 | AB8: 3.57 | AC8: 3.21 | AD8: =3+1 -> 4 | AE8: =+AF8+0.5*AG8 -> 28.35 | AF8: 23.85 | AG8: =2+5+1+1 -> 9
A9: 11 | B9: 2 | C9: 1 | D9: Boyer, Steve | E9: SSP-MM | F9: =+H9+K9+N9+Q9+T9+W9+Z9+AE9 -> 236.06 | G9: =+J9+M9+P9+S9+V9+Y9+AD9+AG9 -> 48 | H9: =+I9+0.5*J9 -> 32.61 | I9: 31.11 | J9: =2+1 -> 3 | K9: =+L9+0.5*M9 -> 38.73 | L9: 33.23 | M9: =1+0+0+6+2+0+2+0 -> 11 | N9: =+O9+0.5*P9 -> 26.51 | O9: 21.01 | P9: =2+7+1+0+0+1 -> 11 | Q9: =+R9+(0.5*S9) -> 31.51 | R9: 29.51 | S9: =1+1+1+1 -> 4 | T9: =+U9+0.5*V9 -> 33.14 | U9: 28.64 | V9: =4+1+2+2 -> 9 | W9: =+X9+(0.5*Y9) -> 21.81 | X9: 21.31 | Y9: 1 | Z9: =+(AA9+AB9+AC9)+0.5*AD9 -> 17.99 | AA9: 4.96 | AB9: 5.47 | AC9: 5.56 | AD9: =2+2 -> 4 | AE9: =+AF9+0.5*AG9 -> 33.76 | AF9: 31.26 | AG9: =1+2+2 -> 5
A10: 37 | B10: 5 | C10: 1 | D10: Koski, Steve | E10: SSP-MA | F10: =+H10+K10+N10+Q10+T10+W10+Z10+AE10 -> 173.14 | G10: =+J10+M10+P10+S10+V10+Y10+AD10+AG10 -> 49 | H10: =+I10+0.5*J10 -> 26.14 | I10: 20.64 | J10: =1+10 -> 11 | K10: =+L10+0.5*M10 -> 23.70 | L10: 22.20 | M10: =1+1+1 -> 3 | N10: =+O10+0.5*P10 -> 19.54 | O10: 17.04 | P10: =3+1+1 -> 5 | Q10: =+R10+(0.5*S10) -> 21.56 | R10: 20.56 | S10: =1+1 -> 2 | T10: =+U10+0.5*V10 -> 25.35 | U10: 21.85 | V10: =0+0+0+0+2+0+0+5 -> 7 | W10: =+X10+(0.5*Y10) -> 16.62 | X10: 16.12 | Y10: 1 | Z10: =+(AA10+AB10+AC10)+0.5*AD10 -> 18.31 | AA10: 4.02 | AB10: 3.57 | AC10: 3.22 | AD10: =3+3+9 -> 15 | AE10: =+AF10+0.5*AG10 -> 21.92 | AF10: 19.42 | AG10: =1+2+2 -> 5
A11: 27 | B11: S1 | C11: 5 | D11: Haslem, Alan | E11: CDP-EX | F11: =+H11+K11+N11+Q11+T11+W11+Z11+AE11 -> 234.36 | G11: =+J11+M11+P11+S11+V11+Y11+AD11+AG11 -> 51 | H11: =+I11+0.5*J11 -> 32.03 | I11: 32.03 | J11: =0+0+0+0+0+0+0+0+0 -> 0 | K11: =+L11+0.5*M11 -> 38.98 | L11: 35.48 | M11: =1+2+1+1+1+1 -> 7 | N11: =+O11+0.5*P11 -> 31.03 | O11: 25.03 | P11: =4+8 -> 12 | Q11: =+R11+(0.5*S11) -> 25.56 | R11: 24.06 | S11: =1+1+1 -> 3 | T11: =+U11+0.5*V11 -> 37.90 | U11: 34.40 | V11: =1+1+5 -> 7 | W11: =+X11+(0.5*Y11) -> 18.40 | X11: 17.90 | Y11: 1 | Z11: =+(AA11+AB11+AC11)+0.5*AD11 -> 19.93 | AA11: 3.93 | AB11: 3.84 | AC11: 3.66 | AD11: =5+2+4+6 -> 17 | AE11: =+AF11+0.5*AG11 -> 30.53 | AF11: 28.53 | AG11: =0+2+2+0+0+0 -> 4
A12: 54 | B12: S9 | C12: 1 | D12: Redford, "Red" | E12: SSR-SS | F12: =+H12+K12+N12+Q12+T12+W12+Z12+AE12 -> 264.33 | G12: =+J12+M12+P12+S12+V12+Y12+AD12+AG12 -> 54 | H12: =+I12+0.5*J12 -> 36.06 | I12: 34.06 | J12: =2+1+1 -> 4 | K12: =+L12+0.5*M12 -> 37.63 | L12: 33.13 | M12: =1+1+3+1+1+2 -> 9 | N12: =+O12+0.5*P12 -> 27.19 | O12: 24.19 | P12: =3+1+1+1 -> 6 | Q12: =+R12+(0.5*S12) -> 49.55 | R12: 41.55 | S12: =4+6+1+2+3 -> 16 | T12: =+U12+0.5*V12 -> 34.22 | U12: 31.22 | V12: =2+1+2+1 -> 6 | W12: =+X12+(0.5*Y12) -> 20.87 | X12: 19.87 | Y12: =1+1 -> 2 | Z12: =+(AA12+AB12+AC12)+0.5*AD12 -> 19.03 | AA12: 4.98 | AB12: 5.43 | AC12: 4.62 | AD12: =4+1+3 -> 8 | AE12: =+AF12+0.5*AG12 -> 39.78 | AF12: 38.28 | AG12: =1+1+1 -> 3
A13: 50 | B13: 7 | C13: 5 | D13: Parker, Patrick | E13: ESP-SS | F13: =+H13+K13+N13+Q13+T13+W13+Z13+AE13 -> 249.89 | G13: =+J13+M13+P13+S13+V13+Y13+AD13+AG13 -> 56 | H13: =+I13+0.5*J13 -> 41.42 | I13: 41.42 | J13: 0 | K13: =+L13+0.5*M13 -> 38.52 | L13: 34.02 | M13: =2+2+1+1+1+1+1 -> 9 | N13: =+O13+0.5*P13 -> 24.36 | O13: 23.36 | P13: =0+1+0+0+0+1 -> 2 | Q13: =+R13+(0.5*S13) -> 32.71 | R13: 29.21 | S13: =1+1+4+1 -> 7 | T13: =+U13+0.5*V13 -> 39.90 | U13: 36.40 | V13: =1+4+1+1 -> 7 | W13: =+X13+(0.5*Y13) -> 19.76 | X13: 19.76 | Y13: 0 | Z13: =+(AA13+AB13+AC13)+0.5*AD13 -> 19.05 | AA13: 4.52 | AB13: 5.42 | AC13: 4.61 | AD13: =1+3+5 -> 9 | AE13: =+AF13+0.5*AG13 -> 34.17 | AF13: 23.17 | AG13: =7+6+3+1+5 -> 22
A14: 36 | B14: S9 | C14: 3 | D14: Knapp, Chris | E14: ESP-SS | F14: =+H14+K14+N14+Q14+T14+W14+Z14+AE14 -> 199.67 | G14: =+J14+M14+P14+S14+V14+Y14+AD14+AG14 -> 61 | H14: =+I14+0.5*J14 -> 26.84 | I14: 25.34 | J14: =1+1+1 -> 3 | K14: =+L14+0.5*M14 -> 32.24 | L14: 24.74 | M14: =1+5+1+2+6 -> 15 | N14: =+O14+0.5*P14 -> 21.33 | O14: 17.33 | P14: =3+1+1+2+1 -> 8 | Q14: =+R14+(0.5*S14) -> 24.97 | R14: 23.97 | S14: =0+0+0+2+0+0+0+0 -> 2 | T14: =+U14+0.5*V14 -> 28.73 | U14: 24.23 | V14: =3+1+2+2+1 -> 9 | W14: =+X14+(0.5*Y14) -> 16.23 | X14: 15.73 | Y14: 1 | Z14: =+(AA14+AB14+AC14)+0.5*AD14 -> 21.46 | AA14: 4.45 | AB14: 3.92 | AC14: 4.09 | AD14: =11+1+6 -> 18 | AE14: =+AF14+0.5*AG14 -> 27.87 | AF14: 25.37 | AG14: =1+1+3 -> 5
A15: 56 | B15: 7 | C15: 1 | D15: Reed, Ken | E15: CDP-MM | F15: =+H15+K15+N15+Q15+T15+W15+Z15+AE15 -> 273.96 | G15: =+J15+M15+P15+S15+V15+Y15+AD15+AG15 -> 61 | H15: =+I15+0.5*J15 -> 44.64 | I15: 43.14 | J15: =1+2 -> 3 | K15: =+L15+0.5*M15 -> 43.05 | L15: 38.05 | M15: =1+5+1+2+1 -> 10 | N15: =+O15+0.5*P15 -> 26.50 | O15: 24.00 | P15: =3+1+1 -> 5 | Q15: =+R15+(0.5*S15) -> 35.67 | R15: 29.17 | S15: =2+0+1+2+1+0+0+1+6 -> 13 | T15: =+U15+0.5*V15 -> 45.00 | U15: 40.00 | V15: =1+1+2+6 -> 10 | W15: =+X15+(0.5*Y15) -> 28.25 | X15: 25.75 | Y15: =4+1 -> 5 | Z15: =+(AA15+AB15+AC15)+0.5*AD15 -> 16.25 | AA15: 5.59 | AB15: 4.44 | AC15: 4.22 | AD15: =1+1+2 -> 4 | AE15: =+AF15+0.5*AG15 -> 34.60 | AF15: 29.10 | AG15: =3+4+1+2+1 -> 11
A16: 38 | B16: 2 | C16: 4 | D16: LaHuillier, Noble | E16: SSP-SS | F16: =+H16+K16+N16+Q16+T16+W16+Z16+AE16 -> 246.92 | G16: =+J16+M16+P16+S16+V16+Y16+AD16+AG16 -> 62 | H16: =+I16+0.5*J16 -> 34.63 | I16: 32.63 | J16: =1+1+1+1 -> 4 | K16: =+L16+0.5*M16 -> 34.96 | L16: 32.46 | M16: =1+1+1+1+1+0+0 -> 5 | N16: =+O16+0.5*P16 -> 27.71 | O16: 26.21 | P16: 3 | Q16: =+R16+(0.5*S16) -> 26.45 | R16: 22.95 | S16: =1+5+0+0+0+0+1+0 -> 7 | T16: =+U16+0.5*V16 -> 42.56 | U16: 38.06 | V16: =1+1+1+4+1+1 -> 9 | W16: =+X16+(0.5*Y16) -> 16.82 | X16: 16.82 | Y16: 0 | Z16: =+(AA16+AB16+AC16)+0.5*AD16 -> 27.17 | AA16: 5.83 | AB16: 7.33 | AC16: 6.51 | AD16: =5+8+2 -> 15 | AE16: =+AF16+0.5*AG16 -> 36.62 | AF16: 27.12 | AG16: =6+5+7+1 -> 19
A17: 26 | B17: 5 | C17: 3 | D17: Griffiths, Todd | E17: CDP-EX | F17: =+H17+K17+N17+Q17+T17+W17+Z17+AE17 -> 190.45 | G17: =+J17+M17+P17+S17+V17+Y17+AD17+AG17 -> 63 | H17: =+I17+0.5*J17 -> 26.06 | I17: 25.06 | J17: =1+1 -> 2 | K17: =+L17+0.5*M17 -> 24.46 | L17: 22.46 | M17: =0+0+0+2+0+0+1+1 -> 4 | N17: =+O17+0.5*P17 -> 23.31 | O17: 19.81 | P17: =1+2+1+3 -> 7 | Q17: =+R17+(0.5*S17) -> 21.74 | R17: 16.74 | S17: =1+1+1+1+6 -> 10 | T17: =+U17+0.5*V17 -> 32.66 | U17: 24.16 | V17: =1+6+2+3+5 -> 17 | W17: =+X17+(0.5*Y17) -> 19.90 | X17: 14.90 | Y17: =4+6 -> 10 | Z17: =+(AA17+AB17+AC17)+0.5*AD17 -> 15.77 | AA17: 4.00 | AB17: 3.87 | AC17: 3.90 | AD17: =3+4+1 -> 8 | AE17: =+AF17+0.5*AG17 -> 26.55 | AF17: 24.05 | AG17: =1+3+1 -> 5
A18: 57 | B18: 6 | C18: 4 | D18: Richards, Dave | E18: SSP-EX | F18: =+H18+K18+N18+Q18+T18+W18+Z18+AE18 -> 205.97 | G18: =+J18+M18+P18+S18+V18+Y18+AD18+AG18 -> 63 | H18: =+I18+0.5*J18 -> 25.63 | I18: 23.63 | J18: =1+1+1+1 -> 4 | K18: =+L18+0.5*M18 -> 34.09 | L18: 26.09 | M18: =1+2+2+1+10 -> 16 | N18: =+O18+0.5*P18 -> 27.36 | O18: 23.36 | P18: =5+2+1 -> 8 | Q18: =+R18+(0.5*S18) -> 25.99 | R18: 22.99 | S18: =2+4 -> 6 | T18: =+U18+0.5*V18 -> 34.36 | U18: 28.36 | V18: =2+2+4+4 -> 12 | W18: =+X18+(0.5*Y18) -> 21.33 | X18: 18.33 | Y18: =1+5+0+0+0+0+0 -> 6 | Z18: =+(AA18+AB18+AC18)+0.5*AD18 -> 14.95 | AA18: 4.27 | AB18: 4.47 | AC18: 3.71 | AD18: =1+3+1 -> 5 | AE18: =+AF18+0.5*AG18 -> 22.26 | AF18: 19.26 | AG18: =2+2+1+1 -> 6
B19: 7 | C19: 1 | D19: Ostler, Jeff | E19: CDP-SS | F19: =+H19+K19+N19+Q19+T19+W19+Z19+AE19 -> 229.74 | G19: =+J19+M19+P19+S19+V19+Y19+AD19+AG19 -> 65 | H19: =+I19+0.5*J19 -> 32.64 | I19: 29.14 | J19: =1+6 -> 7 | K19: =+L19+0.5*M19 -> 31.69 | L19: 30.69 | M19: =1+1 -> 2 | N19: =+O19+0.5*P19 -> 26.22 | O19: 22.22 | P19: =5+2+1+0+0+0 -> 8 | Q19: =+R19+(0.5*S19) -> 34.83 | R19: 25.33 | S19: =2+5+6+5+0+1+0+0 -> 19 | T19: =+U19+0.5*V19 -> 31.52 | U19: 30.02 | V19: =1+2 -> 3 | W19: =+X19+(0.5*Y19) -> 16.58 | X19: 16.58 | Y19: 0 | Z19: =+(AA19+AB19+AC19)+0.5*AD19 -> 21.63 | AA19: 4.21 | AB19: 3.81 | AC19: 3.61 | AD19: =13+2+5 -> 20 | AE19: =+AF19+0.5*AG19 -> 34.63 | AF19: 31.63 | AG19: =1+3+1+1 -> 6
A20: 61 | B20: S3 | C20: 10 | D20: Simpson, Harold | E20: CDP-SS | F20: =+H20+K20+N20+Q20+T20+W20+Z20+AE20 -> 298.26 | G20: =+J20+M20+P20+S20+V20+Y20+AD20+AG20 -> 65 | H20: =+I20+0.5*J20 -> 39.42 | I20: 37.92 | J20: =0+0+0+1+0+0+0+1+1 -> 3 | K20: =+L20+0.5*M20 -> 41.96 | L20: 38.96 | M20: =1+0+1+1+2+0+1+0 -> 6 | N20: =+O20+0.5*P20 -> 34.51 | O20: 30.51 | P20: =6+1+1 -> 8 | Q20: =+R20+(0.5*S20) -> 34.60 | R20: 30.10 | S20: =1+4+2+2 -> 9 | T20: =+U20+0.5*V20 -> 49.51 | U20: 46.51 | V20: =2+4 -> 6 | W20: =+X20+(0.5*Y20) -> 31.01 | X20: 30.01 | Y20: =1+1 -> 2 | Z20: =+(AA20+AB20+AC20)+0.5*AD20 -> 24.11 | AA20: 8.20 | AB20: 6.93 | AC20: 5.48 | AD20: =1+2+4 -> 7 | AE20: =+AF20+0.5*AG20 -> 43.14 | AF20: 31.14 | AG20: =0+0+2+6+10+6 -> 24
A21: 71 | B21: 5 | C21: 3 | D21: Vollmer, Phillip | E21: SSP-EX | F21: =+H21+K21+N21+Q21+T21+W21+Z21+AE21 -> 197.69 | G21: =+J21+M21+P21+S21+V21+Y21+AD21+AG21 -> 67 | H21: =+I21+0.5*J21 -> 24.29 | I21: 24.29 | J21: 0 | K21: =+L21+0.5*M21 -> 29.93 | L21: 22.43 | M21: =6+1+1+1+1+1+3+1 -> 15 | N21: =+O21+0.5*P21 -> 21.26 | O21: 17.76 | P21: =2+4+1 -> 7 | Q21: =+R21+(0.5*S21) -> 24.07 | R21: 22.57 | S21: =1+1+1 -> 3 | T21: =+U21+0.5*V21 -> 29.60 | U21: 23.60 | V21: =0+0+3+1+1+0+2+0+5 -> 12 | W21: =+X21+(0.5*Y21) -> 23.57 | X21: 21.07 | Y21: =4+1 -> 5 | Z21: =+(AA21+AB21+AC21)+0.5*AD21 -> 16.12 | AA21: 3.26 | AB21: 3.62 | AC21: 3.74 | AD21: =1+6+4 -> 11 | AE21: =+AF21+0.5*AG21 -> 28.85 | AF21: 21.85 | AG21: =1+6+1+1+5 -> 14
A22: 32 | B22: 4 | C22: 4 | D22: Huff, Blake | E22: SSR-EX | F22: =+H22+K22+N22+Q22+T22+W22+Z22+AE22 -> 268.04 | G22: =+J22+M22+P22+S22+V22+Y22+AD22+AG22 -> 68 | H22: =+I22+0.5*J22 -> 32.49 | I22: 30.99 | J22: =1+2 -> 3 | K22: =+L22+0.5*M22 -> 37.50 | L22: 36.00 | M22: =2+1 -> 3 | N22: =+O22+0.5*P22 -> 21.62 | O22: 19.12 | P22: =2+1+2 -> 5 | Q22: =+R22+(0.5*S22) -> 40.31 | R22: 31.81 | S22: =5+2+6+4+0+0+0+0 -> 17 | T22: =+U22+0.5*V22 -> 51.67 | U22: 45.67 | V22: =4+1+1+2+4 -> 12 | W22: =+X22+(0.5*Y22) -> 27.45 | X22: 24.45 | Y22: 6 | Z22: =+(AA22+AB22+AC22)+0.5*AD22 -> 20.78 | AA22: 5.24 | AB22: 5.13 | AC22: 6.41 | AD22: =2+5+1 -> 8 | AE22: =+AF22+0.5*AG22 -> 36.22 | AF22: 29.22 | AG22: =2+4+4+4 -> 14
A23: 64 | B23: 1 | C23: 10 | D23: Sterling, Scott | E23: SSP-MM | F23: =+H23+K23+N23+Q23+T23+W23+Z23+AE23 -> 380.36 | G23: =+J23+M23+P23+S23+V23+Y23+AD23+AG23 -> 68 | H23: =+I23+0.5*J23 -> 53.70 | I23: 53.70 | J23: 0 | K23: =+L23+0.5*M23 -> 56.45 | L23: 50.45 | M23: =0+0+1+0+0+1+0+0+10 -> 12 | N23: =+O23+0.5*P23 -> 55.55 | O23: 47.55 | P23: =8+7+1 -> 16 | Q23: =+R23+(0.5*S23) -> 42.94 | R23: 39.94 | S23: =5+1 -> 6 | T23: =+U23+0.5*V23 -> 52.79 | U23: 45.79 | V23: =6+1+1+6 -> 14 | W23: =+X23+(0.5*Y23) -> 30.87 | X23: 28.87 | Y23: =2+2 -> 4 | Z23: =+(AA23+AB23+AC23)+0.5*AD23 -> 19.68 | AA23: 5.40 | AB23: 5.17 | AC23: 5.61 | AD23: =1+3+3 -> 7 | AE23: =+AF23+0.5*AG23 -> 68.38 | AF23: 63.88 | AG23: =2+1+6 -> 9
A24: 48 | B24: S9 | C24: 1 | D24: Outzen, Craig | E24: ESP-SS | F24: =+H24+K24+N24+Q24+T24+W24+Z24+AE24 -> 168.18 | G24: =+J24+M24+P24+S24+V24+Y24+AD24+AG24 -> 69 | H24: =+I24+0.5*J24 -> 20.53 | I24: 20.03 | J24: 1 | K24: =+L24+0.5*M24 -> 23.95 | L24: 19.95 | M24: =1+1+1+3+1+1 -> 8 | N24: =+O24+0.5*P24 -> 19.59 | O24: 16.09 | P24: =2+5 -> 7 | Q24: =+R24+(0.5*S24) -> 27.37 | R24: 17.87 | S24: =6+1+4+4+2+1+1 -> 19 | T24: =+U24+0.5*V24 -> 26.73 | U24: 21.23 | V24: =1+1+1+1+1+5+1 -> 11 | W24: =+X24+(0.5*Y24) -> 14.34 | X24: 13.84 | Y24: 1 | Z24: =+(AA24+AB24+AC24)+0.5*AD24 -> 17.10 | AA24: 4.20 | AB24: 3.57 | AC24: 2.83 | AD24: =5+0+2+6 -> 13 | AE24: =+AF24+0.5*AG24 -> 18.57 | AF24: 14.07 | AG24: =0+1+0+5+0+3 -> 9
A25: 25 | B25: 1 | C25: 6 | D25: Greenfield, Don | E25: SSP-MM | F25: =+H25+K25+N25+Q25+T25+W25+Z25+AE25 -> 338.38 | G25: =+J25+M25+P25+S25+V25+Y25+AD25+AG25 -> 69 | H25: =+I25+0.5*J25 -> 57.25 | I25: 56.25 | J25: =1+1 -> 2 | K25: =+L25+0.5*M25 -> 50.45 | L25: 45.95 | M25: =0+0+1+2+3+2+0+1 -> 9 | N25: =+O25+0.5*P25 -> 38.99 | O25: 35.49 | P25: =1+4+0+1+0+1 -> 7 | Q25: =+R25+(0.5*S25) -> 45.88 | R25: 41.38 | S25: =6+3 -> 9 | T25: =+U25+0.5*V25 -> 47.09 | U25: 35.59 | V25: =8+1+4+10 -> 23 | W25: =+X25+(0.5*Y25) -> 28.16 | X25: 27.66 | Y25: 1 | Z25: =+(AA25+AB25+AC25)+0.5*AD25 -> 21.24 | AA25: 7.69 | AB25: 6.03 | AC25: 5.52 | AD25: =2+2 -> 4 | AE25: =+AF25+0.5*AG25 -> 49.32 | AF25: 42.32 | AG25: =5+1+5+2+1 -> 14
A26: 55 | B26: S8 | C26: 2 | D26: Redford, Steve | E26: ESP-MM | F26: =+H26+K26+N26+Q26+T26+W26+Z26+AE26 -> 238.61 | G26: =+J26+M26+P26+S26+V26+Y26+AD26+AG26 -> 72 | H26: =+I26+0.5*J26 -> 42.58 | I26: 38.08 | J26: =1+1+0+0+5+1+1+0+0 -> 9 | K26: =+L26+0.5*M26 -> 34.49 | L26: 29.99 | M26: =1+3+3+1+1 -> 9 | N26: =+O26+0.5*P26 -> 27.86 | O26: 24.36 | P26: =2+3+1+1 -> 7 | Q26: =+R26+(0.5*S26) -> 29.14 | R26: 22.64 | S26: =2+0+2+1+0+1+1+6 -> 13 | T26: =+U26+0.5*V26 -> 34.11 | U26: 29.61 | V26: =2+2+2+1+2 -> 9 | W26: =+X26+(0.5*Y26) -> 21.56 | X26: 20.06 | Y26: =1+2 -> 3 | Z26: =+(AA26+AB26+AC26)+0.5*AD26 -> 19.09 | AA26: 4.29 | AB26: 4.14 | AC26: 5.16 | AD26: =1+1+3+6 -> 11 | AE26: =+AF26+0.5*AG26 -> 29.78 | AF26: 24.28 | AG26: =2+2+5+1+1 -> 11
A27: 46 | B27: 7 | C27: 5 | D27: Ostler, Jay | E27: CDP-MM | F27: =+H27+K27+N27+Q27+T27+W27+Z27+AE27 -> 443.19 | G27: =+J27+M27+P27+S27+V27+Y27+AD27+AG27 -> 72 | H27: =+I27+0.5*J27 -> 82.49 | I27: 77.49 | J27: 10 | K27: =+L27+0.5*M27 -> 87.14 | L27: 82.14 | M27: =2+1+1+6 -> 10 | N27: =+O27+0.5*P27 -> 50.31 | O27: 43.81 | P27: =2+11+0+0+0+0 -> 13 | Q27: =+R27+(0.5*S27) -> 44.88 | R27: 43.38 | S27: =1+1+1 -> 3 | T27: =+U27+0.5*V27 -> 55.64 | U27: 50.14 | V27: =1+1+2+1+1+3+1+1 -> 11 | W27: =+X27+(0.5*Y27) -> 35.33 | X27: 33.33 | Y27: =1+3 -> 4 | Z27: =+(AA27+AB27+AC27)+0.5*AD27 -> 29.60 | AA27: 8.09 | AB27: 6.18 | AC27: 7.33 | AD27: =10+4+2 -> 16 | AE27: =+AF27+0.5*AG27 -> 57.80 | AF27: 55.30 | AG27: =2+2+1 -> 5
A28: 16 | B28: S9 | C28: 4 | D28: Collins, Ken | E28: ESP-SS | F28: =+H28+K28+N28+Q28+T28+W28+Z28+AE28 -> 218.90 | G28: =+J28+M28+P28+S28+V28+Y28+AD28+AG28 -> 73 | H28: =+I28+0.5*J28 -> 27.87 | I28: 27.37 | J28: 1 | K28: =+L28+0.5*M28 -> 35.33 | L28: 26.83 | M28: =1+2+3+1+10 -> 17 | N28: =+O28+0.5*P28 -> 22.77 | O28: 20.27 | P28: =4+1 -> 5 | Q28: =+R28+(0.5*S28) -> 34.07 | R28: 25.57 | S28: =2+4+1+6+2+1+0+1 -> 17 | T28: =+U28+0.5*V28 -> 32.35 | U28: 27.85 | V28: =1+4+2+1+1 -> 9 | W28: =+X28+(0.5*Y28) -> 20.03 | X28: 17.03 | Y28: 6 | Z28: =+(AA28+AB28+AC28)+0.5*AD28 -> 18.19 | AA28: 5.02 | AB28: 4.32 | AC28: 3.85 | AD28: =1+2+7 -> 10 | AE28: =+AF28+0.5*AG28 -> 28.29 | AF28: 24.29 | AG28: =1+3+3+1 -> 8
A29: 69 | B29: 4 | C29: 3 | D29: Veldboom, Terry | E29: SSR-EX | F29: =+H29+K29+N29+Q29+T29+W29+Z29+AE29 -> 257.52 | G29: =+J29+M29+P29+S29+V29+Y29+AD29+AG29 -> 74 | H29: =+I29+0.5*J29 -> 31.93 | I29: 30.93 | J29: =1+1 -> 2 | K29: =+L29+0.5*M29 -> 34.75 | L29: 31.25 | M29: =1+5+1 -> 7 | N29: =+O29+0.5*P29 -> 23.54 | O29: 20.54 | P29: =1+4+1 -> 6 | Q29: =+R29+(0.5*S29) -> 36.00 | R29: 33.50 | S29: =1+1+1+0+1+0+1+0 -> 5 | T29: =+U29+0.5*V29 -> 51.96 | U29: 43.96 | V29: =1+2+5+6+1+1 -> 16 | W29: =+X29+(0.5*Y29) -> 21.71 | X29: 19.71 | Y29: =0+2+0+1+1+0+0 -> 4 | Z29: =+(AA29+AB29+AC29)+0.5*AD29 -> 19.67 | AA29: 4.41 | AB29: 4.66 | AC29: 4.10 | AD29: =6+4+3 -> 13 | AE29: =+AF29+0.5*AG29 -> 37.96 | AF29: 27.46 | AG29: =1+6+7+1+6 -> 21
A30: 58 | B30: S6 | C30: 6 | D30: Rimer, Clayton | E30: CDP-SS | F30: =+H30+K30+N30+Q30+T30+W30+Z30+AE30 -> 265.79 | G30: =+J30+M30+P30+S30+V30+Y30+AD30+AG30 -> 74 | H30: =+I30+0.5*J30 -> 33.15 | I30: 33.15 | J30: =0+0+0+0+0+0+0+0+0 -> 0 | K30: =+L30+0.5*M30 -> 40.97 | L30: 33.97 | M30: =1+5+2+6 -> 14 | N30: =+O30+0.5*P30 -> 32.85 | O30: 23.85 | P30: =9+6+1+2 -> 18 | Q30: =+R30+(0.5*S30) -> 29.44 | R30: 27.94 | S30: =2+0+1+0+0+0+0+0 -> 3 | T30: =+U30+0.5*V30 -> 40.57 | U30: 37.57 | V30: =1+2+2+1 -> 6 | W30: =+X30+(0.5*Y30) -> 25.80 | X30: 22.80 | Y30: =5+1 -> 6 | Z30: =+(AA30+AB30+AC30)+0.5*AD30 -> 21.05 | AA30: 5.33 | AB30: 3.79 | AC30: 4.93 | AD30: =6+6+2 -> 14 | AE30: =+AF30+0.5*AG30 -> 41.96 | AF30: 35.46 | AG30: =1+6+6 -> 13
A31: 32.8 | B31: 4 | C31: 7 | D31: Badger, Jeff | E31: ESP-SS | F31: =+H31+K31+N31+Q31+T31+W31+Z31+AE31 -> 269.47 | G31: =+J31+M31+P31+S31+V31+Y31+AD31+AG31 -> 75 | H31: =+I31+0.5*J31 -> 32.16 | I31: 31.66 | J31: =0+0+0+1+0+0+0+0+0 -> 1 | K31: =+L31+0.5*M31 -> 42.23 | L31: 35.73 | M31: =1+0+1+0+1+3+0+1+6 -> 13 | N31: =+O31+0.5*P31 -> 32.13 | O31: 25.63 | P31: =6+7 -> 13 | Q31: =+R31+(0.5*S31) -> 51.43 | R31: 33.93 | S31: =2+10+4+5+1+1+2+10 -> 35 | T31: =+U31+0.5*V31 -> 35.30 | U31: 32.80 | V31: =1+1+1+1+1 -> 5 | W31: =+X31+(0.5*Y31) -> 24.77 | X31: 24.77 | Y31: 0 | Z31: =+(AA31+AB31+AC31)+0.5*AD31 -> 18.20 | AA31: 4.80 | AB31: 6.29 | AC31: 5.61 | AD31: 3 | AE31: =+AF31+0.5*AG31 -> 33.25 | AF31: 30.75 | AG31: =1+2+2 -> 5
A32: 5 | B32: S6 | C32: 4 | D32: Attryde, Edward | E32: CDP-MM | F32: =+H32+K32+N32+Q32+T32+W32+Z32+AE32 -> 363.08 | G32: =+J32+M32+P32+S32+V32+Y32+AD32+AG32 -> 78 | H32: =+I32+0.5*J32 -> 47.62 | I32: 47.12 | J32: =0+0+0+0+1+0+0+0+0 -> 1 | K32: =+L32+0.5*M32 -> 57.21 | L32: 53.21 | M32: =1+2+5 -> 8 | N32: =+O32+0.5*P32 -> 38.77 | O32: 34.77 | P32: 8 | Q32: =+R32+(0.5*S32) -> 41.19 | R32: 39.69 | S32: =0+0+1+0+0+1+0+1 -> 3 | T32: =+U32+0.5*V32 -> 49.62 | U32: 44.12 | V32: =1+1+2+1+6 -> 11 | W32: =+X32+(0.5*Y32) -> 39.38 | X32: 37.38 | Y32: =2+1+1 -> 4 | Z32: =+(AA32+AB32+AC32)+0.5*AD32 -> 31.84 | AA32: 5.22 | AB32: 5.48 | AC32: 6.14 | AD32: =10+5+15 -> 30 | AE32: =+AF32+0.5*AG32 -> 57.45 | AF32: 50.95 | AG32: =5+7+0+0+0+1 -> 13
A33: 28 | B33: S1 | C33: 6 | D33: Haslem, Kent | E33: CDP-EX | F33: =+H33+K33+N33+Q33+T33+W33+Z33+AE33 -> 244.31 | G33: =+J33+M33+P33+S33+V33+Y33+AD33+AG33 -> 81 | H33: =+I33+0.5*J33 -> 39.83 | I33: 39.33 | J33: =0+0+0+0+0+0+0+0+1 -> 1 | K33: =+L33+0.5*M33 -> 30.48 | L33: 24.98 | M33: =1+1+2+1+6 -> 11 | N33: =+O33+0.5*P33 -> 37.43 | O33: 23.93 | P33: =5+7+5+10 -> 27 | Q33: =+R33+(0.5*S33) -> 29.12 | R33: 23.62 | S33: =2+4+2+2+1 -> 11 | T33: =+U33+0.5*V33 -> 35.70 | U33: 29.70 | V33: =3+1+1+5+1+1 -> 12 | W33: =+X33+(0.5*Y33) -> 24.15 | X33: 22.15 | Y33: =3+1 -> 4 | Z33: =+(AA33+AB33+AC33)+0.5*AD33 -> 15.86 | AA33: 3.85 | AB33: 4.03 | AC33: 3.48 | AD33: =3+5+1 -> 9 | AE33: =+AF33+0.5*AG33 -> 31.74 | AF33: 28.74 | AG33: =0+0+2+0+0+4 -> 6
A34: 15 | B34: 8 | C34: 8 | D34: Colby, Bill | E34: CDP-SS | F34: =+H34+K34+N34+Q34+T34+W34+Z34+AE34 -> 282.50 | G34: =+J34+M34+P34+S34+V34+Y34+AD34+AG34 -> 81 | H34: =+I34+0.5*J34 -> 35.18 | I34: 34.68 | J34: 1 | K34: =+L34+0.5*M34 -> 38.21 | L34: 35.21 | M34: =2+1+1+1+1 -> 6 | N34: =+O34+0.5*P34 -> 37.45 | O34: 26.95 | P34: =7+10+1+2+1 -> 21 | Q34: =+R34+(0.5*S34) -> 42.67 | R34: 39.67 | S34: =0+0+1+4+0+1+0+0 -> 6 | T34: =+U34+0.5*V34 -> 54.89 | U34: 45.39 | V34: =1+1+1+1+1+4+10 -> 19 | W34: =+X34+(0.5*Y34) -> 22.85 | X34: 18.85 | Y34: =2+6 -> 8 | Z34: =+(AA34+AB34+AC34)+0.5*AD34 -> 19.77 | AA34: 4.41 | AB34: 4.40 | AC34: 3.96 | AD34: =4+6+4 -> 14 | AE34: =+AF34+0.5*AG34 -> 31.48 | AF34: 28.48 | AG34: =2+2+1+1 -> 6
A35: 68 | B35: S9 | C35: 1 | D35: Theodore, Ari | E35: SSP-EX | F35: =+H35+K35+N35+Q35+T35+W35+Z35+AE35 -> 165.73 | G35: =+J35+M35+P35+S35+V35+Y35+AD35+AG35 -> 82 | H35: =+I35+0.5*J35 -> 29.51 | I35: 21.51 | J35: =1+1+1+2+1+10 -> 16 | K35: =+L35+0.5*M35 -> 27.73 | L35: 17.23 | M35: =5+2+5+4+4+1 -> 21 | N35: =+O35+0.5*P35 -> 16.24 | O35: 15.74 | P35: 1 | Q35: =+R35+(0.5*S35) -> 25.55 | R35: 16.55 | S35: =1+1+4+6+4+1+1 -> 18 | T35: =+U35+0.5*V35 -> 21.08 | U35: 18.08 | V35: =1+2+1+1+1 -> 6 | W35: =+X35+(0.5*Y35) -> 14.33 | X35: 11.83 | Y35: =1+3+1 -> 5 | Z35: =+(AA35+AB35+AC35)+0.5*AD35 -> 10.88 | AA35: 3.22 | AB35: 3.28 | AC35: 2.88 | AD35: =1+2 -> 3 | AE35: =+AF35+0.5*AG35 -> 20.41 | AF35: 14.41 | AG35: =1+4+6+1 -> 12
A36: 34 | B36: 8 | C36: 2 | D36: Kirkham, Bart | E36: CDP-MM | F36: =+H36+K36+N36+Q36+T36+W36+Z36+AE36 -> 275.33 | G36: =+J36+M36+P36+S36+V36+Y36+AD36+AG36 -> 82 | H36: =+I36+0.5*J36 -> 43.65 | I36: 42.65 | J36: =1+1 -> 2 | K36: =+L36+0.5*M36 -> 34.92 | L36: 30.42 | M36: =2+1+5+1 -> 9 | N36: =+O36+0.5*P36 -> 27.67 | O36: 17.67 | P36: =7+5+3+5 -> 20 | Q36: =+R36+(0.5*S36) -> 31.56 | R36: 27.06 | S36: =1+0+1+2+1+0+1+3 -> 9 | T36: =+U36+0.5*V36 -> 41.67 | U36: 34.17 | V36: =1+1+2+2+1+3+5 -> 15 | W36: =+X36+(0.5*Y36) -> 20.40 | X36: 19.90 | Y36: 1 | Z36: =+(AA36+AB36+AC36)+0.5*AD36 -> 23.58 | AA36: 5.54 | AB36: 5.55 | AC36: 4.99 | AD36: =8+2+5 -> 15 | AE36: =+AF36+0.5*AG36 -> 51.88 | AF36: 46.38 | AG36: =1+6+2+2 -> 11
A37: 60 | B37: S5 | C37: 11 | D37: Rupert, Frank | E37: CDP-SS | F37: =+H37+K37+N37+Q37+T37+W37+Z37+AE37 -> 298.51 | G37: =+J37+M37+P37+S37+V37+Y37+AD37+AG37 -> 82 | H37: =+I37+0.5*J37 -> 57.30 | I37: 53.80 | J37: =0+1+1+0+0+0+0+5+0 -> 7 | K37: =+L37+0.5*M37 -> 31.54 | L37: 29.54 | M37: =1+1+1+1 -> 4 | N37: =+O37+0.5*P37 -> 31.94 | O37: 23.44 | P37: =6+6+1+2+2 -> 17 | Q37: =+R37+(0.5*S37) -> 27.90 | R37: 24.40 | S37: =0+1+1+2+0+0+1+2 -> 7 | T37: =+U37+0.5*V37 -> 47.79 | U37: 41.29 | V37: =1+1+2+2+6+1 -> 13 | W37: =+X37+(0.5*Y37) -> 40.51 | X37: 39.01 | Y37: =1+2 -> 3 | Z37: =+(AA37+AB37+AC37)+0.5*AD37 -> 27.44 | AA37: 4.14 | AB37: 5.00 | AC37: 7.80 | AD37: =12+9+0 -> 21 | AE37: =+AF37+0.5*AG37 -> 34.09 | AF37: 29.09 | AG37: =3+1+3+0+3+0 -> 10
A38: =11+11+0+1+1+1 -> 25 | B38: 3 | C38: 2 | D38: Pagano, Kevin | E38: SSP-EX | F38: =+H38+K38+N38+Q38+T38+W38+Z38+AE38 -> 186.89 | G38: =+J38+M38+P38+S38+V38+Y38+AD38+AG38 -> 84 | H38: =+I38+0.5*J38 -> 23.71 | I38: 16.21 | J38: =1+3+1+2+5+1+2 -> 15 | K38: =+L38+0.5*M38 -> 27.79 | L38: 20.79 | M38: =3+1+1+1+6+1+1 -> 14 | N38: =+O38+0.5*P38 -> 27.06 | O38: 14.56 | P38: =11+11+0+1+1+1 -> 25 | Q38: =+R38+(0.5*S38) -> 26.85 | R38: 23.35 | S38: =2+1+1+1+1+0+0+1 -> 7 | T38: =+U38+0.5*V38 -> 28.99 | U38: 22.99 | V38: =0+0+2+1+3+0+1+3+2 -> 12 | W38: =+X38+(0.5*Y38) -> 14.82 | X38: 13.32 | Y38: 3 | Z38: =+(AA38+AB38+AC38)+0.5*AD38 -> 13.58 | AA38: 3.78 | AB38: 3.99 | AC38: 3.81 | AD38: =1+3 -> 4 | AE38: =+AF38+0.5*AG38 -> 24.09 | AF38: 22.09 | AG38: =3+1 -> 4
A39: 33 | B39: 7 | C39: 2 | D39: Jorgensen, John | E39: SSP-SS | F39: =+H39+K39+N39+Q39+T39+W39+Z39+AE39 -> 231.27 | G39: =+J39+M39+P39+S39+V39+Y39+AD39+AG39 -> 84 | H39: =+I39+0.5*J39 -> 31.76 | I39: 24.26 | J39: =1+3+1+10 -> 15 | K39: =+L39+0.5*M39 -> 34.23 | L39: 31.23 | M39: =1+3+1+1 -> 6 | N39: =+O39+0.5*P39 -> 24.78 | O39: 18.28 | P39: =1+9+1+2 -> 13 | Q39: =+R39+(0.5*S39) -> 35.28 | R39: 28.78 | S39: =2+2+5+3+1 -> 13 | T39: =+U39+0.5*V39 -> 39.77 | U39: 35.77 | V39: =3+2+2+1 -> 8 | W39: =+X39+(0.5*Y39) -> 20.15 | X39: 17.15 | Y39: =1+5 -> 6 | Z39: =+(AA39+AB39+AC39)+0.5*AD39 -> 18.41 | AA39: 3.63 | AB39: 4.14 | AC39: 4.14 | AD39: =5+4+4 -> 13 | AE39: =+AF39+0.5*AG39 -> 26.89 | AF39: 21.89 | AG39: =0+4+3+2+0+1 -> 10
A40: 44 | B40: 4 | C40: 1 | D40: Mousley, Roger | E40: SSR-EX | F40: =+H40+K40+N40+Q40+T40+W40+Z40+AE40 -> 237.66 | G40: =+J40+M40+P40+S40+V40+Y40+AD40+AG40 -> 88 | H40: =+I40+0.5*J40 -> 35.92 | I40: 33.42 | J40: =4+1 -> 5 | K40: =+L40+0.5*M40 -> 30.99 | L40: 27.99 | M40: =1+1+3+1 -> 6 | N40: =+O40+0.5*P40 -> 23.55 | O40: 19.55 | P40: =4+3+1 -> 8 | Q40: =+R40+(0.5*S40) -> 41.11 | R40: 24.61 | S40: =3+4+1+10+2+1+1+1+10 -> 33 | T40: =+U40+0.5*V40 -> 36.00 | U40: 28.50 | V40: =1+3+4+2+5 -> 15 | W40: =+X40+(0.5*Y40) -> 19.26 | X40: 18.76 | Y40: =0+0+1+0+0+0+0 -> 1 | Z40: =+(AA40+AB40+AC40)+0.5*AD40 -> 18.41 | AA40: 5.55 | AB40: 4.96 | AC40: 3.40 | AD40: =3+3+3 -> 9 | AE40: =+AF40+0.5*AG40 -> 32.42 | AF40: 26.92 | AG40: =5+2+3+1 -> 11
A41: 63 | B41: 7 | C41: 1 | D41: Spicer, Robert | E41: SSP-SS | F41: =+H41+K41+N41+Q41+T41+W41+Z41+AE41 -> 218.58 | G41: =+J41+M41+P41+S41+V41+Y41+AD41+AG41 -> 89 | H41: =+I41+0.5*J41 -> 24.65 | I41: 23.15 | J41: =1+0+0+0+2+0+0+0+0 -> 3 | K41: =+L41+0.5*M41 -> 33.25 | L41: 28.25 | M41: =3+2+3+1+1 -> 10 | N41: =+O41+0.5*P41 -> 22.62 | O41: 20.12 | P41: =1+2+1+1 -> 5 | Q41: =+R41+(0.5*S41) -> 29.53 | R41: 22.03 | S41: =6+5+1+1+1+1 -> 15 | T41: =+U41+0.5*V41 -> 33.72 | U41: 26.72 | V41: =2+4+4+4 -> 14 | W41: =+X41+(0.5*Y41) -> 15.21 | X41: 15.21 | Y41: 0 | Z41: =+(AA41+AB41+AC41)+0.5*AD41 -> 17.55 | AA41: 3.65 | AB41: 4.12 | AC41: 3.78 | AD41: =5+7+0 -> 12 | AE41: =+AF41+0.5*AG41 -> 42.05 | AF41: 27.05 | AG41: =2+6+11+1+6+4 -> 30
A42: 20 | B42: 4 | C42: 2 | D42: Daer, Bill | E42: SSR-EX | F42: =+H42+K42+N42+Q42+T42+W42+Z42+AE42 -> 248.31 | G42: =+J42+M42+P42+S42+V42+Y42+AD42+AG42 -> 90 | H42: =+I42+0.5*J42 -> 31.64 | I42: 27.64 | J42: =1+2+1+4 -> 8 | K42: =+L42+0.5*M42 -> 32.70 | L42: 30.20 | M42: =2+1+2 -> 5 | N42: =+O42+0.5*P42 -> 23.45 | O42: 19.95 | P42: =1+4+1+1 -> 7 | Q42: =+R42+(0.5*S42) -> 44.43 | R42: 27.93 | S42: =2+10+1+5+3+1+0+1+10 -> 33 | T42: =+U42+0.5*V42 -> 37.13 | U42: 31.13 | V42: =4+2+2+1+3 -> 12 | W42: =+X42+(0.5*Y42) -> 18.93 | X42: 18.93 | Y42: 0 | Z42: =+(AA42+AB42+AC42)+0.5*AD42 -> 16.27 | AA42: 5.08 | AB42: 5.00 | AC42: 4.69 | AD42: =1+2 -> 3 | AE42: =+AF42+0.5*AG42 -> 43.76 | AF42: 32.76 | AG42: =2+3+9+6+1+1 -> 22
A43: 8 | B43: 8 | C43: 7 | D43: Berry, Robert | E43: CDP-SS | F43: =+H43+K43+N43+Q43+T43+W43+Z43+AE43 -> 276.76 | G43: =+J43+M43+P43+S43+V43+Y43+AD43+AG43 -> 90 | H43: =+I43+0.5*J43 -> 36.60 | I43: 32.60 | J43: =1+5+1+1 -> 8 | K43: =+L43+0.5*M43 -> 42.96 | L43: 39.96 | M43: =2+1+1+2 -> 6 | N43: =+O43+0.5*P43 -> 30.13 | O43: 25.63 | P43: =4+2+3 -> 9 | Q43: =+R43+(0.5*S43) -> 36.90 | R43: 27.40 | S43: =1+5+3+6+0+2+2+0 -> 19 | T43: =+U43+0.5*V43 -> 40.44 | U43: 37.44 | V43: =2+2+1+1 -> 6 | W43: =+X43+(0.5*Y43) -> 28.02 | X43: 19.02 | Y43: =1+1+1+5+10 -> 18 | Z43: =+(AA43+AB43+AC43)+0.5*AD43 -> 25.50 | AA43: 4.83 | AB43: 7.77 | AC43: 3.90 | AD43: =11+5+2 -> 18 | AE43: =+AF43+0.5*AG43 -> 36.21 | AF43: 33.21 | AG43: =1+1+2+2 -> 6
A44: 51 | B44: S8 | C44: 3 | D44: Phillips, RDan | E44: SSP-MM | F44: =+H44+K44+N44+Q44+T44+W44+Z44+AE44 -> 289.11 | G44: =+J44+M44+P44+S44+V44+Y44+AD44+AG44 -> 90 | H44: =+I44+0.5*J44 -> 34.15 | I44: 33.15 | J44: =1+1 -> 2 | K44: =+L44+0.5*M44 -> 44.87 | L44: 38.37 | M44: =2+1+10 -> 13 | N44: =+O44+0.5*P44 -> 32.85 | O44: 22.35 | P44: =2+2+1+1+5+10 -> 21 | Q44: =+R44+(0.5*S44) -> 41.31 | R44: 34.31 | S44: =4+2+5+2+1 -> 14 | T44: =+U44+0.5*V44 -> 34.82 | U44: 29.82 | V44: =1+2+2+1+1+1+2 -> 10 | W44: =+X44+(0.5*Y44) -> 29.41 | X44: 27.41 | Y44: =1+1+1+1 -> 4 | Z44: =+(AA44+AB44+AC44)+0.5*AD44 -> 16.61 | AA44: 3.56 | AB44: 4.45 | AC44: 4.60 | AD44: =2+5+1 -> 8 | AE44: =+AF44+0.5*AG44 -> 55.09 | AF44: 46.09 | AG44: =1+2+4+3+2+6 -> 18
A45: 12 | B45: 1 | C45: 11 | D45: Bridges, David | E45: SSP-MM | F45: =+H45+K45+N45+Q45+T45+W45+Z45+AE45 -> 397.00 | G45: =+J45+M45+P45+S45+V45+Y45+AD45+AG45 -> 92 | H45: =+I45+0.5*J45 -> 66.39 | I45: 63.39 | J45: =2+3+1 -> 6 | K45: =+L45+0.5*M45 -> 46.63 | L45: 41.63 | M45: =6+1+2+1 -> 10 | N45: =+O45+0.5*P45 -> 45.96 | O45: 37.46 | P45: =10+6+1 -> 17 | Q45: =+R45+(0.5*S45) -> 58.94 | R45: 53.44 | S45: =5+6 -> 11 | T45: =+U45+0.5*V45 -> 62.60 | U45: 54.60 | V45: =2+2+2+10 -> 16 | W45: =+X45+(0.5*Y45) -> 35.68 | X45: 34.68 | Y45: 2 | Z45: =+(AA45+AB45+AC45)+0.5*AD45 -> 28.45 | AA45: 5.04 | AB45: 5.59 | AC45: 4.82 | AD45: =16+6+4 -> 26 | AE45: =+AF45+0.5*AG45 -> 52.35 | AF45: 50.35 | AG45: =2+1+1 -> 4
C46: 1 | D46: Lorenz, David | E46: ESP-NV | F46: =+H46+K46+N46+Q46+T46+W46+Z46+AE46 -> 410.64 | G46: =+J46+M46+P46+S46+V46+Y46+AD46+AG46 -> 93 | H46: =+I46+0.5*J46 -> 56.90 | I46: 51.90 | J46: 10 | K46: =+L46+0.5*M46 -> 64.28 | L46: 63.78 | M46: 1 | N46: =+O46+0.5*P46 -> 56.78 | O46: 40.28 | P46: =11+11+0+0+1+0+10 -> 33 | Q46: =+R46+(0.5*S46) -> 43.73 | R46: 40.23 | S46: =3+1+1+1+1 -> 7 | T46: =+U46+0.5*V46 -> 52.00 | U46: 50.50 | V46: =2+1 -> 3 | W46: =+X46+(0.5*Y46) -> 51.15 | X46: 42.15 | Y46: =1+1+6+10 -> 18 | Z46: =+(AA46+AB46+AC46)+0.5*AD46 -> 22.18 | AA46: 4.68 | AB46: 5.28 | AC46: 6.22 | AD46: =8+1+3 -> 12 | AE46: =+AF46+0.5*AG46 -> 63.62 | AF46: 59.12 | AG46: =3+5+1 -> 9
A47: 39 | B47: 8 | C47: 2 | D47: Langford, Les | E47: CDP-SS | F47: =+H47+K47+N47+Q47+T47+W47+Z47+AE47 -> 235.31 | G47: =+J47+M47+P47+S47+V47+Y47+AD47+AG47 -> 100 | H47: =+I47+0.5*J47 -> 30.39 | I47: 26.89 | J47: =4+1+2 -> 7 | K47: =+L47+0.5*M47 -> 28.91 | L47: 28.41 | M47: 1 | N47: =+O47+0.5*P47 -> 28.66 | O47: 22.16 | P47: =5+2+5+1 -> 13 | Q47: =+R47+(0.5*S47) -> 26.35 | R47: 20.35 | S47: =0+2+4+5+0+0+1+0 -> 12 | T47: =+U47+0.5*V47 -> 37.84 | U47: 24.84 | V47: =3+1+6+1+6+1+2+1+5 -> 26 | W47: =+X47+(0.5*Y47) -> 27.71 | X47: 19.21 | Y47: =2+5+10 -> 17 | Z47: =+(AA47+AB47+AC47)+0.5*AD47 -> 20.64 | AA47: 4.98 | AB47: 5.47 | AC47: 5.19 | AD47: =3+4+3 -> 10 | AE47: =+AF47+0.5*AG47 -> 34.81 | AF47: 27.81 | AG47: =5+3+1+2+3 -> 14
A48: 23 | B48: 8 | C48: 4 | D48: Flores, Oscar | E48: CDP-SS | F48: =+H48+K48+N48+Q48+T48+W48+Z48+AE48 -> 240.40 | G48: =+J48+M48+P48+S48+V48+Y48+AD48+AG48 -> 100 | H48: =+I48+0.5*J48 -> 27.33 | I48: 19.33 | J48: =1+1+2+5+1+4+1+1 -> 16 | K48: =+L48+0.5*M48 -> 37.28 | L48: 30.28 | M48: =2+2+1+1+1+1+6 -> 14 | N48: =+O48+0.5*P48 -> 23.88 | O48: 18.88 | P48: =3+1+1+2+3 -> 10 | Q48: =+R48+(0.5*S48) -> 28.35 | R48: 22.85 | S48: =4+0+2+2+2+1+0+0 -> 11 | T48: =+U48+0.5*V48 -> 41.26 | U48: 38.76 | V48: =1+1+2+1 -> 5 | W48: =+X48+(0.5*Y48) -> 18.52 | X48: 16.02 | Y48: =1+4 -> 5 | Z48: =+(AA48+AB48+AC48)+0.5*AD48 -> 22.82 | AA48: 3.04 | AB48: 2.98 | AC48: 2.80 | AD48: =20+4+4 -> 28 | AE48: =+AF48+0.5*AG48 -> 40.96 | AF48: 35.46 | AG48: =1+5+3+1+1 -> 11
A49: 19 | B49: 1 | C49: 13 | D49: Crosby, Mike | E49: SSP-MM | F49: =+H49+K49+N49+Q49+T49+W49+Z49+AE49 -> 416.63 | G49: =+J49+M49+P49+S49+V49+Y49+AD49+AG49 -> 102 | H49: =+I49+0.5*J49 -> 51.88 | I49: 50.88 | J49: 2 | K49: =+L49+0.5*M49 -> 60.03 | L49: 59.03 | M49: =1+1 -> 2 | N49: =+O49+0.5*P49 -> 38.82 | O49: 32.32 | P49: =10+2+1 -> 13 | Q49: =+R49+(0.5*S49) -> 76.33 | R49: 68.83 | S49: =3+6+4+2 -> 15 | T49: =+U49+0.5*V49 -> 60.63 | U49: 47.13 | V49: =1+1+2+1+6+1+2+2+1+10 -> 27 | W49: =+X49+(0.5*Y49) -> 49.96 | X49: 37.46 | Y49: =5+10+10 -> 25 | Z49: =+(AA49+AB49+AC49)+0.5*AD49 -> 25.87 | AA49: 6.11 | AB49: 5.84 | AC49: 5.42 | AD49: =12+2+3 -> 17 | AE49: =+AF49+0.5*AG49 -> 53.11 | AF49: 52.61 | AG49: 1
A50: 52 | B50: S7 | C50: 3 | D50: Redford, Kent | E50: ESP-MM | F50: =+H50+K50+N50+Q50+T50+W50+Z50+AE50 -> 245.09 | G50: =+J50+M50+P50+S50+V50+Y50+AD50+AG50 -> 103 | H50: =+I50+0.5*J50 -> 36.22 | I50: 31.72 | J50: =1+0+0+0+1+1+1+0+5 -> 9 | K50: =+L50+0.5*M50 -> 32.14 | L50: 26.64 | M50: =3+1+1+1+2+2+1 -> 11 | N50: =+O50+0.5*P50 -> 29.13 | O50: 21.13 | P50: =3+6+4+3 -> 16 | Q50: =+R50+(0.5*S50) -> 31.27 | R50: 25.77 | S50: =2+0+2+4+1+0+1+1 -> 11 | T50: =+U50+0.5*V50 -> 38.68 | U50: 32.68 | V50: =3+4+2+2+1 -> 12 | W50: =+X50+(0.5*Y50) -> 22.00 | X50: 20.00 | Y50: =1+2+1 -> 4 | Z50: =+(AA50+AB50+AC50)+0.5*AD50 -> 18.17 | AA50: 5.05 | AB50: 3.85 | AC50: 2.77 | AD50: =8+1+4 -> 13 | AE50: =+AF50+0.5*AG50 -> 37.48 | AF50: 23.98 | AG50: =7+5+7+7+1 -> 27
A51: 3 | B51: S9 | C51: 6 | D51: Andersen, Welden | E51: SSP-SS | F51: =+H51+K51+N51+Q51+T51+W51+Z51+AE51 -> 277.31 | G51: =+J51+M51+P51+S51+V51+Y51+AD51+AG51 -> 104 | H51: =+I51+0.5*J51 -> 37.35 | I51: 37.35 | J51: 0 | K51: =+L51+0.5*M51 -> 48.08 | L51: 44.08 | M51: =3+1+2+1+1 -> 8 | N51: =+O51+0.5*P51 -> 26.89 | O51: 23.39 | P51: =2+2+2+1 -> 7 | Q51: =+R51+(0.5*S51) -> 42.70 | R51: 28.20 | S51: =1+10+2+4+1+1+10 -> 29 | T51: =+U51+0.5*V51 -> 36.81 | U51: 31.81 | V51: =1+2+6+1 -> 10 | W51: =+X51+(0.5*Y51) -> 23.52 | X51: 18.02 | Y51: =1+1+1+2+6 -> 11 | Z51: =+(AA51+AB51+AC51)+0.5*AD51 -> 24.35 | AA51: 6.74 | AB51: 4.27 | AC51: 3.84 | AD51: =10+4+5 -> 19 | AE51: =+AF51+0.5*AG51 -> 37.61 | AF51: 27.61 | AG51: =2+7+1+6+4 -> 20
A52: 17 | B52: S9 | C52: 3 | D52: Correia, Larry | E52: CDP-SS | F52: =+H52+K52+N52+Q52+T52+W52+Z52+AE52 -> 238.77 | G52: =+J52+M52+P52+S52+V52+Y52+AD52+AG52 -> 108 | H52: =+I52+0.5*J52 -> 36.10 | I52: 32.60 | J52: =1+1+4+1 -> 7 | K52: =+L52+0.5*M52 -> 30.11 | L52: 24.61 | M52: =2+2+1+5+1 -> 11 | N52: =+O52+0.5*P52 -> 24.98 | O52: 20.98 | P52: =2+1+3+1+1 -> 8 | Q52: =+R52+(0.5*S52) -> 33.56 | R52: 20.56 | S52: =1+8+4+1+1+1+10 -> 26 | T52: =+U52+0.5*V52 -> 30.59 | U52: 25.59 | V52: =2+2+1+3+1+1 -> 10 | W52: =+X52+(0.5*Y52) -> 31.33 | X52: 27.33 | Y52: =1+1+6 -> 8 | Z52: =+(AA52+AB52+AC52)+0.5*AD52 -> 18.39 | AA52: 4.28 | AB52: 3.54 | AC52: 4.57 | AD52: =6+2+4 -> 12 | AE52: =+AF52+0.5*AG52 -> 33.71 | AF52: 20.71 | AG52: =8+9+3+5+0+1 -> 26
A53: 66 | B53: S2 | C53: 4 | D53: Stone, Scott | E53: ESP-MM | F53: =+H53+K53+N53+Q53+T53+W53+Z53+AE53 -> 251.72 | G53: =+J53+M53+P53+S53+V53+Y53+AD53+AG53 -> 108 | H53: =+I53+0.5*J53 -> 30.46 | I53: 29.96 | J53: =0+0+0+0+0+0+0+0+1 -> 1 | K53: =+L53+0.5*M53 -> 33.15 | L53: 30.15 | M53: =1+0+1+1+0+2+0+1 -> 6 | N53: =+O53+0.5*P53 -> 33.70 | O53: 18.70 | P53: =5+5+1+7+10+2 -> 30 | Q53: =+R53+(0.5*S53) -> 35.51 | R53: 29.51 | S53: =6+2+3+1 -> 12 | T53: =+U53+0.5*V53 -> 40.59 | U53: 24.09 | V53: =2+1+2+2+1+5+10+10 -> 33 | W53: =+X53+(0.5*Y53) -> 27.97 | X53: 26.97 | Y53: =1+1 -> 2 | Z53: =+(AA53+AB53+AC53)+0.5*AD53 -> 17.64 | AA53: 3.38 | AB53: 4.97 | AC53: 4.79 | AD53: =5+1+3 -> 9 | AE53: =+AF53+0.5*AG53 -> 32.70 | AF53: 25.20 | AG53: =5+2+2+6+0+0 -> 15
A54: 65 | B54: 3 | C54: 6 | D54: Stilwell, Ron | E54: ESP-SS | F54: =+H54+K54+N54+Q54+T54+W54+Z54+AE54 -> 253.28 | G54: =+J54+M54+P54+S54+V54+Y54+AD54+AG54 -> 112 | H54: =+I54+0.5*J54 -> 33.82 | I54: 33.32 | J54: 1 | K54: =+L54+0.5*M54 -> 35.66 | L54: 33.66 | M54: =1+1+1+1 -> 4 | N54: =+O54+0.5*P54 -> 29.45 | O54: 22.95 | P54: =1+1+1+10 -> 13 | Q54: =+R54+(0.5*S54) -> 36.32 | R54: 26.82 | S54: =1+3+1+6+2+6 -> 19 | T54: =+U54+0.5*V54 -> 33.68 | U54: 26.68 | V54: =1+1+3+1+2+0+2+0+4 -> 14 | W54: =+X54+(0.5*Y54) -> 29.89 | X54: 15.89 | Y54: =2+1+5+10+10 -> 28 | Z54: =+(AA54+AB54+AC54)+0.5*AD54 -> 25.18 | AA54: 4.72 | AB54: 3.99 | AC54: 4.47 | AD54: =5+5+8+6 -> 24 | AE54: =+AF54+0.5*AG54 -> 29.28 | AF54: 24.78 | AG54: =0+5+1+0+2+1 -> 9
A55: 30 | B55: 3 | C55: 7 | D55: Hess, Matthew | E55: CDP-EX | F55: =+H55+K55+N55+Q55+T55+W55+Z55+AE55 -> 247.65 | G55: =+J55+M55+P55+S55+V55+Y55+AD55+AG55 -> 113 | H55: =+I55+0.5*J55 -> 28.26 | I55: 25.76 | J55: =1+1+1+1+1 -> 5 | K55: =+L55+0.5*M55 -> 48.61 | L55: 39.61 | M55: =4+2+1+1+10 -> 18 | N55: =+O55+0.5*P55 -> 24.99 | O55: 18.99 | P55: =6+4+1+1 -> 12 | Q55: =+R55+(0.5*S55) -> 23.60 | R55: 19.10 | S55: =1+1+1+3+1+1+1 -> 9 | T55: =+U55+0.5*V55 -> 50.52 | U55: 28.52 | V55: =0+1+1+0+1+10+10+0+1+20 -> 44 | W55: =+X55+(0.5*Y55) -> 17.95 | X55: 14.95 | Y55: 6 | Z55: =+(AA55+AB55+AC55)+0.5*AD55 -> 30.92 | AA55: 4.23 | AB55: 3.76 | AC55: 15.43 | AD55: =1+0+2+12 -> 15 | AE55: =+AF55+0.5*AG55 -> 22.80 | AF55: 20.80 | AG55: =0+0+0+2+2+0 -> 4
A56: 1 | B56: 4 | C56: 6 | D56: Albert, Jim | E56: ESP-MM | F56: =+H56+K56+N56+Q56+T56+W56+Z56+AE56 -> 303.91 | G56: =+J56+M56+P56+S56+V56+Y56+AD56+AG56 -> 114 | H56: =+I56+0.5*J56 -> 48.15 | I56: 37.65 | J56: =0+0+0+0+0+1+0+0+10+10 -> 21 | K56: =+L56+0.5*M56 -> 38.03 | L56: 36.53 | M56: =1+1+0+0+0+0+0+1 -> 3 | N56: =+O56+0.5*P56 -> 29.47 | O56: 23.47 | P56: =2+7+2+1 -> 12 | Q56: =+R56+(0.5*S56) -> 45.07 | R56: 37.07 | S56: =3+2+1+3+1+6 -> 16 | T56: =+U56+0.5*V56 -> 44.73 | U56: 39.23 | V56: =2+2+1+1+5 -> 11 | W56: =+X56+(0.5*Y56) -> 24.94 | X56: 24.44 | Y56: 1 | Z56: =+(AA56+AB56+AC56)+0.5*AD56 -> 31.71 | AA56: 6.03 | AB56: 6.18 | AC56: 6.50 | AD56: =8+4+14 -> 26 | AE56: =+AF56+0.5*AG56 -> 41.81 | AF56: 29.81 | AG56: =2+5+6+5+1+5 -> 24
A57: 62 | B57: 7 | C57: 5 | D57: Spicer, Richard | E57: SSP-SS | F57: =+H57+K57+N57+Q57+T57+W57+Z57+AE57 -> 259.63 | G57: =+J57+M57+P57+S57+V57+Y57+AD57+AG57 -> 115 | H57: =+I57+0.5*J57 -> 37.32 | I57: 28.32 | J57: =0+0+0+1+4+1+1+0+1+10 -> 18 | K57: =+L57+0.5*M57 -> 39.75 | L57: 33.25 | M57: =2+1+1+2+3+2+2 -> 13 | N57: =+O57+0.5*P57 -> 30.50 | O57: 18.50 | P57: =4+15+1+1+3 -> 24 | Q57: =+R57+(0.5*S57) -> 43.96 | R57: 29.46 | S57: =1+4+8+1+1+2+2+10 -> 29 | T57: =+U57+0.5*V57 -> 39.07 | U57: 33.07 | V57: =3+1+4+1+3 -> 12 | W57: =+X57+(0.5*Y57) -> 15.82 | X57: 15.32 | Y57: 1 | Z57: =+(AA57+AB57+AC57)+0.5*AD57 -> 15.74 | AA57: 4.05 | AB57: 3.76 | AC57: 3.43 | AD57: =4+3+2 -> 9 | AE57: =+AF57+0.5*AG57 -> 37.47 | AF57: 32.97 | AG57: =4+1+1+3 -> 9
A58: 80 | B58: 3 | C58: 2 | D58: Stilwell, Mike | E58: ESP-EX | F58: =+H58+K58+N58+Q58+T58+W58+Z58+AE58 -> 229.65 | G58: =+J58+M58+P58+S58+V58+Y58+AD58+AG58 -> 119 | H58: =+I58+0.5*J58 -> 29.12 | I58: 27.62 | J58: =2+1 -> 3 | K58: =+L58+0.5*M58 -> 28.48 | L58: 25.98 | M58: =4+1 -> 5 | N58: =+O58+0.5*P58 -> 20.09 | O58: 18.09 | P58: =1+1+2 -> 4 | Q58: =+R58+(0.5*S58) -> 27.64 | R58: 23.64 | S58: =2+2+1+1+1+1 -> 8 | T58: =+U58+0.5*V58 -> 33.73 | U58: 26.23 | V58: =1+1+4+2+2+4+1 -> 15 | W58: =+X58+(0.5*Y58) -> 25.52 | X58: 16.02 | Y58: =2+1+1+5+10 -> 19 | Z58: =+(AA58+AB58+AC58)+0.5*AD58 -> 16.54 | AA58: 4.85 | AB58: 4.14 | AC58: 3.55 | AD58: =4+3+1 -> 8 | AE58: =+AF58+0.5*AG58 -> 48.53 | AF58: 20.03 | AG58: =10+11+7+15+2+2+10 -> 57
A59: 22 | B59: 1 | C59: 9 | D59: Eubanks, Paul | E59: SSP-MM | F59: =+H59+K59+N59+Q59+T59+W59+Z59+AE59 -> 362.25 | G59: =+J59+M59+P59+S59+V59+Y59+AD59+AG59 -> 119 | H59: =+I59+0.5*J59 -> 55.36 | I59: 51.86 | J59: =1+6 -> 7 | K59: =+L59+0.5*M59 -> 71.83 | L59: 61.33 | M59: =1+1+1+2+6+10 -> 21 | N59: =+O59+0.5*P59 -> 32.52 | O59: 25.02 | P59: =3+4+1+5+2 -> 15 | Q59: =+R59+(0.5*S59) -> 56.21 | R59: 50.71 | S59: =1+5+2+2+1 -> 11 | T59: =+U59+0.5*V59 -> 53.13 | U59: 36.13 | V59: =5+2+4+3+20 -> 34 | W59: =+X59+(0.5*Y59) -> 23.22 | X59: 20.22 | Y59: 6 | Z59: =+(AA59+AB59+AC59)+0.5*AD59 -> 21.15 | AA59: 4.02 | AB59: 5.28 | AC59: 5.35 | AD59: =2+3+8 -> 13 | AE59: =+AF59+0.5*AG59 -> 48.83 | AF59: 42.83 | AG59: =1+2+5+1+1+2 -> 12
A60: =1+5+5+6+3 -> 20 | B60: 2 | C60: 3 | D60: Nelson, John | E60: SSP-SS | F60: =+H60+K60+N60+Q60+T60+W60+Z60+AE60 -> 245.21 | G60: =+J60+M60+P60+S60+V60+Y60+AD60+AG60 -> 120 | H60: =+I60+0.5*J60 -> 33.17 | I60: 31.67 | J60: =1+2 -> 3 | K60: =+L60+0.5*M60 -> 42.10 | L60: 27.60 | M60: =1+1+3+5+4+0+2+3+10 -> 29 | N60: =+O60+0.5*P60 -> 27.40 | O60: 17.90 | P60: =7+1+0+1+0+0+10 -> 19 | Q60: =+R60+(0.5*S60) -> 26.52 | R60: 22.52 | S60: =4+1+1+1+1 -> 8 | T60: =+U60+0.5*V60 -> 35.40 | U60: 24.90 | V60: =1+1+3+4+1+1+10 -> 21 | W60: =+X60+(0.5*Y60) -> 16.61 | X60: 16.61 | Y60: 0 | Z60: =+(AA60+AB60+AC60)+0.5*AD60 -> 32.08 | AA60: 4.57 | AB60: 3.83 | AC60: 14.68 | AD60: =6+6+6 -> 18 | AE60: =+AF60+0.5*AG60 -> 31.93 | AF60: 20.93 | AG60: =1+5+5+6+3+2 -> 22
A61: 13 | B61: S3 | C61: 9 | D61: Brown, Keith | E61: CDP-SS | F61: =+H61+K61+N61+Q61+T61+W61+Z61+AE61 -> 290.80 | G61: =+J61+M61+P61+S61+V61+Y61+AD61+AG61 -> 123 | H61: =+I61+0.5*J61 -> 45.92 | I61: 30.42 | J61: =0+0+0+3+8+0+0+0+0+10+10 -> 31 | K61: =+L61+0.5*M61 -> 47.58 | L61: 33.08 | M61: =3+2+1+0+0+1+2+10+10 -> 29 | N61: =+O61+0.5*P61 -> 38.73 | O61: 12.23 | P61: =6+5+11+15+6+10 -> 53 | Q61: =+R61+(0.5*S61) -> 40.84 | R61: 40.84 | S61: 0 | T61: =+U61+0.5*V61 -> 35.67 | U61: 35.67 | V61: 0 | W61: =+X61+(0.5*Y61) -> 26.03 | X61: 26.03 | Y61: 0 | Z61: =+(AA61+AB61+AC61)+0.5*AD61 -> 20.82 | AA61: 5.29 | AB61: 6.13 | AC61: 8.40 | AD61: =2+0+0 -> 2 | AE61: =+AF61+0.5*AG61 -> 35.21 | AF61: 31.21 | AG61: =0+2+5+1+0 -> 8
A62: 77 | B62: 3 | C62: 2 | D62: Young, Ren | E62: SSP-MM | F62: =+H62+K62+N62+Q62+T62+W62+Z62+AE62 -> 245.62 | G62: =+J62+M62+P62+S62+V62+Y62+AD62+AG62 -> 125 | H62: =+I62+0.5*J62 -> 27.22 | I62: 24.72 | J62: =1+1+2+1 -> 5 | K62: =+L62+0.5*M62 -> 42.19 | L62: 29.69 | M62: =3+1+5+1+3+12 -> 25 | N62: =+O62+0.5*P62 -> 33.73 | O62: 18.23 | P62: =4+13+1+1+2+0+10 -> 31 | Q62: =+R62+(0.5*S62) -> 28.64 | R62: 23.64 | S62: =3+3+4 -> 10 | T62: =+U62+0.5*V62 -> 38.79 | U62: 29.29 | V62: =1+4+2+6+4+2 -> 19 | W62: =+X62+(0.5*Y62) -> 25.35 | X62: 17.85 | Y62: =5+10 -> 15 | Z62: =+(AA62+AB62+AC62)+0.5*AD62 -> 16.47 | AA62: 3.91 | AB62: 4.67 | AC62: 3.89 | AD62: =2+2+4 -> 8 | AE62: =+AF62+0.5*AG62 -> 33.23 | AF62: 27.23 | AG62: =2+1+3+2+1+3 -> 12
A63: 59 | B63: S9 | C63: 5 | D63: Rodriquez, Mike | E63: CDP-SS | F63: =+H63+K63+N63+Q63+T63+W63+Z63+AE63 -> 243.25 | G63: =+J63+M63+P63+S63+V63+Y63+AD63+AG63 -> 128 | H63: =+I63+0.5*J63 -> 33.61 | I63: 32.11 | J63: =1+1+1 -> 3 | K63: =+L63+0.5*M63 -> 33.64 | L63: 28.14 | M63: =4+1+2+3+1 -> 11 | N63: =+O63+0.5*P63 -> 31.00 | O63: 21.00 | P63: =5+4+2+4+5 -> 20 | Q63: =+R63+(0.5*S63) -> 25.12 | R63: 21.12 | S63: =1+1+1+2+1+1+1 -> 8 | T63: =+U63+0.5*V63 -> 40.47 | U63: 26.47 | V63: =1+1+5+1+2+8+10 -> 28 | W63: =+X63+(0.5*Y63) -> 34.43 | X63: 16.43 | Y63: =5+5+1+5+20 -> 36 | Z63: =+(AA63+AB63+AC63)+0.5*AD63 -> 16.16 | AA63: 3.75 | AB63: 4.59 | AC63: 4.32 | AD63: =4+2+1 -> 7 | AE63: =+AF63+0.5*AG63 -> 28.82 | AF63: 21.32 | AG63: =1+1+1+9+1+2 -> 15
A64: 24 | B64: 8 | C64: 5 | D64: Frint, Joe | E64: SSP-MM | F64: =+H64+K64+N64+Q64+T64+W64+Z64+AE64 -> 320.47 | G64: =+J64+M64+P64+S64+V64+Y64+AD64+AG64 -> 128 | H64: =+I64+0.5*J64 -> 45.20 | I64: 44.70 | J64: 1 | K64: =+L64+0.5*M64 -> 47.91 | L64: 39.41 | M64: =4+2+1+4+6 -> 17 | N64: =+O64+0.5*P64 -> 28.46 | O64: 22.96 | P64: =1+1+7+2 -> 11 | Q64: =+R64+(0.5*S64) -> 50.85 | R64: 33.35 | S64: =8+4+1+5+2+1+1+3+10 -> 35 | T64: =+U64+0.5*V64 -> 47.98 | U64: 39.48 | V64: =6+1+1+2+5+2 -> 17 | W64: =+X64+(0.5*Y64) -> 27.84 | X64: 25.84 | Y64: =2+2 -> 4 | Z64: =+(AA64+AB64+AC64)+0.5*AD64 -> 18.26 | AA64: 4.51 | AB64: 5.31 | AC64: 4.94 | AD64: =2+2+3 -> 7 | AE64: =+AF64+0.5*AG64 -> 53.97 | AF64: 35.97 | AG64: =10+7+4+1+7+7 -> 36
A65: 67 | B65: 6 | C65: 8 | D65: Tekmitchov, George | E65: CDP-EX | F65: =+H65+K65+N65+Q65+T65+W65+Z65+AE65 -> 283.41 | G65: =+J65+M65+P65+S65+V65+Y65+AD65+AG65 -> 129 | H65: =+I65+0.5*J65 -> 29.23 | I65: 28.23 | J65: =1+1 -> 2 | K65: =+L65+0.5*M65 -> 45.66 | L65: 31.16 | M65: =0+1+10+0+1+2+0+5+10 -> 29 | N65: =+O65+0.5*P65 -> 28.82 | O65: 20.32 | P65: =6+3+0+0+6+2 -> 17 | Q65: =+R65+(0.5*S65) -> 37.01 | R65: 23.01 | S65: =1+1+10+1+1+4+10 -> 28 | T65: =+U65+0.5*V65 -> 46.33 | U65: 44.33 | V65: =1+2+1 -> 4 | W65: =+X65+(0.5*Y65) -> 40.64 | X65: 26.14 | Y65: 29 | Z65: =+(AA65+AB65+AC65)+0.5*AD65 -> 15.71 | AA65: 4.25 | AB65: 4.42 | AC65: 4.04 | AD65: =3+1+2 -> 6 | AE65: =+AF65+0.5*AG65 -> 40.01 | AF65: 33.01 | AG65: =6+2+3+2+1 -> 14
A66: 78 | B66: S9 | C66: 1 | D66: Zaccardi, Juke | E66: ESP-MM | F66: =+H66+K66+N66+Q66+T66+W66+Z66+AE66 -> 202.17 | G66: =+J66+M66+P66+S66+V66+Y66+AD66+AG66 -> 132 | H66: =+I66+0.5*J66 -> 26.05 | I66: 18.55 | J66: =1+1+6+1+5+1 -> 15 | K66: =+L66+0.5*M66 -> 27.51 | L66: 18.01 | M66: =3+2+1+4+6+1+1+1 -> 19 | N66: =+O66+0.5*P66 -> 20.09 | O66: 14.09 | P66: =1+4+6+1 -> 12 | Q66: =+R66+(0.5*S66) -> 22.00 | R66: 18.50 | S66: =1+2+0+2+0+0+1+1 -> 7 | T66: =+U66+0.5*V66 -> 31.62 | U66: 19.12 | V66: =8+1+1+1+1+1+2+10 -> 25 | W66: =+X66+(0.5*Y66) -> 18.58 | X66: 15.08 | Y66: =1+6 -> 7 | Z66: =+(AA66+AB66+AC66)+0.5*AD66 -> 30.86 | AA66: 8.78 | AB66: 4.36 | AC66: 3.72 | AD66: =12+1+9+6 -> 28 | AE66: =+AF66+0.5*AG66 -> 25.46 | AF66: 15.96 | AG66: =0+7+5+2+0+5 -> 19
A67: 9 | B67: S9 | C67: 7 | D67: Bolinder, Jim | E67: ESP-MM | F67: =+H67+K67+N67+Q67+T67+W67+Z67+AE67 -> 321.09 | G67: =+J67+M67+P67+S67+V67+Y67+AD67+AG67 -> 137 | H67: =+I67+0.5*J67 -> 47.88 | I67: 47.88 | J67: 0 | K67: =+L67+0.5*M67 -> 46.61 | L67: 38.61 | M67: =4+2+2+2+4+1+1 -> 16 | N67: =+O67+0.5*P67 -> 36.87 | O67: 29.37 | P67: =1+9+4+1 -> 15 | Q67: =+R67+(0.5*S67) -> 38.35 | R67: 28.85 | S67: =0+5+6+4+1+1+2+0 -> 19 | T67: =+U67+0.5*V67 -> 50.00 | U67: 41.50 | V67: =5+1+4+3+1+3 -> 17 | W67: =+X67+(0.5*Y67) -> 32.08 | X67: 26.08 | Y67: =1+1+10 -> 12 | Z67: =+(AA67+AB67+AC67)+0.5*AD67 -> 27.91 | AA67: 4.02 | AB67: 4.82 | AC67: 4.07 | AD67: =18+7+5 -> 30 | AE67: =+AF67+0.5*AG67 -> 41.39 | AF67: 27.39 | AG67: =1+10+11+5+1 -> 28
A68: 76 | B68: 6 | C68: 12 | D68: Wong, Hang | E68: SSP-MM | F68: =+H68+K68+N68+Q68+T68+W68+Z68+AE68 -> 405.34 | G68: =+J68+M68+P68+S68+V68+Y68+AD68+AG68 -> 145 | H68: =+I68+0.5*J68 -> 55.70 | I68: 55.70 | J68: 0 | K68: =+L68+0.5*M68 -> 53.46 | L68: 50.96 | M68: =2+1+2 -> 5 | N68: =+O68+0.5*P68 -> 45.60 | O68: 38.10 | P68: =3+4+2+3+2+1 -> 15 | Q68: =+R68+(0.5*S68) -> 55.51 | R68: 48.01 | S68: =1+1+1+6+2+2+2 -> 15 | T68: =+U68+0.5*V68 -> 54.84 | U68: 48.34 | V68: =1+1+2+2+6+1 -> 13 | W68: =+X68+(0.5*Y68) -> 47.54 | X68: 30.54 | Y68: =0+4+0+0+0+5+5+20 -> 34 | Z68: =+(AA68+AB68+AC68)+0.5*AD68 -> 33.04 | AA68: 5.98 | AB68: 6.71 | AC68: 6.35 | AD68: =11+12+5 -> 28 | AE68: =+AF68+0.5*AG68 -> 59.65 | AF68: 42.15 | AG68: =10+5+10+0+0+10 -> 35
A69: 73 | B69: 3 | C69: 1 | D69: Willis, David | E69: CDP-NV | F69: =+H69+K69+N69+Q69+T69+W69+Z69+AE69 -> 349.22 | G69: =+J69+M69+P69+S69+V69+Y69+AD69+AG69 -> 148 | H69: =+I69+0.5*J69 -> 51.76 | I69: 42.76 | J69: =5+1+1+1+10 -> 18 | K69: =+L69+0.5*M69 -> 48.01 | L69: 43.01 | M69: =3+1+1+1+2+2 -> 10 | N69: =+O69+0.5*P69 -> 44.75 | O69: 30.25 | P69: =9+6+1+3+10 -> 29 | Q69: =+R69+(0.5*S69) -> 35.14 | R69: 32.14 | S69: =1+1+1+1+1+1 -> 6 | T69: =+U69+0.5*V69 -> 55.77 | U69: 48.27 | V69: =1+6+1+5+1+1 -> 15 | W69: =+X69+(0.5*Y69) -> 31.84 | X69: 26.84 | Y69: =2+2+5+1 -> 10 | Z69: =+(AA69+AB69+AC69)+0.5*AD69 -> 32.69 | AA69: 4.98 | AB69: 5.58 | AC69: 4.63 | AD69: =10+11+14 -> 35 | AE69: =+AF69+0.5*AG69 -> 49.26 | AF69: 36.76 | AG69: =5+0+6+1+11+2 -> 25
A70: 35 | B70: S4 | C70: 8 | D70: Kirkham, Glade | E70: ESP-MM | F70: =+H70+K70+N70+Q70+T70+W70+Z70+AE70 -> 357.14 | G70: =+J70+M70+P70+S70+V70+Y70+AD70+AG70 -> 149 | H70: =+I70+0.5*J70 -> 54.68 | I70: 32.68 | J70: =0+0+0+10+10+0+1+1+2+20 -> 44 | K70: =+L70+0.5*M70 -> 57.37 | L70: 40.37 | M70: =3+1+2+10+4+1+2+1+10 -> 34 | N70: =+O70+0.5*P70 -> 55.27 | O70: 44.77 | P70: =6+10+5 -> 21 | Q70: =+R70+(0.5*S70) -> 49.54 | R70: 39.04 | S70: =4+1+1+10+3+0+1+1 -> 21 | T70: =+U70+0.5*V70 -> 45.32 | U70: 41.82 | V70: =1+1+1+1+1+1+1 -> 7 | W70: =+X70+(0.5*Y70) -> 27.49 | X70: 26.99 | Y70: 1 | Z70: =+(AA70+AB70+AC70)+0.5*AD70 -> 27.02 | AA70: 7.82 | AB70: 6.99 | AC70: 4.21 | AD70: =11+1+4 -> 16 | AE70: =+AF70+0.5*AG70 -> 40.45 | AF70: 37.95 | AG70: =0+1+0+1+1+2 -> 5
A71: 29 | B71: S4 | C71: 3 | D71: Hatch, Perri | E71: CDP-MM | F71: =+H71+K71+N71+Q71+T71+W71+Z71+AE71 -> 326.57 | G71: =+J71+M71+P71+S71+V71+Y71+AD71+AG71 -> 153 | H71: =+I71+0.5*J71 -> 46.50 | I71: 44.50 | J71: =0+0+0+1+0+0+1+1+1 -> 4 | K71: =+L71+0.5*M71 -> 40.83 | L71: 31.33 | M71: =2+3+5+6+0+1+2+0 -> 19 | N71: =+O71+0.5*P71 -> 41.10 | O71: 24.60 | P71: =15+11+2+2+1+2 -> 33 | Q71: =+R71+(0.5*S71) -> 43.21 | R71: 29.71 | S71: =2+5+4+6+2+2+0+6 -> 27 | T71: =+U71+0.5*V71 -> 40.64 | U71: 36.64 | V71: =4+2+1+1 -> 8 | W71: =+X71+(0.5*Y71) -> 36.10 | X71: 31.10 | Y71: 10 | Z71: =+(AA71+AB71+AC71)+0.5*AD71 -> 24.09 | AA71: 5.02 | AB71: 4.23 | AC71: 3.84 | AD71: =16+5+1 -> 22 | AE71: =+AF71+0.5*AG71 -> 54.10 | AF71: 39.10 | AG71: =1+0+2+15+1+1+10 -> 30
A72: 4.01 | B72: S7 | C72: 5 | D72: Hill, Randy | E72: ESP-MM | F72: =+H72+K72+N72+Q72+T72+W72+Z72+AE72 -> 275.50 | G72: =+J72+M72+P72+S72+V72+Y72+AD72+AG72 -> 156 | H72: =+I72+0.5*J72 -> 35.57 | I72: 32.07 | J72: =0+0+0+0+1+0+1+0+5 -> 7 | K72: =+L72+0.5*M72 -> 37.31 | L72: 27.81 | M72: =4+4+2+1+1+1+6 -> 19 | N72: =+O72+0.5*P72 -> 31.47 | O72: 22.97 | P72: =3+10+1+3 -> 17 | Q72: =+R72+(0.5*S72) -> 40.99 | R72: 29.49 | S72: =2+1+0+2+6+1+1+0+10 -> 23 | T72: =+U72+0.5*V72 -> 42.91 | U72: 28.41 | V72: =1+6+5+2+5+10 -> 29 | W72: =+X72+(0.5*Y72) -> 33.63 | X72: 25.13 | Y72: =1+1+5+10 -> 17 | Z72: =+(AA72+AB72+AC72)+0.5*AD72 -> 24.01 | AA72: 4.39 | AB72: 3.11 | AC72: 4.01 | AD72: =11+6+8 -> 25 | AE72: =+AF72+0.5*AG72 -> 29.61 | AF72: 20.11 | AG72: =6+4+2+6+1 -> 19
A73: 4 | B73: 1 | C73: 2 | D73: Andrus, Jay | E73: CDP-NV | F73: =+H73+K73+N73+Q73+T73+W73+Z73+AE73 -> 374.93 | G73: =+J73+M73+P73+S73+V73+Y73+AD73+AG73 -> 165 | H73: =+I73+0.5*J73 -> 58.12 | I73: 56.62 | J73: =1+1+1 -> 3 | K73: =+L73+0.5*M73 -> 50.26 | L73: 43.26 | M73: =1+1+5+1+6 -> 14 | N73: =+O73+0.5*P73 -> 44.41 | O73: 28.91 | P73: =15+15+1 -> 31 | Q73: =+R73+(0.5*S73) -> 48.63 | R73: 39.13 | S73: =3+1+3+5+1+6 -> 19 | T73: =+U73+0.5*V73 -> 55.34 | U73: 40.34 | V73: =3+0+4+6+4+0+2+6+5 -> 30 | W73: =+X73+(0.5*Y73) -> 40.27 | X73: 29.27 | Y73: =10+1+1+10 -> 22 | Z73: =+(AA73+AB73+AC73)+0.5*AD73 -> 23.62 | AA73: 5.27 | AB73: 5.11 | AC73: 5.24 | AD73: =6+4+6 -> 16 | AE73: =+AF73+0.5*AG73 -> 54.28 | AF73: 39.28 | AG73: =1+6+11+1+9+2 -> 30
A74: 53 | B74: S9 | C74: 4 | D74: Redford, Noel | E74: SSP-MM | F74: =+H74+K74+N74+Q74+T74+W74+Z74+AE74 -> 297.97 | G74: =+J74+M74+P74+S74+V74+Y74+AD74+AG74 -> 167 | H74: =+I74+0.5*J74 -> 42.21 | I74: 35.71 | J74: =1+1+1+10 -> 13 | K74: =+L74+0.5*M74 -> 48.33 | L74: 31.33 | M74: =4+8+5+2+2+2+1+10 -> 34 | N74: =+O74+0.5*P74 -> 32.55 | O74: 23.55 | P74: =3+2+2+1+10 -> 18 | Q74: =+R74+(0.5*S74) -> 35.16 | R74: 24.66 | S74: =4+5+4+2+1+2+2+1 -> 21 | T74: =+U74+0.5*V74 -> 49.43 | U74: 36.93 | V74: =1+1+1+1+10+1+10 -> 25 | W74: =+X74+(0.5*Y74) -> 18.34 | X74: 18.34 | Y74: 0 | Z74: =+(AA74+AB74+AC74)+0.5*AD74 -> 20.20 | AA74: 5.12 | AB74: 4.85 | AC74: 4.23 | AD74: =1+7+4 -> 12 | AE74: =+AF74+0.5*AG74 -> 51.75 | AF74: 29.75 | AG74: =5+11+9+5+11+3 -> 44
A75: 14 | B75: S9 | C75: 1 | D75: Carr, Robert | E75: SSR-NV | F75: =+H75+K75+N75+Q75+T75+W75+Z75+AE75 -> 468.37 | G75: =+J75+M75+P75+S75+V75+Y75+AD75+AG75 -> 182 | H75: =+I75+0.5*J75 -> 73.20 | I75: 59.70 | J75: =1+1+1+1+1+2+20 -> 27 | K75: =+L75+0.5*M75 -> 52.84 | L75: 41.34 | M75: =2+4+4+1+2+10 -> 23 | N75: =+O75+0.5*P75 -> 42.23 | O75: 31.23 | P75: =5+10+1+5+1 -> 22 | Q75: =+R75+(0.5*S75) -> 78.49 | R75: 62.49 | S75: =1+1+2+10+5+1+2+10 -> 32 | T75: =+U75+0.5*V75 -> 69.94 | U75: 63.94 | V75: =2+2+2+4+2 -> 12 | W75: =+X75+(0.5*Y75) -> 49.22 | X75: 40.72 | Y75: =2+5+10 -> 17 | Z75: =+(AA75+AB75+AC75)+0.5*AD75 -> 26.45 | AA75: 6.32 | AB75: 6.24 | AC75: 4.89 | AD75: =8+3+7 -> 18 | AE75: =+AF75+0.5*AG75 -> 76.00 | AF75: 60.50 | AG75: =1+7+11+5+7 -> 31
A76: 74 | B76: 3 | C76: 8 | D76: Wimberly, Jeff | E76: SSP-MM | F76: =+H76+K76+N76+Q76+T76+W76+Z76+AE76 -> 353.19 | G76: =+J76+M76+P76+S76+V76+Y76+AD76+AG76 -> 189 | H76: =+I76+0.5*J76 -> 49.34 | I76: 46.84 | J76: =1+3+1 -> 5 | K76: =+L76+0.5*M76 -> 45.37 | L76: 39.37 | M76: =2+2+5+1+2 -> 12 | N76: =+O76+0.5*P76 -> 33.45 | O76: 21.45 | P76: =9+15 -> 24 | Q76: =+R76+(0.5*S76) -> 45.65 | R76: 31.15 | S76: =4+6+6+6+5+2 -> 29 | T76: =+U76+0.5*V76 -> 57.97 | U76: 39.97 | V76: =0+1+2+1+6+2+10+1+3+10 -> 36 | W76: =+X76+(0.5*Y76) -> 35.72 | X76: 26.72 | Y76: =2+1+5+10 -> 18 | Z76: =+(AA76+AB76+AC76)+0.5*AD76 -> 24.21 | AA76: 4.41 | AB76: 6.08 | AC76: 5.72 | AD76: =7+4+5 -> 16 | AE76: =+AF76+0.5*AG76 -> 61.48 | AF76: 36.98 | AG76: =3+7+3+15+4+7+10 -> 49
A77: 2 | B77: 2 | C77: 7 | D77: Allen, Susan | E77: SSP-MM | F77: =+H77+K77+N77+Q77+T77+W77+Z77+AE77 -> 343.92 | G77: =+J77+M77+P77+S77+V77+Y77+AD77+AG77 -> 208 | H77: =+I77+0.5*J77 -> 40.98 | I77: 38.98 | J77: =1+1+2 -> 4 | K77: =+L77+0.5*M77 -> 44.32 | L77: 32.82 | M77: =3+1+6+0+0+1+0+2+10 -> 23 | N77: =+O77+0.5*P77 -> 45.58 | O77: 26.08 | P77: =15+15+0+1+6+2 -> 39 | Q77: =+R77+(0.5*S77) -> 43.94 | R77: 34.44 | S77: =6+1+2+5+0+1+0+4 -> 19 | T77: =+U77+0.5*V77 -> 54.02 | U77: 34.52 | V77: =5+1+3+6+4+10+10 -> 39 | W77: =+X77+(0.5*Y77) -> 23.33 | X77: 22.83 | Y77: 1 | Z77: =+(AA77+AB77+AC77)+0.5*AD77 -> 24.37 | AA77: 6.09 | AB77: 5.93 | AC77: 5.85 | AD77: =6+5+2 -> 13 | AE77: =+AF77+0.5*AG77 -> 67.38 | AF77: 32.38 | AG77: =6+6+13+15+6+4+20 -> 70
A78: 10 | B78: 2 | C78: 1 | D78: Boyer, Amie | E78: SSP-NV | F78: =+H78+K78+N78+Q78+T78+W78+Z78+AE78 -> 434.06 | G78: =+J78+M78+P78+S78+V78+Y78+AD78+AG78 -> 392 | H78: =+I78+0.5*J78 -> 48.46 | I78: 36.96 | J78: =1+5+1+5+1+5+1+4 -> 23 | K78: =+L78+0.5*M78 -> 50.50 | L78: 33.00 | M78: =2+4+1+3+6+6+2+1+10 -> 35 | N78: =+O78+0.5*P78 -> 43.75 | O78: 26.25 | P78: =13+13+1+1+5+2 -> 35 | Q78: =+R78+(0.5*S78) -> 66.44 | R78: 33.94 | S78: =6+10+4+10+6+1+1+1+26 -> 65 | T78: =+U78+0.5*V78 -> 64.68 | U78: 34.18 | V78: =5+6+5+5+5+4+10+5+6+10 -> 61 | W78: =+X78+(0.5*Y78) -> 35.54 | X78: 24.54 | Y78: =6+1+5+10 -> 22 | Z78: =+(AA78+AB78+AC78)+0.5*AD78 -> 39.77 | AA78: 4.99 | AB78: 5.70 | AC78: 7.08 | AD78: =9+12+17+6 -> 44 | AE78: =+AF78+0.5*AG78 -> 84.92 | AF78: 31.42 | AG78: =15+15+13+13+5+6+40 -> 107
A79: 43 | B79: 2 | C79: 2 | D79: McDermaid, Jen | E79: SSP-NV | F79: =+H79+K79+N79+Q79+T79+W79+Z79+AE79 -> 525.00 | G79: =+J79+M79+P79+S79+V79+Y79+AD79+AG79 -> 427 | H79: =+I79+0.5*J79 -> 53.48 | I79: 43.98 | J79: =3+1+3+3+3+2+3+1 -> 19 | K79: =+L79+0.5*M79 -> 96.92 | L79: 51.42 | M79: =3+6+3+10+10+10+1+8+40 -> 91 | N79: =+O79+0.5*P79 -> 50.68 | O79: 31.18 | P79: =15+13+4+1+2+4 -> 39 | Q79: =+R79+(0.5*S79) -> 97.05 | R79: 52.05 | S79: =4+8+10+10+6+6+4+2+40 -> 90 | T79: =+U79+0.5*V79 -> 85.03 | U79: 48.53 | V79: =10+1+10+1+5+2+8+5+1+30 -> 73 | W79: =+X79+(0.5*Y79) -> 42.67 | X79: 28.67 | Y79: =3+3+12+10 -> 28 | Z79: =+(AA79+AB79+AC79)+0.5*AD79 -> 34.43 | AA79: 5.26 | AB79: 6.00 | AC79: 6.17 | AD79: =23+8+3 -> 34 | AE79: =+AF79+0.5*AG79 -> 64.74 | AF79: 38.24 | AG79: =8+4+13+6+8+8+6 -> 53
A80: 18 | B80: S2 | C80: 6 | D80: Crawford, George | E80: CDP-MM | F80: DNF | G80: DNF | H80: =+I80+0.5*J80 -> 48.29 | I80: 46.79 | J80: =0+0+0+2+0+0+1+0+0 -> 3 | K80: =+L80+0.5*M80 -> 47.03 | L80: 40.03 | M80: =1+1+1+1+0+0+0+0+10 -> 14 | N80: =+O80+0.5*P80 -> 0.00 | Q80: =+R80+(0.5*S80) -> 0.00 | T80: =+U80+0.5*V80 -> 0.00 | W80: =+X80+(0.5*Y80) -> 0.00 | Z80: =+(AA80+AB80+AC80)+0.5*AD80 -> 0.00 | AE80: =+AF80+0.5*AG80 -> 0.00
C82: Legend/Notes:
C83: X | D83: = Shooters who were eligible to receive trophies for their specific Division/Classification. (IDPA ratio is 1 trophy per 3 Div/Class shooters.)
C84: Xx Xx | D84: = Shooters who acted as SOs or were part of the Match Staff.
C85: DNF | D85: = For some reason, the shooter Did Not Finish the match.
C86: XX | D86: = Points Down value included some sort of penalty (Procedural, Hit On Non-threat, Failure to Neutralize, etc.)
C87: XXX.XX | D87: = Because these shooters took 1st place in their specific Div/Class, and there were more than 10 shooters competing in their classification, they were automatically advanced to the next highest classification.
D89: Scores were verified on 9/27/04 and, though minor changes were made, no placings were effected.