C1: 2004 Utah State IDPA Championship Match Results
B2: Held on September 25, 2004 | H2: (Sorted by DIV/CLASS) | Q2: 4 | T2: 5 | W2: 6 | Z2: 7 | AE2: 8
A3: Shooter # | B3: Squad | C3: Place | D3: Name (Last, First) | E3: Div/Class | F3: Shoot Total | G3: Total PD | H3: Stage 1 | I3: String 1 | J3: Points Down | K3: Stage 2 | L3: String 1 | M3: Points Down | N3: Stage 3 | O3: String 1 | P3: Points Down | Q3: Stage 4 | R3: String 1 | S3: Points Down | T3: Stage 5 | U3: String 1 | V3: Points Down | W3: Stage 6 | X3: String 1 | Y3: Points Down | Z3: Stage 7 | AA3: String 1 | AB3: String 2 | AC3: String 3 | AD3: Points Down | AE3: Stage 8 | AF3: String 1 | AG3: Points Down
A4: SSP | C4: SSP | D4: SSP | E4: SSP | H4: SSP | K4: SSP | N4: SSP | Q4: SSP | T4: SSP | W4: SSP | Z4: SSP | AE4: SSP
C5: SSP-MA
A6: 37 | B6: 5 | C6: 1 | D6: Koski, Steve | E6: SSP-MA | F6: =+H6+K6+N6+Q6+T6+W6+Z6+AE6 -> 173.14 | G6: =+J6+M6+P6+S6+V6+Y6+AD6+AG6 -> 49 | H6: =+I6+0.5*J6 -> 26.14 | I6: 20.64 | J6: =1+10 -> 11 | K6: =+L6+0.5*M6 -> 23.70 | L6: 22.20 | M6: =1+1+1 -> 3 | N6: =+O6+0.5*P6 -> 19.54 | O6: 17.04 | P6: =3+1+1 -> 5 | Q6: =+R6+(0.5*S6) -> 21.56 | R6: 20.56 | S6: =1+1 -> 2 | T6: =+U6+0.5*V6 -> 25.35 | U6: 21.85 | V6: =0+0+0+0+2+0+0+5 -> 7 | W6: =+X6+(0.5*Y6) -> 16.62 | X6: 16.12 | Y6: 1 | Z6: =+(AA6+AB6+AC6)+0.5*AD6 -> 18.31 | AA6: 4.02 | AB6: 3.57 | AC6: 3.22 | AD6: =3+3+9 -> 15 | AE6: =+AF6+0.5*AG6 -> 21.92 | AF6: 19.42 | AG6: =1+2+2 -> 5
C7: SSP-EX
A8: 68 | B8: S9 | C8: 1 | D8: Theodore, Ari | E8: SSP-EX | F8: =+H8+K8+N8+Q8+T8+W8+Z8+AE8 -> 165.73 | G8: =+J8+M8+P8+S8+V8+Y8+AD8+AG8 -> 82 | H8: =+I8+0.5*J8 -> 29.51 | I8: 21.51 | J8: =1+1+1+2+1+10 -> 16 | K8: =+L8+0.5*M8 -> 27.73 | L8: 17.23 | M8: =5+2+5+4+4+1 -> 21 | N8: =+O8+0.5*P8 -> 16.24 | O8: 15.74 | P8: 1 | Q8: =+R8+(0.5*S8) -> 25.55 | R8: 16.55 | S8: =1+1+4+6+4+1+1 -> 18 | T8: =+U8+0.5*V8 -> 21.08 | U8: 18.08 | V8: =1+2+1+1+1 -> 6 | W8: =+X8+(0.5*Y8) -> 14.33 | X8: 11.83 | Y8: =1+3+1 -> 5 | Z8: =+(AA8+AB8+AC8)+0.5*AD8 -> 10.88 | AA8: 3.22 | AB8: 3.28 | AC8: 2.88 | AD8: =1+2 -> 3 | AE8: =+AF8+0.5*AG8 -> 20.41 | AF8: 14.41 | AG8: =1+4+6+1 -> 12
A9: =11+11+0+1+1+1 -> 25 | B9: 3 | C9: 2 | D9: Pagano, Kevin | E9: SSP-EX | F9: =+H9+K9+N9+Q9+T9+W9+Z9+AE9 -> 186.89 | G9: =+J9+M9+P9+S9+V9+Y9+AD9+AG9 -> 84 | H9: =+I9+0.5*J9 -> 23.71 | I9: 16.21 | J9: =1+3+1+2+5+1+2 -> 15 | K9: =+L9+0.5*M9 -> 27.79 | L9: 20.79 | M9: =3+1+1+1+6+1+1 -> 14 | N9: =+O9+0.5*P9 -> 27.06 | O9: 14.56 | P9: =11+11+0+1+1+1 -> 25 | Q9: =+R9+(0.5*S9) -> 26.85 | R9: 23.35 | S9: =2+1+1+1+1+0+0+1 -> 7 | T9: =+U9+0.5*V9 -> 28.99 | U9: 22.99 | V9: =0+0+2+1+3+0+1+3+2 -> 12 | W9: =+X9+(0.5*Y9) -> 14.82 | X9: 13.32 | Y9: 3 | Z9: =+(AA9+AB9+AC9)+0.5*AD9 -> 13.58 | AA9: 3.78 | AB9: 3.99 | AC9: 3.81 | AD9: =1+3 -> 4 | AE9: =+AF9+0.5*AG9 -> 24.09 | AF9: 22.09 | AG9: =3+1 -> 4
A10: 71 | B10: 5 | C10: 3 | D10: Vollmer, Phillip | E10: SSP-EX | F10: =+H10+K10+N10+Q10+T10+W10+Z10+AE10 -> 197.69 | G10: =+J10+M10+P10+S10+V10+Y10+AD10+AG10 -> 67 | H10: =+I10+0.5*J10 -> 24.29 | I10: 24.29 | J10: 0 | K10: =+L10+0.5*M10 -> 29.93 | L10: 22.43 | M10: =6+1+1+1+1+1+3+1 -> 15 | N10: =+O10+0.5*P10 -> 21.26 | O10: 17.76 | P10: =2+4+1 -> 7 | Q10: =+R10+(0.5*S10) -> 24.07 | R10: 22.57 | S10: =1+1+1 -> 3 | T10: =+U10+0.5*V10 -> 29.60 | U10: 23.60 | V10: =0+0+3+1+1+0+2+0+5 -> 12 | W10: =+X10+(0.5*Y10) -> 23.57 | X10: 21.07 | Y10: =4+1 -> 5 | Z10: =+(AA10+AB10+AC10)+0.5*AD10 -> 16.12 | AA10: 3.26 | AB10: 3.62 | AC10: 3.74 | AD10: =1+6+4 -> 11 | AE10: =+AF10+0.5*AG10 -> 28.85 | AF10: 21.85 | AG10: =1+6+1+1+5 -> 14
A11: 57 | B11: 6 | C11: 4 | D11: Richards, Dave | E11: SSP-EX | F11: =+H11+K11+N11+Q11+T11+W11+Z11+AE11 -> 205.97 | G11: =+J11+M11+P11+S11+V11+Y11+AD11+AG11 -> 63 | H11: =+I11+0.5*J11 -> 25.63 | I11: 23.63 | J11: =1+1+1+1 -> 4 | K11: =+L11+0.5*M11 -> 34.09 | L11: 26.09 | M11: =1+2+2+1+10 -> 16 | N11: =+O11+0.5*P11 -> 27.36 | O11: 23.36 | P11: =5+2+1 -> 8 | Q11: =+R11+(0.5*S11) -> 25.99 | R11: 22.99 | S11: =2+4 -> 6 | T11: =+U11+0.5*V11 -> 34.36 | U11: 28.36 | V11: =2+2+4+4 -> 12 | W11: =+X11+(0.5*Y11) -> 21.33 | X11: 18.33 | Y11: =1+5+0+0+0+0+0 -> 6 | Z11: =+(AA11+AB11+AC11)+0.5*AD11 -> 14.95 | AA11: 4.27 | AB11: 4.47 | AC11: 3.71 | AD11: =1+3+1 -> 5 | AE11: =+AF11+0.5*AG11 -> 22.26 | AF11: 19.26 | AG11: =2+2+1+1 -> 6
C12: SSP-SS
A13: 63 | B13: 7 | C13: 1 | D13: Spicer, Robert | E13: SSP-SS | F13: =+H13+K13+N13+Q13+T13+W13+Z13+AE13 -> 218.58 | G13: =+J13+M13+P13+S13+V13+Y13+AD13+AG13 -> 89 | H13: =+I13+0.5*J13 -> 24.65 | I13: 23.15 | J13: =1+0+0+0+2+0+0+0+0 -> 3 | K13: =+L13+0.5*M13 -> 33.25 | L13: 28.25 | M13: =3+2+3+1+1 -> 10 | N13: =+O13+0.5*P13 -> 22.62 | O13: 20.12 | P13: =1+2+1+1 -> 5 | Q13: =+R13+(0.5*S13) -> 29.53 | R13: 22.03 | S13: =6+5+1+1+1+1 -> 15 | T13: =+U13+0.5*V13 -> 33.72 | U13: 26.72 | V13: =2+4+4+4 -> 14 | W13: =+X13+(0.5*Y13) -> 15.21 | X13: 15.21 | Y13: 0 | Z13: =+(AA13+AB13+AC13)+0.5*AD13 -> 17.55 | AA13: 3.65 | AB13: 4.12 | AC13: 3.78 | AD13: =5+7+0 -> 12 | AE13: =+AF13+0.5*AG13 -> 42.05 | AF13: 27.05 | AG13: =2+6+11+1+6+4 -> 30
A14: 33 | B14: 7 | C14: 2 | D14: Jorgensen, John | E14: SSP-SS | F14: =+H14+K14+N14+Q14+T14+W14+Z14+AE14 -> 231.27 | G14: =+J14+M14+P14+S14+V14+Y14+AD14+AG14 -> 84 | H14: =+I14+0.5*J14 -> 31.76 | I14: 24.26 | J14: =1+3+1+10 -> 15 | K14: =+L14+0.5*M14 -> 34.23 | L14: 31.23 | M14: =1+3+1+1 -> 6 | N14: =+O14+0.5*P14 -> 24.78 | O14: 18.28 | P14: =1+9+1+2 -> 13 | Q14: =+R14+(0.5*S14) -> 35.28 | R14: 28.78 | S14: =2+2+5+3+1 -> 13 | T14: =+U14+0.5*V14 -> 39.77 | U14: 35.77 | V14: =3+2+2+1 -> 8 | W14: =+X14+(0.5*Y14) -> 20.15 | X14: 17.15 | Y14: =1+5 -> 6 | Z14: =+(AA14+AB14+AC14)+0.5*AD14 -> 18.41 | AA14: 3.63 | AB14: 4.14 | AC14: 4.14 | AD14: =5+4+4 -> 13 | AE14: =+AF14+0.5*AG14 -> 26.89 | AF14: 21.89 | AG14: =0+4+3+2+0+1 -> 10
A15: =1+5+5+6+3 -> 20 | B15: 2 | C15: 3 | D15: Nelson, John | E15: SSP-SS | F15: =+H15+K15+N15+Q15+T15+W15+Z15+AE15 -> 245.21 | G15: =+J15+M15+P15+S15+V15+Y15+AD15+AG15 -> 120 | H15: =+I15+0.5*J15 -> 33.17 | I15: 31.67 | J15: =1+2 -> 3 | K15: =+L15+0.5*M15 -> 42.10 | L15: 27.60 | M15: =1+1+3+5+4+0+2+3+10 -> 29 | N15: =+O15+0.5*P15 -> 27.40 | O15: 17.90 | P15: =7+1+0+1+0+0+10 -> 19 | Q15: =+R15+(0.5*S15) -> 26.52 | R15: 22.52 | S15: =4+1+1+1+1 -> 8 | T15: =+U15+0.5*V15 -> 35.40 | U15: 24.90 | V15: =1+1+3+4+1+1+10 -> 21 | W15: =+X15+(0.5*Y15) -> 16.61 | X15: 16.61 | Y15: 0 | Z15: =+(AA15+AB15+AC15)+0.5*AD15 -> 32.08 | AA15: 4.57 | AB15: 3.83 | AC15: 14.68 | AD15: =6+6+6 -> 18 | AE15: =+AF15+0.5*AG15 -> 31.93 | AF15: 20.93 | AG15: =1+5+5+6+3+2 -> 22
A16: 38 | B16: 2 | C16: 4 | D16: LaHuillier, Noble | E16: SSP-SS | F16: =+H16+K16+N16+Q16+T16+W16+Z16+AE16 -> 246.92 | G16: =+J16+M16+P16+S16+V16+Y16+AD16+AG16 -> 62 | H16: =+I16+0.5*J16 -> 34.63 | I16: 32.63 | J16: =1+1+1+1 -> 4 | K16: =+L16+0.5*M16 -> 34.96 | L16: 32.46 | M16: =1+1+1+1+1+0+0 -> 5 | N16: =+O16+0.5*P16 -> 27.71 | O16: 26.21 | P16: 3 | Q16: =+R16+(0.5*S16) -> 26.45 | R16: 22.95 | S16: =1+5+0+0+0+0+1+0 -> 7 | T16: =+U16+0.5*V16 -> 42.56 | U16: 38.06 | V16: =1+1+1+4+1+1 -> 9 | W16: =+X16+(0.5*Y16) -> 16.82 | X16: 16.82 | Y16: 0 | Z16: =+(AA16+AB16+AC16)+0.5*AD16 -> 27.17 | AA16: 5.83 | AB16: 7.33 | AC16: 6.51 | AD16: =5+8+2 -> 15 | AE16: =+AF16+0.5*AG16 -> 36.62 | AF16: 27.12 | AG16: =6+5+7+1 -> 19
A17: 62 | B17: 7 | C17: 5 | D17: Spicer, Richard | E17: SSP-SS | F17: =+H17+K17+N17+Q17+T17+W17+Z17+AE17 -> 259.63 | G17: =+J17+M17+P17+S17+V17+Y17+AD17+AG17 -> 115 | H17: =+I17+0.5*J17 -> 37.32 | I17: 28.32 | J17: =0+0+0+1+4+1+1+0+1+10 -> 18 | K17: =+L17+0.5*M17 -> 39.75 | L17: 33.25 | M17: =2+1+1+2+3+2+2 -> 13 | N17: =+O17+0.5*P17 -> 30.50 | O17: 18.50 | P17: =4+15+1+1+3 -> 24 | Q17: =+R17+(0.5*S17) -> 43.96 | R17: 29.46 | S17: =1+4+8+1+1+2+2+10 -> 29 | T17: =+U17+0.5*V17 -> 39.07 | U17: 33.07 | V17: =3+1+4+1+3 -> 12 | W17: =+X17+(0.5*Y17) -> 15.82 | X17: 15.32 | Y17: 1 | Z17: =+(AA17+AB17+AC17)+0.5*AD17 -> 15.74 | AA17: 4.05 | AB17: 3.76 | AC17: 3.43 | AD17: =4+3+2 -> 9 | AE17: =+AF17+0.5*AG17 -> 37.47 | AF17: 32.97 | AG17: =4+1+1+3 -> 9
A18: 3 | B18: S9 | C18: 6 | D18: Andersen, Welden | E18: SSP-SS | F18: =+H18+K18+N18+Q18+T18+W18+Z18+AE18 -> 277.31 | G18: =+J18+M18+P18+S18+V18+Y18+AD18+AG18 -> 104 | H18: =+I18+0.5*J18 -> 37.35 | I18: 37.35 | J18: 0 | K18: =+L18+0.5*M18 -> 48.08 | L18: 44.08 | M18: =3+1+2+1+1 -> 8 | N18: =+O18+0.5*P18 -> 26.89 | O18: 23.39 | P18: =2+2+2+1 -> 7 | Q18: =+R18+(0.5*S18) -> 42.70 | R18: 28.20 | S18: =1+10+2+4+1+1+10 -> 29 | T18: =+U18+0.5*V18 -> 36.81 | U18: 31.81 | V18: =1+2+6+1 -> 10 | W18: =+X18+(0.5*Y18) -> 23.52 | X18: 18.02 | Y18: =1+1+1+2+6 -> 11 | Z18: =+(AA18+AB18+AC18)+0.5*AD18 -> 24.35 | AA18: 6.74 | AB18: 4.27 | AC18: 3.84 | AD18: =10+4+5 -> 19 | AE18: =+AF18+0.5*AG18 -> 37.61 | AF18: 27.61 | AG18: =2+7+1+6+4 -> 20
C19: SSP-MM
A20: 11 | B20: 2 | C20: 1 | D20: Boyer, Steve | E20: SSP-MM | F20: =+H20+K20+N20+Q20+T20+W20+Z20+AE20 -> 236.06 | G20: =+J20+M20+P20+S20+V20+Y20+AD20+AG20 -> 48 | H20: =+I20+0.5*J20 -> 32.61 | I20: 31.11 | J20: =2+1 -> 3 | K20: =+L20+0.5*M20 -> 38.73 | L20: 33.23 | M20: =1+0+0+6+2+0+2+0 -> 11 | N20: =+O20+0.5*P20 -> 26.51 | O20: 21.01 | P20: =2+7+1+0+0+1 -> 11 | Q20: =+R20+(0.5*S20) -> 31.51 | R20: 29.51 | S20: =1+1+1+1 -> 4 | T20: =+U20+0.5*V20 -> 33.14 | U20: 28.64 | V20: =4+1+2+2 -> 9 | W20: =+X20+(0.5*Y20) -> 21.81 | X20: 21.31 | Y20: 1 | Z20: =+(AA20+AB20+AC20)+0.5*AD20 -> 17.99 | AA20: 4.96 | AB20: 5.47 | AC20: 5.56 | AD20: =2+2 -> 4 | AE20: =+AF20+0.5*AG20 -> 33.76 | AF20: 31.26 | AG20: =1+2+2 -> 5
A21: 77 | B21: 3 | C21: 2 | D21: Young, Ren | E21: SSP-MM | F21: =+H21+K21+N21+Q21+T21+W21+Z21+AE21 -> 245.62 | G21: =+J21+M21+P21+S21+V21+Y21+AD21+AG21 -> 125 | H21: =+I21+0.5*J21 -> 27.22 | I21: 24.72 | J21: =1+1+2+1 -> 5 | K21: =+L21+0.5*M21 -> 42.19 | L21: 29.69 | M21: =3+1+5+1+3+12 -> 25 | N21: =+O21+0.5*P21 -> 33.73 | O21: 18.23 | P21: =4+13+1+1+2+0+10 -> 31 | Q21: =+R21+(0.5*S21) -> 28.64 | R21: 23.64 | S21: =3+3+4 -> 10 | T21: =+U21+0.5*V21 -> 38.79 | U21: 29.29 | V21: =1+4+2+6+4+2 -> 19 | W21: =+X21+(0.5*Y21) -> 25.35 | X21: 17.85 | Y21: =5+10 -> 15 | Z21: =+(AA21+AB21+AC21)+0.5*AD21 -> 16.47 | AA21: 3.91 | AB21: 4.67 | AC21: 3.89 | AD21: =2+2+4 -> 8 | AE21: =+AF21+0.5*AG21 -> 33.23 | AF21: 27.23 | AG21: =2+1+3+2+1+3 -> 12
A22: 51 | B22: S8 | C22: 3 | D22: Phillips, RDan | E22: SSP-MM | F22: =+H22+K22+N22+Q22+T22+W22+Z22+AE22 -> 289.11 | G22: =+J22+M22+P22+S22+V22+Y22+AD22+AG22 -> 90 | H22: =+I22+0.5*J22 -> 34.15 | I22: 33.15 | J22: =1+1 -> 2 | K22: =+L22+0.5*M22 -> 44.87 | L22: 38.37 | M22: =2+1+10 -> 13 | N22: =+O22+0.5*P22 -> 32.85 | O22: 22.35 | P22: =2+2+1+1+5+10 -> 21 | Q22: =+R22+(0.5*S22) -> 41.31 | R22: 34.31 | S22: =4+2+5+2+1 -> 14 | T22: =+U22+0.5*V22 -> 34.82 | U22: 29.82 | V22: =1+2+2+1+1+1+2 -> 10 | W22: =+X22+(0.5*Y22) -> 29.41 | X22: 27.41 | Y22: =1+1+1+1 -> 4 | Z22: =+(AA22+AB22+AC22)+0.5*AD22 -> 16.61 | AA22: 3.56 | AB22: 4.45 | AC22: 4.60 | AD22: =2+5+1 -> 8 | AE22: =+AF22+0.5*AG22 -> 55.09 | AF22: 46.09 | AG22: =1+2+4+3+2+6 -> 18
A23: 53 | B23: S9 | C23: 4 | D23: Redford, Noel | E23: SSP-MM | F23: =+H23+K23+N23+Q23+T23+W23+Z23+AE23 -> 297.97 | G23: =+J23+M23+P23+S23+V23+Y23+AD23+AG23 -> 167 | H23: =+I23+0.5*J23 -> 42.21 | I23: 35.71 | J23: =1+1+1+10 -> 13 | K23: =+L23+0.5*M23 -> 48.33 | L23: 31.33 | M23: =4+8+5+2+2+2+1+10 -> 34 | N23: =+O23+0.5*P23 -> 32.55 | O23: 23.55 | P23: =3+2+2+1+10 -> 18 | Q23: =+R23+(0.5*S23) -> 35.16 | R23: 24.66 | S23: =4+5+4+2+1+2+2+1 -> 21 | T23: =+U23+0.5*V23 -> 49.43 | U23: 36.93 | V23: =1+1+1+1+10+1+10 -> 25 | W23: =+X23+(0.5*Y23) -> 18.34 | X23: 18.34 | Y23: 0 | Z23: =+(AA23+AB23+AC23)+0.5*AD23 -> 20.20 | AA23: 5.12 | AB23: 4.85 | AC23: 4.23 | AD23: =1+7+4 -> 12 | AE23: =+AF23+0.5*AG23 -> 51.75 | AF23: 29.75 | AG23: =5+11+9+5+11+3 -> 44
A24: 24 | B24: 8 | C24: 5 | D24: Frint, Joe | E24: SSP-MM | F24: =+H24+K24+N24+Q24+T24+W24+Z24+AE24 -> 320.47 | G24: =+J24+M24+P24+S24+V24+Y24+AD24+AG24 -> 128 | H24: =+I24+0.5*J24 -> 45.20 | I24: 44.70 | J24: 1 | K24: =+L24+0.5*M24 -> 47.91 | L24: 39.41 | M24: =4+2+1+4+6 -> 17 | N24: =+O24+0.5*P24 -> 28.46 | O24: 22.96 | P24: =1+1+7+2 -> 11 | Q24: =+R24+(0.5*S24) -> 50.85 | R24: 33.35 | S24: =8+4+1+5+2+1+1+3+10 -> 35 | T24: =+U24+0.5*V24 -> 47.98 | U24: 39.48 | V24: =6+1+1+2+5+2 -> 17 | W24: =+X24+(0.5*Y24) -> 27.84 | X24: 25.84 | Y24: =2+2 -> 4 | Z24: =+(AA24+AB24+AC24)+0.5*AD24 -> 18.26 | AA24: 4.51 | AB24: 5.31 | AC24: 4.94 | AD24: =2+2+3 -> 7 | AE24: =+AF24+0.5*AG24 -> 53.97 | AF24: 35.97 | AG24: =10+7+4+1+7+7 -> 36
A25: 25 | B25: 1 | C25: 6 | D25: Greenfield, Don | E25: SSP-MM | F25: =+H25+K25+N25+Q25+T25+W25+Z25+AE25 -> 338.38 | G25: =+J25+M25+P25+S25+V25+Y25+AD25+AG25 -> 69 | H25: =+I25+0.5*J25 -> 57.25 | I25: 56.25 | J25: =1+1 -> 2 | K25: =+L25+0.5*M25 -> 50.45 | L25: 45.95 | M25: =0+0+1+2+3+2+0+1 -> 9 | N25: =+O25+0.5*P25 -> 38.99 | O25: 35.49 | P25: =1+4+0+1+0+1 -> 7 | Q25: =+R25+(0.5*S25) -> 45.88 | R25: 41.38 | S25: =6+3 -> 9 | T25: =+U25+0.5*V25 -> 47.09 | U25: 35.59 | V25: =8+1+4+10 -> 23 | W25: =+X25+(0.5*Y25) -> 28.16 | X25: 27.66 | Y25: 1 | Z25: =+(AA25+AB25+AC25)+0.5*AD25 -> 21.24 | AA25: 7.69 | AB25: 6.03 | AC25: 5.52 | AD25: =2+2 -> 4 | AE25: =+AF25+0.5*AG25 -> 49.32 | AF25: 42.32 | AG25: =5+1+5+2+1 -> 14
A26: 2 | B26: 2 | C26: 7 | D26: Allen, Susan | E26: SSP-MM | F26: =+H26+K26+N26+Q26+T26+W26+Z26+AE26 -> 343.92 | G26: =+J26+M26+P26+S26+V26+Y26+AD26+AG26 -> 208 | H26: =+I26+0.5*J26 -> 40.98 | I26: 38.98 | J26: =1+1+2 -> 4 | K26: =+L26+0.5*M26 -> 44.32 | L26: 32.82 | M26: =3+1+6+0+0+1+0+2+10 -> 23 | N26: =+O26+0.5*P26 -> 45.58 | O26: 26.08 | P26: =15+15+0+1+6+2 -> 39 | Q26: =+R26+(0.5*S26) -> 43.94 | R26: 34.44 | S26: =6+1+2+5+0+1+0+4 -> 19 | T26: =+U26+0.5*V26 -> 54.02 | U26: 34.52 | V26: =5+1+3+6+4+10+10 -> 39 | W26: =+X26+(0.5*Y26) -> 23.33 | X26: 22.83 | Y26: 1 | Z26: =+(AA26+AB26+AC26)+0.5*AD26 -> 24.37 | AA26: 6.09 | AB26: 5.93 | AC26: 5.85 | AD26: =6+5+2 -> 13 | AE26: =+AF26+0.5*AG26 -> 67.38 | AF26: 32.38 | AG26: =6+6+13+15+6+4+20 -> 70
A27: 74 | B27: 3 | C27: 8 | D27: Wimberly, Jeff | E27: SSP-MM | F27: =+H27+K27+N27+Q27+T27+W27+Z27+AE27 -> 353.19 | G27: =+J27+M27+P27+S27+V27+Y27+AD27+AG27 -> 189 | H27: =+I27+0.5*J27 -> 49.34 | I27: 46.84 | J27: =1+3+1 -> 5 | K27: =+L27+0.5*M27 -> 45.37 | L27: 39.37 | M27: =2+2+5+1+2 -> 12 | N27: =+O27+0.5*P27 -> 33.45 | O27: 21.45 | P27: =9+15 -> 24 | Q27: =+R27+(0.5*S27) -> 45.65 | R27: 31.15 | S27: =4+6+6+6+5+2 -> 29 | T27: =+U27+0.5*V27 -> 57.97 | U27: 39.97 | V27: =0+1+2+1+6+2+10+1+3+10 -> 36 | W27: =+X27+(0.5*Y27) -> 35.72 | X27: 26.72 | Y27: =2+1+5+10 -> 18 | Z27: =+(AA27+AB27+AC27)+0.5*AD27 -> 24.21 | AA27: 4.41 | AB27: 6.08 | AC27: 5.72 | AD27: =7+4+5 -> 16 | AE27: =+AF27+0.5*AG27 -> 61.48 | AF27: 36.98 | AG27: =3+7+3+15+4+7+10 -> 49
A28: 22 | B28: 1 | C28: 9 | D28: Eubanks, Paul | E28: SSP-MM | F28: =+H28+K28+N28+Q28+T28+W28+Z28+AE28 -> 362.25 | G28: =+J28+M28+P28+S28+V28+Y28+AD28+AG28 -> 119 | H28: =+I28+0.5*J28 -> 55.36 | I28: 51.86 | J28: =1+6 -> 7 | K28: =+L28+0.5*M28 -> 71.83 | L28: 61.33 | M28: =1+1+1+2+6+10 -> 21 | N28: =+O28+0.5*P28 -> 32.52 | O28: 25.02 | P28: =3+4+1+5+2 -> 15 | Q28: =+R28+(0.5*S28) -> 56.21 | R28: 50.71 | S28: =1+5+2+2+1 -> 11 | T28: =+U28+0.5*V28 -> 53.13 | U28: 36.13 | V28: =5+2+4+3+20 -> 34 | W28: =+X28+(0.5*Y28) -> 23.22 | X28: 20.22 | Y28: 6 | Z28: =+(AA28+AB28+AC28)+0.5*AD28 -> 21.15 | AA28: 4.02 | AB28: 5.28 | AC28: 5.35 | AD28: =2+3+8 -> 13 | AE28: =+AF28+0.5*AG28 -> 48.83 | AF28: 42.83 | AG28: =1+2+5+1+1+2 -> 12
A29: 64 | B29: 1 | C29: 10 | D29: Sterling, Scott | E29: SSP-MM | F29: =+H29+K29+N29+Q29+T29+W29+Z29+AE29 -> 380.36 | G29: =+J29+M29+P29+S29+V29+Y29+AD29+AG29 -> 68 | H29: =+I29+0.5*J29 -> 53.70 | I29: 53.70 | J29: 0 | K29: =+L29+0.5*M29 -> 56.45 | L29: 50.45 | M29: =0+0+1+0+0+1+0+0+10 -> 12 | N29: =+O29+0.5*P29 -> 55.55 | O29: 47.55 | P29: =8+7+1 -> 16 | Q29: =+R29+(0.5*S29) -> 42.94 | R29: 39.94 | S29: =5+1 -> 6 | T29: =+U29+0.5*V29 -> 52.79 | U29: 45.79 | V29: =6+1+1+6 -> 14 | W29: =+X29+(0.5*Y29) -> 30.87 | X29: 28.87 | Y29: =2+2 -> 4 | Z29: =+(AA29+AB29+AC29)+0.5*AD29 -> 19.68 | AA29: 5.40 | AB29: 5.17 | AC29: 5.61 | AD29: =1+3+3 -> 7 | AE29: =+AF29+0.5*AG29 -> 68.38 | AF29: 63.88 | AG29: =2+1+6 -> 9
A30: 12 | B30: 1 | C30: 11 | D30: Bridges, David | E30: SSP-MM | F30: =+H30+K30+N30+Q30+T30+W30+Z30+AE30 -> 397.00 | G30: =+J30+M30+P30+S30+V30+Y30+AD30+AG30 -> 92 | H30: =+I30+0.5*J30 -> 66.39 | I30: 63.39 | J30: =2+3+1 -> 6 | K30: =+L30+0.5*M30 -> 46.63 | L30: 41.63 | M30: =6+1+2+1 -> 10 | N30: =+O30+0.5*P30 -> 45.96 | O30: 37.46 | P30: =10+6+1 -> 17 | Q30: =+R30+(0.5*S30) -> 58.94 | R30: 53.44 | S30: =5+6 -> 11 | T30: =+U30+0.5*V30 -> 62.60 | U30: 54.60 | V30: =2+2+2+10 -> 16 | W30: =+X30+(0.5*Y30) -> 35.68 | X30: 34.68 | Y30: 2 | Z30: =+(AA30+AB30+AC30)+0.5*AD30 -> 28.45 | AA30: 5.04 | AB30: 5.59 | AC30: 4.82 | AD30: =16+6+4 -> 26 | AE30: =+AF30+0.5*AG30 -> 52.35 | AF30: 50.35 | AG30: =2+1+1 -> 4
A31: 76 | B31: 6 | C31: 12 | D31: Wong, Hang | E31: SSP-MM | F31: =+H31+K31+N31+Q31+T31+W31+Z31+AE31 -> 405.34 | G31: =+J31+M31+P31+S31+V31+Y31+AD31+AG31 -> 145 | H31: =+I31+0.5*J31 -> 55.70 | I31: 55.70 | J31: 0 | K31: =+L31+0.5*M31 -> 53.46 | L31: 50.96 | M31: =2+1+2 -> 5 | N31: =+O31+0.5*P31 -> 45.60 | O31: 38.10 | P31: =3+4+2+3+2+1 -> 15 | Q31: =+R31+(0.5*S31) -> 55.51 | R31: 48.01 | S31: =1+1+1+6+2+2+2 -> 15 | T31: =+U31+0.5*V31 -> 54.84 | U31: 48.34 | V31: =1+1+2+2+6+1 -> 13 | W31: =+X31+(0.5*Y31) -> 47.54 | X31: 30.54 | Y31: =0+4+0+0+0+5+5+20 -> 34 | Z31: =+(AA31+AB31+AC31)+0.5*AD31 -> 33.04 | AA31: 5.98 | AB31: 6.71 | AC31: 6.35 | AD31: =11+12+5 -> 28 | AE31: =+AF31+0.5*AG31 -> 59.65 | AF31: 42.15 | AG31: =10+5+10+0+0+10 -> 35
A32: 19 | B32: 1 | C32: 13 | D32: Crosby, Mike | E32: SSP-MM | F32: =+H32+K32+N32+Q32+T32+W32+Z32+AE32 -> 416.63 | G32: =+J32+M32+P32+S32+V32+Y32+AD32+AG32 -> 102 | H32: =+I32+0.5*J32 -> 51.88 | I32: 50.88 | J32: 2 | K32: =+L32+0.5*M32 -> 60.03 | L32: 59.03 | M32: =1+1 -> 2 | N32: =+O32+0.5*P32 -> 38.82 | O32: 32.32 | P32: =10+2+1 -> 13 | Q32: =+R32+(0.5*S32) -> 76.33 | R32: 68.83 | S32: =3+6+4+2 -> 15 | T32: =+U32+0.5*V32 -> 60.63 | U32: 47.13 | V32: =1+1+2+1+6+1+2+2+1+10 -> 27 | W32: =+X32+(0.5*Y32) -> 49.96 | X32: 37.46 | Y32: =5+10+10 -> 25 | Z32: =+(AA32+AB32+AC32)+0.5*AD32 -> 25.87 | AA32: 6.11 | AB32: 5.84 | AC32: 5.42 | AD32: =12+2+3 -> 17 | AE32: =+AF32+0.5*AG32 -> 53.11 | AF32: 52.61 | AG32: 1
C33: SSP-NV
A34: 10 | B34: 2 | C34: 1 | D34: Boyer, Amie | E34: SSP-NV | F34: =+H34+K34+N34+Q34+T34+W34+Z34+AE34 -> 434.06 | G34: =+J34+M34+P34+S34+V34+Y34+AD34+AG34 -> 392 | H34: =+I34+0.5*J34 -> 48.46 | I34: 36.96 | J34: =1+5+1+5+1+5+1+4 -> 23 | K34: =+L34+0.5*M34 -> 50.50 | L34: 33.00 | M34: =2+4+1+3+6+6+2+1+10 -> 35 | N34: =+O34+0.5*P34 -> 43.75 | O34: 26.25 | P34: =13+13+1+1+5+2 -> 35 | Q34: =+R34+(0.5*S34) -> 66.44 | R34: 33.94 | S34: =6+10+4+10+6+1+1+1+26 -> 65 | T34: =+U34+0.5*V34 -> 64.68 | U34: 34.18 | V34: =5+6+5+5+5+4+10+5+6+10 -> 61 | W34: =+X34+(0.5*Y34) -> 35.54 | X34: 24.54 | Y34: =6+1+5+10 -> 22 | Z34: =+(AA34+AB34+AC34)+0.5*AD34 -> 39.77 | AA34: 4.99 | AB34: 5.70 | AC34: 7.08 | AD34: =9+12+17+6 -> 44 | AE34: =+AF34+0.5*AG34 -> 84.92 | AF34: 31.42 | AG34: =15+15+13+13+5+6+40 -> 107
A35: 43 | B35: 2 | C35: 2 | D35: McDermaid, Jen | E35: SSP-NV | F35: =+H35+K35+N35+Q35+T35+W35+Z35+AE35 -> 525.00 | G35: =+J35+M35+P35+S35+V35+Y35+AD35+AG35 -> 427 | H35: =+I35+0.5*J35 -> 53.48 | I35: 43.98 | J35: =3+1+3+3+3+2+3+1 -> 19 | K35: =+L35+0.5*M35 -> 96.92 | L35: 51.42 | M35: =3+6+3+10+10+10+1+8+40 -> 91 | N35: =+O35+0.5*P35 -> 50.68 | O35: 31.18 | P35: =15+13+4+1+2+4 -> 39 | Q35: =+R35+(0.5*S35) -> 97.05 | R35: 52.05 | S35: =4+8+10+10+6+6+4+2+40 -> 90 | T35: =+U35+0.5*V35 -> 85.03 | U35: 48.53 | V35: =10+1+10+1+5+2+8+5+1+30 -> 73 | W35: =+X35+(0.5*Y35) -> 42.67 | X35: 28.67 | Y35: =3+3+12+10 -> 28 | Z35: =+(AA35+AB35+AC35)+0.5*AD35 -> 34.43 | AA35: 5.26 | AB35: 6.00 | AC35: 6.17 | AD35: =23+8+3 -> 34 | AE35: =+AF35+0.5*AG35 -> 64.74 | AF35: 38.24 | AG35: =8+4+13+6+8+8+6 -> 53
A36: SSR | C36: SSR | D36: SSR | E36: SSR | H36: SSR | K36: SSR | N36: SSR | Q36: SSR | T36: SSR | W36: SSR | Z36: SSR | AE36: SSR
C37: SSR-EX
A38: 44 | B38: 4 | C38: 1 | D38: Mousley, Roger | E38: SSR-EX | F38: =+H38+K38+N38+Q38+T38+W38+Z38+AE38 -> 237.66 | G38: =+J38+M38+P38+S38+V38+Y38+AD38+AG38 -> 88 | H38: =+I38+0.5*J38 -> 35.92 | I38: 33.42 | J38: =4+1 -> 5 | K38: =+L38+0.5*M38 -> 30.99 | L38: 27.99 | M38: =1+1+3+1 -> 6 | N38: =+O38+0.5*P38 -> 23.55 | O38: 19.55 | P38: =4+3+1 -> 8 | Q38: =+R38+(0.5*S38) -> 41.11 | R38: 24.61 | S38: =3+4+1+10+2+1+1+1+10 -> 33 | T38: =+U38+0.5*V38 -> 36.00 | U38: 28.50 | V38: =1+3+4+2+5 -> 15 | W38: =+X38+(0.5*Y38) -> 19.26 | X38: 18.76 | Y38: =0+0+1+0+0+0+0 -> 1 | Z38: =+(AA38+AB38+AC38)+0.5*AD38 -> 18.41 | AA38: 5.55 | AB38: 4.96 | AC38: 3.40 | AD38: =3+3+3 -> 9 | AE38: =+AF38+0.5*AG38 -> 32.42 | AF38: 26.92 | AG38: =5+2+3+1 -> 11
A39: 20 | B39: 4 | C39: 2 | D39: Daer, Bill | E39: SSR-EX | F39: =+H39+K39+N39+Q39+T39+W39+Z39+AE39 -> 248.31 | G39: =+J39+M39+P39+S39+V39+Y39+AD39+AG39 -> 90 | H39: =+I39+0.5*J39 -> 31.64 | I39: 27.64 | J39: =1+2+1+4 -> 8 | K39: =+L39+0.5*M39 -> 32.70 | L39: 30.20 | M39: =2+1+2 -> 5 | N39: =+O39+0.5*P39 -> 23.45 | O39: 19.95 | P39: =1+4+1+1 -> 7 | Q39: =+R39+(0.5*S39) -> 44.43 | R39: 27.93 | S39: =2+10+1+5+3+1+0+1+10 -> 33 | T39: =+U39+0.5*V39 -> 37.13 | U39: 31.13 | V39: =4+2+2+1+3 -> 12 | W39: =+X39+(0.5*Y39) -> 18.93 | X39: 18.93 | Y39: 0 | Z39: =+(AA39+AB39+AC39)+0.5*AD39 -> 16.27 | AA39: 5.08 | AB39: 5.00 | AC39: 4.69 | AD39: =1+2 -> 3 | AE39: =+AF39+0.5*AG39 -> 43.76 | AF39: 32.76 | AG39: =2+3+9+6+1+1 -> 22
A40: 69 | B40: 4 | C40: 3 | D40: Veldboom, Terry | E40: SSR-EX | F40: =+H40+K40+N40+Q40+T40+W40+Z40+AE40 -> 257.52 | G40: =+J40+M40+P40+S40+V40+Y40+AD40+AG40 -> 74 | H40: =+I40+0.5*J40 -> 31.93 | I40: 30.93 | J40: =1+1 -> 2 | K40: =+L40+0.5*M40 -> 34.75 | L40: 31.25 | M40: =1+5+1 -> 7 | N40: =+O40+0.5*P40 -> 23.54 | O40: 20.54 | P40: =1+4+1 -> 6 | Q40: =+R40+(0.5*S40) -> 36.00 | R40: 33.50 | S40: =1+1+1+0+1+0+1+0 -> 5 | T40: =+U40+0.5*V40 -> 51.96 | U40: 43.96 | V40: =1+2+5+6+1+1 -> 16 | W40: =+X40+(0.5*Y40) -> 21.71 | X40: 19.71 | Y40: =0+2+0+1+1+0+0 -> 4 | Z40: =+(AA40+AB40+AC40)+0.5*AD40 -> 19.67 | AA40: 4.41 | AB40: 4.66 | AC40: 4.10 | AD40: =6+4+3 -> 13 | AE40: =+AF40+0.5*AG40 -> 37.96 | AF40: 27.46 | AG40: =1+6+7+1+6 -> 21
A41: 32 | B41: 4 | C41: 4 | D41: Huff, Blake | E41: SSR-EX | F41: =+H41+K41+N41+Q41+T41+W41+Z41+AE41 -> 268.04 | G41: =+J41+M41+P41+S41+V41+Y41+AD41+AG41 -> 68 | H41: =+I41+0.5*J41 -> 32.49 | I41: 30.99 | J41: =1+2 -> 3 | K41: =+L41+0.5*M41 -> 37.50 | L41: 36.00 | M41: =2+1 -> 3 | N41: =+O41+0.5*P41 -> 21.62 | O41: 19.12 | P41: =2+1+2 -> 5 | Q41: =+R41+(0.5*S41) -> 40.31 | R41: 31.81 | S41: =5+2+6+4+0+0+0+0 -> 17 | T41: =+U41+0.5*V41 -> 51.67 | U41: 45.67 | V41: =4+1+1+2+4 -> 12 | W41: =+X41+(0.5*Y41) -> 27.45 | X41: 24.45 | Y41: 6 | Z41: =+(AA41+AB41+AC41)+0.5*AD41 -> 20.78 | AA41: 5.24 | AB41: 5.13 | AC41: 6.41 | AD41: =2+5+1 -> 8 | AE41: =+AF41+0.5*AG41 -> 36.22 | AF41: 29.22 | AG41: =2+4+4+4 -> 14
C42: SSR-SS
A43: 54 | B43: S9 | C43: 1 | D43: Redford, "Red" | E43: SSR-SS | F43: =+H43+K43+N43+Q43+T43+W43+Z43+AE43 -> 264.33 | G43: =+J43+M43+P43+S43+V43+Y43+AD43+AG43 -> 54 | H43: =+I43+0.5*J43 -> 36.06 | I43: 34.06 | J43: =2+1+1 -> 4 | K43: =+L43+0.5*M43 -> 37.63 | L43: 33.13 | M43: =1+1+3+1+1+2 -> 9 | N43: =+O43+0.5*P43 -> 27.19 | O43: 24.19 | P43: =3+1+1+1 -> 6 | Q43: =+R43+(0.5*S43) -> 49.55 | R43: 41.55 | S43: =4+6+1+2+3 -> 16 | T43: =+U43+0.5*V43 -> 34.22 | U43: 31.22 | V43: =2+1+2+1 -> 6 | W43: =+X43+(0.5*Y43) -> 20.87 | X43: 19.87 | Y43: =1+1 -> 2 | Z43: =+(AA43+AB43+AC43)+0.5*AD43 -> 19.03 | AA43: 4.98 | AB43: 5.43 | AC43: 4.62 | AD43: =4+1+3 -> 8 | AE43: =+AF43+0.5*AG43 -> 39.78 | AF43: 38.28 | AG43: =1+1+1 -> 3
C44: SSR-NV
A45: 14 | B45: S9 | C45: 1 | D45: Carr, Robert | E45: SSR-NV | F45: =+H45+K45+N45+Q45+T45+W45+Z45+AE45 -> 468.37 | G45: =+J45+M45+P45+S45+V45+Y45+AD45+AG45 -> 182 | H45: =+I45+0.5*J45 -> 73.20 | I45: 59.70 | J45: =1+1+1+1+1+2+20 -> 27 | K45: =+L45+0.5*M45 -> 52.84 | L45: 41.34 | M45: =2+4+4+1+2+10 -> 23 | N45: =+O45+0.5*P45 -> 42.23 | O45: 31.23 | P45: =5+10+1+5+1 -> 22 | Q45: =+R45+(0.5*S45) -> 78.49 | R45: 62.49 | S45: =1+1+2+10+5+1+2+10 -> 32 | T45: =+U45+0.5*V45 -> 69.94 | U45: 63.94 | V45: =2+2+2+4+2 -> 12 | W45: =+X45+(0.5*Y45) -> 49.22 | X45: 40.72 | Y45: =2+5+10 -> 17 | Z45: =+(AA45+AB45+AC45)+0.5*AD45 -> 26.45 | AA45: 6.32 | AB45: 6.24 | AC45: 4.89 | AD45: =8+3+7 -> 18 | AE45: =+AF45+0.5*AG45 -> 76.00 | AF45: 60.50 | AG45: =1+7+11+5+7 -> 31
C47: Legend/Notes:
C48: X | D48: = Shooters who were eligible to receive trophies for their specific Division/Classification. (IDPA ratio is 1 trophy per 3 Div/Class shooters.)
C49: Xx Xx | D49: = Shooters who acted as SOs or were part of the Match Staff.
C50: DNF | D50: = For some reason, the shooter Did Not Finish the match.
C51: XX | D51: = Points Down value included some sort of penalty (Procedural, Hit On Non-threat, Failure to Neutralize, etc.)
C52: XXX.XX | D52: = Because these shooters took 1st place in their specific Div/Class, and there were more than 10 shooters competing in their classification, they were automatically advanced to the next highest classification.
D54: Scores were verified on 9/27/04 and, though minor changes were made, no placings were effected.