B1: Utah State IDPA Match - 2004 Results | C1: 2004 Utah State IDPA Championship Match
B2: Held on September 25, 2004 | H2: (Sorted by DIVISION without regard to CLASS) | Q2: 4 | T2: 5 | W2: 6 | Z2: 7 | AE2: 8
A3: Shooter # | B3: Squad | C3: Place | D3: Name (Last, First) | E3: Div/Class | F3: Shoot Total | G3: Total PD | H3: Stage 1 | I3: String 1 | J3: Points Down | K3: Stage 2 | L3: String 1 | M3: Points Down | N3: Stage 3 | O3: String 1 | P3: Points Down | Q3: Stage 4 | R3: String 1 | S3: Points Down | T3: Stage 5 | U3: String 1 | V3: Points Down | W3: Stage 6 | X3: String 1 | Y3: Points Down | Z3: Stage 7 | AA3: String 1 | AB3: String 2 | AC3: String 3 | AD3: Points Down | AE3: Stage 8 | AF3: String 1 | AG3: Points Down
C4: CDP
A5: 40 | B5: 5 | C5: 1 | D5: Latham, Corey | E5: CDP-EX | F5: =+H5+K5+N5+Q5+T5+W5+Z5+AE5 -> 188.23 | G5: =+J5+M5+P5+S5+V5+Y5+AD5+AG5 -> 48 | H5: =+I5+0.5*J5 -> 25.01 | I5: 24.51 | J5: 1 | K5: =+L5+0.5*M5 -> 25.08 | L5: 22.08 | M5: =0+1+0+1+1+2+1+0 -> 6 | N5: =+O5+0.5*P5 -> 28.31 | O5: 18.31 | P5: =8+6+1+5 -> 20 | Q5: =+R5+(0.5*S5) -> 23.28 | R5: 22.28 | S5: =1+1 -> 2 | T5: =+U5+0.5*V5 -> 29.89 | U5: 27.89 | V5: =1+1+1+1 -> 4 | W5: =+X5+(0.5*Y5) -> 16.22 | X5: 15.22 | Y5: =1+1 -> 2 | Z5: =+(AA5+AB5+AC5)+0.5*AD5 -> 12.09 | AA5: 3.31 | AB5: 3.57 | AC5: 3.21 | AD5: =3+1 -> 4 | AE5: =+AF5+0.5*AG5 -> 28.35 | AF5: 23.85 | AG5: =2+5+1+1 -> 9
A6: 72 | B6: 5 | C6: 2 | D6: Ward, Dan | E6: CDP-EX | F6: =+H6+K6+N6+Q6+T6+W6+Z6+AE6 -> 188.48 | G6: =+J6+M6+P6+S6+V6+Y6+AD6+AG6 -> 46 | H6: =+I6+0.5*J6 -> 26.19 | I6: 24.19 | J6: =1+0+0+1+0+2+0+0+0 -> 4 | K6: =+L6+0.5*M6 -> 25.80 | L6: 24.30 | M6: =1+0+0+1+0+0+1+0 -> 3 | N6: =+O6+0.5*P6 -> 20.77 | O6: 15.77 | P6: =6+2+1+1 -> 10 | Q6: =+R6+(0.5*S6) -> 22.52 | R6: 20.52 | S6: =1+1+2 -> 4 | T6: =+U6+0.5*V6 -> 27.43 | U6: 23.43 | V6: =1+1+2+2+1+1 -> 8 | W6: =+X6+(0.5*Y6) -> 18.69 | X6: 18.69 | Y6: 0 | Z6: =+(AA6+AB6+AC6)+0.5*AD6 -> 22.08 | AA6: 5.83 | AB6: 5.26 | AC6: 4.99 | AD6: =6+2+4 -> 12 | AE6: =+AF6+0.5*AG6 -> 25.00 | AF6: 22.50 | AG6: 5
A7: 26 | B7: 5 | C7: 3 | D7: Griffiths, Todd | E7: CDP-EX | F7: =+H7+K7+N7+Q7+T7+W7+Z7+AE7 -> 190.45 | G7: =+J7+M7+P7+S7+V7+Y7+AD7+AG7 -> 63 | H7: =+I7+0.5*J7 -> 26.06 | I7: 25.06 | J7: =1+1 -> 2 | K7: =+L7+0.5*M7 -> 24.46 | L7: 22.46 | M7: =0+0+0+2+0+0+1+1 -> 4 | N7: =+O7+0.5*P7 -> 23.31 | O7: 19.81 | P7: =1+2+1+3 -> 7 | Q7: =+R7+(0.5*S7) -> 21.74 | R7: 16.74 | S7: =1+1+1+1+6 -> 10 | T7: =+U7+0.5*V7 -> 32.66 | U7: 24.16 | V7: =1+6+2+3+5 -> 17 | W7: =+X7+(0.5*Y7) -> 19.90 | X7: 14.90 | Y7: =4+6 -> 10 | Z7: =+(AA7+AB7+AC7)+0.5*AD7 -> 15.77 | AA7: 4.00 | AB7: 3.87 | AC7: 3.90 | AD7: =3+4+1 -> 8 | AE7: =+AF7+0.5*AG7 -> 26.55 | AF7: 24.05 | AG7: =1+3+1 -> 5
A8: 42 | B8: S9 | C8: 4 | D8: Lowe, John | E8: CDP-EX | F8: =+H8+K8+N8+Q8+T8+W8+Z8+AE8 -> 203.02 | G8: =+J8+M8+P8+S8+V8+Y8+AD8+AG8 -> 39 | H8: =+I8+0.5*J8 -> 31.41 | I8: 30.91 | J8: 1 | K8: =+L8+0.5*M8 -> 31.08 | L8: 28.58 | M8: =1+1+2+1 -> 5 | N8: =+O8+0.5*P8 -> 22.70 | O8: 20.70 | P8: =1+1+1+1 -> 4 | Q8: =+R8+(0.5*S8) -> 25.85 | R8: 22.35 | S8: =1+1+4+1 -> 7 | T8: =+U8+0.5*V8 -> 27.98 | U8: 25.98 | V8: =1+1+1+1 -> 4 | W8: =+X8+(0.5*Y8) -> 16.49 | X8: 15.99 | Y8: 1 | Z8: =+(AA8+AB8+AC8)+0.5*AD8 -> 18.46 | AA8: 4.97 | AB8: 4.90 | AC8: 4.09 | AD8: =6+3 -> 9 | AE8: =+AF8+0.5*AG8 -> 29.05 | AF8: 25.05 | AG8: =1+1+0+4+2+0 -> 8
B9: 7 | C9: 1 | D9: Ostler, Jeff | E9: CDP-SS | F9: =+H9+K9+N9+Q9+T9+W9+Z9+AE9 -> 229.74 | G9: =+J9+M9+P9+S9+V9+Y9+AD9+AG9 -> 65 | H9: =+I9+0.5*J9 -> 32.64 | I9: 29.14 | J9: =1+6 -> 7 | K9: =+L9+0.5*M9 -> 31.69 | L9: 30.69 | M9: =1+1 -> 2 | N9: =+O9+0.5*P9 -> 26.22 | O9: 22.22 | P9: =5+2+1+0+0+0 -> 8 | Q9: =+R9+(0.5*S9) -> 34.83 | R9: 25.33 | S9: =2+5+6+5+0+1+0+0 -> 19 | T9: =+U9+0.5*V9 -> 31.52 | U9: 30.02 | V9: =1+2 -> 3 | W9: =+X9+(0.5*Y9) -> 16.58 | X9: 16.58 | Y9: 0 | Z9: =+(AA9+AB9+AC9)+0.5*AD9 -> 21.63 | AA9: 4.21 | AB9: 3.81 | AC9: 3.61 | AD9: =13+2+5 -> 20 | AE9: =+AF9+0.5*AG9 -> 34.63 | AF9: 31.63 | AG9: =1+3+1+1 -> 6
A10: 27 | B10: S1 | C10: 5 | D10: Haslem, Alan | E10: CDP-EX | F10: =+H10+K10+N10+Q10+T10+W10+Z10+AE10 -> 234.36 | G10: =+J10+M10+P10+S10+V10+Y10+AD10+AG10 -> 51 | H10: =+I10+0.5*J10 -> 32.03 | I10: 32.03 | J10: =0+0+0+0+0+0+0+0+0 -> 0 | K10: =+L10+0.5*M10 -> 38.98 | L10: 35.48 | M10: =1+2+1+1+1+1 -> 7 | N10: =+O10+0.5*P10 -> 31.03 | O10: 25.03 | P10: =4+8 -> 12 | Q10: =+R10+(0.5*S10) -> 25.56 | R10: 24.06 | S10: =1+1+1 -> 3 | T10: =+U10+0.5*V10 -> 37.90 | U10: 34.40 | V10: =1+1+5 -> 7 | W10: =+X10+(0.5*Y10) -> 18.40 | X10: 17.90 | Y10: 1 | Z10: =+(AA10+AB10+AC10)+0.5*AD10 -> 19.93 | AA10: 3.93 | AB10: 3.84 | AC10: 3.66 | AD10: =5+2+4+6 -> 17 | AE10: =+AF10+0.5*AG10 -> 30.53 | AF10: 28.53 | AG10: =0+2+2+0+0+0 -> 4
A11: 39 | B11: 8 | C11: 2 | D11: Langford, Les | E11: CDP-SS | F11: =+H11+K11+N11+Q11+T11+W11+Z11+AE11 -> 235.31 | G11: =+J11+M11+P11+S11+V11+Y11+AD11+AG11 -> 100 | H11: =+I11+0.5*J11 -> 30.39 | I11: 26.89 | J11: =4+1+2 -> 7 | K11: =+L11+0.5*M11 -> 28.91 | L11: 28.41 | M11: 1 | N11: =+O11+0.5*P11 -> 28.66 | O11: 22.16 | P11: =5+2+5+1 -> 13 | Q11: =+R11+(0.5*S11) -> 26.35 | R11: 20.35 | S11: =0+2+4+5+0+0+1+0 -> 12 | T11: =+U11+0.5*V11 -> 37.84 | U11: 24.84 | V11: =3+1+6+1+6+1+2+1+5 -> 26 | W11: =+X11+(0.5*Y11) -> 27.71 | X11: 19.21 | Y11: =2+5+10 -> 17 | Z11: =+(AA11+AB11+AC11)+0.5*AD11 -> 20.64 | AA11: 4.98 | AB11: 5.47 | AC11: 5.19 | AD11: =3+4+3 -> 10 | AE11: =+AF11+0.5*AG11 -> 34.81 | AF11: 27.81 | AG11: =5+3+1+2+3 -> 14
A12: 17 | B12: S9 | C12: 3 | D12: Correia, Larry | E12: CDP-SS | F12: =+H12+K12+N12+Q12+T12+W12+Z12+AE12 -> 238.77 | G12: =+J12+M12+P12+S12+V12+Y12+AD12+AG12 -> 108 | H12: =+I12+0.5*J12 -> 36.10 | I12: 32.60 | J12: =1+1+4+1 -> 7 | K12: =+L12+0.5*M12 -> 30.11 | L12: 24.61 | M12: =2+2+1+5+1 -> 11 | N12: =+O12+0.5*P12 -> 24.98 | O12: 20.98 | P12: =2+1+3+1+1 -> 8 | Q12: =+R12+(0.5*S12) -> 33.56 | R12: 20.56 | S12: =1+8+4+1+1+1+10 -> 26 | T12: =+U12+0.5*V12 -> 30.59 | U12: 25.59 | V12: =2+2+1+3+1+1 -> 10 | W12: =+X12+(0.5*Y12) -> 31.33 | X12: 27.33 | Y12: =1+1+6 -> 8 | Z12: =+(AA12+AB12+AC12)+0.5*AD12 -> 18.39 | AA12: 4.28 | AB12: 3.54 | AC12: 4.57 | AD12: =6+2+4 -> 12 | AE12: =+AF12+0.5*AG12 -> 33.71 | AF12: 20.71 | AG12: =8+9+3+5+0+1 -> 26
A13: 23 | B13: 8 | C13: 4 | D13: Flores, Oscar | E13: CDP-SS | F13: =+H13+K13+N13+Q13+T13+W13+Z13+AE13 -> 240.40 | G13: =+J13+M13+P13+S13+V13+Y13+AD13+AG13 -> 100 | H13: =+I13+0.5*J13 -> 27.33 | I13: 19.33 | J13: =1+1+2+5+1+4+1+1 -> 16 | K13: =+L13+0.5*M13 -> 37.28 | L13: 30.28 | M13: =2+2+1+1+1+1+6 -> 14 | N13: =+O13+0.5*P13 -> 23.88 | O13: 18.88 | P13: =3+1+1+2+3 -> 10 | Q13: =+R13+(0.5*S13) -> 28.35 | R13: 22.85 | S13: =4+0+2+2+2+1+0+0 -> 11 | T13: =+U13+0.5*V13 -> 41.26 | U13: 38.76 | V13: =1+1+2+1 -> 5 | W13: =+X13+(0.5*Y13) -> 18.52 | X13: 16.02 | Y13: =1+4 -> 5 | Z13: =+(AA13+AB13+AC13)+0.5*AD13 -> 22.82 | AA13: 3.04 | AB13: 2.98 | AC13: 2.80 | AD13: =20+4+4 -> 28 | AE13: =+AF13+0.5*AG13 -> 40.96 | AF13: 35.46 | AG13: =1+5+3+1+1 -> 11
A14: 59 | B14: S9 | C14: 5 | D14: Rodriquez, Mike | E14: CDP-SS | F14: =+H14+K14+N14+Q14+T14+W14+Z14+AE14 -> 243.25 | G14: =+J14+M14+P14+S14+V14+Y14+AD14+AG14 -> 128 | H14: =+I14+0.5*J14 -> 33.61 | I14: 32.11 | J14: =1+1+1 -> 3 | K14: =+L14+0.5*M14 -> 33.64 | L14: 28.14 | M14: =4+1+2+3+1 -> 11 | N14: =+O14+0.5*P14 -> 31.00 | O14: 21.00 | P14: =5+4+2+4+5 -> 20 | Q14: =+R14+(0.5*S14) -> 25.12 | R14: 21.12 | S14: =1+1+1+2+1+1+1 -> 8 | T14: =+U14+0.5*V14 -> 40.47 | U14: 26.47 | V14: =1+1+5+1+2+8+10 -> 28 | W14: =+X14+(0.5*Y14) -> 34.43 | X14: 16.43 | Y14: =5+5+1+5+20 -> 36 | Z14: =+(AA14+AB14+AC14)+0.5*AD14 -> 16.16 | AA14: 3.75 | AB14: 4.59 | AC14: 4.32 | AD14: =4+2+1 -> 7 | AE14: =+AF14+0.5*AG14 -> 28.82 | AF14: 21.32 | AG14: =1+1+1+9+1+2 -> 15
A15: 28 | B15: S1 | C15: 6 | D15: Haslem, Kent | E15: CDP-EX | F15: =+H15+K15+N15+Q15+T15+W15+Z15+AE15 -> 244.31 | G15: =+J15+M15+P15+S15+V15+Y15+AD15+AG15 -> 81 | H15: =+I15+0.5*J15 -> 39.83 | I15: 39.33 | J15: =0+0+0+0+0+0+0+0+1 -> 1 | K15: =+L15+0.5*M15 -> 30.48 | L15: 24.98 | M15: =1+1+2+1+6 -> 11 | N15: =+O15+0.5*P15 -> 37.43 | O15: 23.93 | P15: =5+7+5+10 -> 27 | Q15: =+R15+(0.5*S15) -> 29.12 | R15: 23.62 | S15: =2+4+2+2+1 -> 11 | T15: =+U15+0.5*V15 -> 35.70 | U15: 29.70 | V15: =3+1+1+5+1+1 -> 12 | W15: =+X15+(0.5*Y15) -> 24.15 | X15: 22.15 | Y15: =3+1 -> 4 | Z15: =+(AA15+AB15+AC15)+0.5*AD15 -> 15.86 | AA15: 3.85 | AB15: 4.03 | AC15: 3.48 | AD15: =3+5+1 -> 9 | AE15: =+AF15+0.5*AG15 -> 31.74 | AF15: 28.74 | AG15: =0+0+2+0+0+4 -> 6
A16: 30 | B16: 3 | C16: 7 | D16: Hess, Matthew | E16: CDP-EX | F16: =+H16+K16+N16+Q16+T16+W16+Z16+AE16 -> 247.65 | G16: =+J16+M16+P16+S16+V16+Y16+AD16+AG16 -> 113 | H16: =+I16+0.5*J16 -> 28.26 | I16: 25.76 | J16: =1+1+1+1+1 -> 5 | K16: =+L16+0.5*M16 -> 48.61 | L16: 39.61 | M16: =4+2+1+1+10 -> 18 | N16: =+O16+0.5*P16 -> 24.99 | O16: 18.99 | P16: =6+4+1+1 -> 12 | Q16: =+R16+(0.5*S16) -> 23.60 | R16: 19.10 | S16: =1+1+1+3+1+1+1 -> 9 | T16: =+U16+0.5*V16 -> 50.52 | U16: 28.52 | V16: =0+1+1+0+1+10+10+0+1+20 -> 44 | W16: =+X16+(0.5*Y16) -> 17.95 | X16: 14.95 | Y16: 6 | Z16: =+(AA16+AB16+AC16)+0.5*AD16 -> 30.92 | AA16: 4.23 | AB16: 3.76 | AC16: 15.43 | AD16: =1+0+2+12 -> 15 | AE16: =+AF16+0.5*AG16 -> 22.80 | AF16: 20.80 | AG16: =0+0+0+2+2+0 -> 4
A17: 58 | B17: S6 | C17: 6 | D17: Rimer, Clayton | E17: CDP-SS | F17: =+H17+K17+N17+Q17+T17+W17+Z17+AE17 -> 265.79 | G17: =+J17+M17+P17+S17+V17+Y17+AD17+AG17 -> 74 | H17: =+I17+0.5*J17 -> 33.15 | I17: 33.15 | J17: =0+0+0+0+0+0+0+0+0 -> 0 | K17: =+L17+0.5*M17 -> 40.97 | L17: 33.97 | M17: =1+5+2+6 -> 14 | N17: =+O17+0.5*P17 -> 32.85 | O17: 23.85 | P17: =9+6+1+2 -> 18 | Q17: =+R17+(0.5*S17) -> 29.44 | R17: 27.94 | S17: =2+0+1+0+0+0+0+0 -> 3 | T17: =+U17+0.5*V17 -> 40.57 | U17: 37.57 | V17: =1+2+2+1 -> 6 | W17: =+X17+(0.5*Y17) -> 25.80 | X17: 22.80 | Y17: =5+1 -> 6 | Z17: =+(AA17+AB17+AC17)+0.5*AD17 -> 21.05 | AA17: 5.33 | AB17: 3.79 | AC17: 4.93 | AD17: =6+6+2 -> 14 | AE17: =+AF17+0.5*AG17 -> 41.96 | AF17: 35.46 | AG17: =1+6+6 -> 13
A18: 56 | B18: 7 | C18: 1 | D18: Reed, Ken | E18: CDP-MM | F18: =+H18+K18+N18+Q18+T18+W18+Z18+AE18 -> 273.96 | G18: =+J18+M18+P18+S18+V18+Y18+AD18+AG18 -> 61 | H18: =+I18+0.5*J18 -> 44.64 | I18: 43.14 | J18: =1+2 -> 3 | K18: =+L18+0.5*M18 -> 43.05 | L18: 38.05 | M18: =1+5+1+2+1 -> 10 | N18: =+O18+0.5*P18 -> 26.50 | O18: 24.00 | P18: =3+1+1 -> 5 | Q18: =+R18+(0.5*S18) -> 35.67 | R18: 29.17 | S18: =2+0+1+2+1+0+0+1+6 -> 13 | T18: =+U18+0.5*V18 -> 45.00 | U18: 40.00 | V18: =1+1+2+6 -> 10 | W18: =+X18+(0.5*Y18) -> 28.25 | X18: 25.75 | Y18: =4+1 -> 5 | Z18: =+(AA18+AB18+AC18)+0.5*AD18 -> 16.25 | AA18: 5.59 | AB18: 4.44 | AC18: 4.22 | AD18: =1+1+2 -> 4 | AE18: =+AF18+0.5*AG18 -> 34.60 | AF18: 29.10 | AG18: =3+4+1+2+1 -> 11
A19: 34 | B19: 8 | C19: 2 | D19: Kirkham, Bart | E19: CDP-MM | F19: =+H19+K19+N19+Q19+T19+W19+Z19+AE19 -> 275.33 | G19: =+J19+M19+P19+S19+V19+Y19+AD19+AG19 -> 82 | H19: =+I19+0.5*J19 -> 43.65 | I19: 42.65 | J19: =1+1 -> 2 | K19: =+L19+0.5*M19 -> 34.92 | L19: 30.42 | M19: =2+1+5+1 -> 9 | N19: =+O19+0.5*P19 -> 27.67 | O19: 17.67 | P19: =7+5+3+5 -> 20 | Q19: =+R19+(0.5*S19) -> 31.56 | R19: 27.06 | S19: =1+0+1+2+1+0+1+3 -> 9 | T19: =+U19+0.5*V19 -> 41.67 | U19: 34.17 | V19: =1+1+2+2+1+3+5 -> 15 | W19: =+X19+(0.5*Y19) -> 20.40 | X19: 19.90 | Y19: 1 | Z19: =+(AA19+AB19+AC19)+0.5*AD19 -> 23.58 | AA19: 5.54 | AB19: 5.55 | AC19: 4.99 | AD19: =8+2+5 -> 15 | AE19: =+AF19+0.5*AG19 -> 51.88 | AF19: 46.38 | AG19: =1+6+2+2 -> 11
A20: 8 | B20: 8 | C20: 7 | D20: Berry, Robert | E20: CDP-SS | F20: =+H20+K20+N20+Q20+T20+W20+Z20+AE20 -> 276.76 | G20: =+J20+M20+P20+S20+V20+Y20+AD20+AG20 -> 90 | H20: =+I20+0.5*J20 -> 36.60 | I20: 32.60 | J20: =1+5+1+1 -> 8 | K20: =+L20+0.5*M20 -> 42.96 | L20: 39.96 | M20: =2+1+1+2 -> 6 | N20: =+O20+0.5*P20 -> 30.13 | O20: 25.63 | P20: =4+2+3 -> 9 | Q20: =+R20+(0.5*S20) -> 36.90 | R20: 27.40 | S20: =1+5+3+6+0+2+2+0 -> 19 | T20: =+U20+0.5*V20 -> 40.44 | U20: 37.44 | V20: =2+2+1+1 -> 6 | W20: =+X20+(0.5*Y20) -> 28.02 | X20: 19.02 | Y20: =1+1+1+5+10 -> 18 | Z20: =+(AA20+AB20+AC20)+0.5*AD20 -> 25.50 | AA20: 4.83 | AB20: 7.77 | AC20: 3.90 | AD20: =11+5+2 -> 18 | AE20: =+AF20+0.5*AG20 -> 36.21 | AF20: 33.21 | AG20: =1+1+2+2 -> 6
A21: 15 | B21: 8 | C21: 8 | D21: Colby, Bill | E21: CDP-SS | F21: =+H21+K21+N21+Q21+T21+W21+Z21+AE21 -> 282.50 | G21: =+J21+M21+P21+S21+V21+Y21+AD21+AG21 -> 81 | H21: =+I21+0.5*J21 -> 35.18 | I21: 34.68 | J21: 1 | K21: =+L21+0.5*M21 -> 38.21 | L21: 35.21 | M21: =2+1+1+1+1 -> 6 | N21: =+O21+0.5*P21 -> 37.45 | O21: 26.95 | P21: =7+10+1+2+1 -> 21 | Q21: =+R21+(0.5*S21) -> 42.67 | R21: 39.67 | S21: =0+0+1+4+0+1+0+0 -> 6 | T21: =+U21+0.5*V21 -> 54.89 | U21: 45.39 | V21: =1+1+1+1+1+4+10 -> 19 | W21: =+X21+(0.5*Y21) -> 22.85 | X21: 18.85 | Y21: =2+6 -> 8 | Z21: =+(AA21+AB21+AC21)+0.5*AD21 -> 19.77 | AA21: 4.41 | AB21: 4.40 | AC21: 3.96 | AD21: =4+6+4 -> 14 | AE21: =+AF21+0.5*AG21 -> 31.48 | AF21: 28.48 | AG21: =2+2+1+1 -> 6
A22: 67 | B22: 6 | C22: 8 | D22: Tekmitchov, George | E22: CDP-EX | F22: =+H22+K22+N22+Q22+T22+W22+Z22+AE22 -> 283.41 | G22: =+J22+M22+P22+S22+V22+Y22+AD22+AG22 -> 129 | H22: =+I22+0.5*J22 -> 29.23 | I22: 28.23 | J22: =1+1 -> 2 | K22: =+L22+0.5*M22 -> 45.66 | L22: 31.16 | M22: =0+1+10+0+1+2+0+5+10 -> 29 | N22: =+O22+0.5*P22 -> 28.82 | O22: 20.32 | P22: =6+3+0+0+6+2 -> 17 | Q22: =+R22+(0.5*S22) -> 37.01 | R22: 23.01 | S22: =1+1+10+1+1+4+10 -> 28 | T22: =+U22+0.5*V22 -> 46.33 | U22: 44.33 | V22: =1+2+1 -> 4 | W22: =+X22+(0.5*Y22) -> 40.64 | X22: 26.14 | Y22: 29 | Z22: =+(AA22+AB22+AC22)+0.5*AD22 -> 15.71 | AA22: 4.25 | AB22: 4.42 | AC22: 4.04 | AD22: =3+1+2 -> 6 | AE22: =+AF22+0.5*AG22 -> 40.01 | AF22: 33.01 | AG22: =6+2+3+2+1 -> 14
A23: 13 | B23: S3 | C23: 9 | D23: Brown, Keith | E23: CDP-SS | F23: =+H23+K23+N23+Q23+T23+W23+Z23+AE23 -> 290.80 | G23: =+J23+M23+P23+S23+V23+Y23+AD23+AG23 -> 123 | H23: =+I23+0.5*J23 -> 45.92 | I23: 30.42 | J23: =0+0+0+3+8+0+0+0+0+10+10 -> 31 | K23: =+L23+0.5*M23 -> 47.58 | L23: 33.08 | M23: =3+2+1+0+0+1+2+10+10 -> 29 | N23: =+O23+0.5*P23 -> 38.73 | O23: 12.23 | P23: =6+5+11+15+6+10 -> 53 | Q23: =+R23+(0.5*S23) -> 40.84 | R23: 40.84 | S23: 0 | T23: =+U23+0.5*V23 -> 35.67 | U23: 35.67 | V23: 0 | W23: =+X23+(0.5*Y23) -> 26.03 | X23: 26.03 | Y23: 0 | Z23: =+(AA23+AB23+AC23)+0.5*AD23 -> 20.82 | AA23: 5.29 | AB23: 6.13 | AC23: 8.40 | AD23: =2+0+0 -> 2 | AE23: =+AF23+0.5*AG23 -> 35.21 | AF23: 31.21 | AG23: =0+2+5+1+0 -> 8
A24: 61 | B24: S3 | C24: 10 | D24: Simpson, Harold | E24: CDP-SS | F24: =+H24+K24+N24+Q24+T24+W24+Z24+AE24 -> 298.26 | G24: =+J24+M24+P24+S24+V24+Y24+AD24+AG24 -> 65 | H24: =+I24+0.5*J24 -> 39.42 | I24: 37.92 | J24: =0+0+0+1+0+0+0+1+1 -> 3 | K24: =+L24+0.5*M24 -> 41.96 | L24: 38.96 | M24: =1+0+1+1+2+0+1+0 -> 6 | N24: =+O24+0.5*P24 -> 34.51 | O24: 30.51 | P24: =6+1+1 -> 8 | Q24: =+R24+(0.5*S24) -> 34.60 | R24: 30.10 | S24: =1+4+2+2 -> 9 | T24: =+U24+0.5*V24 -> 49.51 | U24: 46.51 | V24: =2+4 -> 6 | W24: =+X24+(0.5*Y24) -> 31.01 | X24: 30.01 | Y24: =1+1 -> 2 | Z24: =+(AA24+AB24+AC24)+0.5*AD24 -> 24.11 | AA24: 8.20 | AB24: 6.93 | AC24: 5.48 | AD24: =1+2+4 -> 7 | AE24: =+AF24+0.5*AG24 -> 43.14 | AF24: 31.14 | AG24: =0+0+2+6+10+6 -> 24
A25: 60 | B25: S5 | C25: 11 | D25: Rupert, Frank | E25: CDP-SS | F25: =+H25+K25+N25+Q25+T25+W25+Z25+AE25 -> 298.51 | G25: =+J25+M25+P25+S25+V25+Y25+AD25+AG25 -> 82 | H25: =+I25+0.5*J25 -> 57.30 | I25: 53.80 | J25: =0+1+1+0+0+0+0+5+0 -> 7 | K25: =+L25+0.5*M25 -> 31.54 | L25: 29.54 | M25: =1+1+1+1 -> 4 | N25: =+O25+0.5*P25 -> 31.94 | O25: 23.44 | P25: =6+6+1+2+2 -> 17 | Q25: =+R25+(0.5*S25) -> 27.90 | R25: 24.40 | S25: =0+1+1+2+0+0+1+2 -> 7 | T25: =+U25+0.5*V25 -> 47.79 | U25: 41.29 | V25: =1+1+2+2+6+1 -> 13 | W25: =+X25+(0.5*Y25) -> 40.51 | X25: 39.01 | Y25: =1+2 -> 3 | Z25: =+(AA25+AB25+AC25)+0.5*AD25 -> 27.44 | AA25: 4.14 | AB25: 5.00 | AC25: 7.80 | AD25: =12+9+0 -> 21 | AE25: =+AF25+0.5*AG25 -> 34.09 | AF25: 29.09 | AG25: =3+1+3+0+3+0 -> 10
A26: 29 | B26: S4 | C26: 3 | D26: Hatch, Perri | E26: CDP-MM | F26: =+H26+K26+N26+Q26+T26+W26+Z26+AE26 -> 326.57 | G26: =+J26+M26+P26+S26+V26+Y26+AD26+AG26 -> 153 | H26: =+I26+0.5*J26 -> 46.50 | I26: 44.50 | J26: =0+0+0+1+0+0+1+1+1 -> 4 | K26: =+L26+0.5*M26 -> 40.83 | L26: 31.33 | M26: =2+3+5+6+0+1+2+0 -> 19 | N26: =+O26+0.5*P26 -> 41.10 | O26: 24.60 | P26: =15+11+2+2+1+2 -> 33 | Q26: =+R26+(0.5*S26) -> 43.21 | R26: 29.71 | S26: =2+5+4+6+2+2+0+6 -> 27 | T26: =+U26+0.5*V26 -> 40.64 | U26: 36.64 | V26: =4+2+1+1 -> 8 | W26: =+X26+(0.5*Y26) -> 36.10 | X26: 31.10 | Y26: 10 | Z26: =+(AA26+AB26+AC26)+0.5*AD26 -> 24.09 | AA26: 5.02 | AB26: 4.23 | AC26: 3.84 | AD26: =16+5+1 -> 22 | AE26: =+AF26+0.5*AG26 -> 54.10 | AF26: 39.10 | AG26: =1+0+2+15+1+1+10 -> 30
A27: 73 | B27: 3 | C27: 1 | D27: Willis, David | E27: CDP-NV | F27: =+H27+K27+N27+Q27+T27+W27+Z27+AE27 -> 349.22 | G27: =+J27+M27+P27+S27+V27+Y27+AD27+AG27 -> 148 | H27: =+I27+0.5*J27 -> 51.76 | I27: 42.76 | J27: =5+1+1+1+10 -> 18 | K27: =+L27+0.5*M27 -> 48.01 | L27: 43.01 | M27: =3+1+1+1+2+2 -> 10 | N27: =+O27+0.5*P27 -> 44.75 | O27: 30.25 | P27: =9+6+1+3+10 -> 29 | Q27: =+R27+(0.5*S27) -> 35.14 | R27: 32.14 | S27: =1+1+1+1+1+1 -> 6 | T27: =+U27+0.5*V27 -> 55.77 | U27: 48.27 | V27: =1+6+1+5+1+1 -> 15 | W27: =+X27+(0.5*Y27) -> 31.84 | X27: 26.84 | Y27: =2+2+5+1 -> 10 | Z27: =+(AA27+AB27+AC27)+0.5*AD27 -> 32.69 | AA27: 4.98 | AB27: 5.58 | AC27: 4.63 | AD27: =10+11+14 -> 35 | AE27: =+AF27+0.5*AG27 -> 49.26 | AF27: 36.76 | AG27: =5+0+6+1+11+2 -> 25
A28: 5 | B28: S6 | C28: 4 | D28: Attryde, Edward | E28: CDP-MM | F28: =+H28+K28+N28+Q28+T28+W28+Z28+AE28 -> 363.08 | G28: =+J28+M28+P28+S28+V28+Y28+AD28+AG28 -> 78 | H28: =+I28+0.5*J28 -> 47.62 | I28: 47.12 | J28: =0+0+0+0+1+0+0+0+0 -> 1 | K28: =+L28+0.5*M28 -> 57.21 | L28: 53.21 | M28: =1+2+5 -> 8 | N28: =+O28+0.5*P28 -> 38.77 | O28: 34.77 | P28: 8 | Q28: =+R28+(0.5*S28) -> 41.19 | R28: 39.69 | S28: =0+0+1+0+0+1+0+1 -> 3 | T28: =+U28+0.5*V28 -> 49.62 | U28: 44.12 | V28: =1+1+2+1+6 -> 11 | W28: =+X28+(0.5*Y28) -> 39.38 | X28: 37.38 | Y28: =2+1+1 -> 4 | Z28: =+(AA28+AB28+AC28)+0.5*AD28 -> 31.84 | AA28: 5.22 | AB28: 5.48 | AC28: 6.14 | AD28: =10+5+15 -> 30 | AE28: =+AF28+0.5*AG28 -> 57.45 | AF28: 50.95 | AG28: =5+7+0+0+0+1 -> 13
A29: 4 | B29: 1 | C29: 2 | D29: Andrus, Jay | E29: CDP-NV | F29: =+H29+K29+N29+Q29+T29+W29+Z29+AE29 -> 374.93 | G29: =+J29+M29+P29+S29+V29+Y29+AD29+AG29 -> 165 | H29: =+I29+0.5*J29 -> 58.12 | I29: 56.62 | J29: =1+1+1 -> 3 | K29: =+L29+0.5*M29 -> 50.26 | L29: 43.26 | M29: =1+1+5+1+6 -> 14 | N29: =+O29+0.5*P29 -> 44.41 | O29: 28.91 | P29: =15+15+1 -> 31 | Q29: =+R29+(0.5*S29) -> 48.63 | R29: 39.13 | S29: =3+1+3+5+1+6 -> 19 | T29: =+U29+0.5*V29 -> 55.34 | U29: 40.34 | V29: =3+0+4+6+4+0+2+6+5 -> 30 | W29: =+X29+(0.5*Y29) -> 40.27 | X29: 29.27 | Y29: =10+1+1+10 -> 22 | Z29: =+(AA29+AB29+AC29)+0.5*AD29 -> 23.62 | AA29: 5.27 | AB29: 5.11 | AC29: 5.24 | AD29: =6+4+6 -> 16 | AE29: =+AF29+0.5*AG29 -> 54.28 | AF29: 39.28 | AG29: =1+6+11+1+9+2 -> 30
A30: 46 | B30: 7 | C30: 5 | D30: Ostler, Jay | E30: CDP-MM | F30: =+H30+K30+N30+Q30+T30+W30+Z30+AE30 -> 443.19 | G30: =+J30+M30+P30+S30+V30+Y30+AD30+AG30 -> 72 | H30: =+I30+0.5*J30 -> 82.49 | I30: 77.49 | J30: 10 | K30: =+L30+0.5*M30 -> 87.14 | L30: 82.14 | M30: =2+1+1+6 -> 10 | N30: =+O30+0.5*P30 -> 50.31 | O30: 43.81 | P30: =2+11+0+0+0+0 -> 13 | Q30: =+R30+(0.5*S30) -> 44.88 | R30: 43.38 | S30: =1+1+1 -> 3 | T30: =+U30+0.5*V30 -> 55.64 | U30: 50.14 | V30: =1+1+2+1+1+3+1+1 -> 11 | W30: =+X30+(0.5*Y30) -> 35.33 | X30: 33.33 | Y30: =1+3 -> 4 | Z30: =+(AA30+AB30+AC30)+0.5*AD30 -> 29.60 | AA30: 8.09 | AB30: 6.18 | AC30: 7.33 | AD30: =10+4+2 -> 16 | AE30: =+AF30+0.5*AG30 -> 57.80 | AF30: 55.30 | AG30: =2+2+1 -> 5
A31: 18 | B31: S2 | C31: 6 | D31: Crawford, George | E31: CDP-MM | F31: DNF | G31: DNF | H31: =+I31+0.5*J31 -> 48.29 | I31: 46.79 | J31: =0+0+0+2+0+0+1+0+0 -> 3 | K31: =+L31+0.5*M31 -> 47.03 | L31: 40.03 | M31: =1+1+1+1+0+0+0+0+10 -> 14 | N31: =+O31+0.5*P31 -> 0.00 | Q31: =+R31+(0.5*S31) -> 0.00 | T31: =+U31+0.5*V31 -> 0.00 | W31: =+X31+(0.5*Y31) -> 0.00 | Z31: =+(AA31+AB31+AC31)+0.5*AD31 -> 0.00 | AE31: =+AF31+0.5*AG31 -> 0.00
A32: ESP | C32: ESP | D32: ESP | E32: ESP | H32: ESP | K32: ESP | N32: ESP | Q32: ESP | T32: ESP | W32: ESP | Z32: ESP | AE32: ESP
C33: ESP
A34: 21 | B34: 5 | C34: 1 | D34: Edwards, Lance | E34: ESP-EX | F34: =+H34+K34+N34+Q34+T34+W34+Z34+AE34 -> 161.35 | G34: =+J34+M34+P34+S34+V34+Y34+AD34+AG34 -> 46 | H34: =+I34+0.5*J34 -> 19.08 | I34: 15.08 | J34: =1+1+6 -> 8 | K34: =+L34+0.5*M34 -> 21.38 | L34: 20.88 | M34: =1+0+0+0+0+0+0+0 -> 1 | N34: =+O34+0.5*P34 -> 18.89 | O34: 16.39 | P34: =1+3+1 -> 5 | Q34: =+R34+(0.5*S34) -> 23.94 | R34: 18.94 | S34: =5+1+2+1+1 -> 10 | T34: =+U34+0.5*V34 -> 26.22 | U34: 21.72 | V34: =1+1+2+2+1+2 -> 9 | W34: =+X34+(0.5*Y34) -> 13.98 | X34: 13.98 | Y34: 0 | Z34: =+(AA34+AB34+AC34)+0.5*AD34 -> 12.14 | AA34: 2.89 | AB34: 3.45 | AC34: 3.30 | AD34: =2+3 -> 5 | AE34: =+AF34+0.5*AG34 -> 25.72 | AF34: 21.72 | AG34: =1+3+4 -> 8
A35: 48 | B35: S9 | C35: 1 | D35: Outzen, Craig | E35: ESP-SS | F35: =+H35+K35+N35+Q35+T35+W35+Z35+AE35 -> 168.18 | G35: =+J35+M35+P35+S35+V35+Y35+AD35+AG35 -> 69 | H35: =+I35+0.5*J35 -> 20.53 | I35: 20.03 | J35: 1 | K35: =+L35+0.5*M35 -> 23.95 | L35: 19.95 | M35: =1+1+1+3+1+1 -> 8 | N35: =+O35+0.5*P35 -> 19.59 | O35: 16.09 | P35: =2+5 -> 7 | Q35: =+R35+(0.5*S35) -> 27.37 | R35: 17.87 | S35: =6+1+4+4+2+1+1 -> 19 | T35: =+U35+0.5*V35 -> 26.73 | U35: 21.23 | V35: =1+1+1+1+1+5+1 -> 11 | W35: =+X35+(0.5*Y35) -> 14.34 | X35: 13.84 | Y35: 1 | Z35: =+(AA35+AB35+AC35)+0.5*AD35 -> 17.10 | AA35: 4.20 | AB35: 3.57 | AC35: 2.83 | AD35: =5+0+2+6 -> 13 | AE35: =+AF35+0.5*AG35 -> 18.57 | AF35: 14.07 | AG35: =0+1+0+5+0+3 -> 9
A36: 79 | B36: S9 | C36: 2 | D36: Zaccardi, Pat | E36: ESP-SS | F36: =+H36+K36+N36+Q36+T36+W36+Z36+AE36 -> 178.82 | G36: =+J36+M36+P36+S36+V36+Y36+AD36+AG36 -> 39 | H36: =+I36+0.5*J36 -> 20.67 | I36: 20.17 | J36: 1 | K36: =+L36+0.5*M36 -> 28.85 | L36: 24.85 | M36: =1+2+2+3 -> 8 | N36: =+O36+0.5*P36 -> 23.01 | O36: 19.01 | P36: =5+2+1 -> 8 | Q36: =+R36+(0.5*S36) -> 24.13 | R36: 23.63 | S36: 1 | T36: =+U36+0.5*V36 -> 23.77 | U36: 21.77 | V36: =2+1+1 -> 4 | W36: =+X36+(0.5*Y36) -> 18.42 | X36: 16.92 | Y36: =1+2 -> 3 | Z36: =+(AA36+AB36+AC36)+0.5*AD36 -> 16.90 | AA36: 4.43 | AB36: 4.86 | AC36: 3.61 | AD36: =3+2+3 -> 8 | AE36: =+AF36+0.5*AG36 -> 23.07 | AF36: 20.07 | AG36: =1+0+5+0+0+0 -> 6
A37: 36 | B37: S9 | C37: 3 | D37: Knapp, Chris | E37: ESP-SS | F37: =+H37+K37+N37+Q37+T37+W37+Z37+AE37 -> 199.67 | G37: =+J37+M37+P37+S37+V37+Y37+AD37+AG37 -> 61 | H37: =+I37+0.5*J37 -> 26.84 | I37: 25.34 | J37: =1+1+1 -> 3 | K37: =+L37+0.5*M37 -> 32.24 | L37: 24.74 | M37: =1+5+1+2+6 -> 15 | N37: =+O37+0.5*P37 -> 21.33 | O37: 17.33 | P37: =3+1+1+2+1 -> 8 | Q37: =+R37+(0.5*S37) -> 24.97 | R37: 23.97 | S37: =0+0+0+2+0+0+0+0 -> 2 | T37: =+U37+0.5*V37 -> 28.73 | U37: 24.23 | V37: =3+1+2+2+1 -> 9 | W37: =+X37+(0.5*Y37) -> 16.23 | X37: 15.73 | Y37: 1 | Z37: =+(AA37+AB37+AC37)+0.5*AD37 -> 21.46 | AA37: 4.45 | AB37: 3.92 | AC37: 4.09 | AD37: =11+1+6 -> 18 | AE37: =+AF37+0.5*AG37 -> 27.87 | AF37: 25.37 | AG37: =1+1+3 -> 5
A38: 78 | B38: S9 | C38: 1 | D38: Zaccardi, Juke | E38: ESP-MM | F38: =+H38+K38+N38+Q38+T38+W38+Z38+AE38 -> 202.17 | G38: =+J38+M38+P38+S38+V38+Y38+AD38+AG38 -> 132 | H38: =+I38+0.5*J38 -> 26.05 | I38: 18.55 | J38: =1+1+6+1+5+1 -> 15 | K38: =+L38+0.5*M38 -> 27.51 | L38: 18.01 | M38: =3+2+1+4+6+1+1+1 -> 19 | N38: =+O38+0.5*P38 -> 20.09 | O38: 14.09 | P38: =1+4+6+1 -> 12 | Q38: =+R38+(0.5*S38) -> 22.00 | R38: 18.50 | S38: =1+2+0+2+0+0+1+1 -> 7 | T38: =+U38+0.5*V38 -> 31.62 | U38: 19.12 | V38: =8+1+1+1+1+1+2+10 -> 25 | W38: =+X38+(0.5*Y38) -> 18.58 | X38: 15.08 | Y38: =1+6 -> 7 | Z38: =+(AA38+AB38+AC38)+0.5*AD38 -> 30.86 | AA38: 8.78 | AB38: 4.36 | AC38: 3.72 | AD38: =12+1+9+6 -> 28 | AE38: =+AF38+0.5*AG38 -> 25.46 | AF38: 15.96 | AG38: =0+7+5+2+0+5 -> 19
A39: 16 | B39: S9 | C39: 4 | D39: Collins, Ken | E39: ESP-SS | F39: =+H39+K39+N39+Q39+T39+W39+Z39+AE39 -> 218.90 | G39: =+J39+M39+P39+S39+V39+Y39+AD39+AG39 -> 73 | H39: =+I39+0.5*J39 -> 27.87 | I39: 27.37 | J39: 1 | K39: =+L39+0.5*M39 -> 35.33 | L39: 26.83 | M39: =1+2+3+1+10 -> 17 | N39: =+O39+0.5*P39 -> 22.77 | O39: 20.27 | P39: =4+1 -> 5 | Q39: =+R39+(0.5*S39) -> 34.07 | R39: 25.57 | S39: =2+4+1+6+2+1+0+1 -> 17 | T39: =+U39+0.5*V39 -> 32.35 | U39: 27.85 | V39: =1+4+2+1+1 -> 9 | W39: =+X39+(0.5*Y39) -> 20.03 | X39: 17.03 | Y39: 6 | Z39: =+(AA39+AB39+AC39)+0.5*AD39 -> 18.19 | AA39: 5.02 | AB39: 4.32 | AC39: 3.85 | AD39: =1+2+7 -> 10 | AE39: =+AF39+0.5*AG39 -> 28.29 | AF39: 24.29 | AG39: =1+3+3+1 -> 8
A40: 80 | B40: 3 | C40: 2 | D40: Stilwell, Mike | E40: ESP-EX | F40: =+H40+K40+N40+Q40+T40+W40+Z40+AE40 -> 229.65 | G40: =+J40+M40+P40+S40+V40+Y40+AD40+AG40 -> 119 | H40: =+I40+0.5*J40 -> 29.12 | I40: 27.62 | J40: =2+1 -> 3 | K40: =+L40+0.5*M40 -> 28.48 | L40: 25.98 | M40: =4+1 -> 5 | N40: =+O40+0.5*P40 -> 20.09 | O40: 18.09 | P40: =1+1+2 -> 4 | Q40: =+R40+(0.5*S40) -> 27.64 | R40: 23.64 | S40: =2+2+1+1+1+1 -> 8 | T40: =+U40+0.5*V40 -> 33.73 | U40: 26.23 | V40: =1+1+4+2+2+4+1 -> 15 | W40: =+X40+(0.5*Y40) -> 25.52 | X40: 16.02 | Y40: =2+1+1+5+10 -> 19 | Z40: =+(AA40+AB40+AC40)+0.5*AD40 -> 16.54 | AA40: 4.85 | AB40: 4.14 | AC40: 3.55 | AD40: =4+3+1 -> 8 | AE40: =+AF40+0.5*AG40 -> 48.53 | AF40: 20.03 | AG40: =10+11+7+15+2+2+10 -> 57
A41: 55 | B41: S8 | C41: 2 | D41: Redford, Steve | E41: ESP-MM | F41: =+H41+K41+N41+Q41+T41+W41+Z41+AE41 -> 238.61 | G41: =+J41+M41+P41+S41+V41+Y41+AD41+AG41 -> 72 | H41: =+I41+0.5*J41 -> 42.58 | I41: 38.08 | J41: =1+1+0+0+5+1+1+0+0 -> 9 | K41: =+L41+0.5*M41 -> 34.49 | L41: 29.99 | M41: =1+3+3+1+1 -> 9 | N41: =+O41+0.5*P41 -> 27.86 | O41: 24.36 | P41: =2+3+1+1 -> 7 | Q41: =+R41+(0.5*S41) -> 29.14 | R41: 22.64 | S41: =2+0+2+1+0+1+1+6 -> 13 | T41: =+U41+0.5*V41 -> 34.11 | U41: 29.61 | V41: =2+2+2+1+2 -> 9 | W41: =+X41+(0.5*Y41) -> 21.56 | X41: 20.06 | Y41: =1+2 -> 3 | Z41: =+(AA41+AB41+AC41)+0.5*AD41 -> 19.09 | AA41: 4.29 | AB41: 4.14 | AC41: 5.16 | AD41: =1+1+3+6 -> 11 | AE41: =+AF41+0.5*AG41 -> 29.78 | AF41: 24.28 | AG41: =2+2+5+1+1 -> 11
A42: 52 | B42: S7 | C42: 3 | D42: Redford, Kent | E42: ESP-MM | F42: =+H42+K42+N42+Q42+T42+W42+Z42+AE42 -> 245.09 | G42: =+J42+M42+P42+S42+V42+Y42+AD42+AG42 -> 103 | H42: =+I42+0.5*J42 -> 36.22 | I42: 31.72 | J42: =1+0+0+0+1+1+1+0+5 -> 9 | K42: =+L42+0.5*M42 -> 32.14 | L42: 26.64 | M42: =3+1+1+1+2+2+1 -> 11 | N42: =+O42+0.5*P42 -> 29.13 | O42: 21.13 | P42: =3+6+4+3 -> 16 | Q42: =+R42+(0.5*S42) -> 31.27 | R42: 25.77 | S42: =2+0+2+4+1+0+1+1 -> 11 | T42: =+U42+0.5*V42 -> 38.68 | U42: 32.68 | V42: =3+4+2+2+1 -> 12 | W42: =+X42+(0.5*Y42) -> 22.00 | X42: 20.00 | Y42: =1+2+1 -> 4 | Z42: =+(AA42+AB42+AC42)+0.5*AD42 -> 18.17 | AA42: 5.05 | AB42: 3.85 | AC42: 2.77 | AD42: =8+1+4 -> 13 | AE42: =+AF42+0.5*AG42 -> 37.48 | AF42: 23.98 | AG42: =7+5+7+7+1 -> 27
A43: 50 | B43: 7 | C43: 5 | D43: Parker, Patrick | E43: ESP-SS | F43: =+H43+K43+N43+Q43+T43+W43+Z43+AE43 -> 249.89 | G43: =+J43+M43+P43+S43+V43+Y43+AD43+AG43 -> 56 | H43: =+I43+0.5*J43 -> 41.42 | I43: 41.42 | J43: 0 | K43: =+L43+0.5*M43 -> 38.52 | L43: 34.02 | M43: =2+2+1+1+1+1+1 -> 9 | N43: =+O43+0.5*P43 -> 24.36 | O43: 23.36 | P43: =0+1+0+0+0+1 -> 2 | Q43: =+R43+(0.5*S43) -> 32.71 | R43: 29.21 | S43: =1+1+4+1 -> 7 | T43: =+U43+0.5*V43 -> 39.90 | U43: 36.40 | V43: =1+4+1+1 -> 7 | W43: =+X43+(0.5*Y43) -> 19.76 | X43: 19.76 | Y43: 0 | Z43: =+(AA43+AB43+AC43)+0.5*AD43 -> 19.05 | AA43: 4.52 | AB43: 5.42 | AC43: 4.61 | AD43: =1+3+5 -> 9 | AE43: =+AF43+0.5*AG43 -> 34.17 | AF43: 23.17 | AG43: =7+6+3+1+5 -> 22
A44: 66 | B44: S2 | C44: 4 | D44: Stone, Scott | E44: ESP-MM | F44: =+H44+K44+N44+Q44+T44+W44+Z44+AE44 -> 251.72 | G44: =+J44+M44+P44+S44+V44+Y44+AD44+AG44 -> 108 | H44: =+I44+0.5*J44 -> 30.46 | I44: 29.96 | J44: =0+0+0+0+0+0+0+0+1 -> 1 | K44: =+L44+0.5*M44 -> 33.15 | L44: 30.15 | M44: =1+0+1+1+0+2+0+1 -> 6 | N44: =+O44+0.5*P44 -> 33.70 | O44: 18.70 | P44: =5+5+1+7+10+2 -> 30 | Q44: =+R44+(0.5*S44) -> 35.51 | R44: 29.51 | S44: =6+2+3+1 -> 12 | T44: =+U44+0.5*V44 -> 40.59 | U44: 24.09 | V44: =2+1+2+2+1+5+10+10 -> 33 | W44: =+X44+(0.5*Y44) -> 27.97 | X44: 26.97 | Y44: =1+1 -> 2 | Z44: =+(AA44+AB44+AC44)+0.5*AD44 -> 17.64 | AA44: 3.38 | AB44: 4.97 | AC44: 4.79 | AD44: =5+1+3 -> 9 | AE44: =+AF44+0.5*AG44 -> 32.70 | AF44: 25.20 | AG44: =5+2+2+6+0+0 -> 15
A45: 65 | B45: 3 | C45: 6 | D45: Stilwell, Ron | E45: ESP-SS | F45: =+H45+K45+N45+Q45+T45+W45+Z45+AE45 -> 253.28 | G45: =+J45+M45+P45+S45+V45+Y45+AD45+AG45 -> 112 | H45: =+I45+0.5*J45 -> 33.82 | I45: 33.32 | J45: 1 | K45: =+L45+0.5*M45 -> 35.66 | L45: 33.66 | M45: =1+1+1+1 -> 4 | N45: =+O45+0.5*P45 -> 29.45 | O45: 22.95 | P45: =1+1+1+10 -> 13 | Q45: =+R45+(0.5*S45) -> 36.32 | R45: 26.82 | S45: =1+3+1+6+2+6 -> 19 | T45: =+U45+0.5*V45 -> 33.68 | U45: 26.68 | V45: =1+1+3+1+2+0+2+0+4 -> 14 | W45: =+X45+(0.5*Y45) -> 29.89 | X45: 15.89 | Y45: =2+1+5+10+10 -> 28 | Z45: =+(AA45+AB45+AC45)+0.5*AD45 -> 25.18 | AA45: 4.72 | AB45: 3.99 | AC45: 4.47 | AD45: =5+5+8+6 -> 24 | AE45: =+AF45+0.5*AG45 -> 29.28 | AF45: 24.78 | AG45: =0+5+1+0+2+1 -> 9
A46: 32.8 | B46: 4 | C46: 7 | D46: Badger, Jeff | E46: ESP-SS | F46: =+H46+K46+N46+Q46+T46+W46+Z46+AE46 -> 269.47 | G46: =+J46+M46+P46+S46+V46+Y46+AD46+AG46 -> 75 | H46: =+I46+0.5*J46 -> 32.16 | I46: 31.66 | J46: =0+0+0+1+0+0+0+0+0 -> 1 | K46: =+L46+0.5*M46 -> 42.23 | L46: 35.73 | M46: =1+0+1+0+1+3+0+1+6 -> 13 | N46: =+O46+0.5*P46 -> 32.13 | O46: 25.63 | P46: =6+7 -> 13 | Q46: =+R46+(0.5*S46) -> 51.43 | R46: 33.93 | S46: =2+10+4+5+1+1+2+10 -> 35 | T46: =+U46+0.5*V46 -> 35.30 | U46: 32.80 | V46: =1+1+1+1+1 -> 5 | W46: =+X46+(0.5*Y46) -> 24.77 | X46: 24.77 | Y46: 0 | Z46: =+(AA46+AB46+AC46)+0.5*AD46 -> 18.20 | AA46: 4.80 | AB46: 6.29 | AC46: 5.61 | AD46: 3 | AE46: =+AF46+0.5*AG46 -> 33.25 | AF46: 30.75 | AG46: =1+2+2 -> 5
A47: 4.01 | B47: S7 | C47: 5 | D47: Hill, Randy | E47: ESP-MM | F47: =+H47+K47+N47+Q47+T47+W47+Z47+AE47 -> 275.50 | G47: =+J47+M47+P47+S47+V47+Y47+AD47+AG47 -> 156 | H47: =+I47+0.5*J47 -> 35.57 | I47: 32.07 | J47: =0+0+0+0+1+0+1+0+5 -> 7 | K47: =+L47+0.5*M47 -> 37.31 | L47: 27.81 | M47: =4+4+2+1+1+1+6 -> 19 | N47: =+O47+0.5*P47 -> 31.47 | O47: 22.97 | P47: =3+10+1+3 -> 17 | Q47: =+R47+(0.5*S47) -> 40.99 | R47: 29.49 | S47: =2+1+0+2+6+1+1+0+10 -> 23 | T47: =+U47+0.5*V47 -> 42.91 | U47: 28.41 | V47: =1+6+5+2+5+10 -> 29 | W47: =+X47+(0.5*Y47) -> 33.63 | X47: 25.13 | Y47: =1+1+5+10 -> 17 | Z47: =+(AA47+AB47+AC47)+0.5*AD47 -> 24.01 | AA47: 4.39 | AB47: 3.11 | AC47: 4.01 | AD47: =11+6+8 -> 25 | AE47: =+AF47+0.5*AG47 -> 29.61 | AF47: 20.11 | AG47: =6+4+2+6+1 -> 19
A48: 1 | B48: 4 | C48: 6 | D48: Albert, Jim | E48: ESP-MM | F48: =+H48+K48+N48+Q48+T48+W48+Z48+AE48 -> 303.91 | G48: =+J48+M48+P48+S48+V48+Y48+AD48+AG48 -> 114 | H48: =+I48+0.5*J48 -> 48.15 | I48: 37.65 | J48: =0+0+0+0+0+1+0+0+10+10 -> 21 | K48: =+L48+0.5*M48 -> 38.03 | L48: 36.53 | M48: =1+1+0+0+0+0+0+1 -> 3 | N48: =+O48+0.5*P48 -> 29.47 | O48: 23.47 | P48: =2+7+2+1 -> 12 | Q48: =+R48+(0.5*S48) -> 45.07 | R48: 37.07 | S48: =3+2+1+3+1+6 -> 16 | T48: =+U48+0.5*V48 -> 44.73 | U48: 39.23 | V48: =2+2+1+1+5 -> 11 | W48: =+X48+(0.5*Y48) -> 24.94 | X48: 24.44 | Y48: 1 | Z48: =+(AA48+AB48+AC48)+0.5*AD48 -> 31.71 | AA48: 6.03 | AB48: 6.18 | AC48: 6.50 | AD48: =8+4+14 -> 26 | AE48: =+AF48+0.5*AG48 -> 41.81 | AF48: 29.81 | AG48: =2+5+6+5+1+5 -> 24
A49: 9 | B49: S9 | C49: 7 | D49: Bolinder, Jim | E49: ESP-MM | F49: =+H49+K49+N49+Q49+T49+W49+Z49+AE49 -> 321.09 | G49: =+J49+M49+P49+S49+V49+Y49+AD49+AG49 -> 137 | H49: =+I49+0.5*J49 -> 47.88 | I49: 47.88 | J49: 0 | K49: =+L49+0.5*M49 -> 46.61 | L49: 38.61 | M49: =4+2+2+2+4+1+1 -> 16 | N49: =+O49+0.5*P49 -> 36.87 | O49: 29.37 | P49: =1+9+4+1 -> 15 | Q49: =+R49+(0.5*S49) -> 38.35 | R49: 28.85 | S49: =0+5+6+4+1+1+2+0 -> 19 | T49: =+U49+0.5*V49 -> 50.00 | U49: 41.50 | V49: =5+1+4+3+1+3 -> 17 | W49: =+X49+(0.5*Y49) -> 32.08 | X49: 26.08 | Y49: =1+1+10 -> 12 | Z49: =+(AA49+AB49+AC49)+0.5*AD49 -> 27.91 | AA49: 4.02 | AB49: 4.82 | AC49: 4.07 | AD49: =18+7+5 -> 30 | AE49: =+AF49+0.5*AG49 -> 41.39 | AF49: 27.39 | AG49: =1+10+11+5+1 -> 28
A50: 35 | B50: S4 | C50: 8 | D50: Kirkham, Glade | E50: ESP-MM | F50: =+H50+K50+N50+Q50+T50+W50+Z50+AE50 -> 357.14 | G50: =+J50+M50+P50+S50+V50+Y50+AD50+AG50 -> 149 | H50: =+I50+0.5*J50 -> 54.68 | I50: 32.68 | J50: =0+0+0+10+10+0+1+1+2+20 -> 44 | K50: =+L50+0.5*M50 -> 57.37 | L50: 40.37 | M50: =3+1+2+10+4+1+2+1+10 -> 34 | N50: =+O50+0.5*P50 -> 55.27 | O50: 44.77 | P50: =6+10+5 -> 21 | Q50: =+R50+(0.5*S50) -> 49.54 | R50: 39.04 | S50: =4+1+1+10+3+0+1+1 -> 21 | T50: =+U50+0.5*V50 -> 45.32 | U50: 41.82 | V50: =1+1+1+1+1+1+1 -> 7 | W50: =+X50+(0.5*Y50) -> 27.49 | X50: 26.99 | Y50: 1 | Z50: =+(AA50+AB50+AC50)+0.5*AD50 -> 27.02 | AA50: 7.82 | AB50: 6.99 | AC50: 4.21 | AD50: =11+1+4 -> 16 | AE50: =+AF50+0.5*AG50 -> 40.45 | AF50: 37.95 | AG50: =0+1+0+1+1+2 -> 5
C51: 1 | D51: Lorenz, David | E51: ESP-NV | F51: =+H51+K51+N51+Q51+T51+W51+Z51+AE51 -> 410.64 | G51: =+J51+M51+P51+S51+V51+Y51+AD51+AG51 -> 93 | H51: =+I51+0.5*J51 -> 56.90 | I51: 51.90 | J51: 10 | K51: =+L51+0.5*M51 -> 64.28 | L51: 63.78 | M51: 1 | N51: =+O51+0.5*P51 -> 56.78 | O51: 40.28 | P51: =11+11+0+0+1+0+10 -> 33 | Q51: =+R51+(0.5*S51) -> 43.73 | R51: 40.23 | S51: =3+1+1+1+1 -> 7 | T51: =+U51+0.5*V51 -> 52.00 | U51: 50.50 | V51: =2+1 -> 3 | W51: =+X51+(0.5*Y51) -> 51.15 | X51: 42.15 | Y51: =1+1+6+10 -> 18 | Z51: =+(AA51+AB51+AC51)+0.5*AD51 -> 22.18 | AA51: 4.68 | AB51: 5.28 | AC51: 6.22 | AD51: =8+1+3 -> 12 | AE51: =+AF51+0.5*AG51 -> 63.62 | AF51: 59.12 | AG51: =3+5+1 -> 9
C53: Legend/Notes:
C54: X | D54: = Shooters who were eligible to receive trophies for their specific Division/Classification. (IDPA ratio is 1 trophy per 3 Div/Class shooters.)
C55: Xx Xx | D55: = Shooters who acted as SOs or were part of the Match Staff.
C56: DNF | D56: = For some reason, the shooter Did Not Finish the match.
C57: XX | D57: = Points Down value included some sort of penalty (Procedural, Hit On Non-threat, Failure to Neutralize, etc.)
C58: XXX.XX | D58: = Because these shooters took 1st place in their specific Div/Class, and there were more than 10 shooters competing in their classification, they were automatically advanced to the next highest classification.
D60: Scores were verified on 9/27/04 and, though minor changes were made, no placings were effected.