B1: Utah State IDPA Match - 2004 Results | C1: 2004 Utah State IDPA Championship Match
B2: Held on September 25, 2004 | H2: (Sorted by DIV/CLASS) | N2: 3 | Q2: 4 | T2: 5 | W2: 6 | Z2: 7 | AE2: 8
A3: Shooter # | B3: Squad | C3: Place | D3: Name (Last, First) | E3: Div/Class | F3: Shoot Total | G3: Total PD | H3: Stage 1 | I3: String 1 | J3: Points Down | K3: Stage 2 | L3: String 1 | M3: Points Down | N3: Stage 3 | O3: String 1 | P3: Points Down | Q3: Stage 4 | R3: String 1 | S3: Points Down | T3: Stage 5 | U3: String 1 | V3: Points Down | W3: Stage 6 | X3: String 1 | Y3: Points Down | Z3: Stage 7 | AA3: String 1 | AB3: String 2 | AC3: String 3 | AD3: Points Down | AE3: Stage 8 | AF3: String 1 | AG3: Points Down
A4: CDP | C4: CDP | D4: CDP | E4: CDP | H4: CDP | K4: CDP | N4: CDP | Q4: CDP | T4: CDP | W4: CDP | Z4: CDP | AE4: CDP
C5: CDP-EX
A6: 40 | B6: 5 | C6: 1 | D6: Latham, Corey | E6: CDP-EX | F6: =+H6+K6+N6+Q6+T6+W6+Z6+AE6 -> 188.23 | G6: =+J6+M6+P6+S6+V6+Y6+AD6+AG6 -> 48 | H6: =+I6+0.5*J6 -> 25.01 | I6: 24.51 | J6: 1 | K6: =+L6+0.5*M6 -> 25.08 | L6: 22.08 | M6: =0+1+0+1+1+2+1+0 -> 6 | N6: =+O6+0.5*P6 -> 28.31 | O6: 18.31 | P6: =8+6+1+5 -> 20 | Q6: =+R6+(0.5*S6) -> 23.28 | R6: 22.28 | S6: =1+1 -> 2 | T6: =+U6+0.5*V6 -> 29.89 | U6: 27.89 | V6: =1+1+1+1 -> 4 | W6: =+X6+(0.5*Y6) -> 16.22 | X6: 15.22 | Y6: =1+1 -> 2 | Z6: =+(AA6+AB6+AC6)+0.5*AD6 -> 12.09 | AA6: 3.31 | AB6: 3.57 | AC6: 3.21 | AD6: =3+1 -> 4 | AE6: =+AF6+0.5*AG6 -> 28.35 | AF6: 23.85 | AG6: =2+5+1+1 -> 9
A7: 72 | B7: 5 | C7: 2 | D7: Ward, Dan | E7: CDP-EX | F7: =+H7+K7+N7+Q7+T7+W7+Z7+AE7 -> 188.48 | G7: =+J7+M7+P7+S7+V7+Y7+AD7+AG7 -> 46 | H7: =+I7+0.5*J7 -> 26.19 | I7: 24.19 | J7: =1+0+0+1+0+2+0+0+0 -> 4 | K7: =+L7+0.5*M7 -> 25.80 | L7: 24.30 | M7: =1+0+0+1+0+0+1+0 -> 3 | N7: =+O7+0.5*P7 -> 20.77 | O7: 15.77 | P7: =6+2+1+1 -> 10 | Q7: =+R7+(0.5*S7) -> 22.52 | R7: 20.52 | S7: =1+1+2 -> 4 | T7: =+U7+0.5*V7 -> 27.43 | U7: 23.43 | V7: =1+1+2+2+1+1 -> 8 | W7: =+X7+(0.5*Y7) -> 18.69 | X7: 18.69 | Y7: 0 | Z7: =+(AA7+AB7+AC7)+0.5*AD7 -> 22.08 | AA7: 5.83 | AB7: 5.26 | AC7: 4.99 | AD7: =6+2+4 -> 12 | AE7: =+AF7+0.5*AG7 -> 25.00 | AF7: 22.50 | AG7: 5
A8: 26 | B8: 5 | C8: 3 | D8: Griffiths, Todd | E8: CDP-EX | F8: =+H8+K8+N8+Q8+T8+W8+Z8+AE8 -> 190.45 | G8: =+J8+M8+P8+S8+V8+Y8+AD8+AG8 -> 63 | H8: =+I8+0.5*J8 -> 26.06 | I8: 25.06 | J8: =1+1 -> 2 | K8: =+L8+0.5*M8 -> 24.46 | L8: 22.46 | M8: =0+0+0+2+0+0+1+1 -> 4 | N8: =+O8+0.5*P8 -> 23.31 | O8: 19.81 | P8: =1+2+1+3 -> 7 | Q8: =+R8+(0.5*S8) -> 21.74 | R8: 16.74 | S8: =1+1+1+1+6 -> 10 | T8: =+U8+0.5*V8 -> 32.66 | U8: 24.16 | V8: =1+6+2+3+5 -> 17 | W8: =+X8+(0.5*Y8) -> 19.90 | X8: 14.90 | Y8: =4+6 -> 10 | Z8: =+(AA8+AB8+AC8)+0.5*AD8 -> 15.77 | AA8: 4.00 | AB8: 3.87 | AC8: 3.90 | AD8: =3+4+1 -> 8 | AE8: =+AF8+0.5*AG8 -> 26.55 | AF8: 24.05 | AG8: =1+3+1 -> 5
A9: 42 | B9: S9 | C9: 4 | D9: Lowe, John | E9: CDP-EX | F9: =+H9+K9+N9+Q9+T9+W9+Z9+AE9 -> 203.02 | G9: =+J9+M9+P9+S9+V9+Y9+AD9+AG9 -> 39 | H9: =+I9+0.5*J9 -> 31.41 | I9: 30.91 | J9: 1 | K9: =+L9+0.5*M9 -> 31.08 | L9: 28.58 | M9: =1+1+2+1 -> 5 | N9: =+O9+0.5*P9 -> 22.70 | O9: 20.70 | P9: =1+1+1+1 -> 4 | Q9: =+R9+(0.5*S9) -> 25.85 | R9: 22.35 | S9: =1+1+4+1 -> 7 | T9: =+U9+0.5*V9 -> 27.98 | U9: 25.98 | V9: =1+1+1+1 -> 4 | W9: =+X9+(0.5*Y9) -> 16.49 | X9: 15.99 | Y9: 1 | Z9: =+(AA9+AB9+AC9)+0.5*AD9 -> 18.46 | AA9: 4.97 | AB9: 4.90 | AC9: 4.09 | AD9: =6+3 -> 9 | AE9: =+AF9+0.5*AG9 -> 29.05 | AF9: 25.05 | AG9: =1+1+0+4+2+0 -> 8
A10: 27 | B10: S1 | C10: 5 | D10: Haslem, Alan | E10: CDP-EX | F10: =+H10+K10+N10+Q10+T10+W10+Z10+AE10 -> 234.36 | G10: =+J10+M10+P10+S10+V10+Y10+AD10+AG10 -> 51 | H10: =+I10+0.5*J10 -> 32.03 | I10: 32.03 | J10: =0+0+0+0+0+0+0+0+0 -> 0 | K10: =+L10+0.5*M10 -> 38.98 | L10: 35.48 | M10: =1+2+1+1+1+1 -> 7 | N10: =+O10+0.5*P10 -> 31.03 | O10: 25.03 | P10: =4+8 -> 12 | Q10: =+R10+(0.5*S10) -> 25.56 | R10: 24.06 | S10: =1+1+1 -> 3 | T10: =+U10+0.5*V10 -> 37.90 | U10: 34.40 | V10: =1+1+5 -> 7 | W10: =+X10+(0.5*Y10) -> 18.40 | X10: 17.90 | Y10: 1 | Z10: =+(AA10+AB10+AC10)+0.5*AD10 -> 19.93 | AA10: 3.93 | AB10: 3.84 | AC10: 3.66 | AD10: =5+2+4+6 -> 17 | AE10: =+AF10+0.5*AG10 -> 30.53 | AF10: 28.53 | AG10: =0+2+2+0+0+0 -> 4
A11: 28 | B11: S1 | C11: 6 | D11: Haslem, Kent | E11: CDP-EX | F11: =+H11+K11+N11+Q11+T11+W11+Z11+AE11 -> 244.31 | G11: =+J11+M11+P11+S11+V11+Y11+AD11+AG11 -> 81 | H11: =+I11+0.5*J11 -> 39.83 | I11: 39.33 | J11: =0+0+0+0+0+0+0+0+1 -> 1 | K11: =+L11+0.5*M11 -> 30.48 | L11: 24.98 | M11: =1+1+2+1+6 -> 11 | N11: =+O11+0.5*P11 -> 37.43 | O11: 23.93 | P11: =5+7+5+10 -> 27 | Q11: =+R11+(0.5*S11) -> 29.12 | R11: 23.62 | S11: =2+4+2+2+1 -> 11 | T11: =+U11+0.5*V11 -> 35.70 | U11: 29.70 | V11: =3+1+1+5+1+1 -> 12 | W11: =+X11+(0.5*Y11) -> 24.15 | X11: 22.15 | Y11: =3+1 -> 4 | Z11: =+(AA11+AB11+AC11)+0.5*AD11 -> 15.86 | AA11: 3.85 | AB11: 4.03 | AC11: 3.48 | AD11: =3+5+1 -> 9 | AE11: =+AF11+0.5*AG11 -> 31.74 | AF11: 28.74 | AG11: =0+0+2+0+0+4 -> 6
A12: 30 | B12: 3 | C12: 7 | D12: Hess, Matthew | E12: CDP-EX | F12: =+H12+K12+N12+Q12+T12+W12+Z12+AE12 -> 247.65 | G12: =+J12+M12+P12+S12+V12+Y12+AD12+AG12 -> 113 | H12: =+I12+0.5*J12 -> 28.26 | I12: 25.76 | J12: =1+1+1+1+1 -> 5 | K12: =+L12+0.5*M12 -> 48.61 | L12: 39.61 | M12: =4+2+1+1+10 -> 18 | N12: =+O12+0.5*P12 -> 24.99 | O12: 18.99 | P12: =6+4+1+1 -> 12 | Q12: =+R12+(0.5*S12) -> 23.60 | R12: 19.10 | S12: =1+1+1+3+1+1+1 -> 9 | T12: =+U12+0.5*V12 -> 50.52 | U12: 28.52 | V12: =0+1+1+0+1+10+10+0+1+20 -> 44 | W12: =+X12+(0.5*Y12) -> 17.95 | X12: 14.95 | Y12: 6 | Z12: =+(AA12+AB12+AC12)+0.5*AD12 -> 30.92 | AA12: 4.23 | AB12: 3.76 | AC12: 15.43 | AD12: =1+0+2+12 -> 15 | AE12: =+AF12+0.5*AG12 -> 22.80 | AF12: 20.80 | AG12: =0+0+0+2+2+0 -> 4
A13: 67 | B13: 6 | C13: 8 | D13: Tekmitchov, George | E13: CDP-EX | F13: =+H13+K13+N13+Q13+T13+W13+Z13+AE13 -> 283.41 | G13: =+J13+M13+P13+S13+V13+Y13+AD13+AG13 -> 129 | H13: =+I13+0.5*J13 -> 29.23 | I13: 28.23 | J13: =1+1 -> 2 | K13: =+L13+0.5*M13 -> 45.66 | L13: 31.16 | M13: =0+1+10+0+1+2+0+5+10 -> 29 | N13: =+O13+0.5*P13 -> 28.82 | O13: 20.32 | P13: =6+3+0+0+6+2 -> 17 | Q13: =+R13+(0.5*S13) -> 37.01 | R13: 23.01 | S13: =1+1+10+1+1+4+10 -> 28 | T13: =+U13+0.5*V13 -> 46.33 | U13: 44.33 | V13: =1+2+1 -> 4 | W13: =+X13+(0.5*Y13) -> 40.64 | X13: 26.14 | Y13: 29 | Z13: =+(AA13+AB13+AC13)+0.5*AD13 -> 15.71 | AA13: 4.25 | AB13: 4.42 | AC13: 4.04 | AD13: =3+1+2 -> 6 | AE13: =+AF13+0.5*AG13 -> 40.01 | AF13: 33.01 | AG13: =6+2+3+2+1 -> 14
C14: CDP-SS
B15: 7 | C15: 1 | D15: Ostler, Jeff | E15: CDP-SS | F15: =+H15+K15+N15+Q15+T15+W15+Z15+AE15 -> 229.74 | G15: =+J15+M15+P15+S15+V15+Y15+AD15+AG15 -> 65 | H15: =+I15+0.5*J15 -> 32.64 | I15: 29.14 | J15: =1+6 -> 7 | K15: =+L15+0.5*M15 -> 31.69 | L15: 30.69 | M15: =1+1 -> 2 | N15: =+O15+0.5*P15 -> 26.22 | O15: 22.22 | P15: =5+2+1+0+0+0 -> 8 | Q15: =+R15+(0.5*S15) -> 34.83 | R15: 25.33 | S15: =2+5+6+5+0+1+0+0 -> 19 | T15: =+U15+0.5*V15 -> 31.52 | U15: 30.02 | V15: =1+2 -> 3 | W15: =+X15+(0.5*Y15) -> 16.58 | X15: 16.58 | Y15: 0 | Z15: =+(AA15+AB15+AC15)+0.5*AD15 -> 21.63 | AA15: 4.21 | AB15: 3.81 | AC15: 3.61 | AD15: =13+2+5 -> 20 | AE15: =+AF15+0.5*AG15 -> 34.63 | AF15: 31.63 | AG15: =1+3+1+1 -> 6
A16: 39 | B16: 8 | C16: 2 | D16: Langford, Les | E16: CDP-SS | F16: =+H16+K16+N16+Q16+T16+W16+Z16+AE16 -> 235.31 | G16: =+J16+M16+P16+S16+V16+Y16+AD16+AG16 -> 100 | H16: =+I16+0.5*J16 -> 30.39 | I16: 26.89 | J16: =4+1+2 -> 7 | K16: =+L16+0.5*M16 -> 28.91 | L16: 28.41 | M16: 1 | N16: =+O16+0.5*P16 -> 28.66 | O16: 22.16 | P16: =5+2+5+1 -> 13 | Q16: =+R16+(0.5*S16) -> 26.35 | R16: 20.35 | S16: =0+2+4+5+0+0+1+0 -> 12 | T16: =+U16+0.5*V16 -> 37.84 | U16: 24.84 | V16: =3+1+6+1+6+1+2+1+5 -> 26 | W16: =+X16+(0.5*Y16) -> 27.71 | X16: 19.21 | Y16: =2+5+10 -> 17 | Z16: =+(AA16+AB16+AC16)+0.5*AD16 -> 20.64 | AA16: 4.98 | AB16: 5.47 | AC16: 5.19 | AD16: =3+4+3 -> 10 | AE16: =+AF16+0.5*AG16 -> 34.81 | AF16: 27.81 | AG16: =5+3+1+2+3 -> 14
A17: 17 | B17: S9 | C17: 3 | D17: Correia, Larry | E17: CDP-SS | F17: =+H17+K17+N17+Q17+T17+W17+Z17+AE17 -> 238.77 | G17: =+J17+M17+P17+S17+V17+Y17+AD17+AG17 -> 108 | H17: =+I17+0.5*J17 -> 36.10 | I17: 32.60 | J17: =1+1+4+1 -> 7 | K17: =+L17+0.5*M17 -> 30.11 | L17: 24.61 | M17: =2+2+1+5+1 -> 11 | N17: =+O17+0.5*P17 -> 24.98 | O17: 20.98 | P17: =2+1+3+1+1 -> 8 | Q17: =+R17+(0.5*S17) -> 33.56 | R17: 20.56 | S17: =1+8+4+1+1+1+10 -> 26 | T17: =+U17+0.5*V17 -> 30.59 | U17: 25.59 | V17: =2+2+1+3+1+1 -> 10 | W17: =+X17+(0.5*Y17) -> 31.33 | X17: 27.33 | Y17: =1+1+6 -> 8 | Z17: =+(AA17+AB17+AC17)+0.5*AD17 -> 18.39 | AA17: 4.28 | AB17: 3.54 | AC17: 4.57 | AD17: =6+2+4 -> 12 | AE17: =+AF17+0.5*AG17 -> 33.71 | AF17: 20.71 | AG17: =8+9+3+5+0+1 -> 26
A18: 23 | B18: 8 | C18: 4 | D18: Flores, Oscar | E18: CDP-SS | F18: =+H18+K18+N18+Q18+T18+W18+Z18+AE18 -> 240.40 | G18: =+J18+M18+P18+S18+V18+Y18+AD18+AG18 -> 100 | H18: =+I18+0.5*J18 -> 27.33 | I18: 19.33 | J18: =1+1+2+5+1+4+1+1 -> 16 | K18: =+L18+0.5*M18 -> 37.28 | L18: 30.28 | M18: =2+2+1+1+1+1+6 -> 14 | N18: =+O18+0.5*P18 -> 23.88 | O18: 18.88 | P18: =3+1+1+2+3 -> 10 | Q18: =+R18+(0.5*S18) -> 28.35 | R18: 22.85 | S18: =4+0+2+2+2+1+0+0 -> 11 | T18: =+U18+0.5*V18 -> 41.26 | U18: 38.76 | V18: =1+1+2+1 -> 5 | W18: =+X18+(0.5*Y18) -> 18.52 | X18: 16.02 | Y18: =1+4 -> 5 | Z18: =+(AA18+AB18+AC18)+0.5*AD18 -> 22.82 | AA18: 3.04 | AB18: 2.98 | AC18: 2.80 | AD18: =20+4+4 -> 28 | AE18: =+AF18+0.5*AG18 -> 40.96 | AF18: 35.46 | AG18: =1+5+3+1+1 -> 11
A19: 59 | B19: S9 | C19: 5 | D19: Rodriquez, Mike | E19: CDP-SS | F19: =+H19+K19+N19+Q19+T19+W19+Z19+AE19 -> 243.25 | G19: =+J19+M19+P19+S19+V19+Y19+AD19+AG19 -> 128 | H19: =+I19+0.5*J19 -> 33.61 | I19: 32.11 | J19: =1+1+1 -> 3 | K19: =+L19+0.5*M19 -> 33.64 | L19: 28.14 | M19: =4+1+2+3+1 -> 11 | N19: =+O19+0.5*P19 -> 31.00 | O19: 21.00 | P19: =5+4+2+4+5 -> 20 | Q19: =+R19+(0.5*S19) -> 25.12 | R19: 21.12 | S19: =1+1+1+2+1+1+1 -> 8 | T19: =+U19+0.5*V19 -> 40.47 | U19: 26.47 | V19: =1+1+5+1+2+8+10 -> 28 | W19: =+X19+(0.5*Y19) -> 34.43 | X19: 16.43 | Y19: =5+5+1+5+20 -> 36 | Z19: =+(AA19+AB19+AC19)+0.5*AD19 -> 16.16 | AA19: 3.75 | AB19: 4.59 | AC19: 4.32 | AD19: =4+2+1 -> 7 | AE19: =+AF19+0.5*AG19 -> 28.82 | AF19: 21.32 | AG19: =1+1+1+9+1+2 -> 15
A20: 58 | B20: S6 | C20: 6 | D20: Rimer, Clayton | E20: CDP-SS | F20: =+H20+K20+N20+Q20+T20+W20+Z20+AE20 -> 265.79 | G20: =+J20+M20+P20+S20+V20+Y20+AD20+AG20 -> 74 | H20: =+I20+0.5*J20 -> 33.15 | I20: 33.15 | J20: =0+0+0+0+0+0+0+0+0 -> 0 | K20: =+L20+0.5*M20 -> 40.97 | L20: 33.97 | M20: =1+5+2+6 -> 14 | N20: =+O20+0.5*P20 -> 32.85 | O20: 23.85 | P20: =9+6+1+2 -> 18 | Q20: =+R20+(0.5*S20) -> 29.44 | R20: 27.94 | S20: =2+0+1+0+0+0+0+0 -> 3 | T20: =+U20+0.5*V20 -> 40.57 | U20: 37.57 | V20: =1+2+2+1 -> 6 | W20: =+X20+(0.5*Y20) -> 25.80 | X20: 22.80 | Y20: =5+1 -> 6 | Z20: =+(AA20+AB20+AC20)+0.5*AD20 -> 21.05 | AA20: 5.33 | AB20: 3.79 | AC20: 4.93 | AD20: =6+6+2 -> 14 | AE20: =+AF20+0.5*AG20 -> 41.96 | AF20: 35.46 | AG20: =1+6+6 -> 13
A21: 8 | B21: 8 | C21: 7 | D21: Berry, Robert | E21: CDP-SS | F21: =+H21+K21+N21+Q21+T21+W21+Z21+AE21 -> 276.76 | G21: =+J21+M21+P21+S21+V21+Y21+AD21+AG21 -> 90 | H21: =+I21+0.5*J21 -> 36.60 | I21: 32.60 | J21: =1+5+1+1 -> 8 | K21: =+L21+0.5*M21 -> 42.96 | L21: 39.96 | M21: =2+1+1+2 -> 6 | N21: =+O21+0.5*P21 -> 30.13 | O21: 25.63 | P21: =4+2+3 -> 9 | Q21: =+R21+(0.5*S21) -> 36.90 | R21: 27.40 | S21: =1+5+3+6+0+2+2+0 -> 19 | T21: =+U21+0.5*V21 -> 40.44 | U21: 37.44 | V21: =2+2+1+1 -> 6 | W21: =+X21+(0.5*Y21) -> 28.02 | X21: 19.02 | Y21: =1+1+1+5+10 -> 18 | Z21: =+(AA21+AB21+AC21)+0.5*AD21 -> 25.50 | AA21: 4.83 | AB21: 7.77 | AC21: 3.90 | AD21: =11+5+2 -> 18 | AE21: =+AF21+0.5*AG21 -> 36.21 | AF21: 33.21 | AG21: =1+1+2+2 -> 6
A22: 15 | B22: 8 | C22: 8 | D22: Colby, Bill | E22: CDP-SS | F22: =+H22+K22+N22+Q22+T22+W22+Z22+AE22 -> 282.50 | G22: =+J22+M22+P22+S22+V22+Y22+AD22+AG22 -> 81 | H22: =+I22+0.5*J22 -> 35.18 | I22: 34.68 | J22: 1 | K22: =+L22+0.5*M22 -> 38.21 | L22: 35.21 | M22: =2+1+1+1+1 -> 6 | N22: =+O22+0.5*P22 -> 37.45 | O22: 26.95 | P22: =7+10+1+2+1 -> 21 | Q22: =+R22+(0.5*S22) -> 42.67 | R22: 39.67 | S22: =0+0+1+4+0+1+0+0 -> 6 | T22: =+U22+0.5*V22 -> 54.89 | U22: 45.39 | V22: =1+1+1+1+1+4+10 -> 19 | W22: =+X22+(0.5*Y22) -> 22.85 | X22: 18.85 | Y22: =2+6 -> 8 | Z22: =+(AA22+AB22+AC22)+0.5*AD22 -> 19.77 | AA22: 4.41 | AB22: 4.40 | AC22: 3.96 | AD22: =4+6+4 -> 14 | AE22: =+AF22+0.5*AG22 -> 31.48 | AF22: 28.48 | AG22: =2+2+1+1 -> 6
A23: 13 | B23: S3 | C23: 9 | D23: Brown, Keith | E23: CDP-SS | F23: =+H23+K23+N23+Q23+T23+W23+Z23+AE23 -> 290.80 | G23: =+J23+M23+P23+S23+V23+Y23+AD23+AG23 -> 123 | H23: =+I23+0.5*J23 -> 45.92 | I23: 30.42 | J23: =0+0+0+3+8+0+0+0+0+10+10 -> 31 | K23: =+L23+0.5*M23 -> 47.58 | L23: 33.08 | M23: =3+2+1+0+0+1+2+10+10 -> 29 | N23: =+O23+0.5*P23 -> 38.73 | O23: 12.23 | P23: =6+5+11+15+6+10 -> 53 | Q23: =+R23+(0.5*S23) -> 40.84 | R23: 40.84 | S23: 0 | T23: =+U23+0.5*V23 -> 35.67 | U23: 35.67 | V23: 0 | W23: =+X23+(0.5*Y23) -> 26.03 | X23: 26.03 | Y23: 0 | Z23: =+(AA23+AB23+AC23)+0.5*AD23 -> 20.82 | AA23: 5.29 | AB23: 6.13 | AC23: 8.40 | AD23: =2+0+0 -> 2 | AE23: =+AF23+0.5*AG23 -> 35.21 | AF23: 31.21 | AG23: =0+2+5+1+0 -> 8
A24: 61 | B24: S3 | C24: 10 | D24: Simpson, Harold | E24: CDP-SS | F24: =+H24+K24+N24+Q24+T24+W24+Z24+AE24 -> 298.26 | G24: =+J24+M24+P24+S24+V24+Y24+AD24+AG24 -> 65 | H24: =+I24+0.5*J24 -> 39.42 | I24: 37.92 | J24: =0+0+0+1+0+0+0+1+1 -> 3 | K24: =+L24+0.5*M24 -> 41.96 | L24: 38.96 | M24: =1+0+1+1+2+0+1+0 -> 6 | N24: =+O24+0.5*P24 -> 34.51 | O24: 30.51 | P24: =6+1+1 -> 8 | Q24: =+R24+(0.5*S24) -> 34.60 | R24: 30.10 | S24: =1+4+2+2 -> 9 | T24: =+U24+0.5*V24 -> 49.51 | U24: 46.51 | V24: =2+4 -> 6 | W24: =+X24+(0.5*Y24) -> 31.01 | X24: 30.01 | Y24: =1+1 -> 2 | Z24: =+(AA24+AB24+AC24)+0.5*AD24 -> 24.11 | AA24: 8.20 | AB24: 6.93 | AC24: 5.48 | AD24: =1+2+4 -> 7 | AE24: =+AF24+0.5*AG24 -> 43.14 | AF24: 31.14 | AG24: =0+0+2+6+10+6 -> 24
A25: 60 | B25: S5 | C25: 11 | D25: Rupert, Frank | E25: CDP-SS | F25: =+H25+K25+N25+Q25+T25+W25+Z25+AE25 -> 298.51 | G25: =+J25+M25+P25+S25+V25+Y25+AD25+AG25 -> 82 | H25: =+I25+0.5*J25 -> 57.30 | I25: 53.80 | J25: =0+1+1+0+0+0+0+5+0 -> 7 | K25: =+L25+0.5*M25 -> 31.54 | L25: 29.54 | M25: =1+1+1+1 -> 4 | N25: =+O25+0.5*P25 -> 31.94 | O25: 23.44 | P25: =6+6+1+2+2 -> 17 | Q25: =+R25+(0.5*S25) -> 27.90 | R25: 24.40 | S25: =0+1+1+2+0+0+1+2 -> 7 | T25: =+U25+0.5*V25 -> 47.79 | U25: 41.29 | V25: =1+1+2+2+6+1 -> 13 | W25: =+X25+(0.5*Y25) -> 40.51 | X25: 39.01 | Y25: =1+2 -> 3 | Z25: =+(AA25+AB25+AC25)+0.5*AD25 -> 27.44 | AA25: 4.14 | AB25: 5.00 | AC25: 7.80 | AD25: =12+9+0 -> 21 | AE25: =+AF25+0.5*AG25 -> 34.09 | AF25: 29.09 | AG25: =3+1+3+0+3+0 -> 10
C26: CDP-MM
A27: 56 | B27: 7 | C27: 1 | D27: Reed, Ken | E27: CDP-MM | F27: =+H27+K27+N27+Q27+T27+W27+Z27+AE27 -> 273.96 | G27: =+J27+M27+P27+S27+V27+Y27+AD27+AG27 -> 61 | H27: =+I27+0.5*J27 -> 44.64 | I27: 43.14 | J27: =1+2 -> 3 | K27: =+L27+0.5*M27 -> 43.05 | L27: 38.05 | M27: =1+5+1+2+1 -> 10 | N27: =+O27+0.5*P27 -> 26.50 | O27: 24.00 | P27: =3+1+1 -> 5 | Q27: =+R27+(0.5*S27) -> 35.67 | R27: 29.17 | S27: =2+0+1+2+1+0+0+1+6 -> 13 | T27: =+U27+0.5*V27 -> 45.00 | U27: 40.00 | V27: =1+1+2+6 -> 10 | W27: =+X27+(0.5*Y27) -> 28.25 | X27: 25.75 | Y27: =4+1 -> 5 | Z27: =+(AA27+AB27+AC27)+0.5*AD27 -> 16.25 | AA27: 5.59 | AB27: 4.44 | AC27: 4.22 | AD27: =1+1+2 -> 4 | AE27: =+AF27+0.5*AG27 -> 34.60 | AF27: 29.10 | AG27: =3+4+1+2+1 -> 11
A28: 34 | B28: 8 | C28: 2 | D28: Kirkham, Bart | E28: CDP-MM | F28: =+H28+K28+N28+Q28+T28+W28+Z28+AE28 -> 275.33 | G28: =+J28+M28+P28+S28+V28+Y28+AD28+AG28 -> 82 | H28: =+I28+0.5*J28 -> 43.65 | I28: 42.65 | J28: =1+1 -> 2 | K28: =+L28+0.5*M28 -> 34.92 | L28: 30.42 | M28: =2+1+5+1 -> 9 | N28: =+O28+0.5*P28 -> 27.67 | O28: 17.67 | P28: =7+5+3+5 -> 20 | Q28: =+R28+(0.5*S28) -> 31.56 | R28: 27.06 | S28: =1+0+1+2+1+0+1+3 -> 9 | T28: =+U28+0.5*V28 -> 41.67 | U28: 34.17 | V28: =1+1+2+2+1+3+5 -> 15 | W28: =+X28+(0.5*Y28) -> 20.40 | X28: 19.90 | Y28: 1 | Z28: =+(AA28+AB28+AC28)+0.5*AD28 -> 23.58 | AA28: 5.54 | AB28: 5.55 | AC28: 4.99 | AD28: =8+2+5 -> 15 | AE28: =+AF28+0.5*AG28 -> 51.88 | AF28: 46.38 | AG28: =1+6+2+2 -> 11
A29: 29 | B29: S4 | C29: 3 | D29: Hatch, Perri | E29: CDP-MM | F29: =+H29+K29+N29+Q29+T29+W29+Z29+AE29 -> 326.57 | G29: =+J29+M29+P29+S29+V29+Y29+AD29+AG29 -> 153 | H29: =+I29+0.5*J29 -> 46.50 | I29: 44.50 | J29: =0+0+0+1+0+0+1+1+1 -> 4 | K29: =+L29+0.5*M29 -> 40.83 | L29: 31.33 | M29: =2+3+5+6+0+1+2+0 -> 19 | N29: =+O29+0.5*P29 -> 41.10 | O29: 24.60 | P29: =15+11+2+2+1+2 -> 33 | Q29: =+R29+(0.5*S29) -> 43.21 | R29: 29.71 | S29: =2+5+4+6+2+2+0+6 -> 27 | T29: =+U29+0.5*V29 -> 40.64 | U29: 36.64 | V29: =4+2+1+1 -> 8 | W29: =+X29+(0.5*Y29) -> 36.10 | X29: 31.10 | Y29: 10 | Z29: =+(AA29+AB29+AC29)+0.5*AD29 -> 24.09 | AA29: 5.02 | AB29: 4.23 | AC29: 3.84 | AD29: =16+5+1 -> 22 | AE29: =+AF29+0.5*AG29 -> 54.10 | AF29: 39.10 | AG29: =1+0+2+15+1+1+10 -> 30
A30: 5 | B30: S6 | C30: 4 | D30: Attryde, Edward | E30: CDP-MM | F30: =+H30+K30+N30+Q30+T30+W30+Z30+AE30 -> 363.08 | G30: =+J30+M30+P30+S30+V30+Y30+AD30+AG30 -> 78 | H30: =+I30+0.5*J30 -> 47.62 | I30: 47.12 | J30: =0+0+0+0+1+0+0+0+0 -> 1 | K30: =+L30+0.5*M30 -> 57.21 | L30: 53.21 | M30: =1+2+5 -> 8 | N30: =+O30+0.5*P30 -> 38.77 | O30: 34.77 | P30: 8 | Q30: =+R30+(0.5*S30) -> 41.19 | R30: 39.69 | S30: =0+0+1+0+0+1+0+1 -> 3 | T30: =+U30+0.5*V30 -> 49.62 | U30: 44.12 | V30: =1+1+2+1+6 -> 11 | W30: =+X30+(0.5*Y30) -> 39.38 | X30: 37.38 | Y30: =2+1+1 -> 4 | Z30: =+(AA30+AB30+AC30)+0.5*AD30 -> 31.84 | AA30: 5.22 | AB30: 5.48 | AC30: 6.14 | AD30: =10+5+15 -> 30 | AE30: =+AF30+0.5*AG30 -> 57.45 | AF30: 50.95 | AG30: =5+7+0+0+0+1 -> 13
A31: 46 | B31: 7 | C31: 5 | D31: Ostler, Jay | E31: CDP-MM | F31: =+H31+K31+N31+Q31+T31+W31+Z31+AE31 -> 443.19 | G31: =+J31+M31+P31+S31+V31+Y31+AD31+AG31 -> 72 | H31: =+I31+0.5*J31 -> 82.49 | I31: 77.49 | J31: 10 | K31: =+L31+0.5*M31 -> 87.14 | L31: 82.14 | M31: =2+1+1+6 -> 10 | N31: =+O31+0.5*P31 -> 50.31 | O31: 43.81 | P31: =2+11+0+0+0+0 -> 13 | Q31: =+R31+(0.5*S31) -> 44.88 | R31: 43.38 | S31: =1+1+1 -> 3 | T31: =+U31+0.5*V31 -> 55.64 | U31: 50.14 | V31: =1+1+2+1+1+3+1+1 -> 11 | W31: =+X31+(0.5*Y31) -> 35.33 | X31: 33.33 | Y31: =1+3 -> 4 | Z31: =+(AA31+AB31+AC31)+0.5*AD31 -> 29.60 | AA31: 8.09 | AB31: 6.18 | AC31: 7.33 | AD31: =10+4+2 -> 16 | AE31: =+AF31+0.5*AG31 -> 57.80 | AF31: 55.30 | AG31: =2+2+1 -> 5
A32: 18 | B32: S2 | C32: 6 | D32: Crawford, George | E32: CDP-MM | F32: DNF | G32: DNF | H32: =+I32+0.5*J32 -> 48.29 | I32: 46.79 | J32: =0+0+0+2+0+0+1+0+0 -> 3 | K32: =+L32+0.5*M32 -> 47.03 | L32: 40.03 | M32: =1+1+1+1+0+0+0+0+10 -> 14 | N32: =+O32+0.5*P32 -> 0.00 | Q32: =+R32+(0.5*S32) -> 0.00 | T32: =+U32+0.5*V32 -> 0.00 | W32: =+X32+(0.5*Y32) -> 0.00 | Z32: =+(AA32+AB32+AC32)+0.5*AD32 -> 0.00 | AE32: =+AF32+0.5*AG32 -> 0.00
C33: CDP-NV
A34: 73 | B34: 3 | C34: 1 | D34: Willis, David | E34: CDP-NV | F34: =+H34+K34+N34+Q34+T34+W34+Z34+AE34 -> 349.22 | G34: =+J34+M34+P34+S34+V34+Y34+AD34+AG34 -> 148 | H34: =+I34+0.5*J34 -> 51.76 | I34: 42.76 | J34: =5+1+1+1+10 -> 18 | K34: =+L34+0.5*M34 -> 48.01 | L34: 43.01 | M34: =3+1+1+1+2+2 -> 10 | N34: =+O34+0.5*P34 -> 44.75 | O34: 30.25 | P34: =9+6+1+3+10 -> 29 | Q34: =+R34+(0.5*S34) -> 35.14 | R34: 32.14 | S34: =1+1+1+1+1+1 -> 6 | T34: =+U34+0.5*V34 -> 55.77 | U34: 48.27 | V34: =1+6+1+5+1+1 -> 15 | W34: =+X34+(0.5*Y34) -> 31.84 | X34: 26.84 | Y34: =2+2+5+1 -> 10 | Z34: =+(AA34+AB34+AC34)+0.5*AD34 -> 32.69 | AA34: 4.98 | AB34: 5.58 | AC34: 4.63 | AD34: =10+11+14 -> 35 | AE34: =+AF34+0.5*AG34 -> 49.26 | AF34: 36.76 | AG34: =5+0+6+1+11+2 -> 25
A35: 4 | B35: 1 | C35: 2 | D35: Andrus, Jay | E35: CDP-NV | F35: =+H35+K35+N35+Q35+T35+W35+Z35+AE35 -> 374.93 | G35: =+J35+M35+P35+S35+V35+Y35+AD35+AG35 -> 165 | H35: =+I35+0.5*J35 -> 58.12 | I35: 56.62 | J35: =1+1+1 -> 3 | K35: =+L35+0.5*M35 -> 50.26 | L35: 43.26 | M35: =1+1+5+1+6 -> 14 | N35: =+O35+0.5*P35 -> 44.41 | O35: 28.91 | P35: =15+15+1 -> 31 | Q35: =+R35+(0.5*S35) -> 48.63 | R35: 39.13 | S35: =3+1+3+5+1+6 -> 19 | T35: =+U35+0.5*V35 -> 55.34 | U35: 40.34 | V35: =3+0+4+6+4+0+2+6+5 -> 30 | W35: =+X35+(0.5*Y35) -> 40.27 | X35: 29.27 | Y35: =10+1+1+10 -> 22 | Z35: =+(AA35+AB35+AC35)+0.5*AD35 -> 23.62 | AA35: 5.27 | AB35: 5.11 | AC35: 5.24 | AD35: =6+4+6 -> 16 | AE35: =+AF35+0.5*AG35 -> 54.28 | AF35: 39.28 | AG35: =1+6+11+1+9+2 -> 30
A36: ESP | C36: ESP | D36: ESP | E36: ESP | H36: ESP | K36: ESP | N36: ESP | Q36: ESP | T36: ESP | W36: ESP | Z36: ESP | AE36: ESP
C37: ESP-EX
A38: 21 | B38: 5 | C38: 1 | D38: Edwards, Lance | E38: ESP-EX | F38: =+H38+K38+N38+Q38+T38+W38+Z38+AE38 -> 161.35 | G38: =+J38+M38+P38+S38+V38+Y38+AD38+AG38 -> 46 | H38: =+I38+0.5*J38 -> 19.08 | I38: 15.08 | J38: =1+1+6 -> 8 | K38: =+L38+0.5*M38 -> 21.38 | L38: 20.88 | M38: =1+0+0+0+0+0+0+0 -> 1 | N38: =+O38+0.5*P38 -> 18.89 | O38: 16.39 | P38: =1+3+1 -> 5 | Q38: =+R38+(0.5*S38) -> 23.94 | R38: 18.94 | S38: =5+1+2+1+1 -> 10 | T38: =+U38+0.5*V38 -> 26.22 | U38: 21.72 | V38: =1+1+2+2+1+2 -> 9 | W38: =+X38+(0.5*Y38) -> 13.98 | X38: 13.98 | Y38: 0 | Z38: =+(AA38+AB38+AC38)+0.5*AD38 -> 12.14 | AA38: 2.89 | AB38: 3.45 | AC38: 3.30 | AD38: =2+3 -> 5 | AE38: =+AF38+0.5*AG38 -> 25.72 | AF38: 21.72 | AG38: =1+3+4 -> 8
A39: 80 | B39: 3 | C39: 2 | D39: Stilwell, Mike | E39: ESP-EX | F39: =+H39+K39+N39+Q39+T39+W39+Z39+AE39 -> 229.65 | G39: =+J39+M39+P39+S39+V39+Y39+AD39+AG39 -> 119 | H39: =+I39+0.5*J39 -> 29.12 | I39: 27.62 | J39: =2+1 -> 3 | K39: =+L39+0.5*M39 -> 28.48 | L39: 25.98 | M39: =4+1 -> 5 | N39: =+O39+0.5*P39 -> 20.09 | O39: 18.09 | P39: =1+1+2 -> 4 | Q39: =+R39+(0.5*S39) -> 27.64 | R39: 23.64 | S39: =2+2+1+1+1+1 -> 8 | T39: =+U39+0.5*V39 -> 33.73 | U39: 26.23 | V39: =1+1+4+2+2+4+1 -> 15 | W39: =+X39+(0.5*Y39) -> 25.52 | X39: 16.02 | Y39: =2+1+1+5+10 -> 19 | Z39: =+(AA39+AB39+AC39)+0.5*AD39 -> 16.54 | AA39: 4.85 | AB39: 4.14 | AC39: 3.55 | AD39: =4+3+1 -> 8 | AE39: =+AF39+0.5*AG39 -> 48.53 | AF39: 20.03 | AG39: =10+11+7+15+2+2+10 -> 57
C40: ESP-SS
A41: 48 | B41: S9 | C41: 1 | D41: Outzen, Craig | E41: ESP-SS | F41: =+H41+K41+N41+Q41+T41+W41+Z41+AE41 -> 168.18 | G41: =+J41+M41+P41+S41+V41+Y41+AD41+AG41 -> 69 | H41: =+I41+0.5*J41 -> 20.53 | I41: 20.03 | J41: 1 | K41: =+L41+0.5*M41 -> 23.95 | L41: 19.95 | M41: =1+1+1+3+1+1 -> 8 | N41: =+O41+0.5*P41 -> 19.59 | O41: 16.09 | P41: =2+5 -> 7 | Q41: =+R41+(0.5*S41) -> 27.37 | R41: 17.87 | S41: =6+1+4+4+2+1+1 -> 19 | T41: =+U41+0.5*V41 -> 26.73 | U41: 21.23 | V41: =1+1+1+1+1+5+1 -> 11 | W41: =+X41+(0.5*Y41) -> 14.34 | X41: 13.84 | Y41: 1 | Z41: =+(AA41+AB41+AC41)+0.5*AD41 -> 17.10 | AA41: 4.20 | AB41: 3.57 | AC41: 2.83 | AD41: =5+0+2+6 -> 13 | AE41: =+AF41+0.5*AG41 -> 18.57 | AF41: 14.07 | AG41: =0+1+0+5+0+3 -> 9
A42: 79 | B42: S9 | C42: 2 | D42: Zaccardi, Pat | E42: ESP-SS | F42: =+H42+K42+N42+Q42+T42+W42+Z42+AE42 -> 178.82 | G42: =+J42+M42+P42+S42+V42+Y42+AD42+AG42 -> 39 | H42: =+I42+0.5*J42 -> 20.67 | I42: 20.17 | J42: 1 | K42: =+L42+0.5*M42 -> 28.85 | L42: 24.85 | M42: =1+2+2+3 -> 8 | N42: =+O42+0.5*P42 -> 23.01 | O42: 19.01 | P42: =5+2+1 -> 8 | Q42: =+R42+(0.5*S42) -> 24.13 | R42: 23.63 | S42: 1 | T42: =+U42+0.5*V42 -> 23.77 | U42: 21.77 | V42: =2+1+1 -> 4 | W42: =+X42+(0.5*Y42) -> 18.42 | X42: 16.92 | Y42: =1+2 -> 3 | Z42: =+(AA42+AB42+AC42)+0.5*AD42 -> 16.90 | AA42: 4.43 | AB42: 4.86 | AC42: 3.61 | AD42: =3+2+3 -> 8 | AE42: =+AF42+0.5*AG42 -> 23.07 | AF42: 20.07 | AG42: =1+0+5+0+0+0 -> 6
A43: 36 | B43: S9 | C43: 3 | D43: Knapp, Chris | E43: ESP-SS | F43: =+H43+K43+N43+Q43+T43+W43+Z43+AE43 -> 199.67 | G43: =+J43+M43+P43+S43+V43+Y43+AD43+AG43 -> 61 | H43: =+I43+0.5*J43 -> 26.84 | I43: 25.34 | J43: =1+1+1 -> 3 | K43: =+L43+0.5*M43 -> 32.24 | L43: 24.74 | M43: =1+5+1+2+6 -> 15 | N43: =+O43+0.5*P43 -> 21.33 | O43: 17.33 | P43: =3+1+1+2+1 -> 8 | Q43: =+R43+(0.5*S43) -> 24.97 | R43: 23.97 | S43: =0+0+0+2+0+0+0+0 -> 2 | T43: =+U43+0.5*V43 -> 28.73 | U43: 24.23 | V43: =3+1+2+2+1 -> 9 | W43: =+X43+(0.5*Y43) -> 16.23 | X43: 15.73 | Y43: 1 | Z43: =+(AA43+AB43+AC43)+0.5*AD43 -> 21.46 | AA43: 4.45 | AB43: 3.92 | AC43: 4.09 | AD43: =11+1+6 -> 18 | AE43: =+AF43+0.5*AG43 -> 27.87 | AF43: 25.37 | AG43: =1+1+3 -> 5
A44: 16 | B44: S9 | C44: 4 | D44: Collins, Ken | E44: ESP-SS | F44: =+H44+K44+N44+Q44+T44+W44+Z44+AE44 -> 218.90 | G44: =+J44+M44+P44+S44+V44+Y44+AD44+AG44 -> 73 | H44: =+I44+0.5*J44 -> 27.87 | I44: 27.37 | J44: 1 | K44: =+L44+0.5*M44 -> 35.33 | L44: 26.83 | M44: =1+2+3+1+10 -> 17 | N44: =+O44+0.5*P44 -> 22.77 | O44: 20.27 | P44: =4+1 -> 5 | Q44: =+R44+(0.5*S44) -> 34.07 | R44: 25.57 | S44: =2+4+1+6+2+1+0+1 -> 17 | T44: =+U44+0.5*V44 -> 32.35 | U44: 27.85 | V44: =1+4+2+1+1 -> 9 | W44: =+X44+(0.5*Y44) -> 20.03 | X44: 17.03 | Y44: 6 | Z44: =+(AA44+AB44+AC44)+0.5*AD44 -> 18.19 | AA44: 5.02 | AB44: 4.32 | AC44: 3.85 | AD44: =1+2+7 -> 10 | AE44: =+AF44+0.5*AG44 -> 28.29 | AF44: 24.29 | AG44: =1+3+3+1 -> 8
A45: 50 | B45: 7 | C45: 5 | D45: Parker, Patrick | E45: ESP-SS | F45: =+H45+K45+N45+Q45+T45+W45+Z45+AE45 -> 249.89 | G45: =+J45+M45+P45+S45+V45+Y45+AD45+AG45 -> 56 | H45: =+I45+0.5*J45 -> 41.42 | I45: 41.42 | J45: 0 | K45: =+L45+0.5*M45 -> 38.52 | L45: 34.02 | M45: =2+2+1+1+1+1+1 -> 9 | N45: =+O45+0.5*P45 -> 24.36 | O45: 23.36 | P45: =0+1+0+0+0+1 -> 2 | Q45: =+R45+(0.5*S45) -> 32.71 | R45: 29.21 | S45: =1+1+4+1 -> 7 | T45: =+U45+0.5*V45 -> 39.90 | U45: 36.40 | V45: =1+4+1+1 -> 7 | W45: =+X45+(0.5*Y45) -> 19.76 | X45: 19.76 | Y45: 0 | Z45: =+(AA45+AB45+AC45)+0.5*AD45 -> 19.05 | AA45: 4.52 | AB45: 5.42 | AC45: 4.61 | AD45: =1+3+5 -> 9 | AE45: =+AF45+0.5*AG45 -> 34.17 | AF45: 23.17 | AG45: =7+6+3+1+5 -> 22
A46: 65 | B46: 3 | C46: 6 | D46: Stilwell, Ron | E46: ESP-SS | F46: =+H46+K46+N46+Q46+T46+W46+Z46+AE46 -> 253.28 | G46: =+J46+M46+P46+S46+V46+Y46+AD46+AG46 -> 112 | H46: =+I46+0.5*J46 -> 33.82 | I46: 33.32 | J46: 1 | K46: =+L46+0.5*M46 -> 35.66 | L46: 33.66 | M46: =1+1+1+1 -> 4 | N46: =+O46+0.5*P46 -> 29.45 | O46: 22.95 | P46: =1+1+1+10 -> 13 | Q46: =+R46+(0.5*S46) -> 36.32 | R46: 26.82 | S46: =1+3+1+6+2+6 -> 19 | T46: =+U46+0.5*V46 -> 33.68 | U46: 26.68 | V46: =1+1+3+1+2+0+2+0+4 -> 14 | W46: =+X46+(0.5*Y46) -> 29.89 | X46: 15.89 | Y46: =2+1+5+10+10 -> 28 | Z46: =+(AA46+AB46+AC46)+0.5*AD46 -> 25.18 | AA46: 4.72 | AB46: 3.99 | AC46: 4.47 | AD46: =5+5+8+6 -> 24 | AE46: =+AF46+0.5*AG46 -> 29.28 | AF46: 24.78 | AG46: =0+5+1+0+2+1 -> 9
A47: 32.8 | B47: 4 | C47: 7 | D47: Badger, Jeff | E47: ESP-SS | F47: =+H47+K47+N47+Q47+T47+W47+Z47+AE47 -> 269.47 | G47: =+J47+M47+P47+S47+V47+Y47+AD47+AG47 -> 75 | H47: =+I47+0.5*J47 -> 32.16 | I47: 31.66 | J47: =0+0+0+1+0+0+0+0+0 -> 1 | K47: =+L47+0.5*M47 -> 42.23 | L47: 35.73 | M47: =1+0+1+0+1+3+0+1+6 -> 13 | N47: =+O47+0.5*P47 -> 32.13 | O47: 25.63 | P47: =6+7 -> 13 | Q47: =+R47+(0.5*S47) -> 51.43 | R47: 33.93 | S47: =2+10+4+5+1+1+2+10 -> 35 | T47: =+U47+0.5*V47 -> 35.30 | U47: 32.80 | V47: =1+1+1+1+1 -> 5 | W47: =+X47+(0.5*Y47) -> 24.77 | X47: 24.77 | Y47: 0 | Z47: =+(AA47+AB47+AC47)+0.5*AD47 -> 18.20 | AA47: 4.80 | AB47: 6.29 | AC47: 5.61 | AD47: 3 | AE47: =+AF47+0.5*AG47 -> 33.25 | AF47: 30.75 | AG47: =1+2+2 -> 5
C48: ESP-MM
A49: 78 | B49: S9 | C49: 1 | D49: Zaccardi, Juke | E49: ESP-MM | F49: =+H49+K49+N49+Q49+T49+W49+Z49+AE49 -> 202.17 | G49: =+J49+M49+P49+S49+V49+Y49+AD49+AG49 -> 132 | H49: =+I49+0.5*J49 -> 26.05 | I49: 18.55 | J49: =1+1+6+1+5+1 -> 15 | K49: =+L49+0.5*M49 -> 27.51 | L49: 18.01 | M49: =3+2+1+4+6+1+1+1 -> 19 | N49: =+O49+0.5*P49 -> 20.09 | O49: 14.09 | P49: =1+4+6+1 -> 12 | Q49: =+R49+(0.5*S49) -> 22.00 | R49: 18.50 | S49: =1+2+0+2+0+0+1+1 -> 7 | T49: =+U49+0.5*V49 -> 31.62 | U49: 19.12 | V49: =8+1+1+1+1+1+2+10 -> 25 | W49: =+X49+(0.5*Y49) -> 18.58 | X49: 15.08 | Y49: =1+6 -> 7 | Z49: =+(AA49+AB49+AC49)+0.5*AD49 -> 30.86 | AA49: 8.78 | AB49: 4.36 | AC49: 3.72 | AD49: =12+1+9+6 -> 28 | AE49: =+AF49+0.5*AG49 -> 25.46 | AF49: 15.96 | AG49: =0+7+5+2+0+5 -> 19
A50: 55 | B50: S8 | C50: 2 | D50: Redford, Steve | E50: ESP-MM | F50: =+H50+K50+N50+Q50+T50+W50+Z50+AE50 -> 238.61 | G50: =+J50+M50+P50+S50+V50+Y50+AD50+AG50 -> 72 | H50: =+I50+0.5*J50 -> 42.58 | I50: 38.08 | J50: =1+1+0+0+5+1+1+0+0 -> 9 | K50: =+L50+0.5*M50 -> 34.49 | L50: 29.99 | M50: =1+3+3+1+1 -> 9 | N50: =+O50+0.5*P50 -> 27.86 | O50: 24.36 | P50: =2+3+1+1 -> 7 | Q50: =+R50+(0.5*S50) -> 29.14 | R50: 22.64 | S50: =2+0+2+1+0+1+1+6 -> 13 | T50: =+U50+0.5*V50 -> 34.11 | U50: 29.61 | V50: =2+2+2+1+2 -> 9 | W50: =+X50+(0.5*Y50) -> 21.56 | X50: 20.06 | Y50: =1+2 -> 3 | Z50: =+(AA50+AB50+AC50)+0.5*AD50 -> 19.09 | AA50: 4.29 | AB50: 4.14 | AC50: 5.16 | AD50: =1+1+3+6 -> 11 | AE50: =+AF50+0.5*AG50 -> 29.78 | AF50: 24.28 | AG50: =2+2+5+1+1 -> 11
A51: 52 | B51: S7 | C51: 3 | D51: Redford, Kent | E51: ESP-MM | F51: =+H51+K51+N51+Q51+T51+W51+Z51+AE51 -> 245.09 | G51: =+J51+M51+P51+S51+V51+Y51+AD51+AG51 -> 103 | H51: =+I51+0.5*J51 -> 36.22 | I51: 31.72 | J51: =1+0+0+0+1+1+1+0+5 -> 9 | K51: =+L51+0.5*M51 -> 32.14 | L51: 26.64 | M51: =3+1+1+1+2+2+1 -> 11 | N51: =+O51+0.5*P51 -> 29.13 | O51: 21.13 | P51: =3+6+4+3 -> 16 | Q51: =+R51+(0.5*S51) -> 31.27 | R51: 25.77 | S51: =2+0+2+4+1+0+1+1 -> 11 | T51: =+U51+0.5*V51 -> 38.68 | U51: 32.68 | V51: =3+4+2+2+1 -> 12 | W51: =+X51+(0.5*Y51) -> 22.00 | X51: 20.00 | Y51: =1+2+1 -> 4 | Z51: =+(AA51+AB51+AC51)+0.5*AD51 -> 18.17 | AA51: 5.05 | AB51: 3.85 | AC51: 2.77 | AD51: =8+1+4 -> 13 | AE51: =+AF51+0.5*AG51 -> 37.48 | AF51: 23.98 | AG51: =7+5+7+7+1 -> 27
A52: 66 | B52: S2 | C52: 4 | D52: Stone, Scott | E52: ESP-MM | F52: =+H52+K52+N52+Q52+T52+W52+Z52+AE52 -> 251.72 | G52: =+J52+M52+P52+S52+V52+Y52+AD52+AG52 -> 108 | H52: =+I52+0.5*J52 -> 30.46 | I52: 29.96 | J52: =0+0+0+0+0+0+0+0+1 -> 1 | K52: =+L52+0.5*M52 -> 33.15 | L52: 30.15 | M52: =1+0+1+1+0+2+0+1 -> 6 | N52: =+O52+0.5*P52 -> 33.70 | O52: 18.70 | P52: =5+5+1+7+10+2 -> 30 | Q52: =+R52+(0.5*S52) -> 35.51 | R52: 29.51 | S52: =6+2+3+1 -> 12 | T52: =+U52+0.5*V52 -> 40.59 | U52: 24.09 | V52: =2+1+2+2+1+5+10+10 -> 33 | W52: =+X52+(0.5*Y52) -> 27.97 | X52: 26.97 | Y52: =1+1 -> 2 | Z52: =+(AA52+AB52+AC52)+0.5*AD52 -> 17.64 | AA52: 3.38 | AB52: 4.97 | AC52: 4.79 | AD52: =5+1+3 -> 9 | AE52: =+AF52+0.5*AG52 -> 32.70 | AF52: 25.20 | AG52: =5+2+2+6+0+0 -> 15
A53: 4.01 | B53: S7 | C53: 5 | D53: Hill, Randy | E53: ESP-MM | F53: =+H53+K53+N53+Q53+T53+W53+Z53+AE53 -> 275.50 | G53: =+J53+M53+P53+S53+V53+Y53+AD53+AG53 -> 156 | H53: =+I53+0.5*J53 -> 35.57 | I53: 32.07 | J53: =0+0+0+0+1+0+1+0+5 -> 7 | K53: =+L53+0.5*M53 -> 37.31 | L53: 27.81 | M53: =4+4+2+1+1+1+6 -> 19 | N53: =+O53+0.5*P53 -> 31.47 | O53: 22.97 | P53: =3+10+1+3 -> 17 | Q53: =+R53+(0.5*S53) -> 40.99 | R53: 29.49 | S53: =2+1+0+2+6+1+1+0+10 -> 23 | T53: =+U53+0.5*V53 -> 42.91 | U53: 28.41 | V53: =1+6+5+2+5+10 -> 29 | W53: =+X53+(0.5*Y53) -> 33.63 | X53: 25.13 | Y53: =1+1+5+10 -> 17 | Z53: =+(AA53+AB53+AC53)+0.5*AD53 -> 24.01 | AA53: 4.39 | AB53: 3.11 | AC53: 4.01 | AD53: =11+6+8 -> 25 | AE53: =+AF53+0.5*AG53 -> 29.61 | AF53: 20.11 | AG53: =6+4+2+6+1 -> 19
A54: 1 | B54: 4 | C54: 6 | D54: Albert, Jim | E54: ESP-MM | F54: =+H54+K54+N54+Q54+T54+W54+Z54+AE54 -> 303.91 | G54: =+J54+M54+P54+S54+V54+Y54+AD54+AG54 -> 114 | H54: =+I54+0.5*J54 -> 48.15 | I54: 37.65 | J54: =0+0+0+0+0+1+0+0+10+10 -> 21 | K54: =+L54+0.5*M54 -> 38.03 | L54: 36.53 | M54: =1+1+0+0+0+0+0+1 -> 3 | N54: =+O54+0.5*P54 -> 29.47 | O54: 23.47 | P54: =2+7+2+1 -> 12 | Q54: =+R54+(0.5*S54) -> 45.07 | R54: 37.07 | S54: =3+2+1+3+1+6 -> 16 | T54: =+U54+0.5*V54 -> 44.73 | U54: 39.23 | V54: =2+2+1+1+5 -> 11 | W54: =+X54+(0.5*Y54) -> 24.94 | X54: 24.44 | Y54: 1 | Z54: =+(AA54+AB54+AC54)+0.5*AD54 -> 31.71 | AA54: 6.03 | AB54: 6.18 | AC54: 6.50 | AD54: =8+4+14 -> 26 | AE54: =+AF54+0.5*AG54 -> 41.81 | AF54: 29.81 | AG54: =2+5+6+5+1+5 -> 24
A55: 9 | B55: S9 | C55: 7 | D55: Bolinder, Jim | E55: ESP-MM | F55: =+H55+K55+N55+Q55+T55+W55+Z55+AE55 -> 321.09 | G55: =+J55+M55+P55+S55+V55+Y55+AD55+AG55 -> 137 | H55: =+I55+0.5*J55 -> 47.88 | I55: 47.88 | J55: 0 | K55: =+L55+0.5*M55 -> 46.61 | L55: 38.61 | M55: =4+2+2+2+4+1+1 -> 16 | N55: =+O55+0.5*P55 -> 36.87 | O55: 29.37 | P55: =1+9+4+1 -> 15 | Q55: =+R55+(0.5*S55) -> 38.35 | R55: 28.85 | S55: =0+5+6+4+1+1+2+0 -> 19 | T55: =+U55+0.5*V55 -> 50.00 | U55: 41.50 | V55: =5+1+4+3+1+3 -> 17 | W55: =+X55+(0.5*Y55) -> 32.08 | X55: 26.08 | Y55: =1+1+10 -> 12 | Z55: =+(AA55+AB55+AC55)+0.5*AD55 -> 27.91 | AA55: 4.02 | AB55: 4.82 | AC55: 4.07 | AD55: =18+7+5 -> 30 | AE55: =+AF55+0.5*AG55 -> 41.39 | AF55: 27.39 | AG55: =1+10+11+5+1 -> 28
A56: 35 | B56: S4 | C56: 8 | D56: Kirkham, Glade | E56: ESP-MM | F56: =+H56+K56+N56+Q56+T56+W56+Z56+AE56 -> 357.14 | G56: =+J56+M56+P56+S56+V56+Y56+AD56+AG56 -> 149 | H56: =+I56+0.5*J56 -> 54.68 | I56: 32.68 | J56: =0+0+0+10+10+0+1+1+2+20 -> 44 | K56: =+L56+0.5*M56 -> 57.37 | L56: 40.37 | M56: =3+1+2+10+4+1+2+1+10 -> 34 | N56: =+O56+0.5*P56 -> 55.27 | O56: 44.77 | P56: =6+10+5 -> 21 | Q56: =+R56+(0.5*S56) -> 49.54 | R56: 39.04 | S56: =4+1+1+10+3+0+1+1 -> 21 | T56: =+U56+0.5*V56 -> 45.32 | U56: 41.82 | V56: =1+1+1+1+1+1+1 -> 7 | W56: =+X56+(0.5*Y56) -> 27.49 | X56: 26.99 | Y56: 1 | Z56: =+(AA56+AB56+AC56)+0.5*AD56 -> 27.02 | AA56: 7.82 | AB56: 6.99 | AC56: 4.21 | AD56: =11+1+4 -> 16 | AE56: =+AF56+0.5*AG56 -> 40.45 | AF56: 37.95 | AG56: =0+1+0+1+1+2 -> 5
C57: ESP-NV
C58: 1 | D58: Lorenz, David | E58: ESP-NV | F58: =+H58+K58+N58+Q58+T58+W58+Z58+AE58 -> 410.64 | G58: =+J58+M58+P58+S58+V58+Y58+AD58+AG58 -> 93 | H58: =+I58+0.5*J58 -> 56.90 | I58: 51.90 | J58: 10 | K58: =+L58+0.5*M58 -> 64.28 | L58: 63.78 | M58: 1 | N58: =+O58+0.5*P58 -> 56.78 | O58: 40.28 | P58: =11+11+0+0+1+0+10 -> 33 | Q58: =+R58+(0.5*S58) -> 43.73 | R58: 40.23 | S58: =3+1+1+1+1 -> 7 | T58: =+U58+0.5*V58 -> 52.00 | U58: 50.50 | V58: =2+1 -> 3 | W58: =+X58+(0.5*Y58) -> 51.15 | X58: 42.15 | Y58: =1+1+6+10 -> 18 | Z58: =+(AA58+AB58+AC58)+0.5*AD58 -> 22.18 | AA58: 4.68 | AB58: 5.28 | AC58: 6.22 | AD58: =8+1+3 -> 12 | AE58: =+AF58+0.5*AG58 -> 63.62 | AF58: 59.12 | AG58: =3+5+1 -> 9
C60: Legend/Notes:
C61: X | D61: = Shooters who were eligible to receive trophies for their specific Division/Classification. (IDPA ratio is 1 trophy per 3 Div/Class shooters.)
C62: Xx Xx | D62: = Shooters who acted as SOs or were part of the Match Staff.
C63: DNF | D63: = For some reason, the shooter Did Not Finish the match.
C64: XX | D64: = Points Down value included some sort of penalty (Procedural, Hit On Non-threat, Failure to Neutralize, etc.)
C65: XXX.XX | D65: = Because these shooters took 1st place in their specific Div/Class, and there were more than 10 shooters competing in their classification, they were automatically advanced to the next highest classification.
D67: Scores were verified on 9/27/04 and, though minor changes were made, no placings were effected.