A1: Utah Shooting Academy Nov. 10, 2004
A2: SCORES (Including points down and penalties)
A3: Place | B3: Name | C3: Match | D3: Stage 1 | E3: Stage 2 | F3: Stage 3 | G3: Stage 4
A4: 1 | B4: ='[November 10 2004.xls]S10'!$B$1 -> Bryan Mortenson | C4: ='[November 10 2004.xls]S10'!$F$27 -> 98.41 | D4: ='[November 10 2004.xls]S10'!B$27 -> 12.09 | E4: ='[November 10 2004.xls]S10'!C$27 -> 14.20 | F4: ='[November 10 2004.xls]S10'!D$27 -> 57.47 | G4: ='[November 10 2004.xls]S10'!E$27 -> 14.65
A5: 2 | B5: ='[November 10 2004.xls]S11'!$B$1 -> Scott Jenkins | C5: ='[November 10 2004.xls]S11'!$F$27 -> 101.11 | D5: ='[November 10 2004.xls]S11'!B$27 -> 15.03 | E5: ='[November 10 2004.xls]S11'!C$27 -> 18.06 | F5: ='[November 10 2004.xls]S11'!D$27 -> 48.29 | G5: ='[November 10 2004.xls]S11'!E$27 -> 19.73
A6: 3 | B6: ='[November 10 2004.xls]S15'!$B$1 -> Les Langford | C6: ='[November 10 2004.xls]S15'!$F$27 -> 102.37 | D6: ='[November 10 2004.xls]S15'!B$27 -> 14.22 | E6: ='[November 10 2004.xls]S15'!C$27 -> 20.53 | F6: ='[November 10 2004.xls]S15'!D$27 -> 48.68 | G6: ='[November 10 2004.xls]S15'!E$27 -> 18.94
A7: 4 | B7: ='[November 10 2004.xls]S24'!$B$1 -> Red (Auto) | C7: ='[November 10 2004.xls]S24'!$F$27 -> 106.56 | D7: ='[November 10 2004.xls]S24'!B$27 -> 17.85 | E7: ='[November 10 2004.xls]S24'!C$27 -> 19.38 | F7: ='[November 10 2004.xls]S24'!D$27 -> 53.60 | G7: ='[November 10 2004.xls]S24'!E$27 -> 15.73
A8: 5 | B8: ='[November 10 2004.xls]S14'!$B$1 -> George T.\ | C8: ='[November 10 2004.xls]S14'!$F$27 -> 108.64 | D8: ='[November 10 2004.xls]S14'!B$27 -> 13.05 | E8: ='[November 10 2004.xls]S14'!C$27 -> 17.23 | F8: ='[November 10 2004.xls]S14'!D$27 -> 55.45 | G8: ='[November 10 2004.xls]S14'!E$27 -> 22.91
A9: 6 | B9: ='[November 10 2004.xls]S16'!$B$1 -> Dave Richards | C9: ='[November 10 2004.xls]S16'!$F$27 -> 113.58 | D9: ='[November 10 2004.xls]S16'!B$27 -> 17.80 | E9: ='[November 10 2004.xls]S16'!C$27 -> 18.59 | F9: ='[November 10 2004.xls]S16'!D$27 -> 58.99 | G9: ='[November 10 2004.xls]S16'!E$27 -> 18.20
A10: 7 | B10: ='[November 10 2004.xls]S6'!$B$1 -> R Dan Phillips | C10: ='[November 10 2004.xls]S6'!$F$27 -> 117.23 | D10: ='[November 10 2004.xls]S6'!B$27 -> 17.40 | E10: ='[November 10 2004.xls]S6'!C$27 -> 20.13 | F10: ='[November 10 2004.xls]S6'!D$27 -> 54.91 | G10: ='[November 10 2004.xls]S6'!E$27 -> 24.79
A11: 8 | B11: ='[November 10 2004.xls]S23'!$B$1 -> Dave Beck | C11: ='[November 10 2004.xls]S23'!$F$27 -> 121.00 | D11: ='[November 10 2004.xls]S23'!B$27 -> 14.05 | E11: ='[November 10 2004.xls]S23'!C$27 -> 19.76 | F11: ='[November 10 2004.xls]S23'!D$27 -> 69.82 | G11: ='[November 10 2004.xls]S23'!E$27 -> 17.37
A12: 9 | B12: ='[November 10 2004.xls]S17'!$B$1 -> Carl Burney | C12: ='[November 10 2004.xls]S17'!$F$27 -> 129.74 | D12: ='[November 10 2004.xls]S17'!B$27 -> 15.03 | E12: ='[November 10 2004.xls]S17'!C$27 -> 23.56 | F12: ='[November 10 2004.xls]S17'!D$27 -> 64.01 | G12: ='[November 10 2004.xls]S17'!E$27 -> 27.14
A13: 10 | B13: ='[November 10 2004.xls]S20'!$B$1 -> Red (Rev) | C13: ='[November 10 2004.xls]S20'!$F$27 -> 133.01 | D13: ='[November 10 2004.xls]S20'!B$27 -> 18.94 | E13: ='[November 10 2004.xls]S20'!C$27 -> 22.45 | F13: ='[November 10 2004.xls]S20'!D$27 -> 68.56 | G13: ='[November 10 2004.xls]S20'!E$27 -> 23.06
A14: 11 | B14: ='[November 10 2004.xls]S12'!$B$1 -> Joel Jenkins | C14: ='[November 10 2004.xls]S12'!$F$27 -> 133.37 | D14: ='[November 10 2004.xls]S12'!B$27 -> 19.22 | E14: ='[November 10 2004.xls]S12'!C$27 -> 20.66 | F14: ='[November 10 2004.xls]S12'!D$27 -> 64.64 | G14: ='[November 10 2004.xls]S12'!E$27 -> 28.85
A15: 12 | B15: ='[November 10 2004.xls]S9'!$B$1 -> Erin Herring | C15: ='[November 10 2004.xls]S9'!$F$27 -> 135.03 | D15: ='[November 10 2004.xls]S9'!B$27 -> 22.02 | E15: ='[November 10 2004.xls]S9'!C$27 -> 25.03 | F15: ='[November 10 2004.xls]S9'!D$27 -> 58.47 | G15: ='[November 10 2004.xls]S9'!E$27 -> 29.51
A16: 13 | B16: ='[November 10 2004.xls]S3'!$B$1 -> Roger Cox | C16: ='[November 10 2004.xls]S3'!$F$27 -> 141.71 | D16: ='[November 10 2004.xls]S3'!B$27 -> 23.60 | E16: ='[November 10 2004.xls]S3'!C$27 -> 31.66 | F16: ='[November 10 2004.xls]S3'!D$27 -> 62.57 | G16: ='[November 10 2004.xls]S3'!E$27 -> 23.88
A17: 14 | B17: ='[November 10 2004.xls]S4'!$B$1 -> Kevin Oliver | C17: ='[November 10 2004.xls]S4'!$F$27 -> 150.97 | D17: ='[November 10 2004.xls]S4'!B$27 -> 23.69 | E17: ='[November 10 2004.xls]S4'!C$27 -> 34.90 | F17: ='[November 10 2004.xls]S4'!D$27 -> 66.74 | G17: ='[November 10 2004.xls]S4'!E$27 -> 25.64
A18: 15 | B18: ='[November 10 2004.xls]S13'!$B$1 -> Glen Allen | C18: ='[November 10 2004.xls]S13'!$F$27 -> 151.60 | D18: ='[November 10 2004.xls]S13'!B$27 -> 29.33 | E18: ='[November 10 2004.xls]S13'!C$27 -> 26.39 | F18: ='[November 10 2004.xls]S13'!D$27 -> 69.12 | G18: ='[November 10 2004.xls]S13'!E$27 -> 26.76
A19: 16 | B19: ='[November 10 2004.xls]S2'!$B$1 -> Neil Hood | C19: ='[November 10 2004.xls]S2'!$F$27 -> 153.11 | D19: ='[November 10 2004.xls]S2'!B$27 -> 22.18 | E19: ='[November 10 2004.xls]S2'!C$27 -> 24.64 | F19: ='[November 10 2004.xls]S2'!D$27 -> 74.86 | G19: ='[November 10 2004.xls]S2'!E$27 -> 31.43
A20: 17 | B20: ='[November 10 2004.xls]S22'!$B$1 -> Danimal | C20: ='[November 10 2004.xls]S22'!$F$27 -> 155.78 | D20: ='[November 10 2004.xls]S22'!B$27 -> 31.06 | E20: ='[November 10 2004.xls]S22'!C$27 -> 30.16 | F20: ='[November 10 2004.xls]S22'!D$27 -> 70.11 | G20: ='[November 10 2004.xls]S22'!E$27 -> 24.45
A21: 18 | B21: ='[November 10 2004.xls]S18'!$B$1 -> Robert Carr | C21: ='[November 10 2004.xls]S18'!$F$27 -> 167.56 | D21: ='[November 10 2004.xls]S18'!B$27 -> 22.58 | E21: ='[November 10 2004.xls]S18'!C$27 -> 30.87 | F21: ='[November 10 2004.xls]S18'!D$27 -> 79.62 | G21: ='[November 10 2004.xls]S18'!E$27 -> 34.49
A22: 19 | B22: ='[November 10 2004.xls]S1'!$B$1 -> Justin Park | C22: ='[November 10 2004.xls]S1'!$F$27 -> 168.05 | D22: ='[November 10 2004.xls]S1'!B$27 -> 32.52 | E22: ='[November 10 2004.xls]S1'!C$27 -> 21.20 | F22: ='[November 10 2004.xls]S1'!D$27 -> 75.86 | G22: ='[November 10 2004.xls]S1'!E$27 -> 38.47
A23: 20 | B23: ='[November 10 2004.xls]S19'!$B$1 -> Matt Beck | C23: ='[November 10 2004.xls]S19'!$F$27 -> 173.26 | D23: ='[November 10 2004.xls]S19'!B$27 -> 28.17 | E23: ='[November 10 2004.xls]S19'!C$27 -> 34.41 | F23: ='[November 10 2004.xls]S19'!D$27 -> 74.33 | G23: ='[November 10 2004.xls]S19'!E$27 -> 36.35
A24: 21 | B24: ='[November 10 2004.xls]S7'!$B$1 -> Brian Talbut | C24: ='[November 10 2004.xls]S7'!$F$27 -> 185.42 | D24: ='[November 10 2004.xls]S7'!B$27 -> 32.05 | E24: ='[November 10 2004.xls]S7'!C$27 -> 30.68 | F24: ='[November 10 2004.xls]S7'!D$27 -> 83.11 | G24: ='[November 10 2004.xls]S7'!E$27 -> 39.58
A25: 22 | B25: ='[November 10 2004.xls]S8'!$B$1 -> Bill Dezell | C25: ='[November 10 2004.xls]S8'!$F$27 -> 195.13 | D25: ='[November 10 2004.xls]S8'!B$27 -> 25.82 | E25: ='[November 10 2004.xls]S8'!C$27 -> 41.50 | F25: ='[November 10 2004.xls]S8'!D$27 -> 96.64 | G25: ='[November 10 2004.xls]S8'!E$27 -> 31.17
A26: 23 | B26: ='[November 10 2004.xls]S5'!$B$1 -> Carol Perez | C26: ='[November 10 2004.xls]S5'!$F$27 -> 243.13 | D26: ='[November 10 2004.xls]S5'!B$27 -> 60.75 | E26: ='[November 10 2004.xls]S5'!C$27 -> 21.93 | F26: ='[November 10 2004.xls]S5'!D$27 -> 120.63 | G26: ='[November 10 2004.xls]S5'!E$27 -> 39.82
A27: 24 | B27: ='[November 10 2004.xls]S21'!$B$1 -> Ken Thorne | C27: ='[November 10 2004.xls]S21'!$F$27 -> 257.89 | D27: ='[November 10 2004.xls]S21'!B$27 -> 38.74 | E27: ='[November 10 2004.xls]S21'!C$27 -> 94.98 | F27: ='[November 10 2004.xls]S21'!D$27 -> 88.15 | G27: ='[November 10 2004.xls]S21'!E$27 -> 36.02
A28: S25 | B28: ='[November 10 2004.xls]S25'!$B$1 -> 0 | C28: ='[November 10 2004.xls]S25'!$F$27 -> 0.00 | D28: ='[November 10 2004.xls]S25'!B$27 -> 0.00 | E28: ='[November 10 2004.xls]S25'!C$27 -> 0.00 | F28: ='[November 10 2004.xls]S25'!D$27 -> 0.00 | G28: ='[November 10 2004.xls]S25'!E$27 -> 0.00
A29: =COUNTIF($C$4:$C$28,">0") -> 24 | B29: Overall Average: | C29: =SUM(C4:C28)/$A$29 -> 147.6525 | D29: =SUM(D4:D28)/$A$29 -> 23.63291666666667 | E29: =SUM(E4:E28)/$A$29 -> 27.620833333333334 | F29: =SUM(F4:F28)/$A$29 -> 69.359583333333319 | G29: =SUM(G4:G28)/$A$29 -> 27.03916666666667
A30: RAW TIMES
A31: Place | B31: Name | C31: Match | D31: Stage 1 | E31: Stage 2 | F31: Stage 3 | G31: Stage 4
A32: 1 | B32: ='[November 10 2004.xls]S14'!$B$1 -> George T.\ | C32: ='[November 10 2004.xls]S14'!$F$23 -> 86.14 | D32: ='[November 10 2004.xls]S14'!B$23 -> 12.05 | E32: ='[November 10 2004.xls]S14'!C$23 -> 16.23 | F32: ='[November 10 2004.xls]S14'!D$23 -> 42.95 | G32: ='[November 10 2004.xls]S14'!E$23 -> 14.91
A33: 2 | B33: ='[November 10 2004.xls]S10'!$B$1 -> Bryan Mortenson | C33: ='[November 10 2004.xls]S10'!$F$23 -> 88.91 | D33: ='[November 10 2004.xls]S10'!B$23 -> 12.09 | E33: ='[November 10 2004.xls]S10'!C$23 -> 14.20 | F33: ='[November 10 2004.xls]S10'!D$23 -> 47.97 | G33: ='[November 10 2004.xls]S10'!E$23 -> 14.65
A34: 3 | B34: ='[November 10 2004.xls]S11'!$B$1 -> Scott Jenkins | C34: ='[November 10 2004.xls]S11'!$F$23 -> 92.11 | D34: ='[November 10 2004.xls]S11'!B$23 -> 14.53 | E34: ='[November 10 2004.xls]S11'!C$23 -> 17.56 | F34: ='[November 10 2004.xls]S11'!D$23 -> 45.29 | G34: ='[November 10 2004.xls]S11'!E$23 -> 14.73
A35: 4 | B35: ='[November 10 2004.xls]S12'!$B$1 -> Joel Jenkins | C35: ='[November 10 2004.xls]S12'!$F$23 -> 92.37 | D35: ='[November 10 2004.xls]S12'!B$23 -> 14.22 | E35: ='[November 10 2004.xls]S12'!C$23 -> 18.16 | F35: ='[November 10 2004.xls]S12'!D$23 -> 43.64 | G35: ='[November 10 2004.xls]S12'!E$23 -> 16.35
A36: 5 | B36: ='[November 10 2004.xls]S15'!$B$1 -> Les Langford | C36: ='[November 10 2004.xls]S15'!$F$23 -> 92.37 | D36: ='[November 10 2004.xls]S15'!B$23 -> 13.72 | E36: ='[November 10 2004.xls]S15'!C$23 -> 19.53 | F36: ='[November 10 2004.xls]S15'!D$23 -> 42.18 | G36: ='[November 10 2004.xls]S15'!E$23 -> 16.94
A37: 6 | B37: ='[November 10 2004.xls]S16'!$B$1 -> Dave Richards | C37: ='[November 10 2004.xls]S16'!$F$23 -> 94.08 | D37: ='[November 10 2004.xls]S16'!B$23 -> 14.30 | E37: ='[November 10 2004.xls]S16'!C$23 -> 18.09 | F37: ='[November 10 2004.xls]S16'!D$23 -> 46.99 | G37: ='[November 10 2004.xls]S16'!E$23 -> 14.70
A38: 7 | B38: ='[November 10 2004.xls]S24'!$B$1 -> Red (Auto) | C38: ='[November 10 2004.xls]S24'!$F$23 -> 100.06 | D38: ='[November 10 2004.xls]S24'!B$23 -> 14.85 | E38: ='[November 10 2004.xls]S24'!C$23 -> 18.88 | F38: ='[November 10 2004.xls]S24'!D$23 -> 51.10 | G38: ='[November 10 2004.xls]S24'!E$23 -> 15.23
A39: 8 | B39: ='[November 10 2004.xls]S17'!$B$1 -> Carl Burney | C39: ='[November 10 2004.xls]S17'!$F$23 -> 101.24 | D39: ='[November 10 2004.xls]S17'!B$23 -> 14.53 | E39: ='[November 10 2004.xls]S17'!C$23 -> 18.56 | F39: ='[November 10 2004.xls]S17'!D$23 -> 46.51 | G39: ='[November 10 2004.xls]S17'!E$23 -> 21.64
A40: 9 | B40: ='[November 10 2004.xls]S6'!$B$1 -> R Dan Phillips | C40: ='[November 10 2004.xls]S6'!$F$23 -> 105.23 | D40: ='[November 10 2004.xls]S6'!B$23 -> 16.90 | E40: ='[November 10 2004.xls]S6'!C$23 -> 19.13 | F40: ='[November 10 2004.xls]S6'!D$23 -> 47.41 | G40: ='[November 10 2004.xls]S6'!E$23 -> 21.79
A41: 10 | B41: ='[November 10 2004.xls]S23'!$B$1 -> Dave Beck | C41: ='[November 10 2004.xls]S23'!$F$23 -> 106.50 | D41: ='[November 10 2004.xls]S23'!B$23 -> 14.05 | E41: ='[November 10 2004.xls]S23'!C$23 -> 17.26 | F41: ='[November 10 2004.xls]S23'!D$23 -> 58.82 | G41: ='[November 10 2004.xls]S23'!E$23 -> 16.37
A42: 11 | B42: ='[November 10 2004.xls]S3'!$B$1 -> Roger Cox | C42: ='[November 10 2004.xls]S3'!$F$23 -> 113.71 | D42: ='[November 10 2004.xls]S3'!B$23 -> 16.10 | E42: ='[November 10 2004.xls]S3'!C$23 -> 29.66 | F42: ='[November 10 2004.xls]S3'!D$23 -> 50.07 | G42: ='[November 10 2004.xls]S3'!E$23 -> 17.88
A43: 12 | B43: ='[November 10 2004.xls]S20'!$B$1 -> Red (Rev) | C43: ='[November 10 2004.xls]S20'!$F$23 -> 114.01 | D43: ='[November 10 2004.xls]S20'!B$23 -> 16.44 | E43: ='[November 10 2004.xls]S20'!C$23 -> 21.95 | F43: ='[November 10 2004.xls]S20'!D$23 -> 52.56 | G43: ='[November 10 2004.xls]S20'!E$23 -> 23.06
A44: 13 | B44: ='[November 10 2004.xls]S9'!$B$1 -> Erin Herring | C44: ='[November 10 2004.xls]S9'!$F$23 -> 114.03 | D44: ='[November 10 2004.xls]S9'!B$23 -> 17.02 | E44: ='[November 10 2004.xls]S9'!C$23 -> 21.53 | F44: ='[November 10 2004.xls]S9'!D$23 -> 52.47 | G44: ='[November 10 2004.xls]S9'!E$23 -> 23.01
A45: 14 | B45: ='[November 10 2004.xls]S2'!$B$1 -> Neil Hood | C45: ='[November 10 2004.xls]S2'!$F$23 -> 133.61 | D45: ='[November 10 2004.xls]S2'!B$23 -> 20.68 | E45: ='[November 10 2004.xls]S2'!C$23 -> 24.14 | F45: ='[November 10 2004.xls]S2'!D$23 -> 65.36 | G45: ='[November 10 2004.xls]S2'!E$23 -> 23.43
A46: 15 | B46: ='[November 10 2004.xls]S19'!$B$1 -> Matt Beck | C46: ='[November 10 2004.xls]S19'!$F$23 -> 134.76 | D46: ='[November 10 2004.xls]S19'!B$23 -> 20.17 | E46: ='[November 10 2004.xls]S19'!C$23 -> 30.91 | F46: ='[November 10 2004.xls]S19'!D$23 -> 56.83 | G46: ='[November 10 2004.xls]S19'!E$23 -> 26.85
A47: 16 | B47: ='[November 10 2004.xls]S13'!$B$1 -> Glen Allen | C47: ='[November 10 2004.xls]S13'!$F$23 -> 136.10 | D47: ='[November 10 2004.xls]S13'!B$23 -> 29.33 | E47: ='[November 10 2004.xls]S13'!C$23 -> 25.89 | F47: ='[November 10 2004.xls]S13'!D$23 -> 59.62 | G47: ='[November 10 2004.xls]S13'!E$23 -> 21.26
A48: 17 | B48: ='[November 10 2004.xls]S22'!$B$1 -> Danimal | C48: ='[November 10 2004.xls]S22'!$F$23 -> 136.28 | D48: ='[November 10 2004.xls]S22'!B$23 -> 27.56 | E48: ='[November 10 2004.xls]S22'!C$23 -> 29.66 | F48: ='[November 10 2004.xls]S22'!D$23 -> 58.61 | G48: ='[November 10 2004.xls]S22'!E$23 -> 20.45
A49: 18 | B49: ='[November 10 2004.xls]S4'!$B$1 -> Kevin Oliver | C49: ='[November 10 2004.xls]S4'!$F$23 -> 136.97 | D49: ='[November 10 2004.xls]S4'!B$23 -> 17.69 | E49: ='[November 10 2004.xls]S4'!C$23 -> 34.90 | F49: ='[November 10 2004.xls]S4'!D$23 -> 62.24 | G49: ='[November 10 2004.xls]S4'!E$23 -> 22.14
A50: 19 | B50: ='[November 10 2004.xls]S18'!$B$1 -> Robert Carr | C50: ='[November 10 2004.xls]S18'!$F$23 -> 138.56 | D50: ='[November 10 2004.xls]S18'!B$23 -> 22.58 | E50: ='[November 10 2004.xls]S18'!C$23 -> 27.37 | F50: ='[November 10 2004.xls]S18'!D$23 -> 63.12 | G50: ='[November 10 2004.xls]S18'!E$23 -> 25.49
A51: 20 | B51: ='[November 10 2004.xls]S7'!$B$1 -> Brian Talbut | C51: ='[November 10 2004.xls]S7'!$F$23 -> 150.42 | D51: ='[November 10 2004.xls]S7'!B$23 -> 25.55 | E51: ='[November 10 2004.xls]S7'!C$23 -> 27.18 | F51: ='[November 10 2004.xls]S7'!D$23 -> 68.61 | G51: ='[November 10 2004.xls]S7'!E$23 -> 29.08
A52: 21 | B52: ='[November 10 2004.xls]S1'!$B$1 -> Justin Park | C52: ='[November 10 2004.xls]S1'!$F$23 -> 159.05 | D52: ='[November 10 2004.xls]S1'!B$23 -> 31.52 | E52: ='[November 10 2004.xls]S1'!C$23 -> 17.70 | F52: ='[November 10 2004.xls]S1'!D$23 -> 72.36 | G52: ='[November 10 2004.xls]S1'!E$23 -> 37.47
A53: 22 | B53: ='[November 10 2004.xls]S8'!$B$1 -> Bill Dezell | C53: ='[November 10 2004.xls]S8'!$F$23 -> 165.63 | D53: ='[November 10 2004.xls]S8'!B$23 -> 19.32 | E53: ='[November 10 2004.xls]S8'!C$23 -> 37.50 | F53: ='[November 10 2004.xls]S8'!D$23 -> 83.14 | G53: ='[November 10 2004.xls]S8'!E$23 -> 25.67
A54: 23 | B54: ='[November 10 2004.xls]S5'!$B$1 -> Carol Perez | C54: ='[November 10 2004.xls]S5'!$F$23 -> 203.13 | D54: ='[November 10 2004.xls]S5'!B$23 -> 49.25 | E54: ='[November 10 2004.xls]S5'!C$23 -> 18.43 | F54: ='[November 10 2004.xls]S5'!D$23 -> 106.13 | G54: ='[November 10 2004.xls]S5'!E$23 -> 29.32
A55: 24 | B55: ='[November 10 2004.xls]S21'!$B$1 -> Ken Thorne | C55: ='[November 10 2004.xls]S21'!$F$23 -> 241.39 | D55: ='[November 10 2004.xls]S21'!B$23 -> 34.24 | E55: ='[November 10 2004.xls]S21'!C$23 -> 92.48 | F55: ='[November 10 2004.xls]S21'!D$23 -> 83.65 | G55: ='[November 10 2004.xls]S21'!E$23 -> 31.02
A56: S25 | B56: ='[November 10 2004.xls]S25'!$B$1 -> 0 | C56: ='[November 10 2004.xls]S25'!$F$23 -> 0.00 | D56: ='[November 10 2004.xls]S25'!B$23 -> 0.00 | E56: ='[November 10 2004.xls]S25'!C$23 -> 0.00 | F56: ='[November 10 2004.xls]S25'!D$23 -> 0.00 | G56: ='[November 10 2004.xls]S25'!E$23 -> 0.00
A57: Overall Average: | C57: =SUM(C32:C56)/$A$29 -> 126.5275 | D57: =SUM(D32:D56)/$A$29 -> 20.362083333333334 | E57: =SUM(E32:E56)/$A$29 -> 25.704166666666666 | F57: =SUM(F32:F56)/$A$29 -> 58.651249999999997 | G57: =SUM(G32:G56)/$A$29 -> 21.81
A58: POINTS DOWN
A59: Place | B59: Name | C59: Match | D59: Stage 1 | E59: Stage 2 | F59: Stage 3 | G59: Stage 4
A60: 1 | B60: ='[November 10 2004.xls]S24'!$B$1 -> Red (Auto) | C60: ='[November 10 2004.xls]S24'!$F$24 -> 13 | D60: ='[November 10 2004.xls]S24'!B$24 -> 6 | E60: ='[November 10 2004.xls]S24'!C$24 -> 1 | F60: ='[November 10 2004.xls]S24'!D$24 -> 5 | G60: ='[November 10 2004.xls]S24'!E$24 -> 1
A61: 2 | B61: ='[November 10 2004.xls]S1'!$B$1 -> Justin Park | C61: ='[November 10 2004.xls]S1'!$F$24 -> 18 | D61: ='[November 10 2004.xls]S1'!B$24 -> 2 | E61: ='[November 10 2004.xls]S1'!C$24 -> 7 | F61: ='[November 10 2004.xls]S1'!D$24 -> 7 | G61: ='[November 10 2004.xls]S1'!E$24 -> 2
A62: 3 | B62: ='[November 10 2004.xls]S11'!$B$1 -> Scott Jenkins | C62: ='[November 10 2004.xls]S11'!$F$24 -> 18 | D62: ='[November 10 2004.xls]S11'!B$24 -> 1 | E62: ='[November 10 2004.xls]S11'!C$24 -> 1 | F62: ='[November 10 2004.xls]S11'!D$24 -> 6 | G62: ='[November 10 2004.xls]S11'!E$24 -> 10
A63: 4 | B63: ='[November 10 2004.xls]S10'!$B$1 -> Bryan Mortenson | C63: ='[November 10 2004.xls]S10'!$F$24 -> 19 | D63: ='[November 10 2004.xls]S10'!B$24 -> 0 | E63: ='[November 10 2004.xls]S10'!C$24 -> 0 | F63: ='[November 10 2004.xls]S10'!D$24 -> 19 | G63: ='[November 10 2004.xls]S10'!E$24 -> 0
A64: 5 | B64: ='[November 10 2004.xls]S15'!$B$1 -> Les Langford | C64: ='[November 10 2004.xls]S15'!$F$24 -> 20 | D64: ='[November 10 2004.xls]S15'!B$24 -> 1 | E64: ='[November 10 2004.xls]S15'!C$24 -> 2 | F64: ='[November 10 2004.xls]S15'!D$24 -> 13 | G64: ='[November 10 2004.xls]S15'!E$24 -> 4
A65: 6 | B65: ='[November 10 2004.xls]S6'!$B$1 -> R Dan Phillips | C65: ='[November 10 2004.xls]S6'!$F$24 -> 24 | D65: ='[November 10 2004.xls]S6'!B$24 -> 1 | E65: ='[November 10 2004.xls]S6'!C$24 -> 2 | F65: ='[November 10 2004.xls]S6'!D$24 -> 15 | G65: ='[November 10 2004.xls]S6'!E$24 -> 6
A66: 7 | B66: ='[November 10 2004.xls]S4'!$B$1 -> Kevin Oliver | C66: ='[November 10 2004.xls]S4'!$F$24 -> 28 | D66: ='[November 10 2004.xls]S4'!B$24 -> 12 | E66: ='[November 10 2004.xls]S4'!C$24 -> 0 | F66: ='[November 10 2004.xls]S4'!D$24 -> 9 | G66: ='[November 10 2004.xls]S4'!E$24 -> 7
A67: 8 | B67: ='[November 10 2004.xls]S23'!$B$1 -> Dave Beck | C67: ='[November 10 2004.xls]S23'!$F$24 -> 29 | D67: ='[November 10 2004.xls]S23'!B$24 -> 0 | E67: ='[November 10 2004.xls]S23'!C$24 -> 5 | F67: ='[November 10 2004.xls]S23'!D$24 -> 22 | G67: ='[November 10 2004.xls]S23'!E$24 -> 2
A68: 9 | B68: ='[November 10 2004.xls]S13'!$B$1 -> Glen Allen | C68: ='[November 10 2004.xls]S13'!$F$24 -> 31 | D68: ='[November 10 2004.xls]S13'!B$24 -> 0 | E68: ='[November 10 2004.xls]S13'!C$24 -> 1 | F68: ='[November 10 2004.xls]S13'!D$24 -> 19 | G68: ='[November 10 2004.xls]S13'!E$24 -> 11
A69: 10 | B69: ='[November 10 2004.xls]S16'!$B$1 -> Dave Richards | C69: ='[November 10 2004.xls]S16'!$F$24 -> 33 | D69: ='[November 10 2004.xls]S16'!B$24 -> 7 | E69: ='[November 10 2004.xls]S16'!C$24 -> 1 | F69: ='[November 10 2004.xls]S16'!D$24 -> 24 | G69: ='[November 10 2004.xls]S16'!E$24 -> 1
A70: 11 | B70: ='[November 10 2004.xls]S21'!$B$1 -> Ken Thorne | C70: ='[November 10 2004.xls]S21'!$F$24 -> 33 | D70: ='[November 10 2004.xls]S21'!B$24 -> 9 | E70: ='[November 10 2004.xls]S21'!C$24 -> 5 | F70: ='[November 10 2004.xls]S21'!D$24 -> 9 | G70: ='[November 10 2004.xls]S21'!E$24 -> 10
A71: 12 | B71: ='[November 10 2004.xls]S20'!$B$1 -> Red (Rev) | C71: ='[November 10 2004.xls]S20'!$F$24 -> 38 | D71: ='[November 10 2004.xls]S20'!B$24 -> 5 | E71: ='[November 10 2004.xls]S20'!C$24 -> 1 | F71: ='[November 10 2004.xls]S20'!D$24 -> 32 | G71: ='[November 10 2004.xls]S20'!E$24 -> 0
A72: 13 | B72: ='[November 10 2004.xls]S2'!$B$1 -> Neil Hood | C72: ='[November 10 2004.xls]S2'!$F$24 -> 39 | D72: ='[November 10 2004.xls]S2'!B$24 -> 3 | E72: ='[November 10 2004.xls]S2'!C$24 -> 1 | F72: ='[November 10 2004.xls]S2'!D$24 -> 19 | G72: ='[November 10 2004.xls]S2'!E$24 -> 16
A73: 14 | B73: ='[November 10 2004.xls]S22'!$B$1 -> Danimal | C73: ='[November 10 2004.xls]S22'!$F$24 -> 39 | D73: ='[November 10 2004.xls]S22'!B$24 -> 7 | E73: ='[November 10 2004.xls]S22'!C$24 -> 1 | F73: ='[November 10 2004.xls]S22'!D$24 -> 23 | G73: ='[November 10 2004.xls]S22'!E$24 -> 8
A74: 15 | B74: ='[November 10 2004.xls]S9'!$B$1 -> Erin Herring | C74: ='[November 10 2004.xls]S9'!$F$24 -> 42 | D74: ='[November 10 2004.xls]S9'!B$24 -> 10 | E74: ='[November 10 2004.xls]S9'!C$24 -> 7 | F74: ='[November 10 2004.xls]S9'!D$24 -> 12 | G74: ='[November 10 2004.xls]S9'!E$24 -> 13
A75: 16 | B75: ='[November 10 2004.xls]S14'!$B$1 -> George T.\ | C75: ='[November 10 2004.xls]S14'!$F$24 -> 45 | D75: ='[November 10 2004.xls]S14'!B$24 -> 2 | E75: ='[November 10 2004.xls]S14'!C$24 -> 2 | F75: ='[November 10 2004.xls]S14'!D$24 -> 25 | G75: ='[November 10 2004.xls]S14'!E$24 -> 16
A76: 17 | B76: ='[November 10 2004.xls]S3'!$B$1 -> Roger Cox | C76: ='[November 10 2004.xls]S3'!$F$24 -> 56 | D76: ='[November 10 2004.xls]S3'!B$24 -> 15 | E76: ='[November 10 2004.xls]S3'!C$24 -> 4 | F76: ='[November 10 2004.xls]S3'!D$24 -> 25 | G76: ='[November 10 2004.xls]S3'!E$24 -> 12
A77: 18 | B77: ='[November 10 2004.xls]S17'!$B$1 -> Carl Burney | C77: ='[November 10 2004.xls]S17'!$F$24 -> 57 | D77: ='[November 10 2004.xls]S17'!B$24 -> 1 | E77: ='[November 10 2004.xls]S17'!C$24 -> 10 | F77: ='[November 10 2004.xls]S17'!D$24 -> 35 | G77: ='[November 10 2004.xls]S17'!E$24 -> 11
A78: 19 | B78: ='[November 10 2004.xls]S18'!$B$1 -> Robert Carr | C78: ='[November 10 2004.xls]S18'!$F$24 -> 58 | D78: ='[November 10 2004.xls]S18'!B$24 -> 0 | E78: ='[November 10 2004.xls]S18'!C$24 -> 7 | F78: ='[November 10 2004.xls]S18'!D$24 -> 33 | G78: ='[November 10 2004.xls]S18'!E$24 -> 18
A79: 20 | B79: ='[November 10 2004.xls]S8'!$B$1 -> Bill Dezell | C79: ='[November 10 2004.xls]S8'!$F$24 -> 59 | D79: ='[November 10 2004.xls]S8'!B$24 -> 13 | E79: ='[November 10 2004.xls]S8'!C$24 -> 8 | F79: ='[November 10 2004.xls]S8'!D$24 -> 27 | G79: ='[November 10 2004.xls]S8'!E$24 -> 11
A80: 21 | B80: ='[November 10 2004.xls]S7'!$B$1 -> Brian Talbut | C80: ='[November 10 2004.xls]S7'!$F$24 -> 70 | D80: ='[November 10 2004.xls]S7'!B$24 -> 13 | E80: ='[November 10 2004.xls]S7'!C$24 -> 7 | F80: ='[November 10 2004.xls]S7'!D$24 -> 29 | G80: ='[November 10 2004.xls]S7'!E$24 -> 21
A81: 22 | B81: ='[November 10 2004.xls]S19'!$B$1 -> Matt Beck | C81: ='[November 10 2004.xls]S19'!$F$24 -> 77 | D81: ='[November 10 2004.xls]S19'!B$24 -> 16 | E81: ='[November 10 2004.xls]S19'!C$24 -> 7 | F81: ='[November 10 2004.xls]S19'!D$24 -> 35 | G81: ='[November 10 2004.xls]S19'!E$24 -> 19
A82: 23 | B82: ='[November 10 2004.xls]S5'!$B$1 -> Carol Perez | C82: ='[November 10 2004.xls]S5'!$F$24 -> 80 | D82: ='[November 10 2004.xls]S5'!B$24 -> 23 | E82: ='[November 10 2004.xls]S5'!C$24 -> 7 | F82: ='[November 10 2004.xls]S5'!D$24 -> 29 | G82: ='[November 10 2004.xls]S5'!E$24 -> 21
A83: 24 | B83: ='[November 10 2004.xls]S12'!$B$1 -> Joel Jenkins | C83: ='[November 10 2004.xls]S12'!$F$24 -> 82 | D83: ='[November 10 2004.xls]S12'!B$24 -> 10 | E83: ='[November 10 2004.xls]S12'!C$24 -> 5 | F83: ='[November 10 2004.xls]S12'!D$24 -> 42 | G83: ='[November 10 2004.xls]S12'!E$24 -> 25
A84: S25 | B84: ='[November 10 2004.xls]S25'!$B$1 -> 0 | C84: ='[November 10 2004.xls]S25'!$F$24 -> 0 | D84: ='[November 10 2004.xls]S25'!B$24 -> 0 | E84: ='[November 10 2004.xls]S25'!C$24 -> 0 | F84: ='[November 10 2004.xls]S25'!D$24 -> 0 | G84: ='[November 10 2004.xls]S25'!E$24 -> 0
A85: Overall Average: | C85: =SUM(C60:C84)/$A$29 -> 42 | D85: =SUM(D60:D84)/$A$29 -> 6.541666666666667 | E85: =SUM(E60:E84)/$A$29 -> 3.8333333333333335 | F85: =SUM(F60:F84)/$A$29 -> 21.416666666666668 | G85: =SUM(G60:G84)/$A$29 -> 10.208333333333334