A1: Utah Shooting Academy Nov. 24th, 2004
A2: SCORES (Including points down and penalties)
A3: Place | B3: Name | C3: Match | D3: Stage 1 | E3: Stage 2 | F3: Stage 3 | G3: Stage 4
A4: 1 | B4: ='[November 24 2004.xls]S14'!$B$1 -> Les Langford | C4: ='[November 24 2004.xls]S14'!$F$27 -> 128.36 | D4: ='[November 24 2004.xls]S14'!B$27 -> 29.09 | E4: ='[November 24 2004.xls]S14'!C$27 -> 51.43 | F4: ='[November 24 2004.xls]S14'!D$27 -> 9.95 | G4: ='[November 24 2004.xls]S14'!E$27 -> 37.89
A5: 2 | B5: ='[November 24 2004.xls]S4'!$B$1 -> Bryan Mortenson | C5: ='[November 24 2004.xls]S4'!$F$27 -> 136.57 | D5: ='[November 24 2004.xls]S4'!B$27 -> 34.47 | E5: ='[November 24 2004.xls]S4'!C$27 -> 51.28 | F5: ='[November 24 2004.xls]S4'!D$27 -> 8.89 | G5: ='[November 24 2004.xls]S4'!E$27 -> 41.93
A6: 3 | B6: ='[November 24 2004.xls]S15'!$B$1 -> Blake Huff | C6: ='[November 24 2004.xls]S15'!$F$27 -> 154.36 | D6: ='[November 24 2004.xls]S15'!B$27 -> 44.11 | E6: ='[November 24 2004.xls]S15'!C$27 -> 49.37 | F6: ='[November 24 2004.xls]S15'!D$27 -> 9.13 | G6: ='[November 24 2004.xls]S15'!E$27 -> 51.75
A7: 4 | B7: ='[November 24 2004.xls]S8'!$B$1 -> Chris Roach | C7: ='[November 24 2004.xls]S8'!$F$27 -> 169.69 | D7: ='[November 24 2004.xls]S8'!B$27 -> 33.00 | E7: ='[November 24 2004.xls]S8'!C$27 -> 60.13 | F7: ='[November 24 2004.xls]S8'!D$27 -> 17.08 | G7: ='[November 24 2004.xls]S8'!E$27 -> 59.48
A8: 5 | B8: ='[November 24 2004.xls]S1'!$B$1 -> Justin Park | C8: ='[November 24 2004.xls]S1'!$F$27 -> 187.13 | D8: ='[November 24 2004.xls]S1'!B$27 -> 42.96 | E8: ='[November 24 2004.xls]S1'!C$27 -> 81.04 | F8: ='[November 24 2004.xls]S1'!D$27 -> 18.75 | G8: ='[November 24 2004.xls]S1'!E$27 -> 44.38
A9: 6 | B9: ='[November 24 2004.xls]S6'!$B$1 -> Roger "The Beast" Cox | C9: ='[November 24 2004.xls]S6'!$F$27 -> 190.22 | D9: ='[November 24 2004.xls]S6'!B$27 -> 38.24 | E9: ='[November 24 2004.xls]S6'!C$27 -> 73.33 | F9: ='[November 24 2004.xls]S6'!D$27 -> 14.88 | G9: ='[November 24 2004.xls]S6'!E$27 -> 63.77
A10: 7 | B10: George Tekmitchov | C10: ='[November 24 2004.xls]S16'!$F$27 -> 190.51 | D10: ='[November 24 2004.xls]S16'!B$27 -> 61.58 | E10: ='[November 24 2004.xls]S16'!C$27 -> 55.12 | F10: ='[November 24 2004.xls]S16'!D$27 -> 21.57 | G10: ='[November 24 2004.xls]S16'!E$27 -> 52.24
A11: 8 | B11: ='[November 24 2004.xls]S17'!$B$1 -> R Dan | C11: ='[November 24 2004.xls]S17'!$F$27 -> 194.05 | D11: ='[November 24 2004.xls]S17'!B$27 -> 48.04 | E11: ='[November 24 2004.xls]S17'!C$27 -> 70.85 | F11: ='[November 24 2004.xls]S17'!D$27 -> 20.99 | G11: ='[November 24 2004.xls]S17'!E$27 -> 54.17
A12: 9 | B12: ='[November 24 2004.xls]S11'!$B$1 -> Carl Burney | C12: ='[November 24 2004.xls]S11'!$F$27 -> 230.62 | D12: ='[November 24 2004.xls]S11'!B$27 -> 68.81 | E12: ='[November 24 2004.xls]S11'!C$27 -> 75.81 | F12: ='[November 24 2004.xls]S11'!D$27 -> 24.23 | G12: ='[November 24 2004.xls]S11'!E$27 -> 61.77
A13: 10 | B13: ='[November 24 2004.xls]S9'!$B$1 -> Harold Simpson | C13: ='[November 24 2004.xls]S9'!$F$27 -> 241.39 | D13: ='[November 24 2004.xls]S9'!B$27 -> 56.79 | E13: ='[November 24 2004.xls]S9'!C$27 -> 91.20 | F13: ='[November 24 2004.xls]S9'!D$27 -> 21.30 | G13: ='[November 24 2004.xls]S9'!E$27 -> 72.10
A14: 11 | B14: ='[November 24 2004.xls]S3'!$B$1 -> Ken Thorne | C14: ='[November 24 2004.xls]S3'!$F$27 -> 246.36 | D14: ='[November 24 2004.xls]S3'!B$27 -> 52.27 | E14: ='[November 24 2004.xls]S3'!C$27 -> 72.02 | F14: ='[November 24 2004.xls]S3'!D$27 -> 29.15 | G14: ='[November 24 2004.xls]S3'!E$27 -> 92.92
A15: 12 | B15: ='[November 24 2004.xls]S7'!$B$1 -> Ryan Thorne | C15: ='[November 24 2004.xls]S7'!$F$27 -> 261.11 | D15: ='[November 24 2004.xls]S7'!B$27 -> 51.18 | E15: ='[November 24 2004.xls]S7'!C$27 -> 91.06 | F15: ='[November 24 2004.xls]S7'!D$27 -> 33.89 | G15: ='[November 24 2004.xls]S7'!E$27 -> 84.98
A16: 13 | B16: ='[November 24 2004.xls]S2'!$B$1 -> Danimal | C16: ='[November 24 2004.xls]S2'!$F$27 -> 301.68 | D16: ='[November 24 2004.xls]S2'!B$27 -> 78.22 | E16: ='[November 24 2004.xls]S2'!C$27 -> 97.60 | F16: ='[November 24 2004.xls]S2'!D$27 -> 50.07 | G16: ='[November 24 2004.xls]S2'!E$27 -> 75.79
A17: 14 | B17: ='[November 24 2004.xls]S5'!$B$1 -> Bill Dezell | C17: ='[November 24 2004.xls]S5'!$F$27 -> 315.06 | D17: ='[November 24 2004.xls]S5'!B$27 -> 47.21 | E17: ='[November 24 2004.xls]S5'!C$27 -> 89.50 | F17: ='[November 24 2004.xls]S5'!D$27 -> 78.63 | G17: ='[November 24 2004.xls]S5'!E$27 -> 99.72
A18: 15 | B18: ='[November 24 2004.xls]S12'!$B$1 -> George Crawford | C18: ='[November 24 2004.xls]S12'!$F$27 -> 392.31 | D18: ='[November 24 2004.xls]S12'!B$27 -> 62.26 | E18: ='[November 24 2004.xls]S12'!C$27 -> 95.00 | F18: ='[November 24 2004.xls]S12'!D$27 -> 42.27 | G18: ='[November 24 2004.xls]S12'!E$27 -> 192.78
A19: 16 | B19: ='[November 24 2004.xls]S13'!$B$1 -> Carol Perez | C19: ='[November 24 2004.xls]S13'!$F$27 -> 402.10 | D19: ='[November 24 2004.xls]S13'!B$27 -> 123.06 | E19: ='[November 24 2004.xls]S13'!C$27 -> 108.08 | F19: ='[November 24 2004.xls]S13'!D$27 -> 26.32 | G19: ='[November 24 2004.xls]S13'!E$27 -> 144.64
A20: 17 | B20: ='[November 24 2004.xls]S10'!$B$1 -> Erin Herring | C20: ='[November 24 2004.xls]S10'!$F$27 -> 428.81 | D20: ='[November 24 2004.xls]S10'!B$27 -> 117.60 | E20: ='[November 24 2004.xls]S10'!C$27 -> 120.56 | F20: ='[November 24 2004.xls]S10'!D$27 -> 61.92 | G20: ='[November 24 2004.xls]S10'!E$27 -> 128.73
A21: S18 | B21: ='[November 24 2004.xls]S18'!$B$1 -> 0 | C21: ='[November 24 2004.xls]S18'!$F$27 -> 0.00 | D21: ='[November 24 2004.xls]S18'!B$27 -> 0.00 | E21: ='[November 24 2004.xls]S18'!C$27 -> 0.00 | F21: ='[November 24 2004.xls]S18'!D$27 -> 0.00 | G21: ='[November 24 2004.xls]S18'!E$27 -> 0.00
A22: S19 | B22: ='[November 24 2004.xls]S19'!$B$1 -> 0 | C22: ='[November 24 2004.xls]S19'!$F$27 -> 0.00 | D22: ='[November 24 2004.xls]S19'!B$27 -> 0.00 | E22: ='[November 24 2004.xls]S19'!C$27 -> 0.00 | F22: ='[November 24 2004.xls]S19'!D$27 -> 0.00 | G22: ='[November 24 2004.xls]S19'!E$27 -> 0.00
A23: S20 | B23: ='[November 24 2004.xls]S20'!$B$1 -> 0 | C23: ='[November 24 2004.xls]S20'!$F$27 -> 0.00 | D23: ='[November 24 2004.xls]S20'!B$27 -> 0.00 | E23: ='[November 24 2004.xls]S20'!C$27 -> 0.00 | F23: ='[November 24 2004.xls]S20'!D$27 -> 0.00 | G23: ='[November 24 2004.xls]S20'!E$27 -> 0.00
A24: S21 | B24: ='[November 24 2004.xls]S21'!$B$1 -> 0 | C24: ='[November 24 2004.xls]S21'!$F$27 -> 0.00 | D24: ='[November 24 2004.xls]S21'!B$27 -> 0.00 | E24: ='[November 24 2004.xls]S21'!C$27 -> 0.00 | F24: ='[November 24 2004.xls]S21'!D$27 -> 0.00 | G24: ='[November 24 2004.xls]S21'!E$27 -> 0.00
A25: S22 | B25: ='[November 24 2004.xls]S22'!$B$1 -> 0 | C25: ='[November 24 2004.xls]S22'!$F$27 -> 0.00 | D25: ='[November 24 2004.xls]S22'!B$27 -> 0.00 | E25: ='[November 24 2004.xls]S22'!C$27 -> 0.00 | F25: ='[November 24 2004.xls]S22'!D$27 -> 0.00 | G25: ='[November 24 2004.xls]S22'!E$27 -> 0.00
A26: S23 | B26: ='[November 24 2004.xls]S23'!$B$1 -> 0 | C26: ='[November 24 2004.xls]S23'!$F$27 -> 0.00 | D26: ='[November 24 2004.xls]S23'!B$27 -> 0.00 | E26: ='[November 24 2004.xls]S23'!C$27 -> 0.00 | F26: ='[November 24 2004.xls]S23'!D$27 -> 0.00 | G26: ='[November 24 2004.xls]S23'!E$27 -> 0.00
A27: S24 | B27: ='[November 24 2004.xls]S24'!$B$1 -> 0 | C27: ='[November 24 2004.xls]S24'!$F$27 -> 0.00 | D27: ='[November 24 2004.xls]S24'!B$27 -> 0.00 | E27: ='[November 24 2004.xls]S24'!C$27 -> 0.00 | F27: ='[November 24 2004.xls]S24'!D$27 -> 0.00 | G27: ='[November 24 2004.xls]S24'!E$27 -> 0.00
A28: S25 | B28: ='[November 24 2004.xls]S25'!$B$1 -> 0 | C28: ='[November 24 2004.xls]S25'!$F$27 -> 0.00 | D28: ='[November 24 2004.xls]S25'!B$27 -> 0.00 | E28: ='[November 24 2004.xls]S25'!C$27 -> 0.00 | F28: ='[November 24 2004.xls]S25'!D$27 -> 0.00 | G28: ='[November 24 2004.xls]S25'!E$27 -> 0.00
A29: =COUNTIF($C$4:$C$28,">0") -> 17 | B29: Overall Average: | C29: =SUM(C4:C28)/$A$29 -> 245.3135294117647 | D29: =SUM(D4:D28)/$A$29 -> 58.17 | E29: =SUM(E4:E28)/$A$29 -> 78.434117647058798 | F29: =SUM(F4:F28)/$A$29 -> 28.765882352941176 | G29: =SUM(G4:G28)/$A$29 -> 79.9435294117647
A30: RAW TIMES
A31: Place | B31: Name | C31: Match | D31: Stage 1 | E31: Stage 2 | F31: Stage 3 | G31: Stage 4
A32: 1 | B32: ='[November 24 2004.xls]S14'!$B$1 -> Les Langford | C32: ='[November 24 2004.xls]S14'!$F$23 -> 119.86 | D32: ='[November 24 2004.xls]S14'!B$23 -> 26.59 | E32: ='[November 24 2004.xls]S14'!C$23 -> 45.43 | F32: ='[November 24 2004.xls]S14'!D$23 -> 9.95 | G32: ='[November 24 2004.xls]S14'!E$23 -> 37.89
A33: 2 | B33: ='[November 24 2004.xls]S4'!$B$1 -> Bryan Mortenson | C33: ='[November 24 2004.xls]S4'!$F$23 -> 134.07 | D33: ='[November 24 2004.xls]S4'!B$23 -> 34.47 | E33: ='[November 24 2004.xls]S4'!C$23 -> 48.78 | F33: ='[November 24 2004.xls]S4'!D$23 -> 8.89 | G33: ='[November 24 2004.xls]S4'!E$23 -> 41.93
A34: 3 | B34: ='[November 24 2004.xls]S15'!$B$1 -> Blake Huff | C34: ='[November 24 2004.xls]S15'!$F$23 -> 143.86 | D34: ='[November 24 2004.xls]S15'!B$23 -> 40.11 | E34: ='[November 24 2004.xls]S15'!C$23 -> 42.87 | F34: ='[November 24 2004.xls]S15'!D$23 -> 9.13 | G34: ='[November 24 2004.xls]S15'!E$23 -> 51.75
A35: 4 | B35: ='[November 24 2004.xls]S8'!$B$1 -> Chris Roach | C35: ='[November 24 2004.xls]S8'!$F$23 -> 156.69 | D35: ='[November 24 2004.xls]S8'!B$23 -> 29.00 | E35: ='[November 24 2004.xls]S8'!C$23 -> 51.13 | F35: ='[November 24 2004.xls]S8'!D$23 -> 17.08 | G35: ='[November 24 2004.xls]S8'!E$23 -> 59.48
A36: 5 | B36: ='[November 24 2004.xls]S6'!$B$1 -> Roger "The Beast" Cox | C36: ='[November 24 2004.xls]S6'!$F$23 -> 164.22 | D36: ='[November 24 2004.xls]S6'!B$23 -> 32.74 | E36: ='[November 24 2004.xls]S6'!C$23 -> 52.83 | F36: ='[November 24 2004.xls]S6'!D$23 -> 14.88 | G36: ='[November 24 2004.xls]S6'!E$23 -> 63.77
A37: 6 | B37: ='[November 24 2004.xls]S1'!$B$1 -> Justin Park | C37: ='[November 24 2004.xls]S1'!$F$23 -> 168.63 | D37: ='[November 24 2004.xls]S1'!B$23 -> 30.96 | E37: ='[November 24 2004.xls]S1'!C$23 -> 74.54 | F37: ='[November 24 2004.xls]S1'!D$23 -> 18.75 | G37: ='[November 24 2004.xls]S1'!E$23 -> 44.38
A38: 7 | B38: ='[November 24 2004.xls]S17'!$B$1 -> R Dan | C38: ='[November 24 2004.xls]S17'!$F$23 -> 174.05 | D38: ='[November 24 2004.xls]S17'!B$23 -> 38.04 | E38: ='[November 24 2004.xls]S17'!C$23 -> 60.85 | F38: ='[November 24 2004.xls]S17'!D$23 -> 20.99 | G38: ='[November 24 2004.xls]S17'!E$23 -> 54.17
A39: 8 | B39: George Tekmitchov | C39: ='[November 24 2004.xls]S16'!$F$23 -> 178.51 | D39: ='[November 24 2004.xls]S16'!B$23 -> 54.08 | E39: ='[November 24 2004.xls]S16'!C$23 -> 50.62 | F39: ='[November 24 2004.xls]S16'!D$23 -> 21.57 | G39: ='[November 24 2004.xls]S16'!E$23 -> 52.24
A40: 9 | B40: ='[November 24 2004.xls]S11'!$B$1 -> Carl Burney | C40: ='[November 24 2004.xls]S11'!$F$23 -> 217.12 | D40: ='[November 24 2004.xls]S11'!B$23 -> 56.31 | E40: ='[November 24 2004.xls]S11'!C$23 -> 74.81 | F40: ='[November 24 2004.xls]S11'!D$23 -> 24.23 | G40: ='[November 24 2004.xls]S11'!E$23 -> 61.77
A41: 10 | B41: ='[November 24 2004.xls]S9'!$B$1 -> Harold Simpson | C41: ='[November 24 2004.xls]S9'!$F$23 -> 217.39 | D41: ='[November 24 2004.xls]S9'!B$23 -> 40.79 | E41: ='[November 24 2004.xls]S9'!C$23 -> 83.20 | F41: ='[November 24 2004.xls]S9'!D$23 -> 21.30 | G41: ='[November 24 2004.xls]S9'!E$23 -> 72.10
A42: 11 | B42: ='[November 24 2004.xls]S3'!$B$1 -> Ken Thorne | C42: ='[November 24 2004.xls]S3'!$F$23 -> 231.86 | D42: ='[November 24 2004.xls]S3'!B$23 -> 47.27 | E42: ='[November 24 2004.xls]S3'!C$23 -> 62.52 | F42: ='[November 24 2004.xls]S3'!D$23 -> 29.15 | G42: ='[November 24 2004.xls]S3'!E$23 -> 92.92
A43: 12 | B43: ='[November 24 2004.xls]S7'!$B$1 -> Ryan Thorne | C43: ='[November 24 2004.xls]S7'!$F$23 -> 248.11 | D43: ='[November 24 2004.xls]S7'!B$23 -> 44.68 | E43: ='[November 24 2004.xls]S7'!C$23 -> 84.56 | F43: ='[November 24 2004.xls]S7'!D$23 -> 33.89 | G43: ='[November 24 2004.xls]S7'!E$23 -> 84.98
A44: 13 | B44: ='[November 24 2004.xls]S5'!$B$1 -> Bill Dezell | C44: ='[November 24 2004.xls]S5'!$F$23 -> 285.56 | D44: ='[November 24 2004.xls]S5'!B$23 -> 41.71 | E44: ='[November 24 2004.xls]S5'!C$23 -> 65.50 | F44: ='[November 24 2004.xls]S5'!D$23 -> 78.63 | G44: ='[November 24 2004.xls]S5'!E$23 -> 99.72
A45: 14 | B45: ='[November 24 2004.xls]S2'!$B$1 -> Danimal | C45: ='[November 24 2004.xls]S2'!$F$23 -> 288.18 | D45: ='[November 24 2004.xls]S2'!B$23 -> 69.22 | E45: ='[November 24 2004.xls]S2'!C$23 -> 93.10 | F45: ='[November 24 2004.xls]S2'!D$23 -> 50.07 | G45: ='[November 24 2004.xls]S2'!E$23 -> 75.79
A46: 15 | B46: ='[November 24 2004.xls]S13'!$B$1 -> Carol Perez | C46: ='[November 24 2004.xls]S13'!$F$23 -> 353.10 | D46: ='[November 24 2004.xls]S13'!B$23 -> 102.56 | E46: ='[November 24 2004.xls]S13'!C$23 -> 79.58 | F46: ='[November 24 2004.xls]S13'!D$23 -> 26.32 | G46: ='[November 24 2004.xls]S13'!E$23 -> 144.64
A47: 16 | B47: ='[November 24 2004.xls]S12'!$B$1 -> George Crawford | C47: ='[November 24 2004.xls]S12'!$F$23 -> 377.81 | D47: ='[November 24 2004.xls]S12'!B$23 -> 57.26 | E47: ='[November 24 2004.xls]S12'!C$23 -> 85.50 | F47: ='[November 24 2004.xls]S12'!D$23 -> 42.27 | G47: ='[November 24 2004.xls]S12'!E$23 -> 192.78
A48: 17 | B48: ='[November 24 2004.xls]S10'!$B$1 -> Erin Herring | C48: ='[November 24 2004.xls]S10'!$F$23 -> 408.81 | D48: ='[November 24 2004.xls]S10'!B$23 -> 105.60 | E48: ='[November 24 2004.xls]S10'!C$23 -> 112.56 | F48: ='[November 24 2004.xls]S10'!D$23 -> 61.92 | G48: ='[November 24 2004.xls]S10'!E$23 -> 128.73
A49: S18 | B49: ='[November 24 2004.xls]S18'!$B$1 -> 0 | C49: ='[November 24 2004.xls]S18'!$F$23 -> 0.00 | D49: ='[November 24 2004.xls]S18'!B$23 -> 0.00 | E49: ='[November 24 2004.xls]S18'!C$23 -> 0.00 | F49: ='[November 24 2004.xls]S18'!D$23 -> 0.00 | G49: ='[November 24 2004.xls]S18'!E$23 -> 0.00
A50: S19 | B50: ='[November 24 2004.xls]S19'!$B$1 -> 0 | C50: ='[November 24 2004.xls]S19'!$F$23 -> 0.00 | D50: ='[November 24 2004.xls]S19'!B$23 -> 0.00 | E50: ='[November 24 2004.xls]S19'!C$23 -> 0.00 | F50: ='[November 24 2004.xls]S19'!D$23 -> 0.00 | G50: ='[November 24 2004.xls]S19'!E$23 -> 0.00
A51: S20 | B51: ='[November 24 2004.xls]S20'!$B$1 -> 0 | C51: ='[November 24 2004.xls]S20'!$F$23 -> 0.00 | D51: ='[November 24 2004.xls]S20'!B$23 -> 0.00 | E51: ='[November 24 2004.xls]S20'!C$23 -> 0.00 | F51: ='[November 24 2004.xls]S20'!D$23 -> 0.00 | G51: ='[November 24 2004.xls]S20'!E$23 -> 0.00
A52: S21 | B52: ='[November 24 2004.xls]S21'!$B$1 -> 0 | C52: ='[November 24 2004.xls]S21'!$F$23 -> 0.00 | D52: ='[November 24 2004.xls]S21'!B$23 -> 0.00 | E52: ='[November 24 2004.xls]S21'!C$23 -> 0.00 | F52: ='[November 24 2004.xls]S21'!D$23 -> 0.00 | G52: ='[November 24 2004.xls]S21'!E$23 -> 0.00
A53: S22 | B53: ='[November 24 2004.xls]S22'!$B$1 -> 0 | C53: ='[November 24 2004.xls]S22'!$F$23 -> 0.00 | D53: ='[November 24 2004.xls]S22'!B$23 -> 0.00 | E53: ='[November 24 2004.xls]S22'!C$23 -> 0.00 | F53: ='[November 24 2004.xls]S22'!D$23 -> 0.00 | G53: ='[November 24 2004.xls]S22'!E$23 -> 0.00
A54: S23 | B54: ='[November 24 2004.xls]S23'!$B$1 -> 0 | C54: ='[November 24 2004.xls]S23'!$F$23 -> 0.00 | D54: ='[November 24 2004.xls]S23'!B$23 -> 0.00 | E54: ='[November 24 2004.xls]S23'!C$23 -> 0.00 | F54: ='[November 24 2004.xls]S23'!D$23 -> 0.00 | G54: ='[November 24 2004.xls]S23'!E$23 -> 0.00
A55: S24 | B55: ='[November 24 2004.xls]S24'!$B$1 -> 0 | C55: ='[November 24 2004.xls]S24'!$F$23 -> 0.00 | D55: ='[November 24 2004.xls]S24'!B$23 -> 0.00 | E55: ='[November 24 2004.xls]S24'!C$23 -> 0.00 | F55: ='[November 24 2004.xls]S24'!D$23 -> 0.00 | G55: ='[November 24 2004.xls]S24'!E$23 -> 0.00
A56: S25 | B56: ='[November 24 2004.xls]S25'!$B$1 -> 0 | C56: ='[November 24 2004.xls]S25'!$F$23 -> 0.00 | D56: ='[November 24 2004.xls]S25'!B$23 -> 0.00 | E56: ='[November 24 2004.xls]S25'!C$23 -> 0.00 | F56: ='[November 24 2004.xls]S25'!D$23 -> 0.00 | G56: ='[November 24 2004.xls]S25'!E$23 -> 0.00
A57: Overall Average: | C57: =SUM(C32:C56)/$A$29 -> 227.51941176470586 | D57: =SUM(D32:D56)/$A$29 -> 50.08176470588235 | E57: =SUM(E32:E56)/$A$29 -> 68.728235294117653 | F57: =SUM(F32:F56)/$A$29 -> 28.765882352941176 | G57: =SUM(G32:G56)/$A$29 -> 79.9435294117647
A58: POINTS DOWN
A59: Place | B59: Name | C59: Match | D59: Stage 1 | E59: Stage 2 | F59: Stage 3 | G59: Stage 4
A60: 1 | B60: ='[November 24 2004.xls]S4'!$B$1 -> Bryan Mortenson | C60: ='[November 24 2004.xls]S4'!$F$24 -> 5 | D60: ='[November 24 2004.xls]S4'!B$24 -> 0 | E60: ='[November 24 2004.xls]S4'!C$24 -> 5 | F60: ='[November 24 2004.xls]S4'!D$24 -> 0 | G60: ='[November 24 2004.xls]S4'!E$24 -> 0
A61: 2 | B61: ='[November 24 2004.xls]S14'!$B$1 -> Les Langford | C61: ='[November 24 2004.xls]S14'!$F$24 -> 17 | D61: ='[November 24 2004.xls]S14'!B$24 -> 5 | E61: ='[November 24 2004.xls]S14'!C$24 -> 12 | F61: ='[November 24 2004.xls]S14'!D$24 -> 0 | G61: ='[November 24 2004.xls]S14'!E$24 -> 0
A62: 3 | B62: ='[November 24 2004.xls]S15'!$B$1 -> Blake Huff | C62: ='[November 24 2004.xls]S15'!$F$24 -> 21 | D62: ='[November 24 2004.xls]S15'!B$24 -> 8 | E62: ='[November 24 2004.xls]S15'!C$24 -> 13 | F62: ='[November 24 2004.xls]S15'!D$24 -> 0 | G62: ='[November 24 2004.xls]S15'!E$24 -> 0
A63: 4 | B63: George Tekmitchov | C63: ='[November 24 2004.xls]S16'!$F$24 -> 24 | D63: ='[November 24 2004.xls]S16'!B$24 -> 15 | E63: ='[November 24 2004.xls]S16'!C$24 -> 9 | F63: ='[November 24 2004.xls]S16'!D$24 -> 0 | G63: ='[November 24 2004.xls]S16'!E$24 -> 0
A64: 5 | B64: ='[November 24 2004.xls]S7'!$B$1 -> Ryan Thorne | C64: ='[November 24 2004.xls]S7'!$F$24 -> 26 | D64: ='[November 24 2004.xls]S7'!B$24 -> 13 | E64: ='[November 24 2004.xls]S7'!C$24 -> 13 | F64: ='[November 24 2004.xls]S7'!D$24 -> 0 | G64: ='[November 24 2004.xls]S7'!E$24 -> 0
A65: 6 | B65: ='[November 24 2004.xls]S8'!$B$1 -> Chris Roach | C65: ='[November 24 2004.xls]S8'!$F$24 -> 26 | D65: ='[November 24 2004.xls]S8'!B$24 -> 8 | E65: ='[November 24 2004.xls]S8'!C$24 -> 18 | F65: ='[November 24 2004.xls]S8'!D$24 -> 0 | G65: ='[November 24 2004.xls]S8'!E$24 -> 0
A66: 7 | B66: ='[November 24 2004.xls]S2'!$B$1 -> Danimal | C66: ='[November 24 2004.xls]S2'!$F$24 -> 27 | D66: ='[November 24 2004.xls]S2'!B$24 -> 18 | E66: ='[November 24 2004.xls]S2'!C$24 -> 9 | F66: ='[November 24 2004.xls]S2'!D$24 -> 0 | G66: ='[November 24 2004.xls]S2'!E$24 -> 0
A67: 8 | B67: ='[November 24 2004.xls]S11'!$B$1 -> Carl Burney | C67: ='[November 24 2004.xls]S11'!$F$24 -> 27 | D67: ='[November 24 2004.xls]S11'!B$24 -> 25 | E67: ='[November 24 2004.xls]S11'!C$24 -> 2 | F67: ='[November 24 2004.xls]S11'!D$24 -> 0 | G67: ='[November 24 2004.xls]S11'!E$24 -> 0
A68: 9 | B68: ='[November 24 2004.xls]S3'!$B$1 -> Ken Thorne | C68: ='[November 24 2004.xls]S3'!$F$24 -> 29 | D68: ='[November 24 2004.xls]S3'!B$24 -> 10 | E68: ='[November 24 2004.xls]S3'!C$24 -> 19 | F68: ='[November 24 2004.xls]S3'!D$24 -> 0 | G68: ='[November 24 2004.xls]S3'!E$24 -> 0
A69: 10 | B69: ='[November 24 2004.xls]S12'!$B$1 -> George Crawford | C69: ='[November 24 2004.xls]S12'!$F$24 -> 29 | D69: ='[November 24 2004.xls]S12'!B$24 -> 10 | E69: ='[November 24 2004.xls]S12'!C$24 -> 19 | F69: ='[November 24 2004.xls]S12'!D$24 -> 0 | G69: ='[November 24 2004.xls]S12'!E$24 -> 0
A70: 11 | B70: ='[November 24 2004.xls]S1'!$B$1 -> Justin Park | C70: ='[November 24 2004.xls]S1'!$F$24 -> 37 | D70: ='[November 24 2004.xls]S1'!B$24 -> 24 | E70: ='[November 24 2004.xls]S1'!C$24 -> 13 | F70: ='[November 24 2004.xls]S1'!D$24 -> 0 | G70: ='[November 24 2004.xls]S1'!E$24 -> 0
A71: 12 | B71: ='[November 24 2004.xls]S10'!$B$1 -> Erin Herring | C71: ='[November 24 2004.xls]S10'!$F$24 -> 40 | D71: ='[November 24 2004.xls]S10'!B$24 -> 24 | E71: ='[November 24 2004.xls]S10'!C$24 -> 16 | F71: ='[November 24 2004.xls]S10'!D$24 -> 0 | G71: ='[November 24 2004.xls]S10'!E$24 -> 0
A72: 13 | B72: ='[November 24 2004.xls]S17'!$B$1 -> R Dan | C72: ='[November 24 2004.xls]S17'!$F$24 -> 40 | D72: ='[November 24 2004.xls]S17'!B$24 -> 20 | E72: ='[November 24 2004.xls]S17'!C$24 -> 20 | F72: ='[November 24 2004.xls]S17'!D$24 -> 0 | G72: ='[November 24 2004.xls]S17'!E$24 -> 0
A73: 14 | B73: ='[November 24 2004.xls]S9'!$B$1 -> Harold Simpson | C73: ='[November 24 2004.xls]S9'!$F$24 -> 48 | D73: ='[November 24 2004.xls]S9'!B$24 -> 32 | E73: ='[November 24 2004.xls]S9'!C$24 -> 16 | F73: ='[November 24 2004.xls]S9'!D$24 -> 0 | G73: ='[November 24 2004.xls]S9'!E$24 -> 0
A74: 15 | B74: ='[November 24 2004.xls]S6'!$B$1 -> Roger "The Beast" Cox | C74: ='[November 24 2004.xls]S6'!$F$24 -> 52 | D74: ='[November 24 2004.xls]S6'!B$24 -> 11 | E74: ='[November 24 2004.xls]S6'!C$24 -> 41 | F74: ='[November 24 2004.xls]S6'!D$24 -> 0 | G74: ='[November 24 2004.xls]S6'!E$24 -> 0
A75: 16 | B75: ='[November 24 2004.xls]S5'!$B$1 -> Bill Dezell | C75: ='[November 24 2004.xls]S5'!$F$24 -> 59 | D75: ='[November 24 2004.xls]S5'!B$24 -> 11 | E75: ='[November 24 2004.xls]S5'!C$24 -> 48 | F75: ='[November 24 2004.xls]S5'!D$24 -> 0 | G75: ='[November 24 2004.xls]S5'!E$24 -> 0
A76: 17 | B76: ='[November 24 2004.xls]S13'!$B$1 -> Carol Perez | C76: ='[November 24 2004.xls]S13'!$F$24 -> 98 | D76: ='[November 24 2004.xls]S13'!B$24 -> 41 | E76: ='[November 24 2004.xls]S13'!C$24 -> 57 | F76: ='[November 24 2004.xls]S13'!D$24 -> 0 | G76: ='[November 24 2004.xls]S13'!E$24 -> 0
A77: S18 | B77: ='[November 24 2004.xls]S18'!$B$1 -> 0 | C77: ='[November 24 2004.xls]S18'!$F$24 -> 0 | D77: ='[November 24 2004.xls]S18'!B$24 -> 0 | E77: ='[November 24 2004.xls]S18'!C$24 -> 0 | F77: ='[November 24 2004.xls]S18'!D$24 -> 0 | G77: ='[November 24 2004.xls]S18'!E$24 -> 0
A78: S19 | B78: ='[November 24 2004.xls]S19'!$B$1 -> 0 | C78: ='[November 24 2004.xls]S19'!$F$24 -> 0 | D78: ='[November 24 2004.xls]S19'!B$24 -> 0 | E78: ='[November 24 2004.xls]S19'!C$24 -> 0 | F78: ='[November 24 2004.xls]S19'!D$24 -> 0 | G78: ='[November 24 2004.xls]S19'!E$24 -> 0
A79: S20 | B79: ='[November 24 2004.xls]S20'!$B$1 -> 0 | C79: ='[November 24 2004.xls]S20'!$F$24 -> 0 | D79: ='[November 24 2004.xls]S20'!B$24 -> 0 | E79: ='[November 24 2004.xls]S20'!C$24 -> 0 | F79: ='[November 24 2004.xls]S20'!D$24 -> 0 | G79: ='[November 24 2004.xls]S20'!E$24 -> 0
A80: S21 | B80: ='[November 24 2004.xls]S21'!$B$1 -> 0 | C80: ='[November 24 2004.xls]S21'!$F$24 -> 0 | D80: ='[November 24 2004.xls]S21'!B$24 -> 0 | E80: ='[November 24 2004.xls]S21'!C$24 -> 0 | F80: ='[November 24 2004.xls]S21'!D$24 -> 0 | G80: ='[November 24 2004.xls]S21'!E$24 -> 0
A81: S22 | B81: ='[November 24 2004.xls]S22'!$B$1 -> 0 | C81: ='[November 24 2004.xls]S22'!$F$24 -> 0 | D81: ='[November 24 2004.xls]S22'!B$24 -> 0 | E81: ='[November 24 2004.xls]S22'!C$24 -> 0 | F81: ='[November 24 2004.xls]S22'!D$24 -> 0 | G81: ='[November 24 2004.xls]S22'!E$24 -> 0
A82: S23 | B82: ='[November 24 2004.xls]S23'!$B$1 -> 0 | C82: ='[November 24 2004.xls]S23'!$F$24 -> 0 | D82: ='[November 24 2004.xls]S23'!B$24 -> 0 | E82: ='[November 24 2004.xls]S23'!C$24 -> 0 | F82: ='[November 24 2004.xls]S23'!D$24 -> 0 | G82: ='[November 24 2004.xls]S23'!E$24 -> 0
A83: S24 | B83: ='[November 24 2004.xls]S24'!$B$1 -> 0 | C83: ='[November 24 2004.xls]S24'!$F$24 -> 0 | D83: ='[November 24 2004.xls]S24'!B$24 -> 0 | E83: ='[November 24 2004.xls]S24'!C$24 -> 0 | F83: ='[November 24 2004.xls]S24'!D$24 -> 0 | G83: ='[November 24 2004.xls]S24'!E$24 -> 0
A84: S25 | B84: ='[November 24 2004.xls]S25'!$B$1 -> 0 | C84: ='[November 24 2004.xls]S25'!$F$24 -> 0 | D84: ='[November 24 2004.xls]S25'!B$24 -> 0 | E84: ='[November 24 2004.xls]S25'!C$24 -> 0 | F84: ='[November 24 2004.xls]S25'!D$24 -> 0 | G84: ='[November 24 2004.xls]S25'!E$24 -> 0
A85: Overall Average: | C85: =SUM(C60:C84)/$A$29 -> 35.588235294117645 | D85: =SUM(D60:D84)/$A$29 -> 16.176470588235293 | E85: =SUM(E60:E84)/$A$29 -> 19.411764705882351 | F85: =SUM(F60:F84)/$A$29 -> 0 | G85: =SUM(G60:G84)/$A$29 -> 0