B1: Range Masters "Fun" Shoot | H1: Results for May 4, 2004
A2: Click on Stage # for view of COF
B3: Name (Note) | C3: Shoot Total | D3: Total Points Down
A4: Place | E4: Stage 1 | F4: String 1 | G4: PD | H4: Stage 2 | I4: String 1 | J4: PD | K4: Stage 3 | L4: String 1 | M4: PD
A5: 1 | B5: Stilwell, Mike | C5: =+E5+H5+K5 -> 63.49 | D5: =+G5+J5+M5 -> 11 | E5: =+(F5)+0.5*G5 -> 25.74 | F5: 23.74 | G5: 4 | H5: =+(I5)+0.5*J5 -> 26.13 | I5: 23.13 | J5: 6 | K5: =+(L5)+0.5*M5 -> 11.62 | L5: 11.12 | M5: 1
A6: 2 | B6: Young, Jason | C6: =+E6+H6+K6 -> 64.48 | D6: =+G6+J6+M6 -> 19 | E6: =+(F6)+0.5*G6 -> 21.85 | F6: 17.85 | G6: 8 | H6: =+(I6)+0.5*J6 -> 31.38 | I6: 27.38 | J6: 8 | K6: =+(L6)+0.5*M6 -> 11.25 | L6: 9.75 | M6: 3
A7: 3 | B7: Theodore, Ari | C7: =+E7+H7+K7 -> 64.89 | D7: =+G7+J7+M7 -> 25 | E7: =+(F7)+0.5*G7 -> 25.37 | F7: 21.37 | G7: 8 | H7: =+(I7)+0.5*J7 -> 27.06 | I7: 19.06 | J7: 16 | K7: =+(L7)+0.5*M7 -> 12.46 | L7: 11.96 | M7: 1
A8: 4 | B8: Zaccardi, Pat | C8: =+E8+H8+K8 -> 66.42 | D8: =+G8+J8+M8 -> 14 | E8: =+(F8)+0.5*G8 -> 23.14 | F8: 22.14 | G8: 2 | H8: =+(I8)+0.5*J8 -> 32.18 | I8: 27.18 | J8: 10 | K8: =+(L8)+0.5*M8 -> 11.10 | L8: 10.10 | M8: 2
A9: 5 | B9: Rodriquez, Mike | C9: =+E9+H9+K9 -> 67.16 | D9: =+G9+J9+M9 -> 36 | E9: =+(F9)+0.5*G9 -> 27.48 | F9: 19.48 | G9: 16 | H9: =+(I9)+0.5*J9 -> 19.37 | I9: 18.37 | J9: 2 | K9: =+(L9)+0.5*M9 -> 20.31 | L9: 11.31 | M9: 18
A10: 6 | B10: Harmon, Benjamin | C10: =+E10+H10+K10 -> 68.55 | D10: =+G10+J10+M10 -> 28 | E10: =+(F10)+0.5*G10 -> 29.48 | F10: 21.48 | G10: 16 | H10: =+(I10)+0.5*J10 -> 28.10 | I10: 22.10 | J10: 12 | K10: =+(L10)+0.5*M10 -> 10.97 | L10: 10.97 | M10: 0
A11: 7 | B11: Scott, Alan | C11: =+E11+H11+K11 -> 73.67 | D11: =+G11+J11+M11 -> 17 | E11: =+(F11)+0.5*G11 -> 29.82 | F11: 27.82 | G11: 4 | H11: =+(I11)+0.5*J11 -> 28.06 | I11: 26.56 | J11: 3 | K11: =+(L11)+0.5*M11 -> 15.79 | L11: 10.79 | M11: 10
A12: 8 | B12: Billings, Scott | C12: =+E12+H12+K12 -> 79.72 | D12: =+G12+J12+M12 -> 30 | E12: =+(F12)+0.5*G12 -> 31.55 | F12: 23.05 | G12: 17 | H12: =+(I12)+0.5*J12 -> 33.40 | I12: 28.90 | J12: 9 | K12: =+(L12)+0.5*M12 -> 14.77 | L12: 12.77 | M12: 4
A13: 9 | B13: Taylor, Joshua | C13: =+E13+H13+K13 -> 83.33 | D13: =+G13+J13+M13 -> 12 | E13: =+(F13)+0.5*G13 -> 38.20 | F13: 34.70 | G13: 7 | H13: =+(I13)+0.5*J13 -> 29.99 | I13: 28.49 | J13: 3 | K13: =+(L13)+0.5*M13 -> 15.14 | L13: 14.14 | M13: 2
A14: 10 | B14: Adams, Kyle (Rev) | C14: =+E14+H14+K14 -> 86.26 | D14: =+G14+J14+M14 -> 20 | E14: =+(F14)+0.5*G14 -> 29.62 | F14: 26.62 | G14: 6 | H14: =+(I14)+0.5*J14 -> 39.10 | I14: 32.60 | J14: 13 | K14: =+(L14)+0.5*M14 -> 17.54 | L14: 17.04 | M14: 1
A15: 11 | B15: Walker, Ron | C15: =+E15+H15+K15 -> 88.17 | D15: =+G15+J15+M15 -> 18 | E15: =+(F15)+0.5*G15 -> 32.76 | F15: 31.26 | G15: 3 | H15: =+(I15)+0.5*J15 -> 41.13 | I15: 33.63 | J15: 15 | K15: =+(L15)+0.5*M15 -> 14.28 | L15: 14.28 | M15: 0
A16: 12 | B16: Stone, Scott | C16: =+E16+H16+K16 -> 89.74 | D16: =+G16+J16+M16 -> 50 | E16: =+(F16)+0.5*G16 -> 38.38 | F16: 27.38 | G16: 22 | H16: =+(I16)+0.5*J16 -> 38.38 | I16: 28.88 | J16: 19 | K16: =+(L16)+0.5*M16 -> 12.98 | L16: 8.48 | M16: 9
A17: 13 | B17: Scott, Michael | C17: =+E17+H17+K17 -> 91.04 | D17: =+G17+J17+M17 -> 14 | E17: =+(F17)+0.5*G17 -> 39.10 | F17: 35.10 | G17: 8 | H17: =+(I17)+0.5*J17 -> 37.74 | I17: 34.74 | J17: 6 | K17: =+(L17)+0.5*M17 -> 14.20 | L17: 14.20 | M17: 0
A18: 14 | B18: Collins, Ken | C18: =+E18+H18+K18 -> 91.97 | D18: =+G18+J18+M18 -> 44 | E18: =+(F18)+0.5*G18 -> 38.07 | F18: 23.57 | G18: 29 | H18: =+(I18)+0.5*J18 -> 41.25 | I18: 33.75 | J18: 15 | K18: =+(L18)+0.5*M18 -> 12.65 | L18: 12.65 | M18: 0
A19: 15 | B19: Loveless, Doug | C19: =+E19+H19+K19 -> 94.92 | D19: =+G19+J19+M19 -> 41 | E19: =+(F19)+0.5*G19 -> 49.80 | F19: 37.30 | G19: 25 | H19: =+(I19)+0.5*J19 -> 30.56 | I19: 24.56 | J19: 12 | K19: =+(L19)+0.5*M19 -> 14.56 | L19: 12.56 | M19: 4
A20: 16 | B20: Gurr, Gene | C20: =+E20+H20+K20 -> 96.31 | D20: =+G20+J20+M20 -> 29 | E20: =+(F20)+0.5*G20 -> 48.32 | F20: 45.82 | G20: 5 | H20: =+(I20)+0.5*J20 -> 35.72 | I20: 25.72 | J20: 20 | K20: =+(L20)+0.5*M20 -> 12.27 | L20: 10.27 | M20: 4
A21: 17 | B21: Young, Ren | C21: =+E21+H21+K21 -> 96.56 | D21: =+G21+J21+M21 -> 48 | E21: =+(F21)+0.5*G21 -> 34.74 | F21: 28.24 | G21: 13 | H21: =+(I21)+0.5*J21 -> 43.69 | I21: 28.69 | J21: 30 | K21: =+(L21)+0.5*M21 -> 18.13 | L21: 15.63 | M21: 5
A22: 18 | B22: Jones, Brad | C22: =+E22+H22+K22 -> 105.18 | D22: =+G22+J22+M22 -> 19 | E22: =+(F22)+0.5*G22 -> 50.43 | F22: 49.93 | G22: 1 | H22: =+(I22)+0.5*J22 -> 37.93 | I22: 29.93 | J22: 16 | K22: =+(L22)+0.5*M22 -> 16.82 | L22: 15.82 | M22: 2
A23: 19 | B23: Goddard, Kendall | C23: =+E23+H23+K23 -> 107.16 | D23: =+G23+J23+M23 -> 31 | E23: =+(F23)+0.5*G23 -> 40.96 | F23: 35.46 | G23: 11 | H23: =+(I23)+0.5*J23 -> 41.76 | I23: 38.26 | J23: 7 | K23: =+(L23)+0.5*M23 -> 24.44 | L23: 17.94 | M23: 13
A24: 20 | B24: Moses, Tyler | C24: =+E24+H24+K24 -> 107.34 | D24: =+G24+J24+M24 -> 54 | E24: =+(F24)+0.5*G24 -> 53.24 | F24: 43.74 | G24: 19 | H24: =+(I24)+0.5*J24 -> 34.69 | I24: 23.19 | J24: 23 | K24: =+(L24)+0.5*M24 -> 19.41 | L24: 13.41 | M24: 12
A25: 21 | B25: Hood, Neil | C25: =+E25+H25+K25 -> 109.00 | D25: =+G25+J25+M25 -> 48 | E25: =+(F25)+0.5*G25 -> 46.26 | F25: 35.26 | G25: 22 | H25: =+(I25)+0.5*J25 -> 43.44 | I25: 35.94 | J25: 15 | K25: =+(L25)+0.5*M25 -> 19.30 | L25: 13.80 | M25: 11
A26: 22 | B26: Garrett, Dean (.22) | C26: =+E26+H26+K26 -> 113.44 | D26: =+G26+J26+M26 -> 63 | E26: =+(F26)+0.5*G26 -> 55.45 | F26: 33.45 | G26: 44 | H26: =+(I26)+0.5*J26 -> 36.48 | I26: 26.98 | J26: 19 | K26: =+(L26)+0.5*M26 -> 21.51 | L26: 21.51 | M26: 0
A27: 23 | B27: Billings, Richard | C27: =+E27+H27+K27 -> 116.29 | D27: =+G27+J27+M27 -> 46 | E27: =+(F27)+0.5*G27 -> 41.30 | F27: 36.30 | G27: 10 | H27: =+(I27)+0.5*J27 -> 52.84 | I27: 35.84 | J27: 34 | K27: =+(L27)+0.5*M27 -> 22.15 | L27: 21.15 | M27: 2
A28: 24 | B28: Burney, Carl | C28: =+E28+H28+K28 -> 120.35 | D28: =+G28+J28+M28 -> 14 | E28: =+(F28)+0.5*G28 -> 38.59 | F28: 38.09 | G28: 1 | H28: =+(I28)+0.5*J28 -> 58.45 | I28: 52.95 | J28: 11 | K28: =+(L28)+0.5*M28 -> 23.31 | L28: 22.31 | M28: 2
A29: 25 | B29: Crawford, George | C29: =+E29+H29+K29 -> 124.81 | D29: =+G29+J29+M29 -> 53 | E29: =+(F29)+0.5*G29 -> 54.46 | F29: 43.96 | G29: 21 | H29: =+(I29)+0.5*J29 -> 39.63 | I29: 33.63 | J29: 12 | K29: =+(L29)+0.5*M29 -> 30.72 | L29: 20.72 | M29: 20
A30: 26 | B30: Goddard, Logan | C30: =+E30+H30+K30 -> 129.22 | D30: =+G30+J30+M30 -> 75 | E30: =+(F30)+0.5*G30 -> 47.48 | F30: 35.48 | G30: 24 | H30: =+(I30)+0.5*J30 -> 65.29 | I30: 42.29 | J30: 46 | K30: =+(L30)+0.5*M30 -> 16.45 | L30: 13.95 | M30: 5
A31: 27 | B31: Brown, Michael | C31: =+E31+H31+K31 -> 136.23 | D31: =+G31+J31+M31 -> 67 | E31: =+(F31)+0.5*G31 -> 41.78 | F31: 28.78 | G31: 26 | H31: =+(I31)+0.5*J31 -> 64.01 | I31: 49.51 | J31: 29 | K31: =+(L31)+0.5*M31 -> 30.44 | L31: 24.44 | M31: 12
A32: 28 | B32: Goddard, Cole | C32: =+E32+H32+K32 -> 139.30 | D32: =+G32+J32+M32 -> 73 | E32: =+(F32)+0.5*G32 -> 41.99 | F32: 33.49 | G32: 17 | H32: =+(I32)+0.5*J32 -> 59.09 | I32: 32.09 | J32: 54 | K32: =+(L32)+0.5*M32 -> 38.22 | L32: 37.22 | M32: 2
A33: 29 | B33: Garrett, Mike (.22) | C33: =+E33+H33+K33 -> 145.06 | D33: =+G33+J33+M33 -> 39 | E33: =+(F33)+0.5*G33 -> 81.77 | F33: 70.27 | G33: 23 | H33: =+(I33)+0.5*J33 -> 39.45 | I33: 31.45 | J33: 16 | K33: =+(L33)+0.5*M33 -> 23.84 | L33: 23.84 | M33: 0
A34: 30 | B34: West, Dave | C34: =+E34+H34+K34 -> 146.10 | D34: =+G34+J34+M34 -> 45 | E34: =+(F34)+0.5*G34 -> 60.32 | F34: 50.82 | G34: 19 | H34: =+(I34)+0.5*J34 -> 59.87 | I34: 47.37 | J34: 25 | K34: =+(L34)+0.5*M34 -> 25.91 | L34: 25.41 | M34: 1
A35: 31 | B35: Hill, Randy | C35: =+E35+H35+K35 -> 149.96 | D35: =+G35+J35+M35 -> 103 | E35: =+(F35)+0.5*G35 -> 51.25 | F35: 28.25 | G35: 46 | H35: =+(I35)+0.5*J35 -> 68.25 | I35: 45.25 | J35: 46 | K35: =+(L35)+0.5*M35 -> 30.46 | L35: 24.96 | M35: 11
A36: 32 | B36: Billings, Wesley (.22) | C36: =+E36+H36+K36 -> 173.81 | D36: =+G36+J36+M36 -> 83 | E36: =+(F36)+0.5*G36 -> 61.43 | F36: 51.43 | G36: 20 | H36: =+(I36)+0.5*J36 -> 72.93 | I36: 48.43 | J36: 49 | K36: =+(L36)+0.5*M36 -> 39.45 | L36: 32.45 | M36: 14
A37: 33 | B37: Phillips, Rdan (Rev) | C37: =+E37+H37+K37 -> 185.09 | D37: =+G37+J37+M37 -> 105 | E37: =+(F37)+0.5*G37 -> 78.08 | F37: 52.08 | G37: 52 | H37: =+(I37)+0.5*J37 -> 76.52 | I37: 58.02 | J37: 37 | K37: =+(L37)+0.5*M37 -> 30.49 | L37: 22.49 | M37: 16
A38: 34 | B38: Garrett, Steve (.22) | C38: =+E38+H38+K38 -> 202.68 | D38: =+G38+J38+M38 -> 71 | E38: =+(F38)+0.5*G38 -> 106.72 | F38: 91.72 | G38: 30 | H38: =+(I38)+0.5*J38 -> 66.34 | I38: 50.34 | J38: 32 | K38: =+(L38)+0.5*M38 -> 29.62 | L38: 25.12 | M38: 9
A39: 35 | B39: Shumway, Elizabeth | C39: =+E39+H39+K39 -> 208.27 | D39: =+G39+J39+M39 -> 128 | E39: =+(F39)+0.5*G39 -> 75.36 | F39: 50.86 | G39: 49 | H39: =+(I39)+0.5*J39 -> 95.20 | I39: 60.20 | J39: 70 | K39: =+(L39)+0.5*M39 -> 37.71 | L39: 33.21 | M39: 9
A40: 36 | B40: Ethington, Jeff (Rev) | C40: =+E40+H40+K40 -> 216.52 | D40: =+G40+J40+M40 -> 70 | E40: =+(F40)+0.5*G40 -> 101.05 | F40: 94.55 | G40: 13 | H40: =+(I40)+0.5*J40 -> 75.64 | I40: 55.64 | J40: 40 | K40: =+(L40)+0.5*M40 -> 39.83 | L40: 31.33 | M40: 17
A41: 38 | B41: Hardy, Brett | C41: =+E41+H41+K41 -> 306.76 | D41: =+G41+J41+M41 -> 84 | E41: =+(F41)+0.5*G41 -> 164.06 | F41: 147.56 | G41: 33 | H41: =+(I41)+0.5*J41 -> 104.12 | I41: 85.62 | J41: 37 | K41: =+(L41)+0.5*M41 -> 38.58 | L41: 31.58 | M41: 14
A42: Notes:
A43: - | B43: Remember, the "Fun" Shoot is held on the 1st and 3rd Tuesday of each month ( 6:30 p.m.) at Range Masters.
A44: - | B44: You can use ANY handgun you want, as long as it can be safely drawn from a strong-side holster.
A45: - | B45: IDPA format and scoring.
A46: PD | B46: = Points Down = .5 seconds x Points Down
A47: XX | B47: Indicates that the Points Down value includes some kind of penalty (Procedural Error, Hits on Non-Threat, Misses on Steel, etc.)
A48: (Rev) | B48: = Revolver
A49: DNF | B49: = Did Not Finish