B1: Range Masters "Fun" Shoot | I1: Results for May 18, 2004
A2: Click on Stage # for view of COF
B3: Name (Note) | C3: Shoot Total | D3: Total Points Down
A4: Place | E4: Stage 1 | F4: String 1 | G4: String 2 | H4: PD | I4: Stage 2 | J4: String 1 | K4: String 2 | L4: PD | M4: Stage 3 | N4: String 1 | O4: String 2 | P4: String 3 | Q4: String 4 | R4: PD
A5: 1 | B5: Stilwell, Mike | C5: =+E5+I5+M5 -> 65.33 | D5: =+H5+L5+R5 -> 11 | E5: =+(F5+G5)+0.5*H5 -> 28.47 | F5: 8.33 | G5: 18.14 | H5: 4 | I5: =+(J5+K5)+0.5*L5 -> 29.59 | J5: 18.56 | K5: 8.03 | L5: 6 | M5: =+(N5+O5+P5+Q5)+0.5*R5 -> 7.27 | N5: 1.34 | O5: 1.36 | P5: 1.39 | Q5: 2.68 | R5: 1
A6: 2 | B6: Collins, Ken | C6: =+E6+I6+M6 -> 65.70 | D6: =+H6+L6+R6 -> 12 | E6: =+(F6+G6)+0.5*H6 -> 26.44 | F6: 3.81 | G6: 20.13 | H6: 5 | I6: =+(J6+K6)+0.5*L6 -> 30.98 | J6: 20.45 | K6: 8.03 | L6: 5 | M6: =+(N6+O6+P6+Q6)+0.5*R6 -> 8.28 | N6: 1.55 | O6: 1.46 | P6: 1.51 | Q6: 2.76 | R6: 2
A7: 3 | B7: Taylor, Joshua | C7: =+E7+I7+M7 -> 66.49 | D7: =+H7+L7+R7 -> 12 | E7: =+(F7+G7)+0.5*H7 -> 27.22 | F7: 4.71 | G7: 20.01 | H7: 5 | I7: =+(J7+K7)+0.5*L7 -> 30.56 | J7: 19.01 | K7: 8.55 | L7: 6 | M7: =+(N7+O7+P7+Q7)+0.5*R7 -> 8.71 | N7: 1.39 | O7: 1.43 | P7: 1.76 | Q7: 3.63 | R7: 1
A8: 4 | B8: Harmon, Ben | C8: =+E8+I8+M8 -> 70.39 | D8: =+H8+L8+R8 -> 10 | E8: =+(F8+G8)+0.5*H8 -> 30.44 | F8: 4.32 | G8: 21.12 | H8: 10 | I8: =+(J8+K8)+0.5*L8 -> 30.91 | J8: 23.84 | K8: 7.07 | L8: 0 | M8: =+(N8+O8+P8+Q8)+0.5*R8 -> 9.04 | N8: 1.80 | O8: 2.02 | P8: 1.88 | Q8: 3.34 | R8: 0
A9: 5 | B9: Young, Jason | C9: =+E9+I9+M9 -> 74.51 | D9: =+H9+L9+R9 -> 51 | E9: =+(F9+G9)+0.5*H9 -> 32.99 | F9: 8.63 | G9: 11.86 | H9: 25 | I9: =+(J9+K9)+0.5*L9 -> 32.48 | J9: 15.65 | K9: 6.83 | L9: 20 | M9: =+(N9+O9+P9+Q9)+0.5*R9 -> 9.04 | N9: 0.94 | O9: 1.14 | P9: 1.26 | Q9: 2.70 | R9: 6
A10: 6 | B10: Outzen, Craig | C10: =+E10+I10+M10 -> 74.63 | D10: =+H10+L10+R10 -> 51 | E10: =+(F10+G10)+0.5*H10 -> 27.32 | F10: 6.12 | G10: 12.20 | H10: 18 | I10: =+(J10+K10)+0.5*L10 -> 31.80 | J10: 16.35 | K10: 7.45 | L10: 16 | M10: =+(N10+O10+P10+Q10)+0.5*R10 -> 15.51 | N10: 1.37 | O10: 1.29 | P10: 1.40 | Q10: 2.95 | R10: 17
A11: 7 | B11: Rodriquez, Mike | C11: =+E11+I11+M11 -> 75.24 | D11: =+H11+L11+R11 -> 28 | E11: =+(F11+G11)+0.5*H11 -> 34.97 | F11: 6.30 | G11: 18.67 | H11: 20 | I11: =+(J11+K11)+0.5*L11 -> 32.36 | J11: 22.88 | K11: 5.98 | L11: 7 | M11: =+(N11+O11+P11+Q11)+0.5*R11 -> 7.91 | N11: 1.49 | O11: 1.59 | P11: 1.58 | Q11: 2.75 | R11: 1
A12: 8 | B12: Redford, "Red" (.22) | C12: =+E12+I12+M12 -> 78.31 | D12: =+H12+L12+R12 -> 15 | E12: =+(F12+G12)+0.5*H12 -> 32.20 | F12: 4.82 | G12: 24.88 | H12: 5 | I12: =+(J12+K12)+0.5*L12 -> 36.95 | J12: 25.31 | K12: 6.64 | L12: 10 | M12: =+(N12+O12+P12+Q12)+0.5*R12 -> 9.16 | N12: 1.86 | O12: 2.07 | P12: 1.82 | Q12: 3.41 | R12: 0
A13: 9 | B13: Bradtke, John | C13: =+E13+I13+M13 -> 79.01 | D13: =+H13+L13+R13 -> 16 | E13: =+(F13+G13)+0.5*H13 -> 34.44 | F13: 6.38 | G13: 22.56 | H13: 11 | I13: =+(J13+K13)+0.5*L13 -> 34.34 | J13: 23.32 | K13: 8.52 | L13: 5 | M13: =+(N13+O13+P13+Q13)+0.5*R13 -> 10.23 | N13: 2.13 | O13: 2.11 | P13: 2.04 | Q13: 3.95 | R13: 0
A14: 10 | B14: Gurr, Gene | C14: =+E14+I14+M14 -> 81.56 | D14: =+H14+L14+R14 -> 26 | E14: =+(F14+G14)+0.5*H14 -> 36.35 | F14: 6.83 | G14: 21.52 | H14: 16 | I14: =+(J14+K14)+0.5*L14 -> 37.24 | J14: 24.62 | K14: 8.12 | L14: 9 | M14: =+(N14+O14+P14+Q14)+0.5*R14 -> 7.97 | N14: 1.59 | O14: 1.35 | P14: 1.34 | Q14: 3.19 | R14: 1
A15: 11 | B15: Hood, Neil | C15: =+E15+I15+M15 -> 82.72 | D15: =+H15+L15+R15 -> 14 | E15: =+(F15+G15)+0.5*H15 -> 33.82 | F15: 9.28 | G15: 19.54 | H15: 10 | I15: =+(J15+K15)+0.5*L15 -> 38.54 | J15: 24.94 | K15: 12.10 | L15: 3 | M15: =+(N15+O15+P15+Q15)+0.5*R15 -> 10.36 | N15: 1.78 | O15: 2.06 | P15: 2.13 | Q15: 3.89 | R15: 1
A16: 12 | B16: Billings, Scott | C16: =+E16+I16+M16 -> 85.66 | D16: =+H16+L16+R16 -> 28 | E16: =+(F16+G16)+0.5*H16 -> 35.71 | F16: 7.07 | G16: 20.64 | H16: 16 | I16: =+(J16+K16)+0.5*L16 -> 39.56 | J16: 23.77 | K16: 12.29 | L16: 7 | M16: =+(N16+O16+P16+Q16)+0.5*R16 -> 10.39 | N16: 1.46 | O16: 1.51 | P16: 1.37 | Q16: 3.55 | R16: 5
A17: 13 | B17: Stone, Scott | C17: =+E17+I17+M17 -> 86.58 | D17: =+H17+L17+R17 -> 24 | E17: =+(F17+G17)+0.5*H17 -> 38.51 | F17: 7.82 | G17: 26.69 | H17: 8 | I17: =+(J17+K17)+0.5*L17 -> 36.80 | J17: 17.22 | K17: 14.58 | L17: 10 | M17: =+(N17+O17+P17+Q17)+0.5*R17 -> 11.27 | N17: 1.46 | O17: 1.50 | P17: 1.65 | Q17: 3.66 | R17: 6
A18: 14 | B18: Adams, Kyle (Rev) | C18: =+E18+I18+M18 -> 90.59 | D18: =+H18+L18+R18 -> 18 | E18: =+(F18+G18)+0.5*H18 -> 34.01 | F18: 5.37 | G18: 25.64 | H18: 6 | I18: =+(J18+K18)+0.5*L18 -> 42.71 | J18: 30.48 | K18: 11.73 | L18: 1 | M18: =+(N18+O18+P18+Q18)+0.5*R18 -> 13.87 | N18: 2.02 | O18: 1.74 | P18: 1.60 | Q18: 3.01 | R18: 11
A19: 15 | B19: Goddard, Kendall | C19: =+E19+I19+M19 -> 90.87 | D19: =+H19+L19+R19 -> 14 | E19: =+(F19+G19)+0.5*H19 -> 39.00 | F19: 5.64 | G19: 28.86 | H19: 9 | I19: =+(J19+K19)+0.5*L19 -> 38.68 | J19: 28.20 | K19: 10.48 | L19: 0 | M19: =+(N19+O19+P19+Q19)+0.5*R19 -> 13.19 | N19: 2.28 | O19: 2.18 | P19: 1.95 | Q19: 4.28 | R19: 5
A20: 16 | B20: Scott, Alan | C20: =+E20+I20+M20 -> 91.47 | D20: =+H20+L20+R20 -> 15 | E20: =+(F20+G20)+0.5*H20 -> 37.29 | F20: 6.86 | G20: 25.43 | H20: 10 | I20: =+(J20+K20)+0.5*L20 -> 33.97 | J20: 25.60 | K20: 8.37 | L20: 0 | M20: =+(N20+O20+P20+Q20)+0.5*R20 -> 20.21 | N20: 1.55 | O20: 1.33 | P20: 1.36 | Q20: 13.47 | R20: 5
A21: 17 | B21: Redford, Noel (.22) | C21: =+E21+I21+M21 -> 94.43 | D21: =+H21+L21+R21 -> 8 | E21: =+(F21+G21)+0.5*H21 -> 48.41 | F21: 12.36 | G21: 32.05 | H21: 8 | I21: =+(J21+K21)+0.5*L21 -> 36.57 | J21: 26.34 | K21: 10.23 | L21: 0 | M21: =+(N21+O21+P21+Q21)+0.5*R21 -> 9.45 | N21: 1.82 | O21: 1.65 | P21: 1.77 | Q21: 4.21 | R21: 0
A22: 18 | B22: Loveless, Doug (.22) | C22: =+E22+I22+M22 -> 96.95 | D22: =+H22+L22+R22 -> 28 | E22: =+(F22+G22)+0.5*H22 -> 36.69 | F22: 3.77 | G22: 25.92 | H22: 14 | I22: =+(J22+K22)+0.5*L22 -> 48.10 | J22: 36.60 | K22: 7.00 | L22: 9 | M22: =+(N22+O22+P22+Q22)+0.5*R22 -> 12.16 | N22: 1.85 | O22: 1.89 | P22: 2.16 | Q22: 3.76 | R22: 5
A23: 19 | B23: Redford, Steve | C23: =+E23+I23+M23 -> 97.54 | D23: =+H23+L23+R23 -> 37 | E23: =+(F23+G23)+0.5*H23 -> 44.89 | F23: 8.13 | G23: 26.76 | H23: 20 | I23: =+(J23+K23)+0.5*L23 -> 41.75 | J23: 26.97 | K23: 8.78 | L23: 12 | M23: =+(N23+O23+P23+Q23)+0.5*R23 -> 10.90 | N23: 1.69 | O23: 1.63 | P23: 1.79 | Q23: 3.29 | R23: 5
A24: 20 | B24: Young, Ren | C24: =+E24+I24+M24 -> 99.30 | D24: =+H24+L24+R24 -> 12 | E24: =+(F24+G24)+0.5*H24 -> 38.06 | F24: 5.68 | G24: 29.38 | H24: 6 | I24: =+(J24+K24)+0.5*L24 -> 50.38 | J24: 33.95 | K24: 13.43 | L24: 6 | M24: =+(N24+O24+P24+Q24)+0.5*R24 -> 10.86 | N24: 2.02 | O24: 2.24 | P24: 1.84 | Q24: 4.76 | R24: 0
A25: 21 | B25: Ottesen, Sterling | C25: =+E25+I25+M25 -> 110.29 | D25: =+H25+L25+R25 -> 21 | E25: =+(F25+G25)+0.5*H25 -> 53.03 | F25: 21.79 | G25: 26.74 | H25: 9 | I25: =+(J25+K25)+0.5*L25 -> 48.61 | J25: 33.56 | K25: 10.05 | L25: 10 | M25: =+(N25+O25+P25+Q25)+0.5*R25 -> 8.65 | N25: 1.52 | O25: 1.52 | P25: 1.42 | Q25: 3.19 | R25: 2
A26: 22 | B26: Hatch, Perri | C26: =+E26+I26+M26 -> 110.59 | D26: =+H26+L26+R26 -> 48 | E26: =+(F26+G26)+0.5*H26 -> 48.83 | F26: 16.18 | G26: 23.65 | H26: 18 | I26: =+(J26+K26)+0.5*L26 -> 52.60 | J26: 27.67 | K26: 10.43 | L26: 29 | M26: =+(N26+O26+P26+Q26)+0.5*R26 -> 9.16 | N26: 2.06 | O26: 1.72 | P26: 1.63 | Q26: 3.25 | R26: 1
A27: 23 | B27: Zaccardi, Pat | C27: =+E27+I27+M27 -> 113.24 | D27: =+H27+L27+R27 -> 52 | E27: =+(F27+G27)+0.5*H27 -> 39.56 | F27: 8.62 | G27: 25.44 | H27: 11 | I27: =+(J27+K27)+0.5*L27 -> 61.41 | J27: 26.88 | K27: 17.03 | L27: 35 | M27: =+(N27+O27+P27+Q27)+0.5*R27 -> 12.27 | N27: 1.78 | O27: 1.75 | P27: 1.71 | Q27: 4.03 | R27: 6
A28: 24 | B28: Brown, Michael | C28: =+E28+I28+M28 -> 114.64 | D28: =+H28+L28+R28 -> 43 | E28: =+(F28+G28)+0.5*H28 -> 55.06 | F28: 7.62 | G28: 32.94 | H28: 29 | I28: =+(J28+K28)+0.5*L28 -> 38.25 | J28: 18.87 | K28: 14.88 | L28: 9 | M28: =+(N28+O28+P28+Q28)+0.5*R28 -> 21.33 | N28: 2.02 | O28: 2.37 | P28: 2.03 | Q28: 12.41 | R28: 5
A29: 25 | B29: Burney, Carl | C29: =+E29+I29+M29 -> 114.78 | D29: =+H29+L29+R29 -> 9 | E29: =+(F29+G29)+0.5*H29 -> 55.35 | F29: 11.03 | G29: 42.32 | H29: 4 | I29: =+(J29+K29)+0.5*L29 -> 47.90 | J29: 35.59 | K29: 12.31 | L29: 0 | M29: =+(N29+O29+P29+Q29)+0.5*R29 -> 11.53 | N29: 1.95 | O29: 1.63 | P29: 1.78 | Q29: 3.67 | R29: 5
A30: 26 | B30: Goddard, Logan | C30: =+E30+I30+M30 -> 120.06 | D30: =+H30+L30+R30 -> 70 | E30: =+(F30+G30)+0.5*H30 -> 53.16 | F30: 7.61 | G30: 30.55 | H30: 30 | I30: =+(J30+K30)+0.5*L30 -> 56.59 | J30: 33.48 | K30: 5.61 | L30: 35 | M30: =+(N30+O30+P30+Q30)+0.5*R30 -> 10.31 | N30: 1.78 | O30: 1.81 | P30: 1.66 | Q30: 2.56 | R30: 5
A31: 27 | B31: Beavers, Shannon | C31: =+E31+I31+M31 -> 132.46 | D31: =+H31+L31+R31 -> 45 | E31: =+(F31+G31)+0.5*H31 -> 55.46 | F31: 17.23 | G31: 23.23 | H31: 30 | I31: =+(J31+K31)+0.5*L31 -> 61.15 | J31: 43.30 | K31: 13.35 | L31: 9 | M31: =+(N31+O31+P31+Q31)+0.5*R31 -> 15.85 | N31: 3.43 | O31: 2.45 | P31: 2.48 | Q31: 4.49 | R31: 6
A32: 28 | B32: Redford, Noel | C32: =+E32+I32+M32 -> 132.74 | D32: =+H32+L32+R32 -> 43 | E32: =+(F32+G32)+0.5*H32 -> 68.51 | F32: 27.39 | G32: 28.12 | H32: 26 | I32: =+(J32+K32)+0.5*L32 -> 51.17 | J32: 27.69 | K32: 17.98 | L32: 11 | M32: =+(N32+O32+P32+Q32)+0.5*R32 -> 13.06 | N32: 1.69 | O32: 1.62 | P32: 1.58 | Q32: 5.17 | R32: 6
A33: 29 | B33: Ewin, Don | C33: =+E33+I33+M33 -> 133.36 | D33: =+H33+L33+R33 -> 39 | E33: =+(F33+G33)+0.5*H33 -> 65.80 | F33: 18.99 | G33: 35.31 | H33: 23 | I33: =+(J33+K33)+0.5*L33 -> 57.01 | J33: 38.41 | K33: 10.60 | L33: 16 | M33: =+(N33+O33+P33+Q33)+0.5*R33 -> 10.55 | N33: 2.11 | O33: 1.92 | P33: 2.15 | Q33: 4.37 | R33: 0
A34: 30 | B34: Hill, Randy | C34: =+E34+I34+M34 -> 140.08 | D34: =+H34+L34+R34 -> 89 | E34: =+(F34+G34)+0.5*H34 -> 70.11 | F34: 17.12 | G34: 27.99 | H34: 50 | I34: =+(J34+K34)+0.5*L34 -> 56.43 | J34: 31.16 | K34: 8.27 | L34: 34 | M34: =+(N34+O34+P34+Q34)+0.5*R34 -> 13.54 | N34: 2.40 | O34: 2.25 | P34: 2.68 | Q34: 3.71 | R34: 5
A35: 31 | B35: Swart, Johnathan | C35: =+E35+I35+M35 -> 172.87 | D35: =+H35+L35+R35 -> 64 | E35: =+(F35+G35)+0.5*H35 -> 83.78 | F35: 19.07 | G35: 42.71 | H35: 44 | I35: =+(J35+K35)+0.5*L35 -> 78.12 | J35: 52.40 | K35: 16.22 | L35: 19 | M35: =+(N35+O35+P35+Q35)+0.5*R35 -> 10.97 | N35: 1.63 | O35: 1.88 | P35: 1.75 | Q35: 5.21 | R35: 1
A36: 32 | B36: Inoke, Misi | C36: =+E36+I36+M36 -> 190.01 | D36: =+H36+L36+R36 -> 90 | E36: =+(F36+G36)+0.5*H36 -> 83.72 | F36: 40.67 | G36: 26.55 | H36: 33 | I36: =+(J36+K36)+0.5*L36 -> 80.46 | J36: 44.01 | K36: 12.95 | L36: 47 | M36: =+(N36+O36+P36+Q36)+0.5*R36 -> 25.83 | N36: 4.98 | O36: 4.64 | P36: 3.99 | Q36: 7.22 | R36: 10
A37: 33 | B37: Phillips, RDan | C37: =+E37+I37+M37 -> 194.33 | D37: =+H37+L37+R37 -> 60 | E37: =+(F37+G37)+0.5*H37 -> 105.86 | F37: 30.03 | G37: 59.83 | H37: 32 | I37: =+(J37+K37)+0.5*L37 -> 73.28 | J37: 48.57 | K37: 13.21 | L37: 23 | M37: =+(N37+O37+P37+Q37)+0.5*R37 -> 15.19 | N37: 2.58 | O37: 2.83 | P37: 2.40 | Q37: 4.88 | R37: 5
A38: Notes:
A39: - | B39: Remember, the "Fun" Shoot is held on the 1st and 3rd Tuesday of each month ( 6:30 p.m.) at Range Masters.
A40: - | B40: You can use ANY handgun you want, as long as it can be safely drawn from a strong-side holster.
A41: - | B41: IDPA format and scoring.
A42: PD | B42: = Points Down = .5 seconds x Points Down
A43: XX | B43: Indicates that the Points Down value includes some kind of penalty (Procedural Error, Hits on Non-Threat, Misses on Steel, etc.)
A44: (Rev) | B44: = Revolver
A45: DNF | B45: = Did Not Finish