B1: Range Masters "Fun" Shoot | I1: Results for December 7, 2004
A2: Click on Stage # for view of COF
B3: Name (Note) | C3: Shoot Total | D3: Total Points Down
A4: Place | E4: Stage 1 | F4: String 1 | G4: String 2 | H4: PD | I4: Stage 2 | J4: String 1 | K4: String 2 | L4: PD | M4: Stage 3 | N4: String 1 | O4: String 2 | P4: PD
A5: 1 | B5: Young, Ren | C5: =+E5+I5+M5 -> 61.17 | D5: =+H5+L5+P5 -> 12 | E5: =+(F5+G5)+0.5*H5 -> 25.63 | F5: 14.40 | G5: 7.23 | H5: =2+1+2+2+1 -> 8 | I5: =+(J5+K5)+0.5*L5 -> 26.55 | J5: 11.33 | K5: 13.22 | L5: 4 | M5: =+(N5+O5)+0.5*P5 -> 8.99 | N5: 4.80 | O5: 4.19 | P5: 0
A6: 2 | B6: Redford, Noel | C6: =+E6+I6+M6 -> 64.74 | D6: =+H6+L6+P6 -> 3 | E6: =+(F6+G6)+0.5*H6 -> 26.90 | F6: 17.63 | G6: 8.77 | H6: 1 | I6: =+(J6+K6)+0.5*L6 -> 23.34 | J6: 8.82 | K6: 13.52 | L6: 2 | M6: =+(N6+O6)+0.5*P6 -> 14.50 | N6: 6.09 | O6: 8.41 | P6: 0
A7: 3 | B7: Young, Jason | C7: =+E7+I7+M7 -> 73.62 | D7: =+H7+L7+P7 -> 22 | E7: =+(F7+G7)+0.5*H7 -> 24.40 | F7: 14.29 | G7: 9.61 | H7: 1 | I7: =+(J7+K7)+0.5*L7 -> 27.38 | J7: 8.80 | K7: 8.08 | L7: =5+5+5+6 -> 21 | M7: =+(N7+O7)+0.5*P7 -> 21.84 | N7: 6.55 | O7: 15.29 | P7: 0
A8: 4 | B8: Collins, Ken | C8: =+E8+I8+M8 -> 74.57 | D8: =+H8+L8+P8 -> 0 | E8: =+(F8+G8)+0.5*H8 -> 40.92 | F8: 36.35 | G8: 4.57 | H8: 0 | I8: =+(J8+K8)+0.5*L8 -> 21.34 | J8: 11.02 | K8: 10.32 | L8: 0 | M8: =+(N8+O8)+0.5*P8 -> 12.31 | N8: 6.19 | O8: 6.12 | P8: 0
A9: 5 | B9: Mortensen, Gary | C9: =+E9+I9+M9 -> 79.92 | D9: =+H9+L9+P9 -> 2 | E9: =+(F9+G9)+0.5*H9 -> 37.28 | F9: 24.45 | G9: 11.83 | H9: 2 | I9: =+(J9+K9)+0.5*L9 -> 27.35 | J9: 10.97 | K9: 16.38 | L9: 0 | M9: =+(N9+O9)+0.5*P9 -> 15.29 | N9: 7.98 | O9: 7.31 | P9: 0
A10: 6 | B10: Stone, Scott | C10: =+E10+I10+M10 -> 80.02 | D10: =+H10+L10+P10 -> 7 | E10: =+(F10+G10)+0.5*H10 -> 38.97 | F10: 20.64 | G10: 15.83 | H10: =1+1+1+2 -> 5 | I10: =+(J10+K10)+0.5*L10 -> 21.29 | J10: 8.53 | K10: 11.76 | L10: 2 | M10: =+(N10+O10)+0.5*P10 -> 19.76 | N10: 9.08 | O10: 10.68 | P10: 0
A11: 7 | B11: Phillips, RDan | C11: =+E11+I11+M11 -> 86.15 | D11: =+H11+L11+P11 -> 8 | E11: =+(F11+G11)+0.5*H11 -> 28.78 | F11: 21.08 | G11: 5.70 | H11: =2+1+1 -> 4 | I11: =+(J11+K11)+0.5*L11 -> 26.23 | J11: 10.07 | K11: 14.16 | L11: =1+1+2 -> 4 | M11: =+(N11+O11)+0.5*P11 -> 31.14 | N11: 21.50 | O11: 9.64 | P11: 0
A12: 8 | B12: Simpson, Harold | C12: =+E12+I12+M12 -> 90.08 | D12: =+H12+L12+P12 -> 10 | E12: =+(F12+G12)+0.5*H12 -> 30.62 | F12: 17.29 | G12: 10.33 | H12: =1+2+1+2 -> 6 | I12: =+(J12+K12)+0.5*L12 -> 30.64 | J12: 11.35 | K12: 17.29 | L12: =1+3 -> 4 | M12: =+(N12+O12)+0.5*P12 -> 28.82 | N12: 15.91 | O12: 12.91 | P12: 0
A13: 9 | B13: Mortensen, Curtis | C13: =+E13+I13+M13 -> 92.50 | D13: =+H13+L13+P13 -> 12 | E13: =+(F13+G13)+0.5*H13 -> 40.54 | F13: 24.08 | G13: 11.46 | H13: =2+2+1+5 -> 10 | I13: =+(J13+K13)+0.5*L13 -> 33.46 | J13: 13.06 | K13: 19.40 | L13: 2 | M13: =+(N13+O13)+0.5*P13 -> 18.50 | N13: 8.58 | O13: 9.92 | P13: 0
A14: 10 | B14: Scott, Michael | C14: =+E14+I14+M14 -> 101.06 | D14: =+H14+L14+P14 -> 19 | E14: =+(F14+G14)+0.5*H14 -> 45.70 | F14: 22.33 | G14: 16.87 | H14: =2+1+1+6+3 -> 13 | I14: =+(J14+K14)+0.5*L14 -> 26.17 | J14: 8.95 | K14: 14.22 | L14: =1+5 -> 6 | M14: =+(N14+O14)+0.5*P14 -> 29.19 | N14: 20.88 | O14: 8.31 | P14: 0
A15: 11 | B15: Scott, Alan | C15: =+E15+I15+M15 -> 104.24 | D15: =+H15+L15+P15 -> 11 | E15: =+(F15+G15)+0.5*H15 -> 37.88 | F15: 25.66 | G15: 11.72 | H15: 1 | I15: =+(J15+K15)+0.5*L15 -> 26.42 | J15: 9.51 | K15: 11.91 | L15: 10 | M15: =+(N15+O15)+0.5*P15 -> 39.94 | N15: 24.00 | O15: 15.94 | P15: 0
A16: 12 | B16: Hoyt, David | C16: =+E16+I16+M16 -> 120.37 | D16: =+H16+L16+P16 -> 26 | E16: =+(F16+G16)+0.5*H16 -> 51.08 | F16: 24.07 | G16: 22.01 | H16: =4+1+3+2 -> 10 | I16: =+(J16+K16)+0.5*L16 -> 45.66 | J16: 13.74 | K16: 23.92 | L16: =6+3+2+5 -> 16 | M16: =+(N16+O16)+0.5*P16 -> 23.63 | N16: 9.22 | O16: 14.41 | P16: 0
A17: 13 | B17: Billings, Scott (Rev) | C17: =+E17+I17+M17 -> 126.22 | D17: =+H17+L17+P17 -> 12 | E17: =+(F17+G17)+0.5*H17 -> 70.75 | F17: 22.58 | G17: 45.67 | H17: =1+2+1+1 -> 5 | I17: =+(J17+K17)+0.5*L17 -> 32.77 | J17: 11.70 | K17: 17.57 | L17: =4+3 -> 7 | M17: =+(N17+O17)+0.5*P17 -> 22.70 | N17: 5.84 | O17: 16.86 | P17: 0
A18: 14 | B18: Fletcher, Chris | C18: =+E18+I18+M18 -> 171.54 | D18: =+H18+L18+P18 -> 26 | E18: =+(F18+G18)+0.5*H18 -> 64.89 | F18: 34.07 | G18: 24.32 | H18: =6+1+2+4 -> 13 | I18: =+(J18+K18)+0.5*L18 -> 49.63 | J18: 17.99 | K18: 25.14 | L18: 13 | M18: =+(N18+O18)+0.5*P18 -> 57.02 | N18: 27.02 | O18: 30.00 | P18: 0
A19: 15 | B19: Stone, Marylee | C19: =+E19+I19+M19 -> 497.02 | D19: =+H19+L19+P19 -> 37 | E19: =+(F19+G19)+0.5*H19 -> 273.46 | F19: 121.72 | G19: 150.24 | H19: 3 | I19: =+(J19+K19)+0.5*L19 -> 89.38 | J19: 38.63 | K19: 41.25 | L19: =4+1+8+6 -> 19 | M19: =+(N19+O19)+0.5*P19 -> 134.18 | N19: 118.23 | O19: 8.45 | P19: 15
A20: Notes:
A21: - | B21: Remember, the "Fun" Shoot is held on the 1st and 3rd Tuesday of each month ( 6:30 p.m.) at Range Masters.
A22: - | B22: You can use ANY handgun you want, as long as it can be safely drawn from a strong-side holster.
A23: - | B23: IDPA format and scoring.
A24: PD | B24: = Points Down = .5 seconds x Points Down
A25: XX | B25: Indicates that the Points Down value includes some kind of penalty (Procedural Error, Hits on Non-Threat, Misses on Steel, etc.)
A26: (Rev) | B26: = Revolver
A27: DNF | B27: = Did Not Finish