B1: Range Masters "Fun" Shoot | H1: Results for July 20, 2004
A2: Click on Stage # for view of COF
B3: Name (Note) | C3: Shoot Total | D3: Total Points Down
A4: Place | E4: Stage 1 | F4: String 1 | G4: PD | H4: Stage 2 | I4: String 1 | J4: String 2 | K4: PD | L4: Stage 3 | M4: String 1 | N4: String 2 | O4: PD
A5: 1 | B5: Collins, Ken | C5: =+E5+H5+L5 -> 55.86 | D5: =+G5+K5+O5 -> 4 | E5: =+(F5)+0.5*G5 -> 23.57 | F5: 21.57 | G5: 4 | H5: =+(I5+J5)+0.5*K5 -> 22.20 | I5: 10.00 | J5: 12.20 | K5: 0 | L5: =+(M5+N5)+0.5*O5 -> 10.09 | M5: 4.84 | N5: 5.25 | O5: 0
A6: 2 | B6: Terry, Dale (Rev) | C6: =+E6+H6+L6 -> 57.58 | D6: =+G6+K6+O6 -> 22 | E6: =+(F6)+0.5*G6 -> 18.04 | F6: 12.54 | G6: =2+2+2+1+1+2+1 -> 11 | H6: =+(I6+J6)+0.5*K6 -> 30.81 | I6: 11.39 | J6: 13.92 | K6: =5+1+3+2 -> 11 | L6: =+(M6+N6)+0.5*O6 -> 8.73 | M6: 4.46 | N6: 4.27 | O6: 0
A7: 3 | B7: Terry, Mark (Rev) | C7: =+E7+H7+L7 -> 57.79 | D7: =+G7+K7+O7 -> 18 | E7: =+(F7)+0.5*G7 -> 14.48 | F7: 12.48 | G7: 4 | H7: =+(I7+J7)+0.5*K7 -> 33.92 | I7: 11.40 | J7: 16.02 | K7: 13 | L7: =+(M7+N7)+0.5*O7 -> 9.39 | M7: 4.35 | N7: 4.54 | O7: 1
A8: 4 | B8: Rodriquez, Mike | C8: =+E8+H8+L8 -> 68.88 | D8: =+G8+K8+O8 -> 42 | E8: =+(F8)+0.5*G8 -> 20.56 | F8: 16.06 | G8: 9 | H8: =+(I8+J8)+0.5*K8 -> 39.12 | I8: 10.28 | J8: 12.34 | K8: =4+10+5+8+6 -> 33 | L8: =+(M8+N8)+0.5*O8 -> 9.20 | M8: 4.39 | N8: 4.81 | O8: 0
A9: 5 | B9: Taylor, Joshua | C9: =+E9+H9+L9 -> 69.25 | D9: =+G9+K9+O9 -> 17 | E9: =+(F9)+0.5*G9 -> 32.99 | F9: 25.49 | G9: 15 | H9: =+(I9+J9)+0.5*K9 -> 24.79 | I9: 10.09 | J9: 13.70 | K9: 2 | L9: =+(M9+N9)+0.5*O9 -> 11.47 | M9: 5.57 | N9: 5.90 | O9: 0
A10: 6 | B10: Outzen, Craig | C10: =+E10+H10+L10 -> 78.04 | D10: =+G10+K10+O10 -> 62 | E10: =+(F10)+0.5*G10 -> 25.84 | F10: 19.34 | G10: =1+3+1+1+5+2 -> 13 | H10: =+(I10+J10)+0.5*K10 -> 36.68 | I10: 7.65 | J10: 10.03 | K10: =2+20+1+9+6 -> 38 | L10: =+(M10+N10)+0.5*O10 -> 15.52 | M10: 5.11 | N10: 4.91 | O10: 11
A11: 7 | B11: Dockstader, Jeff | C11: =+E11+H11+L11 -> 78.65 | D11: =+G11+K11+O11 -> 40 | E11: =+(F11)+0.5*G11 -> 24.65 | F11: 17.65 | G11: =6+2+2+2+2 -> 14 | H11: =+(I11+J11)+0.5*K11 -> 39.90 | I11: 12.42 | J11: 14.48 | K11: =8+5+3+10 -> 26 | L11: =+(M11+N11)+0.5*O11 -> 14.10 | M11: 6.91 | N11: 7.19 | O11: 0
A12: 8 | B12: Stone, Scott | C12: =+E12+H12+L12 -> 83.39 | D12: =+G12+K12+O12 -> 52 | E12: =+(F12)+0.5*G12 -> 35.36 | F12: 28.86 | G12: =2+2+1+4+4 -> 13 | H12: =+(I12+J12)+0.5*K12 -> 31.65 | I12: 9.11 | J12: 10.54 | K12: =5+5+6+5+3 -> 24 | L12: =+(M12+N12)+0.5*O12 -> 16.38 | M12: 4.57 | N12: 4.31 | O12: =2+1+6+6 -> 15
A13: 9 | B13: Young, Ren | C13: =+E13+H13+L13 -> 83.62 | D13: =+G13+K13+O13 -> 50 | E13: =+(F13)+0.5*G13 -> 30.52 | F13: 18.02 | G13: =2+4+1+4+2+1+1+10 -> 25 | H13: =+(I13+J13)+0.5*K13 -> 35.70 | I13: 15.36 | J13: 14.84 | K13: 11 | L13: =+(M13+N13)+0.5*O13 -> 17.40 | M13: 5.17 | N13: 5.23 | O13: 14
A14: 10 | B14: Young, Jason | C14: =+E14+H14+L14 -> 83.92 | D14: =+G14+K14+O14 -> 86 | E14: =+(F14)+0.5*G14 -> 37.30 | F14: 15.30 | G14: =2+8+4+8+4+6+2+10 -> 44 | H14: =+(I14+J14)+0.5*K14 -> 34.74 | I14: 8.48 | J14: 8.26 | K14: =1+6+15+10+4 -> 36 | L14: =+(M14+N14)+0.5*O14 -> 11.88 | M14: 4.05 | N14: 4.83 | O14: 6
A15: 11 | B15: Zaccardi, Pat | C15: =+E15+H15+L15 -> 84.21 | D15: =+G15+K15+O15 -> 53 | E15: =+(F15)+0.5*G15 -> 28.58 | F15: 22.08 | G15: =2+1+4+2+4 -> 13 | H15: =+(I15+J15)+0.5*K15 -> 45.30 | I15: 11.79 | J15: 13.51 | K15: =2+10+7+7+14 -> 40 | L15: =+(M15+N15)+0.5*O15 -> 10.33 | M15: 5.19 | N15: 5.14 | O15: 0
A16: 12 | B16: Maxwell, Allen | C16: =+E16+H16+L16 -> 86.65 | D16: =+G16+K16+O16 -> 33 | E16: =+(F16)+0.5*G16 -> 32.22 | F16: 29.72 | G16: 5 | H16: =+(I16+J16)+0.5*K16 -> 37.71 | I16: 10.96 | J16: 12.75 | K16: =15+2+11 -> 28 | L16: =+(M16+N16)+0.5*O16 -> 16.72 | M16: 8.36 | N16: 8.36 | O16: 0
A17: 13 | B17: Lemievy, Jeramy | C17: =+E17+H17+L17 -> 86.79 | D17: =+G17+K17+O17 -> 47 | E17: =+(F17)+0.5*G17 -> 34.84 | F17: 21.84 | G17: =1+1+5+1+4+5+4+5 -> 26 | H17: =+(I17+J17)+0.5*K17 -> 35.03 | I17: 13.53 | J17: 14.00 | K17: 15 | L17: =+(M17+N17)+0.5*O17 -> 16.92 | M17: 7.19 | N17: 6.73 | O17: 6
A18: 14 | B18: Phillips, Rdan | C18: =+E18+H18+L18 -> 91.22 | D18: =+G18+K18+O18 -> 46 | E18: =+(F18)+0.5*G18 -> 31.84 | F18: 27.34 | G18: 9 | H18: =+(I18+J18)+0.5*K18 -> 36.49 | I18: 11.58 | J18: 13.91 | K18: =2+5+5+4+6 -> 22 | L18: =+(M18+N18)+0.5*O18 -> 22.89 | M18: 7.17 | N18: 8.22 | O18: 15
A19: 15 | B19: Scott, Michael | C19: =+E19+H19+L19 -> 95.44 | D19: =+G19+K19+O19 -> 63 | E19: =+(F19)+0.5*G19 -> 35.97 | F19: 23.47 | G19: =1+4+6+2+5+3+4 -> 25 | H19: =+(I19+J19)+0.5*K19 -> 37.76 | I19: 11.17 | J19: 16.09 | K19: 21 | L19: =+(M19+N19)+0.5*O19 -> 21.71 | M19: 6.14 | N19: 7.07 | O19: =5+6+6 -> 17
A20: 16 | B20: Hatch, Perri | C20: =+E20+H20+L20 -> 96.15 | D20: =+G20+K20+O20 -> 63 | E20: =+(F20)+0.5*G20 -> 38.74 | F20: 26.74 | G20: =2+2+3+6+4+6+1 -> 24 | H20: =+(I20+J20)+0.5*K20 -> 35.57 | I20: 10.24 | J20: 13.83 | K20: =4+10+1+4+4 -> 23 | L20: =+(M20+N20)+0.5*O20 -> 21.84 | M20: 7.45 | N20: 6.39 | O20: 16
A21: 17 | B21: DeLeeuw, Dave | C21: =+E21+H21+L21 -> 100.50 | D21: =+G21+K21+O21 -> 41 | E21: =+(F21)+0.5*G21 -> 37.06 | F21: 31.56 | G21: 11 | H21: =+(I21+J21)+0.5*K21 -> 43.03 | I21: 14.52 | J21: 16.51 | K21: 24 | L21: =+(M21+N21)+0.5*O21 -> 20.41 | M21: 8.46 | N21: 8.95 | O21: 6
A22: 18 | B22: Hill, Randy | C22: =+E22+H22+L22 -> 102.67 | D22: =+G22+K22+O22 -> 89 | E22: =+(F22)+0.5*G22 -> 36.76 | F22: 19.26 | G22: =4+8+4+1+6+6+1+5 -> 35 | H22: =+(I22+J22)+0.5*K22 -> 36.69 | I22: 12.15 | J22: 11.54 | K22: =2+10+3+2+9 -> 26 | L22: =+(M22+N22)+0.5*O22 -> 29.22 | M22: 8.33 | N22: 6.89 | O22: =6+6+10+6 -> 28
A23: 19 | B23: Redford, Noel | C23: =+E23+H23+L23 -> 119.77 | D23: =+G23+K23+O23 -> 84 | E23: =+(F23)+0.5*G23 -> 40.51 | F23: 25.51 | G23: =1+4+4+5+2+4+4+6 -> 30 | H23: =+(I23+J23)+0.5*K23 -> 53.41 | I23: 20.05 | J23: 18.86 | K23: =5+3+10+3+8 -> 29 | L23: =+(M23+N23)+0.5*O23 -> 25.85 | M23: 6.09 | N23: 7.26 | O23: =5+15+5 -> 25
A24: 20 | B24: Jepperson, Riley | C24: =+E24+H24+L24 -> 121.65 | D24: =+G24+K24+O24 -> 106 | E24: =+(F24)+0.5*G24 -> 48.83 | F24: 26.33 | G24: =6+8+6+8+4+2+6+5 -> 45 | H24: =+(I24+J24)+0.5*K24 -> 55.06 | I24: 11.61 | J24: 18.45 | K24: =6+10+3+13+8+10 -> 50 | L24: =+(M24+N24)+0.5*O24 -> 17.76 | M24: 6.28 | N24: 5.98 | O24: 11
A25: 21 | B25: Shermon, John | C25: =+E25+H25+L25 -> 142.12 | D25: =+G25+K25+O25 -> 98 | E25: =+(F25)+0.5*G25 -> 40.08 | F25: 27.08 | G25: =2+8+2+6+1+2+5 -> 26 | H25: =+(I25+J25)+0.5*K25 -> 51.36 | I25: 11.78 | J25: 12.58 | K25: =4+10+8+16+16 -> 54 | L25: =+(M25+N25)+0.5*O25 -> 50.68 | M25: 19.86 | N25: 21.82 | O25: =12+6 -> 18
A26: 22 | B26: Brown, Mike | C26: =+E26+H26+L26 -> 151.01 | D26: =+G26+K26+O26 -> 125 | E26: =+(F26)+0.5*G26 -> 70.22 | F26: 36.72 | G26: =8+10+10+4+5+2+10+8+10 -> 67 | H26: =+(I26+J26)+0.5*K26 -> 51.41 | I26: 15.52 | J26: 17.89 | K26: =12+10+2+1+11 -> 36 | L26: =+(M26+N26)+0.5*O26 -> 29.38 | M26: 8.09 | N26: 10.29 | O26: =5+5+7+5 -> 22
A27: 23 | B27: Young, Matt | C27: =+E27+H27+L27 -> 164.36 | D27: =+G27+K27+O27 -> 68 | E27: =+(F27)+0.5*G27 -> 77.31 | F27: 65.81 | G27: =1+4+8+4+2+2+2 -> 23 | H27: =+(I27+J27)+0.5*K27 -> 61.09 | I27: 25.61 | J27: 19.48 | K27: =4+5+4+10+9 -> 32 | L27: =+(M27+N27)+0.5*O27 -> 25.96 | M27: 9.49 | N27: 9.97 | O27: 13
A28: 24 | B28: Mandaville, Cathy | C28: =+E28+H28+L28 -> 201.06 | D28: =+G28+K28+O28 -> 120 | E28: =+(F28)+0.5*G28 -> 71.31 | F28: 41.31 | G28: =2+5+8+10+6+6+3+10+10 -> 60 | H28: =+(I28+J28)+0.5*K28 -> 96.89 | I28: 29.09 | J28: 38.30 | K28: =15+12+6+10+16 -> 59 | L28: =+(M28+N28)+0.5*O28 -> 32.86 | M28: 15.68 | N28: 16.68 | O28: 1
A29: Notes:
A30: - | B30: Remember, the "Fun" Shoot is held on the 1st and 3rd Tuesday of each month ( 6:30 p.m.) at Range Masters.
A31: - | B31: You can use ANY handgun you want, as long as it can be safely drawn from a strong-side holster.
A32: - | B32: IDPA format and scoring.
A33: PD | B33: = Points Down = .5 seconds x Points Down
A34: XX | B34: Indicates that the Points Down value includes some kind of penalty (Procedural Error, Hits on Non-Threat, Misses on Steel, etc.)
A35: (Rev) | B35: = Revolver
A36: DNF | B36: = Did Not Finish