B1: Range Masters "Fun" Shoot | I1: Results for November 2, 2004
A2: Click on Stage # for view of COF
B3: Name (Note) | C3: Shoot Total | D3: Total Points Down
A4: Place | E4: Stage 1 | F4: String 1 | G4: String 2 | H4: PD | I4: Stage 2 | J4: String 1 | K4: String 2 | L4: String 3 | M4: PD | N4: Stage 3 | O4: String 1 | P4: String 2 | Q4: String 3 | R4: PD
A5: 1 | B5: Collins, Ken | C5: =+E5+I5+N5 -> 82.09 | D5: =+H5+M5+R5 -> 6 | E5: =+(F5+G5)+0.5*H5 -> 39.37 | F5: 13.89 | G5: 22.48 | H5: =1+1+1+1+2 -> 6 | I5: =+(J5+K5+L5)+0.5*M5 -> 14.52 | J5: 4.32 | K5: 5.00 | L5: 5.20 | M5: 0 | N5: =+(O5+P5+Q5)+0.5*R5 -> 28.20 | O5: 14.17 | P5: 8.00 | Q5: 6.03 | R5: 0
A6: 2 | B6: Young, Ren | C6: =+E6+I6+N6 -> 86.46 | D6: =+H6+M6+R6 -> 13 | E6: =+(F6+G6)+0.5*H6 -> 46.64 | F6: 12.67 | G6: 30.47 | H6: =1+2+1+1+1+1 -> 7 | I6: =+(J6+K6+L6)+0.5*M6 -> 19.02 | J6: 5.39 | K6: 5.36 | L6: 5.27 | M6: =5+1 -> 6 | N6: =+(O6+P6+Q6)+0.5*R6 -> 20.80 | O6: 7.76 | P6: 7.28 | Q6: 5.76 | R6: 0
A7: 3 | B7: Dockstader, Jeff | C7: =+E7+I7+N7 -> 111.22 | D7: =+H7+M7+R7 -> 18 | E7: =+(F7+G7)+0.5*H7 -> 60.79 | F7: 21.50 | G7: 30.79 | H7: =1+3+1+5+1+6 -> 17 | I7: =+(J7+K7+L7)+0.5*M7 -> 24.08 | J7: 4.98 | K7: 7.46 | L7: 11.14 | M7: 1 | N7: =+(O7+P7+Q7)+0.5*R7 -> 26.35 | O7: 7.97 | P7: 7.92 | Q7: 10.46 | R7: 0
A8: 4 | B8: Scott, Alan | C8: =+E8+I8+N8 -> 120.84 | D8: =+H8+M8+R8 -> 30 | E8: =+(F8+G8)+0.5*H8 -> 65.01 | F8: 17.76 | G8: 36.25 | H8: =5+6+1+3+2+4+1 -> 22 | I8: =+(J8+K8+L8)+0.5*M8 -> 25.17 | J8: 6.40 | K8: 7.06 | L8: 7.71 | M8: =1+7 -> 8 | N8: =+(O8+P8+Q8)+0.5*R8 -> 30.66 | O8: 8.81 | P8: 14.24 | Q8: 7.61 | R8: 0
A9: 5 | B9: Stone, Scott | C9: =+E9+I9+N9 -> 134.64 | D9: =+H9+M9+R9 -> 39 | E9: =+(F9+G9)+0.5*H9 -> 70.15 | F9: 20.32 | G9: 37.83 | H9: =1+6+3+1+5+8 -> 24 | I9: =+(J9+K9+L9)+0.5*M9 -> 26.91 | J9: 5.49 | K9: 7.66 | L9: 6.26 | M9: =1+1+5+6+2 -> 15 | N9: =+(O9+P9+Q9)+0.5*R9 -> 37.58 | O9: 8.59 | P9: 18.54 | Q9: 10.45 | R9: 0
A10: 6 | B10: Simpson, Harold | C10: =+E10+I10+N10 -> 143.03 | D10: =+H10+M10+R10 -> 28 | E10: =+(F10+G10)+0.5*H10 -> 78.15 | F10: 15.90 | G10: 54.75 | H10: =2+1+1+4+7 -> 15 | I10: =+(J10+K10+L10)+0.5*M10 -> 25.66 | J10: 5.27 | K10: 5.98 | L10: 7.91 | M10: =7+5+1 -> 13 | N10: =+(O10+P10+Q10)+0.5*R10 -> 39.22 | O10: 14.61 | P10: 13.23 | Q10: 11.38 | R10: 0
A11: 7 | B11: Lyon, Jared | C11: =+E11+I11+N11 -> 148.40 | D11: =+H11+M11+R11 -> 10 | E11: =+(F11+G11)+0.5*H11 -> 67.01 | F11: 29.07 | G11: 35.94 | H11: =1+1+2 -> 4 | I11: =+(J11+K11+L11)+0.5*M11 -> 37.52 | J11: 11.65 | K11: 8.71 | L11: 14.16 | M11: 6 | N11: =+(O11+P11+Q11)+0.5*R11 -> 43.87 | O11: 10.37 | P11: 23.42 | Q11: 10.08 | R11: 0
A12: 8 | B12: Redford, Noel | C12: =+E12+I12+N12 -> 149.10 | D12: =+H12+M12+R12 -> 51 | E12: =+(F12+G12)+0.5*H12 -> 63.85 | F12: 24.46 | G12: 32.39 | H12: =2+1+1+3+7 -> 14 | I12: =+(J12+K12+L12)+0.5*M12 -> 43.77 | J12: 7.30 | K12: 9.79 | L12: 8.18 | M12: =2+2+1+4+8+20 -> 37 | N12: =+(O12+P12+Q12)+0.5*R12 -> 41.48 | O12: 13.83 | P12: 13.72 | Q12: 13.93 | R12: 0
A13: 9 | B13: Scott, Michael | C13: =+E13+I13+N13 -> 163.41 | D13: =+H13+M13+R13 -> 23 | E13: =+(F13+G13)+0.5*H13 -> 67.15 | F13: 16.97 | G13: 44.68 | H13: =1+1+1+1+7 -> 11 | I13: =+(J13+K13+L13)+0.5*M13 -> 25.64 | J13: 5.22 | K13: 6.70 | L13: 7.72 | M13: =1+3+1+7 -> 12 | N13: =+(O13+P13+Q13)+0.5*R13 -> 70.62 | O13: 40.44 | P13: 9.20 | Q13: 20.98 | R13: 0
A14: 10 | B14: Phillips, RDan | C14: =+E14+I14+N14 -> 164.45 | D14: =+H14+M14+R14 -> 12 | E14: =+(F14+G14)+0.5*H14 -> 66.32 | F14: 23.07 | G14: 37.75 | H14: =1+1+1+8 -> 11 | I14: =+(J14+K14+L14)+0.5*M14 -> 28.87 | J14: 6.49 | K14: 8.40 | L14: 13.48 | M14: 1 | N14: =+(O14+P14+Q14)+0.5*R14 -> 69.26 | O14: 18.86 | P14: 18.77 | Q14: 31.63 | R14: 0
A15: 11 | B15: Burney, Carl | C15: =+E15+I15+N15 -> 173.66 | D15: =+H15+M15+R15 -> 24 | E15: =+(F15+G15)+0.5*H15 -> 95.46 | F15: 34.12 | G15: 51.84 | H15: =1+3+1+6+8 -> 19 | I15: =+(J15+K15+L15)+0.5*M15 -> 30.66 | J15: 8.00 | K15: 9.54 | L15: 10.62 | M15: 5 | N15: =+(O15+P15+Q15)+0.5*R15 -> 47.54 | O15: 20.62 | P15: 10.89 | Q15: 16.03 | R15: 0
A16: 12 | B16: Terry, Marshall | C16: =+E16+I16+N16 -> 179.80 | D16: =+H16+M16+R16 -> 51 | E16: =+(F16+G16)+0.5*H16 -> 100.11 | F16: 35.12 | G16: 49.99 | H16: =5+6+1+1+5+9+3 -> 30 | I16: =+(J16+K16+L16)+0.5*M16 -> 31.35 | J16: 6.89 | K16: 9.71 | L16: 9.25 | M16: =5+1+1+1+2+1 -> 11 | N16: =+(O16+P16+Q16)+0.5*R16 -> 48.34 | O16: 9.28 | P16: 26.49 | Q16: 7.57 | R16: 10
A17: 13 | B17: Jepperson, Riley | C17: =+E17+I17+N17 -> 244.39 | D17: =+H17+M17+R17 -> 103 | E17: =+(F17+G17)+0.5*H17 -> 82.07 | F17: 22.22 | G17: 37.35 | H17: =1+10+2+3+5+7+4+13 -> 45 | I17: =+(J17+K17+L17)+0.5*M17 -> 45.12 | J17: 4.57 | K17: 9.46 | L17: 7.09 | M17: =2+7+9+6+7+7+10 -> 48 | N17: =+(O17+P17+Q17)+0.5*R17 -> 117.20 | O17: 18.99 | P17: 47.02 | Q17: 46.19 | R17: 10
A18: 14 | B18: Herring, Erin (.22) | C18: =+E18+I18+N18 -> 260.62 | D18: =+H18+M18+R18 -> 42 | E18: =+(F18+G18)+0.5*H18 -> 119.50 | F18: 38.97 | G18: 69.03 | H18: =5+1+2+2+2+3+2+6 -> 23 | I18: =+(J18+K18+L18)+0.5*M18 -> 38.01 | J18: 9.24 | K18: 9.99 | L18: 9.28 | M18: =1+8+5+5 -> 19 | N18: =+(O18+P18+Q18)+0.5*R18 -> 103.11 | O18: 18.31 | P18: 40.08 | Q18: 44.72 | R18: 0
A19: 15 | B19: Hoyt, David | C19: =+E19+I19+N19 -> 274.75 | D19: =+H19+M19+R19 -> 59 | E19: =+(F19+G19)+0.5*H19 -> 113.93 | F19: 26.25 | G19: 67.68 | H19: =5+5+4+1+9+8+8 -> 40 | I19: =+(J19+K19+L19)+0.5*M19 -> 35.37 | J19: 7.91 | K19: 8.68 | L19: 9.28 | M19: =5+1+5+6+2 -> 19 | N19: =+(O19+P19+Q19)+0.5*R19 -> 125.45 | O19: 22.09 | P19: 38.86 | Q19: 64.50 | R19: 0
A20: 16 | B20: Simons, Jordan | C20: =+E20+I20+N20 -> 293.57 | D20: =+H20+M20+R20 -> 57 | E20: =+(F20+G20)+0.5*H20 -> 137.33 | F20: 30.53 | G20: 89.80 | H20: =9+9+2+5+5+4 -> 34 | I20: =+(J20+K20+L20)+0.5*M20 -> 51.86 | J20: 12.98 | K20: 12.70 | L20: 14.68 | M20: =6+5+1+1+10 -> 23 | N20: =+(O20+P20+Q20)+0.5*R20 -> 104.38 | O20: 16.30 | P20: 40.37 | Q20: 47.71 | R20: 0
A21: 17 | B21: Phillips, Tisha (.22) | C21: =+E21+I21+N21 -> 338.87 | D21: =+H21+M21+R21 -> 102 | E21: =+(F21+G21)+0.5*H21 -> 158.71 | F21: 62.48 | G21: 73.23 | H21: =8+6+2+1+6+7+8+8 -> 46 | I21: =+(J21+K21+L21)+0.5*M21 -> 55.21 | J21: 12.45 | K21: 6.87 | L21: 7.89 | M21: =1+1+8+3+7+6+30 -> 56 | N21: =+(O21+P21+Q21)+0.5*R21 -> 124.95 | O21: 41.42 | P21: 47.34 | Q21: 36.19 | R21: 0
A22: 18 | B22: Simons, Brad | C22: =+E22+I22+N22 -> 352.12 | D22: =+H22+M22+R22 -> 140 | E22: =+(F22+G22)+0.5*H22 -> 107.75 | F22: 31.13 | G22: 56.12 | H22: =1+2+5+2+1+30 -> 41 | I22: =+(J22+K22+L22)+0.5*M22 -> 85.42 | J22: 16.08 | K22: 25.28 | L22: 19.56 | M22: =6+7+13+2+1+20 -> 49 | N22: =+(O22+P22+Q22)+0.5*R22 -> 158.95 | O22: 77.06 | P22: 22.24 | Q22: 34.65 | R22: 50
A23: Notes:
A24: - | B24: Remember, the "Fun" Shoot is held on the 1st and 3rd Tuesday of each month ( 6:30 p.m.) at Range Masters.
A25: - | B25: You can use ANY handgun you want, as long as it can be safely drawn from a strong-side holster.
A26: - | B26: IDPA format and scoring.
A27: PD | B27: = Points Down = .5 seconds x Points Down
A28: XX | B28: Indicates that the Points Down value includes some kind of penalty (Procedural Error, Hits on Non-Threat, Misses on Steel, etc.)
A29: (Rev) | B29: = Revolver
A30: DNF | B30: = Did Not Finish