B1: Range Masters "Fun" Shoot | H1: Results for January 6, 2004
B2: Name (Note) | C2: Shoot Total | D2: Total Points Down
A3: Place | E3: Stage 1 | F3: String 1 | G3: String 2 | H3: PD | I3: Stage 2 | J3: String 1 | K3: PD | L3: Stage 3 | M3: String 1 | N3: String 2 | O3: String 3 | P3: PD
A4: 1 | B4: Zaccardi, Pat | C4: =+E4+I4+L4 -> 47.91 | D4: =+H4+K4+P4 -> 11 | E4: =+(F4+G4)+0.5*H4 -> 22.15 | F4: 14.25 | G4: 3.40 | H4: 9 | I4: =+(J4)+0.5*K4 -> 11.43 | J4: 10.43 | K4: 2 | L4: =+(M4+N4+O4)+0.5*P4 -> 14.33 | M4: 3.09 | N4: 5.21 | O4: 6.03 | P4: 0
A5: 2 | B5: Collins, Ken | C5: =+E5+I5+L5 -> 52.23 | D5: =+H5+K5+P5 -> 12 | E5: =+(F5+G5)+0.5*H5 -> 20.53 | F5: 14.14 | G5: 3.39 | H5: 6 | I5: =+(J5)+0.5*K5 -> 18.70 | J5: 15.70 | K5: 6 | L5: =+(M5+N5+O5)+0.5*P5 -> 13.00 | M5: 4.05 | N5: 4.38 | O5: 4.57 | P5: 0
A6: 3 | B6: Stilwell, Mike | C6: =+E6+I6+L6 -> 55.89 | D6: =+H6+K6+P6 -> 13 | E6: =+(F6+G6)+0.5*H6 -> 21.52 | F6: 15.63 | G6: 3.89 | H6: 4 | I6: =+(J6)+0.5*K6 -> 20.26 | J6: 16.26 | K6: 8 | L6: =+(M6+N6+O6)+0.5*P6 -> 14.11 | M6: 3.12 | N6: 5.83 | O6: 4.66 | P6: 1
A7: 4 | B7: Taylor, Josh | C7: =+E7+I7+L7 -> 61.79 | D7: =+H7+K7+P7 -> 5 | E7: =+(F7+G7)+0.5*H7 -> 27.41 | F7: 19.18 | G7: 6.73 | H7: 3 | I7: =+(J7)+0.5*K7 -> 15.27 | J7: 14.27 | K7: 2 | L7: =+(M7+N7+O7)+0.5*P7 -> 19.11 | M7: 6.59 | N7: 6.08 | O7: 6.44 | P7: 0
A8: 5 | B8: Hansen, Jeff | C8: =+E8+I8+L8 -> 62.19 | D8: =+H8+K8+P8 -> 25 | E8: =+(F8+G8)+0.5*H8 -> 28.20 | F8: 14.74 | G8: 6.96 | H8: 13 | I8: =+(J8)+0.5*K8 -> 19.68 | J8: 14.18 | K8: 11 | L8: =+(M8+N8+O8)+0.5*P8 -> 14.31 | M8: 5.04 | N8: 3.78 | O8: 4.99 | P8: 1
A9: 6 | B9: Legg, Rich | C9: =+E9+I9+L9 -> 65.64 | D9: =+H9+K9+P9 -> 6 | E9: =+(F9+G9)+0.5*H9 -> 29.73 | F9: 22.33 | G9: 6.40 | H9: 2 | I9: =+(J9)+0.5*K9 -> 19.28 | J9: 17.78 | K9: 3 | L9: =+(M9+N9+O9)+0.5*P9 -> 16.63 | M9: 4.20 | N9: 5.52 | O9: 6.41 | P9: 1
A10: 7 | B10: Redford, Steve | C10: =+E10+I10+L10 -> 67.06 | D10: =+H10+K10+P10 -> 38 | E10: =+(F10+G10)+0.5*H10 -> 27.72 | F10: 17.42 | G10: 3.80 | H10: 13 | I10: =+(J10)+0.5*K10 -> 21.87 | J10: 15.37 | K10: 13 | L10: =+(M10+N10+O10)+0.5*P10 -> 17.47 | M10: 3.19 | N10: 3.67 | O10: 4.61 | P10: 12
A11: 8 | B11: Zaccardi, Juke | C11: =+E11+I11+L11 -> 71.75 | D11: =+H11+K11+P11 -> 14 | E11: =+(F11+G11)+0.5*H11 -> 28.96 | F11: 19.58 | G11: 4.38 | H11: 10 | I11: =+(J11)+0.5*K11 -> 23.59 | J11: 22.59 | K11: 2 | L11: =+(M11+N11+O11)+0.5*P11 -> 19.20 | M11: 4.65 | N11: 6.99 | O11: 6.56 | P11: 2
A12: 9 | B12: Young, Jason | C12: =+E12+I12+L12 -> 73.78 | D12: =+H12+K12+P12 -> 63 | E12: =+(F12+G12)+0.5*H12 -> 22.50 | F12: 12.28 | G12: 3.22 | H12: 14 | I12: =+(J12)+0.5*K12 -> 27.83 | J12: 13.83 | K12: 28 | L12: =+(M12+N12+O12)+0.5*P12 -> 23.45 | M12: 2.79 | N12: 5.32 | O12: 4.84 | P12: 21
A13: 10 | B13: Huff, Blake (Rev) | C13: =+E13+I13+L13 -> 75.25 | D13: =+H13+K13+P13 -> 12 | E13: =+(F13+G13)+0.5*H13 -> 36.22 | F13: 22.89 | G13: 8.83 | H13: 9 | I13: =+(J13)+0.5*K13 -> 22.71 | J13: 21.21 | K13: 3 | L13: =+(M13+N13+O13)+0.5*P13 -> 16.32 | M13: 4.91 | N13: 5.37 | O13: 6.04 | P13: 0
A14: 11 | B14: Stoddard, Paul | C14: =+E14+I14+L14 -> 76.69 | D14: =+H14+K14+P14 -> 9 | E14: =+(F14+G14)+0.5*H14 -> 27.19 | F14: 20.82 | G14: 4.37 | H14: 4 | I14: =+(J14)+0.5*K14 -> 23.16 | J14: 20.66 | K14: 5 | L14: =+(M14+N14+O14)+0.5*P14 -> 26.34 | M14: 5.14 | N14: 16.02 | O14: 5.18 | P14: 0
A15: 12 | B15: Mortensen, Gary | C15: =+E15+I15+L15 -> 77.03 | D15: =+H15+K15+P15 -> 32 | E15: =+(F15+G15)+0.5*H15 -> 32.32 | F15: 21.76 | G15: 4.06 | H15: 13 | I15: =+(J15)+0.5*K15 -> 27.19 | J15: 18.69 | K15: 17 | L15: =+(M15+N15+O15)+0.5*P15 -> 17.52 | M15: 5.60 | N15: 5.64 | O15: 5.28 | P15: 2
A16: 13 | B16: Stone, Scott | C16: =+E16+I16+L16 -> 78.63 | D16: =+H16+K16+P16 -> 33 | E16: =+(F16+G16)+0.5*H16 -> 33.91 | F16: 19.95 | G16: 4.46 | H16: 19 | I16: =+(J16)+0.5*K16 -> 24.26 | J16: 20.76 | K16: 7 | L16: =+(M16+N16+O16)+0.5*P16 -> 20.46 | M16: 4.15 | N16: 4.78 | O16: 8.03 | P16: 7
A17: 14 | B17: Hatch, Perri | C17: =+E17+I17+L17 -> 79.55 | D17: =+H17+K17+P17 -> 22 | E17: =+(F17+G17)+0.5*H17 -> 36.77 | F17: 31.33 | G17: 4.94 | H17: 1 | I17: =+(J17)+0.5*K17 -> 26.20 | J17: 18.70 | K17: 15 | L17: =+(M17+N17+O17)+0.5*P17 -> 16.58 | M17: 4.19 | N17: 4.87 | O17: 4.52 | P17: 6
A18: 15 | B18: Hood, Neil | C18: =+E18+I18+L18 -> 80.18 | D18: =+H18+K18+P18 -> 15 | E18: =+(F18+G18)+0.5*H18 -> 37.14 | F18: 25.54 | G18: 4.60 | H18: 14 | I18: =+(J18)+0.5*K18 -> 24.29 | J18: 23.79 | K18: 1 | L18: =+(M18+N18+O18)+0.5*P18 -> 18.75 | M18: 5.28 | N18: 6.50 | O18: 6.97 | P18: 0
A19: 16 | B19: Myers, Chris (Rev) | C19: =+E19+I19+L19 -> 80.87 | D19: =+H19+K19+P19 -> 10 | E19: =+(F19+G19)+0.5*H19 -> 37.90 | F19: 28.65 | G19: 5.25 | H19: 8 | I19: =+(J19)+0.5*K19 -> 22.74 | J19: 22.24 | K19: 1 | L19: =+(M19+N19+O19)+0.5*P19 -> 20.23 | M19: 6.31 | N19: 7.03 | O19: 6.39 | P19: 1
A20: 17 | B20: Redford, Noel | C20: =+E20+I20+L20 -> 82.05 | D20: =+H20+K20+P20 -> 15 | E20: =+(F20+G20)+0.5*H20 -> 33.49 | F20: 23.64 | G20: 6.85 | H20: 6 | I20: =+(J20)+0.5*K20 -> 27.85 | J20: 26.85 | K20: 2 | L20: =+(M20+N20+O20)+0.5*P20 -> 20.71 | M20: 4.76 | N20: 5.32 | O20: 7.13 | P20: 7
A21: 18 | B21: Scott, Alan | C21: =+E21+I21+L21 -> 84.63 | D21: =+H21+K21+P21 -> 21 | E21: =+(F21+G21)+0.5*H21 -> 47.99 | F21: 37.75 | G21: 4.24 | H21: 12 | I21: =+(J21)+0.5*K21 -> 22.44 | J21: 17.94 | K21: 9 | L21: =+(M21+N21+O21)+0.5*P21 -> 14.20 | M21: 4.09 | N21: 5.10 | O21: 5.01 | P21: 0
A22: 19 | B22: Scobell, Justin | C22: =+E22+I22+L22 -> 84.79 | D22: =+H22+K22+P22 -> 40 | E22: =+(F22+G22)+0.5*H22 -> 40.86 | F22: 26.23 | G22: 4.13 | H22: 21 | I22: =+(J22)+0.5*K22 -> 25.74 | J22: 16.24 | K22: 19 | L22: =+(M22+N22+O22)+0.5*P22 -> 18.19 | M22: 5.65 | N22: 6.01 | O22: 6.53 | P22: 0
A23: 20 | B23: Ottesen, Sterling | C23: =+E23+I23+L23 -> 87.41 | D23: =+H23+K23+P23 -> 19 | E23: =+(F23+G23)+0.5*H23 -> 46.17 | F23: 36.68 | G23: 4.99 | H23: 9 | I23: =+(J23)+0.5*K23 -> 20.39 | J23: 19.39 | K23: 2 | L23: =+(M23+N23+O23)+0.5*P23 -> 20.85 | M23: 5.84 | N23: 5.20 | O23: 5.81 | P23: 8
A24: 21 | B24: Billings, Scott | C24: =+E24+I24+L24 -> 92.66 | D24: =+H24+K24+P24 -> 31 | E24: =+(F24+G24)+0.5*H24 -> 37.45 | F24: 28.11 | G24: 6.84 | H24: 5 | I24: =+(J24)+0.5*K24 -> 30.15 | J24: 20.15 | K24: 20 | L24: =+(M24+N24+O24)+0.5*P24 -> 25.06 | M24: 5.76 | N24: 9.14 | O24: 7.16 | P24: 6
A25: 22 | B25: Marlow, Dave (.22) | C25: =+E25+I25+L25 -> 94.16 | D25: =+H25+K25+P25 -> 5 | E25: =+(F25+G25)+0.5*H25 -> 41.52 | F25: 34.47 | G25: 5.05 | H25: 4 | I25: =+(J25)+0.5*K25 -> 25.72 | J25: 25.72 | K25: 0 | L25: =+(M25+N25+O25)+0.5*P25 -> 26.92 | M25: 5.11 | N25: 14.78 | O25: 6.53 | P25: 1
A26: 23 | B26: Sherman, Adam | C26: =+E26+I26+L26 -> 95.74 | D26: =+H26+K26+P26 -> 32 | E26: =+(F26+G26)+0.5*H26 -> 43.73 | F26: 28.09 | G26: 5.64 | H26: 20 | I26: =+(J26)+0.5*K26 -> 26.72 | J26: 23.22 | K26: 7 | L26: =+(M26+N26+O26)+0.5*P26 -> 25.29 | M26: 6.15 | N26: 7.84 | O26: 8.80 | P26: 5
A27: 24 | B27: Johnson, Dixie (.22) | C27: =+E27+I27+L27 -> 97.00 | D27: =+H27+K27+P27 -> 30 | E27: =+(F27+G27)+0.5*H27 -> 46.00 | F27: 30.88 | G27: 5.12 | H27: 20 | I27: =+(J27)+0.5*K27 -> 28.07 | J27: 24.57 | K27: 7 | L27: =+(M27+N27+O27)+0.5*P27 -> 22.93 | M27: 5.68 | N27: 7.37 | O27: 8.38 | P27: 3
A28: 25 | B28: Scott, Michael | C28: =+E28+I28+L28 -> 98.17 | D28: =+H28+K28+P28 -> 19 | E28: =+(F28+G28)+0.5*H28 -> 49.67 | F28: 38.70 | G28: 5.47 | H28: 11 | I28: =+(J28)+0.5*K28 -> 30.80 | J28: 29.30 | K28: 3 | L28: =+(M28+N28+O28)+0.5*P28 -> 17.70 | M28: 4.97 | N28: 5.07 | O28: 5.16 | P28: 5
A29: 26 | B29: Burney, Carl | C29: =+E29+I29+L29 -> 102.33 | D29: =+H29+K29+P29 -> 10 | E29: =+(F29+G29)+0.5*H29 -> 40.19 | F29: 28.63 | G29: 9.06 | H29: 5 | I29: =+(J29)+0.5*K29 -> 33.05 | J29: 30.55 | K29: 5 | L29: =+(M29+N29+O29)+0.5*P29 -> 29.09 | M29: 10.81 | N29: 8.88 | O29: 9.40 | P29: 0
A30: 27 | B30: Stilwell, Skylar | C30: =+E30+I30+L30 -> 111.51 | D30: =+H30+K30+P30 -> 91 | E30: =+(F30+G30)+0.5*H30 -> 36.41 | F30: 21.31 | G30: 6.10 | H30: 18 | I30: =+(J30)+0.5*K30 -> 30.63 | J30: 16.13 | K30: 29 | L30: =+(M30+N30+O30)+0.5*P30 -> 44.47 | M30: 6.29 | N30: 7.33 | O30: 8.85 | P30: 44
A31: 28 | B31: Simons, Jordan | C31: =+E31+I31+L31 -> 123.13 | D31: =+H31+K31+P31 -> 52 | E31: =+(F31+G31)+0.5*H31 -> 60.37 | F31: 46.40 | G31: 4.47 | H31: 19 | I31: =+(J31)+0.5*K31 -> 40.15 | J31: 30.65 | K31: 19 | L31: =+(M31+N31+O31)+0.5*P31 -> 22.61 | M31: 5.02 | N31: 4.98 | O31: 5.61 | P31: 14
A32: 29 | B32: Billings, Richard | C32: =+E32+I32+L32 -> 123.86 | D32: =+H32+K32+P32 -> 101 | E32: =+(F32+G32)+0.5*H32 -> 55.94 | F32: 24.11 | G32: 6.33 | H32: =7+7+2+1+5+8+21 -> 51 | I32: =+(J32)+0.5*K32 -> 36.65 | J32: 21.15 | K32: 31 | L32: =+(M32+N32+O32)+0.5*P32 -> 31.27 | M32: 6.22 | N32: 7.42 | O32: 8.13 | P32: 19
A33: 30 | B33: Simons, Brad | C33: =+E33+I33+L33 -> 125.95 | D33: =+H33+K33+P33 -> 97 | E33: =+(F33+G33)+0.5*H33 -> 62.69 | F33: 31.08 | G33: 6.61 | H33: =1+4+3+4+21+17 -> 50 | I33: =+(J33)+0.5*K33 -> 35.22 | J33: 20.72 | K33: 29 | L33: =+(M33+N33+O33)+0.5*P33 -> 28.04 | M33: 5.93 | N33: 6.45 | O33: 6.66 | P33: 18
A34: 31 | B34: K., Abe (.22) | C34: =+E34+I34+L34 -> 139.94 | D34: =+H34+K34+P34 -> 27 | E34: =+(F34+G34)+0.5*H34 -> 49.58 | F34: 33.35 | G34: 9.23 | H34: 14 | I34: =+(J34)+0.5*K34 -> 52.98 | J34: 52.48 | K34: 1 | L34: =+(M34+N34+O34)+0.5*P34 -> 37.38 | M34: 12.44 | N34: 9.84 | O34: 9.10 | P34: 12
A35: 32 | B35: V. Jeremy | C35: =+E35+I35+L35 -> 145.67 | D35: =+H35+K35+P35 -> 111 | E35: =+(F35+G35)+0.5*H35 -> 54.75 | F35: 26.66 | G35: 4.59 | H35: =6+5+3+3+10+13+7 -> 47 | I35: =+(J35)+0.5*K35 -> 52.54 | J35: 43.04 | K35: 19 | L35: =+(M35+N35+O35)+0.5*P35 -> 38.38 | M35: 5.87 | N35: 5.35 | O35: 4.66 | P35: =17+16+12 -> 45
A36: 33 | B36: Brown, Michael | C36: =+E36+I36+L36 -> 165.68 | D36: =+H36+K36+P36 -> 48 | E36: =+(F36+G36)+0.5*H36 -> 112.22 | F36: 83.63 | G36: 12.09 | H36: 33 | I36: =+(J36)+0.5*K36 -> 24.79 | J36: 20.29 | K36: 9 | L36: =+(M36+N36+O36)+0.5*P36 -> 28.67 | M36: 6.60 | N36: 8.37 | O36: 10.70 | P36: 6
A37: 34 | B37: Johnson, Jim | C37: =+E37+I37+L37 -> 190.87 | D37: =+H37+K37+P37 -> 85 | E37: =+(F37+G37)+0.5*H37 -> 75.14 | F37: 45.96 | G37: 8.18 | H37: 42 | I37: =+(J37)+0.5*K37 -> 89.96 | J37: 70.96 | K37: 38 | L37: =+(M37+N37+O37)+0.5*P37 -> 25.77 | M37: 7.33 | N37: 7.51 | O37: 8.43 | P37: 5
A38: Notes:
A39: - | B39: Remember, the "Fun" Shoot is held on the 1st and 3rd Tuesday of each month ( 6:30 p.m.) at Range Masters.
A40: - | B40: You can use ANY handgun you want, as long as it can be safely drawn from a strong-side holster.
A41: - | B41: IDPA format and scoring.
A42: PD | B42: = Points Down = .5 seconds x Points Down
A43: xx | B43: Indicates that the Points Down value includes some kind of penalty (Procedural Error, Hits on Non-Threat, Misses on Steel, etc.)
A44: (Rev) | B44: = Revolver
A45: DNF | B45: = Did Not Finish