B1: Range Masters "Fun" Shoot | I1: Results for November 16, 2004
A2: Click on Stage # for view of COF
B3: Name (Note) | C3: Shoot Total | D3: Total Points Down
A4: Place | E4: Stage 1 | F4: String 1 | G4: String 2 | H4: PD | I4: Stage 2 | J4: String 1 | K4: String 2 | L4: String 3 | M4: PD | N4: Stage 3 | O4: String 1 | P4: String 2 | Q4: PD
A5: 1 | B5: Collins, Ken | C5: =+E5+I5+N5 -> 55.74 | D5: =+H5+M5+Q5 -> 4 | E5: =+(F5+G5)+0.5*H5 -> 23.42 | F5: 17.09 | G5: 4.83 | H5: 3 | I5: =+(J5+K5+L5)+0.5*M5 -> 16.31 | J5: 4.76 | K5: 5.54 | L5: 5.51 | M5: 1 | N5: =+(O5+P5)+0.5*Q5 -> 16.01 | O5: 9.19 | P5: 6.82 | Q5: 0
A6: 2 | B6: Redford, "Red" | C6: =+E6+I6+N6 -> 69.37 | D6: =+H6+M6+Q6 -> 4 | E6: =+(F6+G6)+0.5*H6 -> 30.67 | F6: 23.24 | G6: 6.43 | H6: 2 | I6: =+(J6+K6+L6)+0.5*M6 -> 21.02 | J6: 6.36 | K6: 5.94 | L6: 7.72 | M6: 2 | N6: =+(O6+P6)+0.5*Q6 -> 17.68 | O6: 10.06 | P6: 7.62 | Q6: 0
A7: 3 | B7: Young, Jason | C7: =+E7+I7+N7 -> 74.05 | D7: =+H7+M7+Q7 -> 5 | E7: =+(F7+G7)+0.5*H7 -> 26.34 | F7: 20.79 | G7: 4.55 | H7: 2 | I7: =+(J7+K7+L7)+0.5*M7 -> 25.39 | J7: 3.89 | K7: 5.07 | L7: 14.93 | M7: 3 | N7: =+(O7+P7)+0.5*Q7 -> 22.32 | O7: 11.07 | P7: 11.25 | Q7: 0
A8: 4 | B8: Rodriquez, Mike | C8: =+E8+I8+N8 -> 81.39 | D8: =+H8+M8+Q8 -> 24 | E8: =+(F8+G8)+0.5*H8 -> 25.99 | F8: 18.28 | G8: 4.71 | H8: =1+1+3+1 -> 6 | I8: =+(J8+K8+L8)+0.5*M8 -> 35.29 | J8: 6.63 | K8: 5.88 | L8: 13.78 | M8: =6+12 -> 18 | N8: =+(O8+P8)+0.5*Q8 -> 20.11 | O8: 11.47 | P8: 8.64 | Q8: 0
A9: 5 | B9: Dockstader, Jeff | C9: =+E9+I9+N9 -> 83.79 | D9: =+H9+M9+Q9 -> 31 | E9: =+(F9+G9)+0.5*H9 -> 32.69 | F9: 19.76 | G9: 5.93 | H9: =1+1+1+5+5+1 -> 14 | I9: =+(J9+K9+L9)+0.5*M9 -> 29.40 | J9: 8.48 | K9: 6.52 | L9: 5.90 | M9: =12+5 -> 17 | N9: =+(O9+P9)+0.5*Q9 -> 21.70 | O9: 11.88 | P9: 9.82 | Q9: 0
A10: 6 | B10: Stone, Scott | C10: =+E10+I10+N10 -> 85.45 | D10: =+H10+M10+Q10 -> 25 | E10: =+(F10+G10)+0.5*H10 -> 35.12 | F10: 21.31 | G10: 4.31 | H10: =3+1+5+3+6+1 -> 19 | I10: =+(J10+K10+L10)+0.5*M10 -> 24.26 | J10: 6.02 | K10: 5.57 | L10: 9.67 | M10: =2+1+3 -> 6 | N10: =+(O10+P10)+0.5*Q10 -> 26.07 | O10: 12.83 | P10: 13.24 | Q10: 0
A11: 7 | B11: Young, Ren | C11: =+E11+I11+N11 -> 85.45 | D11: =+H11+M11+Q11 -> 26 | E11: =+(F11+G11)+0.5*H11 -> 32.86 | F11: 18.66 | G11: 4.70 | H11: =5+5+8+1 -> 19 | I11: =+(J11+K11+L11)+0.5*M11 -> 33.25 | J11: 16.90 | K11: 5.74 | L11: 7.11 | M11: =1+6 -> 7 | N11: =+(O11+P11)+0.5*Q11 -> 19.34 | O11: 9.04 | P11: 10.30 | Q11: 0
A12: 8 | B12: DeLeeuw, Dave | C12: =+E12+I12+N12 -> 94.53 | D12: =+H12+M12+Q12 -> 20 | E12: =+(F12+G12)+0.5*H12 -> 37.73 | F12: 28.05 | G12: 5.18 | H12: =1+1+5+1+1 -> 9 | I12: =+(J12+K12+L12)+0.5*M12 -> 40.16 | J12: 12.70 | K12: 8.93 | L12: 13.03 | M12: =6+4+1 -> 11 | N12: =+(O12+P12)+0.5*Q12 -> 16.64 | O12: 8.68 | P12: 7.96 | Q12: 0
A13: 9 | B13: Mortensen, Curtis | C13: =+E13+I13+N13 -> 94.99 | D13: =+H13+M13+Q13 -> 20 | E13: =+(F13+G13)+0.5*H13 -> 37.02 | F13: 22.67 | G13: 5.35 | H13: =7+2+1+2+2+1+3 -> 18 | I13: =+(J13+K13+L13)+0.5*M13 -> 34.81 | J13: 5.01 | K13: 6.26 | L13: 22.54 | M13: 2 | N13: =+(O13+P13)+0.5*Q13 -> 23.16 | O13: 11.63 | P13: 11.53 | Q13: 0
A14: 10 | B14: Scott, Alan | C14: =+E14+I14+N14 -> 98.59 | D14: =+H14+M14+Q14 -> 39 | E14: =+(F14+G14)+0.5*H14 -> 43.82 | F14: 27.63 | G14: 4.69 | H14: =1+6+5+5+6 -> 23 | I14: =+(J14+K14+L14)+0.5*M14 -> 27.06 | J14: 5.00 | K14: 6.76 | L14: 7.30 | M14: =9+5+2 -> 16 | N14: =+(O14+P14)+0.5*Q14 -> 27.71 | O14: 16.90 | P14: 10.81 | Q14: 0
A15: 11 | B15: Mortensen, Gary | C15: =+E15+I15+N15 -> 111.81 | D15: =+H15+M15+Q15 -> 48 | E15: =+(F15+G15)+0.5*H15 -> 45.05 | F15: 28.78 | G15: 5.27 | H15: =1+1+5+5+10 -> 22 | I15: =+(J15+K15+L15)+0.5*M15 -> 34.36 | J15: 5.75 | K15: 5.87 | L15: 9.74 | M15: =2+12+12 -> 26 | N15: =+(O15+P15)+0.5*Q15 -> 32.40 | O15: 9.70 | P15: 22.70 | Q15: 0
A16: 12 | B16: Simpson, Harold | C16: =+E16+I16+N16 -> 113.70 | D16: =+H16+M16+Q16 -> 25 | E16: =+(F16+G16)+0.5*H16 -> 49.30 | F16: 38.30 | G16: 7.50 | H16: =2+2+1+2 -> 7 | I16: =+(J16+K16+L16)+0.5*M16 -> 43.64 | J16: 7.67 | K16: 11.34 | L16: 15.63 | M16: =12+1+5 -> 18 | N16: =+(O16+P16)+0.5*Q16 -> 20.76 | O16: 11.58 | P16: 9.18 | Q16: 0
A17: 13 | B17: Scott, Michael | C17: =+E17+I17+N17 -> 121.44 | D17: =+H17+M17+Q17 -> 57 | E17: =+(F17+G17)+0.5*H17 -> 47.64 | F17: 30.21 | G17: 3.93 | H17: =1+8+7+6+1+3+1 -> 27 | I17: =+(J17+K17+L17)+0.5*M17 -> 45.54 | J17: 5.60 | K17: 14.34 | L17: 10.60 | M17: =2+6+22 -> 30 | N17: =+(O17+P17)+0.5*Q17 -> 28.26 | O17: 11.33 | P17: 16.93 | Q17: 0
A18: 14 | B18: Jepperson, Riley | C18: =+E18+I18+N18 -> 148.67 | D18: =+H18+M18+Q18 -> 31 | E18: =+(F18+G18)+0.5*H18 -> 55.03 | F18: 38.70 | G18: 5.83 | H18: =2+1+2+1+7+1+2+5 -> 21 | I18: =+(J18+K18+L18)+0.5*M18 -> 37.61 | J18: 14.69 | K18: 6.17 | L18: 11.75 | M18: =1+3+6 -> 10 | N18: =+(O18+P18)+0.5*Q18 -> 56.03 | O18: 15.40 | P18: 40.63 | Q18: 0
A19: 15 | B19: Burney, Carl | C19: =+E19+I19+N19 -> 159.24 | D19: =+H19+M19+Q19 -> 6 | E19: =+(F19+G19)+0.5*H19 -> 53.82 | F19: 36.29 | G19: 14.53 | H19: 6 | I19: =+(J19+K19+L19)+0.5*M19 -> 37.39 | J19: 12.02 | K19: 13.15 | L19: 12.22 | M19: 0 | N19: =+(O19+P19)+0.5*Q19 -> 68.03 | O19: 15.62 | P19: 52.41 | Q19: 0
A20: 16 | B20: Hoyt, David | C20: =+E20+I20+N20 -> 182.69 | D20: =+H20+M20+Q20 -> 50 | E20: =+(F20+G20)+0.5*H20 -> 56.98 | F20: 28.26 | G20: 11.72 | H20: =10+13+6+5 -> 34 | I20: =+(J20+K20+L20)+0.5*M20 -> 39.59 | J20: 6.07 | K20: 8.54 | L20: 16.98 | M20: =6+6+4 -> 16 | N20: =+(O20+P20)+0.5*Q20 -> 86.12 | O20: 45.38 | P20: 40.74 | Q20: 0
A21: 17 | B21: Herring, Erin (.22) | C21: =+E21+I21+N21 -> 199.64 | D21: =+H21+M21+Q21 -> 19 | E21: =+(F21+G21)+0.5*H21 -> 69.41 | F21: 44.25 | G21: 17.16 | H21: =2+7+5+1+1 -> 16 | I21: =+(J21+K21+L21)+0.5*M21 -> 39.15 | J21: 13.63 | K21: 9.38 | L21: 14.64 | M21: =2+1 -> 3 | N21: =+(O21+P21)+0.5*Q21 -> 91.08 | O21: 44.77 | P21: 46.31 | Q21: 0
A22: 18 | B22: Mallory, Kevin | C22: =+E22+I22+N22 -> 230.32 | D22: =+H22+M22+Q22 -> 55 | E22: =+(F22+G22)+0.5*H22 -> 45.41 | F22: 25.13 | G22: 5.28 | H22: =1+5+11+6+2+3+1+1 -> 30 | I22: =+(J22+K22+L22)+0.5*M22 -> 40.06 | J22: 7.16 | K22: 5.03 | L22: 15.37 | M22: =6+6+13 -> 25 | N22: =+(O22+P22)+0.5*Q22 -> 144.85 | O22: 74.72 | P22: 70.13 | Q22: 0
A23: 19 | B23: Betzer, Michael | C23: =+E23+I23+N23 -> 319.83 | D23: =+H23+M23+Q23 -> 58 | E23: =+(F23+G23)+0.5*H23 -> 81.57 | F23: 47.57 | G23: 16.00 | H23: =2+6+4+3+7+2+5+7 -> 36 | I23: =+(J23+K23+L23)+0.5*M23 -> 77.39 | J23: 17.20 | K23: 31.06 | L23: 18.13 | M23: =6+6+10 -> 22 | N23: =+(O23+P23)+0.5*Q23 -> 160.87 | O23: 68.80 | P23: 92.07 | Q23: 0
A24: Notes:
A25: - | B25: Remember, the "Fun" Shoot is held on the 1st and 3rd Tuesday of each month ( 6:30 p.m.) at Range Masters.
A26: - | B26: You can use ANY handgun you want, as long as it can be safely drawn from a strong-side holster.
A27: - | B27: IDPA format and scoring.
A28: PD | B28: = Points Down = .5 seconds x Points Down
A29: XX | B29: Indicates that the Points Down value includes some kind of penalty (Procedural Error, Hits on Non-Threat, Misses on Steel, etc.)
A30: (Rev) | B30: = Revolver
A31: DNF | B31: = Did Not Finish