B1: Range Masters "Fun" Shoot | H1: Results for April 6, 2004
A2: Click on Stage # for view of COF
B3: Name (Note) | C3: Shoot Total | D3: Total Points Down
A4: Place | E4: Stage 1 | F4: String 1 | G4: PD | H4: Stage 2 | I4: String 1 | J4: String 2 | K4: PD | L4: Stage 3 | M4: String 1 | N4: String 2 | O4: PD
A5: 1 | B5: Collins, Ken | C5: =+E5+H5+L5 -> 57.78 | D5: =+G5+K5+O5 -> 13 | E5: =+(F5)+0.5*G5 -> 26.30 | F5: 22.80 | G5: 7 | H5: =+(I5+J5)+0.5*K5 -> 23.01 | I5: 9.39 | J5: 10.62 | K5: 6 | L5: =+(M5+N5)+0.5*O5 -> 8.47 | M5: 4.31 | N5: 4.16 | O5: 0
A6: 2 | B6: Young, Jason | C6: =+E6+H6+L6 -> 58.98 | D6: =+G6+K6+O6 -> 19 | E6: =+(F6)+0.5*G6 -> 27.95 | F6: 24.95 | G6: 6 | H6: =+(I6+J6)+0.5*K6 -> 22.07 | I6: 8.11 | J6: 10.46 | K6: 7 | L6: =+(M6+N6)+0.5*O6 -> 8.96 | M6: 2.77 | N6: 3.19 | O6: 6
A7: 3 | B7: Zaccardi, Pat | C7: =+E7+H7+L7 -> 66.13 | D7: =+G7+K7+O7 -> 17 | E7: =+(F7)+0.5*G7 -> 32.77 | F7: 27.77 | G7: 10 | H7: =+(I7+J7)+0.5*K7 -> 23.44 | I7: 10.16 | J7: 11.78 | K7: 3 | L7: =+(M7+N7)+0.5*O7 -> 9.92 | M7: 4.31 | N7: 3.61 | O7: 4
A8: 4 | B8: Hansen, Jeff | C8: =+E8+H8+L8 -> 74.63 | D8: =+G8+K8+O8 -> 31 | E8: =+(F8)+0.5*G8 -> 31.58 | F8: 26.58 | G8: 10 | H8: =+(I8+J8)+0.5*K8 -> 32.65 | I8: 11.08 | J8: 13.57 | K8: 16 | L8: =+(M8+N8)+0.5*O8 -> 10.40 | M8: 3.69 | N8: 4.21 | O8: 5
A9: 5 | B9: Asbell, Scott | C9: =+E9+H9+L9 -> 74.83 | D9: =+G9+K9+O9 -> 21 | E9: =+(F9)+0.5*G9 -> 33.52 | F9: 30.02 | G9: 7 | H9: =+(I9+J9)+0.5*K9 -> 27.05 | I9: 11.40 | J9: 13.15 | K9: 5 | L9: =+(M9+N9)+0.5*O9 -> 14.26 | M9: 4.79 | N9: 4.97 | O9: 9
A10: 6 | B10: Mousley, Roger (Rev) | C10: =+E10+H10+L10 -> 75.05 | D10: =+G10+K10+O10 -> 1 | E10: =+(F10)+0.5*G10 -> 39.39 | F10: 38.89 | G10: 1 | H10: =+(I10+J10)+0.5*K10 -> 21.33 | I10: 10.81 | J10: 10.52 | K10: 0 | L10: =+(M10+N10)+0.5*O10 -> 14.33 | M10: 6.56 | N10: 7.77 | O10: 0
A11: 7 | B11: Scott, Alan | C11: =+E11+H11+L11 -> 76.78 | D11: =+G11+K11+O11 -> 9 | E11: =+(F11)+0.5*G11 -> 40.93 | F11: 39.43 | G11: 3 | H11: =+(I11+J11)+0.5*K11 -> 25.51 | I11: 10.53 | J11: 11.98 | K11: 6 | L11: =+(M11+N11)+0.5*O11 -> 10.34 | M11: 5.78 | N11: 4.56 | O11: 0
A12: 8 | B12: Stone, Scott | C12: =+E12+H12+L12 -> 76.90 | D12: =+G12+K12+O12 -> 27 | E12: =+(F12)+0.5*G12 -> 36.88 | F12: 31.38 | G12: 11 | H12: =+(I12+J12)+0.5*K12 -> 29.33 | I12: 12.38 | J12: 10.95 | K12: 12 | L12: =+(M12+N12)+0.5*O12 -> 10.69 | M12: 4.89 | N12: 3.80 | O12: 4
A13: 9 | B13: Hatch, Perry | C13: =+E13+H13+L13 -> 82.58 | D13: =+G13+K13+O13 -> 31 | E13: =+(F13)+0.5*G13 -> 31.37 | F13: 30.37 | G13: 2 | H13: =+(I13+J13)+0.5*K13 -> 36.98 | I13: 11.27 | J13: 11.71 | K13: 28 | L13: =+(M13+N13)+0.5*O13 -> 14.23 | M13: 8.47 | N13: 5.26 | O13: 1
A14: 10 | B14: Scott, Michael | C14: =+E14+H14+L14 -> 90.48 | D14: =+G14+K14+O14 -> 18 | E14: =+(F14)+0.5*G14 -> 43.75 | F14: 40.25 | G14: 7 | H14: =+(I14+J14)+0.5*K14 -> 35.00 | I14: 14.14 | J14: 16.36 | K14: 9 | L14: =+(M14+N14)+0.5*O14 -> 11.73 | M14: 5.24 | N14: 5.49 | O14: 2
A15: 11 | B15: Redford, Noel | C15: =+E15+H15+L15 -> 96.04 | D15: =+G15+K15+O15 -> 17 | E15: =+(F15)+0.5*G15 -> 58.82 | F15: 54.82 | G15: 8 | H15: =+(I15+J15)+0.5*K15 -> 27.74 | I15: 13.18 | J15: 11.06 | K15: 7 | L15: =+(M15+N15)+0.5*O15 -> 9.48 | M15: 4.49 | N15: 3.99 | O15: 2
A16: 12 | B16: Goddard, Kendall | C16: =+E16+H16+L16 -> 99.91 | D16: =+G16+K16+O16 -> 23 | E16: =+(F16)+0.5*G16 -> 48.67 | F16: 45.17 | G16: 7 | H16: =+(I16+J16)+0.5*K16 -> 37.65 | I16: 14.34 | J16: 15.81 | K16: 15 | L16: =+(M16+N16)+0.5*O16 -> 13.59 | M16: 6.01 | N16: 7.08 | O16: 1
A17: 13 | B17: Loveless, Doug | C17: =+E17+H17+L17 -> 102.44 | D17: =+G17+K17+O17 -> 45 | E17: =+(F17)+0.5*G17 -> 53.19 | F17: 45.19 | G17: 16 | H17: =+(I17+J17)+0.5*K17 -> 33.79 | I17: 13.28 | J17: 11.51 | K17: 18 | L17: =+(M17+N17)+0.5*O17 -> 15.46 | M17: 4.61 | N17: 5.35 | O17: 11
A18: 14 | B18: Simons, Jordan | C18: =+E18+H18+L18 -> 114.35 | D18: =+G18+K18+O18 -> 45 | E18: =+(F18)+0.5*G18 -> 66.19 | F18: 54.19 | G18: 24 | H18: =+(I18+J18)+0.5*K18 -> 32.10 | I18: 12.46 | J18: 12.64 | K18: 14 | L18: =+(M18+N18)+0.5*O18 -> 16.06 | M18: 7.84 | N18: 4.72 | O18: 7
A19: 15 | B19: Walker, Ron | C19: =+E19+H19+L19 -> 115.80 | D19: =+G19+K19+O19 -> 33 | E19: =+(F19)+0.5*G19 -> 65.06 | F19: 56.56 | G19: 17 | H19: =+(I19+J19)+0.5*K19 -> 35.28 | I19: 15.63 | J19: 14.15 | K19: 11 | L19: =+(M19+N19)+0.5*O19 -> 15.46 | M19: 7.89 | N19: 5.07 | O19: 5
A20: 16 | B20: Goddard, Cole | C20: =+E20+H20+L20 -> 119.16 | D20: =+G20+K20+O20 -> 11 | E20: =+(F20)+0.5*G20 -> 71.35 | F20: 68.35 | G20: 6 | H20: =+(I20+J20)+0.5*K20 -> 28.62 | I20: 12.24 | J20: 14.88 | K20: 3 | L20: =+(M20+N20)+0.5*O20 -> 19.19 | M20: 5.68 | N20: 12.51 | O20: 2
A21: 17 | B21: Baker, David | C21: =+E21+H21+L21 -> 119.89 | D21: =+G21+K21+O21 -> 50 | E21: =+(F21)+0.5*G21 -> 48.06 | F21: 37.56 | G21: 21 | H21: =+(I21+J21)+0.5*K21 -> 52.29 | I21: 20.81 | J21: 27.98 | K21: 7 | L21: =+(M21+N21)+0.5*O21 -> 19.54 | M21: 4.71 | N21: 3.83 | O21: 22
A22: 18 | B22: Simons, Brad | C22: =+E22+H22+L22 -> 132.84 | D22: =+G22+K22+O22 -> 70 | E22: =+(F22)+0.5*G22 -> 73.19 | F22: 55.69 | G22: 35 | H22: =+(I22+J22)+0.5*K22 -> 44.80 | I22: 13.87 | J22: 16.93 | K22: 28 | L22: =+(M22+N22)+0.5*O22 -> 14.85 | M22: 6.06 | N22: 5.29 | O22: 7
A23: 19 | B23: Brown, Michael | C23: =+E23+H23+L23 -> 134.76 | D23: =+G23+K23+O23 -> 49 | E23: =+(F23)+0.5*G23 -> 76.62 | F23: 65.62 | G23: 22 | H23: =+(I23+J23)+0.5*K23 -> 43.28 | I23: 14.35 | J23: 17.93 | K23: 22 | L23: =+(M23+N23)+0.5*O23 -> 14.86 | M23: 6.37 | N23: 5.99 | O23: 5
A24: 20 | B24: Mecham, Lynn (Rev) | C24: =+E24+H24+L24 -> 154.16 | D24: =+G24+K24+O24 -> 16 | E24: =+(F24)+0.5*G24 -> 87.67 | F24: 79.67 | G24: 16 | H24: =+(I24+J24)+0.5*K24 -> 36.53 | I24: 20.63 | J24: 15.90 | K24: 0 | L24: =+(M24+N24)+0.5*O24 -> 29.96 | M24: 17.08 | N24: 12.88 | O24: 0
A25: 21 | B25: Griffin, Roger | C25: =+E25+H25+L25 -> 167.48 | D25: =+G25+K25+O25 -> 24 | E25: =+(F25)+0.5*G25 -> 65.17 | F25: 56.17 | G25: 18 | H25: =+(I25+J25)+0.5*K25 -> 56.27 | I25: 28.27 | J25: 26.00 | K25: 4 | L25: =+(M25+N25)+0.5*O25 -> 46.04 | M25: 26.60 | N25: 18.44 | O25: 2
A26: 22 | B26: Hansen, Lacee (.22) | C26: =+E26+H26+L26 -> 198.95 | D26: =+G26+K26+O26 -> 40 | E26: =+(F26)+0.5*G26 -> 78.27 | F26: 69.27 | G26: 18 | H26: =+(I26+J26)+0.5*K26 -> 85.02 | I26: 35.53 | J26: 43.99 | K26: 11 | L26: =+(M26+N26)+0.5*O26 -> 35.66 | M26: 15.08 | N26: 15.08 | O26: 11
A27: Notes:
A28: - | B28: Remember, the "Fun" Shoot is held on the 1st and 3rd Tuesday of each month ( 6:30 p.m.) at Range Masters.
A29: - | B29: You can use ANY handgun you want, as long as it can be safely drawn from a strong-side holster.
A30: - | B30: IDPA format and scoring.
A31: PD | B31: = Points Down = .5 seconds x Points Down
A32: XX | B32: Indicates that the Points Down value includes some kind of penalty (Procedural Error, Hits on Non-Threat, Misses on Steel, etc.)
A33: (Rev) | B33: = Revolver
A34: DNF | B34: = Did Not Finish