B0: Range Masters "Fun" Shoot | G0: Results for March 2, 2004
B1: Click on the Stage # for a view of the COF.
B2: Name (Note) | C2: Shoot Total | D2: Total Points Down
A3: Place | E3: Stage 1 | F3: String 1 | G3: PD | H3: Stage 2 | I3: String 1 | J3: String 2 | K3: PD | L3: Stage 3 | M3: String 1 | N3: PD
A4: 1 | B4: Collins, Ken | C4: =+E4+H4+L4 -> 53.55 | D4: =+G4+K4+N4 -> 8 | E4: =+(F4)+0.5*G4 -> 15.27 | F4: 14.27 | G4: 2 | H4: =+(I4+J4)+0.5*K4 -> 28.40 | I4: 12.10 | J4: 14.80 | K4: 3 | L4: =+(M4)+0.5*N4 -> 9.88 | M4: 8.38 | N4: 3
A5: 2 | B5: Zaccardi, Pat | C5: =+E5+H5+L5 -> 62.03 | D5: =+G5+K5+N5 -> 28 | E5: =+(F5)+0.5*G5 -> 18.27 | F5: 11.77 | G5: 13 | H5: =+(I5+J5)+0.5*K5 -> 34.10 | I5: 11.16 | J5: 15.94 | K5: 14 | L5: =+(M5)+0.5*N5 -> 9.66 | M5: 9.16 | N5: 1
A6: 3 | B6: Young, Jason | C6: =+E6+H6+L6 -> 62.83 | D6: =+G6+K6+N6 -> 24 | E6: =+(F6)+0.5*G6 -> 16.39 | F6: 13.39 | G6: 6 | H6: =+(I6+J6)+0.5*K6 -> 27.13 | I6: 9.83 | J6: 14.80 | K6: 5 | L6: =+(M6)+0.5*N6 -> 19.31 | M6: 12.81 | N6: 13
A7: 4 | B7: Zaccardi, Juke | C7: =+E7+H7+L7 -> 70.37 | D7: =+G7+K7+N7 -> 27 | E7: =+(F7)+0.5*G7 -> 20.63 | F7: 18.13 | G7: 5 | H7: =+(I7+J7)+0.5*K7 -> 28.35 | I7: 10.34 | J7: 15.01 | K7: 6 | L7: =+(M7)+0.5*N7 -> 21.39 | M7: 13.39 | N7: 16
A8: 5 | B8: Redford, Kent | C8: =+E8+H8+L8 -> 70.51 | D8: =+G8+K8+N8 -> 14 | E8: =+(F8)+0.5*G8 -> 20.27 | F8: 18.27 | G8: 4 | H8: =+(I8+J8)+0.5*K8 -> 36.14 | I8: 14.95 | J8: 17.69 | K8: 7 | L8: =+(M8)+0.5*N8 -> 14.10 | M8: 12.60 | N8: 3
A9: 6 | B9: Myers, Chris | C9: =+E9+H9+L9 -> 71.69 | D9: =+G9+K9+N9 -> 7 | E9: =+(F9)+0.5*G9 -> 24.28 | F9: 21.28 | G9: 6 | H9: =+(I9+J9)+0.5*K9 -> 35.22 | I9: 16.96 | J9: 17.76 | K9: 1 | L9: =+(M9)+0.5*N9 -> 12.19 | M9: 12.19 | N9: 0
A10: 7 | B10: Adams, Kyle (Rev) | C10: =+E10+H10+L10 -> 76.63 | D10: =+G10+K10+N10 -> 2 | E10: =+(F10)+0.5*G10 -> 23.28 | F10: 22.78 | G10: 1 | H10: =+(I10+J10)+0.5*K10 -> 39.50 | I10: 18.41 | J10: 20.59 | K10: 1 | L10: =+(M10)+0.5*N10 -> 13.85 | M10: 13.85 | N10: 0
A11: 8 | B11: Mousley, Roger (Rev) | C11: =+E11+H11+L11 -> 76.67 | D11: =+G11+K11+N11 -> 17 | E11: =+(F11)+0.5*G11 -> 24.24 | F11: 21.74 | G11: 5 | H11: =+(I11+J11)+0.5*K11 -> 39.03 | I11: 14.41 | J11: 18.62 | K11: 12 | L11: =+(M11)+0.5*N11 -> 13.40 | M11: 13.40 | N11: 0
A12: 9 | B12: Huff, Blake (Rev) | C12: =+E12+H12+L12 -> 79.00 | D12: =+G12+K12+N12 -> 16 | E12: =+(F12)+0.5*G12 -> 18.66 | F12: 18.16 | G12: 1 | H12: =+(I12+J12)+0.5*K12 -> 40.83 | I12: 17.15 | J12: 20.68 | K12: 6 | L12: =+(M12)+0.5*N12 -> 19.51 | M12: 15.01 | N12: 9
A13: 10 | B13: Redford, "Red" | C13: =+E13+H13+L13 -> 86.97 | D13: =+G13+K13+N13 -> 19 | E13: =+(F13)+0.5*G13 -> 25.72 | F13: 25.22 | G13: 1 | H13: =+(I13+J13)+0.5*K13 -> 42.97 | I13: 15.92 | J13: 24.55 | K13: 5 | L13: =+(M13)+0.5*N13 -> 18.28 | M13: 11.78 | N13: 13
A14: 11 | B14: Rodriquez, Mike | C14: =+E14+H14+L14 -> 87.58 | D14: =+G14+K14+N14 -> 47 | E14: =+(F14)+0.5*G14 -> 23.65 | F14: 20.15 | G14: 7 | H14: =+(I14+J14)+0.5*K14 -> 37.63 | I14: 15.76 | J14: 16.87 | K14: 10 | L14: =+(M14)+0.5*N14 -> 26.30 | M14: 11.30 | N14: 30
A15: 12 | B15: Billings, Scott | C15: =+E15+H15+L15 -> 90.52 | D15: =+G15+K15+N15 -> 38 | E15: =+(F15)+0.5*G15 -> 21.72 | F15: 17.22 | G15: 9 | H15: =+(I15+J15)+0.5*K15 -> 45.34 | I15: 15.07 | J15: 22.27 | K15: 16 | L15: =+(M15)+0.5*N15 -> 23.46 | M15: 16.96 | N15: 13
A16: 13 | B16: Armstrong, Jeremiah | C16: =+E16+H16+L16 -> 90.75 | D16: =+G16+K16+N16 -> 8 | E16: =+(F16)+0.5*G16 -> 31.83 | F16: 31.33 | G16: 1 | H16: =+(I16+J16)+0.5*K16 -> 40.44 | I16: 17.01 | J16: 20.43 | K16: 6 | L16: =+(M16)+0.5*N16 -> 18.48 | M16: 17.98 | N16: 1
A17: 14 | B17: Redford, "Red" (Rev) | C17: =+E17+H17+L17 -> 90.87 | D17: =+G17+K17+N17 -> 5 | E17: =+(F17)+0.5*G17 -> 33.61 | F17: 33.11 | G17: 1 | H17: =+(I17+J17)+0.5*K17 -> 34.02 | I17: 16.15 | J17: 17.37 | K17: 1 | L17: =+(M17)+0.5*N17 -> 23.24 | M17: 21.74 | N17: 3
A18: 15 | B18: Hansen, Jeff | C18: =+E18+H18+L18 -> 92.56 | D18: =+G18+K18+N18 -> 31 | E18: =+(F18)+0.5*G18 -> 25.49 | F18: 21.49 | G18: 8 | H18: =+(I18+J18)+0.5*K18 -> 42.17 | I18: 14.50 | J18: 18.67 | K18: 18 | L18: =+(M18)+0.5*N18 -> 24.90 | M18: 22.40 | N18: 5
A19: 16 | B19: Goddard, Kendall | C19: =+E19+H19+L19 -> 93.07 | D19: =+G19+K19+N19 -> 4 | E19: =+(F19)+0.5*G19 -> 35.56 | F19: 34.06 | G19: 3 | H19: =+(I19+J19)+0.5*K19 -> 37.67 | I19: 17.02 | J19: 20.15 | K19: 1 | L19: =+(M19)+0.5*N19 -> 19.84 | M19: 19.84 | N19: 0
A20: 17 | B20: Stone, Scott | C20: =+E20+H20+L20 -> 93.19 | D20: =+G20+K20+N20 -> 30 | E20: =+(F20)+0.5*G20 -> 26.04 | F20: 24.54 | G20: 3 | H20: =+(I20+J20)+0.5*K20 -> 43.74 | I20: 19.39 | J20: 19.35 | K20: 10 | L20: =+(M20)+0.5*N20 -> 23.41 | M20: 14.91 | N20: 17
A21: 18 | B21: Redford, Steve | C21: =+E21+H21+L21 -> 96.40 | D21: =+G21+K21+N21 -> 14 | E21: =+(F21)+0.5*G21 -> 29.01 | F21: 26.01 | G21: 6 | H21: =+(I21+J21)+0.5*K21 -> 48.66 | I21: 24.89 | J21: 23.27 | K21: 1 | L21: =+(M21)+0.5*N21 -> 18.73 | M21: 15.23 | N21: 7
A22: 19 | B22: Christensen, Jesse | C22: =+E22+H22+L22 -> 101.79 | D22: =+G22+K22+N22 -> 57 | E22: =+(F22)+0.5*G22 -> 25.42 | F22: 20.92 | G22: 9 | H22: =+(I22+J22)+0.5*K22 -> 48.45 | I22: 19.60 | J22: 18.35 | K22: 21 | L22: =+(M22)+0.5*N22 -> 27.92 | M22: 14.42 | N22: 27
A23: 20 | B23: Walker, Ron | C23: =+E23+H23+L23 -> 107.41 | D23: =+G23+K23+N23 -> 19 | E23: =+(F23)+0.5*G23 -> 34.77 | F23: 31.27 | G23: 7 | H23: =+(I23+J23)+0.5*K23 -> 55.58 | I23: 25.21 | J23: 26.37 | K23: 8 | L23: =+(M23)+0.5*N23 -> 17.06 | M23: 15.06 | N23: 4
A24: 21 | B24: Loveless, Doug | C24: =+E24+H24+L24 -> 108.73 | D24: =+G24+K24+N24 -> 49 | E24: =+(F24)+0.5*G24 -> 34.48 | F24: 27.98 | G24: 13 | H24: =+(I24+J24)+0.5*K24 -> 54.13 | I24: 15.36 | J24: 24.77 | K24: 28 | L24: =+(M24)+0.5*N24 -> 20.12 | M24: 16.12 | N24: 8
A25: 22 | B25: Howard, Jay | C25: =+E25+H25+L25 -> 118.11 | D25: =+G25+K25+N25 -> 9 | E25: =+(F25)+0.5*G25 -> 31.96 | F25: 29.46 | G25: 5 | H25: =+(I25+J25)+0.5*K25 -> 57.87 | I25: 28.49 | J25: 28.88 | K25: 1 | L25: =+(M25)+0.5*N25 -> 28.28 | M25: 26.78 | N25: 3
A26: 23 | B26: Myers, Steven | C26: =+E26+H26+L26 -> 129.81 | D26: =+G26+K26+N26 -> 61 | E26: =+(F26)+0.5*G26 -> 38.84 | F26: 34.34 | G26: 9 | H26: =+(I26+J26)+0.5*K26 -> 54.68 | I26: 23.14 | J26: 23.04 | K26: 17 | L26: =+(M26)+0.5*N26 -> 36.29 | M26: 18.79 | N26: 35
A27: 24 | B27: Brown, Michael | C27: =+E27+H27+L27 -> 131.24 | D27: =+G27+K27+N27 -> 74 | E27: =+(F27)+0.5*G27 -> 32.45 | F27: 21.95 | G27: 21 | H27: =+(I27+J27)+0.5*K27 -> 71.27 | I27: 19.66 | J27: 31.11 | K27: 41 | L27: =+(M27)+0.5*N27 -> 27.52 | M27: 21.52 | N27: 12
A28: 25 | B28: Goddard, Cole | C28: =+E28+H28+L28 -> 140.90 | D28: =+G28+K28+N28 -> 117 | E28: =+(F28)+0.5*G28 -> 31.41 | F28: 25.41 | G28: 12 | H28: =+(I28+J28)+0.5*K28 -> 44.58 | I28: 19.24 | J28: 19.84 | K28: 11 | L28: =+(M28)+0.5*N28 -> 64.91 | M28: 17.91 | N28: 94
A29: 26 | B29: Cloutier, Tyler | C29: =+E29+H29+L29 -> 142.12 | D29: =+G29+K29+N29 -> 94 | E29: =+(F29)+0.5*G29 -> 40.42 | F29: 29.42 | G29: 22 | H29: =+(I29+J29)+0.5*K29 -> 71.41 | I29: 22.22 | J29: 22.69 | K29: =5+10+6+6+10+16 -> 53 | L29: =+(M29)+0.5*N29 -> 30.29 | M29: 20.79 | N29: 19
A30: 27 | B30: Hansen, Lacee (.22) | C30: =+E30+H30+L30 -> 335.65 | D30: =+G30+K30+N30 -> 47 | E30: =+(F30)+0.5*G30 -> 104.76 | F30: 99.26 | G30: 11 | H30: =+(I30+J30)+0.5*K30 -> 167.40 | I30: 70.07 | J30: 86.33 | K30: 22 | L30: =+(M30)+0.5*N30 -> 63.49 | M30: 56.49 | N30: 14
A31: 28 | B31: Bernal, Dave | C31: DNF | D31: DNF | E31: =+(F31)+0.5*G31 -> 44.09 | F31: 34.09 | G31: 20 | H31: DNF | I31: DNF | J31: DNF | L31: =+(M31)+0.5*N31 -> 24.20 | M31: 12.70 | N31: 23
A32: Notes:
A33: - | B33: Remember, the "Fun" Shoot is held on the 1st and 3rd Tuesday of each month ( 6:30 p.m.) at Range Masters.
A34: - | B34: You can use ANY handgun you want, as long as it can be safely drawn from a strong-side holster.
A35: - | B35: IDPA format and scoring.
A36: PD | B36: = Points Down = .5 seconds x Points Down
A37: XX | B37: Indicates that the Points Down value includes some kind of penalty (Procedural Error, Hits on Non-Threat, Misses on Steel, etc.)
A38: (Rev) | B38: = Revolver
A39: DNF | B39: = Did Not Finish