B1: Range Masters "Fun" Shoot | H1: Results for June 1, 2004
A2: Click on Stage # for view of COF
B3: Name (Note) | C3: Shoot Total | D3: Total Points Down
A4: Place | E4: Stage 1 | F4: String 1 | G4: PD | H4: Stage 2 | I4: String 1 | J4: PD | K4: Stage 3 | L4: String 1 | M4: String 2 | N4: PD
A5: 1 | B5: Collins, Ken | C5: =+E5+H5+K5 -> 41.45 | D5: =+G5+J5+N5 -> 8 | E5: =+(F5)+0.5*G5 -> 18.51 | F5: 17.51 | G5: 2 | H5: =+(I5)+0.5*J5 -> 11.98 | I5: 11.98 | J5: 0 | K5: =+(L5+M5)+0.5*N5 -> 10.96 | L5: 1.45 | M5: 6.51 | N5: 6
A6: 2 | B6: Zaccardi, Pat | C6: =+E6+H6+K6 -> 48.32 | D6: =+G6+J6+N6 -> 16 | E6: =+(F6)+0.5*G6 -> 25.86 | F6: 22.36 | G6: 7 | H6: =+(I6)+0.5*J6 -> 10.42 | I6: 9.42 | J6: 2 | K6: =+(L6+M6)+0.5*N6 -> 12.04 | L6: 1.55 | M6: 6.99 | N6: 7
A7: 3 | B7: Mousley, Roger (Rev) | C7: =+E7+H7+K7 -> 48.65 | D7: =+G7+J7+N7 -> 5 | E7: =+(F7)+0.5*G7 -> 25.10 | F7: 23.60 | G7: 3 | H7: =+(I7)+0.5*J7 -> 15.01 | I7: 15.01 | J7: 0 | K7: =+(L7+M7)+0.5*N7 -> 8.54 | L7: 1.42 | M7: 6.12 | N7: 2
A8: 4 | B8: Young, Jason | C8: =+E8+H8+K8 -> 52.56 | D8: =+G8+J8+N8 -> 39 | E8: =+(F8)+0.5*G8 -> 28.28 | F8: 16.78 | G8: 23 | H8: =+(I8)+0.5*J8 -> 13.25 | I8: 6.75 | J8: 13 | K8: =+(L8+M8)+0.5*N8 -> 11.03 | L8: 1.23 | M8: 8.30 | N8: 3
A9: 5 | B9: Stilwell, Mike | C9: =+E9+H9+K9 -> 52.88 | D9: =+G9+J9+N9 -> 28 | E9: =+(F9)+0.5*G9 -> 26.72 | F9: 21.22 | G9: 11 | H9: =+(I9)+0.5*J9 -> 14.00 | I9: 9.00 | J9: 10 | K9: =+(L9+M9)+0.5*N9 -> 12.16 | L9: 1.57 | M9: 7.09 | N9: 7
A10: 6 | B10: Outzen, Craig | C10: =+E10+H10+K10 -> 53.03 | D10: =+G10+J10+N10 -> 21 | E10: =+(F10)+0.5*G10 -> 32.02 | F10: 23.52 | G10: 17 | H10: =+(I10)+0.5*J10 -> 11.46 | I10: 9.46 | J10: 4 | K10: =+(L10+M10)+0.5*N10 -> 9.55 | L10: 1.37 | M10: 8.18 | N10: 0
A11: 7 | B11: Taylor, Joshua | C11: =+E11+H11+K11 -> 54.21 | D11: =+G11+J11+N11 -> 12 | E11: =+(F11)+0.5*G11 -> 26.90 | F11: 21.40 | G11: 11 | H11: =+(I11)+0.5*J11 -> 16.11 | I11: 16.11 | J11: 0 | K11: =+(L11+M11)+0.5*N11 -> 11.20 | L11: 1.45 | M11: 9.25 | N11: 1
A12: 8 | B12: Redford, "Red" | C12: =+E12+H12+K12 -> 55.62 | D12: =+G12+J12+N12 -> 20 | E12: =+(F12)+0.5*G12 -> 29.73 | F12: 25.73 | G12: 8 | H12: =+(I12)+0.5*J12 -> 15.45 | I12: 11.45 | J12: 8 | K12: =+(L12+M12)+0.5*N12 -> 10.44 | L12: 1.26 | M12: 7.18 | N12: 4
A13: 9 | B13: Scott, Alan | C13: =+E13+H13+K13 -> 56.82 | D13: =+G13+J13+N13 -> 9 | E13: =+(F13)+0.5*G13 -> 32.94 | F13: 29.44 | G13: 7 | H13: =+(I13)+0.5*J13 -> 14.48 | I13: 13.48 | J13: 2 | K13: =+(L13+M13)+0.5*N13 -> 9.40 | L13: 1.43 | M13: 7.97 | N13: 0
A14: 10 | B14: Adams, Kyle (Rev) | C14: =+E14+H14+K14 -> 65.91 | D14: =+G14+J14+N14 -> 25 | E14: =+(F14)+0.5*G14 -> 33.73 | F14: 27.73 | G14: 12 | H14: =+(I14)+0.5*J14 -> 21.26 | I14: 15.26 | J14: 12 | K14: =+(L14+M14)+0.5*N14 -> 10.92 | L14: 1.41 | M14: 9.01 | N14: 1
A15: 11 | B15: Redford, Noel | C15: =+E15+H15+K15 -> 70.03 | D15: =+G15+J15+N15 -> 24 | E15: =+(F15)+0.5*G15 -> 40.70 | F15: 30.70 | G15: 20 | H15: =+(I15)+0.5*J15 -> 17.32 | I15: 16.32 | J15: 2 | K15: =+(L15+M15)+0.5*N15 -> 12.01 | L15: 1.58 | M15: 9.43 | N15: 2
A16: 12 | B16: Hood, Neil | C16: =+E16+H16+K16 -> 71.13 | D16: =+G16+J16+N16 -> 15 | E16: =+(F16)+0.5*G16 -> 36.66 | F16: 29.66 | G16: 14 | H16: =+(I16)+0.5*J16 -> 21.67 | I16: 21.17 | J16: 1 | K16: =+(L16+M16)+0.5*N16 -> 12.80 | L16: 1.86 | M16: 10.94 | N16: 0
A17: 13 | B17: Stone, Scott | C17: =+E17+H17+K17 -> 74.17 | D17: =+G17+J17+N17 -> 43 | E17: =+(F17)+0.5*G17 -> 41.88 | F17: 31.88 | G17: 20 | H17: =+(I17)+0.5*J17 -> 14.48 | I17: 9.98 | J17: 9 | K17: =+(L17+M17)+0.5*N17 -> 17.81 | L17: 2.19 | M17: 8.62 | N17: 14
A18: 14 | B18: Scott, Michael | C18: =+E18+H18+K18 -> 75.42 | D18: =+G18+J18+N18 -> 25 | E18: =+(F18)+0.5*G18 -> 42.41 | F18: 34.41 | G18: 16 | H18: =+(I18)+0.5*J18 -> 18.23 | I18: 16.23 | J18: 4 | K18: =+(L18+M18)+0.5*N18 -> 14.78 | L18: 1.41 | M18: 10.87 | N18: 5
A19: 15 | B19: Goddard, Logan | C19: =+E19+H19+K19 -> 76.10 | D19: =+G19+J19+N19 -> 36 | E19: =+(F19)+0.5*G19 -> 33.56 | F19: 25.06 | G19: 17 | H19: =+(I19)+0.5*J19 -> 32.74 | I19: 24.24 | J19: 17 | K19: =+(L19+M19)+0.5*N19 -> 9.80 | L19: 1.72 | M19: 7.08 | N19: 2
A20: 16 | B20: Mousley, Eric (Rev) | C20: =+E20+H20+K20 -> 86.20 | D20: =+G20+J20+N20 -> 50 | E20: =+(F20)+0.5*G20 -> 41.86 | F20: 27.86 | G20: 28 | H20: =+(I20)+0.5*J20 -> 27.19 | I20: 18.69 | J20: 17 | K20: =+(L20+M20)+0.5*N20 -> 17.15 | L20: 1.83 | M20: 12.82 | N20: 5
A21: 17 | B21: Simons, Jordan | C21: =+E21+H21+K21 -> 86.47 | D21: =+G21+J21+N21 -> 44 | E21: =+(F21)+0.5*G21 -> 39.36 | F21: 29.36 | G21: 20 | H21: =+(I21)+0.5*J21 -> 30.74 | I21: 23.24 | J21: 15 | K21: =+(L21+M21)+0.5*N21 -> 16.37 | L21: 1.92 | M21: 9.95 | N21: 9
A22: 18 | B22: Young, Ren | C22: =+E22+H22+K22 -> 93.04 | D22: =+G22+J22+N22 -> 37 | E22: =+(F22)+0.5*G22 -> 42.06 | F22: 31.06 | G22: 22 | H22: =+(I22)+0.5*J22 -> 38.57 | I22: 31.57 | J22: 14 | K22: =+(L22+M22)+0.5*N22 -> 12.41 | L22: 1.75 | M22: 10.16 | N22: 1
A23: 19 | B23: Ottesen, Sterling | C23: =+E23+H23+K23 -> 95.89 | D23: =+G23+J23+N23 -> 25 | E23: =+(F23)+0.5*G23 -> 50.30 | F23: 45.80 | G23: 9 | H23: =+(I23)+0.5*J23 -> 28.02 | I23: 22.02 | J23: 12 | K23: =+(L23+M23)+0.5*N23 -> 17.57 | L23: 1.30 | M23: 14.27 | N23: 4
A24: 20 | B24: Ewin, Don | C24: =+E24+H24+K24 -> 96.80 | D24: =+G24+J24+N24 -> 26 | E24: =+(F24)+0.5*G24 -> 47.60 | F24: 41.60 | G24: 12 | H24: =+(I24)+0.5*J24 -> 32.03 | I24: 26.53 | J24: 11 | K24: =+(L24+M24)+0.5*N24 -> 17.17 | L24: 1.60 | M24: 14.07 | N24: 3
A25: 21 | B25: Young, Matt | C25: =+E25+H25+K25 -> 104.71 | D25: =+G25+J25+N25 -> 59 | E25: =+(F25)+0.5*G25 -> 56.68 | F25: 38.68 | G25: 36 | H25: =+(I25)+0.5*J25 -> 28.23 | I25: 20.73 | J25: 15 | K25: =+(L25+M25)+0.5*N25 -> 19.80 | L25: 1.78 | M25: 14.02 | N25: 8
A26: 22 | B26: Brown, Mike | C26: =+E26+H26+K26 -> 109.12 | D26: =+G26+J26+N26 -> 21 | E26: =+(F26)+0.5*G26 -> 61.89 | F26: 52.39 | G26: 19 | H26: =+(I26)+0.5*J26 -> 27.10 | I26: 26.60 | J26: 1 | K26: =+(L26+M26)+0.5*N26 -> 20.13 | L26: 1.89 | M26: 17.74 | N26: 1
A27: 23 | B27: Shermon, John | C27: =+E27+H27+K27 -> 109.64 | D27: =+G27+J27+N27 -> 60 | E27: =+(F27)+0.5*G27 -> 59.60 | F27: 43.60 | G27: 32 | H27: =+(I27)+0.5*J27 -> 31.67 | I27: 20.67 | J27: 22 | K27: =+(L27+M27)+0.5*N27 -> 18.37 | L27: 1.73 | M27: 13.64 | N27: 6
A28: 24 | B28: Hill, Randy | C28: =+E28+H28+K28 -> 109.66 | D28: =+G28+J28+N28 -> 63 | E28: =+(F28)+0.5*G28 -> 53.85 | F28: 38.85 | G28: 30 | H28: =+(I28)+0.5*J28 -> 32.57 | I28: 21.07 | J28: 23 | K28: =+(L28+M28)+0.5*N28 -> 23.24 | L28: 4.50 | M28: 13.74 | N28: 10
A29: 25 | B29: Simons, Brad | C29: =+E29+H29+K29 -> 110.76 | D29: =+G29+J29+N29 -> 50 | E29: =+(F29)+0.5*G29 -> 61.51 | F29: 47.01 | G29: 29 | H29: =+(I29)+0.5*J29 -> 31.84 | I29: 24.84 | J29: 14 | K29: =+(L29+M29)+0.5*N29 -> 17.41 | L29: 1.61 | M29: 12.30 | N29: 7
A30: 26 | B30: Jaynes, Ryan (.22) | C30: =+E30+H30+K30 -> 114.70 | D30: =+G30+J30+N30 -> 15 | E30: =+(F30)+0.5*G30 -> 55.32 | F30: 50.82 | G30: 9 | H30: =+(I30)+0.5*J30 -> 40.92 | I30: 40.92 | J30: 0 | K30: =+(L30+M30)+0.5*N30 -> 18.46 | L30: 2.49 | M30: 12.97 | N30: 6
A31: 27 | B31: Goddard, Cole | C31: =+E31+H31+K31 -> 119.66 | D31: =+G31+J31+N31 -> 69 | E31: =+(F31)+0.5*G31 -> 78.53 | F31: 53.53 | G31: 50 | H31: =+(I31)+0.5*J31 -> 26.81 | I31: 20.31 | J31: 13 | K31: =+(L31+M31)+0.5*N31 -> 14.32 | L31: 1.42 | M31: 9.90 | N31: 6
A32: 28 | B32: Phillips, RDan | C32: =+E32+H32+K32 -> 132.86 | D32: =+G32+J32+N32 -> 31 | E32: =+(F32)+0.5*G32 -> 80.51 | F32: 66.51 | G32: 28 | H32: =+(I32)+0.5*J32 -> 34.15 | I32: 33.65 | J32: 1 | K32: =+(L32+M32)+0.5*N32 -> 18.20 | L32: 2.09 | M32: 15.11 | N32: 2
A33: 29 | B33: Hood, Thomas | C33: =+E33+H33+K33 -> 139.95 | D33: =+G33+J33+N33 -> 26 | E33: =+(F33)+0.5*G33 -> 71.00 | F33: 58.00 | G33: 26 | H33: =+(I33)+0.5*J33 -> 52.60 | I33: 52.60 | J33: 0 | K33: =+(L33+M33)+0.5*N33 -> 16.35 | L33: 2.53 | M33: 13.82 | N33: 0
A34: 30 | B34: Raigne, Abe (.22) | C34: =+E34+H34+K34 -> 168.89 | D34: =+G34+J34+N34 -> 19 | E34: =+(F34)+0.5*G34 -> 113.13 | F34: 108.13 | G34: 10 | H34: =+(I34)+0.5*J34 -> 27.92 | I34: 23.92 | J34: 8 | K34: =+(L34+M34)+0.5*N34 -> 27.84 | L34: 3.85 | M34: 23.49 | N34: 1
A35: 31 | B35: Phillips, Rdan (Rev) | C35: =+E35+H35+K35 -> 181.92 | D35: =+G35+J35+N35 -> 96 | E35: =+(F35)+0.5*G35 -> 102.47 | F35: 75.47 | G35: 54 | H35: =+(I35)+0.5*J35 -> 57.69 | I35: 40.19 | J35: 35 | K35: =+(L35+M35)+0.5*N35 -> 21.76 | L35: 2.00 | M35: 16.26 | N35: 7
A36: Notes:
A37: - | B37: Remember, the "Fun" Shoot is held on the 1st and 3rd Tuesday of each month ( 6:30 p.m.) at Range Masters.
A38: - | B38: You can use ANY handgun you want, as long as it can be safely drawn from a strong-side holster.
A39: - | B39: IDPA format and scoring.
A40: PD | B40: = Points Down = .5 seconds x Points Down
A41: XX | B41: Indicates that the Points Down value includes some kind of penalty (Procedural Error, Hits on Non-Threat, Misses on Steel, etc.)
A42: (Rev) | B42: = Revolver
A43: DNF | B43: = Did Not Finish