B1: Range Masters "Fun" Shoot | H1: Results for September 7, 2004
A2: Click on Stage # for view of COF
B3: Name (Note) | C3: Shoot Total | D3: Total Points Down
A4: Place | E4: Stage 1 | F4: String 1 | G4: PD | H4: Stage 2 | I4: String 1 | J4: PD | K4: Stage 3 | L4: String 1 | M4: PD
A5: 1 | B5: Collins, Ken | C5: =+E5+H5+K5 -> 59.26 | D5: =+G5+J5+M5 -> 12 | E5: =+(F5)+0.5*G5 -> 28.14 | F5: 26.14 | G5: 4 | H5: =+(I5)+0.5*J5 -> 12.56 | I5: 10.06 | J5: 5 | K5: =+(L5)+0.5*M5 -> 18.56 | L5: 17.06 | M5: 3
A6: 2 | B6: Zaccardi, Pat | C6: =+E6+H6+K6 -> 59.74 | D6: =+G6+J6+M6 -> 15 | E6: =+(F6)+0.5*G6 -> 19.92 | F6: 18.92 | G6: 2 | H6: =+(I6)+0.5*J6 -> 17.25 | I6: 11.75 | J6: 11 | K6: =+(L6)+0.5*M6 -> 22.57 | L6: 21.57 | M6: 2
A7: 3 | B7: Young, Ren | C7: =+E7+H7+K7 -> 71.70 | D7: =+G7+J7+M7 -> 12 | E7: =+(F7)+0.5*G7 -> 36.02 | F7: 35.02 | G7: 2 | H7: =+(I7)+0.5*J7 -> 17.40 | I7: 13.40 | J7: 8 | K7: =+(L7)+0.5*M7 -> 18.28 | L7: 17.28 | M7: 2
A8: 4 | B8: Dockstader, Jeff | C8: =+E8+H8+K8 -> 71.74 | D8: =+G8+J8+M8 -> 24 | E8: =+(F8)+0.5*G8 -> 40.42 | F8: 36.42 | G8: 8 | H8: =+(I8)+0.5*J8 -> 16.53 | I8: 11.53 | J8: 10 | K8: =+(L8)+0.5*M8 -> 14.79 | L8: 11.79 | M8: 6
A9: 5 | B9: Taylor, Joshua | C9: =+E9+H9+K9 -> 76.75 | D9: =+G9+J9+M9 -> 10 | E9: =+(F9)+0.5*G9 -> 30.77 | F9: 30.77 | G9: 0 | H9: =+(I9)+0.5*J9 -> 17.99 | I9: 17.99 | J9: 0 | K9: =+(L9)+0.5*M9 -> 27.99 | L9: 22.99 | M9: 10
A10: 6 | B10: Stone, Scott | C10: =+E10+H10+K10 -> 76.89 | D10: =+G10+J10+M10 -> 22 | E10: =+(F10)+0.5*G10 -> 38.32 | F10: 33.32 | G10: 10 | H10: =+(I10)+0.5*J10 -> 19.17 | I10: 13.67 | J10: =2+1+1+2+1+1+1+2 -> 11 | K10: =+(L10)+0.5*M10 -> 19.40 | L10: 18.90 | M10: 1
A11: 7 | B11: Scott, Alan | C11: =+E11+H11+K11 -> 77.39 | D11: =+G11+J11+M11 -> 18 | E11: =+(F11)+0.5*G11 -> 31.95 | F11: 29.95 | G11: 4 | H11: =+(I11)+0.5*J11 -> 24.59 | I11: 21.59 | J11: 6 | K11: =+(L11)+0.5*M11 -> 20.85 | L11: 16.85 | M11: 8
A12: 8 | B12: Zaccardi, Juke | C12: =+E12+H12+K12 -> 82.34 | D12: =+G12+J12+M12 -> 16 | E12: =+(F12)+0.5*G12 -> 24.27 | F12: 24.27 | G12: 0 | H12: =+(I12)+0.5*J12 -> 17.53 | I12: 15.03 | J12: 5 | K12: =+(L12)+0.5*M12 -> 40.54 | L12: 35.04 | M12: 11
A13: 9 | B13: Redford, "Red" (Rev) | C13: =+E13+H13+K13 -> 97.71 | D13: =+G13+J13+M13 -> 8 | E13: =+(F13)+0.5*G13 -> 41.14 | F13: 40.14 | G13: 2 | H13: =+(I13)+0.5*J13 -> 26.76 | I13: 24.26 | J13: 5 | K13: =+(L13)+0.5*M13 -> 29.81 | L13: 29.31 | M13: 1
A14: 10 | B14: Redford, Noel | C14: =+E14+H14+K14 -> 101.74 | D14: =+G14+J14+M14 -> 14 | E14: =+(F14)+0.5*G14 -> 44.54 | F14: 44.54 | G14: 0 | H14: =+(I14)+0.5*J14 -> 24.36 | I14: 18.86 | J14: =4+4+2+1 -> 11 | K14: =+(L14)+0.5*M14 -> 32.84 | L14: 31.34 | M14: 3
A15: 11 | B15: Phillips, RDan | C15: =+E15+H15+K15 -> 119.62 | D15: =+G15+J15+M15 -> 15 | E15: =+(F15)+0.5*G15 -> 50.96 | F15: 49.96 | G15: 2 | H15: =+(I15)+0.5*J15 -> 21.38 | I15: 17.88 | J15: 7 | K15: =+(L15)+0.5*M15 -> 47.28 | L15: 44.28 | M15: 6
A16: 12 | B16: DeLeeuw, Dave | C16: =+E16+H16+K16 -> 121.18 | D16: =+G16+J16+M16 -> 3 | E16: =+(F16)+0.5*G16 -> 65.25 | F16: 64.75 | G16: 1 | H16: =+(I16)+0.5*J16 -> 27.85 | I16: 27.35 | J16: 1 | K16: =+(L16)+0.5*M16 -> 28.08 | L16: 27.58 | M16: 1
A17: 13 | B17: Jepperson, Riley | C17: =+E17+H17+K17 -> 135.18 | D17: =+G17+J17+M17 -> 102 | E17: =+(F17)+0.5*G17 -> 46.44 | F17: 34.94 | G17: =3+4+1+2+1+2+10 -> 23 | H17: =+(I17)+0.5*J17 -> 35.95 | I17: 17.95 | J17: =1+1+6+4+4+4+8+8 -> 36 | K17: =+(L17)+0.5*M17 -> 52.79 | L17: 31.29 | M17: =1+6+10+6+20 -> 43
A18: 14 | B18: Simons, Jordan | C18: =+E18+H18+K18 -> 142.74 | D18: =+G18+J18+M18 -> 68 | E18: =+(F18)+0.5*G18 -> 65.39 | F18: 46.89 | G18: 37 | H18: =+(I18)+0.5*J18 -> 37.77 | I18: 28.77 | J18: 18 | K18: =+(L18)+0.5*M18 -> 39.58 | L18: 33.08 | M18: 13
A19: 15 | B19: Campbell, Stephen | C19: =+E19+H19+K19 -> 153.80 | D19: =+G19+J19+M19 -> 48 | E19: =+(F19)+0.5*G19 -> 47.03 | F19: 43.03 | G19: 8 | H19: =+(I19)+0.5*J19 -> 44.17 | I19: 32.17 | J19: =4+1+2+10+6+1 -> 24 | K19: =+(L19)+0.5*M19 -> 62.60 | L19: 54.60 | M19: =4+1+8+3 -> 16
A20: 16 | B20: Simons, Brad | C20: =+E20+H20+K20 -> 155.71 | D20: =+G20+J20+M20 -> 40 | E20: =+(F20)+0.5*G20 -> 58.03 | F20: 51.03 | G20: 14 | H20: =+(I20)+0.5*J20 -> 30.53 | I20: 25.53 | J20: 10 | K20: =+(L20)+0.5*M20 -> 67.15 | L20: 59.15 | M20: 16
A21: 17 | B21: Burney Carl | C21: =+E21+H21+K21 -> 159.33 | D21: =+G21+J21+M21 -> 22 | E21: =+(F21)+0.5*G21 -> 84.13 | F21: 84.13 | G21: 0 | H21: =+(I21)+0.5*J21 -> 29.72 | I21: 24.22 | J21: 11 | K21: =+(L21)+0.5*M21 -> 45.48 | L21: 39.98 | M21: 11
A22: 18 | B22: Lundell, Spencer | C22: =+E22+H22+K22 -> 170.95 | D22: =+G22+J22+M22 -> 107 | E22: =+(F22)+0.5*G22 -> 76.04 | F22: 59.04 | G22: =5+10+10+1+8 -> 34 | H22: =+(I22)+0.5*J22 -> 46.08 | I22: 25.08 | J22: =2+4+6+4+1+4+8+8+5 -> 42 | K22: =+(L22)+0.5*M22 -> 48.83 | L22: 33.33 | M22: =1+10+5+5+10 -> 31
A23: 19 | B23: Phillips, Tisha (.22) | C23: =+E23+H23+K23 -> 185.86 | D23: =+G23+J23+M23 -> 61 | E23: =+(F23)+0.5*G23 -> 66.06 | F23: 57.56 | G23: =6+2+3+1+4+1 -> 17 | H23: =+(I23)+0.5*J23 -> 42.77 | I23: 29.27 | J23: =1+4+1+2+1+4+2+4+8 -> 27 | K23: =+(L23)+0.5*M23 -> 77.03 | L23: 68.53 | M23: =1+6+10 -> 17
A24: 20 | B24: Herring, Erin (.22) | C24: =+E24+H24+K24 -> 202.67 | D24: =+G24+J24+M24 -> 38 | E24: =+(F24)+0.5*G24 -> 82.58 | F24: 80.08 | G24: 5 | H24: =+(I24)+0.5*J24 -> 33.54 | I24: 28.04 | J24: 11 | K24: =+(L24)+0.5*M24 -> 86.55 | L24: 75.55 | M24: =1+5+6+10 -> 22
A25: 21 | B25: Stone, Marylee | C25: =+E25+H25+K25 -> 277.73 | D25: =+G25+J25+M25 -> 115 | E25: =+(F25)+0.5*G25 -> 99.76 | F25: 96.76 | G25: 6 | H25: =+(I25)+0.5*J25 -> 72.77 | I25: 32.77 | J25: =8+6+10+6+10+10+10+10+10 -> 80 | K25: =+(L25)+0.5*M25 -> 105.20 | L25: 90.70 | M25: 29
A26: Notes:
A27: - | B27: Remember, the "Fun" Shoot is held on the 1st and 3rd Tuesday of each month ( 6:30 p.m.) at Range Masters.
A28: - | B28: You can use ANY handgun you want, as long as it can be safely drawn from a strong-side holster.
A29: - | B29: IDPA format and scoring.
A30: PD | B30: = Points Down = .5 seconds x Points Down
A31: XX | B31: Indicates that the Points Down value includes some kind of penalty (Procedural Error, Hits on Non-Threat, Misses on Steel, etc.)
A32: (Rev) | B32: = Revolver
A33: DNF | B33: = Did Not Finish