B1: Range Masters "Fun" Shoot | I1: Results for December 21, 2004
A2: Click on Stage # for view of COF
B3: Name (Note) | C3: Shoot Total | D3: Total Points Down
A4: Place | E4: Stage 1 | F4: String 1 | G4: String 2 | H4: PD | I4: Stage 2 | J4: String 1 | K4: String 2 | L4: PD | M4: Stage 3 | N4: String 1 | O4: String 2 | P4: PD
A5: 1 | B5: Young, Ren | C5: =+E5+I5+M5 -> 91.02 | D5: =+H5+L5+P5 -> 16 | E5: =+(F5+G5)+0.5*H5 -> 38.27 | F5: 18.69 | G5: 16.08 | H5: =2+2+1+2 -> 7 | I5: =+(J5+K5)+0.5*L5 -> 30.02 | J5: 12.40 | K5: 13.12 | L5: =1+4+4 -> 9 | M5: =+(N5+O5)+0.5*P5 -> 22.73 | N5: 12.35 | O5: 10.38 | P5: 0
A6: 2 | B6: Zaccardi, Pat | C6: =+E6+I6+M6 -> 95.60 | D6: =+H6+L6+P6 -> 17 | E6: =+(F6+G6)+0.5*H6 -> 42.78 | F6: 19.99 | G6: 20.79 | H6: =2+1+1 -> 4 | I6: =+(J6+K6)+0.5*L6 -> 35.94 | J6: 13.33 | K6: 16.11 | L6: =3+6+2+2 -> 13 | M6: =+(N6+O6)+0.5*P6 -> 16.88 | N6: 7.96 | O6: 8.92 | P6: 0
A7: 3 | B7: Young, Jason | C7: =+E7+I7+M7 -> 96.32 | D7: =+H7+L7+P7 -> 30 | E7: =+(F7+G7)+0.5*H7 -> 35.53 | F7: 17.16 | G7: 15.87 | H7: =1+1+1+1+1 -> 5 | I7: =+(J7+K7)+0.5*L7 -> 33.21 | J7: 9.79 | K7: 10.92 | L7: =4+9+3+7+2 -> 25 | M7: =+(N7+O7)+0.5*P7 -> 27.58 | N7: 19.46 | O7: 8.12 | P7: 0
A8: 4 | B8: Deleeuw, Dave | C8: =+E8+I8+M8 -> 105.26 | D8: =+H8+L8+P8 -> 8 | E8: =+(F8+G8)+0.5*H8 -> 52.42 | F8: 28.68 | G8: 22.24 | H8: =2+1 -> 3 | I8: =+(J8+K8)+0.5*L8 -> 31.83 | J8: 16.07 | K8: 13.26 | L8: =2+2+1 -> 5 | M8: =+(N8+O8)+0.5*P8 -> 21.01 | N8: 8.92 | O8: 12.09 | P8: 0
A9: 5 | B9: Rodriquez, Mike | C9: =+E9+I9+M9 -> 107.80 | D9: =+H9+L9+P9 -> 74 | E9: =+(F9+G9)+0.5*H9 -> 58.77 | F9: 15.40 | G9: 12.37 | H9: =6+10+6+3+11+10+5+1+10 -> 62 | I9: =+(J9+K9)+0.5*L9 -> 30.61 | J9: 11.41 | K9: 13.20 | L9: =2+5+1+2+2 -> 12 | M9: =+(N9+O9)+0.5*P9 -> 18.42 | N9: 10.51 | O9: 7.91 | P9: 0
A10: 6 | B10: Redford, Red | C10: =+E10+I10+M10 -> 113.29 | D10: =+H10+L10+P10 -> 6 | E10: =+(F10+G10)+0.5*H10 -> 61.07 | F10: 35.84 | G10: 24.73 | H10: 1 | I10: =+(J10+K10)+0.5*L10 -> 29.08 | J10: 11.81 | K10: 14.77 | L10: =1+1+2+1 -> 5 | M10: =+(N10+O10)+0.5*P10 -> 23.14 | N10: 11.99 | O10: 11.15 | P10: 0
A11: 7 | B11: Dockstader, Jeff | C11: =+E11+I11+M11 -> 116.24 | D11: =+H11+L11+P11 -> 36 | E11: =+(F11+G11)+0.5*H11 -> 49.81 | F11: 24.21 | G11: 24.60 | H11: 2 | I11: =+(J11+K11)+0.5*L11 -> 42.77 | J11: 13.48 | K11: 12.29 | L11: =3+1+6+6+8+10 -> 34 | M11: =+(N11+O11)+0.5*P11 -> 23.66 | N11: 14.70 | O11: 8.96 | P11: 0
A12: 8 | B12: Stone, Scott | C12: =+E12+I12+M12 -> 118.43 | D12: =+H12+L12+P12 -> 24 | E12: =+(F12+G12)+0.5*H12 -> 61.01 | F12: 23.78 | G12: 32.23 | H12: =2+2+1+2+2+1 -> 10 | I12: =+(J12+K12)+0.5*L12 -> 33.99 | J12: 11.68 | K12: 15.31 | L12: =2+4+2+6 -> 14 | M12: =+(N12+O12)+0.5*P12 -> 23.43 | N12: 12.39 | O12: 11.04 | P12: 0
A13: 9 | B13: Scott, Alan | C13: =+E13+I13+M13 -> 133.04 | D13: =+H13+L13+P13 -> 27 | E13: =+(F13+G13)+0.5*H13 -> 73.31 | F13: 46.69 | G13: 18.12 | H13: =1+11+4+1 -> 17 | I13: =+(J13+K13)+0.5*L13 -> 38.15 | J13: 17.34 | K13: 15.81 | L13: =2+1+1+6 -> 10 | M13: =+(N13+O13)+0.5*P13 -> 21.58 | N13: 9.16 | O13: 12.42 | P13: 0
A14: 10 | B14: Phillips, RDan | C14: =+E14+I14+M14 -> 135.38 | D14: =+H14+L14+P14 -> 29 | E14: =+(F14+G14)+0.5*H14 -> 70.40 | F14: 43.39 | G14: 25.51 | H14: =1+1+1 -> 3 | I14: =+(J14+K14)+0.5*L14 -> 41.13 | J14: 14.00 | K14: 14.13 | L14: =10+3+4+8+1 -> 26 | M14: =+(N14+O14)+0.5*P14 -> 23.85 | N14: 10.59 | O14: 13.26 | P14: 0
A15: 11 | B15: Jepperson, Riley | C15: =+E15+I15+M15 -> 140.00 | D15: =+H15+L15+P15 -> 53 | E15: =+(F15+G15)+0.5*H15 -> 69.67 | F15: 30.21 | G15: 23.96 | H15: =2+6+6+6+5+1+5 -> 31 | I15: =+(J15+K15)+0.5*L15 -> 38.19 | J15: 8.92 | K15: 18.27 | L15: =3+6+4+3+6 -> 22 | M15: =+(N15+O15)+0.5*P15 -> 32.14 | N15: 11.07 | O15: 21.07 | P15: 0
A16: 12 | B16: Simpson, Harold | C16: =+E16+I16+M16 -> 160.23 | D16: =+H16+L16+P16 -> 76 | E16: =+(F16+G16)+0.5*H16 -> 68.31 | F16: 31.01 | G16: 24.30 | H16: =15+1+5+5 -> 26 | I16: =+(J16+K16)+0.5*L16 -> 52.78 | J16: 13.64 | K16: 14.14 | L16: =5+5+8+14+8+10 -> 50 | M16: =+(N16+O16)+0.5*P16 -> 39.14 | N16: 28.00 | O16: 11.14 | P16: 0
A17: 13 | B17: Simons, Jordan | C17: =+E17+I17+M17 -> 164.02 | D17: =+H17+L17+P17 -> 14 | E17: =+(F17+G17)+0.5*H17 -> 73.56 | F17: 46.95 | G17: 25.11 | H17: =1+1+1 -> 3 | I17: =+(J17+K17)+0.5*L17 -> 55.47 | J17: 22.83 | K17: 27.14 | L17: =1+3+4+1+2 -> 11 | M17: =+(N17+O17)+0.5*P17 -> 34.99 | N17: 16.67 | O17: 18.32 | P17: 0
A18: 14 | B18: Tucker, Ben | C18: =+E18+I18+M18 -> 170.49 | D18: =+H18+L18+P18 -> 22 | E18: =+(F18+G18)+0.5*H18 -> 60.43 | F18: 36.55 | G18: 18.38 | H18: =1+3+1+6 -> 11 | I18: =+(J18+K18)+0.5*L18 -> 47.22 | J18: 18.39 | K18: 23.33 | L18: =5+1+2+3 -> 11 | M18: =+(N18+O18)+0.5*P18 -> 62.84 | N18: 42.19 | O18: 20.65 | P18: 0
A19: 15 | B19: Hill, Randy | C19: =+E19+I19+M19 -> 171.51 | D19: =+H19+L19+P19 -> 95 | E19: =+(F19+G19)+0.5*H19 -> 62.97 | F19: 19.54 | G19: 19.93 | H19: =1+7+15+7+1+10+6 -> 47 | I19: =+(J19+K19)+0.5*L19 -> 46.84 | J19: 8.94 | K19: 13.90 | L19: =1+6+15+11+15 -> 48 | M19: =+(N19+O19)+0.5*P19 -> 61.70 | N19: 34.54 | O19: 27.16 | P19: 0
A20: 16 | B20: Scott, Michael | C20: =+E20+I20+M20 -> 181.88 | D20: =+H20+L20+P20 -> 55 | E20: =+(F20+G20)+0.5*H20 -> 65.14 | F20: 32.83 | G20: 23.31 | H20: =1+1+7+7+2 -> 18 | I20: =+(J20+K20)+0.5*L20 -> 51.38 | J20: 14.04 | K20: 18.84 | L20: =6+5+3+9+14 -> 37 | M20: =+(N20+O20)+0.5*P20 -> 65.36 | N20: 53.58 | O20: 11.78 | P20: 0
A21: 17 | B21: Tucker, Jake | C21: =+E21+I21+M21 -> 199.18 | D21: =+H21+L21+P21 -> 20 | E21: =+(F21+G21)+0.5*H21 -> 87.96 | F21: 52.24 | G21: 34.22 | H21: =1+2 -> 3 | I21: =+(J21+K21)+0.5*L21 -> 58.96 | J21: 26.72 | K21: 23.74 | L21: =10+2+4+1 -> 17 | M21: =+(N21+O21)+0.5*P21 -> 52.26 | N21: 36.32 | O21: 15.94 | P21: 0
A22: 18 | B22: Simons, Brad | C22: =+E22+I22+M22 -> 239.34 | D22: =+H22+L22+P22 -> 17 | E22: =+(F22+G22)+0.5*H22 -> 94.45 | F22: 51.34 | G22: 36.61 | H22: =1+3+5+1+2+1 -> 13 | I22: =+(J22+K22)+0.5*L22 -> 64.46 | J22: 28.52 | K22: 33.94 | L22: =1+1+2 -> 4 | M22: =+(N22+O22)+0.5*P22 -> 80.43 | N22: 32.50 | O22: 47.93 | P22: 0
A23: 19 | B23: Phillips, Tisha (.22) | C23: =+E23+I23+M23 -> 266.82 | D23: =+H23+L23+P23 -> 63 | E23: =+(F23+G23)+0.5*H23 -> 107.80 | F23: 56.77 | G23: 50.03 | H23: 2 | I23: =+(J23+K23)+0.5*L23 -> 86.51 | J23: 27.76 | K23: 28.25 | L23: =6+16+10+19+10 -> 61 | M23: =+(N23+O23)+0.5*P23 -> 72.51 | N23: 37.44 | O23: 35.07 | P23: 0
A24: 20 | B24: Hill, Shane | C24: =+E24+I24+M24 -> 321.06 | D24: =+H24+L24+P24 -> 51 | E24: =+(F24+G24)+0.5*H24 -> 106.73 | F24: 48.21 | G24: 48.52 | H24: =7+1+1+7+2+2 -> 20 | I24: =+(J24+K24)+0.5*L24 -> 78.89 | J24: 21.64 | K24: 41.75 | L24: =2+9+6+14 -> 31 | M24: =+(N24+O24)+0.5*P24 -> 135.44 | N24: 67.86 | O24: 67.58 | P24: 0
A25: Notes:
A26: - | B26: Remember, the "Fun" Shoot is held on the 1st and 3rd Tuesday of each month ( 6:30 p.m.) at Range Masters.
A27: - | B27: You can use ANY handgun you want, as long as it can be safely drawn from a strong-side holster.
A28: - | B28: IDPA format and scoring.
A29: PD | B29: = Points Down = .5 seconds x Points Down
A30: XX | B30: Indicates that the Points Down value includes some kind of penalty (Procedural Error, Hits on Non-Threat, Misses on Steel, etc.)
A31: (Rev) | B31: = Revolver
A32: DNF | B32: = Did Not Finish