B1: Range Masters "Fun" Shoot | H1: Results for January 20, 2004
B2: Name (Note) | C2: Shoot Total | D2: Total Points Down
A3: Place | E3: Stage 1 | F3: String 1 | G3: String 2 | H3: PD | I3: Stage 2 | J3: String 1 | K3: String 2 | L3: PD | M3: Stage 3 | N3: String 1 | O3: String 2 | P3: String 3 | Q3: PD
A4: 1 | B4: Boshard, Dave | C4: =+E4+I4+M4 -> 56.75 | D4: =+H4+L4+Q4 -> 26 | E4: =+(F4+G4)+0.5*H4 -> 21.06 | F4: 5.67 | G4: 6.89 | H4: 17 | I4: =+(J4+K4)+0.5*L4 -> 16.38 | J4: 10.59 | K4: 2.79 | L4: 6 | M4: =+(N4+O4+P4)+0.5*Q4 -> 19.31 | N4: 7.16 | O4: 6.64 | P4: 4.01 | Q4: 3
A5: 2 | B5: Stilwell, Mike | C5: =+E5+I5+M5 -> 65.16 | D5: =+H5+L5+Q5 -> 13 | E5: =+(F5+G5)+0.5*H5 -> 21.62 | F5: 6.32 | G5: 12.30 | H5: 6 | I5: =+(J5+K5)+0.5*L5 -> 19.97 | J5: 13.55 | K5: 3.42 | L5: 6 | M5: =+(N5+O5+P5)+0.5*Q5 -> 23.57 | N5: 9.34 | O5: 8.86 | P5: 4.87 | Q5: 1
A6: 3 | B6: Collins, Ken | C6: =+E6+I6+M6 -> 76.83 | D6: =+H6+L6+Q6 -> 30 | E6: =+(F6+G6)+0.5*H6 -> 22.85 | F6: 8.16 | G6: 7.69 | H6: 14 | I6: =+(J6+K6)+0.5*L6 -> 25.22 | J6: 13.13 | K6: 4.09 | L6: 16 | M6: =+(N6+O6+P6)+0.5*Q6 -> 28.76 | N6: 12.91 | O6: 10.65 | P6: 5.20 | Q6: 0
A7: 4 | B7: Young, Jason | C7: =+E7+I7+M7 -> 78.40 | D7: =+H7+L7+Q7 -> 48 | E7: =+(F7+G7)+0.5*H7 -> 34.92 | F7: 8.15 | G7: 7.77 | H7: =4+4+13+8+9 -> 38 | I7: =+(J7+K7)+0.5*L7 -> 19.85 | J7: 15.30 | K7: 4.05 | L7: 1 | M7: =+(N7+O7+P7)+0.5*Q7 -> 23.63 | N7: 7.78 | O7: 7.44 | P7: 3.91 | Q7: 9
A8: 5 | B8: Adams, Kyle (Rev) | C8: =+E8+I8+M8 -> 81.09 | D8: =+H8+L8+Q8 -> 12 | E8: =+(F8+G8)+0.5*H8 -> 33.82 | F8: 12.66 | G8: 17.66 | H8: 7 | I8: =+(J8+K8)+0.5*L8 -> 19.79 | J8: 16.07 | K8: 3.72 | L8: 0 | M8: =+(N8+O8+P8)+0.5*Q8 -> 27.48 | N8: 9.68 | O8: 10.24 | P8: 5.06 | Q8: 5
A9: 6 | B9: Mousley, Roger (Rev) | C9: =+E9+I9+M9 -> 82.75 | D9: =+H9+L9+Q9 -> 20 | E9: =+(F9+G9)+0.5*H9 -> 32.73 | F9: 12.54 | G9: 14.19 | H9: 12 | I9: =+(J9+K9)+0.5*L9 -> 22.72 | J9: 18.62 | K9: 4.10 | L9: 0 | M9: =+(N9+O9+P9)+0.5*Q9 -> 27.30 | N9: 8.75 | O9: 9.04 | P9: 5.51 | Q9: 8
A10: 7 | B10: Taylor, Josh | C10: =+E10+I10+M10 -> 91.91 | D10: =+H10+L10+Q10 -> 3 | E10: =+(F10+G10)+0.5*H10 -> 40.59 | F10: 20.82 | G10: 18.27 | H10: 3 | I10: =+(J10+K10)+0.5*L10 -> 20.53 | J10: 15.21 | K10: 5.32 | L10: 0 | M10: =+(N10+O10+P10)+0.5*Q10 -> 30.79 | N10: 10.88 | O10: 13.34 | P10: 6.57 | Q10: 0
A11: 8 | B11: Rodriquez, Mike | C11: =+E11+I11+M11 -> 94.17 | D11: =+H11+L11+Q11 -> 49 | E11: =+(F11+G11)+0.5*H11 -> 32.97 | F11: 13.56 | G11: 11.41 | H11: 16 | I11: =+(J11+K11)+0.5*L11 -> 32.32 | J11: 19.63 | K11: 4.19 | L11: 17 | M11: =+(N11+O11+P11)+0.5*Q11 -> 28.88 | N11: 7.52 | O11: 8.47 | P11: 4.89 | Q11: 16
A12: 9 | B12: Zaccardi, Pat | C12: =+E12+I12+M12 -> 95.33 | D12: =+H12+L12+Q12 -> 53 | E12: =+(F12+G12)+0.5*H12 -> 36.45 | F12: 6.91 | G12: 12.04 | H12: =1+2+12+6+14 -> 35 | I12: =+(J12+K12)+0.5*L12 -> 23.13 | J12: 17.87 | K12: 3.76 | L12: 3 | M12: =+(N12+O12+P12)+0.5*Q12 -> 35.75 | N12: 10.53 | O12: 10.54 | P12: 7.18 | Q12: 15
A13: 10 | B13: Legg, Rich | C13: =+E13+I13+M13 -> 97.38 | D13: =+H13+L13+Q13 -> 19 | E13: =+(F13+G13)+0.5*H13 -> 37.89 | F13: 11.27 | G13: 21.12 | H13: 11 | I13: =+(J13+K13)+0.5*L13 -> 27.13 | J13: 17.71 | K13: 6.92 | L13: 5 | M13: =+(N13+O13+P13)+0.5*Q13 -> 32.36 | N13: 13.33 | O13: 8.51 | P13: 9.02 | Q13: 3
A14: 11 | B14: Myers, Chris (Rev) | C14: =+E14+I14+M14 -> 100.16 | D14: =+H14+L14+Q14 -> 9 | E14: =+(F14+G14)+0.5*H14 -> 33.15 | F14: 15.14 | G14: 14.51 | H14: 7 | I14: =+(J14+K14)+0.5*L14 -> 29.80 | J14: 24.17 | K14: 5.13 | L14: 1 | M14: =+(N14+O14+P14)+0.5*Q14 -> 37.21 | N14: 15.54 | O14: 12.06 | P14: 9.11 | Q14: 1
A15: 12 | B15: Stone, Scott | C15: =+E15+I15+M15 -> 101.61 | D15: =+H15+L15+Q15 -> 26 | E15: =+(F15+G15)+0.5*H15 -> 30.41 | F15: 17.28 | G15: 12.13 | H15: 2 | I15: =+(J15+K15)+0.5*L15 -> 34.54 | J15: 26.57 | K15: 7.47 | L15: 1 | M15: =+(N15+O15+P15)+0.5*Q15 -> 36.66 | N15: 11.26 | O15: 9.75 | P15: 4.15 | Q15: 23
A16: 13 | B16: Scott, Alan | C16: =+E16+I16+M16 -> 103.40 | D16: =+H16+L16+Q16 -> 26 | E16: =+(F16+G16)+0.5*H16 -> 39.05 | F16: 15.21 | G16: 16.84 | H16: 14 | I16: =+(J16+K16)+0.5*L16 -> 31.18 | J16: 23.82 | K16: 7.36 | L16: 0 | M16: =+(N16+O16+P16)+0.5*Q16 -> 33.17 | N16: 11.46 | O16: 10.07 | P16: 5.64 | Q16: 12
A17: 14 | B17: Huff, Blake | C17: =+E17+I17+M17 -> 103.83 | D17: =+H17+L17+Q17 -> 40 | E17: =+(F17+G17)+0.5*H17 -> 43.89 | F17: 11.13 | G17: 15.26 | H17: 35 | I17: =+(J17+K17)+0.5*L17 -> 28.82 | J17: 23.81 | K17: 4.51 | L17: 1 | M17: =+(N17+O17+P17)+0.5*Q17 -> 31.12 | N17: 11.89 | O17: 11.37 | P17: 5.86 | Q17: 4
A18: 15 | B18: Hatch, Perri | C18: =+E18+I18+M18 -> 104.56 | D18: =+H18+L18+Q18 -> 50 | E18: =+(F18+G18)+0.5*H18 -> 43.87 | F18: 15.05 | G18: 12.32 | H18: =7+1+8+6+11 -> 33 | I18: =+(J18+K18)+0.5*L18 -> 30.93 | J18: 21.05 | K18: 7.38 | L18: 5 | M18: =+(N18+O18+P18)+0.5*Q18 -> 29.76 | N18: 9.07 | O18: 9.44 | P18: 5.25 | Q18: 12
A19: 16 | B19: Outzen, Craig | C19: =+E19+I19+M19 -> 105.18 | D19: =+H19+L19+Q19 -> 37 | E19: =+(F19+G19)+0.5*H19 -> 39.07 | F19: 11.27 | G19: 12.80 | H19: 30 | I19: =+(J19+K19)+0.5*L19 -> 35.72 | J19: 26.38 | K19: 6.34 | L19: 6 | M19: =+(N19+O19+P19)+0.5*Q19 -> 30.39 | N19: 11.25 | O19: 11.32 | P19: 7.32 | Q19: 1
A20: 17 | B20: Scott, Michael | C20: =+E20+I20+M20 -> 108.75 | D20: =+H20+L20+Q20 -> 25 | E20: =+(F20+G20)+0.5*H20 -> 45.77 | F20: 13.64 | G20: 23.13 | H20: 18 | I20: =+(J20+K20)+0.5*L20 -> 25.90 | J20: 20.26 | K20: 5.14 | L20: 1 | M20: =+(N20+O20+P20)+0.5*Q20 -> 37.08 | N20: 12.70 | O20: 13.65 | P20: 7.73 | Q20: 6
A21: 18 | B21: Redford, Steve | C21: =+E21+I21+M21 -> 111.04 | D21: =+H21+L21+Q21 -> 64 | E21: =+(F21+G21)+0.5*H21 -> 38.79 | F21: 11.53 | G21: 13.76 | H21: 27 | I21: =+(J21+K21)+0.5*L21 -> 33.53 | J21: 23.38 | K21: 5.15 | L21: 10 | M21: =+(N21+O21+P21)+0.5*Q21 -> 38.72 | N21: 8.16 | O21: 13.08 | P21: 3.98 | Q21: 27
A22: 19 | B22: Redford, "Red" (Rev) | C22: =+E22+I22+M22 -> 113.76 | D22: =+H22+L22+Q22 -> 12 | E22: =+(F22+G22)+0.5*H22 -> 45.18 | F22: 20.31 | G22: 19.37 | H22: 11 | I22: =+(J22+K22)+0.5*L22 -> 34.33 | J22: 28.69 | K22: 5.64 | L22: 0 | M22: =+(N22+O22+P22)+0.5*Q22 -> 34.25 | N22: 14.87 | O22: 12.99 | P22: 5.89 | Q22: 1
A23: 20 | B23: Sherman, Adam | C23: =+E23+I23+M23 -> 115.59 | D23: =+H23+L23+Q23 -> 26 | E23: =+(F23+G23)+0.5*H23 -> 40.59 | F23: 15.59 | G23: 15.50 | H23: 19 | I23: =+(J23+K23)+0.5*L23 -> 34.35 | J23: 25.64 | K23: 7.21 | L23: 3 | M23: =+(N23+O23+P23)+0.5*Q23 -> 40.65 | N23: 18.48 | O23: 11.40 | P23: 8.77 | Q23: 4
A24: 21 | B24: Billings, Scott | C24: =+E24+I24+M24 -> 120.32 | D24: =+H24+L24+Q24 -> 25 | E24: =+(F24+G24)+0.5*H24 -> 35.55 | F24: 14.28 | G24: 12.77 | H24: 17 | I24: =+(J24+K24)+0.5*L24 -> 33.04 | J24: 24.03 | K24: 8.01 | L24: 2 | M24: =+(N24+O24+P24)+0.5*Q24 -> 51.73 | N24: 19.93 | O24: 16.77 | P24: 12.03 | Q24: 6
A25: 22 | B25: Johnson, Dixie (.22) | C25: =+E25+I25+M25 -> 122.63 | D25: =+H25+L25+Q25 -> 42 | E25: =+(F25+G25)+0.5*H25 -> 46.00 | F25: 16.19 | G25: 15.81 | H25: 28 | I25: =+(J25+K25)+0.5*L25 -> 36.00 | J25: 23.91 | K25: 9.59 | L25: 5 | M25: =+(N25+O25+P25)+0.5*Q25 -> 40.63 | N25: 12.96 | O25: 15.90 | P25: 7.27 | Q25: 9
A26: 23 | B26: Adams, Brent | C26: =+E26+I26+M26 -> 128.04 | D26: =+H26+L26+Q26 -> 17 | E26: =+(F26+G26)+0.5*H26 -> 39.08 | F26: 19.96 | G26: 15.62 | H26: 7 | I26: =+(J26+K26)+0.5*L26 -> 48.00 | J26: 39.95 | K26: 8.05 | L26: 0 | M26: =+(N26+O26+P26)+0.5*Q26 -> 40.96 | N26: 14.58 | O26: 14.18 | P26: 7.20 | Q26: 10
A27: 24 | B27: Scobell, Justin | C27: =+E27+I27+M27 -> 130.77 | D27: =+H27+L27+Q27 -> 45 | E27: =+(F27+G27)+0.5*H27 -> 48.53 | F27: 14.11 | G27: 15.92 | H27: 37 | I27: =+(J27+K27)+0.5*L27 -> 48.70 | J27: 36.36 | K27: 9.84 | L27: 5 | M27: =+(N27+O27+P27)+0.5*Q27 -> 33.54 | N27: 12.97 | O27: 12.21 | P27: 6.86 | Q27: 3
A28: 25 | B28: Zaccardi, Juke | C28: =+E28+I28+M28 -> 131.24 | D28: =+H28+L28+Q28 -> 65 | E28: =+(F28+G28)+0.5*H28 -> 59.16 | F28: 10.82 | G28: 26.34 | H28: =8+4+12+9+11 -> 44 | I28: =+(J28+K28)+0.5*L28 -> 37.04 | J28: 24.02 | K28: 7.52 | L28: 11 | M28: =+(N28+O28+P28)+0.5*Q28 -> 35.04 | N28: 10.76 | O28: 8.99 | P28: 10.29 | Q28: 10
A29: 26 | B29: Bethers, Larry | C29: =+E29+I29+M29 -> 133.03 | D29: =+H29+L29+Q29 -> 27 | E29: =+(F29+G29)+0.5*H29 -> 45.19 | F29: 19.66 | G29: 16.53 | H29: 18 | I29: =+(J29+K29)+0.5*L29 -> 52.42 | J29: 35.02 | K29: 14.40 | L29: 6 | M29: =+(N29+O29+P29)+0.5*Q29 -> 35.42 | N29: 13.36 | O29: 14.61 | P29: 5.95 | Q29: 3
A30: 27 | B30: Redford, Noel | C30: =+E30+I30+M30 -> 133.53 | D30: =+H30+L30+Q30 -> 52 | E30: =+(F30+G30)+0.5*H30 -> 45.88 | F30: 18.78 | G30: 15.60 | H30: 23 | I30: =+(J30+K30)+0.5*L30 -> 51.23 | J30: 38.72 | K30: 6.51 | L30: 12 | M30: =+(N30+O30+P30)+0.5*Q30 -> 36.42 | N30: 11.67 | O30: 9.82 | P30: 6.43 | Q30: 17
A31: 28 | B31: Ottesen, Sterling | C31: =+E31+I31+M31 -> 136.99 | D31: =+H31+L31+Q31 -> 54 | E31: =+(F31+G31)+0.5*H31 -> 40.90 | F31: 21.16 | G31: 14.24 | H31: 11 | I31: =+(J31+K31)+0.5*L31 -> 47.42 | J31: 34.66 | K31: 9.26 | L31: 7 | M31: =+(N31+O31+P31)+0.5*Q31 -> 48.67 | N31: 13.97 | O31: 10.87 | P31: 5.83 | Q31: 36
A32: 29 | B32: Goddard, Kendall | C32: =+E32+I32+M32 -> 137.37 | D32: =+H32+L32+Q32 -> 10 | E32: =+(F32+G32)+0.5*H32 -> 54.34 | F32: 24.62 | G32: 28.22 | H32: 3 | I32: =+(J32+K32)+0.5*L32 -> 32.35 | J32: 23.70 | K32: 8.65 | L32: 0 | M32: =+(N32+O32+P32)+0.5*Q32 -> 50.68 | N32: 19.54 | O32: 19.69 | P32: 7.95 | Q32: 7
A33: 30 | B33: Mousley, Randy (Rev) | C33: =+E33+I33+M33 -> 138.63 | D33: =+H33+L33+Q33 -> 37 | E33: =+(F33+G33)+0.5*H33 -> 60.72 | F33: 23.75 | G33: 25.47 | H33: 23 | I33: =+(J33+K33)+0.5*L33 -> 34.00 | J33: 25.51 | K33: 7.99 | L33: 1 | M33: =+(N33+O33+P33)+0.5*Q33 -> 43.91 | N33: 12.89 | O33: 17.61 | P33: 6.91 | Q33: 13
A34: 31 | B34: Goddard, Cole | C34: =+E34+I34+M34 -> 145.39 | D34: =+H34+L34+Q34 -> 56 | E34: =+(F34+G34)+0.5*H34 -> 63.40 | F34: 25.85 | G34: 23.05 | H34: =9+4+9+2+5 -> 29 | I34: =+(J34+K34)+0.5*L34 -> 40.12 | J34: 29.13 | K34: 4.99 | L34: 12 | M34: =+(N34+O34+P34)+0.5*Q34 -> 41.87 | N34: 14.67 | O34: 15.10 | P34: 4.60 | Q34: 15
A35: 32 | B35: Burney, Carl | C35: =+E35+I35+M35 -> 148.89 | D35: =+H35+L35+Q35 -> 14 | E35: =+(F35+G35)+0.5*H35 -> 57.04 | F35: 30.89 | G35: 21.65 | H35: 9 | I35: =+(J35+K35)+0.5*L35 -> 47.41 | J35: 37.92 | K35: 6.99 | L35: 5 | M35: =+(N35+O35+P35)+0.5*Q35 -> 44.44 | N35: 21.51 | O35: 12.03 | P35: 10.90 | Q35: 0
A36: 33 | B36: Billings, Richard (.22) | C36: =+E36+I36+M36 -> 155.58 | D36: =+H36+L36+Q36 -> 46 | E36: =+(F36+G36)+0.5*H36 -> 58.72 | F36: 14.23 | G36: 27.49 | H36: 34 | I36: =+(J36+K36)+0.5*L36 -> 62.81 | J36: 39.86 | K36: 17.45 | L36: 11 | M36: =+(N36+O36+P36)+0.5*Q36 -> 34.05 | N36: 12.83 | O36: 13.50 | P36: 7.22 | Q36: 1
A37: 34 | B37: Hood, Neil | C37: =+E37+I37+M37 -> 156.01 | D37: =+H37+L37+Q37 -> 19 | E37: =+(F37+G37)+0.5*H37 -> 49.80 | F37: 20.51 | G37: 20.29 | H37: 18 | I37: =+(J37+K37)+0.5*L37 -> 65.09 | J37: 54.96 | K37: 10.13 | L37: 0 | M37: =+(N37+O37+P37)+0.5*Q37 -> 41.12 | N37: 17.68 | O37: 14.68 | P37: 8.26 | Q37: 1
A38: 35 | B38: Raigne, Abe (.22) | C38: =+E38+I38+M38 -> 174.63 | D38: =+H38+L38+Q38 -> 51 | E38: =+(F38+G38)+0.5*H38 -> 66.15 | F38: 37.81 | G38: 15.84 | H38: 25 | I38: =+(J38+K38)+0.5*L38 -> 60.86 | J38: 39.93 | K38: 15.93 | L38: 10 | M38: =+(N38+O38+P38)+0.5*Q38 -> 47.62 | N38: 16.17 | O38: 14.96 | P38: 8.49 | Q38: 16
A39: 36 | B39: Brown, Michael | C39: =+E39+I39+M39 -> 175.37 | D39: =+H39+L39+Q39 -> 100 | E39: =+(F39+G39)+0.5*H39 -> 59.07 | F39: 27.54 | G39: 10.03 | H39: =15+13+4+11 -> 43 | I39: =+(J39+K39)+0.5*L39 -> 56.55 | J39: 37.07 | K39: 13.48 | L39: 12 | M39: =+(N39+O39+P39)+0.5*Q39 -> 59.75 | N39: 15.37 | O39: 16.08 | P39: 5.80 | Q39: =23+8+8+6 -> 45
A40: 37 | B40: Wilkerson, Julie (.22) | C40: =+E40+I40+M40 -> 252.28 | D40: =+H40+L40+Q40 -> 93 | E40: =+(F40+G40)+0.5*H40 -> 80.49 | F40: 43.05 | G40: 11.94 | H40: =11+1+7+7+25 -> 51 | I40: =+(J40+K40)+0.5*L40 -> 83.79 | J40: 63.40 | K40: 14.89 | L40: 11 | M40: =+(N40+O40+P40)+0.5*Q40 -> 88.00 | N40: 31.57 | O40: 32.93 | P40: 8.00 | Q40: 31
A41: 38 | B41: Stone, Mazlee (.22) | C41: =+E41+I41+M41 -> 253.36 | D41: =+H41+L41+Q41 -> 107 | E41: =+(F41+G41)+0.5*H41 -> 70.61 | F41: 28.19 | G41: 12.92 | H41: =11+1+15+18+14 -> 59 | I41: =+(J41+K41)+0.5*L41 -> 111.14 | J41: 72.02 | K41: 36.62 | L41: 5 | M41: =+(N41+O41+P41)+0.5*Q41 -> 71.61 | N41: 24.09 | O41: 18.25 | P41: 7.77 | Q41: 43
A42: 39 | B42: Redmond, Kendall | C42: DNF | D42: DNF | E42: DNF | I42: =+(J42+K42)+0.5*L42 -> 29.57 | J42: 21.38 | K42: 5.69 | L42: 5 | M42: DNF
A43: Notes:
A44: - | B44: Remember, the "Fun" Shoot is held on the 1st and 3rd Tuesday of each month ( 6:30 p.m.) at Range Masters.
A45: - | B45: You can use ANY handgun you want, as long as it can be safely drawn from a strong-side holster.
A46: - | B46: IDPA format and scoring.
A47: PD | B47: = Points Down = .5 seconds x Points Down
A48: xx | B48: Indicates that the Points Down value includes some kind of penalty (Procedural Error, Hits on Non-Threat, Misses on Steel, etc.)
A49: (Rev) | B49: = Revolver
A50: DNF | B50: = Did Not Finish