B0: Range Masters "Fun" Shoot | H0: Results for March 16, 2004
A1: Click on Stage # for view of COF
B2: Name (Note) | C2: Shoot Total | D2: Total Points Down
A3: Place | E3: Stage 1 | F3: String 1 | G3: String 2 | H3: PD | I3: Stage 2 | J3: String 1 | K3: String 2 | L3: PD | M3: Stage 3 | N3: String 1 | O3: String 2 | P3: String 3 | Q3: PD
A4: 1 | B4: Stilwell, Mike | C4: =+E4+I4+M4 -> 62.65 | D4: =+H4+L4+Q4 -> 23 | E4: =+(F4+G4)+0.5*H4 -> 24.53 | F4: 18.06 | G4: 2.97 | H4: 7 | I4: =+(J4+K4)+0.5*L4 -> 21.50 | J4: 5.88 | K4: 10.12 | L4: 11 | M4: =+(N4+O4+P4)+0.5*Q4 -> 16.62 | N4: 4.78 | O4: 4.88 | P4: 4.46 | Q4: 5
A5: 2 | B5: Collins, Ken | C5: =+E5+I5+M5 -> 62.71 | D5: =+H5+L5+Q5 -> 34 | E5: =+(F5+G5)+0.5*H5 -> 32.45 | F5: 17.35 | G5: 2.60 | H5: 25 | I5: =+(J5+K5)+0.5*L5 -> 18.73 | J5: 5.86 | K5: 8.87 | L5: 8 | M5: =+(N5+O5+P5)+0.5*Q5 -> 11.53 | N5: 3.30 | O5: 3.79 | P5: 3.94 | Q5: 1
A6: 3 | B6: Mousley, Roger (Rev) | C6: =+E6+I6+M6 -> 65.37 | D6: =+H6+L6+Q6 -> 4 | E6: =+(F6+G6)+0.5*H6 -> 29.58 | F6: 25.47 | G6: 3.11 | H6: 2 | I6: =+(J6+K6)+0.5*L6 -> 21.48 | J6: 10.35 | K6: 10.13 | L6: 2 | M6: =+(N6+O6+P6)+0.5*Q6 -> 14.31 | N6: 3.39 | O6: 5.31 | P6: 5.61 | Q6: 0
A7: 4 | B7: Young, Jason | C7: =+E7+I7+M7 -> 69.66 | D7: =+H7+L7+Q7 -> 41 | E7: =+(F7+G7)+0.5*H7 -> 35.07 | F7: 22.25 | G7: 4.32 | H7: 17 | I7: =+(J7+K7)+0.5*L7 -> 21.82 | J7: 3.53 | K7: 7.79 | L7: 21 | M7: =+(N7+O7+P7)+0.5*Q7 -> 12.77 | N7: 3.19 | O7: 4.48 | P7: 3.60 | Q7: 3
A8: 5 | B8: Outzen, Craig | C8: =+E8+I8+M8 -> 69.80 | D8: =+H8+L8+Q8 -> 20 | E8: =+(F8+G8)+0.5*H8 -> 32.50 | F8: 26.16 | G8: 3.34 | H8: 6 | I8: =+(J8+K8)+0.5*L8 -> 20.04 | J8: 7.91 | K8: 8.63 | L8: 7 | M8: =+(N8+O8+P8)+0.5*Q8 -> 17.26 | N8: 3.94 | O8: 4.46 | P8: 5.36 | Q8: 7
A9: 6 | B9: Rodriquez, Mike | C9: =+E9+I9+M9 -> 72.83 | D9: =+H9+L9+Q9 -> 37 | E9: =+(F9+G9)+0.5*H9 -> 31.76 | F9: 23.14 | G9: 3.12 | H9: 11 | I9: =+(J9+K9)+0.5*L9 -> 24.20 | J9: 6.18 | K9: 10.02 | L9: 16 | M9: =+(N9+O9+P9)+0.5*Q9 -> 16.87 | N9: 3.54 | O9: 4.11 | P9: 4.22 | Q9: 10
A10: 7 | B10: Hansen, Jeff | C10: =+E10+I10+M10 -> 75.72 | D10: =+H10+L10+Q10 -> 28 | E10: =+(F10+G10)+0.5*H10 -> 35.68 | F10: 29.33 | G10: 2.35 | H10: 8 | I10: =+(J10+K10)+0.5*L10 -> 21.47 | J10: 6.03 | K10: 11.44 | L10: 8 | M10: =+(N10+O10+P10)+0.5*Q10 -> 18.57 | N10: 3.21 | O10: 4.40 | P10: 4.96 | Q10: 12
A11: 8 | B11: Huff, Blake | C11: =+E11+I11+M11 -> 80.32 | D11: =+H11+L11+Q11 -> 15 | E11: =+(F11+G11)+0.5*H11 -> 36.96 | F11: 30.72 | G11: 4.24 | H11: 4 | I11: =+(J11+K11)+0.5*L11 -> 28.28 | J11: 11.70 | K11: 11.58 | L11: 10 | M11: =+(N11+O11+P11)+0.5*Q11 -> 15.08 | N11: 3.75 | O11: 5.71 | P11: 5.12 | Q11: 1
A12: 9 | B12: Lyon, Jared | C12: =+E12+I12+M12 -> 82.45 | D12: =+H12+L12+Q12 -> 29 | E12: =+(F12+G12)+0.5*H12 -> 35.48 | F12: 26.70 | G12: 4.28 | H12: 9 | I12: =+(J12+K12)+0.5*L12 -> 29.73 | J12: 8.86 | K12: 11.37 | L12: 19 | M12: =+(N12+O12+P12)+0.5*Q12 -> 17.24 | N12: 4.39 | O12: 7.33 | P12: 5.02 | Q12: 1
A13: 10 | B13: Myers, Chris | C13: =+E13+I13+M13 -> 83.06 | D13: =+H13+L13+Q13 -> 21 | E13: =+(F13+G13)+0.5*H13 -> 36.17 | F13: 31.58 | G13: 3.09 | H13: 3 | I13: =+(J13+K13)+0.5*L13 -> 29.88 | J13: 7.52 | K13: 15.86 | L13: 13 | M13: =+(N13+O13+P13)+0.5*Q13 -> 17.01 | N13: 4.89 | O13: 4.93 | P13: 4.69 | Q13: 5
A14: 11 | B14: Stone, Scott | C14: =+E14+I14+M14 -> 84.87 | D14: =+H14+L14+Q14 -> 42 | E14: =+(F14+G14)+0.5*H14 -> 40.51 | F14: 33.27 | G14: 3.74 | H14: 7 | I14: =+(J14+K14)+0.5*L14 -> 28.94 | J14: 5.15 | K14: 8.79 | L14: =1+2+4+1+8+6+6+2 -> 30 | M14: =+(N14+O14+P14)+0.5*Q14 -> 15.42 | N14: 3.36 | O14: 5.08 | P14: 4.48 | Q14: 5
A15: 12 | B15: Adams, Kyle (Rev) | C15: =+E15+I15+M15 -> 85.82 | D15: =+H15+L15+Q15 -> 18 | E15: =+(F15+G15)+0.5*H15 -> 39.08 | F15: 33.21 | G15: 2.87 | H15: 6 | I15: =+(J15+K15)+0.5*L15 -> 29.99 | J15: 12.91 | K15: 11.58 | L15: 11 | M15: =+(N15+O15+P15)+0.5*Q15 -> 16.75 | N15: 5.09 | O15: 5.51 | P15: 5.65 | Q15: 1
A16: 13 | B16: Loveless, Doug | C16: =+E16+I16+M16 -> 90.12 | D16: =+H16+L16+Q16 -> 27 | E16: =+(F16+G16)+0.5*H16 -> 42.31 | F16: 34.05 | G16: 4.26 | H16: 8 | I16: =+(J16+K16)+0.5*L16 -> 28.72 | J16: 9.63 | K16: 12.09 | L16: 14 | M16: =+(N16+O16+P16)+0.5*Q16 -> 19.09 | N16: 4.92 | O16: 5.54 | P16: 6.13 | Q16: 5
A17: 14 | B17: Zaccardi, Juke | C17: =+E17+I17+M17 -> 90.60 | D17: =+H17+L17+Q17 -> 50 | E17: =+(F17+G17)+0.5*H17 -> 33.68 | F17: 19.16 | G17: 5.02 | H17: 19 | I17: =+(J17+K17)+0.5*L17 -> 30.70 | J17: 12.22 | K17: 11.98 | L17: 13 | M17: =+(N17+O17+P17)+0.5*Q17 -> 26.22 | N17: 3.89 | O17: 7.03 | P17: 6.30 | Q17: 18
A18: 15 | B18: Redford, Steve | C18: =+E18+I18+M18 -> 91.44 | D18: =+H18+L18+Q18 -> 21 | E18: =+(F18+G18)+0.5*H18 -> 48.92 | F18: 37.12 | G18: 8.30 | H18: 7 | I18: =+(J18+K18)+0.5*L18 -> 24.87 | J18: 11.19 | K18: 9.18 | L18: 9 | M18: =+(N18+O18+P18)+0.5*Q18 -> 17.65 | N18: 5.97 | O18: 5.07 | P18: 4.11 | Q18: 5
A19: 16 | B19: Redford, Noel | C19: =+E19+I19+M19 -> 92.38 | D19: =+H19+L19+Q19 -> 21 | E19: =+(F19+G19)+0.5*H19 -> 49.92 | F19: 38.34 | G19: 5.58 | H19: 12 | I19: =+(J19+K19)+0.5*L19 -> 22.59 | J19: 7.42 | K19: 11.17 | L19: 8 | M19: =+(N19+O19+P19)+0.5*Q19 -> 19.87 | N19: 3.39 | O19: 10.27 | P19: 5.71 | Q19: 1
A20: 17 | B20: Walker, Ron | C20: =+E20+I20+M20 -> 97.35 | D20: =+H20+L20+Q20 -> 6 | E20: =+(F20+G20)+0.5*H20 -> 49.41 | F20: 42.54 | G20: 4.87 | H20: 4 | I20: =+(J20+K20)+0.5*L20 -> 29.33 | J20: 11.11 | K20: 17.72 | L20: 1 | M20: =+(N20+O20+P20)+0.5*Q20 -> 18.61 | N20: 5.15 | O20: 5.78 | P20: 7.18 | Q20: 1
A21: 18 | B21: Scott, Alan | C21: =+E21+I21+M21 -> 99.33 | D21: =+H21+L21+Q21 -> 19 | E21: =+(F21+G21)+0.5*H21 -> 58.73 | F21: 52.23 | G21: 4.00 | H21: 5 | I21: =+(J21+K21)+0.5*L21 -> 22.63 | J21: 5.95 | K21: 12.18 | L21: 9 | M21: =+(N21+O21+P21)+0.5*Q21 -> 17.97 | N21: 4.49 | O21: 6.21 | P21: 4.77 | Q21: 5
A22: 19 | B22: Taylor, Joshua | C22: =+E22+I22+M22 -> 100.30 | D22: =+H22+L22+Q22 -> 12 | E22: =+(F22+G22)+0.5*H22 -> 51.48 | F22: 42.04 | G22: 4.44 | H22: 10 | I22: =+(J22+K22)+0.5*L22 -> 29.40 | J22: 11.16 | K22: 17.24 | L22: 2 | M22: =+(N22+O22+P22)+0.5*Q22 -> 19.42 | N22: 6.47 | O22: 5.99 | P22: 6.96 | Q22: 0
A23: 20 | B23: Billings, Richard | C23: =+E23+I23+M23 -> 103.12 | D23: =+H23+L23+Q23 -> 24 | E23: =+(F23+G23)+0.5*H23 -> 54.51 | F23: 48.48 | G23: 4.03 | H23: 4 | I23: =+(J23+K23)+0.5*L23 -> 29.70 | J23: 7.98 | K23: 12.22 | L23: =2+1+2+5+1+2+2+4 -> 19 | M23: =+(N23+O23+P23)+0.5*Q23 -> 18.91 | N23: 4.59 | O23: 7.57 | P23: 6.25 | Q23: 1
A24: 21 | B24: Goddard, Kendall | C24: =+E24+I24+M24 -> 103.65 | D24: =+H24+L24+Q24 -> 7 | E24: =+(F24+G24)+0.5*H24 -> 50.22 | F24: 46.02 | G24: 3.70 | H24: 1 | I24: =+(J24+K24)+0.5*L24 -> 32.08 | J24: 11.21 | K24: 20.37 | L24: 1 | M24: =+(N24+O24+P24)+0.5*Q24 -> 21.35 | N24: 6.38 | O24: 5.78 | P24: 6.69 | Q24: 5
A25: 22 | B25: Billings, Scott | C25: =+E25+I25+M25 -> 107.00 | D25: =+H25+L25+Q25 -> 44 | E25: =+(F25+G25)+0.5*H25 -> 53.92 | F25: 45.01 | G25: 4.41 | H25: 9 | I25: =+(J25+K25)+0.5*L25 -> 29.94 | J25: 9.85 | K25: 11.09 | L25: 18 | M25: =+(N25+O25+P25)+0.5*Q25 -> 23.14 | N25: 3.85 | O25: 6.12 | P25: 4.67 | Q25: 17
A26: 23 | B26: Moses, Tyler | C26: =+E26+I26+M26 -> 108.78 | D26: =+H26+L26+Q26 -> 30 | E26: =+(F26+G26)+0.5*H26 -> 57.81 | F26: 47.58 | G26: 3.73 | H26: 13 | I26: =+(J26+K26)+0.5*L26 -> 31.54 | J26: 7.84 | K26: 17.70 | L26: 12 | M26: =+(N26+O26+P26)+0.5*Q26 -> 19.43 | N26: 5.90 | O26: 4.98 | P26: 6.05 | Q26: 5
A27: 24 | B27: Scott, Michael | C27: =+E27+I27+M27 -> 125.53 | D27: =+H27+L27+Q27 -> 60 | E27: =+(F27+G27)+0.5*H27 -> 63.79 | F27: 52.68 | G27: 4.11 | H27: 14 | I27: =+(J27+K27)+0.5*L27 -> 44.34 | J27: 7.04 | K27: 14.30 | L27: =6+5+3+5+10+9+2+6 -> 46 | M27: =+(N27+O27+P27)+0.5*Q27 -> 17.40 | N27: 4.77 | O27: 6.23 | P27: 6.40 | Q27: 0
A28: 25 | B28: Brown, Michael | C28: =+E28+I28+M28 -> 132.94 | D28: =+H28+L28+Q28 -> 48 | E28: =+(F28+G28)+0.5*H28 -> 62.38 | F28: 47.56 | G28: 8.32 | H28: 13 | I28: =+(J28+K28)+0.5*L28 -> 31.49 | J28: 8.43 | K28: 15.06 | L28: 16 | M28: =+(N28+O28+P28)+0.5*Q28 -> 39.07 | N28: 6.09 | O28: 17.05 | P28: 6.43 | Q28: 19
A29: 26 | B29: Goddard, Cole | C29: =+E29+I29+M29 -> 140.83 | D29: =+H29+L29+Q29 -> 89 | E29: =+(F29+G29)+0.5*H29 -> 63.93 | F29: 40.19 | G29: 5.74 | H29: 36 | I29: =+(J29+K29)+0.5*L29 -> 40.83 | J29: 11.02 | K29: 16.81 | L29: 26 | M29: =+(N29+O29+P29)+0.5*Q29 -> 36.07 | N29: 6.94 | O29: 6.45 | P29: 9.18 | Q29: 27
A30: 27 | B30: Simons, Brad | C30: =+E30+I30+M30 -> 151.20 | D30: =+H30+L30+Q30 -> 59 | E30: =+(F30+G30)+0.5*H30 -> 65.18 | F30: 47.98 | G30: 14.20 | H30: 6 | I30: =+(J30+K30)+0.5*L30 -> 57.04 | J30: 17.34 | K30: 22.20 | L30: =1+8+4+6+6+1+9 -> 35 | M30: =+(N30+O30+P30)+0.5*Q30 -> 28.98 | N30: 4.73 | O30: 7.54 | P30: 7.71 | Q30: 18
A31: 28 | B31: Adams, Cody | C31: =+E31+I31+M31 -> 195.26 | D31: =+H31+L31+Q31 -> 30 | E31: =+(F31+G31)+0.5*H31 -> 104.62 | F31: 82.74 | G31: 19.88 | H31: 4 | I31: =+(J31+K31)+0.5*L31 -> 47.55 | J31: 16.88 | K31: 22.67 | L31: 16 | M31: =+(N31+O31+P31)+0.5*Q31 -> 43.09 | N31: 6.78 | O31: 14.27 | P31: 17.04 | Q31: 10
A32: 29 | B32: Hansen, Lacee (.22) | C32: =+E32+I32+M32 -> 224.12 | D32: =+H32+L32+Q32 -> 16 | E32: =+(F32+G32)+0.5*H32 -> 109.99 | F32: 101.96 | G32: 6.03 | H32: 4 | I32: =+(J32+K32)+0.5*L32 -> 65.00 | J32: 25.58 | K32: 36.42 | L32: 6 | M32: =+(N32+O32+P32)+0.5*Q32 -> 49.13 | N32: 9.77 | O32: 25.21 | P32: 11.15 | Q32: 6
A33: 30 | B33: Stone, Marylee | C33: =+E33+I33+M33 -> 244.30 | D33: =+H33+L33+Q33 -> 112 | E33: =+(F33+G33)+0.5*H33 -> 114.76 | F33: 84.76 | G33: 19.50 | H33: =1+4+1+1+6+8 -> 21 | I33: =+(J33+K33)+0.5*L33 -> 83.18 | J33: 24.44 | K33: 32.24 | L33: =3+5+4+6+7+14+14 -> 53 | M33: =+(N33+O33+P33)+0.5*Q33 -> 46.36 | N33: 8.14 | O33: 11.06 | P33: 8.16 | Q33: 38
A34: 31 | B34: Dunn, Robert | C34: =+E34+I34+M34 -> 369.61 | D34: =+H34+L34+Q34 -> 73 | E34: =+(F34+G34)+0.5*H34 -> 206.62 | F34: 195.40 | G34: 6.72 | H34: 9 | I34: =+(J34+K34)+0.5*L34 -> 115.56 | J34: 44.29 | K34: 47.27 | L34: =8+4+6+4+8+10+8 -> 48 | M34: =+(N34+O34+P34)+0.5*Q34 -> 47.43 | N34: 10.22 | O34: 10.67 | P34: 18.54 | Q34: 16
A35: 32 | B35: Baralz, Jason | C35: DNF | D35: DNF | E35: DNF | F35: DNF | G35: DNF | I35: =+(J35+K35)+0.5*L35 -> 41.78 | J35: 12.71 | K35: 28.07 | L35: 2 | M35: =+(N35+O35+P35)+0.5*Q35 -> 24.94 | N35: 7.08 | O35: 9.58 | P35: 8.28 | Q35: 0
A36: 33 | B36: Feltenberger, Denver | C36: DNF | D36: DNF | E36: DNF | F36: DNF | G36: DNF | I36: =+(J36+K36)+0.5*L36 -> 36.16 | J36: 9.03 | K36: 19.63 | L36: 15 | M36: =+(N36+O36+P36)+0.5*Q36 -> 25.56 | N36: 7.73 | O36: 9.35 | P36: 7.98 | Q36: 1
A37: 34 | B37: Feltenberger, Matt | C37: DNF | D37: DNF | E37: DNF | F37: DNF | G37: DNF | I37: =+(J37+K37)+0.5*L37 -> 40.45 | J37: 20.69 | K37: 19.76 | M37: =+(N37+O37+P37)+0.5*Q37 -> 23.85 | N37: 6.97 | O37: 8.30 | P37: 8.58 | Q37: 0
A38: 35 | B38: Haigh, Nathan | C38: DNF | D38: DNF | E38: DNF | F38: DNF | G38: DNF | I38: =+(J38+K38)+0.5*L38 -> 30.10 | J38: 8.18 | K38: 10.42 | L38: 23 | M38: =+(N38+O38+P38)+0.5*Q38 -> 35.33 | N38: 4.39 | O38: 4.83 | P38: 6.61 | Q38: 39
A39: 36 | B39: Hatch, Perry | C39: DNF | D39: DNF | E39: DNF | F39: DNF | G39: DNF | I39: =+(J39+K39)+0.5*L39 -> 26.24 | J39: 6.97 | K39: 12.77 | L39: 13 | M39: =+(N39+O39+P39)+0.5*Q39 -> 15.00 | N39: 3.99 | O39: 4.71 | P39: 5.80 | Q39: 1
A40: 37 | B40: Johnson, Dixie | C40: DNF | D40: DNF | E40: DNF | F40: DNF | G40: DNF | I40: =+(J40+K40)+0.5*L40 -> 29.92 | J40: 7.63 | K40: 11.79 | L40: 21 | M40: =+(N40+O40+P40)+0.5*Q40 -> 33.60 | N40: 5.65 | O40: 6.30 | P40: 5.65 | Q40: 32
A41: Notes:
A42: - | B42: Remember, the "Fun" Shoot is held on the 1st and 3rd Tuesday of each month ( 6:30 p.m.) at Range Masters.
A43: - | B43: You can use ANY handgun you want, as long as it can be safely drawn from a strong-side holster.
A44: - | B44: IDPA format and scoring.
A45: PD | B45: = Points Down = .5 seconds x Points Down
A46: XX | B46: Indicates that the Points Down value includes some kind of penalty (Procedural Error, Hits on Non-Threat, Misses on Steel, etc.)
A47: (Rev) | B47: = Revolver
A48: DNF | B48: = Did Not Finish