B1: Range Masters "Fun" Shoot | H1: Results for August 17, 2004
A2: Click on Stage # for view of COF
B3: Name (Note) | C3: Shoot Total | D3: Total Points Down
A4: Place | E4: Stage 1 | F4: String 1 | G4: PD | H4: Stage 2 | I4: String 1 | J4: PD | K4: Stage 3 | L4: String 1 | M4: String 2 | N4: String 3 | O4: String 4 | P4: PD
A5: 1 | B5: Young, Ren | C5: =+E5+H5+K5 -> 63.40 | D5: =+G5+J5+P5 -> 19 | E5: =+(F5)+0.5*G5 -> 26.01 | F5: 20.51 | G5: 11 | H5: =+(I5)+0.5*J5 -> 19.56 | I5: 19.56 | J5: 0 | K5: =+(L5+M5+N5+O5)+0.5*P5 -> 17.83 | L5: 1.95 | M5: 2.83 | N5: 2.70 | O5: 6.35 | P5: 8
A6: 2 | B6: Zaccardi, Pat | C6: =+E6+H6+K6 -> 63.43 | D6: =+G6+J6+P6 -> 37 | E6: =+(F6)+0.5*G6 -> 21.60 | F6: 20.10 | G6: 3 | H6: =+(I6)+0.5*J6 -> 27.07 | I6: 13.07 | J6: =1+2+6+4+5+10 -> 28 | K6: =+(L6+M6+N6+O6)+0.5*P6 -> 14.76 | L6: 1.65 | M6: 1.75 | N6: 2.30 | O6: 6.06 | P6: 6
A7: 3 | B7: Dockstader, Jeff | C7: =+E7+H7+K7 -> 67.22 | D7: =+G7+J7+P7 -> 20 | E7: =+(F7)+0.5*G7 -> 29.95 | F7: 25.45 | G7: 9 | H7: =+(I7)+0.5*J7 -> 19.67 | I7: 18.17 | J7: 3 | K7: =+(L7+M7+N7+O7)+0.5*P7 -> 17.60 | L7: 2.05 | M7: 2.37 | N7: 3.10 | O7: 6.08 | P7: 8
A8: 4 | B8: Young, Jason | C8: =+E8+H8+K8 -> 68.73 | D8: =+G8+J8+P8 -> 26 | E8: =+(F8)+0.5*G8 -> 27.60 | F8: 23.10 | G8: 9 | H8: =+(I8)+0.5*J8 -> 21.39 | I8: 19.89 | J8: 3 | K8: =+(L8+M8+N8+O8)+0.5*P8 -> 19.74 | L8: 1.46 | M8: 2.07 | N8: 2.65 | O8: 6.56 | P8: 14
A9: 5 | B9: Redford, "Red" (Rev) | C9: =+E9+H9+K9 -> 74.67 | D9: =+G9+J9+P9 -> 16 | E9: =+(F9)+0.5*G9 -> 32.68 | F9: 31.68 | G9: 2 | H9: =+(I9)+0.5*J9 -> 24.92 | I9: 18.92 | J9: 12 | K9: =+(L9+M9+N9+O9)+0.5*P9 -> 17.07 | L9: 2.15 | M9: 2.89 | N9: 3.78 | O9: 7.25 | P9: 2
A10: 6 | B10: Redford, "Red" | C10: =+E10+H10+K10 -> 75.58 | D10: =+G10+J10+P10 -> 15 | E10: =+(F10)+0.5*G10 -> 34.51 | F10: 31.51 | G10: 6 | H10: =+(I10)+0.5*J10 -> 21.74 | I10: 21.24 | J10: 1 | K10: =+(L10+M10+N10+O10)+0.5*P10 -> 19.33 | L10: 2.02 | M10: 2.57 | N10: 3.37 | O10: 7.37 | P10: 8
A11: 7 | B11: Hood, Neil | C11: =+E11+H11+K11 -> 77.89 | D11: =+G11+J11+P11 -> 13 | E11: =+(F11)+0.5*G11 -> 41.08 | F11: 37.08 | G11: 8 | H11: =+(I11)+0.5*J11 -> 20.04 | I11: 17.54 | J11: 5 | K11: =+(L11+M11+N11+O11)+0.5*P11 -> 16.77 | L11: 2.07 | M11: 2.88 | N11: 4.14 | O11: 7.68 | P11: 0
A12: 8 | B12: Adams, Kyle (Rev) | C12: =+E12+H12+K12 -> 79.79 | D12: =+G12+J12+P12 -> 14 | E12: =+(F12)+0.5*G12 -> 28.70 | F12: 27.70 | G12: 2 | H12: =+(I12)+0.5*J12 -> 33.49 | I12: 30.99 | J12: 5 | K12: =+(L12+M12+N12+O12)+0.5*P12 -> 17.60 | L12: 1.88 | M12: 2.58 | N12: 2.41 | O12: 7.23 | P12: 7
A13: 9 | B13: Taylor, Joshua | C13: =+E13+H13+K13 -> 80.69 | D13: =+G13+J13+P13 -> 4 | E13: =+(F13)+0.5*G13 -> 33.56 | F13: 32.56 | G13: 2 | H13: =+(I13)+0.5*J13 -> 32.57 | I13: 31.57 | J13: 2 | K13: =+(L13+M13+N13+O13)+0.5*P13 -> 14.56 | L13: 2.06 | M13: 2.69 | N13: 3.10 | O13: 6.71 | P13: 0
A14: 10 | B14: Billings, Scott (Rev) | C14: =+E14+H14+K14 -> 89.32 | D14: =+G14+J14+P14 -> 36 | E14: =+(F14)+0.5*G14 -> 46.80 | F14: 39.80 | G14: 14 | H14: =+(I14)+0.5*J14 -> 25.19 | I14: 21.69 | J14: 7 | K14: =+(L14+M14+N14+O14)+0.5*P14 -> 17.33 | L14: 1.59 | M14: 1.75 | N14: 2.11 | O14: 4.38 | P14: 15
A15: 11 | B15: Hill, Randy | C15: =+E15+H15+K15 -> 91.37 | D15: =+G15+J15+P15 -> 29 | E15: =+(F15)+0.5*G15 -> 41.91 | F15: 36.41 | G15: 11 | H15: =+(I15)+0.5*J15 -> 33.51 | I15: 27.51 | J15: 12 | K15: =+(L15+M15+N15+O15)+0.5*P15 -> 15.95 | L15: 1.61 | M15: 2.14 | N15: 3.06 | O15: 6.14 | P15: 6
A16: 12 | B16: Otteson, Sterling | C16: =+E16+H16+K16 -> 91.46 | D16: =+G16+J16+P16 -> 32 | E16: =+(F16)+0.5*G16 -> 35.30 | F16: 33.80 | G16: 3 | H16: =+(I16)+0.5*J16 -> 32.56 | I16: 25.06 | J16: 15 | K16: =+(L16+M16+N16+O16)+0.5*P16 -> 23.60 | L16: 1.78 | M16: 2.91 | N16: 3.73 | O16: 8.18 | P16: 14
A17: 13 | B17: Johnson, Dixie (.22) | C17: =+E17+H17+K17 -> 95.60 | D17: =+G17+J17+P17 -> 30 | E17: =+(F17)+0.5*G17 -> 41.04 | F17: 37.54 | G17: 7 | H17: =+(I17)+0.5*J17 -> 34.10 | I17: 25.60 | J17: 17 | K17: =+(L17+M17+N17+O17)+0.5*P17 -> 20.46 | L17: 2.76 | M17: 3.74 | N17: 3.28 | O17: 7.68 | P17: 6
A18: 14 | B18: DeLeeuw, Dave | C18: =+E18+H18+K18 -> 97.97 | D18: =+G18+J18+P18 -> 5 | E18: =+(F18)+0.5*G18 -> 44.16 | F18: 43.16 | G18: 2 | H18: =+(I18)+0.5*J18 -> 35.92 | I18: 34.92 | J18: 2 | K18: =+(L18+M18+N18+O18)+0.5*P18 -> 17.89 | L18: 2.28 | M18: 2.81 | N18: 3.61 | O18: 8.69 | P18: 1
A19: 15 | B19: Jepperson, Riley | C19: =+E19+H19+K19 -> 98.63 | D19: =+G19+J19+P19 -> 48 | E19: =+(F19)+0.5*G19 -> 47.93 | F19: 32.93 | G19: =1+3+1+3+4+6+10+2 -> 30 | H19: =+(I19)+0.5*J19 -> 33.43 | I19: 27.43 | J19: =4+1+3+3+1 -> 12 | K19: =+(L19+M19+N19+O19)+0.5*P19 -> 17.27 | L19: 2.57 | M19: 2.44 | N19: 2.51 | O19: 6.75 | P19: 6
A20: 16 | B20: Stone, Scott | C20: =+E20+H20+K20 -> 102.59 | D20: =+G20+J20+P20 -> 47 | E20: =+(F20)+0.5*G20 -> 49.08 | F20: 42.08 | G20: =4+3+1+2+4 -> 14 | H20: =+(I20)+0.5*J20 -> 28.04 | I20: 25.54 | J20: 5 | K20: =+(L20+M20+N20+O20)+0.5*P20 -> 25.47 | L20: 1.74 | M20: 1.88 | N20: 2.58 | O20: 5.27 | P20: =6+15+1+6 -> 28
A21: 17 | B21: Carr, Robert | C21: =+E21+H21+K21 -> 103.57 | D21: =+G21+J21+P21 -> 54 | E21: =+(F21)+0.5*G21 -> 42.84 | F21: 34.34 | G21: =3+1+1+4+2+4+2 -> 17 | H21: =+(I21)+0.5*J21 -> 26.02 | I21: 22.02 | J21: 8 | K21: =+(L21+M21+N21+O21)+0.5*P21 -> 34.71 | L21: 2.49 | M21: 2.54 | N21: 3.35 | O21: 11.83 | P21: =6+10+13 -> 29
A22: 18 | B22: Phillips, RDan | C22: =+E22+H22+K22 -> 103.58 | D22: =+G22+J22+P22 -> 7 | E22: =+(F22)+0.5*G22 -> 40.55 | F22: 40.05 | G22: 1 | H22: =+(I22)+0.5*J22 -> 44.67 | I22: 44.67 | J22: 0 | K22: =+(L22+M22+N22+O22)+0.5*P22 -> 18.36 | L22: 1.73 | M22: 2.79 | N22: 3.69 | O22: 7.15 | P22: 6
A23: 19 | B23: Ewin, Don | C23: =+E23+H23+K23 -> 104.21 | D23: =+G23+J23+P23 -> 28 | E23: =+(F23)+0.5*G23 -> 50.36 | F23: 44.36 | G23: 12 | H23: =+(I23)+0.5*J23 -> 32.21 | I23: 28.21 | J23: 8 | K23: =+(L23+M23+N23+O23)+0.5*P23 -> 21.64 | L23: 2.42 | M23: 3.27 | N23: 3.97 | O23: 7.98 | P23: 8
A24: 20 | B24: Hood, Dan | C24: =+E24+H24+K24 -> 111.62 | D24: =+G24+J24+P24 -> 42 | E24: =+(F24)+0.5*G24 -> 50.01 | F24: 42.01 | G24: =1+3+1+3+3+5 -> 16 | H24: =+(I24)+0.5*J24 -> 34.00 | I24: 30.50 | J24: 7 | K24: =+(L24+M24+N24+O24)+0.5*P24 -> 27.61 | L24: 3.55 | M24: 2.91 | N24: 3.48 | O24: 8.17 | P24: 19
A25: 21 | B25: Simons, Brad | C25: =+E25+H25+K25 -> 117.11 | D25: =+G25+J25+P25 -> 36 | E25: =+(F25)+0.5*G25 -> 62.80 | F25: 47.30 | G25: =1+5+5+1+5+6+1+1+6 -> 31 | H25: =+(I25)+0.5*J25 -> 37.70 | I25: 37.20 | J25: 1 | K25: =+(L25+M25+N25+O25)+0.5*P25 -> 16.61 | L25: 2.08 | M25: 2.24 | N25: 2.95 | O25: 7.34 | P25: 4
A26: 22 | B26: Simons, Jordan | C26: =+E26+H26+K26 -> 132.81 | D26: =+G26+J26+P26 -> 108 | E26: =+(F26)+0.5*G26 -> 82.10 | F26: 45.10 | G26: =4+10+10+4+6+6+8+3+10+5+8 -> 74 | H26: =+(I26)+0.5*J26 -> 26.48 | I26: 22.98 | J26: 7 | K26: =+(L26+M26+N26+O26)+0.5*P26 -> 24.23 | L26: 1.86 | M26: 2.00 | N26: 2.48 | O26: 4.39 | P26: 27
A27: 23 | B27: Phillips, Tisha (.22) | C27: =+E27+H27+K27 -> 145.07 | D27: =+G27+J27+P27 -> 25 | E27: =+(F27)+0.5*G27 -> 51.53 | F27: 48.53 | G27: 6 | H27: =+(I27)+0.5*J27 -> 69.43 | I27: 62.93 | J27: 13 | K27: =+(L27+M27+N27+O27)+0.5*P27 -> 24.11 | L27: 1.74 | M27: 7.76 | N27: 3.43 | O27: 8.18 | P27: 6
A28: 24 | B28: Stone, Marylee | C28: =+E28+H28+K28 -> 172.99 | D28: =+G28+J28+P28 -> 106 | E28: =+(F28)+0.5*G28 -> 55.61 | F28: 31.11 | G28: =1+1+5+1+1+5+8+6+6+1+6+8 -> 49 | H28: =+(I28)+0.5*J28 -> 73.69 | I28: 66.19 | J28: =8+5+1+1 -> 15 | K28: =+(L28+M28+N28+O28)+0.5*P28 -> 43.69 | L28: 3.11 | M28: 4.35 | N28: 5.54 | O28: 9.69 | P28: =8+11+23 -> 42
A29: 25 | B29: White, Natalie (.22) | C29: =+E29+H29+K29 -> 229.42 | D29: =+G29+J29+P29 -> 94 | E29: =+(F29)+0.5*G29 -> 96.03 | F29: 74.53 | G29: =5+1+10+2+6+1+8+10 -> 43 | H29: =+(I29)+0.5*J29 -> 100.91 | I29: 86.91 | J29: =6+1+10+1+5+5 -> 28 | K29: =+(L29+M29+N29+O29)+0.5*P29 -> 32.48 | L29: 1.63 | M29: 1.87 | N29: 8.80 | O29: 8.68 | P29: 23
A30: Notes:
A31: - | B31: Remember, the "Fun" Shoot is held on the 1st and 3rd Tuesday of each month ( 6:30 p.m.) at Range Masters.
A32: - | B32: You can use ANY handgun you want, as long as it can be safely drawn from a strong-side holster.
A33: - | B33: IDPA format and scoring.
A34: PD | B34: = Points Down = .5 seconds x Points Down
A35: XX | B35: Indicates that the Points Down value includes some kind of penalty (Procedural Error, Hits on Non-Threat, Misses on Steel, etc.)
A36: (Rev) | B36: = Revolver
A37: DNF | B37: = Did Not Finish