B1: Range Masters "Fun" Shoot | H1: Results for October 5, 2004
A2: Click on Stage # for view of COF
B3: Name (Note) | C3: Shoot Total | D3: Total Points Down
A4: Place | E4: Stage 1 | F4: String 1 | G4: PD | H4: Stage 2 | I4: String 1 | J4: String 2 | K4: String 3 | L4: PD | M4: Stage 3 | N4: String 1 | O4: String 2 | P4: PD
A5: 1 | B5: Collins, Ken | C5: =+E5+H5+M5 -> 67.54 | D5: =+G5+L5+P5 -> 7 | E5: =+(F5)+0.5*G5 -> 20.20 | F5: 19.70 | G5: 1 | H5: =+(I5+J5+K5)+0.5*L5 -> 35.66 | I5: 7.78 | J5: 17.25 | K5: 7.63 | L5: 6 | M5: =+(N5+O5)+0.5*P5 -> 11.68 | N5: 5.60 | O5: 6.08 | P5: 0
A6: 2 | B6: Rodriquez, Mike | C6: =+E6+H6+M6 -> 68.10 | D6: =+G6+L6+P6 -> 30 | E6: =+(F6)+0.5*G6 -> 18.66 | F6: 16.66 | G6: =1+1+1+1 -> 4 | H6: =+(I6+J6+K6)+0.5*L6 -> 32.59 | I6: 5.28 | J6: 7.89 | K6: 6.42 | L6: =3+5+8+10 -> 26 | M6: =+(N6+O6)+0.5*P6 -> 16.85 | N6: 9.06 | O6: 7.79 | P6: 0
A7: 3 | B7: Bradtke, John | C7: =+E7+H7+M7 -> 70.67 | D7: =+G7+L7+P7 -> 6 | E7: =+(F7)+0.5*G7 -> 22.53 | F7: 21.03 | G7: 3 | H7: =+(I7+J7+K7)+0.5*L7 -> 28.10 | I7: 8.16 | J7: 10.73 | K7: 7.71 | L7: 3 | M7: =+(N7+O7)+0.5*P7 -> 20.04 | N7: 11.31 | O7: 8.73 | P7: 0
A8: 4 | B8: Redford, "Red" | C8: =+E8+H8+M8 -> 71.99 | D8: =+G8+L8+P8 -> 7 | E8: =+(F8)+0.5*G8 -> 24.33 | F8: 22.33 | G8: =1+1+1+1 -> 4 | H8: =+(I8+J8+K8)+0.5*L8 -> 30.50 | I8: 8.03 | J8: 11.87 | K8: 9.10 | L8: =1+1+1 -> 3 | M8: =+(N8+O8)+0.5*P8 -> 17.16 | N8: 9.81 | O8: 7.35 | P8: 0
A9: 5 | B9: Young, Ren | C9: =+E9+H9+M9 -> 73.17 | D9: =+G9+L9+P9 -> 24 | E9: =+(F9)+0.5*G9 -> 22.19 | F9: 21.19 | G9: 2 | H9: =+(I9+J9+K9)+0.5*L9 -> 35.41 | I9: 5.40 | J9: 11.36 | K9: 7.65 | L9: =10+1+1+3+1+6 -> 22 | M9: =+(N9+O9)+0.5*P9 -> 15.57 | N9: 6.24 | O9: 9.33 | P9: 0
A10: 6 | B10: Huff, Blake | C10: =+E10+H10+M10 -> 75.41 | D10: =+G10+L10+P10 -> 13 | E10: =+(F10)+0.5*G10 -> 27.93 | F10: 23.93 | G10: =3+2+2+1 -> 8 | H10: =+(I10+J10+K10)+0.5*L10 -> 28.37 | I10: 7.35 | J10: 10.35 | K10: 8.17 | L10: =1+1+3 -> 5 | M10: =+(N10+O10)+0.5*P10 -> 19.11 | N10: 8.98 | O10: 10.13 | P10: 0
A11: 7 | B11: Taylor, Joshua | C11: =+E11+H11+M11 -> 75.75 | D11: =+G11+L11+P11 -> 4 | E11: =+(F11)+0.5*G11 -> 23.52 | F11: 23.02 | G11: 1 | H11: =+(I11+J11+K11)+0.5*L11 -> 35.33 | I11: 9.12 | J11: 15.33 | K11: 9.38 | L11: 3 | M11: =+(N11+O11)+0.5*P11 -> 16.90 | N11: 9.36 | O11: 7.54 | P11: 0
A12: 8 | B12: Stone, Scott | C12: =+E12+H12+M12 -> 75.76 | D12: =+G12+L12+P12 -> 34 | E12: =+(F12)+0.5*G12 -> 28.45 | F12: 22.45 | G12: =6+1+2+3 -> 12 | H12: =+(I12+J12+K12)+0.5*L12 -> 30.21 | I12: 5.99 | J12: 6.78 | K12: 6.44 | L12: =1+3+10+8 -> 22 | M12: =+(N12+O12)+0.5*P12 -> 17.10 | N12: 8.83 | O12: 8.27 | P12: 0
A13: 9 | B13: Hill, Randy | C13: =+E13+H13+M13 -> 82.45 | D13: =+G13+L13+P13 -> 28 | E13: =+(F13)+0.5*G13 -> 22.07 | F13: 19.07 | G13: =1+1+4 -> 6 | H13: =+(I13+J13+K13)+0.5*L13 -> 37.78 | I13: 8.92 | J13: 9.94 | K13: 7.92 | L13: =10+2+2+5+3 -> 22 | M13: =+(N13+O13)+0.5*P13 -> 22.60 | N13: 14.26 | O13: 8.34 | P13: 0
A14: 10 | B14: Scott, Alan | C14: =+E14+H14+M14 -> 87.77 | D14: =+G14+L14+P14 -> 28 | E14: =+(F14)+0.5*G14 -> 27.84 | F14: 24.34 | G14: =1+1+5 -> 7 | H14: =+(I14+J14+K14)+0.5*L14 -> 39.36 | I14: 10.22 | J14: 9.81 | K14: 8.83 | L14: =5+4+1+7+4 -> 21 | M14: =+(N14+O14)+0.5*P14 -> 20.57 | N14: 7.92 | O14: 12.65 | P14: 0
A15: 11 | B15: Adams, Kyle | C15: =+E15+H15+M15 -> 89.25 | D15: =+G15+L15+P15 -> 28 | E15: =+(F15)+0.5*G15 -> 29.47 | F15: 22.47 | G15: =1+2+1+5+5 -> 14 | H15: =+(I15+J15+K15)+0.5*L15 -> 39.10 | I15: 9.37 | J15: 12.20 | K15: 10.53 | L15: =5+5+1+3 -> 14 | M15: =+(N15+O15)+0.5*P15 -> 20.68 | N15: 13.60 | O15: 7.08 | P15: 0
A16: 12 | B16: Phillips, RDan | C16: =+E16+H16+M16 -> 89.79 | D16: =+G16+L16+P16 -> 19 | E16: =+(F16)+0.5*G16 -> 32.60 | F16: 29.60 | G16: =5+1 -> 6 | H16: =+(I16+J16+K16)+0.5*L16 -> 31.98 | I16: 8.23 | J16: 8.14 | K16: 9.11 | L16: =1+3+9 -> 13 | M16: =+(N16+O16)+0.5*P16 -> 25.21 | N16: 12.82 | O16: 12.39 | P16: 0
A17: 13 | B17: DeLeeuw, Dave | C17: =+E17+H17+M17 -> 92.16 | D17: =+G17+L17+P17 -> 19 | E17: =+(F17)+0.5*G17 -> 31.26 | F17: 26.26 | G17: 10 | H17: =+(I17+J17+K17)+0.5*L17 -> 43.73 | I17: 11.89 | J17: 18.38 | K17: 8.96 | L17: =5+2+2 -> 9 | M17: =+(N17+O17)+0.5*P17 -> 17.17 | N17: 8.46 | O17: 8.71 | P17: 0
A18: 14 | B18: Simpson, Harold | C18: =+E18+H18+M18 -> 94.96 | D18: =+G18+L18+P18 -> 28 | E18: =+(F18)+0.5*G18 -> 37.85 | F18: 32.85 | G18: =3+1+6 -> 10 | H18: =+(I18+J18+K18)+0.5*L18 -> 40.52 | I18: 10.78 | J18: 10.77 | K18: 9.97 | L18: =3+8+5+2 -> 18 | M18: =+(N18+O18)+0.5*P18 -> 16.59 | N18: 9.33 | O18: 7.26 | P18: 0
A19: 15 | B19: Ottesen, Sterling | C19: =+E19+H19+M19 -> 96.40 | D19: =+G19+L19+P19 -> 25 | E19: =+(F19)+0.5*G19 -> 36.87 | F19: 32.37 | G19: =2+2+5 -> 9 | H19: =+(I19+J19+K19)+0.5*L19 -> 38.77 | I19: 8.29 | J19: 12.24 | K19: 10.24 | L19: =5+4+7 -> 16 | M19: =+(N19+O19)+0.5*P19 -> 20.76 | N19: 10.37 | O19: 10.39 | P19: 0
A20: 16 | B20: Redford, Noel | C20: =+E20+H20+M20 -> 108.42 | D20: =+G20+L20+P20 -> 65 | E20: =+(F20)+0.5*G20 -> 34.79 | F20: 25.29 | G20: =1+1+6+6+5 -> 19 | H20: =+(I20+J20+K20)+0.5*L20 -> 51.46 | I20: 9.61 | J20: 9.15 | K20: 9.70 | L20: =10+5+6+12+13 -> 46 | M20: =+(N20+O20)+0.5*P20 -> 22.17 | N20: 9.18 | O20: 12.99 | P20: 0
A21: 17 | B21: Scott, Michael | C21: =+E21+H21+M21 -> 108.63 | D21: =+G21+L21+P21 -> 43 | E21: =+(F21)+0.5*G21 -> 33.35 | F21: 27.85 | G21: =4+1+3+3 -> 11 | H21: =+(I21+J21+K21)+0.5*L21 -> 42.13 | I21: 10.06 | J21: 9.00 | K21: 7.07 | L21: =10+2+2+7+11 -> 32 | M21: =+(N21+O21)+0.5*P21 -> 33.15 | N21: 24.33 | O21: 8.82 | P21: 0
A22: 18 | B22: Simons, Jordan | C22: =+E22+H22+M22 -> 152.37 | D22: =+G22+L22+P22 -> 54 | E22: =+(F22)+0.5*G22 -> 44.81 | F22: 39.81 | G22: =3+6+1 -> 10 | H22: =+(I22+J22+K22)+0.5*L22 -> 51.64 | I22: 10.80 | J22: 10.38 | K22: 8.46 | L22: =20+1+3+3+17 -> 44 | M22: =+(N22+O22)+0.5*P22 -> 55.92 | N22: 31.61 | O22: 24.31 | P22: 0
A23: 19 | B23: Hoyt, David | C23: =+E23+H23+M23 -> 175.27 | D23: =+G23+L23+P23 -> 87 | E23: =+(F23)+0.5*G23 -> 43.09 | F23: 24.09 | G23: =10+1+1+6+5+5                               +10 -> 38 | H23: =+(I23+J23+K23)+0.5*L23 -> 58.11 | I23: 12.60 | J23: 14.36 | K23: 11.65 | L23: =10+7+5+9+8 -> 39 | M23: =+(N23+O23)+0.5*P23 -> 74.07 | N23: 36.49 | O23: 32.58 | P23: 10
A24: 20 | B24: Simons, Brad | C24: =+E24+H24+M24 -> 181.31 | D24: =+G24+L24+P24 -> 92 | E24: =+(F24)+0.5*G24 -> 38.09 | F24: 33.59 | G24: =1+6+1+1 -> 9 | H24: =+(I24+J24+K24)+0.5*L24 -> 67.15 | I24: 7.77 | J24: 15.41 | K24: 12.47 | L24: =20+5+14+9+15 -> 63 | M24: =+(N24+O24)+0.5*P24 -> 76.07 | N24: 36.70 | O24: 29.37 | P24: 20
A25: 21 | B25: Schmidt, Guy | C25: =+E25+H25+M25 -> 187.99 | D25: =+G25+L25+P25 -> 36 | E25: =+(F25)+0.5*G25 -> 38.74 | F25: 36.74 | G25: =1+2+1 -> 4 | H25: =+(I25+J25+K25)+0.5*L25 -> 72.83 | I25: 16.03 | J25: 24.63 | K25: 21.17 | L25: =4+3+6+9 -> 22 | M25: =+(N25+O25)+0.5*P25 -> 76.42 | N25: 15.14 | O25: 56.28 | P25: 10
A26: Notes:
A27: - | B27: Remember, the "Fun" Shoot is held on the 1st and 3rd Tuesday of each month ( 6:30 p.m.) at Range Masters.
A28: - | B28: You can use ANY handgun you want, as long as it can be safely drawn from a strong-side holster.
A29: - | B29: IDPA format and scoring.
A30: PD | B30: = Points Down = .5 seconds x Points Down
A31: XX | B31: Indicates that the Points Down value includes some kind of penalty (Procedural Error, Hits on Non-Threat, Misses on Steel, etc.)
A32: (Rev) | B32: = Revolver
A33: DNF | B33: = Did Not Finish