B1: Range Masters "Fun" Shoot | H1: Results for September 22, 2004
A2: Click on Stage # for view of COF
B3: Name (Note) | C3: Shoot Total | D3: Total Points Down
A4: Place | E4: Stage 1 | F4: String 1 | G4: PD | H4: Stage 2 | I4: String 1 | J4: PD | K4: Stage 3 | L4: String 1 | M4: String 2 | N4: PD
A5: 1 | B5: Collins, Ken | C5: =+E5+H5+K5 -> 48.33 | D5: =+G5+J5+N5 -> 9 | E5: =+(F5)+0.5*G5 -> 18.27 | F5: 17.27 | G5: 2 | H5: =+(I5)+0.5*J5 -> 13.05 | I5: 11.05 | J5: 4 | K5: =+(L5+M5)+0.5*N5 -> 17.01 | L5: 8.12 | M5: 7.39 | N5: 3
A6: 2 | B6: Young, Ren | C6: =+E6+H6+K6 -> 58.66 | D6: =+G6+J6+N6 -> 33 | E6: =+(F6)+0.5*G6 -> 22.85 | F6: 15.85 | G6: =1+4+1+2+1+3+2 -> 14 | H6: =+(I6)+0.5*J6 -> 15.10 | I6: 13.60 | J6: 3 | K6: =+(L6+M6)+0.5*N6 -> 20.71 | L6: 6.29 | M6: 6.42 | N6: =2+9+5 -> 16
A7: 3 | B7: Taylor, Joshua | C7: =+E7+H7+K7 -> 65.62 | D7: =+G7+J7+N7 -> 3 | E7: =+(F7)+0.5*G7 -> 28.36 | F7: 27.36 | G7: 2 | H7: =+(I7)+0.5*J7 -> 18.18 | I7: 17.68 | J7: 1 | K7: =+(L7+M7)+0.5*N7 -> 19.08 | L7: 9.01 | M7: 10.07 | N7: 0
A8: 4 | B8: Outzen, Craig | C8: =+E8+H8+K8 -> 68.43 | D8: =+G8+J8+N8 -> 16 | E8: =+(F8)+0.5*G8 -> 27.06 | F8: 23.56 | G8: =3+2+1+1 -> 7 | H8: =+(I8)+0.5*J8 -> 19.79 | I8: 18.79 | J8: 2 | K8: =+(L8+M8)+0.5*N8 -> 21.58 | L8: 7.11 | M8: 10.97 | N8: 7
A9: 5 | B9: Stilwell, Mike | C9: =+E9+H9+K9 -> 69.53 | D9: =+G9+J9+N9 -> 33 | E9: =+(F9)+0.5*G9 -> 30.12 | F9: 21.62 | G9: =1+8+1+2+5 -> 17 | H9: =+(I9)+0.5*J9 -> 19.08 | I9: 16.58 | J9: 5 | K9: =+(L9+M9)+0.5*N9 -> 20.33 | L9: 6.84 | M9: 7.99 | N9: 11
A10: 6 | B10: Zaccardi, Juke | C10: =+E10+H10+K10 -> 74.76 | D10: =+G10+J10+N10 -> 31 | E10: =+(F10)+0.5*G10 -> 29.70 | F10: 20.70 | G10: =1+1+2+2+2+1+5+2+2 -> 18 | H10: =+(I10)+0.5*J10 -> 20.96 | I10: 18.96 | J10: 4 | K10: =+(L10+M10)+0.5*N10 -> 24.10 | L10: 7.13 | M10: 12.47 | N10: 9
A11: 7 | B11: Redford, Kent | C11: =+E11+H11+K11 -> 82.00 | D11: =+G11+J11+N11 -> 24 | E11: =+(F11)+0.5*G11 -> 39.31 | F11: 30.81 | G11: =1+1+3+2+2+4+4 -> 17 | H11: =+(I11)+0.5*J11 -> 22.97 | I11: 21.47 | J11: 3 | K11: =+(L11+M11)+0.5*N11 -> 19.72 | L11: 9.32 | M11: 8.40 | N11: 4
A12: 8 | B12: Zaccardi, Pat | C12: =+E12+H12+K12 -> 82.91 | D12: =+G12+J12+N12 -> 35 | E12: =+(F12)+0.5*G12 -> 28.56 | F12: 21.56 | G12: =2+2+2+4+1+1+1+1 -> 14 | H12: =+(I12)+0.5*J12 -> 26.01 | I12: 23.01 | J12: 6 | K12: =+(L12+M12)+0.5*N12 -> 28.34 | L12: 8.43 | M12: 12.41 | N12: =3+8+4 -> 15
A13: 9 | B13: Dockstader, Jeff | C13: =+E13+H13+K13 -> 87.78 | D13: =+G13+J13+N13 -> 57 | E13: =+(F13)+0.5*G13 -> 32.81 | F13: 18.81 | G13: =4+2+10+1+4+1+2+4 -> 28 | H13: =+(I13)+0.5*J13 -> 32.51 | I13: 25.01 | J13: 15 | K13: =+(L13+M13)+0.5*N13 -> 22.46 | L13: 9.02 | M13: 6.44 | N13: 14
A14: 10 | B14: Stone, Scott | C14: =+E14+H14+K14 -> 87.85 | D14: =+G14+J14+N14 -> 49 | E14: =+(F14)+0.5*G14 -> 37.90 | F14: 27.40 | G14: =3+1+1+4+2+8+1+1 -> 21 | H14: =+(I14)+0.5*J14 -> 26.53 | I14: 21.53 | J14: =2+1+5+2 -> 10 | K14: =+(L14+M14)+0.5*N14 -> 23.42 | L14: 8.38 | M14: 6.04 | N14: =3+3+12 -> 18
A15: 11 | B15: Adams, Kyle (Rev) | C15: =+E15+H15+K15 -> 90.28 | D15: =+G15+J15+N15 -> 21 | E15: =+(F15)+0.5*G15 -> 31.21 | F15: 27.71 | G15: 7 | H15: =+(I15)+0.5*J15 -> 28.94 | I15: 24.94 | J15: 8 | K15: =+(L15+M15)+0.5*N15 -> 30.13 | L15: 14.22 | M15: 12.91 | N15: 6
A16: 12 | B16: Thomas, Kevin | C16: =+E16+H16+K16 -> 90.31 | D16: =+G16+J16+N16 -> 22 | E16: =+(F16)+0.5*G16 -> 35.71 | F16: 28.71 | G16: =3+1+1+2+6+1 -> 14 | H16: =+(I16)+0.5*J16 -> 30.05 | I16: 29.55 | J16: 1 | K16: =+(L16+M16)+0.5*N16 -> 24.55 | L16: 9.66 | M16: 11.39 | N16: 7
A17: 13 | B17: Hill, Randy | C17: =+E17+H17+K17 -> 93.41 | D17: =+G17+J17+N17 -> 26 | E17: =+(F17)+0.5*G17 -> 35.01 | F17: 29.51 | G17: =1+2+1+3+4 -> 11 | H17: =+(I17)+0.5*J17 -> 30.01 | I17: 27.01 | J17: 6 | K17: =+(L17+M17)+0.5*N17 -> 28.39 | L17: 13.36 | M17: 10.53 | N17: 9
A18: 14 | B18: Redford, "Red" (Rev) | C18: =+E18+H18+K18 -> 94.59 | D18: =+G18+J18+N18 -> 28 | E18: =+(F18)+0.5*G18 -> 35.27 | F18: 23.27 | G18: =1+4+5+6+1+4+1+2 -> 24 | H18: =+(I18)+0.5*J18 -> 28.41 | I18: 27.91 | J18: 1 | K18: =+(L18+M18)+0.5*N18 -> 30.91 | L18: 14.99 | M18: 14.42 | N18: 3
A19: 15 | B19: Simpson, Harold | C19: =+E19+H19+K19 -> 94.96 | D19: =+G19+J19+N19 -> 41 | E19: =+(F19)+0.5*G19 -> 37.22 | F19: 24.72 | G19: =1+5+5+1+10+1+2 -> 25 | H19: =+(I19)+0.5*J19 -> 28.69 | I19: 27.19 | J19: 3 | K19: =+(L19+M19)+0.5*N19 -> 29.05 | L19: 13.21 | M19: 9.34 | N19: 13
A20: 16 | B20: Lyon, Jared | C20: =+E20+H20+K20 -> 94.96 | D20: =+G20+J20+N20 -> 53 | E20: =+(F20)+0.5*G20 -> 34.63 | F20: 20.63 | G20: =4+1+6+4+2+2+8+1 -> 28 | H20: =+(I20)+0.5*J20 -> 27.95 | I20: 25.95 | J20: 4 | K20: =+(L20+M20)+0.5*N20 -> 32.38 | L20: 10.66 | M20: 11.22 | N20: 21
A21: 17 | B21: Brown, Michael | C21: =+E21+H21+K21 -> 95.73 | D21: =+G21+J21+N21 -> 40 | E21: =+(F21)+0.5*G21 -> 32.20 | F21: 24.20 | G21: =6+2+1+1+4+2 -> 16 | H21: =+(I21)+0.5*J21 -> 33.13 | I21: 32.63 | J21: 1 | K21: =+(L21+M21)+0.5*N21 -> 30.40 | L21: 9.40 | M21: 9.50 | N21: =8+8+7 -> 23
A22: 18 | B22: Scott, Alan | C22: =+E22+H22+K22 -> 96.51 | D22: =+G22+J22+N22 -> 26 | E22: =+(F22)+0.5*G22 -> 40.83 | F22: 31.33 | G22: =3+1+1+3+1+4+5+1 -> 19 | H22: =+(I22)+0.5*J22 -> 36.04 | I22: 34.54 | J22: 3 | K22: =+(L22+M22)+0.5*N22 -> 19.64 | L22: 8.55 | M22: 9.09 | N22: 4
A23: 19 | B23: Stoddard, Paul | C23: =+E23+H23+K23 -> 100.16 | D23: =+G23+J23+N23 -> 29 | E23: =+(F23)+0.5*G23 -> 36.23 | F23: 26.23 | G23: =5+1+1+1+1+6+4+1 -> 20 | H23: =+(I23)+0.5*J23 -> 34.38 | I23: 30.88 | J23: 7 | K23: =+(L23+M23)+0.5*N23 -> 29.55 | L23: 13.49 | M23: 15.06 | N23: 2
A24: 20 | B24: DeLeeuw, Dave | C24: =+E24+H24+K24 -> 103.79 | D24: =+G24+J24+N24 -> 12 | E24: =+(F24)+0.5*G24 -> 39.07 | F24: 35.07 | G24: 8 | H24: =+(I24)+0.5*J24 -> 38.58 | I24: 38.08 | J24: 1 | K24: =+(L24+M24)+0.5*N24 -> 26.14 | L24: 13.31 | M24: 11.33 | N24: 3
A25: 21 | B25: Huff, Blake (Rev) | C25: =+E25+H25+K25 -> 104.69 | D25: =+G25+J25+N25 -> 57 | E25: =+(F25)+0.5*G25 -> 41.41 | F25: 23.41 | G25: =8+8+6+4+1+2+6+1 -> 36 | H25: =+(I25)+0.5*J25 -> 30.05 | I25: 29.05 | J25: 2 | K25: =+(L25+M25)+0.5*N25 -> 33.23 | L25: 12.17 | M25: 11.56 | N25: 19
A26: 22 | B26: Phillips, RDan | C26: =+E26+H26+K26 -> 106.80 | D26: =+G26+J26+N26 -> 24 | E26: =+(F26)+0.5*G26 -> 42.58 | F26: 38.08 | G26: 9 | H26: =+(I26)+0.5*J26 -> 34.21 | I26: 32.21 | J26: 4 | K26: =+(L26+M26)+0.5*N26 -> 30.01 | L26: 12.25 | M26: 12.26 | N26: 11
A27: 23 | B27: Hatch, Perri | C27: =+E27+H27+K27 -> 108.81 | D27: =+G27+J27+N27 -> 50 | E27: =+(F27)+0.5*G27 -> 45.37 | F27: 27.37 | G27: =3+2+4+8+4+6+8+1 -> 36 | H27: =+(I27)+0.5*J27 -> 42.34 | I27: 38.84 | J27: 7 | K27: =+(L27+M27)+0.5*N27 -> 21.10 | L27: 10.71 | M27: 6.89 | N27: 7
A28: 24 | B28: Adams, Cody | C28: =+E28+H28+K28 -> 129.31 | D28: =+G28+J28+N28 -> 49 | E28: =+(F28)+0.5*G28 -> 51.53 | F28: 37.53 | G28: =6+3+3+4+1+4+4+3 -> 28 | H28: =+(I28)+0.5*J28 -> 46.07 | I28: 44.07 | J28: 4 | K28: =+(L28+M28)+0.5*N28 -> 31.71 | L28: 11.75 | M28: 11.46 | N28: 17
A29: 25 | B29: Jepperson, Riley | C29: =+E29+H29+K29 -> 136.27 | D29: =+G29+J29+N29 -> 136 | E29: =+(F29)+0.5*G29 -> 48.93 | F29: 23.93 | G29: =8+8+6+4+6+4+10+4 -> 50 | H29: =+(I29)+0.5*J29 -> 53.23 | I29: 28.73 | J29: =1+6+2+30+10 -> 49 | K29: =+(L29+M29)+0.5*N29 -> 34.11 | L29: 10.59 | M29: 5.02 | N29: =15+12+10 -> 37
A30: 26 | B30: Rodrigues, Samuel | C30: =+E30+H30+K30 -> 141.02 | D30: =+G30+J30+N30 -> 105 | E30: =+(F30)+0.5*G30 -> 43.88 | F30: 27.38 | G30: =2+2+1+10+1+5+2+10 -> 33 | H30: =+(I30)+0.5*J30 -> 41.71 | I30: 27.71 | J30: 28 | K30: =+(L30+M30)+0.5*N30 -> 55.43 | L30: 16.40 | M30: 17.03 | N30: =15+16+13 -> 44
A31: 27 | B31: Hoyt, David | C31: =+E31+H31+K31 -> 155.82 | D31: =+G31+J31+N31 -> 95 | E31: =+(F31)+0.5*G31 -> 49.92 | F31: 32.92 | G31: =5+8+4+3+5+3+4+2 -> 34 | H31: =+(I31)+0.5*J31 -> 56.12 | I31: 54.12 | J31: 4 | K31: =+(L31+M31)+0.5*N31 -> 49.78 | L31: 10.27 | M31: 11.01 | N31: =22+15+20 -> 57
A32: 28 | B32: Facer, David | C32: =+E32+H32+K32 -> 157.31 | D32: =+G32+J32+N32 -> 20 | E32: =+(F32)+0.5*G32 -> 71.36 | F32: 62.86 | G32: 17 | H32: =+(I32)+0.5*J32 -> 51.75 | I32: 50.25 | J32: 3 | K32: =+(L32+M32)+0.5*N32 -> 34.20 | L32: 17.08 | M32: 17.12 | N32: 0
A33: 29 | B33: Carr, Robert (Rev) | C33: =+E33+H33+K33 -> 203.59 | D33: =+G33+J33+N33 -> 71 | E33: =+(F33)+0.5*G33 -> 68.36 | F33: 47.86 | G33: =3+6+4+5+8+8+6+1 -> 41 | H33: =+(I33)+0.5*J33 -> 82.75 | I33: 73.25 | J33: =3+4+2+10 -> 19 | K33: =+(L33+M33)+0.5*N33 -> 52.48 | L33: 23.97 | M33: 23.01 | N33: 11
A34: 30 | B34: Filho, Jonas | C34: =+E34+H34+K34 -> 271.74 | D34: =+G34+J34+N34 -> 179 | E34: =+(F34)+0.5*G34 -> 88.67 | F34: 53.67 | G34: =10+8+10+10+6+10+10+6 -> 70 | H34: =+(I34)+0.5*J34 -> 86.83 | I34: 58.33 | J34: =5+4+4+4+40 -> 57 | K34: =+(L34+M34)+0.5*N34 -> 96.24 | L34: 44.68 | M34: 25.56 | N34: =24+17+11 -> 52
A35: Notes:
A36: - | B36: Remember, the "Fun" Shoot is held on the 1st and 3rd Tuesday of each month ( 6:30 p.m.) at Range Masters.
A37: - | B37: You can use ANY handgun you want, as long as it can be safely drawn from a strong-side holster.
A38: - | B38: IDPA format and scoring.
A39: PD | B39: = Points Down = .5 seconds x Points Down
A40: XX | B40: Indicates that the Points Down value includes some kind of penalty (Procedural Error, Hits on Non-Threat, Misses on Steel, etc.)
A41: (Rev) | B41: = Revolver
A42: DNF | B42: = Did Not Finish