B1: Range Masters "Fun" Shoot | H1: Results for April 20, 2004
A2: Click on Stage # for view of COF
B3: Name (Note) | C3: Shoot Total | D3: Total Points Down
A4: Place | E4: Stage 1 | F4: String 1 | G4: PD | H4: Stage 2 | I4: String 1 | J4: String 2 | K4: PD | L4: Stage 3 | M4: String 1 | N4: String 2 | O4: String 3 | P4: PD
A5: 1 | B5: Collins, Ken | C5: =+E5+H5+L5 -> 54.84 | D5: =+G5+K5+P5 -> 6 | E5: =+(F5)+0.5*G5 -> 21.62 | F5: 21.62 | G5: 0 | H5: =+(I5+J5)+0.5*K5 -> 23.65 | I5: 11.37 | J5: 9.28 | K5: 6 | L5: =+(M5+N5+O5)+0.5*P5 -> 9.57 | M5: 2.36 | N5: 2.76 | O5: 4.45 | P5: 0
A6: 2 | B6: Zaccardi, Pat | C6: =+E6+H6+L6 -> 59.34 | D6: =+G6+K6+P6 -> 13 | E6: =+(F6)+0.5*G6 -> 23.59 | F6: 21.09 | G6: 5 | H6: =+(I6+J6)+0.5*K6 -> 24.85 | I6: 10.67 | J6: 11.18 | K6: 6 | L6: =+(M6+N6+O6)+0.5*P6 -> 10.90 | M6: 1.48 | N6: 3.50 | O6: 4.92 | P6: 2
A7: 3 | B7: Stilwell, Mike | C7: =+E7+H7+L7 -> 60.59 | D7: =+G7+K7+P7 -> 8 | E7: =+(F7)+0.5*G7 -> 25.96 | F7: 23.96 | G7: 4 | H7: =+(I7+J7)+0.5*K7 -> 23.66 | I7: 12.26 | J7: 10.90 | K7: 1 | L7: =+(M7+N7+O7)+0.5*P7 -> 10.97 | M7: 2.22 | N7: 3.07 | O7: 4.18 | P7: 3
A8: 4 | B8: Young, Jason | C8: =+E8+H8+L8 -> 61.95 | D8: =+G8+K8+P8 -> 33 | E8: =+(F8)+0.5*G8 -> 25.61 | F8: 18.61 | G8: 14 | H8: =+(I8+J8)+0.5*K8 -> 25.77 | I8: 8.24 | J8: 10.03 | K8: 15 | L8: =+(M8+N8+O8)+0.5*P8 -> 10.57 | M8: 2.36 | N8: 1.73 | O8: 4.48 | P8: 4
A9: 5 | B9: Hatch, Perry (9) | C9: =+E9+H9+L9 -> 64.74 | D9: =+G9+K9+P9 -> 23 | E9: =+(F9)+0.5*G9 -> 26.88 | F9: 22.38 | G9: 9 | H9: =+(I9+J9)+0.5*K9 -> 27.07 | I9: 13.61 | J9: 9.46 | K9: 8 | L9: =+(M9+N9+O9)+0.5*P9 -> 10.79 | M9: 2.06 | N9: 2.44 | O9: 3.29 | P9: 6
A10: 6 | B10: Rodriquez, Mike | C10: =+E10+H10+L10 -> 66.44 | D10: =+G10+K10+P10 -> 27 | E10: =+(F10)+0.5*G10 -> 26.33 | F10: 21.83 | G10: 9 | H10: =+(I10+J10)+0.5*K10 -> 28.66 | I10: 10.43 | J10: 11.23 | K10: 14 | L10: =+(M10+N10+O10)+0.5*P10 -> 11.45 | M10: 2.35 | N10: 2.78 | O10: 4.32 | P10: 4
A11: 7 | B11: Harmon, Benjamin | C11: =+E11+H11+L11 -> 67.72 | D11: =+G11+K11+P11 -> 7 | E11: =+(F11)+0.5*G11 -> 27.51 | F11: 26.01 | G11: 3 | H11: =+(I11+J11)+0.5*K11 -> 25.33 | I11: 13.44 | J11: 11.39 | K11: 1 | L11: =+(M11+N11+O11)+0.5*P11 -> 14.88 | M11: 3.25 | N11: 4.13 | O11: 6.00 | P11: 3
A12: 8 | B12: Zaccardi, Juke | C12: =+E12+H12+L12 -> 68.71 | D12: =+G12+K12+P12 -> 21 | E12: =+(F12)+0.5*G12 -> 30.52 | F12: 26.52 | G12: 8 | H12: =+(I12+J12)+0.5*K12 -> 26.50 | I12: 9.99 | J12: 10.01 | K12: 13 | L12: =+(M12+N12+O12)+0.5*P12 -> 11.69 | M12: 2.86 | N12: 3.58 | O12: 5.25 | P12: 0
A13: 9 | B13: Adams, Kyle | C13: =+E13+H13+L13 -> 73.83 | D13: =+G13+K13+P13 -> 9 | E13: =+(F13)+0.5*G13 -> 25.62 | F13: 22.12 | G13: 7 | H13: =+(I13+J13)+0.5*K13 -> 32.74 | I13: 15.50 | J13: 16.74 | K13: 1 | L13: =+(M13+N13+O13)+0.5*P13 -> 15.47 | M13: 3.93 | N13: 3.95 | O13: 7.09 | P13: 1
A14: 10 | B14: Hatch, Perry (4) | C14: =+E14+H14+L14 -> 75.35 | D14: =+G14+K14+P14 -> 20 | E14: =+(F14)+0.5*G14 -> 35.88 | F14: 33.88 | G14: 4 | H14: =+(I14+J14)+0.5*K14 -> 31.31 | I14: 12.74 | J14: 10.57 | K14: 16 | L14: =+(M14+N14+O14)+0.5*P14 -> 8.16 | M14: 2.28 | N14: 2.33 | O14: 3.55 | P14: 0
A15: 11 | B15: Loveless, Gerald (.22) | C15: =+E15+H15+L15 -> 76.59 | D15: =+G15+K15+P15 -> 13 | E15: =+(F15)+0.5*G15 -> 28.81 | F15: 27.81 | G15: 2 | H15: =+(I15+J15)+0.5*K15 -> 36.32 | I15: 17.35 | J15: 13.97 | K15: 10 | L15: =+(M15+N15+O15)+0.5*P15 -> 11.46 | M15: 2.84 | N15: 2.99 | O15: 5.13 | P15: 1
A16: 12 | B16: Scott, Alan | C16: =+E16+H16+L16 -> 77.42 | D16: =+G16+K16+P16 -> 16 | E16: =+(F16)+0.5*G16 -> 30.15 | F16: 28.15 | G16: 4 | H16: =+(I16+J16)+0.5*K16 -> 32.69 | I16: 13.85 | J16: 12.84 | K16: 12 | L16: =+(M16+N16+O16)+0.5*P16 -> 14.58 | M16: 4.08 | N16: 4.42 | O16: 6.08 | P16: 0
A17: 13 | B17: Redford, Noel | C17: =+E17+H17+L17 -> 82.96 | D17: =+G17+K17+P17 -> 24 | E17: =+(F17)+0.5*G17 -> 31.55 | F17: 30.05 | G17: 3 | H17: =+(I17+J17)+0.5*K17 -> 33.90 | I17: 10.05 | J17: 16.85 | K17: 14 | L17: =+(M17+N17+O17)+0.5*P17 -> 17.51 | M17: 3.00 | N17: 3.99 | O17: 7.02 | P17: 7
A18: 14 | B18: Loveless, Doug | C18: =+E18+H18+L18 -> 84.12 | D18: =+G18+K18+P18 -> 27 | E18: =+(F18)+0.5*G18 -> 35.40 | F18: 31.40 | G18: 8 | H18: =+(I18+J18)+0.5*K18 -> 33.29 | I18: 13.97 | J18: 12.82 | K18: 13 | L18: =+(M18+N18+O18)+0.5*P18 -> 15.43 | M18: 3.39 | N18: 3.40 | O18: 5.64 | P18: 6
A19: 15 | B19: Young, Ren | C19: =+E19+H19+L19 -> 84.12 | D19: =+G19+K19+P19 -> 26 | E19: =+(F19)+0.5*G19 -> 29.69 | F19: 28.69 | G19: 2 | H19: =+(I19+J19)+0.5*K19 -> 40.40 | I19: 16.03 | J19: 15.37 | K19: 18 | L19: =+(M19+N19+O19)+0.5*P19 -> 14.03 | M19: 2.75 | N19: 2.84 | O19: 5.44 | P19: 6
A20: 16 | B20: Billings, Scott | C20: =+E20+H20+L20 -> 88.51 | D20: =+G20+K20+P20 -> 27 | E20: =+(F20)+0.5*G20 -> 32.94 | F20: 30.44 | G20: 5 | H20: =+(I20+J20)+0.5*K20 -> 40.06 | I20: 13.49 | J20: 16.07 | K20: 21 | L20: =+(M20+N20+O20)+0.5*P20 -> 15.51 | M20: 3.49 | N20: 4.91 | O20: 6.61 | P20: 1
A21: 17 | B21: Scott, Michael | C21: =+E21+H21+L21 -> 95.09 | D21: =+G21+K21+P21 -> 10 | E21: =+(F21)+0.5*G21 -> 43.27 | F21: 39.77 | G21: 7 | H21: =+(I21+J21)+0.5*K21 -> 32.05 | I21: 15.77 | J21: 14.78 | K21: 3 | L21: =+(M21+N21+O21)+0.5*P21 -> 19.77 | M21: 4.26 | N21: 4.25 | O21: 11.26 | P21: 0
A22: 18 | B22: Walker, Ron | C22: =+E22+H22+L22 -> 104.38 | D22: =+G22+K22+P22 -> 35 | E22: =+(F22)+0.5*G22 -> 38.78 | F22: 35.78 | G22: 6 | H22: =+(I22+J22)+0.5*K22 -> 41.94 | I22: 17.69 | J22: 19.75 | K22: 9 | L22: =+(M22+N22+O22)+0.5*P22 -> 23.66 | M22: 3.58 | N22: 3.83 | O22: 6.25 | P22: 20
A23: 19 | B23: Lambke, Patrick | C23: =+E23+H23+L23 -> 127.47 | D23: =+G23+K23+P23 -> 57 | E23: =+(F23)+0.5*G23 -> 56.66 | F23: 38.66 | G23: 36 | H23: =+(I23+J23)+0.5*K23 -> 50.16 | I23: 24.51 | J23: 21.15 | K23: 9 | L23: =+(M23+N23+O23)+0.5*P23 -> 20.65 | M23: 3.91 | N23: 4.15 | O23: 6.59 | P23: 12
A24: 20 | B24: Simons, Brad | C24: =+E24+H24+L24 -> 131.16 | D24: =+G24+K24+P24 -> 48 | E24: =+(F24)+0.5*G24 -> 66.16 | F24: 57.16 | G24: 18 | H24: =+(I24+J24)+0.5*K24 -> 40.65 | I24: 17.25 | J24: 16.90 | K24: 13 | L24: =+(M24+N24+O24)+0.5*P24 -> 24.35 | M24: 3.17 | N24: 5.44 | O24: 7.24 | P24: 17
A25: 21 | B25: Redford, Noel (.22) | C25: =+E25+H25+L25 -> 135.16 | D25: =+G25+K25+P25 -> 73 | E25: =+(F25)+0.5*G25 -> 43.60 | F25: 32.60 | G25: 22 | H25: =+(I25+J25)+0.5*K25 -> 45.78 | I25: 19.94 | J25: 15.34 | K25: 21 | L25: =+(M25+N25+O25)+0.5*P25 -> 45.78 | M25: 4.88 | N25: 3.83 | O25: 22.07 | P25: 30
A26: 22 | B26: Bermudez, Michael | C26: =+E26+H26+L26 -> 140.50 | D26: =+G26+K26+P26 -> 79 | E26: =+(F26)+0.5*G26 -> 44.22 | F26: 39.72 | G26: 9 | H26: =+(I26+J26)+0.5*K26 -> 50.56 | I26: 16.04 | J26: 16.02 | K26: 37 | L26: =+(M26+N26+O26)+0.5*P26 -> 45.72 | M26: 3.83 | N26: 18.11 | O26: 7.28 | P26: 33
A27: 23 | B27: Simons, Jordan | C27: =+E27+H27+L27 -> 144.02 | D27: =+G27+K27+P27 -> 60 | E27: =+(F27)+0.5*G27 -> 64.22 | F27: 58.22 | G27: 12 | H27: =+(I27+J27)+0.5*K27 -> 57.00 | I27: 23.70 | J27: 16.80 | K27: 33 | L27: =+(M27+N27+O27)+0.5*P27 -> 22.80 | M27: 3.99 | N27: 4.81 | O27: 6.50 | P27: 15
A28: 24 | B28: Baldwin, Greg | C28: =+E28+H28+L28 -> 161.25 | D28: =+G28+K28+P28 -> 43 | E28: =+(F28)+0.5*G28 -> 64.48 | F28: 60.48 | G28: 8 | H28: =+(I28+J28)+0.5*K28 -> 73.76 | I28: 29.73 | J28: 29.53 | K28: 29 | L28: =+(M28+N28+O28)+0.5*P28 -> 23.01 | M28: 5.28 | N28: 5.86 | O28: 8.87 | P28: 6
A29: 25 | B29: Adams, Cody | C29: =+E29+H29+L29 -> 175.84 | D29: =+G29+K29+P29 -> 107 | E29: =+(F29)+0.5*G29 -> 61.31 | F29: 49.81 | G29: 23 | H29: =+(I29+J29)+0.5*K29 -> 81.48 | I29: 33.74 | J29: 18.74 | K29: 58 | L29: =+(M29+N29+O29)+0.5*P29 -> 33.05 | M29: 5.31 | N29: 5.59 | O29: 9.15 | P29: 26
A30: 26 | B30: Shumway, Elizabeth | C30: =+E30+H30+L30 -> 191.06 | D30: =+G30+K30+P30 -> 82 | E30: =+(F30)+0.5*G30 -> 70.10 | F30: 61.60 | G30: 17 | H30: =+(I30+J30)+0.5*K30 -> 88.10 | I30: 25.78 | J30: 41.82 | K30: 41 | L30: =+(M30+N30+O30)+0.5*P30 -> 32.86 | M30: 4.15 | N30: 5.53 | O30: 11.18 | P30: 24
A31: Notes:
A32: - | B32: Remember, the "Fun" Shoot is held on the 1st and 3rd Tuesday of each month ( 6:30 p.m.) at Range Masters.
A33: - | B33: You can use ANY handgun you want, as long as it can be safely drawn from a strong-side holster.
A34: - | B34: IDPA format and scoring.
A35: PD | B35: = Points Down = .5 seconds x Points Down
A36: XX | B36: Indicates that the Points Down value includes some kind of penalty (Procedural Error, Hits on Non-Threat, Misses on Steel, etc.)
A37: (Rev) | B37: = Revolver
A38: DNF | B38: = Did Not Finish