B1: Range Masters "Fun" Shoot | H1: Results for July 6, 2004
A2: Click on Stage # for view of COF
B3: Name (Note) | C3: Shoot Total | D3: Total Points Down
A4: Place | E4: Stage 1 | F4: String 1 | G4: PD | H4: Stage 2 | I4: String 1 | J4: String 2 | K4: String 3 | L4: PD | M4: Stage 3 | N4: String 1 | O4: String 2 | P4: PD
A5: 1 | B5: Taylor, Joshua | C5: =+E5+H5+M5 -> 48.93 | D5: =+G5+L5+P5 -> 6 | E5: =+(F5)+0.5*G5 -> 24.02 | F5: 22.52 | G5: 3 | H5: =+(I5+J5+K5)+0.5*L5 -> 15.21 | I5: 5.77 | J5: 4.84 | K5: 3.10 | L5: 3 | M5: =+(N5+O5)+0.5*P5 -> 9.70 | N5: 5.50 | O5: 4.20 | P5: 0
A6: 2 | B6: Zaccardi, Pat | C6: =+E6+H6+M6 -> 49.02 | D6: =+G6+L6+P6 -> 26 | E6: =+(F6)+0.5*G6 -> 24.69 | F6: 19.69 | G6: 10 | H6: =+(I6+J6+K6)+0.5*L6 -> 16.64 | I6: 3.52 | J6: 2.78 | K6: 2.34 | L6: 16 | M6: =+(N6+O6)+0.5*P6 -> 7.69 | N6: 4.76 | O6: 2.93 | P6: 0
A7: 3 | B7: Outzen, Craig | C7: =+E7+H7+M7 -> 53.50 | D7: =+G7+L7+P7 -> 28 | E7: =+(F7)+0.5*G7 -> 32.68 | F7: 22.68 | G7: =2+3+3+5+6+1 -> 20 | H7: =+(I7+J7+K7)+0.5*L7 -> 14.64 | I7: 4.52 | J7: 3.50 | K7: 2.62 | L7: 8 | M7: =+(N7+O7)+0.5*P7 -> 6.18 | N7: 3.58 | O7: 2.60 | P7: 0
A8: 4 | B8: Collins, Ken | C8: =+E8+H8+M8 -> 54.19 | D8: =+G8+L8+P8 -> 27 | E8: =+(F8)+0.5*G8 -> 30.46 | F8: 21.46 | G8: =2+1+2+11+2 -> 18 | H8: =+(I8+J8+K8)+0.5*L8 -> 14.54 | I8: 3.75 | J8: 3.35 | K8: 2.94 | L8: 9 | M8: =+(N8+O8)+0.5*P8 -> 9.19 | N8: 5.40 | O8: 3.79 | P8: 0
A9: 5 | B9: Young, Jason | C9: =+E9+H9+M9 -> 55.63 | D9: =+G9+L9+P9 -> 29 | E9: =+(F9)+0.5*G9 -> 34.58 | F9: 26.08 | G9: 17 | H9: =+(I9+J9+K9)+0.5*L9 -> 10.57 | I9: 2.91 | J9: 3.50 | K9: 2.16 | L9: 4 | M9: =+(N9+O9)+0.5*P9 -> 10.48 | N9: 4.05 | O9: 2.43 | P9: 8
A10: 6 | B10: Adams, Kyle (Rev) | C10: =+E10+H10+M10 -> 59.87 | D10: =+G10+L10+P10 -> 23 | E10: =+(F10)+0.5*G10 -> 33.17 | F10: 25.67 | G10: =6+2+2+3+2 -> 15 | H10: =+(I10+J10+K10)+0.5*L10 -> 13.30 | I10: 4.16 | J10: 3.50 | K10: 2.64 | L10: 6 | M10: =+(N10+O10)+0.5*P10 -> 13.40 | N10: 7.48 | O10: 4.92 | P10: 2
A11: 7 | B11: Redford, Noel | C11: =+E11+H11+M11 -> 66.72 | D11: =+G11+L11+P11 -> 30 | E11: =+(F11)+0.5*G11 -> 32.05 | F11: 28.55 | G11: 7 | H11: =+(I11+J11+K11)+0.5*L11 -> 20.60 | I11: 6.03 | J11: 4.00 | K11: 3.07 | L11: 15 | M11: =+(N11+O11)+0.5*P11 -> 14.07 | N11: 6.36 | O11: 3.71 | P11: 8
A12: 8 | B12: Billings, Scott (Rev) | C12: =+E12+H12+M12 -> 71.23 | D12: =+G12+L12+P12 -> 25 | E12: =+(F12)+0.5*G12 -> 46.46 | F12: 38.96 | G12: =3+5+2+3+2 -> 15 | H12: =+(I12+J12+K12)+0.5*L12 -> 15.41 | I12: 3.48 | J12: 3.87 | K12: 3.06 | L12: 10 | M12: =+(N12+O12)+0.5*P12 -> 9.36 | N12: 5.78 | O12: 3.58 | P12: 0
A13: 9 | B13: Huff, Blake (Rev) | C13: =+E13+H13+M13 -> 71.37 | D13: =+G13+L13+P13 -> 34 | E13: =+(F13)+0.5*G13 -> 39.22 | F13: 31.22 | G13: 16 | H13: =+(I13+J13+K13)+0.5*L13 -> 16.58 | I13: 6.31 | J13: 4.73 | K13: 3.04 | L13: 5 | M13: =+(N13+O13)+0.5*P13 -> 15.57 | N13: 4.15 | O13: 4.92 | P13: 13
A14: 10 | B14: Stone, Scott | C14: =+E14+H14+M14 -> 73.19 | D14: =+G14+L14+P14 -> 37 | E14: =+(F14)+0.5*G14 -> 42.16 | F14: 28.66 | G14: =1+6+3+7+9+1 -> 27 | H14: =+(I14+J14+K14)+0.5*L14 -> 16.56 | I14: 3.66 | J14: 5.00 | K14: 3.40 | L14: 9 | M14: =+(N14+O14)+0.5*P14 -> 14.47 | N14: 8.59 | O14: 5.38 | P14: 1
A15: 11 | B15: Young, Ren | C15: =+E15+H15+M15 -> 73.31 | D15: =+G15+L15+P15 -> 37 | E15: =+(F15)+0.5*G15 -> 29.95 | F15: 22.45 | G15: =1+3+3+5+2+1 -> 15 | H15: =+(I15+J15+K15)+0.5*L15 -> 29.22 | I15: 3.67 | J15: 14.89 | K15: 2.66 | L15: 16 | M15: =+(N15+O15)+0.5*P15 -> 14.14 | N15: 6.88 | O15: 4.26 | P15: 6
A16: 12 | B16: Zaccardi, Juke | C16: =+E16+H16+M16 -> 74.59 | D16: =+G16+L16+P16 -> 37 | E16: =+(F16)+0.5*G16 -> 44.95 | F16: 33.45 | G16: =1+5+7+10 -> 23 | H16: =+(I16+J16+K16)+0.5*L16 -> 14.32 | I16: 4.57 | J16: 4.13 | K16: 2.62 | L16: 6 | M16: =+(N16+O16)+0.5*P16 -> 15.32 | N16: 6.47 | O16: 4.85 | P16: 8
A17: 13 | B17: Simons, Jordan | C17: =+E17+H17+M17 -> 80.96 | D17: =+G17+L17+P17 -> 79 | E17: =+(F17)+0.5*G17 -> 43.81 | F17: 19.31 | G17: =2+1+7+13+15+11 -> 49 | H17: =+(I17+J17+K17)+0.5*L17 -> 21.92 | I17: 3.40 | J17: 3.61 | K17: 4.41 | L17: 21 | M17: =+(N17+O17)+0.5*P17 -> 15.23 | N17: 6.10 | O17: 4.63 | P17: 9
A18: 14 | B18: Mousley, Roger (Rev) | C18: =+E18+H18+M18 -> 81.18 | D18: =+G18+L18+P18 -> 50 | E18: =+(F18)+0.5*G18 -> 52.44 | F18: 29.94 | G18: =5+2+3+15+10+10 -> 45 | H18: =+(I18+J18+K18)+0.5*L18 -> 13.98 | I18: 5.07 | J18: 4.56 | K18: 2.85 | L18: 3 | M18: =+(N18+O18)+0.5*P18 -> 14.76 | N18: 8.41 | O18: 5.35 | P18: 2
A19: 15 | B19: Op'thof, Max | C19: =+E19+H19+M19 -> 83.57 | D19: =+G19+L19+P19 -> 100 | E19: =+(F19)+0.5*G19 -> 37.45 | F19: 17.95 | G19: =6+1+4+11+10+7 -> 39 | H19: =+(I19+J19+K19)+0.5*L19 -> 18.14 | I19: 3.58 | J19: 3.40 | K19: 2.66 | L19: 17 | M19: =+(N19+O19)+0.5*P19 -> 27.98 | N19: 2.90 | O19: 3.08 | P19: =12+14+8+10 -> 44
A20: 16 | B20: Shermon, John | C20: =+E20+H20+M20 -> 86.06 | D20: =+G20+L20+P20 -> 77 | E20: =+(F20)+0.5*G20 -> 60.08 | F20: 26.58 | G20: =15+6+9+15+11+11 -> 67 | H20: =+(I20+J20+K20)+0.5*L20 -> 16.40 | I20: 5.62 | J20: 3.76 | K20: 3.52 | L20: 7 | M20: =+(N20+O20)+0.5*P20 -> 9.58 | N20: 4.59 | O20: 3.49 | P20: 3
A21: 17 | B21: Smith, Bruce | C21: =+E21+H21+M21 -> 94.14 | D21: =+G21+L21+P21 -> 45 | E21: =+(F21)+0.5*G21 -> 62.33 | F21: 44.33 | G21: =2+2+5+11+7+9 -> 36 | H21: =+(I21+J21+K21)+0.5*L21 -> 19.17 | I21: 5.04 | J21: 5.70 | K21: 3.93 | L21: 9 | M21: =+(N21+O21)+0.5*P21 -> 12.64 | N21: 6.53 | O21: 6.11 | P21: 0
A22: 18 | B22: Simons, Kyle | C22: =+E22+H22+M22 -> 94.96 | D22: =+G22+L22+P22 -> 93 | E22: =+(F22)+0.5*G22 -> 50.77 | F22: 20.27 | G22: =5+7+4+15+15+15 -> 61 | H22: =+(I22+J22+K22)+0.5*L22 -> 28.31 | I22: 5.26 | J22: 7.16 | K22: 5.89 | L22: 20 | M22: =+(N22+O22)+0.5*P22 -> 15.88 | N22: 5.82 | O22: 4.06 | P22: 12
A23: 19 | B23: Billings, Richard | C23: =+E23+H23+M23 -> 98.00 | D23: =+G23+L23+P23 -> 78 | E23: =+(F23)+0.5*G23 -> 61.07 | F23: 31.57 | G23: =9+15+11+9+7+8 -> 59 | H23: =+(I23+J23+K23)+0.5*L23 -> 13.54 | I23: 4.18 | J23: 4.11 | K23: 3.75 | L23: 3 | M23: =+(N23+O23)+0.5*P23 -> 23.39 | N23: 9.98 | O23: 5.41 | P23: 16
A24: 20 | B24: Simons, Brad | C24: =+E24+H24+M24 -> 100.55 | D24: =+G24+L24+P24 -> 95 | E24: =+(F24)+0.5*G24 -> 62.92 | F24: 27.92 | G24: =15+15+10+15+15 -> 70 | H24: =+(I24+J24+K24)+0.5*L24 -> 21.00 | I24: 5.55 | J24: 4.43 | K24: 5.02 | L24: 12 | M24: =+(N24+O24)+0.5*P24 -> 16.63 | N24: 6.32 | O24: 3.81 | P24: 13
A25: 21 | B25: Hill, Randy | C25: =+E25+H25+M25 -> 107.81 | D25: =+G25+L25+P25 -> 101 | E25: =+(F25)+0.5*G25 -> 52.21 | F25: 27.21 | G25: =6+9+9+15+11 -> 50 | H25: =+(I25+J25+K25)+0.5*L25 -> 32.47 | I25: 5.83 | J25: 8.07 | K25: 4.07 | L25: =8+12+3+6 -> 29 | M25: =+(N25+O25)+0.5*P25 -> 23.13 | N25: 6.94 | O25: 5.19 | P25: 22
A26: 22 | B26: Wilson, Brock | C26: =+E26+H26+M26 -> 109.20 | D26: =+G26+L26+P26 -> 39 | E26: =+(F26)+0.5*G26 -> 71.79 | F26: 55.79 | G26: =11+5+7+3+6 -> 32 | H26: =+(I26+J26+K26)+0.5*L26 -> 22.78 | I26: 6.53 | J26: 7.93 | K26: 5.32 | L26: 6 | M26: =+(N26+O26)+0.5*P26 -> 14.63 | N26: 7.41 | O26: 6.72 | P26: 1
A27: 23 | B27: Curtis, Clay | C27: =+E27+H27+M27 -> 111.89 | D27: =+G27+L27+P27 -> 28 | E27: =+(F27)+0.5*G27 -> 68.68 | F27: 58.18 | G27: 21 | H27: =+(I27+J27+K27)+0.5*L27 -> 25.19 | I27: 8.46 | J27: 9.36 | K27: 4.87 | L27: 5 | M27: =+(N27+O27)+0.5*P27 -> 18.02 | N27: 9.35 | O27: 7.67 | P27: 2
A28: 24 | B28: Patten, Randy | C28: =+E28+H28+M28 -> 121.16 | D28: =+G28+L28+P28 -> 32 | E28: =+(F28)+0.5*G28 -> 68.49 | F28: 59.49 | G28: =10+1+1+5+1 -> 18 | H28: =+(I28+J28+K28)+0.5*L28 -> 28.62 | I28: 8.17 | J28: 9.71 | K28: 8.24 | L28: 5 | M28: =+(N28+O28)+0.5*P28 -> 24.05 | N28: 10.98 | O28: 8.57 | P28: 9
A29: 25 | B29: Brown, Mike | C29: =+E29+H29+M29 -> 122.93 | D29: =+G29+L29+P29 -> 99 | E29: =+(F29)+0.5*G29 -> 48.13 | F29: 34.63 | G29: =2+3+3+11+8 -> 27 | H29: =+(I29+J29+K29)+0.5*L29 -> 25.62 | I29: 4.73 | J29: 6.31 | K29: 4.08 | L29: 21 | M29: =+(N29+O29)+0.5*P29 -> 49.18 | N29: 18.17 | O29: 5.51 | P29: =20+7+11+13 -> 51
A30: 26 | B30: Billings, Wesley (.22) | C30: =+E30+H30+M30 -> 127.92 | D30: =+G30+L30+P30 -> 114 | E30: =+(F30)+0.5*G30 -> 50.23 | F30: 27.23 | G30: =6+8+7+10+7+8 -> 46 | H30: =+(I30+J30+K30)+0.5*L30 -> 46.10 | I30: 4.99 | J30: 6.63 | K30: 10.48 | L30: =18+12+18 -> 48 | M30: =+(N30+O30)+0.5*P30 -> 31.59 | N30: 12.51 | O30: 9.08 | P30: =6+8+6 -> 20
A31: Notes:
A32: - | B32: Remember, the "Fun" Shoot is held on the 1st and 3rd Tuesday of each month ( 6:30 p.m.) at Range Masters.
A33: - | B33: You can use ANY handgun you want, as long as it can be safely drawn from a strong-side holster.
A34: - | B34: IDPA format and scoring.
A35: PD | B35: = Points Down = .5 seconds x Points Down
A36: XX | B36: Indicates that the Points Down value includes some kind of penalty (Procedural Error, Hits on Non-Threat, Misses on Steel, etc.)
A37: (Rev) | B37: = Revolver
A38: DNF | B38: = Did Not Finish