B1: Range Masters "Fun" Shoot | H1: Results for June 15, 2004
A2: Click on Stage # for view of COF
B3: Name (Note) | C3: Shoot Total | D3: Total Points Down
A4: Place | E4: Stage 1 | F4: String 1 | G4: PD | H4: Stage 2 | I4: String 1 | J4: PD | K4: Stage 3 | L4: String 1 | M4: String 2 | N4: PD
A5: 1 | B5: Zaccardi, Pat | C5: =+E5+H5+K5 -> 53.53 | D5: =+G5+J5+N5 -> 18 | E5: =+(F5)+0.5*G5 -> 16.19 | F5: 11.19 | G5: 10 | H5: =+(I5)+0.5*J5 -> 14.06 | I5: 10.56 | J5: 7 | K5: =+(L5+M5)+0.5*N5 -> 23.28 | L5: 9.56 | M5: 13.22 | N5: 1
A6: 2 | B6: Young, Jason | C6: =+E6+H6+K6 -> 58.02 | D6: =+G6+J6+N6 -> 31 | E6: =+(F6)+0.5*G6 -> 20.09 | F6: 11.09 | G6: 18 | H6: =+(I6)+0.5*J6 -> 14.78 | I6: 11.28 | J6: 7 | K6: =+(L6+M6)+0.5*N6 -> 23.15 | L6: 9.78 | M6: 10.37 | N6: 6
A7: 3 | B7: Collins, Ken | C7: =+E7+H7+K7 -> 58.86 | D7: =+G7+J7+N7 -> 2 | E7: =+(F7)+0.5*G7 -> 20.14 | F7: 19.14 | G7: 2 | H7: =+(I7)+0.5*J7 -> 13.58 | I7: 13.58 | J7: 0 | K7: =+(L7+M7)+0.5*N7 -> 25.14 | L7: 11.65 | M7: 13.49 | N7: 0
A8: 4 | B8: Rodriquez, Mike | C8: =+E8+H8+K8 -> 67.00 | D8: =+G8+J8+N8 -> 25 | E8: =+(F8)+0.5*G8 -> 23.93 | F8: 16.43 | G8: 15 | H8: =+(I8)+0.5*J8 -> 18.07 | I8: 16.07 | J8: 4 | K8: =+(L8+M8)+0.5*N8 -> 25.00 | L8: 10.89 | M8: 11.11 | N8: 6
A9: 5 | B9: Adams, Kyle (Rev) | C9: =+E9+H9+K9 -> 67.54 | D9: =+G9+J9+N9 -> 16 | E9: =+(F9)+0.5*G9 -> 23.61 | F9: 18.11 | G9: 11 | H9: =+(I9)+0.5*J9 -> 24.82 | I9: 22.32 | J9: 5 | K9: =+(L9+M9)+0.5*N9 -> 19.11 | L9: 8.98 | M9: 10.13 | N9: 0
A10: 6 | B10: Zaccardi, Juke | C10: =+E10+H10+K10 -> 67.55 | D10: =+G10+J10+N10 -> 26 | E10: =+(F10)+0.5*G10 -> 25.10 | F10: 16.60 | G10: 17 | H10: =+(I10)+0.5*J10 -> 16.53 | I10: 15.03 | J10: 3 | K10: =+(L10+M10)+0.5*N10 -> 25.92 | L10: 11.00 | M10: 11.92 | N10: 6
A11: 7 | B11: Taylor, Joshua | C11: =+E11+H11+K11 -> 72.26 | D11: =+G11+J11+N11 -> 4 | E11: =+(F11)+0.5*G11 -> 19.49 | F11: 17.49 | G11: 4 | H11: =+(I11)+0.5*J11 -> 26.76 | I11: 26.76 | J11: 0 | K11: =+(L11+M11)+0.5*N11 -> 26.01 | L11: 12.47 | M11: 13.54 | N11: 0
A12: 8 | B12: Redford, Steve | C12: =+E12+H12+K12 -> 74.04 | D12: =+G12+J12+N12 -> 7 | E12: =+(F12)+0.5*G12 -> 20.81 | F12: 17.81 | G12: 6 | H12: =+(I12)+0.5*J12 -> 30.82 | I12: 30.32 | J12: 1 | K12: =+(L12+M12)+0.5*N12 -> 22.41 | L12: 10.62 | M12: 11.79 | N12: 0
A13: 9 | B13: Redford, Noel | C13: =+E13+H13+K13 -> 75.38 | D13: =+G13+J13+N13 -> 32 | E13: =+(F13)+0.5*G13 -> 25.37 | F13: 16.37 | G13: =4+4+2+4+4 -> 18 | H13: =+(I13)+0.5*J13 -> 21.37 | I13: 17.37 | J13: 8 | K13: =+(L13+M13)+0.5*N13 -> 28.64 | L13: 12.03 | M13: 13.61 | N13: 6
A14: 10 | B14: Mousley, Roger (Rev) | C14: =+E14+H14+K14 -> 76.94 | D14: =+G14+J14+N14 -> 19 | E14: =+(F14)+0.5*G14 -> 27.24 | F14: 20.24 | G14: 14 | H14: =+(I14)+0.5*J14 -> 20.27 | I14: 18.27 | J14: 4 | K14: =+(L14+M14)+0.5*N14 -> 29.43 | L14: 15.43 | M14: 13.50 | N14: 1
A15: 11 | B15: Hatch, Perri | C15: =+E15+H15+K15 -> 78.71 | D15: =+G15+J15+N15 -> 18 | E15: =+(F15)+0.5*G15 -> 29.69 | F15: 21.19 | G15: 17 | H15: =+(I15)+0.5*J15 -> 22.71 | I15: 22.71 | J15: 0 | K15: =+(L15+M15)+0.5*N15 -> 26.31 | L15: 10.80 | M15: 15.01 | N15: 1
A16: 12 | B16: Stone, Scott | C16: =+E16+H16+K16 -> 80.37 | D16: =+G16+J16+N16 -> 29 | E16: =+(F16)+0.5*G16 -> 23.95 | F16: 18.95 | G16: 10 | H16: =+(I16)+0.5*J16 -> 28.30 | I16: 21.80 | J16: 13 | K16: =+(L16+M16)+0.5*N16 -> 28.12 | L16: 12.65 | M16: 12.47 | N16: 6
A17: 13 | B17: Ottesen, Sterling | C17: =+E17+H17+K17 -> 84.66 | D17: =+G17+J17+N17 -> 18 | E17: =+(F17)+0.5*G17 -> 29.93 | F17: 21.93 | G17: =4+1+3+1+1+1+5 -> 16 | H17: =+(I17)+0.5*J17 -> 27.36 | I17: 26.86 | J17: 1 | K17: =+(L17+M17)+0.5*N17 -> 27.37 | L17: 13.21 | M17: 13.66 | N17: 1
A18: 14 | B18: Young, Ren | C18: =+E18+H18+K18 -> 84.78 | D18: =+G18+J18+N18 -> 31 | E18: =+(F18)+0.5*G18 -> 30.11 | F18: 18.11 | G18: =4+1+3+2+8+6 -> 24 | H18: =+(I18)+0.5*J18 -> 23.28 | I18: 21.28 | J18: 4 | K18: =+(L18+M18)+0.5*N18 -> 31.39 | L18: 17.31 | M18: 12.58 | N18: 3
A19: 15 | B19: Huff, Blake (Rev) | C19: =+E19+H19+K19 -> 85.66 | D19: =+G19+J19+N19 -> 2 | E19: =+(F19)+0.5*G19 -> 32.39 | F19: 31.39 | G19: 2 | H19: =+(I19)+0.5*J19 -> 23.30 | I19: 23.30 | J19: 0 | K19: =+(L19+M19)+0.5*N19 -> 29.97 | L19: 14.25 | M19: 15.72 | N19: 0
A20: 16 | B20: Scott, Alan | C20: =+E20+H20+K20 -> 86.68 | D20: =+G20+J20+N20 -> 42 | E20: =+(F20)+0.5*G20 -> 32.25 | F20: 17.75 | G20: 29 | H20: =+(I20)+0.5*J20 -> 24.64 | I20: 21.64 | J20: 6 | K20: =+(L20+M20)+0.5*N20 -> 29.79 | L20: 15.32 | M20: 10.97 | N20: 7
A21: 17 | B21: Redford, Noel (.22) | C21: =+E21+H21+K21 -> 87.78 | D21: =+G21+J21+N21 -> 53 | E21: =+(F21)+0.5*G21 -> 17.96 | F21: 16.96 | G21: 2 | H21: =+(I21)+0.5*J21 -> 32.67 | I21: 19.17 | J21: 27 | K21: =+(L21+M21)+0.5*N21 -> 37.15 | L21: 11.54 | M21: 13.61 | N21: 24
A22: 18 | B22: Hood, Neil | C22: =+E22+H22+K22 -> 91.94 | D22: =+G22+J22+N22 -> 27 | E22: =+(F22)+0.5*G22 -> 32.99 | F22: 20.49 | G22: =1+1+2+3+8+10 -> 25 | H22: =+(I22)+0.5*J22 -> 25.17 | I22: 25.17 | J22: 0 | K22: =+(L22+M22)+0.5*N22 -> 33.78 | L22: 18.19 | M22: 14.59 | N22: 2
A23: 19 | B23: Billings, Scott | C23: =+E23+H23+K23 -> 95.73 | D23: =+G23+J23+N23 -> 32 | E23: =+(F23)+0.5*G23 -> 34.56 | F23: 25.56 | G23: 18 | H23: =+(I23)+0.5*J23 -> 32.73 | I23: 26.23 | J23: 13 | K23: =+(L23+M23)+0.5*N23 -> 28.44 | L23: 13.44 | M23: 14.50 | N23: 1
A24: 20 | B24: Hill, Randy | C24: =+E24+H24+K24 -> 97.84 | D24: =+G24+J24+N24 -> 28 | E24: =+(F24)+0.5*G24 -> 33.66 | F24: 24.16 | G24: 19 | H24: =+(I24)+0.5*J24 -> 24.53 | I24: 23.53 | J24: 2 | K24: =+(L24+M24)+0.5*N24 -> 39.65 | L24: 21.93 | M24: 14.22 | N24: 7
A25: 21 | B25: Shermon, John | C25: =+E25+H25+K25 -> 98.36 | D25: =+G25+J25+N25 -> 40 | E25: =+(F25)+0.5*G25 -> 35.87 | F25: 28.37 | G25: 15 | H25: =+(I25)+0.5*J25 -> 25.30 | I25: 20.80 | J25: 9 | K25: =+(L25+M25)+0.5*N25 -> 37.19 | L25: 12.20 | M25: 16.99 | N25: 16
A26: 22 | B26: Goddard, Cole | C26: =+E26+H26+K26 -> 99.97 | D26: =+G26+J26+N26 -> 28 | E26: =+(F26)+0.5*G26 -> 40.41 | F26: 34.41 | G26: 12 | H26: =+(I26)+0.5*J26 -> 23.56 | I26: 22.56 | J26: 2 | K26: =+(L26+M26)+0.5*N26 -> 36.00 | L26: 15.09 | M26: 13.91 | N26: 14
A27: 23 | B27: Op'thof, Max | C27: =+E27+H27+K27 -> 100.23 | D27: =+G27+J27+N27 -> 49 | E27: =+(F27)+0.5*G27 -> 37.45 | F27: 26.45 | G27: =3+5+1+1+2+4+6 -> 22 | H27: =+(I27)+0.5*J27 -> 20.54 | I27: 11.54 | J27: =6+4+1+1+2+1+1+2 -> 18 | K27: =+(L27+M27)+0.5*N27 -> 42.24 | L27: 23.56 | M27: 14.18 | N27: 9
A28: 24 | B28: Burney, Carl | C28: =+E28+H28+K28 -> 106.64 | D28: =+G28+J28+N28 -> 15 | E28: =+(F28)+0.5*G28 -> 38.35 | F28: 31.35 | G28: 14 | H28: =+(I28)+0.5*J28 -> 33.83 | I28: 33.83 | J28: 0 | K28: =+(L28+M28)+0.5*N28 -> 34.46 | L28: 14.79 | M28: 19.17 | N28: 1
A29: 25 | B29: Phillips, RDan | C29: =+E29+H29+K29 -> 109.38 | D29: =+G29+J29+N29 -> 37 | E29: =+(F29)+0.5*G29 -> 36.11 | F29: 26.11 | G29: =8+1+3+2+6 -> 20 | H29: =+(I29)+0.5*J29 -> 28.90 | I29: 27.90 | J29: 2 | K29: =+(L29+M29)+0.5*N29 -> 44.37 | L29: 13.10 | M29: 23.77 | N29: 15
A30: 26 | B30: Shermon, Adam | C30: =+E30+H30+K30 -> 114.55 | D30: =+G30+J30+N30 -> 34 | E30: =+(F30)+0.5*G30 -> 38.15 | F30: 28.65 | G30: 19 | H30: =+(I30)+0.5*J30 -> 41.03 | I30: 36.53 | J30: 9 | K30: =+(L30+M30)+0.5*N30 -> 35.37 | L30: 13.55 | M30: 18.82 | N30: 6
A31: 27 | B31: Billings, Richard | C31: =+E31+H31+K31 -> 116.89 | D31: =+G31+J31+N31 -> 60 | E31: =+(F31)+0.5*G31 -> 38.83 | F31: 21.83 | G31: =10+1+4+3+5+6+1+4 -> 34 | H31: =+(I31)+0.5*J31 -> 42.28 | I31: 34.78 | J31: 15 | K31: =+(L31+M31)+0.5*N31 -> 35.78 | L31: 15.74 | M31: 14.54 | N31: 11
A32: 28 | B32: Cloutier, Tyler | C32: =+E32+H32+K32 -> 122.37 | D32: =+G32+J32+N32 -> 24 | E32: =+(F32)+0.5*G32 -> 30.25 | F32: 24.25 | G32: 12 | H32: =+(I32)+0.5*J32 -> 44.19 | I32: 43.19 | J32: 2 | K32: =+(L32+M32)+0.5*N32 -> 47.93 | L32: 19.05 | M32: 23.88 | N32: 10
A33: 29 | B33: Goddard, Kendall | C33: =+E33+H33+K33 -> 124.80 | D33: =+G33+J33+N33 -> 39 | E33: =+(F33)+0.5*G33 -> 31.27 | F33: 21.77 | G33: 19 | H33: =+(I33)+0.5*J33 -> 40.05 | I33: 35.55 | J33: 9 | K33: =+(L33+M33)+0.5*N33 -> 53.48 | L33: 26.27 | M33: 21.71 | N33: 11
A34: 30 | B34: Smith, Bruce | C34: =+E34+H34+K34 -> 125.61 | D34: =+G34+J34+N34 -> 23 | E34: =+(F34)+0.5*G34 -> 39.07 | F34: 30.57 | G34: 17 | H34: =+(I34)+0.5*J34 -> 33.54 | I34: 33.04 | J34: 1 | K34: =+(L34+M34)+0.5*N34 -> 53.00 | L34: 29.07 | M34: 21.43 | N34: 5
A35: 31 | B35: Hardy, Brett | C35: =+E35+H35+K35 -> 131.62 | D35: =+G35+J35+N35 -> 44 | E35: =+(F35)+0.5*G35 -> 42.96 | F35: 30.96 | G35: =6+1+5+1+4+3+4 -> 24 | H35: =+(I35)+0.5*J35 -> 48.75 | I35: 41.25 | J35: 15 | K35: =+(L35+M35)+0.5*N35 -> 39.91 | L35: 20.11 | M35: 17.30 | N35: 5
A36: 32 | B36: Adams,Cody | C36: =+E36+H36+K36 -> 141.68 | D36: =+G36+J36+N36 -> 66 | E36: =+(F36)+0.5*G36 -> 45.41 | F36: 24.41 | G36: =6+10+1+5+1+3+6+10 -> 42 | H36: =+(I36)+0.5*J36 -> 50.75 | I36: 45.25 | J36: 11 | K36: =+(L36+M36)+0.5*N36 -> 45.52 | L36: 16.30 | M36: 22.72 | N36: 13
A37: 33 | B37: Shumway, Elizabeth | C37: =+E37+H37+K37 -> 156.10 | D37: =+G37+J37+N37 -> 78 | E37: =+(F37)+0.5*G37 -> 59.86 | F37: 33.86 | G37: =10+6+6+8+8+10+4 -> 52 | H37: =+(I37)+0.5*J37 -> 47.09 | I37: 38.09 | J37: 18 | K37: =+(L37+M37)+0.5*N37 -> 49.15 | L37: 24.12 | M37: 21.03 | N37: 8
A38: 34 | B38: Raigne, Abe (.22) | C38: =+E38+H38+K38 -> 166.96 | D38: =+G38+J38+N38 -> 108 | E38: =+(F38)+0.5*G38 -> 62.84 | F38: 37.34 | G38: =6+5+10+1+8+10+10+1 -> 51 | H38: =+(I38)+0.5*J38 -> 62.84 | I38: 37.34 | J38: 51 | K38: =+(L38+M38)+0.5*N38 -> 41.28 | L38: 21.04 | M38: 17.24 | N38: 6
A39: 35 | B39: Hood, Thomas | C39: =+E39+H39+K39 -> 169.79 | D39: =+G39+J39+N39 -> 32 | E39: =+(F39)+0.5*G39 -> 66.41 | F39: 53.41 | G39: =10+5+1+5+5 -> 26 | H39: =+(I39)+0.5*J39 -> 55.16 | I39: 55.16 | J39: 0 | K39: =+(L39+M39)+0.5*N39 -> 48.22 | L39: 24.98 | M39: 20.24 | N39: 6
A40: 36 | B40: Billings, Wesley | C40: =+E40+H40+K40 -> 176.69 | D40: =+G40+J40+N40 -> 83 | E40: =+(F40)+0.5*G40 -> 56.43 | F40: 37.43 | G40: =6+4+6+4+8+2+8 -> 38 | H40: =+(I40)+0.5*J40 -> 64.14 | I40: 49.14 | J40: =2+5+11+1+2+1+6+1+1 -> 30 | K40: =+(L40+M40)+0.5*N40 -> 56.12 | L40: 25.83 | M40: 22.79 | N40: 15
A41: 37 | B41: Redford, "Red" | C41: DNF | D41: DNF | E41: =+(F41)+0.5*G41 -> 20.78 | F41: 16.78 | G41: 8 | H41: DNF | I41: DNF | K41: =+(L41+M41)+0.5*N41 -> 27.91 | L41: 8.92 | M41: 11.49 | N41: 15
A42: Notes:
A43: - | B43: Remember, the "Fun" Shoot is held on the 1st and 3rd Tuesday of each month ( 6:30 p.m.) at Range Masters.
A44: - | B44: You can use ANY handgun you want, as long as it can be safely drawn from a strong-side holster.
A45: - | B45: IDPA format and scoring.
A46: PD | B46: = Points Down = .5 seconds x Points Down
A47: XX | B47: Indicates that the Points Down value includes some kind of penalty (Procedural Error, Hits on Non-Threat, Misses on Steel, etc.)
A48: (Rev) | B48: = Revolver
A49: DNF | B49: = Did Not Finish