B1: Range Masters "Fun" Shoot | I1: Results for August 3, 2004
A2: Click on Stage # for view of COF
B3: Name (Note) | C3: Shoot Total | D3: Total Points Down
A4: Place | E4: Stage 1 | F4: String 1 | G4: String 2 | H4: PD | I4: Stage 2 | J4: String 1 | K4: String 2 | L4: PD | M4: Stage 3 | N4: String 1 | O4: String 2 | P4: String 3 | Q4: PD
A5: 1 | B5: Collins, Ken | C5: =+E5+I5+M5 -> 68.56 | D5: =+H5+L5+Q5 -> 13 | E5: =+(F5+G5)+0.5*H5 -> 34.32 | F5: 16.11 | G5: 14.71 | H5: 7 | I5: =+(J5+K5)+0.5*L5 -> 23.28 | J5: 10.26 | K5: 12.52 | L5: 1 | M5: =+(N5+O5+P5)+0.5*Q5 -> 10.96 | N5: 2.80 | O5: 2.88 | P5: 2.78 | Q5: 5
A6: 2 | B6: Zaccardi, Pat | C6: =+E6+I6+M6 -> 78.89 | D6: =+H6+L6+Q6 -> 34 | E6: =+(F6+G6)+0.5*H6 -> 30.35 | F6: 13.44 | G6: 14.91 | H6: 4 | I6: =+(J6+K6)+0.5*L6 -> 36.67 | J6: 11.36 | K6: 12.81 | L6: =2+1+3+1+18 -> 25 | M6: =+(N6+O6+P6)+0.5*Q6 -> 11.87 | N6: 3.97 | O6: 2.91 | P6: 2.49 | Q6: 5
A7: 3 | B7: Taylor, Joshua | C7: =+E7+I7+M7 -> 87.17 | D7: =+H7+L7+Q7 -> 9 | E7: =+(F7+G7)+0.5*H7 -> 35.73 | F7: 18.98 | G7: 16.25 | H7: 1 | I7: =+(J7+K7)+0.5*L7 -> 35.77 | J7: 15.42 | K7: 17.85 | L7: 5 | M7: =+(N7+O7+P7)+0.5*Q7 -> 15.67 | N7: 5.19 | O7: 5.20 | P7: 3.78 | Q7: 3
A8: 4 | B8: Young, Jason | C8: =+E8+I8+M8 -> 88.53 | D8: =+H8+L8+Q8 -> 38 | E8: =+(F8+G8)+0.5*H8 -> 33.78 | F8: 14.99 | G8: 17.29 | H8: 3 | I8: =+(J8+K8)+0.5*L8 -> 43.48 | J8: 11.05 | K8: 15.93 | L8: 33 | M8: =+(N8+O8+P8)+0.5*Q8 -> 11.27 | N8: 3.61 | O8: 4.34 | P8: 2.32 | Q8: 2
A9: 5 | B9: Redford, "Red" | C9: =+E9+I9+M9 -> 88.58 | D9: =+H9+L9+Q9 -> 34 | E9: =+(F9+G9)+0.5*H9 -> 39.17 | F9: 19.28 | G9: 16.89 | H9: 6 | I9: =+(J9+K9)+0.5*L9 -> 35.43 | J9: 12.33 | K9: 11.10 | L9: =3+2+2+5+12 -> 24 | M9: =+(N9+O9+P9)+0.5*Q9 -> 13.98 | N9: 5.64 | O9: 3.71 | P9: 2.63 | Q9: 4
A10: 6 | B10: Young, Ren | C10: =+E10+I10+M10 -> 89.64 | D10: =+H10+L10+Q10 -> 17 | E10: =+(F10+G10)+0.5*H10 -> 39.76 | F10: 21.24 | G10: 17.02 | H10: 3 | I10: =+(J10+K10)+0.5*L10 -> 35.35 | J10: 17.00 | K10: 15.35 | L10: 6 | M10: =+(N10+O10+P10)+0.5*Q10 -> 14.53 | N10: 3.62 | O10: 4.05 | P10: 2.86 | Q10: 8
A11: 7 | B11: Redford, "Red" (Rev) | C11: =+E11+I11+M11 -> 96.59 | D11: =+H11+L11+Q11 -> 20 | E11: =+(F11+G11)+0.5*H11 -> 47.56 | F11: 25.64 | G11: 19.92 | H11: 4 | I11: =+(J11+K11)+0.5*L11 -> 35.99 | J11: 14.55 | K11: 13.94 | L11: =2+2+3+1+7 -> 15 | M11: =+(N11+O11+P11)+0.5*Q11 -> 13.04 | N11: 5.29 | O11: 3.80 | P11: 3.45 | Q11: 1
A12: 8 | B12: Stone, Scott | C12: =+E12+I12+M12 -> 97.83 | D12: =+H12+L12+Q12 -> 47 | E12: =+(F12+G12)+0.5*H12 -> 48.90 | F12: 24.72 | G12: 20.18 | H12: 8 | I12: =+(J12+K12)+0.5*L12 -> 29.83 | J12: 10.31 | K12: 10.02 | L12: =2+1+10+1+5 -> 19 | M12: =+(N12+O12+P12)+0.5*Q12 -> 19.10 | N12: 2.35 | O12: 3.16 | P12: 3.59 | Q12: =7+8+5 -> 20
A13: 9 | B13: Hatch, Perri | C13: =+E13+I13+M13 -> 98.39 | D13: =+H13+L13+Q13 -> 32 | E13: =+(F13+G13)+0.5*H13 -> 50.09 | F13: 29.06 | G13: 15.53 | H13: 11 | I13: =+(J13+K13)+0.5*L13 -> 34.69 | J13: 10.12 | K13: 16.07 | L13: 17 | M13: =+(N13+O13+P13)+0.5*Q13 -> 13.61 | N13: 4.27 | O13: 4.33 | P13: 3.01 | Q13: 4
A14: 10 | B14: Dockstader, Jeff | C14: =+E14+I14+M14 -> 100.43 | D14: =+H14+L14+Q14 -> 27 | E14: =+(F14+G14)+0.5*H14 -> 43.80 | F14: 18.31 | G14: 24.99 | H14: 1 | I14: =+(J14+K14)+0.5*L14 -> 36.63 | J14: 14.79 | K14: 11.34 | L14: =3+4+1+6+7 -> 21 | M14: =+(N14+O14+P14)+0.5*Q14 -> 20.00 | N14: 6.44 | O14: 4.55 | P14: 6.51 | Q14: 5
A15: 11 | B15: Billings, Scott (Rev) | C15: =+E15+I15+M15 -> 102.20 | D15: =+H15+L15+Q15 -> 28 | E15: =+(F15+G15)+0.5*H15 -> 53.46 | F15: 25.68 | G15: 22.78 | H15: 10 | I15: =+(J15+K15)+0.5*L15 -> 34.30 | J15: 15.03 | K15: 14.77 | L15: 9 | M15: =+(N15+O15+P15)+0.5*Q15 -> 14.44 | N15: 3.67 | O15: 3.34 | P15: 2.93 | Q15: 9
A16: 12 | B16: Hill, Randy (4) | C16: =+E16+I16+M16 -> 103.22 | D16: =+H16+L16+Q16 -> 35 | E16: =+(F16+G16)+0.5*H16 -> 47.69 | F16: 26.04 | G16: 18.65 | H16: 6 | I16: =+(J16+K16)+0.5*L16 -> 41.68 | J16: 15.42 | K16: 13.76 | L16: =3+1+2+3+6+10 -> 25 | M16: =+(N16+O16+P16)+0.5*Q16 -> 13.85 | N16: 3.73 | O16: 4.56 | P16: 3.56 | Q16: 4
A17: 13 | B17: Goddard, Cole | C17: =+E17+I17+M17 -> 107.36 | D17: =+H17+L17+Q17 -> 58 | E17: =+(F17+G17)+0.5*H17 -> 53.63 | F17: 26.87 | G17: 17.76 | H17: 18 | I17: =+(J17+K17)+0.5*L17 -> 42.73 | J17: 14.11 | K17: 11.12 | L17: =4+5+5+5+6+10 -> 35 | M17: =+(N17+O17+P17)+0.5*Q17 -> 11.00 | N17: 2.93 | O17: 2.76 | P17: 2.81 | Q17: 5
A18: 14 | B18: Phillips, RDan | C18: =+E18+I18+M18 -> 110.04 | D18: =+H18+L18+Q18 -> 25 | E18: =+(F18+G18)+0.5*H18 -> 56.69 | F18: 32.11 | G18: 23.08 | H18: 3 | I18: =+(J18+K18)+0.5*L18 -> 35.95 | J18: 13.78 | K18: 12.67 | L18: =1+3+7+2+6 -> 19 | M18: =+(N18+O18+P18)+0.5*Q18 -> 17.40 | N18: 5.24 | O18: 5.17 | P18: 5.49 | Q18: 3
A19: 15 | B19: Jepperson, Riley | C19: =+E19+I19+M19 -> 115.02 | D19: =+H19+L19+Q19 -> 65 | E19: =+(F19+G19)+0.5*H19 -> 55.25 | F19: 19.73 | G19: 27.02 | H19: 17 | I19: =+(J19+K19)+0.5*L19 -> 43.68 | J19: 11.46 | K19: 13.72 | L19: =5+10+6+6+10 -> 37 | M19: =+(N19+O19+P19)+0.5*Q19 -> 16.09 | N19: 3.89 | O19: 3.68 | P19: 3.02 | Q19: 11
A20: 16 | B20: Moses, Tyler | C20: =+E20+I20+M20 -> 115.81 | D20: =+H20+L20+Q20 -> 63 | E20: =+(F20+G20)+0.5*H20 -> 60.07 | F20: 23.07 | G20: 26.00 | H20: =1+1+2+5+2+1+10 -> 22 | I20: =+(J20+K20)+0.5*L20 -> 42.18 | J20: 12.51 | K20: 11.17 | L20: =4+6+8+2+7+10 -> 37 | M20: =+(N20+O20+P20)+0.5*Q20 -> 13.56 | N20: 4.51 | O20: 3.69 | P20: 3.36 | Q20: 4
A21: 17 | B21: Brown, Mike | C21: =+E21+I21+M21 -> 119.06 | D21: =+H21+L21+Q21 -> 66 | E21: =+(F21+G21)+0.5*H21 -> 55.44 | F21: 25.01 | G21: 17.43 | H21: 26 | I21: =+(J21+K21)+0.5*L21 -> 44.94 | J21: 16.82 | K21: 14.12 | L21: =3+4+1+10+10 -> 28 | M21: =+(N21+O21+P21)+0.5*Q21 -> 18.68 | N21: 4.71 | O21: 3.87 | P21: 4.10 | Q21: 12
A22: 18 | B22: Burney, Carl | C22: =+E22+I22+M22 -> 124.45 | D22: =+H22+L22+Q22 -> 13 | E22: =+(F22+G22)+0.5*H22 -> 67.44 | F22: 31.17 | G22: 30.77 | H22: 11 | I22: =+(J22+K22)+0.5*L22 -> 37.90 | J22: 18.51 | K22: 18.39 | L22: 2 | M22: =+(N22+O22+P22)+0.5*Q22 -> 19.11 | N22: 8.71 | O22: 5.84 | P22: 4.56 | Q22: 0
A23: 19 | B23: Smith, Bruce | C23: =+E23+I23+M23 -> 126.60 | D23: =+H23+L23+Q23 -> 30 | E23: =+(F23+G23)+0.5*H23 -> 61.91 | F23: 38.05 | G23: 22.86 | H23: 2 | I23: =+(J23+K23)+0.5*L23 -> 47.05 | J23: 16.03 | K23: 21.02 | L23: =1+1+4+8+6 -> 20 | M23: =+(N23+O23+P23)+0.5*Q23 -> 17.64 | N23: 4.40 | O23: 5.23 | P23: 4.01 | Q23: 8
A24: 20 | B24: Otteson, Chris | C24: =+E24+I24+M24 -> 131.11 | D24: =+H24+L24+Q24 -> 63 | E24: =+(F24+G24)+0.5*H24 -> 55.56 | F24: 25.80 | G24: 20.26 | H24: =5+5+1+7+1 -> 19 | I24: =+(J24+K24)+0.5*L24 -> 55.80 | J24: 23.30 | K24: 14.00 | L24: =11+5+3+9+9 -> 37 | M24: =+(N24+O24+P24)+0.5*Q24 -> 19.75 | N24: 5.93 | O24: 5.12 | P24: 5.20 | Q24: 7
A25: 21 | B25: Robinson, Scott | C25: =+E25+I25+M25 -> 134.74 | D25: =+H25+L25+Q25 -> 96 | E25: =+(F25+G25)+0.5*H25 -> 55.21 | F25: 26.30 | G25: 17.91 | H25: =5+2+7+1+7 -> 22 | I25: =+(J25+K25)+0.5*L25 -> 63.73 | J25: 15.38 | K25: 13.85 | L25: =8+6+7+8+20+20 -> 69 | M25: =+(N25+O25+P25)+0.5*Q25 -> 15.80 | N25: 5.64 | O25: 4.39 | P25: 3.27 | Q25: 5
A26: 22 | B26: Goddard, Kendall | C26: =+E26+I26+M26 -> 135.47 | D26: =+H26+L26+Q26 -> 48 | E26: =+(F26+G26)+0.5*H26 -> 81.04 | F26: 40.50 | G26: 35.54 | H26: 10 | I26: =+(J26+K26)+0.5*L26 -> 32.93 | J26: 13.71 | K26: 10.72 | L26: 17 | M26: =+(N26+O26+P26)+0.5*Q26 -> 21.50 | N26: 4.04 | O26: 3.69 | P26: 3.27 | Q26: 21
A27: 23 | B27: DeLeeuw, Dave | C27: =+E27+I27+M27 -> 136.30 | D27: =+H27+L27+Q27 -> 42 | E27: =+(F27+G27)+0.5*H27 -> 61.61 | F27: 32.66 | G27: 27.95 | H27: 2 | I27: =+(J27+K27)+0.5*L27 -> 55.54 | J27: 20.78 | K27: 19.76 | L27: 30 | M27: =+(N27+O27+P27)+0.5*Q27 -> 19.15 | N27: 4.97 | O27: 5.18 | P27: 4.00 | Q27: 10
A28: 24 | B28: Billings, Richard | C28: =+E28+I28+M28 -> 138.74 | D28: =+H28+L28+Q28 -> 86 | E28: =+(F28+G28)+0.5*H28 -> 49.58 | F28: 20.04 | G28: 21.04 | H28: 17 | I28: =+(J28+K28)+0.5*L28 -> 69.85 | J28: 16.22 | K28: 21.63 | L28: =3+4+15+16+16+10 -> 64 | M28: =+(N28+O28+P28)+0.5*Q28 -> 19.31 | N28: 4.72 | O28: 6.24 | P28: 5.85 | Q28: 5
A29: 25 | B29: Simons, Brad | C29: =+E29+I29+M29 -> 139.20 | D29: =+H29+L29+Q29 -> 43 | E29: =+(F29+G29)+0.5*H29 -> 64.43 | F29: 30.37 | G29: 31.56 | H29: 5 | I29: =+(J29+K29)+0.5*L29 -> 52.25 | J29: 16.44 | K29: 19.31 | L29: =4+1+14+4+10 -> 33 | M29: =+(N29+O29+P29)+0.5*Q29 -> 22.52 | N29: 7.84 | O29: 7.01 | P29: 5.17 | Q29: 5
A30: 26 | B30: Simons, Jordan | C30: =+E30+I30+M30 -> 143.70 | D30: =+H30+L30+Q30 -> 129 | E30: =+(F30+G30)+0.5*H30 -> 65.26 | F30: 24.85 | G30: 17.91 | H30: =6+6+5+2+5+4+7+10 -> 45 | I30: =+(J30+K30)+0.5*L30 -> 59.19 | J30: 15.34 | K30: 7.35 | L30: =11+9+10+9+14+20 -> 73 | M30: =+(N30+O30+P30)+0.5*Q30 -> 19.25 | N30: 4.85 | O30: 5.46 | P30: 3.44 | Q30: 11
A31: 27 | B31: Jones, Brad | C31: =+E31+I31+M31 -> 148.77 | D31: =+H31+L31+Q31 -> 33 | E31: =+(F31+G31)+0.5*H31 -> 79.21 | F31: 58.36 | G31: 20.35 | H31: 1 | I31: =+(J31+K31)+0.5*L31 -> 51.03 | J31: 22.93 | K31: 14.60 | L31: =15+7+3+2 -> 27 | M31: =+(N31+O31+P31)+0.5*Q31 -> 18.53 | N31: 6.95 | O31: 5.36 | P31: 3.72 | Q31: 5
A32: 28 | B32: Hill, Randy (5) | C32: =+E32+I32+M32 -> 149.37 | D32: =+H32+L32+Q32 -> 53 | E32: =+(F32+G32)+0.5*H32 -> 74.13 | F32: 39.31 | G32: 33.82 | H32: 2 | I32: =+(J32+K32)+0.5*L32 -> 57.90 | J32: 12.74 | K32: 21.66 | L32: =3+2+8+12+12+10 -> 47 | M32: =+(N32+O32+P32)+0.5*Q32 -> 17.34 | N32: 6.30 | O32: 4.25 | P32: 4.79 | Q32: 4
A33: 29 | B33: Herring, Erin (.22) | C33: =+E33+I33+M33 -> 172.31 | D33: =+H33+L33+Q33 -> 51 | E33: =+(F33+G33)+0.5*H33 -> 98.56 | F33: 47.89 | G33: 39.67 | H33: =4+7+1+5+2+3 -> 22 | I33: =+(J33+K33)+0.5*L33 -> 51.97 | J33: 18.68 | K33: 20.79 | L33: =1+9+9+6 -> 25 | M33: =+(N33+O33+P33)+0.5*Q33 -> 21.78 | N33: 7.01 | O33: 7.18 | P33: 5.59 | Q33: 4
A34: 30 | B34: Billings, Wesley (.22) | C34: =+E34+I34+M34 -> 188.99 | D34: =+H34+L34+Q34 -> 112 | E34: =+(F34+G34)+0.5*H34 -> 71.63 | F34: 29.17 | G34: 19.96 | H34: =6+7+9+6+3+4+10 -> 45 | I34: =+(J34+K34)+0.5*L34 -> 87.10 | J34: 38.52 | K34: 25.08 | L34: =10+7+10+10+10 -> 47 | M34: =+(N34+O34+P34)+0.5*Q34 -> 30.26 | N34: 11.48 | O34: 5.20 | P34: 3.58 | Q34: 20
A35: 31 | B35: Shumway, Elizabeth (Rev) | C35: =+E35+I35+M35 -> 228.78 | D35: =+H35+L35+Q35 -> 127 | E35: =+(F35+G35)+0.5*H35 -> 115.18 | F35: 46.00 | G35: 37.18 | H35: =4+10+3+8+15+3+6+15 -> 64 | I35: =+(J35+K35)+0.5*L35 -> 88.31 | J35: 23.60 | K35: 43.71 | L35: =7+1+16+5+13 -> 42 | M35: =+(N35+O35+P35)+0.5*Q35 -> 25.29 | N35: 3.84 | O35: 5.65 | P35: 5.30 | Q35: =2+15+4 -> 21
A36: Notes:
A37: - | B37: Remember, the "Fun" Shoot is held on the 1st and 3rd Tuesday of each month ( 6:30 p.m.) at Range Masters.
A38: - | B38: You can use ANY handgun you want, as long as it can be safely drawn from a strong-side holster.
A39: - | B39: IDPA format and scoring.
A40: PD | B40: = Points Down = .5 seconds x Points Down
A41: XX | B41: Indicates that the Points Down value includes some kind of penalty (Procedural Error, Hits on Non-Threat, Misses on Steel, etc.)
A42: (Rev) | B42: = Revolver
A43: DNF | B43: = Did Not Finish