B0: Range Masters "Fun" Shoot | H0: Results for February 3, 2004
B1: (Click on the Stage # for a view of the stage.)
B2: Name (Note) | C2: Shoot Total | D2: Total Points Down
A3: Place | E3: Stage 1 | F3: String 1 | G3: String 2 | H3: PD | I3: Stage 2 | J3: String 1 | K3: String 2 | L3: PD | M3: Stage 3 | N3: String 1 | O3: String 2 | P3: PD
A4: 1 | B4: Terry, Blain (Rev) | C4: =+E4+I4+M4 -> 52.14 | D4: =+H4+L4+P4 -> 20 | E4: =+(F4+G4)+0.5*H4 -> 22.60 | F4: 11.85 | G4: 8.25 | H4: 5 | I4: =+(J4+K4)+0.5*L4 -> 16.50 | J4: 9.91 | K4: 4.09 | L4: 5 | M4: =+(N4+O4)+0.5*P4 -> 13.04 | N4: 4.29 | O4: 3.75 | P4: 10
A5: 2 | B5: Hansen, Jeff | C5: =+E5+I5+M5 -> 58.24 | D5: =+H5+L5+P5 -> 16 | E5: =+(F5+G5)+0.5*H5 -> 20.42 | F5: 11.24 | G5: 4.68 | H5: 9 | I5: =+(J5+K5)+0.5*L5 -> 28.05 | J5: 16.18 | K5: 8.37 | L5: 7 | M5: =+(N5+O5)+0.5*P5 -> 9.77 | N5: 4.94 | O5: 4.83 | P5: 0
A6: 3 | B6: Terry, Blain | C6: =+E6+I6+M6 -> 59.49 | D6: =+H6+L6+P6 -> 10 | E6: =+(F6+G6)+0.5*H6 -> 34.97 | F6: 8.39 | G6: 23.58 | H6: 6 | I6: =+(J6+K6)+0.5*L6 -> 14.20 | J6: 8.77 | K6: 3.93 | L6: 3 | M6: =+(N6+O6)+0.5*P6 -> 10.32 | N6: 5.87 | O6: 3.95 | P6: 1
A7: 4 | B7: Zaccardi, Pat | C7: =+E7+I7+M7 -> 61.44 | D7: =+H7+L7+P7 -> 33 | E7: =+(F7+G7)+0.5*H7 -> 23.23 | F7: 8.79 | G7: 4.44 | H7: =1+2+5+3+9 -> 20 | I7: =+(J7+K7)+0.5*L7 -> 22.85 | J7: 16.28 | K7: 5.57 | L7: 2 | M7: =+(N7+O7)+0.5*P7 -> 15.36 | N7: 4.25 | O7: 5.61 | P7: 11
A8: 5 | B8: Redford, "Red" | C8: =+E8+I8+M8 -> 61.74 | D8: =+H8+L8+P8 -> 19 | E8: =+(F8+G8)+0.5*H8 -> 24.64 | F8: 12.97 | G8: 6.17 | H8: 11 | I8: =+(J8+K8)+0.5*L8 -> 25.37 | J8: 15.59 | K8: 6.78 | L8: 6 | M8: =+(N8+O8)+0.5*P8 -> 11.73 | N8: 5.41 | O8: 5.32 | P8: 2
A9: 6 | B9: Young, Jason | C9: =+E9+I9+M9 -> 67.37 | D9: =+H9+L9+P9 -> 23 | E9: =+(F9+G9)+0.5*H9 -> 32.49 | F9: 26.39 | G9: 3.60 | H9: 5 | I9: =+(J9+K9)+0.5*L9 -> 20.95 | J9: 10.66 | K9: 3.79 | L9: 13 | M9: =+(N9+O9)+0.5*P9 -> 13.93 | N9: 4.81 | O9: 6.62 | P9: 5
A10: 7 | B10: Hatch, Perri | C10: =+E10+I10+M10 -> 67.52 | D10: =+H10+L10+P10 -> 16 | E10: =+(F10+G10)+0.5*H10 -> 26.26 | F10: 16.45 | G10: 7.81 | H10: 4 | I10: =+(J10+K10)+0.5*L10 -> 30.58 | J10: 19.07 | K10: 5.51 | L10: 12 | M10: =+(N10+O10)+0.5*P10 -> 10.68 | N10: 6.16 | O10: 4.52 | P10: 0
A11: 8 | B11: Armstrong, Jeremiah | C11: =+E11+I11+M11 -> 69.87 | D11: =+H11+L11+P11 -> 18 | E11: =+(F11+G11)+0.5*H11 -> 33.16 | F11: 16.34 | G11: 11.82 | H11: 10 | I11: =+(J11+K11)+0.5*L11 -> 23.40 | J11: 15.97 | K11: 4.43 | L11: 6 | M11: =+(N11+O11)+0.5*P11 -> 13.31 | N11: 6.15 | O11: 6.16 | P11: 2
A12: 9 | B12: Terry, Dale (Rev) | C12: =+E12+I12+M12 -> 74.37 | D12: =+H12+L12+P12 -> 22 | E12: =+(F12+G12)+0.5*H12 -> 31.53 | F12: 14.78 | G12: 9.75 | H12: 14 | I12: =+(J12+K12)+0.5*L12 -> 32.01 | J12: 21.73 | K12: 7.28 | L12: 6 | M12: =+(N12+O12)+0.5*P12 -> 10.83 | N12: 5.47 | O12: 4.36 | P12: 2
A13: 10 | B13: Zaccardi, Juke | C13: =+E13+I13+M13 -> 77.34 | D13: =+H13+L13+P13 -> 34 | E13: =+(F13+G13)+0.5*H13 -> 32.80 | F13: 19.75 | G13: 5.55 | H13: 15 | I13: =+(J13+K13)+0.5*L13 -> 28.74 | J13: 16.73 | K13: 5.51 | L13: 13 | M13: =+(N13+O13)+0.5*P13 -> 15.80 | N13: 5.12 | O13: 7.68 | P13: 6
A14: 11 | B14: Billings, Scott | C14: =+E14+I14+M14 -> 79.86 | D14: =+H14+L14+P14 -> 56 | E14: =+(F14+G14)+0.5*H14 -> 34.65 | F14: 11.68 | G14: 4.97 | H14: =1+3+6+6+5+2+13 -> 36 | I14: =+(J14+K14)+0.5*L14 -> 30.90 | J14: 15.29 | K14: 5.61 | L14: =2+4+5+2+4+3 -> 20 | M14: =+(N14+O14)+0.5*P14 -> 14.31 | N14: 6.44 | O14: 7.87 | P14: 0
A15: 12 | B15: Mousley, Roger (Rev) | C15: =+E15+I15+M15 -> 81.12 | D15: =+H15+L15+P15 -> 23 | E15: =+(F15+G15)+0.5*H15 -> 31.05 | F15: 19.14 | G15: 9.41 | H15: 5 | I15: =+(J15+K15)+0.5*L15 -> 22.78 | J15: 15.38 | K15: 5.40 | L15: 4 | M15: =+(N15+O15)+0.5*P15 -> 27.29 | N15: 8.72 | O15: 11.57 | P15: 14
A16: 13 | B16: Stone, Scott | C16: =+E16+I16+M16 -> 82.68 | D16: =+H16+L16+P16 -> 52 | E16: =+(F16+G16)+0.5*H16 -> 28.91 | F16: 15.03 | G16: 5.88 | H16: 16 | I16: =+(J16+K16)+0.5*L16 -> 37.76 | J16: 16.47 | K16: 6.29 | L16: 30 | M16: =+(N16+O16)+0.5*P16 -> 16.01 | N16: 6.03 | O16: 6.98 | P16: 6
A17: 14 | B17: Limb, Devin (.22) | C17: =+E17+I17+M17 -> 83.49 | D17: =+H17+L17+P17 -> 17 | E17: =+(F17+G17)+0.5*H17 -> 34.92 | F17: 23.95 | G17: 8.47 | H17: 5 | I17: =+(J17+K17)+0.5*L17 -> 30.04 | J17: 27.11 | K17: 2.93 | L17: 0 | M17: =+(N17+O17)+0.5*P17 -> 18.53 | N17: 6.88 | O17: 5.65 | P17: 12
A18: 15 | B18: Terry, Dale | C18: =+E18+I18+M18 -> 85.08 | D18: =+H18+L18+P18 -> 98 | E18: =+(F18+G18)+0.5*H18 -> 32.01 | F18: 10.02 | G18: 3.49 | H18: =1+2+5+6+6+11+6 -> 37 | I18: =+(J18+K18)+0.5*L18 -> 21.60 | J18: 10.43 | K18: 4.17 | L18: 14 | M18: =+(N18+O18)+0.5*P18 -> 31.47 | N18: 4.19 | O18: 3.78 | P18: 47
A19: 16 | B19: Jepperson, Riley | C19: =+E19+I19+M19 -> 85.48 | D19: =+H19+L19+P19 -> 55 | E19: =+(F19+G19)+0.5*H19 -> 32.16 | F19: 15.65 | G19: 8.01 | H19: 17 | I19: =+(J19+K19)+0.5*L19 -> 30.97 | J19: 14.26 | K19: 5.21 | L19: 23 | M19: =+(N19+O19)+0.5*P19 -> 22.35 | N19: 4.81 | O19: 10.04 | P19: 15
A20: 17 | B20: Taylor, Josh | C20: =+E20+I20+M20 -> 87.42 | D20: =+H20+L20+P20 -> 36 | E20: =+(F20+G20)+0.5*H20 -> 25.02 | F20: 16.19 | G20: 7.33 | H20: 3 | I20: =+(J20+K20)+0.5*L20 -> 32.21 | J20: 17.64 | K20: 8.07 | L20: 13 | M20: =+(N20+O20)+0.5*P20 -> 30.19 | N20: 6.32 | O20: 13.87 | P20: 20
A21: 18 | B21: Walker, Ron | C21: =+E21+I21+M21 -> 91.53 | D21: =+H21+L21+P21 -> 21 | E21: =+(F21+G21)+0.5*H21 -> 41.71 | F21: 27.06 | G21: 6.15 | H21: 17 | I21: =+(J21+K21)+0.5*L21 -> 32.16 | J21: 22.54 | K21: 8.62 | L21: 2 | M21: =+(N21+O21)+0.5*P21 -> 17.66 | N21: 8.73 | O21: 7.93 | P21: 2
A22: 19 | B22: Mousley, Eric (Rev) | C22: =+E22+I22+M22 -> 92.34 | D22: =+H22+L22+P22 -> 42 | E22: =+(F22+G22)+0.5*H22 -> 41.84 | F22: 18.13 | G22: 11.71 | H22: =1+1+1+1+3+3+4+6+4 -> 24 | I22: =+(J22+K22)+0.5*L22 -> 31.47 | J22: 19.03 | K22: 5.94 | L22: 13 | M22: =+(N22+O22)+0.5*P22 -> 19.03 | N22: 8.43 | O22: 8.10 | P22: 5
A23: 20 | B23: Christensen, Jesse | C23: =+E23+I23+M23 -> 92.70 | D23: =+H23+L23+P23 -> 59 | E23: =+(F23+G23)+0.5*H23 -> 32.76 | F23: 17.83 | G23: 5.43 | H23: =1+2+4+8+4 -> 19 | I23: =+(J23+K23)+0.5*L23 -> 44.26 | J23: 22.05 | K23: 5.21 | L23: =1+4+6+6+4+13 -> 34 | M23: =+(N23+O23)+0.5*P23 -> 15.68 | N23: 6.03 | O23: 6.65 | P23: 6
A24: 21 | B24: Scott, Alan | C24: =+E24+I24+M24 -> 94.82 | D24: =+H24+L24+P24 -> 86 | E24: =+(F24+G24)+0.5*H24 -> 28.16 | F24: 14.96 | G24: 4.70 | H24: 17 | I24: =+(J24+K24)+0.5*L24 -> 51.51 | J24: 18.09 | K24: 4.42 | L24: =5+5+2+4+16+6+20 -> 58 | M24: =+(N24+O24)+0.5*P24 -> 15.15 | N24: 4.83 | O24: 4.82 | P24: 11
A25: 22 | B25: Dockstader, Jeff | C25: =+E25+I25+M25 -> 97.48 | D25: =+H25+L25+P25 -> 100 | E25: =+(F25+G25)+0.5*H25 -> 25.82 | F25: 12.54 | G25: 6.28 | H25: 14 | I25: =+(J25+K25)+0.5*L25 -> 42.64 | J25: 11.36 | K25: 4.28 | L25: 54 | M25: =+(N25+O25)+0.5*P25 -> 29.02 | N25: 6.47 | O25: 6.55 | P25: 32
A26: 23 | B26: Brown, Michael | C26: =+E26+I26+M26 -> 97.83 | D26: =+H26+L26+P26 -> 31 | E26: =+(F26+G26)+0.5*H26 -> 46.96 | F26: 27.03 | G26: 11.93 | H26: 16 | I26: =+(J26+K26)+0.5*L26 -> 33.32 | J26: 17.45 | K26: 8.37 | L26: 15 | M26: =+(N26+O26)+0.5*P26 -> 17.55 | N26: 8.39 | O26: 9.16 | P26: 0
A27: 24 | B27: Redford, Noel | C27: =+E27+I27+M27 -> 99.01 | D27: =+H27+L27+P27 -> 47 | E27: =+(F27+G27)+0.5*H27 -> 27.73 | F27: 16.27 | G27: 7.96 | H27: 7 | I27: =+(J27+K27)+0.5*L27 -> 49.24 | J27: 25.13 | K27: 9.61 | L27: 29 | M27: =+(N27+O27)+0.5*P27 -> 22.04 | N27: 7.96 | O27: 8.58 | P27: 11
A28: 25 | B28: Limb, Trent (.22) | C28: =+E28+I28+M28 -> 99.93 | D28: =+H28+L28+P28 -> 21 | E28: =+(F28+G28)+0.5*H28 -> 34.45 | F28: 21.63 | G28: 7.82 | H28: 10 | I28: =+(J28+K28)+0.5*L28 -> 42.16 | J28: 29.88 | K28: 7.28 | L28: 10 | M28: =+(N28+O28)+0.5*P28 -> 23.32 | N28: 13.87 | O28: 8.95 | P28: 1
A29: 26 | B29: Johnson, Dixie (.22) | C29: =+E29+I29+M29 -> 103.55 | D29: =+H29+L29+P29 -> 26 | E29: =+(F29+G29)+0.5*H29 -> 38.84 | F29: 24.20 | G29: 9.14 | H29: 11 | I29: =+(J29+K29)+0.5*L29 -> 48.66 | J29: 34.16 | K29: 11.00 | L29: 7 | M29: =+(N29+O29)+0.5*P29 -> 16.05 | N29: 5.93 | O29: 6.12 | P29: 8
A30: 27 | B30: Dunn, John | C30: =+E30+I30+M30 -> 110.36 | D30: =+H30+L30+P30 -> 35 | E30: =+(F30+G30)+0.5*H30 -> 46.39 | F30: 18.63 | G30: 19.26 | H30: 17 | I30: =+(J30+K30)+0.5*L30 -> 36.66 | J30: 17.59 | K30: 10.07 | L30: 18 | M30: =+(N30+O30)+0.5*P30 -> 27.31 | N30: 7.02 | O30: 20.29 | P30: 0
A31: 28 | B31: Simons, Brad | C31: =+E31+I31+M31 -> 111.41 | D31: =+H31+L31+P31 -> 76 | E31: =+(F31+G31)+0.5*H31 -> 40.67 | F31: 19.54 | G31: 10.13 | H31: =1+3+3+5+5+1+1+3 -> 22 | I31: =+(J31+K31)+0.5*L31 -> 50.38 | J31: 15.98 | K31: 12.40 | L31: =8+10+8+3+5+10 -> 44 | M31: =+(N31+O31)+0.5*P31 -> 20.36 | N31: 7.33 | O31: 8.03 | P31: 10
A32: 29 | B32: Scott, Michael | C32: =+E32+I32+M32 -> 115.97 | D32: =+H32+L32+P32 -> 103 | E32: =+(F32+G32)+0.5*H32 -> 44.47 | F32: 20.83 | G32: 10.14 | H32: =6+1+3+1+16 -> 27 | I32: =+(J32+K32)+0.5*L32 -> 47.12 | J32: 17.40 | K32: 4.72 | L32: =4+6+6+6+7+1+20 -> 50 | M32: =+(N32+O32)+0.5*P32 -> 24.38 | N32: 6.10 | O32: 5.28 | P32: 26
A33: 30 | B33: Simons, Jordan | C33: =+E33+I33+M33 -> 118.17 | D33: =+H33+L33+P33 -> 110 | E33: =+(F33+G33)+0.5*H33 -> 49.59 | F33: 18.51 | G33: 6.08 | H33: =1+3+3+6+8+10+9+10 -> 50 | I33: =+(J33+K33)+0.5*L33 -> 48.01 | J33: 18.64 | K33: 6.87 | L33: =3+1+6+10+9+16 -> 45 | M33: =+(N33+O33)+0.5*P33 -> 20.57 | N33: 6.59 | O33: 6.48 | P33: 15
A34: 31 | B34: Hansen, Lacee | C34: =+E34+I34+M34 -> 152.38 | D34: =+H34+L34+P34 -> 96 | E34: =+(F34+G34)+0.5*H34 -> 61.91 | F34: 22.69 | G34: 8.72 | H34: =1+3+1+16+3+11+10+16 -> 61 | I34: =+(J34+K34)+0.5*L34 -> 57.92 | J34: 39.53 | K34: 8.39 | L34: =2+4+5+5+4 -> 20 | M34: =+(N34+O34)+0.5*P34 -> 32.55 | N34: 12.91 | O34: 12.14 | P34: 15
A35: 32 | B35: Stone, Marylee (.22) | C35: =+E35+I35+M35 -> 194.06 | D35: =+H35+L35+P35 -> 86 | E35: =+(F35+G35)+0.5*H35 -> 63.15 | F35: 35.51 | G35: 13.14 | H35: =1+3+3+5+6+4+4+3 -> 29 | I35: =+(J35+K35)+0.5*L35 -> 49.84 | J35: 14.98 | K35: 13.86 | L35: 42 | M35: =+(N35+O35)+0.5*P35 -> 81.07 | N35: 61.16 | O35: 12.41 | P35: 15
A36: Notes:
A37: - | B37: Remember, the "Fun" Shoot is held on the 1st and 3rd Tuesday of each month ( 6:30 p.m.) at Range Masters.
A38: - | B38: You can use ANY handgun you want, as long as it can be safely drawn from a strong-side holster.
A39: - | B39: IDPA format and scoring.
A40: PD | B40: = Points Down = .5 seconds x Points Down
A41: XX | B41: Indicates that the Points Down value includes some kind of penalty (Procedural Error, Hits on Non-Threat, Misses on Steel, etc.)
A42: (Rev) | B42: = Revolver
A43: DNF | B43: = Did Not Finish