B1: Range Masters "Fun" Shoot | I1: Results for October 19, 2004
A2: Click on Stage # for view of COF
B3: Name (Note) | C3: Shoot Total | D3: Total Points Down
A4: Place | E4: Stage 1 | F4: String 1 | G4: String 2 | H4: PD | I4: Stage 2 | J4: String 1 | K4: String 2 | L4: PD | M4: Stage 3 | N4: String 1 | O4: String 2 | P4: PD
A5: 1 | B5: Collins, Ken | C5: =+E5+I5+M5 -> 57.26 | D5: =+H5+L5+P5 -> 3 | E5: =+(F5+G5)+0.5*H5 -> 22.76 | F5: 10.59 | G5: 11.17 | H5: 2 | I5: =+(J5+K5)+0.5*L5 -> 23.38 | J5: 16.10 | K5: 6.78 | L5: 1 | M5: =+(N5+O5)+0.5*P5 -> 11.12 | N5: 5.76 | O5: 5.36 | P5: 0
A6: 2 | B6: Young, Ren | C6: =+E6+I6+M6 -> 58.31 | D6: =+H6+L6+P6 -> 10 | E6: =+(F6+G6)+0.5*H6 -> 19.68 | F6: 9.17 | G6: 9.01 | H6: 3 | I6: =+(J6+K6)+0.5*L6 -> 21.93 | J6: 12.34 | K6: 6.09 | L6: =1+2+1+2+1 -> 7 | M6: =+(N6+O6)+0.5*P6 -> 16.70 | N6: 9.79 | O6: 6.91 | P6: 0
A7: 3 | B7: Rodriquez, Mike | C7: =+E7+I7+M7 -> 73.81 | D7: =+H7+L7+P7 -> 19 | E7: =+(F7+G7)+0.5*H7 -> 25.05 | F7: 9.83 | G7: 9.72 | H7: =1+1+3+3+3 -> 11 | I7: =+(J7+K7)+0.5*L7 -> 27.42 | J7: 17.63 | K7: 5.79 | L7: =2+2+2+2 -> 8 | M7: =+(N7+O7)+0.5*P7 -> 21.34 | N7: 10.66 | O7: 10.68 | P7: 0
A8: 4 | B8: Stone, Scott | C8: =+E8+I8+M8 -> 76.67 | D8: =+H8+L8+P8 -> 21 | E8: =+(F8+G8)+0.5*H8 -> 28.23 | F8: 10.39 | G8: 10.34 | H8: =1+2+1+4+3+4 -> 15 | I8: =+(J8+K8)+0.5*L8 -> 27.76 | J8: 19.22 | K8: 5.54 | L8: =1+2+2+1 -> 6 | M8: =+(N8+O8)+0.5*P8 -> 20.68 | N8: 12.96 | O8: 7.72 | P8: 0
A9: 5 | B9: Hill, Randy | C9: =+E9+I9+M9 -> 78.57 | D9: =+H9+L9+P9 -> 11 | E9: =+(F9+G9)+0.5*H9 -> 37.07 | F9: 20.40 | G9: 13.17 | H9: 7 | I9: =+(J9+K9)+0.5*L9 -> 23.18 | J9: 14.70 | K9: 6.48 | L9: 4 | M9: =+(N9+O9)+0.5*P9 -> 18.32 | N9: 10.47 | O9: 7.85 | P9: 0
A10: 6 | B10: Phillips, RDan | C10: =+E10+I10+M10 -> 80.29 | D10: =+H10+L10+P10 -> 7 | E10: =+(F10+G10)+0.5*H10 -> 29.28 | F10: 12.06 | G10: 15.22 | H10: =1+1+1+1 -> 4 | I10: =+(J10+K10)+0.5*L10 -> 27.19 | J10: 17.63 | K10: 8.06 | L10: =1+1+1 -> 3 | M10: =+(N10+O10)+0.5*P10 -> 23.82 | N10: 11.01 | O10: 12.81 | P10: 0
A11: 7 | B11: Huff, Blake | C11: =+E11+I11+M11 -> 89.27 | D11: =+H11+L11+P11 -> 19 | E11: =+(F11+G11)+0.5*H11 -> 35.59 | F11: 15.67 | G11: 13.92 | H11: =1+5+1+5 -> 12 | I11: =+(J11+K11)+0.5*L11 -> 32.00 | J11: 18.94 | K11: 9.56 | L11: =1+3+1+2 -> 7 | M11: =+(N11+O11)+0.5*P11 -> 21.68 | N11: 9.47 | O11: 12.21 | P11: 0
A12: 8 | B12: Dockstader, Jeff | C12: =+E12+I12+M12 -> 89.74 | D12: =+H12+L12+P12 -> 40 | E12: =+(F12+G12)+0.5*H12 -> 34.29 | F12: 13.44 | G12: 13.35 | H12: =1+3+1+10 -> 15 | I12: =+(J12+K12)+0.5*L12 -> 29.80 | J12: 14.97 | K12: 7.33 | L12: =1+1+1+4+4+4 -> 15 | M12: =+(N12+O12)+0.5*P12 -> 25.65 | N12: 9.98 | O12: 10.67 | P12: 10
A13: 9 | B13: Redford, Kent | C13: =+E13+I13+M13 -> 90.99 | D13: =+H13+L13+P13 -> 22 | E13: =+(F13+G13)+0.5*H13 -> 27.37 | F13: 11.82 | G13: 13.55 | H13: =2+2 -> 4 | I13: =+(J13+K13)+0.5*L13 -> 39.96 | J13: 23.22 | K13: 7.74 | L13: =2+2+4+3+3+4 -> 18 | M13: =+(N13+O13)+0.5*P13 -> 23.66 | N13: 14.92 | O13: 8.74 | P13: 0
A14: 10 | B14: Hood, Neil | C14: =+E14+I14+M14 -> 91.36 | D14: =+H14+L14+P14 -> 9 | E14: =+(F14+G14)+0.5*H14 -> 33.23 | F14: 19.58 | G14: 12.65 | H14: 2 | I14: =+(J14+K14)+0.5*L14 -> 35.57 | J14: 22.72 | K14: 9.35 | L14: =1+3+1+1+1 -> 7 | M14: =+(N14+O14)+0.5*P14 -> 22.56 | N14: 12.82 | O14: 9.74 | P14: 0
A15: 11 | B15: Scott, Alan | C15: =+E15+I15+M15 -> 95.52 | D15: =+H15+L15+P15 -> 12 | E15: =+(F15+G15)+0.5*H15 -> 35.53 | F15: 20.80 | G15: 13.73 | H15: 2 | I15: =+(J15+K15)+0.5*L15 -> 33.58 | J15: 21.80 | K15: 6.78 | L15: =1+1+3+4+1 -> 10 | M15: =+(N15+O15)+0.5*P15 -> 26.41 | N15: 17.46 | O15: 8.95 | P15: 0
A16: 12 | B16: Scott, Michael | C16: =+E16+I16+M16 -> 101.59 | D16: =+H16+L16+P16 -> 11 | E16: =+(F16+G16)+0.5*H16 -> 30.71 | F16: 15.46 | G16: 12.75 | H16: =2+3 -> 5 | I16: =+(J16+K16)+0.5*L16 -> 37.51 | J16: 22.39 | K16: 12.12 | L16: =2+1+3 -> 6 | M16: =+(N16+O16)+0.5*P16 -> 33.37 | N16: 21.62 | O16: 11.75 | P16: 0
A17: 13 | B17: Hill, Kyle | C17: =+E17+I17+M17 -> 105.74 | D17: =+H17+L17+P17 -> 21 | E17: =+(F17+G17)+0.5*H17 -> 47.87 | F17: 20.83 | G17: 21.04 | H17: =1+1+1+1+6+2 -> 12 | I17: =+(J17+K17)+0.5*L17 -> 31.62 | J17: 20.52 | K17: 6.60 | L17: =2+1+1+2+3 -> 9 | M17: =+(N17+O17)+0.5*P17 -> 26.25 | N17: 16.21 | O17: 10.04 | P17: 0
A18: 14 | B18: Simpson, Harold | C18: =+E18+I18+M18 -> 105.80 | D18: =+H18+L18+P18 -> 13 | E18: =+(F18+G18)+0.5*H18 -> 38.30 | F18: 21.40 | G18: 15.40 | H18: =1+1+1 -> 3 | I18: =+(J18+K18)+0.5*L18 -> 33.58 | J18: 21.43 | K18: 7.15 | L18: =1+1+2+5+1 -> 10 | M18: =+(N18+O18)+0.5*P18 -> 33.92 | N18: 21.18 | O18: 12.74 | P18: 0
A19: 15 | B19: Andrus, Jay | C19: =+E19+I19+M19 -> 114.01 | D19: =+H19+L19+P19 -> 17 | E19: =+(F19+G19)+0.5*H19 -> 40.17 | F19: 19.40 | G19: 16.77 | H19: =1+3+1+1+2 -> 8 | I19: =+(J19+K19)+0.5*L19 -> 39.84 | J19: 26.48 | K19: 8.86 | L19: =1+1+1+2+2+2 -> 9 | M19: =+(N19+O19)+0.5*P19 -> 34.00 | N19: 21.81 | O19: 12.19 | P19: 0
A20: 16 | B20: Brown, Mike | C20: =+E20+I20+M20 -> 114.70 | D20: =+H20+L20+P20 -> 40 | E20: =+(F20+G20)+0.5*H20 -> 33.12 | F20: 14.27 | G20: 13.35 | H20: =1+1+1+8 -> 11 | I20: =+(J20+K20)+0.5*L20 -> 39.90 | J20: 17.40 | K20: 8.00 | L20: =1+2+4+6+2+4+10 -> 29 | M20: =+(N20+O20)+0.5*P20 -> 41.68 | N20: 23.85 | O20: 17.83 | P20: 0
A21: 17 | B21: Loveless, Doug | C21: =+E21+I21+M21 -> 120.80 | D21: =+H21+L21+P21 -> 36 | E21: =+(F21+G21)+0.5*H21 -> 57.48 | F21: 13.96 | G21: 41.02 | H21: =1+1+1+1+1 -> 5 | I21: =+(J21+K21)+0.5*L21 -> 43.88 | J21: 21.14 | K21: 7.24 | L21: =1+4+6+6+10+4 -> 31 | M21: =+(N21+O21)+0.5*P21 -> 19.44 | N21: 8.26 | O21: 11.18 | P21: 0
A22: 18 | B22: Simons, Jordan | C22: =+E22+I22+M22 -> 123.35 | D22: =+H22+L22+P22 -> 34 | E22: =+(F22+G22)+0.5*H22 -> 36.59 | F22: 15.23 | G22: 13.86 | H22: =1+14 -> 15 | I22: =+(J22+K22)+0.5*L22 -> 46.70 | J22: 25.23 | K22: 11.97 | L22: =1+2+8+2+2+4 -> 19 | M22: =+(N22+O22)+0.5*P22 -> 40.06 | N22: 26.37 | O22: 13.69 | P22: 0
A23: 19 | B23: Burney, Carl | C23: =+E23+I23+M23 -> 124.69 | D23: =+H23+L23+P23 -> 21 | E23: =+(F23+G23)+0.5*H23 -> 50.36 | F23: 24.03 | G23: 19.33 | H23: =2+1+1+10 -> 14 | I23: =+(J23+K23)+0.5*L23 -> 42.24 | J23: 26.34 | K23: 12.40 | L23: =1+2+1+3 -> 7 | M23: =+(N23+O23)+0.5*P23 -> 32.09 | N23: 19.57 | O23: 12.52 | P23: 0
A24: 20 | B24: Jepperson, Riley | C24: =+E24+I24+M24 -> 142.89 | D24: =+H24+L24+P24 -> 92 | E24: =+(F24+G24)+0.5*H24 -> 41.58 | F24: 14.94 | G24: 13.14 | H24: =2+6+5+5+9 -> 27 | I24: =+(J24+K24)+0.5*L24 -> 32.43 | J24: 14.91 | K24: 5.02 | L24: =4+3+4+6+2+6 -> 25 | M24: =+(N24+O24)+0.5*P24 -> 68.88 | N24: 27.95 | O24: 20.93 | P24: 40
A25: 21 | B25: Carr, Robert (Rev) | C25: =+E25+I25+M25 -> 177.89 | D25: =+H25+L25+P25 -> 4 | E25: =+(F25+G25)+0.5*H25 -> 67.00 | F25: 44.46 | G25: 22.04 | H25: 1 | I25: =+(J25+K25)+0.5*L25 -> 43.49 | J25: 31.76 | K25: 10.23 | L25: =1+1+1 -> 3 | M25: =+(N25+O25)+0.5*P25 -> 67.40 | N25: 25.37 | O25: 42.03 | P25: 0
A26: 22 | B26: Terry, Marshall | C26: =+E26+I26+M26 -> 183.11 | D26: =+H26+L26+P26 -> 73 | E26: =+(F26+G26)+0.5*H26 -> 68.36 | F26: 24.30 | G26: 26.06 | H26: =1+7+6+8+2+12 -> 36 | I26: =+(J26+K26)+0.5*L26 -> 62.79 | J26: 34.75 | K26: 9.54 | L26: =10+8+8+2+1+8 -> 37 | M26: =+(N26+O26)+0.5*P26 -> 51.96 | N26: 25.67 | O26: 26.29 | P26: 0
A27: 23 | B27: Herring, Erin (.22) | C27: =+E27+I27+M27 -> 190.24 | D27: =+H27+L27+P27 -> 14 | E27: =+(F27+G27)+0.5*H27 -> 61.68 | F27: 29.07 | G27: 28.61 | H27: =1+5+2 -> 8 | I27: =+(J27+K27)+0.5*L27 -> 63.64 | J27: 44.19 | K27: 16.45 | L27: =1+1+4 -> 6 | M27: =+(N27+O27)+0.5*P27 -> 64.92 | N27: 32.34 | O27: 32.58 | P27: 0
A28: 24 | B28: Stone, Marylee | C28: =+E28+I28+M28 -> 303.07 | D28: =+H28+L28+P28 -> 103 | E28: =+(F28+G28)+0.5*H28 -> 76.53 | F28: 29.98 | G28: 30.55 | H28: =2+2+2+7+1+7+11 -> 32 | I28: =+(J28+K28)+0.5*L28 -> 54.80 | J28: 29.03 | K28: 5.27 | L28: =6+6+10+6+8+5 -> 41 | M28: =+(N28+O28)+0.5*P28 -> 171.74 | N28: 80.40 | O28: 76.34 | P28: 30
A29: Notes:
A30: - | B30: Remember, the "Fun" Shoot is held on the 1st and 3rd Tuesday of each month ( 6:30 p.m.) at Range Masters.
A31: - | B31: You can use ANY handgun you want, as long as it can be safely drawn from a strong-side holster.
A32: - | B32: IDPA format and scoring.
A33: PD | B33: = Points Down = .5 seconds x Points Down
A34: XX | B34: Indicates that the Points Down value includes some kind of penalty (Procedural Error, Hits on Non-Threat, Misses on Steel, etc.)
A35: (Rev) | B35: = Revolver
A36: DNF | B36: = Did Not Finish