A2: UDPL Match Results for Oct. 23, 2004 | I2: (Sorted by Division.)
A3: Handgun Match - Note: This was NOT an IDPA match.
B4: Click here for results by Time. | F4: Click on Stage # for COF description.
A5: Place | B5: Name | C5: *DIV | D5: Shoot | E5: Total PD | F5: Stage 1 | G5: String | H5: PD | I5: Stage 2 | J5: String | K5: String | L5: PD | M5: Stage 3 | N5: String | O5: PD | P5: Stage 4 | Q5: String | R5: PD | S5: Stage 5 | T5: String | U5: PD | V5: Stage 6 | W5: String | X5: String | Y5: PD | Z5: Stage 7 | AA5: String | AB5: String | AC5: PD
D6: Total | G6: 1 | J6: 1 | K6: 2 | N6: 1 | Q6: 1 | T6: 1 | W6: 1 | X6: 2 | AA6: 1 | AB6: 2
A7: 1 | B7: Latham, Corey | C7: HiCAP | D7: =+F7+I7+M7+P7+S7+V7+Z7 -> 182.47 | E7: =+H7+L7+O7+R7+U7+Y7+AC7 -> 42 | F7: =+(G7)+H7*0.5 -> 22.45 | G7: 19.95 | H7: =2+2+1 -> 5 | I7: =+(J7+K7)+L7*0.5 -> 25.98 | J7: 9.90 | K7: 12.58 | L7: =5+1+1 -> 7 | M7: =+N7+(O7*0.5) -> 22.90 | N7: 21.90 | O7: =1+1 -> 2 | P7: =+(Q7)+R7*0.5 -> 32.25 | Q7: 31.25 | R7: =1+1 -> 2 | S7: =+(T7)+U7*0.5 -> 23.09 | T7: 23.09 | U7: 0 | V7: =+(W7+X7)+Y7*0.5 -> 33.13 | W7: 9.04 | X7: 13.09 | Y7: =3+2+7+10 -> 22 | Z7: =+(AA7+AB7)+AC7*0.5 -> 22.67 | AA7: 10.60 | AB7: 10.07 | AC7: =1+1+2 -> 4
A8: 2 | B8: Ostler, Jeff | C8: HiCAP | D8: =+F8+I8+M8+P8+S8+V8+Z8 -> 232.52 | E8: =+H8+L8+O8+R8+U8+Y8+AC8 -> 16 | F8: =+(G8)+H8*0.5 -> 30.85 | G8: 30.35 | H8: 1 | I8: =+(J8+K8)+L8*0.5 -> 53.98 | J8: 12.83 | K8: 38.65 | L8: =1+2+2 -> 5 | M8: =+N8+(O8*0.5) -> 26.58 | N8: 26.58 | O8: 0 | P8: =+(Q8)+R8*0.5 -> 43.14 | Q8: 40.14 | R8: 6 | S8: =+(T8)+U8*0.5 -> 26.56 | T8: 26.56 | U8: 0 | V8: =+(W8+X8)+Y8*0.5 -> 28.55 | W8: 9.89 | X8: 17.66 | Y8: =1+1 -> 2 | Z8: =+(AA8+AB8)+AC8*0.5 -> 22.86 | AA8: 10.05 | AB8: 11.81 | AC8: =1+1 -> 2
A9: 3 | B9: Lowe, John | C9: HiCAP | D9: =+F9+I9+M9+P9+S9+V9+Z9 -> 234.67 | E9: =+H9+L9+O9+R9+U9+Y9+AC9 -> 68 | F9: =+(G9)+H9*0.5 -> 31.57 | G9: 23.57 | H9: =1+2+2+1+4+6 -> 16 | I9: =+(J9+K9)+L9*0.5 -> 37.06 | J9: 14.17 | K9: 18.89 | L9: =5+2+1 -> 8 | M9: =+N9+(O9*0.5) -> 24.13 | N9: 22.63 | O9: 3 | P9: =+(Q9)+R9*0.5 -> 59.38 | Q9: 56.38 | R9: =2+2+1+1 -> 6 | S9: =+(T9)+U9*0.5 -> 27.04 | T9: 22.04 | U9: =1+5+3+1 -> 10 | V9: =+(W9+X9)+Y9*0.5 -> 28.57 | W9: 8.92 | X9: 11.65 | Y9: =1+2+11+2 -> 16 | Z9: =+(AA9+AB9)+AC9*0.5 -> 26.92 | AA9: 11.25 | AB9: 11.17 | AC9: =5+1+3 -> 9
A10: 4 | B10: Thomas, Kevin | C10: HiCAP | D10: =+F10+I10+M10+P10+S10+V10+Z10 -> 239.34 | E10: =+H10+L10+O10+R10+U10+Y10+AC10 -> 42 | F10: =+(G10)+H10*0.5 -> 25.85 | G10: 24.85 | H10: =1+1 -> 2 | I10: =+(J10+K10)+L10*0.5 -> 31.65 | J10: 14.72 | K10: 13.93 | L10: =1+2+3 -> 6 | M10: =+N10+(O10*0.5) -> 34.84 | N10: 32.84 | O10: =3+1 -> 4 | P10: =+(Q10)+R10*0.5 -> 43.75 | Q10: 42.25 | R10: =1+1+1 -> 3 | S10: =+(T10)+U10*0.5 -> 34.42 | T10: 27.42 | U10: =1+3+10 -> 14 | V10: =+(W10+X10)+Y10*0.5 -> 29.12 | W10: 11.34 | X10: 12.78 | Y10: =5+5 -> 10 | Z10: =+(AA10+AB10)+AC10*0.5 -> 39.71 | AA10: 17.84 | AB10: 20.37 | AC10: =1+1+1 -> 3
A11: 5 | B11: Hill, Randy | C11: HiCAP | D11: =+F11+I11+M11+P11+S11+V11+Z11 -> 393.59 | E11: =+H11+L11+O11+R11+U11+Y11+AC11 -> 88 | F11: =+(G11)+H11*0.5 -> 37.83 | G11: 25.83 | H11: =1+7+5+2+9 -> 24 | I11: =+(J11+K11)+L11*0.5 -> 104.43 | J11: 20.56 | K11: 71.87 | L11: =8+3+3+10 -> 24 | M11: =+N11+(O11*0.5) -> 41.05 | N11: 38.55 | O11: =1+2+1+1 -> 5 | P11: =+(Q11)+R11*0.5 -> 79.43 | Q11: 69.93 | R11: =1+4+2+2+10 -> 19 | S11: =+(T11)+U11*0.5 -> 39.69 | T11: 39.19 | U11: 1 | V11: =+(W11+X11)+Y11*0.5 -> 34.36 | W11: 14.46 | X11: 15.40 | Y11: =1+1+7 -> 9 | Z11: =+(AA11+AB11)+AC11*0.5 -> 56.80 | AA11: 24.71 | AB11: 29.09 | AC11: =2+2+2 -> 6
A12: 6 | B12: Nielsen, Todd | C12: HiCAP | D12: =+F12+I12+M12+P12+S12+V12+Z12 -> 516.66 | E12: =+H12+L12+O12+R12+U12+Y12+AC12 -> 145 | F12: =+(G12)+H12*0.5 -> 55.48 | G12: 40.98 | H12: =7+4+2+2+5+9 -> 29 | I12: =+(J12+K12)+L12*0.5 -> 118.58 | J12: 45.92 | K12: 66.16 | L12: =4+2+7 -> 13 | M12: =+N12+(O12*0.5) -> 53.93 | N12: 49.93 | O12: =2+1+5 -> 8 | P12: =+(Q12)+R12*0.5 -> 93.54 | Q12: 78.04 | R12: =4+5+4+4+6+8 -> 31 | S12: =+(T12)+U12*0.5 -> 55.46 | T12: 50.96 | U12: =1+1+3+1+1+1+1 -> 9 | V12: =+(W12+X12)+Y12*0.5 -> 68.24 | W12: 20.10 | X12: 21.14 | Y12: =7+5+14+8+20 -> 54 | Z12: =+(AA12+AB12)+AC12*0.5 -> 71.43 | AA12: 39.25 | AB12: 31.68 | AC12: 1
A13: 1 | B13: Collins, Ken | C13: OPEN | D13: =+F13+I13+M13+P13+S13+V13+Z13 -> 206.01 | E13: =+H13+L13+O13+R13+U13+Y13+AC13 -> 16 | F13: =+(G13)+H13*0.5 -> 26.94 | G13: 25.44 | H13: =1+1+1 -> 3 | I13: =+(J13+K13)+L13*0.5 -> 31.40 | J13: 12.20 | K13: 19.20 | L13: 0 | M13: =+N13+(O13*0.5) -> 23.18 | N13: 22.68 | O13: 1 | P13: =+(Q13)+R13*0.5 -> 46.22 | Q13: 43.72 | R13: 5 | S13: =+(T13)+U13*0.5 -> 22.87 | T13: 22.37 | U13: 1 | V13: =+(W13+X13)+Y13*0.5 -> 23.52 | W13: 10.75 | X13: 12.77 | Y13: 0 | Z13: =+(AA13+AB13)+AC13*0.5 -> 31.88 | AA13: 10.34 | AB13: 18.54 | AC13: =1+1+4 -> 6
A14: 2 | B14: Young, Ren | C14: OPEN | D14: =+F14+I14+M14+P14+S14+V14+Z14 -> 239.07 | E14: =+H14+L14+O14+R14+U14+Y14+AC14 -> 38 | F14: =+(G14)+H14*0.5 -> 36.37 | G14: 32.37 | H14: =1+2+1+1+2+1 -> 8 | I14: =+(J14+K14)+L14*0.5 -> 43.77 | J14: 14.48 | K14: 25.29 | L14: =1+7 -> 8 | M14: =+N14+(O14*0.5) -> 31.30 | N14: 30.30 | O14: 2 | P14: =+(Q14)+R14*0.5 -> 40.74 | Q14: 36.74 | R14: =2+3+1+1+1 -> 8 | S14: =+(T14)+U14*0.5 -> 28.17 | T14: 26.17 | U14: =1+1+1+1 -> 4 | V14: =+(W14+X14)+Y14*0.5 -> 31.18 | W14: 13.40 | X14: 15.78 | Y14: =1+1+2 -> 4 | Z14: =+(AA14+AB14)+AC14*0.5 -> 27.54 | AA14: 11.27 | AB14: 14.27 | AC14: =2+1+1 -> 4
A15: 1 | B15: Mousley, Roger | C15: REVOP | D15: =+F15+I15+M15+P15+S15+V15+Z15 -> 232.78 | E15: =+H15+L15+O15+R15+U15+Y15+AC15 -> 23 | F15: =+(G15)+H15*0.5 -> 26.22 | G15: 24.72 | H15: =1+1+1 -> 3 | I15: =+(J15+K15)+L15*0.5 -> 46.90 | J15: 18.20 | K15: 28.20 | L15: 1 | M15: =+N15+(O15*0.5) -> 27.33 | N15: 25.33 | O15: =3+1 -> 4 | P15: =+(Q15)+R15*0.5 -> 31.83 | Q15: 30.83 | R15: =1+1 -> 2 | S15: =+(T15)+U15*0.5 -> 32.24 | T15: 29.24 | U15: =1+1+3+1 -> 6 | V15: =+(W15+X15)+Y15*0.5 -> 36.90 | W15: 14.24 | X15: 19.66 | Y15: =1+5 -> 6 | Z15: =+(AA15+AB15)+AC15*0.5 -> 31.36 | AA15: 13.91 | AB15: 16.95 | AC15: 1
A16: 1 | B16: Griffiths, Todd | C16: TRM | D16: =+F16+I16+M16+P16+S16+V16+Z16 -> 196.94 | E16: =+H16+L16+O16+R16+U16+Y16+AC16 -> 35 | F16: =+(G16)+H16*0.5 -> 21.14 | G16: 20.64 | H16: 1 | I16: =+(J16+K16)+L16*0.5 -> 30.55 | J16: 9.44 | K16: 17.11 | L16: =3+3+2 -> 8 | M16: =+N16+(O16*0.5) -> 23.65 | N16: 22.65 | O16: =1+1 -> 2 | P16: =+(Q16)+R16*0.5 -> 48.83 | Q16: 41.83 | R16: =2+2+10 -> 14 | S16: =+(T16)+U16*0.5 -> 20.72 | T16: 16.72 | U16: =1+5+1+1 -> 8 | V16: =+(W16+X16)+Y16*0.5 -> 24.60 | W16: 10.41 | X16: 13.69 | Y16: 1 | Z16: =+(AA16+AB16)+AC16*0.5 -> 27.45 | AA16: 14.94 | AB16: 12.01 | AC16: 1
A17: 2 | B17: Theodore, Ari | C17: TRM | D17: =+F17+I17+M17+P17+S17+V17+Z17 -> 202.46 | E17: =+H17+L17+O17+R17+U17+Y17+AC17 -> 31 | F17: =+(G17)+H17*0.5 -> 27.77 | G17: 22.77 | H17: =1+5+1+2+1 -> 10 | I17: =+(J17+K17)+L17*0.5 -> 33.46 | J17: 16.38 | K17: 14.58 | L17: =1+3+1 -> 5 | M17: =+N17+(O17*0.5) -> 22.71 | N17: 19.71 | O17: =1+1+4 -> 6 | P17: =+(Q17)+R17*0.5 -> 54.39 | Q17: 50.89 | R17: =2+1+1+1+2 -> 7 | S17: =+(T17)+U17*0.5 -> 16.58 | T17: 16.58 | U17: 0 | V17: =+(W17+X17)+Y17*0.5 -> 23.56 | W17: 10.08 | X17: 12.48 | Y17: =1+1 -> 2 | Z17: =+(AA17+AB17)+AC17*0.5 -> 23.99 | AA17: 11.41 | AB17: 12.08 | AC17: 1
A18: 3 | B18: Mortensen, Bryan | C18: TRM | D18: =+F18+I18+M18+P18+S18+V18+Z18 -> 215.83 | E18: =+H18+L18+O18+R18+U18+Y18+AC18 -> 26 | F18: =+(G18)+H18*0.5 -> 24.43 | G18: 23.43 | H18: =1+1 -> 2 | I18: =+(J18+K18)+L18*0.5 -> 30.09 | J18: 12.79 | K18: 17.30 | L18: 0 | M18: =+N18+(O18*0.5) -> 29.38 | N18: 28.88 | O18: 1 | P18: =+(Q18)+R18*0.5 -> 40.52 | Q18: 39.52 | R18: 2 | S18: =+(T18)+U18*0.5 -> 28.75 | T18: 22.75 | U18: =1+1+10 -> 12 | V18: =+(W18+X18)+Y18*0.5 -> 29.49 | W18: 12.16 | X18: 13.83 | Y18: 7 | Z18: =+(AA18+AB18)+AC18*0.5 -> 33.17 | AA18: 17.77 | AB18: 14.40 | AC18: 2
A19: 4 | B19: Outzen, Craig | C19: TRM | D19: =+F19+I19+M19+P19+S19+V19+Z19 -> 219.54 | E19: =+H19+L19+O19+R19+U19+Y19+AC19 -> 75 | F19: =+(G19)+H19*0.5 -> 39.72 | G19: 20.22 | H19: =4+9+4+3+2+7+10 -> 39 | I19: =+(J19+K19)+L19*0.5 -> 43.18 | J19: 12.66 | K19: 23.02 | L19: =4+7+4 -> 15 | M19: =+N19+(O19*0.5) -> 21.24 | N19: 21.24 | O19: 0 | P19: =+(Q19)+R19*0.5 -> 46.30 | Q19: 44.30 | R19: 4 | S19: =+(T19)+U19*0.5 -> 19.56 | T19: 19.56 | U19: 0 | V19: =+(W19+X19)+Y19*0.5 -> 27.67 | W19: 9.78 | X19: 10.89 | Y19: =2+6+6 -> 14 | Z19: =+(AA19+AB19)+AC19*0.5 -> 21.87 | AA19: 9.83 | AB19: 10.54 | AC19: =1+2 -> 3
A20: 5 | B20: Rodriguez, Mike | C20: TRM | D20: =+F20+I20+M20+P20+S20+V20+Z20 -> 247.67 | E20: =+H20+L20+O20+R20+U20+Y20+AC20 -> 50 | F20: =+(G20)+H20*0.5 -> 30.65 | G20: 24.65 | H20: =8+1+2+1 -> 12 | I20: =+(J20+K20)+L20*0.5 -> 45.41 | J20: 13.01 | K20: 20.40 | L20: =8+9+7 -> 24 | M20: =+N20+(O20*0.5) -> 31.58 | N20: 31.58 | O20: 0 | P20: =+(Q20)+R20*0.5 -> 50.56 | Q20: 48.56 | R20: =1+1+1+1 -> 4 | S20: =+(T20)+U20*0.5 -> 28.43 | T20: 27.93 | U20: 1 | V20: =+(W20+X20)+Y20*0.5 -> 29.91 | W20: 12.48 | X20: 14.43 | Y20: 6 | Z20: =+(AA20+AB20)+AC20*0.5 -> 31.13 | AA20: 15.52 | AB20: 14.11 | AC20: =2+1 -> 3
A21: 6 | B21: Zaccardi, Pat | C21: TRM | D21: =+F21+I21+M21+P21+S21+V21+Z21 -> 267.14 | E21: =+H21+L21+O21+R21+U21+Y21+AC21 -> 46 | F21: =+(G21)+H21*0.5 -> 43.45 | G21: 34.45 | H21: =1+2+9+6 -> 18 | I21: =+(J21+K21)+L21*0.5 -> 51.27 | J21: 19.14 | K21: 26.13 | L21: =3+6+3 -> 12 | M21: =+N21+(O21*0.5) -> 22.81 | N21: 22.81 | O21: 0 | P21: =+(Q21)+R21*0.5 -> 60.67 | Q21: 57.67 | R21: =1+1+1+1+1+1 -> 6 | S21: =+(T21)+U21*0.5 -> 23.86 | T21: 23.36 | U21: 1 | V21: =+(W21+X21)+Y21*0.5 -> 38.05 | W21: 15.90 | X21: 20.15 | Y21: =2+1+1 -> 4 | Z21: =+(AA21+AB21)+AC21*0.5 -> 27.03 | AA21: 12.53 | AB21: 12.00 | AC21: =1+3+1 -> 5
A22: 7 | B22: Vine, Dan | C22: TRM | D22: =+F22+I22+M22+P22+S22+V22+Z22 -> 273.79 | E22: =+H22+L22+O22+R22+U22+Y22+AC22 -> 22 | F22: =+(G22)+H22*0.5 -> 41.13 | G22: 33.63 | H22: =5+10 -> 15 | I22: =+(J22+K22)+L22*0.5 -> 50.59 | J22: 25.05 | K22: 25.04 | L22: 1 | M22: =+N22+(O22*0.5) -> 33.13 | N22: 33.13 | O22: 0 | P22: =+(Q22)+R22*0.5 -> 42.67 | Q22: 42.67 | R22: 0 | S22: =+(T22)+U22*0.5 -> 33.44 | T22: 32.94 | U22: 1 | V22: =+(W22+X22)+Y22*0.5 -> 40.38 | W22: 18.64 | X22: 19.24 | Y22: 5 | Z22: =+(AA22+AB22)+AC22*0.5 -> 32.45 | AA22: 16.00 | AB22: 16.45 | AC22: 0
A23: 8 | B23: Knapp, Chris | C23: TRM | D23: =+F23+I23+M23+P23+S23+V23+Z23 -> 283.23 | E23: =+H23+L23+O23+R23+U23+Y23+AC23 -> 47 | F23: =+(G23)+H23*0.5 -> 30.61 | G23: 27.61 | H23: =1+2+3 -> 6 | I23: =+(J23+K23)+L23*0.5 -> 81.00 | J23: 27.95 | K23: 45.55 | L23: =4+7+4 -> 15 | M23: =+N23+(O23*0.5) -> 29.94 | N23: 29.44 | O23: 1 | P23: =+(Q23)+R23*0.5 -> 47.10 | Q23: 44.10 | R23: =2+1+2+1 -> 6 | S23: =+(T23)+U23*0.5 -> 27.71 | T23: 26.21 | U23: 3 | V23: =+(W23+X23)+Y23*0.5 -> 38.95 | W23: 15.38 | X23: 16.57 | Y23: =2+2+10 -> 14 | Z23: =+(AA23+AB23)+AC23*0.5 -> 27.92 | AA23: 14.89 | AB23: 12.03 | AC23: =1+1 -> 2
A24: 9 | B24: Tekmitchov, George | C24: TRM | D24: =+F24+I24+M24+P24+S24+V24+Z24 -> 293.09 | E24: =+H24+L24+O24+R24+U24+Y24+AC24 -> 71 | F24: =+(G24)+H24*0.5 -> 39.52 | G24: 27.02 | H24: =15+3+5+2 -> 25 | I24: =+(J24+K24)+L24*0.5 -> 46.06 | J24: 15.71 | K24: 22.85 | L24: =4+6+5 -> 15 | M24: =+N24+(O24*0.5) -> 27.20 | N24: 26.20 | O24: =1+1 -> 2 | P24: =+(Q24)+R24*0.5 -> 95.16 | Q24: 85.16 | R24: =2+2+1+1+2+2+10 -> 20 | S24: =+(T24)+U24*0.5 -> 22.78 | T24: 21.78 | U24: =1+1 -> 2 | V24: =+(W24+X24)+Y24*0.5 -> 29.82 | W24: 12.09 | X24: 16.23 | Y24: =1+2 -> 3 | Z24: =+(AA24+AB24)+AC24*0.5 -> 32.55 | AA24: 15.03 | AB24: 15.52 | AC24: =1+3 -> 4
A25: 10 | B25: Simon, Clint | C25: TRM | D25: =+F25+I25+M25+P25+S25+V25+Z25 -> 310.73 | E25: =+H25+L25+O25+R25+U25+Y25+AC25 -> 21 | F25: =+(G25)+H25*0.5 -> 46.13 | G25: 42.13 | H25: =1+1+1+4+1 -> 8 | I25: =+(J25+K25)+L25*0.5 -> 45.25 | J25: 19.84 | K25: 24.91 | L25: 1 | M25: =+N25+(O25*0.5) -> 45.07 | N25: 42.57 | O25: =1+3+1 -> 5 | P25: =+(Q25)+R25*0.5 -> 62.98 | Q25: 61.48 | R25: =1+1+1 -> 3 | S25: =+(T25)+U25*0.5 -> 35.56 | T25: 35.56 | U25: 0 | V25: =+(W25+X25)+Y25*0.5 -> 39.68 | W25: 19.79 | X25: 18.89 | Y25: =1+1 -> 2 | Z25: =+(AA25+AB25)+AC25*0.5 -> 36.06 | AA25: 16.67 | AB25: 18.39 | AC25: 2
A26: 11 | B26: Beck, Dave | C26: TRM | D26: =+F26+I26+M26+P26+S26+V26+Z26 -> 312.17 | E26: =+H26+L26+O26+R26+U26+Y26+AC26 -> 37 | F26: =+(G26)+H26*0.5 -> 35.94 | G26: 32.94 | H26: =2+2+1+1 -> 6 | I26: =+(J26+K26)+L26*0.5 -> 72.09 | J26: 19.32 | K26: 44.27 | L26: =5+2+10 -> 17 | M26: =+N26+(O26*0.5) -> 32.64 | N26: 32.64 | O26: 0 | P26: =+(Q26)+R26*0.5 -> 62.16 | Q26: 58.16 | R26: =1+1+2+4 -> 8 | S26: =+(T26)+U26*0.5 -> 36.32 | T26: 35.82 | U26: 1 | V26: =+(W26+X26)+Y26*0.5 -> 34.17 | W26: 16.38 | X26: 15.29 | Y26: 5 | Z26: =+(AA26+AB26)+AC26*0.5 -> 38.85 | AA26: 22.52 | AB26: 16.33 | AC26: 0
A27: 12 | B27: Zaccardi, Juke | C27: TRM | D27: =+F27+I27+M27+P27+S27+V27+Z27 -> 312.69 | E27: =+H27+L27+O27+R27+U27+Y27+AC27 -> 108 | F27: =+(G27)+H27*0.5 -> 29.99 | G27: 20.49 | H27: =5+1+2+2+4+5 -> 19 | I27: =+(J27+K27)+L27*0.5 -> 100.50 | J27: 40.93 | K27: 39.57 | L27: =8+6+6+20 -> 40 | M27: =+N27+(O27*0.5) -> 20.96 | N27: 19.96 | O27: =1+1 -> 2 | P27: =+(Q27)+R27*0.5 -> 80.88 | Q27: 58.88 | R27: =1+2+1+30+10 -> 44 | S27: =+(T27)+U27*0.5 -> 21.45 | T27: 20.95 | U27: 1 | V27: =+(W27+X27)+Y27*0.5 -> 30.94 | W27: 14.67 | X27: 15.77 | Y27: 1 | Z27: =+(AA27+AB27)+AC27*0.5 -> 27.97 | AA27: 12.02 | AB27: 15.45 | AC27: 1
A28: 13 | B28: Phillips, RDdan | C28: TRM | D28: =+F28+I28+M28+P28+S28+V28+Z28 -> 344.02 | E28: =+H28+L28+O28+R28+U28+Y28+AC28 -> 59 | F28: =+(G28)+H28*0.5 -> 46.85 | G28: 36.85 | H28: =3+4+2+1+10 -> 20 | I28: =+(J28+K28)+L28*0.5 -> 59.47 | J28: 24.99 | K28: 33.48 | L28: 2 | M28: =+N28+(O28*0.5) -> 42.38 | N28: 41.38 | O28: 2 | P28: =+(Q28)+R28*0.5 -> 57.40 | Q28: 53.90 | R28: =2+4+1 -> 7 | S28: =+(T28)+U28*0.5 -> 40.86 | T28: 40.36 | U28: 1 | V28: =+(W28+X28)+Y28*0.5 -> 46.96 | W28: 17.90 | X28: 22.06 | Y28: =4+10 -> 14 | Z28: =+(AA28+AB28)+AC28*0.5 -> 50.10 | AA28: 19.96 | AB28: 23.64 | AC28: =2+1+10 -> 13
A29: 14 | B29: Burden, Pat | C29: TRM | D29: =+F29+I29+M29+P29+S29+V29+Z29 -> 357.16 | E29: =+H29+L29+O29+R29+U29+Y29+AC29 -> 82 | F29: =+(G29)+H29*0.5 -> 47.52 | G29: 42.52 | H29: =1+6+1+2 -> 10 | I29: =+(J29+K29)+L29*0.5 -> 63.66 | J29: 20.69 | K29: 19.47 | L29: =1+1+5+40 -> 47 | M29: =+N29+(O29*0.5) -> 35.94 | N29: 35.44 | O29: 1 | P29: =+(Q29)+R29*0.5 -> 62.95 | Q29: 61.45 | R29: 3 | S29: =+(T29)+U29*0.5 -> 49.04 | T29: 48.04 | U29: =1+1 -> 2 | V29: =+(W29+X29)+Y29*0.5 -> 44.05 | W29: 18.16 | X29: 22.89 | Y29: =1+5 -> 6 | Z29: =+(AA29+AB29)+AC29*0.5 -> 54.00 | AA29: 27.26 | AB29: 20.24 | AC29: =1+2+10 -> 13
A30: 15 | B30: Simpson, Harold | C30: TRM | D30: =+F30+I30+M30+P30+S30+V30+Z30 -> 369.36 | E30: =+H30+L30+O30+R30+U30+Y30+AC30 -> 84 | F30: =+(G30)+H30*0.5 -> 40.56 | G30: 32.06 | H30: =3+3+3+1+3+4 -> 17 | I30: =+(J30+K30)+L30*0.5 -> 64.65 | J30: 21.47 | K30: 38.18 | L30: =2+5+3 -> 10 | M30: =+N30+(O30*0.5) -> 57.08 | N30: 55.58 | O30: =1+1+1 -> 3 | P30: =+(Q30)+R30*0.5 -> 80.74 | Q30: 66.24 | R30: =5+1+1+6+6+10 -> 29 | S30: =+(T30)+U30*0.5 -> 53.20 | T30: 46.70 | U30: =1+1+1+10 -> 13 | V30: =+(W30+X30)+Y30*0.5 -> 37.76 | W30: 18.06 | X30: 16.70 | Y30: =3+3 -> 6 | Z30: =+(AA30+AB30)+AC30*0.5 -> 35.37 | AA30: 13.42 | AB30: 18.95 | AC30: =3+1+2 -> 6
A31: 16 | B31: Pres, Peter | C31: TRM | D31: =+F31+I31+M31+P31+S31+V31+Z31 -> 388.67 | E31: =+H31+L31+O31+R31+U31+Y31+AC31 -> 221 | F31: =+(G31)+H31*0.5 -> 34.05 | G31: 25.05 | H31: =1+4+6+1+6 -> 18 | I31: =+(J31+K31)+L31*0.5 -> 71.59 | J31: 27.96 | K31: 28.63 | L31: =2+4+4+20 -> 30 | M31: =+N31+(O31*0.5) -> 60.93 | N31: 51.93 | O31: =2+2+4+10 -> 18 | P31: =+(Q31)+R31*0.5 -> 88.65 | Q31: 46.15 | R31: =2+3+8+1+6+5+50+10 -> 85 | S31: =+(T31)+U31*0.5 -> 33.17 | T31: 31.67 | U31: =1+1+1 -> 3 | V31: =+(W31+X31)+Y31*0.5 -> 48.20 | W31: 15.38 | X31: 18.82 | Y31: =2+14+12 -> 28 | Z31: =+(AA31+AB31)+AC31*0.5 -> 52.08 | AA31: 18.57 | AB31: 14.01 | AC31: =7+1+11+20 -> 39
A32: 17 | B32: Kirkham, Glade | C32: TRM | D32: =+F32+I32+M32+P32+S32+V32+Z32 -> 429.71 | E32: =+H32+L32+O32+R32+U32+Y32+AC32 -> 60 | F32: =+(G32)+H32*0.5 -> 58.39 | G32: 44.39 | H32: =3+1+1+5+8+10 -> 28 | I32: =+(J32+K32)+L32*0.5 -> 85.18 | J32: 24.91 | K32: 57.27 | L32: =2+2+2 -> 6 | M32: =+N32+(O32*0.5) -> 52.93 | N32: 51.93 | O32: =1+1 -> 2 | P32: =+(Q32)+R32*0.5 -> 94.77 | Q32: 91.27 | R32: =2+1+2+1+1 -> 7 | S32: =+(T32)+U32*0.5 -> 40.59 | T32: 37.59 | U32: =1+5 -> 6 | V32: =+(W32+X32)+Y32*0.5 -> 44.49 | W32: 18.90 | X32: 20.59 | Y32: 10 | Z32: =+(AA32+AB32)+AC32*0.5 -> 53.36 | AA32: 27.62 | AB32: 25.24 | AC32: 1
A33: 18 | B33: Lorenz, David | C33: TRM | D33: =+F33+I33+M33+P33+S33+V33+Z33 -> 440.84 | E33: =+H33+L33+O33+R33+U33+Y33+AC33 -> 37 | F33: =+(G33)+H33*0.5 -> 68.94 | G33: 68.44 | H33: 1 | I33: =+(J33+K33)+L33*0.5 -> 112.21 | J33: 30.45 | K33: 68.26 | L33: =3+1+3+10+10 -> 27 | M33: =+N33+(O33*0.5) -> 44.37 | N33: 44.37 | O33: 0 | P33: =+(Q33)+R33*0.5 -> 74.74 | Q33: 72.74 | R33: =1+1+1+1 -> 4 | S33: =+(T33)+U33*0.5 -> 47.60 | T33: 46.60 | U33: =1+1 -> 2 | V33: =+(W33+X33)+Y33*0.5 -> 51.53 | W33: 24.54 | X33: 25.49 | Y33: =2+1 -> 3 | Z33: =+(AA33+AB33)+AC33*0.5 -> 41.45 | AA33: 17.02 | AB33: 24.43 | AC33: 0
A34: 19 | B34: VanLeuven, Joel | C34: TRM | D34: =+F34+I34+M34+P34+S34+V34+Z34 -> 441.36 | E34: =+H34+L34+O34+R34+U34+Y34+AC34 -> 115 | F34: =+(G34)+H34*0.5 -> 61.33 | G34: 46.33 | H34: =12+8+10 -> 30 | I34: =+(J34+K34)+L34*0.5 -> 79.99 | J34: 31.39 | K34: 31.10 | L34: =7+11+1+1+4+1+10 -> 35 | M34: =+N34+(O34*0.5) -> 47.98 | N34: 47.98 | O34: 0 | P34: =+(Q34)+R34*0.5 -> 66.73 | Q34: 62.23 | R34: =1+2+1+1+4 -> 9 | S34: =+(T34)+U34*0.5 -> 46.04 | T34: 42.04 | U34: =1+1+1+1+3+1 -> 8 | V34: =+(W34+X34)+Y34*0.5 -> 80.01 | W34: 36.02 | X34: 40.99 | Y34: =1+4+1 -> 6 | Z34: =+(AA34+AB34)+AC34*0.5 -> 59.28 | AA34: 21.26 | AB34: 24.52 | AC34: =7+20 -> 27
A35: 20 | B35: Kirkham, Devon (.22) | C35: TRM | D35: =+F35+I35+M35+P35+S35+V35+Z35 -> 453.51 | E35: =+H35+L35+O35+R35+U35+Y35+AC35 -> 139 | F35: =+(G35)+H35*0.5 -> 80.49 | G35: 64.49 | H35: =11+11+2+8 -> 32 | I35: =+(J35+K35)+L35*0.5 -> 79.15 | J35: 31.95 | K35: 40.20 | L35: =6+7+1 -> 14 | M35: =+N35+(O35*0.5) -> 32.77 | N35: 29.27 | O35: =1+1+5 -> 7 | P35: =+(Q35)+R35*0.5 -> 86.17 | Q35: 72.17 | R35: =8+5+6+3+2+4 -> 28 | S35: =+(T35)+U35*0.5 -> 51.66 | T35: 44.66 | U35: =1+5+1+5+1+1 -> 14 | V35: =+(W35+X35)+Y35*0.5 -> 75.80 | W35: 25.42 | X35: 30.38 | Y35: =13+10+17 -> 40 | Z35: =+(AA35+AB35)+AC35*0.5 -> 47.47 | AA35: 25.32 | AB35: 20.15 | AC35: =1+1+2 -> 4
A36: 21 | B36: Barnes, Mike | C36: TRM | D36: =+F36+I36+M36+P36+S36+V36+Z36 -> 471.45 | E36: =+H36+L36+O36+R36+U36+Y36+AC36 -> 93 | F36: =+(G36)+H36*0.5 -> 54.86 | G36: 43.86 | H36: =4+4+1+6+7 -> 22 | I36: =+(J36+K36)+L36*0.5 -> 108.58 | J36: 20.34 | K36: 67.24 | L36: =2+6+4+5+5+5+5+10 -> 42 | M36: =+N36+(O36*0.5) -> 42.84 | N36: 42.84 | O36: 0 | P36: =+(Q36)+R36*0.5 -> 81.19 | Q36: 75.69 | R36: =4+4+1+1+1 -> 11 | S36: =+(T36)+U36*0.5 -> 42.99 | T36: 41.49 | U36: =1+1+1 -> 3 | V36: =+(W36+X36)+Y36*0.5 -> 62.65 | W36: 35.55 | X36: 24.60 | Y36: =2+1+2 -> 5 | Z36: =+(AA36+AB36)+AC36*0.5 -> 78.34 | AA36: 39.42 | AB36: 33.92 | AC36: =2+4+4 -> 10
A37: 22 | B37: Brownlee, Mike | C37: TRM | D37: =+F37+I37+M37+P37+S37+V37+Z37 -> 524.57 | E37: =+H37+L37+O37+R37+U37+Y37+AC37 -> 133 | F37: =+(G37)+H37*0.5 -> 46.27 | G37: 37.27 | H37: =6+8+2+2 -> 18 | I37: =+(J37+K37)+L37*0.5 -> 101.04 | J37: 56.89 | K37: 36.65 | L37: =10+1+4 -> 15 | M37: =+N37+(O37*0.5) -> 52.37 | N37: 44.87 | O37: =1+2+1+1+10 -> 15 | P37: =+(Q37)+R37*0.5 -> 171.54 | Q37: 137.04 | R37: =6+1+1+1+60 -> 69 | S37: =+(T37)+U37*0.5 -> 58.49 | T37: 56.99 | U37: 3 | V37: =+(W37+X37)+Y37*0.5 -> 46.45 | W37: 21.31 | X37: 20.64 | Y37: =2+6+1 -> 9 | Z37: =+(AA37+AB37)+AC37*0.5 -> 48.41 | AA37: 24.55 | AB37: 21.86 | AC37: 4
A38: 23 | B38: Ostler, Jay | C38: TRM | D38: =+F38+I38+M38+P38+S38+V38+Z38 -> 572.61 | E38: =+H38+L38+O38+R38+U38+Y38+AC38 -> 68 | F38: =+(G38)+H38*0.5 -> 90.75 | G38: 87.25 | H38: =1+2+1+1+1+1 -> 7 | I38: =+(J38+K38)+L38*0.5 -> 150.51 | J38: 62.37 | K38: 67.64 | L38: =7+3+1+30 -> 41 | M38: =+N38+(O38*0.5) -> 59.30 | N38: 58.30 | O38: =1+1 -> 2 | P38: =+(Q38)+R38*0.5 -> 64.86 | Q38: 62.86 | R38: =1+1+1+1 -> 4 | S38: =+(T38)+U38*0.5 -> 36.06 | T38: 36.06 | U38: 0 | V38: =+(W38+X38)+Y38*0.5 -> 114.18 | W38: 38.26 | X38: 70.42 | Y38: =1+10 -> 11 | Z38: =+(AA38+AB38)+AC38*0.5 -> 56.95 | AA38: 27.22 | AB38: 28.23 | AC38: 3
A39: 24 | B39: McDermaid, Jen | C39: TRM | D39: =+F39+I39+M39+P39+S39+V39+Z39 -> 601.41 | E39: =+H39+L39+O39+R39+U39+Y39+AC39 -> 164 | F39: =+(G39)+H39*0.5 -> 83.54 | G39: 72.04 | H39: =2+1+1+2+11+6 -> 23 | I39: =+(J39+K39)+L39*0.5 -> 143.87 | J39: 26.93 | K39: 89.94 | L39: =4+6+14+30 -> 54 | M39: =+N39+(O39*0.5) -> 77.82 | N39: 77.82 | O39: 0 | P39: =+(Q39)+R39*0.5 -> 96.96 | Q39: 86.96 | R39: =6+6+1+1+5+1 -> 20 | S39: =+(T39)+U39*0.5 -> 61.25 | T39: 56.25 | U39: =1+1+1+3+3+1 -> 10 | V39: =+(W39+X39)+Y39*0.5 -> 78.55 | W39: 25.55 | X39: 27.50 | Y39: =16+6+8+11+10 -> 51 | Z39: =+(AA39+AB39)+AC39*0.5 -> 59.42 | AA39: 26.17 | AB39: 30.25 | AC39: =1+2+3 -> 6
A40: 25 | B40: Hendricks, Cy | C40: TRM | D40: =+F40+I40+M40+P40+S40+V40+Z40 -> 605.25 | E40: =+H40+L40+O40+R40+U40+Y40+AC40 -> 97 | F40: =+(G40)+H40*0.5 -> 69.51 | G40: 60.51 | H40: =1+2+1+1+3+10 -> 18 | I40: =+(J40+K40)+L40*0.5 -> 154.69 | J40: 72.92 | K40: 71.77 | L40: =7+6+3+4 -> 20 | M40: =+N40+(O40*0.5) -> 52.02 | N40: 50.52 | O40: =1+1+1 -> 3 | P40: =+(Q40)+R40*0.5 -> 105.19 | Q40: 98.19 | R40: =1+1+1+1+10 -> 14 | S40: =+(T40)+U40*0.5 -> 44.86 | T40: 43.86 | U40: =1+1 -> 2 | V40: =+(W40+X40)+Y40*0.5 -> 74.55 | W40: 44.13 | X40: 21.42 | Y40: =7+1+10 -> 18 | Z40: =+(AA40+AB40)+AC40*0.5 -> 104.43 | AA40: 30.56 | AB40: 62.87 | AC40: =1+5+3+3+10 -> 22
A41: 26 | B41: Brown, David | C41: TRM | D41: =+F41+I41+M41+P41+S41+V41+Z41 -> 652.10 | E41: =+H41+L41+O41+R41+U41+Y41+AC41 -> 205 | F41: =+(G41)+H41*0.5 -> 110.28 | G41: 89.78 | H41: =1+7+2+1+10+20 -> 41 | I41: =+(J41+K41)+L41*0.5 -> 137.75 | J41: 93.21 | K41: 39.54 | L41: =1+4+5 -> 10 | M41: =+N41+(O41*0.5) -> 65.72 | N41: 65.72 | O41: 0 | P41: =+(Q41)+R41*0.5 -> 118.15 | Q41: 89.65 | R41: =5+10+6+5+5+5+5+5+1+10 -> 57 | S41: =+(T41)+U41*0.5 -> 47.16 | T41: 45.66 | U41: =1+1+1 -> 3 | V41: =+(W41+X41)+Y41*0.5 -> 102.10 | W41: 44.83 | X41: 33.77 | Y41: =16+11+20 -> 47 | Z41: =+(AA41+AB41)+AC41*0.5 -> 70.94 | AA41: 12.26 | AB41: 35.18 | AC41: =16+10+6+10+5 -> 47
A42: 27 | B42: Brown, Keith | C42: TRM | D42: DNF | E42: DNF | F42: DNF | I42: =+(J42+K42)+L42*0.5 -> 51.08 | J42: 23.44 | K42: 24.14 | L42: =6+1 -> 7 | M42: =+N42+(O42*0.5) -> 33.53 | N42: 32.03 | O42: =1+1+1 -> 3 | P42: =+(Q42)+R42*0.5 -> 49.45 | Q42: 46.45 | R42: =1+5 -> 6 | S42: =+(T42)+U42*0.5 -> 33.83 | T42: 26.33 | U42: =5+10 -> 15 | V42: DNF | Z42: DNF
A43: Notes:
A44: xx | B44: Indicates that the Points Down value includes some kind of penalty (Procedural Error, Hits on Non-Threat or Misses on Steel).
A45: PD | B45: = Points Down value is PD x 5 seconds added to the total stage time.
A46: *DIV | B46: = Divisions: TRM = Ten Round Maximum; HiCAP = High capacity mags, no optics or compensators
B47: REV = Revolver - 8 round max, no optics; REVOP = Revolver - 8 round max, w/optics; OPEN = Anything goes - within the bounds of safety
A48: DNF | B48: = Did Not Finish