A2: Rifle Side Match Results for Oct. 23, 2004
A3: (Sorted by Overall Time without regard for Division.)
A4: Click here for results by DIVISION.
A5: Place | B5: Name | C5: *DIV | D5: Shoot | E5: Total PD | F5: Stage 1 | G5: String | H5: PD | I5: Stage 2 | J5: String | K5: String | L5: PD
D6: Total | G6: 1 | J6: 1 | K6: 2
A7: 1 | B7: Ostler, Jeff | C7: OPTIC | D7: =+F7+I7 -> 58.43 | E7: =+H7+L7 -> 1 | F7: =+(G7)+H7*0.5 -> 37.02 | G7: 36.52 | H7: 1 | I7: =+(J7+K7)+L7*0.5 -> 21.41 | J7: 11.58 | K7: 9.83 | L7: 0
A8: 2 | B8: Latham, Corey | C8: IRON | D8: =+F8+I8 -> 64.14 | E8: =+H8+L8 -> 1 | F8: =+(G8)+H8*0.5 -> 32.40 | G8: 31.90 | H8: 1 | I8: =+(J8+K8)+L8*0.5 -> 31.74 | J8: 15.91 | K8: 15.83 | L8: 0
A9: 3 | B9: Mortensen, Bryan | C9: IRON | D9: =+F9+I9 -> 73.50 | E9: =+H9+L9 -> 5 | F9: =+(G9)+H9*0.5 -> 40.42 | G9: 37.92 | H9: =1+2+1+1 -> 5 | I9: =+(J9+K9)+L9*0.5 -> 33.08 | J9: 20.46 | K9: 12.62 | L9: 0
A10: 4 | B10: Knapp, Chris | C10: IRON | D10: =+F10+I10 -> 92.17 | E10: =+H10+L10 -> 6 | F10: =+(G10)+H10*0.5 -> 41.59 | G10: 38.59 | H10: =1+5 -> 6 | I10: =+(J10+K10)+L10*0.5 -> 50.58 | J10: 27.10 | K10: 23.48 | L10: 0
A11: 5 | B11: Outzen, Craig | C11: OPTIC | D11: =+F11+I11 -> 96.31 | E11: =+H11+L11 -> 3 | F11: =+(G11)+H11*0.5 -> 28.73 | G11: 27.23 | H11: =1+2 -> 3 | I11: =+(J11+K11)+L11*0.5 -> 67.58 | J11: 35.22 | K11: 32.36 | L11: 0
A12: 6 | B12: Zaccardi, Pat | C12: OPTIC | D12: =+F12+I12 -> 101.21 | E12: =+H12+L12 -> 13 | F12: =+(G12)+H12*0.5 -> 37.12 | G12: 30.62 | H12: =2+4+1+1+5 -> 13 | I12: =+(J12+K12)+L12*0.5 -> 64.09 | J12: 36.33 | K12: 27.76 | L12: 0
A13: 7 | B13: Kirkham, Glade | C13: IRON | D13: =+F13+I13 -> 105.68 | E13: =+H13+L13 -> 21 | F13: =+(G13)+H13*0.5 -> 44.10 | G13: 38.60 | H13: =2+4+1+4 -> 11 | I13: =+(J13+K13)+L13*0.5 -> 61.58 | J13: 20.97 | K13: 35.61 | L13: 10
A14: 8 | B14: Beck, Dave | C14: OPTIC | D14: =+F14+I14 -> 111.33 | E14: =+H14+L14 -> 4 | F14: =+(G14)+H14*0.5 -> 35.48 | G14: 33.48 | H14: =1+1+2 -> 4 | I14: =+(J14+K14)+L14*0.5 -> 75.85 | J14: 36.11 | K14: 39.74 | L14: 0
A15: 9 | B15: Brown, Keith | C15: OPTIC | D15: =+F15+I15 -> 120.55 | E15: =+H15+L15 -> 12 | F15: =+(G15)+H15*0.5 -> 41.78 | G15: 35.78 | H15: =1+2+4+3+2 -> 12 | I15: =+(J15+K15)+L15*0.5 -> 78.77 | J15: 38.46 | K15: 40.31 | L15: 0
A16: 10 | B16: Hill, Randy | C16: IRON | D16: =+F16+I16 -> 121.51 | E16: =+H16+L16 -> 22 | F16: =+(G16)+H16*0.5 -> 61.80 | G16: 50.80 | H16: =3+2+3+5+1+1+6+1 -> 22 | I16: =+(J16+K16)+L16*0.5 -> 59.71 | J16: 39.24 | K16: 20.47 | L16: 0
A17: 11 | B17: Lorenz, David | C17: IRON | D17: =+F17+I17 -> 124.40 | E17: =+H17+L17 -> 11 | F17: =+(G17)+H17*0.5 -> 54.73 | G17: 49.23 | H17: =2+1+1+5+2 -> 11 | I17: =+(J17+K17)+L17*0.5 -> 69.67 | J17: 29.40 | K17: 40.27 | L17: 0
A18: 12 | B18: Simon, Clint | C18: OPTIC | D18: =+F18+I18 -> 126.44 | E18: =+H18+L18 -> 3 | F18: =+(G18)+H18*0.5 -> 50.22 | G18: 48.72 | H18: =1+2 -> 3 | I18: =+(J18+K18)+L18*0.5 -> 76.22 | J18: 34.43 | K18: 41.79 | L18: 0
A19: 13 | B19: Tekmitchov, George | C19: OPTIC | D19: =+F19+I19 -> 135.42 | E19: =+H19+L19 -> 36 | F19: =+(G19)+H19*0.5 -> 41.46 | G19: 38.46 | H19: =1+1+1+1+2 -> 6 | I19: =+(J19+K19)+L19*0.5 -> 93.96 | J19: 34.48 | K19: 44.48 | L19: 30
A20: 14 | B20: Lowe, John | C20: OPTIC | D20: =+F20+I20 -> 136.81 | E20: =+H20+L20 -> 4 | F20: =+(G20)+H20*0.5 -> 39.05 | G20: 37.05 | H20: =1+1+1+1 -> 4 | I20: =+(J20+K20)+L20*0.5 -> 97.76 | J20: 58.72 | K20: 39.04 | L20: 0
A21: 15 | B21: Phillips, RDdan | C21: IRON | D21: =+F21+I21 -> 139.09 | E21: =+H21+L21 -> 11 | F21: =+(G21)+H21*0.5 -> 94.10 | G21: 88.60 | H21: =1+5+5 -> 11 | I21: =+(J21+K21)+L21*0.5 -> 44.99 | J21: 24.71 | K21: 20.28 | L21: 0
A22: 16 | B22: Pres, Peter | C22: OPTIC | D22: =+F22+I22 -> 139.96 | E22: =+H22+L22 -> 29 | F22: =+(G22)+H22*0.5 -> 49.40 | G22: 34.90 | H22: =1+2+4+2+2+2+6+10 -> 29 | I22: =+(J22+K22)+L22*0.5 -> 90.56 | J22: 41.08 | K22: 49.48 | L22: 0
A23: 17 | B23: Simpson, Harold | C23: OPTIC | D23: =+F23+I23 -> 141.70 | E23: =+H23+L23 -> 45 | F23: =+(G23)+H23*0.5 -> 59.08 | G23: 56.58 | H23: =1+1+1+1+1 -> 5 | I23: =+(J23+K23)+L23*0.5 -> 82.62 | J23: 32.61 | K23: 30.01 | L23: 40
A24: 18 | B24: Theodore, Ari | C24: OPTIC | D24: =+F24+I24 -> 148.72 | E24: =+H24+L24 -> 18 | F24: =+(G24)+H24*0.5 -> 25.33 | G24: 21.33 | H24: =1+2+1+2+2 -> 8 | I24: =+(J24+K24)+L24*0.5 -> 123.39 | J24: 66.21 | K24: 52.18 | L24: 10
A25: 19 | B25: Ostler, Jay | C25: OPTIC | D25: =+F25+I25 -> 159.43 | E25: =+H25+L25 -> 6 | F25: =+(G25)+H25*0.5 -> 72.05 | G25: 69.05 | H25: =5+1 -> 6 | I25: =+(J25+K25)+L25*0.5 -> 87.38 | J25: 51.55 | K25: 35.83 | L25: 0
A26: 20 | B26: Hendricks, Cy | C26: IRON | D26: =+F26+I26 -> 166.76 | E26: =+H26+L26 -> 19 | F26: =+(G26)+H26*0.5 -> 62.98 | G26: 53.48 | H26: =2+2+2+2+2+8+1 -> 19 | I26: =+(J26+K26)+L26*0.5 -> 103.78 | J26: 69.18 | K26: 34.60 | L26: 0
A27: 21 | B27: Barnes, Mike | C27: IRON | D27: =+F27+I27 -> 182.62 | E27: =+H27+L27 -> 13 | F27: =+(G27)+H27*0.5 -> 66.54 | G27: 60.04 | H27: =2+5+1+1+2+1+1 -> 13 | I27: =+(J27+K27)+L27*0.5 -> 116.08 | J27: 35.96 | K27: 80.12 | L27: 0
A28: 22 | B28: Kirkham, Devon | C28: IRON | D28: =+F28+I28 -> 253.04 | E28: =+H28+L28 -> 77 | F28: =+(G28)+H28*0.5 -> 81.06 | G28: 62.56 | H28: =2+6+8+2+5+8+6 -> 37 | I28: =+(J28+K28)+L28*0.5 -> 171.98 | J28: 69.03 | K28: 82.95 | L28: 40
A29: 23 | B29: Zaccardi, Juke | C29: OPTIC | D29: No Time | E29: =+H29+L29 -> 30 | F29: No Time | G29: No Time | H29: =1+4+2+2+1 -> 10 | I29: =+(J29+K29)+L29*0.5 -> 65.28 | J29: 28.80 | K29: 26.48 | L29: 20
A30: Notes:
A31: xx | B31: Indicates that the Points Down value includes some kind of penalty (Procedural Error, Hits on Non-Threat or Misses on Steel).
A32: PD | B32: = Points Down value is PD x 5 seconds added to the total stage time.
A33: *DIV | B33: = Divisions: IRON = Rifle used was equipped with Iron Sights
B34: OPTIC = Rifle used was equipped with Optical Sights