B1: UDPL 3-Gun Match - Results for March 15, 2003 held at the FARM | AC1: Some shooters did not shoot String 2 and it is NOT included in the totals.
B2: (Results listed by Time without regard to Division) | AS2: **
A3: Place | B3: Name | C3: Division: O=Open L=Limited | D3: Shoot Total | E3: Total Points Down | F3: Stage 1 | G3: String 1 | H3: String 2 | I3: Points Down | J3: Stage 2 | K3: String 1 | L3: String 2 | M3: Points Down | N3: Stage 3 | O3: String 1 | P3: String 2 | Q3: String 3 | R3: Points Down | S3: Stage 4 | T3: String 1 | U3: Points Down | V3: Stage 5 | W3: String 1 | X3: String 2 | Y3: Points Down | Z3: Stage 6 | AA3: String 1 | AB3: Points Down | AC3: Stage 7 | AD3: String 1 | AE3: String 2 | AF3: Points Down | AG3: Stage 8 | AH3: String 1 | AI3: String 2 | AJ3: String 3 | AK3: Points Down | AL3: Stage 9 | AM3: String 1 | AN3: String 2 | AO3: Points Down | AP3: Stage 10 | AQ3: String 1 | AR3: String 2 | AS3: Points Down
A4: 1 | B4: Nankervis, Bob | C4: L | D4: =+F4+J4+N4+S4+V4+Z4+AC4+AG4+AL4+AP4 -> 417.42 | E4: =+I4+M4+R4+U4+Y4+AB4+AF4+AK4+AO4+AS4 -> 71 | F4: =+(G4+H4)+(0.5*I4) -> 32.73 | G4: 17.64 | H4: 15.09 | I4: 0 | J4: =+(K4+L4)+0.5*M4 -> 29.10 | K4: 11.32 | L4: 16.78 | M4: 2 | N4: =+(O4+P4+Q4)+0.5*R4 -> 27.25 | O4: 9.77 | P4: 10.41 | Q4: 7.07 | R4: 0 | S4: =+(T4)+0.5*U4 -> 26.93 | T4: 26.93 | U4: 0 | V4: =+(W4+X4)+0.5*Y4 -> 17.19 | W4: 7.26 | X4: 6.93 | Y4: 6 | Z4: =+(AA4)+0.5*AB4 -> 64.45 | AA4: 58.95 | AB4: 11 | AC4: =+(AD4)+0.5*AF4 -> 18.64 | AD4: 18.64 | AE4: 11.24 | AF4: 0 | AG4: =+(AH4+AI4+AJ4)+0.5*AK4 -> 54.58 | AH4: 15.30 | AI4: 12.70 | AJ4: 24.08 | AK4: 5 | AL4: =+(AM4+AN4)+0.5*AO4 -> 65.89 | AM4: 27.69 | AN4: 29.70 | AO4: 17 | AP4: =+(AQ4+AR4)+0.5*AS4 -> 80.66 | AQ4: 36.83 | AR4: 28.83 | AS4: 30
A5: 2 | B5: Correia, Larry | C5: L | D5: =+F5+J5+N5+S5+V5+Z5+AC5+AG5+AL5+AP5 -> 419.72 | E5: =+I5+M5+R5+U5+Y5+AB5+AF5+AK5+AO5+AS5 -> 112 | F5: =+(G5+H5)+(0.5*I5) -> 38.26 | G5: 16.21 | H5: 22.05 | I5: 0 | J5: =+(K5+L5)+0.5*M5 -> 25.21 | K5: 10.99 | L5: 10.72 | M5: 7 | N5: =+(O5+P5+Q5)+0.5*R5 -> 42.46 | O5: 13.95 | P5: 12.40 | Q5: 11.11 | R5: 10 | S5: =+(T5)+0.5*U5 -> 25.82 | T5: 25.82 | U5: 0 | V5: =+(W5+X5)+0.5*Y5 -> 22.06 | W5: 12.09 | X5: 7.97 | Y5: 4 | Z5: =+(AA5)+0.5*AB5 -> 80.69 | AA5: 58.19 | AB5: 45 | AC5: =+(AD5)+0.5*AF5 -> 14.31 | AD5: 14.31 | AE5: 10.01 | AF5: 0 | AG5: =+(AH5+AI5+AJ5)+0.5*AK5 -> 40.80 | AH5: 8.71 | AI5: 11.58 | AJ5: 16.51 | AK5: 8 | AL5: =+(AM5+AN5)+0.5*AO5 -> 50.18 | AM5: 22.74 | AN5: 18.44 | AO5: 18 | AP5: =+(AQ5+AR5)+0.5*AS5 -> 79.93 | AQ5: 36.99 | AR5: 32.94 | AS5: 20
A6: 3 | B6: Latham, Corey | C6: L | D6: =+F6+J6+N6+S6+V6+Z6+AC6+AG6+AL6+AP6 -> 440.36 | E6: =+I6+M6+R6+U6+Y6+AB6+AF6+AK6+AO6+AS6 -> 71 | F6: =+(G6+H6)+(0.5*I6) -> 34.89 | G6: 20.88 | H6: 14.01 | I6: 0 | J6: =+(K6+L6)+0.5*M6 -> 28.90 | K6: 13.53 | L6: 14.87 | M6: 1 | N6: =+(O6+P6+Q6)+0.5*R6 -> 36.43 | O6: 11.92 | P6: 8.76 | Q6: 10.75 | R6: 10 | S6: =+(T6)+0.5*U6 -> 30.03 | T6: 30.03 | U6: 0 | V6: =+(W6+X6)+0.5*Y6 -> 19.57 | W6: 7.10 | X6: 11.47 | Y6: 2 | Z6: =+(AA6)+0.5*AB6 -> 63.00 | AA6: 54.50 | AB6: 17 | AC6: =+(AD6)+0.5*AF6 -> 21.40 | AD6: 21.40 | AE6: 7.31 | AF6: 0 | AG6: =+(AH6+AI6+AJ6)+0.5*AK6 -> 45.85 | AH6: 10.38 | AI6: 14.56 | AJ6: 20.41 | AK6: 1 | AL6: =+(AM6+AN6)+0.5*AO6 -> 44.68 | AM6: 19.77 | AN6: 22.41 | AO6: 5 | AP6: =+(AQ6+AR6)+0.5*AS6 -> 115.61 | AQ6: 53.67 | AR6: 44.44 | AS6: 35
A7: 4 | B7: Lowe, John | C7: L | D7: =+F7+J7+N7+S7+V7+Z7+AC7+AG7+AL7+AP7 -> 473.35 | E7: =+I7+M7+R7+U7+Y7+AB7+AF7+AK7+AO7+AS7 -> 64 | F7: =+(G7+H7)+(0.5*I7) -> 33.59 | G7: 19.54 | H7: 14.05 | I7: 0 | J7: =+(K7+L7)+0.5*M7 -> 30.37 | K7: 13.92 | L7: 14.95 | M7: 3 | N7: =+(O7+P7+Q7)+0.5*R7 -> 30.51 | O7: 11.41 | P7: 10.04 | Q7: 9.06 | R7: 0 | S7: =+(T7)+0.5*U7 -> 27.62 | T7: 27.62 | U7: 0 | V7: =+(W7+X7)+0.5*Y7 -> 15.90 | W7: 7.22 | X7: 8.68 | Y7: 0 | Z7: =+(AA7)+0.5*AB7 -> 70.84 | AA7: 67.84 | AB7: 6 | AC7: =+(AD7)+0.5*AF7 -> 20.29 | AD7: 20.29 | AE7: 9.67 | AF7: 0 | AG7: =+(AH7+AI7+AJ7)+0.5*AK7 -> 51.69 | AH7: 10.33 | AI7: 13.55 | AJ7: 20.81 | AK7: 14 | AL7: =+(AM7+AN7)+0.5*AO7 -> 56.98 | AM7: 31.85 | AN7: 22.13 | AO7: 6 | AP7: =+(AQ7+AR7)+0.5*AS7 -> 135.56 | AQ7: 56.42 | AR7: 61.64 | AS7: 35
A8: 5 | B8: Snelson, Rylee | C8: L | D8: =+F8+J8+N8+S8+V8+Z8+AC8+AG8+AL8+AP8 -> 492.03 | E8: =+I8+M8+R8+U8+Y8+AB8+AF8+AK8+AO8+AS8 -> 97 | F8: =+(G8+H8)+(0.5*I8) -> 39.03 | G8: 15.72 | H8: 23.31 | I8: 0 | J8: =+(K8+L8)+0.5*M8 -> 36.41 | K8: 13.91 | L8: 15.00 | M8: 15 | N8: =+(O8+P8+Q8)+0.5*R8 -> 29.56 | O8: 10.17 | P8: 10.78 | Q8: 8.61 | R8: 0 | S8: =+(T8)+0.5*U8 -> 28.55 | T8: 28.55 | U8: 0 | V8: =+(W8+X8)+0.5*Y8 -> 24.05 | W8: 10.35 | X8: 12.70 | Y8: 2 | Z8: =+(AA8)+0.5*AB8 -> 70.44 | AA8: 62.94 | AB8: 15 | AC8: =+(AD8)+0.5*AF8 -> 18.23 | AD8: 18.23 | AF8: 0 | AG8: =+(AH8+AI8+AJ8)+0.5*AK8 -> 52.13 | AH8: 9.12 | AI8: 18.65 | AJ8: 20.36 | AK8: 8 | AL8: =+(AM8+AN8)+0.5*AO8 -> 77.63 | AM8: 39.34 | AN8: 24.79 | AO8: 27 | AP8: =+(AQ8+AR8)+0.5*AS8 -> 116.00 | AQ8: 50.65 | AR8: 50.35 | AS8: 30
A9: 6 | B9: Zaccardi, Pat | C9: L | D9: =+F9+J9+N9+S9+V9+Z9+AC9+AG9+AL9+AP9 -> 514.95 | E9: =+I9+M9+R9+U9+Y9+AB9+AF9+AK9+AO9+AS9 -> 149 | F9: =+(G9+H9)+(0.5*I9) -> 37.11 | G9: 20.60 | H9: 16.51 | I9: 0 | J9: =+(K9+L9)+0.5*M9 -> 29.39 | K9: 10.35 | L9: 11.54 | M9: 15 | N9: =+(O9+P9+Q9)+0.5*R9 -> 35.18 | O9: 10.98 | P9: 13.74 | Q9: 10.46 | R9: 0 | S9: =+(T9)+0.5*U9 -> 38.84 | T9: 38.84 | U9: 0 | V9: =+(W9+X9)+0.5*Y9 -> 19.44 | W9: 6.82 | X9: 5.62 | Y9: 14 | Z9: =+(AA9)+0.5*AB9 -> 64.69 | AA9: 54.69 | AB9: 20 | AC9: =+(AD9)+0.5*AF9 -> 25.53 | AD9: 25.53 | AE9: 9.08 | AF9: 0 | AG9: =+(AH9+AI9+AJ9)+0.5*AK9 -> 49.88 | AH9: 8.62 | AI9: 15.67 | AJ9: 19.09 | AK9: 13 | AL9: =+(AM9+AN9)+0.5*AO9 -> 69.42 | AM9: 27.06 | AN9: 21.86 | AO9: 41 | AP9: =+(AQ9+AR9)+0.5*AS9 -> 145.47 | AQ9: 65.33 | AR9: 57.14 | AS9: 46
A10: 7 | B10: Knapp, Chris | C10: L | D10: =+F10+J10+N10+S10+V10+Z10+AC10+AG10+AL10+AP10 -> 515.32 | E10: =+I10+M10+R10+U10+Y10+AB10+AF10+AK10+AO10+AS10 -> 74 | F10: =+(G10+H10)+(0.5*I10) -> 64.72 | G10: 35.08 | H10: 29.64 | I10: 0 | J10: =+(K10+L10)+0.5*M10 -> 37.26 | K10: 16.95 | L10: 18.31 | M10: 4 | N10: =+(O10+P10+Q10)+0.5*R10 -> 38.53 | O10: 11.85 | P10: 13.10 | Q10: 13.58 | R10: 0 | S10: =+(T10)+0.5*U10 -> 32.47 | T10: 32.47 | U10: 0 | V10: =+(W10+X10)+0.5*Y10 -> 31.80 | W10: 13.04 | X10: 12.26 | Y10: 13 | Z10: =+(AA10)+0.5*AB10 -> 89.11 | AA10: 77.61 | AB10: 23 | AC10: =+(AD10)+0.5*AF10 -> 23.82 | AD10: 23.82 | AE10: 12.79 | AF10: 0 | AG10: =+(AH10+AI10+AJ10)+0.5*AK10 -> 57.67 | AH10: 12.65 | AI10: 16.39 | AJ10: 25.13 | AK10: 7 | AL10: =+(AM10+AN10)+0.5*AO10 -> 72.26 | AM10: 35.27 | AN10: 28.49 | AO10: 17 | AP10: =+(AQ10+AR10)+0.5*AS10 -> 67.68 | AQ10: 33.25 | AR10: 29.43 | AS10: 10
A11: 8 | B11: Durant, Steve | C11: L | D11: =+F11+J11+N11+S11+V11+Z11+AC11+AG11+AL11+AP11 -> 517.07 | E11: =+I11+M11+R11+U11+Y11+AB11+AF11+AK11+AO11+AS11 -> 70 | F11: =+(G11+H11)+(0.5*I11) -> 43.83 | G11: 30.37 | H11: 12.96 | I11: 1 | J11: =+(K11+L11)+0.5*M11 -> 32.25 | K11: 11.51 | L11: 14.74 | M11: 12 | N11: =+(O11+P11+Q11)+0.5*R11 -> 46.09 | O11: 14.47 | P11: 14.70 | Q11: 16.92 | R11: 0 | S11: =+(T11)+0.5*U11 -> 47.41 | T11: 47.41 | U11: 0 | V11: =+(W11+X11)+0.5*Y11 -> 23.05 | W11: 10.81 | X11: 9.74 | Y11: 5 | Z11: =+(AA11)+0.5*AB11 -> 72.98 | AA11: 70.98 | AB11: 4 | AC11: =+(AD11)+0.5*AF11 -> 22.32 | AD11: 22.32 | AE11: 14.71 | AF11: 0 | AG11: =+(AH11+AI11+AJ11)+0.5*AK11 -> 70.71 | AH11: 11.62 | AI11: 13.41 | AJ11: 34.18 | AK11: 23 | AL11: =+(AM11+AN11)+0.5*AO11 -> 71.63 | AM11: 35.32 | AN11: 28.81 | AO11: 15 | AP11: =+(AQ11+AR11)+0.5*AS11 -> 86.80 | AQ11: 40.17 | AR11: 41.63 | AS11: 10
A12: 9 | B12: Snelson, Terry | C12: L | D12: =+F12+J12+N12+S12+V12+Z12+AC12+AG12+AL12+AP12 -> 522.44 | E12: =+I12+M12+R12+U12+Y12+AB12+AF12+AK12+AO12+AS12 -> 76 | F12: =+(G12+H12)+(0.5*I12) -> 46.91 | G12: 22.51 | H12: 24.40 | I12: 0 | J12: =+(K12+L12)+0.5*M12 -> 34.80 | K12: 13.84 | L12: 16.96 | M12: 8 | N12: =+(O12+P12+Q12)+0.5*R12 -> 24.35 | O12: 7.85 | P12: 7.95 | Q12: 8.55 | R12: 0 | S12: =+(T12)+0.5*U12 -> 34.48 | T12: 34.48 | U12: 0 | V12: =+(W12+X12)+0.5*Y12 -> 28.78 | W12: 14.01 | X12: 13.77 | Y12: 2 | Z12: =+(AA12)+0.5*AB12 -> 80.79 | AA12: 69.79 | AB12: 22 | AC12: =+(AD12)+0.5*AF12 -> 32.12 | AD12: 32.12 | AF12: 0 | AG12: =+(AH12+AI12+AJ12)+0.5*AK12 -> 63.81 | AH12: 15.33 | AI12: 17.74 | AJ12: 27.24 | AK12: 7 | AL12: =+(AM12+AN12)+0.5*AO12 -> 74.97 | AM12: 42.40 | AN12: 26.57 | AO12: 12 | AP12: =+(AQ12+AR12)+0.5*AS12 -> 101.43 | AQ12: 48.36 | AR12: 40.57 | AS12: 25
A13: 10 | B13: Adams, Kyle | C13: L | D13: =+F13+J13+N13+S13+V13+Z13+AC13+AG13+AL13+AP13 -> 529.92 | E13: =+I13+M13+R13+U13+Y13+AB13+AF13+AK13+AO13+AS13 -> 96 | F13: =+(G13+H13)+(0.5*I13) -> 38.16 | G13: 18.37 | H13: 19.79 | I13: 0 | J13: =+(K13+L13)+0.5*M13 -> 32.69 | K13: 14.79 | L13: 14.90 | M13: 6 | N13: =+(O13+P13+Q13)+0.5*R13 -> 38.82 | O13: 9.31 | P13: 19.57 | Q13: 9.94 | R13: 0 | S13: =+(T13)+0.5*U13 -> 25.22 | T13: 25.22 | U13: 0 | V13: =+(W13+X13)+0.5*Y13 -> 28.53 | W13: 10.89 | X13: 15.14 | Y13: 5 | Z13: =+(AA13)+0.5*AB13 -> 68.89 | AA13: 61.39 | AB13: 15 | AC13: =+(AD13)+0.5*AF13 -> 36.21 | AD13: 36.21 | AF13: 0 | AG13: =+(AH13+AI13+AJ13)+0.5*AK13 -> 66.88 | AH13: 15.08 | AI13: 17.60 | AJ13: 30.20 | AK13: 8 | AL13: =+(AM13+AN13)+0.5*AO13 -> 75.25 | AM13: 33.96 | AN13: 30.29 | AO13: 22 | AP13: =+(AQ13+AR13)+0.5*AS13 -> 119.27 | AQ13: 52.16 | AR13: 47.11 | AS13: 40
A14: 11 | B14: Huff, Blake | C14: L | D14: =+F14+J14+N14+S14+V14+Z14+AC14+AG14+AL14+AP14 -> 535.76 | E14: =+I14+M14+R14+U14+Y14+AB14+AF14+AK14+AO14+AS14 -> 49 | F14: =+(G14+H14)+(0.5*I14) -> 34.16 | G14: 16.37 | H14: 17.79 | I14: 0 | J14: =+(K14+L14)+0.5*M14 -> 34.69 | K14: 17.58 | L14: 16.11 | M14: 2 | N14: =+(O14+P14+Q14)+0.5*R14 -> 30.99 | O14: 10.64 | P14: 11.90 | Q14: 8.45 | R14: 0 | S14: =+(T14)+0.5*U14 -> 54.65 | T14: 54.65 | U14: 0 | V14: =+(W14+X14)+0.5*Y14 -> 22.08 | W14: 9.03 | X14: 10.05 | Y14: 6 | Z14: =+(AA14)+0.5*AB14 -> 68.22 | AA14: 60.22 | AB14: 16 | AC14: =+(AD14)+0.5*AF14 -> 52.71 | AD14: 52.71 | AE14: 14.58 | AF14: 0 | AG14: =+(AH14+AI14+AJ14)+0.5*AK14 -> 65.63 | AH14: 11.00 | AI14: 16.24 | AJ14: 36.39 | AK14: 4 | AL14: =+(AM14+AN14)+0.5*AO14 -> 66.97 | AM14: 35.12 | AN14: 28.85 | AO14: 6 | AP14: =+(AQ14+AR14)+0.5*AS14 -> 105.66 | AQ14: 44.16 | AR14: 54.00 | AS14: 15
A15: 12 | B15: Jones, Mark | C15: O | D15: =+F15+J15+N15+S15+V15+Z15+AC15+AG15+AL15+AP15 -> 545.21 | E15: =+I15+M15+R15+U15+Y15+AB15+AF15+AK15+AO15+AS15 -> 93 | F15: =+(G15+H15)+(0.5*I15) -> 61.62 | G15: 44.00 | H15: 17.62 | I15: 0 | J15: =+(K15+L15)+0.5*M15 -> 33.30 | K15: 20.19 | L15: 10.11 | M15: 6 | N15: =+(O15+P15+Q15)+0.5*R15 -> 32.06 | O15: 11.18 | P15: 9.21 | Q15: 11.67 | R15: 0 | S15: =+(T15)+0.5*U15 -> 46.51 | T15: 46.51 | U15: 0 | V15: =+(W15+X15)+0.5*Y15 -> 26.23 | W15: 13.57 | X15: 8.66 | Y15: 8 | Z15: =+(AA15)+0.5*AB15 -> 79.58 | AA15: 69.58 | AB15: 20 | AC15: =+(AD15)+0.5*AF15 -> 30.10 | AD15: 30.10 | AE15: 12.11 | AF15: 0 | AG15: =+(AH15+AI15+AJ15)+0.5*AK15 -> 73.75 | AH15: 8.96 | AI15: 12.98 | AJ15: 40.31 | AK15: 23 | AL15: =+(AM15+AN15)+0.5*AO15 -> 68.39 | AM15: 27.68 | AN15: 27.71 | AO15: 26 | AP15: =+(AQ15+AR15)+0.5*AS15 -> 93.67 | AQ15: 46.40 | AR15: 42.27 | AS15: 10
A16: 13 | B16: Spicer, Robert | C16: L | D16: =+F16+J16+N16+S16+V16+Z16+AC16+AG16+AL16+AP16 -> 562.81 | E16: =+I16+M16+R16+U16+Y16+AB16+AF16+AK16+AO16+AS16 -> 84 | F16: =+(G16+H16)+(0.5*I16) -> 30.86 | G16: 11.90 | H16: 18.96 | I16: 0 | J16: =+(K16+L16)+0.5*M16 -> 34.73 | K16: 14.69 | L16: 15.04 | M16: 10 | N16: =+(O16+P16+Q16)+0.5*R16 -> 47.94 | O16: 13.84 | P16: 17.76 | Q16: 16.34 | R16: 0 | S16: =+(T16)+0.5*U16 -> 35.38 | T16: 35.38 | U16: 0 | V16: =+(W16+X16)+0.5*Y16 -> 33.98 | W16: 9.45 | X16: 16.53 | Y16: 16 | Z16: =+(AA16)+0.5*AB16 -> 73.68 | AA16: 67.68 | AB16: 12 | AC16: =+(AD16)+0.5*AF16 -> 18.60 | AD16: 18.60 | AE16: 14.48 | AF16: 0 | AG16: =+(AH16+AI16+AJ16)+0.5*AK16 -> 59.80 | AH16: 13.03 | AI16: 17.86 | AJ16: 23.91 | AK16: 10 | AL16: =+(AM16+AN16)+0.5*AO16 -> 79.01 | AM16: 43.15 | AN16: 30.36 | AO16: 11 | AP16: =+(AQ16+AR16)+0.5*AS16 -> 148.83 | AQ16: 45.56 | AR16: 90.77 | AS16: 25
A17: 14 | B17: Hutch, Flinn | C17: L | D17: =+F17+J17+N17+S17+V17+Z17+AC17+AG17+AL17+AP17 -> 565.94 | E17: =+I17+M17+R17+U17+Y17+AB17+AF17+AK17+AO17+AS17 -> 116 | F17: =+(G17+H17)+(0.5*I17) -> 54.92 | G17: 22.68 | H17: 32.24 | I17: 0 | J17: =+(K17+L17)+0.5*M17 -> 32.86 | K17: 13.20 | L17: 14.66 | M17: 10 | N17: =+(O17+P17+Q17)+0.5*R17 -> 47.88 | O17: 17.48 | P17: 16.67 | Q17: 13.73 | R17: 0 | S17: =+(T17)+0.5*U17 -> 35.84 | T17: 35.84 | U17: 0 | V17: =+(W17+X17)+0.5*Y17 -> 37.91 | W17: 16.49 | X17: 18.92 | Y17: 5 | Z17: =+(AA17)+0.5*AB17 -> 82.40 | AA17: 75.40 | AB17: 14 | AC17: =+(AD17)+0.5*AF17 -> 29.35 | AD17: 29.35 | AF17: 0 | AG17: =+(AH17+AI17+AJ17)+0.5*AK17 -> 58.89 | AH17: 15.54 | AI17: 14.43 | AJ17: 24.42 | AK17: 9 | AL17: =+(AM17+AN17)+0.5*AO17 -> 91.12 | AM17: 35.74 | AN17: 28.88 | AO17: 53 | AP17: =+(AQ17+AR17)+0.5*AS17 -> 94.77 | AQ17: 43.96 | AR17: 38.31 | AS17: 25
A18: 15 | B18: Sharp, Mikel | C18: L | D18: =+F18+J18+N18+S18+V18+Z18+AC18+AG18+AL18+AP18 -> 580.80 | E18: =+I18+M18+R18+U18+Y18+AB18+AF18+AK18+AO18+AS18 -> 197 | F18: =+(G18+H18)+(0.5*I18) -> 37.61 | G18: 25.22 | H18: 12.39 | I18: 0 | J18: =+(K18+L18)+0.5*M18 -> 35.43 | K18: 11.77 | L18: 11.66 | M18: 24 | N18: =+(O18+P18+Q18)+0.5*R18 -> 37.96 | O18: 12.54 | P18: 9.97 | Q18: 15.45 | R18: 0 | S18: =+(T18)+0.5*U18 -> 30.31 | T18: 30.31 | U18: 0 | V18: =+(W18+X18)+0.5*Y18 -> 33.77 | W18: 13.28 | X18: 11.49 | Y18: 18 | Z18: =+(AA18)+0.5*AB18 -> 63.79 | AA18: 53.29 | AB18: 21 | AC18: =+(AD18)+0.5*AF18 -> 50.77 | AD18: 50.77 | AE18: 14.71 | AF18: 0 | AG18: =+(AH18+AI18+AJ18)+0.5*AK18 -> 128.75 | AH18: 8.77 | AI18: 59.63 | AJ18: 28.85 | AK18: 63 | AL18: =+(AM18+AN18)+0.5*AO18 -> 67.93 | AM18: 20.89 | AN18: 19.54 | AO18: 55 | AP18: =+(AQ18+AR18)+0.5*AS18 -> 94.48 | AQ18: 43.40 | AR18: 43.08 | AS18: 16
A19: 16 | B19: Risbeck, Andy | C19: L | D19: =+F19+J19+N19+S19+V19+Z19+AC19+AG19+AL19+AP19 -> 586.40 | E19: =+I19+M19+R19+U19+Y19+AB19+AF19+AK19+AO19+AS19 -> 122 | F19: =+(G19+H19)+(0.5*I19) -> 49.16 | G19: 22.77 | H19: 26.39 | I19: 0 | J19: =+(K19+L19)+0.5*M19 -> 45.79 | K19: 17.51 | L19: 24.78 | M19: 7 | N19: =+(O19+P19+Q19)+0.5*R19 -> 48.74 | O19: 14.37 | P19: 12.37 | Q19: 17.00 | R19: 10 | S19: =+(T19)+0.5*U19 -> 74.00 | T19: 74.00 | U19: 0 | V19: =+(W19+X19)+0.5*Y19 -> 31.44 | W19: 11.77 | X19: 18.17 | Y19: 3 | Z19: =+(AA19)+0.5*AB19 -> 71.35 | AA19: 65.85 | AB19: 11 | AC19: =+(AD19)+0.5*AF19 -> 23.11 | AD19: 23.11 | AE19: 10.69 | AF19: 0 | AG19: =+(AH19+AI19+AJ19)+0.5*AK19 -> 52.57 | AH19: 13.16 | AI19: 13.54 | AJ19: 21.37 | AK19: 9 | AL19: =+(AM19+AN19)+0.5*AO19 -> 67.46 | AM19: 30.72 | AN19: 25.74 | AO19: 22 | AP19: =+(AQ19+AR19)+0.5*AS19 -> 122.78 | AQ19: 45.02 | AR19: 47.76 | AS19: 60
A20: 17 | B20: Vollmer, Phillip | C20: L | D20: =+F20+J20+N20+S20+V20+Z20+AC20+AG20+AL20+AP20 -> 587.30 | E20: =+I20+M20+R20+U20+Y20+AB20+AF20+AK20+AO20+AS20 -> 45 | F20: =+(G20+H20)+(0.5*I20) -> 42.51 | G20: 25.91 | H20: 16.60 | I20: 0 | J20: =+(K20+L20)+0.5*M20 -> 40.00 | K20: 18.77 | L20: 17.23 | M20: 8 | N20: =+(O20+P20+Q20)+0.5*R20 -> 43.43 | O20: 15.32 | P20: 15.35 | Q20: 12.76 | R20: 0 | S20: =+(T20)+0.5*U20 -> 36.28 | T20: 36.28 | U20: 0 | V20: =+(W20+X20)+0.5*Y20 -> 19.17 | W20: 8.97 | X20: 8.70 | Y20: 3 | Z20: =+(AA20)+0.5*AB20 -> 69.54 | AA20: 62.04 | AB20: 15 | AC20: =+(AD20)+0.5*AF20 -> 29.24 | AD20: 29.24 | AE20: 10.96 | AF20: 0 | AG20: =+(AH20+AI20+AJ20)+0.5*AK20 -> 70.97 | AH20: 15.93 | AI20: 18.10 | AJ20: 34.44 | AK20: 5 | AL20: =+(AM20+AN20)+0.5*AO20 -> 71.31 | AM20: 33.91 | AN20: 32.90 | AO20: 9 | AP20: =+(AQ20+AR20)+0.5*AS20 -> 164.85 | AQ20: 79.76 | AR20: 82.59 | AS20: 5
A21: 18 | B21: Barnes, Gary | C21: L | D21: =+F21+J21+N21+S21+V21+Z21+AC21+AG21+AL21+AP21 -> 587.92 | E21: =+I21+M21+R21+U21+Y21+AB21+AF21+AK21+AO21+AS21 -> 160 | F21: =+(G21+H21)+(0.5*I21) -> 23.02 | G21: 8.34 | H21: 14.68 | I21: 0 | J21: =+(K21+L21)+0.5*M21 -> 40.22 | K21: 9.97 | L21: 16.25 | M21: 28 | N21: =+(O21+P21+Q21)+0.5*R21 -> 60.03 | O21: 19.80 | P21: 12.38 | Q21: 12.85 | R21: 30 | S21: =+(T21)+0.5*U21 -> 38.62 | T21: 38.62 | U21: 0 | V21: =+(W21+X21)+0.5*Y21 -> 49.16 | W21: 16.65 | X21: 15.01 | Y21: 35 | Z21: =+(AA21)+0.5*AB21 -> 99.51 | AA21: 97.01 | AB21: 5 | AC21: =+(AD21)+0.5*AF21 -> 36.65 | AD21: 31.65 | AE21: 15.71 | AF21: 10 | AG21: =+(AH21+AI21+AJ21)+0.5*AK21 -> 58.87 | AH21: 15.81 | AI21: 14.82 | AJ21: 24.74 | AK21: 7 | AL21: =+(AM21+AN21)+0.5*AO21 -> 81.49 | AM21: 35.82 | AN21: 30.67 | AO21: 30 | AP21: =+(AQ21+AR21)+0.5*AS21 -> 100.35 | AQ21: 51.47 | AR21: 41.38 | AS21: 15
A22: 19 | B22: Willard, Jason | C22: O | D22: =+F22+J22+N22+S22+V22+Z22+AC22+AG22+AL22+AP22 -> 588.23 | E22: =+I22+M22+R22+U22+Y22+AB22+AF22+AK22+AO22+AS22 -> 112 | F22: =+(G22+H22)+(0.5*I22) -> 19.07 | G22: 7.36 | H22: 11.71 | I22: 0 | J22: =+(K22+L22)+0.5*M22 -> 48.47 | K22: 14.79 | L22: 26.18 | M22: 15 | N22: =+(O22+P22+Q22)+0.5*R22 -> 48.18 | O22: 19.12 | P22: 16.02 | Q22: 13.04 | R22: 0 | S22: =+(T22)+0.5*U22 -> 31.70 | T22: 31.70 | U22: 0 | V22: =+(W22+X22)+0.5*Y22 -> 43.88 | W22: 18.14 | X22: 18.74 | Y22: 14 | Z22: =+(AA22)+0.5*AB22 -> 79.24 | AA22: 74.74 | AB22: 9 | AC22: =+(AD22)+0.5*AF22 -> 35.59 | AD22: 35.59 | AE22: 16.51 | AF22: 0 | AG22: =+(AH22+AI22+AJ22)+0.5*AK22 -> 102.37 | AH22: 19.43 | AI22: 54.17 | AJ22: 22.27 | AK22: 13 | AL22: =+(AM22+AN22)+0.5*AO22 -> 80.76 | AM22: 32.71 | AN22: 35.05 | AO22: 26 | AP22: =+(AQ22+AR22)+0.5*AS22 -> 98.97 | AQ22: 42.67 | AR22: 38.80 | AS22: 35
A23: 20 | B23: Spicer, Richard | C23: L | D23: =+F23+J23+N23+S23+V23+Z23+AC23+AG23+AL23+AP23 -> 591.52 | E23: =+I23+M23+R23+U23+Y23+AB23+AF23+AK23+AO23+AS23 -> 74 | F23: =+(G23+H23)+(0.5*I23) -> 35.20 | G23: 13.89 | H23: 21.31 | I23: 0 | J23: =+(K23+L23)+0.5*M23 -> 34.63 | K23: 14.11 | L23: 15.02 | M23: 11 | N23: =+(O23+P23+Q23)+0.5*R23 -> 43.45 | O23: 16.17 | P23: 14.21 | Q23: 13.07 | R23: 0 | S23: =+(T23)+0.5*U23 -> 39.97 | T23: 39.97 | U23: 0 | V23: =+(W23+X23)+0.5*Y23 -> 32.52 | W23: 12.51 | X23: 11.51 | Y23: 17 | Z23: =+(AA23)+0.5*AB23 -> 88.67 | AA23: 83.67 | AB23: 10 | AC23: =+(AD23)+0.5*AF23 -> 41.60 | AD23: 41.60 | AE23: 14.33 | AF23: 0 | AG23: =+(AH23+AI23+AJ23)+0.5*AK23 -> 54.67 | AH23: 14.28 | AI23: 16.92 | AJ23: 21.97 | AK23: 3 | AL23: =+(AM23+AN23)+0.5*AO23 -> 85.08 | AM23: 43.26 | AN23: 37.82 | AO23: 8 | AP23: =+(AQ23+AR23)+0.5*AS23 -> 135.73 | AQ23: 62.76 | AR23: 60.47 | AS23: 25
A24: 21 | B24: Redford, "Red" | C24: L | D24: =+F24+J24+N24+S24+V24+Z24+AC24+AG24+AL24+AP24 -> 593.42 | E24: =+I24+M24+R24+U24+Y24+AB24+AF24+AK24+AO24+AS24 -> 120 | F24: =+(G24+H24)+(0.5*I24) -> 71.66 | G24: 46.85 | H24: 24.81 | I24: 0 | J24: =+(K24+L24)+0.5*M24 -> 73.42 | K24: 20.36 | L24: 39.06 | M24: 28 | N24: =+(O24+P24+Q24)+0.5*R24 -> 33.72 | O24: 13.07 | P24: 11.45 | Q24: 9.20 | R24: 0 | S24: =+(T24)+0.5*U24 -> 37.25 | T24: 37.25 | U24: 0 | V24: =+(W24+X24)+0.5*Y24 -> 27.05 | W24: 8.37 | X24: 13.18 | Y24: 11 | Z24: =+(AA24)+0.5*AB24 -> 70.87 | AA24: 58.87 | AB24: 24 | AC24: =+(AD24)+0.5*AF24 -> 33.72 | AD24: 33.72 | AE24: 41.86* | AF24: 0 | AG24: =+(AH24+AI24+AJ24)+0.5*AK24 -> 66.00 | AH24: 9.30 | AI24: 15.42 | AJ24: 34.78 | AK24: 13 | AL24: =+(AM24+AN24)+0.5*AO24 -> 69.00 | AM24: 32.98 | AN24: 24.02 | AO24: 24 | AP24: =+(AQ24+AR24)+0.5*AS24 -> 110.73 | AQ24: 50.57 | AR24: 50.16 | AS24: 20
A25: 22 | B25: Rodriquez, Mike | C25: L | D25: =+F25+J25+N25+S25+V25+Z25+AC25+AG25+AL25+AP25 -> 607.53 | E25: =+I25+M25+R25+U25+Y25+AB25+AF25+AK25+AO25+AS25 -> 136 | F25: =+(G25+H25)+(0.5*I25) -> 58.12 | G25: 31.02 | H25: 24.60 | I25: 5 | J25: =+(K25+L25)+0.5*M25 -> 45.14 | K25: 17.93 | L25: 19.21 | M25: 16 | N25: =+(O25+P25+Q25)+0.5*R25 -> 39.82 | O25: 11.83 | P25: 8.04 | Q25: 14.95 | R25: 10 | S25: =+(T25)+0.5*U25 -> 46.30 | T25: 46.30 | U25: 0 | V25: =+(W25+X25)+0.5*Y25 -> 29.81 | W25: 15.29 | X25: 13.52 | Y25: 2 | Z25: =+(AA25)+0.5*AB25 -> 94.12 | AA25: 81.12 | AB25: 26 | AC25: =+(AD25)+0.5*AF25 -> 49.59 | AD25: 49.59 | AE25: 8.54 | AF25: 0 | AG25: =+(AH25+AI25+AJ25)+0.5*AK25 -> 63.43 | AH25: 12.69 | AI25: 17.55 | AJ25: 25.69 | AK25: 15 | AL25: =+(AM25+AN25)+0.5*AO25 -> 84.54 | AM25: 33.23 | AN25: 27.81 | AO25: 47 | AP25: =+(AQ25+AR25)+0.5*AS25 -> 96.66 | AQ25: 45.11 | AR25: 44.05 | AS25: 15
A26: 23 | B26: Duncan, Dave | C26: L | D26: =+F26+J26+N26+S26+V26+Z26+AC26+AG26+AL26+AP26 -> 626.86 | E26: =+I26+M26+R26+U26+Y26+AB26+AF26+AK26+AO26+AS26 -> 134 | F26: =+(G26+H26)+(0.5*I26) -> 66.96 | G26: 41.75 | H26: 22.71 | I26: 5 | J26: =+(K26+L26)+0.5*M26 -> 34.89 | K26: 14.40 | L26: 16.49 | M26: 8 | N26: =+(O26+P26+Q26)+0.5*R26 -> 49.50 | O26: 18.81 | P26: 13.96 | Q26: 16.73 | R26: 0 | S26: =+(T26)+0.5*U26 -> 38.39 | T26: 38.39 | U26: 0 | V26: =+(W26+X26)+0.5*Y26 -> 25.17 | W26: 9.24 | X26: 11.43 | Y26: 9 | Z26: =+(AA26)+0.5*AB26 -> 70.38 | AA26: 60.88 | AB26: 19 | AC26: =+(AD26)+0.5*AF26 -> 44.60 | AD26: 39.60 | AE26: 22.72 | AF26: 10 | AG26: =+(AH26+AI26+AJ26)+0.5*AK26 -> 68.09 | AH26: 12.74 | AI26: 19.93 | AJ26: 30.42 | AK26: 10 | AL26: =+(AM26+AN26)+0.5*AO26 -> 62.90 | AM26: 33.30 | AN26: 23.10 | AO26: 13 | AP26: =+(AQ26+AR26)+0.5*AS26 -> 165.98 | AQ26: 65.09 | AR26: 70.89 | AS26: 60
A27: 24 | B27: Peterson, Scott | C27: O | D27: =+F27+J27+N27+S27+V27+Z27+AC27+AG27+AL27+AP27 -> 627.47 | E27: =+I27+M27+R27+U27+Y27+AB27+AF27+AK27+AO27+AS27 -> 208 | F27: =+(G27+H27)+(0.5*I27) -> 30.28 | G27: 11.05 | H27: 19.23 | I27: 0 | J27: =+(K27+L27)+0.5*M27 -> 36.08 | K27: 10.36 | L27: 11.22 | M27: 29 | N27: =+(O27+P27+Q27)+0.5*R27 -> 55.27 | O27: 16.22 | P27: 13.18 | Q27: 15.87 | R27: 20 | S27: =+(T27)+0.5*U27 -> 27.98 | T27: 27.98 | U27: 0 | V27: =+(W27+X27)+0.5*Y27 -> 32.03 | W27: 8.17 | X27: 7.86 | Y27: 32 | Z27: =+(AA27)+0.5*AB27 -> 67.59 | AA27: 50.09 | AB27: 35 | AC27: =+(AD27)+0.5*AF27 -> 18.82 | AD27: 16.32 | AE27: 7.91 | AF27: 5 | AG27: =+(AH27+AI27+AJ27)+0.5*AK27 -> 99.83 | AH27: 10.28 | AI27: 15.05 | AJ27: 62.50 | AK27: 24 | AL27: =+(AM27+AN27)+0.5*AO27 -> 121.95 | AM27: 83.55 | AN27: 21.90 | AO27: 33 | AP27: =+(AQ27+AR27)+0.5*AS27 -> 137.64 | AQ27: 60.55 | AR27: 62.09 | AS27: 30
A28: 25 | B28: Meek, Scott | C28: O | D28: =+F28+J28+N28+S28+V28+Z28+AC28+AG28+AL28+AP28 -> 636.08 | E28: =+I28+M28+R28+U28+Y28+AB28+AF28+AK28+AO28+AS28 -> 206 | F28: =+(G28+H28)+(0.5*I28) -> 51.96 | G28: 16.03 | H28: 35.93 | I28: 0 | J28: =+(K28+L28)+0.5*M28 -> 38.92 | K28: 18.15 | L28: 13.77 | M28: 14 | N28: =+(O28+P28+Q28)+0.5*R28 -> 69.55 | O28: 26.18 | P28: 12.74 | Q28: 15.63 | R28: 30 | S28: =+(T28)+0.5*U28 -> 49.42 | T28: 46.92 | U28: 5 | V28: =+(W28+X28)+0.5*Y28 -> 41.13 | W28: 9.78 | X28: 9.35 | Y28: 44 | Z28: =+(AA28)+0.5*AB28 -> 77.18 | AA28: 69.18 | AB28: 16 | AC28: =+(AD28)+0.5*AF28 -> 30.69 | AD28: 30.69 | AE28: 8.52 | AF28: 0 | AG28: =+(AH28+AI28+AJ28)+0.5*AK28 -> 73.24 | AH28: 11.14 | AI28: 16.99 | AJ28: 23.11 | AK28: 44 | AL28: =+(AM28+AN28)+0.5*AO28 -> 95.04 | AM28: 59.50 | AN28: 24.04 | AO28: 23 | AP28: =+(AQ28+AR28)+0.5*AS28 -> 108.95 | AQ28: 49.33 | AR28: 44.62 | AS28: 30
A29: 26 | B29: Zaccardi, Juke | C29: L | D29: =+F29+J29+N29+S29+V29+Z29+AC29+AG29+AL29+AP29 -> 641.10 | E29: =+I29+M29+R29+U29+Y29+AB29+AF29+AK29+AO29+AS29 -> 134 | F29: =+(G29+H29)+(0.5*I29) -> 74.22 | G29: 37.46 | H29: 36.76 | I29: 0 | J29: =+(K29+L29)+0.5*M29 -> 48.99 | K29: 18.24 | L29: 23.75 | M29: 14 | N29: =+(O29+P29+Q29)+0.5*R29 -> 61.11 | O29: 13.07 | P29: 22.71 | Q29: 25.33 | R29: 0 | S29: =+(T29)+0.5*U29 -> 62.16 | T29: 62.16 | U29: 0 | V29: =+(W29+X29)+0.5*Y29 -> 34.16 | W29: 14.00 | X29: 10.66 | Y29: 19 | Z29: =+(AA29)+0.5*AB29 -> 94.85 | AA29: 83.85 | AB29: 22 | AC29: =+(AD29)+0.5*AF29 -> 23.07 | AD29: 20.57 | AE29: 15.95 | AF29: 5 | AG29: =+(AH29+AI29+AJ29)+0.5*AK29 -> 68.32 | AH29: 14.65 | AI29: 18.79 | AJ29: 29.38 | AK29: 11 | AL29: =+(AM29+AN29)+0.5*AO29 -> 81.49 | AM29: 32.87 | AN29: 34.62 | AO29: 28 | AP29: =+(AQ29+AR29)+0.5*AS29 -> 92.73 | AQ29: 35.67 | AR29: 39.56 | AS29: 35
A30: 27 | B30: Jones, Nate | C30: L | D30: =+F30+J30+N30+S30+V30+Z30+AC30+AG30+AL30+AP30 -> 661.30 | E30: =+I30+M30+R30+U30+Y30+AB30+AF30+AK30+AO30+AS30 -> 80 | F30: =+(G30+H30)+(0.5*I30) -> 105.10 | G30: 69.88 | H30: 35.22 | I30: 0 | J30: =+(K30+L30)+0.5*M30 -> 51.54 | K30: 34.05 | L30: 15.49 | M30: 4 | N30: =+(O30+P30+Q30)+0.5*R30 -> 41.72 | O30: 14.62 | P30: 9.00 | Q30: 18.10 | R30: 0 | S30: =+(T30)+0.5*U30 -> 68.82 | T30: 68.82 | U30: 0 | V30: =+(W30+X30)+0.5*Y30 -> 41.84 | W30: 19.28 | X30: 20.06 | Y30: 5 | Z30: =+(AA30)+0.5*AB30 -> 77.91 | AA30: 74.91 | AB30: 6 | AC30: =+(AD30)+0.5*AF30 -> 23.97 | AD30: 23.97 | AE30: 18.71 | AF30: 0 | AG30: =+(AH30+AI30+AJ30)+0.5*AK30 -> 66.07 | AH30: 16.38 | AI30: 14.55 | AJ30: 33.64 | AK30: 3 | AL30: =+(AM30+AN30)+0.5*AO30 -> 69.34 | AM30: 26.21 | AN30: 24.63 | AO30: 37 | AP30: =+(AQ30+AR30)+0.5*AS30 -> 114.99 | AQ30: 57.69 | AR30: 44.80 | AS30: 25
A31: 28 | B31: Greenfield, Don | C31: L | D31: =+F31+J31+N31+S31+V31+Z31+AC31+AG31+AL31+AP31 -> 663.06 | E31: =+I31+M31+R31+U31+Y31+AB31+AF31+AK31+AO31+AS31 -> 107 | F31: =+(G31+H31)+(0.5*I31) -> 61.08 | G31: 36.23 | H31: 24.85 | I31: 0 | J31: =+(K31+L31)+0.5*M31 -> 50.71 | K31: 20.61 | L31: 27.10 | M31: 6 | N31: =+(O31+P31+Q31)+0.5*R31 -> 65.56 | O31: 21.20 | P31: 28.32 | Q31: 11.04 | R31: 10 | S31: =+(T31)+0.5*U31 -> 56.08 | T31: 56.08 | U31: 0 | V31: =+(W31+X31)+0.5*Y31 -> 37.75 | W31: 15.55 | X31: 9.20 | Y31: 26 | Z31: =+(AA31)+0.5*AB31 -> 89.13 | AA31: 85.13 | AB31: 8 | AC31: =+(AD31)+0.5*AF31 -> 33.69 | AD31: 33.69 | AE31: 38.32* | AF31: 0 | AG31: =+(AH31+AI31+AJ31)+0.5*AK31 -> 64.67 | AH31: 14.33 | AI31: 19.44 | AJ31: 27.90 | AK31: 6 | AL31: =+(AM31+AN31)+0.5*AO31 -> 79.95 | AM31: 39.05 | AN31: 32.90 | AO31: 16 | AP31: =+(AQ31+AR31)+0.5*AS31 -> 124.44 | AQ31: 56.93 | AR31: 50.01 | AS31: 35
A32: 29 | B32: Broadhead, Ken | C32: O | D32: =+F32+J32+N32+S32+V32+Z32+AC32+AG32+AL32+AP32 -> 675.94 | E32: =+I32+M32+R32+U32+Y32+AB32+AF32+AK32+AO32+AS32 -> 90 | F32: =+(G32+H32)+(0.5*I32) -> 54.76 | G32: 37.75 | H32: 17.01 | I32: 0 | J32: =+(K32+L32)+0.5*M32 -> 41.53 | K32: 17.14 | L32: 21.39 | M32: 6 | N32: =+(O32+P32+Q32)+0.5*R32 -> 46.94 | O32: 18.50 | P32: 11.74 | Q32: 11.70 | R32: 10 | S32: =+(T32)+0.5*U32 -> 50.56 | T32: 50.56 | U32: 0 | V32: =+(W32+X32)+0.5*Y32 -> 26.54 | W32: 15.78 | X32: 9.26 | Y32: 3 | Z32: =+(AA32)+0.5*AB32 -> 118.87 | AA32: 109.87 | AB32: 18 | AC32: =+(AD32)+0.5*AF32 -> 49.20 | AD32: 49.20 | AE32: 17.79 | AF32: 0 | AG32: =+(AH32+AI32+AJ32)+0.5*AK32 -> 76.71 | AH32: 12.85 | AI32: 25.59 | AJ32: 32.77 | AK32: 11 | AL32: =+(AM32+AN32)+0.5*AO32 -> 75.47 | AM32: 33.17 | AN32: 26.30 | AO32: 32 | AP32: =+(AQ32+AR32)+0.5*AS32 -> 135.36 | AQ32: 68.78 | AR32: 61.58 | AS32: 10
A33: 30 | B33: Bunten, James | C33: L | D33: =+F33+J33+N33+S33+V33+Z33+AC33+AG33+AL33+AP33 -> 678.18 | E33: =+I33+M33+R33+U33+Y33+AB33+AF33+AK33+AO33+AS33 -> 176 | F33: =+(G33+H33)+(0.5*I33) -> 77.23 | G33: 38.56 | H33: 38.67 | I33: 0 | J33: =+(K33+L33)+0.5*M33 -> 40.39 | K33: 14.14 | L33: 12.75 | M33: 27 | N33: =+(O33+P33+Q33)+0.5*R33 -> 66.75 | O33: 16.50 | P33: 17.45 | Q33: 27.80 | R33: 10 | S33: =+(T33)+0.5*U33 -> 49.86 | T33: 49.86 | U33: 0 | V33: =+(W33+X33)+0.5*Y33 -> 39.99 | W33: 14.01 | X33: 13.98 | Y33: 24 | Z33: =+(AA33)+0.5*AB33 -> 106.82 | AA33: 96.32 | AB33: 21 | AC33: =+(AD33)+0.5*AF33 -> 18.75 | AD33: 18.75 | AE33: 42.48 | AF33: 0 | AG33: =+(AH33+AI33+AJ33)+0.5*AK33 -> 73.35 | AH33: 13.33 | AI33: 21.42 | AJ33: 29.60 | AK33: 18 | AL33: =+(AM33+AN33)+0.5*AO33 -> 102.15 | AM33: 56.72 | AN33: 37.43 | AO33: 16 | AP33: =+(AQ33+AR33)+0.5*AS33 -> 102.89 | AQ33: 36.51 | AR33: 36.38 | AS33: 60
A34: 31 | B34: Peterson, Jared | C34: L | D34: =+F34+J34+N34+S34+V34+Z34+AC34+AG34+AL34+AP34 -> 688.42 | E34: =+I34+M34+R34+U34+Y34+AB34+AF34+AK34+AO34+AS34 -> 138 | F34: =+(G34+H34)+(0.5*I34) -> 60.80 | G34: 29.30 | H34: 31.50 | I34: 0 | J34: =+(K34+L34)+0.5*M34 -> 64.55 | K34: 31.01 | L34: 30.54 | M34: 6 | N34: =+(O34+P34+Q34)+0.5*R34 -> 48.66 | O34: 14.93 | P34: 20.25 | Q34: 13.48 | R34: 0 | S34: =+(T34)+0.5*U34 -> 40.50 | T34: 40.50 | U34: 0 | V34: =+(W34+X34)+0.5*Y34 -> 48.71 | W34: 11.63 | X34: 16.08 | Y34: 42 | Z34: =+(AA34)+0.5*AB34 -> 115.91 | AA34: 99.41 | AB34: 33 | AC34: =+(AD34)+0.5*AF34 -> 35.29 | AD34: 35.29 | AE34: 36.84* | AF34: 0 | AG34: =+(AH34+AI34+AJ34)+0.5*AK34 -> 79.82 | AH34: 21.60 | AI34: 18.55 | AJ34: 32.17 | AK34: 15 | AL34: =+(AM34+AN34)+0.5*AO34 -> 87.16 | AM34: 38.01 | AN34: 33.15 | AO34: 32 | AP34: =+(AQ34+AR34)+0.5*AS34 -> 107.02 | AQ34: 59.37 | AR34: 42.65 | AS34: 10
A35: 32 | B35: Andrus, Jay | C35: L | D35: =+F35+J35+N35+S35+V35+Z35+AC35+AG35+AL35+AP35 -> 695.12 | E35: =+I35+M35+R35+U35+Y35+AB35+AF35+AK35+AO35+AS35 -> 166 | F35: =+(G35+H35)+(0.5*I35) -> 78.10 | G35: 33.72 | H35: 44.38 | I35: 0 | J35: =+(K35+L35)+0.5*M35 -> 61.09 | K35: 21.09 | L35: 34.50 | M35: 11 | N35: =+(O35+P35+Q35)+0.5*R35 -> 68.54 | O35: 25.46 | P35: 18.59 | Q35: 24.49 | R35: 0 | S35: =+(T35)+0.5*U35 -> 57.49 | T35: 57.49 | U35: 0 | V35: =+(W35+X35)+0.5*Y35 -> 29.98 | W35: 14.30 | X35: 14.18 | Y35: 3 | Z35: =+(AA35)+0.5*AB35 -> 85.22 | AA35: 67.22 | AB35: 36 | AC35: =+(AD35)+0.5*AF35 -> 48.50 | AD35: 33.50 | AE35: 17.43 | AF35: 30 | AG35: =+(AH35+AI35+AJ35)+0.5*AK35 -> 74.41 | AH35: 13.11 | AI35: 18.45 | AJ35: 37.35 | AK35: 11 | AL35: =+(AM35+AN35)+0.5*AO35 -> 85.05 | AM35: 32.91 | AN35: 34.64 | AO35: 35 | AP35: =+(AQ35+AR35)+0.5*AS35 -> 106.74 | AQ35: 48.23 | AR35: 38.51 | AS35: 40
A36: 33 | B36: Garcia, Dan | C36: L | D36: =+F36+J36+N36+S36+V36+Z36+AC36+AG36+AL36+AP36 -> 759.88 | E36: =+I36+M36+R36+U36+Y36+AB36+AF36+AK36+AO36+AS36 -> 135 | F36: =+(G36+H36)+(0.5*I36) -> 64.52 | G36: 33.05 | H36: 31.47 | I36: 0 | J36: =+(K36+L36)+0.5*M36 -> 69.59 | K36: 27.18 | L36: 37.91 | M36: 9 | N36: =+(O36+P36+Q36)+0.5*R36 -> 69.28 | O36: 24.00 | P36: 29.23 | Q36: 16.05 | R36: 0 | S36: =+(T36)+0.5*U36 -> 50.66 | T36: 50.66 | U36: 0 | V36: =+(W36+X36)+0.5*Y36 -> 46.65 | W36: 14.90 | X36: 19.75 | Y36: 24 | Z36: =+(AA36)+0.5*AB36 -> 98.94 | AA36: 87.94 | AB36: 22 | AC36: =+(AD36)+0.5*AF36 -> 38.81 | AD36: 38.81 | AE36: 30.90* | AF36: 0 | AG36: =+(AH36+AI36+AJ36)+0.5*AK36 -> 83.35 | AH36: 16.16 | AI36: 26.46 | AJ36: 35.23 | AK36: 11 | AL36: =+(AM36+AN36)+0.5*AO36 -> 91.86 | AM36: 36.40 | AN36: 43.46 | AO36: 24 | AP36: =+(AQ36+AR36)+0.5*AS36 -> 146.22 | AQ36: 54.36 | AR36: 69.36 | AS36: 45
A37: 34 | B37: Hird, Chris | C37: L | D37: =+F37+J37+N37+S37+V37+Z37+AC37+AG37+AL37+AP37 -> 791.07 | E37: =+I37+M37+R37+U37+Y37+AB37+AF37+AK37+AO37+AS37 -> 187 | F37: =+(G37+H37)+(0.5*I37) -> 23.12 | G37: 9.43 | H37: 13.69 | I37: 0 | J37: =+(K37+L37)+0.5*M37 -> 62.28 | K37: 16.78 | L37: 29.00 | M37: 33 | N37: =+(O37+P37+Q37)+0.5*R37 -> 80.30 | O37: 28.10 | P37: 17.87 | Q37: 34.33 | R37: 0 | S37: =+(T37)+0.5*U37 -> 38.22 | T37: 38.22 | U37: 0 | V37: =+(W37+X37)+0.5*Y37 -> 43.15 | W37: 15.25 | X37: 23.40 | Y37: 9 | Z37: =+(AA37)+0.5*AB37 -> 144.49 | AA37: 128.99 | AB37: 31 | AC37: =+(AD37)+0.5*AF37 -> 61.90 | AD37: 61.90 | AE37: 17.24 | AF37: 0 | AG37: =+(AH37+AI37+AJ37)+0.5*AK37 -> 80.72 | AH37: 21.45 | AI37: 16.70 | AJ37: 37.07 | AK37: 11 | AL37: =+(AM37+AN37)+0.5*AO37 -> 100.53 | AM37: 43.90 | AN37: 32.63 | AO37: 48 | AP37: =+(AQ37+AR37)+0.5*AS37 -> 156.36 | AQ37: 72.45 | AR37: 56.41 | AS37: 55
A38: 35 | B38: Risbeck, Carl | C38: L | D38: =+F38+J38+N38+S38+V38+Z38+AC38+AG38+AL38+AP38 -> 1011.81 | E38: =+I38+M38+R38+U38+Y38+AB38+AF38+AK38+AO38+AS38 -> 283 | F38: =+(G38+H38)+(0.5*I38) -> 114.71 | G38: 36.12 | H38: 71.09 | I38: 15 | J38: =+(K38+L38)+0.5*M38 -> 59.30 | K38: 25.78 | L38: 21.52 | M38: 24 | N38: =+(O38+P38+Q38)+0.5*R38 -> 139.76 | O38: 50.88 | P38: 44.79 | Q38: 39.09 | R38: 10 | S38: =+(T38)+0.5*U38 -> 71.81 | T38: 71.81 | U38: 0 | V38: =+(W38+X38)+0.5*Y38 -> 73.35 | W38: 18.63 | X38: 29.22 | Y38: 51 | Z38: =+(AA38)+0.5*AB38 -> 144.19 | AA38: 117.69 | AB38: 53 | AC38: =+(AD38)+0.5*AF38 -> 36.25 | AD38: 36.25 | AE38: 19.52 | AF38: 0 | AG38: =+(AH38+AI38+AJ38)+0.5*AK38 -> 109.22 | AH38: 20.94 | AI38: 35.85 | AJ38: 39.93 | AK38: 25 | AL38: =+(AM38+AN38)+0.5*AO38 -> 119.03 | AM38: 45.22 | AN38: 53.81 | AO38: 40 | AP38: =+(AQ38+AR38)+0.5*AS38 -> 144.19 | AQ38: 56.70 | AR38: 54.99 | AS38: 65
A39: 36 | B39: Cox, Roger | C39: L | D39: DNF | E39: DNF | F39: =+(G39+H39)+(0.5*I39) -> 32.10 | G39: 13.73 | H39: 8.37 | I39: 20 | J39: =+(K39+L39)+0.5*M39 -> 41.57 | K39: 22.30 | L39: 11.27 | M39: 16 | N39: =+(O39+P39+Q39)+0.5*R39 -> 42.68 | O39: 13.91 | P39: 13.33 | Q39: 10.44 | R39: 10 | S39: =+(T39)+0.5*U39 -> 36.30 | T39: 36.30 | U39: 0 | V39: =+(W39+X39)+0.5*Y39 -> 34.53 | W39: 13.29 | X39: 15.74 | Y39: 11 | Z39: DNF | AA39: DNF | AB39: DNF | AC39: =+(AD39)+0.5*AF39 -> 21.26 | AD39: 21.26 | AE39: 10.21 | AF39: 0 | AG39: =+(AH39+AI39+AJ39)+0.5*AK39 -> 63.76 | AH39: 15.64 | AI39: 14.84 | AJ39: 20.78 | AK39: 25 | AL39: =+(AM39+AN39)+0.5*AO39 -> 111.76 | AM39: 61.37 | AN39: 32.39 | AO39: 36 | AP39: =+(AQ39+AR39)+0.5*AS39 -> 102.09 | AQ39: 23.98 | AR39: 68.11 | AS39: 20
A40: 37 | B40: DeCiccio, Mike | C40: L | D40: DNF | E40: DNF | F40: =+(G40+H40)+(0.5*I40) -> 94.77 | G40: 69.92 | H40: 24.85 | I40: 0 | J40: =+(K40+L40)+0.5*M40 -> 62.01 | K40: 37.03 | L40: 21.98 | M40: 6 | N40: =+(O40+P40+Q40)+0.5*R40 -> 42.12 | O40: 14.69 | P40: 13.63 | Q40: 13.80 | R40: 0 | S40: =+(T40)+0.5*U40 -> 53.51 | T40: 53.51 | U40: 0 | V40: =+(W40+X40)+0.5*Y40 -> 45.65 | W40: 16.65 | X40: 18.50 | Y40: 21 | Z40: DNF | AA40: DNF | AB40: DNF | AC40: DNF | AD40: DNF | AE40: DNF | AF40: DNF | AG40: DNF | AH40: DNF | AI40: DNF | AJ40: DNF | AK40: DNF | AL40: =+(AM40+AN40)+0.5*AO40 -> 96.17 | AM40: 25.66 | AN40: 59.01 | AO40: 23 | AP40: =+(AQ40+AR40)+0.5*AS40 -> 134.67 | AQ40: 65.00 | AR40: 47.17 | AS40: 45
A41: Notes:
A42: - | B42: Open Division is for any shooter that was using an optical sighting device on any of their weapons. Limited Division is for all other shooters no matter what caliber, gauge or configuration of weapon.
A43: - | B43: Points Down = .5 seconds x Points Down. PD Total is added to the total Stage time.
A44: XX | B44: Indicates that the Points Down value includes some kind of penalty (Procedural Error, Hits on Non-Threat or Failure to Neutralize).
A45: DNF | B45: = Did Not Finish
A46: * | B46: Shooters noted with an * shot String 2 the same as String 1 except all shots were from the weak side.
A47: ** | B47: All "Failure to Neutralize" penalties were removed from Stage 10. IDPA rules indicate that you cannot access this penalty if the stage is Limited Vickers.