B1: UDPL 3-Gun Match - Results for July 19, 2003 held at the FARM
B2: (Results listed by Time without regard to Division)
A3: Place | B3: Name | C3: Division: O=Open L=Limited | D3: Shoot Total | E3: Total Points Down | F3: Stage 1 | G3: String 1 | H3: String 2 | I3: Points Down | J3: Stage 2 | K3: String 1 | L3: String 2 | M3: Points Down | N3: Stage 3 | O3: String 1 | P3: Points Down | Q3: Stage 4 | R3: String 1 | S3: String 2 | T3: Points Down | U3: Stage 5 | V3: String 1 | W3: String 2 | X3: Points Down | Y3: Stage 6 | Z3: String 1 | AA3: String 2 | AB3: Points Down | AC3: Stage 7 | AD3: String 1 | AE3: String 2 | AF3: Points Down | AG3: Stage 8 | AH3: String 1 | AI3: String 2 | AJ3: Points Down | AK3: Stage 9 | AL3: String 1 | AM3: String 2 | AN3: String 3 | AO3: Points Down
A4: 1 | B4: Marshall, Bob | C4: L | D4: =+F4+J4+N4+Q4+U4+Y4+AC4+AG4+AK4 -> 336.53 | E4: =+I4+M4+P4+T4+X4+AB4+AF4+AJ4+AO4 -> 87 | F4: =+(G4+H4)+(0.5*I4) -> 30.51 | G4: 12.67 | H4: 12.84 | I4: 10 | J4: =+(K4+L4)+0.5*M4 -> 20.37 | K4: 9.18 | L4: 8.69 | M4: 5 | N4: =+(O4)+0.5*P4 -> 34.11 | O4: 26.61 | P4: 15 | Q4: =+(R4+S4)+0.5*T4 -> 36.87 | R4: 15.13 | S4: 14.74 | T4: 14 | U4: =+(V4+W4)+0.5*X4 -> 65.64 | V4: 28.32 | W4: 24.32 | X4: 26 | Y4: =+(Z4+AA4)+0.5*AB4 -> 37.45 | Z4: 17.40 | AA4: 13.55 | AB4: 13 | AC4: =+(AD4+AE4)+0.5*AF4 -> 30.43 | AD4: 10.57 | AE4: 17.86 | AF4: 4 | AG4: =+(AH4+AI4)+0.5*AJ4 -> 31.86 | AH4: 17.55 | AI4: 14.31 | AJ4: 0 | AK4: =+(AL4+AM4+AN4)+0.5*AO4 -> 49.29 | AL4: 15.37 | AM4: 20.39 | AN4: 13.53 | AO4: 0
A5: 2 | B5: Lowe, John | C5: O | D5: =+F5+J5+N5+Q5+U5+Y5+AC5+AG5+AK5 -> 379.88 | E5: =+I5+M5+P5+T5+X5+AB5+AF5+AJ5+AO5 -> 36 | F5: =+(G5+H5)+(0.5*I5) -> 51.15 | G5: 24.41 | H5: 25.24 | I5: 3 | J5: =+(K5+L5)+0.5*M5 -> 26.44 | K5: 12.19 | L5: 13.25 | M5: 2 | N5: =+(O5)+0.5*P5 -> 37.38 | O5: 35.38 | P5: 4 | Q5: =+(R5+S5)+0.5*T5 -> 31.93 | R5: 17.68 | S5: 13.25 | T5: 2 | U5: =+(V5+W5)+0.5*X5 -> 91.24 | V5: 49.73 | W5: 30.51 | X5: 22 | Y5: =+(Z5+AA5)+0.5*AB5 -> 36.52 | Z5: 18.52 | AA5: 16.50 | AB5: 3 | AC5: =+(AD5+AE5)+0.5*AF5 -> 27.20 | AD5: 14.44 | AE5: 12.76 | AF5: 0 | AG5: =+(AH5+AI5)+0.5*AJ5 -> 39.29 | AH5: 20.99 | AI5: 18.30 | AJ5: 0 | AK5: =+(AL5+AM5+AN5)+0.5*AO5 -> 38.73 | AL5: 9.70 | AM5: 15.25 | AN5: 13.78 | AO5: 0
A6: 3 | B6: Correia, Larry | C6: L | D6: =+F6+J6+N6+Q6+U6+Y6+AC6+AG6+AK6 -> 385.11 | E6: =+I6+M6+P6+T6+X6+AB6+AF6+AJ6+AO6 -> 117 | F6: =+(G6+H6)+(0.5*I6) -> 47.55 | G6: 18.33 | H6: 18.22 | I6: 22 | J6: =+(K6+L6)+0.5*M6 -> 25.66 | K6: 10.49 | L6: 10.17 | M6: 10 | N6: =+(O6)+0.5*P6 -> 38.35 | O6: 34.85 | P6: 7 | Q6: =+(R6+S6)+0.5*T6 -> 51.02 | R6: 22.09 | S6: 15.43 | T6: 27 | U6: =+(V6+W6)+0.5*X6 -> 71.60 | V6: 32.92 | W6: 25.68 | X6: 26 | Y6: =+(Z6+AA6)+0.5*AB6 -> 45.58 | Z6: 18.22 | AA6: 20.86 | AB6: 13 | AC6: =+(AD6+AE6)+0.5*AF6 -> 29.67 | AD6: 9.55 | AE6: 14.12 | AF6: 12 | AG6: =+(AH6+AI6)+0.5*AJ6 -> 30.60 | AH6: 14.76 | AI6: 15.84 | AJ6: 0 | AK6: =+(AL6+AM6+AN6)+0.5*AO6 -> 45.08 | AL6: 12.51 | AM6: 20.21 | AN6: 12.36 | AO6: 0
A7: 4 | B7: Ward, Dan | C7: O | D7: =+F7+J7+N7+Q7+U7+Y7+AC7+AG7+AK7 -> 388.34 | E7: =+I7+M7+P7+T7+X7+AB7+AF7+AJ7+AO7 -> 77 | F7: =+(G7+H7)+(0.5*I7) -> 36.02 | G7: 14.76 | H7: 13.26 | I7: 16 | J7: =+(K7+L7)+0.5*M7 -> 32.32 | K7: 15.35 | L7: 14.47 | M7: 5 | N7: =+(O7)+0.5*P7 -> 36.33 | O7: 33.83 | P7: 5 | Q7: =+(R7+S7)+0.5*T7 -> 45.21 | R7: 20.11 | S7: 18.10 | T7: 14 | U7: =+(V7+W7)+0.5*X7 -> 73.64 | V7: 34.88 | W7: 27.26 | X7: 23 | Y7: =+(Z7+AA7)+0.5*AB7 -> 37.36 | Z7: 17.26 | AA7: 18.60 | AB7: 3 | AC7: =+(AD7+AE7)+0.5*AF7 -> 33.58 | AD7: 11.11 | AE7: 16.97 | AF7: 11 | AG7: =+(AH7+AI7)+0.5*AJ7 -> 51.43 | AH7: 29.11 | AI7: 22.32 | AJ7: 0 | AK7: =+(AL7+AM7+AN7)+0.5*AO7 -> 42.45 | AL7: 18.28 | AM7: 13.58 | AN7: 10.59 | AO7: 0
A8: 5 | B8: Theodore, Ari | C8: L | D8: =+F8+J8+N8+Q8+U8+Y8+AC8+AG8+AK8 -> 394.46 | E8: =+I8+M8+P8+T8+X8+AB8+AF8+AJ8+AO8 -> 85 | F8: =+(G8+H8)+(0.5*I8) -> 40.31 | G8: 17.30 | H8: 16.51 | I8: 13 | J8: =+(K8+L8)+0.5*M8 -> 30.77 | K8: 13.74 | L8: 12.53 | M8: 9 | N8: =+(O8)+0.5*P8 -> 37.84 | O8: 34.84 | P8: 6 | Q8: =+(R8+S8)+0.5*T8 -> 42.01 | R8: 21.16 | S8: 20.35 | T8: 1 | U8: =+(V8+W8)+0.5*X8 -> 82.28 | V8: 31.32 | W8: 30.46 | X8: 41 | Y8: =+(Z8+AA8)+0.5*AB8 -> 35.31 | Z8: 14.77 | AA8: 16.04 | AB8: 9 | AC8: =+(AD8+AE8)+0.5*AF8 -> 27.76 | AD8: 10.22 | AE8: 14.54 | AF8: 6 | AG8: =+(AH8+AI8)+0.5*AJ8 -> 35.19 | AH8: 18.38 | AI8: 16.81 | AJ8: 0 | AK8: =+(AL8+AM8+AN8)+0.5*AO8 -> 62.99 | AL8: 12.37 | AM8: 27.62 | AN8: 23.00 | AO8: 0
A9: 6 | B9: Latham, Corey | C9: L | D9: =+F9+J9+N9+Q9+U9+Y9+AC9+AG9+AK9 -> 394.47 | E9: =+I9+M9+P9+T9+X9+AB9+AF9+AJ9+AO9 -> 54 | F9: =+(G9+H9)+(0.5*I9) -> 41.89 | G9: 16.53 | H9: 16.36 | I9: 18 | J9: =+(K9+L9)+0.5*M9 -> 21.89 | K9: 11.20 | L9: 10.69 | M9: 0 | N9: =+(O9)+0.5*P9 -> 32.81 | O9: 32.31 | P9: 1 | Q9: =+(R9+S9)+0.5*T9 -> 45.90 | R9: 18.98 | S9: 22.42 | T9: 9 | U9: =+(V9+W9)+0.5*X9 -> 81.97 | V9: 39.25 | W9: 32.72 | X9: 20 | Y9: =+(Z9+AA9)+0.5*AB9 -> 42.99 | Z9: 20.98 | AA9: 21.01 | AB9: 2 | AC9: =+(AD9+AE9)+0.5*AF9 -> 27.13 | AD9: 10.22 | AE9: 14.91 | AF9: 4 | AG9: =+(AH9+AI9)+0.5*AJ9 -> 34.24 | AH9: 18.25 | AI9: 15.99 | AJ9: 0 | AK9: =+(AL9+AM9+AN9)+0.5*AO9 -> 65.65 | AL9: 17.06 | AM9: 16.89 | AN9: 31.70 | AO9: 0
A10: 7 | B10: Nankervis, Bob | C10: L | D10: =+F10+J10+N10+Q10+U10+Y10+AC10+AG10+AK10 -> 408.63 | E10: =+I10+M10+P10+T10+X10+AB10+AF10+AJ10+AO10 -> 69 | F10: =+(G10+H10)+(0.5*I10) -> 34.21 | G10: 16.00 | H10: 16.71 | I10: 3 | J10: =+(K10+L10)+0.5*M10 -> 26.72 | K10: 13.01 | L10: 11.71 | M10: 4 | N10: =+(O10)+0.5*P10 -> 45.44 | O10: 37.44 | P10: 16 | Q10: =+(R10+S10)+0.5*T10 -> 40.19 | R10: 21.29 | S10: 16.90 | T10: 4 | U10: =+(V10+W10)+0.5*X10 -> 107.51 | V10: 51.18 | W10: 43.33 | X10: 26 | Y10: =+(Z10+AA10)+0.5*AB10 -> 34.69 | Z10: 13.55 | AA10: 19.14 | AB10: 4 | AC10: =+(AD10+AE10)+0.5*AF10 -> 40.52 | AD10: 12.47 | AE10: 22.05 | AF10: 12 | AG10: =+(AH10+AI10)+0.5*AJ10 -> 41.75 | AH10: 19.02 | AI10: 22.73 | AJ10: 0 | AK10: =+(AL10+AM10+AN10)+0.5*AO10 -> 37.60 | AL10: 10.52 | AM10: 11.72 | AN10: 15.36 | AO10: 0
A11: 8 | B11: Redford, "Red" | C11: L | D11: =+F11+J11+N11+Q11+U11+Y11+AC11+AG11+AK11 -> 431.66 | E11: =+I11+M11+P11+T11+X11+AB11+AF11+AJ11+AO11 -> 65 | F11: =+(G11+H11)+(0.5*I11) -> 56.18 | G11: 24.89 | H11: 22.79 | I11: 17 | J11: =+(K11+L11)+0.5*M11 -> 38.38 | K11: 18.65 | L11: 18.23 | M11: 3 | N11: =+(O11)+0.5*P11 -> 50.64 | O11: 46.14 | P11: 9 | Q11: =+(R11+S11)+0.5*T11 -> 48.78 | R11: 28.44 | S11: 17.34 | T11: 6 | U11: =+(V11+W11)+0.5*X11 -> 64.04 | V11: 27.52 | W11: 26.52 | X11: 20 | Y11: =+(Z11+AA11)+0.5*AB11 -> 44.36 | Z11: 25.83 | AA11: 17.53 | AB11: 2 | AC11: =+(AD11+AE11)+0.5*AF11 -> 37.61 | AD11: 13.93 | AE11: 19.68 | AF11: 8 | AG11: =+(AH11+AI11)+0.5*AJ11 -> 33.62 | AH11: 17.34 | AI11: 16.28 | AJ11: 0 | AK11: =+(AL11+AM11+AN11)+0.5*AO11 -> 58.05 | AL11: 18.78 | AM11: 18.87 | AN11: 20.40 | AO11: 0
A12: 9 | B12: Mousley, Roger | C12: L | D12: =+F12+J12+N12+Q12+U12+Y12+AC12+AG12+AK12 -> 441.19 | E12: =+I12+M12+P12+T12+X12+AB12+AF12+AJ12+AO12 -> 99 | F12: =+(G12+H12)+(0.5*I12) -> 39.31 | G12: 16.24 | H12: 16.07 | I12: 14 | J12: =+(K12+L12)+0.5*M12 -> 28.77 | K12: 14.38 | L12: 13.89 | M12: 1 | N12: =+(O12)+0.5*P12 -> 41.32 | O12: 37.32 | P12: 8 | Q12: =+(R12+S12)+0.5*T12 -> 50.02 | R12: 20.33 | S12: 24.19 | T12: 11 | U12: =+(V12+W12)+0.5*X12 -> 98.12 | V12: 33.53 | W12: 42.09 | X12: 45 | Y12: =+(Z12+AA12)+0.5*AB12 -> 36.29 | Z12: 14.17 | AA12: 13.12 | AB12: 18 | AC12: =+(AD12+AE12)+0.5*AF12 -> 28.30 | AD12: 10.64 | AE12: 16.66 | AF12: 2 | AG12: =+(AH12+AI12)+0.5*AJ12 -> 49.43 | AH12: 25.76 | AI12: 23.67 | AJ12: 0 | AK12: =+(AL12+AM12+AN12)+0.5*AO12 -> 69.63 | AL12: 14.36 | AM12: 17.16 | AN12: 38.11 | AO12: 0
A13: 10 | B13: Sharp, Mikel | C13: L | D13: =+F13+J13+N13+Q13+U13+Y13+AC13+AG13+AK13 -> 445.73 | E13: =+I13+M13+P13+T13+X13+AB13+AF13+AJ13+AO13 -> 183 | F13: =+(G13+H13)+(0.5*I13) -> 42.89 | G13: 13.18 | H13: 14.21 | I13: 31 | J13: =+(K13+L13)+0.5*M13 -> 28.70 | K13: 13.54 | L13: 14.16 | M13: 2 | N13: =+(O13)+0.5*P13 -> 31.51 | O13: 30.01 | P13: 3 | Q13: =+(R13+S13)+0.5*T13 -> 40.23 | R13: 16.86 | S13: 17.37 | T13: 12 | U13: =+(V13+W13)+0.5*X13 -> 104.25 | V13: 34.49 | W13: 24.26 | X13: 91 | Y13: =+(Z13+AA13)+0.5*AB13 -> 57.12 | Z13: 29.82 | AA13: 18.80 | AB13: 17 | AC13: =+(AD13+AE13)+0.5*AF13 -> 36.30 | AD13: 9.99 | AE13: 12.81 | AF13: 27 | AG13: =+(AH13+AI13)+0.5*AJ13 -> 45.97 | AH13: 20.29 | AI13: 25.68 | AJ13: 0 | AK13: =+(AL13+AM13+AN13)+0.5*AO13 -> 58.76 | AL13: 11.25 | AM13: 16.12 | AN13: 31.39 | AO13: 0
A14: 11 | B14: Durant, Steve | C14: L | D14: =+F14+J14+N14+Q14+U14+Y14+AC14+AG14+AK14 -> 447.79 | E14: =+I14+M14+P14+T14+X14+AB14+AF14+AJ14+AO14 -> 141 | F14: =+(G14+H14)+(0.5*I14) -> 62.42 | G14: 24.81 | H14: 23.61 | I14: 28 | J14: =+(K14+L14)+0.5*M14 -> 41.27 | K14: 16.39 | L14: 14.88 | M14: 20 | N14: =+(O14)+0.5*P14 -> 41.93 | O14: 40.43 | P14: 3 | Q14: =+(R14+S14)+0.5*T14 -> 50.96 | R14: 20.15 | S14: 21.31 | T14: 19 | U14: =+(V14+W14)+0.5*X14 -> 90.62 | V14: 31.75 | W14: 30.87 | X14: 56 | Y14: =+(Z14+AA14)+0.5*AB14 -> 42.14 | Z14: 18.06 | AA14: 22.08 | AB14: 4 | AC14: =+(AD14+AE14)+0.5*AF14 -> 26.86 | AD14: 10.57 | AE14: 10.79 | AF14: 11 | AG14: =+(AH14+AI14)+0.5*AJ14 -> 57.45 | AH14: 24.63 | AI14: 32.82 | AJ14: 0 | AK14: =+(AL14+AM14+AN14)+0.5*AO14 -> 34.14 | AL14: 10.60 | AM14: 13.77 | AN14: 9.77 | AO14: 0
A15: 12 | B15: Peterson, Scott | C15: ? | D15: =+F15+J15+N15+Q15+U15+Y15+AC15+AG15+AK15 -> 455.88 | E15: =+I15+M15+P15+T15+X15+AB15+AF15+AJ15+AO15 -> 232 | F15: =+(G15+H15)+(0.5*I15) -> 39.30 | G15: 12.37 | H15: 16.43 | I15: 21 | J15: =+(K15+L15)+0.5*M15 -> 36.74 | K15: 10.19 | L15: 18.55 | M15: 16 | N15: =+(O15)+0.5*P15 -> 57.82 | O15: 31.82 | P15: 52 | Q15: =+(R15+S15)+0.5*T15 -> 42.18 | R15: 17.58 | S15: 14.10 | T15: 21 | U15: =+(V15+W15)+0.5*X15 -> 93.32 | V15: 28.25 | W15: 34.57 | X15: 61 | Y15: =+(Z15+AA15)+0.5*AB15 -> 51.38 | Z15: 18.31 | AA15: 19.07 | AB15: 28 | AC15: =+(AD15+AE15)+0.5*AF15 -> 51.12 | AD15: 10.75 | AE15: 26.87 | AF15: 27 | AG15: =+(AH15+AI15)+0.5*AJ15 -> 29.94 | AH15: 15.22 | AI15: 14.72 | AJ15: 0 | AK15: =+(AL15+AM15+AN15)+0.5*AO15 -> 54.08 | AL15: 13.55 | AM15: 21.03 | AN15: 16.50 | AO15: 6
A16: 13 | B16: Marshall, Chad | C16: ? | D16: =+F16+J16+N16+Q16+U16+Y16+AC16+AG16+AK16 -> 456.14 | E16: =+I16+M16+P16+T16+X16+AB16+AF16+AJ16+AO16 -> 114 | F16: =+(G16+H16)+(0.5*I16) -> 38.65 | G16: 17.12 | H16: 16.53 | I16: 10 | J16: =+(K16+L16)+0.5*M16 -> 31.64 | K16: 12.37 | L16: 10.77 | M16: 17 | N16: =+(O16)+0.5*P16 -> 43.06 | O16: 42.56 | P16: 1 | Q16: =+(R16+S16)+0.5*T16 -> 50.59 | R16: 17.58 | S16: 14.51 | T16: 37 | U16: =+(V16+W16)+0.5*X16 -> 76.35 | V16: 27.53 | W16: 30.32 | X16: 37 | Y16: =+(Z16+AA16)+0.5*AB16 -> 42.74 | Z16: 18.81 | AA16: 18.93 | AB16: 10 | AC16: =+(AD16+AE16)+0.5*AF16 -> 41.87 | AD16: 13.57 | AE16: 27.30 | AF16: 2 | AG16: =+(AH16+AI16)+0.5*AJ16 -> 47.90 | AH16: 24.76 | AI16: 23.14 | AJ16: 0 | AK16: =+(AL16+AM16+AN16)+0.5*AO16 -> 83.34 | AL16: 23.05 | AM16: 23.11 | AN16: 37.18 | AO16: 0
A17: 14 | B17: Knapp, Chris | C17: ? | D17: =+F17+J17+N17+Q17+U17+Y17+AC17+AG17+AK17 -> 457.00 | E17: =+I17+M17+P17+T17+X17+AB17+AF17+AJ17+AO17 -> 111 | F17: =+(G17+H17)+(0.5*I17) -> 43.60 | G17: 18.99 | H17: 21.61 | I17: 6 | J17: =+(K17+L17)+0.5*M17 -> 36.54 | K17: 16.09 | L17: 15.95 | M17: 9 | N17: =+(O17)+0.5*P17 -> 37.04 | O17: 34.54 | P17: 5 | Q17: =+(R17+S17)+0.5*T17 -> 63.04 | R17: 22.20 | S17: 21.34 | T17: 39 | U17: =+(V17+W17)+0.5*X17 -> 99.00 | V17: 36.44 | W17: 39.56 | X17: 46 | Y17: =+(Z17+AA17)+0.5*AB17 -> 51.32 | Z17: 27.28 | AA17: 22.04 | AB17: 4 | AC17: =+(AD17+AE17)+0.5*AF17 -> 28.13 | AD17: 14.63 | AE17: 12.50 | AF17: 2 | AG17: =+(AH17+AI17)+0.5*AJ17 -> 44.30 | AH17: 24.17 | AI17: 20.13 | AJ17: 0 | AK17: =+(AL17+AM17+AN17)+0.5*AO17 -> 54.03 | AL17: 17.35 | AM17: 15.06 | AN17: 21.62 | AO17: 0
A18: 15 | B18: Snelson, Rylee | C18: O | D18: =+F18+J18+N18+Q18+U18+Y18+AC18+AG18+AK18 -> 466.49 | E18: =+I18+M18+P18+T18+X18+AB18+AF18+AJ18+AO18 -> 161 | F18: =+(G18+H18)+(0.5*I18) -> 42.19 | G18: 15.80 | H18: 17.39 | I18: 18 | J18: =+(K18+L18)+0.5*M18 -> 30.52 | K18: 11.45 | L18: 11.07 | M18: 16 | N18: =+(O18)+0.5*P18 -> 40.81 | O18: 37.81 | P18: 6 | Q18: =+(R18+S18)+0.5*T18 -> 43.88 | R18: 18.85 | S18: 16.53 | T18: 17 | U18: =+(V18+W18)+0.5*X18 -> 129.90 | V18: 41.03 | W18: 52.37 | X18: 73 | Y18: =+(Z18+AA18)+0.5*AB18 -> 52.64 | Z18: 20.66 | AA18: 20.48 | AB18: 23 | AC18: =+(AD18+AE18)+0.5*AF18 -> 45.49 | AD18: 20.97 | AE18: 20.52 | AF18: 8 | AG18: =+(AH18+AI18)+0.5*AJ18 -> 32.74 | AH18: 16.93 | AI18: 15.81 | AJ18: 0 | AK18: =+(AL18+AM18+AN18)+0.5*AO18 -> 48.32 | AL18: 15.49 | AM18: 16.64 | AN18: 16.19 | AO18: 0
A19: 16 | B19: Zaccardi, Pat | C19: ? | D19: =+F19+J19+N19+Q19+U19+Y19+AC19+AG19+AK19 -> 477.14 | E19: =+I19+M19+P19+T19+X19+AB19+AF19+AJ19+AO19 -> 130 | F19: =+(G19+H19)+(0.5*I19) -> 44.60 | G19: 17.51 | H19: 16.59 | I19: 21 | J19: =+(K19+L19)+0.5*M19 -> 32.36 | K19: 14.19 | L19: 12.17 | M19: 12 | N19: =+(O19)+0.5*P19 -> 44.28 | O19: 39.78 | P19: 9 | Q19: =+(R19+S19)+0.5*T19 -> 45.57 | R19: 20.04 | S19: 20.53 | T19: 10 | U19: =+(V19+W19)+0.5*X19 -> 116.48 | V19: 49.13 | W19: 41.85 | X19: 51 | Y19: =+(Z19+AA19)+0.5*AB19 -> 38.09 | Z19: 14.49 | AA19: 17.10 | AB19: 13.00 | AC19: =+(AD19+AE19)+0.5*AF19 -> 39.16 | AD19: 12.76 | AE19: 19.40 | AF19: 14 | AG19: =+(AH19+AI19)+0.5*AJ19 -> 45.90 | AH19: 26.35 | AI19: 19.55 | AJ19: 0 | AK19: =+(AL19+AM19+AN19)+0.5*AO19 -> 70.70 | AL19: 20.15 | AM19: 24.18 | AN19: 26.37 | AO19: 0
A20: 17 | B20: Vollmer, Phillip | C20: L | D20: =+F20+J20+N20+Q20+U20+Y20+AC20+AG20+AK20 -> 478.46 | E20: =+I20+M20+P20+T20+X20+AB20+AF20+AJ20+AO20 -> 101 | F20: =+(G20+H20)+(0.5*I20) -> 56.76 | G20: 20.58 | H20: 18.18 | I20: 36 | J20: =+(K20+L20)+0.5*M20 -> 36.06 | K20: 18.24 | L20: 16.32 | M20: 3 | N20: =+(O20)+0.5*P20 -> 42.41 | O20: 36.91 | P20: 11 | Q20: =+(R20+S20)+0.5*T20 -> 49.28 | R20: 21.30 | S20: 19.98 | T20: 16 | U20: =+(V20+W20)+0.5*X20 -> 101.85 | V20: 45.99 | W20: 47.86 | X20: 16 | Y20: =+(Z20+AA20)+0.5*AB20 -> 64.28 | Z20: 25.47 | AA20: 31.31 | AB20: 15 | AC20: =+(AD20+AE20)+0.5*AF20 -> 31.87 | AD20: 11.92 | AE20: 17.95 | AF20: 4 | AG20: =+(AH20+AI20)+0.5*AJ20 -> 43.29 | AH20: 22.46 | AI20: 20.83 | AJ20: 0 | AK20: =+(AL20+AM20+AN20)+0.5*AO20 -> 52.66 | AL20: 11.57 | AM20: 16.17 | AN20: 24.92 | AO20: 0
A21: 18 | B21: Cox, Roger | C21: L | D21: =+F21+J21+N21+Q21+U21+Y21+AC21+AG21+AK21 -> 493.60 | E21: =+I21+M21+P21+T21+X21+AB21+AF21+AJ21+AO21 -> 131 | F21: =+(G21+H21)+(0.5*I21) -> 40.31 | G21: 17.00 | H21: 18.81 | I21: 9 | J21: =+(K21+L21)+0.5*M21 -> 30.52 | K21: 9.25 | L21: 10.77 | M21: 21 | N21: =+(O21)+0.5*P21 -> 47.04 | O21: 40.04 | P21: 14 | Q21: =+(R21+S21)+0.5*T21 -> 39.99 | R21: 17.52 | S21: 19.47 | T21: 6 | U21: =+(V21+W21)+0.5*X21 -> 85.27 | V21: 26.32 | W21: 26.95 | X21: 64 | Y21: =+(Z21+AA21)+0.5*AB21 -> 42.63 | Z21: 18.72 | AA21: 20.91 | AB21: 6 | AC21: =+(AD21+AE21)+0.5*AF21 -> 31.38 | AD21: 10.51 | AE21: 15.37 | AF21: 11 | AG21: =+(AH21+AI21)+0.5*AJ21 -> 36.18 | AH21: 18.50 | AI21: 17.68 | AJ21: 0 | AK21: =+(AL21+AM21+AN21)+0.5*AO21 -> 140.28 | AL21: 16.03 | AM21: 16.61 | AN21: 107.64 | AO21: 0
A22: 19 | B22: Meek, Scott | C22: O | D22: =+F22+J22+N22+Q22+U22+Y22+AC22+AG22+AK22 -> 517.60 | E22: =+I22+M22+P22+T22+X22+AB22+AF22+AJ22+AO22 -> 160 | F22: =+(G22+H22)+(0.5*I22) -> 48.69 | G22: 21.40 | H22: 18.79 | I22: 17 | J22: =+(K22+L22)+0.5*M22 -> 53.74 | K22: 16.31 | L22: 22.93 | M22: 29 | N22: =+(O22)+0.5*P22 -> 43.40 | O22: 40.40 | P22: 6 | Q22: =+(R22+S22)+0.5*T22 -> 60.21 | R22: 32.96 | S22: 21.75 | T22: 11 | U22: =+(V22+W22)+0.5*X22 -> 88.24 | V22: 32.57 | W22: 27.67 | X22: 56 | Y22: =+(Z22+AA22)+0.5*AB22 -> 86.52 | Z22: 33.69 | AA22: 40.33 | AB22: 25 | AC22: =+(AD22+AE22)+0.5*AF22 -> 31.31 | AD22: 10.71 | AE22: 12.60 | AF22: 16 | AG22: =+(AH22+AI22)+0.5*AJ22 -> 50.51 | AH22: 28.59 | AI22: 21.92 | AJ22: 0 | AK22: =+(AL22+AM22+AN22)+0.5*AO22 -> 54.98 | AL22: 11.77 | AM22: 13.08 | AN22: 30.13 | AO22: 0
A23: 20 | B23: Adams, Kyle | C23: ? | D23: =+F23+J23+N23+Q23+U23+Y23+AC23+AG23+AK23 -> 522.36 | E23: =+I23+M23+P23+T23+X23+AB23+AF23+AJ23+AO23 -> 164 | F23: =+(G23+H23)+(0.5*I23) -> 58.35 | G23: 27.22 | H23: 28.13 | I23: 6 | J23: =+(K23+L23)+0.5*M23 -> 32.51 | K23: 15.56 | L23: 14.95 | M23: 4 | N23: =+(O23)+0.5*P23 -> 47.66 | O23: 44.66 | P23: 6 | Q23: =+(R23+S23)+0.5*T23 -> 49.57 | R23: 20.92 | S23: 18.65 | T23: 20 | U23: =+(V23+W23)+0.5*X23 -> 136.20 | V23: 48.19 | W23: 37.51 | X23: 101 | Y23: =+(Z23+AA23)+0.5*AB23 -> 48.99 | Z23: 21.43 | AA23: 22.56 | AB23: 10 | AC23: =+(AD23+AE23)+0.5*AF23 -> 46.49 | AD23: 17.55 | AE23: 20.44 | AF23: 17 | AG23: =+(AH23+AI23)+0.5*AJ23 -> 41.15 | AH23: 19.97 | AI23: 21.18 | AJ23: 0 | AK23: =+(AL23+AM23+AN23)+0.5*AO23 -> 61.44 | AL23: 17.55 | AM23: 18.00 | AN23: 25.89 | AO23: 0
A24: 21 | B24: Beck, Dave | C24: L | D24: =+F24+J24+N24+Q24+U24+Y24+AC24+AG24+AK24 -> 531.73 | E24: =+I24+M24+P24+T24+X24+AB24+AF24+AJ24+AO24 -> 132 | F24: =+(G24+H24)+(0.5*I24) -> 55.86 | G24: 24.40 | H24: 26.46 | I24: 10 | J24: =+(K24+L24)+0.5*M24 -> 37.53 | K24: 15.17 | L24: 14.36 | M24: 16 | N24: =+(O24)+0.5*P24 -> 56.86 | O24: 45.86 | P24: 22 | Q24: =+(R24+S24)+0.5*T24 -> 65.44 | R24: 32.98 | S24: 25.96 | T24: 13 | U24: =+(V24+W24)+0.5*X24 -> 89.69 | V24: 36.66 | W24: 33.53 | X24: 39 | Y24: =+(Z24+AA24)+0.5*AB24 -> 56.36 | Z24: 26.93 | AA24: 20.93 | AB24: 17 | AC24: =+(AD24+AE24)+0.5*AF24 -> 43.67 | AD24: 14.03 | AE24: 22.14 | AF24: 15 | AG24: =+(AH24+AI24)+0.5*AJ24 -> 51.24 | AH24: 25.67 | AI24: 25.57 | AJ24: 0 | AK24: =+(AL24+AM24+AN24)+0.5*AO24 -> 75.08 | AL24: 20.53 | AM24: 29.66 | AN24: 24.89 | AO24: 0
A25: 22 | B25: Diamond, John | C25: ? | D25: =+F25+J25+N25+Q25+U25+Y25+AC25+AG25+AK25 -> 536.81 | E25: =+I25+M25+P25+T25+X25+AB25+AF25+AJ25+AO25 -> 246 | F25: =+(G25+H25)+(0.5*I25) -> 51.45 | G25: 19.09 | H25: 20.36 | I25: 24 | J25: =+(K25+L25)+0.5*M25 -> 54.50 | K25: 17.46 | L25: 14.54 | M25: 45 | N25: =+(O25)+0.5*P25 -> 59.64 | O25: 43.64 | P25: 32 | Q25: =+(R25+S25)+0.5*T25 -> 57.50 | R25: 29.31 | S25: 22.69 | T25: 11 | U25: =+(V25+W25)+0.5*X25 -> 101.02 | V25: 21.40 | W25: 23.62 | X25: 112 | Y25: =+(Z25+AA25)+0.5*AB25 -> 68.14 | Z25: 27.73 | AA25: 29.41 | AB25: 22 | AC25: =+(AD25+AE25)+0.5*AF25 -> 36.55 | AD25: 17.97 | AE25: 18.58 | AF25: 0 | AG25: =+(AH25+AI25)+0.5*AJ25 -> 43.16 | AH25: 22.39 | AI25: 20.77 | AJ25: 0 | AK25: =+(AL25+AM25+AN25)+0.5*AO25 -> 64.85 | AL25: 20.56 | AM25: 24.47 | AN25: 19.82 | AO25: 0
A26: 23 | B26: Zaccardi, Juke | C26: ? | D26: =+F26+J26+N26+Q26+U26+Y26+AC26+AG26+AK26 -> 570.03 | E26: =+I26+M26+P26+T26+X26+AB26+AF26+AJ26+AO26 -> 176 | F26: =+(G26+H26)+(0.5*I26) -> 56.94 | G26: 22.78 | H26: 20.16 | I26: 28 | J26: =+(K26+L26)+0.5*M26 -> 37.44 | K26: 14.60 | L26: 18.34 | M26: 9 | N26: =+(O26)+0.5*P26 -> 43.39 | O26: 41.39 | P26: 4 | Q26: =+(R26+S26)+0.5*T26 -> 56.81 | R26: 24.24 | S26: 20.57 | T26: 24 | U26: =+(V26+W26)+0.5*X26 -> 117.38 | V26: 46.07 | W26: 48.81 | X26: 45 | Y26: =+(Z26+AA26)+0.5*AB26 -> 103.82 | Z26: 48.39 | AA26: 43.93 | AB26: 23 | AC26: =+(AD26+AE26)+0.5*AF26 -> 44.35 | AD26: 13.78 | AE26: 21.07 | AF26: 19 | AG26: =+(AH26+AI26)+0.5*AJ26 -> 60.33 | AH26: 28.72 | AI26: 31.61 | AJ26: 0 | AK26: =+(AL26+AM26+AN26)+0.5*AO26 -> 49.57 | AL26: 16.00 | AM26: 19.90 | AN26: 1.67 | AO26: 24
A27: 24 | B27: Decker, Dennis | C27: ? | D27: =+F27+J27+N27+Q27+U27+Y27+AC27+AG27+AK27 -> 608.98 | E27: =+I27+M27+P27+T27+X27+AB27+AF27+AJ27+AO27 -> 178 | F27: =+(G27+H27)+(0.5*I27) -> 57.80 | G27: 29.66 | H27: 19.64 | I27: 17 | J27: =+(K27+L27)+0.5*M27 -> 46.94 | K27: 19.63 | L27: 21.81 | M27: 11 | N27: =+(O27)+0.5*P27 -> 55.83 | O27: 51.83 | P27: 8 | Q27: =+(R27+S27)+0.5*T27 -> 53.65 | R27: 23.48 | S27: 20.67 | T27: 19 | U27: =+(V27+W27)+0.5*X27 -> 132.02 | V27: 45.71 | W27: 40.81 | X27: 91 | Y27: =+(Z27+AA27)+0.5*AB27 -> 73.91 | Z27: 37.07 | AA27: 25.34 | AB27: 23 | AC27: =+(AD27+AE27)+0.5*AF27 -> 30.06 | AD27: 10.68 | AE27: 14.88 | AF27: 9 | AG27: =+(AH27+AI27)+0.5*AJ27 -> 49.70 | AH27: 24.94 | AI27: 24.76 | AJ27: 0 | AK27: =+(AL27+AM27+AN27)+0.5*AO27 -> 109.07 | AL27: 13.99 | AM27: 75.86 | AN27: 19.22 | AO27: 0
A28: 25 | B28: Asbell, Scott | C28: L | D28: =+F28+J28+N28+Q28+U28+Y28+AC28+AG28+AK28 -> 610.23 | E28: =+I28+M28+P28+T28+X28+AB28+AF28+AJ28+AO28 -> 91 | F28: =+(G28+H28)+(0.5*I28) -> 59.63 | G28: 25.76 | H28: 30.87 | I28: 6 | J28: =+(K28+L28)+0.5*M28 -> 65.44 | K28: 35.15 | L28: 27.79 | M28: 5 | N28: =+(O28)+0.5*P28 -> 53.89 | O28: 51.89 | P28: 4 | Q28: =+(R28+S28)+0.5*T28 -> 61.18 | R28: 28.68 | S28: 28.50 | T28: 8 | U28: =+(V28+W28)+0.5*X28 -> 108.50 | V28: 37.19 | W28: 41.81 | X28: 59 | Y28: =+(Z28+AA28)+0.5*AB28 -> 41.41 | Z28: 19.58 | AA28: 18.33 | AB28: 7 | AC28: =+(AD28+AE28)+0.5*AF28 -> 66.14 | AD28: 21.54 | AE28: 43.60 | AF28: 2 | AG28: =+(AH28+AI28)+0.5*AJ28 -> 96.57 | AH28: 48.23 | AI28: 48.34 | AJ28: 0 | AK28: =+(AL28+AM28+AN28)+0.5*AO28 -> 57.47 | AL28: 14.06 | AM28: 17.99 | AN28: 25.42 | AO28: 0
A29: 26 | B29: Roller, Rick | C29: ? | D29: =+F29+J29+N29+Q29+U29+Y29+AC29+AG29+AK29 -> 661.33 | E29: =+I29+M29+P29+T29+X29+AB29+AF29+AJ29+AO29 -> 214 | F29: =+(G29+H29)+(0.5*I29) -> 73.51 | G29: 35.46 | H29: 26.55 | I29: 23 | J29: =+(K29+L29)+0.5*M29 -> 43.15 | K29: 20.04 | L29: 18.11 | M29: 10 | N29: =+(O29)+0.5*P29 -> 79.05 | O29: 69.05 | P29: 20 | Q29: =+(R29+S29)+0.5*T29 -> 57.73 | R29: 29.89 | S29: 22.34 | T29: 11 | U29: =+(V29+W29)+0.5*X29 -> 147.26 | V29: 40.91 | W29: 49.85 | X29: 113 | Y29: =+(Z29+AA29)+0.5*AB29 -> 58.30 | Z29: 24.68 | AA29: 30.62 | AB29: 6 | AC29: =+(AD29+AE29)+0.5*AF29 -> 50.05 | AD29: 24.21 | AE29: 10.34 | AF29: 31 | AG29: =+(AH29+AI29)+0.5*AJ29 -> 49.60 | AH29: 24.34 | AI29: 25.26 | AJ29: 0 | AK29: =+(AL29+AM29+AN29)+0.5*AO29 -> 102.68 | AL29: 44.62 | AM29: 22.84 | AN29: 35.22 | AO29: 0
A30: 27 | B30: Murray, Bob | C30: ? | D30: =+F30+J30+N30+Q30+U30+Y30+AC30+AG30+AK30 -> 672.63 | E30: =+I30+M30+P30+T30+X30+AB30+AF30+AJ30+AO30 -> 319 | F30: =+(G30+H30)+(0.5*I30) -> 55.97 | G30: 18.10 | H30: 16.87 | I30: 42 | J30: =+(K30+L30)+0.5*M30 -> 36.44 | K30: 14.09 | L30: 13.85 | M30: 17 | N30: =+(O30)+0.5*P30 -> 61.84 | O30: 42.84 | P30: 38 | Q30: =+(R30+S30)+0.5*T30 -> 60.39 | R30: 20.40 | S30: 19.99 | T30: 40 | U30: =+(V30+W30)+0.5*X30 -> 134.15 | V30: 38.10 | W30: 45.05 | X30: 102 | Y30: =+(Z30+AA30)+0.5*AB30 -> 100.68 | Z30: 35.58 | AA30: 48.10 | AB30: 34 | AC30: =+(AD30+AE30)+0.5*AF30 -> 55.88 | AD30: 15.97 | AE30: 25.91 | AF30: 28 | AG30: =+(AH30+AI30)+0.5*AJ30 -> 63.54 | AH30: 36.38 | AI30: 27.16 | AJ30: 0 | AK30: =+(AL30+AM30+AN30)+0.5*AO30 -> 103.74 | AL30: 25.76 | AM30: 27.46 | AN30: 41.52 | AO30: 18
A31: 28 | B31: Redford, Noel | C31: L | D31: =+F31+J31+N31+Q31+U31+Y31+AC31+AG31+AK31 -> 745.44 | E31: =+I31+M31+P31+T31+X31+AB31+AF31+AJ31+AO31 -> 192 | F31: =+(G31+H31)+(0.5*I31) -> 64.56 | G31: 24.93 | H31: 29.63 | I31: 20 | J31: =+(K31+L31)+0.5*M31 -> 72.42 | K31: 35.50 | L31: 28.42 | M31: 17 | N31: =+(O31)+0.5*P31 -> 72.40 | O31: 70.90 | P31: 3 | Q31: =+(R31+S31)+0.5*T31 -> 53.57 | R31: 21.08 | S31: 22.49 | T31: 20 | U31: =+(V31+W31)+0.5*X31 -> 151.14 | V31: 55.23 | W31: 40.91 | X31: 110 | Y31: =+(Z31+AA31)+0.5*AB31 -> 73.42 | Z31: 43.34 | AA31: 24.08 | AB31: 12 | AC31: =+(AD31+AE31)+0.5*AF31 -> 52.51 | AD31: 22.77 | AE31: 24.74 | AF31: 10 | AG31: =+(AH31+AI31)+0.5*AJ31 -> 59.56 | AH31: 29.29 | AI31: 30.27 | AJ31: 0 | AK31: =+(AL31+AM31+AN31)+0.5*AO31 -> 145.86 | AL31: 24.30 | AM31: 29.25 | AN31: 92.31 | AO31: 0
A32: 29 | B32: Roller, Michael | C32: ? | D32: =+F32+J32+N32+Q32+U32+Y32+AC32+AG32+AK32 -> 858.11 | E32: =+I32+M32+P32+T32+X32+AB32+AF32+AJ32+AO32 -> 319 | F32: =+(G32+H32)+(0.5*I32) -> 76.53 | G32: 30.92 | H32: 31.61 | I32: 28 | J32: =+(K32+L32)+0.5*M32 -> 58.53 | K32: 22.45 | L32: 24.08 | M32: 24 | N32: =+(O32)+0.5*P32 -> 45.60 | O32: 21.60 | P32: 48 | Q32: =+(R32+S32)+0.5*T32 -> 68.71 | R32: 28.73 | S32: 23.98 | T32: 32 | U32: =+(V32+W32)+0.5*X32 -> 201.35 | V32: 84.73 | W32: 60.12 | X32: 113 | Y32: =+(Z32+AA32)+0.5*AB32 -> 104.32 | Z32: 40.78 | AA32: 46.54 | AB32: 34 | AC32: =+(AD32+AE32)+0.5*AF32 -> 77.61 | AD32: 42.05 | AE32: 27.56 | AF32: 16 | AG32: =+(AH32+AI32)+0.5*AJ32 -> 71.63 | AH32: 28.84 | AI32: 33.79 | AJ32: 18 | AK32: =+(AL32+AM32+AN32)+0.5*AO32 -> 153.83 | AL32: 36.48 | AM32: 58.47 | AN32: 55.88 | AO32: 6
A33: 30 | B33: Crosby, Mike | C33: L | D33: =+F33+J33+N33+Q33+U33+Y33+AC33+AG33+AK33 -> 859.92 | E33: =+I33+M33+P33+T33+X33+AB33+AF33+AJ33+AO33 -> 160 | F33: =+(G33+H33)+(0.5*I33) -> 93.50 | G33: 41.58 | H33: 39.92 | I33: 24 | J33: =+(K33+L33)+0.5*M33 -> 48.12 | K33: 21.09 | L33: 21.03 | M33: 12 | N33: =+(O33)+0.5*P33 -> 83.79 | O33: 75.79 | P33: 16 | Q33: =+(R33+S33)+0.5*T33 -> 57.39 | R33: 27.82 | S33: 25.07 | T33: 9 | U33: =+(V33+W33)+0.5*X33 -> 195.91 | V33: 93.07 | W33: 78.34 | X33: 49 | Y33: =+(Z33+AA33)+0.5*AB33 -> 61.81 | Z33: 28.04 | AA33: 21.27 | AB33: 25 | AC33: =+(AD33+AE33)+0.5*AF33 -> 64.44 | AD33: 18.39 | AE33: 33.55 | AF33: 25 | AG33: =+(AH33+AI33)+0.5*AJ33 -> 85.08 | AH33: 34.80 | AI33: 50.28 | AJ33: 0 | AK33: =+(AL33+AM33+AN33)+0.5*AO33 -> 169.88 | AL33: 35.28 | AM33: 61.41 | AN33: 73.19 | AO33: 0
A34: 31 | B34: Roller, Andrew | C34: ? | D34: =+F34+J34+N34+Q34+U34+Y34+AC34+AG34+AK34 -> 934.37 | E34: =+I34+M34+P34+T34+X34+AB34+AF34+AJ34+AO34 -> 424 | F34: =+(G34+H34)+(0.5*I34) -> 56.49 | G34: 24.47 | H34: 23.02 | I34: 18 | J34: =+(K34+L34)+0.5*M34 -> 62.75 | K34: 23.61 | L34: 22.14 | M34: 34 | N34: =+(O34)+0.5*P34 -> 139.12 | O34: 130.62 | P34: 17 | Q34: =+(R34+S34)+0.5*T34 -> 91.87 | R34: 34.76 | S34: 37.61 | T34: 39 | U34: =+(V34+W34)+0.5*X34 -> 175.33 | V34: 56.63 | W34: 49.20 | X34: 139 | Y34: =+(Z34+AA34)+0.5*AB34 -> 121.15 | Z34: 31.17 | AA34: 26.48 | AB34: 127 | AC34: =+(AD34+AE34)+0.5*AF34 -> 53.66 | AD34: 23.39 | AE34: 17.27 | AF34: 26 | AG34: =+(AH34+AI34)+0.5*AJ34 -> 129.74 | AH34: 84.20 | AI34: 33.54 | AJ34: 24 | AK34: =+(AL34+AM34+AN34)+0.5*AO34 -> 104.26 | AL34: 15.61 | AM34: 39.19 | AN34: 49.46 | AO34: 0
A35: 32 | B35: Sherman, Adam | C35: L | D35: DNF | E35: DNF | F35: =+(G35+H35)+(0.5*I35) -> 92.92 | G35: 40.25 | H35: 38.17 | I35: 29 | J35: =+(K35+L35)+0.5*M35 -> 75.68 | K35: 34.72 | L35: 31.96 | M35: 18 | N35: =+(O35)+0.5*P35 -> 78.53 | O35: 74.53 | P35: 8 | Q35: =+(R35+S35)+0.5*T35 -> 0.00 | U35: =+(V35+W35)+0.5*X35 -> 0.00 | Y35: =+(Z35+AA35)+0.5*AB35 -> 0.00 | AC35: =+(AD35+AE35)+0.5*AF35 -> 0.00 | AG35: =+(AH35+AI35)+0.5*AJ35 -> 0.00 | AK35: =+(AL35+AM35+AN35)+0.5*AO35 -> 100.25 | AL35: 33.24 | AM35: 25.35 | AN35: 41.66 | AO35: 0
A36: Notes:
A37: - | B37: Open Division is for any shooter that was using an optical sighting device on any of their weapons. Limited Division is for all other shooters no matter what caliber, gauge or configuration of weapon.
A38: - | B38: Points Down = .5 seconds x Points Down. PD Total is added to the total Stage time.
A39: XX | B39: Indicates that the Points Down value includes some kind of penalty (Procedural Error, Hits on Non-Threat or Failure to Do Right).
A40: DNF | B40: = Did Not Finish