B1: UDPL 3-Gun Match - Results for September 20, 2003 held at the FARM
B2: (Results listed by Time without regard to Division)
A3: Place | B3: Name | C3: Division: O=Open L=Limited | D3: Shoot Total | E3: Total Points Down | F3: Stage 1 | G3: String 1 | H3: String 2 | I3: Points Down | J3: Stage 2 | K3: String 1 | L3: String 2 | M3: Points Down | N3: Stage 3 | O3: String 1 | P3: Points Down | Q3: Stage 4 | R3: String 1 | S3: String 2 | T3: Points Down | U3: Stage 5 | V3: String 1 | W3: Points Down | X3: Stage 6 | Y3: String 1 | Z3: Points Down | AA3: Stage 7 | AB3: String 1 | AC3: String 2 | AD3: String 3 | AE3: Points Down | AF3: Stage 8 | AG3: String 1 | AH3: String 2 | AI3: Points Down | AJ3: Stage 9 | AK3: String 1 | AL3: Points Down
A4: 1 | B4: Latham, Corey | C4: L | D4: =+F4+J4+N4+Q4+U4+X4+AA4+AF4+AJ4 -> 373.04 | E4: =+I4+M4+P4+T4+W4+Z4+AE4+AI4+AL4 -> 40 | F4: =+(G4+H4)+(0.5*I4) -> 41.42 | G4: 18.01 | H4: 19.91 | I4: 7 | J4: =+(K4+L4)+0.5*M4 -> 37.06 | K4: 18.87 | L4: 18.19 | M4: 0 | N4: =+(O4)+0.5*P4 -> 88.48 | O4: 78.98 | P4: 19 | Q4: =+(R4+S4)+0.5*T4 -> 39.11 | R4: 21.66 | S4: 16.95 | T4: 1 | U4: =+(V4)+0.5*W4 -> 26.83 | V4: 25.83 | W4: 2 | X4: =+(Y4)+0.5*Z4 -> 38.05 | Y4: 38.05 | Z4: 0 | AA4: =+(AB4+AC4+AD4)+0.5*AE4 -> 29.20 | AB4: 7.38 | AC4: 7.70 | AD4: 8.62 | AE4: 11 | AF4: =+(AG4+AH4)+0.5*AI4 -> 43.73 | AG4: 21.26 | AH4: 22.47 | AI4: 0 | AJ4: =+(AK4)+0.5*AL4 -> 29.16 | AK4: 29.16 | AL4: 0
A5: 2 | B5: Theodore, Ari | C5: L | D5: =+F5+J5+N5+Q5+U5+X5+AA5+AF5+AJ5 -> 376.98 | E5: =+I5+M5+P5+T5+W5+Z5+AE5+AI5+AL5 -> 63 | F5: =+(G5+H5)+(0.5*I5) -> 52.71 | G5: 21.38 | H5: 19.33 | I5: 24 | J5: =+(K5+L5)+0.5*M5 -> 34.82 | K5: 18.15 | L5: 16.67 | M5: 0 | N5: =+(O5)+0.5*P5 -> 89.93 | O5: 74.93 | P5: 30 | Q5: =+(R5+S5)+0.5*T5 -> 37.25 | R5: 15.65 | S5: 21.60 | T5: 0 | U5: =+(V5)+0.5*W5 -> 26.11 | V5: 25.11 | W5: 2 | X5: =+(Y5)+0.5*Z5 -> 38.23 | Y5: 38.23 | Z5: 0 | AA5: =+(AB5+AC5+AD5)+0.5*AE5 -> 28.68 | AB5: 9.72 | AC5: 8.11 | AD5: 7.85 | AE5: 6 | AF5: =+(AG5+AH5)+0.5*AI5 -> 43.66 | AG5: 20.12 | AH5: 23.54 | AI5: 0 | AJ5: =+(AK5)+0.5*AL5 -> 25.59 | AK5: 25.09 | AL5: 1
A6: 3 | B6: Lowe, John | C6: L | D6: =+F6+J6+N6+Q6+U6+X6+AA6+AF6+AJ6 -> 381.07 | E6: =+I6+M6+P6+T6+W6+Z6+AE6+AI6+AL6 -> 41 | F6: =+(G6+H6)+(0.5*I6) -> 43.89 | G6: 19.96 | H6: 19.43 | I6: 9 | J6: =+(K6+L6)+0.5*M6 -> 33.66 | K6: 16.16 | L6: 17.50 | M6: 0 | N6: =+(O6)+0.5*P6 -> 83.50 | O6: 73.50 | P6: 20 | Q6: =+(R6+S6)+0.5*T6 -> 41.09 | R6: 19.61 | S6: 21.48 | T6: 0 | U6: =+(V6)+0.5*W6 -> 23.24 | V6: 21.74 | W6: 3 | X6: =+(Y6)+0.5*Z6 -> 33.39 | Y6: 33.39 | Z6: 0 | AA6: =+(AB6+AC6+AD6)+0.5*AE6 -> 29.20 | AB6: 7.76 | AC6: 9.50 | AD6: 7.44 | AE6: 9 | AF6: =+(AG6+AH6)+0.5*AI6 -> 38.17 | AG6: 18.33 | AH6: 19.84 | AI6: 0 | AJ6: =+(AK6)+0.5*AL6 -> 54.93 | AK6: 54.93 | AL6: 0
A7: 4 | B7: Mousley, Roger | C7: ? | D7: =+F7+J7+N7+Q7+U7+X7+AA7+AF7+AJ7 -> 382.98 | E7: =+I7+M7+P7+T7+W7+Z7+AE7+AI7+AL7 -> 42 | F7: =+(G7+H7)+(0.5*I7) -> 41.97 | G7: 22.59 | H7: 16.88 | I7: 5 | J7: =+(K7+L7)+0.5*M7 -> 40.71 | K7: 19.01 | L7: 21.70 | M7: 0 | N7: =+(O7)+0.5*P7 -> 82.92 | O7: 72.92 | P7: 20 | Q7: =+(R7+S7)+0.5*T7 -> 35.98 | R7: 19.45 | S7: 16.53 | T7: 0 | U7: =+(V7)+0.5*W7 -> 24.19 | V7: 23.19 | W7: 2 | X7: =+(Y7)+0.5*Z7 -> 38.48 | Y7: 38.48 | Z7: 0.00 | AA7: =+(AB7+AC7+AD7)+0.5*AE7 -> 37.71 | AB7: 9.62 | AC7: 9.10 | AD7: 12.99 | AE7: 12 | AF7: =+(AG7+AH7)+0.5*AI7 -> 43.47 | AG7: 20.99 | AH7: 22.48 | AI7: 0 | AJ7: =+(AK7)+0.5*AL7 -> 37.55 | AK7: 36.05 | AL7: 3
A8: 5 | B8: Thomas, Kevin | C8: L | D8: =+F8+J8+N8+Q8+U8+X8+AA8+AF8+AJ8 -> 413.52 | E8: =+I8+M8+P8+T8+W8+Z8+AE8+AI8+AL8 -> 49 | F8: =+(G8+H8)+(0.5*I8) -> 43.69 | G8: 20.13 | H8: 17.06 | I8: 13 | J8: =+(K8+L8)+0.5*M8 -> 61.12 | K8: 21.61 | L8: 39.51 | M8: 0 | N8: =+(O8)+0.5*P8 -> 94.09 | O8: 86.09 | P8: 16 | Q8: =+(R8+S8)+0.5*T8 -> 40.63 | R8: 19.57 | S8: 19.06 | T8: 4 | U8: =+(V8)+0.5*W8 -> 27.41 | V8: 24.41 | W8: 6 | X8: =+(Y8)+0.5*Z8 -> 36.17 | Y8: 36.17 | Z8: 0 | AA8: =+(AB8+AC8+AD8)+0.5*AE8 -> 34.56 | AB8: 10.53 | AC8: 11.00 | AD8: 8.53 | AE8: 9 | AF8: =+(AG8+AH8)+0.5*AI8 -> 40.50 | AG8: 21.27 | AH8: 19.23 | AI8: 0 | AJ8: =+(AK8)+0.5*AL8 -> 35.35 | AK8: 34.85 | AL8: 1
A9: 6 | B9: Kurtz, Scott | C9: L | D9: =+F9+J9+N9+Q9+U9+X9+AA9+AF9+AJ9 -> 417.75 | E9: =+I9+M9+P9+T9+W9+Z9+AE9+AI9+AL9 -> 72 | F9: =+(G9+H9)+(0.5*I9) -> 50.28 | G9: 27.18 | H9: 18.60 | I9: 9 | J9: =+(K9+L9)+0.5*M9 -> 37.87 | K9: 17.61 | L9: 20.26 | M9: 0 | N9: =+(O9)+0.5*P9 -> 77.68 | O9: 65.68 | P9: 24 | Q9: =+(R9+S9)+0.5*T9 -> 50.44 | R9: 17.24 | S9: 30.70 | T9: 5 | U9: =+(V9)+0.5*W9 -> 28.33 | V9: 22.33 | W9: 12 | X9: =+(Y9)+0.5*Z9 -> 32.14 | Y9: 32.14 | Z9: 0 | AA9: =+(AB9+AC9+AD9)+0.5*AE9 -> 46.09 | AB9: 8.65 | AC9: 20.17 | AD9: 7.27 | AE9: 20 | AF9: =+(AG9+AH9)+0.5*AI9 -> 48.95 | AG9: 18.98 | AH9: 29.97 | AI9: 0 | AJ9: =+(AK9)+0.5*AL9 -> 45.97 | AK9: 44.97 | AL9: 2
A10: 7 | B10: Sharp, Mikel | C10: L | D10: =+F10+J10+N10+Q10+U10+X10+AA10+AF10+AJ10 -> 420.69 | E10: =+I10+M10+P10+T10+W10+Z10+AE10+AI10+AL10 -> 147 | F10: =+(G10+H10)+(0.5*I10) -> 58.28 | G10: 13.29 | H10: 11.49 | I10: 67 | J10: =+(K10+L10)+0.5*M10 -> 52.12 | K10: 36.25 | L10: 15.87 | M10: 0 | N10: =+(O10)+0.5*P10 -> 100.11 | O10: 79.61 | P10: 41 | Q10: =+(R10+S10)+0.5*T10 -> 43.70 | R10: 20.80 | S10: 17.90 | T10: 10 | U10: =+(V10)+0.5*W10 -> 25.22 | V10: 19.72 | W10: 11 | X10: =+(Y10)+0.5*Z10 -> 33.74 | Y10: 33.74 | Z10: 0 | AA10: =+(AB10+AC10+AD10)+0.5*AE10 -> 28.96 | AB10: 7.53 | AC10: 7.06 | AD10: 6.87 | AE10: 15 | AF10: =+(AG10+AH10)+0.5*AI10 -> 48.67 | AG10: 31.83 | AH10: 16.84 | AI10: 0 | AJ10: =+(AK10)+0.5*AL10 -> 29.89 | AK10: 28.39 | AL10: 3
A11: 8 | B11: Zaccardi, Pat | C11: L | D11: =+F11+J11+N11+Q11+U11+X11+AA11+AF11+AJ11 -> 450.67 | E11: =+I11+M11+P11+T11+W11+Z11+AE11+AI11+AL11 -> 66 | F11: =+(G11+H11)+(0.5*I11) -> 53.40 | G11: 22.79 | H11: 22.11 | I11: 17 | J11: =+(K11+L11)+0.5*M11 -> 41.84 | K11: 21.76 | L11: 20.08 | M11: 0 | N11: =+(O11)+0.5*P11 -> 110.28 | O11: 98.28 | P11: 24 | Q11: =+(R11+S11)+0.5*T11 -> 52.35 | R11: 26.76 | S11: 23.59 | T11: 4 | U11: =+(V11)+0.5*W11 -> 30.69 | V11: 27.69 | W11: 6 | X11: =+(Y11)+0.5*Z11 -> 36.29 | Y11: 36.29 | Z11: 0 | AA11: =+(AB11+AC11+AD11)+0.5*AE11 -> 35.58 | AB11: 8.92 | AC11: 9.56 | AD11: 10.10 | AE11: 14 | AF11: =+(AG11+AH11)+0.5*AI11 -> 53.07 | AG11: 28.29 | AH11: 24.78 | AI11: 0 | AJ11: =+(AK11)+0.5*AL11 -> 37.17 | AK11: 36.67 | AL11: 1
A12: 9 | B12: Correia, Larry | C12: L | D12: =+F12+J12+N12+Q12+U12+X12+AA12+AF12+AJ12 -> 464.91 | E12: =+I12+M12+P12+T12+W12+Z12+AE12+AI12+AL12 -> 93 | F12: =+(G12+H12)+(0.5*I12) -> 42.23 | G12: 16.03 | H12: 15.70 | I12: 21 | J12: =+(K12+L12)+0.5*M12 -> 38.46 | K12: 22.13 | L12: 16.33 | M12: 0 | N12: =+(O12)+0.5*P12 -> 96.91 | O12: 73.91 | P12: 46 | Q12: =+(R12+S12)+0.5*T12 -> 62.34 | R12: 29.36 | S12: 29.98 | T12: 6 | U12: =+(V12)+0.5*W12 -> 30.81 | V12: 27.81 | W12: 6 | X12: =+(Y12)+0.5*Z12 -> 23.25 | Y12: 23.25 | Z12: 0 | AA12: =+(AB12+AC12+AD12)+0.5*AE12 -> 31.46 | AB12: 8.64 | AC12: 8.24 | AD12: 8.58 | AE12: 12 | AF12: =+(AG12+AH12)+0.5*AI12 -> 49.20 | AG12: 22.79 | AH12: 26.41 | AI12: 0 | AJ12: =+(AK12)+0.5*AL12 -> 90.25 | AK12: 89.25 | AL12: 2
A13: 10 | B13: Redford, "Red" | C13: L | D13: =+F13+J13+N13+Q13+U13+X13+AA13+AF13+AJ13 -> 522.14 | E13: =+I13+M13+P13+T13+W13+Z13+AE13+AI13+AL13 -> 65 | F13: =+(G13+H13)+(0.5*I13) -> 56.41 | G13: 22.94 | H13: 22.97 | I13: 21 | J13: =+(K13+L13)+0.5*M13 -> 70.13 | K13: 36.53 | L13: 33.60 | M13: 0 | N13: =+(O13)+0.5*P13 -> 108.32 | O13: 104.82 | P13: 7 | Q13: =+(R13+S13)+0.5*T13 -> 46.32 | R13: 22.38 | S13: 22.44 | T13: 3 | U13: =+(V13)+0.5*W13 -> 56.71 | V13: 52.21 | W13: 9 | X13: =+(Y13)+0.5*Z13 -> 40.37 | Y13: 40.37 | Z13: 0 | AA13: =+(AB13+AC13+AD13)+0.5*AE13 -> 38.70 | AB13: 8.07 | AC13: 7.94 | AD13: 16.69 | AE13: 12 | AF13: =+(AG13+AH13)+0.5*AI13 -> 59.08 | AG13: 32.31 | AH13: 21.77 | AI13: 10 | AJ13: =+(AK13)+0.5*AL13 -> 46.10 | AK13: 44.60 | AL13: 3
A14: 11 | B14: Knapp, Chris | C14: ? | D14: =+F14+J14+N14+Q14+U14+X14+AA14+AF14+AJ14 -> 530.34 | E14: =+I14+M14+P14+T14+W14+Z14+AE14+AI14+AL14 -> 128 | F14: =+(G14+H14)+(0.5*I14) -> 51.09 | G14: 22.13 | H14: 19.46 | I14: 19 | J14: =+(K14+L14)+0.5*M14 -> 59.95 | K14: 31.18 | L14: 28.77 | M14: 0 | N14: =+(O14)+0.5*P14 -> 128.73 | O14: 96.73 | P14: 64 | Q14: =+(R14+S14)+0.5*T14 -> 66.67 | R14: 27.14 | S14: 34.53 | T14: 10 | U14: =+(V14)+0.5*W14 -> 31.44 | V14: 27.44 | W14: 8 | X14: =+(Y14)+0.5*Z14 -> 37.90 | Y14: 37.90 | Z14: 0 | AA14: =+(AB14+AC14+AD14)+0.5*AE14 -> 36.50 | AB14: 9.33 | AC14: 14.87 | AD14: 9.80 | AE14: 5 | AF14: =+(AG14+AH14)+0.5*AI14 -> 69.32 | AG14: 27.33 | AH14: 31.99 | AI14: 20 | AJ14: =+(AK14)+0.5*AL14 -> 48.74 | AK14: 47.74 | AL14: 2
A15: 12 | B15: Redford, Steve | C15: L | D15: =+F15+J15+N15+Q15+U15+X15+AA15+AF15+AJ15 -> 553.91 | E15: =+I15+M15+P15+T15+W15+Z15+AE15+AI15+AL15 -> 103 | F15: =+(G15+H15)+(0.5*I15) -> 46.58 | G15: 20.87 | H15: 19.71 | I15: 12 | J15: =+(K15+L15)+0.5*M15 -> 68.28 | K15: 38.08 | L15: 30.20 | M15: 0 | N15: =+(O15)+0.5*P15 -> 115.25 | O15: 96.75 | P15: 37 | Q15: =+(R15+S15)+0.5*T15 -> 57.87 | R15: 25.46 | S15: 29.41 | T15: 6 | U15: =+(V15)+0.5*W15 -> 47.75 | V15: 39.25 | W15: 17 | X15: =+(Y15)+0.5*Z15 -> 59.11 | Y15: 59.11 | Z15: 0 | AA15: =+(AB15+AC15+AD15)+0.5*AE15 -> 49.04 | AB15: 10.13 | AC15: 11.01 | AD15: 15.40 | AE15: 25 | AF15: =+(AG15+AH15)+0.5*AI15 -> 55.34 | AG15: 28.08 | AH15: 27.26 | AI15: 0 | AJ15: =+(AK15)+0.5*AL15 -> 54.69 | AK15: 51.69 | AL15: 6
A16: 13 | B16: Beck, Dave | C16: L | D16: =+F16+J16+N16+Q16+U16+X16+AA16+AF16+AJ16 -> 558.94 | E16: =+I16+M16+P16+T16+W16+Z16+AE16+AI16+AL16 -> 81 | F16: =+(G16+H16)+(0.5*I16) -> 49.12 | G16: 22.96 | H16: 23.16 | I16: 6 | J16: =+(K16+L16)+0.5*M16 -> 49.34 | K16: 23.02 | L16: 26.32 | M16: 0 | N16: =+(O16)+0.5*P16 -> 127.47 | O16: 107.47 | P16: 40 | Q16: =+(R16+S16)+0.5*T16 -> 75.85 | R16: 42.52 | S16: 28.33 | T16: 10 | U16: =+(V16)+0.5*W16 -> 53.06 | V16: 47.06 | W16: 12 | X16: =+(Y16)+0.5*Z16 -> 48.23 | Y16: 48.23 | Z16: 0 | AA16: =+(AB16+AC16+AD16)+0.5*AE16 -> 38.95 | AB16: 14.28 | AC16: 9.55 | AD16: 9.12 | AE16: 12 | AF16: =+(AG16+AH16)+0.5*AI16 -> 63.08 | AG16: 31.69 | AH16: 31.39 | AI16: 0 | AJ16: =+(AK16)+0.5*AL16 -> 53.84 | AK16: 53.34 | AL16: 1
A17: 14 | B17: Ostler, Jeff | C17: L | D17: =+F17+J17+N17+Q17+U17+X17+AA17+AF17+AJ17 -> 587.23 | E17: =+I17+M17+P17+T17+W17+Z17+AE17+AI17+AL17 -> 91 | F17: =+(G17+H17)+(0.5*I17) -> 43.01 | G17: 20.17 | H17: 15.84 | I17: 14 | J17: =+(K17+L17)+0.5*M17 -> 57.11 | K17: 34.42 | L17: 22.69 | M17: 0 | N17: =+(O17)+0.5*P17 -> 182.66 | O17: 166.16 | P17: 33 | Q17: =+(R17+S17)+0.5*T17 -> 71.27 | R17: 35.75 | S17: 26.52 | T17: 18 | U17: =+(V17)+0.5*W17 -> 37.54 | V17: 34.04 | W17: 7 | X17: =+(Y17)+0.5*Z17 -> 42.42 | Y17: 42.42 | Z17: 0 | AA17: =+(AB17+AC17+AD17)+0.5*AE17 -> 39.92 | AB17: 9.32 | AC17: 12.25 | AD17: 9.35 | AE17: 18 | AF17: =+(AG17+AH17)+0.5*AI17 -> 59.61 | AG17: 35.80 | AH17: 23.81 | AI17: 0 | AJ17: =+(AK17)+0.5*AL17 -> 53.69 | AK17: 53.19 | AL17: 1
A18: 15 | B18: Zaccardi, Juke | C18: L | D18: =+F18+J18+N18+Q18+U18+X18+AA18+AF18+AJ18 -> 603.66 | E18: =+I18+M18+P18+T18+W18+Z18+AE18+AI18+AL18 -> 85 | F18: =+(G18+H18)+(0.5*I18) -> 72.42 | G18: 27.87 | H18: 29.05 | I18: 31 | J18: =+(K18+L18)+0.5*M18 -> 40.63 | K18: 21.01 | L18: 19.62 | M18: 0 | N18: =+(O18)+0.5*P18 -> 118.01 | O18: 112.51 | P18: 11 | Q18: =+(R18+S18)+0.5*T18 -> 116.55 | R18: 54.26 | S18: 58.79 | T18: 7 | U18: =+(V18)+0.5*W18 -> 27.79 | V18: 25.79 | W18: 4 | X18: =+(Y18)+0.5*Z18 -> 42.44 | Y18: 42.44 | Z18: 0 | AA18: =+(AB18+AC18+AD18)+0.5*AE18 -> 46.22 | AB18: 14.03 | AC18: 12.89 | AD18: 14.80 | AE18: 9 | AF18: =+(AG18+AH18)+0.5*AI18 -> 59.20 | AG18: 33.85 | AH18: 25.35 | AI18: 0 | AJ18: =+(AK18)+0.5*AL18 -> 80.40 | AK18: 68.90 | AL18: 23
A19: 16 | B19: Rodriquez, Mike | C19: L | D19: =+F19+J19+N19+Q19+U19+X19+AA19+AF19+AJ19 -> 622.61 | E19: =+I19+M19+P19+T19+W19+Z19+AE19+AI19+AL19 -> 93 | F19: =+(G19+H19)+(0.5*I19) -> 47.71 | G19: 19.38 | H19: 19.33 | I19: 18 | J19: =+(K19+L19)+0.5*M19 -> 61.24 | K19: 28.84 | L19: 32.40 | M19: 0 | N19: =+(O19)+0.5*P19 -> 150.96 | O19: 142.96 | P19: 16 | Q19: =+(R19+S19)+0.5*T19 -> 68.30 | R19: 32.23 | S19: 33.07 | T19: 6 | U19: =+(V19)+0.5*W19 -> 40.20 | V19: 30.20 | W19: 20 | X19: =+(Y19)+0.5*Z19 -> 56.32 | Y19: 51.32 | Z19: 10 | AA19: =+(AB19+AC19+AD19)+0.5*AE19 -> 49.49 | AB19: 19.00 | AC19: 12.74 | AD19: 16.75 | AE19: 2 | AF19: =+(AG19+AH19)+0.5*AI19 -> 74.34 | AG19: 32.45 | AH19: 31.89 | AI19: 20 | AJ19: =+(AK19)+0.5*AL19 -> 74.05 | AK19: 73.55 | AL19: 1
A20: 17 | B20: Andrus, Jay | C20: ? | D20: =+F20+J20+N20+Q20+U20+X20+AA20+AF20+AJ20 -> 671.30 | E20: =+I20+M20+P20+T20+W20+Z20+AE20+AI20+AL20 -> 104 | F20: =+(G20+H20)+(0.5*I20) -> 69.37 | G20: 27.95 | H20: 19.92 | I20: 43 | J20: =+(K20+L20)+0.5*M20 -> 83.97 | K20: 44.41 | L20: 39.56 | M20: 0 | N20: =+(O20)+0.5*P20 -> 124.28 | O20: 114.28 | P20: 20 | Q20: =+(R20+S20)+0.5*T20 -> 88.15 | R20: 37.68 | S20: 45.47 | T20: 10 | U20: =+(V20)+0.5*W20 -> 35.69 | V20: 31.19 | W20: 9 | X20: =+(Y20)+0.5*Z20 -> 55.73 | Y20: 55.73 | Z20: 0 | AA20: =+(AB20+AC20+AD20)+0.5*AE20 -> 65.74 | AB20: 23.21 | AC20: 18.03 | AD20: 14.50 | AE20: 20 | AF20: =+(AG20+AH20)+0.5*AI20 -> 94.94 | AG20: 51.40 | AH20: 43.54 | AI20: 0 | AJ20: =+(AK20)+0.5*AL20 -> 53.43 | AK20: 52.43 | AL20: 2
A21: 18 | B21: Greenfield, Don | C21: L | D21: =+F21+J21+N21+Q21+U21+X21+AA21+AF21+AJ21 -> 720.00 | E21: =+I21+M21+P21+T21+W21+Z21+AE21+AI21+AL21 -> 97 | F21: =+(G21+H21)+(0.5*I21) -> 69.63 | G21: 35.06 | H21: 28.57 | I21: 12 | J21: =+(K21+L21)+0.5*M21 -> 76.65 | K21: 38.34 | L21: 38.31 | M21: 0 | N21: =+(O21)+0.5*P21 -> 117.95 | O21: 108.95 | P21: 18 | Q21: =+(R21+S21)+0.5*T21 -> 71.31 | R21: 31.15 | S21: 35.66 | T21: 9 | U21: =+(V21)+0.5*W21 -> 38.68 | V21: 30.18 | W21: 17 | X21: =+(Y21)+0.5*Z21 -> 62.01 | Y21: 62.01 | Z21: 0 | AA21: =+(AB21+AC21+AD21)+0.5*AE21 -> 85.43 | AB21: 13.93 | AC21: 31.20 | AD21: 20.30 | AE21: 40 | AF21: =+(AG21+AH21)+0.5*AI21 -> 113.50 | AG21: 55.95 | AH21: 57.55 | AI21: 0 | AJ21: =+(AK21)+0.5*AL21 -> 84.84 | AK21: 84.34 | AL21: 1
A22: 19 | B22: Crosby, Mike | C22: L | D22: =+F22+J22+N22+Q22+U22+X22+AA22+AF22+AJ22 -> 781.68 | E22: =+I22+M22+P22+T22+W22+Z22+AE22+AI22+AL22 -> 79 | F22: =+(G22+H22)+(0.5*I22) -> 79.37 | G22: 35.72 | H22: 41.65 | I22: 4 | J22: =+(K22+L22)+0.5*M22 -> 65.36 | K22: 35.01 | L22: 30.35 | M22: 0 | N22: =+(O22)+0.5*P22 -> 171.59 | O22: 155.59 | P22: 32 | Q22: =+(R22+S22)+0.5*T22 -> 77.12 | R22: 32.23 | S22: 32.39 | T22: 25 | U22: =+(V22)+0.5*W22 -> 60.04 | V22: 55.04 | W22: 10 | X22: =+(Y22)+0.5*Z22 -> 64.40 | Y22: 64.40 | Z22: 0 | AA22: =+(AB22+AC22+AD22)+0.5*AE22 -> 56.42 | AB22: 18.96 | AC22: 17.30 | AD22: 16.66 | AE22: 7 | AF22: =+(AG22+AH22)+0.5*AI22 -> 81.51 | AG22: 50.78 | AH22: 30.73 | AI22: 0 | AJ22: =+(AK22)+0.5*AL22 -> 125.87 | AK22: 125.37 | AL22: 1
A23: 20 | B23: Greenfield, Alex | C23: L | D23: =+F23+J23+N23+Q23+U23+X23+AA23+AF23+AJ23 -> 797.10 | E23: =+I23+M23+P23+T23+W23+Z23+AE23+AI23+AL23 -> 185 | F23: =+(G23+H23)+(0.5*I23) -> 65.13 | G23: 28.86 | H23: 25.77 | I23: 21 | J23: =+(K23+L23)+0.5*M23 -> 128.90 | K23: 59.84 | L23: 69.06 | M23: 0 | N23: =+(O23)+0.5*P23 -> 143.58 | O23: 127.08 | P23: 33 | Q23: =+(R23+S23)+0.5*T23 -> 81.09 | R23: 32.28 | S23: 44.31 | T23: 9 | U23: =+(V23)+0.5*W23 -> 32.55 | V23: 28.55 | W23: 8 | X23: =+(Y23)+0.5*Z23 -> 76.04 | Y23: 76.04 | Z23: 0 | AA23: =+(AB23+AC23+AD23)+0.5*AE23 -> 69.75 | AB23: 11.63 | AC23: 14.04 | AD23: 33.08 | AE23: 22 | AF23: =+(AG23+AH23)+0.5*AI23 -> 145.11 | AG23: 55.03 | AH23: 45.08 | AI23: 90 | AJ23: =+(AK23)+0.5*AL23 -> 54.95 | AK23: 53.95 | AL23: 2
A24: 21 | B24: Bray, Matt | C24: O | D24: DNF | E24: DNF | F24: =+(G24+H24)+(0.5*I24) -> 64.60 | G24: 25.32 | H24: 22.78 | I24: 33 | J24: =+(K24+L24)+0.5*M24 -> 76.38 | K24: 39.88 | L24: 36.50 | M24: 0 | N24: =+(O24)+0.5*P24 -> 109.38 | O24: 97.38 | P24: 24 | Q24: =+(R24+S24)+0.5*T24 -> 80.86 | R24: 33.80 | S24: 44.56 | T24: 5 | U24: =+(V24)+0.5*W24 -> 25.61 | V24: 23.11 | W24: 5 | X24: =+(Y24)+0.5*Z24 -> 63.50 | Y24: 63.50 | Z24: 0 | AA24: =+(AB24+AC24+AD24)+0.5*AE24 -> 38.99 | AB24: 9.99 | AC24: 10.55 | AD24: 10.45 | AE24: 16 | AF24: DNF | AJ24: DNF
A25: Notes:
A26: - | B26: Open Division is for any shooter that was using an optical sighting device on any of their weapons. Limited Division is for all other shooters no matter what caliber, gauge or configuration of weapon.
A27: - | B27: Points Down = .5 seconds x Points Down. PD Total is added to the total Stage time.
A28: XX | B28: Indicates that the Points Down value includes some kind of penalty (Procedural Error, Hits on Non-Threat Misses on Steel, etc.).
A29: DNF | B29: = Did Not Finish