B1: UDPL 3-Gun Match - Results for November 15, 2003 held at the FARM
B2: (Results listed by Time without regard to Division) | I2: To see a description of each Stage, click on the Stage #.
A3: Place | B3: Name | C3: Div * | D3: Shoot Total | E3: Total Points Down | F3: Stage 1 | G3: String 1 | H3: Points Down | I3: Stage 2 | J3: String 1 | K3: String 2 | L3: String 3 | M3: Points Down | N3: Stage 3 | O3: String 1 | P3: String 2 | Q3: Points Down | R3: Stage 4 | S3: String 1 | T3: String 2 | U3: String 3 | V3: Points Down | W3: Stage 5 | X3: String 1 | Y3: String 2 | Z3: Points Down | AA3: Stage 6 | AB3: String 1 | AC3: String 2 | AD3: Points Down | AE3: Stage 7 | AF3: String 1 | AG3: String 2 | AH3: String 3 | AI3: Points Down | AJ3: Stage 8 | AK3: String 1 | AL3: String 2 | AM3: String 3 | AN3: Points Down | AO3: Stage 9 | AP3: String 1 | AQ3: Points Down
A4: 1 | B4: Latham, Corey | C4: L | D4: =+F4+I4+N4+R4+W4+AA4+AE4+AJ4+AO4 -> 416.09 | E4: =+H4+M4+Q4+V4+Z4+AD4+AI4+AN4+AQ4 -> 21 | F4: =+(G4)+(0.5*H4) -> 46.13 | G4: 46.13 | H4: 0 | I4: =+(J4+K4+L4)+0.5*M4 -> 23.16 | J4: 10.58 | K4: 9.86 | L4: 2.72 | M4: 0 | N4: =+(O4+P4)+0.5*Q4 -> 46.81 | O4: 19.68 | P4: 20.13 | Q4: 14 | R4: =+(S4+T4+U4)+0.5*V4 -> 19.16 | S4: 4.81 | T4: 5.02 | U4: 6.83 | V4: 5 | W4: =+(X4+Y4)+0.5*Z4 -> 79.38 | X4: 43.10 | Y4: 36.28 | Z4: 0 | AA4: =+(AB4+AC4)+0.5*AD4 -> 58.09 | AB4: 26.39 | AC4: 31.20 | AD4: 1 | AE4: =+(AF4+AG4+AH4)+0.5*AI4 -> 42.03 | AF4: 11.48 | AG4: 9.77 | AH4: 20.28 | AI4: 1 | AJ4: =+(AK4+AL4+AM4)+0.5*AN4 -> 20.02 | AK4: 6.90 | AL4: 6.86 | AM4: 6.26 | AN4: 0 | AO4: =+(AP4)+0.5*AQ4 -> 81.31 | AP4: 81.31 | AQ4: 0
A5: 2 | B5: Ostler, Jeff | C5: T | D5: =+F5+I5+N5+R5+W5+AA5+AE5+AJ5+AO5 -> 427.97 | E5: =+H5+M5+Q5+V5+Z5+AD5+AI5+AN5+AQ5 -> 50 | F5: =+(G5)+(0.5*H5) -> 46.17 | G5: 46.17 | H5: 0 | I5: =+(J5+K5+L5)+0.5*M5 -> 32.29 | J5: 16.80 | K5: 11.54 | L5: 3.95 | M5: 0 | N5: =+(O5+P5)+0.5*Q5 -> 45.91 | O5: 19.57 | P5: 20.84 | Q5: 11 | R5: =+(S5+T5+U5)+0.5*V5 -> 25.98 | S5: 5.32 | T5: 5.75 | U5: 5.91 | V5: 18 | W5: =+(X5+Y5)+0.5*Z5 -> 76.34 | X5: 40.05 | Y5: 36.29 | Z5: 0 | AA5: =+(AB5+AC5)+0.5*AD5 -> 46.25 | AB5: 22.50 | AC5: 23.25 | AD5: 1 | AE5: =+(AF5+AG5+AH5)+0.5*AI5 -> 46.70 | AF5: 10.09 | AG5: 11.03 | AH5: 21.08 | AI5: 9 | AJ5: =+(AK5+AL5+AM5)+0.5*AN5 -> 31.02 | AK5: 8.44 | AL5: 10.47 | AM5: 6.61 | AN5: 11 | AO5: =+(AP5)+0.5*AQ5 -> 77.31 | AP5: 77.31 | AQ5: 0
A6: 3 | B6: Mousley, Roger | C6: TRO | D6: =+F6+I6+N6+R6+W6+AA6+AE6+AJ6+AO6 -> 428.48 | E6: =+H6+M6+Q6+V6+Z6+AD6+AI6+AN6+AQ6 -> 47 | F6: =+(G6)+(0.5*H6) -> 57.94 | G6: 57.94 | H6: 0 | I6: =+(J6+K6+L6)+0.5*M6 -> 36.85 | J6: 16.42 | K6: 13.67 | L6: 6.76 | M6: 0 | N6: =+(O6+P6)+0.5*Q6 -> 46.85 | O6: 16.76 | P6: 27.09 | Q6: 6 | R6: =+(S6+T6+U6)+0.5*V6 -> 26.63 | S6: 4.55 | T6: 6.65 | U6: 6.43 | V6: 18 | W6: =+(X6+Y6)+0.5*Z6 -> 70.18 | X6: 35.77 | Y6: 34.41 | Z6: 0 | AA6: =+(AB6+AC6)+0.5*AD6 -> 53.10 | AB6: 28.86 | AC6: 23.24 | AD6: 2 | AE6: =+(AF6+AG6+AH6)+0.5*AI6 -> 46.97 | AF6: 11.17 | AG6: 11.08 | AH6: 17.22 | AI6: 15 | AJ6: =+(AK6+AL6+AM6)+0.5*AN6 -> 30.00 | AK6: 9.08 | AL6: 8.92 | AM6: 9.00 | AN6: 6 | AO6: =+(AP6)+0.5*AQ6 -> 59.96 | AP6: 59.96 | AQ6: 0
A7: 4 | B7: Terry, Mark | C7: O | D7: =+F7+I7+N7+R7+W7+AA7+AE7+AJ7+AO7 -> 453.87 | E7: =+H7+M7+Q7+V7+Z7+AD7+AI7+AN7+AQ7 -> 85 | F7: =+(G7)+(0.5*H7) -> 68.61 | G7: 68.61 | H7: 0 | I7: =+(J7+K7+L7)+0.5*M7 -> 23.48 | J7: 9.41 | K7: 9.51 | L7: 4.56 | M7: 0 | N7: =+(O7+P7)+0.5*Q7 -> 45.35 | O7: 17.70 | P7: 16.15 | Q7: 23 | R7: =+(S7+T7+U7)+0.5*V7 -> 21.04 | S7: 4.13 | T7: 4.78 | U7: 4.13 | V7: 16 | W7: =+(X7+Y7)+0.5*Z7 -> 68.94 | X7: 35.11 | Y7: 33.83 | Z7: 0 | AA7: =+(AB7+AC7)+0.5*AD7 -> 52.70 | AB7: 29.30 | AC7: 21.90 | AD7: 3 | AE7: =+(AF7+AG7+AH7)+0.5*AI7 -> 46.00 | AF7: 9.12 | AG7: 11.20 | AH7: 24.18 | AI7: 3 | AJ7: =+(AK7+AL7+AM7)+0.5*AN7 -> 49.40 | AK7: 10.01 | AL7: 9.31 | AM7: 10.08 | AN7: 40 | AO7: =+(AP7)+0.5*AQ7 -> 78.35 | AP7: 78.35 | AQ7: 0
A8: 5 | B8: Griffiths, Todd | C8: L | D8: =+F8+I8+N8+R8+W8+AA8+AE8+AJ8+AO8 -> 482.43 | E8: =+H8+M8+Q8+V8+Z8+AD8+AI8+AN8+AQ8 -> 31 | F8: =+(G8)+(0.5*H8) -> 69.68 | G8: 69.68 | H8: 0 | I8: =+(J8+K8+L8)+0.5*M8 -> 34.85 | J8: 13.35 | K8: 17.85 | L8: 3.65 | M8: 0 | N8: =+(O8+P8)+0.5*Q8 -> 41.90 | O8: 20.12 | P8: 18.28 | Q8: 7 | R8: =+(S8+T8+U8)+0.5*V8 -> 24.30 | S8: 5.46 | T8: 6.02 | U8: 7.32 | V8: 11 | W8: =+(X8+Y8)+0.5*Z8 -> 82.00 | X8: 46.61 | Y8: 35.39 | Z8: 0 | AA8: =+(AB8+AC8)+0.5*AD8 -> 49.46 | AB8: 26.58 | AC8: 21.88 | AD8: 2 | AE8: =+(AF8+AG8+AH8)+0.5*AI8 -> 53.28 | AF8: 13.59 | AG8: 15.01 | AH8: 19.18 | AI8: 11 | AJ8: =+(AK8+AL8+AM8)+0.5*AN8 -> 31.84 | AK8: 7.99 | AL8: 8.02 | AM8: 15.83 | AN8: 0 | AO8: =+(AP8)+0.5*AQ8 -> 95.12 | AP8: 95.12 | AQ8: 0
A9: 6 | B9: Theodore, Ari | C9: T | D9: =+F9+I9+N9+R9+W9+AA9+AE9+AJ9+AO9 -> 487.75 | E9: =+H9+M9+Q9+V9+Z9+AD9+AI9+AN9+AQ9 -> 55 | F9: =+(G9)+(0.5*H9) -> 50.89 | G9: 50.89 | H9: 0 | I9: =+(J9+K9+L9)+0.5*M9 -> 33.47 | J9: 12.71 | K9: 14.63 | L9: 6.13 | M9: 0 | N9: =+(O9+P9)+0.5*Q9 -> 52.90 | O9: 19.79 | P9: 22.61 | Q9: 21 | R9: =+(S9+T9+U9)+0.5*V9 -> 25.26 | S9: 5.10 | T9: 6.77 | U9: 6.89 | V9: 13 | W9: =+(X9+Y9)+0.5*Z9 -> 81.33 | X9: 35.31 | Y9: 46.02 | Z9: 0 | AA9: =+(AB9+AC9)+0.5*AD9 -> 54.51 | AB9: 29.96 | AC9: 23.55 | AD9: 2 | AE9: =+(AF9+AG9+AH9)+0.5*AI9 -> 47.03 | AF9: 10.39 | AG9: 9.63 | AH9: 20.51 | AI9: 13 | AJ9: =+(AK9+AL9+AM9)+0.5*AN9 -> 34.98 | AK9: 11.91 | AL9: 9.87 | AM9: 10.20 | AN9: 6 | AO9: =+(AP9)+0.5*AQ9 -> 107.38 | AP9: 107.38 | AQ9: 0
A10: 7 | B10: Zaccardi, Pat | C10: TRO | D10: =+F10+I10+N10+R10+W10+AA10+AE10+AJ10+AO10 -> 492.76 | E10: =+H10+M10+Q10+V10+Z10+AD10+AI10+AN10+AQ10 -> 62 | F10: =+(G10)+(0.5*H10) -> 45.72 | G10: 45.72 | H10: 0 | I10: =+(J10+K10+L10)+0.5*M10 -> 25.22 | J10: 13.58 | K10: 8.87 | L10: 2.77 | M10: 0 | N10: =+(O10+P10)+0.5*Q10 -> 51.41 | O10: 23.41 | P10: 19.00 | Q10: 18 | R10: =+(S10+T10+U10)+0.5*V10 -> 24.74 | S10: 4.87 | T10: 5.01 | U10: 5.86 | V10: 18 | W10: =+(X10+Y10)+0.5*Z10 -> 87.84 | X10: 43.07 | Y10: 44.77 | Z10: 0 | AA10: =+(AB10+AC10)+0.5*AD10 -> 57.50 | AB10: 30.58 | AC10: 26.42 | AD10: 1 | AE10: =+(AF10+AG10+AH10)+0.5*AI10 -> 54.36 | AF10: 9.89 | AG10: 13.48 | AH10: 25.99 | AI10: 10 | AJ10: =+(AK10+AL10+AM10)+0.5*AN10 -> 41.22 | AK10: 16.88 | AL10: 8.80 | AM10: 8.04 | AN10: 15 | AO10: =+(AP10)+0.5*AQ10 -> 104.75 | AP10: 104.75 | AQ10: 0
A11: 8 | B11: Collins, Ken | C11: O | D11: =+F11+I11+N11+R11+W11+AA11+AE11+AJ11+AO11 -> 500.34 | E11: =+H11+M11+Q11+V11+Z11+AD11+AI11+AN11+AQ11 -> 20 | F11: =+(G11)+(0.5*H11) -> 62.13 | G11: 62.13 | H11: 0 | I11: =+(J11+K11+L11)+0.5*M11 -> 34.33 | J11: 13.69 | K11: 14.06 | L11: 6.58 | M11: 0 | N11: =+(O11+P11)+0.5*Q11 -> 46.84 | O11: 22.55 | P11: 20.79 | Q11: 7 | R11: =+(S11+T11+U11)+0.5*V11 -> 23.32 | S11: 6.21 | T11: 5.73 | U11: 5.88 | V11: 11 | W11: =+(X11+Y11)+0.5*Z11 -> 97.85 | X11: 55.28 | Y11: 42.57 | Z11: 0 | AA11: =+(AB11+AC11)+0.5*AD11 -> 40.24 | AB11: 23.98 | AC11: 16.26 | AD11: 0 | AE11: =+(AF11+AG11+AH11)+0.5*AI11 -> 46.63 | AF11: 9.82 | AG11: 16.16 | AH11: 19.65 | AI11: 2 | AJ11: =+(AK11+AL11+AM11)+0.5*AN11 -> 25.18 | AK11: 7.85 | AL11: 9.14 | AM11: 8.19 | AN11: 0 | AO11: =+(AP11)+0.5*AQ11 -> 123.82 | AP11: 123.82 | AQ11: 0
A12: 9 | B12: Knapp, Chris | C12: L | D12: =+F12+I12+N12+R12+W12+AA12+AE12+AJ12+AO12 -> 534.58 | E12: =+H12+M12+Q12+V12+Z12+AD12+AI12+AN12+AQ12 -> 37 | F12: =+(G12)+(0.5*H12) -> 63.28 | G12: 63.28 | H12: 0 | I12: =+(J12+K12+L12)+0.5*M12 -> 46.66 | J12: 16.54 | K12: 19.84 | L12: 5.28 | M12: 10 | N12: =+(O12+P12)+0.5*Q12 -> 60.30 | O12: 32.60 | P12: 27.70 | Q12: 0 | R12: =+(S12+T12+U12)+0.5*V12 -> 28.89 | S12: 7.80 | T12: 7.64 | U12: 8.95 | V12: 9 | W12: =+(X12+Y12)+0.5*Z12 -> 82.53 | X12: 46.52 | Y12: 36.01 | Z12: 0 | AA12: =+(AB12+AC12)+0.5*AD12 -> 79.27 | AB12: 38.01 | AC12: 39.76 | AD12: 3 | AE12: =+(AF12+AG12+AH12)+0.5*AI12 -> 51.14 | AF12: 13.08 | AG12: 16.10 | AH12: 19.96 | AI12: 4 | AJ12: =+(AK12+AL12+AM12)+0.5*AN12 -> 44.45 | AK12: 11.20 | AL12: 14.65 | AM12: 13.10 | AN12: 11 | AO12: =+(AP12)+0.5*AQ12 -> 78.06 | AP12: 78.06 | AQ12: 0
A13: 10 | B13: Correia, Larry | C13: O | D13: =+F13+I13+N13+R13+W13+AA13+AE13+AJ13+AO13 -> 539.97 | E13: =+H13+M13+Q13+V13+Z13+AD13+AI13+AN13+AQ13 -> 87 | F13: =+(G13)+(0.5*H13) -> 31.97 | G13: 31.97 | H13: 0 | I13: =+(J13+K13+L13)+0.5*M13 -> 27.59 | J13: 12.44 | K13: 12.24 | L13: 2.91 | M13: 0 | N13: =+(O13+P13)+0.5*Q13 -> 60.97 | O13: 28.06 | P13: 22.91 | Q13: 20 | R13: =+(S13+T13+U13)+0.5*V13 -> 31.45 | S13: 5.55 | T13: 5.64 | U13: 6.26 | V13: 28 | W13: =+(X13+Y13)+0.5*Z13 -> 128.36 | X13: 59.68 | Y13: 68.68 | Z13: 0 | AA13: =+(AB13+AC13)+0.5*AD13 -> 54.10 | AB13: 24.65 | AC13: 25.95 | AD13: 7 | AE13: =+(AF13+AG13+AH13)+0.5*AI13 -> 34.18 | AF13: 9.98 | AG13: 10.77 | AH13: 9.43 | AI13: 8 | AJ13: =+(AK13+AL13+AM13)+0.5*AN13 -> 41.44 | AK13: 11.59 | AL13: 8.90 | AM13: 8.95 | AN13: 24 | AO13: =+(AP13)+0.5*AQ13 -> 129.91 | AP13: 129.91 | AQ13: 0
A14: 11 | B14: Lowe, John | C14: L | D14: =+F14+I14+N14+R14+W14+AA14+AE14+AJ14+AO14 -> 548.74 | E14: =+H14+M14+Q14+V14+Z14+AD14+AI14+AN14+AQ14 -> 18 | F14: =+(G14)+(0.5*H14) -> 53.56 | G14: 53.56 | H14: 0 | I14: =+(J14+K14+L14)+0.5*M14 -> 29.90 | J14: 10.17 | K14: 13.55 | L14: 6.18 | M14: 0 | N14: =+(O14+P14)+0.5*Q14 -> 47.54 | O14: 24.69 | P14: 19.35 | Q14: 7 | R14: =+(S14+T14+U14)+0.5*V14 -> 18.90 | S14: 5.13 | T14: 6.32 | U14: 6.45 | V14: 2 | W14: =+(X14+Y14)+0.5*Z14 -> 140.64 | X14: 78.15 | Y14: 62.49 | Z14: 0 | AA14: =+(AB14+AC14)+0.5*AD14 -> 66.93 | AB14: 37.91 | AC14: 27.52 | AD14: 3 | AE14: =+(AF14+AG14+AH14)+0.5*AI14 -> 43.20 | AF14: 10.02 | AG14: 11.65 | AH14: 18.53 | AI14: 6 | AJ14: =+(AK14+AL14+AM14)+0.5*AN14 -> 24.76 | AK14: 8.53 | AL14: 7.99 | AM14: 8.24 | AN14: 0 | AO14: =+(AP14)+0.5*AQ14 -> 123.31 | AP14: 123.31 | AQ14: 0
A15: 12 | B15: Huff, Blake | C15: T | D15: =+F15+I15+N15+R15+W15+AA15+AE15+AJ15+AO15 -> 555.27 | E15: =+H15+M15+Q15+V15+Z15+AD15+AI15+AN15+AQ15 -> 45 | F15: =+(G15)+(0.5*H15) -> 54.47 | G15: 54.47 | H15: 0 | I15: =+(J15+K15+L15)+0.5*M15 -> 34.03 | J15: 13.87 | K15: 12.94 | L15: 7.22 | M15: 0 | N15: =+(O15+P15)+0.5*Q15 -> 54.23 | O15: 24.31 | P15: 21.92 | Q15: 16 | R15: =+(S15+T15+U15)+0.5*V15 -> 27.30 | S15: 5.09 | T15: 5.40 | U15: 5.81 | V15: 22 | W15: =+(X15+Y15)+0.5*Z15 -> 89.34 | X15: 48.84 | Y15: 40.50 | Z15: 0 | AA15: =+(AB15+AC15)+0.5*AD15 -> 55.69 | AB15: 29.52 | AC15: 25.67 | AD15: 1 | AE15: =+(AF15+AG15+AH15)+0.5*AI15 -> 52.58 | AF15: 13.04 | AG15: 16.00 | AH15: 20.54 | AI15: 6 | AJ15: =+(AK15+AL15+AM15)+0.5*AN15 -> 24.80 | AK15: 7.97 | AL15: 8.60 | AM15: 8.23 | AN15: 0 | AO15: =+(AP15)+0.5*AQ15 -> 162.83 | AP15: 162.83 | AQ15: 0
A16: 13 | B16: Ward, Dan | C16: TRO | D16: =+F16+I16+N16+R16+W16+AA16+AE16+AJ16+AO16 -> 560.23 | E16: =+H16+M16+Q16+V16+Z16+AD16+AI16+AN16+AQ16 -> 25 | F16: =+(G16)+(0.5*H16) -> 70.72 | G16: 70.72 | H16: 0 | I16: =+(J16+K16+L16)+0.5*M16 -> 83.91 | J16: 55.43 | K16: 22.47 | L16: 6.01 | M16: 0 | N16: =+(O16+P16)+0.5*Q16 -> 39.90 | O16: 17.67 | P16: 20.23 | Q16: 4 | R16: =+(S16+T16+U16)+0.5*V16 -> 22.12 | S16: 5.38 | T16: 6.12 | U16: 6.62 | V16: 8 | W16: =+(X16+Y16)+0.5*Z16 -> 79.13 | X16: 38.34 | Y16: 40.79 | Z16: 0 | AA16: =+(AB16+AC16)+0.5*AD16 -> 74.48 | AB16: 52.61 | AC16: 20.87 | AD16: 2 | AE16: =+(AF16+AG16+AH16)+0.5*AI16 -> 57.63 | AF16: 10.33 | AG16: 11.86 | AH16: 32.44 | AI16: 6 | AJ16: =+(AK16+AL16+AM16)+0.5*AN16 -> 27.64 | AK16: 8.48 | AL16: 8.83 | AM16: 7.83 | AN16: 5 | AO16: =+(AP16)+0.5*AQ16 -> 104.70 | AP16: 104.70 | AQ16: 0
A17: 14 | B17: Myers, Chris | C17: TRO | D17: =+F17+I17+N17+R17+W17+AA17+AE17+AJ17+AO17 -> 565.38 | E17: =+H17+M17+Q17+V17+Z17+AD17+AI17+AN17+AQ17 -> 54 | F17: =+(G17)+(0.5*H17) -> 79.12 | G17: 79.12 | H17: 0 | I17: =+(J17+K17+L17)+0.5*M17 -> 61.42 | J17: 24.22 | K17: 26.94 | L17: 10.26 | M17: 0 | N17: =+(O17+P17)+0.5*Q17 -> 48.92 | O17: 20.62 | P17: 25.30 | Q17: 6 | R17: =+(S17+T17+U17)+0.5*V17 -> 25.69 | S17: 6.86 | T17: 6.81 | U17: 6.52 | V17: 11 | W17: =+(X17+Y17)+0.5*Z17 -> 109.41 | X17: 52.78 | Y17: 56.63 | Z17: 0 | AA17: =+(AB17+AC17)+0.5*AD17 -> 57.46 | AB17: 29.73 | AC17: 27.73 | AD17: 0 | AE17: =+(AF17+AG17+AH17)+0.5*AI17 -> 59.44 | AF17: 11.82 | AG17: 15.38 | AH17: 23.74 | AI17: 17 | AJ17: =+(AK17+AL17+AM17)+0.5*AN17 -> 33.02 | AK17: 14.53 | AL17: 9.75 | AM17: 8.74 | AN17: 0 | AO17: =+(AP17)+0.5*AQ17 -> 90.90 | AP17: 80.90 | AQ17: 20
A18: 15 | B18: Adams, Kyle | C18: TRO | D18: =+F18+I18+N18+R18+W18+AA18+AE18+AJ18+AO18 -> 577.84 | E18: =+H18+M18+Q18+V18+Z18+AD18+AI18+AN18+AQ18 -> 109 | F18: =+(G18)+(0.5*H18) -> 46.94 | G18: 46.94 | H18: 0 | I18: =+(J18+K18+L18)+0.5*M18 -> 31.98 | J18: 12.39 | K18: 14.81 | L18: 4.78 | M18: 0 | N18: =+(O18+P18)+0.5*Q18 -> 60.53 | O18: 24.91 | P18: 26.62 | Q18: 18 | R18: =+(S18+T18+U18)+0.5*V18 -> 33.97 | S18: 10.19 | T18: 7.93 | U18: 6.85 | V18: 18 | W18: =+(X18+Y18)+0.5*Z18 -> 145.48 | X18: 100.15 | Y18: 45.33 | Z18: 0 | AA18: =+(AB18+AC18)+0.5*AD18 -> 56.39 | AB18: 22.59 | AC18: 30.30 | AD18: 7 | AE18: =+(AF18+AG18+AH18)+0.5*AI18 -> 61.08 | AF18: 17.27 | AG18: 18.62 | AH18: 18.19 | AI18: 14 | AJ18: =+(AK18+AL18+AM18)+0.5*AN18 -> 52.91 | AK18: 8.54 | AL18: 9.49 | AM18: 8.88 | AN18: 52 | AO18: =+(AP18)+0.5*AQ18 -> 88.56 | AP18: 88.56 | AQ18: 0
A19: 16 | B19: Stilwell, Mike | C19: L | D19: =+F19+I19+N19+R19+W19+AA19+AE19+AJ19+AO19 -> 580.48 | E19: =+H19+M19+Q19+V19+Z19+AD19+AI19+AN19+AQ19 -> 68 | F19: =+(G19)+(0.5*H19) -> 84.07 | G19: 84.07 | H19: 0 | I19: =+(J19+K19+L19)+0.5*M19 -> 36.22 | J19: 14.75 | K19: 15.31 | L19: 6.16 | M19: 0 | N19: =+(O19+P19)+0.5*Q19 -> 58.63 | O19: 19.62 | P19: 19.01 | Q19: 40 | R19: =+(S19+T19+U19)+0.5*V19 -> 22.76 | S19: 5.77 | T19: 5.63 | U19: 6.36 | V19: 10 | W19: =+(X19+Y19)+0.5*Z19 -> 79.54 | X19: 43.20 | Y19: 36.34 | Z19: 0 | AA19: =+(AB19+AC19)+0.5*AD19 -> 66.70 | AB19: 34.26 | AC19: 31.94 | AD19: 1 | AE19: =+(AF19+AG19+AH19)+0.5*AI19 -> 53.73 | AF19: 12.90 | AG19: 13.03 | AH19: 24.80 | AI19: 6 | AJ19: =+(AK19+AL19+AM19)+0.5*AN19 -> 31.06 | AK19: 8.10 | AL19: 11.17 | AM19: 6.29 | AN19: 11 | AO19: =+(AP19)+0.5*AQ19 -> 147.77 | AP19: 147.77 | AQ19: 0
A20: 17 | B20: Zaccardi, Juke | C20: TRO | D20: =+F20+I20+N20+R20+W20+AA20+AE20+AJ20+AO20 -> 593.53 | E20: =+H20+M20+Q20+V20+Z20+AD20+AI20+AN20+AQ20 -> 87 | F20: =+(G20)+(0.5*H20) -> 77.72 | G20: 77.72 | H20: 0 | I20: =+(J20+K20+L20)+0.5*M20 -> 29.72 | J20: 11.90 | K20: 14.11 | L20: 3.71 | M20: 0 | N20: =+(O20+P20)+0.5*Q20 -> 62.50 | O20: 31.84 | P20: 29.66 | Q20: 2 | R20: =+(S20+T20+U20)+0.5*V20 -> 25.85 | S20: 6.50 | T20: 4.92 | U20: 6.93 | V20: 15 | W20: =+(X20+Y20)+0.5*Z20 -> 113.52 | X20: 62.72 | Y20: 50.80 | Z20: 0 | AA20: =+(AB20+AC20)+0.5*AD20 -> 58.89 | AB20: 29.46 | AC20: 22.43 | AD20: 14 | AE20: =+(AF20+AG20+AH20)+0.5*AI20 -> 52.21 | AF20: 9.66 | AG20: 13.68 | AH20: 21.37 | AI20: 15 | AJ20: =+(AK20+AL20+AM20)+0.5*AN20 -> 51.26 | AK20: 7.80 | AL20: 12.01 | AM20: 10.95 | AN20: 41 | AO20: =+(AP20)+0.5*AQ20 -> 121.86 | AP20: 121.86 | AQ20: 0
A21: 18 | B21: Cox, Roger | C21: L | D21: =+F21+I21+N21+R21+W21+AA21+AE21+AJ21+AO21 -> 605.69 | E21: =+H21+M21+Q21+V21+Z21+AD21+AI21+AN21+AQ21 -> 73 | F21: =+(G21)+(0.5*H21) -> 68.63 | G21: 68.63 | H21: 0 | I21: =+(J21+K21+L21)+0.5*M21 -> 27.37 | J21: 12.88 | K21: 11.25 | L21: 3.24 | M21: 0 | N21: =+(O21+P21)+0.5*Q21 -> 90.79 | O21: 44.25 | P21: 39.54 | Q21: 14 | R21: =+(S21+T21+U21)+0.5*V21 -> 27.33 | S21: 6.14 | T21: 6.08 | U21: 6.11 | V21: 18 | W21: =+(X21+Y21)+0.5*Z21 -> 117.65 | X21: 77.66 | Y21: 39.99 | Z21: 0 | AA21: =+(AB21+AC21)+0.5*AD21 -> 76.81 | AB21: 45.47 | AC21: 30.84 | AD21: 1 | AE21: =+(AF21+AG21+AH21)+0.5*AI21 -> 61.20 | AF21: 9.14 | AG21: 10.62 | AH21: 26.94 | AI21: 29 | AJ21: =+(AK21+AL21+AM21)+0.5*AN21 -> 32.78 | AK21: 8.05 | AL21: 11.76 | AM21: 7.47 | AN21: 11 | AO21: =+(AP21)+0.5*AQ21 -> 103.13 | AP21: 103.13 | AQ21: 0
A22: 19 | B22: Rodriquez, Mike | C22: T | D22: =+F22+I22+N22+R22+W22+AA22+AE22+AJ22+AO22 -> 605.96 | E22: =+H22+M22+Q22+V22+Z22+AD22+AI22+AN22+AQ22 -> 135 | F22: =+(G22)+(0.5*H22) -> 75.87 | G22: 75.87 | H22: 0 | I22: =+(J22+K22+L22)+0.5*M22 -> 44.87 | J22: 22.31 | K22: 17.86 | L22: 4.70 | M22: 0 | N22: =+(O22+P22)+0.5*Q22 -> 65.42 | O22: 32.99 | P22: 20.93 | Q22: 23 | R22: =+(S22+T22+U22)+0.5*V22 -> 33.81 | S22: 5.29 | T22: 5.23 | U22: 6.29 | V22: 34 | W22: =+(X22+Y22)+0.5*Z22 -> 102.72 | X22: 59.00 | Y22: 43.72 | Z22: 0 | AA22: =+(AB22+AC22)+0.5*AD22 -> 75.47 | AB22: 37.39 | AC22: 36.58 | AD22: 3 | AE22: =+(AF22+AG22+AH22)+0.5*AI22 -> 70.50 | AF22: 12.19 | AG22: 20.81 | AH22: 24.00 | AI22: 27 | AJ22: =+(AK22+AL22+AM22)+0.5*AN22 -> 47.30 | AK22: 8.13 | AL22: 7.89 | AM22: 7.28 | AN22: 48 | AO22: =+(AP22)+0.5*AQ22 -> 90.00 | AP22: 90.00 | AQ22: 0
A23: 20 | B23: Terry, Dale | C23: O | D23: =+F23+I23+N23+R23+W23+AA23+AE23+AJ23+AO23 -> 607.01 | E23: =+H23+M23+Q23+V23+Z23+AD23+AI23+AN23+AQ23 -> 94 | F23: =+(G23)+(0.5*H23) -> 59.01 | G23: 59.01 | H23: 0 | I23: =+(J23+K23+L23)+0.5*M23 -> 49.05 | J23: 24.44 | K23: 20.68 | L23: 3.93 | M23: 0 | N23: =+(O23+P23)+0.5*Q23 -> 35.73 | O23: 14.17 | P23: 13.06 | Q23: 17 | R23: =+(S23+T23+U23)+0.5*V23 -> 45.86 | S23: 7.79 | T23: 9.08 | U23: 6.99 | V23: 44 | W23: =+(X23+Y23)+0.5*Z23 -> 115.01 | X23: 74.08 | Y23: 40.93 | Z23: 0 | AA23: =+(AB23+AC23)+0.5*AD23 -> 52.28 | AB23: 28.09 | AC23: 23.69 | AD23: 1 | AE23: =+(AF23+AG23+AH23)+0.5*AI23 -> 56.86 | AF23: 9.83 | AG23: 17.67 | AH23: 25.86 | AI23: 7 | AJ23: =+(AK23+AL23+AM23)+0.5*AN23 -> 40.82 | AK23: 10.20 | AL23: 8.77 | AM23: 9.35 | AN23: 25 | AO23: =+(AP23)+0.5*AQ23 -> 152.39 | AP23: 152.39 | AQ23: 0
A24: 21 | B24: Kirkham, Bart | C24: L | D24: =+F24+I24+N24+R24+W24+AA24+AE24+AJ24+AO24 -> 613.23 | E24: =+H24+M24+Q24+V24+Z24+AD24+AI24+AN24+AQ24 -> 67 | F24: =+(G24)+(0.5*H24) -> 87.22 | G24: 87.22 | H24: 0 | I24: =+(J24+K24+L24)+0.5*M24 -> 56.04 | J24: 20.03 | K24: 27.49 | L24: 8.52 | M24: 0 | N24: =+(O24+P24)+0.5*Q24 -> 51.24 | O24: 24.31 | P24: 23.43 | Q24: 7 | R24: =+(S24+T24+U24)+0.5*V24 -> 30.99 | S24: 6.44 | T24: 14.31 | U24: 5.74 | V24: 9 | W24: =+(X24+Y24)+0.5*Z24 -> 100.53 | X24: 47.98 | Y24: 52.55 | Z24: 0 | AA24: =+(AB24+AC24)+0.5*AD24 -> 83.88 | AB24: 49.31 | AC24: 32.57 | AD24: 4 | AE24: =+(AF24+AG24+AH24)+0.5*AI24 -> 59.27 | AF24: 12.68 | AG24: 15.61 | AH24: 21.48 | AI24: 19 | AJ24: =+(AK24+AL24+AM24)+0.5*AN24 -> 46.82 | AK24: 13.77 | AL24: 9.52 | AM24: 9.53 | AN24: 28 | AO24: =+(AP24)+0.5*AQ24 -> 97.24 | AP24: 97.24 | AQ24: 0
A25: 22 | B25: Durant, Steve | C25: T | D25: =+F25+I25+N25+R25+W25+AA25+AE25+AJ25+AO25 -> 625.90 | E25: =+H25+M25+Q25+V25+Z25+AD25+AI25+AN25+AQ25 -> 98 | F25: =+(G25)+(0.5*H25) -> 78.09 | G25: 78.09 | H25: 0 | I25: =+(J25+K25+L25)+0.5*M25 -> 49.63 | J25: 23.39 | K25: 19.65 | L25: 6.59 | M25: 0 | N25: =+(O25+P25)+0.5*Q25 -> 62.52 | O25: 26.13 | P25: 27.89 | Q25: 17 | R25: =+(S25+T25+U25)+0.5*V25 -> 36.23 | S25: 6.29 | T25: 6.54 | U25: 6.40 | V25: 34 | W25: =+(X25+Y25)+0.5*Z25 -> 121.43 | X25: 61.69 | Y25: 59.74 | Z25: 0 | AA25: =+(AB25+AC25)+0.5*AD25 -> 75.36 | AB25: 47.69 | AC25: 21.67 | AD25: 12 | AE25: =+(AF25+AG25+AH25)+0.5*AI25 -> 69.70 | AF25: 13.74 | AG25: 15.15 | AH25: 33.31 | AI25: 15 | AJ25: =+(AK25+AL25+AM25)+0.5*AN25 -> 41.59 | AK25: 11.80 | AL25: 9.91 | AM25: 9.88 | AN25: 20 | AO25: =+(AP25)+0.5*AQ25 -> 91.35 | AP25: 91.35 | AQ25: 0
A26: 23 | B26: Durning, Will | C26: TRO | D26: =+F26+I26+N26+R26+W26+AA26+AE26+AJ26+AO26 -> 632.99 | E26: =+H26+M26+Q26+V26+Z26+AD26+AI26+AN26+AQ26 -> 181 | F26: =+(G26)+(0.5*H26) -> 71.09 | G26: 71.09 | H26: 0 | I26: =+(J26+K26+L26)+0.5*M26 -> 64.63 | J26: 18.79 | K26: 30.04 | L26: 15.80 | M26: 0 | N26: =+(O26+P26)+0.5*Q26 -> 60.84 | O26: 24.66 | P26: 24.18 | Q26: 24 | R26: =+(S26+T26+U26)+0.5*V26 -> 39.25 | S26: 7.79 | T26: 7.52 | U26: 6.94 | V26: 34 | W26: =+(X26+Y26)+0.5*Z26 -> 94.22 | X26: 40.37 | Y26: 53.85 | Z26: 0 | AA26: =+(AB26+AC26)+0.5*AD26 -> 78.53 | AB26: 26.03 | AC26: 23.50 | AD26: 58 | AE26: =+(AF26+AG26+AH26)+0.5*AI26 -> 63.57 | AF26: 18.77 | AG26: 12.78 | AH26: 23.52 | AI26: 17 | AJ26: =+(AK26+AL26+AM26)+0.5*AN26 -> 73.32 | AK26: 15.19 | AL26: 16.89 | AM26: 17.24 | AN26: 48 | AO26: =+(AP26)+0.5*AQ26 -> 87.54 | AP26: 87.54 | AQ26: 0
A27: 24 | B27: Richards, Dave | C27: TRO | D27: =+F27+I27+N27+R27+W27+AA27+AE27+AJ27+AO27 -> 638.80 | E27: =+H27+M27+Q27+V27+Z27+AD27+AI27+AN27+AQ27 -> 124 | F27: =+(G27)+(0.5*H27) -> 73.21 | G27: 73.21 | H27: 0 | I27: =+(J27+K27+L27)+0.5*M27 -> 49.25 | J27: 21.87 | K27: 17.15 | L27: 5.23 | M27: 10 | N27: =+(O27+P27)+0.5*Q27 -> 50.68 | O27: 28.42 | P27: 19.26 | Q27: 6 | R27: =+(S27+T27+U27)+0.5*V27 -> 26.60 | S27: 5.37 | T27: 4.54 | U27: 5.69 | V27: 22 | W27: =+(X27+Y27)+0.5*Z27 -> 77.83 | X27: 37.49 | Y27: 40.34 | Z27: 0 | AA27: =+(AB27+AC27)+0.5*AD27 -> 173.81 | AB27: 116.58 | AC27: 17.23 | AD27: 80 | AE27: =+(AF27+AG27+AH27)+0.5*AI27 -> 61.64 | AF27: 8.70 | AG27: 12.06 | AH27: 37.88 | AI27: 6 | AJ27: =+(AK27+AL27+AM27)+0.5*AN27 -> 22.30 | AK27: 7.65 | AL27: 7.41 | AM27: 7.24 | AN27: 0 | AO27: =+(AP27)+0.5*AQ27 -> 103.48 | AP27: 103.48 | AQ27: 0
A28: 25 | B28: Vollmer, Phillip | C28: T | D28: =+F28+I28+N28+R28+W28+AA28+AE28+AJ28+AO28 -> 647.66 | E28: =+H28+M28+Q28+V28+Z28+AD28+AI28+AN28+AQ28 -> 47 | F28: =+(G28)+(0.5*H28) -> 96.86 | G28: 96.86 | H28: 0 | I28: =+(J28+K28+L28)+0.5*M28 -> 35.07 | J28: 14.15 | K28: 13.58 | L28: 7.34 | M28: 0 | N28: =+(O28+P28)+0.5*Q28 -> 47.60 | O28: 20.79 | P28: 18.31 | Q28: 17 | R28: =+(S28+T28+U28)+0.5*V28 -> 42.76 | S28: 5.40 | T28: 21.02 | U28: 7.84 | V28: 17 | W28: =+(X28+Y28)+0.5*Z28 -> 113.63 | X28: 68.46 | Y28: 45.17 | Z28: 0 | AA28: =+(AB28+AC28)+0.5*AD28 -> 70.69 | AB28: 38.09 | AC28: 31.60 | AD28: 2 | AE28: =+(AF28+AG28+AH28)+0.5*AI28 -> 61.97 | AF28: 11.68 | AG28: 16.81 | AH28: 27.98 | AI28: 11 | AJ28: =+(AK28+AL28+AM28)+0.5*AN28 -> 35.94 | AK28: 10.33 | AL28: 15.43 | AM28: 10.18 | AN28: 0 | AO28: =+(AP28)+0.5*AQ28 -> 143.14 | AP28: 143.14 | AQ28: 0
A29: 26 | B29: Taylor, Joshua | C29: TRO | D29: =+F29+I29+N29+R29+W29+AA29+AE29+AJ29+AO29 -> 703.52 | E29: =+H29+M29+Q29+V29+Z29+AD29+AI29+AN29+AQ29 -> 53 | F29: =+(G29)+(0.5*H29) -> 67.61 | G29: 67.61 | H29: 0 | I29: =+(J29+K29+L29)+0.5*M29 -> 64.83 | J29: 23.03 | K29: 26.13 | L29: 15.67 | M29: 0 | N29: =+(O29+P29)+0.5*Q29 -> 57.07 | O29: 30.05 | P29: 26.52 | Q29: 1 | R29: =+(S29+T29+U29)+0.5*V29 -> 47.52 | S29: 6.95 | T29: 13.55 | U29: 13.52 | V29: 27 | W29: =+(X29+Y29)+0.5*Z29 -> 93.58 | X29: 43.33 | Y29: 50.25 | Z29: 0 | AA29: =+(AB29+AC29)+0.5*AD29 -> 94.42 | AB29: 52.54 | AC29: 41.88 | AD29: 0 | AE29: =+(AF29+AG29+AH29)+0.5*AI29 -> 75.22 | AF29: 21.13 | AG29: 19.06 | AH29: 29.03 | AI29: 12 | AJ29: =+(AK29+AL29+AM29)+0.5*AN29 -> 40.20 | AK29: 9.21 | AL29: 15.06 | AM29: 9.43 | AN29: 13 | AO29: =+(AP29)+0.5*AQ29 -> 163.07 | AP29: 163.07 | AQ29: 0
A30: 27 | B30: Simpson, Harold | C30: TRO | D30: =+F30+I30+N30+R30+W30+AA30+AE30+AJ30+AO30 -> 712.75 | E30: =+H30+M30+Q30+V30+Z30+AD30+AI30+AN30+AQ30 -> 80 | F30: =+(G30)+(0.5*H30) -> 89.79 | G30: 89.79 | H30: 0 | I30: =+(J30+K30+L30)+0.5*M30 -> 44.31 | J30: 16.81 | K30: 22.07 | L30: 5.43 | M30: 0 | N30: =+(O30+P30)+0.5*Q30 -> 68.67 | O30: 31.66 | P30: 33.51 | Q30: 7 | R30: =+(S30+T30+U30)+0.5*V30 -> 46.73 | S30: 23.70 | T30: 8.10 | U30: 7.43 | V30: 15 | W30: =+(X30+Y30)+0.5*Z30 -> 84.72 | X30: 42.12 | Y30: 42.60 | Z30: 0 | AA30: =+(AB30+AC30)+0.5*AD30 -> 92.30 | AB30: 60.19 | AC30: 30.61 | AD30: 3 | AE30: =+(AF30+AG30+AH30)+0.5*AI30 -> 67.18 | AF30: 12.18 | AG30: 16.42 | AH30: 32.58 | AI30: 12 | AJ30: =+(AK30+AL30+AM30)+0.5*AN30 -> 51.31 | AK30: 12.26 | AL30: 9.27 | AM30: 8.28 | AN30: 43 | AO30: =+(AP30)+0.5*AQ30 -> 167.74 | AP30: 167.74 | AQ30: 0
A31: 28 | B31: Hood, Neil | C31: TRO | D31: =+F31+I31+N31+R31+W31+AA31+AE31+AJ31+AO31 -> 724.94 | E31: =+H31+M31+Q31+V31+Z31+AD31+AI31+AN31+AQ31 -> 60 | F31: =+(G31)+(0.5*H31) -> 100.93 | G31: 100.93 | H31: 0 | I31: =+(J31+K31+L31)+0.5*M31 -> 42.07 | J31: 17.52 | K31: 17.07 | L31: 7.48 | M31: 0 | N31: =+(O31+P31)+0.5*Q31 -> 83.95 | O31: 36.21 | P31: 38.74 | Q31: 18 | R31: =+(S31+T31+U31)+0.5*V31 -> 29.97 | S31: 6.26 | T31: 7.34 | U31: 6.87 | V31: 19 | W31: =+(X31+Y31)+0.5*Z31 -> 109.09 | X31: 53.67 | Y31: 55.42 | Z31: 0 | AA31: =+(AB31+AC31)+0.5*AD31 -> 86.39 | AB31: 38.48 | AC31: 39.91 | AD31: 16 | AE31: =+(AF31+AG31+AH31)+0.5*AI31 -> 63.02 | AF31: 11.95 | AG31: 17.25 | AH31: 30.32 | AI31: 7 | AJ31: =+(AK31+AL31+AM31)+0.5*AN31 -> 34.87 | AK31: 11.33 | AL31: 10.86 | AM31: 12.68 | AN31: 0 | AO31: =+(AP31)+0.5*AQ31 -> 174.65 | AP31: 174.65 | AQ31: 0
A32: 29 | B32: Jensen, Mark | C32: T | D32: =+F32+I32+N32+R32+W32+AA32+AE32+AJ32+AO32 -> 752.59 | E32: =+H32+M32+Q32+V32+Z32+AD32+AI32+AN32+AQ32 -> 169 | F32: =+(G32)+(0.5*H32) -> 109.76 | G32: 109.76 | H32: 0 | I32: =+(J32+K32+L32)+0.5*M32 -> 47.87 | J32: 21.11 | K32: 18.65 | L32: 8.11 | M32: 0 | N32: =+(O32+P32)+0.5*Q32 -> 50.29 | O32: 30.51 | P32: 16.78 | Q32: 6 | R32: =+(S32+T32+U32)+0.5*V32 -> 28.90 | S32: 4.71 | T32: 5.09 | U32: 5.10 | V32: 28 | W32: =+(X32+Y32)+0.5*Z32 -> 120.88 | X32: 76.22 | Y32: 44.66 | Z32: 0 | AA32: =+(AB32+AC32)+0.5*AD32 -> 82.50 | AB32: 57.56 | AC32: 23.44 | AD32: 3 | AE32: =+(AF32+AG32+AH32)+0.5*AI32 -> 67.13 | AF32: 9.49 | AG32: 17.18 | AH32: 36.46 | AI32: 8 | AJ32: =+(AK32+AL32+AM32)+0.5*AN32 -> 42.92 | AK32: 12.10 | AL32: 8.54 | AM32: 10.28 | AN32: 24 | AO32: =+(AP32)+0.5*AQ32 -> 202.34 | AP32: 152.34 | AQ32: 100
A33: 30 | B33: Hendricks, Cy | C33: T | D33: =+F33+I33+N33+R33+W33+AA33+AE33+AJ33+AO33 -> 754.12 | E33: =+H33+M33+Q33+V33+Z33+AD33+AI33+AN33+AQ33 -> 153 | F33: =+(G33)+(0.5*H33) -> 88.03 | G33: 88.03 | H33: 0 | I33: =+(J33+K33+L33)+0.5*M33 -> 67.32 | J33: 32.21 | K33: 30.93 | L33: 4.18 | M33: 0 | N33: =+(O33+P33)+0.5*Q33 -> 63.33 | O33: 25.48 | P33: 17.35 | Q33: 41 | R33: =+(S33+T33+U33)+0.5*V33 -> 48.05 | S33: 10.00 | T33: 6.40 | U33: 6.65 | V33: 50 | W33: =+(X33+Y33)+0.5*Z33 -> 102.30 | X33: 50.36 | Y33: 51.94 | Z33: 0 | AA33: =+(AB33+AC33)+0.5*AD33 -> 97.32 | AB33: 27.24 | AC33: 68.58 | AD33: 3 | AE33: =+(AF33+AG33+AH33)+0.5*AI33 -> 82.85 | AF33: 19.40 | AG33: 23.22 | AH33: 28.23 | AI33: 24 | AJ33: =+(AK33+AL33+AM33)+0.5*AN33 -> 81.07 | AK33: 17.28 | AL33: 22.62 | AM33: 23.67 | AN33: 35 | AO33: =+(AP33)+0.5*AQ33 -> 123.85 | AP33: 123.85 | AQ33: 0
A34: 31 | B34: Andrus, Jay | C34: T | D34: =+F34+I34+N34+R34+W34+AA34+AE34+AJ34+AO34 -> 755.08 | E34: =+H34+M34+Q34+V34+Z34+AD34+AI34+AN34+AQ34 -> 69 | F34: =+(G34)+(0.5*H34) -> 99.85 | G34: 99.85 | H34: 0 | I34: =+(J34+K34+L34)+0.5*M34 -> 61.63 | J34: 34.98 | K34: 20.00 | L34: 6.65 | M34: 0 | N34: =+(O34+P34)+0.5*Q34 -> 77.12 | O34: 41.07 | P34: 34.55 | Q34: 3 | R34: =+(S34+T34+U34)+0.5*V34 -> 33.54 | S34: 5.65 | T34: 5.60 | U34: 5.79 | V34: 33 | W34: =+(X34+Y34)+0.5*Z34 -> 112.68 | X34: 58.69 | Y34: 53.99 | Z34: 0 | AA34: =+(AB34+AC34)+0.5*AD34 -> 109.11 | AB34: 47.61 | AC34: 60.00 | AD34: 3 | AE34: =+(AF34+AG34+AH34)+0.5*AI34 -> 76.05 | AF34: 14.72 | AG34: 16.51 | AH34: 31.32 | AI34: 27 | AJ34: =+(AK34+AL34+AM34)+0.5*AN34 -> 51.41 | AK34: 17.32 | AL34: 10.63 | AM34: 21.96 | AN34: 3 | AO34: =+(AP34)+0.5*AQ34 -> 133.69 | AP34: 133.69 | AQ34: 0
A35: 32 | B35: Durant, David | C35: T | D35: =+F35+I35+N35+R35+W35+AA35+AE35+AJ35+AO35 -> 772.37 | E35: =+H35+M35+Q35+V35+Z35+AD35+AI35+AN35+AQ35 -> 61 | F35: =+(G35)+(0.5*H35) -> 113.01 | G35: 113.01 | H35: 0 | I35: =+(J35+K35+L35)+0.5*M35 -> 59.68 | J35: 21.95 | K35: 28.15 | L35: 9.58 | M35: 0 | N35: =+(O35+P35)+0.5*Q35 -> 80.81 | O35: 40.21 | P35: 34.60 | Q35: 12 | R35: =+(S35+T35+U35)+0.5*V35 -> 36.95 | S35: 7.17 | T35: 5.46 | U35: 5.82 | V35: 37 | W35: =+(X35+Y35)+0.5*Z35 -> 123.07 | X35: 62.73 | Y35: 60.34 | Z35: 0 | AA35: =+(AB35+AC35)+0.5*AD35 -> 120.39 | AB35: 63.92 | AC35: 55.97 | AD35: 1 | AE35: =+(AF35+AG35+AH35)+0.5*AI35 -> 101.52 | AF35: 33.90 | AG35: 19.36 | AH35: 45.26 | AI35: 6 | AJ35: =+(AK35+AL35+AM35)+0.5*AN35 -> 40.14 | AK35: 14.48 | AL35: 11.64 | AM35: 11.52 | AN35: 5 | AO35: =+(AP35)+0.5*AQ35 -> 96.80 | AP35: 96.80 | AQ35: 0
A36: 33 | B36: Simon, Clint | C36: TRO | D36: =+F36+I36+N36+R36+W36+AA36+AE36+AJ36+AO36 -> 835.91 | E36: =+H36+M36+Q36+V36+Z36+AD36+AI36+AN36+AQ36 -> 123 | F36: =+(G36)+(0.5*H36) -> 110.15 | G36: 110.15 | H36: 0 | I36: =+(J36+K36+L36)+0.5*M36 -> 81.79 | J36: 38.84 | K36: 34.29 | L36: 8.66 | M36: 0 | N36: =+(O36+P36)+0.5*Q36 -> 72.13 | O36: 32.96 | P36: 28.67 | Q36: 21 | R36: =+(S36+T36+U36)+0.5*V36 -> 55.26 | S36: 7.22 | T36: 7.53 | U36: 8.51 | V36: 64 | W36: =+(X36+Y36)+0.5*Z36 -> 103.97 | X36: 56.70 | Y36: 47.27 | Z36: 0 | AA36: =+(AB36+AC36)+0.5*AD36 -> 94.41 | AB36: 59.02 | AC36: 34.39 | AD36: 2 | AE36: =+(AF36+AG36+AH36)+0.5*AI36 -> 201.36 | AF36: 18.13 | AG36: 27.89 | AH36: 139.84 | AI36: 31 | AJ36: =+(AK36+AL36+AM36)+0.5*AN36 -> 35.47 | AK36: 11.76 | AL36: 11.48 | AM36: 9.73 | AN36: 5 | AO36: =+(AP36)+0.5*AQ36 -> 81.37 | AP36: 81.37 | AQ36: 0
A37: 34 | B37: Kirkham, Glade | C37: L | D37: =+F37+I37+N37+R37+W37+AA37+AE37+AJ37+AO37 -> 938.40 | E37: =+H37+M37+Q37+V37+Z37+AD37+AI37+AN37+AQ37 -> 95 | F37: =+(G37)+(0.5*H37) -> 91.64 | G37: 91.64 | H37: 0 | I37: =+(J37+K37+L37)+0.5*M37 -> 66.50 | J37: 25.07 | K37: 27.05 | L37: 14.38 | M37: 0 | N37: =+(O37+P37)+0.5*Q37 -> 117.08 | O37: 69.47 | P37: 36.61 | Q37: 22 | R37: =+(S37+T37+U37)+0.5*V37 -> 41.01 | S37: 6.79 | T37: 6.57 | U37: 9.65 | V37: 36 | W37: =+(X37+Y37)+0.5*Z37 -> 295.55 | X37: 208.60 | Y37: 86.95 | Z37: 0 | AA37: =+(AB37+AC37)+0.5*AD37 -> 87.59 | AB37: 49.66 | AC37: 37.93 | AD37: 0 | AE37: =+(AF37+AG37+AH37)+0.5*AI37 -> 83.20 | AF37: 20.64 | AG37: 26.29 | AH37: 25.27 | AI37: 22 | AJ37: =+(AK37+AL37+AM37)+0.5*AN37 -> 79.99 | AK37: 28.74 | AL37: 19.84 | AM37: 23.91 | AN37: 15 | AO37: =+(AP37)+0.5*AQ37 -> 75.84 | AP37: 75.84 | AQ37: 0
A38: 35 | B38: Ellsworth, Jason | C38: T | D38: =+F38+I38+N38+R38+W38+AA38+AE38+AJ38+AO38 -> 1006.46 | E38: =+H38+M38+Q38+V38+Z38+AD38+AI38+AN38+AQ38 -> 111 | F38: =+(G38)+(0.5*H38) -> 107.19 | G38: 107.19 | H38: 0 | I38: =+(J38+K38+L38)+0.5*M38 -> 40.43 | J38: 18.56 | K38: 18.10 | L38: 3.77 | M38: 0 | N38: =+(O38+P38)+0.5*Q38 -> 59.14 | O38: 28.59 | P38: 21.05 | Q38: 19 | R38: =+(S38+T38+U38)+0.5*V38 -> 33.42 | S38: 7.73 | T38: 10.08 | U38: 8.61 | V38: 14 | W38: =+(X38+Y38)+0.5*Z38 -> 133.10 | X38: 50.99 | Y38: 82.11 | Z38: 0 | AA38: =+(AB38+AC38)+0.5*AD38 -> 90.26 | AB38: 51.23 | AC38: 36.53 | AD38: 5 | AE38: =+(AF38+AG38+AH38)+0.5*AI38 -> 70.69 | AF38: 17.68 | AG38: 22.79 | AH38: 26.22 | AI38: 8 | AJ38: =+(AK38+AL38+AM38)+0.5*AN38 -> 49.08 | AK38: 15.08 | AL38: 12.51 | AM38: 13.99 | AN38: 15 | AO38: =+(AP38)+0.5*AQ38 -> 423.15 | AP38: 398.15 | AQ38: 50
A39: 36 | B39: Sterling, Scott | C39: L | D39: =+F39+I39+N39+R39+W39+AA39+AE39+AJ39+AO39 -> 1162.88 | E39: =+H39+M39+Q39+V39+Z39+AD39+AI39+AN39+AQ39 -> 259 | F39: =+(G39)+(0.5*H39) -> 105.43 | G39: 105.43 | H39: 0 | I39: =+(J39+K39+L39)+0.5*M39 -> 55.71 | J39: 21.37 | K39: 21.88 | L39: 12.46 | M39: 0 | N39: =+(O39+P39)+0.5*Q39 -> 135.21 | O39: 52.50 | P39: 41.21 | Q39: 83 | R39: =+(S39+T39+U39)+0.5*V39 -> 34.28 | S39: 6.87 | T39: 6.74 | U39: 8.17 | V39: 25 | W39: =+(X39+Y39)+0.5*Z39 -> 248.12 | X39: 133.97 | Y39: 114.15 | Z39: 0 | AA39: =+(AB39+AC39)+0.5*AD39 -> 94.20 | AB39: 53.69 | AC39: 38.01 | AD39: 5 | AE39: =+(AF39+AG39+AH39)+0.5*AI39 -> 91.77 | AF39: 14.76 | AG39: 32.54 | AH39: 35.47 | AI39: 18 | AJ39: =+(AK39+AL39+AM39)+0.5*AN39 -> 56.60 | AK39: 12.24 | AL39: 13.20 | AM39: 12.16 | AN39: 38 | AO39: =+(AP39)+0.5*AQ39 -> 341.56 | AP39: 296.56 | AQ39: 90
A40: 37 | B40: Brown, Keith A. | C40: L | D40: DNF | E40: DNF | F40: DNF | G40: DNF | H40: DNF | I40: DNF | J40: DNF | K40: DNF | L40: 12.70 | M40: DNF | N40: =+(O40+P40)+0.5*Q40 -> 70.42 | O40: 31.86 | P40: 25.56 | Q40: 26 | R40: =+(S40+T40+U40)+0.5*V40 -> 40.82 | S40: 16.61 | T40: 7.74 | U40: 7.97 | V40: 17 | W40: =+(X40+Y40)+0.5*Z40 -> 88.37 | X40: 50.94 | Y40: 37.43 | Z40: 0 | AA40: DNF | AB40: DNF | AC40: 30.86 | AD40: DNF | AE40: DNF | AF40: 13.86 | AG40: 17.91 | AH40: DNF | AI40: DNF | AJ40: =+(AK40+AL40+AM40)+0.5*AN40 -> 34.76 | AK40: 9.01 | AL40: 8.11 | AM40: 7.14 | AN40: 21 | AO40: =+(AP40)+0.5*AQ40 -> 111.54 | AP40: 111.54 | AQ40: 0
A41: 38 | B41: Jordan, Susan | C41: L | D41: DNF | E41: DNF | F41: DNF | G41: DNF | H41: DNF | I41: DNF | J41: DNF | K41: DNF | L41: DNF | M41: DNF | N41: DNF | O41: DNF | P41: DNF | Q41: DNF | R41: DNF | S41: DNF | T41: DNF | U41: DNF | V41: DNF | W41: =+(X41+Y41)+0.5*Z41 -> 188.87 | X41: 81.84 | Y41: 107.03 | Z41: 0 | AA41: =+(AB41+AC41)+0.5*AD41 -> 114.08 | AB41: 50.22 | AC41: 58.86 | AD41: 10 | AE41: DNF | AF41: 30.40 | AG41: 44.48 | AH41: DNF | AI41: DNF | AJ41: =+(AK41+AL41+AM41)+0.5*AN41 -> 165.48 | AK41: 76.52 | AL41: 49.07 | AM41: 21.89 | AN41: 36 | AO41: =+(AP41)+0.5*AQ41 -> 221.80 | AP41: 221.80 | AQ41: 0
A42: Notes:
A43: - | B43: Div * - Refer to the UDPL 3-Gun Division Specifications for specifics on each Division.
B44: L = | C44: LIMITED
B45: T = | C45: TACTICAL
B46: TRO = | C46: TACTICAL RIFLE-OPTICAL
B47: O = | C47: OPEN
A48: - | B48: Points Down = .5 seconds x Points Down. PD Total is added to the total Stage time.
A49: XX | B49: = Indicates that the Points Down value includes some kind of penalty (Procedural Error, Hits on Non-Threat, Misses on Steel, etc.).
A50: DNF | B50: = Did Not Finish