B1: UDPL 3-Gun Match - Results for March 15, 2003 held at the FARM | AC1: Some shooters did not shoot String 2 and it is NOT included in the totals.
B2: (Results listed by Division) | AS2: **
A3: Place | B3: Name | C3: Division: O=Open L=Limited | D3: Shoot Total | E3: Total Points Down | F3: Stage 1 | G3: String 1 | H3: String 2 | I3: Points Down | J3: Stage 2 | K3: String 1 | L3: String 2 | M3: Points Down | N3: Stage 3 | O3: String 1 | P3: String 2 | Q3: String 3 | R3: Points Down | S3: Stage 4 | T3: String 1 | U3: Points Down | V3: Stage 5 | W3: String 1 | X3: String 2 | Y3: Points Down | Z3: Stage 6 | AA3: String 1 | AB3: Points Down | AC3: Stage 7 | AD3: String 1 | AE3: String 2 | AF3: Points Down | AG3: Stage 8 | AH3: String 1 | AI3: String 2 | AJ3: String 3 | AK3: Points Down | AL3: Stage 9 | AM3: String 1 | AN3: String 2 | AO3: Points Down | AP3: Stage 10 | AQ3: String 1 | AR3: String 2 | AS3: Points Down
A4: "Open" Division
A5: 1 | B5: Jones, Mark | C5: O | D5: =+F5+J5+N5+S5+V5+Z5+AC5+AG5+AL5+AP5 -> 545.21 | E5: =+I5+M5+R5+U5+Y5+AB5+AF5+AK5+AO5+AS5 -> 93 | F5: =+(G5+H5)+(0.5*I5) -> 61.62 | G5: 44.00 | H5: 17.62 | I5: 0 | J5: =+(K5+L5)+0.5*M5 -> 33.30 | K5: 20.19 | L5: 10.11 | M5: 6 | N5: =+(O5+P5+Q5)+0.5*R5 -> 32.06 | O5: 11.18 | P5: 9.21 | Q5: 11.67 | R5: 0 | S5: =+(T5)+0.5*U5 -> 46.51 | T5: 46.51 | U5: 0 | V5: =+(W5+X5)+0.5*Y5 -> 26.23 | W5: 13.57 | X5: 8.66 | Y5: 8 | Z5: =+(AA5)+0.5*AB5 -> 79.58 | AA5: 69.58 | AB5: 20 | AC5: =+(AD5)+0.5*AF5 -> 30.10 | AD5: 30.10 | AE5: 12.11 | AF5: 0 | AG5: =+(AH5+AI5+AJ5)+0.5*AK5 -> 73.75 | AH5: 8.96 | AI5: 12.98 | AJ5: 40.31 | AK5: 23 | AL5: =+(AM5+AN5)+0.5*AO5 -> 68.39 | AM5: 27.68 | AN5: 27.71 | AO5: 26 | AP5: =+(AQ5+AR5)+0.5*AS5 -> 93.67 | AQ5: 46.40 | AR5: 42.27 | AS5: 10
A6: 2 | B6: Willard, Jason | C6: O | D6: =+F6+J6+N6+S6+V6+Z6+AC6+AG6+AL6+AP6 -> 588.23 | E6: =+I6+M6+R6+U6+Y6+AB6+AF6+AK6+AO6+AS6 -> 112 | F6: =+(G6+H6)+(0.5*I6) -> 19.07 | G6: 7.36 | H6: 11.71 | I6: 0 | J6: =+(K6+L6)+0.5*M6 -> 48.47 | K6: 14.79 | L6: 26.18 | M6: 15 | N6: =+(O6+P6+Q6)+0.5*R6 -> 48.18 | O6: 19.12 | P6: 16.02 | Q6: 13.04 | R6: 0 | S6: =+(T6)+0.5*U6 -> 31.70 | T6: 31.70 | U6: 0 | V6: =+(W6+X6)+0.5*Y6 -> 43.88 | W6: 18.14 | X6: 18.74 | Y6: 14 | Z6: =+(AA6)+0.5*AB6 -> 79.24 | AA6: 74.74 | AB6: 9 | AC6: =+(AD6)+0.5*AF6 -> 35.59 | AD6: 35.59 | AE6: 16.51 | AF6: 0 | AG6: =+(AH6+AI6+AJ6)+0.5*AK6 -> 102.37 | AH6: 19.43 | AI6: 54.17 | AJ6: 22.27 | AK6: 13 | AL6: =+(AM6+AN6)+0.5*AO6 -> 80.76 | AM6: 32.71 | AN6: 35.05 | AO6: 26 | AP6: =+(AQ6+AR6)+0.5*AS6 -> 98.97 | AQ6: 42.67 | AR6: 38.80 | AS6: 35
A7: 3 | B7: Peterson, Scott | C7: O | D7: =+F7+J7+N7+S7+V7+Z7+AC7+AG7+AL7+AP7 -> 627.47 | E7: =+I7+M7+R7+U7+Y7+AB7+AF7+AK7+AO7+AS7 -> 208 | F7: =+(G7+H7)+(0.5*I7) -> 30.28 | G7: 11.05 | H7: 19.23 | I7: 0 | J7: =+(K7+L7)+0.5*M7 -> 36.08 | K7: 10.36 | L7: 11.22 | M7: 29 | N7: =+(O7+P7+Q7)+0.5*R7 -> 55.27 | O7: 16.22 | P7: 13.18 | Q7: 15.87 | R7: 20 | S7: =+(T7)+0.5*U7 -> 27.98 | T7: 27.98 | U7: 0 | V7: =+(W7+X7)+0.5*Y7 -> 32.03 | W7: 8.17 | X7: 7.86 | Y7: 32 | Z7: =+(AA7)+0.5*AB7 -> 67.59 | AA7: 50.09 | AB7: 35 | AC7: =+(AD7)+0.5*AF7 -> 18.82 | AD7: 16.32 | AE7: 7.91 | AF7: 5 | AG7: =+(AH7+AI7+AJ7)+0.5*AK7 -> 99.83 | AH7: 10.28 | AI7: 15.05 | AJ7: 62.50 | AK7: 24 | AL7: =+(AM7+AN7)+0.5*AO7 -> 121.95 | AM7: 83.55 | AN7: 21.90 | AO7: 33 | AP7: =+(AQ7+AR7)+0.5*AS7 -> 137.64 | AQ7: 60.55 | AR7: 62.09 | AS7: 30
A8: 4 | B8: Meek, Scott | C8: O | D8: =+F8+J8+N8+S8+V8+Z8+AC8+AG8+AL8+AP8 -> 636.08 | E8: =+I8+M8+R8+U8+Y8+AB8+AF8+AK8+AO8+AS8 -> 206 | F8: =+(G8+H8)+(0.5*I8) -> 51.96 | G8: 16.03 | H8: 35.93 | I8: 0 | J8: =+(K8+L8)+0.5*M8 -> 38.92 | K8: 18.15 | L8: 13.77 | M8: 14 | N8: =+(O8+P8+Q8)+0.5*R8 -> 69.55 | O8: 26.18 | P8: 12.74 | Q8: 15.63 | R8: 30 | S8: =+(T8)+0.5*U8 -> 49.42 | T8: 46.92 | U8: 5 | V8: =+(W8+X8)+0.5*Y8 -> 41.13 | W8: 9.78 | X8: 9.35 | Y8: 44 | Z8: =+(AA8)+0.5*AB8 -> 77.18 | AA8: 69.18 | AB8: 16 | AC8: =+(AD8)+0.5*AF8 -> 30.69 | AD8: 30.69 | AE8: 8.52 | AF8: 0 | AG8: =+(AH8+AI8+AJ8)+0.5*AK8 -> 73.24 | AH8: 11.14 | AI8: 16.99 | AJ8: 23.11 | AK8: 44 | AL8: =+(AM8+AN8)+0.5*AO8 -> 95.04 | AM8: 59.50 | AN8: 24.04 | AO8: 23 | AP8: =+(AQ8+AR8)+0.5*AS8 -> 108.95 | AQ8: 49.33 | AR8: 44.62 | AS8: 30
A9: 5 | B9: Broadhead, Ken | C9: O | D9: =+F9+J9+N9+S9+V9+Z9+AC9+AG9+AL9+AP9 -> 675.94 | E9: =+I9+M9+R9+U9+Y9+AB9+AF9+AK9+AO9+AS9 -> 90 | F9: =+(G9+H9)+(0.5*I9) -> 54.76 | G9: 37.75 | H9: 17.01 | I9: 0 | J9: =+(K9+L9)+0.5*M9 -> 41.53 | K9: 17.14 | L9: 21.39 | M9: 6 | N9: =+(O9+P9+Q9)+0.5*R9 -> 46.94 | O9: 18.50 | P9: 11.74 | Q9: 11.70 | R9: 10 | S9: =+(T9)+0.5*U9 -> 50.56 | T9: 50.56 | U9: 0 | V9: =+(W9+X9)+0.5*Y9 -> 26.54 | W9: 15.78 | X9: 9.26 | Y9: 3 | Z9: =+(AA9)+0.5*AB9 -> 118.87 | AA9: 109.87 | AB9: 18 | AC9: =+(AD9)+0.5*AF9 -> 49.20 | AD9: 49.20 | AE9: 17.79 | AF9: 0 | AG9: =+(AH9+AI9+AJ9)+0.5*AK9 -> 76.71 | AH9: 12.85 | AI9: 25.59 | AJ9: 32.77 | AK9: 11 | AL9: =+(AM9+AN9)+0.5*AO9 -> 75.47 | AM9: 33.17 | AN9: 26.30 | AO9: 32 | AP9: =+(AQ9+AR9)+0.5*AS9 -> 135.36 | AQ9: 68.78 | AR9: 61.58 | AS9: 10
A10: "Limited" Division
A11: 1 | B11: Nankervis, Bob | C11: L | D11: =+F11+J11+N11+S11+V11+Z11+AC11+AG11+AL11+AP11 -> 417.42 | E11: =+I11+M11+R11+U11+Y11+AB11+AF11+AK11+AO11+AS11 -> 71 | F11: =+(G11+H11)+(0.5*I11) -> 32.73 | G11: 17.64 | H11: 15.09 | I11: 0 | J11: =+(K11+L11)+0.5*M11 -> 29.10 | K11: 11.32 | L11: 16.78 | M11: 2 | N11: =+(O11+P11+Q11)+0.5*R11 -> 27.25 | O11: 9.77 | P11: 10.41 | Q11: 7.07 | R11: 0 | S11: =+(T11)+0.5*U11 -> 26.93 | T11: 26.93 | U11: 0 | V11: =+(W11+X11)+0.5*Y11 -> 17.19 | W11: 7.26 | X11: 6.93 | Y11: 6 | Z11: =+(AA11)+0.5*AB11 -> 64.45 | AA11: 58.95 | AB11: 11 | AC11: =+(AD11)+0.5*AF11 -> 18.64 | AD11: 18.64 | AE11: 11.24 | AF11: 0 | AG11: =+(AH11+AI11+AJ11)+0.5*AK11 -> 54.58 | AH11: 15.30 | AI11: 12.70 | AJ11: 24.08 | AK11: 5 | AL11: =+(AM11+AN11)+0.5*AO11 -> 65.89 | AM11: 27.69 | AN11: 29.70 | AO11: 17 | AP11: =+(AQ11+AR11)+0.5*AS11 -> 80.66 | AQ11: 36.83 | AR11: 28.83 | AS11: 30
A12: 2 | B12: Correia, Larry | C12: L | D12: =+F12+J12+N12+S12+V12+Z12+AC12+AG12+AL12+AP12 -> 419.72 | E12: =+I12+M12+R12+U12+Y12+AB12+AF12+AK12+AO12+AS12 -> 112 | F12: =+(G12+H12)+(0.5*I12) -> 38.26 | G12: 16.21 | H12: 22.05 | I12: 0 | J12: =+(K12+L12)+0.5*M12 -> 25.21 | K12: 10.99 | L12: 10.72 | M12: 7 | N12: =+(O12+P12+Q12)+0.5*R12 -> 42.46 | O12: 13.95 | P12: 12.40 | Q12: 11.11 | R12: 10 | S12: =+(T12)+0.5*U12 -> 25.82 | T12: 25.82 | U12: 0 | V12: =+(W12+X12)+0.5*Y12 -> 22.06 | W12: 12.09 | X12: 7.97 | Y12: 4 | Z12: =+(AA12)+0.5*AB12 -> 80.69 | AA12: 58.19 | AB12: 45 | AC12: =+(AD12)+0.5*AF12 -> 14.31 | AD12: 14.31 | AE12: 10.01 | AF12: 0 | AG12: =+(AH12+AI12+AJ12)+0.5*AK12 -> 40.80 | AH12: 8.71 | AI12: 11.58 | AJ12: 16.51 | AK12: 8 | AL12: =+(AM12+AN12)+0.5*AO12 -> 50.18 | AM12: 22.74 | AN12: 18.44 | AO12: 18 | AP12: =+(AQ12+AR12)+0.5*AS12 -> 79.93 | AQ12: 36.99 | AR12: 32.94 | AS12: 20
A13: 3 | B13: Latham, Corey | C13: L | D13: =+F13+J13+N13+S13+V13+Z13+AC13+AG13+AL13+AP13 -> 440.36 | E13: =+I13+M13+R13+U13+Y13+AB13+AF13+AK13+AO13+AS13 -> 71 | F13: =+(G13+H13)+(0.5*I13) -> 34.89 | G13: 20.88 | H13: 14.01 | I13: 0 | J13: =+(K13+L13)+0.5*M13 -> 28.90 | K13: 13.53 | L13: 14.87 | M13: 1 | N13: =+(O13+P13+Q13)+0.5*R13 -> 36.43 | O13: 11.92 | P13: 8.76 | Q13: 10.75 | R13: 10 | S13: =+(T13)+0.5*U13 -> 30.03 | T13: 30.03 | U13: 0 | V13: =+(W13+X13)+0.5*Y13 -> 19.57 | W13: 7.10 | X13: 11.47 | Y13: 2 | Z13: =+(AA13)+0.5*AB13 -> 63.00 | AA13: 54.50 | AB13: 17 | AC13: =+(AD13)+0.5*AF13 -> 21.40 | AD13: 21.40 | AE13: 7.31 | AF13: 0 | AG13: =+(AH13+AI13+AJ13)+0.5*AK13 -> 45.85 | AH13: 10.38 | AI13: 14.56 | AJ13: 20.41 | AK13: 1 | AL13: =+(AM13+AN13)+0.5*AO13 -> 44.68 | AM13: 19.77 | AN13: 22.41 | AO13: 5 | AP13: =+(AQ13+AR13)+0.5*AS13 -> 115.61 | AQ13: 53.67 | AR13: 44.44 | AS13: 35
A14: 4 | B14: Lowe, John | C14: L | D14: =+F14+J14+N14+S14+V14+Z14+AC14+AG14+AL14+AP14 -> 473.35 | E14: =+I14+M14+R14+U14+Y14+AB14+AF14+AK14+AO14+AS14 -> 64 | F14: =+(G14+H14)+(0.5*I14) -> 33.59 | G14: 19.54 | H14: 14.05 | I14: 0 | J14: =+(K14+L14)+0.5*M14 -> 30.37 | K14: 13.92 | L14: 14.95 | M14: 3 | N14: =+(O14+P14+Q14)+0.5*R14 -> 30.51 | O14: 11.41 | P14: 10.04 | Q14: 9.06 | R14: 0 | S14: =+(T14)+0.5*U14 -> 27.62 | T14: 27.62 | U14: 0 | V14: =+(W14+X14)+0.5*Y14 -> 15.90 | W14: 7.22 | X14: 8.68 | Y14: 0 | Z14: =+(AA14)+0.5*AB14 -> 70.84 | AA14: 67.84 | AB14: 6 | AC14: =+(AD14)+0.5*AF14 -> 20.29 | AD14: 20.29 | AE14: 9.67 | AF14: 0 | AG14: =+(AH14+AI14+AJ14)+0.5*AK14 -> 51.69 | AH14: 10.33 | AI14: 13.55 | AJ14: 20.81 | AK14: 14 | AL14: =+(AM14+AN14)+0.5*AO14 -> 56.98 | AM14: 31.85 | AN14: 22.13 | AO14: 6 | AP14: =+(AQ14+AR14)+0.5*AS14 -> 135.56 | AQ14: 56.42 | AR14: 61.64 | AS14: 35
A15: 5 | B15: Snelson, Rylee | C15: L | D15: =+F15+J15+N15+S15+V15+Z15+AC15+AG15+AL15+AP15 -> 492.03 | E15: =+I15+M15+R15+U15+Y15+AB15+AF15+AK15+AO15+AS15 -> 97 | F15: =+(G15+H15)+(0.5*I15) -> 39.03 | G15: 15.72 | H15: 23.31 | I15: 0 | J15: =+(K15+L15)+0.5*M15 -> 36.41 | K15: 13.91 | L15: 15.00 | M15: 15 | N15: =+(O15+P15+Q15)+0.5*R15 -> 29.56 | O15: 10.17 | P15: 10.78 | Q15: 8.61 | R15: 0 | S15: =+(T15)+0.5*U15 -> 28.55 | T15: 28.55 | U15: 0 | V15: =+(W15+X15)+0.5*Y15 -> 24.05 | W15: 10.35 | X15: 12.70 | Y15: 2 | Z15: =+(AA15)+0.5*AB15 -> 70.44 | AA15: 62.94 | AB15: 15 | AC15: =+(AD15)+0.5*AF15 -> 18.23 | AD15: 18.23 | AF15: 0 | AG15: =+(AH15+AI15+AJ15)+0.5*AK15 -> 52.13 | AH15: 9.12 | AI15: 18.65 | AJ15: 20.36 | AK15: 8 | AL15: =+(AM15+AN15)+0.5*AO15 -> 77.63 | AM15: 39.34 | AN15: 24.79 | AO15: 27 | AP15: =+(AQ15+AR15)+0.5*AS15 -> 116.00 | AQ15: 50.65 | AR15: 50.35 | AS15: 30
A16: 6 | B16: Zaccardi, Pat | C16: L | D16: =+F16+J16+N16+S16+V16+Z16+AC16+AG16+AL16+AP16 -> 514.95 | E16: =+I16+M16+R16+U16+Y16+AB16+AF16+AK16+AO16+AS16 -> 149 | F16: =+(G16+H16)+(0.5*I16) -> 37.11 | G16: 20.60 | H16: 16.51 | I16: 0 | J16: =+(K16+L16)+0.5*M16 -> 29.39 | K16: 10.35 | L16: 11.54 | M16: 15 | N16: =+(O16+P16+Q16)+0.5*R16 -> 35.18 | O16: 10.98 | P16: 13.74 | Q16: 10.46 | R16: 0 | S16: =+(T16)+0.5*U16 -> 38.84 | T16: 38.84 | U16: 0 | V16: =+(W16+X16)+0.5*Y16 -> 19.44 | W16: 6.82 | X16: 5.62 | Y16: 14 | Z16: =+(AA16)+0.5*AB16 -> 64.69 | AA16: 54.69 | AB16: 20 | AC16: =+(AD16)+0.5*AF16 -> 25.53 | AD16: 25.53 | AE16: 9.08 | AF16: 0 | AG16: =+(AH16+AI16+AJ16)+0.5*AK16 -> 49.88 | AH16: 8.62 | AI16: 15.67 | AJ16: 19.09 | AK16: 13 | AL16: =+(AM16+AN16)+0.5*AO16 -> 69.42 | AM16: 27.06 | AN16: 21.86 | AO16: 41 | AP16: =+(AQ16+AR16)+0.5*AS16 -> 145.47 | AQ16: 65.33 | AR16: 57.14 | AS16: 46
A17: 7 | B17: Knapp, Chris | C17: L | D17: =+F17+J17+N17+S17+V17+Z17+AC17+AG17+AL17+AP17 -> 515.32 | E17: =+I17+M17+R17+U17+Y17+AB17+AF17+AK17+AO17+AS17 -> 74 | F17: =+(G17+H17)+(0.5*I17) -> 64.72 | G17: 35.08 | H17: 29.64 | I17: 0 | J17: =+(K17+L17)+0.5*M17 -> 37.26 | K17: 16.95 | L17: 18.31 | M17: 4 | N17: =+(O17+P17+Q17)+0.5*R17 -> 38.53 | O17: 11.85 | P17: 13.10 | Q17: 13.58 | R17: 0 | S17: =+(T17)+0.5*U17 -> 32.47 | T17: 32.47 | U17: 0 | V17: =+(W17+X17)+0.5*Y17 -> 31.80 | W17: 13.04 | X17: 12.26 | Y17: 13 | Z17: =+(AA17)+0.5*AB17 -> 89.11 | AA17: 77.61 | AB17: 23 | AC17: =+(AD17)+0.5*AF17 -> 23.82 | AD17: 23.82 | AE17: 12.79 | AF17: 0 | AG17: =+(AH17+AI17+AJ17)+0.5*AK17 -> 57.67 | AH17: 12.65 | AI17: 16.39 | AJ17: 25.13 | AK17: 7 | AL17: =+(AM17+AN17)+0.5*AO17 -> 72.26 | AM17: 35.27 | AN17: 28.49 | AO17: 17 | AP17: =+(AQ17+AR17)+0.5*AS17 -> 67.68 | AQ17: 33.25 | AR17: 29.43 | AS17: 10
A18: 8 | B18: Durant, Steve | C18: L | D18: =+F18+J18+N18+S18+V18+Z18+AC18+AG18+AL18+AP18 -> 517.07 | E18: =+I18+M18+R18+U18+Y18+AB18+AF18+AK18+AO18+AS18 -> 70 | F18: =+(G18+H18)+(0.5*I18) -> 43.83 | G18: 30.37 | H18: 12.96 | I18: 1 | J18: =+(K18+L18)+0.5*M18 -> 32.25 | K18: 11.51 | L18: 14.74 | M18: 12 | N18: =+(O18+P18+Q18)+0.5*R18 -> 46.09 | O18: 14.47 | P18: 14.70 | Q18: 16.92 | R18: 0 | S18: =+(T18)+0.5*U18 -> 47.41 | T18: 47.41 | U18: 0 | V18: =+(W18+X18)+0.5*Y18 -> 23.05 | W18: 10.81 | X18: 9.74 | Y18: 5 | Z18: =+(AA18)+0.5*AB18 -> 72.98 | AA18: 70.98 | AB18: 4 | AC18: =+(AD18)+0.5*AF18 -> 22.32 | AD18: 22.32 | AE18: 14.71 | AF18: 0 | AG18: =+(AH18+AI18+AJ18)+0.5*AK18 -> 70.71 | AH18: 11.62 | AI18: 13.41 | AJ18: 34.18 | AK18: 23 | AL18: =+(AM18+AN18)+0.5*AO18 -> 71.63 | AM18: 35.32 | AN18: 28.81 | AO18: 15 | AP18: =+(AQ18+AR18)+0.5*AS18 -> 86.80 | AQ18: 40.17 | AR18: 41.63 | AS18: 10
A19: 9 | B19: Snelson, Terry | C19: L | D19: =+F19+J19+N19+S19+V19+Z19+AC19+AG19+AL19+AP19 -> 522.44 | E19: =+I19+M19+R19+U19+Y19+AB19+AF19+AK19+AO19+AS19 -> 76 | F19: =+(G19+H19)+(0.5*I19) -> 46.91 | G19: 22.51 | H19: 24.40 | I19: 0 | J19: =+(K19+L19)+0.5*M19 -> 34.80 | K19: 13.84 | L19: 16.96 | M19: 8 | N19: =+(O19+P19+Q19)+0.5*R19 -> 24.35 | O19: 7.85 | P19: 7.95 | Q19: 8.55 | R19: 0 | S19: =+(T19)+0.5*U19 -> 34.48 | T19: 34.48 | U19: 0 | V19: =+(W19+X19)+0.5*Y19 -> 28.78 | W19: 14.01 | X19: 13.77 | Y19: 2 | Z19: =+(AA19)+0.5*AB19 -> 80.79 | AA19: 69.79 | AB19: 22 | AC19: =+(AD19)+0.5*AF19 -> 32.12 | AD19: 32.12 | AF19: 0 | AG19: =+(AH19+AI19+AJ19)+0.5*AK19 -> 63.81 | AH19: 15.33 | AI19: 17.74 | AJ19: 27.24 | AK19: 7 | AL19: =+(AM19+AN19)+0.5*AO19 -> 74.97 | AM19: 42.40 | AN19: 26.57 | AO19: 12 | AP19: =+(AQ19+AR19)+0.5*AS19 -> 101.43 | AQ19: 48.36 | AR19: 40.57 | AS19: 25
A20: 10 | B20: Adams, Kyle | C20: L | D20: =+F20+J20+N20+S20+V20+Z20+AC20+AG20+AL20+AP20 -> 529.92 | E20: =+I20+M20+R20+U20+Y20+AB20+AF20+AK20+AO20+AS20 -> 96 | F20: =+(G20+H20)+(0.5*I20) -> 38.16 | G20: 18.37 | H20: 19.79 | I20: 0 | J20: =+(K20+L20)+0.5*M20 -> 32.69 | K20: 14.79 | L20: 14.90 | M20: 6 | N20: =+(O20+P20+Q20)+0.5*R20 -> 38.82 | O20: 9.31 | P20: 19.57 | Q20: 9.94 | R20: 0 | S20: =+(T20)+0.5*U20 -> 25.22 | T20: 25.22 | U20: 0 | V20: =+(W20+X20)+0.5*Y20 -> 28.53 | W20: 10.89 | X20: 15.14 | Y20: 5 | Z20: =+(AA20)+0.5*AB20 -> 68.89 | AA20: 61.39 | AB20: 15 | AC20: =+(AD20)+0.5*AF20 -> 36.21 | AD20: 36.21 | AF20: 0 | AG20: =+(AH20+AI20+AJ20)+0.5*AK20 -> 66.88 | AH20: 15.08 | AI20: 17.60 | AJ20: 30.20 | AK20: 8 | AL20: =+(AM20+AN20)+0.5*AO20 -> 75.25 | AM20: 33.96 | AN20: 30.29 | AO20: 22 | AP20: =+(AQ20+AR20)+0.5*AS20 -> 119.27 | AQ20: 52.16 | AR20: 47.11 | AS20: 40
A21: 11 | B21: Huff, Blake | C21: L | D21: =+F21+J21+N21+S21+V21+Z21+AC21+AG21+AL21+AP21 -> 535.76 | E21: =+I21+M21+R21+U21+Y21+AB21+AF21+AK21+AO21+AS21 -> 49 | F21: =+(G21+H21)+(0.5*I21) -> 34.16 | G21: 16.37 | H21: 17.79 | I21: 0 | J21: =+(K21+L21)+0.5*M21 -> 34.69 | K21: 17.58 | L21: 16.11 | M21: 2 | N21: =+(O21+P21+Q21)+0.5*R21 -> 30.99 | O21: 10.64 | P21: 11.90 | Q21: 8.45 | R21: 0 | S21: =+(T21)+0.5*U21 -> 54.65 | T21: 54.65 | U21: 0 | V21: =+(W21+X21)+0.5*Y21 -> 22.08 | W21: 9.03 | X21: 10.05 | Y21: 6 | Z21: =+(AA21)+0.5*AB21 -> 68.22 | AA21: 60.22 | AB21: 16 | AC21: =+(AD21)+0.5*AF21 -> 52.71 | AD21: 52.71 | AE21: 14.58 | AF21: 0 | AG21: =+(AH21+AI21+AJ21)+0.5*AK21 -> 65.63 | AH21: 11.00 | AI21: 16.24 | AJ21: 36.39 | AK21: 4 | AL21: =+(AM21+AN21)+0.5*AO21 -> 66.97 | AM21: 35.12 | AN21: 28.85 | AO21: 6 | AP21: =+(AQ21+AR21)+0.5*AS21 -> 105.66 | AQ21: 44.16 | AR21: 54.00 | AS21: 15
A22: 12 | B22: Spicer, Robert | C22: L | D22: =+F22+J22+N22+S22+V22+Z22+AC22+AG22+AL22+AP22 -> 562.81 | E22: =+I22+M22+R22+U22+Y22+AB22+AF22+AK22+AO22+AS22 -> 84 | F22: =+(G22+H22)+(0.5*I22) -> 30.86 | G22: 11.90 | H22: 18.96 | I22: 0 | J22: =+(K22+L22)+0.5*M22 -> 34.73 | K22: 14.69 | L22: 15.04 | M22: 10 | N22: =+(O22+P22+Q22)+0.5*R22 -> 47.94 | O22: 13.84 | P22: 17.76 | Q22: 16.34 | R22: 0 | S22: =+(T22)+0.5*U22 -> 35.38 | T22: 35.38 | U22: 0 | V22: =+(W22+X22)+0.5*Y22 -> 33.98 | W22: 9.45 | X22: 16.53 | Y22: 16 | Z22: =+(AA22)+0.5*AB22 -> 73.68 | AA22: 67.68 | AB22: 12 | AC22: =+(AD22)+0.5*AF22 -> 18.60 | AD22: 18.60 | AE22: 14.48 | AF22: 0 | AG22: =+(AH22+AI22+AJ22)+0.5*AK22 -> 59.80 | AH22: 13.03 | AI22: 17.86 | AJ22: 23.91 | AK22: 10 | AL22: =+(AM22+AN22)+0.5*AO22 -> 79.01 | AM22: 43.15 | AN22: 30.36 | AO22: 11 | AP22: =+(AQ22+AR22)+0.5*AS22 -> 148.83 | AQ22: 45.56 | AR22: 90.77 | AS22: 25
A23: 13 | B23: Hutch, Flinn | C23: L | D23: =+F23+J23+N23+S23+V23+Z23+AC23+AG23+AL23+AP23 -> 565.94 | E23: =+I23+M23+R23+U23+Y23+AB23+AF23+AK23+AO23+AS23 -> 116 | F23: =+(G23+H23)+(0.5*I23) -> 54.92 | G23: 22.68 | H23: 32.24 | I23: 0 | J23: =+(K23+L23)+0.5*M23 -> 32.86 | K23: 13.20 | L23: 14.66 | M23: 10 | N23: =+(O23+P23+Q23)+0.5*R23 -> 47.88 | O23: 17.48 | P23: 16.67 | Q23: 13.73 | R23: 0 | S23: =+(T23)+0.5*U23 -> 35.84 | T23: 35.84 | U23: 0 | V23: =+(W23+X23)+0.5*Y23 -> 37.91 | W23: 16.49 | X23: 18.92 | Y23: 5 | Z23: =+(AA23)+0.5*AB23 -> 82.40 | AA23: 75.40 | AB23: 14 | AC23: =+(AD23)+0.5*AF23 -> 29.35 | AD23: 29.35 | AF23: 0 | AG23: =+(AH23+AI23+AJ23)+0.5*AK23 -> 58.89 | AH23: 15.54 | AI23: 14.43 | AJ23: 24.42 | AK23: 9 | AL23: =+(AM23+AN23)+0.5*AO23 -> 91.12 | AM23: 35.74 | AN23: 28.88 | AO23: 53 | AP23: =+(AQ23+AR23)+0.5*AS23 -> 94.77 | AQ23: 43.96 | AR23: 38.31 | AS23: 25
A24: 14 | B24: Sharp, Mikel | C24: L | D24: =+F24+J24+N24+S24+V24+Z24+AC24+AG24+AL24+AP24 -> 580.80 | E24: =+I24+M24+R24+U24+Y24+AB24+AF24+AK24+AO24+AS24 -> 197 | F24: =+(G24+H24)+(0.5*I24) -> 37.61 | G24: 25.22 | H24: 12.39 | I24: 0 | J24: =+(K24+L24)+0.5*M24 -> 35.43 | K24: 11.77 | L24: 11.66 | M24: 24 | N24: =+(O24+P24+Q24)+0.5*R24 -> 37.96 | O24: 12.54 | P24: 9.97 | Q24: 15.45 | R24: 0 | S24: =+(T24)+0.5*U24 -> 30.31 | T24: 30.31 | U24: 0 | V24: =+(W24+X24)+0.5*Y24 -> 33.77 | W24: 13.28 | X24: 11.49 | Y24: 18 | Z24: =+(AA24)+0.5*AB24 -> 63.79 | AA24: 53.29 | AB24: 21 | AC24: =+(AD24)+0.5*AF24 -> 50.77 | AD24: 50.77 | AE24: 14.71 | AF24: 0 | AG24: =+(AH24+AI24+AJ24)+0.5*AK24 -> 128.75 | AH24: 8.77 | AI24: 59.63 | AJ24: 28.85 | AK24: 63 | AL24: =+(AM24+AN24)+0.5*AO24 -> 67.93 | AM24: 20.89 | AN24: 19.54 | AO24: 55 | AP24: =+(AQ24+AR24)+0.5*AS24 -> 94.48 | AQ24: 43.40 | AR24: 43.08 | AS24: 16
A25: 15 | B25: Risbeck, Andy | C25: L | D25: =+F25+J25+N25+S25+V25+Z25+AC25+AG25+AL25+AP25 -> 586.40 | E25: =+I25+M25+R25+U25+Y25+AB25+AF25+AK25+AO25+AS25 -> 122 | F25: =+(G25+H25)+(0.5*I25) -> 49.16 | G25: 22.77 | H25: 26.39 | I25: 0 | J25: =+(K25+L25)+0.5*M25 -> 45.79 | K25: 17.51 | L25: 24.78 | M25: 7 | N25: =+(O25+P25+Q25)+0.5*R25 -> 48.74 | O25: 14.37 | P25: 12.37 | Q25: 17.00 | R25: 10 | S25: =+(T25)+0.5*U25 -> 74.00 | T25: 74.00 | U25: 0 | V25: =+(W25+X25)+0.5*Y25 -> 31.44 | W25: 11.77 | X25: 18.17 | Y25: 3 | Z25: =+(AA25)+0.5*AB25 -> 71.35 | AA25: 65.85 | AB25: 11 | AC25: =+(AD25)+0.5*AF25 -> 23.11 | AD25: 23.11 | AE25: 10.69 | AF25: 0 | AG25: =+(AH25+AI25+AJ25)+0.5*AK25 -> 52.57 | AH25: 13.16 | AI25: 13.54 | AJ25: 21.37 | AK25: 9 | AL25: =+(AM25+AN25)+0.5*AO25 -> 67.46 | AM25: 30.72 | AN25: 25.74 | AO25: 22 | AP25: =+(AQ25+AR25)+0.5*AS25 -> 122.78 | AQ25: 45.02 | AR25: 47.76 | AS25: 60
A26: 16 | B26: Vollmer, Phillip | C26: L | D26: =+F26+J26+N26+S26+V26+Z26+AC26+AG26+AL26+AP26 -> 587.30 | E26: =+I26+M26+R26+U26+Y26+AB26+AF26+AK26+AO26+AS26 -> 45 | F26: =+(G26+H26)+(0.5*I26) -> 42.51 | G26: 25.91 | H26: 16.60 | I26: 0 | J26: =+(K26+L26)+0.5*M26 -> 40.00 | K26: 18.77 | L26: 17.23 | M26: 8 | N26: =+(O26+P26+Q26)+0.5*R26 -> 43.43 | O26: 15.32 | P26: 15.35 | Q26: 12.76 | R26: 0 | S26: =+(T26)+0.5*U26 -> 36.28 | T26: 36.28 | U26: 0 | V26: =+(W26+X26)+0.5*Y26 -> 19.17 | W26: 8.97 | X26: 8.70 | Y26: 3 | Z26: =+(AA26)+0.5*AB26 -> 69.54 | AA26: 62.04 | AB26: 15 | AC26: =+(AD26)+0.5*AF26 -> 29.24 | AD26: 29.24 | AE26: 10.96 | AF26: 0 | AG26: =+(AH26+AI26+AJ26)+0.5*AK26 -> 70.97 | AH26: 15.93 | AI26: 18.10 | AJ26: 34.44 | AK26: 5 | AL26: =+(AM26+AN26)+0.5*AO26 -> 71.31 | AM26: 33.91 | AN26: 32.90 | AO26: 9 | AP26: =+(AQ26+AR26)+0.5*AS26 -> 164.85 | AQ26: 79.76 | AR26: 82.59 | AS26: 5
A27: 17 | B27: Barnes, Gary | C27: L | D27: =+F27+J27+N27+S27+V27+Z27+AC27+AG27+AL27+AP27 -> 587.92 | E27: =+I27+M27+R27+U27+Y27+AB27+AF27+AK27+AO27+AS27 -> 160 | F27: =+(G27+H27)+(0.5*I27) -> 23.02 | G27: 8.34 | H27: 14.68 | I27: 0 | J27: =+(K27+L27)+0.5*M27 -> 40.22 | K27: 9.97 | L27: 16.25 | M27: 28 | N27: =+(O27+P27+Q27)+0.5*R27 -> 60.03 | O27: 19.80 | P27: 12.38 | Q27: 12.85 | R27: 30 | S27: =+(T27)+0.5*U27 -> 38.62 | T27: 38.62 | U27: 0 | V27: =+(W27+X27)+0.5*Y27 -> 49.16 | W27: 16.65 | X27: 15.01 | Y27: 35 | Z27: =+(AA27)+0.5*AB27 -> 99.51 | AA27: 97.01 | AB27: 5 | AC27: =+(AD27)+0.5*AF27 -> 36.65 | AD27: 31.65 | AE27: 15.71 | AF27: 10 | AG27: =+(AH27+AI27+AJ27)+0.5*AK27 -> 58.87 | AH27: 15.81 | AI27: 14.82 | AJ27: 24.74 | AK27: 7 | AL27: =+(AM27+AN27)+0.5*AO27 -> 81.49 | AM27: 35.82 | AN27: 30.67 | AO27: 30 | AP27: =+(AQ27+AR27)+0.5*AS27 -> 100.35 | AQ27: 51.47 | AR27: 41.38 | AS27: 15
A28: 18 | B28: Spicer, Richard | C28: L | D28: =+F28+J28+N28+S28+V28+Z28+AC28+AG28+AL28+AP28 -> 591.52 | E28: =+I28+M28+R28+U28+Y28+AB28+AF28+AK28+AO28+AS28 -> 74 | F28: =+(G28+H28)+(0.5*I28) -> 35.20 | G28: 13.89 | H28: 21.31 | I28: 0 | J28: =+(K28+L28)+0.5*M28 -> 34.63 | K28: 14.11 | L28: 15.02 | M28: 11 | N28: =+(O28+P28+Q28)+0.5*R28 -> 43.45 | O28: 16.17 | P28: 14.21 | Q28: 13.07 | R28: 0 | S28: =+(T28)+0.5*U28 -> 39.97 | T28: 39.97 | U28: 0 | V28: =+(W28+X28)+0.5*Y28 -> 32.52 | W28: 12.51 | X28: 11.51 | Y28: 17 | Z28: =+(AA28)+0.5*AB28 -> 88.67 | AA28: 83.67 | AB28: 10 | AC28: =+(AD28)+0.5*AF28 -> 41.60 | AD28: 41.60 | AE28: 14.33 | AF28: 0 | AG28: =+(AH28+AI28+AJ28)+0.5*AK28 -> 54.67 | AH28: 14.28 | AI28: 16.92 | AJ28: 21.97 | AK28: 3 | AL28: =+(AM28+AN28)+0.5*AO28 -> 85.08 | AM28: 43.26 | AN28: 37.82 | AO28: 8 | AP28: =+(AQ28+AR28)+0.5*AS28 -> 135.73 | AQ28: 62.76 | AR28: 60.47 | AS28: 25
A29: 19 | B29: Redford, "Red" | C29: L | D29: =+F29+J29+N29+S29+V29+Z29+AC29+AG29+AL29+AP29 -> 593.42 | E29: =+I29+M29+R29+U29+Y29+AB29+AF29+AK29+AO29+AS29 -> 120 | F29: =+(G29+H29)+(0.5*I29) -> 71.66 | G29: 46.85 | H29: 24.81 | I29: 0 | J29: =+(K29+L29)+0.5*M29 -> 73.42 | K29: 20.36 | L29: 39.06 | M29: 28 | N29: =+(O29+P29+Q29)+0.5*R29 -> 33.72 | O29: 13.07 | P29: 11.45 | Q29: 9.20 | R29: 0 | S29: =+(T29)+0.5*U29 -> 37.25 | T29: 37.25 | U29: 0 | V29: =+(W29+X29)+0.5*Y29 -> 27.05 | W29: 8.37 | X29: 13.18 | Y29: 11 | Z29: =+(AA29)+0.5*AB29 -> 70.87 | AA29: 58.87 | AB29: 24 | AC29: =+(AD29)+0.5*AF29 -> 33.72 | AD29: 33.72 | AE29: 41.86* | AF29: 0 | AG29: =+(AH29+AI29+AJ29)+0.5*AK29 -> 66.00 | AH29: 9.30 | AI29: 15.42 | AJ29: 34.78 | AK29: 13 | AL29: =+(AM29+AN29)+0.5*AO29 -> 69.00 | AM29: 32.98 | AN29: 24.02 | AO29: 24 | AP29: =+(AQ29+AR29)+0.5*AS29 -> 110.73 | AQ29: 50.57 | AR29: 50.16 | AS29: 20
A30: 20 | B30: Rodriquez, Mike | C30: L | D30: =+F30+J30+N30+S30+V30+Z30+AC30+AG30+AL30+AP30 -> 607.53 | E30: =+I30+M30+R30+U30+Y30+AB30+AF30+AK30+AO30+AS30 -> 136 | F30: =+(G30+H30)+(0.5*I30) -> 58.12 | G30: 31.02 | H30: 24.60 | I30: 5 | J30: =+(K30+L30)+0.5*M30 -> 45.14 | K30: 17.93 | L30: 19.21 | M30: 16 | N30: =+(O30+P30+Q30)+0.5*R30 -> 39.82 | O30: 11.83 | P30: 8.04 | Q30: 14.95 | R30: 10 | S30: =+(T30)+0.5*U30 -> 46.30 | T30: 46.30 | U30: 0 | V30: =+(W30+X30)+0.5*Y30 -> 29.81 | W30: 15.29 | X30: 13.52 | Y30: 2 | Z30: =+(AA30)+0.5*AB30 -> 94.12 | AA30: 81.12 | AB30: 26 | AC30: =+(AD30)+0.5*AF30 -> 49.59 | AD30: 49.59 | AE30: 8.54 | AF30: 0 | AG30: =+(AH30+AI30+AJ30)+0.5*AK30 -> 63.43 | AH30: 12.69 | AI30: 17.55 | AJ30: 25.69 | AK30: 15 | AL30: =+(AM30+AN30)+0.5*AO30 -> 84.54 | AM30: 33.23 | AN30: 27.81 | AO30: 47 | AP30: =+(AQ30+AR30)+0.5*AS30 -> 96.66 | AQ30: 45.11 | AR30: 44.05 | AS30: 15
A31: 21 | B31: Duncan, Dave | C31: L | D31: =+F31+J31+N31+S31+V31+Z31+AC31+AG31+AL31+AP31 -> 626.86 | E31: =+I31+M31+R31+U31+Y31+AB31+AF31+AK31+AO31+AS31 -> 134 | F31: =+(G31+H31)+(0.5*I31) -> 66.96 | G31: 41.75 | H31: 22.71 | I31: 5 | J31: =+(K31+L31)+0.5*M31 -> 34.89 | K31: 14.40 | L31: 16.49 | M31: 8 | N31: =+(O31+P31+Q31)+0.5*R31 -> 49.50 | O31: 18.81 | P31: 13.96 | Q31: 16.73 | R31: 0 | S31: =+(T31)+0.5*U31 -> 38.39 | T31: 38.39 | U31: 0 | V31: =+(W31+X31)+0.5*Y31 -> 25.17 | W31: 9.24 | X31: 11.43 | Y31: 9 | Z31: =+(AA31)+0.5*AB31 -> 70.38 | AA31: 60.88 | AB31: 19 | AC31: =+(AD31)+0.5*AF31 -> 44.60 | AD31: 39.60 | AE31: 22.72 | AF31: 10 | AG31: =+(AH31+AI31+AJ31)+0.5*AK31 -> 68.09 | AH31: 12.74 | AI31: 19.93 | AJ31: 30.42 | AK31: 10 | AL31: =+(AM31+AN31)+0.5*AO31 -> 62.90 | AM31: 33.30 | AN31: 23.10 | AO31: 13 | AP31: =+(AQ31+AR31)+0.5*AS31 -> 165.98 | AQ31: 65.09 | AR31: 70.89 | AS31: 60
A32: 22 | B32: Zaccardi, Juke | C32: L | D32: =+F32+J32+N32+S32+V32+Z32+AC32+AG32+AL32+AP32 -> 641.10 | E32: =+I32+M32+R32+U32+Y32+AB32+AF32+AK32+AO32+AS32 -> 134 | F32: =+(G32+H32)+(0.5*I32) -> 74.22 | G32: 37.46 | H32: 36.76 | I32: 0 | J32: =+(K32+L32)+0.5*M32 -> 48.99 | K32: 18.24 | L32: 23.75 | M32: 14 | N32: =+(O32+P32+Q32)+0.5*R32 -> 61.11 | O32: 13.07 | P32: 22.71 | Q32: 25.33 | R32: 0 | S32: =+(T32)+0.5*U32 -> 62.16 | T32: 62.16 | U32: 0 | V32: =+(W32+X32)+0.5*Y32 -> 34.16 | W32: 14.00 | X32: 10.66 | Y32: 19 | Z32: =+(AA32)+0.5*AB32 -> 94.85 | AA32: 83.85 | AB32: 22 | AC32: =+(AD32)+0.5*AF32 -> 23.07 | AD32: 20.57 | AE32: 15.95 | AF32: 5 | AG32: =+(AH32+AI32+AJ32)+0.5*AK32 -> 68.32 | AH32: 14.65 | AI32: 18.79 | AJ32: 29.38 | AK32: 11 | AL32: =+(AM32+AN32)+0.5*AO32 -> 81.49 | AM32: 32.87 | AN32: 34.62 | AO32: 28 | AP32: =+(AQ32+AR32)+0.5*AS32 -> 92.73 | AQ32: 35.67 | AR32: 39.56 | AS32: 35
A33: 23 | B33: Jones, Nate | C33: L | D33: =+F33+J33+N33+S33+V33+Z33+AC33+AG33+AL33+AP33 -> 661.30 | E33: =+I33+M33+R33+U33+Y33+AB33+AF33+AK33+AO33+AS33 -> 80 | F33: =+(G33+H33)+(0.5*I33) -> 105.10 | G33: 69.88 | H33: 35.22 | I33: 0 | J33: =+(K33+L33)+0.5*M33 -> 51.54 | K33: 34.05 | L33: 15.49 | M33: 4 | N33: =+(O33+P33+Q33)+0.5*R33 -> 41.72 | O33: 14.62 | P33: 9.00 | Q33: 18.10 | R33: 0 | S33: =+(T33)+0.5*U33 -> 68.82 | T33: 68.82 | U33: 0 | V33: =+(W33+X33)+0.5*Y33 -> 41.84 | W33: 19.28 | X33: 20.06 | Y33: 5 | Z33: =+(AA33)+0.5*AB33 -> 77.91 | AA33: 74.91 | AB33: 6 | AC33: =+(AD33)+0.5*AF33 -> 23.97 | AD33: 23.97 | AE33: 18.71 | AF33: 0 | AG33: =+(AH33+AI33+AJ33)+0.5*AK33 -> 66.07 | AH33: 16.38 | AI33: 14.55 | AJ33: 33.64 | AK33: 3 | AL33: =+(AM33+AN33)+0.5*AO33 -> 69.34 | AM33: 26.21 | AN33: 24.63 | AO33: 37 | AP33: =+(AQ33+AR33)+0.5*AS33 -> 114.99 | AQ33: 57.69 | AR33: 44.80 | AS33: 25
A34: 24 | B34: Greenfield, Don | C34: L | D34: =+F34+J34+N34+S34+V34+Z34+AC34+AG34+AL34+AP34 -> 663.06 | E34: =+I34+M34+R34+U34+Y34+AB34+AF34+AK34+AO34+AS34 -> 107 | F34: =+(G34+H34)+(0.5*I34) -> 61.08 | G34: 36.23 | H34: 24.85 | I34: 0 | J34: =+(K34+L34)+0.5*M34 -> 50.71 | K34: 20.61 | L34: 27.10 | M34: 6 | N34: =+(O34+P34+Q34)+0.5*R34 -> 65.56 | O34: 21.20 | P34: 28.32 | Q34: 11.04 | R34: 10 | S34: =+(T34)+0.5*U34 -> 56.08 | T34: 56.08 | U34: 0 | V34: =+(W34+X34)+0.5*Y34 -> 37.75 | W34: 15.55 | X34: 9.20 | Y34: 26 | Z34: =+(AA34)+0.5*AB34 -> 89.13 | AA34: 85.13 | AB34: 8 | AC34: =+(AD34)+0.5*AF34 -> 33.69 | AD34: 33.69 | AE34: 38.32* | AF34: 0 | AG34: =+(AH34+AI34+AJ34)+0.5*AK34 -> 64.67 | AH34: 14.33 | AI34: 19.44 | AJ34: 27.90 | AK34: 6 | AL34: =+(AM34+AN34)+0.5*AO34 -> 79.95 | AM34: 39.05 | AN34: 32.90 | AO34: 16 | AP34: =+(AQ34+AR34)+0.5*AS34 -> 124.44 | AQ34: 56.93 | AR34: 50.01 | AS34: 35
A35: 25 | B35: Bunten, James | C35: L | D35: =+F35+J35+N35+S35+V35+Z35+AC35+AG35+AL35+AP35 -> 678.18 | E35: =+I35+M35+R35+U35+Y35+AB35+AF35+AK35+AO35+AS35 -> 176 | F35: =+(G35+H35)+(0.5*I35) -> 77.23 | G35: 38.56 | H35: 38.67 | I35: 0 | J35: =+(K35+L35)+0.5*M35 -> 40.39 | K35: 14.14 | L35: 12.75 | M35: 27 | N35: =+(O35+P35+Q35)+0.5*R35 -> 66.75 | O35: 16.50 | P35: 17.45 | Q35: 27.80 | R35: 10 | S35: =+(T35)+0.5*U35 -> 49.86 | T35: 49.86 | U35: 0 | V35: =+(W35+X35)+0.5*Y35 -> 39.99 | W35: 14.01 | X35: 13.98 | Y35: 24 | Z35: =+(AA35)+0.5*AB35 -> 106.82 | AA35: 96.32 | AB35: 21 | AC35: =+(AD35)+0.5*AF35 -> 18.75 | AD35: 18.75 | AE35: 42.48 | AF35: 0 | AG35: =+(AH35+AI35+AJ35)+0.5*AK35 -> 73.35 | AH35: 13.33 | AI35: 21.42 | AJ35: 29.60 | AK35: 18 | AL35: =+(AM35+AN35)+0.5*AO35 -> 102.15 | AM35: 56.72 | AN35: 37.43 | AO35: 16 | AP35: =+(AQ35+AR35)+0.5*AS35 -> 102.89 | AQ35: 36.51 | AR35: 36.38 | AS35: 60
A36: 26 | B36: Peterson, Jared | C36: L | D36: =+F36+J36+N36+S36+V36+Z36+AC36+AG36+AL36+AP36 -> 688.42 | E36: =+I36+M36+R36+U36+Y36+AB36+AF36+AK36+AO36+AS36 -> 138 | F36: =+(G36+H36)+(0.5*I36) -> 60.80 | G36: 29.30 | H36: 31.50 | I36: 0 | J36: =+(K36+L36)+0.5*M36 -> 64.55 | K36: 31.01 | L36: 30.54 | M36: 6 | N36: =+(O36+P36+Q36)+0.5*R36 -> 48.66 | O36: 14.93 | P36: 20.25 | Q36: 13.48 | R36: 0 | S36: =+(T36)+0.5*U36 -> 40.50 | T36: 40.50 | U36: 0 | V36: =+(W36+X36)+0.5*Y36 -> 48.71 | W36: 11.63 | X36: 16.08 | Y36: 42 | Z36: =+(AA36)+0.5*AB36 -> 115.91 | AA36: 99.41 | AB36: 33 | AC36: =+(AD36)+0.5*AF36 -> 35.29 | AD36: 35.29 | AE36: 36.84* | AF36: 0 | AG36: =+(AH36+AI36+AJ36)+0.5*AK36 -> 79.82 | AH36: 21.60 | AI36: 18.55 | AJ36: 32.17 | AK36: 15 | AL36: =+(AM36+AN36)+0.5*AO36 -> 87.16 | AM36: 38.01 | AN36: 33.15 | AO36: 32 | AP36: =+(AQ36+AR36)+0.5*AS36 -> 107.02 | AQ36: 59.37 | AR36: 42.65 | AS36: 10
A37: 27 | B37: Andrus, Jay | C37: L | D37: =+F37+J37+N37+S37+V37+Z37+AC37+AG37+AL37+AP37 -> 695.12 | E37: =+I37+M37+R37+U37+Y37+AB37+AF37+AK37+AO37+AS37 -> 166 | F37: =+(G37+H37)+(0.5*I37) -> 78.10 | G37: 33.72 | H37: 44.38 | I37: 0 | J37: =+(K37+L37)+0.5*M37 -> 61.09 | K37: 21.09 | L37: 34.50 | M37: 11 | N37: =+(O37+P37+Q37)+0.5*R37 -> 68.54 | O37: 25.46 | P37: 18.59 | Q37: 24.49 | R37: 0 | S37: =+(T37)+0.5*U37 -> 57.49 | T37: 57.49 | U37: 0 | V37: =+(W37+X37)+0.5*Y37 -> 29.98 | W37: 14.30 | X37: 14.18 | Y37: 3 | Z37: =+(AA37)+0.5*AB37 -> 85.22 | AA37: 67.22 | AB37: 36 | AC37: =+(AD37)+0.5*AF37 -> 48.50 | AD37: 33.50 | AE37: 17.43 | AF37: 30 | AG37: =+(AH37+AI37+AJ37)+0.5*AK37 -> 74.41 | AH37: 13.11 | AI37: 18.45 | AJ37: 37.35 | AK37: 11 | AL37: =+(AM37+AN37)+0.5*AO37 -> 85.05 | AM37: 32.91 | AN37: 34.64 | AO37: 35 | AP37: =+(AQ37+AR37)+0.5*AS37 -> 106.74 | AQ37: 48.23 | AR37: 38.51 | AS37: 40
A38: 28 | B38: Garcia, Dan | C38: L | D38: =+F38+J38+N38+S38+V38+Z38+AC38+AG38+AL38+AP38 -> 759.88 | E38: =+I38+M38+R38+U38+Y38+AB38+AF38+AK38+AO38+AS38 -> 135 | F38: =+(G38+H38)+(0.5*I38) -> 64.52 | G38: 33.05 | H38: 31.47 | I38: 0 | J38: =+(K38+L38)+0.5*M38 -> 69.59 | K38: 27.18 | L38: 37.91 | M38: 9 | N38: =+(O38+P38+Q38)+0.5*R38 -> 69.28 | O38: 24.00 | P38: 29.23 | Q38: 16.05 | R38: 0 | S38: =+(T38)+0.5*U38 -> 50.66 | T38: 50.66 | U38: 0 | V38: =+(W38+X38)+0.5*Y38 -> 46.65 | W38: 14.90 | X38: 19.75 | Y38: 24 | Z38: =+(AA38)+0.5*AB38 -> 98.94 | AA38: 87.94 | AB38: 22 | AC38: =+(AD38)+0.5*AF38 -> 38.81 | AD38: 38.81 | AE38: 30.90* | AF38: 0 | AG38: =+(AH38+AI38+AJ38)+0.5*AK38 -> 83.35 | AH38: 16.16 | AI38: 26.46 | AJ38: 35.23 | AK38: 11 | AL38: =+(AM38+AN38)+0.5*AO38 -> 91.86 | AM38: 36.40 | AN38: 43.46 | AO38: 24 | AP38: =+(AQ38+AR38)+0.5*AS38 -> 146.22 | AQ38: 54.36 | AR38: 69.36 | AS38: 45
A39: 29 | B39: Hird, Chris | C39: L | D39: =+F39+J39+N39+S39+V39+Z39+AC39+AG39+AL39+AP39 -> 791.07 | E39: =+I39+M39+R39+U39+Y39+AB39+AF39+AK39+AO39+AS39 -> 187 | F39: =+(G39+H39)+(0.5*I39) -> 23.12 | G39: 9.43 | H39: 13.69 | I39: 0 | J39: =+(K39+L39)+0.5*M39 -> 62.28 | K39: 16.78 | L39: 29.00 | M39: 33 | N39: =+(O39+P39+Q39)+0.5*R39 -> 80.30 | O39: 28.10 | P39: 17.87 | Q39: 34.33 | R39: 0 | S39: =+(T39)+0.5*U39 -> 38.22 | T39: 38.22 | U39: 0 | V39: =+(W39+X39)+0.5*Y39 -> 43.15 | W39: 15.25 | X39: 23.40 | Y39: 9 | Z39: =+(AA39)+0.5*AB39 -> 144.49 | AA39: 128.99 | AB39: 31 | AC39: =+(AD39)+0.5*AF39 -> 61.90 | AD39: 61.90 | AE39: 17.24 | AF39: 0 | AG39: =+(AH39+AI39+AJ39)+0.5*AK39 -> 80.72 | AH39: 21.45 | AI39: 16.70 | AJ39: 37.07 | AK39: 11 | AL39: =+(AM39+AN39)+0.5*AO39 -> 100.53 | AM39: 43.90 | AN39: 32.63 | AO39: 48 | AP39: =+(AQ39+AR39)+0.5*AS39 -> 156.36 | AQ39: 72.45 | AR39: 56.41 | AS39: 55
A40: 30 | B40: Risbeck, Carl | C40: L | D40: =+F40+J40+N40+S40+V40+Z40+AC40+AG40+AL40+AP40 -> 1011.81 | E40: =+I40+M40+R40+U40+Y40+AB40+AF40+AK40+AO40+AS40 -> 283 | F40: =+(G40+H40)+(0.5*I40) -> 114.71 | G40: 36.12 | H40: 71.09 | I40: 15 | J40: =+(K40+L40)+0.5*M40 -> 59.30 | K40: 25.78 | L40: 21.52 | M40: 24 | N40: =+(O40+P40+Q40)+0.5*R40 -> 139.76 | O40: 50.88 | P40: 44.79 | Q40: 39.09 | R40: 10 | S40: =+(T40)+0.5*U40 -> 71.81 | T40: 71.81 | U40: 0 | V40: =+(W40+X40)+0.5*Y40 -> 73.35 | W40: 18.63 | X40: 29.22 | Y40: 51 | Z40: =+(AA40)+0.5*AB40 -> 144.19 | AA40: 117.69 | AB40: 53 | AC40: =+(AD40)+0.5*AF40 -> 36.25 | AD40: 36.25 | AE40: 19.52 | AF40: 0 | AG40: =+(AH40+AI40+AJ40)+0.5*AK40 -> 109.22 | AH40: 20.94 | AI40: 35.85 | AJ40: 39.93 | AK40: 25 | AL40: =+(AM40+AN40)+0.5*AO40 -> 119.03 | AM40: 45.22 | AN40: 53.81 | AO40: 40 | AP40: =+(AQ40+AR40)+0.5*AS40 -> 144.19 | AQ40: 56.70 | AR40: 54.99 | AS40: 65
A41: 31 | B41: Cox, Roger | C41: L | D41: DNF | E41: DNF | F41: =+(G41+H41)+(0.5*I41) -> 32.10 | G41: 13.73 | H41: 8.37 | I41: 20 | J41: =+(K41+L41)+0.5*M41 -> 41.57 | K41: 22.30 | L41: 11.27 | M41: 16 | N41: =+(O41+P41+Q41)+0.5*R41 -> 42.68 | O41: 13.91 | P41: 13.33 | Q41: 10.44 | R41: 10 | S41: =+(T41)+0.5*U41 -> 36.30 | T41: 36.30 | U41: 0 | V41: =+(W41+X41)+0.5*Y41 -> 34.53 | W41: 13.29 | X41: 15.74 | Y41: 11 | Z41: DNF | AA41: DNF | AB41: DNF | AC41: =+(AD41)+0.5*AF41 -> 21.26 | AD41: 21.26 | AE41: 10.21 | AF41: 0 | AG41: =+(AH41+AI41+AJ41)+0.5*AK41 -> 63.76 | AH41: 15.64 | AI41: 14.84 | AJ41: 20.78 | AK41: 25 | AL41: =+(AM41+AN41)+0.5*AO41 -> 111.76 | AM41: 61.37 | AN41: 32.39 | AO41: 36 | AP41: =+(AQ41+AR41)+0.5*AS41 -> 102.09 | AQ41: 23.98 | AR41: 68.11 | AS41: 20
A42: 32 | B42: DeCiccio, Mike | C42: L | D42: DNF | E42: DNF | F42: =+(G42+H42)+(0.5*I42) -> 94.77 | G42: 69.92 | H42: 24.85 | I42: 0 | J42: =+(K42+L42)+0.5*M42 -> 62.01 | K42: 37.03 | L42: 21.98 | M42: 6 | N42: =+(O42+P42+Q42)+0.5*R42 -> 42.12 | O42: 14.69 | P42: 13.63 | Q42: 13.80 | R42: 0 | S42: =+(T42)+0.5*U42 -> 53.51 | T42: 53.51 | U42: 0 | V42: =+(W42+X42)+0.5*Y42 -> 45.65 | W42: 16.65 | X42: 18.50 | Y42: 21 | Z42: DNF | AA42: DNF | AB42: DNF | AC42: DNF | AD42: DNF | AE42: DNF | AF42: DNF | AG42: DNF | AH42: DNF | AI42: DNF | AJ42: DNF | AK42: DNF | AL42: =+(AM42+AN42)+0.5*AO42 -> 96.17 | AM42: 25.66 | AN42: 59.01 | AO42: 23 | AP42: =+(AQ42+AR42)+0.5*AS42 -> 134.67 | AQ42: 65.00 | AR42: 47.17 | AS42: 45
A43: Notes:
A44: - | B44: Open Division is for any shooter that was using an optical sighting device on any of their weapons. Limited Division is for all other shooters no matter what caliber, gauge or configuration of weapon.
A45: - | B45: Points Down = .5 seconds x Points Down. PD Total is added to the total Stage time.
A46: XX | B46: Indicates that the Points Down value includes some kind of penalty (Procedural Error, Hits on Non-Threat or Failure to Neutralize).
A47: DNF | B47: = Did Not Finish
A48: * | B48: Shooters noted with an * shot String 2 the same as String 1 except all shots were from the weak side.
A49: ** | B49: All "Failure to Neutralize" penalties were removed from Stage 10. IDPA rules indicate that you cannot assess this penalty if the stage is Limited Vickers.