A2: UDPL Match Results for May 22, 2004 | J2: (Sorted by Overall Time without regard for Division.)
A3: Pistol Match - Note: This was NOT an IDPA match.
B4: Click here for results by Division. | F4: Click on Stage # for COF description.
A5: Place | B5: Name | C5: *DIV | D5: Shoot | E5: Total PD | F5: Stage 1 | G5: String | H5: String | I5: PD | J5: Stage 2 | K5: String | L5: String | M5: String | N5: String | O5: PD | P5: Stage 3 | Q5: String | R5: PD | S5: Stage 4 | T5: String | U5: String | V5: String | W5: PD | X5: Stage 5 | Y5: String | Z5: String | AA5: PD | AB5: Stage 6 | AC5: String | AD5: String | AE5: String | AF5: PD
D6: Total | G6: 1 | H6: 2 | K6: 1 | L6: 2 | M6: 3 | N6: 4 | Q6: 1 | T6: 1 | U6: 2 | V6: 3 | Y6: 1 | Z6: 2 | AC6: 1 | AD6: 2 | AE6: 3
A7: 1 | B7: Terry, Blaine | C7: REVOP | D7: =+F7+J7+P7+S7+X7+AB7 -> 161.36 | E7: =+I7+O7+R7+W7+AA7+AF7 -> 23 | F7: =+(G7+H7)+I7*0.5 -> 34.12 | G7: 12.30 | H7: 17.32 | I7: 9 | J7: =+(K7+L7+M7+N7)+O7*0.5 -> 10.38 | K7: 2.50 | L7: 2.49 | M7: 3.01 | N7: 2.38 | O7: 0 | P7: =+Q7+(R7*0.5) -> 27.28 | Q7: 26.78 | R7: 1 | S7: =+(T7+U7+V7)+W7*0.5 -> 26.30 | T7: 8.66 | U7: 8.37 | V7: 7.27 | W7: 4 | X7: =+(Y7+Z7)+AA7*0.5 -> 34.39 | Y7: 16.19 | Z7: 17.20 | AA7: 2 | AB7: =+(AC7+AD7+AE7)+AF7*0.5 -> 28.89 | AC7: 8.26 | AD7: 9.58 | AE7: 7.55 | AF7: 7
A8: 2 | B8: Latham, Corey | C8: TRM | D8: =+F8+J8+P8+S8+X8+AB8 -> 175.47 | E8: =+I8+O8+R8+W8+AA8+AF8 -> 27 | F8: =+(G8+H8)+I8*0.5 -> 31.09 | G8: 11.92 | H8: 16.17 | I8: 6 | J8: =+(K8+L8+M8+N8)+O8*0.5 -> 14.42 | K8: 3.51 | L8: 3.46 | M8: 3.97 | N8: 3.48 | O8: 0 | P8: =+Q8+(R8*0.5) -> 31.97 | Q8: 31.97 | R8: 0 | S8: =+(T8+U8+V8)+W8*0.5 -> 22.75 | T8: 6.16 | U8: 6.62 | V8: 6.47 | W8: 7 | X8: =+(Y8+Z8)+AA8*0.5 -> 50.37 | Y8: 27.71 | Z8: 21.16 | AA8: 3 | AB8: =+(AC8+AD8+AE8)+AF8*0.5 -> 24.87 | AC8: 6.17 | AD8: 6.38 | AE8: 6.82 | AF8: 11
A9: 3 | B9: Terry, Blaine | C9: HiCAP | D9: =+F9+J9+P9+S9+X9+AB9 -> 180.37 | E9: =+I9+O9+R9+W9+AA9+AF9 -> 90 | F9: =+(G9+H9)+I9*0.5 -> 46.92 | G9: 15.11 | H9: 18.31 | I9: 27 | J9: =+(K9+L9+M9+N9)+O9*0.5 -> 18.09 | K9: 3.68 | L9: 4.12 | M9: 4.64 | N9: 5.65 | O9: 0 | P9: =+Q9+(R9*0.5) -> 19.05 | Q9: 18.55 | R9: 1 | S9: =+(T9+U9+V9)+W9*0.5 -> 28.76 | T9: 4.89 | U9: 5.08 | V9: 4.29 | W9: 29 | X9: =+(Y9+Z9)+AA9*0.5 -> 38.78 | Y9: 22.18 | Z9: 15.10 | AA9: 3 | AB9: =+(AC9+AD9+AE9)+AF9*0.5 -> 28.77 | AC9: 5.11 | AD9: 4.23 | AE9: 4.43 | AF9: 30
A10: 4 | B10: Collins, Ken | C10: OPEN | D10: =+F10+J10+P10+S10+X10+AB10 -> 185.39 | E10: =+I10+O10+R10+W10+AA10+AF10 -> 44 | F10: =+(G10+H10)+I10*0.5 -> 26.43 | G10: 12.49 | H10: 13.44 | I10: 1 | J10: =+(K10+L10+M10+N10)+O10*0.5 -> 19.33 | K10: 5.59 | L10: 4.88 | M10: 4.82 | N10: 4.04 | O10: 0 | P10: =+Q10+(R10*0.5) -> 26.74 | Q10: 26.74 | R10: 0 | S10: =+(T10+U10+V10)+W10*0.5 -> 24.68 | T10: 8.08 | U10: 6.89 | V10: 7.71 | W10: 4 | X10: =+(Y10+Z10)+AA10*0.5 -> 48.70 | Y10: 30.36 | Z10: 16.84 | AA10: 3 | AB10: =+(AC10+AD10+AE10)+AF10*0.5 -> 39.51 | AC10: 6.80 | AD10: 7.26 | AE10: 7.45 | AF10: 36
A11: 5 | B11: Terry, Mark | C11: REVOP | D11: =+F11+J11+P11+S11+X11+AB11 -> 193.17 | E11: =+I11+O11+R11+W11+AA11+AF11 -> 14 | F11: =+(G11+H11)+I11*0.5 -> 34.80 | G11: 12.51 | H11: 20.29 | I11: 4 | J11: =+(K11+L11+M11+N11)+O11*0.5 -> 13.75 | K11: 2.99 | L11: 3.80 | M11: 3.39 | N11: 3.57 | O11: 0 | P11: =+Q11+(R11*0.5) -> 30.77 | Q11: 30.27 | R11: 1 | S11: =+(T11+U11+V11)+W11*0.5 -> 32.08 | T11: 8.23 | U11: 12.28 | V11: 9.57 | W11: 4 | X11: =+(Y11+Z11)+AA11*0.5 -> 45.51 | Y11: 25.00 | Z11: 20.51 | AA11: 0 | AB11: =+(AC11+AD11+AE11)+AF11*0.5 -> 36.26 | AC11: 10.77 | AD11: 11.87 | AE11: 11.12 | AF11: 5
A12: 6 | B12: Terry, Dale | C12: REVOP | D12: =+F12+J12+P12+S12+X12+AB12 -> 211.03 | E12: =+I12+O12+R12+W12+AA12+AF12 -> 50 | F12: =+(G12+H12)+I12*0.5 -> 42.13 | G12: 13.82 | H12: 27.81 | I12: 1 | J12: =+(K12+L12+M12+N12)+O12*0.5 -> 28.06 | K12: 3.21 | L12: 7.96 | M12: 8.09 | N12: 3.80 | O12: 10 | P12: =+Q12+(R12*0.5) -> 26.04 | Q12: 26.04 | R12: 0 | S12: =+(T12+U12+V12)+W12*0.5 -> 32.39 | T12: 8.34 | U12: 9.89 | V12: 8.16 | W12: 12 | X12: =+(Y12+Z12)+AA12*0.5 -> 49.14 | Y12: 21.92 | Z12: 21.22 | AA12: 12 | AB12: =+(AC12+AD12+AE12)+AF12*0.5 -> 33.27 | AC12: 7.90 | AD12: 8.94 | AE12: 8.93 | AF12: 15
A13: 7 | B13: Lowe, John | C13: HiCAP | D13: =+F13+J13+P13+S13+X13+AB13 -> 212.55 | E13: =+I13+O13+R13+W13+AA13+AF13 -> 65 | F13: =+(G13+H13)+I13*0.5 -> 34.44 | G13: 13.89 | H13: 16.05 | I13: 9 | J13: =+(K13+L13+M13+N13)+O13*0.5 -> 24.06 | K13: 6.82 | L13: 7.05 | M13: 4.88 | N13: 5.31 | O13: 0 | P13: =+Q13+(R13*0.5) -> 31.74 | Q13: 30.24 | R13: 3 | S13: =+(T13+U13+V13)+W13*0.5 -> 34.22 | T13: 8.87 | U13: 8.70 | V13: 7.15 | W13: 19 | X13: =+(Y13+Z13)+AA13*0.5 -> 59.85 | Y13: 23.76 | Z13: 25.59 | AA13: 21 | AB13: =+(AC13+AD13+AE13)+AF13*0.5 -> 28.24 | AC13: 7.40 | AD13: 7.70 | AE13: 6.64 | AF13: 13
A14: 8 | B14: Vollmer, Phillip | C14: TRM | D14: =+F14+J14+P14+S14+X14+AB14 -> 215.32 | E14: =+I14+O14+R14+W14+AA14+AF14 -> 50 | F14: =+(G14+H14)+I14*0.5 -> 38.34 | G14: 15.97 | H14: 21.37 | I14: 2 | J14: =+(K14+L14+M14+N14)+O14*0.5 -> 20.55 | K14: 4.41 | L14: 5.63 | M14: 5.77 | N14: 4.74 | O14: 0 | P14: =+Q14+(R14*0.5) -> 29.41 | Q14: 28.41 | R14: 2 | S14: =+(T14+U14+V14)+W14*0.5 -> 38.24 | T14: 7.30 | U14: 7.01 | V14: 7.43 | W14: 33 | X14: =+(Y14+Z14)+AA14*0.5 -> 59.61 | Y14: 28.65 | Z14: 29.96 | AA14: 2 | AB14: =+(AC14+AD14+AE14)+AF14*0.5 -> 29.17 | AC14: 7.64 | AD14: 8.46 | AE14: 7.57 | AF14: 11
A15: 9 | B15: Correia, Larry | C15: HiCAP | D15: =+F15+J15+P15+S15+X15+AB15 -> 255.60 | E15: =+I15+O15+R15+W15+AA15+AF15 -> 102 | F15: =+(G15+H15)+I15*0.5 -> 51.67 | G15: 19.28 | H15: 22.89 | I15: 19 | J15: =+(K15+L15+M15+N15)+O15*0.5 -> 30.62 | K15: 7.75 | L15: 10.40 | M15: 7.72 | N15: 4.75 | O15: 0 | P15: =+Q15+(R15*0.5) -> 42.59 | Q15: 42.09 | R15: 1 | S15: =+(T15+U15+V15)+W15*0.5 -> 36.50 | T15: 5.46 | U15: 5.25 | V15: 5.29 | W15: 41 | X15: =+(Y15+Z15)+AA15*0.5 -> 64.86 | Y15: 34.04 | Z15: 24.32 | AA15: 13 | AB15: =+(AC15+AD15+AE15)+AF15*0.5 -> 29.36 | AC15: 5.37 | AD15: 5.22 | AE15: 4.77 | AF15: 28
A16: 10 | B16: Redford, "Red" | C16: TRM | D16: =+F16+J16+P16+S16+X16+AB16 -> 258.99 | E16: =+I16+O16+R16+W16+AA16+AF16 -> 67 | F16: =+(G16+H16)+I16*0.5 -> 45.23 | G16: 16.60 | H16: 22.63 | I16: 12 | J16: =+(K16+L16+M16+N16)+O16*0.5 -> 32.53 | K16: 9.23 | L16: 6.69 | M16: 7.99 | N16: 8.62 | O16: 0 | P16: =+Q16+(R16*0.5) -> 47.06 | Q16: 46.06 | R16: 2 | S16: =+(T16+U16+V16)+W16*0.5 -> 34.07 | T16: 7.40 | U16: 7.41 | V16: 6.76 | W16: 25 | X16: =+(Y16+Z16)+AA16*0.5 -> 73.58 | Y16: 33.01 | Z16: 33.07 | AA16: 15 | AB16: =+(AC16+AD16+AE16)+AF16*0.5 -> 26.52 | AC16: 6.59 | AD16: 6.39 | AE16: 7.04 | AF16: 13
A17: 11 | B17: Rodriguez, Mike | C17: TRM | D17: =+F17+J17+P17+S17+X17+AB17 -> 262.53 | E17: =+I17+O17+R17+W17+AA17+AF17 -> 108 | F17: =+(G17+H17)+I17*0.5 -> 61.63 | G17: 26.07 | H17: 30.56 | I17: 10 | J17: =+(K17+L17+M17+N17)+O17*0.5 -> 20.18 | K17: 5.73 | L17: 5.09 | M17: 5.01 | N17: 4.35 | O17: 0 | P17: =+Q17+(R17*0.5) -> 33.58 | Q17: 32.58 | R17: 2 | S17: =+(T17+U17+V17)+W17*0.5 -> 36.30 | T17: 6.65 | U17: 7.00 | V17: 7.15 | W17: 31 | X17: =+(Y17+Z17)+AA17*0.5 -> 64.72 | Y17: 28.06 | Z17: 27.66 | AA17: 18 | AB17: =+(AC17+AD17+AE17)+AF17*0.5 -> 46.12 | AC17: 7.80 | AD17: 7.89 | AE17: 6.93 | AF17: 47
A18: 12 | B18: Mousley, Roger | C18: TRM | D18: =+F18+J18+P18+S18+X18+AB18 -> 268.13 | E18: =+I18+O18+R18+W18+AA18+AF18 -> 72 | F18: =+(G18+H18)+I18*0.5 -> 52.97 | G18: 25.15 | H18: 25.32 | I18: 5 | J18: =+(K18+L18+M18+N18)+O18*0.5 -> 25.99 | K18: 7.15 | L18: 5.65 | M18: 5.52 | N18: 7.67 | O18: 0 | P18: =+Q18+(R18*0.5) -> 51.51 | Q18: 49.51 | R18: 4 | S18: =+(T18+U18+V18)+W18*0.5 -> 34.85 | T18: 8.22 | U18: 8.66 | V18: 8.47 | W18: 19 | X18: =+(Y18+Z18)+AA18*0.5 -> 55.48 | Y18: 27.49 | Z18: 24.49 | AA18: 7 | AB18: =+(AC18+AD18+AE18)+AF18*0.5 -> 47.33 | AC18: 10.70 | AD18: 9.84 | AE18: 8.29 | AF18: 37
A19: 13 | B19: Scott, Alan | C19: TRM | D19: =+F19+J19+P19+S19+X19+AB19 -> 271.44 | E19: =+I19+O19+R19+W19+AA19+AF19 -> 40 | F19: =+(G19+H19)+I19*0.5 -> 54.62 | G19: 17.37 | H19: 31.75 | I19: 11 | J19: =+(K19+L19+M19+N19)+O19*0.5 -> 28.70 | K19: 7.71 | L19: 5.73 | M19: 6.73 | N19: 8.53 | O19: 0 | P19: =+Q19+(R19*0.5) -> 47.09 | Q19: 45.59 | R19: 3 | S19: =+(T19+U19+V19)+W19*0.5 -> 37.01 | T19: 11.95 | U19: 8.67 | V19: 8.39 | W19: 16 | X19: =+(Y19+Z19)+AA19*0.5 -> 71.11 | Y19: 42.06 | Z19: 26.55 | AA19: 5 | AB19: =+(AC19+AD19+AE19)+AF19*0.5 -> 32.91 | AC19: 8.06 | AD19: 15.06 | AE19: 7.29 | AF19: 5
A20: 14 | B20: Zaccardi, Pat | C20: TRM | D20: =+F20+J20+P20+S20+X20+AB20 -> 279.82 | E20: =+I20+O20+R20+W20+AA20+AF20 -> 114 | F20: =+(G20+H20)+I20*0.5 -> 54.20 | G20: 15.96 | H20: 26.74 | I20: 23 | J20: =+(K20+L20+M20+N20)+O20*0.5 -> 23.87 | K20: 6.05 | L20: 6.23 | M20: 5.68 | N20: 5.91 | O20: 0 | P20: =+Q20+(R20*0.5) -> 38.72 | Q20: 35.22 | R20: 7 | S20: =+(T20+U20+V20)+W20*0.5 -> 48.12 | T20: 11.38 | U20: 11.92 | V20: 9.82 | W20: 30 | X20: =+(Y20+Z20)+AA20*0.5 -> 67.76 | Y20: 27.73 | Z20: 30.53 | AA20: 19 | AB20: =+(AC20+AD20+AE20)+AF20*0.5 -> 47.15 | AC20: 8.49 | AD20: 11.12 | AE20: 10.04 | AF20: 35
A21: 15 | B21: Brown, Keith | C21: TRM | D21: =+F21+J21+P21+S21+X21+AB21 -> 290.63 | E21: =+I21+O21+R21+W21+AA21+AF21 -> 63 | F21: =+(G21+H21)+I21*0.5 -> 56.41 | G21: 16.57 | H21: 35.84 | I21: 8 | J21: =+(K21+L21+M21+N21)+O21*0.5 -> 21.91 | K21: 5.23 | L21: 5.77 | M21: 6.71 | N21: 4.20 | O21: 0 | P21: =+Q21+(R21*0.5) -> 57.88 | Q21: 56.88 | R21: 2 | S21: =+(T21+U21+V21)+W21*0.5 -> 47.94 | T21: 15.45 | U21: 13.00 | V21: 12.49 | W21: 14 | X21: =+(Y21+Z21)+AA21*0.5 -> 68.26 | Y21: 31.89 | Z21: 33.37 | AA21: 6 | AB21: =+(AC21+AD21+AE21)+AF21*0.5 -> 38.23 | AC21: 7.65 | AD21: 7.36 | AE21: 6.72 | AF21: 33
A22: 16 | B22: Scott, Michael | C22: TRM | D22: =+F22+J22+P22+S22+X22+AB22 -> 301.61 | E22: =+I22+O22+R22+W22+AA22+AF22 -> 55 | F22: =+(G22+H22)+I22*0.5 -> 72.15 | G22: 23.01 | H22: 43.64 | I22: 11 | J22: =+(K22+L22+M22+N22)+O22*0.5 -> 25.34 | K22: 7.49 | L22: 4.93 | M22: 5.32 | N22: 7.60 | O22: 0 | P22: =+Q22+(R22*0.5) -> 55.86 | Q22: 53.36 | R22: 5 | S22: =+(T22+U22+V22)+W22*0.5 -> 43.23 | T22: 10.80 | U22: 9.88 | V22: 11.55 | W22: 22 | X22: =+(Y22+Z22)+AA22*0.5 -> 75.35 | Y22: 35.82 | Z22: 35.03 | AA22: 9 | AB22: =+(AC22+AD22+AE22)+AF22*0.5 -> 29.68 | AC22: 9.13 | AD22: 9.18 | AE22: 7.37 | AF22: 8
A23: 17 | B23: Gurr, Gene | C23: HiCAP | D23: =+F23+J23+P23+S23+X23+AB23 -> 307.21 | E23: =+I23+O23+R23+W23+AA23+AF23 -> 84 | F23: =+(G23+H23)+I23*0.5 -> 55.47 | G23: 14.23 | H23: 37.24 | I23: 8 | J23: =+(K23+L23+M23+N23)+O23*0.5 -> 34.97 | K23: 7.53 | L23: 8.54 | M23: 10.19 | N23: 8.71 | O23: 0 | P23: =+Q23+(R23*0.5) -> 54.61 | Q23: 50.61 | R23: 8 | S23: =+(T23+U23+V23)+W23*0.5 -> 39.26 | T23: 8.68 | U23: 7.71 | V23: 7.87 | W23: 30 | X23: =+(Y23+Z23)+AA23*0.5 -> 76.09 | Y23: 38.03 | Z23: 32.56 | AA23: 11 | AB23: =+(AC23+AD23+AE23)+AF23*0.5 -> 46.81 | AC23: 17.14 | AD23: 7.61 | AE23: 8.56 | AF23: 27
A24: 18 | B24: Theodore, Ari | C24: TRM | D24: =+F24+J24+P24+S24+X24+AB24 -> 309.12 | E24: =+I24+O24+R24+W24+AA24+AF24 -> 109 | F24: =+(G24+H24)+I24*0.5 -> 35.75 | G24: 11.37 | H24: 15.88 | I24: 17 | J24: =+(K24+L24+M24+N24)+O24*0.5 -> 27.96 | K24: 9.83 | L24: 7.55 | M24: 6.22 | N24: 4.36 | O24: 0 | P24: =+Q24+(R24*0.5) -> 95.22 | Q24: 83.72 | R24: 23 | S24: =+(T24+U24+V24)+W24*0.5 -> 42.91 | T24: 8.11 | U24: 8.41 | V24: 8.89 | W24: 35 | X24: =+(Y24+Z24)+AA24*0.5 -> 67.26 | Y24: 32.14 | Z24: 28.62 | AA24: 13 | AB24: =+(AC24+AD24+AE24)+AF24*0.5 -> 40.02 | AC24: 7.77 | AD24: 10.09 | AE24: 11.66 | AF24: 21
A25: 19 | B25: Wimberly, Jeff | C25: TRM | D25: =+F25+J25+P25+S25+X25+AB25 -> 313.87 | E25: =+I25+O25+R25+W25+AA25+AF25 -> 81 | F25: =+(G25+H25)+I25*0.5 -> 53.03 | G25: 27.46 | H25: 17.57 | I25: 16 | J25: =+(K25+L25+M25+N25)+O25*0.5 -> 28.62 | K25: 9.28 | L25: 5.36 | M25: 8.59 | N25: 5.39 | O25: 0 | P25: =+Q25+(R25*0.5) -> 73.40 | Q25: 71.40 | R25: 4 | S25: =+(T25+U25+V25)+W25*0.5 -> 42.57 | T25: 10.21 | U25: 9.02 | V25: 8.84 | W25: 29 | X25: =+(Y25+Z25)+AA25*0.5 -> 75.28 | Y25: 36.66 | Z25: 34.62 | AA25: 8 | AB25: =+(AC25+AD25+AE25)+AF25*0.5 -> 40.97 | AC25: 10.28 | AD25: 9.94 | AE25: 8.75 | AF25: 24
A26: 20 | B26: Outzen, Craig | C26: TRM | D26: =+F26+J26+P26+S26+X26+AB26 -> 319.75 | E26: =+I26+O26+R26+W26+AA26+AF26 -> 152 | F26: =+(G26+H26)+I26*0.5 -> 70.22 | G26: 17.32 | H26: 39.40 | I26: 27 | J26: =+(K26+L26+M26+N26)+O26*0.5 -> 26.06 | K26: 6.09 | L26: 4.37 | M26: 5.02 | N26: 5.58 | O26: 10 | P26: =+Q26+(R26*0.5) -> 61.97 | Q26: 54.97 | R26: 14 | S26: =+(T26+U26+V26)+W26*0.5 -> 41.25 | T26: 7.86 | U26: 7.70 | V26: 7.69 | W26: 36 | X26: =+(Y26+Z26)+AA26*0.5 -> 78.09 | Y26: 34.40 | Z26: 32.19 | AA26: 23 | AB26: =+(AC26+AD26+AE26)+AF26*0.5 -> 42.16 | AC26: 7.65 | AD26: 7.26 | AE26: 6.25 | AF26: 42
A27: 21 | B27: Kirkham, Glade | C27: TRM | D27: =+F27+J27+P27+S27+X27+AB27 -> 326.91 | E27: =+I27+O27+R27+W27+AA27+AF27 -> 49 | F27: =+(G27+H27)+I27*0.5 -> 61.23 | G27: 28.03 | H27: 32.70 | I27: 1 | J27: =+(K27+L27+M27+N27)+O27*0.5 -> 30.62 | K27: 5.97 | L27: 11.07 | M27: 7.18 | N27: 6.40 | O27: 0 | P27: =+Q27+(R27*0.5) -> 78.38 | Q27: 76.38 | R27: 4 | S27: =+(T27+U27+V27)+W27*0.5 -> 39.59 | T27: 11.17 | U27: 11.08 | V27: 9.84 | W27: 15 | X27: =+(Y27+Z27)+AA27*0.5 -> 77.34 | Y27: 35.76 | Z27: 38.08 | AA27: 7 | AB27: =+(AC27+AD27+AE27)+AF27*0.5 -> 39.75 | AC27: 7.95 | AD27: 9.46 | AE27: 11.34 | AF27: 22
A28: 22 | B28: Redford, "Red" | C28: REV | D28: =+F28+J28+P28+S28+X28+AB28 -> 337.82 | E28: =+I28+O28+R28+W28+AA28+AF28 -> 58 | F28: =+(G28+H28)+I28*0.5 -> 63.90 | G28: 27.02 | H28: 34.38 | I28: 5 | J28: =+(K28+L28+M28+N28)+O28*0.5 -> 34.02 | K28: 8.95 | L28: 10.81 | M28: 4.66 | N28: 9.60 | O28: 0 | P28: =+Q28+(R28*0.5) -> 71.99 | Q28: 71.49 | R28: 1 | S28: =+(T28+U28+V28)+W28*0.5 -> 51.55 | T28: 12.51 | U28: 12.61 | V28: 15.43 | W28: 22 | X28: =+(Y28+Z28)+AA28*0.5 -> 74.51 | Y28: 30.82 | Z28: 36.19 | AA28: 15 | AB28: =+(AC28+AD28+AE28)+AF28*0.5 -> 41.85 | AC28: 12.13 | AD28: 10.95 | AE28: 11.27 | AF28: 15
A29: 23 | B29: Brownlee, Mike | C29: HiCAP | D29: =+F29+J29+P29+S29+X29+AB29 -> 340.04 | E29: =+I29+O29+R29+W29+AA29+AF29 -> 140 | F29: =+(G29+H29)+I29*0.5 -> 55.22 | G29: 20.88 | H29: 25.34 | I29: 18 | J29: =+(K29+L29+M29+N29)+O29*0.5 -> 37.02 | K29: 8.63 | L29: 10.64 | M29: 9.89 | N29: 7.86 | O29: 0 | P29: =+Q29+(R29*0.5) -> 56.50 | Q29: 54.50 | R29: 4 | S29: =+(T29+U29+V29)+W29*0.5 -> 45.68 | T29: 7.79 | U29: 7.50 | V29: 6.89 | W29: 47 | X29: =+(Y29+Z29)+AA29*0.5 -> 89.27 | Y29: 35.35 | Z29: 48.42 | AA29: 11 | AB29: =+(AC29+AD29+AE29)+AF29*0.5 -> 56.35 | AC29: 9.29 | AD29: 8.66 | AE29: 8.40 | AF29: 60
A30: 24 | B30: Simpson, Harold | C30: TRM | D30: =+F30+J30+P30+S30+X30+AB30 -> 358.61 | E30: =+I30+O30+R30+W30+AA30+AF30 -> 103 | F30: =+(G30+H30)+I30*0.5 -> 70.70 | G30: 30.61 | H30: 30.09 | I30: 20 | J30: =+(K30+L30+M30+N30)+O30*0.5 -> 38.34 | K30: 6.59 | L30: 6.26 | M30: 7.34 | N30: 18.15 | O30: 0 | P30: =+Q30+(R30*0.5) -> 75.93 | Q30: 74.43 | R30: 3 | S30: =+(T30+U30+V30)+W30*0.5 -> 64.45 | T30: 9.66 | U30: 8.80 | V30: 15.49 | W30: 61 | X30: =+(Y30+Z30)+AA30*0.5 -> 74.74 | Y30: 36.33 | Z30: 33.91 | AA30: 9 | AB30: =+(AC30+AD30+AE30)+AF30*0.5 -> 34.45 | AC30: 10.36 | AD30: 9.85 | AE30: 9.24 | AF30: 10
A31: 25 | B31: Case, James | C31: TRM | D31: =+F31+J31+P31+S31+X31+AB31 -> 382.79 | E31: =+I31+O31+R31+W31+AA31+AF31 -> 92 | F31: =+(G31+H31)+I31*0.5 -> 64.87 | G31: 30.21 | H31: 29.16 | I31: 11 | J31: =+(K31+L31+M31+N31)+O31*0.5 -> 40.52 | K31: 7.04 | L31: 6.89 | M31: 7.86 | N31: 18.73 | O31: 0 | P31: =+Q31+(R31*0.5) -> 85.84 | Q31: 71.34 | R31: 29 | S31: =+(T31+U31+V31)+W31*0.5 -> 45.01 | T31: 10.06 | U31: 8.82 | V31: 9.63 | W31: 33 | X31: =+(Y31+Z31)+AA31*0.5 -> 109.17 | Y31: 55.11 | Z31: 49.06 | AA31: 10 | AB31: =+(AC31+AD31+AE31)+AF31*0.5 -> 37.38 | AC31: 11.57 | AD31: 11.32 | AE31: 9.99 | AF31: 9
A32: 26 | B32: Crawford, George | C32: TRM | D32: =+F32+J32+P32+S32+X32+AB32 -> 412.04 | E32: =+I32+O32+R32+W32+AA32+AF32 -> 117 | F32: =+(G32+H32)+I32*0.5 -> 65.66 | G32: 24.28 | H32: 34.88 | I32: 13 | J32: =+(K32+L32+M32+N32)+O32*0.5 -> 55.74 | K32: 20.15 | L32: 15.88 | M32: 8.16 | N32: 11.55 | O32: 0 | P32: =+Q32+(R32*0.5) -> 86.04 | Q32: 82.04 | R32: 8 | S32: =+(T32+U32+V32)+W32*0.5 -> 57.87 | T32: 12.31 | U32: 12.55 | V32: 12.01 | W32: 42 | X32: =+(Y32+Z32)+AA32*0.5 -> 99.17 | Y32: 45.34 | Z32: 44.33 | AA32: 19 | AB32: =+(AC32+AD32+AE32)+AF32*0.5 -> 47.56 | AC32: 10.22 | AD32: 9.90 | AE32: 9.94 | AF32: 35
A33: 27 | B33: Kirkham, Devon | C33: TRM | D33: =+F33+J33+P33+S33+X33+AB33 -> 416.65 | E33: =+I33+O33+R33+W33+AA33+AF33 -> 179 | F33: =+(G33+H33)+I33*0.5 -> 66.97 | G33: 28.68 | H33: 33.29 | I33: 10 | J33: =+(K33+L33+M33+N33)+O33*0.5 -> 42.00 | K33: 10.97 | L33: 8.78 | M33: 9.71 | N33: 12.54 | O33: 0 | P33: =+Q33+(R33*0.5) -> 71.81 | Q33: 63.81 | R33: 16 | S33: =+(T33+U33+V33)+W33*0.5 -> 46.91 | T33: 9.91 | U33: 9.31 | V33: 10.69 | W33: 34 | X33: =+(Y33+Z33)+AA33*0.5 -> 118.74 | Y33: 38.04 | Z33: 41.70 | AA33: 78 | AB33: =+(AC33+AD33+AE33)+AF33*0.5 -> 70.22 | AC33: 32.91 | AD33: 9.26 | AE33: 7.55 | AF33: 41
A34: 28 | B34: Case, Morgan | C34: TRM | D34: =+F34+J34+P34+S34+X34+AB34 -> 450.31 | E34: =+I34+O34+R34+W34+AA34+AF34 -> 118 | F34: =+(G34+H34)+I34*0.5 -> 75.21 | G34: 33.53 | H34: 38.18 | I34: 7 | J34: =+(K34+L34+M34+N34)+O34*0.5 -> 47.61 | K34: 6.99 | L34: 6.99 | M34: 8.01 | N34: 15.62 | O34: 20 | P34: =+Q34+(R34*0.5) -> 103.34 | Q34: 81.34 | R34: 44 | S34: =+(T34+U34+V34)+W34*0.5 -> 64.29 | T34: 16.91 | U34: 15.35 | V34: 14.03 | W34: 36 | X34: =+(Y34+Z34)+AA34*0.5 -> 103.74 | Y34: 54.31 | Z34: 49.43 | AA34: 0 | AB34: =+(AC34+AD34+AE34)+AF34*0.5 -> 56.12 | AC34: 21.15 | AD34: 13.99 | AE34: 15.48 | AF34: 11
A35: 29 | B35: Young, Ren | C35: TRM | D35: DNF | E35: DNF | F35: =+(G35+H35)+I35*0.5 -> 55.26 | G35: 23.07 | H35: 24.19 | I35: 16 | J35: =+(K35+L35+M35+N35)+O35*0.5 -> 50.16 | K35: 10.24 | L35: 11.20 | M35: 8.13 | N35: 10.59 | O35: 20 | P35: =+Q35+(R35*0.5) -> 102.23 | Q35: 63.23 | R35: 78 | S35: =+(T35+U35+V35)+W35*0.5 -> 58.21 | T35: 8.15 | U35: 6.99 | V35: 7.57 | W35: 71 | X35: =+(Y35+Z35)+AA35*0.5 -> 171.87 | Y35: 63.55 | Z35: 53.32 | AA35: 110 | AB35: DNF
A36: Notes:
A37: xx | B37: Indicates that the Points Down value includes some kind of penalty (Procedural Error, Hits on Non-Threat or Misses on Steel).
A38: PD | B38: = Points Down value is PD x 5 seconds added to the total stage time.
A39: *DIV | B39: = Divisions: TRM = Ten Round Maximum; HiCAP = High capacity mags, no optics or compensators
B40: REV = Revolver - 8 round max, no optics; REVOP = Revolver - 8 round max, w/optics; OPEN = Anything goes - within the bounds of safety
A41: DNF | B41: = Did Not Finish