B2: UDPL IDPA Match Results for June 19, 2004
B3: Sorted by Division | H3: Click here for results by Time.
B4: Click on the Stage # to view the COF.
A5: Place | B5: Name | C5: (Div-Class) | D5: Shoot Total | E5: Total PD | F5: Stage 1 | G5: String 1 | H5: PD | I5: Stage 2 | J5: String 1 | K5: PD | L5: Stage 3 | M5: String 1 | N5: PD | O5: Stage 4 | P5: String 1 | Q5: PD | R5: Stage 5 | S5: String 1 | T5: PD | U5: Stage 6 | V5: String 1 | W5: String 2 | X5: String 3 | Y5: PD
A6: CDP - SharpShooter
A7: 1 | B7: Rodriquez, Mike | C7: CDP-SS | D7: =+F7+I7+L7+O7+R7+U7 -> 174.67 | E7: =+H7+K7+N7+Q7+T7+Y7 -> 67 | F7: =+(G7)+0.5*H7 -> 34.80 | G7: 28.80 | H7: 12 | I7: =+(J7)+0.5*K7 -> 26.99 | J7: 25.49 | K7: 3 | L7: =+(M7)+0.5*N7 -> 30.20 | M7: 21.70 | N7: 17 | O7: =+(P7)+0.5*Q7 -> 29.84 | P7: 26.84 | Q7: 6 | R7: =+(S7)+0.5*T7 -> 23.98 | S7: 23.48 | T7: 1 | U7: =+(V7+W7+X7)+0.5*Y7 -> 28.86 | V7: 4.76 | W7: 6.95 | X7: 3.15 | Y7: 28
A8: 2 | B8: Montgomery, Robert | C8: CDP-SS | D8: =+F8+I8+L8+O8+R8+U8 -> 175.14 | E8: =+H8+K8+N8+Q8+T8+Y8 -> 46 | F8: =+(G8)+0.5*H8 -> 35.46 | G8: 30.46 | H8: 10 | I8: =+(J8)+0.5*K8 -> 25.45 | J8: 24.45 | K8: 2 | L8: =+(M8)+0.5*N8 -> 35.73 | M8: 29.23 | N8: 13 | O8: =+(P8)+0.5*Q8 -> 42.75 | P8: 37.25 | Q8: 11 | R8: =+(S8)+0.5*T8 -> 18.46 | S8: 16.46 | T8: 4 | U8: =+(V8+W8+X8)+0.5*Y8 -> 17.29 | V8: 5.43 | W8: 4.86 | X8: 4.00 | Y8: 6
A9: 3 | B9: Beck, Dave | C9: CDP-SS | D9: =+F9+I9+L9+O9+R9+U9 -> 181.95 | E9: =+H9+K9+N9+Q9+T9+Y9 -> 61 | F9: =+(G9)+0.5*H9 -> 34.10 | G9: 27.60 | H9: 13 | I9: =+(J9)+0.5*K9 -> 28.61 | J9: 26.61 | K9: 4 | L9: =+(M9)+0.5*N9 -> 46.52 | M9: 34.52 | N9: 24 | O9: =+(P9)+0.5*Q9 -> 40.56 | P9: 36.56 | Q9: 8 | R9: =+(S9)+0.5*T9 -> 16.23 | S9: 15.23 | T9: 2 | U9: =+(V9+W9+X9)+0.5*Y9 -> 15.93 | V9: 3.87 | W9: 3.52 | X9: 3.54 | Y9: 10
A10: 4 | B10: Collins, Ken | C10: CDP-SS | D10: =+F10+I10+L10+O10+R10+U10 -> 189.94 | E10: =+H10+K10+N10+Q10+T10+Y10 -> 69 | F10: =+(G10)+0.5*H10 -> 51.34 | G10: 35.84 | H10: 31 | I10: =+(J10)+0.5*K10 -> 35.04 | J10: 26.04 | K10: 18 | L10: =+(M10)+0.5*N10 -> 27.45 | M10: 24.45 | N10: 6 | O10: =+(P10)+0.5*Q10 -> 37.30 | P10: 31.80 | Q10: 11 | R10: =+(S10)+0.5*T10 -> 22.58 | S10: 22.58 | T10: 0 | U10: =+(V10+W10+X10)+0.5*Y10 -> 16.23 | V10: 3.90 | W10: 6.67 | X10: 4.16 | Y10: 3
A11: CDP - UnClassified
A12: 1 | B12: Hatch, Perri | C12: CDP-UC | D12: =+F12+I12+L12+O12+R12+U12 -> 201.95 | E12: =+H12+K12+N12+Q12+T12+Y12 -> 62 | F12: =+(G12)+0.5*H12 -> 49.36 | G12: 46.36 | H12: 6 | I12: =+(J12)+0.5*K12 -> 38.56 | J12: 33.06 | K12: 11 | L12: =+(M12)+0.5*N12 -> 35.07 | M12: 27.57 | N12: 15 | O12: =+(P12)+0.5*Q12 -> 42.73 | P12: 34.73 | Q12: 16 | R12: =+(S12)+0.5*T12 -> 20.39 | S12: 17.39 | T12: 6 | U12: =+(V12+W12+X12)+0.5*Y12 -> 15.84 | V12: 4.22 | W12: 4.43 | X12: 3.19 | Y12: 8
A13: 2 | B13: Hill, Randy | C13: CDP-UC | D13: =+F13+I13+L13+O13+R13+U13 -> 294.88 | E13: =+H13+K13+N13+Q13+T13+Y13 -> 120 | F13: =+(G13)+0.5*H13 -> 66.92 | G13: 50.42 | H13: 33 | I13: =+(J13)+0.5*K13 -> 60.21 | J13: 41.21 | K13: 38 | L13: =+(M13)+0.5*N13 -> 43.52 | M13: 30.52 | N13: 26 | O13: =+(P13)+0.5*Q13 -> 65.82 | P13: 59.32 | Q13: 13 | R13: =+(S13)+0.5*T13 -> 34.42 | S13: 33.42 | T13: 2 | U13: =+(V13+W13+X13)+0.5*Y13 -> 23.99 | V13: 6.90 | W13: 8.99 | X13: 4.10 | Y13: 8
A14: ESP - Expert
A15: 1 | B15: Latham, Corey | C15: ESP-EX | D15: =+F15+I15+L15+O15+R15+U15 -> 131.22 | E15: =+H15+K15+N15+Q15+T15+Y15 -> 34 | F15: =+(G15)+0.5*H15 -> 22.21 | G15: 21.21 | H15: 2 | I15: =+(J15)+0.5*K15 -> 30.04 | J15: 24.54 | K15: 11 | L15: =+(M15)+0.5*N15 -> 24.24 | M15: 23.24 | N15: 2 | O15: =+(P15)+0.5*Q15 -> 31.64 | P15: 24.14 | Q15: 15 | R15: =+(S15)+0.5*T15 -> 11.66 | S15: 11.16 | T15: 1 | U15: =+(V15+W15+X15)+0.5*Y15 -> 11.43 | V15: 3.16 | W15: 3.76 | X15: 3.01 | Y15: 3
A16: ESP - SharpShooter
A17: 1 | B17: Collins, Ken | C17: ESP-SS | D17: =+F17+I17+L17+O17+R17+U17 -> 123.63 | E17: =+H17+K17+N17+Q17+T17+Y17 -> 14 | F17: =+(G17)+0.5*H17 -> 28.07 | G17: 27.57 | H17: 1 | I17: =+(J17)+0.5*K17 -> 20.36 | J17: 19.86 | K17: 1 | L17: =+(M17)+0.5*N17 -> 22.84 | M17: 22.34 | N17: 1 | O17: =+(P17)+0.5*Q17 -> 25.16 | P17: 22.16 | Q17: 6 | R17: =+(S17)+0.5*T17 -> 15.86 | S17: 15.36 | T17: 1 | U17: =+(V17+W17+X17)+0.5*Y17 -> 11.34 | V17: 2.95 | W17: 3.30 | X17: 3.09 | Y17: 4
A18: ESP - MarksMan
A19: 1 | B19: Zaccardi, Juke | C19: ESP-MM | D19: =+F19+I19+L19+O19+R19+U19 -> 158.69 | E19: =+H19+K19+N19+Q19+T19+Y19 -> 92 | F19: =+(G19)+0.5*H19 -> 31.84 | G19: 23.84 | H19: 16 | I19: =+(J19)+0.5*K19 -> 33.77 | J19: 19.27 | K19: 29 | L19: =+(M19)+0.5*N19 -> 31.21 | M19: 19.21 | N19: 24 | O19: =+(P19)+0.5*Q19 -> 29.13 | P19: 21.13 | Q19: 16 | R19: =+(S19)+0.5*T19 -> 12.33 | S19: 12.33 | T19: 0 | U19: =+(V19+W19+X19)+0.5*Y19 -> 20.41 | V19: 9.54 | W19: 4.11 | X19: 3.26 | Y19: 7
A20: ESP - UnClassified
A21: 1 | B21: Outzen, Craig | C21: ESP-UC | D21: =+F21+I21+L21+O21+R21+U21 -> 133.49 | E21: =+H21+K21+N21+Q21+T21+Y21 -> 44 | F21: =+(G21)+0.5*H21 -> 25.03 | G21: 23.53 | H21: 3 | I21: =+(J21)+0.5*K21 -> 28.43 | J21: 19.93 | K21: 17 | L21: =+(M21)+0.5*N21 -> 25.10 | M21: 20.60 | N21: 9 | O21: =+(P21)+0.5*Q21 -> 28.85 | P21: 23.35 | Q21: 11 | R21: =+(S21)+0.5*T21 -> 14.82 | S21: 13.82 | T21: 2 | U21: =+(V21+W21+X21)+0.5*Y21 -> 11.26 | V21: 3.84 | W21: 3.60 | X21: 2.82 | Y21: 2
A22: 2 | B22: Jochetz, Chris | C22: ESP-UC | D22: =+F22+I22+L22+O22+R22+U22 -> 215.90 | E22: =+H22+K22+N22+Q22+T22+Y22 -> 62 | F22: =+(G22)+0.5*H22 -> 41.43 | G22: 37.93 | H22: 7 | I22: =+(J22)+0.5*K22 -> 47.34 | J22: 41.84 | K22: 11 | L22: =+(M22)+0.5*N22 -> 39.42 | M22: 33.92 | N22: 11 | O22: =+(P22)+0.5*Q22 -> 43.63 | P22: 33.63 | Q22: 20 | R22: =+(S22)+0.5*T22 -> 22.63 | S22: 21.13 | T22: 3 | U22: =+(V22+W22+X22)+0.5*Y22 -> 21.45 | V22: 7.41 | W22: 5.35 | X22: 3.69 | Y22: 10
A23: SSP - MAster
A24: 1 | B24: Lowe, John | C24: SSP-MA | D24: =+F24+I24+L24+O24+R24+U24 -> 140.31 | E24: =+H24+K24+N24+Q24+T24+Y24 -> 18 | F24: =+(G24)+0.5*H24 -> 24.78 | G24: 23.78 | H24: 2 | I24: =+(J24)+0.5*K24 -> 25.25 | J24: 23.25 | K24: 4 | L24: =+(M24)+0.5*N24 -> 33.02 | M24: 30.52 | N24: 5 | O24: =+(P24)+0.5*Q24 -> 28.92 | P24: 26.42 | Q24: 5 | R24: =+(S24)+0.5*T24 -> 15.27 | S24: 15.27 | T24: 0 | U24: =+(V24+W24+X24)+0.5*Y24 -> 13.07 | V24: 3.92 | W24: 4.61 | X24: 3.54 | Y24: 2
A25: SSP - SharpShooter
A26: 1 | B26: Theodore, Ari | C26: SSP-SS | D26: =+F26+I26+L26+O26+R26+U26 -> 112.22 | E26: =+H26+K26+N26+Q26+T26+Y26 -> 39 | F26: =+(G26)+0.5*H26 -> 21.01 | G26: 17.01 | H26: 8 | I26: =+(J26)+0.5*K26 -> 28.71 | J26: 18.71 | K26: 20 | L26: =+(M26)+0.5*N26 -> 18.35 | M26: 16.85 | N26: 3 | O26: =+(P26)+0.5*Q26 -> 21.20 | P26: 19.70 | Q26: 3 | R26: =+(S26)+0.5*T26 -> 11.82 | S26: 11.32 | T26: 1 | U26: =+(V26+W26+X26)+0.5*Y26 -> 11.13 | V26: 3.02 | W26: 3.30 | X26: 2.81 | Y26: 4
A27: 2 | B27: Zaccardi, Pat | C27: SSP-SS | D27: =+F27+I27+L27+O27+R27+U27 -> 154.74 | E27: =+H27+K27+N27+Q27+T27+Y27 -> 55 | F27: =+(G27)+0.5*H27 -> 25.81 | G27: 21.81 | H27: 8 | I27: =+(J27)+0.5*K27 -> 31.39 | J27: 24.89 | K27: 13 | L27: =+(M27)+0.5*N27 -> 29.68 | M27: 24.68 | N27: 10 | O27: =+(P27)+0.5*Q27 -> 33.59 | P27: 28.59 | Q27: 10 | R27: =+(S27)+0.5*T27 -> 17.73 | S27: 15.73 | T27: 4 | U27: =+(V27+W27+X27)+0.5*Y27 -> 16.54 | V27: 4.91 | W27: 3.46 | X27: 3.17 | Y27: 10
A28: 3 | B28: Legg, Rich | C28: SSP-SS | D28: =+F28+I28+L28+O28+R28+U28 -> 160.51 | E28: =+H28+K28+N28+Q28+T28+Y28 -> 21 | F28: =+(G28)+0.5*H28 -> 31.37 | G28: 30.87 | H28: 1 | I28: =+(J28)+0.5*K28 -> 29.02 | J28: 28.02 | K28: 2 | L28: =+(M28)+0.5*N28 -> 29.92 | M28: 26.42 | N28: 7 | O28: =+(P28)+0.5*Q28 -> 33.85 | P28: 33.35 | Q28: 1 | R28: =+(S28)+0.5*T28 -> 17.07 | S28: 17.07 | T28: 0 | U28: =+(V28+W28+X28)+0.5*Y28 -> 19.28 | V28: 5.69 | W28: 5.08 | X28: 3.51 | Y28: 10
A29: 4 | B29: Redford, "Red" | C29: SSP-SS | D29: =+F29+I29+L29+O29+R29+U29 -> 184.05 | E29: =+H29+K29+N29+Q29+T29+Y29 -> 62 | F29: =+(G29)+0.5*H29 -> 47.24 | G29: 38.24 | H29: 18 | I29: =+(J29)+0.5*K29 -> 28.16 | J29: 26.16 | K29: 4 | L29: =+(M29)+0.5*N29 -> 39.95 | M29: 34.45 | N29: 11 | O29: =+(P29)+0.5*Q29 -> 36.75 | P29: 26.75 | Q29: 20 | R29: =+(S29)+0.5*T29 -> 17.10 | S29: 16.10 | T29: 2 | U29: =+(V29+W29+X29)+0.5*Y29 -> 14.85 | V29: 4.48 | W29: 3.76 | X29: 3.11 | Y29: 7
A30: 5 | B30: Brownlee, Mike | C30: SSP-SS | D30: =+F30+I30+L30+O30+R30+U30 -> 184.27 | E30: =+H30+K30+N30+Q30+T30+Y30 -> 92 | F30: =+(G30)+0.5*H30 -> 32.56 | G30: 29.56 | H30: 6 | I30: =+(J30)+0.5*K30 -> 36.21 | J30: 21.21 | K30: 30 | L30: =+(M30)+0.5*N30 -> 43.59 | M30: 25.59 | N30: 36 | O30: =+(P30)+0.5*Q30 -> 32.17 | P30: 27.67 | Q30: 9 | R30: =+(S30)+0.5*T30 -> 25.17 | S30: 22.17 | T30: 6 | U30: =+(V30+W30+X30)+0.5*Y30 -> 14.57 | V30: 4.02 | W30: 4.23 | X30: 3.82 | Y30: 5
A31: SSP - UnClassified
A32: 1 | B32: Legg, Kris | C32: SSP-UC | D32: =+F32+I32+L32+O32+R32+U32 -> 183.39 | E32: =+H32+K32+N32+Q32+T32+Y32 -> 27 | F32: =+(G32)+0.5*H32 -> 37.77 | G32: 37.27 | H32: 1 | I32: =+(J32)+0.5*K32 -> 36.81 | J32: 31.81 | K32: 10 | L32: =+(M32)+0.5*N32 -> 30.49 | M32: 27.99 | N32: 5 | O32: =+(P32)+0.5*Q32 -> 34.17 | P32: 32.17 | Q32: 4 | R32: =+(S32)+0.5*T32 -> 20.18 | S32: 19.18 | T32: 2 | U32: =+(V32+W32+X32)+0.5*Y32 -> 23.97 | V32: 9.71 | W32: 7.20 | X32: 4.56 | Y32: 5
A33: 2 | B33: Kirkham, Glade | C33: SSP-UC | D33: =+F33+I33+L33+O33+R33+U33 -> 199.99 | E33: =+H33+K33+N33+Q33+T33+Y33 -> 29 | F33: =+(G33)+0.5*H33 -> 44.05 | G33: 41.05 | H33: 6 | I33: =+(J33)+0.5*K33 -> 37.66 | J33: 34.66 | K33: 6 | L33: =+(M33)+0.5*N33 -> 32.64 | M33: 30.64 | N33: 4 | O33: =+(P33)+0.5*Q33 -> 42.53 | P33: 40.53 | Q33: 4 | R33: =+(S33)+0.5*T33 -> 21.39 | S33: 20.89 | T33: 1 | U33: =+(V33+W33+X33)+0.5*Y33 -> 21.72 | V33: 7.36 | W33: 6.20 | X33: 4.16 | Y33: 8
A34: 3 | B34: Phillips, RDan | C34: SSP-UC | D34: =+F34+I34+L34+O34+R34+U34 -> 253.10 | E34: =+H34+K34+N34+Q34+T34+Y34 -> 72 | F34: =+(G34)+0.5*H34 -> 65.41 | G34: 56.91 | H34: 17 | I34: =+(J34)+0.5*K34 -> 43.80 | J34: 37.30 | K34: 13 | L34: =+(M34)+0.5*N34 -> 66.22 | M34: 52.72 | N34: 27 | O34: =+(P34)+0.5*Q34 -> 39.33 | P34: 36.33 | Q34: 6 | R34: =+(S34)+0.5*T34 -> 21.59 | S34: 21.09 | T34: 1 | U34: =+(V34+W34+X34)+0.5*Y34 -> 16.75 | V34: 3.90 | W34: 5.05 | X34: 3.80 | Y34: 8
A35: SSR - EXpert
A36: 1 | B36: Mousley, Roger | C36: SSR-EX | D36: =+F36+I36+L36+O36+R36+U36 -> 149.72 | E36: =+H36+K36+N36+Q36+T36+Y36 -> 39 | F36: =+(G36)+0.5*H36 -> 26.10 | G36: 26.10 | H36: 0 | I36: =+(J36)+0.5*K36 -> 23.50 | J36: 20.50 | K36: 6 | L36: =+(M36)+0.5*N36 -> 29.55 | M36: 27.05 | N36: 5 | O36: =+(P36)+0.5*Q36 -> 30.45 | P36: 26.95 | Q36: 7 | R36: =+(S36)+0.5*T36 -> 20.74 | S36: 17.74 | T36: 6 | U36: =+(V36+W36+X36)+0.5*Y36 -> 19.38 | V36: 4.18 | W36: 4.29 | X36: 3.41 | Y36: 15
A37: 26 | B37: Rodriquez, Mike | C37: CDP-MM | D37: DNF | E37: =+H37+K37+N37+Q37+T37+Y37 -> 0 | F37: =+(G37+#REF!)+0.5*H37 -> #REF! | I37: =+(J37)+0.5*K37 -> 0.00 | L37: =+(M37+#REF!)+0.5*N37 -> #REF! | O37: =+(P37+#REF!+#REF!)+0.5*Q37 -> #REF! | R37: =+(S37)+0.5*T37 -> 0.00 | U37: =+(V37+W37)+0.5*Y37 -> 0.00
A38: No Division / Classification
A39: 1 | B39: Kirkham, Devon (.22) | C39: N/A-N/A | D39: =+F39+I39+L39+O39+R39+U39 -> 249.43 | E39: =+H39+K39+N39+Q39+T39+Y39 -> 64 | F39: =+(G39)+0.5*H39 -> 41.09 | G39: 35.59 | H39: 11 | I39: =+(J39)+0.5*K39 -> 44.16 | J39: 39.16 | K39: 10 | L39: =+(M39)+0.5*N39 -> 51.05 | M39: 42.05 | N39: 18 | O39: =+(P39)+0.5*Q39 -> 63.14 | P39: 55.64 | Q39: 15 | R39: =+(S39)+0.5*T39 -> 29.98 | S39: 28.48 | T39: 3 | U39: =+(V39+W39+X39)+0.5*Y39 -> 20.01 | V39: 4.69 | W39: 6.77 | X39: 5.05 | Y39: 7
A40: Notes:
A41: xx | B41: Indicates that the Points Down value includes some kind of penalty (Procedural Error, Hits on Non-Threat or Failure to Neutralize).
A42: PD | B42: = Points Down value is PD x .5 seconds added to the total stage time.
A43: xx | B43: Indicates that the Points Down value includes some kind of penalty (Procedural Error, Hits on Non-Threat or Failure to Neutralize).
A44: DNF | B44: = Did Not Finish
A45: NS | B45: = No Score
B46: Div/Class Information:
A47: - | B47: Division: CDP = Custom Defense Pistol; ESP = Enhanced Service Pistol; SSP = Stock Service Pistol; SSR = Stock Service Revolver
A48: - | B48: Classification: MA = Master; EX = Expert; SS = Sharpshooter; MM = Marksman; NV = Novice; UC = Unclassified
B49: .22-N/C = Shooter used a non IDPA firearm and was not placed in an IDPA Div/Class.