B2: UDPL IDPA Match Results for June 19, 2004
B3: Sorted by Time without regard to Div/Class | H3: Click here for results by Division.
B4: Click on the Stage # to view the COF.
A5: Place | B5: Name | C5: (Div-Class) | D5: Shoot Total | E5: Total PD | F5: Stage 1 | G5: String 1 | H5: PD | I5: Stage 2 | J5: String 1 | K5: PD | L5: Stage 3 | M5: String 1 | N5: PD | O5: Stage 4 | P5: String 1 | Q5: PD | R5: Stage 5 | S5: String 1 | T5: PD | U5: Stage 6 | V5: String 1 | W5: String 2 | X5: String 3 | Y5: PD
A6: 1 | B6: Theodore, Ari | C6: SSP-SS | D6: =+F6+I6+L6+O6+R6+U6 -> 112.22 | E6: =+H6+K6+N6+Q6+T6+Y6 -> 39 | F6: =+(G6)+0.5*H6 -> 21.01 | G6: 17.01 | H6: 8 | I6: =+(J6)+0.5*K6 -> 28.71 | J6: 18.71 | K6: 20 | L6: =+(M6)+0.5*N6 -> 18.35 | M6: 16.85 | N6: 3 | O6: =+(P6)+0.5*Q6 -> 21.20 | P6: 19.70 | Q6: 3 | R6: =+(S6)+0.5*T6 -> 11.82 | S6: 11.32 | T6: 1 | U6: =+(V6+W6+X6)+0.5*Y6 -> 11.13 | V6: 3.02 | W6: 3.30 | X6: 2.81 | Y6: 4
A7: 2 | B7: Collins, Ken | C7: ESP-SS | D7: =+F7+I7+L7+O7+R7+U7 -> 123.63 | E7: =+H7+K7+N7+Q7+T7+Y7 -> 14 | F7: =+(G7)+0.5*H7 -> 28.07 | G7: 27.57 | H7: 1 | I7: =+(J7)+0.5*K7 -> 20.36 | J7: 19.86 | K7: 1 | L7: =+(M7)+0.5*N7 -> 22.84 | M7: 22.34 | N7: 1 | O7: =+(P7)+0.5*Q7 -> 25.16 | P7: 22.16 | Q7: 6 | R7: =+(S7)+0.5*T7 -> 15.86 | S7: 15.36 | T7: 1 | U7: =+(V7+W7+X7)+0.5*Y7 -> 11.34 | V7: 2.95 | W7: 3.30 | X7: 3.09 | Y7: 4
A8: 3 | B8: Latham, Corey | C8: ESP-EX | D8: =+F8+I8+L8+O8+R8+U8 -> 131.22 | E8: =+H8+K8+N8+Q8+T8+Y8 -> 34 | F8: =+(G8)+0.5*H8 -> 22.21 | G8: 21.21 | H8: 2 | I8: =+(J8)+0.5*K8 -> 30.04 | J8: 24.54 | K8: 11 | L8: =+(M8)+0.5*N8 -> 24.24 | M8: 23.24 | N8: 2 | O8: =+(P8)+0.5*Q8 -> 31.64 | P8: 24.14 | Q8: 15 | R8: =+(S8)+0.5*T8 -> 11.66 | S8: 11.16 | T8: 1 | U8: =+(V8+W8+X8)+0.5*Y8 -> 11.43 | V8: 3.16 | W8: 3.76 | X8: 3.01 | Y8: 3
A9: 4 | B9: Outzen, Craig | C9: ESP-UC | D9: =+F9+I9+L9+O9+R9+U9 -> 133.49 | E9: =+H9+K9+N9+Q9+T9+Y9 -> 44 | F9: =+(G9)+0.5*H9 -> 25.03 | G9: 23.53 | H9: 3 | I9: =+(J9)+0.5*K9 -> 28.43 | J9: 19.93 | K9: 17 | L9: =+(M9)+0.5*N9 -> 25.10 | M9: 20.60 | N9: 9 | O9: =+(P9)+0.5*Q9 -> 28.85 | P9: 23.35 | Q9: 11 | R9: =+(S9)+0.5*T9 -> 14.82 | S9: 13.82 | T9: 2 | U9: =+(V9+W9+X9)+0.5*Y9 -> 11.26 | V9: 3.84 | W9: 3.60 | X9: 2.82 | Y9: 2
A10: 5 | B10: Lowe, John | C10: SSP-MA | D10: =+F10+I10+L10+O10+R10+U10 -> 140.31 | E10: =+H10+K10+N10+Q10+T10+Y10 -> 18 | F10: =+(G10)+0.5*H10 -> 24.78 | G10: 23.78 | H10: 2 | I10: =+(J10)+0.5*K10 -> 25.25 | J10: 23.25 | K10: 4 | L10: =+(M10)+0.5*N10 -> 33.02 | M10: 30.52 | N10: 5 | O10: =+(P10)+0.5*Q10 -> 28.92 | P10: 26.42 | Q10: 5 | R10: =+(S10)+0.5*T10 -> 15.27 | S10: 15.27 | T10: 0 | U10: =+(V10+W10+X10)+0.5*Y10 -> 13.07 | V10: 3.92 | W10: 4.61 | X10: 3.54 | Y10: 2
A11: 6 | B11: Mousley, Roger | C11: SSR-EX | D11: =+F11+I11+L11+O11+R11+U11 -> 149.72 | E11: =+H11+K11+N11+Q11+T11+Y11 -> 39 | F11: =+(G11)+0.5*H11 -> 26.10 | G11: 26.10 | H11: 0 | I11: =+(J11)+0.5*K11 -> 23.50 | J11: 20.50 | K11: 6 | L11: =+(M11)+0.5*N11 -> 29.55 | M11: 27.05 | N11: 5 | O11: =+(P11)+0.5*Q11 -> 30.45 | P11: 26.95 | Q11: 7 | R11: =+(S11)+0.5*T11 -> 20.74 | S11: 17.74 | T11: 6 | U11: =+(V11+W11+X11)+0.5*Y11 -> 19.38 | V11: 4.18 | W11: 4.29 | X11: 3.41 | Y11: 15
A12: 7 | B12: Zaccardi, Pat | C12: SSP-SS | D12: =+F12+I12+L12+O12+R12+U12 -> 154.74 | E12: =+H12+K12+N12+Q12+T12+Y12 -> 55 | F12: =+(G12)+0.5*H12 -> 25.81 | G12: 21.81 | H12: 8 | I12: =+(J12)+0.5*K12 -> 31.39 | J12: 24.89 | K12: 13 | L12: =+(M12)+0.5*N12 -> 29.68 | M12: 24.68 | N12: 10 | O12: =+(P12)+0.5*Q12 -> 33.59 | P12: 28.59 | Q12: 10 | R12: =+(S12)+0.5*T12 -> 17.73 | S12: 15.73 | T12: 4 | U12: =+(V12+W12+X12)+0.5*Y12 -> 16.54 | V12: 4.91 | W12: 3.46 | X12: 3.17 | Y12: 10
A13: 8 | B13: Zaccardi, Juke | C13: ESP-MM | D13: =+F13+I13+L13+O13+R13+U13 -> 158.69 | E13: =+H13+K13+N13+Q13+T13+Y13 -> 92 | F13: =+(G13)+0.5*H13 -> 31.84 | G13: 23.84 | H13: 16 | I13: =+(J13)+0.5*K13 -> 33.77 | J13: 19.27 | K13: 29 | L13: =+(M13)+0.5*N13 -> 31.21 | M13: 19.21 | N13: 24 | O13: =+(P13)+0.5*Q13 -> 29.13 | P13: 21.13 | Q13: 16 | R13: =+(S13)+0.5*T13 -> 12.33 | S13: 12.33 | T13: 0 | U13: =+(V13+W13+X13)+0.5*Y13 -> 20.41 | V13: 9.54 | W13: 4.11 | X13: 3.26 | Y13: 7
A14: 9 | B14: Legg, Rich | C14: SSP-SS | D14: =+F14+I14+L14+O14+R14+U14 -> 160.51 | E14: =+H14+K14+N14+Q14+T14+Y14 -> 21 | F14: =+(G14)+0.5*H14 -> 31.37 | G14: 30.87 | H14: 1 | I14: =+(J14)+0.5*K14 -> 29.02 | J14: 28.02 | K14: 2 | L14: =+(M14)+0.5*N14 -> 29.92 | M14: 26.42 | N14: 7 | O14: =+(P14)+0.5*Q14 -> 33.85 | P14: 33.35 | Q14: 1 | R14: =+(S14)+0.5*T14 -> 17.07 | S14: 17.07 | T14: 0 | U14: =+(V14+W14+X14)+0.5*Y14 -> 19.28 | V14: 5.69 | W14: 5.08 | X14: 3.51 | Y14: 10
A15: 10 | B15: Rodriquez, Mike | C15: CDP-SS | D15: =+F15+I15+L15+O15+R15+U15 -> 174.67 | E15: =+H15+K15+N15+Q15+T15+Y15 -> 67 | F15: =+(G15)+0.5*H15 -> 34.80 | G15: 28.80 | H15: 12 | I15: =+(J15)+0.5*K15 -> 26.99 | J15: 25.49 | K15: 3 | L15: =+(M15)+0.5*N15 -> 30.20 | M15: 21.70 | N15: 17 | O15: =+(P15)+0.5*Q15 -> 29.84 | P15: 26.84 | Q15: 6 | R15: =+(S15)+0.5*T15 -> 23.98 | S15: 23.48 | T15: 1 | U15: =+(V15+W15+X15)+0.5*Y15 -> 28.86 | V15: 4.76 | W15: 6.95 | X15: 3.15 | Y15: 28
A16: 11 | B16: Montgomery, Robert | C16: CDP-SS | D16: =+F16+I16+L16+O16+R16+U16 -> 175.14 | E16: =+H16+K16+N16+Q16+T16+Y16 -> 46 | F16: =+(G16)+0.5*H16 -> 35.46 | G16: 30.46 | H16: 10 | I16: =+(J16)+0.5*K16 -> 25.45 | J16: 24.45 | K16: 2 | L16: =+(M16)+0.5*N16 -> 35.73 | M16: 29.23 | N16: 13 | O16: =+(P16)+0.5*Q16 -> 42.75 | P16: 37.25 | Q16: 11 | R16: =+(S16)+0.5*T16 -> 18.46 | S16: 16.46 | T16: 4 | U16: =+(V16+W16+X16)+0.5*Y16 -> 17.29 | V16: 5.43 | W16: 4.86 | X16: 4.00 | Y16: 6
A17: 12 | B17: Beck, Dave | C17: CDP-SS | D17: =+F17+I17+L17+O17+R17+U17 -> 181.95 | E17: =+H17+K17+N17+Q17+T17+Y17 -> 61 | F17: =+(G17)+0.5*H17 -> 34.10 | G17: 27.60 | H17: 13 | I17: =+(J17)+0.5*K17 -> 28.61 | J17: 26.61 | K17: 4 | L17: =+(M17)+0.5*N17 -> 46.52 | M17: 34.52 | N17: 24 | O17: =+(P17)+0.5*Q17 -> 40.56 | P17: 36.56 | Q17: 8 | R17: =+(S17)+0.5*T17 -> 16.23 | S17: 15.23 | T17: 2 | U17: =+(V17+W17+X17)+0.5*Y17 -> 15.93 | V17: 3.87 | W17: 3.52 | X17: 3.54 | Y17: 10
A18: 13 | B18: Legg, Kris | C18: SSP-UC | D18: =+F18+I18+L18+O18+R18+U18 -> 183.39 | E18: =+H18+K18+N18+Q18+T18+Y18 -> 27 | F18: =+(G18)+0.5*H18 -> 37.77 | G18: 37.27 | H18: 1 | I18: =+(J18)+0.5*K18 -> 36.81 | J18: 31.81 | K18: 10 | L18: =+(M18)+0.5*N18 -> 30.49 | M18: 27.99 | N18: 5 | O18: =+(P18)+0.5*Q18 -> 34.17 | P18: 32.17 | Q18: 4 | R18: =+(S18)+0.5*T18 -> 20.18 | S18: 19.18 | T18: 2 | U18: =+(V18+W18+X18)+0.5*Y18 -> 23.97 | V18: 9.71 | W18: 7.20 | X18: 4.56 | Y18: 5
A19: 14 | B19: Redford, "Red" | C19: SSP-SS | D19: =+F19+I19+L19+O19+R19+U19 -> 184.05 | E19: =+H19+K19+N19+Q19+T19+Y19 -> 62 | F19: =+(G19)+0.5*H19 -> 47.24 | G19: 38.24 | H19: 18 | I19: =+(J19)+0.5*K19 -> 28.16 | J19: 26.16 | K19: 4 | L19: =+(M19)+0.5*N19 -> 39.95 | M19: 34.45 | N19: 11 | O19: =+(P19)+0.5*Q19 -> 36.75 | P19: 26.75 | Q19: 20 | R19: =+(S19)+0.5*T19 -> 17.10 | S19: 16.10 | T19: 2 | U19: =+(V19+W19+X19)+0.5*Y19 -> 14.85 | V19: 4.48 | W19: 3.76 | X19: 3.11 | Y19: 7
A20: 15 | B20: Brownlee, Mike | C20: SSP-SS | D20: =+F20+I20+L20+O20+R20+U20 -> 184.27 | E20: =+H20+K20+N20+Q20+T20+Y20 -> 92 | F20: =+(G20)+0.5*H20 -> 32.56 | G20: 29.56 | H20: 6 | I20: =+(J20)+0.5*K20 -> 36.21 | J20: 21.21 | K20: 30 | L20: =+(M20)+0.5*N20 -> 43.59 | M20: 25.59 | N20: 36 | O20: =+(P20)+0.5*Q20 -> 32.17 | P20: 27.67 | Q20: 9 | R20: =+(S20)+0.5*T20 -> 25.17 | S20: 22.17 | T20: 6 | U20: =+(V20+W20+X20)+0.5*Y20 -> 14.57 | V20: 4.02 | W20: 4.23 | X20: 3.82 | Y20: 5
A21: 16 | B21: Collins, Ken | C21: CDP-SS | D21: =+F21+I21+L21+O21+R21+U21 -> 189.94 | E21: =+H21+K21+N21+Q21+T21+Y21 -> 69 | F21: =+(G21)+0.5*H21 -> 51.34 | G21: 35.84 | H21: 31 | I21: =+(J21)+0.5*K21 -> 35.04 | J21: 26.04 | K21: 18 | L21: =+(M21)+0.5*N21 -> 27.45 | M21: 24.45 | N21: 6 | O21: =+(P21)+0.5*Q21 -> 37.30 | P21: 31.80 | Q21: 11 | R21: =+(S21)+0.5*T21 -> 22.58 | S21: 22.58 | T21: 0 | U21: =+(V21+W21+X21)+0.5*Y21 -> 16.23 | V21: 3.90 | W21: 6.67 | X21: 4.16 | Y21: 3
A22: 17 | B22: Kirkham, Glade | C22: SSP-UC | D22: =+F22+I22+L22+O22+R22+U22 -> 199.99 | E22: =+H22+K22+N22+Q22+T22+Y22 -> 29 | F22: =+(G22)+0.5*H22 -> 44.05 | G22: 41.05 | H22: 6 | I22: =+(J22)+0.5*K22 -> 37.66 | J22: 34.66 | K22: 6 | L22: =+(M22)+0.5*N22 -> 32.64 | M22: 30.64 | N22: 4 | O22: =+(P22)+0.5*Q22 -> 42.53 | P22: 40.53 | Q22: 4 | R22: =+(S22)+0.5*T22 -> 21.39 | S22: 20.89 | T22: 1 | U22: =+(V22+W22+X22)+0.5*Y22 -> 21.72 | V22: 7.36 | W22: 6.20 | X22: 4.16 | Y22: 8
A23: 18 | B23: Hatch, Perri | C23: CDP-UC | D23: =+F23+I23+L23+O23+R23+U23 -> 201.95 | E23: =+H23+K23+N23+Q23+T23+Y23 -> 62 | F23: =+(G23)+0.5*H23 -> 49.36 | G23: 46.36 | H23: 6 | I23: =+(J23)+0.5*K23 -> 38.56 | J23: 33.06 | K23: 11 | L23: =+(M23)+0.5*N23 -> 35.07 | M23: 27.57 | N23: 15 | O23: =+(P23)+0.5*Q23 -> 42.73 | P23: 34.73 | Q23: 16 | R23: =+(S23)+0.5*T23 -> 20.39 | S23: 17.39 | T23: 6 | U23: =+(V23+W23+X23)+0.5*Y23 -> 15.84 | V23: 4.22 | W23: 4.43 | X23: 3.19 | Y23: 8
A24: 19 | B24: Jochetz, Chris | C24: ESP-UC | D24: =+F24+I24+L24+O24+R24+U24 -> 215.90 | E24: =+H24+K24+N24+Q24+T24+Y24 -> 62 | F24: =+(G24)+0.5*H24 -> 41.43 | G24: 37.93 | H24: 7 | I24: =+(J24)+0.5*K24 -> 47.34 | J24: 41.84 | K24: 11 | L24: =+(M24)+0.5*N24 -> 39.42 | M24: 33.92 | N24: 11 | O24: =+(P24)+0.5*Q24 -> 43.63 | P24: 33.63 | Q24: 20 | R24: =+(S24)+0.5*T24 -> 22.63 | S24: 21.13 | T24: 3 | U24: =+(V24+W24+X24)+0.5*Y24 -> 21.45 | V24: 7.41 | W24: 5.35 | X24: 3.69 | Y24: 10
A25: 20 | B25: Kirkham, Devon (.22) | C25: N/A-N/A | D25: =+F25+I25+L25+O25+R25+U25 -> 249.43 | E25: =+H25+K25+N25+Q25+T25+Y25 -> 64 | F25: =+(G25)+0.5*H25 -> 41.09 | G25: 35.59 | H25: 11 | I25: =+(J25)+0.5*K25 -> 44.16 | J25: 39.16 | K25: 10 | L25: =+(M25)+0.5*N25 -> 51.05 | M25: 42.05 | N25: 18 | O25: =+(P25)+0.5*Q25 -> 63.14 | P25: 55.64 | Q25: 15 | R25: =+(S25)+0.5*T25 -> 29.98 | S25: 28.48 | T25: 3 | U25: =+(V25+W25+X25)+0.5*Y25 -> 20.01 | V25: 4.69 | W25: 6.77 | X25: 5.05 | Y25: 7
A26: 21 | B26: Phillips, RDan | C26: SSP-UC | D26: =+F26+I26+L26+O26+R26+U26 -> 253.10 | E26: =+H26+K26+N26+Q26+T26+Y26 -> 72 | F26: =+(G26)+0.5*H26 -> 65.41 | G26: 56.91 | H26: 17 | I26: =+(J26)+0.5*K26 -> 43.80 | J26: 37.30 | K26: 13 | L26: =+(M26)+0.5*N26 -> 66.22 | M26: 52.72 | N26: 27 | O26: =+(P26)+0.5*Q26 -> 39.33 | P26: 36.33 | Q26: 6 | R26: =+(S26)+0.5*T26 -> 21.59 | S26: 21.09 | T26: 1 | U26: =+(V26+W26+X26)+0.5*Y26 -> 16.75 | V26: 3.90 | W26: 5.05 | X26: 3.80 | Y26: 8
A27: 22 | B27: Hill, Randy | C27: CDP-UC | D27: =+F27+I27+L27+O27+R27+U27 -> 294.88 | E27: =+H27+K27+N27+Q27+T27+Y27 -> 120 | F27: =+(G27)+0.5*H27 -> 66.92 | G27: 50.42 | H27: 33 | I27: =+(J27)+0.5*K27 -> 60.21 | J27: 41.21 | K27: 38 | L27: =+(M27)+0.5*N27 -> 43.52 | M27: 30.52 | N27: 26 | O27: =+(P27)+0.5*Q27 -> 65.82 | P27: 59.32 | Q27: 13 | R27: =+(S27)+0.5*T27 -> 34.42 | S27: 33.42 | T27: 2 | U27: =+(V27+W27+X27)+0.5*Y27 -> 23.99 | V27: 6.90 | W27: 8.99 | X27: 4.10 | Y27: 8
A28: 26 | B28: Rodriquez, Mike | C28: CDP-MM | D28: DNF | E28: =+H28+K28+N28+Q28+T28+Y28 -> 0 | F28: =+(G28+#REF!)+0.5*H28 -> #REF! | I28: =+(J28)+0.5*K28 -> 0.00 | L28: =+(M28+#REF!)+0.5*N28 -> #REF! | O28: =+(P28+#REF!+#REF!)+0.5*Q28 -> #REF! | R28: =+(S28)+0.5*T28 -> 0.00 | U28: =+(V28+W28)+0.5*Y28 -> 0.00
A29: Notes:
A30: xx | B30: Indicates that the Points Down value includes some kind of penalty (Procedural Error, Hits on Non-Threat or Failure to Neutralize).
A31: PD | B31: = Points Down value is PD x .5 seconds added to the total stage time.
A32: xx | B32: Indicates that the Points Down value includes some kind of penalty (Procedural Error, Hits on Non-Threat or Failure to Neutralize).
A33: DNF | B33: = Did Not Finish
A34: NS | B34: = No Score
B35: Div/Class Information:
A36: - | B36: Division: CDP = Custom Defense Pistol; ESP = Enhanced Service Pistol; SSP = Stock Service Pistol; SSR = Stock Service Revolver
A37: - | B37: Classification: MA = Master; EX = Expert; SS = Sharpshooter; MM = Marksman; NV = Novice; UC = Unclassified
B38: .22-N/C = Shooter used a non IDPA firearm and was not placed in an IDPA Div/Class.