B1: UDPL 3-Gun Match - Results for November 20, 2004 held at the F.A.R.M.
B2: (Results listed by Divison) | J2: To see a description of each Stage, click on the Stage #.
B3: Click here for results by TIME.
A4: Place | B4: Name | C4: Div * | D4: Shoot Total | E4: Total Points Down | F4: Stage 1 | G4: String 1 | H4: String 2 | I4: PD | J4: Stage 2 | K4: String 1 | L4: String 2 | M4: PD | N4: Stage 3 | O4: String 1 | P4: String 2 | Q4: PD | R4: Stage 4 | S4: String 1 | T4: String 2 | U4: PD | V4: Stage 5 | W4: String 1 | X4: String 2 | Y4: PD | Z4: Stage 6 | AA4: String 1 | AB4: String 2 | AC4: PD
A5: 1 | B5: Latham, Corey | C5: L | D5: =+F5+J5+N5+R5+V5+Z5 -> 317.09 | E5: =+I5+M5+Q5+U5+Y5+AC5 -> 52 | F5: =+(G5+H5)+(0.5*I5) -> 64.51 | G5: 29.07 | H5: 27.94 | I5: =1+1+6+2+5 -> 15 | J5: =+(K5+L5)+0.5*M5 -> 44.34 | K5: 20.45 | L5: 18.89 | M5: =6+2+2 -> 10 | N5: =+(O5+P5)+0.5*Q5 -> 44.60 | O5: 21.86 | P5: 21.24 | Q5: 3 | R5: =+(S5+T5)+0.5*U5 -> 52.12 | S5: 20.81 | T5: 22.31 | U5: =2+7+2+5+2 -> 18 | V5: =+(W5+X5)+0.5*Y5 -> 51.40 | W5: 23.31 | X5: 25.09 | Y5: =3+2+1 -> 6 | Z5: =+(AA5+AB5)+0.5*AC5 -> 60.12 | AA5: 38.61 | AB5: 21.51 | AC5: 0
A6: 2 | B6: Griffiths, Todd | C6: L | D6: =+F6+J6+N6+R6+V6+Z6 -> 330.54 | E6: =+I6+M6+Q6+U6+Y6+AC6 -> 55 | F6: =+(G6+H6)+(0.5*I6) -> 54.54 | G6: 26.55 | H6: 24.99 | I6: =1+2+1+2 -> 6 | J6: =+(K6+L6)+0.5*M6 -> 59.63 | K6: 22.07 | L6: 28.06 | M6: =4+6+6+3 -> 19 | N6: =+(O6+P6)+0.5*Q6 -> 48.28 | O6: 23.84 | P6: 23.94 | Q6: 1 | R6: =+(S6+T6)+0.5*U6 -> 67.38 | S6: 25.53 | T6: 28.35 | U6: =6+6+2+4+3+6 -> 27 | V6: =+(W6+X6)+0.5*Y6 -> 51.47 | W6: 25.74 | X6: 24.73 | Y6: 2 | Z6: =+(AA6+AB6)+0.5*AC6 -> 49.24 | AA6: 27.85 | AB6: 21.39 | AC6: 0
A7: 3 | B7: Kirkham, Glade | C7: L | D7: =+F7+J7+N7+R7+V7+Z7 -> 584.41 | E7: =+I7+M7+Q7+U7+Y7+AC7 -> 95 | F7: =+(G7+H7)+(0.5*I7) -> 107.96 | G7: 53.53 | H7: 39.43 | I7: =4+7+4+1+3+2+9 -> 30 | J7: =+(K7+L7)+0.5*M7 -> 117.67 | K7: 56.61 | L7: 57.06 | M7: =5+2+1 -> 8 | N7: =+(O7+P7)+0.5*Q7 -> 81.54 | O7: 38.29 | P7: 39.75 | Q7: =2+2+3 -> 7 | R7: =+(S7+T7)+0.5*U7 -> 118.39 | S7: 51.44 | T7: 46.45 | U7: =10+10+4+4+5+8 -> 41 | V7: =+(W7+X7)+0.5*Y7 -> 81.57 | W7: 35.57 | X7: 41.50 | Y7: =3+2+4 -> 9 | Z7: =+(AA7+AB7)+0.5*AC7 -> 77.28 | AA7: 36.39 | AB7: 40.89 | AC7: 0
A8: 4 | B8: Andrews, Ethan | C8: L | D8: =+F8+J8+N8+R8+V8+Z8 -> 596.78 | E8: =+I8+M8+Q8+U8+Y8+AC8 -> 63 | F8: =+(G8+H8)+(0.5*I8) -> 109.04 | G8: 56.54 | H8: 43.50 | I8: =1+2+4+2+3+6 -> 18 | J8: =+(K8+L8)+0.5*M8 -> 73.96 | K8: 40.68 | L8: 30.78 | M8: =1+1+3 -> 5 | N8: =+(O8+P8)+0.5*Q8 -> 90.83 | O8: 47.96 | P8: 35.37 | Q8: =4+4+2+4+1 -> 15 | R8: =+(S8+T8)+0.5*U8 -> 117.38 | S8: 51.55 | T8: 55.83 | U8: =10+3+3+2+2 -> 20 | V8: =+(W8+X8)+0.5*Y8 -> 93.27 | W8: 47.57 | X8: 43.20 | Y8: =1+1+1+2 -> 5 | Z8: =+(AA8+AB8)+0.5*AC8 -> 112.30 | AA8: 57.33 | AB8: 54.97 | AC8: 0
A9: 5 | B9: Hoyt, David | C9: L | D9: =+F9+J9+N9+R9+V9+Z9 -> 827.46 | E9: =+I9+M9+Q9+U9+Y9+AC9 -> 226 | F9: =+(G9+H9)+(0.5*I9) -> 160.75 | G9: 53.19 | H9: 45.56 | I9: =18+16+14+12+18+18+12+16 -> 124 | J9: =+(K9+L9)+0.5*M9 -> 141.17 | K9: 78.51 | L9: 58.66 | M9: =5+1+1+1 -> 8 | N9: =+(O9+P9)+0.5*Q9 -> 111.44 | O9: 62.06 | P9: 46.88 | Q9: 5 | R9: =+(S9+T9)+0.5*U9 -> 105.62 | S9: 37.17 | T9: 36.45 | U9: =10+5+12+11+10+16 -> 64 | V9: =+(W9+X9)+0.5*Y9 -> 143.09 | W9: 72.62 | X9: 57.97 | Y9: =2+9+6+8 -> 25 | Z9: =+(AA9+AB9)+0.5*AC9 -> 165.39 | AA9: 99.71 | AB9: 65.68 | AC9: 0
A11: 1 | B11: DeLeeuw, Dave | C11: O | D11: =+F11+J11+N11+R11+V11+Z11 -> 438.39 | E11: =+I11+M11+Q11+U11+Y11+AC11 -> 32 | F11: =+(G11+H11)+(0.5*I11) -> 82.69 | G11: 48.44 | H11: 32.25 | I11: =1+2+1 -> 4 | J11: =+(K11+L11)+0.5*M11 -> 63.10 | K11: 32.14 | L11: 29.96 | M11: 2 | N11: =+(O11+P11)+0.5*Q11 -> 73.01 | O11: 39.21 | P11: 32.80 | Q11: 2 | R11: =+(S11+T11)+0.5*U11 -> 80.28 | S11: 39.56 | T11: 30.72 | U11: =8+1+4+3+2+2 -> 20 | V11: =+(W11+X11)+0.5*Y11 -> 80.10 | W11: 37.06 | X11: 41.04 | Y11: 4 | Z11: =+(AA11+AB11)+0.5*AC11 -> 59.21 | AA11: 32.87 | AB11: 26.34 | AC11: 0
A12: 2 | B12: Young, Ren | C12: O | D12: =+F12+J12+N12+R12+V12+Z12 -> 448.51 | E12: =+I12+M12+Q12+U12+Y12+AC12 -> 89 | F12: =+(G12+H12)+(0.5*I12) -> 90.73 | G12: 38.37 | H12: 36.86 | I12: =6+3+3+2+4+6+3+4 -> 31 | J12: =+(K12+L12)+0.5*M12 -> 85.93 | K12: 40.55 | L12: 40.38 | M12: =2+2+6 -> 10 | N12: =+(O12+P12)+0.5*Q12 -> 66.01 | O12: 34.24 | P12: 27.77 | Q12: =2+1+5 -> 8 | R12: =+(S12+T12)+0.5*U12 -> 78.53 | S12: 24.93 | T12: 39.10 | U12: =5+10+2+2+7+3 -> 29 | V12: =+(W12+X12)+0.5*Y12 -> 64.03 | W12: 26.05 | X12: 32.48 | Y12: =3+1+4+3 -> 11 | Z12: =+(AA12+AB12)+0.5*AC12 -> 63.28 | AA12: 29.08 | AB12: 34.20 | AC12: 0
A14: 1 | B14: Correia, Larry | C14: T | D14: =+F14+J14+N14+R14+V14+Z14 -> 350.43 | E14: =+I14+M14+Q14+U14+Y14+AC14 -> 89 | F14: =+(G14+H14)+(0.5*I14) -> 82.71 | G14: 28.81 | H14: 28.90 | I14: =1+1+7+3+14+20+4 -> 50 | J14: =+(K14+L14)+0.5*M14 -> 51.72 | K14: 20.08 | L14: 22.14 | M14: =7+6+2+4 -> 19 | N14: =+(O14+P14)+0.5*Q14 -> 54.92 | O14: 30.28 | P14: 22.64 | Q14: 4 | R14: =+(S14+T14)+0.5*U14 -> 57.40 | S14: 25.61 | T14: 27.29 | U14: =1+3+2+2+1 -> 9 | V14: =+(W14+X14)+0.5*Y14 -> 57.42 | W14: 27.25 | X14: 26.67 | Y14: =2+2+1+2 -> 7 | Z14: =+(AA14+AB14)+0.5*AC14 -> 46.26 | AA14: 22.77 | AB14: 23.49 | AC14: 0
A15: 2 | B15: Lowe, John | C15: T | D15: =+F15+J15+N15+R15+V15+Z15 -> 359.74 | E15: =+I15+M15+Q15+U15+Y15+AC15 -> 63 | F15: =+(G15+H15)+(0.5*I15) -> 63.37 | G15: 28.53 | H15: 25.84 | I15: =1+7+2+1+4+3 -> 18 | J15: =+(K15+L15)+0.5*M15 -> 57.62 | K15: 26.77 | L15: 24.85 | M15: =3+4+2+3 -> 12 | N15: =+(O15+P15)+0.5*Q15 -> 51.15 | O15: 24.21 | P15: 24.94 | Q15: 4 | R15: =+(S15+T15)+0.5*U15 -> 66.10 | S15: 30.79 | T15: 29.81 | U15: =1+1+2+3+1+3 -> 11 | V15: =+(W15+X15)+0.5*Y15 -> 59.81 | W15: 25.47 | X15: 25.34 | Y15: =2+3+2+1+10 -> 18 | Z15: =+(AA15+AB15)+0.5*AC15 -> 61.69 | AA15: 35.88 | AB15: 25.81 | AC15: 0
A16: 3 | B16: Vollmer, Phil | C16: T | D16: =+F16+J16+N16+R16+V16+Z16 -> 394.28 | E16: =+I16+M16+Q16+U16+Y16+AC16 -> 99 | F16: =+(G16+H16)+(0.5*I16) -> 92.80 | G16: 37.34 | H16: 33.96 | I16: =10+10+3+6+3+3+8 -> 43 | J16: =+(K16+L16)+0.5*M16 -> 56.33 | K16: 23.27 | L16: 23.56 | M16: =6+3+5+5 -> 19 | N16: =+(O16+P16)+0.5*Q16 -> 59.62 | O16: 26.64 | P16: 29.48 | Q16: =1+1+2+3 -> 7 | R16: =+(S16+T16)+0.5*U16 -> 57.23 | S16: 25.98 | T16: 22.75 | U16: =1+4+4+5+3 -> 17 | V16: =+(W16+X16)+0.5*Y16 -> 77.38 | W16: 36.17 | X16: 34.71 | Y16: =4+3+2+4 -> 13 | Z16: =+(AA16+AB16)+0.5*AC16 -> 50.92 | AA16: 27.19 | AB16: 23.73 | AC16: 0
A17: 4 | B17: Montgomery, Robert | C17: T | D17: =+F17+J17+N17+R17+V17+Z17 -> 412.38 | E17: =+I17+M17+Q17+U17+Y17+AC17 -> 75 | F17: =+(G17+H17)+(0.5*I17) -> 80.34 | G17: 35.04 | H17: 33.30 | I17: =2+5+2+2+5+5+1+2 -> 24 | J17: =+(K17+L17)+0.5*M17 -> 49.97 | K17: 24.69 | L17: 23.78 | M17: 3 | N17: =+(O17+P17)+0.5*Q17 -> 61.62 | O17: 28.84 | P17: 27.28 | Q17: =1+3+1+4+2 -> 11 | R17: =+(S17+T17)+0.5*U17 -> 81.92 | S17: 35.46 | T17: 34.46 | U17: =1+2+7+4+4+6 -> 24 | V17: =+(W17+X17)+0.5*Y17 -> 67.95 | W17: 31.23 | X17: 30.22 | Y17: =6+5+2 -> 13 | Z17: =+(AA17+AB17)+0.5*AC17 -> 70.58 | AA17: 26.47 | AB17: 44.11 | AC17: 0
A18: 5 | B18: Lauritzen, Scott | C18: T | D18: =+F18+J18+N18+R18+V18+Z18 -> 419.75 | E18: =+I18+M18+Q18+U18+Y18+AC18 -> 82 | F18: =+(G18+H18)+(0.5*I18) -> 78.06 | G18: 37.95 | H18: 32.11 | I18: =2+3+2+1+2+5+1 -> 16 | J18: =+(K18+L18)+0.5*M18 -> 64.03 | K18: 25.73 | L18: 24.30 | M18: =3+9+2+4+10 -> 28 | N18: =+(O18+P18)+0.5*Q18 -> 68.71 | O18: 29.25 | P18: 34.96 | Q18: =1+2+2+4 -> 9 | R18: =+(S18+T18)+0.5*U18 -> 68.76 | S18: 29.37 | T18: 26.89 | U18: =2+4+7+3+6+3 -> 25 | V18: =+(W18+X18)+0.5*Y18 -> 74.59 | W18: 37.70 | X18: 34.89 | Y18: 4 | Z18: =+(AA18+AB18)+0.5*AC18 -> 65.60 | AA18: 32.81 | AB18: 32.79 | AC18: 0
A19: 6 | B19: Decker, Dennis | C19: T | D19: =+F19+J19+N19+R19+V19+Z19 -> 455.75 | E19: =+I19+M19+Q19+U19+Y19+AC19 -> 124 | F19: =+(G19+H19)+(0.5*I19) -> 106.40 | G19: 45.09 | H19: 36.81 | I19: =1+1+5+6+5+3+16+12 -> 49 | J19: =+(K19+L19)+0.5*M19 -> 68.70 | K19: 24.69 | L19: 33.51 | M19: =6+4+8+3 -> 21 | N19: =+(O19+P19)+0.5*Q19 -> 68.82 | O19: 32.06 | P19: 28.26 | Q19: =2+4+6+3+2 -> 17 | R19: =+(S19+T19)+0.5*U19 -> 72.03 | S19: 29.90 | T19: 27.13 | U19: =2+3+8+7+6+4 -> 30 | V19: =+(W19+X19)+0.5*Y19 -> 69.29 | W19: 34.74 | X19: 31.05 | Y19: =2+2+3 -> 7 | Z19: =+(AA19+AB19)+0.5*AC19 -> 70.51 | AA19: 31.59 | AB19: 38.92 | AC19: 0
A20: 7 | B20: Rodriquez, Mike | C20: T | D20: =+F20+J20+N20+R20+V20+Z20 -> 464.09 | E20: =+I20+M20+Q20+U20+Y20+AC20 -> 71 | F20: =+(G20+H20)+(0.5*I20) -> 82.93 | G20: 38.36 | H20: 35.07 | I20: =3+2+2+6+1+2+1+2 -> 19 | J20: =+(K20+L20)+0.5*M20 -> 89.72 | K20: 41.96 | L20: 41.26 | M20: =3+3+3+4 -> 13 | N20: =+(O20+P20)+0.5*Q20 -> 63.23 | O20: 31.55 | P20: 26.68 | Q20: =2+2+3+3 -> 10 | R20: =+(S20+T20)+0.5*U20 -> 71.58 | S20: 28.98 | T20: 32.60 | U20: =1+2+6+2+2+7 -> 20 | V20: =+(W20+X20)+0.5*Y20 -> 78.42 | W20: 42.06 | X20: 31.86 | Y20: =1+6+2 -> 9 | Z20: =+(AA20+AB20)+0.5*AC20 -> 78.21 | AA20: 48.53 | AB20: 29.68 | AC20: 0
A21: 8 | B21: Pres, Peter | C21: T | D21: =+F21+J21+N21+R21+V21+Z21 -> 534.93 | E21: =+I21+M21+Q21+U21+Y21+AC21 -> 155 | F21: =+(G21+H21)+(0.5*I21) -> 127.39 | G21: 61.62 | H21: 29.27 | I21: =3+7+10+11+6+16+14+6 -> 73 | J21: =+(K21+L21)+0.5*M21 -> 82.49 | K21: 39.40 | L21: 27.59 | M21: =14+5+3+9 -> 31 | N21: =+(O21+P21)+0.5*Q21 -> 76.70 | O21: 33.32 | P21: 36.88 | Q21: =3+1+4+3+2 -> 13 | R21: =+(S21+T21)+0.5*U21 -> 86.98 | S21: 35.59 | T21: 36.39 | U21: =4+12+7+5+2 -> 30 | V21: =+(W21+X21)+0.5*Y21 -> 88.83 | W21: 48.96 | X21: 35.87 | Y21: =2+2+2+2 -> 8 | Z21: =+(AA21+AB21)+0.5*AC21 -> 72.54 | AA21: 40.45 | AB21: 32.09 | AC21: 0
A23: 1 | B23: Outzen, Craig | C23: TRO | D23: =+F23+J23+N23+R23+V23+Z23 -> 267.54 | E23: =+I23+M23+Q23+U23+Y23+AC23 -> 62 | F23: =+(G23+H23)+(0.5*I23) -> 53.02 | G23: 21.98 | H23: 23.54 | I23: =3+2+1+1+2+1+5 -> 15 | J23: =+(K23+L23)+0.5*M23 -> 44.93 | K23: 20.24 | L23: 15.19 | M23: =8+6+1+4 -> 19 | N23: =+(O23+P23)+0.5*Q23 -> 44.52 | O23: 21.47 | P23: 22.05 | Q23: 2 | R23: =+(S23+T23)+0.5*U23 -> 44.55 | S23: 18.33 | T23: 17.22 | U23: =3+1+6+1+4+3 -> 18 | V23: =+(W23+X23)+0.5*Y23 -> 40.90 | W23: 18.16 | X23: 18.74 | Y23: =2+4+1+1 -> 8 | Z23: =+(AA23+AB23)+0.5*AC23 -> 39.62 | AA23: 20.31 | AB23: 19.31 | AC23: 0
A24: 2 | B24: Marshall, Bob | C24: TRO | D24: =+F24+J24+N24+R24+V24+Z24 -> 277.80 | E24: =+I24+M24+Q24+U24+Y24+AC24 -> 49 | F24: =+(G24+H24)+(0.5*I24) -> 51.37 | G24: 24.38 | H24: 19.49 | I24: =2+2+4+3+3+1 -> 15 | J24: =+(K24+L24)+0.5*M24 -> 49.94 | K24: 32.30 | L24: 16.14 | M24: 3 | N24: =+(O24+P24)+0.5*Q24 -> 44.12 | O24: 21.92 | P24: 20.20 | Q24: 4 | R24: =+(S24+T24)+0.5*U24 -> 46.91 | S24: 19.86 | T24: 20.05 | U24: 14 | V24: =+(W24+X24)+0.5*Y24 -> 45.12 | W24: 18.12 | X24: 20.50 | Y24: =3+4+4+2 -> 13 | Z24: =+(AA24+AB24)+0.5*AC24 -> 40.34 | AA24: 20.59 | AB24: 19.75 | AC24: 0
A25: 3 | B25: Theodore, Ari | C25: TRO | D25: =+F25+J25+N25+R25+V25+Z25 -> 314.05 | E25: =+I25+M25+Q25+U25+Y25+AC25 -> 71 | F25: =+(G25+H25)+(0.5*I25) -> 62.40 | G25: 26.65 | H25: 26.75 | I25: =1+4+3+5+5 -> 18 | J25: =+(K25+L25)+0.5*M25 -> 49.86 | K25: 18.05 | L25: 27.31 | M25: =1+2+3+3 -> 9 | N25: =+(O25+P25)+0.5*Q25 -> 50.89 | O25: 27.16 | P25: 21.73 | Q25: 4 | R25: =+(S25+T25)+0.5*U25 -> 54.29 | S25: 20.86 | T25: 23.93 | U25: =1+10+2+3+3 -> 19 | V25: =+(W25+X25)+0.5*Y25 -> 57.14 | W25: 25.17 | X25: 21.47 | Y25: =4+4+7+6 -> 21 | Z25: =+(AA25+AB25)+0.5*AC25 -> 39.47 | AA25: 17.16 | AB25: 22.31 | AC25: 0
A26: 4 | B26: Ostler, Jeff | C26: TRO | D26: =+F26+J26+N26+R26+V26+Z26 -> 316.67 | E26: =+I26+M26+Q26+U26+Y26+AC26 -> 26 | F26: =+(G26+H26)+(0.5*I26) -> 65.43 | G26: 29.56 | H26: 27.37 | I26: =2+1+3+2+2+7 -> 17 | J26: =+(K26+L26)+0.5*M26 -> 43.98 | K26: 22.28 | L26: 21.70 | M26: 0 | N26: =+(O26+P26)+0.5*Q26 -> 50.52 | O26: 26.73 | P26: 23.79 | Q26: 0 | R26: =+(S26+T26)+0.5*U26 -> 50.49 | S26: 24.54 | T26: 21.95 | U26: =5+2+1 -> 8 | V26: =+(W26+X26)+0.5*Y26 -> 57.40 | W26: 29.35 | X26: 27.55 | Y26: 1 | Z26: =+(AA26+AB26)+0.5*AC26 -> 48.85 | AA26: 22.25 | AB26: 26.60 | AC26: 0
A27: 5 | B27: Langford, Les | C27: TRO | D27: =+F27+J27+N27+R27+V27+Z27 -> 350.56 | E27: =+I27+M27+Q27+U27+Y27+AC27 -> 86 | F27: =+(G27+H27)+(0.5*I27) -> 74.05 | G27: 30.09 | H27: 27.46 | I27: =5+4+8+2+8+4+2 -> 33 | J27: =+(K27+L27)+0.5*M27 -> 47.91 | K27: 19.49 | L27: 18.92 | M27: =4+1+3+11 -> 19 | N27: =+(O27+P27)+0.5*Q27 -> 65.81 | O27: 29.90 | P27: 32.41 | Q27: =2+3+2 -> 7 | R27: =+(S27+T27)+0.5*U27 -> 50.71 | S27: 21.54 | T27: 21.67 | U27: =7+3+3+2 -> 15 | V27: =+(W27+X27)+0.5*Y27 -> 56.65 | W27: 25.85 | X27: 24.80 | Y27: =1+5+4+2 -> 12 | Z27: =+(AA27+AB27)+0.5*AC27 -> 55.43 | AA27: 29.34 | AB27: 26.09 | AC27: 0
A28: 6 | B28: Zaccardi, Pat | C28: TRO | D28: =+F28+J28+N28+R28+V28+Z28 -> 380.55 | E28: =+I28+M28+Q28+U28+Y28+AC28 -> 60 | F28: =+(G28+H28)+(0.5*I28) -> 78.59 | G28: 35.87 | H28: 34.72 | I28: =1+1+1+5+1+1+3+3 -> 16 | J28: =+(K28+L28)+0.5*M28 -> 47.62 | K28: 21.37 | L28: 20.75 | M28: =3+4+4 -> 11 | N28: =+(O28+P28)+0.5*Q28 -> 54.05 | O28: 27.96 | P28: 23.59 | Q28: =1+1+1+1+1 -> 5 | R28: =+(S28+T28)+0.5*U28 -> 69.62 | S28: 32.32 | T28: 30.80 | U28: =5+4+2+2 -> 13 | V28: =+(W28+X28)+0.5*Y28 -> 72.92 | W28: 31.90 | X28: 33.52 | Y28: =1+1+2+1+10 -> 15 | Z28: =+(AA28+AB28)+0.5*AC28 -> 57.75 | AA28: 29.94 | AB28: 27.81 | AC28: 0
A29: 7 | B29: Beck, Dave | C29: TRO | D29: =+F29+J29+N29+R29+V29+Z29 -> 402.90 | E29: =+I29+M29+Q29+U29+Y29+AC29 -> 47 | F29: =+(G29+H29)+(0.5*I29) -> 70.83 | G29: 28.88 | H29: 32.45 | I29: =4+1+4+6+2+2 -> 19 | J29: =+(K29+L29)+0.5*M29 -> 53.31 | K29: 22.87 | L29: 21.94 | M29: =4+5+4+4 -> 17 | N29: =+(O29+P29)+0.5*Q29 -> 80.14 | O29: 41.76 | P29: 37.88 | Q29: 1 | R29: =+(S29+T29)+0.5*U29 -> 78.62 | S29: 41.38 | T29: 34.24 | U29: 6 | V29: =+(W29+X29)+0.5*Y29 -> 58.93 | W29: 32.12 | X29: 24.81 | Y29: 4 | Z29: =+(AA29+AB29)+0.5*AC29 -> 61.07 | AA29: 30.83 | AB29: 30.24 | AC29: 0
A30: 8 | B30: Wong, Hang | C30: TRO | D30: =+F30+J30+N30+R30+V30+Z30 -> 425.87 | E30: =+I30+M30+Q30+U30+Y30+AC30 -> 112 | F30: =+(G30+H30)+(0.5*I30) -> 99.34 | G30: 36.02 | H30: 40.82 | I30: =4+2+2+5+10+9+10+3 -> 45 | J30: =+(K30+L30)+0.5*M30 -> 57.18 | K30: 28.51 | L30: 23.17 | M30: =2+2+3+4 -> 11 | N30: =+(O30+P30)+0.5*Q30 -> 65.67 | O30: 25.31 | P30: 31.86 | Q30: =3+2+6+3+3 -> 17 | R30: =+(S30+T30)+0.5*U30 -> 72.58 | S30: 28.17 | T30: 28.41 | U30: =4+5+5+9+9 -> 32 | V30: =+(W30+X30)+0.5*Y30 -> 61.25 | W30: 29.70 | X30: 28.05 | Y30: 7 | Z30: =+(AA30+AB30)+0.5*AC30 -> 69.85 | AA30: 31.22 | AB30: 38.63 | AC30: 0
A31: 9 | B31: Zaccardi, Juke | C31: TRO | D31: =+F31+J31+N31+R31+V31+Z31 -> 425.96 | E31: =+I31+M31+Q31+U31+Y31+AC31 -> 75 | F31: =+(G31+H31)+(0.5*I31) -> 89.09 | G31: 38.01 | H31: 37.08 | I31: =1+6+1+9+4+3+3+1 -> 28 | J31: =+(K31+L31)+0.5*M31 -> 56.52 | K31: 23.49 | L31: 24.53 | M31: =5+4+4+4 -> 17 | N31: =+(O31+P31)+0.5*Q31 -> 54.00 | O31: 29.68 | P31: 22.82 | Q31: 3 | R31: =+(S31+T31)+0.5*U31 -> 73.53 | S31: 32.63 | T31: 34.40 | U31: =1+10+1+1 -> 13 | V31: =+(W31+X31)+0.5*Y31 -> 70.34 | W31: 31.90 | X31: 31.44 | Y31: =7+4+3 -> 14 | Z31: =+(AA31+AB31)+0.5*AC31 -> 82.48 | AA31: 42.72 | AB31: 39.76 | AC31: 0
A32: 10 | B32: Simpson, Harold | C32: TRO | D32: =+F32+J32+N32+R32+V32+Z32 -> 435.82 | E32: =+I32+M32+Q32+U32+Y32+AC32 -> 78 | F32: =+(G32+H32)+(0.5*I32) -> 88.70 | G32: 44.70 | H32: 34.50 | I32: =1+2+5+3+2+2+4 -> 19 | J32: =+(K32+L32)+0.5*M32 -> 58.61 | K32: 28.92 | L32: 22.69 | M32: =3+5+3+3 -> 14 | N32: =+(O32+P32)+0.5*Q32 -> 71.28 | O32: 33.03 | P32: 30.25 | Q32: =2+2+1+1+10 -> 16 | R32: =+(S32+T32)+0.5*U32 -> 65.27 | S32: 30.00 | T32: 25.27 | U32: =5+5+6+4 -> 20 | V32: =+(W32+X32)+0.5*Y32 -> 58.36 | W32: 27.80 | X32: 26.06 | Y32: =3+1+3+2 -> 9 | Z32: =+(AA32+AB32)+0.5*AC32 -> 93.60 | AA32: 31.96 | AB32: 61.64 | AC32: 0
A33: 11 | B33: Lorenz, David | C33: TRO | D33: =+F33+J33+N33+R33+V33+Z33 -> 437.28 | E33: =+I33+M33+Q33+U33+Y33+AC33 -> 74 | F33: =+(G33+H33)+(0.5*I33) -> 81.81 | G33: 37.99 | H33: 35.82 | I33: =2+3+2+1+1+1+4+2 -> 16 | J33: =+(K33+L33)+0.5*M33 -> 58.12 | K33: 29.72 | L33: 23.40 | M33: =1+1+5+3 -> 10 | N33: =+(O33+P33)+0.5*Q33 -> 75.33 | O33: 32.08 | P33: 35.75 | Q33: =3+4+2+4+2 -> 15 | R33: =+(S33+T33)+0.5*U33 -> 80.60 | S33: 36.03 | T33: 31.07 | U33: =6+2+3+4+9+3 -> 27 | V33: =+(W33+X33)+0.5*Y33 -> 76.68 | W33: 37.65 | X33: 36.03 | Y33: 6 | Z33: =+(AA33+AB33)+0.5*AC33 -> 64.74 | AA33: 27.50 | AB33: 37.24 | AC33: 0
A34: 12 | B34: Brown, Keith | C34: TRO | D34: =+F34+J34+N34+R34+V34+Z34 -> 440.07 | E34: =+I34+M34+Q34+U34+Y34+AC34 -> 71 | F34: =+(G34+H34)+(0.5*I34) -> 105.09 | G34: 45.26 | H34: 36.83 | I34: =5+8+7+4+6+7+9 -> 46 | J34: =+(K34+L34)+0.5*M34 -> 50.24 | K34: 24.75 | L34: 22.49 | M34: =3+1+2 -> 6 | N34: =+(O34+P34)+0.5*Q34 -> 66.29 | O34: 35.51 | P34: 28.78 | Q34: 4 | R34: =+(S34+T34)+0.5*U34 -> 62.40 | S34: 28.52 | T34: 28.38 | U34: =1+5+1+2+2 -> 11 | V34: =+(W34+X34)+0.5*Y34 -> 97.72 | W34: 41.96 | X34: 53.76 | Y34: 4 | Z34: =+(AA34+AB34)+0.5*AC34 -> 58.33 | AA34: 24.36 | AB34: 33.97 | AC34: 0
A35: 13 | B35: Scott, Alan | C35: TRO | D35: =+F35+J35+N35+R35+V35+Z35 -> 458.64 | E35: =+I35+M35+Q35+U35+Y35+AC35 -> 89 | F35: =+(G35+H35)+(0.5*I35) -> 116.46 | G35: 52.75 | H35: 42.71 | I35: =4+6+9+5+4+3+7+4 -> 42 | J35: =+(K35+L35)+0.5*M35 -> 63.34 | K35: 28.53 | L35: 27.31 | M35: =5+4+3+3 -> 15 | N35: =+(O35+P35)+0.5*Q35 -> 69.37 | O35: 35.73 | P35: 31.64 | Q35: 4 | R35: =+(S35+T35)+0.5*U35 -> 65.54 | S35: 32.94 | T35: 26.60 | U35: =1+2+2+4+3 -> 12 | V35: =+(W35+X35)+0.5*Y35 -> 69.99 | W35: 47.37 | X35: 14.62 | Y35: =2+2+2+10 -> 16 | Z35: =+(AA35+AB35)+0.5*AC35 -> 73.94 | AA35: 42.24 | AB35: 31.70 | AC35: 0
A36: 14 | B36: Stone, Scott | C36: TRO | D36: =+F36+J36+N36+R36+V36+Z36 -> 472.35 | E36: =+I36+M36+Q36+U36+Y36+AC36 -> 105 | F36: =+(G36+H36)+(0.5*I36) -> 102.11 | G36: 32.73 | H36: 50.38 | I36: =3+7+1+3+5+9+5+5 -> 38 | J36: =+(K36+L36)+0.5*M36 -> 62.70 | K36: 23.00 | L36: 37.20 | M36: =1+1+3 -> 5 | N36: =+(O36+P36)+0.5*Q36 -> 73.76 | O36: 37.87 | P36: 29.39 | Q36: =3+1+4+5 -> 13 | R36: =+(S36+T36)+0.5*U36 -> 83.37 | S36: 37.24 | T36: 33.13 | U36: =8+5+3+4+2+4 -> 26 | V36: =+(W36+X36)+0.5*Y36 -> 79.30 | W36: 32.01 | X36: 35.79 | Y36: =10+8+1+4 -> 23 | Z36: =+(AA36+AB36)+0.5*AC36 -> 71.11 | AA36: 40.80 | AB36: 30.31 | AC36: 0
A37: 15 | B37: Durning, William | C37: TRO | D37: =+F37+J37+N37+R37+V37+Z37 -> 484.06 | E37: =+I37+M37+Q37+U37+Y37+AC37 -> 172 | F37: =+(G37+H37)+(0.5*I37) -> 98.35 | G37: 41.17 | H37: 34.68 | I37: =9+10+2+2+3+2+8+9 -> 45 | J37: =+(K37+L37)+0.5*M37 -> 64.73 | K37: 20.23 | L37: 23.50 | M37: =6+8+5+13+10 -> 42 | N37: =+(O37+P37)+0.5*Q37 -> 79.17 | O37: 37.11 | P37: 35.06 | Q37: =2+3+4+2+3 -> 14 | R37: =+(S37+T37)+0.5*U37 -> 72.27 | S37: 24.67 | T37: 27.10 | U37: =5+5+8+10+6+7 -> 41 | V37: =+(W37+X37)+0.5*Y37 -> 91.83 | W37: 41.78 | X37: 35.05 | Y37: =4+14+5+7 -> 30 | Z37: =+(AA37+AB37)+0.5*AC37 -> 77.71 | AA37: 37.40 | AB37: 40.31 | AC37: 0
A38: 16 | B38: Willard, Jason | C38: TRO | D38: =+F38+J38+N38+R38+V38+Z38 -> 542.68 | E38: =+I38+M38+Q38+U38+Y38+AC38 -> 107 | F38: =+(G38+H38)+(0.5*I38) -> 106.73 | G38: 52.29 | H38: 44.94 | I38: =6+5+1+1+2+4 -> 19 | J38: =+(K38+L38)+0.5*M38 -> 80.97 | K38: 35.23 | L38: 34.24 | M38: =6+6+5+6 -> 23 | N38: =+(O38+P38)+0.5*Q38 -> 80.32 | O38: 41.30 | P38: 34.52 | Q38: =3+1+3+2 -> 9 | R38: =+(S38+T38)+0.5*U38 -> 88.96 | S38: 37.94 | T38: 34.02 | U38: =10+10+3+5+5+1 -> 34 | V38: =+(W38+X38)+0.5*Y38 -> 123.59 | W38: 61.65 | X38: 50.94 | Y38: =1+3+10+2+6 -> 22 | Z38: =+(AA38+AB38)+0.5*AC38 -> 62.11 | AA38: 30.94 | AB38: 31.17 | AC38: 0
A39: 17 | B39: Scott, Sam | C39: TRO | D39: =+F39+J39+N39+R39+V39+Z39 -> 547.75 | E39: =+I39+M39+Q39+U39+Y39+AC39 -> 151 | F39: =+(G39+H39)+(0.5*I39) -> 124.56 | G39: 52.36 | H39: 47.20 | I39: =6+2+11+2+8+4+12+5 -> 50 | J39: =+(K39+L39)+0.5*M39 -> 70.14 | K39: 30.76 | L39: 26.88 | M39: =6+3+7+9 -> 25 | N39: =+(O39+P39)+0.5*Q39 -> 80.47 | O39: 41.48 | P39: 38.49 | Q39: 1 | R39: =+(S39+T39)+0.5*U39 -> 79.58 | S39: 33.84 | T39: 24.24 | U39: =1+5+3+2+16+16 -> 43 | V39: =+(W39+X39)+0.5*Y39 -> 108.24 | W39: 45.77 | X39: 46.47 | Y39: =8+8+2+14 -> 32 | Z39: =+(AA39+AB39)+0.5*AC39 -> 84.76 | AA39: 46.12 | AB39: 38.64 | AC39: 0
A40: 18 | B40: Scott, Michael | C40: TRO | D40: =+F40+J40+N40+R40+V40+Z40 -> 556.61 | E40: =+I40+M40+Q40+U40+Y40+AC40 -> 73 | F40: =+(G40+H40)+(0.5*I40) -> 111.39 | G40: 53.00 | H40: 49.89 | I40: =6+2+1+4+2+1+1 -> 17 | J40: =+(K40+L40)+0.5*M40 -> 77.69 | K40: 41.48 | L40: 30.21 | M40: =6+2+1+3 -> 12 | N40: =+(O40+P40)+0.5*Q40 -> 80.14 | O40: 41.09 | P40: 39.05 | Q40: 0 | R40: =+(S40+T40)+0.5*U40 -> 88.29 | S40: 40.77 | T40: 32.52 | U40: =10+7+5+2+6 -> 30 | V40: =+(W40+X40)+0.5*Y40 -> 95.77 | W40: 42.02 | X40: 46.75 | Y40: =2+2+5+5 -> 14 | Z40: =+(AA40+AB40)+0.5*AC40 -> 103.33 | AA40: 39.54 | AB40: 63.79 | AC40: 0
A41: 19 | B41: Brownlee, Mike | C41: TRO | D41: =+F41+J41+N41+R41+V41+Z41 -> 559.90 | E41: =+I41+M41+Q41+U41+Y41+AC41 -> 116 | F41: =+(G41+H41)+(0.5*I41) -> 114.35 | G41: 40.83 | H41: 42.52 | I41: =4+9+8+15+14+2+6+4 -> 62 | J41: =+(K41+L41)+0.5*M41 -> 80.82 | K41: 37.88 | L41: 38.44 | M41: =7+2 -> 9 | N41: =+(O41+P41)+0.5*Q41 -> 65.17 | O41: 32.91 | P41: 32.26 | Q41: 0 | R41: =+(S41+T41)+0.5*U41 -> 120.59 | S41: 51.32 | T41: 58.77 | U41: =5+10+1+5 -> 21 | V41: =+(W41+X41)+0.5*Y41 -> 100.88 | W41: 42.01 | X41: 46.87 | Y41: =6+9+5+4 -> 24 | Z41: =+(AA41+AB41)+0.5*AC41 -> 78.09 | AA41: 23.25 | AB41: 54.84 | AC41: 0
A42: 20 | B42: Murray, Bob | C42: TRO | D42: =+F42+J42+N42+R42+V42+Z42 -> 629.65 | E42: =+I42+M42+Q42+U42+Y42+AC42 -> 171 | F42: =+(G42+H42)+(0.5*I42) -> 100.70 | G42: 36.67 | H42: 35.53 | I42: =2+4+8+6+6+14+5+12 -> 57 | J42: =+(K42+L42)+0.5*M42 -> 86.86 | K42: 30.99 | L42: 42.87 | M42: =4+4+8+10 -> 26 | N42: =+(O42+P42)+0.5*Q42 -> 102.59 | O42: 46.75 | P42: 43.84 | Q42: =3+4+3+10+4 -> 24 | R42: =+(S42+T42)+0.5*U42 -> 93.13 | S42: 30.61 | T42: 39.02 | U42: =10+1+6+5+16+9 -> 47 | V42: =+(W42+X42)+0.5*Y42 -> 131.19 | W42: 68.36 | X42: 54.33 | Y42: =8+2+3+4 -> 17 | Z42: =+(AA42+AB42)+0.5*AC42 -> 115.18 | AA42: 67.39 | AB42: 47.79 | AC42: 0
A43: 21 | B43: Ostler, Jay | C43: TRO | D43: =+F43+J43+N43+R43+V43+Z43 -> 685.06 | E43: =+I43+M43+Q43+U43+Y43+AC43 -> 64 | F43: =+(G43+H43)+(0.5*I43) -> 135.30 | G43: 79.60 | H43: 40.20 | I43: =3+1+3+6+5+7+6 -> 31 | J43: =+(K43+L43)+0.5*M43 -> 100.72 | K43: 54.52 | L43: 43.70 | M43: =2+2+1 -> 5 | N43: =+(O43+P43)+0.5*Q43 -> 103.94 | O43: 44.56 | P43: 57.38 | Q43: 4 | R43: =+(S43+T43)+0.5*U43 -> 86.53 | S43: 41.83 | T43: 36.70 | U43: =5+5+2+1+2+1 -> 16 | V43: =+(W43+X43)+0.5*Y43 -> 153.62 | W43: 75.17 | X43: 74.45 | Y43: =1+2+2+2+1 -> 8 | Z43: =+(AA43+AB43)+0.5*AC43 -> 104.95 | AA43: 67.62 | AB43: 37.33 | AC43: 0
A44: 22 | B44: Koch, Rodney | C44: TRO | D44: =+F44+J44+N44+R44+V44+Z44 -> 742.43 | E44: =+I44+M44+Q44+U44+Y44+AC44 -> 207 | F44: =+(G44+H44)+(0.5*I44) -> 145.37 | G44: 58.78 | H44: 51.09 | I44: =14+11+11+4+12+10+1+8 -> 71 | J44: =+(K44+L44)+0.5*M44 -> 90.36 | K44: 26.08 | L44: 33.28 | M44: =12+20+16+14 -> 62 | N44: =+(O44+P44)+0.5*Q44 -> 88.70 | O44: 43.34 | P44: 42.36 | Q44: 6 | R44: =+(S44+T44)+0.5*U44 -> 144.99 | S44: 76.63 | T44: 45.36 | U44: =1+5+14+12+3+11 -> 46 | V44: =+(W44+X44)+0.5*Y44 -> 151.77 | W44: 53.56 | X44: 87.21 | Y44: =5+7+5+5 -> 22 | Z44: =+(AA44+AB44)+0.5*AC44 -> 121.24 | AA44: 70.56 | AB44: 50.68 | AC44: 0
A45: Notes:
A46: - | B46: Div * - Refer to the UDPL 3-Gun Division Specifications for specifics on each Division.
B47: L = | C47: LIMITED
B48: T = | C48: TACTICAL
B49: TRO = | C49: TACTICAL RIFLE-OPTICAL
B50: O = | C50: OPEN
A51: PD | B51: = Points Down = .5 seconds x Points Down. PD Total is added to the total Stage time.
A52: XX | B52: = Indicates that the Points Down value includes some kind of penalty (Procedural Error, Hits on Non-Threat, Misses on Steel (5 seconds each), etc.).
A53: DNF | B53: = Did Not Finish
A54: NS | B54: = No Score was recorded for this string. Shooter placed lower than indicated.
A55: ? | B55: = Shooter did not indicate which Division he should be scored in.