B1: UDPL 3-Gun Match - Results for November 20, 2004 held at the F.A.R.M.
B2: (Results listed by Time without regard to Division) | J2: To see a description of each Stage, click on the Stage #.
B3: Click here for results by DIVISION.
A4: Place | B4: Name | C4: Div * | D4: Shoot Total | E4: Total Points Down | F4: Stage 1 | G4: String 1 | H4: String 2 | I4: PD | J4: Stage 2 | K4: String 1 | L4: String 2 | M4: PD | N4: Stage 3 | O4: String 1 | P4: String 2 | Q4: PD | R4: Stage 4 | S4: String 1 | T4: String 2 | U4: PD | V4: Stage 5 | W4: String 1 | X4: String 2 | Y4: PD | Z4: Stage 6 | AA4: String 1 | AB4: String 2 | AC4: PD
A5: 1 | B5: Outzen, Craig | C5: TRO | D5: =+F5+J5+N5+R5+V5+Z5 -> 267.54 | E5: =+I5+M5+Q5+U5+Y5+AC5 -> 62 | F5: =+(G5+H5)+(0.5*I5) -> 53.02 | G5: 21.98 | H5: 23.54 | I5: =3+2+1+1+2+1+5 -> 15 | J5: =+(K5+L5)+0.5*M5 -> 44.93 | K5: 20.24 | L5: 15.19 | M5: =8+6+1+4 -> 19 | N5: =+(O5+P5)+0.5*Q5 -> 44.52 | O5: 21.47 | P5: 22.05 | Q5: 2 | R5: =+(S5+T5)+0.5*U5 -> 44.55 | S5: 18.33 | T5: 17.22 | U5: =3+1+6+1+4+3 -> 18 | V5: =+(W5+X5)+0.5*Y5 -> 40.90 | W5: 18.16 | X5: 18.74 | Y5: =2+4+1+1 -> 8 | Z5: =+(AA5+AB5)+0.5*AC5 -> 39.62 | AA5: 20.31 | AB5: 19.31 | AC5: 0
A6: 2 | B6: Marshall, Bob | C6: TRO | D6: =+F6+J6+N6+R6+V6+Z6 -> 277.80 | E6: =+I6+M6+Q6+U6+Y6+AC6 -> 49 | F6: =+(G6+H6)+(0.5*I6) -> 51.37 | G6: 24.38 | H6: 19.49 | I6: =2+2+4+3+3+1 -> 15 | J6: =+(K6+L6)+0.5*M6 -> 49.94 | K6: 32.30 | L6: 16.14 | M6: 3 | N6: =+(O6+P6)+0.5*Q6 -> 44.12 | O6: 21.92 | P6: 20.20 | Q6: 4 | R6: =+(S6+T6)+0.5*U6 -> 46.91 | S6: 19.86 | T6: 20.05 | U6: 14 | V6: =+(W6+X6)+0.5*Y6 -> 45.12 | W6: 18.12 | X6: 20.50 | Y6: =3+4+4+2 -> 13 | Z6: =+(AA6+AB6)+0.5*AC6 -> 40.34 | AA6: 20.59 | AB6: 19.75 | AC6: 0
A7: 3 | B7: Theodore, Ari | C7: TRO | D7: =+F7+J7+N7+R7+V7+Z7 -> 314.05 | E7: =+I7+M7+Q7+U7+Y7+AC7 -> 71 | F7: =+(G7+H7)+(0.5*I7) -> 62.40 | G7: 26.65 | H7: 26.75 | I7: =1+4+3+5+5 -> 18 | J7: =+(K7+L7)+0.5*M7 -> 49.86 | K7: 18.05 | L7: 27.31 | M7: =1+2+3+3 -> 9 | N7: =+(O7+P7)+0.5*Q7 -> 50.89 | O7: 27.16 | P7: 21.73 | Q7: 4 | R7: =+(S7+T7)+0.5*U7 -> 54.29 | S7: 20.86 | T7: 23.93 | U7: =1+10+2+3+3 -> 19 | V7: =+(W7+X7)+0.5*Y7 -> 57.14 | W7: 25.17 | X7: 21.47 | Y7: =4+4+7+6 -> 21 | Z7: =+(AA7+AB7)+0.5*AC7 -> 39.47 | AA7: 17.16 | AB7: 22.31 | AC7: 0
A8: 4 | B8: Ostler, Jeff | C8: TRO | D8: =+F8+J8+N8+R8+V8+Z8 -> 316.67 | E8: =+I8+M8+Q8+U8+Y8+AC8 -> 26 | F8: =+(G8+H8)+(0.5*I8) -> 65.43 | G8: 29.56 | H8: 27.37 | I8: =2+1+3+2+2+7 -> 17 | J8: =+(K8+L8)+0.5*M8 -> 43.98 | K8: 22.28 | L8: 21.70 | M8: 0 | N8: =+(O8+P8)+0.5*Q8 -> 50.52 | O8: 26.73 | P8: 23.79 | Q8: 0 | R8: =+(S8+T8)+0.5*U8 -> 50.49 | S8: 24.54 | T8: 21.95 | U8: =5+2+1 -> 8 | V8: =+(W8+X8)+0.5*Y8 -> 57.40 | W8: 29.35 | X8: 27.55 | Y8: 1 | Z8: =+(AA8+AB8)+0.5*AC8 -> 48.85 | AA8: 22.25 | AB8: 26.60 | AC8: 0
A9: 5 | B9: Latham, Corey | C9: L | D9: =+F9+J9+N9+R9+V9+Z9 -> 317.09 | E9: =+I9+M9+Q9+U9+Y9+AC9 -> 52 | F9: =+(G9+H9)+(0.5*I9) -> 64.51 | G9: 29.07 | H9: 27.94 | I9: =1+1+6+2+5 -> 15 | J9: =+(K9+L9)+0.5*M9 -> 44.34 | K9: 20.45 | L9: 18.89 | M9: =6+2+2 -> 10 | N9: =+(O9+P9)+0.5*Q9 -> 44.60 | O9: 21.86 | P9: 21.24 | Q9: 3 | R9: =+(S9+T9)+0.5*U9 -> 52.12 | S9: 20.81 | T9: 22.31 | U9: =2+7+2+5+2 -> 18 | V9: =+(W9+X9)+0.5*Y9 -> 51.40 | W9: 23.31 | X9: 25.09 | Y9: =3+2+1 -> 6 | Z9: =+(AA9+AB9)+0.5*AC9 -> 60.12 | AA9: 38.61 | AB9: 21.51 | AC9: 0
A10: 6 | B10: Griffiths, Todd | C10: L | D10: =+F10+J10+N10+R10+V10+Z10 -> 330.54 | E10: =+I10+M10+Q10+U10+Y10+AC10 -> 55 | F10: =+(G10+H10)+(0.5*I10) -> 54.54 | G10: 26.55 | H10: 24.99 | I10: =1+2+1+2 -> 6 | J10: =+(K10+L10)+0.5*M10 -> 59.63 | K10: 22.07 | L10: 28.06 | M10: =4+6+6+3 -> 19 | N10: =+(O10+P10)+0.5*Q10 -> 48.28 | O10: 23.84 | P10: 23.94 | Q10: 1 | R10: =+(S10+T10)+0.5*U10 -> 67.38 | S10: 25.53 | T10: 28.35 | U10: =6+6+2+4+3+6 -> 27 | V10: =+(W10+X10)+0.5*Y10 -> 51.47 | W10: 25.74 | X10: 24.73 | Y10: 2 | Z10: =+(AA10+AB10)+0.5*AC10 -> 49.24 | AA10: 27.85 | AB10: 21.39 | AC10: 0
A11: 7 | B11: Correia, Larry | C11: T | D11: =+F11+J11+N11+R11+V11+Z11 -> 350.43 | E11: =+I11+M11+Q11+U11+Y11+AC11 -> 89 | F11: =+(G11+H11)+(0.5*I11) -> 82.71 | G11: 28.81 | H11: 28.90 | I11: =1+1+7+3+14+20+4 -> 50 | J11: =+(K11+L11)+0.5*M11 -> 51.72 | K11: 20.08 | L11: 22.14 | M11: =7+6+2+4 -> 19 | N11: =+(O11+P11)+0.5*Q11 -> 54.92 | O11: 30.28 | P11: 22.64 | Q11: 4 | R11: =+(S11+T11)+0.5*U11 -> 57.40 | S11: 25.61 | T11: 27.29 | U11: =1+3+2+2+1 -> 9 | V11: =+(W11+X11)+0.5*Y11 -> 57.42 | W11: 27.25 | X11: 26.67 | Y11: =2+2+1+2 -> 7 | Z11: =+(AA11+AB11)+0.5*AC11 -> 46.26 | AA11: 22.77 | AB11: 23.49 | AC11: 0
A12: 8 | B12: Langford, Les | C12: TRO | D12: =+F12+J12+N12+R12+V12+Z12 -> 350.56 | E12: =+I12+M12+Q12+U12+Y12+AC12 -> 86 | F12: =+(G12+H12)+(0.5*I12) -> 74.05 | G12: 30.09 | H12: 27.46 | I12: =5+4+8+2+8+4+2 -> 33 | J12: =+(K12+L12)+0.5*M12 -> 47.91 | K12: 19.49 | L12: 18.92 | M12: =4+1+3+11 -> 19 | N12: =+(O12+P12)+0.5*Q12 -> 65.81 | O12: 29.90 | P12: 32.41 | Q12: =2+3+2 -> 7 | R12: =+(S12+T12)+0.5*U12 -> 50.71 | S12: 21.54 | T12: 21.67 | U12: =7+3+3+2 -> 15 | V12: =+(W12+X12)+0.5*Y12 -> 56.65 | W12: 25.85 | X12: 24.80 | Y12: =1+5+4+2 -> 12 | Z12: =+(AA12+AB12)+0.5*AC12 -> 55.43 | AA12: 29.34 | AB12: 26.09 | AC12: 0
A13: 9 | B13: Lowe, John | C13: T | D13: =+F13+J13+N13+R13+V13+Z13 -> 359.74 | E13: =+I13+M13+Q13+U13+Y13+AC13 -> 63 | F13: =+(G13+H13)+(0.5*I13) -> 63.37 | G13: 28.53 | H13: 25.84 | I13: =1+7+2+1+4+3 -> 18 | J13: =+(K13+L13)+0.5*M13 -> 57.62 | K13: 26.77 | L13: 24.85 | M13: =3+4+2+3 -> 12 | N13: =+(O13+P13)+0.5*Q13 -> 51.15 | O13: 24.21 | P13: 24.94 | Q13: 4 | R13: =+(S13+T13)+0.5*U13 -> 66.10 | S13: 30.79 | T13: 29.81 | U13: =1+1+2+3+1+3 -> 11 | V13: =+(W13+X13)+0.5*Y13 -> 59.81 | W13: 25.47 | X13: 25.34 | Y13: =2+3+2+1+10 -> 18 | Z13: =+(AA13+AB13)+0.5*AC13 -> 61.69 | AA13: 35.88 | AB13: 25.81 | AC13: 0
A14: 10 | B14: Zaccardi, Pat | C14: TRO | D14: =+F14+J14+N14+R14+V14+Z14 -> 380.55 | E14: =+I14+M14+Q14+U14+Y14+AC14 -> 60 | F14: =+(G14+H14)+(0.5*I14) -> 78.59 | G14: 35.87 | H14: 34.72 | I14: =1+1+1+5+1+1+3+3 -> 16 | J14: =+(K14+L14)+0.5*M14 -> 47.62 | K14: 21.37 | L14: 20.75 | M14: =3+4+4 -> 11 | N14: =+(O14+P14)+0.5*Q14 -> 54.05 | O14: 27.96 | P14: 23.59 | Q14: =1+1+1+1+1 -> 5 | R14: =+(S14+T14)+0.5*U14 -> 69.62 | S14: 32.32 | T14: 30.80 | U14: =5+4+2+2 -> 13 | V14: =+(W14+X14)+0.5*Y14 -> 72.92 | W14: 31.90 | X14: 33.52 | Y14: =1+1+2+1+10 -> 15 | Z14: =+(AA14+AB14)+0.5*AC14 -> 57.75 | AA14: 29.94 | AB14: 27.81 | AC14: 0
A15: 11 | B15: Vollmer, Phil | C15: T | D15: =+F15+J15+N15+R15+V15+Z15 -> 394.28 | E15: =+I15+M15+Q15+U15+Y15+AC15 -> 99 | F15: =+(G15+H15)+(0.5*I15) -> 92.80 | G15: 37.34 | H15: 33.96 | I15: =10+10+3+6+3+3+8 -> 43 | J15: =+(K15+L15)+0.5*M15 -> 56.33 | K15: 23.27 | L15: 23.56 | M15: =6+3+5+5 -> 19 | N15: =+(O15+P15)+0.5*Q15 -> 59.62 | O15: 26.64 | P15: 29.48 | Q15: =1+1+2+3 -> 7 | R15: =+(S15+T15)+0.5*U15 -> 57.23 | S15: 25.98 | T15: 22.75 | U15: =1+4+4+5+3 -> 17 | V15: =+(W15+X15)+0.5*Y15 -> 77.38 | W15: 36.17 | X15: 34.71 | Y15: =4+3+2+4 -> 13 | Z15: =+(AA15+AB15)+0.5*AC15 -> 50.92 | AA15: 27.19 | AB15: 23.73 | AC15: 0
A16: 12 | B16: Beck, Dave | C16: TRO | D16: =+F16+J16+N16+R16+V16+Z16 -> 402.90 | E16: =+I16+M16+Q16+U16+Y16+AC16 -> 47 | F16: =+(G16+H16)+(0.5*I16) -> 70.83 | G16: 28.88 | H16: 32.45 | I16: =4+1+4+6+2+2 -> 19 | J16: =+(K16+L16)+0.5*M16 -> 53.31 | K16: 22.87 | L16: 21.94 | M16: =4+5+4+4 -> 17 | N16: =+(O16+P16)+0.5*Q16 -> 80.14 | O16: 41.76 | P16: 37.88 | Q16: 1 | R16: =+(S16+T16)+0.5*U16 -> 78.62 | S16: 41.38 | T16: 34.24 | U16: 6 | V16: =+(W16+X16)+0.5*Y16 -> 58.93 | W16: 32.12 | X16: 24.81 | Y16: 4 | Z16: =+(AA16+AB16)+0.5*AC16 -> 61.07 | AA16: 30.83 | AB16: 30.24 | AC16: 0
A17: 13 | B17: Montgomery, Robert | C17: T | D17: =+F17+J17+N17+R17+V17+Z17 -> 412.38 | E17: =+I17+M17+Q17+U17+Y17+AC17 -> 75 | F17: =+(G17+H17)+(0.5*I17) -> 80.34 | G17: 35.04 | H17: 33.30 | I17: =2+5+2+2+5+5+1+2 -> 24 | J17: =+(K17+L17)+0.5*M17 -> 49.97 | K17: 24.69 | L17: 23.78 | M17: 3 | N17: =+(O17+P17)+0.5*Q17 -> 61.62 | O17: 28.84 | P17: 27.28 | Q17: =1+3+1+4+2 -> 11 | R17: =+(S17+T17)+0.5*U17 -> 81.92 | S17: 35.46 | T17: 34.46 | U17: =1+2+7+4+4+6 -> 24 | V17: =+(W17+X17)+0.5*Y17 -> 67.95 | W17: 31.23 | X17: 30.22 | Y17: =6+5+2 -> 13 | Z17: =+(AA17+AB17)+0.5*AC17 -> 70.58 | AA17: 26.47 | AB17: 44.11 | AC17: 0
A18: 14 | B18: Lauritzen, Scott | C18: T | D18: =+F18+J18+N18+R18+V18+Z18 -> 419.75 | E18: =+I18+M18+Q18+U18+Y18+AC18 -> 82 | F18: =+(G18+H18)+(0.5*I18) -> 78.06 | G18: 37.95 | H18: 32.11 | I18: =2+3+2+1+2+5+1 -> 16 | J18: =+(K18+L18)+0.5*M18 -> 64.03 | K18: 25.73 | L18: 24.30 | M18: =3+9+2+4+10 -> 28 | N18: =+(O18+P18)+0.5*Q18 -> 68.71 | O18: 29.25 | P18: 34.96 | Q18: =1+2+2+4 -> 9 | R18: =+(S18+T18)+0.5*U18 -> 68.76 | S18: 29.37 | T18: 26.89 | U18: =2+4+7+3+6+3 -> 25 | V18: =+(W18+X18)+0.5*Y18 -> 74.59 | W18: 37.70 | X18: 34.89 | Y18: 4 | Z18: =+(AA18+AB18)+0.5*AC18 -> 65.60 | AA18: 32.81 | AB18: 32.79 | AC18: 0
A19: 15 | B19: Wong, Hang | C19: TRO | D19: =+F19+J19+N19+R19+V19+Z19 -> 425.87 | E19: =+I19+M19+Q19+U19+Y19+AC19 -> 112 | F19: =+(G19+H19)+(0.5*I19) -> 99.34 | G19: 36.02 | H19: 40.82 | I19: =4+2+2+5+10+9+10+3 -> 45 | J19: =+(K19+L19)+0.5*M19 -> 57.18 | K19: 28.51 | L19: 23.17 | M19: =2+2+3+4 -> 11 | N19: =+(O19+P19)+0.5*Q19 -> 65.67 | O19: 25.31 | P19: 31.86 | Q19: =3+2+6+3+3 -> 17 | R19: =+(S19+T19)+0.5*U19 -> 72.58 | S19: 28.17 | T19: 28.41 | U19: =4+5+5+9+9 -> 32 | V19: =+(W19+X19)+0.5*Y19 -> 61.25 | W19: 29.70 | X19: 28.05 | Y19: 7 | Z19: =+(AA19+AB19)+0.5*AC19 -> 69.85 | AA19: 31.22 | AB19: 38.63 | AC19: 0
A20: 16 | B20: Zaccardi, Juke | C20: TRO | D20: =+F20+J20+N20+R20+V20+Z20 -> 425.96 | E20: =+I20+M20+Q20+U20+Y20+AC20 -> 75 | F20: =+(G20+H20)+(0.5*I20) -> 89.09 | G20: 38.01 | H20: 37.08 | I20: =1+6+1+9+4+3+3+1 -> 28 | J20: =+(K20+L20)+0.5*M20 -> 56.52 | K20: 23.49 | L20: 24.53 | M20: =5+4+4+4 -> 17 | N20: =+(O20+P20)+0.5*Q20 -> 54.00 | O20: 29.68 | P20: 22.82 | Q20: 3 | R20: =+(S20+T20)+0.5*U20 -> 73.53 | S20: 32.63 | T20: 34.40 | U20: =1+10+1+1 -> 13 | V20: =+(W20+X20)+0.5*Y20 -> 70.34 | W20: 31.90 | X20: 31.44 | Y20: =7+4+3 -> 14 | Z20: =+(AA20+AB20)+0.5*AC20 -> 82.48 | AA20: 42.72 | AB20: 39.76 | AC20: 0
A21: 17 | B21: Simpson, Harold | C21: TRO | D21: =+F21+J21+N21+R21+V21+Z21 -> 435.82 | E21: =+I21+M21+Q21+U21+Y21+AC21 -> 78 | F21: =+(G21+H21)+(0.5*I21) -> 88.70 | G21: 44.70 | H21: 34.50 | I21: =1+2+5+3+2+2+4 -> 19 | J21: =+(K21+L21)+0.5*M21 -> 58.61 | K21: 28.92 | L21: 22.69 | M21: =3+5+3+3 -> 14 | N21: =+(O21+P21)+0.5*Q21 -> 71.28 | O21: 33.03 | P21: 30.25 | Q21: =2+2+1+1+10 -> 16 | R21: =+(S21+T21)+0.5*U21 -> 65.27 | S21: 30.00 | T21: 25.27 | U21: =5+5+6+4 -> 20 | V21: =+(W21+X21)+0.5*Y21 -> 58.36 | W21: 27.80 | X21: 26.06 | Y21: =3+1+3+2 -> 9 | Z21: =+(AA21+AB21)+0.5*AC21 -> 93.60 | AA21: 31.96 | AB21: 61.64 | AC21: 0
A22: 18 | B22: Lorenz, David | C22: TRO | D22: =+F22+J22+N22+R22+V22+Z22 -> 437.28 | E22: =+I22+M22+Q22+U22+Y22+AC22 -> 74 | F22: =+(G22+H22)+(0.5*I22) -> 81.81 | G22: 37.99 | H22: 35.82 | I22: =2+3+2+1+1+1+4+2 -> 16 | J22: =+(K22+L22)+0.5*M22 -> 58.12 | K22: 29.72 | L22: 23.40 | M22: =1+1+5+3 -> 10 | N22: =+(O22+P22)+0.5*Q22 -> 75.33 | O22: 32.08 | P22: 35.75 | Q22: =3+4+2+4+2 -> 15 | R22: =+(S22+T22)+0.5*U22 -> 80.60 | S22: 36.03 | T22: 31.07 | U22: =6+2+3+4+9+3 -> 27 | V22: =+(W22+X22)+0.5*Y22 -> 76.68 | W22: 37.65 | X22: 36.03 | Y22: 6 | Z22: =+(AA22+AB22)+0.5*AC22 -> 64.74 | AA22: 27.50 | AB22: 37.24 | AC22: 0
A23: 19 | B23: DeLeeuw, Dave | C23: O | D23: =+F23+J23+N23+R23+V23+Z23 -> 438.39 | E23: =+I23+M23+Q23+U23+Y23+AC23 -> 32 | F23: =+(G23+H23)+(0.5*I23) -> 82.69 | G23: 48.44 | H23: 32.25 | I23: =1+2+1 -> 4 | J23: =+(K23+L23)+0.5*M23 -> 63.10 | K23: 32.14 | L23: 29.96 | M23: 2 | N23: =+(O23+P23)+0.5*Q23 -> 73.01 | O23: 39.21 | P23: 32.80 | Q23: 2 | R23: =+(S23+T23)+0.5*U23 -> 80.28 | S23: 39.56 | T23: 30.72 | U23: =8+1+4+3+2+2 -> 20 | V23: =+(W23+X23)+0.5*Y23 -> 80.10 | W23: 37.06 | X23: 41.04 | Y23: 4 | Z23: =+(AA23+AB23)+0.5*AC23 -> 59.21 | AA23: 32.87 | AB23: 26.34 | AC23: 0
A24: 20 | B24: Brown, Keith | C24: TRO | D24: =+F24+J24+N24+R24+V24+Z24 -> 440.07 | E24: =+I24+M24+Q24+U24+Y24+AC24 -> 71 | F24: =+(G24+H24)+(0.5*I24) -> 105.09 | G24: 45.26 | H24: 36.83 | I24: =5+8+7+4+6+7+9 -> 46 | J24: =+(K24+L24)+0.5*M24 -> 50.24 | K24: 24.75 | L24: 22.49 | M24: =3+1+2 -> 6 | N24: =+(O24+P24)+0.5*Q24 -> 66.29 | O24: 35.51 | P24: 28.78 | Q24: 4 | R24: =+(S24+T24)+0.5*U24 -> 62.40 | S24: 28.52 | T24: 28.38 | U24: =1+5+1+2+2 -> 11 | V24: =+(W24+X24)+0.5*Y24 -> 97.72 | W24: 41.96 | X24: 53.76 | Y24: 4 | Z24: =+(AA24+AB24)+0.5*AC24 -> 58.33 | AA24: 24.36 | AB24: 33.97 | AC24: 0
A25: 21 | B25: Young, Ren | C25: O | D25: =+F25+J25+N25+R25+V25+Z25 -> 448.51 | E25: =+I25+M25+Q25+U25+Y25+AC25 -> 89 | F25: =+(G25+H25)+(0.5*I25) -> 90.73 | G25: 38.37 | H25: 36.86 | I25: =6+3+3+2+4+6+3+4 -> 31 | J25: =+(K25+L25)+0.5*M25 -> 85.93 | K25: 40.55 | L25: 40.38 | M25: =2+2+6 -> 10 | N25: =+(O25+P25)+0.5*Q25 -> 66.01 | O25: 34.24 | P25: 27.77 | Q25: =2+1+5 -> 8 | R25: =+(S25+T25)+0.5*U25 -> 78.53 | S25: 24.93 | T25: 39.10 | U25: =5+10+2+2+7+3 -> 29 | V25: =+(W25+X25)+0.5*Y25 -> 64.03 | W25: 26.05 | X25: 32.48 | Y25: =3+1+4+3 -> 11 | Z25: =+(AA25+AB25)+0.5*AC25 -> 63.28 | AA25: 29.08 | AB25: 34.20 | AC25: 0
A26: 22 | B26: Decker, Dennis | C26: T | D26: =+F26+J26+N26+R26+V26+Z26 -> 455.75 | E26: =+I26+M26+Q26+U26+Y26+AC26 -> 124 | F26: =+(G26+H26)+(0.5*I26) -> 106.40 | G26: 45.09 | H26: 36.81 | I26: =1+1+5+6+5+3+16+12 -> 49 | J26: =+(K26+L26)+0.5*M26 -> 68.70 | K26: 24.69 | L26: 33.51 | M26: =6+4+8+3 -> 21 | N26: =+(O26+P26)+0.5*Q26 -> 68.82 | O26: 32.06 | P26: 28.26 | Q26: =2+4+6+3+2 -> 17 | R26: =+(S26+T26)+0.5*U26 -> 72.03 | S26: 29.90 | T26: 27.13 | U26: =2+3+8+7+6+4 -> 30 | V26: =+(W26+X26)+0.5*Y26 -> 69.29 | W26: 34.74 | X26: 31.05 | Y26: =2+2+3 -> 7 | Z26: =+(AA26+AB26)+0.5*AC26 -> 70.51 | AA26: 31.59 | AB26: 38.92 | AC26: 0
A27: 23 | B27: Scott, Alan | C27: TRO | D27: =+F27+J27+N27+R27+V27+Z27 -> 458.64 | E27: =+I27+M27+Q27+U27+Y27+AC27 -> 89 | F27: =+(G27+H27)+(0.5*I27) -> 116.46 | G27: 52.75 | H27: 42.71 | I27: =4+6+9+5+4+3+7+4 -> 42 | J27: =+(K27+L27)+0.5*M27 -> 63.34 | K27: 28.53 | L27: 27.31 | M27: =5+4+3+3 -> 15 | N27: =+(O27+P27)+0.5*Q27 -> 69.37 | O27: 35.73 | P27: 31.64 | Q27: 4 | R27: =+(S27+T27)+0.5*U27 -> 65.54 | S27: 32.94 | T27: 26.60 | U27: =1+2+2+4+3 -> 12 | V27: =+(W27+X27)+0.5*Y27 -> 69.99 | W27: 47.37 | X27: 14.62 | Y27: =2+2+2+10 -> 16 | Z27: =+(AA27+AB27)+0.5*AC27 -> 73.94 | AA27: 42.24 | AB27: 31.70 | AC27: 0
A28: 24 | B28: Rodriquez, Mike | C28: T | D28: =+F28+J28+N28+R28+V28+Z28 -> 464.09 | E28: =+I28+M28+Q28+U28+Y28+AC28 -> 71 | F28: =+(G28+H28)+(0.5*I28) -> 82.93 | G28: 38.36 | H28: 35.07 | I28: =3+2+2+6+1+2+1+2 -> 19 | J28: =+(K28+L28)+0.5*M28 -> 89.72 | K28: 41.96 | L28: 41.26 | M28: =3+3+3+4 -> 13 | N28: =+(O28+P28)+0.5*Q28 -> 63.23 | O28: 31.55 | P28: 26.68 | Q28: =2+2+3+3 -> 10 | R28: =+(S28+T28)+0.5*U28 -> 71.58 | S28: 28.98 | T28: 32.60 | U28: =1+2+6+2+2+7 -> 20 | V28: =+(W28+X28)+0.5*Y28 -> 78.42 | W28: 42.06 | X28: 31.86 | Y28: =1+6+2 -> 9 | Z28: =+(AA28+AB28)+0.5*AC28 -> 78.21 | AA28: 48.53 | AB28: 29.68 | AC28: 0
A29: 25 | B29: Stone, Scott | C29: TRO | D29: =+F29+J29+N29+R29+V29+Z29 -> 472.35 | E29: =+I29+M29+Q29+U29+Y29+AC29 -> 105 | F29: =+(G29+H29)+(0.5*I29) -> 102.11 | G29: 32.73 | H29: 50.38 | I29: =3+7+1+3+5+9+5+5 -> 38 | J29: =+(K29+L29)+0.5*M29 -> 62.70 | K29: 23.00 | L29: 37.20 | M29: =1+1+3 -> 5 | N29: =+(O29+P29)+0.5*Q29 -> 73.76 | O29: 37.87 | P29: 29.39 | Q29: =3+1+4+5 -> 13 | R29: =+(S29+T29)+0.5*U29 -> 83.37 | S29: 37.24 | T29: 33.13 | U29: =8+5+3+4+2+4 -> 26 | V29: =+(W29+X29)+0.5*Y29 -> 79.30 | W29: 32.01 | X29: 35.79 | Y29: =10+8+1+4 -> 23 | Z29: =+(AA29+AB29)+0.5*AC29 -> 71.11 | AA29: 40.80 | AB29: 30.31 | AC29: 0
A30: 26 | B30: Durning, William | C30: TRO | D30: =+F30+J30+N30+R30+V30+Z30 -> 484.06 | E30: =+I30+M30+Q30+U30+Y30+AC30 -> 172 | F30: =+(G30+H30)+(0.5*I30) -> 98.35 | G30: 41.17 | H30: 34.68 | I30: =9+10+2+2+3+2+8+9 -> 45 | J30: =+(K30+L30)+0.5*M30 -> 64.73 | K30: 20.23 | L30: 23.50 | M30: =6+8+5+13+10 -> 42 | N30: =+(O30+P30)+0.5*Q30 -> 79.17 | O30: 37.11 | P30: 35.06 | Q30: =2+3+4+2+3 -> 14 | R30: =+(S30+T30)+0.5*U30 -> 72.27 | S30: 24.67 | T30: 27.10 | U30: =5+5+8+10+6+7 -> 41 | V30: =+(W30+X30)+0.5*Y30 -> 91.83 | W30: 41.78 | X30: 35.05 | Y30: =4+14+5+7 -> 30 | Z30: =+(AA30+AB30)+0.5*AC30 -> 77.71 | AA30: 37.40 | AB30: 40.31 | AC30: 0
A31: 27 | B31: Pres, Peter | C31: T | D31: =+F31+J31+N31+R31+V31+Z31 -> 534.93 | E31: =+I31+M31+Q31+U31+Y31+AC31 -> 155 | F31: =+(G31+H31)+(0.5*I31) -> 127.39 | G31: 61.62 | H31: 29.27 | I31: =3+7+10+11+6+16+14+6 -> 73 | J31: =+(K31+L31)+0.5*M31 -> 82.49 | K31: 39.40 | L31: 27.59 | M31: =14+5+3+9 -> 31 | N31: =+(O31+P31)+0.5*Q31 -> 76.70 | O31: 33.32 | P31: 36.88 | Q31: =3+1+4+3+2 -> 13 | R31: =+(S31+T31)+0.5*U31 -> 86.98 | S31: 35.59 | T31: 36.39 | U31: =4+12+7+5+2 -> 30 | V31: =+(W31+X31)+0.5*Y31 -> 88.83 | W31: 48.96 | X31: 35.87 | Y31: =2+2+2+2 -> 8 | Z31: =+(AA31+AB31)+0.5*AC31 -> 72.54 | AA31: 40.45 | AB31: 32.09 | AC31: 0
A32: 28 | B32: Willard, Jason | C32: TRO | D32: =+F32+J32+N32+R32+V32+Z32 -> 542.68 | E32: =+I32+M32+Q32+U32+Y32+AC32 -> 107 | F32: =+(G32+H32)+(0.5*I32) -> 106.73 | G32: 52.29 | H32: 44.94 | I32: =6+5+1+1+2+4 -> 19 | J32: =+(K32+L32)+0.5*M32 -> 80.97 | K32: 35.23 | L32: 34.24 | M32: =6+6+5+6 -> 23 | N32: =+(O32+P32)+0.5*Q32 -> 80.32 | O32: 41.30 | P32: 34.52 | Q32: =3+1+3+2 -> 9 | R32: =+(S32+T32)+0.5*U32 -> 88.96 | S32: 37.94 | T32: 34.02 | U32: =10+10+3+5+5+1 -> 34 | V32: =+(W32+X32)+0.5*Y32 -> 123.59 | W32: 61.65 | X32: 50.94 | Y32: =1+3+10+2+6 -> 22 | Z32: =+(AA32+AB32)+0.5*AC32 -> 62.11 | AA32: 30.94 | AB32: 31.17 | AC32: 0
A33: 29 | B33: Scott, Sam | C33: TRO | D33: =+F33+J33+N33+R33+V33+Z33 -> 547.75 | E33: =+I33+M33+Q33+U33+Y33+AC33 -> 151 | F33: =+(G33+H33)+(0.5*I33) -> 124.56 | G33: 52.36 | H33: 47.20 | I33: =6+2+11+2+8+4+12+5 -> 50 | J33: =+(K33+L33)+0.5*M33 -> 70.14 | K33: 30.76 | L33: 26.88 | M33: =6+3+7+9 -> 25 | N33: =+(O33+P33)+0.5*Q33 -> 80.47 | O33: 41.48 | P33: 38.49 | Q33: 1 | R33: =+(S33+T33)+0.5*U33 -> 79.58 | S33: 33.84 | T33: 24.24 | U33: =1+5+3+2+16+16 -> 43 | V33: =+(W33+X33)+0.5*Y33 -> 108.24 | W33: 45.77 | X33: 46.47 | Y33: =8+8+2+14 -> 32 | Z33: =+(AA33+AB33)+0.5*AC33 -> 84.76 | AA33: 46.12 | AB33: 38.64 | AC33: 0
A34: 30 | B34: Scott, Michael | C34: TRO | D34: =+F34+J34+N34+R34+V34+Z34 -> 556.61 | E34: =+I34+M34+Q34+U34+Y34+AC34 -> 73 | F34: =+(G34+H34)+(0.5*I34) -> 111.39 | G34: 53.00 | H34: 49.89 | I34: =6+2+1+4+2+1+1 -> 17 | J34: =+(K34+L34)+0.5*M34 -> 77.69 | K34: 41.48 | L34: 30.21 | M34: =6+2+1+3 -> 12 | N34: =+(O34+P34)+0.5*Q34 -> 80.14 | O34: 41.09 | P34: 39.05 | Q34: 0 | R34: =+(S34+T34)+0.5*U34 -> 88.29 | S34: 40.77 | T34: 32.52 | U34: =10+7+5+2+6 -> 30 | V34: =+(W34+X34)+0.5*Y34 -> 95.77 | W34: 42.02 | X34: 46.75 | Y34: =2+2+5+5 -> 14 | Z34: =+(AA34+AB34)+0.5*AC34 -> 103.33 | AA34: 39.54 | AB34: 63.79 | AC34: 0
A35: 31 | B35: Brownlee, Mike | C35: TRO | D35: =+F35+J35+N35+R35+V35+Z35 -> 559.90 | E35: =+I35+M35+Q35+U35+Y35+AC35 -> 116 | F35: =+(G35+H35)+(0.5*I35) -> 114.35 | G35: 40.83 | H35: 42.52 | I35: =4+9+8+15+14+2+6+4 -> 62 | J35: =+(K35+L35)+0.5*M35 -> 80.82 | K35: 37.88 | L35: 38.44 | M35: =7+2 -> 9 | N35: =+(O35+P35)+0.5*Q35 -> 65.17 | O35: 32.91 | P35: 32.26 | Q35: 0 | R35: =+(S35+T35)+0.5*U35 -> 120.59 | S35: 51.32 | T35: 58.77 | U35: =5+10+1+5 -> 21 | V35: =+(W35+X35)+0.5*Y35 -> 100.88 | W35: 42.01 | X35: 46.87 | Y35: =6+9+5+4 -> 24 | Z35: =+(AA35+AB35)+0.5*AC35 -> 78.09 | AA35: 23.25 | AB35: 54.84 | AC35: 0
A36: 32 | B36: Kirkham, Glade | C36: L | D36: =+F36+J36+N36+R36+V36+Z36 -> 584.41 | E36: =+I36+M36+Q36+U36+Y36+AC36 -> 95 | F36: =+(G36+H36)+(0.5*I36) -> 107.96 | G36: 53.53 | H36: 39.43 | I36: =4+7+4+1+3+2+9 -> 30 | J36: =+(K36+L36)+0.5*M36 -> 117.67 | K36: 56.61 | L36: 57.06 | M36: =5+2+1 -> 8 | N36: =+(O36+P36)+0.5*Q36 -> 81.54 | O36: 38.29 | P36: 39.75 | Q36: =2+2+3 -> 7 | R36: =+(S36+T36)+0.5*U36 -> 118.39 | S36: 51.44 | T36: 46.45 | U36: =10+10+4+4+5+8 -> 41 | V36: =+(W36+X36)+0.5*Y36 -> 81.57 | W36: 35.57 | X36: 41.50 | Y36: =3+2+4 -> 9 | Z36: =+(AA36+AB36)+0.5*AC36 -> 77.28 | AA36: 36.39 | AB36: 40.89 | AC36: 0
A37: 33 | B37: Andrews, Ethan | C37: L | D37: =+F37+J37+N37+R37+V37+Z37 -> 596.78 | E37: =+I37+M37+Q37+U37+Y37+AC37 -> 63 | F37: =+(G37+H37)+(0.5*I37) -> 109.04 | G37: 56.54 | H37: 43.50 | I37: =1+2+4+2+3+6 -> 18 | J37: =+(K37+L37)+0.5*M37 -> 73.96 | K37: 40.68 | L37: 30.78 | M37: =1+1+3 -> 5 | N37: =+(O37+P37)+0.5*Q37 -> 90.83 | O37: 47.96 | P37: 35.37 | Q37: =4+4+2+4+1 -> 15 | R37: =+(S37+T37)+0.5*U37 -> 117.38 | S37: 51.55 | T37: 55.83 | U37: =10+3+3+2+2 -> 20 | V37: =+(W37+X37)+0.5*Y37 -> 93.27 | W37: 47.57 | X37: 43.20 | Y37: =1+1+1+2 -> 5 | Z37: =+(AA37+AB37)+0.5*AC37 -> 112.30 | AA37: 57.33 | AB37: 54.97 | AC37: 0
A38: 34 | B38: Murray, Bob | C38: TRO | D38: =+F38+J38+N38+R38+V38+Z38 -> 629.65 | E38: =+I38+M38+Q38+U38+Y38+AC38 -> 171 | F38: =+(G38+H38)+(0.5*I38) -> 100.70 | G38: 36.67 | H38: 35.53 | I38: =2+4+8+6+6+14+5+12 -> 57 | J38: =+(K38+L38)+0.5*M38 -> 86.86 | K38: 30.99 | L38: 42.87 | M38: =4+4+8+10 -> 26 | N38: =+(O38+P38)+0.5*Q38 -> 102.59 | O38: 46.75 | P38: 43.84 | Q38: =3+4+3+10+4 -> 24 | R38: =+(S38+T38)+0.5*U38 -> 93.13 | S38: 30.61 | T38: 39.02 | U38: =10+1+6+5+16+9 -> 47 | V38: =+(W38+X38)+0.5*Y38 -> 131.19 | W38: 68.36 | X38: 54.33 | Y38: =8+2+3+4 -> 17 | Z38: =+(AA38+AB38)+0.5*AC38 -> 115.18 | AA38: 67.39 | AB38: 47.79 | AC38: 0
A39: 35 | B39: Ostler, Jay | C39: TRO | D39: =+F39+J39+N39+R39+V39+Z39 -> 685.06 | E39: =+I39+M39+Q39+U39+Y39+AC39 -> 64 | F39: =+(G39+H39)+(0.5*I39) -> 135.30 | G39: 79.60 | H39: 40.20 | I39: =3+1+3+6+5+7+6 -> 31 | J39: =+(K39+L39)+0.5*M39 -> 100.72 | K39: 54.52 | L39: 43.70 | M39: =2+2+1 -> 5 | N39: =+(O39+P39)+0.5*Q39 -> 103.94 | O39: 44.56 | P39: 57.38 | Q39: 4 | R39: =+(S39+T39)+0.5*U39 -> 86.53 | S39: 41.83 | T39: 36.70 | U39: =5+5+2+1+2+1 -> 16 | V39: =+(W39+X39)+0.5*Y39 -> 153.62 | W39: 75.17 | X39: 74.45 | Y39: =1+2+2+2+1 -> 8 | Z39: =+(AA39+AB39)+0.5*AC39 -> 104.95 | AA39: 67.62 | AB39: 37.33 | AC39: 0
A40: 36 | B40: Koch, Rodney | C40: TRO | D40: =+F40+J40+N40+R40+V40+Z40 -> 742.43 | E40: =+I40+M40+Q40+U40+Y40+AC40 -> 207 | F40: =+(G40+H40)+(0.5*I40) -> 145.37 | G40: 58.78 | H40: 51.09 | I40: =14+11+11+4+12+10+1+8 -> 71 | J40: =+(K40+L40)+0.5*M40 -> 90.36 | K40: 26.08 | L40: 33.28 | M40: =12+20+16+14 -> 62 | N40: =+(O40+P40)+0.5*Q40 -> 88.70 | O40: 43.34 | P40: 42.36 | Q40: 6 | R40: =+(S40+T40)+0.5*U40 -> 144.99 | S40: 76.63 | T40: 45.36 | U40: =1+5+14+12+3+11 -> 46 | V40: =+(W40+X40)+0.5*Y40 -> 151.77 | W40: 53.56 | X40: 87.21 | Y40: =5+7+5+5 -> 22 | Z40: =+(AA40+AB40)+0.5*AC40 -> 121.24 | AA40: 70.56 | AB40: 50.68 | AC40: 0
A41: 37 | B41: Hoyt, David | C41: L | D41: =+F41+J41+N41+R41+V41+Z41 -> 827.46 | E41: =+I41+M41+Q41+U41+Y41+AC41 -> 226 | F41: =+(G41+H41)+(0.5*I41) -> 160.75 | G41: 53.19 | H41: 45.56 | I41: =18+16+14+12+18+18+12+16 -> 124 | J41: =+(K41+L41)+0.5*M41 -> 141.17 | K41: 78.51 | L41: 58.66 | M41: =5+1+1+1 -> 8 | N41: =+(O41+P41)+0.5*Q41 -> 111.44 | O41: 62.06 | P41: 46.88 | Q41: 5 | R41: =+(S41+T41)+0.5*U41 -> 105.62 | S41: 37.17 | T41: 36.45 | U41: =10+5+12+11+10+16 -> 64 | V41: =+(W41+X41)+0.5*Y41 -> 143.09 | W41: 72.62 | X41: 57.97 | Y41: =2+9+6+8 -> 25 | Z41: =+(AA41+AB41)+0.5*AC41 -> 165.39 | AA41: 99.71 | AB41: 65.68 | AC41: 0
A42: Notes:
A43: - | B43: Div * - Refer to the UDPL 3-Gun Division Specifications for specifics on each Division.
B44: L = | C44: LIMITED
B45: T = | C45: TACTICAL
B46: TRO = | C46: TACTICAL RIFLE-OPTICAL
B47: O = | C47: OPEN
A48: PD | B48: = Points Down = .5 seconds x Points Down. PD Total is added to the total Stage time.
A49: XX | B49: = Indicates that the Points Down value includes some kind of penalty (Procedural Error, Hits on Non-Threat, Misses on Steel (5 seconds each), etc.).
A50: DNF | B50: = Did Not Finish
A51: NS | B51: = No Score was recorded for this string. Shooter placed lower than indicated.
A52: ? | B52: = Shooter did not indicate which Division he should be scored in.