A1: Utah Shooting Academy May 2004
A2: MATCH SCORES (Including points down and penalties) Click on Stage # to view COF
A3: Number | B3: Name | C3: Match | D3: Stage1 | E3: Stage 2 | F3: Stage 3
A4: S01 | B4: George Tekmitchov | C4: 44.83 | D4: 16.35 | E4: 15.08 | F4: 13.40
A5: S02 | B5: Ari T | C5: 45.62 | D5: 13.13 | E5: 15.69 | F5: 15.30
A6: S03 | B6: Justin Park | C6: 52.12 | D6: 15.85 | E6: 17.81 | F6: 18.46
A7: S04 | B7: Les Langford | C7: 55.22 | D7: 17.95 | E7: 20.03 | F7: 17.24
A8: S05 | B8: Bryan Mortenson | C8: 62.08 | D8: 16.45 | E8: 25.83 | F8: 19.80
A9: S06 | B9: Kip Peterson | C9: 63.30 | D9: 17.64 | E9: 26.48 | F9: 19.18
A10: S07 | B10: Dave Duncan | C10: 64.22 | D10: 25.42 | E10: 19.66 | F10: 19.14
A11: S08 | B11: Brent Adams | C11: 66.53 | D11: 25.38 | E11: 22.63 | F11: 18.52
A12: S09 | B12: Joe Frint | C12: 71.29 | D12: 28.05 | E12: 22.97 | F12: 20.27
A13: S10 | B13: Perry Hatch | C13: 71.55 | D13: 27.17 | E13: 19.01 | F13: 25.37
A14: S11 | B14: Creatch Dezel | C14: 72.28 | D14: 24.74 | E14: 30.13 | F14: 17.41
A15: S12 | B15: John Diamond | C15: 73.29 | D15: 19.13 | E15: 27.63 | F15: 26.53
A16: S13 | B16: Ken Thorne | C16: 78.30 | D16: 22.74 | E16: 29.69 | F16: 25.87
A17: S14 | B17: Scott Stone | C17: 79.00 | D17: 31.89 | E17: 27.64 | F17: 19.47
A18: S15 | B18: Carl Burney | C18: 89.79 | D18: 39.73 | E18: 28.85 | F18: 21.21
A19: S16 | B19: Micheal Brown | C19: 91.88 | D19: 31.21 | E19: 31.18 | F19: 29.49
A20: S17 | B20: Bill Dezell | C20: 93.64 | D20: 30.94 | E20: 39.80 | F20: 22.90
A21: S18 | B21: Ryan Thorne | C21: 101.18 | D21: 34.37 | E21: 33.02 | F21: 33.79
A22: S19 | B22: Randy Hill | C22: 106.15 | D22: 28.97 | E22: 49.44 | F22: 27.74
A23: S20 | B23: R Dan Phillips | C23: 132.95 | D23: 37.24 | E23: 47.49 | F23: 48.22
A24: S21 | B24: Carol Perez | C24: 133.33 | D24: 60.77 | E24: 35.27 | F24: 37.29
A25: S22 | B25: Misi Inoke | C25: 166.01 | D25: 48.34 | E25: 75.52 | F25: 42.15
A26: S23 | B26: Scott Brown | C26: 206.01 | D26: 80.15 | E26: 78.39 | F26: 47.47
A27: S24 | B27: Milos | C27: DNF | D27: 21.35 | E27: 23.32 | F27: 0.00
A28: S25 | C28: =AVERAGE(C4:C27) -> 87.850869565217394
A29: Overall Match Average: | C29: =AVERAGE(C4:C28) -> 87.850869565217394 | D29: =AVERAGE(D4:D28) -> 29.79 | E29: =AVERAGE(E4:E28) -> 31.77333333333333 | F29: =AVERAGE(F4:F28) -> 24.42583333333334
A30: RAW TIMES
A31: Number | B31: Name | C31: Match | D31: Stage1 | E31: Stage 2 | F31: Stage 3
A32: S01 | B32: Justin Park | C32: ='[February 2004.xls]S18'!$F$23+SUM(D32:F32) -> 38.62 | D32: 15.85 | E32: 10.81 | F32: 11.96
A33: S02 | B33: George Tekmitchov | C33: ='[February 2004.xls]S18'!$F$23+SUM(D33:F33) -> 39.82 | D33: 12.84 | E33: 14.08 | F33: 12.90
A34: S03 | B34: Ari T | C34: ='[February 2004.xls]S18'!$F$23+SUM(D34:F34) -> 40.62 | D34: 13.13 | E34: 13.69 | F34: 13.80
A35: S04 | B35: Kip Peterson | C35: ='[February 2004.xls]S18'!$F$23+SUM(D35:F35) -> 49.80 | D35: 14.64 | E35: 20.48 | F35: 14.68
A36: S05 | B36: Les Langford | C36: ='[February 2004.xls]S18'!$F$23+SUM(D36:F36) -> 50.72 | D36: 16.95 | E36: 19.03 | F36: 14.74
A37: S06 | B37: Bryan Mortenson | C37: ='[February 2004.xls]S18'!$F$23+SUM(D37:F37) -> 52.07 | D37: 16.45 | E37: 23.82 | F37: 11.80
A38: S07 | B38: Perry Hatch | C38: ='[February 2004.xls]S18'!$F$23+SUM(D38:F38) -> 53.05 | D38: 21.17 | E38: 18.51 | F38: 13.37
A39: S08 | B39: Dave Duncan | C39: ='[February 2004.xls]S18'!$F$23+SUM(D39:F39) -> 55.72 | D39: 22.92 | E39: 18.66 | F39: 14.14
A40: S09 | B40: Scott Stone | C40: ='[February 2004.xls]S18'!$F$23+SUM(D40:F40) -> 59.00 | D40: 29.89 | E40: 16.14 | F40: 12.97
A41: S10 | B41: Brent Adams | C41: ='[February 2004.xls]S18'!$F$23+SUM(D41:F41) -> 60.03 | D41: 24.88 | E41: 21.13 | F41: 14.02
A42: S11 | B42: John Diamond | C42: ='[February 2004.xls]S18'!$F$23+SUM(D42:F42) -> 60.29 | D42: 19.13 | E42: 25.13 | F42: 16.03
A43: S12 | B43: Randy Hill | C43: ='[February 2004.xls]S18'!$F$23+SUM(D43:F43) -> 60.65 | D43: 16.97 | E43: 26.94 | F43: 16.74
A44: S13 | B44: Ken Thorne | C44: ='[February 2004.xls]S18'!$F$23+SUM(D44:F44) -> 63.80 | D44: 21.24 | E44: 25.69 | F44: 16.87
A45: S14 | B45: Joe Frint | C45: ='[February 2004.xls]S18'!$F$23+SUM(D45:F45) -> 64.29 | D45: 25.55 | E45: 21.97 | F45: 16.77
A46: S15 | B46: Creatch Dezel | C46: ='[February 2004.xls]S18'!$F$23+SUM(D46:F46) -> 66.78 | D46: 23.24 | E46: 27.63 | F46: 15.91
A47: S16 | B47: Micheal Brown | C47: ='[February 2004.xls]S18'!$F$23+SUM(D47:F47) -> 69.38 | D47: 29.71 | E47: 22.18 | F47: 17.49
A48: S17 | B48: Ryan Thorne | C48: ='[February 2004.xls]S18'!$F$23+SUM(D48:F48) -> 70.18 | D48: 25.37 | E48: 28.52 | F48: 16.29
A49: S18 | B49: Carl Burney | C49: ='[February 2004.xls]S18'!$F$23+SUM(D49:F49) -> 82.29 | D49: 34.73 | E49: 28.85 | F49: 18.71
A50: S19 | B50: Bill Dezell | C50: ='[February 2004.xls]S18'!$F$23+SUM(D50:F50) -> 82.64 | D50: 28.44 | E50: 38.80 | F50: 15.40
A51: S20 | B51: R Dan Phillips | C51: ='[February 2004.xls]S18'!$F$23+SUM(D51:F51) -> 100.45 | D51: 30.24 | E51: 44.49 | F51: 25.72
A52: S21 | B52: Carol Perez | C52: ='[February 2004.xls]S18'!$F$23+SUM(D52:F52) -> 103.33 | D52: 52.77 | E52: 26.27 | F52: 24.29
A53: S22 | B53: Misi Inoke | C53: ='[February 2004.xls]S18'!$F$23+SUM(D53:F53) -> 125.01 | D53: 29.34 | E53: 68.52 | F53: 27.15
A54: S23 | B54: Scott Brown | C54: ='[February 2004.xls]S18'!$F$23+SUM(D54:F54) -> 148.51 | D54: 52.65 | E54: 67.39 | F54: 28.47
A55: S24 | B55: Milos | C55: DNF | D55: 15.85 | E55: 18.32 | F55: 0.00
A56: S25
A57: Overall Raw Time Average: | C57: =AVERAGE(C32:C56) -> 69.43695652173912 | D57: =AVERAGE(D32:D56) -> 24.747916666666665 | E57: =AVERAGE(E32:E56) -> 26.960416666666671 | F57: =AVERAGE(F32:F56) -> 16.259166666666662
A58: POINTS DOWN
A59: Number | B59: Name | C59: Match | D59: Stage1 | E59: Stage 2 | F59: Stage 3
A60: S01 | B60: Carl Burney | C60: ='[February 2004.xls]S21'!$F$24+SUM(D60:F60) -> 5 | D60: 0 | E60: 0 | F60: 5
A61: S02 | B61: Ari T | C61: ='[February 2004.xls]S21'!$F$24+SUM(D61:F61) -> 8 | D61: 1 | E61: 4 | F61: 3
A62: S03 | B62: Les Langford | C62: ='[February 2004.xls]S21'!$F$24+SUM(D62:F62) -> 9 | D62: 2 | E62: 2 | F62: 5
A63: S04 | B63: George Tekmitchov | C63: ='[February 2004.xls]S21'!$F$24+SUM(D63:F63) -> 10 | D63: 7 | E63: 2 | F63: 1
A64: S05 | B64: Creatch Dezel | C64: ='[February 2004.xls]S21'!$F$24+SUM(D64:F64) -> 11 | D64: 3 | E64: 5 | F64: 3
A65: S06 | B65: Brent Adams | C65: ='[February 2004.xls]S21'!$F$24+SUM(D65:F65) -> 13 | D65: 1 | E65: 3 | F65: 9
A66: S07 | B66: Joe Frint | C66: ='[February 2004.xls]S21'!$F$24+SUM(D66:F66) -> 14 | D66: 5 | E66: 2 | F66: 7
A67: S08 | B67: Dave Duncan | C67: ='[February 2004.xls]S21'!$F$24+SUM(D67:F67) -> 17 | D67: 5 | E67: 2 | F67: 10
A68: S09 | B68: Bryan Mortenson | C68: ='[February 2004.xls]S21'!$F$24+SUM(D68:F68) -> 20 | D68: 0 | E68: 4 | F68: 16
A69: S10 | B69: Bill Dezell | C69: ='[February 2004.xls]S21'!$F$24+SUM(D69:F69) -> 22 | D69: 5 | E69: 2 | F69: 15
A70: S11 | B70: John Diamond | C70: ='[February 2004.xls]S21'!$F$24+SUM(D70:F70) -> 26 | D70: 0 | E70: 5 | F70: 21
A71: S12 | B71: Justin Park | C71: ='[February 2004.xls]S21'!$F$24+SUM(D71:F71) -> 27 | D71: 0 | E71: 14 | F71: 13
A72: S13 | B72: Kip Peterson | C72: ='[February 2004.xls]S21'!$F$24+SUM(D72:F72) -> 27 | D72: 6 | E72: 12 | F72: 9
A73: S14 | B73: Ken Thorne | C73: ='[February 2004.xls]S21'!$F$24+SUM(D73:F73) -> 29 | D73: 3 | E73: 8 | F73: 18
A74: S15 | B74: Perry Hatch | C74: ='[February 2004.xls]S21'!$F$24+SUM(D74:F74) -> 37 | D74: 12 | E74: 1 | F74: 24
A75: S16 | B75: Scott Stone | C75: ='[February 2004.xls]S21'!$F$24+SUM(D75:F75) -> 40 | D75: 4 | E75: 23 | F75: 13
A76: S17 | B76: Micheal Brown | C76: ='[February 2004.xls]S21'!$F$24+SUM(D76:F76) -> 45 | D76: 3 | E76: 18 | F76: 24
A77: S18 | B77: Carol Perez | C77: ='[February 2004.xls]S21'!$F$24+SUM(D77:F77) -> 60 | D77: 16 | E77: 18 | F77: 26
A78: S19 | B78: Ryan Thorne | C78: ='[February 2004.xls]S21'!$F$24+SUM(D78:F78) -> 62 | D78: 18 | E78: 9 | F78: 35
A79: S20 | B79: R Dan Phillips | C79: ='[February 2004.xls]S21'!$F$24+SUM(D79:F79) -> 65 | D79: 14 | E79: 6 | F79: 45
A80: S21 | B80: Misi Inoke | C80: ='[February 2004.xls]S21'!$F$24+SUM(D80:F80) -> 72 | D80: 28 | E80: 14 | F80: 30
A81: S22 | B81: Randy Hill | C81: ='[February 2004.xls]S21'!$F$24+SUM(D81:F81) -> 81 | D81: 14 | E81: 45 | F81: 22
A82: S23 | B82: Scott Brown | C82: ='[February 2004.xls]S21'!$F$24+SUM(D82:F82) -> 105 | D82: 45 | E82: 22 | F82: 38
A83: S24 | B83: Milos | C83: DNF | D83: 11 | E83: 10 | F83: DNF
A84: S25
A85: Overall Points Down Average: | C85: =AVERAGE(C60:C84) -> 35 | D85: =AVERAGE(D60:D84) -> 8.4583333333333339 | E85: =AVERAGE(E60:E84) -> 9.625 | F85: =AVERAGE(F60:F84) -> 17.043478260869566