A1: Utah Shooting Academy July 2004
A2: OVERALL SCORES (Includes procedurals and hits on non-threat)
A3: Number | B3: Name | C3: Match | D3: Stage1 | E3: Stage 2 | F3: Stage 3 | G3: Stage4
A4: 1 | B4: ='[July 2004.xls]S10'!$B$1 -> Pat Zaccardi | C4: 64.44 | D4: ='[July 2004.xls]S10'!B$27 -> 4.00 | E4: ='[July 2004.xls]S10'!C$27 -> 31.70 | F4: ='[July 2004.xls]S10'!D$27 -> 28.74 | G4: ='[July 2004.xls]S1'!E$27 -> 0.00
A5: 2 | B5: ='[July 2004.xls]S6'!$B$1 -> Bryan Mortensen | C5: 67.78 | D5: ='[July 2004.xls]S6'!B$27 -> 5.50 | E5: ='[July 2004.xls]S6'!C$27 -> 26.74 | F5: ='[July 2004.xls]S6'!D$27 -> 35.54 | G5: ='[July 2004.xls]S2'!E$27 -> 0.00
A6: 3 | B6: ='[July 2004.xls]S1'!$B$1 -> Mike Rodriquez | C6: 68.88 | D6: 17.50 | E6: 27.67 | F6: 23.71 | G6: ='[July 2004.xls]S3'!E$27 -> 0.00
A7: 4 | B7: ='[July 2004.xls]S14'!$B$1 -> Les Langford | C7: 72.36 | D7: ='[July 2004.xls]S14'!B$27 -> 8.00 | E7: ='[July 2004.xls]S14'!C$27 -> 26.76 | F7: ='[July 2004.xls]S14'!D$27 -> 37.60 | G7: ='[July 2004.xls]S4'!E$27 -> 0.00
A8: 5 | B8: ='[July 2004.xls]S4'!$B$1 -> Justin Park | C8: 72.43 | D8: ='[July 2004.xls]S4'!B$27 -> 9.50 | E8: ='[July 2004.xls]S4'!C$27 -> 32.23 | F8: ='[July 2004.xls]S4'!D$27 -> 30.70 | G8: ='[July 2004.xls]S5'!E$27 -> 0.00
A9: 6 | B9: ='[July 2004.xls]S15'!$B$1 -> Brayden Brucher | C9: 77.92 | D9: ='[July 2004.xls]S15'!B$27 -> 13.50 | E9: ='[July 2004.xls]S15'!C$27 -> 30.71 | F9: ='[July 2004.xls]S15'!D$27 -> 33.71 | G9: ='[July 2004.xls]S6'!E$27 -> 0.00
A10: 7 | B10: ='[July 2004.xls]S13'!$B$1 -> Roger Mousley | C10: 78.35 | D10: ='[July 2004.xls]S13'!B$27 -> 17.00 | E10: ='[July 2004.xls]S13'!C$27 -> 24.45 | F10: ='[July 2004.xls]S13'!D$27 -> 36.90 | G10: ='[July 2004.xls]S7'!E$27 -> 0.00
A11: 8 | B11: ='[July 2004.xls]S5'!$B$1 -> Juke Zacardi | C11: 82.20 | D11: ='[July 2004.xls]S5'!B$27 -> 10.00 | E11: ='[July 2004.xls]S5'!C$27 -> 28.25 | F11: ='[July 2004.xls]S5'!D$27 -> 43.95 | G11: ='[July 2004.xls]S8'!E$27 -> 0.00
A12: 9 | B12: ='[July 2004.xls]S12'!$B$1 -> Bill Dezell | C12: 97.76 | D12: ='[July 2004.xls]S12'!B$27 -> 6.50 | E12: ='[July 2004.xls]S12'!C$27 -> 46.56 | F12: ='[July 2004.xls]S12'!D$27 -> 45.70 | G12: ='[July 2004.xls]S9'!E$27 -> 0.00
A13: 10 | B13: ='[July 2004.xls]S3'!$B$1 -> R Dan Phillips | C13: 99.49 | D13: ='[July 2004.xls]S3'!B$27 -> 11.00 | E13: ='[July 2004.xls]S3'!C$27 -> 44.48 | F13: ='[July 2004.xls]S3'!D$27 -> 44.01 | G13: ='[July 2004.xls]S10'!E$27 -> 0.00
A14: 11 | B14: ='[July 2004.xls]S11'!$B$1 -> Carl Burney | C14: 100.17 | D14: ='[July 2004.xls]S11'!B$27 -> 9.50 | E14: ='[July 2004.xls]S11'!C$27 -> 47.85 | F14: ='[July 2004.xls]S11'!D$27 -> 42.82 | G14: ='[July 2004.xls]S11'!E$27 -> 0.00
A15: 12 | B15: ='[July 2004.xls]S2'!$B$1 -> Creatch Dezell | C15: 107.81 | D15: ='[July 2004.xls]S2'!B$27 -> 13.00 | E15: ='[July 2004.xls]S2'!C$27 -> 39.59 | F15: 55.22 | G15: ='[July 2004.xls]S12'!E$27 -> 0.00
A16: 13 | B16: ='[July 2004.xls]S8'!$B$1 -> Ken Thorne | C16: 107.93 | D16: ='[July 2004.xls]S8'!B$27 -> 14.00 | E16: ='[July 2004.xls]S8'!C$27 -> 47.78 | F16: ='[July 2004.xls]S8'!D$27 -> 46.15 | G16: ='[July 2004.xls]S13'!E$27 -> 0.00
A17: 14 | B17: ='[July 2004.xls]S9'!$B$1 -> Ryan Thorne | C17: 120.93 | D17: ='[July 2004.xls]S9'!B$27 -> 8.00 | E17: ='[July 2004.xls]S9'!C$27 -> 47.08 | F17: ='[July 2004.xls]S9'!D$27 -> 65.85 | G17: ='[July 2004.xls]S14'!E$27 -> 0.00
A18: 15 | B18: ='[July 2004.xls]S7'!$B$1 -> Randy Hill | C18: 122.10 | D18: ='[July 2004.xls]S7'!B$27 -> 17.00 | E18: ='[July 2004.xls]S7'!C$27 -> 55.39 | F18: ='[July 2004.xls]S7'!D$27 -> 49.71 | G18: ='[July 2004.xls]S15'!E$27 -> 0.00
A19: 16 | B19: ='[July 2004.xls]S16'!$B$1 -> Eric Mousley | C19: 122.67 | D19: ='[July 2004.xls]S16'!B$27 -> 23.00 | E19: ='[July 2004.xls]S16'!C$27 -> 47.00 | F19: ='[July 2004.xls]S16'!D$27 -> 52.67 | G19: ='[July 2004.xls]S16'!E$27 -> 0.00
A20: Overall Average: | C20: =AVERAGE(C4:C19) -> 91.451250000000002 | D20: =AVERAGE(D4:D19) -> 11.6875 | E20: =AVERAGE(E4:E19) -> 37.765000000000001 | F20: =AVERAGE(F4:F19) -> 42.061250000000001 | G20: =AVERAGE(G4:G19) -> 0.00
A21: RAW TIMES
A22: Number | B22: Name | C22: Match | D22: Stage1 | E22: Stage 2 | F22: Stage 3 | G22: Stage4
A23: 1 | B23: ='[July 2004.xls]S10'!$B$1 -> Pat Zaccardi | C23: 39.94 | D23: PAR | E23: ='[July 2004.xls]S10'!C$23 -> 21.20 | F23: ='[July 2004.xls]S10'!D$23 -> 18.74 | G23: ='[July 2004.xls]S1'!E$23 -> 0.00
A24: 2 | B24: ='[July 2004.xls]S1'!$B$1 -> Mike Rodriquez | C24: 40.88 | D24: PAR | E24: 20.67 | F24: 20.21 | G24: ='[July 2004.xls]S2'!E$23 -> 0.00
A25: 3 | B25: ='[July 2004.xls]S4'!$B$1 -> Justin Park | C25: 46.43 | D25: PAR | E25: ='[July 2004.xls]S4'!C$23 -> 27.73 | F25: ='[July 2004.xls]S4'!D$23 -> 18.70 | G25: ='[July 2004.xls]S3'!E$23 -> 0.00
A26: 4 | B26: ='[July 2004.xls]S14'!$B$1 -> Les Langford | C26: 48.36 | D26: PAR | E26: ='[July 2004.xls]S14'!C$23 -> 20.26 | F26: ='[July 2004.xls]S14'!D$23 -> 28.10 | G26: ='[July 2004.xls]S4'!E$23 -> 0.00
A27: 5 | B27: ='[July 2004.xls]S13'!$B$1 -> Roger Mousley | C27: 48.85 | D27: PAR | E27: ='[July 2004.xls]S13'!C$23 -> 21.95 | F27: ='[July 2004.xls]S13'!D$23 -> 26.90 | G27: ='[July 2004.xls]S5'!E$23 -> 0.00
A28: 6 | B28: ='[July 2004.xls]S5'!$B$1 -> Juke Zacardi | C28: 51.70 | D28: PAR | E28: ='[July 2004.xls]S5'!C$23 -> 24.25 | F28: ='[July 2004.xls]S5'!D$23 -> 27.45 | G28: ='[July 2004.xls]S6'!E$23 -> 0.00
A29: 7 | B29: ='[July 2004.xls]S15'!$B$1 -> Brayden Brucher | C29: 52.42 | D29: PAR | E29: ='[July 2004.xls]S15'!C$23 -> 25.21 | F29: ='[July 2004.xls]S15'!D$23 -> 27.21 | G29: ='[July 2004.xls]S7'!E$23 -> 0.00
A30: 8 | B30: ='[July 2004.xls]S6'!$B$1 -> Bryan Mortensen | C30: 54.78 | D30: PAR | E30: ='[July 2004.xls]S6'!C$23 -> 25.24 | F30: ='[July 2004.xls]S6'!D$23 -> 29.54 | G30: ='[July 2004.xls]S8'!E$23 -> 0.00
A31: 9 | B31: ='[July 2004.xls]S16'!$B$1 -> Eric Mousley | C31: 58.17 | D31: PAR | E31: ='[July 2004.xls]S16'!C$23 -> 26.50 | F31: ='[July 2004.xls]S16'!D$23 -> 31.67 | G31: ='[July 2004.xls]S9'!E$23 -> 0.00
A32: 10 | B32: ='[July 2004.xls]S3'!$B$1 -> R Dan Phillips | C32: 62.49 | D32: PAR | E32: ='[July 2004.xls]S3'!C$23 -> 35.98 | F32: ='[July 2004.xls]S3'!D$23 -> 26.51 | G32: ='[July 2004.xls]S10'!E$23 -> 0.00
A33: 11 | B33: ='[July 2004.xls]S8'!$B$1 -> Ken Thorne | C33: 65.43 | D33: PAR | E33: ='[July 2004.xls]S8'!C$23 -> 34.78 | F33: ='[July 2004.xls]S8'!D$23 -> 30.65 | G33: ='[July 2004.xls]S11'!E$23 -> 0.00
A34: 12 | B34: ='[July 2004.xls]S7'!$B$1 -> Randy Hill | C34: 70.60 | D34: PAR | E34: ='[July 2004.xls]S7'!C$23 -> 37.89 | F34: ='[July 2004.xls]S7'!D$23 -> 32.71 | G34: ='[July 2004.xls]S12'!E$23 -> 0.00
A35: 13 | B35: ='[July 2004.xls]S2'!$B$1 -> Creatch Dezell | C35: 72.81 | D35: PAR | E35: ='[July 2004.xls]S2'!C$23 -> 36.09 | F35: ='[July 2004.xls]S2'!D$23 -> 36.72 | G35: ='[July 2004.xls]S13'!E$23 -> 0.00
A36: 14 | B36: ='[July 2004.xls]S11'!$B$1 -> Carl Burney | C36: 83.17 | D36: PAR | E36: ='[July 2004.xls]S11'!C$23 -> 40.35 | F36: ='[July 2004.xls]S11'!D$23 -> 42.82 | G36: ='[July 2004.xls]S14'!E$23 -> 0.00
A37: 15 | B37: ='[July 2004.xls]S12'!$B$1 -> Bill Dezell | C37: 88.26 | D37: PAR | E37: ='[July 2004.xls]S12'!C$23 -> 44.06 | F37: ='[July 2004.xls]S12'!D$23 -> 44.20 | G37: ='[July 2004.xls]S15'!E$23 -> 0.00
A38: 16 | B38: ='[July 2004.xls]S9'!$B$1 -> Ryan Thorne | C38: 88.93 | D38: PAR | E38: ='[July 2004.xls]S9'!C$23 -> 37.58 | F38: ='[July 2004.xls]S9'!D$23 -> 51.35 | G38: ='[July 2004.xls]S16'!E$23 -> 0.00
A39: Overall Average: | C39: =SUM(C23:C38)/16 -> 60.826250000000002 | D39: PAR | E39: =SUM(E23:E38)/16 -> 29.983750000000001 | F39: =SUM(F23:F38)/16 -> 30.842500000000001 | G39: =SUM(G23:G38)/#REF! -> #REF!
A40: POINTS DOWN
A41: Number | B41: Name | C41: Match | D41: Stage1 | E41: Stage 2 | F41: Stage 3 | G41: Stage4
A42: 1 | B42: ='[July 2004.xls]S12'!$B$1 -> Bill Dezell | C42: 21 | D42: ='[July 2004.xls]S12'!B$24 -> 13 | E42: ='[July 2004.xls]S12'!C$24 -> 5 | F42: ='[July 2004.xls]S12'!D$24 -> 3
A43: 2 | B43: ='[July 2004.xls]S11'!$B$1 -> Carl Burney | C43: 24 | D43: ='[July 2004.xls]S11'!B$24 -> 9 | E43: ='[July 2004.xls]S11'!C$24 -> 15 | F43: ='[July 2004.xls]S11'!D$24 -> 0 | G43: ='[July 2004.xls]S2'!E$24 -> 0
A44: 3 | B44: ='[July 2004.xls]S6'!$B$1 -> Bryan Mortensen | C44: 26 | D44: ='[July 2004.xls]S6'!B$24 -> 11 | E44: ='[July 2004.xls]S6'!C$24 -> 3 | F44: ='[July 2004.xls]S6'!D$24 -> 12 | G44: ='[July 2004.xls]S3'!E$24 -> 0
A45: 4 | B45: ='[July 2004.xls]S4'!$B$1 -> Justin Park | C45: 42 | D45: ='[July 2004.xls]S4'!B$24 -> 9 | E45: ='[July 2004.xls]S4'!C$24 -> 9 | F45: ='[July 2004.xls]S4'!D$24 -> 24 | G45: ='[July 2004.xls]S4'!E$24 -> 0
A46: 5 | B46: ='[July 2004.xls]S14'!$B$1 -> Les Langford | C46: 48 | D46: ='[July 2004.xls]S14'!B$24 -> 16 | E46: ='[July 2004.xls]S14'!C$24 -> 13 | F46: ='[July 2004.xls]S14'!D$24 -> 19 | G46: ='[July 2004.xls]S5'!E$24 -> 0
A47: 6 | B47: ='[July 2004.xls]S10'!$B$1 -> Pat Zaccardi | C47: 49 | D47: ='[July 2004.xls]S10'!B$24 -> 8 | E47: ='[July 2004.xls]S10'!C$24 -> 21 | F47: ='[July 2004.xls]S10'!D$24 -> 20 | G47: ='[July 2004.xls]S6'!E$24 -> 0
A48: 7 | B48: ='[July 2004.xls]S15'!$B$1 -> Brayden Brucher | C48: 51 | D48: ='[July 2004.xls]S15'!B$24 -> 27 | E48: ='[July 2004.xls]S15'!C$24 -> 11 | F48: ='[July 2004.xls]S15'!D$24 -> 13 | G48: ='[July 2004.xls]S7'!E$24 -> 0
A49: 8 | B49: ='[July 2004.xls]S1'!$B$1 -> Mike Rodriquez | C49: 56 | D49: 35 | E49: 15 | F49: 7 | G49: ='[July 2004.xls]S8'!E$24 -> 0
A50: 9 | B50: ='[July 2004.xls]S13'!$B$1 -> Roger Mousley | C50: 59 | D50: ='[July 2004.xls]S13'!B$24 -> 34 | E50: ='[July 2004.xls]S13'!C$24 -> 5 | F50: ='[July 2004.xls]S13'!D$24 -> 20 | G50: ='[July 2004.xls]S9'!E$24 -> 0
A51: 10 | B51: ='[July 2004.xls]S5'!$B$1 -> Juke Zacardi | C51: 61 | D51: ='[July 2004.xls]S5'!B$24 -> 20 | E51: ='[July 2004.xls]S5'!C$24 -> 8 | F51: ='[July 2004.xls]S5'!D$24 -> 33 | G51: ='[July 2004.xls]S10'!E$24 -> 0
A52: 11 | B52: ='[July 2004.xls]S9'!$B$1 -> Ryan Thorne | C52: 64 | D52: ='[July 2004.xls]S9'!B$24 -> 16 | E52: ='[July 2004.xls]S9'!C$24 -> 19 | F52: ='[July 2004.xls]S9'!D$24 -> 29 | G52: ='[July 2004.xls]S11'!E$24 -> 0
A53: 12 | B53: ='[July 2004.xls]S2'!$B$1 -> Creatch Dezell | C53: 70 | D53: 26 | E53: 7 | F53: ='[July 2004.xls]S2'!D$24 -> 37 | G53: ='[July 2004.xls]S12'!E$24 -> 0
A54: 13 | B54: ='[July 2004.xls]S3'!$B$1 -> R Dan Phillips | C54: 74 | D54: ='[July 2004.xls]S3'!B$24 -> 22 | E54: ='[July 2004.xls]S3'!C$24 -> 17 | F54: ='[July 2004.xls]S3'!D$24 -> 35 | G54: ='[July 2004.xls]S13'!E$24 -> 0
A55: 14 | B55: ='[July 2004.xls]S8'!$B$1 -> Ken Thorne | C55: 85 | D55: ='[July 2004.xls]S8'!B$24 -> 28 | E55: ='[July 2004.xls]S8'!C$24 -> 26 | F55: ='[July 2004.xls]S8'!D$24 -> 31 | G55: ='[July 2004.xls]S14'!E$24 -> 0
A56: 15 | B56: ='[July 2004.xls]S7'!$B$1 -> Randy Hill | C56: 103 | D56: ='[July 2004.xls]S7'!B$24 -> 34 | E56: ='[July 2004.xls]S7'!C$24 -> 35 | F56: ='[July 2004.xls]S7'!D$24 -> 34 | G56: ='[July 2004.xls]S15'!E$24 -> 0
A57: 16 | B57: ='[July 2004.xls]S16'!$B$1 -> Eric Mousley | C57: 109 | D57: ='[July 2004.xls]S16'!B$24 -> 26 | E57: ='[July 2004.xls]S16'!C$24 -> 41 | F57: ='[July 2004.xls]S16'!D$24 -> 42 | G57: ='[July 2004.xls]S16'!E$24 -> 0
A58: Overall Average: | C58: =SUM(C42:C57)/16 -> 58.875 | D58: =SUM(D42:D57)/16 -> 20.875 | E58: =SUM(E42:E57)/16 -> 15.625 | F58: =SUM(F42:F57)/16 -> 22.4375 | G58: =SUM(G42:G57)/#REF! -> #REF!