A3: Shotgun Side Match Results
A4: Place | B4: Name | C4: *DIV | D4: Shoot Total | E4: Total PD | F4: Stage 1 | G4: String 1 | H4: String 2 | I4: String 3 | J4: PD | K4: Stage 2 | L4: String 1 | M4: String 2 | N4: String 3 | O4: PD
A5: 1 | B5: Ostler, Jeff | C5: AUTO | D5: =+F5+K5 -> 11.17 | E5: =+J5+O5 -> 0 | F5: =+(G5+H5+I5)+5*J5 -> 6.33 | G5: 2.42 | H5: 2.04 | I5: 1.87 | J5: 0 | K5: =+(L5+M5+N5)+5*O5 -> 4.84 | L5: 1.66 | M5: 1.57 | N5: 1.61 | O5: 0
A6: 2 | B6: Terry, Dale | C6: AUTO | D6: =+F6+K6 -> 11.88 | E6: =+J6+O6 -> 0 | F6: =+(G6+H6+I6)+5*J6 -> 7.16 | G6: 2.66 | H6: 2.29 | I6: 2.21 | J6: 0 | K6: =+(L6+M6+N6)+5*O6 -> 4.72 | L6: 1.62 | M6: 1.50 | N6: 1.60 | O6: 0
A7: 3 | B7: Terry, Blaine | C7: AUTO | D7: =+F7+K7 -> 12.43 | E7: =+J7+O7 -> 0 | F7: =+(G7+H7+I7)+5*J7 -> 8.62 | G7: 2.28 | H7: 1.99 | I7: 4.35 | J7: 0 | K7: =+(L7+M7+N7)+5*O7 -> 3.81 | L7: 1.24 | M7: 1.33 | N7: 1.24 | O7: 0
A8: 4 | B8: Latham, Corey | C8: AUTO | D8: =+F8+K8 -> 12.67 | E8: =+J8+O8 -> 0 | F8: =+(G8+H8+I8)+5*J8 -> 7.81 | G8: 2.77 | H8: 2.44 | I8: 2.60 | J8: 0 | K8: =+(L8+M8+N8)+5*O8 -> 4.86 | L8: 1.60 | M8: 1.61 | N8: 1.65 | O8: 0
A9: 5 | B9: Nankervis, Bob | C9: AUTO | D9: =+F9+K9 -> 15.53 | E9: =+J9+O9 -> 0 | F9: =+(G9+H9+I9)+5*J9 -> 9.46 | G9: 3.76 | H9: 2.98 | I9: 2.72 | J9: 0 | K9: =+(L9+M9+N9)+5*O9 -> 6.07 | L9: 1.97 | M9: 2.05 | N9: 2.05 | O9: 0
A10: 6 | B10: Stevens, Randy | C10: AUTO | D10: =+F10+K10 -> 16.06 | E10: =+J10+O10 -> 0 | F10: =+(G10+H10+I10)+5*J10 -> 10.40 | G10: 3.57 | H10: 3.18 | I10: 3.65 | J10: 0 | K10: =+(L10+M10+N10)+5*O10 -> 5.66 | L10: 1.96 | M10: 1.88 | N10: 1.82 | O10: 0
A11: 7 | B11: Griffiths, Todd | C11: AUTO | D11: =+F11+K11 -> 16.33 | E11: =+J11+O11 -> 0 | F11: =+(G11+H11+I11)+5*J11 -> 9.10 | G11: 2.94 | H11: 3.34 | I11: 2.82 | J11: 0 | K11: =+(L11+M11+N11)+5*O11 -> 7.23 | L11: 2.19 | M11: 2.38 | N11: 2.66 | O11: 0
A12: 8 | B12: Beck, Dave | C12: AUTO | D12: =+F12+K12 -> 19.34 | E12: =+J12+O12 -> 1 | F12: =+(G12+H12+I12)+5*J12 -> 8.32 | G12: 2.86 | H12: 2.93 | I12: 2.53 | J12: 0 | K12: =+(L12+M12+N12)+5*O12 -> 11.02 | L12: 2.06 | M12: 2.12 | N12: 1.84 | O12: 1
A13: 9 | B13: Theodore, Ari | C13: AUTO | D13: =+F13+K13 -> 19.52 | E13: =+J13+O13 -> 0 | F13: =+(G13+H13+I13)+5*J13 -> 11.29 | G13: 5.10 | H13: 4.05 | I13: 2.14 | J13: 0 | K13: =+(L13+M13+N13)+5*O13 -> 8.23 | L13: 2.84 | M13: 2.75 | N13: 2.64 | O13: 0
A14: 10 | B14: Zaccardi, Pat | C14: AUTO | D14: =+F14+K14 -> 20.36 | E14: =+J14+O14 -> 0 | F14: =+(G14+H14+I14)+5*J14 -> 10.45 | G14: 3.53 | H14: 3.47 | I14: 3.45 | J14: 0 | K14: =+(L14+M14+N14)+5*O14 -> 9.91 | L14: 2.62 | M14: 3.96 | N14: 3.33 | O14: 0
A15: 11 | B15: Terry, Mark | C15: AUTO | D15: =+F15+K15 -> 27.48 | E15: =+J15+O15 -> 0 | F15: =+(G15+H15+I15)+5*J15 -> 14.41 | G15: 4.88 | H15: 6.93 | I15: 2.60 | J15: 0 | K15: =+(L15+M15+N15)+5*O15 -> 13.07 | L15: 2.21 | M15: 8.85 | N15: 2.01 | O15: 0
A16: 12 | B16: Collins, Ken | C16: AUTO | D16: =+F16+K16 -> 29.74 | E16: =+J16+O16 -> 1 | F16: =+(G16+H16+I16)+5*J16 -> 18.43 | G16: 11.30 | H16: 3.78 | I16: 3.35 | J16: 0 | K16: =+(L16+M16+N16)+5*O16 -> 11.31 | L16: 2.07 | M16: 1.99 | N16: 2.25 | O16: 1
A17: 13 | B17: Correia, Larry | C17: AUTO | D17: =+F17+K17 -> 31.93 | E17: =+J17+O17 -> 4 | F17: =+(G17+H17+I17)+5*J17 -> 7.35 | G17: 2.64 | H17: 2.35 | I17: 2.36 | J17: 0 | K17: =+(L17+M17+N17)+5*O17 -> 24.58 | L17: 1.72 | M17: 1.41 | N17: 1.45 | O17: 4
A18: 14 | B18: Latham, Cody | C18: AUTO | D18: =+F18+K18 -> 32.30 | E18: =+J18+O18 -> 0 | F18: =+(G18+H18+I18)+5*J18 -> 23.92 | G18: 6.11 | H18: 12.81 | I18: 5.00 | J18: 0 | K18: =+(L18+M18+N18)+5*O18 -> 8.38 | L18: 2.72 | M18: 2.99 | N18: 2.67 | O18: 0
A19: 15 | B19: Loveless, Doug | C19: AUTO | D19: =+F19+K19 -> 41.36 | E19: =+J19+O19 -> 5 | F19: =+(G19+H19+I19)+5*J19 -> 29.06 | G19: 4.17 | H19: 0.89 | I19: 4.00 | J19: 4 | K19: =+(L19+M19+N19)+5*O19 -> 12.30 | L19: 2.59 | M19: 2.29 | N19: 2.42 | O19: 1
A20: 1 | B20: Outzen, Craig | C20: PUMP | D20: =+F20+K20 -> 14.97 | E20: =+J20+O20 -> 0 | F20: =+(G20+H20+I20)+5*J20 -> 8.36 | G20: 2.91 | H20: 2.78 | I20: 2.67 | J20: 0 | K20: =+(L20+M20+N20)+5*O20 -> 6.61 | L20: 2.37 | M20: 2.05 | N20: 2.19 | O20: 0
A21: 2 | B21: Knapp, Chris | C21: PUMP | D21: =+F21+K21 -> 17.12 | E21: =+J21+O21 -> 0 | F21: =+(G21+H21+I21)+5*J21 -> 9.49 | G21: 3.12 | H21: 3.21 | I21: 3.16 | J21: 0 | K21: =+(L21+M21+N21)+5*O21 -> 7.63 | L21: 2.61 | M21: 2.57 | N21: 2.45 | O21: 0
A22: 3 | B22: Zaccardi, Juke | C22: PUMP | D22: =+F22+K22 -> 20.65 | E22: =+J22+O22 -> 0 | F22: =+(G22+H22+I22)+5*J22 -> 11.38 | G22: 4.01 | H22: 3.59 | I22: 3.78 | J22: 0 | K22: =+(L22+M22+N22)+5*O22 -> 9.27 | L22: 2.88 | M22: 3.51 | N22: 2.88 | O22: 0
A23: 4 | B23: Lowe, John | C23: PUMP | D23: =+F23+K23 -> 21.05 | E23: =+J23+O23 -> 0 | F23: =+(G23+H23+I23)+5*J23 -> 12.66 | G23: 3.96 | H23: 4.74 | I23: 3.96 | J23: 0 | K23: =+(L23+M23+N23)+5*O23 -> 8.39 | L23: 2.19 | M23: 3.29 | N23: 2.91 | O23: 0
A24: Notes:
A25: xx | B25: Indicates that the Points Down value includes some kind of penalty (Procedural Error, Hits on Non-Threat or Misses on Steel).
A26: PD | B26: = Points Down value is PD x .5 seconds added to the total stage time.
A27: DNF | B27: = Did Not Finish