A3: Click here for Shotgun Side Match Results
A4: Place | B4: Name | C4: *DIV | D4: Shoot Total | E4: Total PD | F4: Stage 1 | G4: String 1 | H4: PD | I4: Stage 2 | J4: String 1 | K4: PD | L4: Stage 3 | M4: String 1 | N4: String 2 | O4: PD | P4: Stage 4 | Q4: String 1 | R4: PD | S4: Stage 5 | T4: String 1 | U4: String 2 | V4: PD | W4: Stage 6 | X4: String 1 | Y4: String 2 | Z4: PD | AA4: Stage 7 | AB4: String 1 | AC4: PD
A5: 1 | B5: Ostler, Jeff | C5: HiCAP | D5: =+F5+I5+L5+P5+S5+W5 -> 237.40 | E5: =+H5+K5+O5+R5+V5+Z5+AC5 -> 0 | F5: =+(G5)+0.5*H5 -> 23.94 | G5: 23.94 | H5: 0 | I5: =+(J5)+0.5*K5 -> 50.55 | J5: 50.55 | K5: 0 | L5: =+(M5+N5)+0.5*O5 -> 44.31 | M5: 23.12 | N5: 21.19 | O5: 0 | P5: =+(Q5)+0.5*R5 -> 30.98 | Q5: 30.98 | R5: 0 | S5: =+(T5+U5)+0.5*V5 -> 42.59 | T5: 16.29 | U5: 26.30 | V5: 0 | W5: =+(X5+Y5)+0.5*Z5 -> 45.03 | X5: 18.62 | Y5: 26.41 | Z5: 0 | AA5: =+(AB5)+0.5*AC5 -> 23.50 | AB5: 23.50 | AC5: 0
A6: 2 | B6: Stevens, Randy | C6: HiCAP | D6: =+F6+I6+L6+P6+S6+W6 -> 269.26 | E6: =+H6+K6+O6+R6+V6+Z6+AC6 -> 0 | F6: =+(G6)+0.5*H6 -> 30.34 | G6: 30.34 | H6: 0 | I6: =+(J6)+0.5*K6 -> 67.85 | J6: 67.85 | K6: 0 | L6: =+(M6+N6)+0.5*O6 -> 36.53 | M6: 18.67 | N6: 17.86 | O6: 0 | P6: =+(Q6)+0.5*R6 -> 32.83 | Q6: 32.83 | R6: 0 | S6: =+(T6+U6)+0.5*V6 -> 55.72 | T6: 21.28 | U6: 34.44 | V6: 0 | W6: =+(X6+Y6)+0.5*Z6 -> 45.99 | X6: 22.29 | Y6: 23.70 | Z6: 0 | AA6: =+(AB6)+0.5*AC6 -> 23.17 | AB6: 23.17 | AC6: 0
A7: 3 | B7: Outzen, Craig | C7: HiCAP | D7: =+F7+I7+L7+P7+S7+W7 -> 314.86 | E7: =+H7+K7+O7+R7+V7+Z7+AC7 -> 0 | F7: =+(G7)+0.5*H7 -> 26.38 | G7: 26.38 | H7: 0 | I7: =+(J7)+0.5*K7 -> 50.39 | J7: 50.39 | K7: 0 | L7: =+(M7+N7)+0.5*O7 -> 47.22 | M7: 20.59 | N7: 26.63 | O7: 0 | P7: =+(Q7)+0.5*R7 -> 37.18 | Q7: 37.18 | R7: 0 | S7: =+(T7+U7)+0.5*V7 -> 61.88 | T7: 19.49 | U7: 42.39 | V7: 0 | W7: =+(X7+Y7)+0.5*Z7 -> 91.81 | X7: 69.76 | Y7: 22.05 | Z7: 0 | AA7: =+(AB7)+0.5*AC7 -> 27.90 | AB7: 27.90 | AC7: 0
A8: 4 | B8: Montgomery, Robert | C8: HiCAP | D8: =+F8+I8+L8+P8+S8+W8 -> 385.42 | E8: =+H8+K8+O8+R8+V8+Z8+AC8 -> 0 | F8: =+(G8)+0.5*H8 -> 36.51 | G8: 36.51 | H8: 0 | I8: =+(J8)+0.5*K8 -> 63.61 | J8: 63.61 | K8: 0 | L8: =+(M8+N8)+0.5*O8 -> 57.18 | M8: 25.61 | N8: 31.57 | O8: 0 | P8: =+(Q8)+0.5*R8 -> 49.29 | Q8: 49.29 | R8: 0 | S8: =+(T8+U8)+0.5*V8 -> 83.90 | T8: 29.59 | U8: 54.31 | V8: 0 | W8: =+(X8+Y8)+0.5*Z8 -> 94.93 | X8: 49.17 | Y8: 45.76 | Z8: 0 | AA8: =+(AB8)+0.5*AC8 -> 40.39 | AB8: 40.39 | AC8: 0
A9: 5 | B9: Brownlee, Mike | C9: HiCAP | D9: =+F9+I9+L9+P9+S9+W9 -> 437.60 | E9: =+H9+K9+O9+R9+V9+Z9+AC9 -> 0 | F9: =+(G9)+0.5*H9 -> 74.19 | G9: 74.19 | H9: 0 | I9: =+(J9)+0.5*K9 -> 81.69 | J9: 81.69 | K9: 0 | L9: =+(M9+N9)+0.5*O9 -> 75.64 | M9: 42.21 | N9: 33.43 | O9: 0 | P9: =+(Q9)+0.5*R9 -> 48.00 | Q9: 48.00 | R9: 0 | S9: =+(T9+U9)+0.5*V9 -> 70.71 | T9: 30.46 | U9: 40.25 | V9: 0 | W9: =+(X9+Y9)+0.5*Z9 -> 87.37 | X9: 53.10 | Y9: 34.27 | Z9: 0 | AA9: =+(AB9)+0.5*AC9 -> 37.78 | AB9: 37.78 | AC9: 0
A10: 1 | B10: Knapp, Chris | C10: OPEN | D10: =+F10+I10+L10+P10+S10+W10 -> 168.42 | E10: =+H10+K10+O10+R10+V10+Z10+AC10 -> 0 | F10: =+(G10)+0.5*H10 -> 23.38 | G10: 23.38 | H10: 0 | I10: =+(J10)+0.5*K10 -> 35.05 | J10: 35.05 | K10: 0 | L10: =+(M10+N10)+0.5*O10 -> 33.80 | M10: 18.33 | N10: 15.47 | O10: 0 | P10: =+(Q10)+0.5*R10 -> 24.05 | Q10: 24.05 | R10: 0 | S10: =+(T10+U10)+0.5*V10 -> 19.95 | T10: 7.34 | U10: 12.61 | V10: 0 | W10: =+(X10+Y10)+0.5*Z10 -> 32.19 | X10: 14.57 | Y10: 17.62 | Z10: 0 | AA10: =+(AB10)+0.5*AC10 -> 14.64 | AB10: 14.64 | AC10: 0
A11: 2 | B11: Lowe, John | C11: OPEN | D11: =+F11+I11+L11+P11+S11+W11 -> 183.83 | E11: =+H11+K11+O11+R11+V11+Z11+AC11 -> 0 | F11: =+(G11)+0.5*H11 -> 18.78 | G11: 18.78 | H11: 0 | I11: =+(J11)+0.5*K11 -> 41.81 | J11: 41.81 | K11: 0 | L11: =+(M11+N11)+0.5*O11 -> 36.54 | M11: 19.09 | N11: 17.45 | O11: 0 | P11: =+(Q11)+0.5*R11 -> 20.62 | Q11: 20.62 | R11: 0 | S11: =+(T11+U11)+0.5*V11 -> 20.02 | T11: 11.11 | U11: 8.91 | V11: 0 | W11: =+(X11+Y11)+0.5*Z11 -> 46.06 | X11: 24.70 | Y11: 21.36 | Z11: 0 | AA11: =+(AB11)+0.5*AC11 -> 19.58 | AB11: 19.58 | AC11: 0
A12: 3 | B12: Collins, Ken | C12: OPEN | D12: =+F12+I12+L12+P12+S12+W12 -> 198.90 | E12: =+H12+K12+O12+R12+V12+Z12+AC12 -> 0 | F12: =+(G12)+0.5*H12 -> 25.15 | G12: 25.15 | H12: 0 | I12: =+(J12)+0.5*K12 -> 40.17 | J12: 40.17 | K12: 0 | L12: =+(M12+N12)+0.5*O12 -> 38.57 | M12: 20.74 | N12: 17.83 | O12: 0 | P12: =+(Q12)+0.5*R12 -> 23.85 | Q12: 23.85 | R12: 0 | S12: =+(T12+U12)+0.5*V12 -> 35.77 | T12: 18.37 | U12: 17.40 | V12: 0 | W12: =+(X12+Y12)+0.5*Z12 -> 35.39 | X12: 19.52 | Y12: 15.87 | Z12: 0 | AA12: =+(AB12)+0.5*AC12 -> 23.53 | AB12: 23.53 | AC12: 0
A13: 4 | B13: Correia, Larry | C13: OPEN | D13: =+F13+I13+L13+P13+S13+W13 -> 217.58 | E13: =+H13+K13+O13+R13+V13+Z13+AC13 -> 5 | F13: =+(G13)+0.5*H13 -> 24.84 | G13: 24.84 | H13: 0 | I13: =+(J13)+0.5*K13 -> 47.07 | J13: 47.07 | K13: 0 | L13: =+(M13+N13)+0.5*O13 -> 46.23 | M13: 25.91 | N13: 20.32 | O13: 0 | P13: =+(Q13)+0.5*R13 -> 22.97 | Q13: 22.97 | R13: 0 | S13: =+(T13+U13)+5*V13 -> 29.21 | T13: 12.42 | U13: 11.79 | V13: 1 | W13: =+(X13+Y13)+5*Z13 -> 47.26 | X13: 12.54 | Y13: 14.72 | Z13: 4 | AA13: =+(AB13)+0.5*AC13 -> 32.98 | AB13: 32.98 | AC13: 0
A14: 1 | B14: Huff, Blake | C14: REV | D14: =+F14+I14+L14+P14+S14+W14 -> 321.48 | E14: =+H14+K14+O14+R14+V14+Z14+AC14 -> 0 | F14: =+(G14)+0.5*H14 -> 37.96 | G14: 37.96 | H14: 0 | I14: =+(J14)+0.5*K14 -> 62.97 | J14: 62.97 | K14: 0 | L14: =+(M14+N14)+0.5*O14 -> 60.50 | M14: 33.28 | N14: 27.22 | O14: 0 | P14: =+(Q14)+0.5*R14 -> 41.86 | Q14: 41.86 | R14: 0 | S14: =+(T14+U14)+0.5*V14 -> 55.19 | T14: 20.99 | U14: 34.20 | V14: 0 | W14: =+(X14+Y14)+0.5*Z14 -> 63.00 | X14: 33.59 | Y14: 29.41 | Z14: 0 | AA14: =+(AB14)+0.5*AC14 -> 30.03 | AB14: 30.03 | AC14: 0
A15: 2 | B15: Redford, Steve | C15: REV | D15: =+F15+I15+L15+P15+S15+W15 -> 506.35 | E15: =+H15+K15+O15+R15+V15+Z15+AC15 -> 0 | F15: =+(G15)+0.5*H15 -> 63.46 | G15: 63.46 | H15: 0 | I15: =+(J15)+0.5*K15 -> 139.95 | J15: 139.95 | K15: 0 | L15: =+(M15+N15)+0.5*O15 -> 76.84 | M15: 44.72 | N15: 32.12 | O15: 0 | P15: =+(Q15)+0.5*R15 -> 64.21 | Q15: 64.21 | R15: 0 | S15: =+(T15+U15)+0.5*V15 -> 73.99 | T15: 35.13 | U15: 38.86 | V15: 0 | W15: =+(X15+Y15)+0.5*Z15 -> 87.90 | X15: 41.75 | Y15: 46.15 | Z15: 0 | AA15: =+(AB15)+0.5*AC15 -> 50.15 | AB15: 50.15 | AC15: 0
A16: 1 | B16: Terry, Dale | C16: REVOP | D16: =+F16+I16+L16+P16+S16+W16 -> 201.85 | E16: =+H16+K16+O16+R16+V16+Z16 -> 0 | F16: =+(G16)+0.5*H16 -> 23.47 | G16: 23.47 | H16: 0 | I16: =+(J16)+0.5*K16 -> 38.91 | J16: 38.91 | K16: 0 | L16: =+(M16+N16)+0.5*O16 -> 32.62 | M16: 16.24 | N16: 16.38 | O16: 0 | P16: =+(Q16)+0.5*R16 -> 27.72 | Q16: 27.72 | R16: 0 | S16: =+(T16+U16)+0.5*V16 -> 38.97 | T16: 18.22 | U16: 20.75 | V16: 0 | W16: =+(X16+Y16)+0.5*Z16 -> 40.16 | X16: 20.37 | Y16: 19.79 | Z16: 0 | AA16: =+(AB16)+0.5*AC16 -> 29.92 | AB16: 29.92 | AC16: 0
A17: 2 | B17: Terry, Blaine | C17: REVOP | D17: =+F17+I17+L17+P17+S17+W17+AA17 -> 203.61 | E17: =+H17+K17+O17+R17+V17+Z17 -> 0 | F17: =+(G17)+0.5*H17 -> 28.65 | G17: 28.65 | H17: 0 | I17: =+(J17)+0.5*K17 -> 30.77 | J17: 30.77 | K17: 0 | L17: =+(M17+N17)+0.5*O17 -> 29.88 | M17: 14.64 | N17: 15.24 | O17: 0 | P17: =+(Q17)+0.5*R17 -> 21.14 | Q17: 21.14 | R17: 0 | S17: =+(T17+U17)+0.5*V17 -> 38.54 | T17: 13.60 | U17: 24.94 | V17: 0 | W17: =+(X17+Y17)+0.5*Z17 -> 33.59 | X17: 16.77 | Y17: 16.82 | Z17: 0 | AA17: =+(AB17)+0.5*AC17 -> 21.04 | AB17: 21.04 | AC17: 0
A18: 3 | B18: Terry, Mark | C18: REVOP | D18: =+F18+I18+L18+P18+S18+W18 -> 213.20 | E18: =+H18+K18+O18+R18+V18+Z18 -> 0 | F18: =+(G18)+0.5*H18 -> 30.99 | G18: 30.99 | H18: 0 | I18: =+(J18)+0.5*K18 -> 39.11 | J18: 39.11 | K18: 0 | L18: =+(M18+N18)+0.5*O18 -> 34.82 | M18: 18.36 | N18: 16.46 | O18: 0 | P18: =+(Q18)+0.5*R18 -> 30.40 | Q18: 30.40 | R18: 0 | S18: =+(T18+U18)+0.5*V18 -> 37.96 | T18: 16.58 | U18: 21.38 | V18: 0 | W18: =+(X18+Y18)+0.5*Z18 -> 39.92 | X18: 20.63 | Y18: 19.29 | Z18: 0 | AA18: =+(AB18)+0.5*AC18 -> 24.59 | AB18: 24.59 | AC18: 0
A19: 4 | B19: Nankervis, Bob | C19: REVOP | D19: =+F19+I19+L19+P19+S19+W19 -> 347.56 | E19: =+H19+K19+O19+R19+V19+Z19 -> 0 | F19: =+(G19)+0.5*H19 -> 35.15 | G19: 35.15 | H19: 0 | I19: =+(J19)+0.5*K19 -> 75.41 | J19: 75.41 | K19: 0 | L19: =+(M19+N19)+0.5*O19 -> 61.89 | M19: 31.05 | N19: 30.84 | O19: 0 | P19: =+(Q19)+0.5*R19 -> 38.91 | Q19: 38.91 | R19: 0 | S19: =+(T19+U19)+0.5*V19 -> 65.74 | T19: 19.52 | U19: 46.22 | V19: 0 | W19: =+(X19+Y19)+0.5*Z19 -> 70.46 | X19: 31.36 | Y19: 39.10 | Z19: 0 | AA19: =+(AB19)+0.5*AC19 -> 31.55 | AB19: 31.55 | AC19: 0
A20: 1 | B20: Griffiths, Todd | C20: TRM | D20: =+F20+I20+L20+P20+S20+W20 -> 230.42 | E20: =+H20+K20+O20+R20+V20+Z20+AC20 -> 0 | F20: =+(G20)+0.5*H20 -> 27.76 | G20: 27.76 | H20: 0 | I20: =+(J20)+0.5*K20 -> 38.52 | J20: 38.52 | K20: 0 | L20: =+(M20+N20)+0.5*O20 -> 37.22 | M20: 16.55 | N20: 20.67 | O20: 0 | P20: =+(Q20)+0.5*R20 -> 35.59 | Q20: 35.59 | R20: 0 | S20: =+(T20+U20)+0.5*V20 -> 43.74 | T20: 21.13 | U20: 22.61 | V20: 0 | W20: =+(X20+Y20)+0.5*Z20 -> 47.59 | X20: 24.24 | Y20: 23.35 | Z20: 0 | AA20: =+(AB20)+0.5*AC20 -> 25.17 | AB20: 25.17 | AC20: 0
A21: 2 | B21: Latham, Corey | C21: TRM | D21: =+F21+I21+L21+P21+S21+W21 -> 242.40 | E21: =+H21+K21+O21+R21+V21+Z21+AC21 -> 0 | F21: =+(G21)+0.5*H21 -> 28.13 | G21: 28.13 | H21: 0 | I21: =+(J21)+0.5*K21 -> 34.27 | J21: 34.27 | K21: 0 | L21: =+(M21+N21)+0.5*O21 -> 40.02 | M21: 21.68 | N21: 18.34 | O21: 0 | P21: =+(Q21)+0.5*R21 -> 43.39 | Q21: 43.39 | R21: 0 | S21: =+(T21+U21)+0.5*V21 -> 42.96 | T21: 19.64 | U21: 23.32 | V21: 0 | W21: =+(X21+Y21)+0.5*Z21 -> 53.63 | X21: 36.10 | Y21: 17.53 | Z21: 0 | AA21: =+(AB21)+0.5*AC21 -> 23.69 | AB21: 23.69 | AC21: 0
A22: 3 | B22: Theodore, Ari | C22: TRM | D22: =+F22+I22+L22+P22+S22+W22 -> 249.42 | E22: =+H22+K22+O22+R22+V22+Z22+AC22 -> 0 | F22: =+(G22)+0.5*H22 -> 29.72 | G22: 29.72 | H22: 0 | I22: =+(J22)+0.5*K22 -> 53.97 | J22: 53.97 | K22: 0 | L22: =+(M22+N22)+0.5*O22 -> 39.60 | M22: 20.22 | N22: 19.38 | O22: 0 | P22: =+(Q22)+0.5*R22 -> 34.50 | Q22: 34.50 | R22: 0 | S22: =+(T22+U22)+0.5*V22 -> 43.92 | T22: 18.01 | U22: 25.91 | V22: 0 | W22: =+(X22+Y22)+0.5*Z22 -> 47.71 | X22: 23.25 | Y22: 24.46 | Z22: 0 | AA22: =+(AB22)+0.5*AC22 -> 25.42 | AB22: 25.42 | AC22: 0
A23: 4 | B23: Zaccardi, Pat | C23: TRM | D23: =+F23+I23+L23+P23+S23+W23 -> 282.80 | E23: =+H23+K23+O23+R23+V23+Z23+AC23 -> 0 | F23: =+(G23)+0.5*H23 -> 26.18 | G23: 26.18 | H23: 0 | I23: =+(J23)+0.5*K23 -> 58.30 | J23: 58.30 | K23: 0 | L23: =+(M23+N23)+0.5*O23 -> 46.05 | M23: 22.76 | N23: 23.29 | O23: 0 | P23: =+(Q23)+0.5*R23 -> 32.02 | Q23: 32.02 | R23: 0 | S23: =+(T23+U23)+0.5*V23 -> 61.11 | T23: 24.28 | U23: 36.83 | V23: 0 | W23: =+(X23+Y23)+0.5*Z23 -> 59.14 | X23: 26.57 | Y23: 32.57 | Z23: 0 | AA23: =+(AB23)+0.5*AC23 -> 31.21 | AB23: 31.21 | AC23: 0
A24: 5 | B24: Beck, Dave | C24: TRM | D24: =+F24+I24+L24+P24+S24+W24 -> 308.32 | E24: =+H24+K24+O24+R24+V24+Z24+AC24 -> 0 | F24: =+(G24)+0.5*H24 -> 31.49 | G24: 31.49 | H24: 0 | I24: =+(J24)+0.5*K24 -> 54.70 | J24: 54.70 | K24: 0 | L24: =+(M24+N24)+0.5*O24 -> 49.59 | M24: 21.61 | N24: 27.98 | O24: 0 | P24: =+(Q24)+0.5*R24 -> 35.86 | Q24: 35.86 | R24: 0 | S24: =+(T24+U24)+0.5*V24 -> 77.54 | T24: 25.26 | U24: 52.28 | V24: 0 | W24: =+(X24+Y24)+0.5*Z24 -> 59.14 | X24: 25.76 | Y24: 33.38 | Z24: 0 | AA24: =+(AB24)+0.5*AC24 -> 29.00 | AB24: 29.00 | AC24: 0
A25: 6 | B25: Rodriguez, Mike | C25: TRM | D25: =+F25+I25+L25+P25+S25+W25 -> 324.03 | E25: =+H25+K25+O25+R25+V25+Z25+AC25 -> 0 | F25: =+(G25)+0.5*H25 -> 32.09 | G25: 32.09 | H25: 0 | I25: =+(J25)+0.5*K25 -> 62.16 | J25: 62.16 | K25: 0 | L25: =+(M25+N25)+0.5*O25 -> 65.45 | M25: 33.41 | N25: 32.04 | O25: 0 | P25: =+(Q25)+0.5*R25 -> 40.76 | Q25: 40.76 | R25: 0 | S25: =+(T25+U25)+0.5*V25 -> 51.51 | T25: 20.53 | U25: 30.98 | V25: 0 | W25: =+(X25+Y25)+0.5*Z25 -> 72.06 | X25: 39.18 | Y25: 32.88 | Z25: 0 | AA25: =+(AB25)+0.5*AC25 -> 40.39 | AB25: 40.39 | AC25: 0
A26: 7 | B26: Zaccardi, Juke | C26: TRM | D26: =+F26+I26+L26+P26+S26+W26 -> 327.48 | E26: =+H26+K26+O26+R26+V26+Z26+AC26 -> 0 | F26: =+(G26)+0.5*H26 -> 34.57 | G26: 34.57 | H26: 0 | I26: =+(J26)+0.5*K26 -> 65.31 | J26: 65.31 | K26: 0 | L26: =+(M26+N26)+0.5*O26 -> 44.99 | M26: 19.77 | N26: 25.22 | O26: 0 | P26: =+(Q26)+0.5*R26 -> 28.09 | Q26: 28.09 | R26: 0 | S26: =+(T26+U26)+0.5*V26 -> 92.77 | T26: 29.12 | U26: 63.65 | V26: 0 | W26: =+(X26+Y26)+0.5*Z26 -> 61.75 | X26: 36.19 | Y26: 25.56 | Z26: 0 | AA26: =+(AB26)+0.5*AC26 -> 32.34 | AB26: 32.34 | AC26: 0
A27: 8 | B27: Hiner, Brett | C27: TRM | D27: =+F27+I27+L27+P27+S27+W27 -> 379.87 | E27: =+H27+K27+O27+R27+V27+Z27+AC27 -> 0 | F27: =+(G27)+0.5*H27 -> 47.27 | G27: 47.27 | H27: 0 | I27: =+(J27)+0.5*K27 -> 61.67 | J27: 61.67 | K27: 0 | L27: =+(M27+N27)+0.5*O27 -> 55.52 | M27: 30.52 | N27: 25.00 | O27: 0 | P27: =+(Q27)+0.5*R27 -> 64.81 | Q27: 64.81 | R27: 0 | S27: =+(T27+U27)+0.5*V27 -> 79.45 | T27: 36.40 | U27: 43.05 | V27: 0 | W27: =+(X27+Y27)+0.5*Z27 -> 71.15 | X27: 34.69 | Y27: 36.46 | Z27: 0 | AA27: =+(AB27)+0.5*AC27 -> 40.38 | AB27: 40.38 | AC27: 0
A28: 9 | B28: Adams, Brent | C28: TRM | D28: =+F28+I28+L28+P28+S28+W28 -> 388.19 | E28: =+H28+K28+O28+R28+V28+Z28+AC28 -> 0 | F28: =+(G28)+0.5*H28 -> 56.05 | G28: 56.05 | H28: 0 | I28: =+(J28)+0.5*K28 -> 97.12 | J28: 97.12 | K28: 0 | L28: =+(M28+N28)+0.5*O28 -> 55.19 | M28: 28.18 | N28: 27.01 | O28: 0 | P28: =+(Q28)+0.5*R28 -> 44.56 | Q28: 44.56 | R28: 0 | S28: =+(T28+U28)+0.5*V28 -> 55.42 | T28: 27.55 | U28: 27.87 | V28: 0 | W28: =+(X28+Y28)+0.5*Z28 -> 79.85 | X28: 37.47 | Y28: 42.38 | Z28: 0 | AA28: =+(AB28)+0.5*AC28 -> 42.63 | AB28: 42.63 | AC28: 0
A29: 10 | B29: Vollmer, Phillip | C29: TRM | D29: =+F29+I29+L29+P29+S29+W29 -> 421.05 | E29: =+H29+K29+O29+R29+V29+Z29+AC29 -> 0 | F29: =+(G29)+0.5*H29 -> 59.67 | G29: 59.67 | H29: 0 | I29: =+(J29)+0.5*K29 -> 60.71 | J29: 60.71 | K29: 0 | L29: =+(M29+N29)+0.5*O29 -> 60.68 | M29: 28.22 | N29: 32.46 | O29: 0 | P29: =+(Q29)+0.5*R29 -> 52.87 | Q29: 52.87 | R29: 0 | S29: =+(T29+U29)+0.5*V29 -> 96.52 | T29: 45.68 | U29: 50.84 | V29: 0 | W29: =+(X29+Y29)+0.5*Z29 -> 90.60 | X29: 60.11 | Y29: 30.49 | Z29: 0 | AA29: =+(AB29)+0.5*AC29 -> 42.67 | AB29: 42.67 | AC29: 0
A30: 11 | B30: Simon, Clint | C30: TRM | D30: =+F30+I30+L30+P30+S30+W30 -> 434.60 | E30: =+H30+K30+O30+R30+V30+Z30+AC30 -> 0 | F30: =+(G30)+0.5*H30 -> 53.23 | G30: 53.23 | H30: 0 | I30: =+(J30)+0.5*K30 -> 66.73 | J30: 66.73 | K30: 0 | L30: =+(M30+N30)+0.5*O30 -> 69.84 | M30: 29.24 | N30: 40.60 | O30: 0 | P30: =+(Q30)+0.5*R30 -> 61.50 | Q30: 61.50 | R30: 0 | S30: =+(T30+U30)+0.5*V30 -> 67.77 | T30: 30.33 | U30: 37.44 | V30: 0 | W30: =+(X30+Y30)+0.5*Z30 -> 115.53 | X30: 77.68 | Y30: 37.85 | Z30: 0 | AA30: =+(AB30)+0.5*AC30 -> 51.51 | AB30: 51.51 | AC30: 0
A31: 12 | B31: Redford, Kent | C31: TRM | D31: =+F31+I31+L31+P31+S31+W31 -> 442.10 | E31: =+H31+K31+O31+R31+V31+Z31+AC31 -> 0 | F31: =+(G31)+0.5*H31 -> 42.79 | G31: 42.79 | H31: 0 | I31: =+(J31)+0.5*K31 -> 125.45 | J31: 125.45 | K31: 0 | L31: =+(M31+N31)+0.5*O31 -> 75.39 | M31: 40.65 | N31: 34.74 | O31: 0 | P31: =+(Q31)+0.5*R31 -> 50.77 | Q31: 50.77 | R31: 0 | S31: =+(T31+U31)+0.5*V31 -> 76.22 | T31: 34.39 | U31: 41.83 | V31: 0 | W31: =+(X31+Y31)+0.5*Z31 -> 71.48 | X31: 33.33 | Y31: 38.15 | Z31: 0 | AA31: =+(AB31)+0.5*AC31 -> 28.59 | AB31: 28.59 | AC31: 0
A32: 13 | B32: Scott, Alan | C32: TRM | D32: =+F32+I32+L32+P32+S32+W32 -> 446.68 | E32: =+H32+K32+O32+R32+V32+Z32+AC32 -> 0 | F32: =+(G32)+0.5*H32 -> 52.44 | G32: 52.44 | H32: 0 | I32: =+(J32)+0.5*K32 -> 81.97 | J32: 81.97 | K32: 0 | L32: =+(M32+N32)+0.5*O32 -> 71.09 | M32: 36.60 | N32: 34.49 | O32: 0 | P32: =+(Q32)+0.5*R32 -> 73.71 | Q32: 73.71 | R32: 0 | S32: =+(T32+U32)+0.5*V32 -> 90.24 | T32: 46.82 | U32: 43.42 | V32: 0 | W32: =+(X32+Y32)+0.5*Z32 -> 77.23 | X32: 41.66 | Y32: 35.57 | Z32: 0 | AA32: =+(AB32)+0.5*AC32 -> 63.24 | AB32: 63.24 | AC32: 0
A33: 14 | B33: Loveless, Doug | C33: TRM | D33: =+F33+I33+L33+P33+S33+W33 -> 446.95 | E33: =+H33+K33+O33+R33+V33+Z33+AC33 -> 5 | F33: =+(G33)+0.5*H33 -> 58.69 | G33: 58.69 | H33: 0 | I33: =+(J33)+5*K33 -> 93.33 | J33: 68.33 | K33: 5 | L33: =+(M33+N33)+0.5*O33 -> 66.10 | M33: 30.16 | N33: 35.94 | O33: 0 | P33: =+(Q33)+0.5*R33 -> 54.05 | Q33: 54.05 | R33: 0 | S33: =+(T33+U33)+0.5*V33 -> 62.04 | T33: 35.35 | U33: 26.69 | V33: 0 | W33: =+(X33+Y33)+0.5*Z33 -> 112.74 | X33: 65.32 | Y33: 47.42 | Z33: 0 | AA33: =+(AB33)+0.5*AC33 -> 36.51 | AB33: 36.51 | AC33: 0
A34: 15 | B34: Simpson, Harold | C34: TRM | D34: =+F34+I34+L34+P34+S34+W34 -> 455.90 | E34: =+H34+K34+O34+R34+V34+Z34+AC34 -> 0 | F34: =+(G34)+0.5*H34 -> 63.92 | G34: 63.92 | H34: 0 | I34: =+(J34)+0.5*K34 -> 79.89 | J34: 79.89 | K34: 0 | L34: =+(M34+N34)+0.5*O34 -> 109.13 | M34: 46.81 | N34: 62.32 | O34: 0 | P34: =+(Q34)+0.5*R34 -> 56.28 | Q34: 56.28 | R34: 0 | S34: =+(T34+U34)+0.5*V34 -> 55.85 | T34: 22.62 | U34: 33.23 | V34: 0 | W34: =+(X34+Y34)+0.5*Z34 -> 90.83 | X34: 31.69 | Y34: 59.14 | Z34: 0 | AA34: =+(AB34)+0.5*AC34 -> 37.87 | AB34: 37.87 | AC34: 0
A35: 16 | B35: Kirkham, Glade | C35: TRM | D35: =+F35+I35+L35+P35+S35+W35 -> 476.68 | E35: =+H35+K35+O35+R35+V35+Z35+AC35 -> 0 | F35: =+(G35)+0.5*H35 -> 81.56 | G35: 81.56 | H35: 0 | I35: =+(J35)+0.5*K35 -> 94.94 | J35: 94.94 | K35: 0 | L35: =+(M35+N35)+0.5*O35 -> 75.05 | M35: 38.34 | N35: 36.71 | O35: 0 | P35: =+(Q35)+0.5*R35 -> 53.85 | Q35: 53.85 | R35: 0 | S35: =+(T35+U35)+0.5*V35 -> 70.00 | T35: 31.92 | U35: 38.08 | V35: 0 | W35: =+(X35+Y35)+0.5*Z35 -> 101.28 | X35: 61.04 | Y35: 40.24 | Z35: 0 | AA35: =+(AB35)+0.5*AC35 -> 49.77 | AB35: 49.77 | AC35: 0
A36: 17 | B36: Osthed, Adam | C36: TRM | D36: =+F36+I36+L36+P36+S36+W36 -> 477.73 | E36: =+H36+K36+O36+R36+V36+Z36+AC36 -> 0 | F36: =+(G36)+0.5*H36 -> 65.23 | G36: 65.23 | H36: 0 | I36: =+(J36)+0.5*K36 -> 83.25 | J36: 83.25 | K36: 0 | L36: =+(M36+N36)+0.5*O36 -> 79.05 | M36: 40.08 | N36: 38.97 | O36: 0 | P36: =+(Q36)+0.5*R36 -> 52.56 | Q36: 52.56 | R36: 0 | S36: =+(T36+U36)+0.5*V36 -> 101.69 | T36: 56.86 | U36: 44.83 | V36: 0 | W36: =+(X36+Y36)+0.5*Z36 -> 95.95 | X36: 45.90 | Y36: 50.05 | Z36: 0 | AA36: =+(AB36)+0.5*AC36 -> 58.92 | AB36: 58.92 | AC36: 0
A37: 18 | B37: Kirkham, Devon | C37: TRM | D37: =+F37+I37+L37+P37+S37+W37 -> 608.79 | E37: =+H37+K37+O37+R37+V37+Z37+AC37 -> 2 | F37: =+(G37)+0.5*H37 -> 101.52 | G37: 101.52 | H37: 0 | I37: =+(J37)+0.5*K37 -> 99.83 | J37: 99.83 | K37: 0 | L37: =+(M37+N37)+0.5*O37 -> 102.30 | M37: 46.05 | N37: 56.25 | O37: 0 | P37: =+(Q37)+0.5*R37 -> 72.83 | Q37: 72.83 | R37: 0 | S37: =+(T37+U37)+5*V37 -> 97.71 | T37: 47.39 | U37: 40.32 | V37: 2 | W37: =+(X37+Y37)+0.5*Z37 -> 134.60 | X37: 65.16 | Y37: 69.44 | Z37: 0 | AA37: =+(AB37)+0.5*AC37 -> 52.66 | AB37: 52.66 | AC37: 0
A38: 19 | B38: Latham, Cody | C38: TRM | D38: =+F38+I38+L38+P38+S38+W38 -> 675.62 | E38: =+H38+K38+O38+R38+V38+Z38+AC38 -> 0 | F38: =+(G38)+0.5*H38 -> 95.87 | G38: 95.87 | H38: 0 | I38: =+(J38)+0.5*K38 -> 128.74 | J38: 128.74 | K38: 0 | L38: =+(M38+N38)+0.5*O38 -> 112.54 | M38: 60.65 | N38: 51.89 | O38: 0 | P38: =+(Q38)+0.5*R38 -> 109.61 | Q38: 109.61 | R38: 0 | S38: =+(T38+U38)+0.5*V38 -> 124.99 | T38: 74.26 | U38: 50.73 | V38: 0 | W38: =+(X38+Y38)+0.5*Z38 -> 103.87 | X38: 68.94 | Y38: 34.93 | Z38: 0 | AA38: =+(AB38)+0.5*AC38 -> 95.23 | AB38: 95.23 | AC38: 0
A39: 20 | B39: Crawford, George | C39: TRM | D39: =+F39+I39+L39+P39+S39+W39 -> 814.87 | E39: =+H39+K39+O39+R39+V39+Z39+AC39 -> 54 | F39: =+(G39)+0.5*H39 -> 118.71 | G39: 118.71 | H39: 0 | I39: =+(J39)+5*K39 -> 130.88 | J39: 105.88 | K39: 5 | L39: =+(M39+N39)+0.5*O39 -> 111.35 | M39: 45.70 | N39: 65.65 | O39: 0 | P39: =+(Q39)+0.5*R39 -> 147.02 | Q39: 147.02 | R39: 0 | S39: =+(T39+U39)+5*V39 -> 169.96 | T39: 5.79 | U39: 9.17 | V39: 31 | W39: =+(X39+Y39)+5*Z39 -> 136.95 | X39: 33.37 | Y39: 33.58 | Z39: 14 | AA39: =+(AB39)+5*AC39 -> 78.82 | AB39: 58.82 | AC39: 4
A40: 21 | B40: Druce, Jerry | C40: TRM | D40: DNF | E40: =+H40+K40+O40+R40+V40+Z40+AC40 -> 11 | F40: =+(G40)+0.5*H40 -> 66.31 | G40: 66.31 | H40: 0 | I40: =+(J40)+0.5*K40 -> 80.23 | J40: 80.23 | K40: 0 | L40: =+(M40+N40)+0.5*O40 -> 143.86 | M40: 65.66 | N40: 78.20 | O40: 0 | P40: =+(Q40)+0.5*R40 -> 101.92 | Q40: 101.92 | R40: 0 | S40: =+(T40+U40)+5*V40 -> 138.41 | T40: 36.58 | U40: 46.83 | V40: 11 | W40: DNF | AA40: DNF
A41: 22 | B41: Willis, David | C41: TRM | D41: DNF | E41: =+H41+K41+O41+R41+V41+Z41+AC41 -> 2 | F41: =+(G41)+5*H41 -> 81.69 | G41: 76.69 | H41: 1 | I41: =+(J41)+0.5*K41 -> 94.87 | J41: 94.87 | K41: 0 | L41: =+(M41+N41)+0.5*O41 -> 157.06 | M41: 65.42 | N41: 91.64 | O41: 0 | P41: =+(Q41)+0.5*R41 -> 99.30 | Q41: 99.30 | R41: 0 | S41: =+(T41+U41)+0.5*V41 -> 116.94 | T41: 41.11 | U41: 75.83 | V41: 0 | W41: DNF | AA41: =+(AB41)+5*AC41 -> 88.69 | AB41: 83.69 | AC41: 1
A42: Notes:
A43: xx | B43: Indicates that the Points Down value includes some kind of penalty (Procedural Error, Hits on Non-Threat or Misses on Steel).
A44: PD | B44: = Points Down value is PD x 5 seconds added to the total stage time.
A45: *DIV | B45: = Divisions: TRM = Ten Round Maximum; HiCAP = High capacity mags, no optics or compensators
B46: REV = Revolver - 8 round max, no optics; REVOP = Revolver - 8 round max, w/optics; OPEN = Anything goes - within the bounds of safety
A47: DNF | B47: = Did Not Finish