A1: UDPL - IDPA Classifier | F1: Results for April 24, 2004 (Listed Alphabetically)
A2: Name | E2: Total Points Down | O2: Points Down | Y2: Points Down | AH2: Points Down
B3: Div. | C3: Class./ Rank | D3: Match Total | F3: Stage 1 | G3: Stage PD | H3: String 1 | I3: String 2 | J3: String 3 | K3: String 4 | L3: String 5 | M3: String 6 | N3: String 7 | O3: T1 | P3: T2 | Q3: T3 | R3: PD Time | S3: Stage 2 | T3: Stage PD | U3: String 1 | V3: String 2 | W3: String 3 | X3: String 4 | Y3: T1 | Z3: T2 | AA3: T3 | AB3: PD Time | AC3: Stage 3 | AD3: Stage PD | AE3: String 1 | AF3: String 2 | AG3: String 3 | AH3: T1 | AI3: T2 | AJ3: T3 | AK3: PD Time
A4: Adams, Brent | B4: CDP | C4: NFC-MM | D4: =+F4+S4+AC4 -> 150.52 | E4: =+G4+T4+AD4 -> 40 | F4: =+(H4+I4+J4+K4+L4+M4+N4)+0.5*G4 -> 43.57 | G4: =+O4+P4+Q4 -> 7 | H4: 3.51 | I4: 3.63 | J4: 3.40 | K4: 7.85 | L4: 4.53 | M4: 10.71 | N4: 6.44 | O4: 6 | P4: 1 | Q4: 0 | R4: =+(Q4+P4+O4)*0.5 -> 3.50 | S4: =+(U4+V4+W4+X4)+0.5*T4 -> 35.92 | T4: =+Y4+Z4+AA4 -> 5 | U4: 5.81 | V4: 6.42 | W4: 13.79 | X4: 7.40 | Y4: 2 | Z4: 3 | AA4: 0 | AB4: =+(AA4+Z4+Y4)*0.5 -> 2.50 | AC4: =+(AE4+AF4+AG4)+0.5*AD4 -> 71.03 | AD4: =+AH4+AI4+AJ4 -> 28 | AE4: 23.93 | AF4: 24.12 | AG4: 8.98 | AH4: 12 | AI4: 4 | AJ4: 12 | AK4: =+(AJ4+AI4+AH4)*0.5 -> 14.00
A5: Brown, Keith | B5: CDP | C5: SS | D5: =+F5+S5+AC5 -> 136.67 | E5: =+G5+T5+AD5 -> 22 | F5: =+(H5+I5+J5+K5+L5+M5+N5)+0.5*G5 -> 40.03 | G5: =+O5+P5+Q5 -> 3 | H5: 3.43 | I5: 3.24 | J5: 3.15 | K5: 7.28 | L5: 5.50 | M5: 10.18 | N5: 5.75 | O5: 1 | P5: 1 | Q5: 1 | R5: =+(Q5+P5+O5)*0.5 -> 1.50 | S5: =+(U5+V5+W5+X5)+0.5*T5 -> 32.16 | T5: =+Y5+Z5+AA5 -> 6 | U5: 5.64 | V5: 4.88 | W5: 12.91 | X5: 5.73 | Y5: 2 | Z5: 2 | AA5: 2 | AB5: =+(AA5+Z5+Y5)*0.5 -> 3.00 | AC5: =+(AE5+AF5+AG5)+0.5*AD5 -> 64.48 | AD5: =+AH5+AI5+AJ5 -> 13 | AE5: 23.85 | AF5: 26.94 | AG5: 7.19 | AH5: 7 | AI5: 3 | AJ5: 3 | AK5: =+(AJ5+AI5+AH5)*0.5 -> 6.50
A6: Brown, Mike | B6: SSP | C6: NFC-MM | D6: =+F6+S6+AC6 -> 209.75 | E6: =+G6+T6+AD6 -> 144 | F6: =+(H6+I6+J6+K6+L6+M6+N6)+0.5*G6 -> 58.60 | G6: =+O6+P6+Q6 -> 45 | H6: 2.61 | I6: 2.64 | J6: 2.41 | K6: 5.83 | L6: 4.37 | M6: 10.76 | N6: 7.48 | O6: 20 | P6: 9 | Q6: 16 | R6: =+(Q6+P6+O6)*0.5 -> 22.50 | S6: =+(U6+V6+W6+X6)+0.5*T6 -> 46.97 | T6: =+Y6+Z6+AA6 -> 21 | U6: 5.37 | V6: 5.79 | W6: 17.16 | X6: 8.15 | Y6: 8 | Z6: 4 | AA6: 9 | AB6: =+(AA6+Z6+Y6)*0.5 -> 10.50 | AC6: =+(AE6+AF6+AG6)+0.5*AD6 -> 104.18 | AD6: =+AH6+AI6+AJ6 -> 78 | AE6: 27.92 | AF6: 27.41 | AG6: 9.85 | AH6: 23 | AI6: 28 | AJ6: 27 | AK6: =+(AJ6+AI6+AH6)*0.5 -> 39.00
A7: Brownlee, Mike | B7: SSP | C7: SS | D7: =+F7+S7+AC7 -> 140.76 | E7: =+G7+T7+AD7 -> 75 | F7: =+(H7+I7+J7+K7+L7+M7+N7)+0.5*G7 -> 40.48 | G7: =+O7+P7+Q7 -> 18 | H7: 2.93 | I7: 3.14 | J7: 3.07 | K7: 5.41 | L7: 3.91 | M7: 7.26 | N7: 5.76 | O7: 7 | P7: 2 | Q7: 9 | R7: =+(Q7+P7+O7)*0.5 -> 9.00 | S7: =+(U7+V7+W7+X7)+0.5*T7 -> 36.64 | T7: =+Y7+Z7+AA7 -> 25 | U7: 4.63 | V7: 4.47 | W7: 9.76 | X7: 5.28 | Y7: 8 | Z7: 10 | AA7: 7 | AB7: =+(AA7+Z7+Y7)*0.5 -> 12.50 | AC7: =+(AE7+AF7+AG7)+0.5*AD7 -> 63.64 | AD7: =+AH7+AI7+AJ7 -> 32 | AE7: 20.18 | AF7: 20.29 | AG7: 7.17 | AH7: 8 | AI7: 14 | AJ7: 10 | AK7: =+(AJ7+AI7+AH7)*0.5 -> 16.00
A8: Heiner, Brett | B8: CDP | C8: SS | D8: =+F8+S8+AC8 -> 137.50 | E8: =+G8+T8+AD8 -> 48 | F8: =+(H8+I8+J8+K8+L8+M8+N8)+0.5*G8 -> 41.90 | G8: =+O8+P8+Q8 -> 12 | H8: 3.10 | I8: 2.97 | J8: 3.23 | K8: 5.61 | L8: 3.58 | M8: 10.52 | N8: 6.89 | O8: 2 | P8: 9 | Q8: 1 | R8: =+(Q8+P8+O8)*0.5 -> 6.00 | S8: =+(U8+V8+W8+X8)+0.5*T8 -> 33.80 | T8: =+Y8+Z8+AA8 -> 8 | U8: 5.10 | V8: 5.34 | W8: 12.97 | X8: 6.39 | Y8: 3 | Z8: 3 | AA8: 2 | AB8: =+(AA8+Z8+Y8)*0.5 -> 4.00 | AC8: =+(AE8+AF8+AG8)+0.5*AD8 -> 61.80 | AD8: =+AH8+AI8+AJ8 -> 28 | AE8: 21.57 | AF8: 19.41 | AG8: 6.82 | AH8: 8 | AI8: 13 | AJ8: 7 | AK8: =+(AJ8+AI8+AH8)*0.5 -> 14.00
A9: Lambke, Patrick | B9: SSP | C9: NFC-MM | D9: =+F9+S9+AC9 -> 206.24 | E9: =+G9+T9+AD9 -> 67 | F9: =+(H9+I9+J9+K9+L9+M9+N9)+0.5*G9 -> 64.04 | G9: =+O9+P9+Q9 -> 19 | H9: 4.97 | I9: 5.76 | J9: 5.76 | K9: 10.23 | L9: 5.49 | M9: 14.52 | N9: 7.81 | O9: 11 | P9: 2 | Q9: 6 | R9: =+(Q9+P9+O9)*0.5 -> 9.50 | S9: =+(U9+V9+W9+X9)+0.5*T9 -> 61.90 | T9: =+Y9+Z9+AA9 -> 14 | U9: 9.95 | V9: 9.94 | W9: 25.96 | X9: 9.05 | Y9: 10 | Z9: 1 | AA9: 3 | AB9: =+(AA9+Z9+Y9)*0.5 -> 7.00 | AC9: =+(AE9+AF9+AG9)+0.5*AD9 -> 80.30 | AD9: =+AH9+AI9+AJ9 -> 34 | AE9: 22.43 | AF9: 31.41 | AG9: 9.46 | AH9: 20 | AI9: 7 | AJ9: 7 | AK9: =+(AJ9+AI9+AH9)*0.5 -> 17.00
A10: Ostler, Jeff | B10: CDP | C10: SS | D10: =+F10+S10+AC10 -> 115.05 | E10: =+G10+T10+AD10 -> 48 | F10: =+(H10+I10+J10+K10+L10+M10+N10)+0.5*G10 -> 36.58 | G10: =+O10+P10+Q10 -> 13 | H10: 2.49 | I10: 2.38 | J10: 2.43 | K10: 5.32 | L10: 3.82 | M10: 7.53 | N10: 6.11 | O10: 5 | P10: 3 | Q10: 5 | R10: =+(Q10+P10+O10)*0.5 -> 6.50 | S10: =+(U10+V10+W10+X10)+0.5*T10 -> 28.77 | T10: =+Y10+Z10+AA10 -> 12 | U10: 4.29 | V10: 3.62 | W10: 9.30 | X10: 5.56 | Y10: 6 | Z10: 2 | AA10: 4 | AB10: =+(AA10+Z10+Y10)*0.5 -> 6.00 | AC10: =+(AE10+AF10+AG10)+0.5*AD10 -> 49.70 | AD10: =+AH10+AI10+AJ10 -> 23 | AE10: 15.69 | AF10: 15.50 | AG10: 7.01 | AH10: 7 | AI10: 11 | AJ10: 5 | AK10: =+(AJ10+AI10+AH10)*0.5 -> 11.50
A11: Scott, Alan | B11: CDP | C11: MM | D11: =+F11+S11+AC11 -> 144.97 | E11: =+G11+T11+AD11 -> 60 | F11: =+(H11+I11+J11+K11+L11+M11+N11)+0.5*G11 -> 39.83 | G11: =+O11+P11+Q11 -> 4 | H11: 3.36 | I11: 3.07 | J11: 3.28 | K11: 5.95 | L11: 4.41 | M11: 11.52 | N11: 6.24 | O11: 0 | P11: 2 | Q11: 2 | R11: =+(Q11+P11+O11)*0.5 -> 2.00 | S11: =+(U11+V11+W11+X11)+0.5*T11 -> 39.29 | T11: =+Y11+Z11+AA11 -> 18 | U11: 4.77 | V11: 5.48 | W11: 13.45 | X11: 6.59 | Y11: 8 | Z11: 6 | AA11: 4 | AB11: =+(AA11+Z11+Y11)*0.5 -> 9.00 | AC11: =+(AE11+AF11+AG11)+0.5*AD11 -> 65.85 | AD11: =+AH11+AI11+AJ11 -> 38 | AE11: 18.75 | AF11: 20.73 | AG11: 7.37 | AH11: 11 | AI11: 14 | AJ11: 13 | AK11: =+(AJ11+AI11+AH11)*0.5 -> 19.00
A12: Scott, Michael | B12: CDP | C12: MM | D12: =+F12+S12+AC12 -> 152.24 | E12: =+G12+T12+AD12 -> 80 | F12: =+(H12+I12+J12+K12+L12+M12+N12)+0.5*G12 -> 47.60 | G12: =+O12+P12+Q12 -> 23 | H12: 3.04 | I12: 3.07 | J12: 3.24 | K12: 6.39 | L12: 4.67 | M12: 9.52 | N12: 6.17 | O12: 3 | P12: 6 | Q12: 14 | R12: =+(Q12+P12+O12)*0.5 -> 11.50 | S12: =+(U12+V12+W12+X12)+0.5*T12 -> 39.94 | T12: =+Y12+Z12+AA12 -> 22 | U12: 4.75 | V12: 5.27 | W12: 12.60 | X12: 6.32 | Y12: 9 | Z12: 2 | AA12: 11 | AB12: =+(AA12+Z12+Y12)*0.5 -> 11.00 | AC12: =+(AE12+AF12+AG12)+0.5*AD12 -> 64.70 | AD12: =+AH12+AI12+AJ12 -> 35 | AE12: 19.62 | AF12: 20.72 | AG12: 6.86 | AH12: 15 | AI12: 6 | AJ12: 14 | AK12: =+(AJ12+AI12+AH12)*0.5 -> 17.50
A13: Scott, Sam | B13: SSP | C13: MM | D13: =+F13+S13+AC13 -> 170.20 | E13: =+G13+T13+AD13 -> 69 | F13: =+(H13+I13+J13+K13+L13+M13+N13)+0.5*G13 -> 52.93 | G13: =+O13+P13+Q13 -> 15 | H13: 4.68 | I13: 3.87 | J13: 4.62 | K13: 8.41 | L13: 6.80 | M13: 9.94 | N13: 7.11 | O13: 6 | P13: 1 | Q13: 8 | R13: =+(Q13+P13+O13)*0.5 -> 7.50 | S13: =+(U13+V13+W13+X13)+0.5*T13 -> 44.14 | T13: =+Y13+Z13+AA13 -> 17 | U13: 5.63 | V13: 5.66 | W13: 14.45 | X13: 9.90 | Y13: 13 | Z13: 2 | AA13: 2 | AB13: =+(AA13+Z13+Y13)*0.5 -> 8.50 | AC13: =+(AE13+AF13+AG13)+0.5*AD13 -> 73.13 | AD13: =+AH13+AI13+AJ13 -> 37 | AE13: 22.03 | AF13: 23.72 | AG13: 8.88 | AH13: 10 | AI13: 15 | AJ13: 12 | AK13: =+(AJ13+AI13+AH13)*0.5 -> 18.50
A14: Simpson, Harold | B14: CDP | C14: SS | D14: =+F14+S14+AC14 -> 136.45 | E14: =+G14+T14+AD14 -> 35 | F14: =+(H14+I14+J14+K14+L14+M14+N14)+0.5*G14 -> 40.13 | G14: =+O14+P14+Q14 -> 3 | H14: 3.44 | I14: 3.83 | J14: 4.45 | K14: 6.97 | L14: 4.18 | M14: 8.83 | N14: 6.93 | O14: 0 | P14: 0 | Q14: 3 | R14: =+(Q14+P14+O14)*0.5 -> 1.50 | S14: =+(U14+V14+W14+X14)+0.5*T14 -> 33.26 | T14: =+Y14+Z14+AA14 -> 7 | U14: 5.12 | V14: 5.18 | W14: 11.86 | X14: 7.60 | Y14: 3 | Z14: 3 | AA14: 1 | AB14: =+(AA14+Z14+Y14)*0.5 -> 3.50 | AC14: =+(AE14+AF14+AG14)+0.5*AD14 -> 63.06 | AD14: =+AH14+AI14+AJ14 -> 25 | AE14: 20.44 | AF14: 23.21 | AG14: 6.91 | AH14: 8 | AI14: 7 | AJ14: 10 | AK14: =+(AJ14+AI14+AH14)*0.5 -> 12.50
A15: Stone, Scott | B15: ESP | C15: MM | D15: =+F15+S15+AC15 -> 174.88 | E15: =+G15+T15+AD15 -> 129 | F15: =+(H15+I15+J15+K15+L15+M15+N15)+0.5*G15 -> 40.97 | G15: =+O15+P15+Q15 -> 22 | H15: 3.06 | I15: 2.69 | J15: 2.60 | K15: 6.56 | L15: 3.38 | M15: 6.01 | N15: 5.67 | O15: 13 | P15: 3 | Q15: 6 | R15: =+(Q15+P15+O15)*0.5 -> 11.00 | S15: =+(U15+V15+W15+X15)+0.5*T15 -> 38.02 | T15: =+Y15+Z15+AA15 -> 32 | U15: 3.48 | V15: 4.15 | W15: 8.47 | X15: 5.92 | Y15: 9 | Z15: 11 | AA15: 12 | AB15: =+(AA15+Z15+Y15)*0.5 -> 16.00 | AC15: =+(AE15+AF15+AG15)+0.5*AD15 -> 95.89 | AD15: =+AH15+AI15+AJ15 -> 75 | AE15: 20.16 | AF15: 24.45 | AG15: 13.78 | AH15: 28 | AI15: 23 | AJ15: 24 | AK15: =+(AJ15+AI15+AH15)*0.5 -> 37.50
A16: Walker, Ron | B16: SSP | C16: MM | D16: =+F16+S16+AC16 -> 178.84 | E16: =+G16+T16+AD16 -> 79 | F16: =+(H16+I16+J16+K16+L16+M16+N16)+0.5*G16 -> 53.88 | G16: =+O16+P16+Q16 -> 24 | H16: 3.42 | I16: 3.52 | J16: 3.74 | K16: 7.82 | L16: 5.53 | M16: 10.53 | N16: 7.32 | O16: 7 | P16: 16 | Q16: 1 | R16: =+(Q16+P16+O16)*0.5 -> 12.00 | S16: =+(U16+V16+W16+X16)+0.5*T16 -> 38.03 | T16: =+Y16+Z16+AA16 -> 11 | U16: 5.57 | V16: 5.76 | W16: 13.52 | X16: 7.68 | Y16: 3 | Z16: 0 | AA16: 8 | AB16: =+(AA16+Z16+Y16)*0.5 -> 5.50 | AC16: =+(AE16+AF16+AG16)+0.5*AD16 -> 86.93 | AD16: =+AH16+AI16+AJ16 -> 44 | AE16: 21.62 | AF16: 23.10 | AG16: 20.21 | AH16: 13 | AI16: 14 | AJ16: 17 | AK16: =+(AJ16+AI16+AH16)*0.5 -> 22.00
C17: NFC-XX | D17: = Not For Classification - These shooters were new and did not shoot for classification, but rankings were noted for their information.
C18: XX(XX) | D18: If a shooter has classified with a higher ranking in a previous Classifier Match but ranked lower in this match, they retain the higher ranking. Example: If the notation under Class./Rank indicates something like NV(MM), it means that the shooter qualified in this classifier as a Novice, but retains the higher Marksman ranking previously earned.
A19: Div. = Division; Class./Rank = Classification/Ranking
A20: Divisions: CDP = Custom Defense Pistol; ESP = Enhanced Service Pistol; SSP = Stock Service Pistol; SSR = Stock Service Revolver
A21: Classification Score Breakdown By Division/Ranking:
A22: CDP - Master = 91.76 or less; Expert = 91.77 to 111.43; Sharpshooter = 111.44 to 141.82; Marksman = 141.83 to 195.00; Novice = 195.01 or more
A23: ESP - Master = 89.41 or less; Expert = 89.42 to 108.57; Sharpshooter = 108.58 to 138.18; Marksman = 138.19 to 190.00; Novice = 190.01 or more
A24: SSP - Master = 98.82 or less; Expert = 98.83 to 120.00; Sharpshooter = 120.01 to 152.73; Marksman = 152.74 to 210.00; Novice = 210.01 or more
A25: SSR - Master = 102.35 or less; Expert = 102.36 to 124.29; Sharpshooter = 124.30 to 158.18; Marksman = 158.19 to 217.50; Novice = 217.51 or more
A26: Points Down = .5 seconds x Points Down
A28: UDPL - IDPA Classifier | E28: Total Points Down | F28: Results for August 23, 2003 (Listed by Division/Ranking)
A29: Name | B29: Div. | C29: Class./ Rank | D29: Match Total | F29: Stage 1 | G29: Stage PD | H29: String 1 | I29: String 2 | J29: String 3 | K29: String 4 | L29: String 5 | M29: String 6 | N29: String 7 | O29: T1 | P29: T2 | Q29: T3 | R29: PD Time | S29: Stage 2 | T29: Stage PD | U29: String 1 | V29: String 2 | W29: String 3 | X29: String 4 | Y29: T1 | Z29: T2 | AA29: T3 | AB29: PD Time | AC29: Stage 3 | AD29: Stage PD | AE29: String 1 | AF29: String 2 | AG29: String 3 | AH29: T1 | AI29: T2 | AJ29: T3 | AK29: PD Time
D30: =+F30+S30+AC30 -> 0.00 | E30: =+G30+T30+AD30 -> 0 | F30: =+(H30+I30+J30+K30+L30+M30+N30)+0.5*G30 -> 0.00 | G30: =+O30+P30+Q30 -> 0 | R30: =+(Q30+P30+O30)*0.5 -> 0.00 | S30: =+(U30+V30+W30+X30)+0.5*T30 -> 0.00 | T30: =+Y30+Z30+AA30 -> 0 | AB30: =+(AA30+Z30+Y30)*0.5 -> 0.00 | AC30: =+(AE30+AF30+AG30)+0.5*AD30 -> 0.00 | AD30: =+AH30+AI30+AJ30 -> 0 | AK30: =+(AJ30+AI30+AH30)*0.5 -> 0.00
D31: =+F31+S31+AC31 -> 0.00 | E31: =+G31+T31+AD31 -> 0 | F31: =+(H31+I31+J31+K31+L31+M31+N31)+0.5*G31 -> 0.00 | G31: =+O31+P31+Q31 -> 0 | R31: =+(Q31+P31+O31)*0.5 -> 0.00 | S31: =+(U31+V31+W31+X31)+0.5*T31 -> 0.00 | T31: =+Y31+Z31+AA31 -> 0 | AB31: =+(AA31+Z31+Y31)*0.5 -> 0.00 | AC31: =+(AE31+AF31+AG31)+0.5*AD31 -> 0.00 | AD31: =+AH31+AI31+AJ31 -> 0 | AK31: =+(AJ31+AI31+AH31)*0.5 -> 0.00
D32: =+F32+S32+AC32 -> 0.00 | E32: =+G32+T32+AD32 -> 0 | F32: =+(H32+I32+J32+K32+L32+M32+N32)+0.5*G32 -> 0.00 | G32: =+O32+P32+Q32 -> 0 | R32: =+(Q32+P32+O32)*0.5 -> 0.00 | S32: =+(U32+V32+W32+X32)+0.5*T32 -> 0.00 | T32: =+Y32+Z32+AA32 -> 0 | AB32: =+(AA32+Z32+Y32)*0.5 -> 0.00 | AC32: =+(AE32+AF32+AG32)+0.5*AD32 -> 0.00 | AD32: =+AH32+AI32+AJ32 -> 0 | AK32: =+(AJ32+AI32+AH32)*0.5 -> 0.00
D33: =+F33+S33+AC33 -> 0.00 | E33: =+G33+T33+AD33 -> 0 | F33: =+(H33+I33+J33+K33+L33+M33+N33)+0.5*G33 -> 0.00 | G33: =+O33+P33+Q33 -> 0 | R33: =+(Q33+P33+O33)*0.5 -> 0.00 | S33: =+(U33+V33+W33+X33)+0.5*T33 -> 0.00 | T33: =+Y33+Z33+AA33 -> 0 | AB33: =+(AA33+Z33+Y33)*0.5 -> 0.00 | AC33: =+(AE33+AF33+AG33)+0.5*AD33 -> 0.00 | AD33: =+AH33+AI33+AJ33 -> 0 | AK33: =+(AJ33+AI33+AH33)*0.5 -> 0.00
D34: =+F34+S34+AC34 -> 0.00 | E34: =+G34+T34+AD34 -> 0 | F34: =+(H34+I34+J34+K34+L34+M34+N34)+0.5*G34 -> 0.00 | G34: =+O34+P34+Q34 -> 0 | R34: =+(Q34+P34+O34)*0.5 -> 0.00 | S34: =+(U34+V34+W34+X34)+0.5*T34 -> 0.00 | T34: =+Y34+Z34+AA34 -> 0 | AB34: =+(AA34+Z34+Y34)*0.5 -> 0.00 | AC34: =+(AE34+AF34+AG34)+0.5*AD34 -> 0.00 | AD34: =+AH34+AI34+AJ34 -> 0 | AK34: =+(AJ34+AI34+AH34)*0.5 -> 0.00
D35: =+F35+S35+AC35 -> 0.00 | E35: =+G35+T35+AD35 -> 0 | F35: =+(H35+I35+J35+K35+L35+M35+N35)+0.5*G35 -> 0.00 | G35: =+O35+P35+Q35 -> 0 | R35: =+(Q35+P35+O35)*0.5 -> 0.00 | S35: =+(U35+V35+W35+X35)+0.5*T35 -> 0.00 | T35: =+Y35+Z35+AA35 -> 0 | AB35: =+(AA35+Z35+Y35)*0.5 -> 0.00 | AC35: =+(AE35+AF35+AG35)+0.5*AD35 -> 0.00 | AD35: =+AH35+AI35+AJ35 -> 0 | AK35: =+(AJ35+AI35+AH35)*0.5 -> 0.00
D36: =+F36+S36+AC36 -> 0.00 | E36: =+G36+T36+AD36 -> 0 | F36: =+(H36+I36+J36+K36+L36+M36+N36)+0.5*G36 -> 0.00 | G36: =+O36+P36+Q36 -> 0 | R36: =+(Q36+P36+O36)*0.5 -> 0.00 | S36: =+(U36+V36+W36+X36)+0.5*T36 -> 0.00 | T36: =+Y36+Z36+AA36 -> 0 | AB36: =+(AA36+Z36+Y36)*0.5 -> 0.00 | AC36: =+(AE36+AF36+AG36)+0.5*AD36 -> 0.00 | AD36: =+AH36+AI36+AJ36 -> 0 | AK36: =+(AJ36+AI36+AH36)*0.5 -> 0.00
D37: =+F37+S37+AC37 -> 0.00 | E37: =+G37+T37+AD37 -> 0 | F37: =+(H37+I37+J37+K37+L37+M37+N37)+0.5*G37 -> 0.00 | G37: =+O37+P37+Q37 -> 0 | R37: =+(Q37+P37+O37)*0.5 -> 0.00 | S37: =+(U37+V37+W37+X37)+0.5*T37 -> 0.00 | T37: =+Y37+Z37+AA37 -> 0 | AB37: =+(AA37+Z37+Y37)*0.5 -> 0.00 | AC37: =+(AE37+AF37+AG37)+0.5*AD37 -> 0.00 | AD37: =+AH37+AI37+AJ37 -> 0 | AK37: =+(AJ37+AI37+AH37)*0.5 -> 0.00
D38: =+F38+S38+AC38 -> 0.00 | E38: =+G38+T38+AD38 -> 0 | F38: =+(H38+I38+J38+K38+L38+M38+N38)+0.5*G38 -> 0.00 | G38: =+O38+P38+Q38 -> 0 | R38: =+(Q38+P38+O38)*0.5 -> 0.00 | S38: =+(U38+V38+W38+X38)+0.5*T38 -> 0.00 | T38: =+Y38+Z38+AA38 -> 0 | AB38: =+(AA38+Z38+Y38)*0.5 -> 0.00 | AC38: =+(AE38+AF38+AG38)+0.5*AD38 -> 0.00 | AD38: =+AH38+AI38+AJ38 -> 0 | AK38: =+(AJ38+AI38+AH38)*0.5 -> 0.00
D39: =+F39+S39+AC39 -> 0.00 | E39: =+G39+T39+AD39 -> 0 | F39: =+(H39+I39+J39+K39+L39+M39+N39)+0.5*G39 -> 0.00 | G39: =+O39+P39+Q39 -> 0 | R39: =+(Q39+P39+O39)*0.5 -> 0.00 | S39: =+(U39+V39+W39+X39)+0.5*T39 -> 0.00 | T39: =+Y39+Z39+AA39 -> 0 | AB39: =+(AA39+Z39+Y39)*0.5 -> 0.00 | AC39: =+(AE39+AF39+AG39)+0.5*AD39 -> 0.00 | AD39: =+AH39+AI39+AJ39 -> 0 | AK39: =+(AJ39+AI39+AH39)*0.5 -> 0.00
D40: =+F40+S40+AC40 -> 0.00 | E40: =+G40+T40+AD40 -> 0 | F40: =+(H40+I40+J40+K40+L40+M40+N40)+0.5*G40 -> 0.00 | G40: =+O40+P40+Q40 -> 0 | R40: =+(Q40+P40+O40)*0.5 -> 0.00 | S40: =+(U40+V40+W40+X40)+0.5*T40 -> 0.00 | T40: =+Y40+Z40+AA40 -> 0 | AB40: =+(AA40+Z40+Y40)*0.5 -> 0.00 | AC40: =+(AE40+AF40+AG40)+0.5*AD40 -> 0.00 | AD40: =+AH40+AI40+AJ40 -> 0 | AK40: =+(AJ40+AI40+AH40)*0.5 -> 0.00
D41: =+F41+S41+AC41 -> 0.00 | E41: =+G41+T41+AD41 -> 0 | F41: =+(H41+I41+J41+K41+L41+M41+N41)+0.5*G41 -> 0.00 | G41: =+O41+P41+Q41 -> 0 | R41: =+(Q41+P41+O41)*0.5 -> 0.00 | S41: =+(U41+V41+W41+X41)+0.5*T41 -> 0.00 | T41: =+Y41+Z41+AA41 -> 0 | AB41: =+(AA41+Z41+Y41)*0.5 -> 0.00 | AC41: =+(AE41+AF41+AG41)+0.5*AD41 -> 0.00 | AD41: =+AH41+AI41+AJ41 -> 0 | AK41: =+(AJ41+AI41+AH41)*0.5 -> 0.00
D42: =+F42+S42+AC42 -> 0.00 | E42: =+G42+T42+AD42 -> 0 | F42: =+(H42+I42+J42+K42+L42+M42+N42)+0.5*G42 -> 0.00 | G42: =+O42+P42+Q42 -> 0 | R42: =+(Q42+P42+O42)*0.5 -> 0.00 | S42: =+(U42+V42+W42+X42)+0.5*T42 -> 0.00 | T42: =+Y42+Z42+AA42 -> 0 | AB42: =+(AA42+Z42+Y42)*0.5 -> 0.00 | AC42: =+(AE42+AF42+AG42)+0.5*AD42 -> 0.00 | AD42: =+AH42+AI42+AJ42 -> 0 | AK42: =+(AJ42+AI42+AH42)*0.5 -> 0.00
D43: =+F43+S43+AC43 -> 0.00 | E43: =+G43+T43+AD43 -> 0 | F43: =+(H43+I43+J43+K43+L43+M43+N43)+0.5*G43 -> 0.00 | G43: =+O43+P43+Q43 -> 0 | R43: =+(Q43+P43+O43)*0.5 -> 0.00 | S43: =+(U43+V43+W43+X43)+0.5*T43 -> 0.00 | T43: =+Y43+Z43+AA43 -> 0 | AB43: =+(AA43+Z43+Y43)*0.5 -> 0.00 | AC43: =+(AE43+AF43+AG43)+0.5*AD43 -> 0.00 | AD43: =+AH43+AI43+AJ43 -> 0 | AK43: =+(AJ43+AI43+AH43)*0.5 -> 0.00
D44: =+F44+S44+AC44 -> 0.00 | E44: =+G44+T44+AD44 -> 0 | F44: =+(H44+I44+J44+K44+L44+M44+N44)+0.5*G44 -> 0.00 | G44: =+O44+P44+Q44 -> 0 | R44: =+(Q44+P44+O44)*0.5 -> 0.00 | S44: =+(U44+V44+W44+X44)+0.5*T44 -> 0.00 | T44: =+Y44+Z44+AA44 -> 0 | AB44: =+(AA44+Z44+Y44)*0.5 -> 0.00 | AC44: =+(AE44+AF44+AG44)+0.5*AD44 -> 0.00 | AD44: =+AH44+AI44+AJ44 -> 0 | AK44: =+(AJ44+AI44+AH44)*0.5 -> 0.00
D45: =+F45+S45+AC45 -> 0.00 | E45: =+G45+T45+AD45 -> 0 | F45: =+(H45+I45+J45+K45+L45+M45+N45)+0.5*G45 -> 0.00 | G45: =+O45+P45+Q45 -> 0 | R45: =+(Q45+P45+O45)*0.5 -> 0.00 | S45: =+(U45+V45+W45+X45)+0.5*T45 -> 0.00 | T45: =+Y45+Z45+AA45 -> 0 | AB45: =+(AA45+Z45+Y45)*0.5 -> 0.00 | AC45: =+(AE45+AF45+AG45)+0.5*AD45 -> 0.00 | AD45: =+AH45+AI45+AJ45 -> 0 | AK45: =+(AJ45+AI45+AH45)*0.5 -> 0.00
D46: =+F46+S46+AC46 -> 0.00 | E46: =+G46+T46+AD46 -> 0 | F46: =+(H46+I46+J46+K46+L46+M46+N46)+0.5*G46 -> 0.00 | G46: =+O46+P46+Q46 -> 0 | R46: =+(Q46+P46+O46)*0.5 -> 0.00 | S46: =+(U46+V46+W46+X46)+0.5*T46 -> 0.00 | T46: =+Y46+Z46+AA46 -> 0 | AB46: =+(AA46+Z46+Y46)*0.5 -> 0.00 | AC46: =+(AE46+AF46+AG46)+0.5*AD46 -> 0.00 | AD46: =+AH46+AI46+AJ46 -> 0 | AK46: =+(AJ46+AI46+AH46)*0.5 -> 0.00
D47: =+F47+S47+AC47 -> 0.00 | E47: =+G47+T47+AD47 -> 0 | F47: =+(H47+I47+J47+K47+L47+M47+N47)+0.5*G47 -> 0.00 | G47: =+O47+P47+Q47 -> 0 | R47: =+(Q47+P47+O47)*0.5 -> 0.00 | S47: =+(U47+V47+W47+X47)+0.5*T47 -> 0.00 | T47: =+Y47+Z47+AA47 -> 0 | AB47: =+(AA47+Z47+Y47)*0.5 -> 0.00 | AC47: =+(AE47+AF47+AG47)+0.5*AD47 -> 0.00 | AD47: =+AH47+AI47+AJ47 -> 0 | AK47: =+(AJ47+AI47+AH47)*0.5 -> 0.00
D48: =+F48+S48+AC48 -> 0.00 | E48: =+G48+T48+AD48 -> 0 | F48: =+(H48+I48+J48+K48+L48+M48+N48)+0.5*G48 -> 0.00 | G48: =+O48+P48+Q48 -> 0 | R48: =+(Q48+P48+O48)*0.5 -> 0.00 | S48: =+(U48+V48+W48+X48)+0.5*T48 -> 0.00 | T48: =+Y48+Z48+AA48 -> 0 | AB48: =+(AA48+Z48+Y48)*0.5 -> 0.00 | AC48: =+(AE48+AF48+AG48)+0.5*AD48 -> 0.00 | AD48: =+AH48+AI48+AJ48 -> 0 | AK48: =+(AJ48+AI48+AH48)*0.5 -> 0.00
A51: If a shooter has classified with a higher ranking in a previous Classifier Match but ranked lower in this match, they retain the higher ranking. Example: If the notation under Class./Rank indicates something like NV(MM), it means that the shooter qualified in this classifier as a Novice, but retains the higher Marksman ranking previously earned.
A52: Div. = Division; Class./Rank = Classification/Ranking
A53: Divisions: CDP = Custom Defense Pistol; ESP = Enhanced Service Pistol; SSP = Stock Service Pistol; SSR = Stock Service Revolver
A54: Classification Score Breakdown By Division/Ranking:
A55: CDP - Master = 91.76 or less; Expert = 91.77 to 111.43; Sharpshooter = 111.44 to 141.82; Marksman = 141.83 to 195.00; Novice = 195.01 or more
A56: ESP - Master = 89.41 or less; Expert = 89.42 to 108.57; Sharpshooter = 108.58 to 138.18; Marksman = 138.19 to 190.00; Novice = 190.01 or more
A57: SSP - Master = 98.82 or less; Expert = 98.83 to 120.00; Sharpshooter = 120.01 to 152.73; Marksman = 152.74 to 210.00; Novice = 210.01 or more
A58: SSR - Master = 102.35 or less; Expert = 102.36 to 124.29; Sharpshooter = 124.30 to 158.18; Marksman = 158.19 to 217.50; Novice = 217.51 or more
A59: Points Down = .5 seconds x Points Down