A1: Click here for results by Div/Class
B2: UDPL IDPA Match Results for February 28, 2004
B3: Sorted by Time without regard to Div/Class | H3: Click on the Stage # to view the COF.
A4: Place | B4: Name | C4: (Div-Class) | D4: Shoot Total | E4: Total PD | F4: Stage 2 | G4: String 1 | H4: String 2 | I4: String 3 | J4: PD | K4: Stage 3 | L4: String 1 | M4: String 2 | N4: PD | O4: Stage 4 | P4: String 1 | Q4: String 2 | R4: PD | S4: Stage 5 | T4: String 1 | U4: String 2 | V4: String 3 | W4: PD | X4: Stage 6 | Y4: String 1 | Z4: String 2 | AA4: String 3 | AB4: PD | AC4: Stage 7 | AD4: String 1 | AE4: String 2 | AF4: String 3 | AG4: String 4 | AH4: String 5 | AI4: String 6 | AJ4: String 7 | AK4: PD
A5: 1 | B5: Theodore, Ari | C5: CDP-EX | D5: =+F5+K5+O5+S5+X5+AC5 -> 164.52 | E5: =+J5+N5+R5+W5+AB5+AK5 -> 52 | F5: =+(G5+H5+I5)+0.5*J5 -> 15.08 | G5: 3.63 | H5: 5.03 | I5: 5.42 | J5: 2 | K5: =+(L5+M5)+0.5*N5 -> 30.91 | L5: 12.24 | M5: 15.67 | N5: 6 | O5: =+(P5+Q5)+0.5*R5 -> 27.01 | P5: 10.57 | Q5: 12.44 | R5: 8 | S5: =+(T5+U5+V5)+0.5*W5 -> 27.12 | T5: 8.85 | U5: 8.41 | V5: 7.36 | W5: 5 | X5: =+(Y5+Z5+AA5)+0.5*AB5 -> 29.25 | Y5: 3.89 | Z5: 5.14 | AA5: 7.72 | AB5: 25 | AC5: =+(AD5+AE5+AF5+AG5+AH5+AI5+AJ5)+0.5*AK5 -> 35.15 | AD5: 2.79 | AE5: 2.71 | AF5: 2.96 | AG5: 7.92 | AH5: 3.96 | AI5: 6.36 | AJ5: 5.45 | AK5: 6
A6: 2 | B6: Ostler, Jeff | C6: CDP-UC | D6: =+F6+K6+O6+S6+X6+AC6 -> 173.40 | E6: =+J6+N6+R6+W6+AB6+AK6 -> 46 | F6: =+(G6+H6+I6)+0.5*J6 -> 17.06 | G6: 4.77 | H6: 7.03 | I6: 5.26 | J6: 0 | K6: =+(L6+M6)+0.5*N6 -> 36.33 | L6: 16.34 | M6: 17.49 | N6: 5 | O6: =+(P6+Q6)+0.5*R6 -> 27.42 | P6: 13.39 | Q6: 13.03 | R6: 2 | S6: =+(T6+U6+V6)+0.5*W6 -> 29.36 | T6: 8.02 | U6: 7.81 | V6: 7.03 | W6: 13 | X6: =+(Y6+Z6+AA6)+0.5*AB6 -> 18.09 | Y6: 5.22 | Z6: 5.59 | AA6: 6.28 | AB6: 2 | AC6: =+(AD6+AE6+AF6+AG6+AH6+AI6+AJ6)+0.5*AK6 -> 45.14 | AD6: 2.83 | AE6: 2.65 | AF6: 3.05 | AG6: 6.14 | AH6: 4.10 | AI6: 8.09 | AJ6: 6.28 | AK6: 24
A7: 3 | B7: Montgomery, Robert | C7: SSP-EX | D7: =+F7+K7+O7+S7+X7+AC7 -> 175.19 | E7: =+J7+N7+R7+W7+AB7+AK7 -> 40 | F7: =+(G7+H7+I7)+0.5*J7 -> 17.24 | G7: 4.74 | H7: 4.72 | I7: 5.28 | J7: 5 | K7: =+(L7+M7)+0.5*N7 -> 39.51 | L7: 14.03 | M7: 19.48 | N7: 12 | O7: =+(P7+Q7)+0.5*R7 -> 25.81 | P7: 10.39 | Q7: 10.92 | R7: 9 | S7: =+(T7+U7+V7)+0.5*W7 -> 30.14 | T7: 9.81 | U7: 9.57 | V7: 10.26 | W7: 1 | X7: =+(Y7+Z7+AA7)+0.5*AB7 -> 28.00 | Y7: 5.78 | Z7: 6.98 | AA7: 10.24 | AB7: 10 | AC7: =+(AD7+AE7+AF7+AG7+AH7+AI7+AJ7)+0.5*AK7 -> 34.49 | AD7: 3.14 | AE7: 2.86 | AF7: 1.82 | AG7: 6.23 | AH7: 4.17 | AI7: 8.56 | AJ7: 6.21 | AK7: 3
A8: 4 | B8: Mousley, Roger | C8: SSR-EX | D8: =+F8+K8+O8+S8+X8+AC8 -> 177.51 | E8: =+J8+N8+R8+W8+AB8+AK8 -> 41 | F8: =+(G8+H8+I8)+0.5*J8 -> 15.46 | G8: 4.58 | H8: 5.06 | I8: 4.82 | J8: 2 | K8: =+(L8+M8)+0.5*N8 -> 31.06 | L8: 12.52 | M8: 15.54 | N8: 6 | O8: =+(P8+Q8)+0.5*R8 -> 30.69 | P8: 13.42 | Q8: 12.77 | R8: 9 | S8: =+(T8+U8+V8)+0.5*W8 -> 39.17 | T8: 11.55 | U8: 15.87 | V8: 9.75 | W8: 4 | X8: =+(Y8+Z8+AA8)+0.5*AB8 -> 27.84 | Y8: 5.17 | Z8: 7.26 | AA8: 7.41 | AB8: 16 | AC8: =+(AD8+AE8+AF8+AG8+AH8+AI8+AJ8)+0.5*AK8 -> 33.29 | AD8: 3.03 | AE8: 2.85 | AF8: 2.79 | AG8: 6.09 | AH8: 3.24 | AI8: 7.98 | AJ8: 5.31 | AK8: 4
A9: 5 | B9: Beck, Dave | C9: CDP-SS | D9: =+F9+K9+O9+S9+X9+AC9 -> 179.84 | E9: =+J9+N9+R9+W9+AB9+AK9 -> 88 | F9: =+(G9+H9+I9)+0.5*J9 -> 12.21 | G9: 4.01 | H9: 3.46 | I9: 4.24 | J9: 1 | K9: =+(L9+M9)+0.5*N9 -> 33.92 | L9: 13.82 | M9: 14.10 | N9: 12 | O9: =+(P9+Q9)+0.5*R9 -> 30.98 | P9: 11.20 | Q9: 13.78 | R9: 12 | S9: =+(T9+U9+V9)+0.5*W9 -> 28.37 | T9: 8.22 | U9: 8.58 | V9: 9.07 | W9: 5 | X9: =+(Y9+Z9+AA9)+0.5*AB9 -> 39.49 | Y9: 4.90 | Z9: 5.65 | AA9: 5.44 | AB9: 47 | AC9: =+(AD9+AE9+AF9+AG9+AH9+AI9+AJ9)+0.5*AK9 -> 34.87 | AD9: 2.59 | AE9: 2.79 | AF9: 2.89 | AG9: 6.24 | AH9: 3.80 | AI9: 5.55 | AJ9: 5.51 | AK9: 11
A10: 6 | B10: Collins, Ken | C10: ESP-SS | D10: =+F10+K10+O10+S10+X10+AC10 -> 184.85 | E10: =+J10+N10+R10+W10+AB10+AK10 -> 59 | F10: =+(G10+H10+I10)+0.5*J10 -> 15.37 | G10: 4.57 | H10: 5.37 | I10: 4.93 | J10: 1 | K10: =+(L10+M10)+0.5*N10 -> 34.16 | L10: 15.49 | M10: 15.67 | N10: 6 | O10: =+(P10+Q10)+0.5*R10 -> 24.88 | P10: 11.03 | Q10: 11.85 | R10: 4 | S10: =+(T10+U10+V10)+0.5*W10 -> 36.87 | T10: 10.89 | U10: 8.75 | V10: 12.23 | W10: 10 | X10: =+(Y10+Z10+AA10)+0.5*AB10 -> 38.29 | Y10: 4.80 | Z10: 11.98 | AA10: 8.51 | AB10: 26 | AC10: =+(AD10+AE10+AF10+AG10+AH10+AI10+AJ10)+0.5*AK10 -> 35.28 | AD10: 2.70 | AE10: 2.94 | AF10: 2.69 | AG10: 5.03 | AH10: 3.06 | AI10: 7.66 | AJ10: 5.20 | AK10: 12
A11: 7 | B11: Vollmer, Phillip | C11: SSP-EX | D11: =+F11+K11+O11+S11+X11+AC11 -> 190.98 | E11: =+J11+N11+R11+W11+AB11+AK11 -> 68 | F11: =+(G11+H11+I11)+0.5*J11 -> 13.44 | G11: 3.97 | H11: 4.67 | I11: 4.80 | J11: 0 | K11: =+(L11+M11)+0.5*N11 -> 46.14 | L11: 15.98 | M11: 20.66 | N11: 19 | O11: =+(P11+Q11)+0.5*R11 -> 31.61 | P11: 11.62 | Q11: 13.99 | R11: 12 | S11: =+(T11+U11+V11)+0.5*W11 -> 17.66 | T11: 5.22 | U11: 5.34 | V11: 5.60 | W11: 3 | X11: =+(Y11+Z11+AA11)+0.5*AB11 -> 41.18 | Y11: 13.79 | Z11: 10.09 | AA11: 11.30 | AB11: 12 | AC11: =+(AD11+AE11+AF11+AG11+AH11+AI11+AJ11)+0.5*AK11 -> 40.95 | AD11: 2.67 | AE11: 2.58 | AF11: 2.77 | AG11: 6.36 | AH11: 2.85 | AI11: 7.78 | AJ11: 4.94 | AK11: 22
A12: 8 | B12: Outzen, Craig | C12: SSP-UC | D12: =+F12+K12+O12+S12+X12+AC12 -> 194.17 | E12: =+J12+N12+R12+W12+AB12+AK12 -> 95 | F12: =+(G12+H12+I12)+0.5*J12 -> 14.92 | G12: 4.29 | H12: 4.32 | I12: 4.31 | J12: 4 | K12: =+(L12+M12)+0.5*N12 -> 36.11 | L12: 13.06 | M12: 18.55 | N12: 9 | O12: =+(P12+Q12)+0.5*R12 -> 31.05 | P12: 10.42 | Q12: 10.63 | R12: 20 | S12: =+(T12+U12+V12)+0.5*W12 -> 33.41 | T12: 10.34 | U12: 9.86 | V12: 8.71 | W12: 9 | X12: =+(Y12+Z12+AA12)+0.5*AB12 -> 32.94 | Y12: 5.22 | Z12: 5.94 | AA12: 7.78 | AB12: 28 | AC12: =+(AD12+AE12+AF12+AG12+AH12+AI12+AJ12)+0.5*AK12 -> 45.74 | AD12: 2.62 | AE12: 2.54 | AF12: 2.47 | AG12: 5.48 | AH12: 4.68 | AI12: 9.87 | AJ12: 5.58 | AK12: 25
A13: 9 | B13: Zaccardi, Pat | C13: ESP-SS | D13: =+F13+K13+O13+S13+X13+AC13 -> 199.81 | E13: =+J13+N13+R13+W13+AB13+AK13 -> 74 | F13: =+(G13+H13+I13)+0.5*J13 -> 12.50 | G13: 4.12 | H13: 2.92 | I13: 3.96 | J13: 3 | K13: =+(L13+M13)+0.5*N13 -> 43.12 | L13: 22.08 | M13: 16.04 | N13: 10 | O13: =+(P13+Q13)+0.5*R13 -> 27.72 | P13: 11.18 | Q13: 11.54 | R13: 10 | S13: =+(T13+U13+V13)+0.5*W13 -> 31.17 | T13: 9.20 | U13: 10.30 | V13: 9.17 | W13: 5 | X13: =+(Y13+Z13+AA13)+0.5*AB13 -> 36.42 | Y13: 4.88 | Z13: 10.52 | AA13: 12.52 | AB13: 17 | AC13: =+(AD13+AE13+AF13+AG13+AH13+AI13+AJ13)+0.5*AK13 -> 48.88 | AD13: 3.41 | AE13: 3.59 | AF13: 3.08 | AG13: 7.41 | AH13: 4.51 | AI13: 7.65 | AJ13: 4.73 | AK13: 29
A14: 10 | B14: Boyer, Steve | C14: SSP-MM | D14: =+F14+K14+O14+S14+X14+AC14 -> 200.07 | E14: =+J14+N14+R14+W14+AB14+AK14 -> 46 | F14: =+(G14+H14+I14)+0.5*J14 -> 19.27 | G14: 5.54 | H14: 7.50 | I14: 5.73 | J14: 1 | K14: =+(L14+M14)+0.5*N14 -> 45.57 | L14: 19.58 | M14: 20.99 | N14: 10 | O14: =+(P14+Q14)+0.5*R14 -> 31.70 | P14: 14.61 | Q14: 14.09 | R14: 6 | S14: =+(T14+U14+V14)+0.5*W14 -> 35.20 | T14: 10.94 | U14: 11.81 | V14: 10.45 | W14: 4 | X14: =+(Y14+Z14+AA14)+0.5*AB14 -> 24.42 | Y14: 7.26 | Z14: 6.25 | AA14: 7.41 | AB14: 7 | AC14: =+(AD14+AE14+AF14+AG14+AH14+AI14+AJ14)+0.5*AK14 -> 43.91 | AD14: 4.17 | AE14: 3.88 | AF14: 3.28 | AG14: 5.51 | AH14: 3.55 | AI14: 8.76 | AJ14: 5.76 | AK14: 18
A15: 11 | B15: Vollertsen, Joel | C15: CDP-UC | D15: =+F15+K15+O15+S15+X15+AC15 -> 202.35 | E15: =+J15+N15+R15+W15+AB15+AK15 -> 58 | F15: =+(G15+H15+I15)+0.5*J15 -> 17.26 | G15: 4.80 | H15: 5.87 | I15: 4.59 | J15: 4 | K15: =+(L15+M15)+0.5*N15 -> 46.06 | L15: 18.92 | M15: 20.64 | N15: 13 | O15: =+(P15+Q15)+0.5*R15 -> 37.42 | P15: 18.46 | Q15: 16.96 | R15: 4 | S15: =+(T15+U15+V15)+0.5*W15 -> 37.76 | T15: 10.85 | U15: 10.12 | V15: 10.29 | W15: 13 | X15: =+(Y15+Z15+AA15)+0.5*AB15 -> 21.71 | Y15: 5.45 | Z15: 5.50 | AA15: 8.26 | AB15: 5 | AC15: =+(AD15+AE15+AF15+AG15+AH15+AI15+AJ15)+0.5*AK15 -> 42.14 | AD15: 3.26 | AE15: 3.11 | AF15: 2.63 | AG15: 5.17 | AH15: 3.89 | AI15: 10.11 | AJ15: 4.47 | AK15: 19
A16: 12 | B16: VanLeuven, Joel | C16: SSP-MM | D16: =+F16+K16+O16+S16+X16+AC16 -> 204.84 | E16: =+J16+N16+R16+W16+AB16+AK16 -> 75 | F16: =+(G16+H16+I16)+0.5*J16 -> 16.46 | G16: 4.85 | H16: 5.34 | I16: 4.77 | J16: 3 | K16: =+(L16+M16)+0.5*N16 -> 40.83 | L16: 16.51 | M16: 15.82 | N16: 17 | O16: =+(P16+Q16)+0.5*R16 -> 34.82 | P16: 13.45 | Q16: 13.37 | R16: 16 | S16: =+(T16+U16+V16)+0.5*W16 -> 48.37 | T16: 9.02 | U16: 14.10 | V16: 17.25 | W16: 16 | X16: =+(Y16+Z16+AA16)+0.5*AB16 -> 26.98 | Y16: 6.06 | Z16: 6.40 | AA16: 8.02 | AB16: 13 | AC16: =+(AD16+AE16+AF16+AG16+AH16+AI16+AJ16)+0.5*AK16 -> 37.38 | AD16: 3.37 | AE16: 3.62 | AF16: 3.39 | AG16: 5.65 | AH16: 3.01 | AI16: 8.16 | AJ16: 5.18 | AK16: 10
A17: 13 | B17: Huff, Blake | C17: ESP-SS | D17: =+F17+K17+O17+S17+X17+AC17 -> 207.38 | E17: =+J17+N17+R17+W17+AB17+AK17 -> 36 | F17: =+(G17+H17+I17)+0.5*J17 -> 19.85 | G17: 4.82 | H17: 6.24 | I17: 7.29 | J17: 3 | K17: =+(L17+M17)+0.5*N17 -> 39.40 | L17: 17.41 | M17: 18.99 | N17: 6 | O17: =+(P17+Q17)+0.5*R17 -> 33.82 | P17: 16.62 | Q17: 14.20 | R17: 6 | S17: =+(T17+U17+V17)+0.5*W17 -> 35.42 | T17: 11.76 | U17: 10.24 | V17: 8.92 | W17: 9 | X17: =+(Y17+Z17+AA17)+0.5*AB17 -> 30.81 | Y17: 7.60 | Z17: 11.46 | AA17: 9.25 | AB17: 5 | AC17: =+(AD17+AE17+AF17+AG17+AH17+AI17+AJ17)+0.5*AK17 -> 48.08 | AD17: 3.11 | AE17: 3.28 | AF17: 2.99 | AG17: 7.21 | AH17: 4.92 | AI17: 17.48 | AJ17: 5.59 | AK17: 7
A18: 14 | B18: Krivka, Milos | C18: ESP-UC | D18: =+F18+K18+O18+S18+X18+AC18 -> 209.41 | E18: =+J18+N18+R18+W18+AB18+AK18 -> 78 | F18: =+(G18+H18+I18)+0.5*J18 -> 19.17 | G18: 6.17 | H18: 6.35 | I18: 6.65 | J18: 0 | K18: =+(L18+M18)+0.5*N18 -> 37.50 | L18: 14.92 | M18: 18.08 | N18: 9 | O18: =+(P18+Q18)+0.5*R18 -> 32.92 | P18: 12.15 | Q18: 12.77 | R18: 16 | S18: =+(T18+U18+V18)+0.5*W18 -> 41.39 | T18: 13.76 | U18: 11.45 | V18: 10.68 | W18: 11 | X18: =+(Y18+Z18+AA18)+0.5*AB18 -> 33.50 | Y18: 5.72 | Z18: 7.42 | AA18: 7.86 | AB18: 25 | AC18: =+(AD18+AE18+AF18+AG18+AH18+AI18+AJ18)+0.5*AK18 -> 44.93 | AD18: 4.03 | AE18: 3.64 | AF18: 3.39 | AG18: 6.59 | AH18: 3.51 | AI18: 8.99 | AJ18: 6.28 | AK18: 17
A19: 15 | B19: Brown, Keith | C19: CDP-SS | D19: =+F19+K19+O19+S19+X19+AC19 -> 215.19 | E19: =+J19+N19+R19+W19+AB19+AK19 -> 27 | F19: =+(G19+H19+I19)+0.5*J19 -> 20.61 | G19: 4.97 | H19: 8.68 | I19: 5.46 | J19: 3 | K19: =+(L19+M19)+0.5*N19 -> 49.17 | L19: 22.74 | M19: 24.93 | N19: 3 | O19: =+(P19+Q19)+0.5*R19 -> 38.40 | P19: 17.91 | Q19: 19.49 | R19: 2 | S19: =+(T19+U19+V19)+0.5*W19 -> 44.72 | T19: 12.82 | U19: 16.34 | V19: 14.56 | W19: 2 | X19: =+(Y19+Z19+AA19)+0.5*AB19 -> 23.96 | Y19: 6.22 | Z19: 5.31 | AA19: 5.93 | AB19: 13 | AC19: =+(AD19+AE19+AF19+AG19+AH19+AI19+AJ19)+0.5*AK19 -> 38.33 | AD19: 3.29 | AE19: 3.56 | AF19: 3.76 | AG19: 6.40 | AH19: 3.66 | AI19: 10.01 | AJ19: 5.65 | AK19: 4
A20: 16 | B20: Eddy, Nephi | C20: SSP-UC | D20: =+F20+K20+O20+S20+X20+AC20 -> 216.12 | E20: =+J20+N20+R20+W20+AB20+AK20 -> 69 | F20: =+(G20+H20+I20)+0.5*J20 -> 20.25 | G20: 5.15 | H20: 5.86 | I20: 5.24 | J20: 8 | K20: =+(L20+M20)+0.5*N20 -> 54.19 | L20: 16.90 | M20: 30.29 | N20: 14 | O20: =+(P20+Q20)+0.5*R20 -> 34.87 | P20: 13.38 | Q20: 14.49 | R20: 14 | S20: =+(T20+U20+V20)+0.5*W20 -> 36.90 | T20: 12.98 | U20: 10.34 | V20: 10.58 | W20: 6 | X20: =+(Y20+Z20+AA20)+0.5*AB20 -> 24.12 | Y20: 5.93 | Z20: 6.67 | AA20: 8.52 | AB20: 6 | AC20: =+(AD20+AE20+AF20+AG20+AH20+AI20+AJ20)+0.5*AK20 -> 45.79 | AD20: 3.37 | AE20: 2.78 | AF20: 3.54 | AG20: 5.81 | AH20: 4.88 | AI20: 8.48 | AJ20: 6.43 | AK20: 21
A21: 17 | B21: Stone, Scott | C21: SSP-UC | D21: =+F21+K21+O21+S21+X21+AC21 -> 216.96 | E21: =+J21+N21+R21+W21+AB21+AK21 -> 107 | F21: =+(G21+H21+I21)+0.5*J21 -> 19.45 | G21: 6.04 | H21: 6.12 | I21: 6.29 | J21: 2 | K21: =+(L21+M21)+0.5*N21 -> 43.41 | L21: 17.11 | M21: 13.80 | N21: 25 | O21: =+(P21+Q21)+0.5*R21 -> 42.59 | P21: 15.00 | Q21: 16.59 | R21: 22 | S21: =+(T21+U21+V21)+0.5*W21 -> 33.67 | T21: 9.39 | U21: 9.44 | V21: 8.84 | W21: 12 | X21: =+(Y21+Z21+AA21)+0.5*AB21 -> 30.87 | Y21: 5.24 | Z21: 6.96 | AA21: 5.67 | AB21: 26 | AC21: =+(AD21+AE21+AF21+AG21+AH21+AI21+AJ21)+0.5*AK21 -> 46.97 | AD21: 2.82 | AE21: 3.34 | AF21: 3.02 | AG21: 7.51 | AH21: 4.89 | AI21: 9.21 | AJ21: 6.18 | AK21: 20
A22: 18 | B22: Zaccardi, Juke | C22: ESP-MM | D22: =+F22+K22+O22+S22+X22+AC22 -> 217.34 | E22: =+J22+N22+R22+W22+AB22+AK22 -> 126 | F22: =+(G22+H22+I22)+0.5*J22 -> 16.85 | G22: 4.51 | H22: 4.00 | I22: 5.84 | J22: 5 | K22: =+(L22+M22)+0.5*N22 -> 49.11 | L22: 13.01 | M22: 16.60 | N22: 39 | O22: =+(P22+Q22)+0.5*R22 -> 25.78 | P22: 11.19 | Q22: 10.09 | R22: 9 | S22: =+(T22+U22+V22)+0.5*W22 -> 29.17 | T22: 7.93 | U22: 7.58 | V22: 7.66 | W22: 12 | X22: =+(Y22+Z22+AA22)+0.5*AB22 -> 44.91 | Y22: 4.41 | Z22: 9.86 | AA22: 19.64 | AB22: 22 | AC22: =+(AD22+AE22+AF22+AG22+AH22+AI22+AJ22)+0.5*AK22 -> 51.52 | AD22: 1.91 | AE22: 2.55 | AF22: 2.28 | AG22: 6.29 | AH22: 5.56 | AI22: 6.43 | AJ22: 7.00 | AK22: 39
A23: 19 | B23: Brown, Jason | C23: SSP-UC | D23: =+F23+K23+O23+S23+X23+AC23 -> 222.68 | E23: =+J23+N23+R23+W23+AB23+AK23 -> 72 | F23: =+(G23+H23+I23)+0.5*J23 -> 21.26 | G23: 6.43 | H23: 7.17 | I23: 6.16 | J23: 3 | K23: =+(L23+M23)+0.5*N23 -> 46.14 | L23: 19.95 | M23: 21.19 | N23: 10 | O23: =+(P23+Q23)+0.5*R23 -> 38.04 | P23: 18.28 | Q23: 13.76 | R23: 12 | S23: =+(T23+U23+V23)+0.5*W23 -> 42.32 | T23: 10.69 | U23: 13.18 | V23: 12.95 | W23: 11 | X23: =+(Y23+Z23+AA23)+0.5*AB23 -> 29.53 | Y23: 5.38 | Z23: 6.92 | AA23: 9.73 | AB23: 15 | AC23: =+(AD23+AE23+AF23+AG23+AH23+AI23+AJ23)+0.5*AK23 -> 45.39 | AD23: 2.98 | AE23: 3.07 | AF23: 2.89 | AG23: 6.91 | AH23: 4.69 | AI23: 8.15 | AJ23: 6.20 | AK23: 21
A24: 20 | B24: Brownlee, Mike | C24: SSP-MM | D24: =+F24+K24+O24+S24+X24+AC24 -> 225.77 | E24: =+J24+N24+R24+W24+AB24+AK24 -> 85 | F24: =+(G24+H24+I24)+0.5*J24 -> 21.80 | G24: 6.67 | H24: 6.65 | I24: 6.48 | J24: 4 | K24: =+(L24+M24)+0.5*N24 -> 49.54 | L24: 19.59 | M24: 18.45 | N24: 23 | O24: =+(P24+Q24)+0.5*R24 -> 42.37 | P24: 13.22 | Q24: 17.15 | R24: 24 | S24: =+(T24+U24+V24)+0.5*W24 -> 39.84 | T24: 10.24 | U24: 9.86 | V24: 10.74 | W24: 18 | X24: =+(Y24+Z24+AA24)+0.5*AB24 -> 25.06 | Y24: 6.02 | Z24: 7.21 | AA24: 9.33 | AB24: 5 | AC24: =+(AD24+AE24+AF24+AG24+AH24+AI24+AJ24)+0.5*AK24 -> 47.16 | AD24: 3.57 | AE24: 3.91 | AF24: 3.75 | AG24: 7.70 | AH24: 4.45 | AI24: 10.90 | AJ24: 7.38 | AK24: 11
A25: 21 | B25: Simpson, Harold | C25: CDP-MM | D25: =+F25+K25+O25+S25+X25+AC25 -> 238.61 | E25: =+J25+N25+R25+W25+AB25+AK25 -> 47 | F25: =+(G25+H25+I25)+0.5*J25 -> 20.76 | G25: 6.25 | H25: 7.11 | I25: 6.90 | J25: 1 | K25: =+(L25+M25)+0.5*N25 -> 50.70 | L25: 22.07 | M25: 19.63 | N25: 18 | O25: =+(P25+Q25)+0.5*R25 -> 53.63 | P25: 20.80 | Q25: 31.33 | R25: 3 | S25: =+(T25+U25+V25)+0.5*W25 -> 34.64 | T25: 10.80 | U25: 11.44 | V25: 10.90 | W25: 3 | X25: =+(Y25+Z25+AA25)+0.5*AB25 -> 35.65 | Y25: 9.80 | Z25: 8.59 | AA25: 14.76 | AB25: 5 | AC25: =+(AD25+AE25+AF25+AG25+AH25+AI25+AJ25)+0.5*AK25 -> 43.23 | AD25: 3.56 | AE25: 3.52 | AF25: 3.60 | AG25: 6.84 | AH25: 3.87 | AI25: 7.75 | AJ25: 5.59 | AK25: 17
A26: 22 | B26: Loveless, Doug | C26: SSP-UC | D26: =+F26+K26+O26+S26+X26+AC26 -> 242.37 | E26: =+J26+N26+R26+W26+AB26+AK26 -> 129 | F26: =+(G26+H26+I26)+0.5*J26 -> 21.57 | G26: 5.10 | H26: 4.80 | I26: 7.67 | J26: 8 | K26: =+(L26+M26)+0.5*N26 -> 49.38 | L26: 15.61 | M26: 15.77 | N26: 36 | O26: =+(P26+Q26)+0.5*R26 -> 49.53 | P26: 14.45 | Q26: 17.58 | R26: 35 | S26: =+(T26+U26+V26)+0.5*W26 -> 45.15 | T26: 15.87 | U26: 12.25 | V26: 11.03 | W26: 12 | X26: =+(Y26+Z26+AA26)+0.5*AB26 -> 33.67 | Y26: 6.46 | Z26: 7.06 | AA26: 7.15 | AB26: 26 | AC26: =+(AD26+AE26+AF26+AG26+AH26+AI26+AJ26)+0.5*AK26 -> 43.07 | AD26: 2.88 | AE26: 3.78 | AF26: 2.89 | AG26: 5.75 | AH26: 4.66 | AI26: 10.73 | AJ26: 6.38 | AK26: 12
A27: 23 | B27: Kirkham, Glade | C27: SSP-UC | D27: =+F27+K27+O27+S27+X27+AC27 -> 263.26 | E27: =+J27+N27+R27+W27+AB27+AK27 -> 89 | F27: =+(G27+H27+I27)+0.5*J27 -> 24.95 | G27: 8.52 | H27: 7.92 | I27: 6.01 | J27: 5 | K27: =+(L27+M27)+0.5*N27 -> 60.97 | L27: 24.91 | M27: 24.56 | N27: 23 | O27: =+(P27+Q27)+0.5*R27 -> 36.59 | P27: 16.13 | Q27: 14.46 | R27: 12 | S27: =+(T27+U27+V27)+0.5*W27 -> 46.61 | T27: 14.55 | U27: 13.24 | V27: 13.82 | W27: 10 | X27: =+(Y27+Z27+AA27)+0.5*AB27 -> 39.91 | Y27: 7.24 | Z27: 9.41 | AA27: 10.76 | AB27: 25 | AC27: =+(AD27+AE27+AF27+AG27+AH27+AI27+AJ27)+0.5*AK27 -> 54.23 | AD27: 3.95 | AE27: 3.68 | AF27: 3.37 | AG27: 10.16 | AH27: 5.88 | AI27: 11.97 | AJ27: 8.22 | AK27: 14
A28: 24 | B28: Werner, Jake | C28: SSP-UC | D28: =+F28+K28+O28+S28+X28+AC28 -> 265.61 | E28: =+J28+N28+R28+W28+AB28+AK28 -> 78 | F28: =+(G28+H28+I28)+0.5*J28 -> 28.10 | G28: 7.87 | H28: 9.20 | I28: 8.53 | J28: 5 | K28: =+(L28+M28)+0.5*N28 -> 51.41 | L28: 21.66 | M28: 24.25 | N28: 11 | O28: =+(P28+Q28)+0.5*R28 -> 39.52 | P28: 17.01 | Q28: 21.51 | R28: 2 | S28: =+(T28+U28+V28)+0.5*W28 -> 54.06 | T28: 21.07 | U28: 16.80 | V28: 9.69 | W28: 13 | X28: =+(Y28+Z28+AA28)+0.5*AB28 -> 30.49 | Y28: 6.40 | Z28: 8.26 | AA28: 8.83 | AB28: 14 | AC28: =+(AD28+AE28+AF28+AG28+AH28+AI28+AJ28)+0.5*AK28 -> 62.03 | AD28: 3.79 | AE28: 3.85 | AF28: 3.84 | AG28: 8.99 | AH28: 5.79 | AI28: 11.48 | AJ28: 7.79 | AK28: 33
A29: 25 | B29: Kirkham, Bart | C29: CDP-UC | D29: =+F29+K29+O29+S29+X29+AC29 -> 272.41 | E29: =+J29+N29+R29+W29+AB29+AK29 -> 107 | F29: =+(G29+H29+I29)+0.5*J29 -> 21.37 | G29: 6.05 | H29: 7.36 | I29: 5.46 | J29: 5 | K29: =+(L29+M29)+0.5*N29 -> 67.34 | L29: 19.43 | M29: 30.41 | N29: 35 | O29: =+(P29+Q29)+0.5*R29 -> 46.89 | P29: 17.74 | Q29: 22.15 | R29: 14 | S29: =+(T29+U29+V29)+0.5*W29 -> 47.99 | T29: 14.50 | U29: 15.00 | V29: 12.99 | W29: 11 | X29: =+(Y29+Z29+AA29)+0.5*AB29 -> 40.93 | Y29: 8.64 | Z29: 8.30 | AA29: 8.99 | AB29: 30 | AC29: =+(AD29+AE29+AF29+AG29+AH29+AI29+AJ29)+0.5*AK29 -> 47.89 | AD29: 3.90 | AE29: 3.62 | AF29: 3.47 | AG29: 7.42 | AH29: 5.33 | AI29: 10.44 | AJ29: 7.71 | AK29: 12
A30: 26 | B30: Lauritzen, Scott | C30: SSP-UC | D30: =+F30+K30+O30+S30+X30+AC30 -> 275.51 | E30: =+J30+N30+R30+W30+AB30+AK30 -> 64 | F30: =+(G30+H30+I30)+0.5*J30 -> 21.65 | G30: 7.73 | H30: 5.10 | I30: 5.82 | J30: 6 | K30: =+(L30+M30)+0.5*N30 -> 51.11 | L30: 22.16 | M30: 25.95 | N30: 6 | O30: =+(P30+Q30)+0.5*R30 -> 51.55 | P30: 22.29 | Q30: 22.26 | R30: 14 | S30: =+(T30+U30+V30)+0.5*W30 -> 45.69 | T30: 10.00 | U30: 13.67 | V30: 13.02 | W30: 18 | X30: =+(Y30+Z30+AA30)+0.5*AB30 -> 28.95 | Y30: 6.64 | Z30: 7.93 | AA30: 10.38 | AB30: 8 | AC30: =+(AD30+AE30+AF30+AG30+AH30+AI30+AJ30)+0.5*AK30 -> 76.56 | AD30: 5.61 | AE30: 5.28 | AF30: 6.38 | AG30: 12.14 | AH30: 10.58 | AI30: 16.85 | AJ30: 13.72 | AK30: 12
A31: 27 | B31: Runolfson, Rhett | C31: SSP-MM | D31: =+F31+K31+O31+S31+X31+AC31 -> 275.58300000000003 | E31: =+J31+N31+R31+W31+AB31+AK31 -> 103 | F31: =+(G31+H31+I31)+0.5*J31 -> 29.152999999999999 | G31: 10.42 | H31: 9.6229999999999993 | I31: 9.11 | J31: 0 | K31: =+(L31+M31)+0.5*N31 -> 52.74 | L31: 19.76 | M31: 22.98 | N31: 20 | O31: =+(P31+Q31)+0.5*R31 -> 52.59 | P31: 21.18 | Q31: 19.41 | R31: 24 | S31: =+(T31+U31+V31)+0.5*W31 -> 44.99 | T31: 15.39 | U31: 12.41 | V31: 12.69 | W31: 9 | X31: =+(Y31+Z31+AA31)+0.5*AB31 -> 31.31 | Y31: 8.39 | Z31: 7.83 | AA31: 9.09 | AB31: 12 | AC31: =+(AD31+AE31+AF31+AG31+AH31+AI31+AJ31)+0.5*AK31 -> 64.80 | AD31: 4.48 | AE31: 4.65 | AF31: 5.28 | AG31: 7.61 | AH31: 4.66 | AI31: 10.96 | AJ31: 8.16 | AK31: 38
A32: 28 | B32: Osthed, Adam | C32: CDP-UC | D32: =+F32+K32+O32+S32+X32+AC32 -> 293.89 | E32: =+J32+N32+R32+W32+AB32+AK32 -> 102 | F32: =+(G32+H32+I32)+0.5*J32 -> 23.93 | G32: 6.51 | H32: 6.88 | I32: 6.54 | J32: 8 | K32: =+(L32+M32)+0.5*N32 -> 54.93 | L32: 24.29 | M32: 28.64 | N32: 4 | O32: =+(P32+Q32)+0.5*R32 -> 61.44 | P32: 26.35 | Q32: 26.59 | R32: 17 | S32: =+(T32+U32+V32)+0.5*W32 -> 46.58 | T32: 15.18 | U32: 12.64 | V32: 13.26 | W32: 11 | X32: =+(Y32+Z32+AA32)+0.5*AB32 -> 50.60 | Y32: 7.56 | Z32: 11.71 | AA32: 13.83 | AB32: 35 | AC32: =+(AD32+AE32+AF32+AG32+AH32+AI32+AJ32)+0.5*AK32 -> 56.41 | AD32: 3.12 | AE32: 4.72 | AF32: 4.58 | AG32: 9.11 | AH32: 4.82 | AI32: 9.05 | AJ32: 7.51 | AK32: 27
A33: 29 | B33: Ostler, Jay | C33: CDP-UC | D33: =+F33+K33+O33+S33+X33+AC33 -> 304.63 | E33: =+J33+N33+R33+W33+AB33+AK33 -> 59 | F33: =+(G33+H33+I33)+0.5*J33 -> 29.33 | G33: 6.50 | H33: 7.29 | I33: 11.54 | J33: 8 | K33: =+(L33+M33)+0.5*N33 -> 63.06 | L33: 31.95 | M33: 27.11 | N33: 8 | O33: =+(P33+Q33)+0.5*R33 -> 66.51 | P33: 30.10 | Q33: 31.91 | R33: 9 | S33: =+(T33+U33+V33)+0.5*W33 -> 60.67 | T33: 18.24 | U33: 17.17 | V33: 21.76 | W33: 7 | X33: =+(Y33+Z33+AA33)+0.5*AB33 -> 24.13 | Y33: 6.90 | Z33: 7.56 | AA33: 7.67 | AB33: 4 | AC33: =+(AD33+AE33+AF33+AG33+AH33+AI33+AJ33)+0.5*AK33 -> 60.93 | AD33: 4.60 | AE33: 3.95 | AF33: 3.65 | AG33: 7.99 | AH33: 3.82 | AI33: 18.99 | AJ33: 6.43 | AK33: 23
A34: 30 | B34: Vollertsen, Cindy | C34: SSP-UC | D34: =+F34+K34+O34+S34+X34+AC34 -> 311.87 | E34: =+J34+N34+R34+W34+AB34+AK34 -> 132 | F34: =+(G34+H34+I34)+0.5*J34 -> 30.72 | G34: 7.19 | H34: 7.67 | I34: 8.86 | J34: 14 | K34: =+(L34+M34)+0.5*N34 -> 64.31 | L34: 34.37 | M34: 19.44 | N34: 21 | O34: =+(P34+Q34)+0.5*R34 -> 46.78 | P34: 18.17 | Q34: 17.61 | R34: 22 | S34: =+(T34+U34+V34)+0.5*W34 -> 57.64 | T34: 14.10 | U34: 17.54 | V34: 17.00 | W34: 18 | X34: =+(Y34+Z34+AA34)+0.5*AB34 -> 42.01 | Y34: 10.32 | Z34: 10.63 | AA34: 9.56 | AB34: 23 | AC34: =+(AD34+AE34+AF34+AG34+AH34+AI34+AJ34)+0.5*AK34 -> 70.41 | AD34: 6.05 | AE34: 5.33 | AF34: 4.52 | AG34: 9.24 | AH34: 4.04 | AI34: 12.84 | AJ34: 11.39 | AK34: 34
A35: 31 | B35: Hendricks, Cy | C35: SSP-UC | D35: =+F35+K35+O35+S35+X35+AC35 -> 324.49 | E35: =+J35+N35+R35+W35+AB35+AK35 -> 141 | F35: =+(G35+H35+I35)+0.5*J35 -> 40.02 | G35: 17.34 | H35: 7.54 | I35: 9.14 | J35: 12 | K35: =+(L35+M35)+0.5*N35 -> 62.91 | L35: 22.00 | M35: 29.41 | N35: 23 | O35: =+(P35+Q35)+0.5*R35 -> 52.61 | P35: 23.13 | Q35: 20.48 | R35: 18 | S35: =+(T35+U35+V35)+0.5*W35 -> 56.09 | T35: 14.82 | U35: 15.76 | V35: 16.01 | W35: 19 | X35: =+(Y35+Z35+AA35)+0.5*AB35 -> 30.40 | Y35: 7.67 | Z35: 7.37 | AA35: 8.86 | AB35: 13 | AC35: =+(AD35+AE35+AF35+AG35+AH35+AI35+AJ35)+0.5*AK35 -> 82.46 | AD35: 8.95 | AE35: 4.95 | AF35: 4.23 | AG35: 6.89 | AH35: 4.56 | AI35: 17.32 | AJ35: 7.56 | AK35: 56
A36: 32 | B36: Padro, Manny | C36: CDP-UC | D36: =+F36+K36+O36+S36+X36+AC36 -> 336.89 | E36: =+J36+N36+R36+W36+AB36+AK36 -> 170 | F36: =+(G36+H36+I36)+0.5*J36 -> 30.21 | G36: 5.92 | H36: 6.00 | I36: 5.79 | J36: 25 | K36: =+(L36+M36)+0.5*N36 -> 65.36 | L36: 25.99 | M36: 18.37 | N36: 42 | O36: =+(P36+Q36)+0.5*R36 -> 61.44 | P36: 24.29 | Q36: 25.15 | R36: 24 | S36: =+(T36+U36+V36)+0.5*W36 -> 54.55 | T36: 17.43 | U36: 15.35 | V36: 16.27 | W36: 11 | X36: =+(Y36+Z36+AA36)+0.5*AB36 -> 54.64 | Y36: 9.93 | Z36: 9.16 | AA36: 10.55 | AB36: 50 | AC36: =+(AD36+AE36+AF36+AG36+AH36+AI36+AJ36)+0.5*AK36 -> 70.69 | AD36: 4.61 | AE36: 4.33 | AF36: 12.50 | AG36: 11.59 | AH36: 6.22 | AI36: 13.25 | AJ36: 9.19 | AK36: 18
A37: 33 | B37: Sackett, Scott | C37: CDP-UC | D37: =+F37+K37+O37+S37+X37+AC37 -> 424.30 | E37: =+J37+N37+R37+W37+AB37+AK37 -> 163 | F37: =+(G37+H37+I37)+0.5*J37 -> 74.73 | G37: 11.40 | H37: 9.36 | I37: 51.47 | J37: 5 | K37: =+(L37+M37)+0.5*N37 -> 74.06 | L37: 19.63 | M37: 25.93 | N37: 57 | O37: =+(P37+Q37)+0.5*R37 -> 69.57 | P37: 27.04 | Q37: 29.53 | R37: 26 | S37: =+(T37+U37+V37)+0.5*W37 -> 74.86 | T37: 17.66 | U37: 30.73 | V37: 16.47 | W37: 20 | X37: =+(Y37+Z37+AA37)+0.5*AB37 -> 46.23 | Y37: 12.83 | Z37: 8.44 | AA37: 14.96 | AB37: 20 | AC37: =+(AD37+AE37+AF37+AG37+AH37+AI37+AJ37)+0.5*AK37 -> 84.85 | AD37: 4.82 | AE37: 4.45 | AF37: 4.49 | AG37: 22.52 | AH37: 4.17 | AI37: 18.16 | AJ37: 8.74 | AK37: 35
A38: 34 | B38: Schulze, Brian | C38: CDP-UC | D38: =+F38+K38+O38+S38+X38+AC38 -> 446.69 | E38: =+J38+N38+R38+W38+AB38+AK38 -> 267 | F38: =+(G38+H38+I38)+0.5*J38 -> 50.09 | G38: 10.68 | H38: 11.17 | I38: 11.74 | J38: 33 | K38: =+(L38+M38)+0.5*N38 -> 91.64 | L38: 20.62 | M38: 23.52 | N38: 95 | O38: =+(P38+Q38)+0.5*R38 -> 81.22 | P38: 37.13 | Q38: 30.59 | R38: 27 | S38: =+(T38+U38+V38)+0.5*W38 -> 72.35 | T38: 23.31 | U38: 21.54 | V38: 21.00 | W38: 13 | X38: =+(Y38+Z38+AA38)+0.5*AB38 -> 61.42 | Y38: 12.80 | Z38: 19.11 | AA38: 12.01 | AB38: 35 | AC38: =+(AD38+AE38+AF38+AG38+AH38+AI38+AJ38)+0.5*AK38 -> 89.97 | AD38: 4.26 | AE38: 5.24 | AF38: 4.25 | AG38: 7.29 | AH38: 7.65 | AI38: 18.08 | AJ38: 11.20 | AK38: 64
A39: 35 | B39: Kirkham, Devon | C39: .22-N/C | D39: =+F39+K39+O39+S39+X39+AC39 -> 496.61 | E39: =+J39+N39+R39+W39+AB39+AK39 -> 63 | F39: =+(G39+H39+I39)+0.5*J39 -> 33.23 | G39: 12.48 | H39: 9.09 | I39: 6.66 | J39: 10 | K39: =+(L39+M39)+0.5*N39 -> 123.56 | L39: 79.80 | M39: 37.76 | N39: 12 | O39: =+(P39+Q39)+0.5*R39 -> 82.96 | P39: 20.84 | Q39: 53.12 | R39: 18 | S39: =+(T39+U39+V39)+0.5*W39 -> 114.25 | T39: 31.07 | U39: 52.07 | V39: 25.61 | W39: 11 | X39: =+(Y39+Z39+AA39)+0.5*AB39 -> 39.55 | Y39: 9.87 | Z39: 16.90 | AA39: 9.78 | AB39: 6 | AC39: =+(AD39+AE39+AF39+AG39+AH39+AI39+AJ39)+0.5*AK39 -> 103.06 | AD39: 12.29 | AE39: 8.52 | AF39: 7.62 | AG39: 23.85 | AH39: 13.19 | AI39: 23.94 | AJ39: 10.65 | AK39: 6
A40: 26 | B40: Rodriquez, Mike | C40: CDP-MM | D40: DNF | E40: =+J40+N40+R40+W40+AB40+AK40 -> 0 | F40: =+(G40+#REF!)+0.5*J40 -> #REF! | K40: =+(L40)+0.5*N40 -> 0.00 | O40: =+(P40+#REF!)+0.5*R40 -> #REF! | S40: =+(T40+U40+V40)+0.5*W40 -> 0.00 | X40: =+(Y40)+0.5*AB40 -> 0.00 | AC40: =+(AD40+AE40)+0.5*AK40 -> 0.00
A41: Notes:
A42: xx | B42: Indicates that the Points Down value includes some kind of penalty (Procedural Error, Hits on Non-Threat or Failure to Neutralize).
A43: PD | B43: = Points Down value is PD x .5 seconds added to the total stage time.
A44: xx | B44: Indicates that the Points Down value includes some kind of penalty (Procedural Error, Hits on Non-Threat or Failure to Neutralize).
A45: DNF | B45: = Did Not Finish
B46: Div/Class Information:
A47: - | B47: Division: CDP = Custom Defense Pistol; ESP = Enhanced Service Pistol; SSP = Stock Service Pistol; SSR = Stock Service Revolver
A48: - | B48: Classification: MA = Master; EX = Expert; SS = Sharpshooter; MM = Marksman; NV = Novice; UC = Unclassified
B49: .22-N/C = Shooter used a non IDPA firearm and was not placed in an IDPA Div/Class.