B2: UDPL IDPA Match Results for February 28, 2004
B3: Sorted by Div/Class | H3: Click on the Stage # to view the COF.
A4: Place | B4: Name | C4: (Div-Class) | D4: Shoot Total | E4: Total PD | F4: Stage 2 | G4: String 1 | H4: String 2 | I4: String 3 | J4: PD | K4: Stage 3 | L4: String 1 | M4: String 2 | N4: PD | O4: Stage 4 | P4: String 1 | Q4: String 2 | R4: PD | S4: Stage 5 | T4: String 1 | U4: String 2 | V4: String 3 | W4: PD | X4: Stage 6 | Y4: String 1 | Z4: String 2 | AA4: String 3 | AB4: PD | AC4: Stage 7 | AD4: String 1 | AE4: String 2 | AF4: String 3 | AG4: String 4 | AH4: String 5 | AI4: String 6 | AJ4: String 7 | AK4: PD
A5: CDP-EX
A6: 1 | B6: Theodore, Ari | C6: CDP-EX | D6: =+F6+K6+O6+S6+X6+AC6 -> 164.52 | E6: =+J6+N6+R6+W6+AB6+AK6 -> 52 | F6: =+(G6+H6+I6)+0.5*J6 -> 15.08 | G6: 3.63 | H6: 5.03 | I6: 5.42 | J6: 2 | K6: =+(L6+M6)+0.5*N6 -> 30.91 | L6: 12.24 | M6: 15.67 | N6: 6 | O6: =+(P6+Q6)+0.5*R6 -> 27.01 | P6: 10.57 | Q6: 12.44 | R6: 8 | S6: =+(T6+U6+V6)+0.5*W6 -> 27.12 | T6: 8.85 | U6: 8.41 | V6: 7.36 | W6: 5 | X6: =+(Y6+Z6+AA6)+0.5*AB6 -> 29.25 | Y6: 3.89 | Z6: 5.14 | AA6: 7.72 | AB6: 25 | AC6: =+(AD6+AE6+AF6+AG6+AH6+AI6+AJ6)+0.5*AK6 -> 35.15 | AD6: 2.79 | AE6: 2.71 | AF6: 2.96 | AG6: 7.92 | AH6: 3.96 | AI6: 6.36 | AJ6: 5.45 | AK6: 6
A7: CDP-SS
A8: 1 | B8: Beck, Dave | C8: CDP-SS | D8: =+F8+K8+O8+S8+X8+AC8 -> 179.84 | E8: =+J8+N8+R8+W8+AB8+AK8 -> 88 | F8: =+(G8+H8+I8)+0.5*J8 -> 12.21 | G8: 4.01 | H8: 3.46 | I8: 4.24 | J8: 1 | K8: =+(L8+M8)+0.5*N8 -> 33.92 | L8: 13.82 | M8: 14.10 | N8: 12 | O8: =+(P8+Q8)+0.5*R8 -> 30.98 | P8: 11.20 | Q8: 13.78 | R8: 12 | S8: =+(T8+U8+V8)+0.5*W8 -> 28.37 | T8: 8.22 | U8: 8.58 | V8: 9.07 | W8: 5 | X8: =+(Y8+Z8+AA8)+0.5*AB8 -> 39.49 | Y8: 4.90 | Z8: 5.65 | AA8: 5.44 | AB8: 47 | AC8: =+(AD8+AE8+AF8+AG8+AH8+AI8+AJ8)+0.5*AK8 -> 34.87 | AD8: 2.59 | AE8: 2.79 | AF8: 2.89 | AG8: 6.24 | AH8: 3.80 | AI8: 5.55 | AJ8: 5.51 | AK8: 11
A9: 2 | B9: Brown, Keith | C9: CDP-SS | D9: =+F9+K9+O9+S9+X9+AC9 -> 215.19 | E9: =+J9+N9+R9+W9+AB9+AK9 -> 27 | F9: =+(G9+H9+I9)+0.5*J9 -> 20.61 | G9: 4.97 | H9: 8.68 | I9: 5.46 | J9: 3 | K9: =+(L9+M9)+0.5*N9 -> 49.17 | L9: 22.74 | M9: 24.93 | N9: 3 | O9: =+(P9+Q9)+0.5*R9 -> 38.40 | P9: 17.91 | Q9: 19.49 | R9: 2 | S9: =+(T9+U9+V9)+0.5*W9 -> 44.72 | T9: 12.82 | U9: 16.34 | V9: 14.56 | W9: 2 | X9: =+(Y9+Z9+AA9)+0.5*AB9 -> 23.96 | Y9: 6.22 | Z9: 5.31 | AA9: 5.93 | AB9: 13 | AC9: =+(AD9+AE9+AF9+AG9+AH9+AI9+AJ9)+0.5*AK9 -> 38.33 | AD9: 3.29 | AE9: 3.56 | AF9: 3.76 | AG9: 6.40 | AH9: 3.66 | AI9: 10.01 | AJ9: 5.65 | AK9: 4
A10: CDP-MM
A11: 1 | B11: Simpson, Harold | C11: CDP-MM | D11: =+F11+K11+O11+S11+X11+AC11 -> 238.61 | E11: =+J11+N11+R11+W11+AB11+AK11 -> 47 | F11: =+(G11+H11+I11)+0.5*J11 -> 20.76 | G11: 6.25 | H11: 7.11 | I11: 6.90 | J11: 1 | K11: =+(L11+M11)+0.5*N11 -> 50.70 | L11: 22.07 | M11: 19.63 | N11: 18 | O11: =+(P11+Q11)+0.5*R11 -> 53.63 | P11: 20.80 | Q11: 31.33 | R11: 3 | S11: =+(T11+U11+V11)+0.5*W11 -> 34.64 | T11: 10.80 | U11: 11.44 | V11: 10.90 | W11: 3 | X11: =+(Y11+Z11+AA11)+0.5*AB11 -> 35.65 | Y11: 9.80 | Z11: 8.59 | AA11: 14.76 | AB11: 5 | AC11: =+(AD11+AE11+AF11+AG11+AH11+AI11+AJ11)+0.5*AK11 -> 43.23 | AD11: 3.56 | AE11: 3.52 | AF11: 3.60 | AG11: 6.84 | AH11: 3.87 | AI11: 7.75 | AJ11: 5.59 | AK11: 17
A12: CDP-UC
A13: 1 | B13: Ostler, Jeff | C13: CDP-UC | D13: =+F13+K13+O13+S13+X13+AC13 -> 173.40 | E13: =+J13+N13+R13+W13+AB13+AK13 -> 46 | F13: =+(G13+H13+I13)+0.5*J13 -> 17.06 | G13: 4.77 | H13: 7.03 | I13: 5.26 | J13: 0 | K13: =+(L13+M13)+0.5*N13 -> 36.33 | L13: 16.34 | M13: 17.49 | N13: 5 | O13: =+(P13+Q13)+0.5*R13 -> 27.42 | P13: 13.39 | Q13: 13.03 | R13: 2 | S13: =+(T13+U13+V13)+0.5*W13 -> 29.36 | T13: 8.02 | U13: 7.81 | V13: 7.03 | W13: 13 | X13: =+(Y13+Z13+AA13)+0.5*AB13 -> 18.09 | Y13: 5.22 | Z13: 5.59 | AA13: 6.28 | AB13: 2 | AC13: =+(AD13+AE13+AF13+AG13+AH13+AI13+AJ13)+0.5*AK13 -> 45.14 | AD13: 2.83 | AE13: 2.65 | AF13: 3.05 | AG13: 6.14 | AH13: 4.10 | AI13: 8.09 | AJ13: 6.28 | AK13: 24
A14: 2 | B14: Vollertsen, Joel | C14: CDP-UC | D14: =+F14+K14+O14+S14+X14+AC14 -> 202.35 | E14: =+J14+N14+R14+W14+AB14+AK14 -> 58 | F14: =+(G14+H14+I14)+0.5*J14 -> 17.26 | G14: 4.80 | H14: 5.87 | I14: 4.59 | J14: 4 | K14: =+(L14+M14)+0.5*N14 -> 46.06 | L14: 18.92 | M14: 20.64 | N14: 13 | O14: =+(P14+Q14)+0.5*R14 -> 37.42 | P14: 18.46 | Q14: 16.96 | R14: 4 | S14: =+(T14+U14+V14)+0.5*W14 -> 37.76 | T14: 10.85 | U14: 10.12 | V14: 10.29 | W14: 13 | X14: =+(Y14+Z14+AA14)+0.5*AB14 -> 21.71 | Y14: 5.45 | Z14: 5.50 | AA14: 8.26 | AB14: 5 | AC14: =+(AD14+AE14+AF14+AG14+AH14+AI14+AJ14)+0.5*AK14 -> 42.14 | AD14: 3.26 | AE14: 3.11 | AF14: 2.63 | AG14: 5.17 | AH14: 3.89 | AI14: 10.11 | AJ14: 4.47 | AK14: 19
A15: 3 | B15: Kirkham, Bart | C15: CDP-UC | D15: =+F15+K15+O15+S15+X15+AC15 -> 272.41 | E15: =+J15+N15+R15+W15+AB15+AK15 -> 107 | F15: =+(G15+H15+I15)+0.5*J15 -> 21.37 | G15: 6.05 | H15: 7.36 | I15: 5.46 | J15: 5 | K15: =+(L15+M15)+0.5*N15 -> 67.34 | L15: 19.43 | M15: 30.41 | N15: 35 | O15: =+(P15+Q15)+0.5*R15 -> 46.89 | P15: 17.74 | Q15: 22.15 | R15: 14 | S15: =+(T15+U15+V15)+0.5*W15 -> 47.99 | T15: 14.50 | U15: 15.00 | V15: 12.99 | W15: 11 | X15: =+(Y15+Z15+AA15)+0.5*AB15 -> 40.93 | Y15: 8.64 | Z15: 8.30 | AA15: 8.99 | AB15: 30 | AC15: =+(AD15+AE15+AF15+AG15+AH15+AI15+AJ15)+0.5*AK15 -> 47.89 | AD15: 3.90 | AE15: 3.62 | AF15: 3.47 | AG15: 7.42 | AH15: 5.33 | AI15: 10.44 | AJ15: 7.71 | AK15: 12
A16: 4 | B16: Osthed, Adam | C16: CDP-UC | D16: =+F16+K16+O16+S16+X16+AC16 -> 293.89 | E16: =+J16+N16+R16+W16+AB16+AK16 -> 102 | F16: =+(G16+H16+I16)+0.5*J16 -> 23.93 | G16: 6.51 | H16: 6.88 | I16: 6.54 | J16: 8 | K16: =+(L16+M16)+0.5*N16 -> 54.93 | L16: 24.29 | M16: 28.64 | N16: 4 | O16: =+(P16+Q16)+0.5*R16 -> 61.44 | P16: 26.35 | Q16: 26.59 | R16: 17 | S16: =+(T16+U16+V16)+0.5*W16 -> 46.58 | T16: 15.18 | U16: 12.64 | V16: 13.26 | W16: 11 | X16: =+(Y16+Z16+AA16)+0.5*AB16 -> 50.60 | Y16: 7.56 | Z16: 11.71 | AA16: 13.83 | AB16: 35 | AC16: =+(AD16+AE16+AF16+AG16+AH16+AI16+AJ16)+0.5*AK16 -> 56.41 | AD16: 3.12 | AE16: 4.72 | AF16: 4.58 | AG16: 9.11 | AH16: 4.82 | AI16: 9.05 | AJ16: 7.51 | AK16: 27
A17: 5 | B17: Ostler, Jay | C17: CDP-UC | D17: =+F17+K17+O17+S17+X17+AC17 -> 304.63 | E17: =+J17+N17+R17+W17+AB17+AK17 -> 59 | F17: =+(G17+H17+I17)+0.5*J17 -> 29.33 | G17: 6.50 | H17: 7.29 | I17: 11.54 | J17: 8 | K17: =+(L17+M17)+0.5*N17 -> 63.06 | L17: 31.95 | M17: 27.11 | N17: 8 | O17: =+(P17+Q17)+0.5*R17 -> 66.51 | P17: 30.10 | Q17: 31.91 | R17: 9 | S17: =+(T17+U17+V17)+0.5*W17 -> 60.67 | T17: 18.24 | U17: 17.17 | V17: 21.76 | W17: 7 | X17: =+(Y17+Z17+AA17)+0.5*AB17 -> 24.13 | Y17: 6.90 | Z17: 7.56 | AA17: 7.67 | AB17: 4 | AC17: =+(AD17+AE17+AF17+AG17+AH17+AI17+AJ17)+0.5*AK17 -> 60.93 | AD17: 4.60 | AE17: 3.95 | AF17: 3.65 | AG17: 7.99 | AH17: 3.82 | AI17: 18.99 | AJ17: 6.43 | AK17: 23
A18: 6 | B18: Padro, Manny | C18: CDP-UC | D18: =+F18+K18+O18+S18+X18+AC18 -> 336.89 | E18: =+J18+N18+R18+W18+AB18+AK18 -> 170 | F18: =+(G18+H18+I18)+0.5*J18 -> 30.21 | G18: 5.92 | H18: 6.00 | I18: 5.79 | J18: 25 | K18: =+(L18+M18)+0.5*N18 -> 65.36 | L18: 25.99 | M18: 18.37 | N18: 42 | O18: =+(P18+Q18)+0.5*R18 -> 61.44 | P18: 24.29 | Q18: 25.15 | R18: 24 | S18: =+(T18+U18+V18)+0.5*W18 -> 54.55 | T18: 17.43 | U18: 15.35 | V18: 16.27 | W18: 11 | X18: =+(Y18+Z18+AA18)+0.5*AB18 -> 54.64 | Y18: 9.93 | Z18: 9.16 | AA18: 10.55 | AB18: 50 | AC18: =+(AD18+AE18+AF18+AG18+AH18+AI18+AJ18)+0.5*AK18 -> 70.69 | AD18: 4.61 | AE18: 4.33 | AF18: 12.50 | AG18: 11.59 | AH18: 6.22 | AI18: 13.25 | AJ18: 9.19 | AK18: 18
A19: 7 | B19: Sackett, Scott | C19: CDP-UC | D19: =+F19+K19+O19+S19+X19+AC19 -> 424.30 | E19: =+J19+N19+R19+W19+AB19+AK19 -> 163 | F19: =+(G19+H19+I19)+0.5*J19 -> 74.73 | G19: 11.40 | H19: 9.36 | I19: 51.47 | J19: 5 | K19: =+(L19+M19)+0.5*N19 -> 74.06 | L19: 19.63 | M19: 25.93 | N19: 57 | O19: =+(P19+Q19)+0.5*R19 -> 69.57 | P19: 27.04 | Q19: 29.53 | R19: 26 | S19: =+(T19+U19+V19)+0.5*W19 -> 74.86 | T19: 17.66 | U19: 30.73 | V19: 16.47 | W19: 20 | X19: =+(Y19+Z19+AA19)+0.5*AB19 -> 46.23 | Y19: 12.83 | Z19: 8.44 | AA19: 14.96 | AB19: 20 | AC19: =+(AD19+AE19+AF19+AG19+AH19+AI19+AJ19)+0.5*AK19 -> 84.85 | AD19: 4.82 | AE19: 4.45 | AF19: 4.49 | AG19: 22.52 | AH19: 4.17 | AI19: 18.16 | AJ19: 8.74 | AK19: 35
A20: 8 | B20: Schulze, Brian | C20: CDP-UC | D20: =+F20+K20+O20+S20+X20+AC20 -> 446.69 | E20: =+J20+N20+R20+W20+AB20+AK20 -> 267 | F20: =+(G20+H20+I20)+0.5*J20 -> 50.09 | G20: 10.68 | H20: 11.17 | I20: 11.74 | J20: 33 | K20: =+(L20+M20)+0.5*N20 -> 91.64 | L20: 20.62 | M20: 23.52 | N20: 95 | O20: =+(P20+Q20)+0.5*R20 -> 81.22 | P20: 37.13 | Q20: 30.59 | R20: 27 | S20: =+(T20+U20+V20)+0.5*W20 -> 72.35 | T20: 23.31 | U20: 21.54 | V20: 21.00 | W20: 13 | X20: =+(Y20+Z20+AA20)+0.5*AB20 -> 61.42 | Y20: 12.80 | Z20: 19.11 | AA20: 12.01 | AB20: 35 | AC20: =+(AD20+AE20+AF20+AG20+AH20+AI20+AJ20)+0.5*AK20 -> 89.97 | AD20: 4.26 | AE20: 5.24 | AF20: 4.25 | AG20: 7.29 | AH20: 7.65 | AI20: 18.08 | AJ20: 11.20 | AK20: 64
A21: ESP-SS
A22: 1 | B22: Collins, Ken | C22: ESP-SS | D22: =+F22+K22+O22+S22+X22+AC22 -> 184.85 | E22: =+J22+N22+R22+W22+AB22+AK22 -> 59 | F22: =+(G22+H22+I22)+0.5*J22 -> 15.37 | G22: 4.57 | H22: 5.37 | I22: 4.93 | J22: 1 | K22: =+(L22+M22)+0.5*N22 -> 34.16 | L22: 15.49 | M22: 15.67 | N22: 6 | O22: =+(P22+Q22)+0.5*R22 -> 24.88 | P22: 11.03 | Q22: 11.85 | R22: 4 | S22: =+(T22+U22+V22)+0.5*W22 -> 36.87 | T22: 10.89 | U22: 8.75 | V22: 12.23 | W22: 10 | X22: =+(Y22+Z22+AA22)+0.5*AB22 -> 38.29 | Y22: 4.80 | Z22: 11.98 | AA22: 8.51 | AB22: 26 | AC22: =+(AD22+AE22+AF22+AG22+AH22+AI22+AJ22)+0.5*AK22 -> 35.28 | AD22: 2.70 | AE22: 2.94 | AF22: 2.69 | AG22: 5.03 | AH22: 3.06 | AI22: 7.66 | AJ22: 5.20 | AK22: 12
A23: 2 | B23: Zaccardi, Pat | C23: ESP-SS | D23: =+F23+K23+O23+S23+X23+AC23 -> 199.81 | E23: =+J23+N23+R23+W23+AB23+AK23 -> 74 | F23: =+(G23+H23+I23)+0.5*J23 -> 12.50 | G23: 4.12 | H23: 2.92 | I23: 3.96 | J23: 3 | K23: =+(L23+M23)+0.5*N23 -> 43.12 | L23: 22.08 | M23: 16.04 | N23: 10 | O23: =+(P23+Q23)+0.5*R23 -> 27.72 | P23: 11.18 | Q23: 11.54 | R23: 10 | S23: =+(T23+U23+V23)+0.5*W23 -> 31.17 | T23: 9.20 | U23: 10.30 | V23: 9.17 | W23: 5 | X23: =+(Y23+Z23+AA23)+0.5*AB23 -> 36.42 | Y23: 4.88 | Z23: 10.52 | AA23: 12.52 | AB23: 17 | AC23: =+(AD23+AE23+AF23+AG23+AH23+AI23+AJ23)+0.5*AK23 -> 48.88 | AD23: 3.41 | AE23: 3.59 | AF23: 3.08 | AG23: 7.41 | AH23: 4.51 | AI23: 7.65 | AJ23: 4.73 | AK23: 29
A24: 3 | B24: Huff, Blake | C24: ESP-SS | D24: =+F24+K24+O24+S24+X24+AC24 -> 207.38 | E24: =+J24+N24+R24+W24+AB24+AK24 -> 36 | F24: =+(G24+H24+I24)+0.5*J24 -> 19.85 | G24: 4.82 | H24: 6.24 | I24: 7.29 | J24: 3 | K24: =+(L24+M24)+0.5*N24 -> 39.40 | L24: 17.41 | M24: 18.99 | N24: 6 | O24: =+(P24+Q24)+0.5*R24 -> 33.82 | P24: 16.62 | Q24: 14.20 | R24: 6 | S24: =+(T24+U24+V24)+0.5*W24 -> 35.42 | T24: 11.76 | U24: 10.24 | V24: 8.92 | W24: 9 | X24: =+(Y24+Z24+AA24)+0.5*AB24 -> 30.81 | Y24: 7.60 | Z24: 11.46 | AA24: 9.25 | AB24: 5 | AC24: =+(AD24+AE24+AF24+AG24+AH24+AI24+AJ24)+0.5*AK24 -> 48.08 | AD24: 3.11 | AE24: 3.28 | AF24: 2.99 | AG24: 7.21 | AH24: 4.92 | AI24: 17.48 | AJ24: 5.59 | AK24: 7
A25: ESP-MM
A26: 1 | B26: Zaccardi, Juke | C26: ESP-MM | D26: =+F26+K26+O26+S26+X26+AC26 -> 217.34 | E26: =+J26+N26+R26+W26+AB26+AK26 -> 126 | F26: =+(G26+H26+I26)+0.5*J26 -> 16.85 | G26: 4.51 | H26: 4.00 | I26: 5.84 | J26: 5 | K26: =+(L26+M26)+0.5*N26 -> 49.11 | L26: 13.01 | M26: 16.60 | N26: 39 | O26: =+(P26+Q26)+0.5*R26 -> 25.78 | P26: 11.19 | Q26: 10.09 | R26: 9 | S26: =+(T26+U26+V26)+0.5*W26 -> 29.17 | T26: 7.93 | U26: 7.58 | V26: 7.66 | W26: 12 | X26: =+(Y26+Z26+AA26)+0.5*AB26 -> 44.91 | Y26: 4.41 | Z26: 9.86 | AA26: 19.64 | AB26: 22 | AC26: =+(AD26+AE26+AF26+AG26+AH26+AI26+AJ26)+0.5*AK26 -> 51.52 | AD26: 1.91 | AE26: 2.55 | AF26: 2.28 | AG26: 6.29 | AH26: 5.56 | AI26: 6.43 | AJ26: 7.00 | AK26: 39
A27: ESP-UC
A28: 1 | B28: Krivka, Milos | C28: ESP-UC | D28: =+F28+K28+O28+S28+X28+AC28 -> 209.41 | E28: =+J28+N28+R28+W28+AB28+AK28 -> 78 | F28: =+(G28+H28+I28)+0.5*J28 -> 19.17 | G28: 6.17 | H28: 6.35 | I28: 6.65 | J28: 0 | K28: =+(L28+M28)+0.5*N28 -> 37.50 | L28: 14.92 | M28: 18.08 | N28: 9 | O28: =+(P28+Q28)+0.5*R28 -> 32.92 | P28: 12.15 | Q28: 12.77 | R28: 16 | S28: =+(T28+U28+V28)+0.5*W28 -> 41.39 | T28: 13.76 | U28: 11.45 | V28: 10.68 | W28: 11 | X28: =+(Y28+Z28+AA28)+0.5*AB28 -> 33.50 | Y28: 5.72 | Z28: 7.42 | AA28: 7.86 | AB28: 25 | AC28: =+(AD28+AE28+AF28+AG28+AH28+AI28+AJ28)+0.5*AK28 -> 44.93 | AD28: 4.03 | AE28: 3.64 | AF28: 3.39 | AG28: 6.59 | AH28: 3.51 | AI28: 8.99 | AJ28: 6.28 | AK28: 17
A29: SSP-EX
A30: 1 | B30: Montgomery, Robert | C30: SSP-EX | D30: =+F30+K30+O30+S30+X30+AC30 -> 175.19 | E30: =+J30+N30+R30+W30+AB30+AK30 -> 40 | F30: =+(G30+H30+I30)+0.5*J30 -> 17.24 | G30: 4.74 | H30: 4.72 | I30: 5.28 | J30: 5 | K30: =+(L30+M30)+0.5*N30 -> 39.51 | L30: 14.03 | M30: 19.48 | N30: 12 | O30: =+(P30+Q30)+0.5*R30 -> 25.81 | P30: 10.39 | Q30: 10.92 | R30: 9 | S30: =+(T30+U30+V30)+0.5*W30 -> 30.14 | T30: 9.81 | U30: 9.57 | V30: 10.26 | W30: 1 | X30: =+(Y30+Z30+AA30)+0.5*AB30 -> 28.00 | Y30: 5.78 | Z30: 6.98 | AA30: 10.24 | AB30: 10 | AC30: =+(AD30+AE30+AF30+AG30+AH30+AI30+AJ30)+0.5*AK30 -> 34.49 | AD30: 3.14 | AE30: 2.86 | AF30: 1.82 | AG30: 6.23 | AH30: 4.17 | AI30: 8.56 | AJ30: 6.21 | AK30: 3
A31: 2 | B31: Vollmer, Phillip | C31: SSP-EX | D31: =+F31+K31+O31+S31+X31+AC31 -> 190.98 | E31: =+J31+N31+R31+W31+AB31+AK31 -> 68 | F31: =+(G31+H31+I31)+0.5*J31 -> 13.44 | G31: 3.97 | H31: 4.67 | I31: 4.80 | J31: 0 | K31: =+(L31+M31)+0.5*N31 -> 46.14 | L31: 15.98 | M31: 20.66 | N31: 19 | O31: =+(P31+Q31)+0.5*R31 -> 31.61 | P31: 11.62 | Q31: 13.99 | R31: 12 | S31: =+(T31+U31+V31)+0.5*W31 -> 17.66 | T31: 5.22 | U31: 5.34 | V31: 5.60 | W31: 3 | X31: =+(Y31+Z31+AA31)+0.5*AB31 -> 41.18 | Y31: 13.79 | Z31: 10.09 | AA31: 11.30 | AB31: 12 | AC31: =+(AD31+AE31+AF31+AG31+AH31+AI31+AJ31)+0.5*AK31 -> 40.95 | AD31: 2.67 | AE31: 2.58 | AF31: 2.77 | AG31: 6.36 | AH31: 2.85 | AI31: 7.78 | AJ31: 4.94 | AK31: 22
A32: SSP-MM
A33: 1 | B33: Boyer, Steve | C33: SSP-MM | D33: =+F33+K33+O33+S33+X33+AC33 -> 200.07 | E33: =+J33+N33+R33+W33+AB33+AK33 -> 46 | F33: =+(G33+H33+I33)+0.5*J33 -> 19.27 | G33: 5.54 | H33: 7.50 | I33: 5.73 | J33: 1 | K33: =+(L33+M33)+0.5*N33 -> 45.57 | L33: 19.58 | M33: 20.99 | N33: 10 | O33: =+(P33+Q33)+0.5*R33 -> 31.70 | P33: 14.61 | Q33: 14.09 | R33: 6 | S33: =+(T33+U33+V33)+0.5*W33 -> 35.20 | T33: 10.94 | U33: 11.81 | V33: 10.45 | W33: 4 | X33: =+(Y33+Z33+AA33)+0.5*AB33 -> 24.42 | Y33: 7.26 | Z33: 6.25 | AA33: 7.41 | AB33: 7 | AC33: =+(AD33+AE33+AF33+AG33+AH33+AI33+AJ33)+0.5*AK33 -> 43.91 | AD33: 4.17 | AE33: 3.88 | AF33: 3.28 | AG33: 5.51 | AH33: 3.55 | AI33: 8.76 | AJ33: 5.76 | AK33: 18
A34: 2 | B34: VanLeuven, Joel | C34: SSP-MM | D34: =+F34+K34+O34+S34+X34+AC34 -> 204.84 | E34: =+J34+N34+R34+W34+AB34+AK34 -> 75 | F34: =+(G34+H34+I34)+0.5*J34 -> 16.46 | G34: 4.85 | H34: 5.34 | I34: 4.77 | J34: 3 | K34: =+(L34+M34)+0.5*N34 -> 40.83 | L34: 16.51 | M34: 15.82 | N34: 17 | O34: =+(P34+Q34)+0.5*R34 -> 34.82 | P34: 13.45 | Q34: 13.37 | R34: 16 | S34: =+(T34+U34+V34)+0.5*W34 -> 48.37 | T34: 9.02 | U34: 14.10 | V34: 17.25 | W34: 16 | X34: =+(Y34+Z34+AA34)+0.5*AB34 -> 26.98 | Y34: 6.06 | Z34: 6.40 | AA34: 8.02 | AB34: 13 | AC34: =+(AD34+AE34+AF34+AG34+AH34+AI34+AJ34)+0.5*AK34 -> 37.38 | AD34: 3.37 | AE34: 3.62 | AF34: 3.39 | AG34: 5.65 | AH34: 3.01 | AI34: 8.16 | AJ34: 5.18 | AK34: 10
A35: 3 | B35: Brownlee, Mike | C35: SSP-MM | D35: =+F35+K35+O35+S35+X35+AC35 -> 225.77 | E35: =+J35+N35+R35+W35+AB35+AK35 -> 85 | F35: =+(G35+H35+I35)+0.5*J35 -> 21.80 | G35: 6.67 | H35: 6.65 | I35: 6.48 | J35: 4 | K35: =+(L35+M35)+0.5*N35 -> 49.54 | L35: 19.59 | M35: 18.45 | N35: 23 | O35: =+(P35+Q35)+0.5*R35 -> 42.37 | P35: 13.22 | Q35: 17.15 | R35: 24 | S35: =+(T35+U35+V35)+0.5*W35 -> 39.84 | T35: 10.24 | U35: 9.86 | V35: 10.74 | W35: 18 | X35: =+(Y35+Z35+AA35)+0.5*AB35 -> 25.06 | Y35: 6.02 | Z35: 7.21 | AA35: 9.33 | AB35: 5 | AC35: =+(AD35+AE35+AF35+AG35+AH35+AI35+AJ35)+0.5*AK35 -> 47.16 | AD35: 3.57 | AE35: 3.91 | AF35: 3.75 | AG35: 7.70 | AH35: 4.45 | AI35: 10.90 | AJ35: 7.38 | AK35: 11
A36: 4 | B36: Runolfson, Rhett | C36: SSP-MM | D36: =+F36+K36+O36+S36+X36+AC36 -> 275.58300000000003 | E36: =+J36+N36+R36+W36+AB36+AK36 -> 103 | F36: =+(G36+H36+I36)+0.5*J36 -> 29.152999999999999 | G36: 10.42 | H36: 9.6229999999999993 | I36: 9.11 | J36: 0 | K36: =+(L36+M36)+0.5*N36 -> 52.74 | L36: 19.76 | M36: 22.98 | N36: 20 | O36: =+(P36+Q36)+0.5*R36 -> 52.59 | P36: 21.18 | Q36: 19.41 | R36: 24 | S36: =+(T36+U36+V36)+0.5*W36 -> 44.99 | T36: 15.39 | U36: 12.41 | V36: 12.69 | W36: 9 | X36: =+(Y36+Z36+AA36)+0.5*AB36 -> 31.31 | Y36: 8.39 | Z36: 7.83 | AA36: 9.09 | AB36: 12 | AC36: =+(AD36+AE36+AF36+AG36+AH36+AI36+AJ36)+0.5*AK36 -> 64.80 | AD36: 4.48 | AE36: 4.65 | AF36: 5.28 | AG36: 7.61 | AH36: 4.66 | AI36: 10.96 | AJ36: 8.16 | AK36: 38
A37: SSP-UC
A38: 1 | B38: Outzen, Craig | C38: SSP-UC | D38: =+F38+K38+O38+S38+X38+AC38 -> 194.17 | E38: =+J38+N38+R38+W38+AB38+AK38 -> 95 | F38: =+(G38+H38+I38)+0.5*J38 -> 14.92 | G38: 4.29 | H38: 4.32 | I38: 4.31 | J38: 4 | K38: =+(L38+M38)+0.5*N38 -> 36.11 | L38: 13.06 | M38: 18.55 | N38: 9 | O38: =+(P38+Q38)+0.5*R38 -> 31.05 | P38: 10.42 | Q38: 10.63 | R38: 20 | S38: =+(T38+U38+V38)+0.5*W38 -> 33.41 | T38: 10.34 | U38: 9.86 | V38: 8.71 | W38: 9 | X38: =+(Y38+Z38+AA38)+0.5*AB38 -> 32.94 | Y38: 5.22 | Z38: 5.94 | AA38: 7.78 | AB38: 28 | AC38: =+(AD38+AE38+AF38+AG38+AH38+AI38+AJ38)+0.5*AK38 -> 45.74 | AD38: 2.62 | AE38: 2.54 | AF38: 2.47 | AG38: 5.48 | AH38: 4.68 | AI38: 9.87 | AJ38: 5.58 | AK38: 25
A39: 2 | B39: Eddy, Nephi | C39: SSP-UC | D39: =+F39+K39+O39+S39+X39+AC39 -> 216.12 | E39: =+J39+N39+R39+W39+AB39+AK39 -> 69 | F39: =+(G39+H39+I39)+0.5*J39 -> 20.25 | G39: 5.15 | H39: 5.86 | I39: 5.24 | J39: 8 | K39: =+(L39+M39)+0.5*N39 -> 54.19 | L39: 16.90 | M39: 30.29 | N39: 14 | O39: =+(P39+Q39)+0.5*R39 -> 34.87 | P39: 13.38 | Q39: 14.49 | R39: 14 | S39: =+(T39+U39+V39)+0.5*W39 -> 36.90 | T39: 12.98 | U39: 10.34 | V39: 10.58 | W39: 6 | X39: =+(Y39+Z39+AA39)+0.5*AB39 -> 24.12 | Y39: 5.93 | Z39: 6.67 | AA39: 8.52 | AB39: 6 | AC39: =+(AD39+AE39+AF39+AG39+AH39+AI39+AJ39)+0.5*AK39 -> 45.79 | AD39: 3.37 | AE39: 2.78 | AF39: 3.54 | AG39: 5.81 | AH39: 4.88 | AI39: 8.48 | AJ39: 6.43 | AK39: 21
A40: 3 | B40: Stone, Scott | C40: SSP-UC | D40: =+F40+K40+O40+S40+X40+AC40 -> 216.96 | E40: =+J40+N40+R40+W40+AB40+AK40 -> 107 | F40: =+(G40+H40+I40)+0.5*J40 -> 19.45 | G40: 6.04 | H40: 6.12 | I40: 6.29 | J40: 2 | K40: =+(L40+M40)+0.5*N40 -> 43.41 | L40: 17.11 | M40: 13.80 | N40: 25 | O40: =+(P40+Q40)+0.5*R40 -> 42.59 | P40: 15.00 | Q40: 16.59 | R40: 22 | S40: =+(T40+U40+V40)+0.5*W40 -> 33.67 | T40: 9.39 | U40: 9.44 | V40: 8.84 | W40: 12 | X40: =+(Y40+Z40+AA40)+0.5*AB40 -> 30.87 | Y40: 5.24 | Z40: 6.96 | AA40: 5.67 | AB40: 26 | AC40: =+(AD40+AE40+AF40+AG40+AH40+AI40+AJ40)+0.5*AK40 -> 46.97 | AD40: 2.82 | AE40: 3.34 | AF40: 3.02 | AG40: 7.51 | AH40: 4.89 | AI40: 9.21 | AJ40: 6.18 | AK40: 20
A41: 4 | B41: Brown, Jason | C41: SSP-UC | D41: =+F41+K41+O41+S41+X41+AC41 -> 222.68 | E41: =+J41+N41+R41+W41+AB41+AK41 -> 72 | F41: =+(G41+H41+I41)+0.5*J41 -> 21.26 | G41: 6.43 | H41: 7.17 | I41: 6.16 | J41: 3 | K41: =+(L41+M41)+0.5*N41 -> 46.14 | L41: 19.95 | M41: 21.19 | N41: 10 | O41: =+(P41+Q41)+0.5*R41 -> 38.04 | P41: 18.28 | Q41: 13.76 | R41: 12 | S41: =+(T41+U41+V41)+0.5*W41 -> 42.32 | T41: 10.69 | U41: 13.18 | V41: 12.95 | W41: 11 | X41: =+(Y41+Z41+AA41)+0.5*AB41 -> 29.53 | Y41: 5.38 | Z41: 6.92 | AA41: 9.73 | AB41: 15 | AC41: =+(AD41+AE41+AF41+AG41+AH41+AI41+AJ41)+0.5*AK41 -> 45.39 | AD41: 2.98 | AE41: 3.07 | AF41: 2.89 | AG41: 6.91 | AH41: 4.69 | AI41: 8.15 | AJ41: 6.20 | AK41: 21
A42: 5 | B42: Loveless, Doug | C42: SSP-UC | D42: =+F42+K42+O42+S42+X42+AC42 -> 242.37 | E42: =+J42+N42+R42+W42+AB42+AK42 -> 129 | F42: =+(G42+H42+I42)+0.5*J42 -> 21.57 | G42: 5.10 | H42: 4.80 | I42: 7.67 | J42: 8 | K42: =+(L42+M42)+0.5*N42 -> 49.38 | L42: 15.61 | M42: 15.77 | N42: 36 | O42: =+(P42+Q42)+0.5*R42 -> 49.53 | P42: 14.45 | Q42: 17.58 | R42: 35 | S42: =+(T42+U42+V42)+0.5*W42 -> 45.15 | T42: 15.87 | U42: 12.25 | V42: 11.03 | W42: 12 | X42: =+(Y42+Z42+AA42)+0.5*AB42 -> 33.67 | Y42: 6.46 | Z42: 7.06 | AA42: 7.15 | AB42: 26 | AC42: =+(AD42+AE42+AF42+AG42+AH42+AI42+AJ42)+0.5*AK42 -> 43.07 | AD42: 2.88 | AE42: 3.78 | AF42: 2.89 | AG42: 5.75 | AH42: 4.66 | AI42: 10.73 | AJ42: 6.38 | AK42: 12
A43: 6 | B43: Kirkham, Glade | C43: SSP-UC | D43: =+F43+K43+O43+S43+X43+AC43 -> 263.26 | E43: =+J43+N43+R43+W43+AB43+AK43 -> 89 | F43: =+(G43+H43+I43)+0.5*J43 -> 24.95 | G43: 8.52 | H43: 7.92 | I43: 6.01 | J43: 5 | K43: =+(L43+M43)+0.5*N43 -> 60.97 | L43: 24.91 | M43: 24.56 | N43: 23 | O43: =+(P43+Q43)+0.5*R43 -> 36.59 | P43: 16.13 | Q43: 14.46 | R43: 12 | S43: =+(T43+U43+V43)+0.5*W43 -> 46.61 | T43: 14.55 | U43: 13.24 | V43: 13.82 | W43: 10 | X43: =+(Y43+Z43+AA43)+0.5*AB43 -> 39.91 | Y43: 7.24 | Z43: 9.41 | AA43: 10.76 | AB43: 25 | AC43: =+(AD43+AE43+AF43+AG43+AH43+AI43+AJ43)+0.5*AK43 -> 54.23 | AD43: 3.95 | AE43: 3.68 | AF43: 3.37 | AG43: 10.16 | AH43: 5.88 | AI43: 11.97 | AJ43: 8.22 | AK43: 14
A44: 7 | B44: Werner, Jake | C44: SSP-UC | D44: =+F44+K44+O44+S44+X44+AC44 -> 265.61 | E44: =+J44+N44+R44+W44+AB44+AK44 -> 78 | F44: =+(G44+H44+I44)+0.5*J44 -> 28.10 | G44: 7.87 | H44: 9.20 | I44: 8.53 | J44: 5 | K44: =+(L44+M44)+0.5*N44 -> 51.41 | L44: 21.66 | M44: 24.25 | N44: 11 | O44: =+(P44+Q44)+0.5*R44 -> 39.52 | P44: 17.01 | Q44: 21.51 | R44: 2 | S44: =+(T44+U44+V44)+0.5*W44 -> 54.06 | T44: 21.07 | U44: 16.80 | V44: 9.69 | W44: 13 | X44: =+(Y44+Z44+AA44)+0.5*AB44 -> 30.49 | Y44: 6.40 | Z44: 8.26 | AA44: 8.83 | AB44: 14 | AC44: =+(AD44+AE44+AF44+AG44+AH44+AI44+AJ44)+0.5*AK44 -> 62.03 | AD44: 3.79 | AE44: 3.85 | AF44: 3.84 | AG44: 8.99 | AH44: 5.79 | AI44: 11.48 | AJ44: 7.79 | AK44: 33
A45: 8 | B45: Lauritzen, Scott | C45: SSP-UC | D45: =+F45+K45+O45+S45+X45+AC45 -> 275.51 | E45: =+J45+N45+R45+W45+AB45+AK45 -> 64 | F45: =+(G45+H45+I45)+0.5*J45 -> 21.65 | G45: 7.73 | H45: 5.10 | I45: 5.82 | J45: 6 | K45: =+(L45+M45)+0.5*N45 -> 51.11 | L45: 22.16 | M45: 25.95 | N45: 6 | O45: =+(P45+Q45)+0.5*R45 -> 51.55 | P45: 22.29 | Q45: 22.26 | R45: 14 | S45: =+(T45+U45+V45)+0.5*W45 -> 45.69 | T45: 10.00 | U45: 13.67 | V45: 13.02 | W45: 18 | X45: =+(Y45+Z45+AA45)+0.5*AB45 -> 28.95 | Y45: 6.64 | Z45: 7.93 | AA45: 10.38 | AB45: 8 | AC45: =+(AD45+AE45+AF45+AG45+AH45+AI45+AJ45)+0.5*AK45 -> 76.56 | AD45: 5.61 | AE45: 5.28 | AF45: 6.38 | AG45: 12.14 | AH45: 10.58 | AI45: 16.85 | AJ45: 13.72 | AK45: 12
A46: 9 | B46: Vollertsen, Cindy | C46: SSP-UC | D46: =+F46+K46+O46+S46+X46+AC46 -> 311.87 | E46: =+J46+N46+R46+W46+AB46+AK46 -> 132 | F46: =+(G46+H46+I46)+0.5*J46 -> 30.72 | G46: 7.19 | H46: 7.67 | I46: 8.86 | J46: 14 | K46: =+(L46+M46)+0.5*N46 -> 64.31 | L46: 34.37 | M46: 19.44 | N46: 21 | O46: =+(P46+Q46)+0.5*R46 -> 46.78 | P46: 18.17 | Q46: 17.61 | R46: 22 | S46: =+(T46+U46+V46)+0.5*W46 -> 57.64 | T46: 14.10 | U46: 17.54 | V46: 17.00 | W46: 18 | X46: =+(Y46+Z46+AA46)+0.5*AB46 -> 42.01 | Y46: 10.32 | Z46: 10.63 | AA46: 9.56 | AB46: 23 | AC46: =+(AD46+AE46+AF46+AG46+AH46+AI46+AJ46)+0.5*AK46 -> 70.41 | AD46: 6.05 | AE46: 5.33 | AF46: 4.52 | AG46: 9.24 | AH46: 4.04 | AI46: 12.84 | AJ46: 11.39 | AK46: 34
A47: 10 | B47: Hendricks, Cy | C47: SSP-UC | D47: =+F47+K47+O47+S47+X47+AC47 -> 324.49 | E47: =+J47+N47+R47+W47+AB47+AK47 -> 141 | F47: =+(G47+H47+I47)+0.5*J47 -> 40.02 | G47: 17.34 | H47: 7.54 | I47: 9.14 | J47: 12 | K47: =+(L47+M47)+0.5*N47 -> 62.91 | L47: 22.00 | M47: 29.41 | N47: 23 | O47: =+(P47+Q47)+0.5*R47 -> 52.61 | P47: 23.13 | Q47: 20.48 | R47: 18 | S47: =+(T47+U47+V47)+0.5*W47 -> 56.09 | T47: 14.82 | U47: 15.76 | V47: 16.01 | W47: 19 | X47: =+(Y47+Z47+AA47)+0.5*AB47 -> 30.40 | Y47: 7.67 | Z47: 7.37 | AA47: 8.86 | AB47: 13 | AC47: =+(AD47+AE47+AF47+AG47+AH47+AI47+AJ47)+0.5*AK47 -> 82.46 | AD47: 8.95 | AE47: 4.95 | AF47: 4.23 | AG47: 6.89 | AH47: 4.56 | AI47: 17.32 | AJ47: 7.56 | AK47: 56
A48: SSR-EX
A49: 1 | B49: Mousley, Roger | C49: SSR-EX | D49: =+F49+K49+O49+S49+X49+AC49 -> 177.51 | E49: =+J49+N49+R49+W49+AB49+AK49 -> 41 | F49: =+(G49+H49+I49)+0.5*J49 -> 15.46 | G49: 4.58 | H49: 5.06 | I49: 4.82 | J49: 2 | K49: =+(L49+M49)+0.5*N49 -> 31.06 | L49: 12.52 | M49: 15.54 | N49: 6 | O49: =+(P49+Q49)+0.5*R49 -> 30.69 | P49: 13.42 | Q49: 12.77 | R49: 9 | S49: =+(T49+U49+V49)+0.5*W49 -> 39.17 | T49: 11.55 | U49: 15.87 | V49: 9.75 | W49: 4 | X49: =+(Y49+Z49+AA49)+0.5*AB49 -> 27.84 | Y49: 5.17 | Z49: 7.26 | AA49: 7.41 | AB49: 16 | AC49: =+(AD49+AE49+AF49+AG49+AH49+AI49+AJ49)+0.5*AK49 -> 33.29 | AD49: 3.03 | AE49: 2.85 | AF49: 2.79 | AG49: 6.09 | AH49: 3.24 | AI49: 7.98 | AJ49: 5.31 | AK49: 4
A50: 26 | B50: Rodriquez, Mike | C50: CDP-MM | D50: DNF | E50: =+J50+N50+R50+W50+AB50+AK50 -> 0 | F50: =+(G50+#REF!)+0.5*J50 -> #REF! | K50: =+(L50)+0.5*N50 -> 0.00 | O50: =+(P50+#REF!)+0.5*R50 -> #REF! | S50: =+(T50+U50+V50)+0.5*W50 -> 0.00 | X50: =+(Y50)+0.5*AB50 -> 0.00 | AC50: =+(AD50+AE50)+0.5*AK50 -> 0.00
A51: OTHER
A52: 1 | B52: Kirkham, Devon | C52: .22-N/C | D52: =+F52+K52+O52+S52+X52+AC52 -> 496.61 | E52: =+J52+N52+R52+W52+AB52+AK52 -> 63 | F52: =+(G52+H52+I52)+0.5*J52 -> 33.23 | G52: 12.48 | H52: 9.09 | I52: 6.66 | J52: 10 | K52: =+(L52+M52)+0.5*N52 -> 123.56 | L52: 79.80 | M52: 37.76 | N52: 12 | O52: =+(P52+Q52)+0.5*R52 -> 82.96 | P52: 20.84 | Q52: 53.12 | R52: 18 | S52: =+(T52+U52+V52)+0.5*W52 -> 114.25 | T52: 31.07 | U52: 52.07 | V52: 25.61 | W52: 11 | X52: =+(Y52+Z52+AA52)+0.5*AB52 -> 39.55 | Y52: 9.87 | Z52: 16.90 | AA52: 9.78 | AB52: 6 | AC52: =+(AD52+AE52+AF52+AG52+AH52+AI52+AJ52)+0.5*AK52 -> 103.06 | AD52: 12.29 | AE52: 8.52 | AF52: 7.62 | AG52: 23.85 | AH52: 13.19 | AI52: 23.94 | AJ52: 10.65 | AK52: 6
A53: Notes:
A54: xx | B54: Indicates that the Points Down value includes some kind of penalty (Procedural Error, Hits on Non-Threat or Failure to Neutralize).
A55: PD | B55: = Points Down value is PD x .5 seconds added to the total stage time.
A56: xx | B56: Indicates that the Points Down value includes some kind of penalty (Procedural Error, Hits on Non-Threat or Failure to Neutralize).
A57: DNF | B57: = Did Not Finish
B58: Div/Class Information:
A59: - | B59: Division: CDP = Custom Defense Pistol; ESP = Enhanced Service Pistol; SSP = Stock Service Pistol; SSR = Stock Service Revolver
A60: - | B60: Classification: MA = Master; EX = Expert; SS = Sharpshooter; MM = Marksman; NV = Novice; UC = Unclassified
B61: .22-N/C = Shooter used a non IDPA firearm and was not placed in an IDPA Div/Class.