B2: UDPL IDPA Match Results for April 24, 2004
B3: Sorted by Time without regard to Div/Class
B4: Click here to view results by DIV/CLASS. | H4: Click on the Stage # to view the COF.
A5: Place | B5: Name | C5: (Div-Class) | D5: Shoot Total | E5: Total PD | F5: Stage 1 | G5: String 1 | H5: PD | I5: Stage 2 | J5: String 1 | K5: PD | L5: Stage 3 | M5: String 1 | N5: PD | O5: Stage 4 | P5: String 1 | Q5: PD | R5: Stage 5 | S5: String 1 | T5: PD | U5: Stage 6 | V5: String 1 | W5: String 2 | X5: String 3 | Y5: String 4 | Z5: PD
A6: 1 | B6: Lowe, John | C6: CDP-EX | D6: =+F6+I6+L6+O6+R6+U6 -> 153.87 | E6: =+H6+K6+N6+Q6+T6+Z6 -> 22 | F6: =+(G6)+0.5*H6 -> 28.23 | G6: 27.73 | H6: 1 | I6: =+(J6)+0.5*K6 -> 23.61 | J6: 23.61 | K6: 0 | L6: =+(M6)+0.5*N6 -> 28.51 | M6: 25.51 | N6: 6 | O6: =+(P6)+0.5*Q6 -> 22.26 | P6: 20.26 | Q6: 4 | R6: =+(S6)+0.5*T6 -> 27.43 | S6: 25.43 | T6: 4 | U6: =+(V6+W6+X6+Y6)+0.5*Z6 -> 23.83 | V6: 3.79 | W6: 3.25 | X6: 8.71 | Y6: 4.58 | Z6: 7
A7: 2 | B7: Collins, Ken | C7: SSP-EX | D7: =+F7+I7+L7+O7+R7+U7 -> 163.77 | E7: =+H7+K7+N7+Q7+T7+Z7 -> 27 | F7: =+(G7)+0.5*H7 -> 28.03 | G7: 25.53 | H7: 5 | I7: =+(J7)+0.5*K7 -> 23.66 | J7: 22.66 | K7: 2 | L7: =+(M7)+0.5*N7 -> 26.50 | M7: 23.50 | N7: 6 | O7: =+(P7)+0.5*Q7 -> 19.36 | P7: 19.36 | Q7: 0 | R7: =+(S7)+0.5*T7 -> 36.24 | S7: 35.24 | T7: 2 | U7: =+(V7+W7+X7+Y7)+0.5*Z7 -> 29.98 | V7: 4.97 | W7: 4.26 | X7: 9.17 | Y7: 5.58 | Z7: 12
A8: 3 | B8: Latham, Corey | C8: CDP-EX | D8: =+F8+I8+L8+O8+R8+U8 -> 168.23 | E8: =+H8+K8+N8+Q8+T8+Z8 -> 17 | F8: =+(G8)+0.5*H8 -> 27.35 | G8: 26.85 | H8: 1 | I8: =+(J8)+0.5*K8 -> 23.12 | J8: 23.12 | K8: 0 | L8: =+(M8)+0.5*N8 -> 37.60 | M8: 34.10 | N8: 7 | O8: =+(P8)+0.5*Q8 -> 23.04 | P8: 22.54 | Q8: 1 | R8: =+(S8)+0.5*T8 -> 30.20 | S8: 28.70 | T8: 3 | U8: =+(V8+W8+X8+Y8)+0.5*Z8 -> 26.92 | V8: 4.27 | W8: 4.42 | X8: 10.78 | Y8: 4.95 | Z8: 5
A9: 4 | B9: Ostler, Jeff | C9: ESP-UC | D9: =+F9+I9+L9+O9+R9+U9 -> 169.31 | E9: =+H9+K9+N9+Q9+T9+Z9 -> 48 | F9: =+(G9)+0.5*H9 -> 26.75 | G9: 26.25 | H9: 1 | I9: =+(J9)+0.5*K9 -> 27.05 | J9: 23.55 | K9: 7 | L9: =+(M9)+0.5*N9 -> 32.25 | M9: 23.25 | N9: 18 | O9: =+(P9)+0.5*Q9 -> 22.87 | P9: 20.87 | Q9: 4 | R9: =+(S9)+0.5*T9 -> 30.05 | S9: 28.55 | T9: 3 | U9: =+(V9+W9+X9+Y9)+0.5*Z9 -> 30.34 | V9: 3.70 | W9: 3.64 | X9: 9.58 | Y9: 5.92 | Z9: 15
A10: 5 | B10: Theodore, Ari | C10: CDP-EX | D10: =+F10+I10+L10+O10+R10+U10 -> 170.55 | E10: =+H10+K10+N10+Q10+T10+Z10 -> 35 | F10: =+(G10)+0.5*H10 -> 29.67 | G10: 24.67 | H10: 10 | I10: =+(J10)+0.5*K10 -> 30.08 | J10: 22.58 | K10: 15 | L10: =+(M10)+0.5*N10 -> 26.51 | M10: 26.01 | N10: 1 | O10: =+(P10)+0.5*Q10 -> 20.76 | P10: 19.76 | Q10: 2 | R10: =+(S10)+0.5*T10 -> 36.53 | S10: 36.53 | T10: 0 | U10: =+(V10+W10+X10+Y10)+0.5*Z10 -> 27.00 | V10: 3.78 | W10: 3.82 | X10: 10.05 | Y10: 5.85 | Z10: 7
A11: 6 | B11: Montgomery, Robert | C11: SSP-EX | D11: =+F11+I11+L11+O11+R11+U11 -> 186.02 | E11: =+H11+K11+N11+Q11+T11+Z11 -> 56 | F11: =+(G11)+0.5*H11 -> 28.15 | G11: 21.65 | H11: 13 | I11: =+(J11)+0.5*K11 -> 21.44 | J11: 20.44 | K11: 2 | L11: =+(M11)+0.5*N11 -> 35.79 | M11: 30.79 | N11: 10 | O11: =+(P11)+0.5*Q11 -> 26.83 | P11: 25.33 | Q11: 3 | R11: =+(S11)+0.5*T11 -> 36.06 | S11: 35.06 | T11: 2 | U11: =+(V11+W11+X11+Y11)+0.5*Z11 -> 37.75 | V11: 3.68 | W11: 4.78 | X11: 9.47 | Y11: 6.82 | Z11: 26
A12: 7 | B12: Outzen, Craig | C12: SSP-UC | D12: =+F12+I12+L12+O12+R12+U12 -> 186.60 | E12: =+H12+K12+N12+Q12+T12+Z12 -> 75 | F12: =+(G12)+0.5*H12 -> 33.23 | G12: 21.23 | H12: 24 | I12: =+(J12)+0.5*K12 -> 28.21 | J12: 23.71 | K12: 9 | L12: =+(M12)+0.5*N12 -> 30.78 | M12: 28.28 | N12: 5 | O12: =+(P12)+0.5*Q12 -> 25.36 | P12: 18.36 | Q12: 14 | R12: =+(S12)+0.5*T12 -> 38.92 | S12: 33.42 | T12: 11 | U12: =+(V12+W12+X12+Y12)+0.5*Z12 -> 30.10 | V12: 5.06 | W12: 4.09 | X12: 8.33 | Y12: 6.62 | Z12: 12
A13: 8 | B13: Mousley, Roger | C13: SSR-EX | D13: =+F13+I13+L13+O13+R13+U13 -> 188.57 | E13: =+H13+K13+N13+Q13+T13+Z13 -> 53 | F13: =+(G13)+0.5*H13 -> 27.61 | G13: 27.11 | H13: 1 | I13: =+(J13)+0.5*K13 -> 28.48 | J13: 28.48 | K13: 0 | L13: =+(M13)+0.5*N13 -> 30.97 | M13: 25.47 | N13: 11 | O13: =+(P13)+0.5*Q13 -> 33.98 | P13: 20.48 | Q13: 27 | R13: =+(S13)+0.5*T13 -> 36.52 | S13: 36.02 | T13: 1 | U13: =+(V13+W13+X13+Y13)+0.5*Z13 -> 31.01 | V13: 4.55 | W13: 4.15 | X13: 9.90 | Y13: 5.91 | Z13: 13
A14: 9 | B14: Johnson, Michael | C14: CDP-? | D14: =+F14+I14+L14+O14+R14+U14 -> 202.00 | E14: =+H14+K14+N14+Q14+T14+Z14 -> 56 | F14: =+(G14)+0.5*H14 -> 33.17 | G14: 32.17 | H14: 2 | I14: =+(J14)+0.5*K14 -> 35.45 | J14: 27.95 | K14: 15 | L14: =+(M14)+0.5*N14 -> 31.77 | M14: 27.27 | N14: 9 | O14: =+(P14)+0.5*Q14 -> 26.99 | P14: 18.99 | Q14: 16 | R14: =+(S14)+0.5*T14 -> 41.85 | S14: 39.35 | T14: 5 | U14: =+(V14+W14+X14+Y14)+0.5*Z14 -> 32.77 | V14: 6.02 | W14: 4.97 | X14: 11.32 | Y14: 5.96 | Z14: 9
A15: 10 | B15: Brownlee, Mike | C15: SSP-SS | D15: =+F15+I15+L15+O15+R15+U15 -> 208.01 | E15: =+H15+K15+N15+Q15+T15+Z15 -> 63 | F15: =+(G15)+0.5*H15 -> 35.70 | G15: 34.70 | H15: 2 | I15: =+(J15)+0.5*K15 -> 32.58 | J15: 26.58 | K15: 12 | L15: =+(M15)+0.5*N15 -> 32.63 | M15: 29.63 | N15: 6 | O15: =+(P15)+0.5*Q15 -> 31.55 | P15: 24.55 | Q15: 14 | R15: =+(S15)+0.5*T15 -> 40.24 | S15: 36.24 | T15: 8 | U15: =+(V15+W15+X15+Y15)+0.5*Z15 -> 35.31 | V15: 4.52 | W15: 4.56 | X15: 9.99 | Y15: 5.74 | Z15: 21
A16: 11 | B16: Redford, Red | C16: SSR-SS | D16: =+F16+I16+L16+O16+R16+U16 -> 208.92 | E16: =+H16+K16+N16+Q16+T16+Z16 -> 29 | F16: =+(G16)+0.5*H16 -> 24.89 | G16: 23.89 | H16: 2 | I16: =+(J16)+0.5*K16 -> 34.61 | J16: 33.11 | K16: 3 | L16: =+(M16)+0.5*N16 -> 37.92 | M16: 32.92 | N16: 10 | O16: =+(P16)+0.5*Q16 -> 25.01 | P16: 23.01 | Q16: 4 | R16: =+(S16)+0.5*T16 -> 55.22 | S16: 54.22 | T16: 2 | U16: =+(V16+W16+X16+Y16)+0.5*Z16 -> 31.27 | V16: 4.54 | W16: 5.12 | X16: 11.98 | Y16: 5.63 | Z16: 8
A17: 12 | B17: Redford, Red | C17: SSP-SS | D17: =+F17+I17+L17+O17+R17+U17 -> 209.38 | E17: =+H17+K17+N17+Q17+T17+Z17 -> 68 | F17: =+(G17)+0.5*H17 -> 42.80 | G17: 33.80 | H17: 18 | I17: =+(J17)+0.5*K17 -> 21.98 | J17: 21.48 | K17: 1 | L17: =+(M17)+0.5*N17 -> 32.80 | M17: 29.30 | N17: 7 | O17: =+(P17)+0.5*Q17 -> 34.13 | P17: 24.63 | Q17: 19 | R17: =+(S17)+0.5*T17 -> 45.06 | S17: 43.56 | T17: 3 | U17: =+(V17+W17+X17+Y17)+0.5*Z17 -> 32.61 | V17: 4.12 | W17: 4.31 | X17: 9.06 | Y17: 5.12 | Z17: 20
A18: 13 | B18: Stone, Scott | C18: ESP-MM | D18: =+F18+I18+L18+O18+R18+U18 -> 214.25 | E18: =+H18+K18+N18+Q18+T18+Z18 -> 115 | F18: =+(G18)+0.5*H18 -> 36.94 | G18: 28.44 | H18: 17 | I18: =+(J18)+0.5*K18 -> 30.21 | J18: 23.71 | K18: 13 | L18: =+(M18)+0.5*N18 -> 34.34 | M18: 31.34 | N18: 6 | O18: =+(P18)+0.5*Q18 -> 34.95 | P18: 17.95 | Q18: 34 | R18: =+(S18)+0.5*T18 -> 38.68 | S18: 31.18 | T18: 15 | U18: =+(V18+W18+X18+Y18)+0.5*Z18 -> 39.13 | V18: 3.78 | W18: 3.68 | X18: 10.44 | Y18: 6.23 | Z18: 30
A19: 14 | B19: Scott, Alan | C19: CDP-MM | D19: =+F19+I19+L19+O19+R19+U19 -> 215.40 | E19: =+H19+K19+N19+Q19+T19+Z19 -> 69 | F19: =+(G19)+0.5*H19 -> 35.50 | G19: 33.00 | H19: 5 | I19: =+(J19)+0.5*K19 -> 30.14 | J19: 26.64 | K19: 7 | L19: =+(M19)+0.5*N19 -> 38.57 | M19: 30.07 | N19: 17 | O19: =+(P19)+0.5*Q19 -> 28.21 | P19: 26.71 | Q19: 3 | R19: =+(S19)+0.5*T19 -> 42.35 | S19: 36.85 | T19: 11 | U19: =+(V19+W19+X19+Y19)+0.5*Z19 -> 40.63 | V19: 4.27 | W19: 5.15 | X19: 12.45 | Y19: 5.76 | Z19: 26
A20: 15 | B20: Simon, Clint | C20: SSP-UC | D20: =+F20+I20+L20+O20+R20+U20 -> 222.94 | E20: =+H20+K20+N20+Q20+T20+Z20 -> 91 | F20: =+(G20)+0.5*H20 -> 46.50 | G20: 32.00 | H20: 29 | I20: =+(J20)+0.5*K20 -> 29.97 | J20: 27.97 | K20: 4 | L20: =+(M20)+0.5*N20 -> 31.45 | M20: 27.95 | N20: 7 | O20: =+(P20)+0.5*Q20 -> 35.01 | P20: 25.01 | Q20: 20 | R20: =+(S20)+0.5*T20 -> 41.65 | S20: 34.65 | T20: 14 | U20: =+(V20+W20+X20+Y20)+0.5*Z20 -> 38.36 | V20: 5.29 | W20: 5.68 | X20: 12.75 | Y20: 6.14 | Z20: 17
A21: 16 | B21: Adams, Brent | C21: CDP-UC | D21: =+F21+I21+L21+O21+R21+U21 -> 226.07 | E21: =+H21+K21+N21+Q21+T21+Z21 -> 31 | F21: =+(G21)+0.5*H21 -> 33.45 | G21: 30.45 | H21: 6 | I21: =+(J21)+0.5*K21 -> 33.67 | J21: 31.17 | K21: 5 | L21: =+(M21)+0.5*N21 -> 36.25 | M21: 34.75 | N21: 3 | O21: =+(P21)+0.5*Q21 -> 41.25 | P21: 38.25 | Q21: 6 | R21: =+(S21)+0.5*T21 -> 48.51 | S21: 45.51 | T21: 6 | U21: =+(V21+W21+X21+Y21)+0.5*Z21 -> 32.94 | V21: 6.20 | W21: 6.39 | X21: 11.98 | Y21: 5.87 | Z21: 5
A22: 17 | B22: Heiner, Brett | C22: CDP-SS | D22: =+F22+I22+L22+O22+R22+U22 -> 233.14 | E22: =+H22+K22+N22+Q22+T22+Z22 -> 29 | F22: =+(G22)+0.5*H22 -> 37.77 | G22: 35.77 | H22: 4 | I22: =+(J22)+0.5*K22 -> 33.89 | J22: 33.39 | K22: 1 | L22: =+(M22)+0.5*N22 -> 38.25 | M22: 35.25 | N22: 6 | O22: =+(P22)+0.5*Q22 -> 30.25 | P22: 30.25 | Q22: 0 | R22: =+(S22)+0.5*T22 -> 47.34 | S22: 47.34 | T22: 0 | U22: =+(V22+W22+X22+Y22)+0.5*Z22 -> 45.64 | V22: 6.08 | W22: 5.91 | X22: 17.51 | Y22: 7.14 | Z22: 18
A23: 18 | B23: Brown, Keith | C23: CDP-SS | D23: =+F23+I23+L23+O23+R23+U23 -> 236.68 | E23: =+H23+K23+N23+Q23+T23+Z23 -> 22 | F23: =+(G23)+0.5*H23 -> 43.50 | G23: 42.50 | H23: 2 | I23: =+(J23)+0.5*K23 -> 33.80 | J23: 30.80 | K23: 6 | L23: =+(M23)+0.5*N23 -> 47.32 | M23: 45.82 | N23: 3 | O23: =+(P23)+0.5*Q23 -> 37.02 | P23: 31.52 | Q23: 11 | R23: =+(S23)+0.5*T23 -> 42.83 | S23: 42.83 | T23: 0 | U23: =+(V23+W23+X23+Y23)+0.5*Z23 -> 32.21 | V23: 6.51 | W23: 5.90 | X23: 13.90 | Y23: 5.90 | Z23: 0
A24: 19 | B24: Kirkham, Glade | C24: SSP-UC | D24: =+F24+I24+L24+O24+R24+U24 -> 249.16 | E24: =+H24+K24+N24+Q24+T24+Z24 -> 78 | F24: =+(G24)+0.5*H24 -> 42.77 | G24: 33.27 | H24: 19 | I24: =+(J24)+0.5*K24 -> 32.31 | J24: 27.31 | K24: 10 | L24: =+(M24)+0.5*N24 -> 43.01 | M24: 34.01 | N24: 18 | O24: =+(P24)+0.5*Q24 -> 42.15 | P24: 39.15 | Q24: 6 | R24: =+(S24)+0.5*T24 -> 42.11 | S24: 37.61 | T24: 9 | U24: =+(V24+W24+X24+Y24)+0.5*Z24 -> 46.81 | V24: 6.02 | W24: 6.09 | X24: 16.80 | Y24: 9.90 | Z24: 16
A25: 20 | B25: Scott, Michael | C25: CDP-MM | D25: =+F25+I25+L25+O25+R25+U25 -> 252.17 | E25: =+H25+K25+N25+Q25+T25+Z25 -> 58 | F25: =+(G25)+0.5*H25 -> 37.00 | G25: 36.00 | H25: 2 | I25: =+(J25)+0.5*K25 -> 36.68 | J25: 32.68 | K25: 8 | L25: =+(M25)+0.5*N25 -> 39.65 | M25: 35.15 | N25: 9 | O25: =+(P25)+0.5*Q25 -> 37.89 | P25: 33.89 | Q25: 8 | R25: =+(S25)+0.5*T25 -> 57.53 | S25: 55.03 | T25: 5 | U25: =+(V25+W25+X25+Y25)+0.5*Z25 -> 43.42 | V25: 4.67 | W25: 5.81 | X25: 13.39 | Y25: 6.55 | Z25: 26
A26: 21 | B26: Walker, Ron | C26: SSP-MM | D26: =+F26+I26+L26+O26+R26+U26 -> 253.93 | E26: =+H26+K26+N26+Q26+T26+Z26 -> 73 | F26: =+(G26)+0.5*H26 -> 43.05 | G26: 40.05 | H26: 6 | I26: =+(J26)+0.5*K26 -> 32.35 | J26: 30.35 | K26: 4 | L26: =+(M26)+0.5*N26 -> 45.48 | M26: 39.48 | N26: 12 | O26: =+(P26)+0.5*Q26 -> 33.60 | P26: 29.10 | Q26: 9 | R26: =+(S26)+0.5*T26 -> 49.07 | S26: 45.57 | T26: 7 | U26: =+(V26+W26+X26+Y26)+0.5*Z26 -> 50.38 | V26: 4.98 | W26: 4.44 | X26: 16.11 | Y26: 7.35 | Z26: 35
A27: 22 | B27: Simpson, Harold | C27: CDP-SS | D27: =+F27+I27+L27+O27+R27+U27 -> 260.42 | E27: =+H27+K27+N27+Q27+T27+Z27 -> 53 | F27: =+(G27)+0.5*H27 -> 44.75 | G27: 41.75 | H27: 6 | I27: =+(J27)+0.5*K27 -> 38.87 | J27: 37.37 | K27: 3 | L27: =+(M27)+0.5*N27 -> 47.34 | M27: 45.34 | N27: 4 | O27: =+(P27)+0.5*Q27 -> 38.09 | P27: 31.09 | Q27: 14 | R27: =+(S27)+0.5*T27 -> 54.28 | S27: 46.78 | T27: 15 | U27: =+(V27+W27+X27+Y27)+0.5*Z27 -> 37.09 | V27: 4.91 | W27: 5.58 | X27: 14.80 | Y27: 6.30 | Z27: 11
A28: 23 | B28: Gurr, Gene | C28: SSP-SS | D28: =+F28+I28+L28+O28+R28+U28 -> 261.68 | E28: =+H28+K28+N28+Q28+T28+Z28 -> 47 | F28: =+(G28)+0.5*H28 -> 79.08 | G28: 76.08 | H28: 6 | I28: =+(J28)+0.5*K28 -> 29.42 | J28: 27.92 | K28: 3 | L28: =+(M28)+0.5*N28 -> 35.93 | M28: 32.43 | N28: 7 | O28: =+(P28)+0.5*Q28 -> 26.48 | P28: 25.48 | Q28: 2 | R28: =+(S28)+0.5*T28 -> 49.44 | S28: 40.44 | T28: 18 | U28: =+(V28+W28+X28+Y28)+0.5*Z28 -> 41.33 | V28: 5.42 | W28: 5.07 | X28: 19.29 | Y28: 6.05 | Z28: 11
A29: 24 | B29: Hatch, Perri | C29: ESP-UC | D29: =+F29+I29+L29+O29+R29+U29 -> 264.57 | E29: =+H29+K29+N29+Q29+T29+Z29 -> 129 | F29: =+(G29)+0.5*H29 -> 49.46 | G29: 42.96 | H29: 13 | I29: =+(J29)+0.5*K29 -> 38.88 | J29: 31.38 | K29: 15 | L29: =+(M29)+0.5*N29 -> 37.11 | M29: 35.11 | N29: 4 | O29: =+(P29)+0.5*Q29 -> 54.84 | P29: 29.84 | Q29: 50 | R29: =+(S29)+0.5*T29 -> 51.72 | S29: 39.72 | T29: 24 | U29: =+(V29+W29+X29+Y29)+0.5*Z29 -> 32.56 | V29: 3.86 | W29: 3.44 | X29: 9.71 | Y29: 4.05 | Z29: 23
A30: 25 | B30: Scott, Sam | C30: SSP-MM | D30: =+F30+I30+L30+O30+R30+U30 -> 267.58 | E30: =+H30+K30+N30+Q30+T30+Z30 -> 89 | F30: =+(G30)+0.5*H30 -> 35.21 | G30: 33.21 | H30: 4 | I30: =+(J30)+0.5*K30 -> 41.59 | J30: 31.59 | K30: 20 | L30: =+(M30)+0.5*N30 -> 45.38 | M30: 42.38 | N30: 6 | O30: =+(P30)+0.5*Q30 -> 45.20 | P30: 30.20 | Q30: 30 | R30: =+(S30)+0.5*T30 -> 47.26 | S30: 43.76 | T30: 7 | U30: =+(V30+W30+X30+Y30)+0.5*Z30 -> 52.94 | V30: 5.76 | W30: 6.34 | X30: 16.64 | Y30: 13.20 | Z30: 22
A31: 26 | B31: Willis, Dave | C31: CDP-UC | D31: =+F31+I31+L31+O31+R31+U31 -> 287.86 | E31: =+H31+K31+N31+Q31+T31+Z31 -> 107 | F31: =+(G31)+0.5*H31 -> 49.63 | G31: 40.63 | H31: 18 | I31: =+(J31)+0.5*K31 -> 46.07 | J31: 42.57 | K31: 7 | L31: =+(M31)+0.5*N31 -> 60.43 | M31: 44.93 | N31: 31 | O31: =+(P31)+0.5*Q31 -> 39.38 | P31: 28.38 | Q31: 22 | R31: =+(S31)+0.5*T31 -> 45.76 | S31: 41.76 | T31: 8 | U31: =+(V31+W31+X31+Y31)+0.5*Z31 -> 46.59 | V31: 6.51 | W31: 6.38 | X31: 15.04 | Y31: 8.16 | Z31: 21
A32: 27 | B32: Brown, Mike | C32: SSP-UC | D32: =+F32+I32+L32+O32+R32+U32 -> 288.89 | E32: =+H32+K32+N32+Q32+T32+Z32 -> 164 | F32: =+(G32)+0.5*H32 -> 45.02 | G32: 37.02 | H32: 16 | I32: =+(J32)+0.5*K32 -> 37.77 | J32: 31.27 | K32: 13 | L32: =+(M32)+0.5*N32 -> 45.71 | M32: 35.21 | N32: 21 | O32: =+(P32)+0.5*Q32 -> 53.52 | P32: 33.02 | Q32: 41 | R32: =+(S32)+0.5*T32 -> 52.96 | S32: 34.46 | T32: 37 | U32: =+(V32+W32+X32+Y32)+0.5*Z32 -> 53.91 | V32: 5.32 | W32: 5.24 | X32: 15.83 | Y32: 9.52 | Z32: 36
A33: 28 | B33: Crawford, George | C33: CDP-MM | D33: =+F33+I33+L33+O33+R33+U33 -> 301.34 | E33: =+H33+K33+N33+Q33+T33+Z33 -> 62 | F33: =+(G33)+0.5*H33 -> 43.95 | G33: 42.45 | H33: 3 | I33: =+(J33)+0.5*K33 -> 39.45 | J33: 38.45 | K33: 2 | L33: =+(M33)+0.5*N33 -> 65.98 | M33: 52.48 | N33: 27 | O33: =+(P33)+0.5*Q33 -> 39.07 | P33: 38.57 | Q33: 1 | R33: =+(S33)+0.5*T33 -> 69.24 | S33: 59.74 | T33: 19 | U33: =+(V33+W33+X33+Y33)+0.5*Z33 -> 43.65 | V33: 7.27 | W33: 7.19 | X33: 16.43 | Y33: 7.76 | Z33: 10
A34: 29 | B34: Catallo, Tony | C34: SSP-UC | D34: =+F34+I34+L34+O34+R34+U34 -> 310.11 | E34: =+H34+K34+N34+Q34+T34+Z34 -> 91 | F34: =+(G34)+0.5*H34 -> 51.21 | G34: 49.21 | H34: 4 | I34: =+(J34)+0.5*K34 -> 47.56 | J34: 37.06 | K34: 21 | L34: =+(M34)+0.5*N34 -> 36.72 | M34: 31.72 | N34: 10 | O34: =+(P34)+0.5*Q34 -> 34.95 | P34: 26.95 | Q34: 16 | R34: =+(S34)+0.5*T34 -> 52.61 | S34: 43.11 | T34: 19 | U34: =+(V34+W34+X34+Y34)+0.5*Z34 -> 87.06 | V34: 19.20 | W34: 15.44 | X34: 28.31 | Y34: 13.61 | Z34: 21
A35: 30 | B35: Burns, Bill | C35: SSP-UC | D35: =+F35+I35+L35+O35+R35+U35 -> 326.83 | E35: =+H35+K35+N35+Q35+T35+Z35 -> 112 | F35: =+(G35)+0.5*H35 -> 59.43 | G35: 53.43 | H35: 12 | I35: =+(J35)+0.5*K35 -> 41.91 | J35: 36.41 | K35: 11 | L35: =+(M35)+0.5*N35 -> 52.67 | M35: 47.67 | N35: 10 | O35: =+(P35)+0.5*Q35 -> 47.78 | P35: 35.28 | Q35: 25 | R35: =+(S35)+0.5*T35 -> 70.03 | S35: 59.03 | T35: 22 | U35: =+(V35+W35+X35+Y35)+0.5*Z35 -> 55.01 | V35: 8.72 | W35: 5.57 | X35: 17.24 | Y35: 7.48 | Z35: 32
A36: 31 | B36: Lambke, Patrick | C36: SSP-UC | D36: =+F36+I36+L36+O36+R36+U36 -> 364.71 | E36: =+H36+K36+N36+Q36+T36+Z36 -> 150 | F36: =+(G36)+0.5*H36 -> 47.71 | G36: 39.21 | H36: 17 | I36: =+(J36)+0.5*K36 -> 51.34 | J36: 33.84 | K36: 35 | L36: =+(M36)+0.5*N36 -> 84.79 | M36: 63.29 | N36: 43 | O36: =+(P36)+0.5*Q36 -> 43.95 | P36: 32.95 | Q36: 22 | R36: =+(S36)+0.5*T36 -> 53.16 | S36: 53.16 | T36: 0 | U36: =+(V36+W36+X36+Y36)+0.5*Z36 -> 83.76 | V36: 9.66 | W36: 17.16 | X36: 30.34 | Y36: 10.10 | Z36: 33
A37: 32 | B37: Case, Morgan | C37: SSP-UC | D37: =+F37+I37+L37+O37+R37+U37 -> 392.29 | E37: =+H37+K37+N37+Q37+T37+Z37 -> 84 | F37: =+(G37)+0.5*H37 -> 67.70 | G37: 62.20 | H37: 11 | I37: =+(J37)+0.5*K37 -> 69.99 | J37: 66.99 | K37: 6 | L37: =+(M37)+0.5*N37 -> 78.34 | M37: 73.84 | N37: 9 | O37: =+(P37)+0.5*Q37 -> 56.82 | P37: 43.32 | Q37: 27 | R37: =+(S37)+0.5*T37 -> 50.26 | S37: 44.76 | T37: 11 | U37: =+(V37+W37+X37+Y37)+0.5*Z37 -> 69.18 | V37: 7.32 | W37: 6.34 | X37: 36.15 | Y37: 9.37 | Z37: 20
A38: 33 | B38: Wolfe, Kathy | C38: SSP-UC | D38: =+F38+I38+L38+O38+R38+U38 -> 428.27 | E38: =+H38+K38+N38+Q38+T38+Z38 -> 226 | F38: =+(G38)+0.5*H38 -> 67.40 | G38: 56.40 | H38: 22 | I38: =+(J38)+0.5*K38 -> 84.27 | J38: 63.27 | K38: 42 | L38: =+(M38)+0.5*N38 -> 59.52 | M38: 38.52 | N38: 42 | O38: =+(P38)+0.5*Q38 -> 52.86 | P38: 31.36 | Q38: 43 | R38: =+(S38)+0.5*T38 -> 78.39 | S38: 58.39 | T38: 40 | U38: =+(V38+W38+X38+Y38)+0.5*Z38 -> 85.83 | V38: 11.61 | W38: 15.96 | X38: 26.46 | Y38: 13.30 | Z38: 37
A39: 34 | B39: Burns, Susan | C39: ESP-UC | D39: =+F39+I39+L39+O39+R39+U39 -> 490.70 | E39: =+H39+K39+N39+Q39+T39+Z39 -> 94 | F39: =+(G39)+0.5*H39 -> 90.80 | G39: 88.80 | H39: 4 | I39: =+(J39)+0.5*K39 -> 71.23 | J39: 57.23 | K39: 28 | L39: =+(M39)+0.5*N39 -> 79.49 | M39: 70.99 | N39: 17 | O39: =+(P39)+0.5*Q39 -> 63.79 | P39: 55.29 | Q39: 17 | R39: =+(S39)+0.5*T39 -> 85.69 | S39: 81.69 | T39: 8 | U39: =+(V39+W39+X39+Y39)+0.5*Z39 -> 99.70 | V39: 11.43 | W39: 27.18 | X39: 31.64 | Y39: 19.45 | Z39: 20
A40: 35 | B40: Stone, Marylee | C40: SSP-UC | D40: DNF | E40: DNF | F40: DNF | I40: DNF | L40: DNF | O40: =+(P40)+0.5*Q40 -> 115.16 | P40: 86.66 | Q40: 57 | R40: =+(S40)+0.5*T40 -> 119.98 | S40: 92.98 | T40: 54 | U40: =+(V40+W40+X40+Y40)+0.5*Z40 -> 120.24 | V40: 10.52 | W40: 18.28 | X40: 30.84 | Y40: 17.60 | Z40: 86
A41: 36 | B41: Zaccardi, Pat | C41: SSP-SS | D41: DNF | E41: DNF | F41: =+(G41)+0.5*H41 -> 26.09 | G41: 24.09 | H41: 4 | I41: =+(J41)+0.5*K41 -> 23.53 | J41: 20.03 | K41: 7 | L41: =+(M41)+0.5*N41 -> 31.99 | M41: 22.99 | N41: 18 | O41: =+(P41)+0.5*Q41 -> 27.07 | P41: 19.57 | Q41: 15 | R41: =+(S41)+0.5*T41 -> 42.49 | S41: 37.49 | T41: 10 | U41: DNF
A42: 37 | B42: Allison, Peter | C42: CDP-UC | D42: NS | E42: =+H42+K42+N42+Q42+T42+Z42 -> 224 | F42: =+(G42)+0.5*H42 -> 71.43 | G42: 50.93 | H42: 41 | I42: =+(J42)+0.5*K42 -> 75.78 | J42: 54.28 | K42: 43 | L42: =+(M42)+0.5*N42 -> 84.97 | M42: 75.47 | N42: 19 | O42: NS | P42: NS | Q42: 34 | R42: =+(S42)+0.5*T42 -> 98.47 | S42: 81.97 | T42: 33 | U42: =+(V42+W42+X42+Y42)+0.5*Z42 -> 88.89 | V42: 11.59 | W42: 10.44 | X42: 28.23 | Y42: 11.63 | Z42: 54
A43: 26 | B43: Rodriquez, Mike | C43: CDP-MM | D43: DNF | E43: =+H43+K43+N43+Q43+T43+Z43 -> 0 | F43: =+(G43+#REF!)+0.5*H43 -> #REF! | I43: =+(J43)+0.5*K43 -> 0.00 | L43: =+(M43+#REF!)+0.5*N43 -> #REF! | O43: =+(P43+#REF!+#REF!)+0.5*Q43 -> #REF! | R43: =+(S43)+0.5*T43 -> 0.00 | U43: =+(V43+W43)+0.5*Z43 -> 0.00
A44: Notes:
A45: xx | B45: Indicates that the Points Down value includes some kind of penalty (Procedural Error, Hits on Non-Threat or Failure to Neutralize).
A46: PD | B46: = Points Down value is PD x .5 seconds added to the total stage time.
A47: xx | B47: Indicates that the Points Down value includes some kind of penalty (Procedural Error, Hits on Non-Threat or Failure to Neutralize).
A48: DNF | B48: = Did Not Finish
A49: NS | B49: = No Score
B50: Div/Class Information:
A51: - | B51: Division: CDP = Custom Defense Pistol; ESP = Enhanced Service Pistol; SSP = Stock Service Pistol; SSR = Stock Service Revolver
A52: - | B52: Classification: MA = Master; EX = Expert; SS = Sharpshooter; MM = Marksman; NV = Novice; UC = Unclassified
B53: .22-N/C = Shooter used a non IDPA firearm and was not placed in an IDPA Div/Class.