B2: UDPL Match Results for January 24, 2004 | L2: (Sorted by Overall Time without regard for Division or Classification.)
B3: Pistol Match - Note: This was NOT an IDPA match.
A4: Place | B4: Name | C4: *DIV | D4: Shoot Total | E4: Total PD | F4: Stage 1 | G4: String 1 | H4: String 2 | I4: String 3 | J4: PD | K4: Stage 2 | L4: String 1 | M4: PD | N4: Stage 3 | O4: String 1 | P4: String 2 | Q4: PD | R4: Stage 4 | S4: String 1 | T4: String 2 | U4: PD | V4: Stage 5 | W4: String 1 | X4: String 2 | Y4: String 3 | Z4: String 4 | AA4: PD | AB4: Stage 6 | AC4: String 1 | AD4: String 2 | AE4: PD
A5: 1 | B5: Terry, Blain | C5: REVOP | D5: =+F5+K5+N5+R5+V5+AB5 -> 162.31 | E5: =+J5+M5+Q5+U5+AA5+AE5 -> 45 | F5: =+(G5+H5+I5)+0.5*J5 -> 26.96 | G5: 6.49 | H5: 4.27 | I5: 5.70 | J5: 21 | K5: =+(L5)+0.5*M5 -> 21.25 | L5: 19.25 | M5: 4 | N5: =+(O5+P5)+0.5*Q5 -> 25.13 | O5: 13.16 | P5: 11.47 | Q5: 1 | R5: =+(S5+T5)+0.5*U5 -> 37.09 | S5: 19.30 | T5: 17.79 | U5: 0 | V5: =+(W5+X5+Y5+Z5)+0.5*AA5 -> 25.24 | W5: 2.85 | X5: 3.21 | Y5: 7.95 | Z5: 4.23 | AA5: 14 | AB5: =+(AC5+AD5)+0.5*AE5 -> 26.64 | AC5: 12.02 | AD5: 12.12 | AE5: 5
A6: 2 | B6: Terry, Blain | C6: TRM | D6: =+F6+K6+N6+R6+V6+AB6 -> 164.17 | E6: =+J6+M6+Q6+U6+AA6+AE6 -> 66 | F6: =+(G6+H6+I6)+0.5*J6 -> 19.62 | G6: 6.82 | H6: 3.23 | I6: 5.07 | J6: 9 | K6: =+(L6)+0.5*M6 -> 22.02 | L6: 16.52 | M6: 11 | N6: =+(O6+P6)+0.5*Q6 -> 37.92 | O6: 12.77 | P6: 12.15 | Q6: 26 | R6: =+(S6+T6)+0.5*U6 -> 36.20 | S6: 18.28 | T6: 15.42 | U6: 5 | V6: =+(W6+X6+Y6+Z6)+0.5*AA6 -> 26.70 | W6: 3.30 | X6: 3.11 | Y6: 11.41 | Z6: 3.88 | AA6: 10 | AB6: =+(AC6+AD6)+0.5*AE6 -> 21.71 | AC6: 10.83 | AD6: 8.38 | AE6: 5
A7: 3 | B7: Theodore, Ari | C7: TRM | D7: =+F7+K7+N7+R7+V7+AB7 -> 179.06 | E7: =+J7+M7+Q7+U7+AA7+AE7 -> 21 | F7: =+(G7+H7+I7)+0.5*J7 -> 25.93 | G7: 10.84 | H7: 5.95 | I7: 6.14 | J7: 6 | K7: =+(L7)+0.5*M7 -> 24.19 | L7: 23.69 | M7: 1 | N7: =+(O7+P7)+0.5*Q7 -> 35.94 | O7: 17.67 | P7: 17.27 | Q7: 2 | R7: =+(S7+T7)+0.5*U7 -> 38.70 | S7: 17.68 | T7: 18.02 | U7: 6 | V7: =+(W7+X7+Y7+Z7)+0.5*AA7 -> 26.95 | W7: 4.19 | X7: 4.57 | Y7: 9.99 | Z7: 6.20 | AA7: 4 | AB7: =+(AC7+AD7)+0.5*AE7 -> 27.35 | AC7: 11.14 | AD7: 15.21 | AE7: 2
A8: 4 | B8: Mousley, Roger | C8: REV | D8: =+F8+K8+N8+R8+V8+AB8 -> 185.75 | E8: =+J8+M8+Q8+U8+AA8+AE8 -> 31 | F8: =+(G8+H8+I8)+0.5*J8 -> 28.68 | G8: 8.23 | H8: 5.75 | I8: 5.70 | J8: 18 | K8: =+(L8)+0.5*M8 -> 23.52 | L8: 22.52 | M8: 2 | N8: =+(O8+P8)+0.5*Q8 -> 36.33 | O8: 17.47 | P8: 18.86 | Q8: 0 | R8: =+(S8+T8)+0.5*U8 -> 45.29 | S8: 21.89 | T8: 22.90 | U8: 1 | V8: =+(W8+X8+Y8+Z8)+0.5*AA8 -> 25.78 | W8: 3.83 | X8: 3.73 | Y8: 8.47 | Z8: 5.25 | AA8: 9 | AB8: =+(AC8+AD8)+0.5*AE8 -> 26.15 | AC8: 11.79 | AD8: 13.86 | AE8: 1
A9: 5 | B9: Zaccardi, Pat | C9: TRM | D9: =+F9+K9+N9+R9+V9+AB9 -> 200.03 | E9: =+J9+M9+Q9+U9+AA9+AE9 -> 54 | F9: =+(G9+H9+I9)+0.5*J9 -> 24.90 | G9: 7.73 | H9: 6.26 | I9: 7.41 | J9: 7 | K9: =+(L9)+0.5*M9 -> 29.82 | L9: 26.32 | M9: 7 | N9: =+(O9+P9)+0.5*Q9 -> 42.16 | O9: 18.11 | P9: 17.55 | Q9: 13 | R9: =+(S9+T9)+0.5*U9 -> 38.81 | S9: 19.41 | T9: 18.40 | U9: 2 | V9: =+(W9+X9+Y9+Z9)+0.5*AA9 -> 27.35 | W9: 3.92 | X9: 3.04 | Y9: 8.33 | Z9: 6.06 | AA9: 12 | AB9: =+(AC9+AD9)+0.5*AE9 -> 36.99 | AC9: 12.61 | AD9: 17.88 | AE9: 13
A10: 6 | B10: Terry, Dale | C10: REVOP | D10: =+F10+K10+N10+R10+V10+AB10 -> 200.50 | E10: =+J10+M10+Q10+U10+AA10+AE10 -> 73 | F10: =+(G10+H10+I10)+0.5*J10 -> 29.44 | G10: 8.24 | H10: 5.74 | I10: 5.46 | J10: 20 | K10: =+(L10)+0.5*M10 -> 26.15 | L10: 25.15 | M10: 2 | N10: =+(O10+P10)+0.5*Q10 -> 30.22 | O10: 15.55 | P10: 13.67 | Q10: 2 | R10: =+(S10+T10)+0.5*U10 -> 49.40 | S10: 22.02 | T10: 22.88 | U10: 9 | V10: =+(W10+X10+Y10+Z10)+0.5*AA10 -> 30.67 | W10: 3.62 | X10: 4.01 | Y10: 8.74 | Z10: 3.80 | AA10: 21 | AB10: =+(AC10+AD10)+0.5*AE10 -> 34.62 | AC10: 10.27 | AD10: 14.85 | AE10: 19
A11: 7 | B11: Collins, Ken | C11: TRM | D11: =+F11+K11+N11+R11+V11+AB11 -> 201.85 | E11: =+J11+M11+Q11+U11+AA11+AE11 -> 28 | F11: =+(G11+H11+I11)+0.5*J11 -> 23.78 | G11: 7.33 | H11: 4.87 | I11: 5.08 | J11: 13 | K11: =+(L11)+0.5*M11 -> 27.49 | L11: 25.49 | M11: 4 | N11: =+(O11+P11)+0.5*Q11 -> 40.29 | O11: 23.11 | P11: 16.68 | Q11: 1 | R11: =+(S11+T11)+0.5*U11 -> 39.58 | S11: 18.48 | T11: 20.10 | U11: 2 | V11: =+(W11+X11+Y11+Z11)+0.5*AA11 -> 29.86 | W11: 4.08 | X11: 4.78 | Y11: 14.92 | Z11: 4.58 | AA11: 3 | AB11: =+(AC11+AD11)+0.5*AE11 -> 40.85 | AC11: 17.87 | AD11: 20.48 | AE11: 5
A12: 8 | B12: Lowew, John | C12: TRM | D12: =+F12+K12+N12+R12+V12+AB12 -> 203.17 | E12: =+J12+M12+Q12+U12+AA12+AE12 -> 68 | F12: =+(G12+H12+I12)+0.5*J12 -> 30.29 | G12: 8.45 | H12: 7.50 | I12: 7.34 | J12: 14 | K12: =+(L12)+0.5*M12 -> 25.57 | L12: 25.57 | M12: 0 | N12: =+(O12+P12)+0.5*Q12 -> 46.82 | O12: 19.77 | P12: 16.05 | Q12: 22 | R12: =+(S12+T12)+0.5*U12 -> 48.83 | S12: 17.33 | T12: 21.00 | U12: 21 | V12: =+(W12+X12+Y12+Z12)+0.5*AA12 -> 22.82 | W12: 3.69 | X12: 3.22 | Y12: 10.00 | Z12: 4.41 | AA12: 3 | AB12: =+(AC12+AD12)+0.5*AE12 -> 28.84 | AC12: 11.18 | AD12: 13.66 | AE12: 8
A13: 9 | B13: Beck, Dave | C13: TRM | D13: =+F13+K13+N13+R13+V13+AB13 -> 214.29 | E13: =+J13+M13+Q13+U13+AA13+AE13 -> 75 | F13: =+(G13+H13+I13)+0.5*J13 -> 27.99 | G13: 9.31 | H13: 5.01 | I13: 7.17 | J13: 13 | K13: =+(L13)+0.5*M13 -> 24.85 | L13: 22.85 | M13: 4 | N13: =+(O13+P13)+0.5*Q13 -> 47.14 | O13: 21.26 | P13: 18.38 | Q13: 15 | R13: =+(S13+T13)+0.5*U13 -> 44.88 | S13: 19.12 | T13: 21.76 | U13: 8 | V13: =+(W13+X13+Y13+Z13)+0.5*AA13 -> 30.28 | W13: 3.84 | X13: 3.74 | Y13: 8.96 | Z13: 5.24 | AA13: 17 | AB13: =+(AC13+AD13)+0.5*AE13 -> 39.15 | AC13: 11.87 | AD13: 18.28 | AE13: 18
A14: 10 | B14: Wheeler, Egan | C14: TRM | D14: =+F14+K14+N14+R14+V14+AB14 -> 216.87 | E14: =+J14+M14+Q14+U14+AA14+AE14 -> 80 | F14: =+(G14+H14+I14)+0.5*J14 -> 31.05 | G14: 10.35 | H14: 7.59 | I14: 7.11 | J14: 12 | K14: =+(L14)+0.5*M14 -> 27.62 | L14: 24.12 | M14: 7 | N14: =+(O14+P14)+0.5*Q14 -> 40.80 | O14: 21.24 | P14: 17.06 | Q14: 5 | R14: =+(S14+T14)+0.5*U14 -> 49.34 | S14: 21.34 | T14: 20.00 | U14: 16 | V14: =+(W14+X14+Y14+Z14)+0.5*AA14 -> 32.16 | W14: 4.38 | X14: 3.71 | Y14: 8.74 | Z14: 5.33 | AA14: 20 | AB14: =+(AC14+AD14)+0.5*AE14 -> 35.90 | AC14: 12.87 | AD14: 13.03 | AE14: 20
A15: 11 | B15: Zaccardi, Juke | C15: TRM | D15: =+F15+K15+N15+R15+V15+AB15 -> 217.34 | E15: =+J15+M15+Q15+U15+AA15+AE15 -> 73 | F15: =+(G15+H15+I15)+0.5*J15 -> 31.57 | G15: 9.85 | H15: 6.07 | I15: 10.65 | J15: 10 | K15: =+(L15)+0.5*M15 -> 26.06 | L15: 18.06 | M15: 16 | N15: =+(O15+P15)+0.5*Q15 -> 42.47 | O15: 16.51 | P15: 18.46 | Q15: 15 | R15: =+(S15+T15)+0.5*U15 -> 46.42 | S15: 21.28 | T15: 22.64 | U15: 5 | V15: =+(W15+X15+Y15+Z15)+0.5*AA15 -> 38.42 | W15: 4.28 | X15: 5.04 | Y15: 10.50 | Z15: 9.10 | AA15: 19 | AB15: =+(AC15+AD15)+0.5*AE15 -> 32.40 | AC15: 11.59 | AD15: 16.81 | AE15: 8
A16: 12 | B16: Spicer, Robert | C16: TRM | D16: =+F16+K16+N16+R16+V16+AB16 -> 220.00 | E16: =+J16+M16+Q16+U16+AA16+AE16 -> 110 | F16: =+(G16+H16+I16)+0.5*J16 -> 31.88 | G16: 8.19 | H16: 5.68 | I16: 6.01 | J16: 24 | K16: =+(L16)+0.5*M16 -> 29.21 | L16: 25.71 | M16: 7 | N16: =+(O16+P16)+0.5*Q16 -> 45.01 | O16: 20.83 | P16: 17.68 | Q16: 13 | R16: =+(S16+T16)+0.5*U16 -> 49.86 | S16: 18.57 | T16: 18.29 | U16: 26 | V16: =+(W16+X16+Y16+Z16)+0.5*AA16 -> 33.25 | W16: 2.87 | X16: 2.96 | Y16: 8.98 | Z16: 4.44 | AA16: 28 | AB16: =+(AC16+AD16)+0.5*AE16 -> 30.79 | AC16: 12.86 | AD16: 11.93 | AE16: 12
A17: 13 | B17: Spicer, Richard | C17: TRM | D17: =+F17+K17+N17+R17+V17+AB17 -> 220.11 | E17: =+J17+M17+Q17+U17+AA17+AE17 -> 87 | F17: =+(G17+H17+I17)+0.5*J17 -> 25.35 | G17: 7.20 | H17: 6.01 | I17: 6.64 | J17: 11 | K17: =+(L17)+0.5*M17 -> 32.51 | L17: 29.51 | M17: 6 | N17: =+(O17+P17)+0.5*Q17 -> 48.27 | O17: 19.63 | P17: 19.14 | Q17: 19 | R17: =+(S17+T17)+0.5*U17 -> 54.26 | S17: 20.33 | T17: 23.43 | U17: 21 | V17: =+(W17+X17+Y17+Z17)+0.5*AA17 -> 26.50 | W17: 3.77 | X17: 2.72 | Y17: 8.90 | Z17: 4.61 | AA17: 13 | AB17: =+(AC17+AD17)+0.5*AE17 -> 33.22 | AC17: 12.00 | AD17: 12.72 | AE17: 17
A18: 14 | B18: Russell, Ryan | C18: TRM | D18: =+F18+K18+N18+R18+V18+AB18 -> 225.65 | E18: =+J18+M18+Q18+U18+AA18+AE18 -> 100 | F18: =+(G18+H18+I18)+0.5*J18 -> 28.25 | G18: 10.91 | H18: 4.32 | I18: 5.02 | J18: 16 | K18: =+(L18)+0.5*M18 -> 26.86 | L18: 25.86 | M18: 2 | N18: =+(O18+P18)+0.5*Q18 -> 41.66 | O18: 18.33 | P18: 15.33 | Q18: 16 | R18: =+(S18+T18)+0.5*U18 -> 57.75 | S18: 22.38 | T18: 19.87 | U18: 31 | V18: =+(W18+X18+Y18+Z18)+0.5*AA18 -> 38.97 | W18: 4.92 | X18: 4.80 | Y18: 11.77 | Z18: 5.48 | AA18: 24 | AB18: =+(AC18+AD18)+0.5*AE18 -> 32.16 | AC18: 12.38 | AD18: 14.28 | AE18: 11
A19: 15 | B19: Montgomery, Robert | C19: TRM | D19: =+F19+K19+N19+R19+V19+AB19 -> 226.97 | E19: =+J19+M19+Q19+U19+AA19+AE19 -> 81 | F19: =+(G19+H19+I19)+0.5*J19 -> 33.58 | G19: 8.48 | H19: 5.30 | I19: 12.30 | J19: 15 | K19: =+(L19)+0.5*M19 -> 32.09 | L19: 26.59 | M19: 11 | N19: =+(O19+P19)+0.5*Q19 -> 46.87 | O19: 20.23 | P19: 19.64 | Q19: 14 | R19: =+(S19+T19)+0.5*U19 -> 52.70 | S19: 21.67 | T19: 24.53 | U19: 13 | V19: =+(W19+X19+Y19+Z19)+0.5*AA19 -> 29.60 | W19: 3.49 | X19: 4.17 | Y19: 9.83 | Z19: 5.61 | AA19: 13 | AB19: =+(AC19+AD19)+0.5*AE19 -> 32.13 | AC19: 12.09 | AD19: 12.54 | AE19: 15
A20: 16 | B20: Rodriquez, Mike | C20: TRM | D20: =+F20+K20+N20+R20+V20+AB20 -> 227.05 | E20: =+J20+M20+Q20+U20+AA20+AE20 -> 69 | F20: =+(G20+H20+I20)+0.5*J20 -> 28.29 | G20: 10.75 | H20: 5.39 | I20: 5.65 | J20: 13 | K20: =+(L20)+0.5*M20 -> 27.29 | L20: 24.29 | M20: 6 | N20: =+(O20+P20)+0.5*Q20 -> 47.29 | O20: 23.75 | P20: 18.54 | Q20: 10 | R20: =+(S20+T20)+0.5*U20 -> 49.21 | S20: 21.11 | T20: 24.60 | U20: 7 | V20: =+(W20+X20+Y20+Z20)+0.5*AA20 -> 39.51 | W20: 4.03 | X20: 4.05 | Y20: 17.56 | Z20: 5.87 | AA20: 16 | AB20: =+(AC20+AD20)+0.5*AE20 -> 35.46 | AC20: 12.16 | AD20: 14.80 | AE20: 17
A21: 17 | B21: Huff, Blake | C21: REV | D21: =+F21+K21+N21+R21+V21+AB21 -> 228.33 | E21: =+J21+M21+Q21+U21+AA21+AE21 -> 28 | F21: =+(G21+H21+I21)+0.5*J21 -> 29.48 | G21: 9.08 | H21: 8.11 | I21: 10.29 | J21: 4 | K21: =+(L21)+0.5*M21 -> 26.75 | L21: 26.25 | M21: 1 | N21: =+(O21+P21)+0.5*Q21 -> 55.07 | O21: 27.03 | P21: 22.54 | Q21: 11 | R21: =+(S21+T21)+0.5*U21 -> 60.50 | S21: 34.15 | T21: 26.35 | U21: 0 | V21: =+(W21+X21+Y21+Z21)+0.5*AA21 -> 28.30 | W21: 4.37 | X21: 4.97 | Y21: 10.46 | Z21: 5.50 | AA21: 6 | AB21: =+(AC21+AD21)+0.5*AE21 -> 28.23 | AC21: 12.68 | AD21: 12.55 | AE21: 6
A22: 18 | B22: Brownlee, Mike | C22: HiCAP | D22: =+F22+K22+N22+R22+V22+AB22 -> 246.38 | E22: =+J22+M22+Q22+U22+AA22+AE22 -> 119 | F22: =+(G22+H22+I22)+0.5*J22 -> 33.62 | G22: 10.40 | H22: 5.54 | I22: 8.68 | J22: 18 | K22: =+(L22)+0.5*M22 -> 29.89 | L22: 23.89 | M22: 12 | N22: =+(O22+P22)+0.5*Q22 -> 57.63 | O22: 20.77 | P22: 18.36 | Q22: 37 | R22: =+(S22+T22)+0.5*U22 -> 52.81 | S22: 23.76 | T22: 25.55 | U22: 7 | V22: =+(W22+X22+Y22+Z22)+0.5*AA22 -> 38.54 | W22: 3.85 | X22: 4.56 | Y22: 10.56 | Z22: 5.07 | AA22: 29 | AB22: =+(AC22+AD22)+0.5*AE22 -> 33.89 | AC22: 12.07 | AD22: 13.82 | AE22: 16
A23: 19 | B23: Outzen, Craig | C23: TRM | D23: =+F23+K23+N23+R23+V23+AB23 -> 250.12 | E23: =+J23+M23+Q23+U23+AA23+AE23 -> 122 | F23: =+(G23+H23+I23)+0.5*J23 -> 39.76 | G23: 13.28 | H23: 6.09 | I23: 8.39 | J23: 24 | K23: =+(L23)+0.5*M23 -> 27.18 | L23: 22.68 | M23: 9 | N23: =+(O23+P23)+0.5*Q23 -> 60.54 | O23: 19.87 | P23: 17.67 | Q23: 46 | R23: =+(S23+T23)+0.5*U23 -> 56.76 | S23: 22.67 | T23: 22.59 | U23: 23 | V23: =+(W23+X23+Y23+Z23)+0.5*AA23 -> 35.65 | W23: 5.64 | X23: 4.80 | Y23: 12.70 | Z23: 6.01 | AA23: 13 | AB23: =+(AC23+AD23)+0.5*AE23 -> 30.23 | AC23: 12.94 | AD23: 13.79 | AE23: 7
A24: 20 | B24: Boyer, Steve | C24: HiCAP | D24: =+F24+K24+N24+R24+V24+AB24 -> 251.05 | E24: =+J24+M24+Q24+U24+AA24+AE24 -> 71 | F24: =+(G24+H24+I24)+0.5*J24 -> 31.74 | G24: 11.06 | H24: 5.92 | I24: 5.26 | J24: 19 | K24: =+(L24)+0.5*M24 -> 41.23 | L24: 35.73 | M24: 11 | N24: =+(O24+P24)+0.5*Q24 -> 49.08 | O24: 24.61 | P24: 17.97 | Q24: 13 | R24: =+(S24+T24)+0.5*U24 -> 58.14 | S24: 24.72 | T24: 26.92 | U24: 13 | V24: =+(W24+X24+Y24+Z24)+0.5*AA24 -> 37.32 | W24: 5.82 | X24: 6.08 | Y24: 15.38 | Z24: 6.54 | AA24: 7 | AB24: =+(AC24+AD24)+0.5*AE24 -> 33.54 | AC24: 14.79 | AD24: 14.75 | AE24: 8
A25: 21 | B25: Brown, Keith | C25: TRM | D25: =+F25+K25+N25+R25+V25+AB25 -> 251.50 | E25: =+J25+M25+Q25+U25+AA25+AE25 -> 66 | F25: =+(G25+H25+I25)+0.5*J25 -> 31.02 | G25: 12.41 | H25: 7.03 | I25: 6.58 | J25: 10 | K25: =+(L25)+0.5*M25 -> 33.75 | L25: 33.75 | M25: 0 | N25: =+(O25+P25)+0.5*Q25 -> 60.59 | O25: 31.33 | P25: 18.26 | Q25: 22 | R25: =+(S25+T25)+0.5*U25 -> 58.75 | S25: 28.60 | T25: 29.15 | U25: 2 | V25: =+(W25+X25+Y25+Z25)+0.5*AA25 -> 35.77 | W25: 4.88 | X25: 4.60 | Y25: 10.59 | Z25: 6.20 | AA25: 19 | AB25: =+(AC25+AD25)+0.5*AE25 -> 31.62 | AC25: 12.77 | AD25: 12.35 | AE25: 13
A26: 22 | B26: Scott, Alan | C26: TRM | D26: =+F26+K26+N26+R26+V26+AB26 -> 257.50 | E26: =+J26+M26+Q26+U26+AA26+AE26 -> 76 | F26: =+(G26+H26+I26)+0.5*J26 -> 31.99 | G26: 12.34 | H26: 6.63 | I26: 7.52 | J26: 11 | K26: =+(L26)+0.5*M26 -> 29.64 | L26: 27.64 | M26: 4 | N26: =+(O26+P26)+0.5*Q26 -> 51.16 | O26: 21.26 | P26: 20.40 | Q26: 19 | R26: =+(S26+T26)+0.5*U26 -> 82.80 | S26: 41.37 | T26: 29.43 | U26: 24 | V26: =+(W26+X26+Y26+Z26)+0.5*AA26 -> 33.98 | W26: 4.81 | X26: 5.24 | Y26: 12.69 | Z26: 5.74 | AA26: 11 | AB26: =+(AC26+AD26)+0.5*AE26 -> 27.93 | AC26: 11.79 | AD26: 12.64 | AE26: 7
A27: 23 | B27: Eddy, Nephi | C27: TRM | D27: =+F27+K27+N27+R27+V27+AB27 -> 268.58 | E27: =+J27+M27+Q27+U27+AA27+AE27 -> 70 | F27: =+(G27+H27+I27)+0.5*J27 -> 39.17 | G27: 17.49 | H27: 7.77 | I27: 5.91 | J27: 16 | K27: =+(L27)+0.5*M27 -> 35.42 | L27: 26.92 | M27: 17 | N27: =+(O27+P27)+0.5*Q27 -> 70.50 | O27: 28.61 | P27: 32.89 | Q27: 18 | R27: =+(S27+T27)+0.5*U27 -> 58.51 | S27: 31.42 | T27: 25.59 | U27: 3 | V27: =+(W27+X27+Y27+Z27)+0.5*AA27 -> 34.62 | W27: 5.65 | X27: 4.72 | Y27: 13.07 | Z27: 5.68 | AA27: 11 | AB27: =+(AC27+AD27)+0.5*AE27 -> 30.36 | AC27: 13.71 | AD27: 14.15 | AE27: 5
A28: 24 | B28: Simpson, Harold | C28: TRM | D28: =+F28+K28+N28+R28+V28+AB28 -> 270.14 | E28: =+J28+M28+Q28+U28+AA28+AE28 -> 35 | F28: =+(G28+H28+I28)+0.5*J28 -> 39.55 | G28: 15.29 | H28: 9.72 | I28: 6.54 | J28: 16 | K28: =+(L28)+0.5*M28 -> 45.27 | L28: 45.27 | M28: 0 | N28: =+(O28+P28)+0.5*Q28 -> 46.70 | O28: 24.96 | P28: 19.24 | Q28: 5 | R28: =+(S28+T28)+0.5*U28 -> 71.47 | S28: 34.11 | T28: 36.36 | U28: 2 | V28: =+(W28+X28+Y28+Z28)+0.5*AA28 -> 36.81 | W28: 5.93 | X28: 5.22 | Y28: 13.86 | Z28: 6.80 | AA28: 10 | AB28: =+(AC28+AD28)+0.5*AE28 -> 30.34 | AC28: 14.17 | AD28: 15.17 | AE28: 2
A29: 25 | B29: Scott, Sam | C29: TRM | D29: =+F29+K29+N29+R29+V29+AB29 -> 277.00 | E29: =+J29+M29+Q29+U29+AA29+AE29 -> 109 | F29: =+(G29+H29+I29)+0.5*J29 -> 39.65 | G29: 14.47 | H29: 9.10 | I29: 7.08 | J29: 18 | K29: =+(L29)+0.5*M29 -> 35.39 | L29: 33.39 | M29: 4 | N29: =+(O29+P29)+0.5*Q29 -> 54.56 | O29: 27.85 | P29: 17.21 | Q29: 19 | R29: =+(S29+T29)+0.5*U29 -> 55.58 | S29: 24.18 | T29: 24.90 | U29: 13 | V29: =+(W29+X29+Y29+Z29)+0.5*AA29 -> 49.11 | W29: 5.64 | X29: 5.44 | Y29: 17.10 | Z29: 7.93 | AA29: 26 | AB29: =+(AC29+AD29)+0.5*AE29 -> 42.71 | AC29: 14.89 | AD29: 13.32 | AE29: 29
A30: 26 | B30: Bray, Matt | C30: OPEN | D30: =+F30+K30+N30+R30+V30+AB30 -> 284.99 | E30: =+J30+M30+Q30+U30+AA30+AE30 -> 128 | F30: =+(G30+H30+I30)+0.5*J30 -> 35.88 | G30: 15.27 | H30: 4.62 | I30: 5.99 | J30: 20 | K30: =+(L30)+0.5*M30 -> 36.55 | L30: 26.55 | M30: 20 | N30: =+(O30+P30)+0.5*Q30 -> 56.09 | O30: 23.82 | P30: 17.77 | Q30: 29 | R30: =+(S30+T30)+0.5*U30 -> 82.92 | S30: 29.73 | T30: 37.69 | U30: 31 | V30: =+(W30+X30+Y30+Z30)+0.5*AA30 -> 41.44 | W30: 3.98 | X30: 5.96 | Y30: 17.09 | Z30: 5.41 | AA30: 18 | AB30: =+(AC30+AD30)+0.5*AE30 -> 32.11 | AC30: 14.98 | AD30: 12.13 | AE30: 10
A31: 27 | B31: Kirkham, Glade | C31: TRM | D31: =+F31+K31+N31+R31+V31+AB31 -> 294.40 | E31: =+J31+M31+Q31+U31+AA31+AE31 -> 83 | F31: =+(G31+H31+I31)+0.5*J31 -> 46.61 | G31: 11.64 | H31: 5.87 | I31: 6.10 | J31: =8+10+9+10+9 -> 46 | K31: =+(L31)+0.5*M31 -> 38.06 | L31: 36.06 | M31: 4 | N31: =+(O31+P31)+0.5*Q31 -> 55.22 | O31: 30.23 | P31: 21.99 | Q31: 6 | R31: =+(S31+T31)+0.5*U31 -> 64.13 | S31: 28.34 | T31: 30.79 | U31: 10 | V31: =+(W31+X31+Y31+Z31)+0.5*AA31 -> 32.70 | W31: 5.02 | X31: 4.04 | Y31: 19.11 | Z31: 4.53 | AA31: 0 | AB31: =+(AC31+AD31)+0.5*AE31 -> 57.68 | AC31: 17.98 | AD31: 31.20 | AE31: 17
A32: 28 | B32: Barney, Randy | C32: TRM | D32: =+F32+K32+N32+R32+V32+AB32 -> 303.38 | E32: =+J32+M32+Q32+U32+AA32+AE32 -> 129 | F32: =+(G32+H32+I32)+0.5*J32 -> 35.74 | G32: 15.43 | H32: 5.86 | I32: 6.95 | J32: 15 | K32: =+(L32)+0.5*M32 -> 35.56 | L32: 30.56 | M32: 10 | N32: =+(O32+P32)+0.5*Q32 -> 56.04 | O32: 24.38 | P32: 17.66 | Q32: 28 | R32: =+(S32+T32)+0.5*U32 -> 82.08 | S32: 33.04 | T32: 33.04 | U32: 32 | V32: =+(W32+X32+Y32+Z32)+0.5*AA32 -> 50.28 | W32: 5.21 | X32: 5.11 | Y32: 19.88 | Z32: 6.08 | AA32: 28 | AB32: =+(AC32+AD32)+0.5*AE32 -> 43.68 | AC32: 15.47 | AD32: 20.21 | AE32: 16
A33: 29 | B33: Runolfson, Rhett | C33: HiCAP | D33: =+F33+K33+N33+R33+V33+AB33 -> 303.91 | E33: =+J33+M33+Q33+U33+AA33+AE33 -> 121 | F33: =+(G33+H33+I33)+0.5*J33 -> 35.08 | G33: 12.05 | H33: 5.99 | I33: 6.54 | J33: 21 | K33: =+(L33)+0.5*M33 -> 52.24 | L33: 31.74 | M33: 41 | N33: =+(O33+P33)+0.5*Q33 -> 57.33 | O33: 26.08 | P33: 23.75 | Q33: 15 | R33: =+(S33+T33)+0.5*U33 -> 66.40 | S33: 32.95 | T33: 22.95 | U33: 21 | V33: =+(W33+X33+Y33+Z33)+0.5*AA33 -> 48.84 | W33: 7.35 | X33: 7.79 | Y33: 17.58 | Z33: 9.12 | AA33: 14 | AB33: =+(AC33+AD33)+0.5*AE33 -> 44.02 | AC33: 15.12 | AD33: 24.40 | AE33: 9
A34: 30 | B34: Glasscock, Grant | C34: TRM | D34: =+F34+K34+N34+R34+V34+AB34 -> 321.24 | E34: =+J34+M34+Q34+U34+AA34+AE34 -> 122 | F34: =+(G34+H34+I34)+0.5*J34 -> 38.35 | G34: 16.44 | H34: 6.29 | I34: 7.62 | J34: 16 | K34: =+(L34)+0.5*M34 -> 32.27 | L34: 29.77 | M34: 5 | N34: =+(O34+P34)+0.5*Q34 -> 76.73 | O34: 39.50 | P34: 22.73 | Q34: 29 | R34: =+(S34+T34)+0.5*U34 -> 75.34 | S34: 31.81 | T34: 33.03 | U34: 21 | V34: =+(W34+X34+Y34+Z34)+0.5*AA34 -> 54.33 | W34: 5.87 | X34: 7.10 | Y34: 21.27 | Z34: 7.09 | AA34: 26 | AB34: =+(AC34+AD34)+0.5*AE34 -> 44.22 | AC34: 16.14 | AD34: 15.58 | AE34: 25
A35: 31 | B35: Bolinder, Jim | C35: TRM | D35: =+F35+K35+N35+R35+V35+AB35 -> 324.24 | E35: =+J35+M35+Q35+U35+AA35+AE35 -> 219 | F35: =+(G35+H35+I35)+0.5*J35 -> 50.00 | G35: 20.40 | H35: 7.52 | I35: 6.08 | J35: =6+6+9+6+5 -> 32 | K35: =+(L35)+0.5*M35 -> 34.60 | L35: 24.10 | M35: 21 | N35: =+(O35+P35)+0.5*Q35 -> 69.93 | O35: 22.14 | P35: 19.79 | Q35: =11+8+6+9+6+1+15 -> 56 | R35: =+(S35+T35)+0.5*U35 -> 73.87 | S35: 27.49 | T35: 27.38 | U35: =3+1+8+9+5+12 -> 38 | V35: =+(W35+X35+Y35+Z35)+0.5*AA35 -> 46.39 | W35: 5.10 | X35: 5.36 | Y35: 11.91 | Z35: 6.02 | AA35: 36 | AB35: =+(AC35+AD35)+0.5*AE35 -> 49.45 | AC35: 15.56 | AD35: 15.89 | AE35: =14+8+14 -> 36
A36: 32 | B36: Osthed, Adam | C36: TRM | D36: =+F36+K36+N36+R36+V36+AB36 -> 407.79 | E36: =+J36+M36+Q36+U36+AA36+AE36 -> 136 | F36: =+(G36+H36+I36)+0.5*J36 -> 41.28 | G36: 15.39 | H36: 7.37 | I36: 5.02 | J36: 27 | K36: =+(L36)+0.5*M36 -> 45.04 | L36: 39.04 | M36: 12 | N36: =+(O36+P36)+0.5*Q36 -> 94.30 | O36: 49.30 | P36: 37.00 | Q36: 16 | R36: =+(S36+T36)+0.5*U36 -> 103.12 | S36: 46.32 | T36: 47.80 | U36: 18 | V36: =+(W36+X36+Y36+Z36)+0.5*AA36 -> 63.96 | W36: 7.52 | X36: 7.22 | Y36: 22.45 | Z36: 3.77 | AA36: 46 | AB36: =+(AC36+AD36)+0.5*AE36 -> 60.09 | AC36: 16.07 | AD36: 35.52 | AE36: 17
A37: Notes:
A38: xx | B38: Indicates that the Points Down value includes some kind of penalty (Procedural Error, Hits on Non-Threat or Misses on Steel).
A39: PD | B39: = Points Down value is PD x .5 seconds added to the total stage time.
A40: *DIV | B40: = Divisions: TRM = Ten Round Maximum; HiCAP = High capacity mags, no optics or compensators
B41: REV = Revolver - 8 round max, no optics; REVOP = Revolver - 8 round max, w/optics; OPEN = Anything goes - within the bounds of safety
A42: DNF | B42: = Did Not Finish
B43: Note: Michael Scott also participated in the match, but his score sheet was not submitted for scoring.