B1: UDPL New Year's Day 3-Gun Match - Results for January 1, 2004 held at the FARM
B2: (Results listed by Time without regard to Division) - Corrected | K2: To see a description of each Stage, click on the Stage #.
A3: Place | B3: Name | C3: Div * | D3: Shoot Total | E3: Total Points Down | F3: Stage 1 | G3: String 1 | H3: String 2 | I3: String 3 | J3: PD | K3: Stage 2 | L3: String 1 | M3: String 2 | N3: String 3 | O3: PD | P3: Stage 3 | Q3: String 1 | R3: String 2 | S3: String 3 | T3: PD | U3: Stage 4 | V3: String 1 | W3: String 2 | X3: String 3 | Y3: PD | Z3: Stage 5 | AA3: String 1 | AB3: PD | AC3: Stage 6 | AD3: String 1 | AE3: String 2 | AF3: String 3 | AG3: PD
A4: 1 | B4: Griffiths, Todd | C4: L | D4: =+F4+K4+P4+U4+Z4+AC4 -> 145.55 | E4: =+J4+O4+T4+Y4+AB4+AG4 -> 10 | F4: =+(G4+H4+I4)+(0.5*J4) -> 34.20 | G4: 8.08 | H4: 15.41 | I4: 10.71 | J4: 0 | K4: =+(L4+M4+N4)+0.5*O4 -> 11.63 | L4: 1.75 | M4: 2.50 | N4: 2.38 | O4: 10 | P4: =+(Q4+R4+S4)+0.5*T4 -> 12.15 | Q4: 4.79 | R4: 3.71 | S4: 3.65 | T4: 0 | U4: =+(V4+W4+X4)+0.5*Y4 -> 30.16 | V4: 11.18 | W4: 8.23 | X4: 10.75 | Y4: 0 | Z4: =+(AA4)+0.5*AB4 -> 33.75 | AA4: 33.75 | AB4: 0 | AC4: =+(AD4+AE4+AF4)+0.5*AG4 -> 23.66 | AD4: 7.76 | AE4: 8.55 | AF4: 7.35 | AG4: 0
A5: 2 | B5: Stevens, Randy | C5: T | D5: =+F5+K5+P5+U5+Z5+AC5 -> 160.75 | E5: =+J5+O5+T5+Y5+AB5+AG5 -> 0 | F5: =+(G5+H5+I5)+(0.5*J5) -> 55.88 | G5: 36.24 | H5: 11.47 | I5: 8.17 | J5: 0 | K5: =+(L5+M5+N5)+0.5*O5 -> 11.69 | L5: 3.58 | M5: 3.57 | N5: 4.54 | O5: 0 | P5: =+(Q5+R5+S5)+0.5*T5 -> 10.28 | Q5: 3.87 | R5: 2.67 | S5: 3.74 | T5: 0 | U5: =+(V5+W5+X5)+0.5*Y5 -> 28.61 | V5: 14.71 | W5: 4.94 | X5: 8.96 | Y5: 0 | Z5: =+(AA5)+0.5*AB5 -> 25.02 | AA5: 25.02 | AB5: 0 | AC5: =+(AD5+AE5+AF5)+0.5*AG5 -> 29.27 | AD5: 12.59 | AE5: 7.41 | AF5: 9.27 | AG5: 0
A6: 3 | B6: Collins, Ken | C6: O | D6: =+F6+K6+P6+U6+Z6+AC6 -> 163.52 | E6: =+J6+O6+T6+Y6+AB6+AG6 -> 0 | F6: =+(G6+H6+I6)+(0.5*J6) -> 34.31 | G6: 11.66 | H6: 13.62 | I6: 9.03 | J6: 0 | K6: =+(L6+M6+N6)+0.5*O6 -> 10.69 | L6: 4.05 | M6: 2.90 | N6: 3.74 | O6: 0 | P6: =+(Q6+R6+S6)+0.5*T6 -> 12.61 | Q6: 4.89 | R6: 4.20 | S6: 3.52 | T6: 0 | U6: =+(V6+W6+X6)+0.5*Y6 -> 44.87 | V6: 12.60 | W6: 19.87 | X6: 12.40 | Y6: 0 | Z6: =+(AA6)+0.5*AB6 -> 29.68 | AA6: 29.68 | AB6: 0 | AC6: =+(AD6+AE6+AF6)+0.5*AG6 -> 31.36 | AD6: 10.21 | AE6: 9.85 | AF6: 11.30 | AG6: 0
A7: 4 | B7: Vollmer, Phillip | C7: T | D7: =+F7+K7+P7+U7+Z7+AC7 -> 163.72 | E7: =+J7+O7+T7+Y7+AB7+AG7 -> 0 | F7: =+(G7+H7+I7)+(0.5*J7) -> 40.06 | G7: 12.90 | H7: 16.44 | I7: 10.72 | J7: 0 | K7: =+(L7+M7+N7)+0.5*O7 -> 14.82 | L7: 4.98 | M7: 4.78 | N7: 5.06 | O7: 0 | P7: =+(Q7+R7+S7)+0.5*T7 -> 13.22 | Q7: 4.21 | R7: 4.36 | S7: 4.65 | T7: 0 | U7: =+(V7+W7+X7)+0.5*Y7 -> 36.14 | V7: 12.71 | W7: 13.26 | X7: 10.17 | Y7: 0 | Z7: =+(AA7)+0.5*AB7 -> 33.22 | AA7: 33.22 | AB7: 0 | AC7: =+(AD7+AE7+AF7)+0.5*AG7 -> 26.26 | AD7: 8.19 | AE7: 8.22 | AF7: 9.85 | AG7: 0
A8: 5 | B8: Langford, Les | C8: TRO | D8: =+F8+K8+P8+U8+Z8+AC8 -> 170.14 | E8: =+J8+O8+T8+Y8+AB8+AG8 -> 10 | F8: =+(G8+H8+I8)+(0.5*J8) -> 34.02 | G8: 11.91 | H8: 13.90 | I8: 8.21 | J8: 0 | K8: =+(L8+M8+N8)+0.5*O8 -> 11.48 | L8: 3.90 | M8: 3.67 | N8: 3.91 | O8: 0 | P8: =+(Q8+R8+S8)+0.5*T8 -> 15.43 | Q8: 3.69 | R8: 3.30 | S8: 3.44 | T8: 10 | U8: =+(V8+W8+X8)+0.5*Y8 -> 44.86 | V8: 17.58 | W8: 13.37 | X8: 13.91 | Y8: 0 | Z8: =+(AA8)+0.5*AB8 -> 38.20 | AA8: 38.20 | AB8: 0 | AC8: =+(AD8+AE8+AF8)+0.5*AG8 -> 26.15 | AD8: 8.17 | AE8: 9.68 | AF8: 8.30 | AG8: 0
A9: 6 | B9: Latham, Corey | C9: L | D9: =+F9+K9+P9+U9+Z9+AC9 -> 180.88 | E9: =+J9+O9+T9+Y9+AB9+AG9 -> 20 | F9: =+(G9+H9+I9)+(0.5*J9) -> 60.26 | G9: 25.30 | H9: 14.65 | I9: 15.31 | J9: 10 | K9: =+(L9+M9+N9)+0.5*O9 -> 5.51 | L9: 1.21 | M9: 1.97 | N9: 2.33 | O9: 0 | P9: =+(Q9+R9+S9)+0.5*T9 -> 10.39 | Q9: 3.24 | R9: 3.67 | S9: 3.48 | T9: 0 | U9: =+(V9+W9+X9)+0.5*Y9 -> 26.33 | V9: 12.79 | W9: 7.93 | X9: 5.61 | Y9: 0 | Z9: =+(AA9)+0.5*AB9 -> 32.62 | AA9: 32.62 | AB9: 0 | AC9: =+(AD9+AE9+AF9)+0.5*AG9 -> 45.77 | AD9: 9.12 | AE9: 24.38 | AF9: 7.27 | AG9: 10
A10: 7 | B10: Huff, Blake | C10: TRO | D10: =+F10+K10+P10+U10+Z10+AC10 -> 183.45 | E10: =+J10+O10+T10+Y10+AB10+AG10 -> 0 | F10: =+(G10+H10+I10)+(0.5*J10) -> 53.07 | G10: 15.97 | H10: 27.70 | I10: 9.40 | J10: 0 | K10: =+(L10+M10+N10)+0.5*O10 -> 12.12 | L10: 4.06 | M10: 3.95 | N10: 4.11 | O10: 0 | P10: =+(Q10+R10+S10)+0.5*T10 -> 11.84 | Q10: 3.22 | R10: 4.13 | S10: 4.49 | T10: 0 | U10: =+(V10+W10+X10)+0.5*Y10 -> 44.97 | V10: 17.95 | W10: 12.99 | X10: 14.03 | Y10: 0 | Z10: =+(AA10)+0.5*AB10 -> 34.42 | AA10: 34.42 | AB10: 0 | AC10: =+(AD10+AE10+AF10)+0.5*AG10 -> 27.03 | AD10: 10.00 | AE10: 9.01 | AF10: 8.02 | AG10: 0
A11: 8 | B11: Ward, Dan | C11: TRO | D11: =+F11+K11+P11+U11+Z11+AC11 -> 185.93 | E11: =+J11+O11+T11+Y11+AB11+AG11 -> 0 | F11: =+(G11+H11+I11)+(0.5*J11) -> 57.33 | G11: 14.68 | H11: 23.36 | I11: 19.29 | J11: 0 | K11: =+(L11+M11+N11)+0.5*O11 -> 19.15 | L11: 7.42 | M11: 5.81 | N11: 5.92 | O11: 0 | P11: =+(Q11+R11+S11)+0.5*T11 -> 11.86 | Q11: 4.46 | R11: 3.90 | S11: 3.50 | T11: 0 | U11: =+(V11+W11+X11)+0.5*Y11 -> 35.65 | V11: 13.35 | W11: 13.12 | X11: 9.18 | Y11: 0 | Z11: =+(AA11)+0.5*AB11 -> 34.28 | AA11: 34.28 | AB11: 0 | AC11: =+(AD11+AE11+AF11)+0.5*AG11 -> 27.66 | AD11: 9.16 | AE11: 9.14 | AF11: 9.36 | AG11: 0
A12: 9 | B12: Correia, Larry | C12: O | D12: =+F12+K12+P12+U12+Z12+AC12 -> 190.29 | E12: =+J12+O12+T12+Y12+AB12+AG12 -> 0 | F12: =+(G12+H12+I12)+(0.5*J12) -> 62.25 | G12: 14.41 | H12: 36.62 | I12: 11.22 | J12: 0 | K12: =+(L12+M12+N12)+0.5*O12 -> 9.57 | L12: 3.70 | M12: 2.84 | N12: 3.03 | O12: 0 | P12: =+(Q12+R12+S12)+0.5*T12 -> 13.69 | Q12: 4.41 | R12: 5.15 | S12: 4.13 | T12: 0 | U12: =+(V12+W12+X12)+0.5*Y12 -> 32.82 | V12: 11.18 | W12: 3.69 | X12: 17.95 | Y12: 0 | Z12: =+(AA12)+0.5*AB12 -> 37.71 | AA12: 37.71 | AB12: 0 | AC12: =+(AD12+AE12+AF12)+0.5*AG12 -> 34.25 | AD12: 13.51 | AE12: 9.27 | AF12: 11.47 | AG12: 0
A13: 10 | B13: Mousley, Roger | C13: TRO | D13: =+F13+K13+P13+U13+Z13+AC13 -> 190.85 | E13: =+J13+O13+T13+Y13+AB13+AG13 -> 0 | F13: =+(G13+H13+I13)+(0.5*J13) -> 67.84 | G13: 16.62 | H13: 37.82 | I13: 13.40 | J13: 0 | K13: =+(L13+M13+N13)+0.5*O13 -> 10.72 | L13: 3.73 | M13: 3.38 | N13: 3.61 | O13: 0 | P13: =+(Q13+R13+S13)+0.5*T13 -> 8.04 | Q13: 2.85 | R13: 2.52 | S13: 2.67 | T13: 0 | U13: =+(V13+W13+X13)+0.5*Y13 -> 31.65 | V13: 15.36 | W13: 8.36 | X13: 7.93 | Y13: 0 | Z13: =+(AA13)+0.5*AB13 -> 39.32 | AA13: 39.32 | AB13: 0 | AC13: =+(AD13+AE13+AF13)+0.5*AG13 -> 33.28 | AD13: 11.40 | AE13: 11.34 | AF13: 10.54 | AG13: 0
A14: 11 | B14: Ostler, Jeff | C14: TRO | D14: =+F14+K14+P14+U14+Z14+AC14 -> 192.22 | E14: =+J14+O14+T14+Y14+AB14+AG14 -> 30 | F14: =+(G14+H14+I14)+(0.5*J14) -> 62.78 | G14: 25.94 | H14: 21.30 | I14: 15.54 | J14: 0 | K14: =+(L14+M14+N14)+0.5*O14 -> 9.77 | L14: 4.65 | M14: 2.78 | N14: 2.34 | O14: 0 | P14: =+(Q14+R14+S14)+0.5*T14 -> 10.36 | Q14: 3.84 | R14: 3.48 | S14: 3.04 | T14: 0 | U14: =+(V14+W14+X14)+0.5*Y14 -> 32.73 | V14: 16.20 | W14: 6.45 | X14: 10.08 | Y14: 0 | Z14: =+(AA14)+0.5*AB14 -> 52.99 | AA14: 37.99 | AB14: 30 | AC14: =+(AD14+AE14+AF14)+0.5*AG14 -> 23.59 | AD14: 7.90 | AE14: 8.10 | AF14: 7.59 | AG14: 0
A15: 12 | B15: Lowe, John | C15: TRO | D15: =+F15+K15+P15+U15+Z15+AC15 -> 192.73 | E15: =+J15+O15+T15+Y15+AB15+AG15 -> 10 | F15: =+(G15+H15+I15)+(0.5*J15) -> 76.51 | G15: 36.37 | H15: 29.36 | I15: 10.78 | J15: 0 | K15: =+(L15+M15+N15)+0.5*O15 -> 12.01 | L15: 4.78 | M15: 3.83 | N15: 3.40 | O15: 0 | P15: =+(Q15+R15+S15)+0.5*T15 -> 17.08 | Q15: 4.11 | R15: 4.23 | S15: 3.74 | T15: 10 | U15: =+(V15+W15+X15)+0.5*Y15 -> 30.65 | V15: 18.06 | W15: 6.59 | X15: 6.00 | Y15: 0 | Z15: =+(AA15)+0.5*AB15 -> 33.47 | AA15: 33.47 | AB15: 0 | AC15: =+(AD15+AE15+AF15)+0.5*AG15 -> 23.01 | AD15: 8.32 | AE15: 6.43 | AF15: 8.26 | AG15: 0
A16: 13 | B16: Theodore, Ari | C16: T | D16: =+F16+K16+P16+U16+Z16+AC16 -> 217.74 | E16: =+J16+O16+T16+Y16+AB16+AG16 -> 20 | F16: =+(G16+H16+I16)+(0.5*J16) -> 81.99 | G16: 36.03 | H16: 32.28 | I16: 13.68 | J16: 0 | K16: =+(L16+M16+N16)+0.5*O16 -> 16.67 | L16: 7.04 | M16: 4.91 | N16: 4.72 | O16: 0 | P16: =+(Q16+R16+S16)+0.5*T16 -> 12.62 | Q16: 3.89 | R16: 4.49 | S16: 4.24 | T16: 0 | U16: =+(V16+W16+X16)+0.5*Y16 -> 27.73 | V16: 11.70 | W16: 9.69 | X16: 6.34 | Y16: 0 | Z16: =+(AA16)+0.5*AB16 -> 35.81 | AA16: 35.81 | AB16: 0 | AC16: =+(AD16+AE16+AF16)+0.5*AG16 -> 42.92 | AD16: 10.69 | AE16: 10.69 | AF16: 11.54 | AG16: 20
A17: 14 | B17: Adams, Kyle | C17: TRO | D17: =+F17+K17+P17+U17+Z17+AC17 -> 228.99 | E17: =+J17+O17+T17+Y17+AB17+AG17 -> 0 | F17: =+(G17+H17+I17)+(0.5*J17) -> 56.05 | G17: 18.60 | H17: 14.28 | I17: 23.17 | J17: 0 | K17: =+(L17+M17+N17)+0.5*O17 -> 10.75 | L17: 3.93 | M17: 3.55 | N17: 3.27 | O17: 0 | P17: =+(Q17+R17+S17)+0.5*T17 -> 18.50 | Q17: 7.36 | R17: 4.67 | S17: 6.47 | T17: 0 | U17: =+(V17+W17+X17)+0.5*Y17 -> 55.21 | V17: 19.72 | W17: 22.00 | X17: 13.49 | Y17: 0 | Z17: =+(AA17)+0.5*AB17 -> 27.41 | AA17: 27.41 | AB17: 0 | AC17: =+(AD17+AE17+AF17)+0.5*AG17 -> 61.07 | AD17: 20.36 | AE17: 28.07 | AF17: 12.64 | AG17: 0
A18: 15 | B18: Zaccardi, Pat | C18: L | D18: =+F18+K18+P18+U18+Z18+AC18 -> 236.74 | E18: =+J18+O18+T18+Y18+AB18+AG18 -> 30 | F18: =+(G18+H18+I18)+(0.5*J18) -> 81.50 | G18: 20.19 | H18: 34.74 | I18: 16.57 | J18: 20 | K18: =+(L18+M18+N18)+0.5*O18 -> 12.95 | L18: 4.63 | M18: 3.96 | N18: 4.36 | O18: 0 | P18: =+(Q18+R18+S18)+0.5*T18 -> 18.44 | Q18: 3.87 | R18: 5.42 | S18: 4.15 | T18: 10 | U18: =+(V18+W18+X18)+0.5*Y18 -> 47.44 | V18: 22.62 | W18: 16.43 | X18: 8.39 | Y18: 0 | Z18: =+(AA18)+0.5*AB18 -> 45.92 | AA18: 45.92 | AB18: 0 | AC18: =+(AD18+AE18+AF18)+0.5*AG18 -> 30.49 | AD18: 10.95 | AE18: 8.37 | AF18: 11.17 | AG18: 0
A19: 16 | B19: Roberts, Bruce | C19: TRO | D19: =+F19+K19+P19+U19+Z19+AC19 -> 243.23 | E19: =+J19+O19+T19+Y19+AB19+AG19 -> 0 | F19: =+(G19+H19+I19)+(0.5*J19) -> 83.45 | G19: 46.70 | H19: 18.18 | I19: 18.57 | J19: 0 | K19: =+(L19+M19+N19)+0.5*O19 -> 16.55 | L19: 7.37 | M19: 4.67 | N19: 4.51 | O19: 0 | P19: =+(Q19+R19+S19)+0.5*T19 -> 15.08 | Q19: 7.05 | R19: 4.42 | S19: 3.61 | T19: 0 | U19: =+(V19+W19+X19)+0.5*Y19 -> 57.41 | V19: 32.09 | W19: 14.57 | X19: 10.75 | Y19: 0 | Z19: =+(AA19)+0.5*AB19 -> 39.78 | AA19: 39.78 | AB19: 0 | AC19: =+(AD19+AE19+AF19)+0.5*AG19 -> 30.96 | AD19: 12.71 | AE19: 8.40 | AF19: 9.85 | AG19: 0
A20: 17 | B20: Montgomery, Robert | C20: L | D20: =+F20+K20+P20+U20+Z20+AC20 -> 245.22 | E20: =+J20+O20+T20+Y20+AB20+AG20 -> 0 | F20: =+(G20+H20+I20)+(0.5*J20) -> 79.10 | G20: 14.86 | H20: 44.36 | I20: 19.88 | J20: 0 | K20: =+(L20+M20+N20)+0.5*O20 -> 18.09 | L20: 6.85 | M20: 5.92 | N20: 5.32 | O20: 0 | P20: =+(Q20+R20+S20)+0.5*T20 -> 17.90 | Q20: 6.82 | R20: 5.60 | S20: 5.48 | T20: 0 | U20: =+(V20+W20+X20)+0.5*Y20 -> 47.09 | V20: 19.93 | W20: 17.72 | X20: 9.44 | Y20: 0 | Z20: =+(AA20)+0.5*AB20 -> 38.95 | AA20: 38.95 | AB20: 0 | AC20: =+(AD20+AE20+AF20)+0.5*AG20 -> 44.09 | AD20: 12.71 | AE20: 11.59 | AF20: 19.79 | AG20: 0
A21: 18 | B21: Taylor, Joshua | C21: T | D21: =+F21+K21+P21+U21+Z21+AC21 -> 245.81 | E21: =+J21+O21+T21+Y21+AB21+AG21 -> 0 | F21: =+(G21+H21+I21)+(0.5*J21) -> 55.59 | G21: 11.54 | H21: 22.42 | I21: 21.63 | J21: 0 | K21: =+(L21+M21+N21)+0.5*O21 -> 16.25 | L21: 5.37 | M21: 5.21 | N21: 5.67 | O21: 0 | P21: =+(Q21+R21+S21)+0.5*T21 -> 16.41 | Q21: 5.67 | R21: 5.38 | S21: 5.36 | T21: 0 | U21: =+(V21+W21+X21)+0.5*Y21 -> 60.69 | V21: 30.50 | W21: 18.49 | X21: 11.70 | Y21: 0 | Z21: =+(AA21)+0.5*AB21 -> 46.74 | AA21: 46.74 | AB21: 0 | AC21: =+(AD21+AE21+AF21)+0.5*AG21 -> 50.13 | AD21: 19.17 | AE21: 17.85 | AF21: 13.11 | AG21: 0
A22: 19 | B22: Willard, Jason | C22: TRO | D22: =+F22+K22+P22+U22+Z22+AC22 -> 269.23 | E22: =+J22+O22+T22+Y22+AB22+AG22 -> 0 | F22: =+(G22+H22+I22)+(0.5*J22) -> 103.61 | G22: 20.45 | H22: 60.03 | I22: 23.13 | J22: 0 | K22: =+(L22+M22+N22)+0.5*O22 -> 13.86 | L22: 4.45 | M22: 4.95 | N22: 4.46 | O22: 0 | P22: =+(Q22+R22+S22)+0.5*T22 -> 12.61 | Q22: 4.03 | R22: 4.02 | S22: 4.56 | T22: 0 | U22: =+(V22+W22+X22)+0.5*Y22 -> 54.73 | V22: 36.30 | W22: 10.12 | X22: 8.31 | Y22: 0 | Z22: =+(AA22)+0.5*AB22 -> 46.98 | AA22: 46.98 | AB22: 0 | AC22: =+(AD22+AE22+AF22)+0.5*AG22 -> 37.44 | AD22: 16.62 | AE22: 9.97 | AF22: 10.85 | AG22: 0
A23: 20 | B23: Beck, Dave | C23: L | D23: =+F23+K23+P23+U23+Z23+AC23 -> 273.30 | E23: =+J23+O23+T23+Y23+AB23+AG23 -> 20 | F23: =+(G23+H23+I23)+(0.5*J23) -> 94.12 | G23: 43.65 | H23: 34.80 | I23: 15.67 | J23: 0 | K23: =+(L23+M23+N23)+0.5*O23 -> 20.88 | L23: 3.95 | M23: 4.71 | N23: 7.22 | O23: 10 | P23: =+(Q23+R23+S23)+0.5*T23 -> 17.79 | Q23: 4.93 | R23: 3.72 | S23: 4.14 | T23: 10 | U23: =+(V23+W23+X23)+0.5*Y23 -> 80.93 | V23: 34.75 | W23: 33.32 | X23: 12.86 | Y23: 0 | Z23: =+(AA23)+0.5*AB23 -> 31.87 | AA23: 31.87 | AB23: 0 | AC23: =+(AD23+AE23+AF23)+0.5*AG23 -> 27.71 | AD23: 9.91 | AE23: 8.99 | AF23: 8.81 | AG23: 0
A24: 21 | B24: Knapp, Chris | C24: L | D24: =+F24+K24+P24+U24+Z24+AC24 -> 306.28 | E24: =+J24+O24+T24+Y24+AB24+AG24 -> 0 | F24: =+(G24+H24+I24)+(0.5*J24) -> 132.37 | G24: 56.08 | H24: 51.76 | I24: 24.53 | J24: 0 | K24: =+(L24+M24+N24)+0.5*O24 -> 13.08 | L24: 4.62 | M24: 4.19 | N24: 4.27 | O24: 0 | P24: =+(Q24+R24+S24)+0.5*T24 -> 17.80 | Q24: 6.94 | R24: 5.97 | S24: 4.89 | T24: 0 | U24: =+(V24+W24+X24)+0.5*Y24 -> 53.35 | V24: 30.25 | W24: 12.04 | X24: 11.06 | Y24: 0 | Z24: =+(AA24)+0.5*AB24 -> 56.00 | AA24: 56.00 | AB24: 0 | AC24: =+(AD24+AE24+AF24)+0.5*AG24 -> 33.68 | AD24: 10.32 | AE24: 12.12 | AF24: 11.24 | AG24: 0
A25: 22 | B25: Clarin, Kent | C25: T | D25: =+F25+K25+P25+U25+Z25+AC25 -> 308.96 | E25: =+J25+O25+T25+Y25+AB25+AG25 -> 0 | F25: =+(G25+H25+I25)+(0.5*J25) -> 78.91 | G25: 19.86 | H25: 19.80 | I25: 39.25 | J25: 0 | K25: =+(L25+M25+N25)+0.5*O25 -> 19.88 | L25: 7.62 | M25: 6.26 | N25: 6.00 | O25: 0 | P25: =+(Q25+R25+S25)+0.5*T25 -> 19.80 | Q25: 5.53 | R25: 9.96 | S25: 4.31 | T25: 0 | U25: =+(V25+W25+X25)+0.5*Y25 -> 83.03 | V25: 41.27 | W25: 30.48 | X25: 11.28 | Y25: 0 | Z25: =+(AA25)+0.5*AB25 -> 59.99 | AA25: 59.99 | AB25: 0 | AC25: =+(AD25+AE25+AF25)+0.5*AG25 -> 47.35 | AD25: 14.13 | AE25: 24.20 | AF25: 9.02 | AG25: 0
A26: 23 | B26: Zaccardi, Juke | C26: L | D26: =+F26+K26+P26+U26+Z26+AC26 -> 340.33 | E26: =+J26+O26+T26+Y26+AB26+AG26 -> 70 | F26: =+(G26+H26+I26)+(0.5*J26) -> 127.85 | G26: 25.49 | H26: 46.96 | I26: 20.40 | J26: 70 | K26: =+(L26+M26+N26)+0.5*O26 -> 14.78 | L26: 5.03 | M26: 5.35 | N26: 4.40 | O26: 0 | P26: =+(Q26+R26+S26)+0.5*T26 -> 16.43 | Q26: 5.71 | R26: 5.41 | S26: 5.31 | T26: 0 | U26: =+(V26+W26+X26)+0.5*Y26 -> 78.77 | V26: 45.58 | W26: 23.02 | X26: 10.17 | Y26: 0 | Z26: =+(AA26)+0.5*AB26 -> 65.87 | AA26: 65.87 | AB26: 0 | AC26: =+(AD26+AE26+AF26)+0.5*AG26 -> 36.63 | AD26: 11.72 | AE26: 12.50 | AF26: 12.41 | AG26: 0
A27: 24 | B27: Simpson, Harold | C27: TRO | D27: =+F27+K27+P27+U27+Z27+AC27 -> 344.94 | E27: =+J27+O27+T27+Y27+AB27+AG27 -> 30 | F27: =+(G27+H27+I27)+(0.5*J27) -> 113.29 | G27: 48.44 | H27: 42.46 | I27: 22.39 | J27: 0 | K27: =+(L27+M27+N27)+0.5*O27 -> 29.14 | L27: 6.67 | M27: 6.25 | N27: 6.22 | O27: 20 | P27: =+(Q27+R27+S27)+0.5*T27 -> 22.50 | Q27: 5.82 | R27: 5.24 | S27: 6.44 | T27: 10 | U27: =+(V27+W27+X27)+0.5*Y27 -> 82.09 | V27: 43.50 | W27: 19.49 | X27: 19.10 | Y27: 0 | Z27: =+(AA27)+0.5*AB27 -> 50.30 | AA27: 50.30 | AB27: 0 | AC27: =+(AD27+AE27+AF27)+0.5*AG27 -> 47.62 | AD27: 15.01 | AE27: 16.22 | AF27: 16.39 | AG27: 0
A28: 25 | B28: Rogers, Scott | C28: L | D28: =+F28+K28+P28+U28+Z28+AC28 -> 408.31 | E28: =+J28+O28+T28+Y28+AB28+AG28 -> 50 | F28: =+(G28+H28+I28)+(0.5*J28) -> 116.24 | G28: 18.41 | H28: 51.58 | I28: 41.25 | J28: 10 | K28: =+(L28+M28+N28)+0.5*O28 -> 19.78 | L28: 6.48 | M28: 7.02 | N28: 6.28 | O28: 0 | P28: =+(Q28+R28+S28)+0.5*T28 -> 24.65 | Q28: 9.86 | R28: 9.52 | S28: 5.27 | T28: 0 | U28: =+(V28+W28+X28)+0.5*Y28 -> 127.38 | V28: 51.32 | W28: 26.16 | X28: 29.90 | Y28: 40 | Z28: =+(AA28)+0.5*AB28 -> 70.30 | AA28: 70.30 | AB28: 0 | AC28: =+(AD28+AE28+AF28)+0.5*AG28 -> 49.96 | AD28: 17.24 | AE28: 14.95 | AF28: 17.77 | AG28: 0
A29: 26 | B29: Roberts, Jay | C29: TRO | D29: =+F29+K29+P29+U29+Z29+AC29 -> 425.84 | E29: =+J29+O29+T29+Y29+AB29+AG29 -> 0 | F29: =+(G29+H29+I29)+(0.5*J29) -> 170.24 | G29: 86.48 | H29: 43.53 | I29: 40.23 | J29: 0 | K29: =+(L29+M29+N29)+0.5*O29 -> 19.39 | L29: 6.83 | M29: 6.71 | N29: 5.85 | O29: 0 | P29: =+(Q29+R29+S29)+0.5*T29 -> 17.36 | Q29: 6.45 | R29: 6.34 | S29: 4.57 | T29: 0 | U29: =+(V29+W29+X29)+0.5*Y29 -> 95.71 | V29: 56.49 | W29: 18.38 | X29: 20.84 | Y29: 0 | Z29: =+(AA29)+0.5*AB29 -> 66.73 | AA29: 66.73 | AB29: 0 | AC29: =+(AD29+AE29+AF29)+0.5*AG29 -> 56.41 | AD29: 30.12 | AE29: 11.49 | AF29: 14.80 | AG29: 0
A30: 27 | B30: Knapp, Nathan | C30: L | D30: =+F30+K30+P30+U30+Z30+AC30 -> 498.03 | E30: =+J30+O30+T30+Y30+AB30+AG30 -> 60 | F30: =+(G30+H30+I30)+(0.5*J30) -> 159.10 | G30: 58.29 | H30: 74.36 | I30: 26.45 | J30: 0 | K30: =+(L30+M30+N30)+0.5*O30 -> 15.85 | L30: 5.67 | M30: 5.30 | N30: 4.88 | O30: 0 | P30: =+(Q30+R30+S30)+0.5*T30 -> 16.84 | Q30: 6.47 | R30: 5.72 | S30: 4.65 | T30: 0 | U30: =+(V30+W30+X30)+0.5*Y30 -> 140.98 | V30: 50.56 | W30: 34.46 | X30: 25.96 | Y30: 60 | Z30: =+(AA30)+0.5*AB30 -> 120.33 | AA30: 120.33 | AB30: 0 | AC30: =+(AD30+AE30+AF30)+0.5*AG30 -> 44.93 | AD30: 21.53 | AE30: 11.90 | AF30: 11.50 | AG30: 0
A31: 28 | B31: Garcia, Dan | C31: TRO | D31: =+F31+K31+P31+U31+Z31+AC31 -> 502.13 | E31: =+J31+O31+T31+Y31+AB31+AG31 -> 150 | F31: =+(G31+H31+I31)+(0.5*J31) -> 268.51 | G31: 94.50 | H31: 93.41 | I31: 20.60 | J31: 120 | K31: =+(L31+M31+N31)+0.5*O31 -> 41.99 | L31: 11.60 | M31: 6.63 | N31: 8.76 | O31: 30 | P31: =+(Q31+R31+S31)+0.5*T31 -> 31.14 | Q31: 16.09 | R31: 5.63 | S31: 9.42 | T31: 0 | U31: =+(V31+W31+X31)+0.5*Y31 -> 68.42 | V31: 42.72 | W31: 12.48 | X31: 13.22 | Y31: 0 | Z31: =+(AA31)+0.5*AB31 -> 56.52 | AA31: 56.52 | AB31: 0 | AC31: =+(AD31+AE31+AF31)+0.5*AG31 -> 35.55 | AD31: 12.74 | AE31: 9.72 | AF31: 13.09 | AG31: 0
A32: 29 | B32: Adams, Cody | C32: TRO | D32: =+F32+K32+P32+U32+Z32+AC32 -> 668.72 | E32: =+J32+O32+T32+Y32+AB32+AG32 -> 0 | F32: =+(G32+H32+I32)+(0.5*J32) -> 168.50 | G32: 53.24 | H32: 46.76 | I32: 68.50 | J32: 0 | K32: =+(L32+M32+N32)+0.5*O32 -> 27.99 | L32: 8.19 | M32: 7.56 | N32: 12.24 | O32: 0 | P32: =+(Q32+R32+S32)+0.5*T32 -> 36.15 | Q32: 10.09 | R32: 13.83 | S32: 12.23 | T32: 0 | U32: =+(V32+W32+X32)+0.5*Y32 -> 226.46 | V32: 91.38 | W32: 95.14 | X32: 39.94 | Y32: 0 | Z32: =+(AA32)+0.5*AB32 -> 142.05 | AA32: 142.05 | AB32: 0 | AC32: =+(AD32+AE32+AF32)+0.5*AG32 -> 67.57 | AD32: 18.36 | AE32: 27.28 | AF32: 21.93 | AG32: 0
A33: Notes:
A34: - | B34: Div * - Refer to the UDPL 3-Gun Division Specifications for specifics on each Division.
B35: L = | C35: LIMITED
B36: T = | C36: TACTICAL
B37: TRO = | C37: TACTICAL RIFLE-OPTICAL
B38: O = | C38: OPEN
A39: PD | B39: = Points Down = .5 seconds x Points Down. PD Total is added to the total Stage time.
A40: XX | B40: = Indicates that the Points Down value includes some kind of penalty (Procedural Error, Hits on Non-Threat, Misses on Steel (5 seconds each), etc.).
A41: DNF | B41: = Did Not Finish