B0: UDPL 3-Gun Match - Results for March 20, 2004 held at the FARM | AO0: Due to time constraints, String 3 was omitted from this stage.
B1: (Results listed by Time without regard to Division) | J1: To see a description of each Stage, click on the Stage #.
B2: Click here to see results by Division
A3: Place | B3: Name | C3: Div * | D3: Shoot Total | E3: Total Points Down | F3: Stage 1 | G3: String 1 | H3: String 2 | I3: PD | J3: Stage 2 | K3: String 1 | L3: String 2 | M3: String 3 | N3: PD | O3: Stage 3 | P3: String 1 | Q3: String 2 | R3: PD | S3: Stage 4 | T3: String 1 | U3: String 2 | V3: PD | W3: Stage 5 | X3: String 1 | Y3: String 2 | Z3: PD | AA3: Stage 6 | AB3: String 1 | AC3: String 2 | AD3: PD | AE3: Stage 7 | AF3: String 1 | AG3: String 2 | AH3: String 3 | AI3: PD | AJ3: Stage 8 | AK3: String 1 | AL3: String 2 | AM3: String 3 | AN3: PD | AO3: Stage 9 | AP3: String 1 | AQ3: String 2 | AR3: PD
A4: 1 | B4: Latham, Corey | C4: L | D4: =+F4+J4+O4+S4+W4+AA4+AE4+AJ4+AO4 -> 328.13 | E4: =+I4+N4+R4+V4+Z4+AD4+AI4+AN4+AR4 -> 100 | F4: =+(G4+H4)+(0.5*I4) -> 37.70 | G4: 19.17 | H4: 11.03 | I4: 15 | J4: =+(K4+L4+M4)+0.5*N4 -> 10.00 | K4: 3.52 | L4: 3.30 | M4: 3.18 | N4: 0 | O4: =+(P4+Q4)+0.5*R4 -> 41.46 | P4: 14.43 | Q4: 14.53 | R4: 25 | S4: =+(T4+U4)+0.5*V4 -> 48.84 | T4: 16.28 | U4: 18.06 | V4: 29 | W4: =+(Y4+X4)+0.5*Z4 -> 69.23 | X4: 29.49 | Y4: 27.24 | Z4: 25 | AA4: =+(AB4+AC4)+0.5*AD4 -> 31.05 | AB4: 16.59 | AC4: 14.46 | AD4: 0 | AE4: =+(AF4+AG4+AH4)+0.5*AI4 -> 11.92 | AF4: 3.70 | AG4: 3.06 | AH4: 5.16 | AI4: 0 | AJ4: =+(AK4+AL4+AM4)+0.5*AN4 -> 33.45 | AK4: 6.24 | AL4: 8.85 | AM4: 15.36 | AN4: 6 | AO4: =+(AP4+AQ4)+0.5*AR4 -> 44.48 | AP4: 19.25 | AQ4: 25.23 | AR4: 0
A5: 2 | B5: Terry, Dale | C5: TRO | D5: =+F5+J5+O5+S5+W5+AA5+AE5+AJ5+AO5 -> 349.49 | E5: =+I5+N5+R5+V5+Z5+AD5+AI5+AN5+AR5 -> 133 | F5: =+(G5+H5)+(0.5*I5) -> 57.81 | G5: 17.28 | H5: 20.53 | I5: 40 | J5: =+(K5+L5+M5)+0.5*N5 -> 25.57 | K5: 3.22 | L5: 12.70 | M5: 4.65 | N5: 10 | O5: =+(P5+Q5)+0.5*R5 -> 36.67 | P5: 11.79 | Q5: 12.88 | R5: 24 | S5: =+(T5+U5)+0.5*V5 -> 41.67 | T5: 16.45 | U5: 13.72 | V5: 23 | W5: =+(Y5+X5)+0.5*Z5 -> 76.18 | X5: 29.34 | Y5: 31.34 | Z5: 31 | AA5: =+(AB5+AC5)+0.5*AD5 -> 22.54 | AB5: 12.14 | AC5: 10.40 | AD5: 0 | AE5: =+(AF5+AG5+AH5)+0.5*AI5 -> 13.61 | AF5: 3.40 | AG5: 5.06 | AH5: 5.15 | AI5: 0 | AJ5: =+(AK5+AL5+AM5)+0.5*AN5 -> 31.64 | AK5: 7.38 | AL5: 11.91 | AM5: 9.85 | AN5: 5 | AO5: =+(AP5+AQ5)+0.5*AR5 -> 43.80 | AP5: 22.81 | AQ5: 20.99 | AR5: 0
A6: 3 | B6: Outzen, Craig | C6: TRO | D6: =+F6+J6+O6+S6+W6+AA6+AE6+AJ6+AO6 -> 352.54 | E6: =+I6+N6+R6+V6+Z6+AD6+AI6+AN6+AR6 -> 86 | F6: =+(G6+H6)+(0.5*I6) -> 40.36 | G6: 19.73 | H6: 12.63 | I6: 16 | J6: =+(K6+L6+M6)+0.5*N6 -> 12.18 | K6: 3.78 | L6: 3.94 | M6: 4.46 | N6: 0 | O6: =+(P6+Q6)+0.5*R6 -> 32.15 | P6: 10.63 | Q6: 11.02 | R6: 21 | S6: =+(T6+U6)+0.5*V6 -> 41.14 | T6: 18.33 | U6: 13.81 | V6: 18 | W6: =+(Y6+X6)+0.5*Z6 -> 76.26 | X6: 32.35 | Y6: 34.41 | Z6: 19 | AA6: =+(AB6+AC6)+0.5*AD6 -> 45.35 | AB6: 26.52 | AC6: 18.83 | AD6: 0 | AE6: =+(AF6+AG6+AH6)+0.5*AI6 -> 13.83 | AF6: 4.18 | AG6: 4.22 | AH6: 5.43 | AI6: 0 | AJ6: =+(AK6+AL6+AM6)+0.5*AN6 -> 43.71 | AK6: 7.97 | AL6: 11.02 | AM6: 18.72 | AN6: 12 | AO6: =+(AP6+AQ6)+0.5*AR6 -> 47.56 | AP6: 21.63 | AQ6: 25.93 | AR6: 0
A7: 4 | B7: Griffiths, Todd | C7: L | D7: =+F7+J7+O7+S7+W7+AA7+AE7+AJ7+AO7 -> 358.69 | E7: =+I7+N7+R7+V7+Z7+AD7+AI7+AN7+AR7 -> 87 | F7: =+(G7+H7)+(0.5*I7) -> 39.62 | G7: 17.47 | H7: 12.15 | I7: 20 | J7: =+(K7+L7+M7)+0.5*N7 -> 11.39 | K7: 4.25 | L7: 3.53 | M7: 3.61 | N7: 0 | O7: =+(P7+Q7)+0.5*R7 -> 36.46 | P7: 13.06 | Q7: 12.90 | R7: 21 | S7: =+(T7+U7)+0.5*V7 -> 44.67 | T7: 16.07 | U7: 15.60 | V7: 26 | W7: =+(Y7+X7)+0.5*Z7 -> 68.96 | X7: 30.11 | Y7: 30.35 | Z7: 17 | AA7: =+(AB7+AC7)+0.5*AD7 -> 30.60 | AB7: 15.59 | AC7: 15.01 | AD7: 0 | AE7: =+(AF7+AG7+AH7)+0.5*AI7 -> 12.41 | AF7: 3.92 | AG7: 3.67 | AH7: 4.82 | AI7: 0 | AJ7: =+(AK7+AL7+AM7)+0.5*AN7 -> 28.86 | AK7: 6.06 | AL7: 10.72 | AM7: 10.58 | AN7: 3 | AO7: =+(AP7+AQ7)+0.5*AR7 -> 85.72 | AP7: 25.41 | AQ7: 60.31 | AR7: 0
A8: 5 | B8: Terry, Wade | C8: O | D8: =+F8+J8+O8+S8+W8+AA8+AE8+AJ8+AO8 -> 365.62 | E8: =+I8+N8+R8+V8+Z8+AD8+AI8+AN8+AR8 -> 58 | F8: =+(G8+H8)+(0.5*I8) -> 45.26 | G8: 24.49 | H8: 12.77 | I8: 16 | J8: =+(K8+L8+M8)+0.5*N8 -> 17.39 | K8: 7.63 | L8: 4.38 | M8: 5.38 | N8: 0 | O8: =+(P8+Q8)+0.5*R8 -> 32.51 | P8: 14.34 | Q8: 12.67 | R8: 11 | S8: =+(T8+U8)+0.5*V8 -> 49.14 | T8: 20.61 | U8: 19.53 | V8: 18 | W8: =+(Y8+X8)+0.5*Z8 -> 69.35 | X8: 33.00 | Y8: 30.35 | Z8: 12 | AA8: =+(AB8+AC8)+0.5*AD8 -> 36.12 | AB8: 16.44 | AC8: 19.68 | AD8: 0 | AE8: =+(AF8+AG8+AH8)+0.5*AI8 -> 17.70 | AF8: 6.04 | AG8: 5.91 | AH8: 5.75 | AI8: 0 | AJ8: =+(AK8+AL8+AM8)+0.5*AN8 -> 43.08 | AK8: 10.95 | AL8: 12.83 | AM8: 18.80 | AN8: 1 | AO8: =+(AP8+AQ8)+0.5*AR8 -> 55.07 | AP8: 25.48 | AQ8: 29.59 | AR8: 0
A9: 6 | B9: Mousley, Roger | C9: TRO | D9: =+F9+J9+O9+S9+W9+AA9+AE9+AJ9+AO9 -> 376.65 | E9: =+I9+N9+R9+V9+Z9+AD9+AI9+AN9+AR9 -> 94 | F9: =+(G9+H9)+(0.5*I9) -> 53.04 | G9: 26.51 | H9: 16.03 | I9: 21 | J9: =+(K9+L9+M9)+0.5*N9 -> 13.58 | K9: 4.56 | L9: 3.97 | M9: 5.05 | N9: 0 | O9: =+(P9+Q9)+0.5*R9 -> 26.97 | P9: 10.64 | Q9: 7.83 | R9: 17 | S9: =+(T9+U9)+0.5*V9 -> 37.67 | T9: 16.61 | U9: 15.56 | V9: 11 | W9: =+(Y9+X9)+0.5*Z9 -> 91.02 | X9: 34.58 | Y9: 47.44 | Z9: 18 | AA9: =+(AB9+AC9)+0.5*AD9 -> 43.59 | AB9: 17.16 | AC9: 16.43 | AD9: 20 | AE9: =+(AF9+AG9+AH9)+0.5*AI9 -> 14.41 | AF9: 3.80 | AG9: 4.58 | AH9: 6.03 | AI9: 0 | AJ9: =+(AK9+AL9+AM9)+0.5*AN9 -> 40.12 | AK9: 10.62 | AL9: 12.14 | AM9: 13.86 | AN9: 7 | AO9: =+(AP9+AQ9)+0.5*AR9 -> 56.25 | AP9: 23.92 | AQ9: 32.33 | AR9: 0
A10: 7 | B10: Sharp, Mikel | C10: T | D10: =+F10+J10+O10+S10+W10+AA10+AE10+AJ10+AO10 -> 388.42 | E10: =+I10+N10+R10+V10+Z10+AD10+AI10+AN10+AR10 -> 132 | F10: =+(G10+H10)+(0.5*I10) -> 46.16 | G10: 17.63 | H10: 13.03 | I10: 31 | J10: =+(K10+L10+M10)+0.5*N10 -> 17.73 | K10: 6.90 | L10: 6.23 | M10: 4.60 | N10: 0 | O10: =+(P10+Q10)+0.5*R10 -> 44.87 | P10: 17.71 | Q10: 12.16 | R10: 30 | S10: =+(T10+U10)+0.5*V10 -> 42.07 | T10: 17.30 | U10: 17.77 | V10: 14 | W10: =+(Y10+X10)+0.5*Z10 -> 87.71 | X10: 39.28 | Y10: 26.93 | Z10: 43 | AA10: =+(AB10+AC10)+0.5*AD10 -> 37.59 | AB10: 17.04 | AC10: 20.55 | AD10: 0 | AE10: =+(AF10+AG10+AH10)+0.5*AI10 -> 22.50 | AF10: 3.86 | AG10: 5.41 | AH10: 10.23 | AI10: 6 | AJ10: =+(AK10+AL10+AM10)+0.5*AN10 -> 39.12 | AK10: 7.34 | AL10: 10.72 | AM10: 17.06 | AN10: 8 | AO10: =+(AP10+AQ10)+0.5*AR10 -> 50.67 | AP10: 26.02 | AQ10: 24.65 | AR10: 0
A11: 8 | B11: Vollmer, Phillip | C11: L | D11: =+F11+J11+O11+S11+W11+AA11+AE11+AJ11+AO11 -> 393.03 | E11: =+I11+N11+R11+V11+Z11+AD11+AI11+AN11+AR11 -> 105 | F11: =+(G11+H11)+(0.5*I11) -> 55.44 | G11: 26.64 | H11: 14.80 | I11: 28 | J11: =+(K11+L11+M11)+0.5*N11 -> 16.11 | K11: 6.76 | L11: 4.64 | M11: 4.71 | N11: 0 | O11: =+(P11+Q11)+0.5*R11 -> 37.36 | P11: 14.87 | Q11: 15.49 | R11: 14 | S11: =+(T11+U11)+0.5*V11 -> 51.12 | T11: 20.86 | U11: 21.26 | V11: 18 | W11: =+(Y11+X11)+0.5*Z11 -> 79.79 | X11: 33.65 | Y11: 32.64 | Z11: 27 | AA11: =+(AB11+AC11)+0.5*AD11 -> 54.56 | AB11: 33.53 | AC11: 21.03 | AD11: 0 | AE11: =+(AF11+AG11+AH11)+0.5*AI11 -> 14.35 | AF11: 4.43 | AG11: 3.78 | AH11: 6.14 | AI11: 0 | AJ11: =+(AK11+AL11+AM11)+0.5*AN11 -> 34.57 | AK11: 6.98 | AL11: 9.51 | AM11: 9.08 | AN11: 18 | AO11: =+(AP11+AQ11)+0.5*AR11 -> 49.73 | AP11: 23.16 | AQ11: 26.57 | AR11: 0
A12: 9 | B12: Ostler, Jeff | C12: TRO | D12: =+F12+J12+O12+S12+W12+AA12+AE12+AJ12+AO12 -> 394.13 | E12: =+I12+N12+R12+V12+Z12+AD12+AI12+AN12+AR12 -> 78 | F12: =+(G12+H12)+(0.5*I12) -> 36.77 | G12: 20.22 | H12: 11.55 | I12: 10 | J12: =+(K12+L12+M12)+0.5*N12 -> 12.87 | K12: 4.22 | L12: 5.81 | M12: 2.84 | N12: 0 | O12: =+(P12+Q12)+0.5*R12 -> 42.78 | P12: 20.13 | Q12: 13.65 | R12: 18 | S12: =+(T12+U12)+0.5*V12 -> 52.10 | T12: 21.88 | U12: 19.72 | V12: 21 | W12: =+(Y12+X12)+0.5*Z12 -> 73.80 | X12: 34.56 | Y12: 31.24 | Z12: 16 | AA12: =+(AB12+AC12)+0.5*AD12 -> 34.42 | AB12: 21.86 | AC12: 12.56 | AD12: 0 | AE12: =+(AF12+AG12+AH12)+0.5*AI12 -> 14.29 | AF12: 3.64 | AG12: 3.08 | AH12: 7.57 | AI12: 0 | AJ12: =+(AK12+AL12+AM12)+0.5*AN12 -> 72.32 | AK12: 8.80 | AL12: 36.07 | AM12: 20.95 | AN12: 13 | AO12: =+(AP12+AQ12)+0.5*AR12 -> 54.78 | AP12: 19.96 | AQ12: 34.82 | AR12: 0
A13: 10 | B13: Lowe, John | C13: T | D13: =+F13+J13+O13+S13+W13+AA13+AE13+AJ13+AO13 -> 396.47 | E13: =+I13+N13+R13+V13+Z13+AD13+AI13+AN13+AR13 -> 66 | F13: =+(G13+H13)+(0.5*I13) -> 53.45 | G13: 28.35 | H13: 15.60 | I13: 19 | J13: =+(K13+L13+M13)+0.5*N13 -> 14.20 | K13: 4.07 | L13: 5.07 | M13: 5.06 | N13: 0 | O13: =+(P13+Q13)+0.5*R13 -> 49.95 | P13: 20.72 | Q13: 23.23 | R13: 12 | S13: =+(T13+U13)+0.5*V13 -> 49.16 | T13: 20.75 | U13: 22.41 | V13: 12 | W13: =+(Y13+X13)+0.5*Z13 -> 82.86 | X13: 37.91 | Y13: 33.95 | Z13: 22 | AA13: =+(AB13+AC13)+0.5*AD13 -> 49.19 | AB13: 19.99 | AC13: 29.20 | AD13: 0 | AE13: =+(AF13+AG13+AH13)+0.5*AI13 -> 14.21 | AF13: 4.44 | AG13: 3.92 | AH13: 5.85 | AI13: 0 | AJ13: =+(AK13+AL13+AM13)+0.5*AN13 -> 29.49 | AK13: 6.92 | AL13: 9.97 | AM13: 12.10 | AN13: 1 | AO13: =+(AP13+AQ13)+0.5*AR13 -> 53.96 | AP13: 20.98 | AQ13: 32.98 | AR13: 0
A14: 11 | B14: Correia, Larry | C14: T | D14: =+F14+J14+O14+S14+W14+AA14+AE14+AJ14+AO14 -> 397.51 | E14: =+I14+N14+R14+V14+Z14+AD14+AI14+AN14+AR14 -> 149 | F14: =+(G14+H14)+(0.5*I14) -> 45.46 | G14: 17.53 | H14: 14.93 | I14: 26 | J14: =+(K14+L14+M14)+0.5*N14 -> 13.65 | K14: 5.58 | L14: 4.10 | M14: 3.97 | N14: 0 | O14: =+(P14+Q14)+0.5*R14 -> 38.98 | P14: 15.06 | Q14: 11.42 | R14: 25 | S14: =+(T14+U14)+0.5*V14 -> 51.98 | T14: 14.37 | U14: 16.61 | V14: 42 | W14: =+(Y14+X14)+0.5*Z14 -> 84.40 | X14: 30.56 | Y14: 35.84 | Z14: 36 | AA14: =+(AB14+AC14)+0.5*AD14 -> 28.63 | AB14: 14.79 | AC14: 13.84 | AD14: 0 | AE14: =+(AF14+AG14+AH14)+0.5*AI14 -> 15.41 | AF14: 3.97 | AG14: 4.45 | AH14: 6.99 | AI14: 0 | AJ14: =+(AK14+AL14+AM14)+0.5*AN14 -> 50.48 | AK14: 7.57 | AL14: 10.23 | AM14: 22.68 | AN14: 20 | AO14: =+(AP14+AQ14)+0.5*AR14 -> 68.52 | AP14: 25.45 | AQ14: 43.07 | AR14: 0
A15: 12 | B15: Cox, Roger | C15: ? | D15: =+F15+J15+O15+S15+W15+AA15+AE15+AJ15+AO15 -> 399.90 | E15: =+I15+N15+R15+V15+Z15+AD15+AI15+AN15+AR15 -> 140 | F15: =+(G15+H15)+(0.5*I15) -> 51.92 | G15: 20.52 | H15: 12.40 | I15: 38 | J15: =+(K15+L15+M15)+0.5*N15 -> 12.54 | K15: 3.64 | L15: 3.59 | M15: 5.31 | N15: 0 | O15: =+(P15+Q15)+0.5*R15 -> 40.07 | P15: 11.27 | Q15: 12.30 | R15: 33 | S15: =+(T15+U15)+0.5*V15 -> 58.96 | T15: 17.52 | U15: 27.94 | V15: 27 | W15: =+(Y15+X15)+0.5*Z15 -> 74.40 | X15: 32.29 | Y15: 34.61 | Z15: 15 | AA15: =+(AB15+AC15)+0.5*AD15 -> 39.07 | AB15: 19.57 | AC15: 19.50 | AD15: 0 | AE15: =+(AF15+AG15+AH15)+0.5*AI15 -> 19.26 | AF15: 8.29 | AG15: 4.20 | AH15: 6.77 | AI15: 0 | AJ15: =+(AK15+AL15+AM15)+0.5*AN15 -> 54.56 | AK15: 9.19 | AL15: 13.19 | AM15: 18.68 | AN15: 27 | AO15: =+(AP15+AQ15)+0.5*AR15 -> 49.12 | AP15: 24.01 | AQ15: 25.11 | AR15: 0
A16: 13 | B16: Terry, Mark | C16: O | D16: =+F16+J16+O16+S16+W16+AA16+AE16+AJ16+AO16 -> 420.81 | E16: =+I16+N16+R16+V16+Z16+AD16+AI16+AN16+AR16 -> 88 | F16: =+(G16+H16)+(0.5*I16) -> 51.15 | G16: 26.00 | H16: 16.65 | I16: 17 | J16: =+(K16+L16+M16)+0.5*N16 -> 13.28 | K16: 4.40 | L16: 4.19 | M16: 4.69 | N16: 0 | O16: =+(P16+Q16)+0.5*R16 -> 33.43 | P16: 12.79 | Q16: 9.64 | R16: 22 | S16: =+(T16+U16)+0.5*V16 -> 77.12 | T16: 30.59 | U16: 42.03 | V16: 9 | W16: =+(Y16+X16)+0.5*Z16 -> 92.70 | X16: 48.10 | Y16: 26.60 | Z16: 36 | AA16: =+(AB16+AC16)+0.5*AD16 -> 37.91 | AB16: 22.49 | AC16: 15.42 | AD16: 0 | AE16: =+(AF16+AG16+AH16)+0.5*AI16 -> 14.44 | AF16: 4.24 | AG16: 3.78 | AH16: 6.42 | AI16: 0 | AJ16: =+(AK16+AL16+AM16)+0.5*AN16 -> 39.36 | AK16: 8.14 | AL16: 10.04 | AM16: 19.18 | AN16: 4 | AO16: =+(AP16+AQ16)+0.5*AR16 -> 61.42 | AP16: 32.75 | AQ16: 28.67 | AR16: 0
A17: 14 | B17: Richards, Dave | C17: T | D17: =+F17+J17+O17+S17+W17+AA17+AE17+AJ17+AO17 -> 425.81 | E17: =+I17+N17+R17+V17+Z17+AD17+AI17+AN17+AR17 -> 92 | F17: =+(G17+H17)+(0.5*I17) -> 49.67 | G17: 27.26 | H17: 14.41 | I17: 16 | J17: =+(K17+L17+M17)+0.5*N17 -> 15.98 | K17: 5.94 | L17: 5.12 | M17: 4.92 | N17: 0 | O17: =+(P17+Q17)+0.5*R17 -> 39.12 | P17: 16.28 | Q17: 17.34 | R17: 11 | S17: =+(T17+U17)+0.5*V17 -> 63.36 | T17: 29.25 | U17: 26.11 | V17: 16 | W17: =+(Y17+X17)+0.5*Z17 -> 74.69 | X17: 32.45 | Y17: 34.24 | Z17: 16 | AA17: =+(AB17+AC17)+0.5*AD17 -> 28.38 | AB17: 15.22 | AC17: 13.16 | AD17: 0 | AE17: =+(AF17+AG17+AH17)+0.5*AI17 -> 20.56 | AF17: 6.67 | AG17: 6.19 | AH17: 7.70 | AI17: 0 | AJ17: =+(AK17+AL17+AM17)+0.5*AN17 -> 75.88 | AK17: 16.94 | AL17: 9.84 | AM17: 32.60 | AN17: 33 | AO17: =+(AP17+AQ17)+0.5*AR17 -> 58.17 | AP17: 28.04 | AQ17: 30.13 | AR17: 0
A18: 15 | B18: Beck, Dave | C18: L | D18: =+F18+J18+O18+S18+W18+AA18+AE18+AJ18+AO18 -> 434.54 | E18: =+I18+N18+R18+V18+Z18+AD18+AI18+AN18+AR18 -> 114 | F18: =+(G18+H18)+(0.5*I18) -> 51.40 | G18: 23.69 | H18: 13.71 | I18: 28 | J18: =+(K18+L18+M18)+0.5*N18 -> 12.50 | K18: 4.44 | L18: 4.11 | M18: 3.95 | N18: 0 | O18: =+(P18+Q18)+0.5*R18 -> 46.63 | P18: 17.79 | Q18: 16.34 | R18: 25 | S18: =+(T18+U18)+0.5*V18 -> 57.12 | T18: 21.64 | U18: 19.48 | V18: 32 | W18: =+(Y18+X18)+0.5*Z18 -> 88.03 | X18: 39.12 | Y18: 38.91 | Z18: 20 | AA18: =+(AB18+AC18)+0.5*AD18 -> 37.03 | AB18: 17.88 | AC18: 19.15 | AD18: 0 | AE18: =+(AF18+AG18+AH18)+0.5*AI18 -> 10.57 | AF18: 3.84 | AG18: 3.50 | AH18: 3.23 | AI18: 0 | AJ18: =+(AK18+AL18+AM18)+0.5*AN18 -> 58.73 | AK18: 11.05 | AL18: 18.79 | AM18: 24.39 | AN18: 9 | AO18: =+(AP18+AQ18)+0.5*AR18 -> 72.53 | AP18: 24.90 | AQ18: 47.63 | AR18: 0
A19: 16 | B19: Peterson, Scott | C19: TRO | D19: =+F19+J19+O19+S19+W19+AA19+AE19+AJ19+AO19 -> 446.31 | E19: =+I19+N19+R19+V19+Z19+AD19+AI19+AN19+AR19 -> 183 | F19: =+(G19+H19)+(0.5*I19) -> 70.74 | G19: 21.09 | H19: 20.65 | I19: 58 | J19: =+(K19+L19+M19)+0.5*N19 -> 18.11 | K19: 3.61 | L19: 3.60 | M19: 10.90 | N19: 0 | O19: =+(P19+Q19)+0.5*R19 -> 56.26 | P19: 24.46 | Q19: 17.80 | R19: 28 | S19: =+(T19+U19)+0.5*V19 -> 51.70 | T19: 18.75 | U19: 20.95 | V19: 24 | W19: =+(Y19+X19)+0.5*Z19 -> 88.56 | X19: 32.81 | Y19: 24.75 | Z19: 62 | AA19: =+(AB19+AC19)+0.5*AD19 -> 49.48 | AB19: 29.33 | AC19: 20.15 | AD19: 0 | AE19: =+(AF19+AG19+AH19)+0.5*AI19 -> 11.24 | AF19: 3.20 | AG19: 3.29 | AH19: 4.75 | AI19: 0 | AJ19: =+(AK19+AL19+AM19)+0.5*AN19 -> 44.22 | AK19: 9.06 | AL19: 10.21 | AM19: 19.45 | AN19: 11 | AO19: =+(AP19+AQ19)+0.5*AR19 -> 56.00 | AP19: 28.72 | AQ19: 27.28 | AR19: 0
A20: 17 | B20: Zaccardi, Pat | C20: L | D20: =+F20+J20+O20+S20+W20+AA20+AE20+AJ20+AO20 -> 448.40 | E20: =+I20+N20+R20+V20+Z20+AD20+AI20+AN20+AR20 -> 61 | F20: =+(G20+H20)+(0.5*I20) -> 52.66 | G20: 27.11 | H20: 19.05 | I20: 13 | J20: =+(K20+L20+M20)+0.5*N20 -> 13.46 | K20: 4.53 | L20: 4.72 | M20: 4.21 | N20: 0 | O20: =+(P20+Q20)+0.5*R20 -> 39.06 | P20: 20.48 | Q20: 17.08 | R20: 3 | S20: =+(T20+U20)+0.5*V20 -> 59.84 | T20: 29.78 | U20: 24.06 | V20: 12 | W20: =+(Y20+X20)+0.5*Z20 -> 102.91 | X20: 45.98 | Y20: 47.93 | Z20: 18 | AA20: =+(AB20+AC20)+0.5*AD20 -> 48.92 | AB20: 25.69 | AC20: 23.23 | AD20: 0 | AE20: =+(AF20+AG20+AH20)+0.5*AI20 -> 17.38 | AF20: 4.87 | AG20: 4.14 | AH20: 8.37 | AI20: 0 | AJ20: =+(AK20+AL20+AM20)+0.5*AN20 -> 49.40 | AK20: 12.77 | AL20: 11.53 | AM20: 17.60 | AN20: 15 | AO20: =+(AP20+AQ20)+0.5*AR20 -> 64.77 | AP20: 28.61 | AQ20: 36.16 | AR20: 0
A21: 18 | B21: Eddy, Nephi | C21: TRO | D21: =+F21+J21+O21+S21+W21+AA21+AE21+AJ21+AO21 -> 452.24 | E21: =+I21+N21+R21+V21+Z21+AD21+AI21+AN21+AR21 -> 101 | F21: =+(G21+H21)+(0.5*I21) -> 55.88 | G21: 32.45 | H21: 16.93 | I21: 13 | J21: =+(K21+L21+M21)+0.5*N21 -> 17.03 | K21: 7.15 | L21: 5.29 | M21: 4.59 | N21: 0 | O21: =+(P21+Q21)+0.5*R21 -> 45.66 | P21: 16.79 | Q21: 15.37 | R21: 27 | S21: =+(T21+U21)+0.5*V21 -> 50.58 | T21: 19.92 | U21: 21.66 | V21: 18 | W21: =+(Y21+X21)+0.5*Z21 -> 91.13 | X21: 43.71 | Y21: 36.42 | Z21: 22 | AA21: =+(AB21+AC21)+0.5*AD21 -> 47.99 | AB21: 22.61 | AC21: 25.38 | AD21: 0 | AE21: =+(AF21+AG21+AH21)+0.5*AI21 -> 19.98 | AF21: 7.02 | AG21: 5.81 | AH21: 7.15 | AI21: 0 | AJ21: =+(AK21+AL21+AM21)+0.5*AN21 -> 66.94 | AK21: 8.31 | AL21: 15.99 | AM21: 32.14 | AN21: 21 | AO21: =+(AP21+AQ21)+0.5*AR21 -> 57.05 | AP21: 21.95 | AQ21: 35.10 | AR21: 0
A22: 19 | B22: Montgomery, Robert | C22: T | D22: =+F22+J22+O22+S22+W22+AA22+AE22+AJ22+AO22 -> 452.35 | E22: =+I22+N22+R22+V22+Z22+AD22+AI22+AN22+AR22 -> 74 | F22: =+(G22+H22)+(0.5*I22) -> 42.33 | G22: 20.16 | H22: 16.17 | I22: 12 | J22: =+(K22+L22+M22)+0.5*N22 -> 20.19 | K22: 7.45 | L22: 6.27 | M22: 6.47 | N22: 0 | O22: =+(P22+Q22)+0.5*R22 -> 41.94 | P22: 15.12 | Q22: 14.82 | R22: 24 | S22: =+(T22+U22)+0.5*V22 -> 45.57 | T22: 24.92 | U22: 20.65 | V22: 0 | W22: =+(Y22+X22)+0.5*Z22 -> 104.70 | X22: 43.75 | Y22: 42.95 | Z22: 36 | AA22: =+(AB22+AC22)+0.5*AD22 -> 40.19 | AB22: 23.92 | AC22: 16.27 | AD22: 0 | AE22: =+(AF22+AG22+AH22)+0.5*AI22 -> 22.34 | AF22: 5.62 | AG22: 8.12 | AH22: 8.60 | AI22: 0 | AJ22: =+(AK22+AL22+AM22)+0.5*AN22 -> 31.69 | AK22: 8.37 | AL22: 13.55 | AM22: 8.77 | AN22: 2 | AO22: =+(AP22+AQ22)+0.5*AR22 -> 103.40 | AP22: 42.20 | AQ22: 61.20 | AR22: 0
A23: 20 | B23: Brown, Keith | C23: T | D23: =+F23+J23+O23+S23+W23+AA23+AE23+AJ23+AO23 -> 452.90 | E23: =+I23+N23+R23+V23+Z23+AD23+AI23+AN23+AR23 -> 74 | F23: =+(G23+H23)+(0.5*I23) -> 50.22 | G23: 28.74 | H23: 12.98 | I23: 17 | J23: =+(K23+L23+M23)+0.5*N23 -> 23.69 | K23: 7.14 | L23: 8.18 | M23: 8.37 | N23: 0 | O23: =+(P23+Q23)+0.5*R23 -> 40.48 | P23: 16.23 | Q23: 14.75 | R23: 19 | S23: =+(T23+U23)+0.5*V23 -> 68.93 | T23: 26.63 | U23: 36.30 | V23: 12 | W23: =+(Y23+X23)+0.5*Z23 -> 76.38 | X23: 35.45 | Y23: 29.43 | Z23: 23 | AA23: =+(AB23+AC23)+0.5*AD23 -> 40.46 | AB23: 17.46 | AC23: 23.00 | AD23: 0 | AE23: =+(AF23+AG23+AH23)+0.5*AI23 -> 33.84 | AF23: 12.12 | AG23: 11.72 | AH23: 10.00 | AI23: 0 | AJ23: =+(AK23+AL23+AM23)+0.5*AN23 -> 54.59 | AK23: 16.11 | AL23: 11.44 | AM23: 25.54 | AN23: 3 | AO23: =+(AP23+AQ23)+0.5*AR23 -> 64.31 | AP23: 36.10 | AQ23: 28.21 | AR23: 0
A24: 21 | B24: Brown, Jason | C24: L | D24: =+F24+J24+O24+S24+W24+AA24+AE24+AJ24+AO24 -> 462.40 | E24: =+I24+N24+R24+V24+Z24+AD24+AI24+AN24+AR24 -> 105 | F24: =+(G24+H24)+(0.5*I24) -> 61.44 | G24: 29.45 | H24: 16.99 | I24: 30 | J24: =+(K24+L24+M24)+0.5*N24 -> 26.53 | K24: 10.32 | L24: 7.12 | M24: 9.09 | N24: 0 | O24: =+(P24+Q24)+0.5*R24 -> 40.66 | P24: 15.09 | Q24: 19.57 | R24: 12 | S24: =+(T24+U24)+0.5*V24 -> 47.14 | T24: 20.78 | U24: 19.86 | V24: 13 | W24: =+(Y24+X24)+0.5*Z24 -> 81.38 | X24: 37.08 | Y24: 32.30 | Z24: 24 | AA24: =+(AB24+AC24)+0.5*AD24 -> 65.76 | AB24: 29.59 | AC24: 31.17 | AD24: 10 | AE24: =+(AF24+AG24+AH24)+0.5*AI24 -> 27.01 | AF24: 5.94 | AG24: 5.06 | AH24: 16.01 | AI24: 0 | AJ24: =+(AK24+AL24+AM24)+0.5*AN24 -> 46.36 | AK24: 9.54 | AL24: 13.36 | AM24: 15.46 | AN24: 16 | AO24: =+(AP24+AQ24)+0.5*AR24 -> 66.12 | AP24: 33.31 | AQ24: 32.81 | AR24: 0
A25: 22 | B25: Durant, Steve | C25: ? | D25: =+F25+J25+O25+S25+W25+AA25+AE25+AJ25+AO25 -> 475.28 | E25: =+I25+N25+R25+V25+Z25+AD25+AI25+AN25+AR25 -> 66 | F25: =+(G25+H25)+(0.5*I25) -> 54.09 | G25: 24.57 | H25: 20.52 | I25: 18 | J25: =+(K25+L25+M25)+0.5*N25 -> 19.47 | K25: 7.81 | L25: 5.00 | M25: 6.66 | N25: 0 | O25: =+(P25+Q25)+0.5*R25 -> 30.82 | P25: 15.39 | Q25: 14.93 | R25: 1 | S25: =+(T25+U25)+0.5*V25 -> 64.29 | T25: 27.73 | U25: 21.56 | V25: 30 | W25: =+(Y25+X25)+0.5*Z25 -> 93.70 | X25: 44.26 | Y25: 47.44 | Z25: 4 | AA25: =+(AB25+AC25)+0.5*AD25 -> 57.96 | AB25: 30.34 | AC25: 27.62 | AD25: 0 | AE25: =+(AF25+AG25+AH25)+0.5*AI25 -> 26.09 | AF25: 8.31 | AG25: 7.26 | AH25: 10.52 | AI25: 0 | AJ25: =+(AK25+AL25+AM25)+0.5*AN25 -> 58.75 | AK25: 12.73 | AL25: 15.48 | AM25: 24.04 | AN25: 13 | AO25: =+(AP25+AQ25)+0.5*AR25 -> 70.11 | AP25: 35.24 | AQ25: 34.87 | AR25: 0
A26: 23 | B26: Redford, "Red" | C26: T | D26: =+F26+J26+O26+S26+W26+AA26+AE26+AJ26+AO26 -> 475.89 | E26: =+I26+N26+R26+V26+Z26+AD26+AI26+AN26+AR26 -> 99 | F26: =+(G26+H26)+(0.5*I26) -> 48.28 | G26: 25.99 | H26: 18.29 | I26: 8 | J26: =+(K26+L26+M26)+0.5*N26 -> 13.22 | K26: 4.67 | L26: 4.33 | M26: 4.22 | N26: 0 | O26: =+(P26+Q26)+0.5*R26 -> 61.46 | P26: 23.30 | Q26: 23.16 | R26: 30 | S26: =+(T26+U26)+0.5*V26 -> 66.94 | T26: 24.22 | U26: 29.22 | V26: 27 | W26: =+(Y26+X26)+0.5*Z26 -> 119.94 | X26: 50.73 | Y26: 54.21 | Z26: 30 | AA26: =+(AB26+AC26)+0.5*AD26 -> 57.88 | AB26: 34.21 | AC26: 23.67 | AD26: 0 | AE26: =+(AF26+AG26+AH26)+0.5*AI26 -> 16.54 | AF26: 4.46 | AG26: 5.36 | AH26: 6.72 | AI26: 0 | AJ26: =+(AK26+AL26+AM26)+0.5*AN26 -> 30.74 | AK26: 7.30 | AL26: 9.68 | AM26: 11.76 | AN26: 4 | AO26: =+(AP26+AQ26)+0.5*AR26 -> 60.89 | AP26: 29.67 | AQ26: 31.22 | AR26: 0
A27: 24 | B27: Scott, Alan | C27: ? | D27: =+F27+J27+O27+S27+W27+AA27+AE27+AJ27+AO27 -> 488.79 | E27: =+I27+N27+R27+V27+Z27+AD27+AI27+AN27+AR27 -> 116 | F27: =+(G27+H27)+(0.5*I27) -> 60.60 | G27: 23.28 | H27: 17.32 | I27: 40 | J27: =+(K27+L27+M27)+0.5*N27 -> 22.28 | K27: 7.29 | L27: 7.77 | M27: 7.22 | N27: 0 | O27: =+(P27+Q27)+0.5*R27 -> 45.79 | P27: 14.12 | Q27: 14.17 | R27: 35 | S27: =+(T27+U27)+0.5*V27 -> 56.98 | T27: 28.68 | U27: 21.30 | V27: 14 | W27: =+(Y27+X27)+0.5*Z27 -> 84.45 | X27: 37.81 | Y27: 35.14 | Z27: 23 | AA27: =+(AB27+AC27)+0.5*AD27 -> 56.67 | AB27: 30.53 | AC27: 26.14 | AD27: 0 | AE27: =+(AF27+AG27+AH27)+0.5*AI27 -> 19.71 | AF27: 6.77 | AG27: 5.68 | AH27: 7.26 | AI27: 0 | AJ27: =+(AK27+AL27+AM27)+0.5*AN27 -> 50.46 | AK27: 14.67 | AL27: 16.76 | AM27: 17.03 | AN27: 4 | AO27: =+(AP27+AQ27)+0.5*AR27 -> 91.85 | AP27: 33.52 | AQ27: 58.33 | AR27: 0
A28: 25 | B28: Decker, Dennis | C28: ? | D28: =+F28+J28+O28+S28+W28+AA28+AE28+AJ28+AO28 -> 493.92 | E28: =+I28+N28+R28+V28+Z28+AD28+AI28+AN28+AR28 -> 169 | F28: =+(G28+H28)+(0.5*I28) -> 60.41 | G28: 28.52 | H28: 12.39 | I28: 39 | J28: =+(K28+L28+M28)+0.5*N28 -> 26.52 | K28: 5.11 | L28: 9.74 | M28: 11.67 | N28: 0 | O28: =+(P28+Q28)+0.5*R28 -> 54.98 | P28: 18.05 | Q28: 15.43 | R28: 43 | S28: =+(T28+U28)+0.5*V28 -> 63.08 | T28: 26.65 | U28: 26.43 | V28: 20 | W28: =+(Y28+X28)+0.5*Z28 -> 100.57 | X28: 35.95 | Y28: 37.12 | Z28: 55 | AA28: =+(AB28+AC28)+0.5*AD28 -> 45.60 | AB28: 31.66 | AC28: 13.94 | AD28: 0 | AE28: =+(AF28+AG28+AH28)+0.5*AI28 -> 17.60 | AF28: 5.05 | AG28: 6.26 | AH28: 6.29 | AI28: 0 | AJ28: =+(AK28+AL28+AM28)+0.5*AN28 -> 66.71 | AK28: 15.29 | AL28: 19.91 | AM28: 25.51 | AN28: 12 | AO28: =+(AP28+AQ28)+0.5*AR28 -> 58.45 | AP28: 27.33 | AQ28: 31.12 | AR28: 0
A29: 26 | B29: Simpson, Harold | C29: TRO | D29: =+F29+J29+O29+S29+W29+AA29+AE29+AJ29+AO29 -> 498.26 | E29: =+I29+N29+R29+V29+Z29+AD29+AI29+AN29+AR29 -> 120 | F29: =+(G29+H29)+(0.5*I29) -> 64.28 | G29: 35.47 | H29: 14.31 | I29: 29 | J29: =+(K29+L29+M29)+0.5*N29 -> 14.67 | K29: 5.62 | L29: 4.92 | M29: 4.13 | N29: 0 | O29: =+(P29+Q29)+0.5*R29 -> 52.15 | P29: 16.35 | Q29: 18.30 | R29: 35 | S29: =+(T29+U29)+0.5*V29 -> 59.46 | T29: 27.10 | U29: 20.36 | V29: 24 | W29: =+(Y29+X29)+0.5*Z29 -> 95.16 | X29: 40.61 | Y29: 39.55 | Z29: 30 | AA29: =+(AB29+AC29)+0.5*AD29 -> 50.73 | AB29: 30.23 | AC29: 20.50 | AD29: 0 | AE29: =+(AF29+AG29+AH29)+0.5*AI29 -> 21.77 | AF29: 5.21 | AG29: 8.11 | AH29: 8.45 | AI29: 0 | AJ29: =+(AK29+AL29+AM29)+0.5*AN29 -> 72.91 | AK29: 9.89 | AL29: 21.59 | AM29: 40.43 | AN29: 2 | AO29: =+(AP29+AQ29)+0.5*AR29 -> 67.13 | AP29: 22.19 | AQ29: 44.94 | AR29: 0
A30: 27 | B30: Lauritzen, Scott | C30: ? | D30: =+F30+J30+O30+S30+W30+AA30+AE30+AJ30+AO30 -> 502.98 | E30: =+I30+N30+R30+V30+Z30+AD30+AI30+AN30+AR30 -> 118 | F30: =+(G30+H30)+(0.5*I30) -> 54.04 | G30: 25.84 | H30: 14.20 | I30: 28 | J30: =+(K30+L30+M30)+0.5*N30 -> 21.17 | K30: 5.84 | L30: 8.89 | M30: 6.44 | N30: 0 | O30: =+(P30+Q30)+0.5*R30 -> 46.46 | P30: 21.76 | Q30: 18.20 | R30: 13 | S30: =+(T30+U30)+0.5*V30 -> 61.45 | T30: 25.68 | U30: 22.77 | V30: 26 | W30: =+(Y30+X30)+0.5*Z30 -> 101.36 | X30: 42.81 | Y30: 35.55 | Z30: 46 | AA30: =+(AB30+AC30)+0.5*AD30 -> 70.53 | AB30: 26.00 | AC30: 44.53 | AD30: 0 | AE30: =+(AF30+AG30+AH30)+0.5*AI30 -> 27.76 | AF30: 6.25 | AG30: 8.37 | AH30: 13.14 | AI30: 0 | AJ30: =+(AK30+AL30+AM30)+0.5*AN30 -> 38.46 | AK30: 10.17 | AL30: 10.77 | AM30: 15.02 | AN30: 5 | AO30: =+(AP30+AQ30)+0.5*AR30 -> 81.75 | AP30: 42.23 | AQ30: 39.52 | AR30: 0
A31: 28 | B31: Ostler, John | C31: T | D31: =+F31+J31+O31+S31+W31+AA31+AE31+AJ31+AO31 -> 519.71 | E31: =+I31+N31+R31+V31+Z31+AD31+AI31+AN31+AR31 -> 130 | F31: =+(G31+H31)+(0.5*I31) -> 66.31 | G31: 32.10 | H31: 14.71 | I31: 39 | J31: =+(K31+L31+M31)+0.5*N31 -> 25.68 | K31: 10.28 | L31: 4.60 | M31: 10.80 | N31: 0 | O31: =+(P31+Q31)+0.5*R31 -> 47.18 | P31: 21.57 | Q31: 24.11 | R31: 3 | S31: =+(T31+U31)+0.5*V31 -> 57.00 | T31: 26.75 | U31: 22.25 | V31: 16 | W31: =+(Y31+X31)+0.5*Z31 -> 90.09 | X31: 44.39 | Y31: 39.20 | Z31: 13 | AA31: =+(AB31+AC31)+0.5*AD31 -> 61.29 | AB31: 27.99 | AC31: 28.30 | AD31: 10 | AE31: =+(AF31+AG31+AH31)+0.5*AI31 -> 16.35 | AF31: 4.48 | AG31: 4.68 | AH31: 7.19 | AI31: 0 | AJ31: =+(AK31+AL31+AM31)+0.5*AN31 -> 75.17 | AK31: 12.64 | AL31: 15.48 | AM31: 37.55 | AN31: 19 | AO31: =+(AP31+AQ31)+0.5*AR31 -> 80.64 | AP31: 33.19 | AQ31: 32.45 | AR31: 30
A32: 29 | B32: Knapp, Chris | C32: ? | D32: =+F32+J32+O32+S32+W32+AA32+AE32+AJ32+AO32 -> 522.72 | E32: =+I32+N32+R32+V32+Z32+AD32+AI32+AN32+AR32 -> 125 | F32: =+(G32+H32)+(0.5*I32) -> 70.83 | G32: 34.91 | H32: 22.42 | I32: 27 | J32: =+(K32+L32+M32)+0.5*N32 -> 14.46 | K32: 4.70 | L32: 5.64 | M32: 4.12 | N32: 0 | O32: =+(P32+Q32)+0.5*R32 -> 60.14 | P32: 24.90 | Q32: 21.24 | R32: 28 | S32: =+(T32+U32)+0.5*V32 -> 62.03 | T32: 24.02 | U32: 22.01 | V32: 32 | W32: =+(Y32+X32)+0.5*Z32 -> 105.04 | X32: 48.99 | Y32: 41.05 | Z32: 30 | AA32: =+(AB32+AC32)+0.5*AD32 -> 45.04 | AB32: 25.39 | AC32: 19.65 | AD32: 0 | AE32: =+(AF32+AG32+AH32)+0.5*AI32 -> 15.67 | AF32: 5.16 | AG32: 4.81 | AH32: 5.70 | AI32: 0 | AJ32: =+(AK32+AL32+AM32)+0.5*AN32 -> 77.58 | AK32: 14.61 | AL32: 20.10 | AM32: 38.87 | AN32: 8 | AO32: =+(AP32+AQ32)+0.5*AR32 -> 71.93 | AP32: 35.73 | AQ32: 36.20 | AR32: 0
A33: 30 | B33: Redford, Steve | C33: T | D33: =+F33+J33+O33+S33+W33+AA33+AE33+AJ33+AO33 -> 527.86 | E33: =+I33+N33+R33+V33+Z33+AD33+AI33+AN33+AR33 -> 172 | F33: =+(G33+H33)+(0.5*I33) -> 73.56 | G33: 27.01 | H33: 31.05 | I33: 31 | J33: =+(K33+L33+M33)+0.5*N33 -> 17.74 | K33: 6.49 | L33: 5.92 | M33: 5.33 | N33: 0 | O33: =+(P33+Q33)+0.5*R33 -> 58.22 | P33: 16.06 | Q33: 15.16 | R33: =7+13+13+15+6 -> 54 | S33: =+(T33+U33)+0.5*V33 -> 116.72 | T33: 44.46 | U33: 46.76 | V33: =7+18+6+20 -> 51 | W33: =+(Y33+X33)+0.5*Z33 -> 73.56 | X33: 27.01 | Y33: 31.05 | Z33: 31 | AA33: =+(AB33+AC33)+0.5*AD33 -> 43.22 | AB33: 16.61 | AC33: 26.61 | AD33: 0 | AE33: =+(AF33+AG33+AH33)+0.5*AI33 -> 24.31 | AF33: 6.94 | AG33: 6.44 | AH33: 10.93 | AI33: 0 | AJ33: =+(AK33+AL33+AM33)+0.5*AN33 -> 51.95 | AK33: 9.38 | AL33: 13.95 | AM33: 26.12 | AN33: 5 | AO33: =+(AP33+AQ33)+0.5*AR33 -> 68.58 | AP33: 36.25 | AQ33: 32.33 | AR33: 0
A34: 31 | B34: Taylor, Joshua | C34: T | D34: =+F34+J34+O34+S34+W34+AA34+AE34+AJ34+AO34 -> 547.50 | E34: =+I34+N34+R34+V34+Z34+AD34+AI34+AN34+AR34 -> 54 | F34: =+(G34+H34)+(0.5*I34) -> 58.37 | G34: 37.28 | H34: 20.09 | I34: 2 | J34: =+(K34+L34+M34)+0.5*N34 -> 21.84 | K34: 6.57 | L34: 9.02 | M34: 6.25 | N34: 0 | O34: =+(P34+Q34)+0.5*R34 -> 63.39 | P34: 32.32 | Q34: 23.57 | R34: 15 | S34: =+(T34+U34)+0.5*V34 -> 69.39 | T34: 26.89 | U34: 31.00 | V34: 23 | W34: =+(Y34+X34)+0.5*Z34 -> 126.04 | X34: 55.62 | Y34: 63.92 | Z34: 13 | AA34: =+(AB34+AC34)+0.5*AD34 -> 43.23 | AB34: 23.16 | AC34: 20.07 | AD34: 0 | AE34: =+(AF34+AG34+AH34)+0.5*AI34 -> 21.93 | AF34: 6.85 | AG34: 5.62 | AH34: 9.46 | AI34: 0 | AJ34: =+(AK34+AL34+AM34)+0.5*AN34 -> 36.34 | AK34: 9.93 | AL34: 11.02 | AM34: 14.89 | AN34: 1 | AO34: =+(AP34+AQ34)+0.5*AR34 -> 106.97 | AP34: 59.59 | AQ34: 47.38 | AR34: 0
A35: 32 | B35: Zaccardi, Juke | C35: L | D35: =+F35+J35+O35+S35+W35+AA35+AE35+AJ35+AO35 -> 562.81 | E35: =+I35+N35+R35+V35+Z35+AD35+AI35+AN35+AR35 -> 142 | F35: =+(G35+H35)+(0.5*I35) -> 53.70 | G35: 23.50 | H35: 12.70 | I35: 35 | J35: =+(K35+L35+M35)+0.5*N35 -> 15.87 | K35: 5.87 | L35: 5.17 | M35: 4.83 | N35: 0 | O35: =+(P35+Q35)+0.5*R35 -> 49.38 | P35: 23.10 | Q35: 17.78 | R35: 17 | S35: =+(T35+U35)+0.5*V35 -> 56.92 | T35: 19.77 | U35: 20.15 | V35: 34 | W35: =+(Y35+X35)+0.5*Z35 -> 106.79 | X35: 45.71 | Y35: 41.08 | Z35: 40 | AA35: =+(AB35+AC35)+0.5*AD35 -> 71.79 | AB35: 42.73 | AC35: 29.06 | AD35: 0 | AE35: =+(AF35+AG35+AH35)+0.5*AI35 -> 17.97 | AF35: 4.88 | AG35: 5.65 | AH35: 7.44 | AI35: 0 | AJ35: =+(AK35+AL35+AM35)+0.5*AN35 -> 61.25 | AK35: 16.86 | AL35: 20.48 | AM35: 20.91 | AN35: 6 | AO35: =+(AP35+AQ35)+0.5*AR35 -> 129.14 | AP35: 48.20 | AQ35: 75.94 | AR35: 10
A36: 33 | B36: Adams, Brent | C36: T | D36: =+F36+J36+O36+S36+W36+AA36+AE36+AJ36+AO36 -> 566.26 | E36: =+I36+N36+R36+V36+Z36+AD36+AI36+AN36+AR36 -> 55 | F36: =+(G36+H36)+(0.5*I36) -> 75.65 | G36: 31.15 | H36: 42.50 | I36: 4 | J36: =+(K36+L36+M36)+0.5*N36 -> 24.30 | K36: 10.34 | L36: 7.53 | M36: 6.43 | N36: 0 | O36: =+(P36+Q36)+0.5*R36 -> 65.99 | P36: 27.30 | Q36: 29.69 | R36: 18 | S36: =+(T36+U36)+0.5*V36 -> 88.68 | T36: 41.50 | U36: 43.18 | V36: 8 | W36: =+(Y36+X36)+0.5*Z36 -> 94.88 | X36: 41.50 | Y36: 41.88 | Z36: 23 | AA36: =+(AB36+AC36)+0.5*AD36 -> 55.34 | AB36: 22.39 | AC36: 32.95 | AD36: 0 | AE36: =+(AF36+AG36+AH36)+0.5*AI36 -> 26.96 | AF36: 7.54 | AG36: 7.44 | AH36: 11.98 | AI36: 0 | AJ36: =+(AK36+AL36+AM36)+0.5*AN36 -> 41.93 | AK36: 12.38 | AL36: 13.35 | AM36: 15.20 | AN36: 2 | AO36: =+(AP36+AQ36)+0.5*AR36 -> 92.53 | AP36: 50.13 | AQ36: 42.40 | AR36: 0
A37: 34 | B37: Brownlee, Mike | C37: TRO | D37: =+F37+J37+O37+S37+W37+AA37+AE37+AJ37+AO37 -> 574.37 | E37: =+I37+N37+R37+V37+Z37+AD37+AI37+AN37+AR37 -> 102 | F37: =+(G37+H37)+(0.5*I37) -> 84.72 | G37: 31.22 | H37: 31.50 | I37: 44 | J37: =+(K37+L37+M37)+0.5*N37 -> 18.13 | K37: 6.91 | L37: 5.25 | M37: 5.97 | N37: 0 | O37: =+(P37+Q37)+0.5*R37 -> 66.37 | P37: 32.44 | Q37: 22.43 | R37: 23 | S37: =+(T37+U37)+0.5*V37 -> 90.55 | T37: 53.34 | U37: 27.71 | V37: 19 | W37: =+(Y37+X37)+0.5*Z37 -> 100.88 | X37: 48.33 | Y37: 48.05 | Z37: 9 | AA37: =+(AB37+AC37)+0.5*AD37 -> 67.27 | AB37: 38.55 | AC37: 28.72 | AD37: 0 | AE37: =+(AF37+AG37+AH37)+0.5*AI37 -> 22.08 | AF37: 5.98 | AG37: 7.41 | AH37: 8.69 | AI37: 0 | AJ37: =+(AK37+AL37+AM37)+0.5*AN37 -> 51.67 | AK37: 12.04 | AL37: 13.72 | AM37: 22.41 | AN37: 7 | AO37: =+(AP37+AQ37)+0.5*AR37 -> 72.70 | AP37: 38.49 | AQ37: 34.21 | AR37: 0
A38: 35 | B38: Kirkham, Glade | C38: L | D38: =+F38+J38+O38+S38+W38+AA38+AE38+AJ38+AO38 -> 581.37 | E38: =+I38+N38+R38+V38+Z38+AD38+AI38+AN38+AR38 -> 133 | F38: =+(G38+H38)+(0.5*I38) -> 58.53 | G38: 27.32 | H38: 24.21 | I38: 14 | J38: =+(K38+L38+M38)+0.5*N38 -> 17.69 | K38: 6.80 | L38: 6.11 | M38: 4.78 | N38: 0 | O38: =+(P38+Q38)+0.5*R38 -> 61.04 | P38: 15.75 | Q38: 18.29 | R38: 54 | S38: =+(T38+U38)+0.5*V38 -> 75.32 | T38: 37.17 | U38: 26.65 | V38: 23 | W38: =+(Y38+X38)+0.5*Z38 -> 113.09 | X38: 55.01 | Y38: 42.08 | Z38: 32 | AA38: =+(AB38+AC38)+0.5*AD38 -> 66.61 | AB38: 37.40 | AC38: 29.21 | AD38: 0 | AE38: =+(AF38+AG38+AH38)+0.5*AI38 -> 29.48 | AF38: 6.88 | AG38: 8.41 | AH38: 14.19 | AI38: 0 | AJ38: =+(AK38+AL38+AM38)+0.5*AN38 -> 85.39 | AK38: 12.07 | AL38: 30.47 | AM38: 37.85 | AN38: 10 | AO38: =+(AP38+AQ38)+0.5*AR38 -> 74.22 | AP38: 35.52 | AQ38: 38.70 | AR38: 0
A39: 36 | B39: Greenfield, Don | C39: L | D39: =+F39+J39+O39+S39+W39+AA39+AE39+AJ39+AO39 -> 593.24 | E39: =+I39+N39+R39+V39+Z39+AD39+AI39+AN39+AR39 -> 131 | F39: =+(G39+H39)+(0.5*I39) -> 60.92 | G39: 30.62 | H39: 13.80 | I39: 33 | J39: =+(K39+L39+M39)+0.5*N39 -> 16.84 | K39: 4.98 | L39: 6.12 | M39: 5.74 | N39: 0 | O39: =+(P39+Q39)+0.5*R39 -> 56.22 | P39: 25.19 | Q39: 23.03 | R39: 16 | S39: =+(T39+U39)+0.5*V39 -> 80.08 | T39: 39.68 | U39: 26.90 | V39: 27 | W39: =+(Y39+X39)+0.5*Z39 -> 133.77 | X39: 56.49 | Y39: 53.28 | Z39: 48 | AA39: =+(AB39+AC39)+0.5*AD39 -> 67.39 | AB39: 32.72 | AC39: 34.67 | AD39: 0 | AE39: =+(AF39+AG39+AH39)+0.5*AI39 -> 22.70 | AF39: 6.03 | AG39: 7.15 | AH39: 9.52 | AI39: 0 | AJ39: =+(AK39+AL39+AM39)+0.5*AN39 -> 60.03 | AK39: 11.86 | AL39: 17.48 | AM39: 27.19 | AN39: 7 | AO39: =+(AP39+AQ39)+0.5*AR39 -> 95.29 | AP39: 51.04 | AQ39: 44.25 | AR39: 0
A40: 37 | B40: Sharp, Jeff | C40: T | D40: =+F40+J40+O40+S40+W40+AA40+AE40+AJ40+AO40 -> 593.72 | E40: =+I40+N40+R40+V40+Z40+AD40+AI40+AN40+AR40 -> 236 | F40: =+(G40+H40)+(0.5*I40) -> 57.28 | G40: 20.94 | H40: 18.34 | I40: 36 | J40: =+(K40+L40+M40)+0.5*N40 -> 20.98 | K40: 6.81 | L40: 7.34 | M40: 6.83 | N40: 0 | O40: =+(P40+Q40)+0.5*R40 -> 53.06 | P40: 20.87 | Q40: 20.19 | R40: 24 | S40: =+(T40+U40)+0.5*V40 -> 80.63 | T40: 31.36 | U40: 23.77 | V40: 51 | W40: =+(Y40+X40)+0.5*Z40 -> 135.02 | X40: 43.02 | Y40: 37.50 | Z40: 109 | AA40: =+(AB40+AC40)+0.5*AD40 -> 58.43 | AB40: 38.03 | AC40: 20.40 | AD40: 0 | AE40: =+(AF40+AG40+AH40)+0.5*AI40 -> 42.85 | AF40: 10.24 | AG40: 14.97 | AH40: 17.64 | AI40: 0 | AJ40: =+(AK40+AL40+AM40)+0.5*AN40 -> 52.26 | AK40: 10.36 | AL40: 11.95 | AM40: 21.95 | AN40: 16 | AO40: =+(AP40+AQ40)+0.5*AR40 -> 93.21 | AP40: 57.69 | AQ40: 35.52 | AR40: 0
A41: 38 | B41: Scott, Michael | C41: ? | D41: =+F41+J41+O41+S41+W41+AA41+AE41+AJ41+AO41 -> 600.36 | E41: =+I41+N41+R41+V41+Z41+AD41+AI41+AN41+AR41 -> 162 | F41: =+(G41+H41)+(0.5*I41) -> 66.40 | G41: 25.01 | H41: 23.89 | I41: 35 | J41: =+(K41+L41+M41)+0.5*N41 -> 25.47 | K41: 11.08 | L41: 7.74 | M41: 6.65 | N41: 0 | O41: =+(P41+Q41)+0.5*R41 -> 61.58 | P41: 19.87 | Q41: 16.71 | R41: 50 | S41: =+(T41+U41)+0.5*V41 -> 83.72 | T41: 31.26 | U41: 32.96 | V41: 39 | W41: =+(Y41+X41)+0.5*Z41 -> 94.22 | X41: 42.70 | Y41: 40.02 | Z41: 23 | AA41: =+(AB41+AC41)+0.5*AD41 -> 54.69 | AB41: 28.02 | AC41: 26.67 | AD41: 0 | AE41: =+(AF41+AG41+AH41)+0.5*AI41 -> 20.06 | AF41: 6.09 | AG41: 5.46 | AH41: 8.51 | AI41: 0 | AJ41: =+(AK41+AL41+AM41)+0.5*AN41 -> 83.46 | AK41: 16.43 | AL41: 23.91 | AM41: 35.62 | AN41: 15 | AO41: =+(AP41+AQ41)+0.5*AR41 -> 110.76 | AP41: 68.35 | AQ41: 42.41 | AR41: 0
A42: 39 | B42: Stone, Scott | C42: T | D42: =+F42+J42+O42+S42+W42+AA42+AE42+AJ42+AO42 -> 610.41 | E42: =+I42+N42+R42+V42+Z42+AD42+AI42+AN42+AR42 -> 312 | F42: =+(G42+H42)+(0.5*I42) -> 179.80 | G42: 64.43 | H42: 61.37 | I42: 108 | J42: =+(K42+L42+M42)+0.5*N42 -> 16.72 | K42: 5.65 | L42: 5.86 | M42: 5.21 | N42: 0 | O42: =+(P42+Q42)+0.5*R42 -> 65.87 | P42: 20.23 | Q42: 15.14 | R42: 61 | S42: =+(T42+U42)+0.5*V42 -> 69.80 | T42: 28.72 | U42: 23.58 | V42: 35 | W42: =+(Y42+X42)+0.5*Z42 -> 58.81 | X42: 23.61 | Y42: 12.70 | Z42: 45 | AA42: =+(AB42+AC42)+0.5*AD42 -> 67.94 | AB42: 27.16 | AC42: 25.78 | AD42: 30 | AE42: =+(AF42+AG42+AH42)+0.5*AI42 -> 18.14 | AF42: 5.62 | AG42: 5.70 | AH42: 6.82 | AI42: 0 | AJ42: =+(AK42+AL42+AM42)+0.5*AN42 -> 63.35 | AK42: 14.90 | AL42: 11.54 | AM42: 20.41 | AN42: 33 | AO42: =+(AP42+AQ42)+0.5*AR42 -> 69.98 | AP42: 38.60 | AQ42: 31.38 | AR42: 0
A43: 40 | B43: Rodriquez, Mike | C43: ? | D43: =+F43+J43+O43+S43+W43+AA43+AE43+AJ43+AO43 -> 614.70 | E43: =+I43+N43+R43+V43+Z43+AD43+AI43+AN43+AR43 -> 158 | F43: =+(G43+H43)+(0.5*I43) -> 61.90 | G43: 25.53 | H43: 18.37 | I43: 36 | J43: =+(K43+L43+M43)+0.5*N43 -> 19.37 | K43: 6.06 | L43: 7.81 | M43: 5.50 | N43: 0 | O43: =+(P43+Q43)+0.5*R43 -> 63.16 | P43: 17.16 | Q43: 22.50 | R43: 47 | S43: =+(T43+U43)+0.5*V43 -> 86.61 | T43: 30.37 | U43: 38.74 | V43: 35 | W43: =+(Y43+X43)+0.5*Z43 -> 113.79 | X43: 49.45 | Y43: 48.84 | Z43: 31 | AA43: =+(AB43+AC43)+0.5*AD43 -> 46.70 | AB43: 25.86 | AC43: 20.84 | AD43: 0 | AE43: =+(AF43+AG43+AH43)+0.5*AI43 -> 19.52 | AF43: 6.49 | AG43: 5.27 | AH43: 7.76 | AI43: 0 | AJ43: =+(AK43+AL43+AM43)+0.5*AN43 -> 74.23 | AK43: 18.70 | AL43: 12.89 | AM43: 38.14 | AN43: 9 | AO43: =+(AP43+AQ43)+0.5*AR43 -> 129.42 | AP43: 67.53 | AQ43: 61.89 | AR43: 0
A44: 41 | B44: Andrus, Jay | C44: L | D44: =+F44+J44+O44+S44+W44+AA44+AE44+AJ44+AO44 -> 689.81 | E44: =+I44+N44+R44+V44+Z44+AD44+AI44+AN44+AR44 -> 215 | F44: =+(G44+H44)+(0.5*I44) -> 71.21 | G44: 34.39 | H44: 16.82 | I44: 40 | J44: =+(K44+L44+M44)+0.5*N44 -> 21.99 | K44: 6.44 | L44: 5.94 | M44: 9.61 | N44: 0 | O44: =+(P44+Q44)+0.5*R44 -> 71.70 | P44: 20.78 | Q44: 17.42 | R44: 67 | S44: =+(T44+U44)+0.5*V44 -> 75.26 | T44: 28.56 | U44: 23.20 | V44: 47 | W44: =+(Y44+X44)+0.5*Z44 -> 112.28 | X44: 43.92 | Y44: 43.86 | Z44: 49 | AA44: =+(AB44+AC44)+0.5*AD44 -> 72.06 | AB44: 38.12 | AC44: 33.94 | AD44: 0 | AE44: =+(AF44+AG44+AH44)+0.5*AI44 -> 20.09 | AF44: 5.70 | AG44: 5.00 | AH44: 9.39 | AI44: 0 | AJ44: =+(AK44+AL44+AM44)+0.5*AN44 -> 70.73 | AK44: 14.60 | AL44: 18.67 | AM44: 31.46 | AN44: 12 | AO44: =+(AP44+AQ44)+0.5*AR44 -> 174.49 | AP44: 107.76 | AQ44: 66.73 | AR44: 0
A45: 42 | B45: Huff, Blake | C45: T | D45: =+F45+J45+O45+S45+W45+AA45+AE45+AJ45+AO45 -> 715.67 | E45: =+I45+N45+R45+V45+Z45+AD45+AI45+AN45+AR45 -> 269 | F45: =+(G45+H45)+(0.5*I45) -> 50.48 | G45: 20.08 | H45: 13.40 | I45: 34 | J45: =+(K45+L45+M45)+0.5*N45 -> 12.19 | K45: 4.62 | L45: 3.97 | M45: 3.60 | N45: 0 | O45: =+(P45+Q45)+0.5*R45 -> 80.52 | P45: 25.35 | Q45: 21.67 | R45: 67 | S45: =+(T45+U45)+0.5*V45 -> 137.97 | T45: 75.58 | U45: 20.89 | V45: 83 | W45: =+(Y45+X45)+0.5*Z45 -> 230.62 | X45: 140.98 | Y45: 51.64 | Z45: 76 | AA45: =+(AB45)+0.5*AD45 -> 26.08 | AB45: 26.08 | AC45: NS | AD45: 0 | AE45: =+(AF45+AG45+AH45)+0.5*AI45 -> 16.38 | AF45: 4.97 | AG45: 4.79 | AH45: 6.62 | AI45: 0 | AJ45: =+(AK45+AL45+AM45)+0.5*AN45 -> 45.79 | AK45: 7.71 | AL45: 12.91 | AM45: 20.67 | AN45: 9 | AO45: =+(AP45+AQ45)+0.5*AR45 -> 115.64 | AP45: 48.94 | AQ45: 66.70 | AR45: 0
A46: 43 | B46: Wong, Hang | C46: TRO | D46: =+F46+J46+O46+S46+W46+AA46+AE46+AJ46+AO46 -> 744.99 | E46: =+I46+N46+R46+V46+Z46+AD46+AI46+AN46+AR46 -> 192 | F46: =+(G46+H46)+(0.5*I46) -> 66.05 | G46: 39.59 | H46: 15.96 | I46: 21 | J46: =+(K46+L46+M46)+0.5*N46 -> 30.52 | K46: 12.85 | L46: 10.04 | M46: 7.63 | N46: 0 | O46: =+(P46+Q46)+0.5*R46 -> 62.63 | P46: 18.95 | Q46: 15.18 | R46: 57 | S46: =+(T46+U46)+0.5*V46 -> 85.81 | T46: 29.94 | U46: 39.37 | V46: 33 | W46: =+(Y46+X46)+0.5*Z46 -> 96.24 | X46: 34.75 | Y46: 33.99 | Z46: 55 | AA46: =+(AB46+AC46)+0.5*AD46 -> 107.69 | AB46: 66.05 | AC46: 41.64 | AD46: 0 | AE46: =+(AF46+AG46+AH46)+0.5*AI46 -> 67.54 | AF46: 13.87 | AG46: 11.05 | AH46: 37.62 | AI46: 10 | AJ46: =+(AK46+AL46+AM46)+0.5*AN46 -> 122.27 | AK46: 34.14 | AL46: 33.84 | AM46: 46.29 | AN46: 16 | AO46: =+(AP46+AQ46)+0.5*AR46 -> 106.24 | AP46: 64.25 | AQ46: 41.99 | AR46: 0
A47: 44 | B47: Ostler, Jay | C47: T | D47: =+F47+J47+O47+S47+W47+AA47+AE47+AJ47+AO47 -> 770.02 | E47: =+I47+N47+R47+V47+Z47+AD47+AI47+AN47+AR47 -> 163 | F47: =+(G47+H47)+(0.5*I47) -> 87.63 | G47: 42.65 | H47: 21.98 | I47: 46 | J47: =+(K47+L47+M47)+0.5*N47 -> 21.56 | K47: 8.71 | L47: 6.55 | M47: 6.30 | N47: 0 | O47: =+(P47+Q47)+0.5*R47 -> 73.34 | P47: 22.48 | Q47: 25.36 | R47: 51 | S47: =+(T47+U47)+0.5*V47 -> 82.52 | T47: 44.23 | U47: 34.29 | V47: 8 | W47: =+(Y47+X47)+0.5*Z47 -> 130.84 | X47: 53.77 | Y47: 55.07 | Z47: 44 | AA47: =+(AB47+AC47)+0.5*AD47 -> 128.38 | AB47: 72.17 | AC47: 53.71 | AD47: 5 | AE47: =+(AF47+AG47+AH47)+0.5*AI47 -> 45.08 | AF47: 12.87 | AG47: 6.18 | AH47: 26.03 | AI47: 0 | AJ47: =+(AK47+AL47+AM47)+0.5*AN47 -> 88.02 | AK47: 24.01 | AL47: 27.00 | AM47: 32.51 | AN47: 9 | AO47: =+(AP47+AQ47)+0.5*AR47 -> 112.65 | AP47: 54.96 | AQ47: 57.69 | AR47: 0
A48: Notes:
A49: - | B49: Div * - Refer to the UDPL 3-Gun Division Specifications for specifics on each Division.
B50: L = | C50: LIMITED
B51: T = | C51: TACTICAL
B52: TRO = | C52: TACTICAL RIFLE-OPTICAL
B53: O = | C53: OPEN
A54: PD | B54: = Points Down = .5 seconds x Points Down. PD Total is added to the total Stage time.
A55: XX | B55: = Indicates that the Points Down value includes some kind of penalty (Procedural Error, Hits on Non-Threat, Misses on Steel (5 seconds each), etc.).
A56: DNF | B56: = Did Not Finish
A57: NS | B57: = No Score was recorded for this string. Shooter placed lower than indicated.
A58: ? | B58: = Shooter did not indicate which Division he should be scored in.